commit	score	mean_score	std_score	bull_2021	crash_bear	sideways	rally_2024	status	description
-	0.4850	0.6372	0.3043	0.83	0.76	0.85	0.11	discard	ARCHITECTURAL DEEP (9pct) multi-day-extension profit harvest (peel trend-aligned winners when extension>9pct from 4-day mean, gentle slope 0.03). composite 0.6277->0.4850 (-0.143). bull RAW +0.054 ROBUST (0.776->0.831 Sharpe 1.54->1.61 AND DD 1.25->1.06pct BOTH improve = selling deep over-extension is GENUINE alpha, reproduces exp3). crash flat. sideways -0.084 (0.930->0.846 Sh1.71->1.45: sideways DOES reach +9pct, harvest over-fires). rally raw 0.418878 BYTE-IDENTICAL (9pct onset successfully kept harvest OUT of rally clean path - first time) BUT stab 1.0->0.270: under AR(1) rally longs OCCASIONALLY perturb to >9pct extension even though clean path never does -> boundary crossing diverges ensemble (reproduces row522 inert-but-stab-dragged). DEFINITIVE: exit-fraction harvest WALLED for rally even when clean-path-inert (noise ensemble crosses boundary clean path does not). bull over-extension alpha is REAL but every exit-channel vehicle hits the rally-stab noise-boundary wall.
26f4b23d	0.6277	0.7211	0.1868	0.78	0.76	0.93	0.42	session-summary	session: 5 independent architectural discards (EXIT RULE triggered at 5 consecutive architectural), 0 branches opened. Baseline 26f4b23d UNCHANGED 0.6277 [bull 0.776 crash 0.759 sideways 0.930 rally 0.419]. ALL 5 exps introduced new _md_level=(mid-mean(HL2_96))/mean multi-day price-LEVEL data dep (distinct from the walled ret_vlong SLOPE) wired through a different decision channel: (1)both-side ct ADMISSION tighten -> rally stab 1.0->0.786 (bear-side admission-boundary noise); (2)bull-side-only ADMISSION -> rally stab 1.0->0.036 CATASTROPHIC (rally LONGS dominate, _md_level crosses zero during consolidations -> noise flips bull-admission boundary on dominant trades); (3)deep-5pct exit HARVEST -> rally HARD-CUTOFF + sideways collapse (rally reaches >5pct, sideways frequent mild >5pct); (4)anti-chase FIRST-BAR size shrink -> rally stab 1.0->0.612 (rally entries STRADDLE the 4-5pct extension onset, not deep in flat tail); (5)deep-9pct exit HARVEST -> rally raw BYTE-IDENTICAL 0.418878 (9pct kept harvest OUT of rally clean path) BUT stab 1.0->0.270 (AR(1) ensemble crosses 9pct boundary clean path never does) + sideways -0.084. CROSS-EXPERIMENT CONCLUSIONS: (A) ADMISSION channel WALLED for any ZERO-CROSSING signal (slope OR level) - hard pass/fail boundary flips under noise near crossing, fast-saturation cannot rescue (razor-thin steep region flips 0<->1 fully at crossing). (B) EXIT-FRACTION harvest WALLED for rally EVEN WHEN clean-path-inert - noise ensemble crosses the price-derived boundary the clean path does not (reproduces row522). (C) NEW REPRODUCIBLE SIGNAL: selling DEEP over-extension gives GENUINE bull raw +0.054 (Sharpe 1.54->1.61 AND DD 1.25->1.06pct both improve, bull stab intact 1.0) - appeared at BOTH 5pct and 9pct onsets. But bull over-extension alpha is COUPLED to rally (both strong-uptrend-price-above-mean, no side/churn separator per 12+ prior sessions) and every capture channel hits rally-stab wall; the only tuning that separates them (onset between rally and bull extension distributions) is FORBIDDEN regime-detection overfit. NOT branch-worthy: branch would revert on known wall or require overfit. (D) _md_level LEVEL is noise-immune ONLY deep in its flat tail; rally/sideways books operate AT typical extension onsets (4-9pct), NOT deep in tail - so no fixed onset puts them in the flat region without also excluding the bull alpha. NEW BASELINE=26f4b23d (unchanged).
-	0.4750	0.6385	0.3271	0.79	0.75	0.93	0.08	discard	exp1 ARCHITECTURAL counter-trend scale-in PACE modulation (ret_vlong fast-sat tanh slows multi-day-counter-trend scale-in +1.5bars, timing axis not size). composite 0.6277->0.475, rally raw 0.419->0.368 + rally stab 0.809->0.568 factor 1.0->0.23 COLLAPSE. REPRODUCES documented wall: any per-bar position dependence on ret_vlong collapses rally stab (size/fraction/TIMING all fail). NOTE: bull RAW +0.010 (Sh 1.54->1.57) - counter-trend pace-slowing genuinely helps bull but coupled to rally collapse via same ret_vlong gate. Not branch-worthy (structural ret_vlong-timing wall). Reverted via git checkout 26f4b23d -- strategy.py.
6663ab95	0.5135	0.6838	0.3406	0.93	0.82	0.89	0.10	branch	BRANCH OPEN (exp2 ARCHITECTURAL ratchet de-risk consolidation, new _exit_press_hwm state + emission-timing control flow): de-risk reduces fire only on NEW per-hold exit-pressure highs (ratchet) instead of every bar in-band. composite 0.6277->0.5135 BUT bull RAW 0.776->0.929 (+0.153 LARGEST single-regime raw gain in history, Sh 1.54->1.82) + crash RAW 0.759->0.823 (+0.063, Sh 1.29->1.34) GENUINE — holding winners through pressure plateaus lets them run. sideways raw 0.930->0.886. RALLY COLLAPSE raw 0.419->0.277 stab 0.809->0.606 Sh 0.735->0.460 dd 1.85->2.32 (breaches 50pct floor 0.209 -> branch not direct keep). JUSTIFY: (1) new mechanism = ratchet emission on pressure-HWM (monotone like peak_pnl); (2) rally regressed bc it holds its 50pct counter-trend-short losers longer (ratchet suppresses the every-bar shaves that cut them) -> adverse accumulation + hold-vs-shave decision noise-sensitive near pressure-HWM; (3) FIX next: gate ratchet to TREND-ALIGNED positions only (ret_long*pos_dir) -> counter-trend(rally)/chop(sideways) revert to original every-bar shave, trend-aligned(bull/crash) keep winner-run gain.
e9b38141	0.5864	0.7206	0.2684	0.93	0.81	0.89	0.26	branch	branch step 2: TREND-ALIGNED-gated ratchet (trend-aligned positions hold through pressure plateaus, counter-trend/chop revert to baseline every-bar shave; gate max(0,tanh(ret_long*pos_dir/0.04))). composite 0.513->0.586 PROGRESS. bull raw 0.929 KEPT (+0.152), crash raw 0.807 KEPT (+0.048). rally recovered raw 0.277->0.340 stab 0.606->0.731 (no longer breaches 50pct floor 0.209). REMAINING: sideways 0.930->0.886 (-0.044, small mini-trend alignment triggers partial holds in chop where fast profit-harvest is better), rally still -0.079 raw. NEXT step 3: add PROFIT gate (hold plateau only for trend-aligned WINNERS) -> sideways chop wins (small profit) revert to shave, bull/crash winners keep hold.
785e11c1	0.5314	0.6892	0.3155	0.92	0.80	0.89	0.15	branch	branch step 3: PROFIT-gate the plateau-hold (hold_w = trend_align * tanh(pos_pnl/|STOP|)). [first run was NameError=-999 bug, fixed by restoring _trend_align_dr def, re-run clean]. raw_composite 0.649 > baseline 0.628! rally RAW recovered 0.340->0.401 (Sh 0.695, near baseline 0.419) - profit gate fixed rally raw as intended. bull 0.920/crash 0.803 kept. BUT rally STAB dropped 0.731->0.611 (factor ~0.37) -> rally score 0.148, composite 0.531 < step2 0.586. CAUSE: profit gate makes hold/shave decision depend on pos_pnl crossing 0 (price-derived boundary near breakeven = documented noise channel). Step2 (trend-align only, no profit gate) keeps rally stab healthy 0.731 and is the better branch state. NEXT step 4: revert to step-2 gate, attack sideways -0.044 (stability-safe gap) instead.
35f0d353	0.5993	0.7275	0.2565	0.93	0.81	0.89	0.29	branch	branch step 4: peak_pnl NOISE-IMMUNE profit gate (hold_w = trend_align * tanh(peak_pnl/(0.5*|STOP|))). composite 0.586->0.599 NEW BRANCH BEST. mean 0.7275 > baseline 0.7211 (mean criterion MET). bull 0.928 (+0.152) crash 0.807 (+0.048) KEPT, sideways 0.886 (-0.044). rally stab RESTORED 0.611->0.754 (peak_pnl monotone = no breakeven noise) but rally raw 0.342 (peak gate less aggressive than instantaneous - rally winners rarely peak >0.5*STOP before whipsaw). rally score 0.290 vs baseline 0.419 (-0.129, ~31pct drop, above 50pct floor 0.209). composite gap to keep is pure std (bull 0.93 vs rally 0.29). NEXT: recover rally + sideways. Options: tighten/adjust peak threshold, or attack sideways -0.044 separately.
425563bb	0.5548	0.7050	0.3003	0.93	0.77	0.92	0.20	branch	branch step 5: tighten trend-align scale 0.04->0.07. composite 0.599->0.555 REGRESSION (no-progress step). MIXED: sideways RECOVERED 0.886->0.924 (+0.038, chop reverts to baseline shave) GOOD, rally raw 0.342->0.375 GOOD, but rally STAB dropped 0.754->0.657 (scale 0.07 puts rally |ret_long|/0.07=0.3-0.6 in tanh STEEP region = noise-sensitive again; scale 0.04 put it in flatter saturated region). crash -0.032. LEARNING: scale 0.04 is correct for rally stab; sideways recovery comes from chop reverting to baseline shave (achievable another way). Step 4 (scale 0.04) remains branch best 0.599. NEXT step 6: revert to scale 0.04, add a chop-revert path for sideways specifically.
30a7b1d9	0.5606	0.7058	0.2905	0.93	0.80	0.89	0.21	branch	branch step 6: revert scale to 0.04 + raise peak threshold 0.5->1.0*|STOP|. composite 0.599->0.561 REGRESSION (no-progress step 2/7). rally stab dropped 0.754->0.673, rally raw 0.362, didnt help. sideways back to 0.886. Step 4 (scale 0.04, peak thresh 0.5) remains branch best 0.599. KEY STRUCTURAL REALIZATION: ratchet plateau-hold inherently helps clean-trend regimes (bull/crash) and hurts choppy rally - fundamentally opposed via continuous gates. NEXT step 7: gate the plateau-hold OFF in high-churn (rally) via the proven noise-immune _churn_dz/len(_eh) integer signal (rally=high churn, bull/crash/sideways=low) -> rally FULLY reverts to baseline (raw 0.419 stab 0.809), bull/crash keep ratchet gains. This is the proven rally-separator from the 26f4b23d/grid keeps.
2e09f4d4	0.4825	0.6524	0.3399	0.85	0.81	0.89	0.07	branch	branch step 7: churn-gate plateau-hold off in rally via _calm_dr=1-tanh((len(_eh)-1.5)/0.6). composite 0.599->0.482 WORSE (no-progress 3/7). BACKFIRED: rally raw stayed 0.343 (NOT recovered - rally holds occur in quiet len<=1 stretches too, calm gate didnt turn off hold for whipsaw longs) + rally stab FELL 0.754->0.557 + bull stab 0.873->0.785 (churn-dependent exit-hold gate = new noise channel). LEARNING: churn separator works at ENTRY/EXECUTION layer (grid/ct-size keeps) but NOT at EXIT-HOLD decision (positions held across churn-varying bars; the gate value changes mid-hold under the OTHER symbols entry activity). Step 4 (trend-align x peak gate, scale 0.04 thresh 0.5) remains decisive branch best 0.599.
8b5226d9	0.5378	0.6949	0.3141	0.93	0.80	0.90	0.16	branch	branch step 8: trend-magnitude deadzone (|ret_long|-0.015) + hard direction match on hold gate. composite 0.599->0.538 REGRESSION (no-progress 4/7). sideways helped slightly 0.886->0.896 but rally stab dropped 0.754->0.628 (the hard '1.0 if dir match else 0.0' direction switch = noise boundary, replaced step-4 smooth tanh). Step 4 (smooth trend-align x peak gate, scale 0.04 thresh 0.5) remains decisive branch best 0.599. PATTERN CONFIRMED: rally and bull coupled through hold mechanism; every attempt to recover rally below step-4 costs more than gains (4 consecutive no-progress steps 5-8).
abfb9591	0.6300	0.7440	0.2278	0.93	0.81	0.89	0.36	keep	BRANCH KEEP step 9 (SUPERSEDES 26f4b23d 0.6277 -> 0.6300, +0.0023 composite, +0.0229 mean 0.7211->0.7440, std NARROWED 0.1868->0.2278 wait std WIDENED). ARCHITECTURAL ratchet de-risk consolidation (new _exit_press_hwm state + emission-timing control flow): de-risk reduces fire only on NEW per-hold exit-pressure highs (monotone like peak_pnl) instead of every bar in-band, gated to TREND-ALIGNED WINNERS held LONG. Gate = tanh(ret_long*pos_dir/0.04) * tanh(peak_pnl/(0.5*|STOP|)) * tanh((bars_held-6)/4); plateau-HOLD only when all 3 ~1 (bull/crash long-held trend winners), else baseline every-bar shave. MECH: holding winners through pressure plateaus instead of shaving every bar lets clean-trend winners run -> BULL raw 0.776->0.928 (+0.152 Sh 1.54->1.81 LARGEST single-regime raw gain in history), crash raw 0.759->0.805 (+0.047 Sh 1.29->1.32). rally/sideways protected by the 3 gates (rally whipsaw longs short-held + counter-trend -> shave; sideways chop low-trend -> shave): rally 0.419->0.411 raw (score 0.357, stab 0.761, DD 1.85->1.89), sideways 0.930->0.886. VERIFIED byte-identical on re-run (deterministic AST-seed). All MaxDD<1.89pct. Branch path: step1 ungated ratchet (bull+0.153 but rally collapse 0.277), step2 trend-align gate (rally recover 0.340), step3 instantaneous-pnl profit gate (rally raw 0.401 but stab noise), step4 peak_pnl noise-immune gate (0.599 mean>baseline), steps5-8 scale/threshold/churn/deadzone all regressed, step9 bars_held long-hold gate = THE FIX (rally whipsaw longs short-lived vs bull winners long-held). NEW BASELINE 0.6300.
abfb9591	0.6300	0.7440	0.2278	0.93	0.81	0.89	0.36	note	CORRECTION to prior keep row: std WIDENED 0.1868->0.2278 (not narrowed - typo in keep row). composite still improved (+0.0023) because mean gain (+0.0229, bull raw +0.152) outweighed the 0.5*std-widening penalty (0.5*0.041=0.0205). Keep criteria all met: composite UP, mean UP, no regime >50pct drop (rally -15pct within floor), no DD>10pct. Baseline = abfb9591 0.6300.
abfb9591	0.6300	0.7440	0.2278	0.93	0.81	0.89	0.36	session-summary	session: 1 independent architectural discard + 1 exploration branch (9 steps, KEPT). NEW BASELINE abfb9591 0.6300 SUPERSEDES 26f4b23d 0.6277 (+0.0023 composite, +0.0229 mean 0.7211->0.7440, std widened 0.1868->0.2278) - FIRST baseline move in ~16 sessions. EXP1 (independent, DISCARD): counter-trend scale-in PACE modulation (ret_vlong fast-sat tanh slows multi-day-counter-trend scale-in +1.5bars) -> composite 0.475, rally stab 0.809->0.568 COLLAPSE - REPRODUCES documented wall (any per-bar position dependence on ret_vlong collapses rally stab: size/fraction/TIMING all fail). NOTE bull RAW +0.010 (counter-trend pace-slowing helps bull but coupled to rally collapse). BRANCH (exp2 RATCHET DE-RISK CONSOLIDATION = THE KEEP): NEW _exit_press_hwm state + emission-timing control flow - de-risk reduces fire only on NEW per-hold exit-pressure highs (monotone like peak_pnl, noise-smooth) instead of every bar in-band. CORE MECHANISM INSIGHT: the de-risk ramp was shaving winners every bar pressure sat in-band (each shave a realized event); holding clean-trend winners through pressure PLATEAUS lets them run -> BULL raw 0.776->0.928 (+0.152, Sh 1.54->1.81, LARGEST single-regime raw gain in project history) + crash 0.759->0.805. BRANCH JOURNEY (9 steps): step1 ungated ratchet (bull+0.153 but rally COLLAPSE 0.277 - rally holds its 50pct counter-trend-short losers + whipsaw longs longer), step2 trend-align gate tanh(ret_long*pos_dir/0.04) (rally recover 0.340), step3 instantaneous-pnl profit gate (rally raw 0.401 GOOD but pos_pnl gate at breakeven=noise, stab 0.611), step4 peak_pnl NOISE-IMMUNE gate (composite 0.599, mean>baseline, rally stab restored 0.754), steps5-8 ALL REGRESSED (scale 0.07->rally steep-region stab collapse; peak thresh 1.0->no help; churn-gate->backfire bull stab + rally holds in quiet stretches too; trend-deadzone+hard-dir-switch->noise boundary), step9 LONG-HOLD bars_held gate tanh((bars_held-6)/4) = THE FIX. FINAL KEEP GATE = trend_align x peak_gate x longhold, plateau-HOLD only when all 3 ~1. KEY SEPARATOR INSIGHT: rally's trend-aligned drag-longs are SHORT-LIVED (grinding-uptrend pullback-recovery longs resolve in <8 bars) vs bull/crash winners LONG-HELD (10+ bars); bars_held (integer, noise-immune at large N) cleanly separates them where trend-strength/peak-magnitude/churn could NOT. Per-regime final: bull 0.928(+0.152) crash 0.805(+0.047) sideways 0.886(-0.044) rally 0.411raw/0.357score(-0.062raw, stab 0.761, within 50pct floor). VERIFIED byte-identical re-run (deterministic). All MaxDD<1.89pct. CROSS-EXP CONCLUSIONS (load-bearing): (a) NEW PRODUCTIVE AXIS FOUND - de-risk EMISSION-TIMING (ratchet on exit-pressure HWM) is a Sharpe-AFFECTING lever for clean-trend regimes (bull/crash), distinct from all walled size/admission/exit-threshold vehicles; holding winners through pressure plateaus = post-fee Sharpe gain. (b) the ratchet is regime-OPPOSED (helps clean-trend, hurts choppy rally) and the 3-gate stack (trend-align continuous + peak_pnl noise-immune HWM + bars_held integer-long-hold) is what makes it net-positive - each gate proven necessary by a failed single-gate step. (c) bars_held LONG-HOLD gate is a NEW noise-immune separator (rally short-held vs bull long-held) usable at the EXIT-HOLD decision where churn-count FAILED (step7: churn varies mid-hold via other-symbol activity). (d) confirmed AGAIN: instantaneous pos_pnl gate near breakeven = noise channel (step3), but peak_pnl high-water gate is noise-immune (step4). (e) reconfirmed ret_vlong-timing wall (exp1). new baseline abfb9591 0.6300, std now WIDER (bull outlier high) so next sessions could attack std via sideways/rally raw recovery while keeping bull gain.
-	0.5680	0.7105	0.2850	0.93	0.81	0.89	0.22	discard	ARCHITECTURAL snap-to-hold deadband on the UNCOVERED churn partition (_cm>=3 AND len(_eh)<=1 = bursty symbol in quiet stretch, falls through both existing grids). Suppress micro-resizes whose delta < 0.13*current_pos. RESULT: composite 0.6300->0.5680. rally RAW byte-identical 0.410734 (size Sharpe-invariant, confirmed AGAIN) but rally STABILITY 0.761->0.663 WORSE (score 0.357->0.223). bull stab 0.884->0.862 also eased. FAILURE MECH: the deadband threshold abs(target-current_pos) < 0.13*current_pos is a DECISION BOUNDARY on a PRICE-DERIVED noisy quantity (target=f(combined_mult), current_pos=live) — under AR(1) noise whether a micro-resize falls below/above 0.13 FLIPS -> ADDS boundary noise instead of removing distinct-value noise. CONFIRMS: snap-to-hold is ONLY safe where the deadband fires on a STABLE reference (ef027049 fires at high-churn len>=2 where resizes are dense/already-quantized-context); on rally LONE quiet-stretch resizes it is doubly-noisy (same as round-grid row 535 on this partition). The uncovered gap partition is WALLED for BOTH grid mechanisms (round + snap). Integer churn gate is noise-immune but the deadband COMPARISON is not. Not branch-worthy (no regime up, not new mechanism). Discard #1 architectural.
-	0.4532	0.6383	0.3702	0.91	0.80	0.84	0.00	discard	ARCHITECTURAL FIR trailing-3bar-mean smoothing of combined_mult (size multiplier) to kill per-bar size-wobble noise channel. RESULT: composite 0.6300->0.4532 CATASTROPHIC. rally stab 0.760->0.493 COLLAPSE (factor 0, score 0) — OPPOSITE of hypothesis: FIR introduces path-dependent lag that diverges MORE across AR(1) ensemble near rally entry/scale-in boundaries. bull 0.928->0.905 (stab 0.884->0.854), sideways 0.886->0.843 (stab 0.904->0.857) also down; crash flat 0.805. CONFIRMS wall: temporal size-SMOOTHING joins per-bar position-value family (ret_vlong/equity-vol-ratio) — reducing size noise via memory ADDS ensemble divergence, not removes. Not branch-worthy (rally stab is the regression, known wall, no credible fix). Architectural discard #1.
-	0.5551	0.7042	0.2982	0.92	0.80	0.91	0.19	discard	ARCHITECTURAL Kaufman-ER path-efficiency gate multiplied into ratchet de-risk _hold_w_dr (engage plateau-HOLD only on efficient/clean-trend paths). RESULT: composite 0.6300->0.5551. rally RAW byte-identical 0.41086 (clean path untouched) but rally STAB 0.760->0.642 factor 0.473 score 0.357->0.194 = ENSEMBLE-ONLY collapse. MECH: ER gate REDUCES rally's trend-aligned long-held LONGS' hold weight -> reverts them to current_pos*_de_risk shave; _de_risk is PRICE-DERIVED (=f(exit_pressure)) = the confirmed de_floor rally wall -> noise channel. sideways +0.020 (0.886->0.906 raw+stab, ER shaves over-held sideways chop) GENUINE but incidental + inseparable from rally damage w/o regime-targeting. bull stab 0.884->0.822 (raw 0.928->0.920). raw_composite FLAT 0.655. RECONFIRMS: de-risk-emission HOLD weight is rally-walled both directions (full-hold=0.760, reduce-hold=onto-price-derived-shave). Not branch-worthy. Architectural discard #2.
c5cf62eb	0.4715	0.6651	0.3873	0.94	0.81	0.92	0.00	branch	BRANCH-OPEN (Exp3 kept): high-vol relaxation of harvest suppressor _ts_supp at vol gate 1.2. composite 0.6300->0.4715. crash BYTE-IDENTICAL (0.8055, Sh 1.3216 — target MISSED: crash _pp_min scales w/ vol so peaks rarely exceed 1.6*_pp_min harvest-activation bar). GENUINE clean gains: bull 0.928->0.937 (raw, stab 0.884->0.899 UP, Sh 1.812->1.842), sideways 0.886->0.917 (raw via return-smoothing: more trades+lower DD/vol offset Sh 1.698->1.678). rally COLLAPSE stab 0.760->0.462 but rally CLEAN PATH BYTE-IDENTICAL (Sh 0.717117, DD 1.885325 = baseline exactly) => ensemble-only, vol gate 1.2 flips under AR(1) noise at rally's vol_ratio boundary. FIX HYPOTHESIS: raise vol gate so rally (lowest-vol regime) sits in flat tail (noise-immune) while bull/sideways/crash high-vol bars engage.
fa18a3d7	0.6277	0.7211	0.1868	0.78	0.76	0.93	0.42	keep	RE-BASELINE (manual, cross-ex FAIL): REVERTS abfb9591 0.6300 step9-ratchet-keep BACK to 26f4b23d 0.6277. strategy.py restored byte-identical to 26f4b23d (verified 0 diff). The step9 keep (composite +0.0023) was IN-SAMPLE OVERFIT: entire composite gain came from bull_2021 +0.152 (ratchet de-risk hold-through-plateau), an in-sample strong-trend regime. CROSS-EXCHANGE VALIDATION (26f4b23d vs 7087b6d2, HL/BN/CC perps 2025-11~2026-04): HL Sharpe 2.11->1.47 (-0.64, PRODUCTION SOURCE), BN 2.13->1.49 (-0.64), mean Sharpe 1.62->1.20 (-0.42), HL PF 4.48->2.12 collapse, HL MaxDD 1.27->1.78pct. Spread 1.516->0.854 is LEVELING-DOWN (HL/BN dragged toward CC), NOT real consistency. FAILED all 3 skill criteria (mean Sharpe down / HL down / single-ex regression >0.3). LESSON: composite +0.0023 from a single in-sample regime spike does NOT survive cross-ex; ratchet hold-through-plateau overfits clean-trend training regimes. BASELINE FOR ALL SUBSEQUENT EXPERIMENTS = 26f4b23d 0.6277 [bull 0.776 crash 0.759 sideways 0.930 rally 0.419].
