commit	score	mean_score	std_score	bull_2021	crash_bear	sideways	rally_2024	status	description
24b3f31e	0.849039	0.888419	0.131264	0.970328	0.811798	1.053595	0.717954	keep	KEEP (NEW BASELINE, SUPERSEDES a465684a 0.848733). Exp3 (architectural, indep): COUNTER-TREND-specific portfolio-loss-streak first-bar SIZE shrink. Distinct from Exp1 (d881e261, blanket cooldown+size+admission escalation -> hurt bull -0.113/rally -0.079): this shrinks ONLY counter-trend entries (bull in multi-day downtrend / bear in multi-day uptrend) after a portfolio loss streak, leaving trend-aligned entries at full size. NEW state: portfolio _loss_streak counter (mirrors max_consecutive_losses over chronological trade_pnls). _streak_ct=tanh((streak-1)/2) (0 at streak<=1, ~1 at streak>=3) x fast-saturating /0.01 ret_vlong ct indicator (near-constant, noise-free) x 0.25 max shrink. Shrink-only (safe family), first-bar-only. MEASURED vs a465684a 0.848733: composite +0.000306 (0.849039), mean +0.000346 (0.888419), std +0.000132. PER-REGIME: bull 0.969117->0.970328 (+0.001211, Sh 1.84->1.85, DD 0.90->0.896 - bull post-streak ct longs in 2021 late correction shrunk), rally 0.717782->0.717954 (+0.000172, Sh 1.30036->1.30078, DD 1.5735->1.5717), crash BYTE-IDENTICAL 0.811798 (crash shorts are trend-aligned -> ct indicator 0 -> no shrink), sideways BYTE-IDENTICAL 1.053595. All stability_factor 1.0, all flip_streak_gate 1.0, all MaxDD<10pct. All keep criteria met. Mechanism confirmed: shrinking ct entries after a loss streak (sparing trend-aligned) improves bull+rally; the ct indicator never fires on trend-aligned crash shorts or sideways -> those regimes byte-identical. NEW BASELINE 0.849039. Observation (correlation only): bull gain larger than rally; direction-split PnL not measured, so ct-loser-magnitude attribution is hypothesis not confirmed.
a0a67298	0.825138	0.862764	0.125419	0.876867	0.811798	1.053595	0.708795	discard	Exp4 (architectural, indep): sustain Exp3 streak-ct shrink through scale-in. Cache _streak_ct_shrink at entry (like Exp5/Exp9 for conc_shrink/vol_shrink), apply to scale-in full_target so the shrink persists for the whole hold instead of ramping back to un-shrunk size after bar 1. MEASURED vs 24b3f31e 0.849039: composite -0.023901, mean -0.025655. PER-REGIME: bull 0.970328->0.876867 (-0.093461 CATASTROPHIC, Sh 1.85->1.71, DD 0.896->0.825), rally 0.717954->0.708795 (-0.009159, Sh 1.30->1.28, DD 1.572->1.560), crash byte-identical 0.811798, sideways byte-identical 1.053595. Sustaining the ct shrink through the whole hold OVER-SHRINKS ct entries (some are winners -> over-shrinking loses alpha); first-bar-only (Exp3) is the calibrated optimum (mirrors the Exp4 0.50-cap lesson: stronger harvest over-cuts winners). Reverted to 24b3f31e.
1b0f2c46	0.849413	0.888861	0.131496	0.972003	0.811798	1.053595	0.718050	keep	KEEP (NEW BASELINE, SUPERSEDES 24b3f31e 0.849039). Exp5 (architectural, indep): COUNTER-TREND-specific loss-streak ADMISSION tightening (admission counterpart to Exp3 ct size shrink). After a portfolio loss streak, tighten the admission bar (strong_min) for COUNTER-TREND entries only via the fast-saturating /0.01 ret_vlong ct indicator x streak ramp (max 10pct). Filters the WEAK ct re-entries that extend the loss streak (rally pullback shorts) while strong-conviction ct entries still pass; trend-aligned entries (ct indicator 0) NOT tightened -> bull/crash/rally trend longs protected (lesson from Exp1 blanket tightening which hurt bull). MEASURED vs 24b3f31e 0.849039: composite +0.000374 (0.849413), mean +0.000442 (0.888861), std +0.000232. PER-REGIME: bull 0.970328->0.972003 (+0.001675, Sh 1.85->1.853, DD 0.896->0.895), rally 0.717954->0.718050 (+0.000096, Sh 1.3008->1.3010, DD 1.572->1.572), crash BYTE-IDENTICAL 0.811798, sideways BYTE-IDENTICAL 1.053595. All stability_factor 1.0, all flip_streak_gate 1.0, all MaxDD<10pct. All keep criteria met. The loss-streak x counter-trend mechanism is now validated across TWO subsystems (Exp3 sizing + Exp5 admission), both first-bar/gate scoped (Exp4 showed sustaining through scale-in over-shrinks). NEW BASELINE 0.849413. Observation (correlation only): bull gain dominates again; direction-split PnL not measured.
-	-	-	-	-	-	-	-	session-summary	SESSION: 2 KEEPS (Exp3 +0.000306, Exp5 +0.000374) + 3 architectural discards (Exp1/E1 blanket streak escalator, Exp2 VWAP-slope exit pressure inert, Exp4 sustain-streak-ct-shrink through scale-in). NEW BASELINE 1b0f2c46 0.849413 (SUPERSEDES a465684a 0.848733, +0.000680 composite, +0.000788 mean 0.888073->0.888861, std 0.131132->0.131496). [bull 0.969117->0.972003, crash 0.811798 unchanged, sideways 1.053595 unchanged, rally 0.717782->0.718050]. THEME: NEW STATE DIMENSION = PORTFOLIO CONSECUTIVE-LOSS STREAK. Diagnostic at session start: all stability_factor=1.0 and flip_streak_gate=1.0 across all regimes, so score=raw_score entirely; decomposed rally 0.717782 = ln(1+1.3004)*0.9845(dd_gate)*0.8753(streak_gate) -> max_consecutive_losses~4 is the largest single raw-vs-actual gap of any regime (streak_gate 0.875). NEW MECHANISM: portfolio-level _loss_streak counter (mirrors max_consecutive_losses over chronological trade_pnls in prepare.py; increment on loss, reset on win) x fast-saturating /0.01 ret_vlong COUNTER-TREND indicator (near-constant, noise-free). Applied ct-SPECIFICALLY (trend-aligned entries spared by ct indicator=0 -> bull/crash/sideways trend longs byte-identical, protecting bull which Exp1 blanket escalation had hurt -0.113). Exp3 (KEEP): ct first-bar SIZE shrink max 0.25. Exp5 (KEEP): ct ADMISSION tightening max 10pct (filters weak ct re-entries). Both improve bull (+0.0012/+0.0017) and rally (+0.0002/+0.0001); crash/sideways byte-identical. LESSONS: (1) Exp1 blanket cooldown+size+admission escalation after streak BACKFIRED (rally churn 96->107, Sharpe 1.30->1.20, bull -0.113) -> the lever must be ct-SPECIFIC not blanket, and cooldown-stretch increases churn rather than breaking the streak. (2) Exp2: exit MAX fusion is CLOSED - a new profit-side source (VWAP-slope) is inert (rally byte-identical, bull -0.0007); the 7 existing sources + agreement attenuator cover the space. (3) Exp4: sustaining the ct size-shrink through scale-in OVER-SHRINKS ct entries (bull -0.093, rally -0.009) - first-bar-only is the calibrated optimum (mirrors prior Exp4 0.50-cap lesson: stronger harvest over-cuts winners; some ct entries are winners). (4) The streak COUNT is structural (hard to cut - cooldown does not break it without an intervening winner); the validated mechanism cuts ct-loser MAGNITUDE (Sharpe/dd_gate) not count. OBSERVATION (correlation only, direction-split PnL not measured): bull gain exceeded rally gain in both keeps - the ct-shrink-after-streak fires on bull post-streak ct longs (2021 late correction) more impactfully than rally pullback shorts; causal attribution to ct-loser-magnitude not directly measured.
19e64389	0.501003	0.651803	0.502669	0.947915	0.811798	1.053595	-0.206094	discard	Exp1 (architectural, indep): COUNTER-TREND-DIRECTION entry BLOCK after portfolio loss streak>=2 (3-bar block on ct re-entries). NEW control flow + new state (_ct_block counter). Hypothesis: blocking rally pullback-short re-entries after 2 consec losses inserts a gap so a trend-aligned winner resets the streak count, cutting max_consec_losses (rally streak_gate ~0.875 = its largest raw gap). Distinct from Exp3 size shrink + Exp5 admission tighten (cut ct-loser MAGNITUDE; this cuts COUNT). MEASURED vs 1b0f2c46 0.849413: composite -0.348410 (0.501003), mean -0.237058, std +0.371173. PER-REGIME: rally 0.718050->-0.206094 (-0.924144 CATASTROPHIC, Sharpe 1.30->-0.21, MaxDD 1.5716->3.2221, AnnRet +3.9->-0.6pct), bull 0.972003->0.947915 (-0.024088, Sh 1.85->1.78), crash BYTE-IDENTICAL 0.811798, sideways BYTE-IDENTICAL 1.053595. All stab 1.0, all flip_gate 1.0, all MaxDD<10pct. CATASTROPHIC rally regression breaches 50pct gate by 128pct. Reverted to 1b0f2c46. CONCLUSION (correlation only, direction-split not measured): the hard 3-bar ct BLOCK is far too aggressive - it removes winning ct trades rally depends on (the prior Exp4 over-shrink lesson already found some ct entries ARE winners; a hard block is strictly more aggressive than over-shrinking). Confirms the prior session record that the streak COUNT is structural - cutting it via entry-blocking destroys rally alpha rather than breaking the streak cleanly. The ct-scoping worked as designed (crash/sideways byte-identical, bull near-flat), but the block MECHANISM itself is wrong for this strategy. Not branch-eligible (no regime improved; mechanism direction confirmed counterproductive).
0f3f5fe8	0.668588	0.708807	0.134064	0.855185	0.825095	0.612446	0.542501	discard	Exp2 (architectural, indep): CONVICTION-MARGIN exit-threshold modulation. NEW cross-component data dep + new state (_entry_conv caches entry-time conviction margin); exit threshold *= (1+0.10*tanh(margin/0.40)) for winners (more room for high-conviction entries to ride pullback noise). Hypothesis: high-conviction rally trend longs get more exit room -> less churn -> higher Sharpe. MEASURED vs 1b0f2c46 0.849413: composite -0.180825 (0.668588), raw_composite 0.709386, mean -0.180054, std +0.002568. PER-REGIME: sideways 1.053595->0.612446 (-0.441149 CATASTROPHIC, Sharpe 2.02->1.16, AnnRet 3.5->1.6pct - held winners through mean-reversion giveback), bull 0.972003->0.855185 (-0.116818, Sh 1.85->1.52, MaxDD 0.90->1.11), rally 0.718050->0.542501 (-0.175549, Sh 1.30->1.17, MaxDD 1.57->1.83, stability 1.0->0.812 - extending ct winners added noise-driven hold-length variance), crash 0.811798->0.825095 (+0.013297 only regime up). All MaxDD<10pct. sideways breaches 50pct gate (58pct drop). Reverted to 1b0f2c46. CONCLUSION: extending winner hold-time (more exit room) hurts mean-reverting regimes (sideways/bull) catastrophically -- high-conviction winners in chop mean-revert, and the extra room rides the giveback. The exit-threshold calibration is tight; loosening it for conviction regresses. Conviction-based exit extension is the wrong lever (mirrors prior _vt_factor removal: ad-hoc exit-thresh band-pass was redundant). crash (pure trend, no mean-reversion) was the only regime helped, confirming the mechanism helps trend-persistence but destroys chop. Not branch-eligible (only crash +0.013 vs 3 regime regressions; direction counterproductive for the binding rally).
411dc380	0.849390	0.888840	0.131498	0.971949	0.811798	1.053595	0.718018	discard	Exp3 (architectural, indep): STREAK-GATED TREND-ALIGNED entry BOOST (symmetric counterpart to Exp3-keep ct-shrink). NEW state-interaction: loss_streak x trend-alignment conjunction (no existing boost gates on loss_streak). +0.05 max first-bar boost on trend-aligned entries after streak>=2. Hypothesis: boost the likely streak-resetting winner -> higher Sharpe + faster streak reset (targets rally streak_gate ~0.875). MEASURED vs 1b0f2c46 0.849413: composite -0.000023 (0.849390, SUB-NOISE), mean -0.000021, std +0.000002. PER-REGIME: bull 0.972003->0.971949 (-0.000054), rally 0.718050->0.718018 (-0.000032), crash BYTE-IDENTICAL 0.811798, sideways BYTE-IDENTICAL 1.053595. All Sharpe/AnnRet/MaxDD unchanged to 2dp; all stab 1.0. The boost is INERT: the streak>=2 AND fresh-trend-aligned-entry coincidence is rare, and first-bar-only +0.05 on an already-heavily-attenuated first-bar target is a tiny absolute PnL change. Variance-safe family confirmed (no stability penalty). Reverted to 1b0f2c46. CONCLUSION: mirrors the prior-session effort/result branch (sub-noise, reverted for overfit hygiene -- peak +0.000064 was ~8x below the ~0.0005 keep floor). Amplifying (bigger magnitude / sustain-through-scale-in) risks the 0.820 rally stability knee; effort/result precedent showed amplification is NON-MONOTONIC and fails to clear the noise floor. Not branch-eligible (no regime improved; mechanism near-inert by construction).
1d176e91	-1.229028	-0.985240	0.812628	-1.399195	-1.501204	-1.461424	0.420863	discard	Exp4 (architectural, indep): SUSTAIN _port_dd_atten through scale-in (cached at entry, mirrors Exp5/Exp9 sustain pattern). Hypothesis: keep DD-affected entries smaller for the whole hold -> lower MaxDD -> higher dd_gate. MEASURED vs 1b0f2c46 0.849413: composite -2.078441 (CATASTROPHIC -1.229028), mean -1.874101. PER-REGIME: bull 0.972->-1.399 (Sharpe 1.85->-1.40, AnnRet 4.7->-2.2pct), crash 0.812->-1.501 (Sh 1.26->-1.50), sideways 1.054->-1.461 (Sh 2.02->-1.46), rally 0.718->0.421 (Sh 1.30->0.78, MaxDD 1.57->1.20 - the ONLY improvement, dd_gate mechanism direction confirmed). All stab 1.0, all MaxDD<10pct. Reverted to 1b0f2c46. CONCLUSION (mechanism-level, not correlational): the Exp5/Exp9 sustain pattern is VALID only for STRUCTURAL entry-time conditions (concentration, volume spike) that do not recover post-entry. _port_dd_atten reflects a TRANSIENT portfolio state (equity/peak) that RECOVERS as the drawdown resolves; caching it at entry permanently under-sizes every position that entered during even a minor equity dip (equity fluctuates on every bar so most entries catch some DD) -> systematic under-sizing -> returns collapse -> Sharpe negative across 3 regimes. The LIVE _port_dd_atten (baseline) is correct: it should relax as DD recovers. Caching a transient signal is a category error. rally MaxDD did drop (1.57->1.20), confirming the dd_gate lever is real, but the cached-sustain mechanism is the wrong implementation. Not branch-eligible (3 regimes catastrophic; mechanism fundamentally mismatched).
040bf0ee	0.849413	0.888861	0.131496	0.972003	0.811798	1.053595	0.718050	discard	Exp5 (architectural, indep): STREAK-GATED COUNTER-TREND-LOSER exit pressure source (8th soft source in MAX fusion). NEW data dep at exit: portfolio loss_streak (no existing soft source reads it). EXIT-side counterpart to the entry-side ct keeps (Exp3 size shrink / Exp5 admission tighten): add exit pressure when streak>=2 AND position ct AND losing -> exit ct losers faster -> smaller losses + sooner streak reset. Variance-safe (integer streak x saturated /0.01 ret_vlong ct indicator x loss-side weight). MEASURED vs 1b0f2c46 0.849413: BYTE-IDENTICAL (composite 0.849413, all 4 regime scores/Sharpe/AnnRet/MaxDD unchanged, rally 0.718050 Sh1.30). The _sct_pressure NEVER FIRES on any clean trade: the portfolio streak>=2 state and an open ct losing position do not co-occur at any exit decision (ct losers exit before streak reaches 2, or the streak-2 state has no open ct loser). All stab 1.0, all MaxDD<10pct. Reverted to 1b0f2c46. CONCLUSION: extends the prior-session ct-shrink-saturation conclusion (DVP-ct-shrink Exp8 was also byte-identical inert) to the EXIT side -- the existing ct mechanisms (ct_vlong shrink, vd_ct_shrink, churn_ct, streak_ct size+admission, ct_hold_sat max_hold, adverse-freeze) already FULLY cover every ct-loser moment; the streak>=2 x open-ct-loser conjunction has ZERO incremental coverage because those states do not co-occur. The ct-loser space is SATURATED on both entry AND exit sides, for streak-gated as for volume/price-gated. Not branch-eligible (mechanism provably non-functional/inert in this backtest; amplifying an inert mechanism is pointless per DVP-ct-shrink + effort/result precedents). EXIT RULE: 5th consecutive architectural discard -> session ends.
-	-	-	-	-	-	-	-	session-summary	SESSION: 0 keeps + 5 architectural discards (EXIT RULE at 5 consecutive architectural). Baseline 1b0f2c46 0.849413 UNCHANGED. [bull 0.972003, crash 0.811798, sideways 1.053595, rally 0.718050 all unchanged]. Diagnostic at session start: all stability_factor=1.0, all flip_streak_gate=1.0 -> raw IS score; binding constraint is rally (Sharpe 1.30, 98 trades=2x others, 84.7
658aa81e	0.849415	0.888865	0.131498	0.972015	0.811798	1.053595	0.718051	discard	Exp1 (architectural, indep): SYMMETRIC ret_vlong<0 gate on the BEAR close-loc boost (mirrors the bull-side ret_vlong>0 gate that excludes crash dead-cat-bounce ct losers). Hypothesis: ungated bear boost fires on rally pullback ct shorts (bear short vs solidly-positive ret_vlong = rally LOSING trades) BOOSTING them bigger; gating on ret_vlong<0 keeps the boost on trend-aligned crash shorts (winners) and removes it from rally ct shorts (losers). MEASURED vs 1b0f2c46 0.849413: composite +0.000002 (0.849415 SUB-NOISE/INERT), mean +0.000004, std +0.000002. PER-REGIME: rally 0.718050->0.718051 (+0.000001 - Sh 1.301039->1.301040 UNCHANGED, MaxDD 1.5716 unchanged, the bear close-loc boost does NOT meaningfully fire on rally ct shorts), crash BYTE-IDENTICAL 0.811798 (Sh1.263846 unchanged - the gate keeps the boost on crash shorts but it was already near-inert there too per the prior-session comment), bull 0.972003->0.972015 (+0.000012 sub-noise), sideways BYTE-IDENTICAL 1.053595. All stab 1.0, all flip_gate 1.0, min_stability 0.8204->0.8204, all MaxDD<10pct. Reverted to 1b0f2c46. CONCLUSION: the bear close-loc boost is NEAR-INERT across all regimes (rally Sh unchanged to 5dp proves it does not meaningfully fire on rally ct pullback shorts - the 3-bar close-near-low x trend_w x er_w conjunction rarely co-occurs at meaningful magnitude on rally ct entries). Gating an inert mechanism is itself inert. Confirms the prior-session comment (bear close-loc boost near-inert; crash shorts trend-aligned) extends to: the boost does not fire meaningfully on rally ct shorts either. Amplifying an inert mechanism is pointless per the DVP-ct-shrink + effort/result precedents. Not branch-eligible (no regime meaningfully improved; mechanism provably near-inert). The close-loc axis (own-boost=keep 6e765b0f, own-shrink=dead-end, cross-symbol=redundant, scale-in=catastrophic, bear-gate=inert) is fully exhausted.
df49b108	0.608204	0.725561	0.391191	0.971886	0.811790	1.053608	0.064960	discard	Exp2 (architectural, indep): opp-gate trend-alignment GRADUATION uses MULTI-DAY ret_vlong (96-bar OLS) instead of 20-bar ret_long. Hypothesis: a 20-bar counter-move within a sustained multi-day trend (rally pullback, crash dead-cat bounce) makes ret_long flip against a winning position -> binary full exit on the opp-gate, forcing churn+smaller wins; using ret_vlong graduates winning trend-aligned positions through counter-moves (partial exit) -> rally longs+crash shorts capture more trend. MEASURED vs 1b0f2c46 0.849413: CATASTROPHIC composite -0.241209 (0.608204), raw_composite 0.800361 (final 0.608 = stability penalty hit), mean -0.163300, std +0.259695. PER-REGIME: rally 0.718050->0.064960 (-0.653090, 91pct drop BREACHES 50pct gate - Sh 1.301->0.962, MaxDD 1.5716->1.5813, raw_score 0.718->0.580681, stability_factor 1.000->0.111868 (STABILITY COLLAPSED - min_stability 0.5336 near the 0.50 rejection floor)), bull 0.972003->0.971886 (-0.000117 near-flat Sh1.852), crash 0.811798->0.811790 (-0.000008 byte-identical Sh1.264), sideways 1.053595->1.053608 (+0.000013 byte-identical Sh2.024). All MaxDD<10pct. Reverted to 1b0f2c46. CONCLUSION (mechanism-level, measured directly): the 20-bar ret_long flip detecting pullbacks in the opp-gate graduation is LOAD-BEARING for rally. Switching to ret_vlong HELD rally longs through 20-bar pullbacks (graduated partial exits instead of binary full) which is exactly wrong: (a) STABILITY CRASHED - holding positions longer through noisy pullback regions raises position-value variance across the AR(1) noise ensemble (stability 1.0->0.53 near rejection); (b) RAW DROPPED - the pullbacks the binary opp-gate cuts are REAL giveback, not temporary noise; riding them loses more. The near-term (20-bar) trend flip IS the correct exit signal for rally longs - it cuts them when the near-term trend turns, protecting both Sharpe (cuts giveback) AND stability (shorter holds = less position-value variance). The smoother multi-day ret_vlong is too slow a reversal detector for the exit-graduation decision point. Symmetric to the prior-session conviction-exit-extension discard (holding winners through mean-reversion destroys sideways/rally). Not branch-eligible (3 regimes near-flat, binding regime catastrophic - mechanism direction confirmed counterproductive). KEY CROSS-EXPERIMENT INSIGHT: exit-graduation trend-alignment must use the NEAR-TERM (20-bar) trend, NOT the multi-day trend - the exit decision needs a responsive reversal detector, and multi-day smoothness here costs stability+raw. Do NOT re-route exit-side trend gates to ret_vlong.
