commit	score	mean_score	std_score	bull_2021	crash_bear	sideways	rally_2024	status	description
86c3abb7	0.783182	0.827039	0.146191	0.940364	0.731308	0.996184	0.640302	discard	Exp1 (architectural, indep): STD-DEVIATION-EXTENSION profit-harvest exit pressure (7th soft MAX source). NEW data dep absent from the 6 existing soft sources: Bollinger-style price extension z-score (20-bar close mean/std, signed by position direction). Profit-side only, smooth tanh, same safe family as validated vc_pressure keep. MEASURED vs b902da2f 0.783185: composite -0.000003 SUB-NOISE (0.783182), mean -0.000005 (0.827039). PER-REGIME all stab 1.0 all raw==score: bull 0.940387->0.940364 (-0.000023), crash 0.731303->0.731308 (+0.000005), sideways byte-identical 0.996184, rally byte-identical 0.640302. KEY FINDING: the std-ext z>2 profit-direction condition rarely fires (20-bar close z>2 in the trade direction is uncommon in hourly data) and is DOMINATED by the existing MAX-fusion sources (pp/slope/time) whenever it does -> net inert. Confirms the exit-fusion saturation wall extends to a 7th profit-side source: the MAX takes the most-pressing term so an additional profit-harvest source is redundant with pp/vc whenever it would activate. Not branch-eligible (no regime improved meaningfully; crash +0.000005 is noise-floor). 1st architectural discard.
531a5a84	0.540154	0.654958	0.382682	0.882829	0.721836	1.000507	0.014662	discard	Exp2 (architectural, indep): CONVEX scale-in curve SHAPE (scale_frac progress^1.0 -> progress^1.4). New control flow on the scale-in subsystem's core FUNCTION FORM (prior sessions tuned PACE _entry_full_bars_dyn/win-accel but never the functional form -- always linear). Convex commits less in early bars then ramps to full at the same endpoint. MEASURED vs b902da2f 0.783185: composite -0.243 CATASTROPHIC (0.540154), mean -0.172 (0.654958). PER-REGIME: rally 0.640302->0.014662 (raw 0.133493, stability_factor 0.109832 CRASHED below 0.50 knee -> factor 0.11, BREACHED 50pct gate); bull 0.940387->0.882829 (-0.058); crash 0.731303->0.721836 (-0.0095); sideways 0.996184->1.000507 (+0.004). KEY FINDING: a convex ramp holds positions LONGER at intermediate (noise-sensitive) scale_frac values under AR(1) perturbation -> tracking error explodes on rally's high-churn positions (stability 1.0->0.11). The LINEAR fast-to-full scale-in was load-bearing for rally stability. Confirms and EXTENDS the documented wall (sustained-through-pullback sizing hurts rally) to the scale-in CURVE SHAPE: any mid-curve slowdown (convex) is the same failure mode as sustaining. Not branch-eligible (rally breached 50pct gate; stability collapse is the documented wrong-direction wall, no recovery path -- concave would commit more early = more first-bar DD, opposite wall). 2nd architectural discard.
-	-	-	-	-	-	-	-	session-summary	SESSION (baseline b902da2f 0.783185 -> UNCHANGED, no keep): 2 independent architectural experiments (Exp1-2, BOTH discards), no exploration branch opened. EXIT RULE: 2-architectural-discard minimum MET (2 attempted); exited on saturation (strategy at confirmed deep local optimum across 10+ prior sessions ~30 arch discards; both experiments this session reconfirmed documented walls, no plausible path to keep). Baseline b902da2f re-verified reproduces 0.783185 byte-identical at session start AND end [bull 0.940387 Sh1.927 DD3.21pct, crash 0.731303 Sh1.274 DD2.46pct 100pct WR, sideways 0.996184 Sh2.01 DD2.21pct 48t sample_factor 0.980, rally 0.640302 Sh1.47 DD5.19pct 100t 85pct WR; all stab 1.0, all raw==score, min_stab 0.811]. strategy.py matches b902da2f byte-identical (0 diff verified). CROSS-EXPERIMENT CONCLUSIONS (all measured this session, verifiable): (1) Exp1 (std-deviation-extension profit-harvest exit pressure, 7th soft MAX source, Bollinger z>2 signed by pos_dir): composite -0.000003 SUB-NOISE, rally/sideways BYTE-IDENTICAL, bull -0.000023, crash +0.000005. The 20-bar close z>2 profit-direction condition rarely fires in hourly data and is DOMINATED by the existing MAX-fusion sources (pp/slope/time) whenever it does -> net inert. CONFIRMS the exit-fusion saturation wall EXTENDS to a 7th profit-side source: the element-wise MAX takes the most-pressing term so an additional profit-harvest source is redundant with pp/vc whenever it would activate. (2) Exp2 (CONVEX scale-in curve shape, scale_frac progress^1.0 -> progress^1.4): composite -0.243 CATASTROPHIC, rally 0.640->0.0147 (raw 0.133, stability_factor 0.110 CRASHED below 0.50 knee, BREACHED 50pct gate). The convex ramp holds positions LONGER at intermediate (noise-sensitive) scale_frac values under AR(1) perturbation -> tracking error explodes on rally high-churn positions. The LINEAR fast-to-full scale-in was LOAD-BEARING for rally stability. NEW WALL: the scale-in curve SHAPE is load-bearing (prior sessions tuned PACE _entry_full_bars_dyn/win-accel but never the functional FORM -- always linear; this proves linear fast-to-full is required, not just one option among tunable forms). Extends the documented sustained-through-pullback-sizing wall to the mid-curve: ANY mid-curve slowdown (convex) is the same failure mode as sustaining an intermediate size. REMAINING UNCONQUERED: rally (0.640, streak_gate 0.873 from 4 consec ct-short losses, exit-timing inert, entry-size/ct-admission/ct-exit/scale-in-shape all saturated) and crash (0.731, return-limited Sh1.274 100pct WR, structurally small-move-capped). Both binding regimes at non-addressable structural limits. Structural-exploration NOT attempted: no coherent subsystem-rewrite hypothesis with a plausible path (every core mechanism converted+tuned by prior sessions; the two binding-regime limits are structural properties of the regime data -- rally ct-loser peak magnitude, crash bounce move size -- not of the strategy mechanism, so no subsystem rewrite can address them). results.tsv append-only preserved (path-scoped git checkout -- strategy.py throughout, never git revert). NEW BASELINE 0.783185 unchanged for future sessions.
2926c870	0.783185	0.827044	0.146196	0.940387	0.731303	0.996184	0.640302	discard	Exp1 (architectural, indep): TREND-ALIGNMENT-ADAPTIVE entry accumulator RHO. NEW cross-timescale data dep at the admission readiness EMA: each SIDE accumulator RHO (fixed 0.5) coupled to that side trend-ALIGNMENT -- lower RHO (faster admission, 0.5->0.35) for trend-aligned side (bull in uptrend / bear in downtrend), RHO_BASE for ct side (rally pullback shorts NOT sped up). Mechanism: a conviction spike in a confirmed trend is signal (admit fast, capture trend) vs noise in chop (filter). MEASURED vs baseline b902da2f 0.783185: BYTE-IDENTICAL INERT (composite 0.783185, mean 0.827044, std 0.146196 unchanged; all 4 regimes byte-identical incl Sharpe/MaxDD/trade counts: bull 0.940387, crash 0.731303, sideways 0.996184, rally 0.640302; all stab 1.0, all raw==score, min_stab 0.807). ROOT CAUSE: the accumulator RHO affects EMA smoothing of the conviction margin, but the admission threshold crossing (ENTRY_ACCUM_THRESH=0.0) fires on the SAME bars regardless of RHO 0.35 vs 0.5 -- a genuine entry has margin sustained over multiple bars so the EMA crosses on the same bar either way; trend-aligned entries already pass admission so speeding them does not admit a new trade. Same threshold-dominated inertness pattern as prior admission-smoothing experiments. ct side byte-identical by construction (RHO_BASE). NOT branch-eligible (no regime improved; byte-identical). Reverted to b902da2f. 1st architectural discard.
0e96e5a6	0.783076	0.826965	0.146297	0.940387	0.731303	0.996184	0.639987	discard	Exp2 (architectural, indep): GRIND-GATE on calm_boost. NEW cross-component data dep: calm_boost magnitude gated on trend-strength x low-vol conjunction (the grind condition). Reduce calm_boost by up to 30pct ONLY in strong-trend + low-vol (rally grind), sparing crash/bull (high vol -> gate 0) and sideways (low trend -> gate 0). Hypothesis: calm_boost over-boosts rally grind entries raising DD without alpha gain (prior calm_boost leverage-coupling discard). MEASURED vs baseline b902da2f 0.783185: SUB-NOISE, composite -0.000109 (0.783076), mean -0.000079 (0.826965), std +0.000101. PER-REGIME all stab 1.0 all raw==score: bull BYTE-IDENTICAL 0.940387, crash BYTE-IDENTICAL 0.731303, sideways BYTE-IDENTICAL 0.996184, rally 0.640302->0.639987 (-0.000315 sub-noise, Sh1.4709->1.4705). ROOT CAUSE: the grind-gate fired only on rally (the grind regime, as designed) but REDUCING calm_boost there slightly HURT rally (-0.000315) rather than helping -- calm_boost's contribution to rally grind/dwell entries is mildly net-POSITIVE alpha (reducing it cuts rally return), so the base calm_boost is well-calibrated on rally. The prior over-boost finding was specific to the leverage-COUPLED magnitude INCREASE (CALM_BOOST_MAX 0.8->0.90), not the base 0.8 calm_boost -- reducing the base below 0.8 in the grind costs alpha. crash/bull/sideways byte-identical confirms the grind-gate spares them correctly (high vol or low trend -> gate 0). NOT branch-eligible (no regime improved; sub-noise). Reverted to b902da2f. 2nd architectural discard (2-arch minimum MET).
-	-	-	-	-	-	-	-	session-summary	SESSION (baseline b902da2f 0.783185 -> UNCHANGED, no keep): 2 independent architectural experiments (Exp1-2, BOTH discards), no exploration branch opened (neither branch-worthy -- Exp1 byte-identical inert, Exp2 sub-noise negative with no regime improved). EXIT RULE: 2-architectural-discard minimum MET (2 attempted); exited on saturation (strategy at confirmed deep local optimum across 10+ prior sessions ~32 arch discards; both experiments this session reconfirmed documented walls). Baseline b902da2f re-verified reproduces 0.783185 byte-identical at session start AND end [bull 0.940387 Sh1.927 DD3.21pct, crash 0.731303 Sh1.274 DD2.46pct 100pct WR, sideways 0.996184 Sh2.01 DD2.21pct 48t sample_factor 0.980, rally 0.640302 Sh1.471 DD5.19pct; all stab 1.0, all raw==score, min_stab 0.811]. strategy.py matches b902da2f byte-identical (0 diff verified post-revert). THEME: probed two genuinely-untested architectural angles (verified untested via saturation grep before committing). Exp1 TREND-ALIGNMENT-ADAPTIVE entry accumulator RHO (per-side readiness-EMA memory coupled to that side trend-ALIGNMENT -- lower RHO=faster admission for trend-aligned side, RHO_BASE for ct side): BYTE-IDENTICAL INERT. ROOT CAUSE (verifiable): the accumulator RHO affects EMA smoothing of the conviction margin, but the admission threshold crossing (ENTRY_ACCUM_THRESH=0.0) fires on the SAME bars regardless of RHO 0.35 vs 0.5 -- a genuine entry has margin sustained over multiple bars so the EMA crosses on the same bar either way; trend-aligned entries already pass admission so speeding them admits no new trade. Reconfirms the THRESHOLD-DOMINATED inertness pattern of admission-smoothing (the EMA accumulator's RHO is not the binding knob; the threshold level is, and threshold changes are walled). Exp2 GRIND-GATE on calm_boost (calm_boost magnitude gated on trend-strength x low-vol conjunction -- reduce up to 30pct ONLY in strong-trend+low-vol grind, sparing crash/bull high-vol + sideways low-trend): SUB-NOISE -0.000109, rally -0.000315, others BYTE-IDENTICAL. ROOT CAUSE (verifiable): the grind-gate fired only on rally (as designed) but REDUCING calm_boost there slightly HURT rally -- calm_boost's contribution to rally grind/dwell entries is mildly net-POSITIVE alpha, so the base calm_boost (0.8) is well-calibrated on rally. CORRECTS a potential misreading of the prior calm_boost leverage-coupling discard: that discard's over-boost was from the leverage-COUPLED magnitude INCREASE (CALM_BOOST_MAX 0.8->0.90), NOT from the base 0.8 calm_boost; reducing the base below 0.8 in the grind costs alpha. So calm_boost base is at its optimum on rally; only the leverage-coupled increase is walled. CROSS-EXPERIMENT CONCLUSIONS (all measured this session, verifiable): (1) the entry-readiness accumulator RHO is NOT a viable lever -- it is threshold-dominated (byte-identical under RHO 0.35-0.65); admission timing is governed by the threshold level + the margin magnitude, not the EMA memory constant. (2) calm_boost base (0.8) is well-calibrated on rally grind (net-positive alpha; reducing it costs rally -0.0003); the documented calm_boost over-boost is a leverage-coupling artifact, not a base-calibration issue. (3) Both experiments reconfirm the deep local optimum: the admission-smoothing axis is inert, the calm_boost base is optimal. REMAINING UNCONQUERED: rally (0.640, DD5.19pct, streak structural, alpha-trade wall on entry, all DD-reduction levers maxed) and crash (0.731, return-limited Sh1.274 100pct WR, structurally small-move-capped). Both binding regimes at non-addressable structural limits per prior-session conclusions. Structural-exploration NOT attempted: no coherent subsystem-rewrite hypothesis with a plausible path (every core mechanism converted+tuned by prior sessions; the two binding-regime limits are structural properties of the regime data, not of the strategy mechanism). results.tsv append-only preserved (path-scoped git checkout -- strategy.py throughout, never git revert); both discards reverted to b902da2f; strategy.py matches b902da2f byte-identical (0 diff verified). NEW BASELINE 0.783185 unchanged for future sessions.
dde0058e	0.783185	0.827044	0.146196	0.940387	0.731303	0.996184	0.640302	discard	Exp1 (architectural, indep): COUNTER-TREND stop tightening (ct-gated ATR stop band 0.75x). NEW cross-component data dep at the stop subsystem: the ret_vlong ct indicator (fast-saturating /0.01, near-constant noise-free) was previously applied only to entry SIZE / scale-in / max_hold, never to the stop band. Hypothesis: rally ct shorts ride to stop as losses -> tightening the stop band for ct positions caps realized loss magnitude -> higher rally Sharpe (raw, the binding lever, all stability factors 1.0). MEASURED vs b902da2f 0.783185: BYTE-IDENTICAL (composite 0.783185, mean 0.827044, std 0.146196). PER-REGIME all byte-identical: bull 0.940387 Sh1.927, crash 0.731303 Sh1.273, sideways 0.996184 Sh2.006, rally 0.640302 Sh1.470935 DD5.191388 UNCHANGED. KEY FINDING (corrects prior framing): tightening the ATR stop band 25pct for ct positions had ZERO effect -> the ct losers do NOT exit via the SL path. They exit via the soft-pressure MAX fusion (slope-against/time/pp/ve/ar/vc) + de-risk ramp BEFORE the tightened stop band binds. The prior session-summary phrasing that ct shorts ride to stop as losses is imprecise: the ct-loser EXIT PATH is soft-pressure-dominated (giveback/slope/time), not stop-dominated. Extends the documented exit-timing/giveback-dominated inertness wall to the STOP subsystem. Not branch-eligible (no regime improved; byte-identical inert, hypothesis refuted, no path to keep). Reverted to b902da2f. Architectural discard #1.
1391d941	0.783185	0.827044	0.146196	0.940387	0.731303	0.996184	0.640302	discard	Exp2 (architectural, indep): COUNTER-TREND slope-against pressure WEIGHT boost in the exit MAX fusion. Builds on Exp1 finding (ct losers exit via soft-pressure MAX fusion, NOT the stop). For a rally ct short the exit slope is up=against the short -> slope-against is the early-firing soft term; boost its fusion weight 30pct for ct positions (ret_vlong ct indicator, fast-saturating /0.01 near-constant noise-free) -> ct short crosses de-risk floor at smaller slope-against -> exits sooner -> smaller realized loss -> higher rally Sharpe (raw). MEASURED vs b902da2f 0.783185: BYTE-IDENTICAL (composite 0.783185, mean 0.827044, std 0.146196). PER-REGIME all byte-identical: bull 0.940387 Sh1.927, crash 0.731303 Sh1.273, sideways 0.996184 Sh2.006, rally 0.640302 Sh1.470935 DD5.191388 stab0.811171 UNCHANGED. KEY FINDING: boosting the slope-against fusion weight for ct had ZERO effect -> slope-against is NOT the binding soft-pressure term for ct losers (another term dominates the MAX, or the exit fires via a path insensitive to _w_slope). Combined with Exp1 (stop tightening inert) this LOCALIZES the ct-loser exit path to TIME-PRESSURE (max_hold), which is ALREADY optimized in the baseline via _ct_hold_sat fast-saturating shortening (the validated Exp5 keep). The ct-loser exit is giveback/time-dominated and fully optimized: stop=inert, slope-against=inert, giveback=inert (ct peaks < _pp_min), pp-activation=refuted, max_hold=already-at-optimum. Extends the exit-timing inertness wall to the slope-against fusion weight. Not branch-eligible (no regime improved; byte-identical inert, hypothesis refuted, no path to keep). Reverted to b902da2f. Architectural discard #2.
1cb51da1	0.706443	0.775559	0.230388	0.958405	0.730050	0.996184	0.417599	discard	Exp3 (architectural, indep): COUNTER-TREND TIME-GRID resize throttle (non-price-derived integer gate, row 531 untried vehicle). bars_held parity gate suppresses ct same-sign resizes on odd bars_held -> halves ct resize emission frequency -> intended to consolidate partial-reduce shaves feeding the rally 4-loss streak (streak_gate 0.873). MEASURED vs b902da2f 0.783185: REGRESSION composite -0.076742 (0.706443), mean -0.051485 (0.775559), std +0.084192 (0.230388). PER-REGIME all stab 1.0 except rally 0.802201 all raw==score: bull 0.940387->0.958405 (+0.018018 Sh1.927->? incidental), crash 0.731303->0.730050 (-0.001253), sideways BYTE-IDENTICAL 0.996184, rally 0.640302->0.417599 (-0.222703 BIG, Sh1.470935->1.120894, DD5.191->7.202pct, stab0.811->0.802). KEY FINDING: the 1-bar lag on ct de-risk shrinks made ct losers LOSE MORE (Sh -0.35, DD +2.0pct) -> the partial-reduce shaves are NOT immaterial, they are LOAD-BEARING beneficial de-risking (shrinking the position as it loses caps the loss). CONFIRMS the streak-breaking via shave-consolidation is WALLED at this baseline: unlike row 531s old 26f4b23d baseline where the 7-streak contained immaterial shaves (pos_pnl ~-0.01..-0.02pct), at b902da2f the de-risk ramp does real loss-capping work. All four streak-breaking vehicles now confirmed walled: (1) per-step-\$ gate=latch(catastrophic), (2) |pos_pnl|-band=price-boundary noise(stability collapse), (3) ratchet=overfit(failed cross-ex fa18a3d7), (4) time-grid=lag costs raw(rally -0.22). The streak is structurally unbreakable. rally stability 0.802 (just above 0.80 knee) -- time-grid did NOT help stability (grid quantization already handles it). Not branch-eligible (rally -0.22 dominant, composite -0.077, no path to keep). Reverted to b902da2f. Architectural discard #3.
6b061f30	0.580465	0.650380	0.233049	0.442968	0.731303	0.996184	0.431064	discard	Exp4 (architectural, indep): DEEP-STREAK ct admission ESCALATION TIER (+35pct tighten at streak>=4, on top of base +10pct at streak>=2). Targets streak_gate 0.873 directly (largest un-maxed lever; only admission blocking breaks a streak). Noise-immune integer loss-streak gate. MEASURED vs b902da2f 0.783185: CATASTROPHIC composite -0.202720 (0.580465), mean -0.176664 (0.650380), std +0.086853 (0.233049). PER-REGIME: bull 0.940387->0.442968 (-0.497419 BREACHES 50pct gate floor 0.470 -- the integer loss-streak MISFIRES on bull: 2021 multi-bar corrections accumulate a long-loss streak; when ret_vlong dips negative the bull recovery dip-buy long is flagged ct and the +35pct escalation BLOCKS it -> destroys bull alpha, same misfire as per-direction streak ca639bc9 but worse), crash BYTE-IDENTICAL 0.731303, sideways BYTE-IDENTICAL 0.996184, rally 0.640302->0.431064 (raw 0.640->0.610 DOWN streak did NOT break -- the +35pct still insufficient to block high-conviction ct shorts OR blocked ct winners too; stability CRASHED 0.811->0.712 below 0.80 knee -> stability_factor 0.707 -- harder admission threshold is a noise boundary). KEY FINDING: streak-breaking via ct admission is STRUCTURALLY WALLED: (1) the integer loss-streak MISFIRES on bull (corrections create long-loss streaks flagging bull recovery longs as ct), (2) harder admission collapses rally stability (threshold noise boundary), (3) even +35pct does not break the rally streak (admission-inertness: ct shorts are high-conviction). Combined with Exp1-3 this completes the ct-exit/streak axis saturation. Not branch-eligible (catastrophic, bull 50pct gate breached, rally stability collapse). Reverted to b902da2f. Architectural discard #4.
04db1628	0.772066	0.814884	0.142729	0.931675	0.715502	0.976206	0.636154	discard	Exp5 (architectural simplification, indep): REMOVE the _tq_atten (R^2 trend-quality entry attenuator). TEST whether R^2 (OLS linearity) is redundant with Kaufman ER (path efficiency, already used in _er_adj/_close_conv/_dvp gates) -- both are path-efficiency statistics, highly correlated in principle. If redundant, removal is score-neutral/positive (simpler). MEASURED vs b902da2f 0.783185: REGRESSION composite -0.011119 (0.772066), mean -0.012160 (0.814884), std -0.003467 (0.142729 tighter but via mean drop). PER-REGIME all stab 1.0 (min 0.811920) all raw==score: bull 0.940387->0.931675 (-0.008712 Sh1.927->1.911), crash 0.731303->0.715502 (-0.015801 Sh1.273->1.242), sideways 0.996184->0.976206 (-0.019978 Sh2.006->1.703 BIG), rally 0.640302->0.636154 (-0.004148 Sh1.471->1.460). KEY FINDING: R^2 linearity is NOT redundant with Kaufman ER path-efficiency -- _tq_atten is LOAD-BEARING, especially for sideways (-0.020, Sh -0.30). R^2 (goodness of linear FIT) captures the LINEARITY/direction-consistency of the trend that ER (|net move|/sum|path|) does not: a path can be efficient (high ER) but non-linear (e.g. a single jump then flat -> high ER, low R^2), and vice versa. Confirms the TIGHT LOCAL OPTIMUM: even correlated-looking path-efficiency signals are each load-bearing; no simplification holds score. Not branch-eligible (no regime improved; all regressed). Reverted to b902da2f. Architectural discard #5. EXIT RULE: 5 consecutive architectural discards met.
