commit	score	mean_score	std_score	bull_2021	crash_bear	sideways	rally_2024	status	description
13e5fcc5	0.604412	0.633126	0.095714	0.699048	0.575486	0.749281	0.508689	discard	Exp1 (architectural, indep): SUSTAIN conviction-margin entry shrink (_bull_conv_atten/_bear_conv_atten 0.70..1.0) through scale-in, mirroring the validated Exp5/Exp9 sustain pattern for _conc_shrink/_vol_shrink (cached at entry, applied in full_target, reset on exit). Hypothesis: marginal-conviction entries (documented as rally instability driver) stay smaller for whole hold -> smaller giveback on marginal trades that reverse -> lower rally DD -> higher rally Sharpe. MEASURED vs baseline cabfb6f1 0.605307: composite -0.000895 (0.604412), mean -0.000622 (0.633126), std UP 0.094802->0.095714. PER-REGIME: bull 0.699048 BYTE-IDENTICAL (Sh1.863940 - high conviction -> conv_atten~1.0 -> sustain no-op), crash 0.575486 BYTE-IDENTICAL (Sh1.263849), sideways 0.749111->0.749281 (+0.000170 - Sh2.024898->2.025718, MaxDD 0.5529->0.5542 ~same), rally 0.511346->0.508689 (-0.002657 REGRESSION - Sh1.300294->1.291782, MaxDD 1.5716->1.5704 ~same). All stab 1.0, all flip 1.0, all MaxDD<10pct. CORRELATION ONLY (not causal): the rally regression is the OPPOSITE of hypothesis - sustaining the shrink on marginal-conviction rally entries capped their trend-capture (rally grinds on marginal-conviction entries that ARE alpha), extending the documented "rally re-entries are alpha" wall to marginal-conviction entries specifically. Sideways small gain = marginal sideways losers kept smaller. Mechanism wrong-directional for the binding regime; no clean fix (would fight the alpha-trade wall). Architectural discard #1.
fdb69641	-999.000000	-999.000000	0.000000	-999	-999	-999	-999	discard	Exp2 (architectural, indep): TREND DECELERATION exit pressure (8th soft source). NEW data dep genuinely orthogonal to all existing exit signals: 2nd derivative of log price (slope-of-slope). _exit_slope_prev = mean of 12/16/22-bar OLS slopes over window shifted back 3 bars; _acc = _exit_slope - _exit_slope_prev; direction-signed _decel fires when slope moving AGAINST position dir (trend decelerating). Profit-side only (harvest winners at exhaustion). MEASURED vs baseline cabfb6f1 0.605307: CATASTROPHIC composite -999 (hard >10pct DD cutoff). PER-REGIME MaxDD exploded: bull 0.8955->29.166pct, crash 0.6489->34.678pct, sideways 0.5529->15.174pct, rally 1.5716->35.819pct. Sharpe: bull 1.864->2.436 (up - exits winners early then they run without it?), crash 1.264->-1.610 (fights downtrend), sideways 2.025->2.715, rally 1.300->1.085. All stab 1.0. CORRELATION ONLY: the DD explosion is from slope-of-slope AMPLIFYING price noise -> false deceleration exits on every trend pullback/bounce -> churn + re-entry into adverse bounces -> compounding losses. Same noise-sensitive trajectory/2nd-derivative family prior sessions confirmed dead for trend regimes ("conviction-noise around saturation IS normal regime structure"; slope-trajectory gates crushed rally -0.31). crash Sharpe turning negative confirms the mechanism systematically fights strong trends (exits crash shorts on every decelerating bounce). Not branch-recovered: realistic fix (heavy sustained-deceleration gating) likely renders dead-code, and the noise amplification is structural to 2nd-derivative signals. Architectural discard #2; meets exit-rule minimum of 2 architectural discards.
43d69252	0.526956	0.563244	0.120957	0.419084	0.576464	0.749115	0.508312	discard	Exp3 (architectural, indep): CROSS-SYMBOL BROAD-TREND-AGREEMENT amplifier on the de-risk convex cushion. NEW cross-symbol data dep at the de-risk decision: cushion exponent _dr_k amplified by up to +25pct of base amp when BOTH BTC 96-bar trend (_btc_trend) AND partner-alt 20-bar trend (_alt_lead[partner]) agree with position direction (broad confirmed trend -> ride local pullback giveback). Reuses existing _btc_trend/_alt_lead (no new price reads), deep-saturated scales (/0.03 /0.02), gated on _dr_align + profit. MEASURED vs baseline cabfb6f1 0.605307: composite -0.078351 (0.526956), mean -0.070504 (0.563244), std UP 0.094802->0.120957. PER-REGIME: bull 0.699048->0.419084 (-0.279964 CRUSHED - Sh1.863940->1.302936, MaxDD 0.8955->1.6216 - the amplifier rode 2021 correction givebacks), crash 0.575486->0.576464 (+0.000978 - Sh1.263849->1.266811, but stab 0.970->0.825 dropped), sideways 0.749111->0.749115 (BYTE-IDENTICAL - sideways has no broad-trend agreement), rally 0.511346->0.508312 (-0.003034 OPPOSITE of hypothesis - Sh1.300294->1.289798, MaxDD 1.5716->1.5975). All MaxDD<10pct, all flip 1.0. CORRELATION ONLY: the bull crush is because broad-trend AGREEMENT does not distinguish a local pullback from a real correction -- bull 2021 corrections occur DURING broad uptrend agreement (BTC/partner still trending up) so the amplifier fires and rides the correction giveback -> DD widens, Sharpe collapses. The cross-symbol agreement signal carries no information about whether the CURRENT giveback is noise or reversal (both coincide with agreement). Not branch-recoverable: gating out the corrections would require detecting the correction itself, which is the very discrimination the cushion is supposed to make -> circular. Same family as prior cross-symbol exit failures (portfolio-DD accelerator, VWAP-opp-gate): cross-symbol signals at exit correlate with regime/broad-state but lack per-symbol-momentum context to separate pullback from reversal. Architectural discard #3.
							session-summary	SESSION (v2.1 baseline cabfb6f1 0.605307): 0 keeps + 3 architectural discards (Exp1/Exp2/Exp3), no branch opened. Baseline UNCHANGED cabfb6f1 0.605307 [bull 0.699048 Sh1.864, crash 0.575486 Sh1.264, sideways 0.749111 Sh2.025, rally 0.511346 Sh1.300 MaxDD1.57; all stab 1.0, all flip 1.0, all MaxDD<10pct]. THEME: per the prior session-summary guidance (Sharpe-improvement not return-seeking; binding levers rally Sharpe 1.30 + crash Sharpe 1.26), probed 3 genuinely-novel architectural mechanisms targeting the binding rally lever via signal-quality / exit-timing rather than sizing. (1) Exp1 SUSTAIN conviction-margin entry shrink through scale-in (mirror Exp5/Exp9 sustain pattern; _bull_conv_atten cached + applied in full_target): rally -0.0027 (Sh1.300->1.292), sideways +0.00017, bull/crash byte-identical. FAILURE = the alpha-trade wall: marginal-conviction rally entries ARE alpha (sustaining the shrink capped their trend-capture), extending the documented "rally re-entries are alpha" finding to marginal-conviction entries specifically. (2) Exp2 TREND DECELERATION exit pressure (8th soft source, NEW 2nd-derivative-of-log-price data dep, slope-of-slope over 3-bar shift): CATASTROPHIC composite -999 (MaxDD 0.90->29pct bull, 0.65->35pct crash, 1.57->36pct rally; hard >10pct cutoff). crash Sharpe 1.26->-1.61 (fights downtrend). FAILURE = the noise-trajectory wall: slope-of-slope AMPLIFIES price noise -> false deceleration exits on every trend pullback/bounce -> churn + re-entry into adverse bounces -> DD explosion. Same family prior sessions confirmed dead ("conviction-noise around saturation IS normal regime structure"; slope-trajectory gates crushed rally -0.31). 2nd-derivative signals are structurally too noise-sensitive for this hourly bar scale. (3) Exp3 CROSS-SYMBOL BROAD-TREND-AGREEMENT amplifier on the de-risk convex cushion (_dr_k amplified when BTC 96-bar + partner-alt 20-bar both agree with position dir; reuses _btc_trend/_alt_lead): bull CRUSHED -0.280 (Sh1.86->1.30, MaxDD 0.90->1.62), rally -0.003 (opposite of hypothesis), crash +0.001, sideways byte-identical. FAILURE = the cross-symbol-exit-correlation wall: broad-trend AGREEMENT does not distinguish local pullback from real correction (bull 2021 corrections occur DURING broad uptrend agreement -> amplifier fires and rides correction giveback). Cross-symbol signals at exit correlate with regime/broad-state but lack per-symbol-momentum context to separate pullback from reversal -- same family as prior portfolio-DD-accelerator and VWAP-opp-gate discards. CROSS-SESSION CONCLUSION (reinforced): the strategy is at structural rigidity. All 3 of this sessions genuinely-novel mechanisms (a new sustain pattern, a genuinely-new 2nd-derivative signal, a new cross-symbol cushion gate) failed in ways that match 3 DISTINCT documented dead-end families (alpha-trade wall, noise-trajectory wall, cross-symbol-exit-correlation wall). No branch-worthy signal emerged (each failure was wrong-directional for the binding regime, not a tunable regression). The binding rally Sharpe (1.30) remains the unconquered lever; every angle that could improve it (filter count -> alpha wall; shrink size -> alpha wall; extend winners -> noise/time-pressure wall; exit on 2nd-derivative -> noise wall; ride giveback on broad agreement -> correction wall) is now documented dead. Future sessions: do NOT re-attempt (a) sustaining conviction-margin shrink, (b) 2nd-derivative/slope-of-slope exit signals, (c) cross-symbol broad-trend-agreement at the exit/cushion subsystem. The marginal-conviction-entries-are-alpha finding (Exp1) is a NEW load-bearing fact for the rally regime -- conviction-margin entry shrink must remain first-bar-only (not sustained). Baseline cabfb6f1 0.605307 unchanged; 3 architectural discards recorded.
0e6483fe	0.605276	0.633698	0.094741	0.699048	0.575486	0.748911	0.511346	discard	Exp1 (architectural, indep): REALIZED-EXCESS-KURTOSIS entry-size attenuator. NEW 4th-moment data dep (orthogonal: vol=magnitude, skew=asymmetry, none=tail-fatness). 50-bar excess kurtosis, deep-saturated tanh /8.0, shrink-only max 0.15, first-bar-only. MEASURED vs cabfb6f1 0.605307: composite -0.000031 (0.605276, sub-noise inert), mean -0.000050, std -0.000061. PER-REGIME: bull BYTE-IDENTICAL 0.699048, crash BYTE-IDENTICAL 0.575486, rally BYTE-IDENTICAL 0.511346, sideways -0.000200 (0.749111->0.748911). All stab 1.0, all flip 1.0, min_stability 0.820383 unchanged. The /8.0 deep-sat gate essentially never fires (50-bar hourly excess kurtosis rarely >8 for BTC/ETH/SOL) -> _kurt_atten ~= 1.0 across all regimes -> no signal. New data dep but inert in practice (no regime-level signal to iterate on; same inert precedent as row 847 BTC-8bar). Not branch-eligible (no regime improved). Architectural discard #1. Reverted to cabfb6f1 via git checkout -- strategy.py.
a0ed3cbf	0.604413	0.633111	0.095661	0.699113	0.575487	0.749115	0.508730	discard	Exp2 (architectural, indep): ADDITIVE-BOUNDED fusion of the 8 volume/DVP entry boosts (x -> +bounded, capped +0.20). Decision-architecture change: the {own,BTC,partner}x{vol,price,DVP} grid was validated factor-by-factor but never tested as a compound product; in broad-trend all 8 fire -> multiplicative 1.05^8=1.48 (+48% first-bar over-commit). Hypothesis: compound over-commits rally trend longs into pullbacks (win-accelerator-over-commit mechanism). MEASURED vs cabfb6f1 0.605307: composite -0.000894 (0.604413), mean -0.000637, std +0.000859. PER-REGIME: rally -0.002616 (0.511346->0.508730), bull +0.000065 (~identical 0.699048->0.699113), crash +0.000001 (identical), sideways +0.000004 (identical). All stab 1.0, min_stability 0.819252. Capping the compound HURT rally -> the volume-confirmation boosts are NOT over-committing harmfully; they are genuine alpha for rally (capping removes it). Compound-over-commit hypothesis DISPROVEN. Observation (correlation only): extends the rally-re-entries-are-alpha finding to the volume-confirmation boost axis - the compound product captures real trend-entry alpha, does not double-count. Wrong-directional for the binding regime (rally dropped), not a tunable regression -> not branch-eligible. Architectural discard #2. Reverted to cabfb6f1.
35c7c7d4	0.604891	0.633448	0.095190	0.699048	0.575486	0.749111	0.510146	discard	Exp3 (architectural, indep): COUNTER-TREND bars-held DIRECT exit pressure (7th soft source in MAX fusion). Re-tests row-701 multi-day-ct exit lever under v2.1 (row-701 blocked by rally stability at 0.8008 knife-edge; v2.1 has all stab 1.0 = headroom). ct indicator (fast-sat /0.01 ret_vlong, near-constant) x bars_held onset 4 ramp 4 cap 0.45, weight 1.0, added to MAX fusion. MEASURED vs cabfb6f1 0.605307: composite -0.000416 (0.604891), mean -0.000300, std +0.000388. PER-REGIME: rally -0.001200 (0.511346->0.510146), bull BYTE-IDENTICAL, crash BYTE-IDENTICAL, sideways BYTE-IDENTICAL. All stab 1.0 (rally stab did NOT drop - v2.1 stability-headroom hypothesis confirmed). Mechanism fired as designed (rally ct targeted) but HURT rally. DISCREPANCY vs row-701 (+0.052 Sharpe on de412448): current cabfb6f1 already has FOUR ct-loser-cutting mechanisms (_ct_hold_sat + _ct_vlong + _churn_ct_atten + _streak_ct_shrink); a 5th direct-pressure ct cutter OVER-cuts rally ct positions (winning ct shorts + alpha). Multi-day-ct exit-cutting axis SATURATED in current baseline. Observation (correlation only): confirms row-924 EXIT-SIDE-LOSERS-SATURATED extends to direct bars_held pressure variant. Wrong-directional for binding regime, no tunable fix (saturation) -> not branch-eligible. Architectural discard #3. Reverted to cabfb6f1.
ffea3f30	0.393233	0.424247	0.103379	0.288569	0.575730	0.391158	0.441532	discard	Exp4 (architectural, indep): LOG-SUM-EXP soft-exit fusion blend (MAX -> smooth-LSE operator, sharpness 12). Hypothesis: pure MAX discards reinforcement from two independent near-equal moderate pressures; LSE stays ~= MAX single-source but adds bonus when 2nd source near-max. MEASURED vs cabfb6f1 0.605307: composite -0.212 (0.393233 CATASTROPHIC), raw_composite 0.455404. PER-REGIME raw: bull 0.699->0.418 (stab 1.0->0.691 -> final 0.289), sideways 0.749->0.391 (stab 1.0), rally 0.511->0.529 RAW UP +0.018 but stab 1.0->0.835 -> final 0.442, crash ~identical 0.5757. min_stability 0.820->0.707. Stability collapse confirms MAX is load-bearing: 7 terms share vol_ratio/HL2/pnl_scale inputs -> multiple simultaneously non-zero under AR(1) noise -> LSE ADDS them -> correlated-noise amplification -> tracking error explodes (bull stab 0.691, rally 0.835). Near-MAX-single-source reasoning WRONG for shared-input multi-term fusion. Observation (correlation only): rally raw +0.018 = multi-source-agreement hypothesis has small positive raw signal there, but fusion-BLEND vehicle destroys stability (wrong mechanism); existing _soft_atten already captures multi-source agreement noise-safely via single-source attenuation. Not branch-eligible (catastrophic, blend IS the noise problem). Architectural discard #4. Reverted to cabfb6f1.
f36d098e	0.605307	0.633748	0.094802	0.699048	0.575486	0.749111	0.511346	discard	Exp5 (architectural, indep): STALE-LOSS sustained-underwater exit pressure (7th soft source, new per-symbol consecutive-underwater state). Re-tests row-775 stale-loss lever under v2.1 (row-775 raised rally raw Sharpe +0.04 surgical but blocked by rally stability seed-lock under v1; v2.1 has rally stab 1.0 headroom). Sustained-underwater (consecutive bars pos_pnl<-0.5*|stop|) onset 4 ramp 4 cap 0.40, weight 1.0, integer count (noise-immune). MEASURED vs cabfb6f1 0.605307: BYTE-IDENTICAL (composite 0.605307, all 4 regimes identical, all stab 1.0, min_stability 0.820383). Completely INERT: onset-4 gate never fires because losers exit via instantaneous ATR stop (_sl_pressure saturates 0.95 -> binary) or saturated slope-against BEFORE accruing 4 consecutive underwater bars. Confirms row-924 EXIT-SIDE-LOSERS-SATURATED with a NEW mechanism (adverse-DURATION, distinct from Exp3 ct-bars-held): no position sits sustained-underwater long enough for a duration-based loser-exit gate to bind. v2.1 headroom did NOT help (lever inert-by-construction; row-775 +0.04 was on de412448 WITHOUT the current ATR-stop/slope-against/ar-pressure stack that pre-empts slow bleeders). Observation (correlation only): exit-loser axis saturated across sub-mechanisms (Exp3 ct-bars-held over-cuts, Exp5 stale-loss inert). Not branch-eligible (byte-identical). Architectural discard #5. EXIT RULE triggered (5 consecutive architectural discards). Reverted to cabfb6f1.
-	-	-	-	-	-	-	-	session-summary	SESSION (v2.1 baseline cabfb6f1 0.605307): 0 keeps + 5 architectural discards (EXIT RULE at 5 consecutive architectural), no branch opened. Baseline UNCHANGED cabfb6f1 0.605307 [bull 0.699048 Sh1.864, crash 0.575486 Sh1.264, sideways 0.749111 Sh2.025, rally 0.511346 Sh1.300 MaxDD1.57; all stab 1.0, all flip 1.0, all MaxDD<10pct]. THEME: tested whether the v2.1 scoring relaxation (k 0.5->0.3, all stabilities now 1.0 = headroom absent under v1) unblocks previously-stability-blocked levers, plus genuinely-novel data deps. 5 architectural experiments across entry-sizing + exit-fusion subsystems. (1) Exp1 REALIZED-EXCESS-KURTOSIS entry-size attenuator (NEW 4th-moment data dep, /8.0 deep-sat): INERT -0.000031 (bull/crash/rally byte-identical, sideways -0.0002); 50-bar hourly excess kurtosis rarely >8 -> gate never fires. (2) Exp2 ADDITIVE-BOUNDED fusion of 8 volume/DVP entry boosts (x -> +bounded cap +0.20, compound-over-commit hypothesis): -0.000894, rally -0.0026 (capping HURT rally -> boosts are genuine alpha not over-commit; compound-over-commit hypothesis DISPROVEN for volume boosts). (3) Exp3 COUNTER-TREND bars-held DIRECT exit pressure (7th soft source, re-test row-701 under v2.1 headroom): -0.000416, rally -0.0012 (bull/crash/sideways byte-identical; stability did NOT drop = headroom confirmed, but RAW gain absent because current baseline already has 4 ct-cutting mechanisms -> 5th over-cuts). (4) Exp4 LOG-SUM-EXP soft-exit fusion blend (MAX -> smooth-LSE operator): CATASTROPHIC -0.212 (bull stab 1.0->0.691, rally stab 1.0->0.835; 7 shared-input terms added by LSE -> correlated-noise amplification -> stability collapse; confirms MAX is load-bearing. rally raw +0.018 = multi-source-agreement has small positive signal but blend is wrong vehicle). (5) Exp5 STALE-LOSS sustained-underwater exit pressure (7th soft source, re-test row-775 under v2.1 headroom, new per-symbol consecutive-underwater state): BYTE-IDENTICAL INERT (losers exit via ATR stop/slope-against before accruing 4 underwater bars). CROSS-SESSION CONCLUSIONS (reinforced, all measured this session): (a) v2.1 stability headroom is REAL (Exp3/Exp5 stability did not drop) but DOES NOT unblock the exit-loser levers because those levers are inert-by-construction in the CURRENT baseline (row-701/775 were on older baselines de412448 without the current ATR-stop/slope-against/ar-pressure/ct-cutting stack that pre-empts slow/ct bleeders). (b) EXIT-LOSER AXIS SATURATED across sub-mechanisms: Exp3 (ct x bars_held) over-cuts rally, Exp5 (adverse x duration) inert - losers exit via existing stop/slope-against on the same bar (row-924 conclusion confirmed with 2 NEW mechanisms). (c) ENTRY VOLUME-CONFIRMATION BOOSTS ARE GENUINE ALPHA, not over-commitment: capping their compound product removes rally alpha (Exp2), extending the rally-re-entries-are-alpha finding to the volume-confirmation axis. (d) The MAX soft-exit fusion is load-bearing against any additive/blend replacement (Exp4 catastrophic); the existing _soft_atten already captures multi-source agreement noise-safely via single-source attenuation. (e) New higher-moment (kurtosis) signals are inert at this hourly scale (deep-sat thresholds never reached). The binding rally Sharpe (1.30) remains unconquered; this session's 5 architectural mechanisms failed in ways consistent with the 4 documented dead-end families (inert/alpha-wall/noise-wall/saturation). results.tsv append-only preserved (path-scoped git checkout -- strategy.py throughout); all 5 discards reverted to cabfb6f1. EXIT: 0 keeps, 5 architectural discards (satisfies exit rule), baseline cabfb6f1 0.605307 unchanged.
146f0621	0.381538	0.460778	0.264132	0.504220	0.576010	0.735918	0.026963	discard	STRUCTURAL_EXPLORATION: de-risk ramp CORE MECHANISM rewrite (power-ramp _de_risk=1-_dr_x^k -> normalized-logistic sigmoid; function FORM change: symmetric S-curve vs monotone convexity). Subsystem: exit de-risk ramp. Trigger met: 5 prior architectural discards + true subsystem rewrite. Cushion gate drives sigmoid inflection (0.5->0.65) + steepness (4->9); endpoints normalized to 1@x=0 / 0@x=1. MEASURED vs cabfb6f1 0.605307: composite 0.381538 (-0.224, BELOW relaxed floor 0.525307=baseline-0.08), mean 0.460778 (BELOW relaxed floor 0.583748=baseline_mean-0.05), raw_composite 0.468787. PER-REGIME raw: bull 0.699->0.504 (stab 1.0), crash 0.575->0.576 (~identical stab 1.0), sideways 0.749->0.736 (stab 1.0), rally 0.511->0.263 RAW (51.5% of baseline, just above 50% gate) BUT stab 1.0->0.102 -> final 0.027. min_stability 0.820->0.531. DD all<10pct (rally 2.69pct). Sigmoid SLOW-END TAIL let rally ct losers linger under near-full pressure -> adverse accumulation -> stability collapse + raw drop. FAILED RELAXED GATES (composite+mean below floors) -> does NOT open structural-exploration branch. The de-risk power-ramp FUNCTION FORM is load-bearing: convex hold-then-cut (sharp approach to 0) calibrated to rally ct-loser exit timing; sigmoid lacks the sharp near-saturation cut. Observation (correlation only): de-risk ramp shape binds on RALLY ct positions specifically (only regime where de-risk is the binding exit path, not stop/slope); crash/sideways de-risk-shape-invariant. ONE structural-exploration attempt per session; reverted -> session ends. Reverted to cabfb6f1.
