commit	score	mean_score	std_score	bull_2021	crash_bear	sideways	rally_2024	status	description
2ed872c6	0.595523	0.686057	0.301781	1.025954	0.563883	1.066580	0.362880	0.410990	branch	branch step1 (re-test prior-session step4 3c12a731 full-exit oscillation supplement): voter-independent structural trigger -- held ct multi-day ret_vlong + near-breakeven |pos_pnl|<0.5*|stop| + trend_avg guard + bars_held>ENTRY_FULL_BARS -> grid-bypassing full exit target->0. MEASURED vs 99a369a1 0.706007: composite 0.595523 (-0.110484 REGRESSION), raw_composite 0.706007->0.647658 (-0.058349), mean 0.778803->0.686057 (-0.092746), std 0.242655->0.301781 (worse). PER-REGIME: bull BYTE-IDENTICAL 1.025954, crash 0.720320->0.563883 (-0.156437 Sh1.254->1.009 -- REGRESSED), sideways BYTE-IDENTICAL 1.066580, rally 0.670171->0.362880 (-0.307291 RAW 0.670171->0.570868 -0.099303 DOWN not up, stab_factor 1.0->0.635663 COLLAPSED, Sh1.553->1.328), mixed BYTE-IDENTICAL 0.410990. max_dd rally 4.969 (<10pct). DOES NOT REPRODUCE step4s +0.0024 (rally +0.0105 stab 1.0) -- instead rally stability COLLAPSED + rally raw DOWN. FAILURE MECH (architectural fact, direct measurement): the near-breakeven band _nb_br = 1 - min(1, |pos_pnl|/(0.5*|stop|)) is a PRICE-DERIVED THRESHOLD (|pos_pnl| crosses 0.5*|stop| under AR(1) close perturbation) -- the documented price-boundary-noise wall (row 528/531: |pos_pnl|<BREAKEVEN_BAND flips under AR(1) -> perturbed close moves pos_pnl across the boundary differently per noise path -> divergent exits -> tracking-error explosion -> stability collapse). The supplement fires on perturbed bars differently -> rally stability 0.636. ALSO rally raw DOWN (-0.099) and crash -0.156: the full-exit over-fires on positions that would have recovered (the trend_avg guard does not protect crash dead-cat longs which are themselves trend_avg<0; same crash wall step5 hit). BRANCH CONTINUES: step2 replaces the price-derived _nb_br near-breakeven band with a NOISE-IMMUNE condition (the prior session step4 MUST have escaped this via the already-modified opp-gate context of its structural-exploration branch; on the unmodified baseline the price-band noise wall bites). Hypothesis: gate the supplement on an INTEGER bar-count of sustained near-breakeven (noise-immune count, same safety family as len(_eh)/_churn_hist) OR drop the near-breakeven condition entirely and rely on ct+held+trend_avg alone. raw_composite 0.647658 is the branch best so far (only step1).
ed8bd1e2	0.587501	0.680024	0.308410	1.025954	0.563883	1.066580	0.332715	0.410990	branch	branch step2: REPLACE price-derived near-breakeven band (step1 _nb_br) with NOISE-IMMUNE bars_held ramp (_hold_br = (bars_held-ENTRY_FULL_BARS)/OSC_HOLD_RAMP=6). Fix for step1 rally stab collapse (price-boundary noise wall). MEASURED vs step1 0.595523: composite 0.587501 (-0.008022 WORSE), raw_composite 0.647658->0.647943 (+0.000285 sub-noise flat), mean 0.686057->0.680024. PER-REGIME: bull/sideways/mixed byte-identical, crash byte-identical 0.563883 (Sh1.009), rally 0.362880->0.332715 (-0.030 raw 0.570868->0.572082 ~flat, stab_factor 0.635663->0.581586 COLLAPSED further). NO-PROGRESS: the bars_held ramp did NOT fix the over-firing -- the supplement still fires on rally ct shorts that RECOVER (rally uptrend resumes), closing them locks losses + exit-timing noise persists (rally stab 0.58). The full-exit ACTION on recovering ct shorts is the problem, not the near-breakeven band. Crash -0.156 unchanged (trend_avg guard passes dead-cat longs). no-progress step 1/7.
0a2ae320	0.587501	0.680024	0.308410	1.025954	0.563883	1.066580	0.332715	0.410990	branch	branch step3: stricter multi-day ct magnitude gate (/0.01->/0.008, only deeply ct fires). MEASURED vs step2: BYTE-IDENTICAL (composite 0.587501, all 5 regimes identical, rally stab 0.581586, raw 0.572082). The /0.01 ct gate was already near-binary 1.0 for rallys solidly-positive ret_vlong -> deepening to /0.008 changes which bars fire NOT AT ALL (rally ret_vlong sits in the flat saturated tail of both scales). no-progress step 2/7. The ct magnitude axis is saturated (near-binary either way).
64c82639	0.706007	0.778803	0.242655	1.025954	0.720320	1.066580	0.670171	0.410990	branch	branch step4: add NOISE-ROBUST MAE adverse-recovery dead-capital gate (mae<-0.3*|stop| AND recovery_frac in [0.3,1.0] band) to the oscillation supplement. MAE is a monotonic low-water mark (noise-IMMUNE, unlike instantaneous pos_pnl band). MEASURED vs baseline 99a369a1: BYTE-IDENTICAL (composite 0.706007, all 5 regimes identical, every Sharpe identical). The MAE adverse-recovery dead-capital zone NEVER co-occurs with the ct+held+trend_avg conjunction on any clean trade -> the supplement NEVER fires. Confirms prior session step10 finding (MAE dead-capital detector byte-identical). no-progress step 3/7. BRANCH TERMINATING: the voter-independent full-exit supplement is UNREPRODUCIBLE on the unmodified baseline -- step1-2 over-fire (rally stab collapse 0.58, the price-boundary/exit-timing noise wall) when the supplement fires enough to reach rally; step3-4 are byte-identical (ct magnitude saturated, MAE gate makes it never fire) when gated narrowly enough to be safe. The prior session step4s +0.0024 (rally +0.0105 stab 1.0) was an ARTIFACT of its already-rewritten opp-gate context (structural-exploration branch step1-3 rewrote the flip admission first), leaving few cases for the supplement to fire on safely; reproducing that context requires rewriting the opp-gate, which the prior branch proved is a DEAD END (margin/vote-count identity, step3 byte-identical proof). No narrow configuration exists where the supplement reaches rally without collapsing stability on the unmodified baseline. Branch REVERTED to 99a369a1.
-	-	-	-	-	-	-	-	-	discard	BRANCH SUMMARY (voter-independent full-exit oscillation supplement, 4 steps, REVERTED to 99a369a1): re-tested the prior-session STRUCTURAL_EXPLORATION step4 (3c12a731, +0.0024 composite, rally +0.0105, all stab 1.0) on the unmodified baseline. step1 (exact step4 reproduction: ct + near-breakeven |pos_pnl|<0.5|stop| + trend_avg guard + bars_held>ENTRY_FULL_BARS -> full exit): REGRESSED rally 0.670->0.363 (stab 1.0->0.636 COLLAPSE, raw 0.670->0.571 DOWN not up) + crash -0.156 (0.720->0.564) -- the near-breakeven |pos_pnl| band is a PRICE-DERIVED boundary that flips under AR(1) (documented price-boundary-noise wall row 528/531) -> supplement fires on perturbed bars differently -> tracking-error explosion + over-fires on recovering rally ct shorts. step2 (replace price band with noise-immune bars_held ramp): NO-PROGRESS (rally stab 0.582 further collapse, raw flat; the full-exit ACTION on recovering ct shorts is the problem, not the band). step3 (stricter ct magnitude /0.01->/0.008): BYTE-IDENTICAL to step2 (ct gate already near-binary at /0.01 for rallys solidly-positive ret_vlong). step4 (add noise-robust MAE adverse-recovery dead-capital gate): BYTE-IDENTICAL to baseline (the MAE recovery zone never co-occurs with ct+held+trend_avg -> supplement never fires; confirms prior session step10). BRANCH CEILING = step1 raw_composite 0.647658 (BELOW baseline 0.706007, a REGRESSION not a gain). CROSS-EXPERIMENT CONCLUSION (measured, verifiable): the prior session step4s +0.0024 (rally +0.0105, stab 1.0) was an ARTIFACT of its already-rewritten opp-gate context -- that structural-exploration branch step1-3 had REWRITTEN the opp-gate flip admission (hard count-gate -> margin-EMA) FIRST, leaving few cases for the supplement to fire on safely; on the UNMODIFIED baseline the supplement either over-fires (step1-2: rally stab collapse, the exit-timing noise wall) or never fires (step3-4: ct magnitude saturated, MAE gate makes it inert). NO narrow configuration exists where the voter-independent full-exit supplement reaches rally without collapsing stability on the unmodified baseline. Reproducing the prior step4 context requires rewriting the opp-gate, which the prior branch PROVED is a DEAD END (margin/vote-count identity: _bear_margin and bear_votes are monotone transforms of the same _bear_confs -> a margin-EMA supplement is logically redundant with the count gate -> cannot reach cases the count gate misses, step3 byte-identical proof). KEY FOR FUTURE SESSIONS: (a) do NOT re-attempt the voter-independent oscillation supplement full-exit on the unmodified opp-gate baseline -- it is unreproducible (over-fires or inert, no Goldilocks zone); (b) the prior step4 +0.0024 result was context-dependent on the opp-gate rewrite, which is itself a dead end -> the +0.0024 is NOT a recoverable signal on the current baseline; (c) the price-boundary noise wall (|pos_pnl| band) and the exit-timing noise wall (full-exit on recovering ct shorts) both bite the voter-independent structural-exit axis on the unmodified baseline; (d) the MAE adverse-recovery dead-capital zone does not co-occur with ct+held+trend_avg on any clean trade (2nd confirmation, extends prior step10). results.tsv append-only preserved (path-scoped git checkout 99a369a1 -- strategy.py for branch revert, never git revert); strategy.py 0-diff to keep verified, baseline 0.706007 reproduced.
-	-	-	-	-	-	-	-	-	session-summary	SESSION (baseline 99a369a1 0.706007 5-regime -> UNCHANGED, no keep): 2 independent ARCHITECTURAL experiments (Exp1-2, ALL discards) + 1 exploration branch (voter-independent full-exit oscillation supplement, 4 steps, REVERTED). EXIT RULE: branch reverted -> session ends (per protocol: one branch per session; branch revert is a strong enough signal to conclude). >=2 architectural discards MET (Exp1 + Exp2 both architectural; branch steps all architectural). Baseline 99a369a1 re-verified byte-identical at session start (composite 0.706007 mean 0.778803 std 0.242655, all stab 1.0 raw==score, min_stab 0.844331) [bull 1.025954 Sh2.068, crash 0.720320 Sh1.254, sideways 1.066580 Sh2.027, rally 0.670171 Sh1.553, mixed 0.410990 Sh0.808] AND post-branch-revert (strategy.py 0-diff to keep, baseline 0.706007 reproduced). results.tsv append-only preserved throughout (path-scoped git checkout 99a369a1 -- strategy.py for every discard/revert, never git revert; results.tsv untouched by rollback). THEME: probed the ONE recent real rally signal (prior-session STRUCTURAL_EXPLORATION step4 voter-independent oscillation supplement, +0.0024 composite / rally +0.0105) via two fresh action variants (partial de-risk, win-streak exit-threshold) then a 4-step branch re-testing the full-exit action on the unmodified baseline. CROSS-EXPERIMENT CONCLUSIONS (all MEASURED this session, verifiable): (1) PARTIAL DE-RISK ACTION IS DOMINATED BY FULL-EXIT (Exp1): the step4 voter-independent structural trigger fired as a PARTIAL de-risk (target->0.5*current_pos) instead of full exit gave rally BYTE-IDENTICAL (target missed) + crash -0.017. A partial shrink keeps the position OPEN so it persists in the near-breakeven ct zone (vs full exit which closes it); the Sharpe gain step4 got from CLOSING does not materialize, and the shrink accumulates on crash dead-cat longs (trend_avg<0 guard does not protect crash). The full-exit action is not just sufficient but NECESSARY (closing the position IS the mechanism). Extends step4 branch conclusion: the supplement only works as a FULL exit. (2) WIN-STREAK EXIT-THRESHOLD LEVER IS INERT (Exp2, byte-identical): raising the de-risk graduation _exit_thresh during a portfolio win-streak (noise-immune integer counter, trend-aligned gated) NEVER binds -- positions exit via _sl_pressure/_soft_max (MAX fusion + SL) BEFORE the graduation threshold is reached. Same single-exit-path inertness wall as row 988 conclusion (d): crash return-seeking via SINGLE exit-path levers (max_hold, pp_pressure, exit_thresh) is structurally inert. Extends that wall to the _exit_thresh graduation path (3rd single-exit-path lever confirmed inert for crash). The _win_streak state is correctly tracked but has no binding exit-path lever (graduation is architecturally DOWNSTREAM of the binding MAX-fusion/SL exit decision). (3) VOTER-INDEPENDENT FULL-EXIT SUPPLEMENT IS UNREPRODUCIBLE ON THE UNMODIFIED BASELINE (branch, 4 steps): the prior-session step4 +0.0024 (rally +0.0105, stab 1.0) was an ARTIFACT of its already-rewritten opp-gate context (structural-exploration branch step1-3 rewrote the flip admission first, leaving few cases for the supplement to fire on safely). On the unmodified baseline: step1 (exact step4 repro) REGRESSED rally 0.670->0.363 (stab 1.0->0.636 collapse -- the |pos_pnl|<0.5|stop| near-breakeven band is a PRICE-DERIVED boundary that flips under AR(1), the documented price-boundary-noise wall) + crash -0.156 (dead-cat longs); step2 (noise-immune bars_held ramp replacing price band) NO-PROGRESS (rally stab 0.582 further collapse -- the full-exit on RECOVERING ct shorts is the problem, not the band); step3 (stricter ct magnitude /0.01->/0.008) BYTE-IDENTICAL to step2 (ct gate already near-binary at /0.01); step4 (MAE adverse-recovery dead-capital gate) BYTE-IDENTICAL to baseline (the MAE recovery zone never co-occurs with ct+held+trend_avg -> supplement never fires, confirms prior step10). NO narrow configuration reaches rally without collapsing stability on the unmodified baseline. Reproducing the prior step4 context requires rewriting the opp-gate, which the prior branch PROVED is a DEAD END (margin/vote-count identity). NEW BASELINE 99a369a1 0.706007 UNCHANGED. KEY FOR FUTURE SESSIONS: (a) do NOT re-attempt the voter-independent oscillation supplement full-exit on the unmodified opp-gate baseline -- it is unreproducible (over-fires -> rally stab collapse, or inert); the prior +0.0024 was opp-gate-rewrite-context-dependent and that rewrite is a dead end; (b) the partial-de-risk action variant is dominated by full-exit (do not re-attempt partial); (c) the _exit_thresh graduation path is inert (downstream of the binding MAX-fusion/SL exit) -- do not re-attempt exit-threshold levers for return-seeking; (d) the |pos_pnl| near-breakeven BAND and the full-exit on recovering ct shorts are both noise-walled on the unmodified baseline. The strategy remains at the confirmed deep local optimum (99a369a1); rally (0.670) and mixed (0.411) remain the binding regimes, walled on all tested exit/sizing/entry/smoothing/structural-exit axes.
6fe8e869	0.687507	0.753988	0.221604	0.901874	0.720571	1.066580	0.670171	0.410745	discard	Exp1 (architectural, indep): MULTI-DAY ret_vlong ACTIVATION gate on tp_harvest (max(|ret_long|,|ret_vlong|)/0.04). Symmetric counterpart to Exp4 keep (a481f7bc fixed _ts_supp SUPPRESSION ret_long->ret_vlong). Hypothesis: mixed deep peaks form in low-|ret_long| local bounces during multi-day downtrend; the _tp_trend_gate ACTIVATION still used 20-bar |ret_long| blocking the harvest Exp4 unsuppressed. MEASURED vs 99a369a1 0.706007: composite 0.687507 (-0.0185 FAIL), mean 0.753988 (-0.0248 FAIL). PER-REGIME all stab 1.0 raw==score: bull 1.025954->0.901874 (-0.1241 Sh2.0678->1.9428 -- the ENTIRE drop), crash BYTE-IDENTICAL 0.720571 (Sh1.2539), sideways BYTE-IDENTICAL 1.066580 (Sh2.0270), rally BYTE-IDENTICAL 0.670171 (Sh1.5529), mixed 0.410990->0.410745 (-0.0002 noise, TARGET NOT REACHED). FAILURE MECH: bull-2021 is a multi-day uptrend where 20-bar PULLBACKS (|ret_long| low -> baseline gate partially closed, protecting pullback peaks) co-occur with high |ret_vlong| (uptrend intact). max() opened the gate on bull pullbacks -> harvested bull trend winners during normal pullbacks -> Sh -0.125. mixed BYTE-IDENTICAL: the activation gate was NOT the binding blocker for mixed (mixed harvest already active or blocked elsewhere -- likely _ts_supp already ~0 unsuppressed via Exp4 AND the activation ramp (tp_ratio-1.6)/0.6 already saturated at mixed deep peaks). Confirms prior depth-bypass (0e7c3649) finding: the trend-gate axis does not move mixed. Not branch-eligible (no regime improved; bull catastrophic). Reverted to 99a369a1. 1st architectural discard.
c1a75174	0.705966	0.778767	0.242671	1.025954	0.720320	1.066580	0.669991	0.410990	discard	Exp2 (architectural, indep): CT-SIGN MULTI-DAY gate on tp_harvest ACTIVATION magnitude. Symmetric counterpart to Exp4 keep (a481fbc unsuppressed mixed harvest via _ts_supp ret_vlong). Hypothesis: the activation trend_gate still uses 20-bar |ret_long| (~0 in mixed chop), throttling harvest AMOUNT on mixed deep peaks; open it via ct-sign (ret_vlong*pos_dir<0 = mixed longs in downtrend) only, sparing trend-aligned (bull/crash/rally) and flat (sideways). MEASURED vs 99a369a1 0.706007: composite 0.705966 (-0.000041 SUB-NOISE FAIL), mean 0.778767 (-0.000036). PER-REGIME all stab 1.0 raw==score: bull BYTE-IDENTICAL 1.025954 (Sh2.0678), crash BYTE-IDENTICAL 0.720320 (Sh1.2539), sideways BYTE-IDENTICAL 1.066580 (Sh2.0270), rally 0.670171->0.669991 (-0.0002 Sh1.5529->1.5525 -- ct-sign opened slightly for rally pullback shorts which ARE ct at multi-day), mixed BYTE-IDENTICAL 0.410990 (Sh0.807528, TARGET NOT REACHED). FAILURE MECH (architectural fact): mixed byte-identical confirms mixed deep peaks already saturate the activation trend_gate at baseline (mixed peaks form when local 20-bar ret_long IS substantial during bounces -> trend_gate already ~1 -> ct-sign opens nothing new). Combined with 57671aa6 (ct-sign THRESHOLD byte-identical) + aa8ea260 (ct-sign RAMP ONSET byte-identical) + 0e7c3649 (depth-bypass byte-identical on mixed) + Exp1-this-session (max activation bull-only regression): ALL FOUR tp_harvest axes (threshold, onset, activation-magnitude, depth) are confirmed SATURATED for mixed. mixed deep peaks (tp_ratio 5.6/13.3/16.4 quartiles) already receive maximal harvest (_ts_supp~0 via Exp4 + deep-peak factor ~1 + trend_gate already ~1 + activation ramp saturated). The tp_harvest path is STRUCTURALLY INCAPABLE of moving mixed further -- the binding-floor mixed Sharpe (0.8075) is NOT addressable via tp_harvest. Not branch-eligible (mixed byte-identical, no regime improved). Reverted to 99a369a1. 2nd architectural discard. DIRECTION CONCLUSION: stop targeting mixed via tp_harvest (4-axis saturation confirmed).
6a0694dd	0.633177	0.697664	0.214955	0.609999	0.719204	1.073034	0.673732	0.412349	branch	Exp3 (architectural, indep, BRANCH OPEN): INSIDE-BAR CONTRACTION exit pressure (7th soft MAX source). NEW orthogonal candle-structure data dep: 3-bar mean intrabar range CONTAINMENT (current bar range inside prior bar range = inside-bar nesting = momentum contraction). NO existing exit source reads range containment (slope=direction, pp=giveback, time=bars-held, ve=vol-expansion, vc=volume-spike). EXIT subsystem (not entry -> avoids grid-absorption wall). Profit-side only, 3-bar mean noise-robustness, 0.40 cap, activate above 0.70 containment saturate 0.90. MEASURED vs 99a369a1 0.706007: composite 0.633177 (-0.0728 FAIL), mean 0.697664 (-0.0811), std 0.214955 (-0.0277 lower). PER-REGIME all stab 1.0 raw==score: bull 1.025954->0.609999 (-0.4160 CATASTROPHIC Sh2.0678->1.3363 -- inside-bar fired on bull GRINDING consolidation = normal CONTINUATION not exhaustion, over-harvested trend winners), crash 0.720320->0.719204 (-0.0011 byte-identical-ish Sh1.2539->1.2518), sideways 1.066580->1.073034 (+0.0065 Sh2.0270->2.0432 IMPROVED), rally 0.670171->0.673732 (+0.0036 Sh1.5529->1.5612 IMPROVED), mixed 0.410990->0.412349 (+0.0014 Sh0.8075->0.8103 IMPROVED -- mixed chop contraction exits help). FAILURE MECH (architectural fact): the contraction signal is a genuine exhaustion signature for sideways/rally/mixed (3 regimes improved) but MISSES that bull-2021 grinding uptrends have FREQUENT inside-bar consolidation as normal CONTINUATION (low-vol grind = nested inside bars while trending) -> over-harvested bull winners. BRANCH OPEN: 3 regimes improved (sideways/rally/mixed) + fundamentally new mechanism (orthogonal candle-structure exit source). FIX HYPOTHESIS: gate the contraction-exit to fire only when the contraction coincides with SLOPE-WEAKENING or counter-trend context (genuine exhaustion, not trend-ALIGNED continuation) -> spares bull (slope still confirming during grind consolidation) while keeping the sideways/rally/mixed gains. The 3ac778e 7th-term agreement-attenuator coupling is bounded (profit-gated, near-0 most bars).
c39e6849	0.705101	0.777570	0.241561	1.016124	0.720320	1.070244	0.670171	0.410990	branch	branch step2: SLOPE-CONFIRMATION gate on inside-bar contraction exit. Multiply _ib_pressure by (1 - _ib_slope_conf) where _ib_slope_conf=max(0,tanh(exit_slope*pos_dir/0.0004)) (multi-window 12/16/22-bar OLS mean, same as _dr_slope_conf). MEASURED vs step1 0.633177: composite 0.705101 (+0.071924 BIG PROGRESS), mean 0.777570. PER-REGIME all stab 1.0 raw==score: bull 0.609999->1.016124 (+0.406 RECOVERED from catastrophic -- slope gate worked, Sh1.336->2.058), crash BYTE-IDENTICAL 0.720320, sideways 1.073034->1.070244 (-0.0028 still +0.0037 vs baseline 1.066580, IMPROVED kept), rally 0.673732->0.670171 (-0.0036 back to baseline -- gate killed rally gain, rally contractions still slope-confirming), mixed 0.412349->0.410990 (-0.0014 back to baseline -- gate killed mixed gain too). DIAGNOSIS: the (1 - _ib_slope_conf) gate is TOO STRICT -- it zeroes pressure whenever slope confirms AT ALL, but rally/mixed exhaustion-contractions ALSO have moderate slope confirmation -> their gains lost. bull spared (strong slope-conf ~1 -> gate 0); rally/mixed (moderate slope-conf ~0.4-0.6 -> gate still ~0.4-0.6 -> partial kill). Net -0.0009 vs baseline (sub-noise), sideways gain preserved. FIX: gentler gate -- spare only STRONG slope confirmation (bull ~1), keep firing for moderate (rally/mixed). Use threshold onset: full fire below slope-conf 0.5, fade to 0 above 0.75. raw_composite progress +0.072 vs step1.
