commit	score	mean_score	std_score	bull_2021	crash_bear	sideways	rally_2024	status	description
6dffd231	-	-	-	-	-	-	-	branch:discard	BRANCH (STRUCTURAL_EXPLORATION: exit-pressure fusion MAX -> agreement-amplification) REVERTED to 637f5e53 after 3 steps (step1 LSE FUSE_TAU=4/floor0.02; step2 top-2 bonus0.15/floor0.10; step3 top-2 bonus0.05/floor0.40). All 3 regressed (raw_composite 0.779314 -> -379 -> -879 -> 0.415214; 3-consecutive-regression termination guard triggered). step1+step2 breached the retained 10pct DD hard cutoff (bull DD 13.5/12.6pct, crash/sideways 11.9/11.4pct at step2); step3 no DD breach but stability collapsed (bull 0.755, sideways 0.393 below 0.50 knee -> score zeroed, rally 0.777 below 0.80 knee). DEFINITIVE STRUCTURAL FINDING (load-bearing, do NOT re-attempt): the MAX fusion core is load-bearing BECAUSE the 7 soft pressure terms (slope/pp/time/ve/ep/ar/vc) are co-active above ANY reasonable floor during normal operation (giveback+time+slope all moderate simultaneously), so ANY agreement-amplification (LSE or top-2 blend, at ANY parameter setting) systematically inflates exit pressure -> premature exits -> churn + DD breach + stability collapse. MAX (winner-take-all) is structurally optimal for this strategy -- it was explicitly chosen to eliminate the correlated-noise addition that agreement-amplification re-introduces (prior session replaced weighted-sum with MAX for exactly this reason). The fusion agreement-signal is NOT recoverable via amplification; it is structurally sacrificed by design. Reverted strategy.py ONLY (path-scoped checkout) to 637f5e53; results.tsv untouched.
-	-	-	-	-	-	-	-	session-summary	SESSION (baseline 637f5e53 0.779314 -> UNCHANGED, no keep): 3 independent architectural experiments (Exp1 portfolio-DD profit-side slope-pressure amp +0.000419 SUB-NOISE, Exp2 profit-cushion slope-threshold relaxation BYTE-IDENTICAL, Exp3 multi-day trend-acceleration entry boost BYTE-IDENTICAL) all discards + 1 STRUCTURAL_EXPLORATION branch (exit-fusion MAX->agreement-amplification, 3 steps, reverted). EXIT RULE: 3 consecutive architectural discards triggered STRUCTURAL_EXPLORATION eligibility; branch opened on the exit-fusion subsystem rewrite (MAX->LSE/top-2 agreement blend); branch terminated via 3-consecutive-regression guard. User 2-arch-discard minimum exceeded (3 + branch). Baseline 637f5e53 re-verified reproduces 0.779314 byte-identical post-revert. CROSS-EXPERIMENT FINDINGS (load-bearing, future sessions read these): (1) portfolio-DD-coupled exit levers are INERT on rally (the binding regime) because rally equity is mostly RISING -> _port_dd_frac ~0 -> DD-coupled mechanisms (giveback-tighten, tp-harvest-relax, slope-amp) do not activate on rally; they only fire on bull pullback DDs. (2) slope-against pressure is NOT the binding exit term for deep-profit trend-aligned winners (_sl_slope_pressure ~0 when slope confirms trend; giveback/time dominate the MAX fusion whenever slope is near threshold) -> profit-cushion slope-threshold relaxation is byte-identical. (3) small entry-size changes (+/-0.05) are absorbed by the order-emission grid quantization layer (0.06*equity*BASE_POSITION_SIZE in both churn and calm partitions) -> byte-identical; only larger (>0.10) entry-size changes or admission-gate changes affect emitted trades. (4) MAX exit-fusion is structurally optimal (co-active terms); agreement-amplification is a dead direction (see branch:discard row above).
e7cb047a	0.749175	0.803163	0.179962	0.923316	0.730154	1.012687	0.546496	discard	Exp1 (architectural, indep): PORTFOLIO EQUITY-MOMENTUM admission modulator. NEW data dep: fast-over-slow MACD on the strategy's OWN equity curve (ema span3 - ema span12, normalized) -- the equity DERIVATIVE (slope), distinct from the equity LEVEL (DD fraction) already used by _port_dd_atten/giveback-tightening. Shrink-only: tighten _bull/_bear_strong_min up to +12pct when equity momentum negative (byte-identical when flat/up). MEASURED vs 637f5e53 0.779314: composite -0.030139 (0.749175), mean -0.021418, std +0.029072, min_stability 0.807->0.759. PER-REGIME: bull/crash/sideways BYTE-IDENTICAL (equity flat/up in those regimes -> factor 1.0 -> no admission change); rally 0.632168->0.546496 (-0.085672 -- raw 0.632168->0.632172 ~IDENTICAL but stability_factor 1.0->0.864 (stability 0.807->0.759 below 0.80 knee), Sharpe 1.470->1.470, DD 6.36 unchanged). The equity-momentum tightening activates only in rally (its equity drawdowns); even smoothed (both EMAs) the tightening amount wobbles rally entry timing -> stability penalty. CONFIRMS documented pattern: any admission-gate signal that activates in rally destabilizes rally entry timing (rally stability is fragile at 0.807). The equity-slope derivative is NOT a usable admission signal at this operating point. Reverted to 637f5e53.
0f0967d2	0.779314	0.824581	0.150891	0.923316	0.730154	1.012687	0.632168	discard	Exp2 (architectural, indep): DOWNTREND-SCOPED bounce-long admission tightening gated on RETURN AUTOCORRELATION. NEW data primitive: lag-1 autocorrelation of 48-bar log returns (no existing signal measures return persistence directly; voters use price levels/slopes/MACD, vol_ratio uses vol magnitude). High AC = persistent/trending regime, low/negative = choppy. Mechanism: in a multi-day DOWNTREND (ret_vlong<0; crash-only -- rally/bull ret_vlong>0 -> gate 0 -> byte-identical), tighten bull admission +12pct when the down-leg is persistent (high AC = dead-cat bounce more likely) so only high-conviction bounces pass -> filters crash falling-knife longs -> higher crash Sharpe. Shrink-only, continuous tanh. MEASURED vs 637f5e53 0.779314: BYTE-IDENTICAL (composite 0.779314, mean 0.824581, std 0.150891, min_stability 0.807; all regime scores/Sharpe/num_trades unchanged; rally 0.632168->0.632166 is 6th-decimal rounding). The +12pct admission tightening on persistent-downtrend bounce longs never crossed an admission threshold for any actual crash trade -- the existing admission stack (freq/trend/streak-ct gates + EMA conviction margin) already filters such that no crash bounce long was marginal enough to flip on a 12pct tighten. CONFIRMS admission-inertness wall (cf row 1067 peak-stall near-inert, row 1072 cooldown sub-noise): admission tightening below the marginal-trade gap produces zero trade-count change. The autocorrelation primitive itself is sound (new, orthogonal) but routed through admission it is inert at this operating point. Reverted to 637f5e53.
f96ed465	0.779184	0.824419	0.150785	0.922669	0.730154	1.012687	0.632168	discard	Exp3 (architectural, indep): DOWNTREND-STRENGTH bear (trend-short) first-bar size boost +15pct. Clean ret_vlong<0 gate (crash-scoped intent) at larger magnitude to cross the order-emission grid quantization step that dilutes existing 3-way-conjunction bear boosts (+5pct, below grid). Hypothesis: crash is return-limited (Sh1.274 lowest) but DD-SAFE (3.04pct << 8pct knee) -> return-seeking on the trend-aligned crash short raises return, calmar up -> return_reward up, DD has headroom. MEASURED vs 637f5e53 0.779314: composite -0.000130 (0.779184 SUB-NOISE), mean -0.000162, std -0.000105. PER-REGIME: crash BYTE-IDENTICAL (0.730154, Sh1.273617, AnnRet15.16, DD3.04 -- crash is ~100pct bounce LONGS per prior sessions, very few trend shorts, so the bear boost rarely fires in crash); bull 0.923316->0.922669 (-0.000647 MISFIRE -- bull ret_vlong dips negative during multi-day corrections within the uptrend -> the downtrend gate fired on counter-trend-within-bull pullback shorts -> larger losing shorts -> Sharpe 1.936451->1.935769, AnnRet 24.93->24.89, DD3.71 unchanged); rally/sideways BYTE-IDENTICAL. HYPOTHESIS REFUTED: crash is NOT a trend-short regime (it is a bounce-long regime), so a downtrend-gated bear boost cannot help crash and misfires in bull corrections. Confirms prior-session finding that crash is ~100pct bounce longs. Reverted to 637f5e53.
57d675bb	0.779314	0.824581	0.150890	0.923316	0.730154	1.012687	0.632168	discard	Exp4 (architectural, indep): DOWNTREND-SCOPED bull-accumulator responsiveness. Crash is bounce-LONG + return-limited (Sh1.274) but DD-SAFE (3.04pct) AND stability-SAFE (0.981, huge headroom) -> entry-TIMING changes here cannot trigger a stability penalty (unlike rally 0.807). Lowered the bull entry-accumulator rho 0.5->0.35 in downtrends (ret_vlong<0, crash-only; byte-identical for rally/bull ret_vlong>0 and bear) so it reacts FASTER to a sharp V-reversal bounce (lower rho = more weight on new margin = crosses ENTRY_ACCUM_THRESH sooner), catching genuine V-reversals earlier while gradual dead-cats accumulate slower. New control flow: accumulator responsiveness depends on multi-day trend direction. MEASURED vs 637f5e53 0.779314: BYTE-IDENTICAL (composite 0.779314, mean 0.824581, std 0.150890, min_stability 0.807; all regime scores/Sharpe/AnnRet/DD/num_trades unchanged). The rho 0.5->0.35 change altered no crash entry decision: crash bounce longs are conviction-STRONG enough that the bull margin crosses ENTRY_ACCUM_THRESH=0.0 on the SAME bar regardless of rho (the margin is large and positive at a bounce). Accumulator responsiveness only matters for MARGINAL entries near the threshold; crash bounces are not marginal. CONFIRMS admission-inertness wall (cf exp2 this session, rows 1067/1072): timing/threshold changes below the marginal-trade gap produce zero trade-count change. The crash bounce-long entry is a high-conviction event that no accumulator-responsiveness tuning can shift. Reverted to 637f5e53.
b64046f4	-999.0	-999.0	0.0	-999.0	-999.0	-999.0	-999.0	discard	Exp5 (architectural, indep): GIVEBACK-VELOCITY exit pressure (7th active soft MAX source). NEW data primitive: per-bar CHANGE in giveback (derivative of peak_pnl - pos_pnl), orthogonal to the giveback RATIO (level, _pp_pressure). A sharply accelerating giveback = fast reversal off peak (genuine reversal) vs steady giveback (normal pullback) at the same ratio; fires EARLIER than the ratio threshold on sharp reversals. Profit-side only, 0.45 cap, _gb_vel activation threshold 0.15 (normalized by _pp_min), new per-symbol _prev_giveback state. MEASURED vs 637f5e53 0.779314: CATASTROPHIC composite -999 (all 4 regimes hit the >10pct DD hard cutoff: bull DD55.96pct AnnRet1604pct, crash DD100.07pct AnnRet-100pct Sh-3.15, sideways DD36.96pct AnnRet615pct, rally DD76.77pct AnnRet293pct). The absurd annual returns + 100pct DDs indicate the velocity pressure dominated the MAX fusion (firing near-saturation constantly on normal bar-to-bar giveback noise -> constant exit/re-entry cycling -> fee bleed + compounding churn + DD blowup). The _gb_vel threshold 0.15 was far too low (normal giveback delta/ATR easily exceeds it every pulling-back bar). CONFIRMS (cf STRUCTURAL_EXPLORATION row 6dffd231): the MAX exit fusion is load-bearing and tightly balanced; ANY additional/miscalibrated source breaks exit timing globally (this source broke ALL 4 regimes, not just one -- the exit fusion is a single global chokepoint). A new exit source must be EXCEEDINGLY weakly activated to avoid dominating MAX; giveback-velocity at any useful activation is too volatile. Reverted to 637f5e53.
-	-	-	-	-	-	-	-	session-summary	SESSION (baseline 637f5e53 0.779314 -> UNCHANGED, no keep): 5 independent architectural experiments (Exp1-5, ALL discards), no branch opened (none branch-worthy -- no regime improved meaningfully in any experiment). Exp1 portfolio equity-momentum (fast-over-slow MACD on equity curve DERIVATIVE) admission modulator: rally stability 0.807->0.759 (below knee, stab_factor 1.0->0.864), composite -0.030; bull/crash/sideways byte-identical (equity flat/up there). Confirms any admission signal activating in rally destabilizes rally entry timing (rally stability fragile at 0.807). Exp2 downtrend-scoped return-autocorrelation (lag-1, 48bar -- NEW data primitive) bounce-long admission tightening: BYTE-IDENTICAL (admission-inertness wall -- crash bounces are high-conviction, not marginal at threshold, +12pct tighten crosses no trade). Exp3 downtrend-strength bear (trend-short) size boost +15pct: sub-noise -0.00013, crash BYTE-IDENTICAL (crash is ~100pct bounce LONGS, few trend shorts -- hypothesis refuted), bull MISFIRE -0.0006 (ret_vlong dips negative in bull multi-day corrections -> boost fired on counter-trend-within-bull pullback shorts). Exp4 downtrend-scoped bull-accumulator responsiveness (rho 0.5->0.35): BYTE-IDENTICAL (same admission-inertness wall -- crash bounces cross ENTRY_ACCUM_THRESH on the same bar regardless of rho). Exp5 giveback-velocity (derivative of peak giveback -- NEW data primitive) 7th soft MAX exit source: CATASTROPHIC -999 all regimes DD>10pct (velocity threshold too low -> dominated MAX fusion -> exit/re-entry churn -> DD blowup). CROSS-SESSION CONCLUSIONS (all measured this session, correlation-only where applicable): (a) CRASH is a bounce-LONG regime (return-limited Sh1.274, DD-safe 3.04pct, stability-safe 0.981) -- trend-short levers cannot help it (Exp3), and bounce-long admission/timing changes are INERT because crash bounces are high-conviction events that cross admission/accumulator thresholds on the same bar regardless of small tuning (Exp2, Exp4) -- the crash bounce-long entry is not marginal at any decision boundary; (b) RALLY stability (0.807) is the fragile binding constraint -- ANY signal that activates in rally and touches entry OR exit timing destabilizes it (Exp1 admission, Exp5 exit); rally has NO stability headroom (factor already 1.0 at 0.807>0.80 knee) so only raw Sharpe/DD improvements help, and rally DD-reduction is saturated (giveback-tightening 0.50 + tp-harvest 0.30 at cliffs per prior sessions); (c) the MAX exit fusion is a single global chokepoint -- a miscalibrated additional source breaks ALL 4 regimes at once (Exp5), reconfirming it is load-bearing and tightly balanced (cf STRUCTURAL_EXPLORATION 6dffd231); (d) the admission-inertness wall: threshold/timing changes below the marginal-trade gap produce zero trade-count change (Exp2, Exp4 byte-identical). Strategy at a hard ceiling under current architecture. Baseline 637f5e53 0.779314 preserved.
82207cf1	0.768357	0.811519	0.143873	0.871055	0.730164	1.012687	0.632168	discard	Exp1 (architectural, indep): STATELESS 3-bar MEAN volume-z for _vc_pressure exit input (variance-reduction archetype, 9d730c7 class -- the only proven-productive lever per c265424d is a stateless formula change reducing per-bar output variance). Replaced single-bar volume z with mean of last 3 bars volume z (stateless recompute, no frozen state). MEASURED vs baseline 637f5e53 0.779314: composite -0.010957 (0.768357 REGRESSION), mean -0.013062 (0.811519), std -0.007017 (0.143873 tighter but via bull regression). PER-REGIME all stab 1.0 all raw==score: bull 0.923316->0.871055 (-0.052261 MISFIRE, Sh down, DD 3.71->4.19pct UP -- smoothed volume-climax fired on more bull trend bars -> cut/delayed bull winners -> more giveback+DD), crash 0.730154->0.730164 (+0.000010 noise byte-near-identical), sideways BYTE-IDENTICAL 1.012687, rally BYTE-IDENTICAL 0.632168. ROOT CAUSE: smoothing the volume-climax input did NOT reduce beneficial variance -- it SHIFTED which bars fire (3-bar mean crosses the 2.0-sigma activation on different bars than single-bar) -> bull trend bars with sustained-elevated volume now trip the climax gate -> premature exit pressure on bull winners -> DD up. The variance-reduction archetype requires the smoothed quantity be NOISE on clean path; here the single-bar volume-z IS the intended signal (a climax IS a bar event), so averaging dilutes the signal and widens activation onto non-climax trend bars. crash/sideways/rally inert (their profit-side exits are giveback/slope-dominated; _vc_pressure non-binding there, reconfirming exit-path inertness). Reverted to 637f5e53. 1st architectural discard.
dcc21240	0.779314	0.824581	0.150890	0.923316	0.730154	1.012687	0.632168	discard	Exp2 (architectural, SIMPLIFICATION): REMOVE _ar_pressure adverse-recovery exit term from the MAX fusion outright (prior sessions only deferred MAE updates, 3c394c1 flat). MAE low-water-mark STATE retained (drives _ts_supp tp-harvest gate). MEASURED vs baseline 637f5e53 0.779314: BYTE-IDENTICAL (composite 0.779314, all 4 regimes byte-identical incl MaxDD: bull 0.923316 DD3.71pct, crash 0.730154 DD3.04pct, sideways 1.012687 DD2.75pct, rally 0.632168 DD6.36pct; all stab 1.0, all raw==score, min_stab 0.807103). DEFINITIVELY CONFIRMS _ar_pressure is DEAD CODE -- it NEVER contributes to the MAX fusion on any binding-regime bar (positions in MAE-recovery exit via slope/pp/sl before _ar_pressure engages; the recovery-frac gate rarely co-occurs with _ar_pressure being the MAX-dominant term). Sub-noise +0.000 < +0.003 keep threshold -> DISCARD per strict rule, reverted. But the dead-code finding is load-bearing for future sessions: the _ar_pressure exit term (and its _w_ar=1.0 weight in the MAX fusion) can be REMOVED FREELY for code simplification with zero score cost; the _mae STATE must be kept (load-bearing for _ts_supp). Reverted to 637f5e53. 2nd architectural discard (exit-rule 2-arch minimum MET).
-	-	-	-	-	-	-	-	session-summary	SESSION (baseline 637f5e53 0.779314 -> UNCHANGED, no keep): 2 independent architectural experiments (Exp1, Exp2, both discards), no branch opened. EXIT RULE: 2-architectural-discard minimum MET; exited on saturation (strategy at confirmed deep local optimum across 5+ prior sessions ~20 arch discards; both experiments this session confirmed documented walls -- no promising direction for a branch). Baseline 637f5e53 re-verified reproduces 0.779314 byte-identical at session start [bull 0.923316 Sh1.936 DD3.71pct, crash 0.730154 Sh1.274 DD3.04pct, sideways 1.012687 Sh2.001 DD2.75pct, rally 0.632168 Sh1.470 DD6.36pct; all stab 1.0, all raw==score, min_stab 0.807]. THEME: probed the 9d730c7 archetype (the ONLY proven-productive lever class per c265424d = stateless formula change that REDUCES per-bar output variance) on the exit subsystem, plus a simplification. Exp1 STATELESS 3-BAR MEAN volume-z for _vc_pressure exit input (variance-reduction archetype): composite -0.010957 (0.768357 REGRESSION) -- bull -0.052261 MISFIRE (DD 3.71->4.19pct UP) with crash/sideways/rally BYTE-IDENTICAL. ROOT CAUSE: the variance-reduction archetype requires the smoothed quantity be NOISE on clean path; here the single-bar volume-z IS the intended signal (a climax IS a bar event), so averaging dilutes the signal and SHIFTED which bars trip the 2.0-sigma activation onto sustained-elevated-volume bull TREND bars -> premature exit pressure on bull winners -> DD up. Lesson: input-smoothing a signal that IS inherently single-bar-event-driven is wrong-directional (dilutes signal not noise). crash/sideways/rally inert reconfirms exit-path inertness (_vc_pressure non-binding there; profit-side exits giveback/slope-dominated). Exp2 SIMPLIFICATION -- REMOVE _ar_pressure adverse-recovery exit term from MAX fusion outright (prior sessions only deferred MAE updates): BYTE-IDENTICAL (composite 0.779314, all 4 regimes byte-identical incl MaxDD). DEFINITIVELY CONFIRMS _ar_pressure is DEAD CODE (never the MAX-dominant term on any binding-regime bar; positions in MAE-recovery exit via slope/pp/sl first). Sub-noise +0.000 < +0.003 keep threshold -> DISCARD per strict rule, reverted. LOAD-BEARING FINDING for future sessions: the _ar_pressure exit term + its _w_ar weight can be REMOVED FREELY for code simplification at zero score cost; the _mae STATE must be kept (load-bearing for the _ts_supp tp-harvest MAE-cleanliness gate). CROSS-SESSION CONCLUSIONS (all measured this session): (a) the 9d730c7 variance-reduction archetype does NOT generalize to single-bar-event-driven signals (volume climax) -- smoothing dilutes the signal and shifts activation onto non-climax bars; it only works when the smoothed quantity is genuine per-bar NOISE (as for the deadband cushion). (b) _ar_pressure is the second confirmed dead-code exit term (joins _ep_pressure, removed prior): the MAX fusion is now 6 effective soft sources (slope/pp/time/ve/vc + sl + voter_bias), of which crash/sideways/rally are giveback/slope-dominated (the additional sources non-binding there). (c) bull is sensitive to exit-pressure INPUT changes (Exp1 -0.052) -- the volume-climax gate firing on bull trend bars cuts winners; any future _vc_pressure tuning must spare bull (e.g. sharper threshold, not input smoothing). The binding rally (DD-bound 6.36pct near 8pct knee, all DD-reduction levers maxed/walled) and crash (return-limited Sh1.27, exit-path-inert, single-exit-path-inert-4x-confirmed) remain unconquered. results.tsv append-only preserved (path-scoped git checkout -- strategy.py throughout, never git revert); both discards reverted to 637f5e53; strategy.py matches 637f5e53 byte-identical (empty diff verified).
