commit	score	mean_score	std_score	bull_2021	crash_bear	sideways	rally_2024	status	description
-	-	-	-	-	-	-	-	-	session-summary	BRANCH SUMMARY (STRUCTURAL_EXPLORATION: exit-pressure fusion MAX -> tempered log-sum-exp soft-maximum, 3 steps, REVERTED to 99a369a1): opened after 4 independent architectural discards (Exp1 mixed voter-saturated at admission, Exp2 stale-loss exit inert at modern baseline, Exp3 mixed-grid boosts load-bearing, Exp4 DVP voter -- sample_factor lever on mixed is a TRAP). TARGET: the exit-pressure fusion subsystem -- replace element-wise MAX with tempered LSE soft-maximum that EQUALS max when one source dominates (preserves MAX correlated-noise-elimination) and EXCEEDS max when 2+ sources moderately agree (the agreement bonus = the LSE gap). HYPOTHESIS: MAX discards moderate multi-source agreement; rally losing longs ride pullbacks where slope/time/pp all mod-agree but none saturates -> MAX takes largest moderate -> late exit -> giveback -> DD; LSE raises combined pressure so exit fires earlier on multi-source agreement. step1 (ungated LSE, TAU=10, floor 0.05): CATASTROPHIC bull -999 (MaxDD 22.1pct, trades 51->111) -- LSE agreement bonus over-fired on bull pullbacks where slope/time/pp ALL sit moderate -> over-exit churn. step2 (chop-gate the bonus): bull recovered BUT sideways COLLAPSED 1.067->0.157 (MaxDD 9.68pct) + mixed 0.411->0.103 -- sideways/mixed ARE chop so the gate fired fully and moderate multi-source overlap in chop = constant inflation. step3 (strong-agreement-only gate, 2nd term >=50pct of max): bull -999 AGAIN (sharp pullbacks have slope+time+pp near-saturate simultaneously) + sideways still collapsed. raw_composite FLAT at 0.424 across all 3 steps (ZERO progress) + 50pct gate breached on bull/sideways/mixed. TERMINATED (no progress + safety breaches). CROSS-EXPERIMENT CONCLUSION (measured, verifiable): the LSE agreement-bonus premise is REFUTED across 3 gating strategies -- ANY multi-source agreement bonus re-introduces the correlated-noise ADDITION the MAX keep was specifically designed to eliminate. Every regime has bars where multiple exit sources co-saturate (trend pullbacks in bull/rally, mean-reversion in chop sideways/mixed); inflating combined pressure there causes over-exit + re-enter churn -> DD blowup. The MAX fusion is at a genuine STRUCTURAL OPTIMUM, not at a ceiling -- the _agree_gate attenuator (chop-only single-source DOWN-weight) is the correct agreement handling, and it is ONE-DIRECTIONAL (down-weight single-source, do NOT up-weight agreement) by design. NEW BASELINE 99a369a1 0.706007 UNCHANGED. KEY FOR FUTURE SESSIONS: (a) do NOT re-attempt replacing MAX fusion with any agreement-ADDITIVE mechanism (LSE/softmax/weighted-sum) -- 3 gates all refuted, MAX is structurally optimal; (b) the exit-pressure fusion is a CONFIRMED load-bearing subsystem at its optimum; (c) agreement handling is correctly one-directional (attenuate single-source only).
-	-	-	-	-	-	-	-	-	session-summary	SESSION (baseline 99a369a1 0.706007 5-regime -> UNCHANGED, no keep): 4 independent ARCHITECTURAL discards (Exp1-4) + 1 STRUCTURAL_EXPLORATION branch (LSE softmax exit fusion, 3 steps, REVERTED). Baseline 99a369a1 re-verified byte-identical at session start (composite 0.706007 mean 0.778803 std 0.242655, all stab 1.0 raw==score, min_stab 0.844331) [bull 1.025954 Sh2.068 51t, crash 0.720320 Sh1.254 52t, sideways 1.066580 Sh2.027 50t, rally 0.670171 Sh1.553 101t, mixed 0.410990 Sh0.808 43t -- the binding floor + std outlier, sample_factor 0.927 the ONLY regime below the 50-trade knee] AND post-branch-revert (strategy.py 0-diff to keep, reproduces 0.706007). EXIT RULE: structural-exploration branch reverted -> session ends (per protocol: at most ONE structural-exploration branch per session; if it reverts, session ends). >=2 architectural discards MET (Exp1-4 all architectural + 3 branch steps all architectural). results.tsv append-only preserved throughout (path-scoped git checkout 99a369a1 -- strategy.py for every discard/revert, never git revert; results.tsv untouched by rollback). THEME: targeted the binding floor mixed_2025 (0.411, 43 trades, Sh0.808) via the UN-TESTED sample_factor lever (mixed sits at 43 trades = sample_factor 0.927 = 7.3pct penalty, the ONLY regime below the 50-trade knee -- a +7-trade recovery would be worth +0.032 on mixed directly, raising mean AND cutting std). Probed 4 admission/voter axes to raise mixed trade count, then a structural-exploration on the exit fusion. CROSS-EXPERIMENT CONCLUSIONS (all MEASURED this session, verifiable): (1) SAMPLE_FACTOR LEVER ON MIXED IS A TRAP (Exp4, DECISIVE): a 9th DVP voter (orthogonal data-source, no existing weights touched -- the prior-session-identified un-disproven axis) ADDED 14 mixed trades (43->57) but mixed WR CRASHED 100->89.5pct and Sharpe FELL 0.808->0.642 -- mixeds 43 trades are the WINNERS (genuine voter selectivity); the marginal entries the new voter admitted are LOSERS. mixed score 0.411->0.327 (-0.084) vs the +0.032 the sample_factor recovery would have given. Conclusively explains why ALL prior admission-relaxation attempts (this session Exp1 + 5 prior sessions across vol_ratio/rsi_trend_str/R^2/churn/persistence/multi-day-ct-sign axes) added 0 mixed trades: the existing voters are CORRECTLY saturated -- they filter exactly the losers. mixed is NOT under-trading; its 100pct WR is real selectivity on 43 signal-bound trades. (2) MIXED VOTER-SATURATED AT ADMISSION ON THE MULTI-DAY-CT-SIGN AXIS (Exp1): relaxing bull admission during multi-day downtrend (ret_vlong<0, mixeds documented separator from sideways) added ZERO mixed trades -- 6th confirmation mixed trade count is signal-bound not admission-bound. (3) STALE-LOSS EXIT INERT AT MODERN BASELINE (Exp2): the catalogued surgical rally-raw lever (ba7cd2fb, +0.04 Sharpe at de412448) is BYTE-IDENTICAL at 99a369a1 -- the bleeder zone (held past onset, still underwater) is fully dominated by existing exit pressures (slope/time/pp/ve/vc, MORE than at de412448 which had fewer). 2nd confirmation (row708 + this) the bleeder zone is closed at modern baselines. (4) MIXED-GRID ENTRY BOOSTS ARE LOAD-BEARING NOT REDUNDANT (Exp3): removing the 4 mixed cells of the {own,BTC,partner}x{vol,price,DVP} grid (explicitly flagged redundancy-risk) REGRESSED mixed -0.008 + rally -0.006 -- confirms prior row-1286 finding the DVP-column cells genuinely move mixed (+0.0068). NOT dead-code-adjacent (contrast _ar_pressure removal which was byte-identical). (5) EXIT-PRESSURE MAX FUSION IS A STRUCTURAL OPTIMUM (STRUCTURAL_EXPLORATION branch, 3 steps): replacing MAX with tempered LSE soft-maximum (agreement-ADDITIVE) was REFUTED across 3 gating strategies -- ungated (step1 bull blowup MaxDD22pct), chop-gated (step2 sideways/mixed collapse MaxDD9.7pct), strong-agreement-gated (step3 bull blowup again + sideways collapse). raw_composite FLAT at 0.424 across all 3 steps (ZERO progress) + 50pct gate breached. ANY multi-source agreement bonus re-introduces the correlated-noise ADDITION the MAX keep was designed to eliminate; every regime has bars where multiple exit sources co-saturate (trend pullbacks, chop mean-reversion) and inflating pressure there causes over-exit churn. The _agree_gate attenuator (chop-only single-source DOWN-weight) is correctly ONE-DIRECTIONAL. SATURATION RECONFIRMED: mixed is walled on ALL tested axes -- proportional sizing (grid), partial harvest (grid), full-exit-timing, opp-gate voter-count (margin/vote-count identity), opp-gate voter-independent structural, ADMISSION relaxation (voter-saturated, 6 axes), VOTER addition (sample_factor trap, adding trades regresses). mixed residual low-Sharpe (0.411, Sh0.808) is INTRINSIC to its 43 winner trades MTM oscillation -- NOT addressable by trade-count, sizing, harvest, or exit fusion. NEW BASELINE 99a369a1 0.706007 UNCHANGED. KEY FOR FUTURE SESSIONS: (a) the sample_factor lever on mixed is a CONFIRMED TRAP -- do NOT attempt to raise mixed trade count via admission/voter changes (Exp1+Exp4 this session + 5 prior sessions, 7 axes total, all confirm); mixeds 43 trades are genuine 100pct-WR selectivity; (b) MAX exit fusion is a structural optimum -- do NOT re-attempt any agreement-ADDITIVE fusion (LSE/softmax/weighted-sum); agreement handling is correctly one-directional (attenuate single-source only); (c) stale-loss exit is inert at modern baselines (bleeder zone closed by 7 exit pressures) -- do NOT re-attempt unless exit pressures are first REMOVED; (d) the mixed-grid DVP boosts are load-bearing (do NOT remove); (e) the only un-walled mixed axis remains the MTM-chop emission throttle (prior session, at its optimum WITH winner-fade) -- mixed is at its intrinsic floor.
