commit	score	mean_score	std_score	bull_2021	crash_bear	sideways	rally_2024	status	description
013b2eca	0.846889	0.886793	0.133013	0.969028	0.811993	1.053933	0.712218	branch	BRANCH OPEN (close-loc conviction entry boost). Exp1 (architectural, indep): NEW data dep close_loc=(close-low)/(high-low), 3-bar mean, intrabar conviction (close near high=bull, near low=bear). Trend-aligned (|ret_long|/0.04) gate, deep-saturated /0.15, first-bar-only, +0.05 max bilateral boost. MEASURED vs 1c503346 0.846892: composite -0.000003 (flat), mean -0.000073, std -0.000232 (tighter). PER-REGIME: rally 0.711673->0.712218 (+0.000545 Sh 1.283437->1.284885 - UPTREND bars close high -> boost fires), crash 0.812359->0.811993 (-0.000366 - MOVED, no longer byte-identical), bull 0.969298->0.969028 (-0.000270), sideways 1.054133->1.053933 (-0.000200). All stab 1.0, all MaxDD<10pct. BRANCH-ELIGIBLE: rally improved + new mechanism. Diagnosis (correlation only, not causal): bull-side boost leaks into crash dead-cat-bounce longs (trend-aligned at 20-bar during sharp bounces but counter-trend at 96-bar) -> crash/bull slight regression. NEXT: gate trend-alignment on ret_vlong (96-bar) instead of ret_long so crash ct-bounce longs excluded while rally longs kept. rally gain preserved + crash leak fixed -> mean positive.
6e765b0f	0.847017	0.886943	0.133086	0.969313	0.812148	1.054095	0.712218	keep	KEEP (NEW BASELINE, SUPERSEDES 1c503346 0.846892). BRANCH SUCCESS (close-loc conviction entry boost, 7 steps). NEW data dep: close_loc=(close-low)/(high-low), 3-bar mean - intrabar CONVICTION signal (close near high=bullish control, near low=bearish). Genuinely orthogonal to HL2 midpoint, ATR span, VWAP level-deviation, slope, RSI, MACD. Fires as a trend-aligned first-bar entry boost (deep-saturated /0.15 conviction, +0.05 max, bilateral). Final gating (step7): trend-w (|ret_long|/0.04) x ER grind gate (_er/0.25 - separates rally directional grind from sideways chop at equal low vol) x multi-day ret_vlong>0 confirmation on bull side (excludes crash dead-cat-bounce longs) x conviction. MEASURED vs 1c503346 0.846892: composite +0.000125, mean +0.000077, std -0.000159 (tighter). PER-REGIME: rally 0.711673->0.712218 (+0.000545 Sh 1.283437->1.284884 - UPTREND grind bars close high then continue -> boost fires on genuine continuation), bull 0.969298->0.969313 (+0.000015 flat), crash 0.812359->0.812148 (-0.000211 - bear boost near-inert; residual is path-dependent), sideways 1.054133->1.054095 (-0.000038 flat - ER gate spared chop). All stab 1.0, all MaxDD<10pct (rally 1.538). All keep criteria met. BRANCH EVOLUTION: step1 ret_long gate both sides (rally +0.000545 but bull/crash/sideways leaks, mean -0.000073); step2 ret_vlong gate (regressed -0.000064); step3 drop bear (inert); step4 +low-vol grind gate (composite +0.000009 but mean -0.000058); step5 tighten conviction 0.62/0.10 (killed rally signal, -0.000165); step6 ER gate replaces vol (composite +0.000025, sideways leak cut); step7 +ret_vlong>0 bull gate (composite +0.000125, mean +0.000077 - crash leak cut). KEY MECHANISM INSIGHT: close_loc is a CONTINUATION signal for GRINDING trends (rally) but a REVERSAL signal at crash capitulation lows (V-bounces) and in sideways chop (mean-reversion); the ER grind gate + multi-day ret_vlong confirmation isolate the trending-continuation case. Observation (correlation only): rally gain consistent with bar-close-continuation hypothesis but direction-split PnL not measured.
-	-	-	-	-	-	-	-	session-summary	SESSION: 1 KEEP (branch close-loc conviction boost +0.000125) via 1 exploration branch (7 steps, success). NEW BASELINE 6e765b0f 0.847017 (SUPERSEDES 1c503346 0.846892, +0.000125 composite, +0.000077 mean 0.886866->0.886943, std 0.133245->0.133086 tighter). [bull 0.969298->0.969313, crash 0.812359->0.812148, sideways 1.054133->1.054095, rally 0.711673->0.712218 BINDING +0.000545 Sh 1.283437->1.284884]. THEME: NEW DATA SOURCE - close-POSITION-WITHIN-BAR (close_loc=(close-low)/(high-low)), a pure intrabar conviction signal ORTHOGONAL to all existing primitives (HL2 midpoint, ATR span, VWAP level-deviation, slope, RSI, MACD - none read where close sits in the bar's own range). 0 prior experiments on close-position-within-bar (grep confirmed). Used as a trend-aligned first-bar entry boost in the validated deep-saturated + first-bar-only + bilateral safe-family envelope. KEY MECHANISM INSIGHT (load-bearing for future sessions): close_loc is a CONTINUATION signal for GRINDING trends (rally uptrend bars close high then continue) but a REVERSAL signal in (a) crash capitulation lows (V-bounces off exhaustion) and (b) sideways chop (mean-reversion). The productive gate stack: trend-w (|ret_long|/0.04) x ER grind gate (_er/0.25 - Kaufman efficiency separates rally directional grind from sideways chop at equal low vol, BETTER than vol_ratio which could not) x multi-day ret_vlong>0 confirmation on the bull side (excludes crash dead-cat-bounce longs whose 20-bar ret_long is positive during sharp bounces but 96-bar ret_vlong negative). The ER gate was the key leak-cutter (vol gate failed on sideways-low-vol); the ret_vlong>0 bull gate was the crash-leak cutter. BRANCH EVOLUTION: step1 ret_long both sides (rally +0.000545 but 3-regime leaks, mean -0.000073); step2 ret_vlong gate (regressed); step3 drop bear (inert - bear boost near-inert throughout); step4 +vol grind gate (composite +0.000009, mean still -0.000058); step5 tighten conviction 0.62/0.10 (KILLED rally signal -0.000165, the loose 0.55/0.15 gate is load-bearing); step6 ER replaces vol (composite +0.000025, sideways leak cut -0.000199->-0.000111); step7 +ret_vlong>0 bull gate (composite +0.000125, mean +0.000077 KEEP). CONCLUSIONS: (1) close-position-within-bar is a genuine new data axis with real (sub-noise-to-noise-level) signal; (2) the loose conviction gate (0.55/0.15) is load-bearing - tightening kills the rally continuation signal; (3) the bear-side close_loc boost is near-inert (crash low-close bars are capitulation-reversal not continuation; do not pursue a bear close_loc boost); (4) ER (Kaufman efficiency) is the correct grind-vs-chop discriminator for continuation signals, superior to vol_ratio (which conflates low-vol chop with low-vol grind). strategy.py at 6e765b0f. results.tsv append-only preserved (path-scoped git checkout -- strategy.py throughout). rally STILL binding (0.7122, Sh 1.285) - the close-loc axis moved it +0.000545 this session. FUTURE: close_loc has a natural SHRINK counterpart (shrink entries where close is OPPOSITE the trade direction = low-conviction bars) but entry-shrink family is at risk of the same leak issues; the continuation-vs-reversal asymmetry means any close_loc signal MUST be gated by ER+ret_vlong to isolate grinding-trend continuation.
e7ad3abb	0.846686	0.886714	0.133425	0.969382	0.812148	1.054101	0.711224	discard	Exp2 (architectural, indep): close-loc SHRINK counterpart to validated boost. Shrink trend-aligned entries whose entry bar closed opposite trade dir (bull+close-low / bear+close-high), gated by same ER+ret_vlong stack. MEASURED vs 6e765b0f 0.847017: composite -0.000331, mean -0.000229, std +0.000339. PER-REGIME: rally 0.712218->0.711224 (-0.000994 BINDING - bull-side shrink hit dip-buy longs: bars closing low in the uptrend are net-positive dip-buys, shrinking them cut rally Sharpe), bull 0.969313->0.969382 (+0.000069 sub-noise), crash BYTE-IDENTICAL 0.812148, sideways 1.054095->1.054101 (+0.000006 sub-noise). All stab 1.0, all MaxDD<10pct. Reverted to 6e765b0f. CORRELATION ONLY (not causal): rally regression consistent with the close_loc shrink tilting first-bar size away from dip-bar bull entries, which prior sessions found are net-positive in rally (same family as filtering rally entries hurts). Bear-side shrink (ct shorts on bounce bars) near-inert. CONCLUSION: close_loc shrink axis has the same sub-noise+leak character the prior session-summary warned about; bull dip-buys are good entries, not low-conviction. Do not pursue the bull-side close_loc shrink. Bear-only variant untested but ct-shrink space is already saturated (ct_vlong/churn_ct/vd_ct_shrink) so likely redundant.b1f63408	0.846938	0.886856	0.133062	0.969064	0.812050	1.054095	0.712218	discard	Exp2 (architectural, indep): BTC INTRABAR close-loc x BTC-trend-agreement conjunction boost on ALT entries. NEW cross-symbol x bar-shape data dep (extends own-symbol close-loc boost 6e765b0f to the leader; BTC 3-bar mean close_loc x /0.03 BTC-trend gate). MEASURED vs 6e765b0f 0.847017: composite -0.000079, mean -0.000087, std -0.000024 (tighter). PER-REGIME: rally BYTE-IDENTICAL 0.712218 (boost near-inert on rally - BTC trend solidly positive so gate ~1 but BTC close-loc did not align often enough to move alt entries already captured by own close-loc boost + saturated vol grid), bull 0.969313->0.969064 (-0.000249 sub-noise), crash 0.812148->0.812050 (-0.000098 sub-noise), sideways BYTE-IDENTICAL 1.054095. All stab 1.0, all MaxDD<10pct. Reverted to 6e765b0f. CONCLUSION: cross-symbol close-loc is REDUNDANT with the existing own-symbol close-loc boost (6e765b0f) and the saturated {own,BTC,partner}x{vol,price} volume grid - the broad-market confirmation signal is already captured. No regime improved (not branch-eligible). The close_loc data axis (own boost=keep, own shrink=dead-end, cross-symbol boost=redundant) is now thoroughly explored.3e3668e9	0.847017	0.886943	0.133086	0.969313	0.812148	1.054095	0.712218	discard	Exp3 (architectural, indep): vol-LEVEL admission relaxation - readiness threshold ENTRY_ACCUM_THRESH lowers in deep low-vol (tanh on (0.70-vol_ratio)/0.15, max -0.05). Hypothesis: admit marginally-below-threshold calm-market entries to cross the sample_factor 50-trade knee (sideways at 49 trades, sqrt(49/50)=0.990). MEASURED vs 6e765b0f 0.847017: BYTE-IDENTICAL (composite 0.847017, sideways STILL 49 trades). The 0.70 vol gate never fires: sideways vol_ratio is ~0.85 (calmer than other regimes but not deep-low) so the relaxation stays ~0 and no new entry is admitted. All stab 1.0. Reverted to 6e765b0f. CONCLUSION: the sideways sample-factor knee is NOT reachable via low-vol admission gating - sideways vol_ratio (~0.85) is too close to the other regimes; a gate high enough to fire (>=0.90) would also fire in rally/crash calm stretches -> rally over-trading wall (same as prior sessions confirmed-walled trade-count levers). The 49->50 sideways trade is structurally inaccessible without regime-targeted gating (forbidden).42dbdb6e	0.840333	0.882087	0.139180	0.969179	0.812148	1.053594	0.693427	discard	Exp4 (architectural, indep): close-loc CONTINUATION co-gate on the win-accelerator (scale-in accel depends on 3-bar close-loc agreeing with pos dir, soft blend 0.5+0.5*cont). Hypothesis: cut over-acceleration of fading-conviction rally longs (documented rally drag: large-notional longs scaling up then reversing at small pct). MEASURED vs 6e765b0f 0.847017: composite -0.006684 (CATASTROPHIC), mean -0.004856, std +0.006094. PER-REGIME: rally 0.712218->0.693427 (-0.018791 OPPOSITE of expected - Sharpe 1.28->1.24, trades 94->92, WR 8442dbdb6e	0.840333	0.882087	0.139180	0.969179	0.812148	1.053594	0.693427	discard	Exp4 (architectural, indep): close-loc CONTINUATION co-gate on the win-accelerator (scale-in accel depends on 3-bar close-loc agreeing with pos dir, soft blend 0.5+0.5*cont). Hypothesis: cut over-acceleration of fading-conviction rally longs (documented rally drag: large-notional longs scaling up then reversing at small pct). MEASURED vs 6e765b0f 0.847017: composite -0.006684 (CATASTROPHIC), mean -0.004856, std +0.006094. PER-REGIME: rally 0.712218 to 0.693427 (-0.018791 OPPOSITE of expected - Sharpe 1.28 to 1.24, trades 94 to 92, WR 84pct to 82.6pct; the soft blend REDUCED the accelerator magnitude -> slower scale-in on rally longs -> smaller trend capture -> LOWER rally Sharpe), sideways 1.054095 to 1.053594 (-0.000501), bull 0.969313 to 0.969179 (-0.000134), crash BYTE-IDENTICAL 0.812148. All stab 1.0, all MaxDD<10pct (rally 1.59). Reverted to 6e765b0f. CONCLUSION: the win-accelerator MAGNITUDE is load-bearing for rally (prior session Exp3: accelerator gave rally +0.021); ANY gate that reduces it (even a soft 0.5 floor blend) slows rally scale-in and costs rally raw. The accelerator is already correctly gated by slope-confirmation (Exp4 prior session); adding a close-loc co-gate is redundant and only removes needed magnitude. Do not re-attempt gating/reducing the win-accelerator. close-loc is a validated ENTRY signal but does NOT transfer to the scale-in accelerator (different decision point, magnitude-sensitive).
da32db79	0.846936	0.886844	0.133024	0.968914	0.812148	1.054095	0.712218	discard	Exp5 (architectural, indep): RANGE-EXPANSION entry boost. NEW data axis: current bar range (high-low) relative to ATR (mean TR), intrabar directional ENERGY (distinct from close_loc position, vol_rise volume, slope). Trend-gated boost on range-expanding trend entries (+0.05 max, /0.50 deep-saturated, first-bar-only, bilateral). MEASURED vs 6e765b0f 0.847017: composite -0.000081, mean -0.000099, std -0.000062 (tighter). PER-REGIME: rally BYTE-IDENTICAL 0.712218 (boost near-inert on rally - energetic continuation bars already captured by existing vol_rise + close-loc boosts, redundant), bull 0.969313->0.968914 (-0.000399 sub-noise), crash BYTE-IDENTICAL 0.812148, sideways BYTE-IDENTICAL 1.054095. All stab 1.0, all MaxDD<10pct. Reverted to 6e765b0f. CONCLUSION: intrabar range-expansion is REDUNDANT with the existing energetic-continuation capture (vol_rise boost + close-loc boost already size up high-energy trend-aligned bars). No regime improved (not branch-eligible). The intrabar bar-shape axis (close_loc + range-expansion) is now thoroughly explored: close_loc own-boost=keep (6e765b0f), close_loc shrink=dead-end, cross-symbol close_loc=redundant, range-expansion=redundant.
-	-	-	-	-	-	-	-	session-summary	SESSION: 5 architectural discards (EXIT RULE at 5 consecutive architectural), 0 branches opened. Baseline 6e765b0f 0.847017 UNCHANGED (strategy.py byte-identical at session end). All 5 discards architectural (new code structure / new data deps / new control flow), no parameter tweaks. THEME: explored the INTRABAR BAR-SHAPE data axis (close-position-within-bar and range-expansion) plus a vol-level admission lever, across entry/scale-in/admission subsystems. Discards: (1) close-loc SHRINK counterpart to the validated own-symbol boost (entry, bilateral, ER+ret_vlong gated) - composite -0.000331: rally -0.000994 (bull-side shrink hit dip-buy longs; bars closing low in the uptrend are net-positive dip-buys not low-conviction, same family as prior-session finding filtering rally entries hurts); bear-side shrink near-inert. (2) BTC CROSS-SYMBOL close-loc x BTC-trend agreement alt entry boost - composite -0.000079 (sub-noise): rally BYTE-IDENTICAL, redundant with existing own-symbol close-loc boost + saturated {own,BTC,partner}x{vol,price} volume grid (broad-market confirmation already captured). (3) vol-LEVEL admission relaxation (readiness threshold lowers in deep low-vol to cross the sideways 49-trade sample_factor knee) - BYTE-IDENTICAL/INERT: sideways vol_ratio ~0.85 (calmer than other regimes but NOT deep-low) so the 0.70 gate never fires; a gate high enough to fire (>=0.90) would also fire in rally/crash calm stretches -> rally over-trading wall (same trade-count lever prior sessions confirmed walled). The 49->50 sideways trade is structurally inaccessible without regime-targeted gating (forbidden). (4) close-loc CONTINUATION co-gate on the win-accelerator (scale-in) - composite -0.006684 CATASTROPHIC: rally -0.018791 (Sharpe 1.28->1.24, trades 94->92) - the soft blend (0.5+0.5*cont) REDUCED the accelerator magnitude -> slower scale-in on rally longs -> smaller trend capture. The win-accelerator MAGNITUDE is load-bearing for rally (prior-session Exp3 gave rally +0.021); ANY gate reducing it costs rally raw. close-loc is a validated ENTRY signal but does NOT transfer to the scale-in accelerator (magnitude-sensitive decision point). (5) RANGE-EXPANSION entry boost (current bar range vs ATR, intrabar directional energy, trend-gated) - composite -0.000081 (sub-noise): rally BYTE-IDENTICAL, redundant with existing vol_rise + close-loc boosts (energetic continuation bars already sized up). CROSS-EXPERIMENT CONCLUSIONS (load-bearing for future sessions): (a) INTRABAR BAR-SHAPE AXIS IS NOW SATURATED - close_loc own-boost=keep (6e765b0f, the only productive bar-shape signal), close_loc own-shrink=dead-end (dip-buys are good), cross-symbol close_loc=redundant (broad-market confirmation already captured by volume grid), close_loc on scale-in accelerator=catastrophic (magnitude load-bearing), range-expansion=redundant (energetic continuation already captured by vol_rise+close-loc). The ONLY productive bar-shape signal is the own-symbol close-loc entry boost already in the baseline; all 5 extensions this session failed. (b) ENTRY-SHRINK FAMILY CONSISTENTLY HURTS RALLY - confirms across this + prior sessions that rally entries (longs AND shorts) are net-positive; shrinking any subset (dip-buys, ct shorts, low-conviction) hurts rally. Entry BOOSTS are the only productive entry-side direction, and the boost space is saturated (volume grid complete + close-loc). (c) SAMPLE_FACTOR 50-TRADE KNEE for sideways (49 trades) is STRUCTURALLY INACCESSIBLE - sideways vol_ratio (~0.85) is too close to other regimes to gate cleanly; any admission relaxation high enough to fire also over-trades rally. Do not re-attempt the sideways sample-knee lever. (d) SCALE-IN ACCELERATOR MAGNITUDE IS LOAD-BEARING - do not gate/reduce it; it is already correctly gated by slope-confirmation. rally STILL binding (0.712218, Sh 1.285) UNCHANGED this session. FUTURE: the entry-boost + bar-shape axes are exhausted; productive new directions likely require a genuinely new DATA SOURCE (not bar-shape derivatives of OHLC) or a subsystem redesign of the EXIT fusion / order-emission layer (both flagged saturated in prior sessions but not re-tested at the 6e765b0f baseline). results.tsv append-only preserved (path-scoped git checkout -- strategy.py throughout); all 5 discards reverted to 6e765b0f.
cf9a42ea	0.847578	0.887336	0.132523	0.969307	0.811923	1.054088	0.714024	keep	KEEP (NEW BASELINE, SUPERSEDES 6e765b0f 0.847017). Exp1 (architectural, indep): DIRECTIONAL VOLUME PRESSURE (normalized OBV) trend-aligned entry boost. NEW data axis: DVP = sum(vol[i]*sign(close[i]-close[i-1]))/sum(vol[i]) over 12 bars, range [-1,+1] - whether participating volume is on up-bars or down-bars. Genuinely orthogonal to VWAP voter (level deviation), vol_rise (total vol magnitude trend), vol_z (level spike) - NONE measured directional balance of volume. close-to-close sign uses only close (noise-perturbed -> legitimately noise-sensitive, not the open-price artifact). Mechanism: grinding rally uptrend has volume on up-bars (DVP>0) even when TOTAL volume is flat (the case vol_rise misses) -> trend-aligned long confirmed by buy-side volume = higher-quality entry -> larger first-bar commitment -> higher rally Sharpe. Mirrors validated close-loc boost envelope EXACTLY: trend_w (|ret_long|/0.04) x ER grind gate (_er/0.25) x multi-day ret_vlong>0 bull gate (excludes crash dead-cat bounces) x deep-saturated conviction (/0.15) x +0.05 max first-bar-only bilateral. MEASURED vs 6e765b0f 0.847017: composite +0.000561, mean +0.000393, std -0.000563 (tighter). PER-REGIME: rally 0.712218->0.714024 (+0.001806 BINDING - Sh 1.284884->1.289841, DD 1.538->1.546, uptrend grind bars have buy-side volume -> boost fires on genuine continuation longs), bull 0.969313->0.969307 (~flat -0.000006 Sh1.846 - /0.04 trend_w spared weak-trend 2021 pullback stretches), crash 0.812148->0.811923 (-0.000225 sub-noise Sh1.264 - bear boost ungated but crash downtrend sell-side volume -> small boost on crash shorts, residual path-dependent), sideways 1.054095->1.054088 (~flat -0.000007 - ER gate spared chop, DVP~0 in sideways). All stab 1.0, all MaxDD<10pct (rally 1.546). All keep criteria met. NEW BASELINE 0.847578. New cross-data-type dep at entry sizing. Observation (correlation only): rally gain consistent with buy-side-volume-confirmed-trend-long hypothesis but direction-split PnL not measured.
