commit	score	mean_score	std_score	bull_2021	crash_bear	sideways	rally_2024	status	description
87b9c055	0.793651	0.836842	0.143970	0.961441	0.730871	0.994833	0.660224	discard	Exp5 (architectural simplification, indep): REMOVED the _vd_ct_shrink counter-trend volume-decline shrink (Exp6 component, max 0.12, ret_vlong-gated decline x ct conjunction) AND its two factors from the entry-target multiplication chain. Redundancy test with the existing _ct_vlong ct shrink (also ret_vlong-gated) + the symmetric _vol_decline_shrink. MEASURED vs 5a748c8a 0.793917: composite -0.000266 SUB-NOISE negative; mean -0.000284; std -0.000059. PER-REGIME all stab 1.0 all raw==score all DD<10pct: bull 0.962118->0.961441 (-0.000677, Sh2.000->1.998 -- the component is microscopically load-bearing on bull), crash 0.731300->0.730871 (-0.000429), sideways BYTE-IDENTICAL 0.994833, rally 0.660252->0.660224 (-0.000028 flat). KEY FINDING: _vd_ct_shrink is NOT redundant -- it is microscopically load-bearing (bull -0.0007). Confirms the TIGHT LOCAL OPTIMUM holds: even a max-0.12 ct volume-decline shrink contributes marginal alpha below the +0.003 keep threshold; no simplification holds score (mirrors the prior Exp3 double-cross-boosts removal -0.000108 and the _ar_pressure dead-code findings). Every multiplicative entry-size component, however small, is load-bearing at this baseline. Reverted to 5a748c8a. Architectural discard #5 -- EXIT RULE (5 consecutive architectural discards) MET.
-	-	-	-	-	-	-	-	session-summary	SESSION (baseline 5a748c8a 0.793917 -> UNCHANGED, no keep): 5 independent architectural experiments (Exp1-5, ALL discards), no exploration branch opened. EXIT RULE: 5 consecutive architectural discards MET -> stop (user 2-arch-discard minimum exceeded: 5). Baseline 5a748c8a re-verified reproduces 0.793917 byte-identical at session start AND post-revert [bull 0.962118 Sh1.9997 DD3.09pct 52t 86.5pct WR, crash 0.731300 Sh1.2727 DD2.46pct 57t 100pct WR, sideways 0.994833 Sh2.002 DD2.21pct 48t 97.9pct WR sample_factor 0.980, rally 0.660252 Sh1.526 DD5.19pct 100t 85pct WR; all stab_factor 1.0, all raw==score, min_stab 0.810456]. strategy.py matches 5a748c8a byte-identical (0 diff verified post-revert). results.tsv append-only preserved (path-scoped git checkout -- strategy.py throughout, never git revert). THEME: probed 5 genuinely-different architectural angles across all 3 decision subsystems (exit, entry-admission, voter, fusion, simplification), each with a clear mechanism. CROSS-EXPERIMENT CONCLUSIONS (all measured this session, verifiable): (1) Exp1 (profit-DECELERATION pre-peak harvest, 7th soft MAX source -- EMA of 1-bar pos_pnl delta=velocity + its delta=acceleration; fires when winner STILL RISING vel>0 BUT DECELERATING accel<0 = peak-forming BEFORE giveback, so pp=0 and slope-with-pos -> SOLE firing source, intended to evade MAX-fusion wall): REGRESSION -0.031. The pre-peak evasion insight HELD (mechanism FIRED, not MAX-dominated) BUT the rally DD-relief benefit was negligible (+0.001, DD5.19->5.18) while bull trend winners were harvested too early (-0.144, Sh2.00->1.72). A deceleration PAUSE in a strong bull uptrend resumes, so it is not a peak signal in the trending regimes where winners are biggest. WALL EXTENDED: forward-looking peak PREDICTION (2nd derivative of pos_pnl) is too noisy a peak signal in trends; backward pp giveback (fires only AFTER confirmed peak+giveback) remains the only viable harvest trigger. (2) Exp2 (LOW-CHURN relaxation of the sideways chop-tightening on the admission floor -- halve the +0.20*(1-rsi_trend_str) term when len(_eh)<=1 to recover sideways trades below the 50-trade sample_factor knee): SUB-NOISE -0.000018 FLAT, sideways STILL 48 TRADES. The chop-tightening magnitude is NOT binding on sideways trade count: voter conviction either clearly exceeds or falls well below the floor (NO marginal bars). Extends the THRESHOLD-DOMINATED inertness finding (accumulator RHO inert prior; here _strong_min chop magnitude inert) -- sideways trade count is fixed by WHERE voter conviction appears, not the admission threshold. The sample_factor 0.980 penalty is STRUCTURAL (voter signal structure in chop), not admission-addressable. (3) Exp3 (9th VOTER stochastic %K range-position, 0 prior mentions as a voter -- centered (2*%K-1) signed by 14-bar close direction, weight 0.55): REGRESSION -0.023, rally -0.066 (Sh1.526->1.371, 100->95 trades, WR85->78pct). A 9th DIRECTIONAL voter over-amplifies trend conviction on rally (same failure mode as ret_vlong voter c4c31861 -0.115); bull/crash byte-identical. Confirms voter-axis saturation extends to stochastic range-position: directional level-in-range voters are redundant-with-co-firing at best, trend-over-amplifying at worst. (4) Exp4 (EXIT-FUSION CONFIRMATION AMPLIFICATION -- extend _agree_gate from attenuate-only 0.75-1.0 to also amplify +10pct on 2+ source agreement): CATASTROPHIC -0.374, sideways 0.995->0.158 (Sh2.00->1.13, DD2.21->9.70pct NEAR 10pct HARD CUTOFF, 48->104 trades), bull 0.962->0.429, min_stab 0.810->0.794 below knee. CONFIRMS the MAX-fusion wall is STRUCTURAL at the fusion-architecture level: amplifying on agreement re-introduces EXACTLY the correlated-noise addition that weighted-sum had and MAX was chosen to eliminate (sideways trades exploded 48->104 from noise co-firing amplified into micro-exits). Not only are additional exit SOURCES inert under MAX (prior sessions), but the MAX MECHANISM itself cannot be softened with agreement-amplification -- the agreement information is irreducibly correlated-noise-contaminated. (5) Exp5 (simplification: REMOVE _vd_ct_shrink ct volume-decline shrink, redundancy test with _ct_vlong + _vol_decline_shrink): SUB-NOISE -0.000266, bull -0.0007. The component is microscopically load-bearing, NOT redundant. Confirms the TIGHT LOCAL OPTIMUM: every multiplicative entry-size component (however small max-0.12) contributes marginal alpha below the +0.003 keep threshold; no simplification holds score. KEY LOAD-BEARING CONCLUSIONS: (A) the EXIT-FUSION MAX architecture is a HARD WALL at two levels -- source-count (additional sources MAX-dominated) AND mechanism (agreement-amplification re-amplifies correlated noise); no exit-fusion variant is viable. (B) ADMISSION THRESHOLD MAGNITUDE is NOT a lever for sideways trade count (threshold-dominated; voter conviction structure is binding); the sample_factor 0.980 penalty on sideways is structural. (C) the VOTER axis remains saturated -- a 9th directional voter (stochastic) over-amplifies trend on rally; only the 8th efficiency voter (orthogonal QUALITY) ever worked. (D) forward-looking peak PREDICTION (pos_pnl 2nd derivative) is too noisy in trends; backward giveback is the only viable harvest trigger. (E) the tight local optimum holds -- every component (even max-0.12 shrinks) is microscopically load-bearing; no simplification holds score. REMAINING UNCONQUERED: rally (0.660, streak_gate 0.875 structurally unbreakable per 5 prior vehicles, ct-exit fully optimized, all raw levers walled, stability_factor 1.0 no headroom, DD-reduction levers maxed) and crash (0.731, return-limited Sh1.2727 100pct WR, structurally small-move-capped). Both binding regimes at non-addressable structural limits. Structural-exploration NOT attempted: trigger met (5 arch discards) but no coherent subsystem-rewrite hypothesis with a plausible path (every core mechanism converted+tuned by 10+ prior sessions; the two binding-regime limits are structural properties of the regime data -- rally ct-loser peak magnitude + 4-loss streak, crash bounce move size -- not of the strategy mechanism, so no subsystem rewrite can address them; this session additionally CONFIRMED the MAX-fusion wall is architectural-level, foreclosing exit-fusion rewrites). NEW BASELINE 0.793917 unchanged for future sessions.
b451b273	0.793892	0.837096	0.144012	0.962235	0.731300	0.994635	0.660214	discard	Exp1 (architectural simplification, indep): REMOVED the mixed-cell boost layer (Exp8 BTC-vol-rise x partner-price + Exp9 partner-vol-rise x BTC-price), both self-flagged redundant at inception ("may be redundant with Exp1 (BTC-vol) x Exp2-partner-boost (partner-price) which already multiply"). MEASURED vs 5a748c8a 0.793917: composite -0.000025 SUB-NOISE; mean -0.000030; std -0.000017 (tighter). PER-REGIME all stab 1.0 all raw==score all DD<10pct: bull 0.962118->0.962235 (+0.000117), crash BYTE-IDENTICAL 0.731300, sideways 0.994833->0.994635 (-0.000198), rally 0.660252->0.660214 (-0.000038). KEY FINDING: confirms the mixed-cell {vol x price} boosts are REDUNDANT-WITH-CLEAN-KEEPS (sub-noise near-inert) -- the clean 2-way keeps (Exp1 BTC-vol-rise x BTC-trend; Exp3 partner-vol x partner-price; Exp2 partner-lead) already multiply the BTC-vol-rise, partner-vol-rise, partner-price, BTC-trend signals onto the same alt trend entries, so the MIXED cells re-combine them = near-double-count with ~zero marginal effect. Consistent with prior Exp5 (_vd_ct_shrink removal -0.000266): every multiplicative entry-size component is microscopically load-bearing/redundant-but-inert at this baseline (tight local optimum). Not branch-eligible (sub-noise flat, no regime positive delta above noise-floor, no path to +0.003 keep -- removing redundant components cannot yield a keep). Reverted to 5a748c8a. Architectural discard #1.
9c420de0	0.793917	0.837126	0.144029	0.962118	0.731300	0.994833	0.660252	discard	Exp2 (architectural, indep): TREND-ADAPTIVE entry-readiness EMA accumulator RHO. Replaced fixed ENTRY_ACCUM_RHO=0.5 with _rho_dyn = 0.65 - 0.30*_trend_strength_w in [0.65 chop, 0.35 strong trend]. Mechanism: fixed RHO over-smooths trend entries (rally/crash admitted 1 bar late -> less return) and under-smooths chop entries (sideways noise trades); trend-adaptive RHO admits trend entries faster (lower RHO) while filtering chop more (higher RHO). OPPOSITE direction of prior Exp2 rc_dir sign-smoothing (which added smoothing IN trends and hurt them). MEASURED vs 5a748c8a 0.793917: BYTE-IDENTICAL (composite 0.793917, mean 0.837126, std 0.144029). PER-REGIME all byte-identical all stab 1.0 all raw==score: bull 0.962118, crash 0.731300, sideways 0.994833, rally 0.660252; min_stab 0.810398. KEY FINDING: the trend-adaptive RHO is COMPLETELY INERT -- the admission decision (_acc_b >= ENTRY_ACCUM_THRESH=0.0) fires on the SAME bars regardless of RHO in [0.35, 0.65]. The conviction margin either clearly crosses 0 (admitted regardless of smoothing) or stays well below (not admitted) -- the accumulator THRESHOLD (0.0) is not binding on the margin; conviction clearly exceeds or falls below. Same threshold-dominated inertness pattern as prior Exp2 low-churn relaxation (sideways trade count fixed by WHERE conviction appears, not the threshold). The accumulators VALUE was in replacing the hard persist/anti-dip gates (structural, Exp2 subsystem redesign keep), NOT in the RHO tuning -- RHO within a wide range is dead-code-adjacent. Distinct from prior Exp2 rc_dir sign-smoothing (-0.0106): that changed the voter SIGN input to the strong-sum (materially shifted the margin); this only changed the margins temporal smoothing (did not move the crossing bar). Extends the admission-threshold-inertness wall to the accumulator RHO. Not branch-eligible (byte-identical inert, no regime improved, no path to keep -- RHO is not the binding lever and no follow-up RHO change can make it one). Reverted to 5a748c8a. Architectural discard #2.
775a7d5b	0.792245	0.835915	0.145566	0.962360	0.731745	0.994585	0.654968	discard	Exp3 (architectural simplification, indep): REMOVED the DVP boost column (own-DVP _dvp_boost + btc-DVP _btcdvp_boost + partner-DVP _partnerdvp_boost, the 3 directional-volume-pressure boosts, +0.05 each). Hypothesis: DVP signal (volume-direction balance) redundant with the VWAP voter (close vs volume-weighted typical price) and close-conv boost; column possibly net-harmful (over-commits rally longs). MEASURED vs 5a748c8a 0.793917: composite -0.001672 REGRESSION; mean -0.001211; std +0.001537 (worse). PER-REGIME all stab 1.0 all raw==score all DD<10pct: bull 0.962118->0.962360 (+0.000242 sub-noise), crash 0.731300->0.731745 (+0.000445 sub-noise), sideways 0.994833->0.994585 (-0.000248), rally 0.660252->0.654968 (-0.005284 REGRESSION). KEY FINDING: the DVP column is LOAD-BEARING (NOT redundant) -- removing it regresses rally -0.0053 (the dominant loss). The own-DVP boost captures a UNIQUE volume-direction signal the VWAP voter (a level deviation, not a directional-volume balance) does NOT cover. Contrast with Exp1 (mixed-cell layer removal was sub-noise redundant) and prior Exp5 (_vd_ct_shrink sub-noise): the DVP column is genuinely informative, not a double-count. bull/crash sub-noise-positive (the DVP boosts fire mostly on rally alts, less on BTC-dominated bull/crash). Confirms the tight local optimum is SELECTIVE: redundant/near-double-count components (mixed cells) are sub-noise-removable, but unique-signal components (DVP) are load-bearing. Not branch-eligible (rally -0.0053 dominant, DVP non-redundant, no path to keep -- removing a load-bearing signal cannot yield +0.003). Reverted to 5a748c8a. Architectural discard #3.
f14c046c	0.793781	0.837028	0.144156	0.962088	0.731573	0.994813	0.659639	discard	Exp4 (architectural simplification, indep): REMOVED the close-conv boost (_close_conv_boost, close-position-in-bar continuation boost, +0.05 max, gated trend_w x ER x multi-day ret_vlong x close-loc). Hypothesis: close-in-bar signal may be redundant with DVP/other trend boosts, or net-harmful (over-commits rally longs into pullbacks). MEASURED vs 5a748c8a 0.793917: composite -0.000136 SUB-NOISE; mean -0.000098; std -0.000127 (tighter). PER-REGIME all stab 1.0 all raw==score all DD<10pct: bull 0.962118->0.962088 (-0.000030), crash 0.731300->0.731573 (+0.000273 sub-noise), sideways 0.994833->0.994813 (-0.000020), rally 0.660252->0.659639 (-0.000613). KEY FINDING: close-conv boost is MICROSCOPICALLY LOAD-BEARING on rally (-0.0006) but sub-noise overall. The close-in-bar continuation signal is a weak-but-real trend-conviction input (fires on rally longs closing near highs); removing it costs a sliver of rally trend capture but below the +0.003 keep threshold. Sits between Exp1 (mixed-cell, fully redundant sub-noise) and Exp3 (DVP, load-bearing -0.0017) on the load-bearing spectrum -- a weak unique signal, not a double-count. Confirms the tight local optimum: even weak-signal +0.05 boosts are microscopically load-bearing. Not branch-eligible (sub-noise, no regime positive above noise-floor, no path to +0.003 keep). Reverted to 5a748c8a. Architectural discard #4.
cd2e1c41	0.793471	0.836885	0.144713	0.962861	0.731300	0.994828	0.658549	discard	Exp5 (architectural simplification, indep): REMOVED the own-vol-rise trend-aligned boost (_vol_rise_boost, +0.08 max -- LARGER than the +0.05 boosts so clearer signal). Hypothesis: trend-aligned entry on rising volume may be net-harmful (over-commits rally longs into pullbacks) given other trend boosts; or load-bearing if rising-volume is a unique participation signal. MEASURED vs 5a748c8a 0.793917: composite -0.000446 SUB-NOISE; mean -0.000241; std +0.000684. PER-REGIME all stab 1.0 all raw==score all DD<10pct: bull 0.962118->0.962861 (+0.000743 -- the boost slightly HURT bull, removing helps), crash BYTE-IDENTICAL 0.731300, sideways 0.994833->0.994828 (-0.000005 flat), rally 0.660252->0.658549 (-0.001703 LOAD-BEARING). KEY FINDING: the own-vol-rise boost is LOAD-BEARING on rally (-0.0017, the dominant loss) -- rising-volume participation is a REAL signal for rally longs (grinding uptrend on building volume). bull +0.0007 (the boost over-committed some bull pullback stretches; removing helps bull sub-noise) but the rally cost dominates. Sub-noise overall. Confirms the tight local optimum: the +0.08 magnitude boost is load-bearing on the binding regime (rally) despite being sub-noise on bull/crash/sideways. Not branch-eligible (rally -0.0017 dominant, rising-volume non-redundant, no path to +0.003 keep). Reverted to 5a748c8a. Architectural discard #5 -- EXIT RULE (5 consecutive architectural discards) MET.
-	-	-	-	-	-	-	-	session-summary	SESSION (baseline 5a748c8a 0.793917 -> UNCHANGED, no keep): 5 independent architectural experiments (Exp1-5, ALL discards), no exploration branch opened. EXIT RULE: 5 consecutive architectural discards MET -> stop (user 2-arch-discard minimum exceeded: 5). Baseline 5a748c8a re-verified byte-identical 0.793917 post-revert (0 diff) [bull 0.962118 Sh1.9997, crash 0.731300 Sh1.2727 100pct WR, sideways 0.994833 Sh2.002 48t sample_factor 0.980, rally 0.660252 Sh1.526; all stab 1.0, all raw==score, min_stab 0.810456]. results.tsv append-only preserved (path-scoped git checkout -- strategy.py throughout, never git revert). THEME: probed 5 architectural angles -- 2 simplification-of-possibly-redundant-layers (Exp1 mixed-cell, Exp3 DVP-column), 2 single-unique-signal-boost removals (Exp4 close-conv, Exp5 own-vol-rise), 1 admission-control-flow change (Exp2 trend-adaptive accumulator RHO). CROSS-EXPERIMENT CONCLUSIONS (all measured this session, verifiable): (1) Exp1 (REMOVE mixed-cell boost layer -- Exp8 BTC-vol x partner-price + Exp9 partner-vol x BTC-price): SUB-NOISE -0.000025, essentially INERT. CONFIRMS the mixed-cell {vol x price} boosts are REDUNDANT-WITH-CLEAN-KEEPS -- the clean 2-way keeps (Exp1 BTC-vol-rise x BTC-trend; Exp3 partner-vol x partner-price; Exp2 partner-lead) already multiply the same signals onto the same alt trend entries, so the MIXED cells re-combine them = near-double-count with ~zero marginal effect. The mixed-cell layer is the ONLY sub-noise-removable layer tested (removing it loses nothing but gains nothing = discard under the +0.003 keep threshold). (2) Exp2 (TREND-ADAPTIVE entry-readiness EMA RHO, fixed 0.5 -> [0.65 chop, 0.35 trend]): BYTE-IDENTICAL 0.793917 INERT. The admission decision (_acc_b >= 0.0) fires on the SAME bars regardless of RHO in [0.35, 0.65] -- the conviction margin either clearly crosses 0 (admitted) or stays well below (not admitted). The accumulator THRESHOLD (0.0) is not binding on the margin; the accumulators VALUE was in replacing the hard persist/anti-dip gates (structural, prior Exp2 subsystem redesign keep), NOT in RHO tuning -- RHO within a wide range is dead-code-adjacent. Distinct from prior Exp2 rc_dir sign-smoothing (-0.0106): that changed the voter SIGN input to the strong-sum (materially shifted the margin); this only changed the margins temporal smoothing (did not move the crossing bar). EXTENDS the admission-threshold-inertness wall to the accumulator RHO. (3) Exp3 (REMOVE DVP boost column -- own-DVP + btc-DVP + partner-DVP): REGRESSION -0.001672, rally -0.0053 DOMINANT. The DVP column is LOAD-BEARING (NOT redundant with the VWAP voter): the own-DVP boost captures a UNIQUE volume-DIRECTION signal (buy-side vs sell-side volume balance) the VWAP voter (a level deviation) does NOT cover. CONTRAST: the mixed-cell layer (Exp1, redundant double-count) vs the DVP column (Exp3, unique signal) -- the strategy is a MIX of redundant and load-bearing components; only the redundant ones are sub-noise-removable. (4) Exp4 (REMOVE close-conv boost, close-position-in-bar continuation): SUB-NOISE -0.000136, rally -0.0006 microscopically load-bearing. The close-in-bar signal is a WEAK unique trend-conviction input (fires on rally longs closing near highs); sits between Exp1 (fully redundant) and Exp3 (load-bearing -0.0017) on the load-bearing spectrum. (5) Exp5 (REMOVE own-vol-rise trend-aligned boost, +0.08 max -- LARGER magnitude): SUB-NOISE -0.000446, rally -0.0017 LOAD-BEARING, bull +0.0007 (the boost slightly hurt bull). Rising-volume participation is a REAL signal for rally longs (grinding uptrend on building volume); the +0.08 magnitude boost is load-bearing on the binding regime despite being sub-noise on others. KEY LOAD-BEARING CONCLUSIONS: (A) the tight local optimum is SELECTIVE: components fall on a load-bearing spectrum -- redundant double-counts (mixed-cell layer, sub-noise-removable but no gain) < weak unique signals (close-conv, microscopically load-bearing) < strong unique signals (DVP column -0.0017, own-vol-rise -0.0017, load-bearing). Removing ANY of them cannot yield a +0.003 keep (redundant ones give ~0, load-bearing ones regress). (B) the entry-readiness accumulator RHO is INERT in a wide range -- admission is threshold-dominated (margin clearly crosses 0 or not); the accumulator is structurally load-bearing (replaces persist/anti-dip gates) but its RHO parameter is dead-code-adjacent. (C) the entry-sizing boost stack is FULLY MINED: every boost (mixed-cell redundant, DVP/close-conv/vol-rise load-bearing) has been removal-tested; no simplification yields a keep. REMAINING UNCONQUERED: rally (0.660, streak_gate 0.875 structurally unbreakable, stability_factor 1.0 no headroom, DD-reduction levers maxed, all entry-size + admission + exit levers walled) and crash (0.731, return-limited Sh1.2727 100pct WR, structurally small-move-capped). Both binding regimes at non-addressable structural limits (3rd consecutive session confirming this). Structural-exploration NOT attempted: trigger met (5 arch discards) but no coherent subsystem-rewrite hypothesis with a plausible path (every core mechanism converted+tuned by 10+ prior sessions; the two binding-regime limits are structural properties of the regime data -- rally ct-loser streak/magnitude, crash bounce move size -- not of the strategy mechanism, so no subsystem rewrite can address them). NEW BASELINE 0.793917 unchanged for future sessions.
