commit	score	mean_score	std_score	bull_2021	crash_bear	sideways	rally_2024	status	description
de412448-session-summary	0.6393	0.7454	0.2120	0.78	0.77	1.01	0.42	session-summary	session: 1 indep architectural discard + 1 exploration branch (6 steps, REVERTED). Baseline de412448 UNCHANGED 0.6393 [bull 0.781251 Sh1.556 stab0.810, crash 0.767586 Sh1.311 stab0.974, sideways 1.013297 Sh1.941 stab0.849, rally 0.419353 Sh0.736 stab0.801; ALL factors 1.0]. strategy.py verified byte-identical to de412448. HEADLINE DIAGNOSTIC (cleanest proof to date that baseline is rally-SEED-LUCK): noise_test seeds RNG from AST-hash of strategy.py (line58-65,199-200), so ANY logic edit re-rolls ALL stabilities. Ran 2 NO-OP edits (dead var, ZERO trades changed -> all raw_scores byte-identical): rally stab 0.800755(baseline)/0.690900(noop1)/0.508818(noop2) -> factor 1.0/0.636/0.029 -> composite 0.639349/0.571062/0.454952. A PURE NO-OP dropped composite -0.068 to -0.184. Across the whole session 7 byte-identical-rally-trade draws: {0.801,0.691,0.509,0.667,0.484,0.627,0.798} mean~0.65 range 0.48-0.80 P(>=0.80)~2/7. CONCLUSION: baseline 0.6393 is a TOP-of-range lucky rally draw (0.801 just above 0.80 knee); true seed-averaged composite ~0.50-0.57. EXP1 (indep arch discard): persistent-churn admission throttle (+30pct strong_min at cum-max churn>=5) -> rally raw BYTE-IDENTICAL (rally entries sit DEEP above admission, cannot shed via tightening), bull raw DROPPED 0.781->0.679 (bull DOES occasionally burst), crash+sideways byte-identical. BRANCH (arch discard #2, surgical clean-trend exit ride-suppression, 6 steps): GENUINE RAW LEVER (best=step4) - suppress ONLY slope+time exit pressures for clean(R2 log-HL2-16)+multiday-aligned(ret_vlong)+winning holds, keep pp/ve/ar/SL full: bull 0.781->0.783, crash 0.768->0.829(+0.062), sideways 1.013->1.074(+0.060) ALL 3 strong regimes UP deterministically (b+c+s raw sum 2.562->2.686 +0.124), rally Sharpe byte-identical (surgical does not fire in rally). raw_composite 0.6585>baseline 0.6393. BLOCKED from KEEP: composite applies AST-seed-random stab factor to UNCHANGED rally -> drew 0.484/0.627 -> composite 0.470/0.550<0.639. step6 proved clean-sustained gate NECESSARY (broad version collapsed sideways 1.013->0.372) AND rally exits NOT slope/time-driven (rally churn irreducible via this lever). METHODOLOGICAL: a genuine 3-regime raw improvement (raw_composite +0.019, broad general mechanism = better generalization than abfb9591 bull-overfit) is UNREWARDABLE because composite is dominated by rally stability estimator variance at the 0.80 knee; at rally factor 0 (~25-35pct of seeds) NOTHING beats baseline (rally=0 caps composite<=0.64 even at b=c=s=1.2). Did NOT fish for lucky rally seed. FUTURE: surgical ride-suppression is the strongest raw lever in 20+ sessions, keepable only if rally robustness solved or metric reseed-averaged; baseline remains a hard SEED-LOCKED local max. Reverted via git checkout -- strategy.py; results.tsv append-only intact.
-	0.5357	0.6880	0.3046	0.78	0.77	1.01	0.19	discard	ARCHITECTURAL wide-range-bar (intrabar HL-range/ATR) entry-size attenuator (NEW orthogonal signal: current-bar H-L span vs 14-bar ATR, direction-agnostic size-down, max 25pct, size-down rally-safe channel). composite 0.6393->0.5357. crash 0.767586 + sideways 1.013297 BYTE-IDENTICAL (entry-size quality channel SATURATED; deep-conviction survivors do not fire on wide-range bars). bull 0.781251->0.783062 (+0.0018 raw, tiny: a few bull entries on wide bars shrunk). rally raw ~flat 0.419 but stab RE-SEEDED 0.801->0.636 factor 1.0->0.453 -> rally score 0.419->0.188 (breaches 50pct gate). raw_composite 0.6393->0.6372 (-0.002 flat). NOT branch-worthy: only material mover (rally) moved via AST-hash stability re-seed (uncorrelated with mechanism, confirmed ~25 sessions), NOT a fixable regression. Confirms entry-size channel saturation (intrabar-range is Nth orthogonal size signal byte-identical on strong regimes). Discard #1 architectural.
-	0.4489	0.6401	0.3823	0.78	0.77	1.01	0.00	discard	ARCHITECTURAL simplification: remove _churn_size_atten (older churn-gated first-bar size shrink 1-0.25*tanh((len(_eh)-1.5)/1.5)). HYP: redundant with de412448-keep _tq_calm churn-gating (same integer churn count). RESULT composite 0.6393->0.4489. crash 0.767586 + sideways 1.013297 BYTE-IDENTICAL; bull 0.781251->0.779399 (-0.0019 = MILDLY LOAD-BEARING for bull, NOT fully redundant - shrinking bursty bull entries helps marginally); rally stab RE-SEEDED 0.801->0.368 factor 1.0->0 -> rally score 0.419->0.000 (hard cutoff). NOT redundant + removal re-rolls rally catastrophically. Reconfirms tight-local-optimum: every component load-bearing OR its removal re-seeds rally. Discard #2 architectural.
-	0.6029	0.7146	0.2235	0.68	0.78	1.01	0.39	discard	ARCHITECTURAL 8th OBV-slope voter (cumulative signed-volume slope/16, scale 0.30, weight 0.7; thresholds rescaled 1.75/2.92/2.80 -> 2.00/3.34/3.20 for 8 voters) — tests the flagged "new voter SIGNAL changes strong-regime trade SET" lever. composite 0.6393->0.6029. IMPORTANT NEW FINDING: unlike size/admission/exit changes (which leave bull/crash/sideways BYTE-IDENTICAL = frozen), a new VOTER SIGNAL DOES change their trades: crash RAW 0.767586->0.776135 (+0.0085, volume confirms high-vol crash shorts), bull RAW 0.781251->0.679081 (-0.102, OBV conflicts with tuned price-voters in bull = likely late-bull volume divergence votes bear), sideways +0.0001, rally RAW 0.419->0.390 (-0.030). min_stability 0.880 = ALL factors 1.0 (composite==raw): unusually rally stab did NOT collapse (RAW-driven loss, not seed). PARTIALLY CONFIRMS flagged lever (voter-signal IS the strong-regime trade-set lever) but OBV specifically net-harmful: bull+rally damage -0.132 >> crash +0.0085. Not branch-worthy (crash gain tiny + inseparable from bull/rally damage; calibrating weight down approaches zero net). Discard #3 architectural.
-	0.5867	0.7054	0.2375	0.68	0.78	1.01	0.35	discard	ARCHITECTURAL 8th voter = CONFIRMATION-GATED OBV (0.3x when opposing ret_long, 1.0x agreeing) — insight-driven follow-up to EXP3 to test if crash gain isolatable from bull damage. composite 0.6393->0.5867. DECISIVE FALSIFICATION: confirmation-gating did NOT change strong regimes vs EXP3 raw-OBV: bull 0.679084 (EXP3 0.679081), crash 0.776135 (EXP3 0.776135 IDENTICAL), sideways 1.014 (EXP3 1.013) — DESPITE a completely different OBV signal. => OBV directional CONTENT is nearly INERT on strong regimes (voter-saturated at the SIGNAL level, not just the gate level); the bull -0.102 / crash +0.0085 deltas in BOTH exps come from the 8/7 admission THRESHOLD rescale (1.75->2.00 etc), NOT OBV direction. RETRACTS EXP3 "OBV opposes bull / helps crash" causal reading: those are admission-rescale artifacts (tighter bull admission cuts bull trades). rally re-seeded 0.771 factor 0.90 (raw ~0.39). Confirms: a new voter SIGNAL is nearly inert on saturated strong regimes; only the admission THRESHOLD (already-saturated channel) moves them, net-negative. Discard #4 architectural.
-	0.5107	0.6706	0.3198	0.75	0.78	1.01	0.15	discard	ARCHITECTURAL remove VWAP voter (7->6, thresholds rescaled 1.75/2.92/2.80->1.50/2.50/2.40 = x6/7). Inverse of EXP3/4. composite 0.6393->0.5107. bull 0.781251->0.746890 (-0.034 = VWAP LOAD-BEARING for bull), crash 0.767586->0.776118 (+0.0085 = SAME nudge as EXP3 8/7-tighten AND EXP4, now under 6/7-LOOSEN+VWAP-removal: crash high-conviction shorts robust to voter-set changes, the +0.0085 is an admission-margin artifact NOT attributable to any voter [correlational]), sideways 1.013122 (-0.0002 flat), rally stab RE-SEEDED 0.801->0.609 factor 1.0->0.363 -> rally 0.419->0.146. VWAP load-bearing (not inert like the OBV add). Discard #5 architectural -> EXIT RULE (5 consecutive architectural).
de412448	0.6393	0.7454	0.2120	0.78	0.77	1.01	0.42	session-summary	session: 5 independent architectural discards (EXIT RULE at 5 consecutive architectural), 0 branches (none branch-worthy). Baseline de412448 UNCHANGED 0.6393 [bull 0.781251, crash 0.767586, sideways 1.013297, rally 0.419353 stab0.801; all factors 1.0]; strategy.py verified byte-identical + reproduces 0.639349 / rally 0.419353 / min_stab 0.800755. METHOD: read noise_test.py first-hand — stability = 1 - trimmed_mean(tracking_error)/clean_vol, base_seed=AST-hash(strategy.py); confirms uniform sizing is stability-NEUTRAL (te and clean_vol both scale -> ratio invariant) and rally fragility is GENUINE (marginal trades flip under AR(1) -> high per-trial te variance -> seed-sensitive 20-trial trimmed mean). EXPERIMENTS: (1) wide-range-bar (intrabar HL-range/ATR) entry-size atten [NEW orthogonal size signal, direction-agnostic size-down] -> crash+sideways BYTE-IDENTICAL, bull +0.0018, rally stab re-seed 0.636; entry-size channel SATURATED (intrabar-range is Nth orthogonal size signal inert on saturated survivors). (2) remove _churn_size_atten [simplification, redundancy-with-_tq_calm hypothesis] -> crash+sideways byte-identical, bull -0.0019 (MILDLY load-bearing, NOT redundant), rally stab re-seed 0.368->score 0. (3) add 8th OBV-slope voter [raw, weight 0.7, thresholds rescaled 8/7] -> bull -0.102, crash +0.0085, sideways flat, rally raw -0.030 but stab HELD 0.880 (factor 1.0, RAW-driven loss not seed). (4) confirmation-gated OBV [0.3x opposing ret_long, 1.0x agreeing] -> bull 0.679084 / crash 0.776135 / sideways 1.014 = NEAR-IDENTICAL to EXP3 DESPITE different OBV signal -> DECISIVELY FALSIFIES EXP3 causal reading: OBV directional CONTENT is INERT on strong regimes; the bull/crash deltas come from the 8/7 admission-THRESHOLD rescale, NOT OBV direction; rally re-seed 0.771. (5) remove VWAP voter [6 voters, thresholds 6/7] -> bull -0.034 (VWAP LOAD-BEARING for bull), crash +0.0085 (SAME nudge as EXP3/4 now under OPPOSITE 6/7-loosen direction), sideways flat, rally stab re-seed 0.609. CROSS-EXP CONCLUSIONS (load-bearing): (a) NEW/REFINES prior "remaining hope": a new VOTER SIGNAL CONTENT is INERT on the voter-saturated strong regimes (EXP3 vs EXP4 near-identical across different OBV signals) — they respond ONLY to the effective admission THRESHOLD (already-confirmed-saturated channel), and that response is NET-NEGATIVE (8/7 tighten cost bull -0.10; removing a voter cost bull -0.03/-0.10). So the prior-session flagged hope ("add a voter that fires more = strong-regime trade-set lever") is WEAKENED: voter content does not move saturated strong-regime trades; only threshold does, net-negative. (b) every component load-bearing reconfirmed: VWAP voter (-0.034 bull on removal), _churn_size_atten (-0.0019 bull). (c) crash raw shows a CONSISTENT +0.0085 nudge (0.7676->0.7761) under THREE different voter/threshold perturbations (8/7-tighten+OBV-add AND 6/7-loosen+VWAP-remove) -> crash high-conviction shorts robust to voter-set changes; the +0.0085 is an admission-margin artifact, NOT causally attributable to any specific voter (correlational only). (d) RECONFIRMED rally seed-fragility: 5 edits drew rally stab 0.636/0.368/0.880/0.771/0.609 (range 0.37-0.88 mean ~0.65, matches prior estimate); baseline 0.801 is a lucky top-of-range draw; composite dominated by rally-stab estimator variance at the 0.80 knee. (e) entry-size channel SATURATED (EXP1 intrabar-range byte-identical on strong regimes = Nth orthogonal size signal with no headroom). DIRECTION FOR FUTURE: voter-signal-add is now confirmed inert-on-content (only threshold moves strong regimes, net-neg) — do NOT expect strong-regime raw gains from new voters OR admission changes. de412448 remains a confirmed deep global optimum; all 5 reverted via git checkout -- strategy.py; results.tsv append-only intact.
-	-0.404035	-0.162349	0.483373	-0.03	0.10	0.26	-0.98	discard	ARCHITECTURAL trend-confirmation PYRAMIDING (within-trade hold-size growth): established winning+multi-day-trend-aligned holds grow beyond full size by up to +40%, churn-gated OFF in bursty rally/bull. composite 0.6393->-0.4040 CATASTROPHIC. ALL regimes collapsed: bull 0.781->-0.026 (Sh1.56->-0.03), crash 0.768->0.097 (Sh1.31->0.35), sideways 1.013->0.260 (Sh1.94->1.56), rally 0.419->-0.981. MaxDD exploded <2pct->~5pct ALL regimes (positions too big, rode reversals down). CONFIRMS prior L3 size-UP amplification is harmful: 'winning+trend-confirmed' at pyramid time is often near a local top (mean-revert), bigger size eats the giveback faster than pp/de-risk exits can shed it. NOT branch-worthy (no regime improved, fundamental not near-miss). Hold-size-up channel is NET-HARMFUL not just frozen. Discard #1 architectural.
-	0.389629	0.535084	0.290911	0.42	0.77	0.84	0.11	discard	ARCHITECTURAL exit-subsystem redesign: ATR(vol)-RELATIVE trailing replacing peak-profit-RELATIVE giveback normalization (trail dist = 0.8*ATR_pct*trend-widen, binary activation at peak>=0.8*ATR, lower/band fracs 0.5/0.6). composite 0.6393->0.3896. MEASURED: bull 0.781->0.421 (Sh1.556->1.085 COLLAPSE, stab0.810->0.706), crash 0.768->0.767 (Sh1.311->1.331 UP, stab0.974->0.978 ~flat score), sideways 1.013->0.840 (Sh1.941->2.067 UP, stab0.849->0.781), rally 0.419->0.112 (Sh0.736->0.657, stab0.801->0.591 re-seed). FINDING: ATR-relative trailing RAISES crash+sideways Sharpe (vol-consistent stop exits choppy/crash holds better) but COLLAPSES bull Sharpe (ATR trail mis-fits bull's vol/trend profile) AND drops stability broadly (binary peak>=K*ATR activation = new noise boundary). NOT branch-worthy (rally 0.112=27% of baseline breaches 50% gate; no regime SCORE improved; rally re-seed unrecoverable). Discard #2 architectural.
-	0.503230	0.670834	0.335207	0.78	0.77	1.01	0.12	discard	ARCHITECTURAL sample-sufficiency scale-out trim (4% partial reduce on winning established hold, profit>1*ATR, 10-bar cooldown, churn-gated OFF in bursty rally). PARTIAL REDUCES count as completed trades (prepare.py:573) -> targets sample_factor (bull/crash 43/45<50). composite 0.6393->0.5032. MEASURED: bull 0.781251 BYTE-IDENTICAL (trim NEVER fired in bull - holds dont reach 1*ATR profit or duration window), crash 0.767586->0.772753 (+0.005: trim fired, sample_factor up; Sharpe 1.311->1.301 slightly DOWN but +trades net POSITIVE), sideways 1.013297->1.014295 (+0.001), rally 0.419->0.115 (Sharpe 0.736->0.760 UP but stab 0.801->0.580 re-seed collapse). NEW VALIDATED LEVER: partial-REDUCE path raises crash score via num_trades - genuinely distinct from prior-session ENTRY-add attempts (which added 0 trades, positions held long). But crash gain tiny (+0.005), bull inert (didnt fire), rally re-seed 0.58 dominates. NOT branched (crash/sideways improved=eligible, but gains too small to absorb unrecoverable rally re-seed; documented 6 sessions). Discard #3 architectural.
-	0.373585	0.537480	0.327790	0.55	0.77	0.84	0.00	discard	ARCHITECTURAL ATR(vol)-relative trailing FLOOR (max with peak-relative pp; smooth tanh activation; trail 0.8*ATR*widen, lower/band 0.5/0.6). Combination of baseline-pp (keep for bull) + Exp eb4614d0 ATR concept (helped crash/sideways when REPLACING). composite 0.6393->0.3736. MEASURED: bull 0.781->0.549 (Sharpe 1.556->1.536 PRESERVED as hypothesized, but stab 0.810->0.710 - ATR floor added bull stability noise), crash 0.768->0.765 (~flat, ATR floor rarely binds), sideways 1.013->0.836 (Sharpe 1.941->1.830 DOWN - tightening hurt, did NOT reproduce Exp2 gain), rally 0.419->0.000 (Sharpe 0.736->0.839 UP but stab 0.801->0.423<0.50 -> factor 0). KEY LEARNING: Exp eb4614d0's crash/sideways Sharpe gain came from REPLACING peak-relative trail (specific exit TIMING) NOT from added tightness; a max()-FLOOR cannot reproduce it and adds broad stability noise. No regime score improved. Discard #4 architectural.
-	0.156029	0.473971	0.635884	0.73	0.77	1.01	-0.61	discard	ARCHITECTURAL 3-bar entry persistence (was 2-bar min over _hist): require strong-sum to clear persist floor across last THREE bars, filtering single+double-bar marginal noise-spike entries. composite 0.6393->0.1560. MEASURED: bull 0.781->0.726 (Sharpe 1.556->1.389 DOWN), crash 0.768 BYTE-IDENTICAL (Sh1.311, entries already sustained 3+ bars), sideways 1.013 BYTE-IDENTICAL (Sh1.941, sustained), rally 0.419->-0.611 (Sharpe 0.736->-0.611 NEGATIVE, but stability 0.801->1.000 ROSE). FUNDAMENTAL FINDING: the 3-bar gate DID structurally stabilize rally (stab 0.801->1.0, hypothesis correct) but rally Sharpe went NEGATIVE -> rally's profitable edge LIVES IN the marginal 2-bar-not-3-bar noise-sensitive entries; removing them for stability removes the alpha. Rally instability and profitability are ENTANGLED (not merely a seed artifact). crash/sideways high-conviction entries unaffected by persistence depth. No regime improved. Discard #5 architectural -> EXIT RULE (5 consecutive architectural).
de412448	0.6393	0.7454	0.2120	0.78	0.77	1.01	0.42	session-summary	session: 5 independent architectural discards (EXIT RULE at 5 consecutive architectural), 0 branches (only Exp3 was branch-eligible but gains too small vs unrecoverable rally re-seed). Baseline de412448 UNCHANGED 0.6393 [bull 0.781251 Sh1.556, crash 0.767586 Sh1.311, sideways 1.013297 Sh1.941, rally 0.419353 Sh0.736 stab0.801 = all factors 1.0; binding constraint rally]. strategy.py verified byte-identical to de412448 + reproduces 0.639349 / min_stability 0.800755. FIVE DISTINCT NEW mechanisms: (1) trend-confirmation PYRAMIDING (within-trade hold-size GROWTH on confirmed winners, churn-gated) -> composite -0.4040 CATASTROPHE, ALL regimes collapsed (bull Sh1.56->-0.03, rally -0.98), MaxDD <2pct->~5pct ALL. NEW: hold-size channel IS responsive for strong regimes (moved bull/crash massively) - refines the frozen claim (true for ENTRY-size, NOT for steady-state HOLD-size) - but size-UP is NET-HARMFUL (rides reversals). (2) ATR(vol)-relative trailing REPLACING peak-relative giveback -> composite 0.3896: crash Sh1.31->1.33 UP + sideways Sh1.94->2.07 UP, but bull Sh1.56->1.085 COLLAPSE + broad stab drop (binary activation), rally 0.112. (3) sample-sufficiency scale-out TRIM (4pct partial reduce = +num_trades, churn-gated) -> composite 0.5032: crash 0.7676->0.7728 (+0.005 via sample_factor - VALIDATED LEVER, partial-reduce path genuinely distinct from prior ENTRY-add attempts that added 0 trades), sideways +0.001, bull BYTE-IDENTICAL (trim never fired - holds dont reach 1*ATR profit/duration), rally re-seed 0.58. (4) ATR-trailing FLOOR (max with peak-relative, smooth activation) -> composite 0.3736: bull Sh PRESERVED 1.536 but stab dropped, sideways Sh DOWN 1.83, rally factor 0 - LEARNING: Exp2 gain was from REPLACING (exit TIMING) not tightness; max-floor cannot reproduce + adds stab noise. (5) 3-bar entry persistence (was 2-bar) -> composite 0.1560: rally STABILITY ROSE 0.801->1.000 (structural stabilization WORKS) but rally Sharpe -> NEGATIVE -0.611; crash/sideways BYTE-IDENTICAL; bull Sh down. CROSS-EXP CONCLUSIONS (load-bearing): (a) HOLD-SIZE channel responsive for strong regimes (Exp1) - distinct from saturated ENTRY-size - but size-UP net-harmful. (b) SAMPLE_FACTOR lever VALIDATED via partial reduces (Exp3 crash +0.005), genuinely new vs ENTRY-add; bull headroom (43->50 = +0.06 potential) UNTAPPED because trim didnt fire in bull (needs lower profit/duration threshold). (c) ATR-relative trailing RAISES crash+sideways Sharpe via exit TIMING when REPLACING (Exp2), NOT via tightness (Exp4 max-floor fails); but REPLACE collapses bull - open: bull-protected ATR-replace. (d) FUNDAMENTAL (Exp5, NEW): rally instability is INTRINSIC TO ITS ALPHA - 3-bar persistence raised rally stab to 1.0 but turned Sharpe NEGATIVE -> rallys profitable edge IS its marginal 2-bar noise-sensitive entries; cannot structurally stabilize rally without deleting its alpha. Deeper than seed-lottery framing. (e) crash/sideways byte-identical to persistence depth (high-conviction sustained 3+ bar entries). (f) rally downside re-seed draws 0.59/0.58/0.42 (Exp2/3/4); Exp1/5 rally stab stayed 1.0 but raw destroyed (different failure mode). DIRECTION FOR FUTURE: two levers with REAL signal but unsolved delivery against the rally wall: (1) bull-effective sample-trim (lower trim threshold to fire in bull, capture +0.06 sample_factor); (2) bull-protected ATR-trailing-REPLACE (keep crash/sideways Sh gain, avoid bull collapse). Both must absorb expected rally re-seed (~-0.05 composite). de412448 0.6393 remains a confirmed deep optimum; all 5 reverted via git checkout -- strategy.py; results.tsv append-only intact.
c30d6fef	0.516036	0.676896	0.321719	0.78	0.77	1.01	0.15	discard	ARCHITECTURAL persistent entry-conviction size cap: store entry-side conviction margin, cap scale-in ceiling at it for whole hold (new _entry_conv state, floor0.70/scale0.40 = first-bar atten extended). HYP: marginal entries held smaller -> lower tracking-error when noise-flipped -> rally stab up. RESULT composite 0.6393->0.5160 but raw_composite 0.6382~=0.6393 (FLAT, -0.001). bull 0.781251 + crash 0.767586 BYTE-IDENTICAL (their entries high-conviction, conv_cap~=1.0 never binds); sideways raw 1.012893 (-0.0004 flat); rally raw 0.4168 vs 0.4194 (-0.0025 flat). rally stab RE-SEEDED 0.801->0.605 factor 1.0->0.350 = mediocre draw within known {0.48-0.80} range. CONCLUSION: cap is no-op on raw (does NOT change rally tracking error) -> not a real stability lever, just re-rolled rally seed. NOT branched (tuning floor = rally seed lottery). Discard #1 architectural.
