commit	score	mean_score	std_score	bull_2021	crash_bear	sideways	rally_2024	status	description
f973f875	0.518586	0.534375	0.052631	0.583484	0.589240	0.471138	0.493639	branch	BRANCH OPEN (trend-aligned winner exit-threshold raise). Exp1 architectural indep: raise _exit_thresh for mature trend-aligned (ret_vlong-confirmed) in-profit positions -- targets the THRESHOLD itself (the binding exit channel), NOT time-pressure/pp-giveback (prior winner-hold attempts were byte-identical inert because crash exits via slope-against first). MEASURED vs cabfb6f1 0.605307: composite -0.086721 (0.518586), mean -0.099373, std -0.042171 (tighter). PER-REGIME: crash 0.575486->0.589240 (+0.013754 BINDING TARGET IMPROVED, Sh 1.263849->1.306656, DD 0.649->0.648 -- return-seeking WORKS for crash's persistent downtrend shorts), rally 0.511346->0.493639 (-0.017707, Sh 1.300->1.239, DD 1.57->1.71), bull 0.699048->0.583484 (-0.115564, Sh 1.864->1.428, DD 0.90->1.21 -- 2021 sharp corrections punished), sideways 0.749111->0.471138 (-0.277973, Sh 2.025->1.163 -- mean-reversion regime, bounces ARE reversals not noise). All stab 1.0, all MaxDD<10pct, no 50pct gate breach (sideways -37pct, bull -17pct). BRANCH HYPOTHESIS: gate too broad -- fires in sideways chop (low ER) and correction-prone bull. Fix: tighten to clean PERSISTENT trends only (high ER + strong multi-day ret_vlong + low vol-of-vol to exclude spiky corrections) so raise fires for crash-type persistent trends, not sideways/bull.
a1152516	0.529103	0.548963	0.066200	0.642114	0.575486	0.466899	0.511352	branch	branch step4: add high-vol gate to step3 (raise only in elevated-vol trends). MEASURED vs cabfb6f1 0.605307: composite -0.076204 (0.529103), raw 0.529103, mean -0.084785, std -0.028602. PER-REGIME: bull 0.699->0.642 (-0.057, Sh 1.864->1.641 -- recovering, vol gate excluded lower-vol phases), crash 0.575->0.575 (+0.000 GAIN VANISHED -- vol gate too restrictive, crash vol not always >1.1), sideways 0.749->0.467 (-0.282 STILL DESTROYED -- sideways 2023 recovery is elevated-vol AND strong-trend AND slope-confirmed, looks like a trend to all gates), rally 0.511->0.511 (+0.000 recovered to baseline, vol gate excluded low-vol rally). All stab 1.0. PROGRESS vs step3 raw 0.522->0.529 (+0.007). KEY FINDING: vol gate separates crash from rally (low-vol) but NOT from sideways (also elevated-vol). Sideways destruction is robust across all gates -- the only separator is path cleanliness (choppy vs clean), which is noise-sensitive (step2 ER gate broke sideways stability 0.52). Likely walled.
ddefc948	-999	-999	0	-999	-999	-999	-999	branch	branch step5: add R^2 path-cleanliness gate. CATASTROPHIC: composite -999 (hard cutoff breached -- crash Sharpe 1.264->-1.611, positions held far too long / DD blew past 10pct or lost >15pct). R^2 gate unstable in crash. Confirms the documented wall: path-cleanliness gates (ER step2, R^2 step5) are noise/behavior-unstable here.
-	-	-	-	-	-	-	-	discard	BRANCH SUMMARY (trend-aligned winner exit-thresh raise): REVERTED to cabfb6f1. Opened after Exp1 (architectural indep) showed crash +0.013754 (Sh 1.264->1.307) -- the binding target regime improved via a NEW mechanism (raising _exit_thresh itself, the binding exit channel, vs prior inert time-pressure/pp-giveback winner-hold attempts that crash exits before reaching). 5 branch steps. BEST raw 0.529103 (step4, vs baseline 0.605307 = -0.076). NEVER met keep criteria. ROOT CAUSE OF FAILURE: the hold-extension helps crash (persistent downtrend shorts) but DESTROYS sideways (-0.278 to -0.282 robustly across ALL gates). Sideways-2023 is an elevated-vol + strong-trend + slope-confirmed CHOPPY uptrend (recovery) -- it looks like a trend to every gate (ret_vlong alignment, slope-conf, vol, ER) but its swings mean-revert, so holding trend-winners longer catches reversals. The ONLY separator (path cleanliness: crash clean high-R^2 vs sideways choppy low-R^2) is NOISE/BEHAVIOR-UNSTABLE: step2 ER+vol gate broke sideways stability (factor 0.52), step5 R^2 gate catastrophic (-999, crash Sh->-1.61). CONCLUSION (correlational, not causal-promoted): crash and sideways are coupled on every smooth gate (both elevated-vol strong-trend); the hold-extension axis cannot separate persistent-trend (crash, benefits) from choppy-mean-reverting (sideways, destroyed) without an unstable cleanliness gate. This extends the documented winner-hold/return-seeking wall: the prior inert attempts failed because they targeted the wrong exit channel; targeting the threshold itself (the binding channel) DOES move crash (+0.014 verified) but the sideways coupling is the hard wall. Baseline UNCHANGED cabfb6f1 0.605307.
47bc5c7b	0.310311	0.362008	0.172323	0.599897	0.450217	0.223838	0.174079	discard	Exp2 (architectural, indep): SOFTMAX-BLENDED exit fusion (0.5*MAX + 0.5*weighted_mean). Hypothesis: MAX (chosen for the now-solved stability wall) is too aggressive, cuts trend winners on first single-source spike; blending with mean lets positions ride single-source noise -> more return. MEASURED vs cabfb6f1 0.605307: composite -0.294996 (0.310311), raw 0.336287, mean -0.271740, std +0.077521. PER-REGIME: ALL regressed -- bull 0.699->0.600 (Sh 1.864->1.488, DD 0.90->1.61), crash 0.575->0.450 (Sh 1.264->1.208, DD 0.65->3.13 TRIPLED), sideways 0.749->0.224 (Sh 2.025->0.625 DESTROYED), rally 0.511->0.174 (Sh 1.300->0.531, stability_factor 0.684 CRASHED, DD 1.57->2.82). min_stability 0.705. CONFIRMS MAX fusion is load-bearing: reducing exit pressure (mean < MAX) holds positions longer -> DDs rise (crash 3.13pct, rally 2.82pct) and Sharpe drops everywhere; rally stability re-crashes (the exact wall MAX was introduced to fix). Extends the 66-prior-experiment fusion saturation: under v2.1 scoring MAX remains correct (stability solved does NOT mean the noise-addition problem is gone -- mean-blend re-introduced it, dropping rally stability 1.0->0.684). No regime improved -> not branch-eligible. Baseline UNCHANGED cabfb6f1.
-	-	-	-	-	-	-	-	session-summary	SESSION (v2.1 baseline cabfb6f1 0.605307): 0 keeps + 1 exploration branch (5 steps, REVERTED) + 1 independent architectural discard = 2 architectural discards total. EXIT RULE: user-required minimum 2 architectural discards met; branch-conclusion rule (session ends after branch revert) also triggered. Baseline UNCHANGED cabfb6f1 0.605307 [bull 0.699048 Sh1.864, crash 0.575486 Sh1.264 WR100pct, sideways 0.749111 Sh2.025, rally 0.511346 Sh1.300; all stab 1.0, all raw==score]. KEY DIAGNOSTIC THIS SESSION: crash (100pct WR / 0.65pct DD / 3.2pct AnnRet) and sideways (98pct WR / 0.55pct DD / 3.5pct) are RETURN-LIMITED with enormous DD headroom (15x below 10pct cutoff) -- gain-locking exits too conservative. BRANCH (trend-aligned winner exit-thresh raise): targeted the THRESHOLD itself (the binding exit channel) vs prior inert time-pressure/pp-giveback winner-hold attempts. VERIFIED crash +0.013754 (Sh 1.264->1.307) on step1 -- the mechanism DOES capture more trend return. But walled: sideways destroyed (-0.278 robustly across ALL gates) because sideways-2023 is an elevated-vol + strong-trend + slope-confirmed CHOPPY uptrend (recovery) that looks like a trend to every smooth gate but mean-reverts. The only separator (path cleanliness R^2/ER) is NOISE-UNSTABLE (ER broke sideways stability 0.52; R^2 catastrophic -999). CONCLUSION (correlational): crash and sideways are coupled on every smooth gate -- the hold-extension axis cannot separate persistent-trend (crash, benefits) from choppy-mean-reverting (sideways, destroyed) without an unstable cleanliness gate. Exp2 (softmax-blended fusion): tested whether MAX (chosen for solved stability wall) is too aggressive for return; CONFIRMED MAX load-bearing (mean-blend re-crashed rally stability 1.0->0.684, tripled crash DD 0.65->3.13). SATURATION confirmed: fusion(66)/vol-scaling(60)/slope-atten(52)/harvest(56)/DD-circuit(25) prior mentions -- strategy at deep local optimum. NEW BASELINE: none (cabfb6f1 unchanged).
74804911	0.288848	0.397301	0.361513	0.468936	0.575485	0.749194	-0.204410	discard	Exp1 (architectural, indep): MULTI-WINDOW slope-confirmation gate on opp-gate FULL exit. When opp-gate full-exit path is about to fire (counter-trend OR losing, _grad_gate not engaged) but the 12/16/22-bar OLS _exit_slope mean still CONFIRMS the position (slope-with), downgrade full exit to graduated partial. Hypothesis: opp-voters+trend_avg sign flip while smooth slope unconfirmed = dead-cat/pullback spike not real reversal -> ride at partial -> more trend return in return-limited crash. MEASURED vs cabfb6f1 0.605307: composite -0.316459 (0.288848 CATASTROPHIC), mean -0.236447, std +0.266711. PER-REGIME: rally -0.715756 (0.511->-0.204, Sh 1.300->-0.204, MaxDD 1.57->3.01 BREACHED 50pct gate), bull -0.230112 (0.699->0.469, Sh 1.864->1.430, MaxDD 0.90->0.65), crash BYTE-IDENTICAL 0.575485 (Sh1.263845 -- opp-gate full-exit path rarely fires on crash shorts which are trend-aligned+profit -> graduated path, untouched), sideways -0.001517 (0.749->0.749 Sh2.025->2.025). All stab 1.0, all MaxDD<10pct (rally 3.01). FAILURE: mechanism is WRONG-DIRECTIONAL for rally+bull -- the multi-window slope LAGS real reversals by construction (3-window OLS mean is SLOW), so 'ride while slope unconfirmed' holds rally pullback shorts and bull longs THROUGH the genuine reversal that IS their risk, not just through dead-cat spikes. Same family as the documented winner-hold/exit-thresh-raise wall (sideways coupling + slope-lags-reversal). No credible smooth-gate fix: separating dead-cat-bounce from real pullback-reversal on the slope signal alone is the documented noise-unstable/catastrophic axis (prior R^2/ER cleanliness gates). Smaller magnitude = weaker wrong-direction effect, not a fix. Not branch-eligible (rally breached 50pct gate; mechanism wrong-directional for binding regime at any magnitude). Architectural discard #1. Reverted to cabfb6f1 via git checkout -- strategy.py.
696385f9	0.490044	0.535392	0.151161	0.315962	0.576079	0.737944	0.511582	branch	BRANCH OPEN (deep-peak x slope-confirmed de-risk floor relaxation, return-seeking). Exp2 architectural indep: relax _de_floor by up to 0.10 for deep-peak (peak>2.5*_pp_min) x slope-still-confirming (_dr_slope_conf) x in-profit winners. Hypothesis: crash (persistent downtrend, DEEP peaks) is distinguished from sideways-2023 (chop, SMALL peaks) by peak MAGNITUDE -- the one statistic trend-gates cannot separate (prior exit-thresh-raise branch walled on crash-sideways coupling). Relaxing the de-risk floor rides small giveback to capture more crash trend return; small-peak sideways excluded by deep-peak gate; rally pullback longs protected by slope-conf gate (slope weakens in pullbacks). MEASURED vs cabfb6f1 0.605307: composite -0.115263 (0.490044), mean -0.098356, std +0.056359, min_stability 0.874->0.740. PER-REGIME: crash 0.575486->0.576079 (+0.000593 TARGET REGIME IMPROVED as hypothesized, Sh1.263845->1.265698 -- the mechanism DOES capture more crash trend return), rally 0.511346->0.511582 (+0.000236 PROTECTED by slope-conf gate as hypothesized, Sh1.300->1.301), sideways 0.749111->0.737944 (-0.011167 small-peak leak -- some sideways peaks cross 2.5x), bull 0.699048->0.315962 (-0.383086 CATASTROPHIC, Sh1.864->1.199, MaxDD 0.90->1.63, stability_factor 1.0->0.801). All MaxDD<10pct. FAILURE: peak-magnitude separates crash from SIDEWAYS (small-peak chop) but NOT from BULL -- bull-2021 grinding-top longs ALSO have deep peaks + persistently-confirming slope (until the Oct-2021 correction), so the gate fired on bull longs -> held them through sharp corrections -> bull collapsed (stability 0.80 = position-value wobble under noise from the relaxed floor). Same coupling wall as exit-thresh-raise branch, reached via bull instead of sideways.
-	0.531890	0.567496	0.118689	0.430469	0.575471	0.752814	0.511232	branch	branch step2: tighten deep-peak threshold 2.5->4.0 (exclude bull grinding-top moderate peaks, keep only crash deepest persistent-downtrend peaks). MEASURED vs step1 0.490044: composite +0.041846 (0.531890 improved), mean +0.032104, std -0.032472. PER-REGIME: bull 0.316->0.430 (+0.114 partly recovered but still -0.269 vs baseline, stability_factor 0.799, Sh1.49 vs 1.864 -- STILL broken), sideways 0.738->0.753 (+0.015 recovered ABOVE baseline), rally 0.511->0.511 (flat protected), crash 0.576079->0.575471 (-0.000608 -- the crash GAIN VANISHED; the deepest-peaks-only gate excludes the crash trades that benefited at 2.5). WALL CONFIRMED: at thresh2.5 crash+0.0006 but bull -0.383; at thresh4.0 bull partly recovers but crash gain gone + bull stability still 0.799. No threshold value both preserves bull AND captures crash -- bull and crash share the deep-peak x slope-conf region (bull grinding-top longs vs crash persistent-downtrend shorts are indistinguishable on peak magnitude + slope confirmation). The deep-peak separator distinguishes crash from sideways (chop, small peaks) but NOT from bull (grinding top, deep peaks). Same documented crash-bull/sideways coupling wall on the return-seeking exit axis.
-	-	-	-	-	-	-	-	discard	BRANCH SUMMARY (deep-peak x slope-confirmed de-risk floor relaxation): REVERTED to cabfb6f1. Opened after Exp2 (architectural indep) showed crash +0.000593 (target binding regime improved) + rally protected (+0.000236) via the slope-conf gate -- the peak-magnitude separator hypothesis worked for crash-vs-sideways. 2 branch steps. BEST composite 0.531890 (step2, vs baseline 0.605307 = -0.073). NEVER met keep criteria. ROOT CAUSE OF FAILURE: peak MAGNITUDE (the proposed separator from the sideways coupling wall) distinguishes crash from SIDEWAYS (chop = small peaks) but NOT from BULL (bull-2021 grinding-top longs have deep peaks + persistently-confirming slope until the Oct-2021 correction). At threshold 2.5: crash +0.0006 (target met) but bull -0.383 (catastrophic, stability 0.80). At threshold 4.0: bull partly recovers (-0.269, stability still 0.799) but crash gain vanishes (-0.000015). No threshold both preserves bull AND captures crash -> bull and crash are coupled on the deep-peak x slope-conf surface. CONCLUSION (correlational): the return-seeking exit-axis wall (prior exit-thresh-raise branch) is NOT specific to the threshold-raising mechanism -- it reproduces via the de-risk FLOOR relaxation mechanism too, confirming the wall is at the SUBSYSTEM level (any 'hold trend winners longer' lever couples crash persistent-downtrend to bull grinding-top, because both are deep-peak + slope-confirming trend winners that diverge only AFTER a correction the smooth gates cannot foresee). Extends the documented return-seeking-exit-axis dead-end family from threshold-raising to floor-relaxation. The binding crash return (100pct WR / 0.65pct DD / 3.2pct AnnRet, huge DD headroom) remains unconquered via the exit-hold axis. Reverted to cabfb6f1. Session ends (branch concluded).
-	-	-	-	-	-	-	-	session-summary	SESSION (v2.1 baseline cabfb6f1 0.605307): 0 keeps + 1 independent architectural discard (Exp1) + 1 exploration branch (Exp2 deep-peak de-risk floor relaxation, 2 steps, REVERTED) = 2 architectural discards total. EXIT: branch-conclusion rule (session ends after branch revert); user-required 2-architectural-discard minimum met. Baseline UNCHANGED cabfb6f1 0.605307 [bull 0.699048 Sh1.864, crash 0.575486 Sh1.264, sideways 0.749111 Sh2.025, rally 0.511346 Sh1.300; all stab 1.0, all raw==score]. THEME: probed the binding RETURN-LIMITED exit axis (crash 100pct WR / 0.65pct DD / 3.2pct AnnRet = huge DD headroom, gain-locking too conservative) via two genuinely-novel mechanisms, each NOT in a prior dead-end family by construction. INDEPENDENT DISCARD: (1) Exp1 MULTI-WINDOW slope-confirmation gate on opp-gate FULL exit (downgrade full-exit to graduated when 12/16/22-bar OLS _exit_slope mean still confirms position): composite -0.316 CATASTROPHIC, rally -0.716 (Sh -0.20, DD 1.57->3.01 BREACHED 50pct gate), bull -0.230, crash BYTE-IDENTICAL, sideways -0.002. WRONG-DIRECTIONAL: the multi-window slope LAGS real reversals by construction, so 'ride while slope unconfirmed' holds rally pullback shorts + bull longs THROUGH the genuine reversal that IS their risk. Same family as winner-hold/exit-thresh-raise wall (slope-lags-reversal). Not branch-eligible (rally breached 50pct gate; wrong-directional at any magnitude). BRANCH (deep-peak x slope-confirmed de-risk FLOOR relaxation): the prior exit-thresh-raise branch walled on crash-SIDEWAYS coupling (both look like trends to every gate). This tested whether peak MAGNITUDE (deep peaks = persistent trend; small peaks = chop) is the separator the trend-gates lack. Exp2 step1 (thresh2.5): crash +0.000593 (TARGET improved as hypothesized) + rally +0.000236 (PROTECTED by slope-conf gate as hypothesized) + sideways -0.011 (small-peak leak) BUT bull -0.383 CATASTROPHIC (stability 0.80). Peak-magnitude separates crash from sideways (small-peak chop) but NOT from bull (grinding-top longs also deep-peak + slope-confirming until the Oct-2021 correction). step2 (thresh4.0): bull partly recovered (-0.269, stability still 0.799) BUT crash gain vanished (the deepest-peaks-only gate excluded the benefiting crash trades). WALL: no threshold both preserves bull AND captures crash -> bull+crash coupled on the deep-peak x slope-conf surface. CROSS-SESSION CONCLUSIONS (all measured this session): (a) the return-seeking EXIT-HOLD axis wall is NOT specific to threshold-raising -- it REPRODUCES via the de-risk FLOOR relaxation mechanism, confirming the wall is at the SUBSYSTEM level (any 'hold trend winners longer' lever couples crash persistent-downtrend to bull grinding-top, because both are deep-peak + slope-confirming trend winners that diverge only AFTER a correction the smooth gates cannot foresee); (b) peak MAGNITUDE is a REAL separator of crash from SIDEWAYS (chop=small peaks) but NOT from BULL (grinding-top=deep peaks) -- a NEW partial-separator finding (peak magnitude is NOT a universal trend-quality axis; it distinguishes persistent-trend from chop but not persistent-trend from late-stage-grinding-top); (c) the multi-window exit-slope LAGS real reversals (3-window OLS mean is SLOW), so any 'hold while slope unconfirmed' gate is wrong-directional for pullback-prone regimes (rally/bull) -- extends the slope-lags-reversal dead-end family from single-16bar to multi-window-mean. The binding crash return (huge DD headroom) remains unconquered via the exit-hold axis; both mechanisms failed in ways consistent with the documented dead-end families (slope-lags-reversal / return-seeking-exit-axis-coupling-wall). results.tsv append-only preserved (path-scoped git checkout -- strategy.py throughout, never git revert); all experiments reverted to cabfb6f1. EXIT: 0 keeps, 2 architectural discards (>=2 required, satisfied) + 1 reverted branch, baseline cabfb6f1 0.605307 unchanged.
5c3e8eb1	0.605307	0.633748	0.094802	0.699048	0.575486	0.749111	0.511346	discard	Exp1 (architectural, indep): COUNTER-TREND-LONG HARD take-profit. NEW exit control-flow path: full exit at modest ATR-scaled gain (~1.2pct, clamped 0.008-0.020), gated ct-long (current_pos>0 AND ret_vlong<-0.01 = crash bounce longs). Hypothesis: crash bounces are MODEST winners whose peaks stay BELOW _pp_min (2.5pct), so Exp4 (ct-long max_hold) and Exp5 (ct-long pp-giveback) were byte-identical inert (pp_pressure=0 / time never engages); a hard TP at ~1.2pct (BELOW pp_min) is a level modest winners REACH -> fires where pp/time levers do not. ct-long gate (ret_vlong<-0.01) is the ct-DIRECTION separator the deep-peak de-risk branch LACKED (it gated deep-peak x slope-conf -> caught bull grinding-top longs -> bull -0.383); ret_vlong<-0.01 cleanly excludes bull (ret_vlong>0). MEASURED vs cabfb6f1 0.605307: BYTE-IDENTICAL (composite 0.605307, all 4 regimes identical, all stab 1.0, min_stability 0.820149). Completely INERT: the hard TP never alters a crash trade. 4th confirmation (after Exp4 max_hold, Exp5 pp-giveback, and the single-exit-path-inert-for-crash conclusion) that crash's exit path is structurally hard to shift: crash bounce longs exit via slope-against / adverse-recovery BEFORE pos_pnl reaches even a modest +1.2pct gain (peaks below the TP level), so a hard TP at any modest level is inert. crash AnnReturn 3.2pct over 52 trades with 6.5pct-base positions means per-trade pos_pnl peaks are small. Not branch-eligible (byte-identical, no regime improved, no firing mechanism to iterate -- lowering the TP level below typical noise would fire on noise, and raising it moves toward the inert pp_min region). Architectural discard #1. Reverted to cabfb6f1 via git checkout -- strategy.py.
