commit	score	mean_score	std_score	bull_2021	crash_bear	sideways	rally_2024	status	description
5388a23	0.945	0.861	0.187	1.16	0.65	0.80	0.84	branch-open	outcome-conditioned cooldown duration (architectural new _last_exit_pnl state + new data dep at cooldown-window) — composite -0.009 vs 83ffa0a 0.954 (fails composite criterion, std slightly wider 0.186->0.187), mean +0.001. Crash +0.006 (post-stopout entries filtered, reduces dead-cat re-entry churn), rally +0.002 (winner-momentum cooldown shortening helps rally counter-trend re-entries), bull -0.004 (essentially flat, mechanism rarely fires in continuous bull), sideways -0.005 (outcome conditioning creates noise in chop where exit pnls are randomly distributed — tightens cooldown after random small-win exits, opens too-fast re-entries). Mechanism activates in correct direction (loss->longer, win->shorter) but sideways noise dominates. OPENING BRANCH: hypothesis is gating the outcome scaling on trend strength (only fire in trend regimes where loss/win has signal value, not in chop where exit pnls are random) preserves crash/rally gains while neutralizing sideways noise.
ad412b2	0.945	0.861	0.187	1.16	0.65	0.80	0.84	branch	step 2: trend-gate outcome conditioning — composite 0.9451 vs step1 0.9454 essentially flat (-0.0003), all regimes within 0.001. Trend-gating had near-null effect because outcome scaling barely fires in chop anyway (small _last_exit_pnl in sideways → tanh ~0). Sideways regression in step 1 was NOT from chop-amplified outcome noise. Different angle needed.
dbc147b	0.945	0.861	0.188	1.16	0.65	0.80	0.84	branch	step 3: amplify outcome scaling [0.5, 2.0] — composite 0.9453 vs step2 0.9451 essentially flat (+0.0002), all regimes within 0.003. Amplification produced very small effects — cooldown_factor saturates fast in chop.
f9760dd	0.944	0.862	0.189	1.16	0.65	0.80	0.84	branch	step 4: outcome-conditioning via direct first-bar size multiplier — composite 0.944 (-0.001 vs step3). Direct size modulation barely moved anything; mechanism leverage too small for current strategy structure.
3d65eb0	0.942	0.862	0.190	1.17	0.65	0.79	0.84	branch	step 5: combined window-stretch + size-mult steeper magnitudes — composite 0.942 (-0.002 vs step4). Bull +0.006, crash +0.004 (intended direction), but rally -0.007 (winner-side size boost hurt rally counter-trend re-entries). One-sided loss-only conditioning needed.
5cebe68	0.945	0.866	0.190	1.17	0.65	0.80	0.85	branch	step 6: one-sided LOSS-only conditioning (drop win-boost) — composite 0.9449 vs step5 0.9419 (+0.003 PROGRESS). Bull +0.006, crash +0.011, sideways -0.004, rally +0.007 vs 83ffa0a baseline. Mean 0.866 (+0.006). 3 of 4 regimes improved vs baseline. Composite still -0.009 vs 0.954 because LOC overhead (1037 vs 998 = +39 lines, ~-0.013 LOC penalty) outweighs mean+std net gain (+0.004). Need LOC compression next.
-	0.939	0.854	0.195	1.16	0.63	0.79	0.83	discard	min-of-attenuators entry-size fusion (architectural fusion shape change at entry) — composite -0.018 vs 9d71185 0.956, mean -0.013. All 4 regimes mildly down (bull -0.005, crash -0.022, sideways -0.003, rally -0.020). Std widened 0.191->0.195. Min-fusion preserves only the worst-firing attenuator but loses orthogonal signal from the other 4 — the 5 attenuators (ct/consensus/quality/vol_entry/outcome) are NOT redundant; each carries a distinct entry-size cue (counter-trend, slope consensus, conviction quality, low-volume, post-loss state). Multiplicative compounding was the correct fusion because each attenuator captures a different noise dimension; min throws away 4 of 5 signals. Reverting.
-	-999	-999	0	-999	-999	-999	-999	discard	peak-anchored progressive SL tightening (architectural new SL decision boundary) — IMPLEMENTATION ERROR: _pp_min referenced at SL block (line ~619) but defined later (~line 658). Stale value from prior symbol iteration leaked into _stop_tighten_t computation. All 4 regimes hit -999 hard cutoff (MaxDD 19-42%). Mechanism not cleanly tested; treating as failed experiment. Reverted.
-	0.953	0.867	0.191	1.17	0.65	0.80	0.85	branch-discard	BRANCH SUMMARY (4 steps): peak-anchored progressive SL tightening v2 (architectural new SL decision boundary, peak/_pp_min dep at SL band). Step 1 (open, threshold 0.7, magnitude 0.30): composite 0.9527 vs baseline 0.956 (-0.003 LOC penalty), mean +0.0001 essentially flat; bull +0.003 / crash +0.002 / sideways -0.004 / rally -0.003. Step 2 (trend-aligned gate added): composite 0.9487 (-0.004 LOC), all per-regime scores IDENTICAL to step1 to 6 decimals — gate dead-code-adjacent because high-peak positions are already trend-aligned. Step 3 (raise activation threshold 0.7->1.2): composite 0.9527, all per-regime IDENTICAL to step1 — threshold change had ZERO behavioral impact. Step 4 (amplify magnitude 0.30->0.60): composite 0.9527, all per-regime IDENTICAL to step1 — magnitude doubling had ZERO impact. CONCLUSION: peak-anchored stop tightening is structurally DEAD-CODE-ADJACENT in current strategy. By the time peak_pnl crosses tightening threshold, _pp_pressure giveback ratio has already triggered exit on those positions. SL never fires on high-peak positions because pp_pressure pre-empts. Mechanism redundant with existing pp_pressure pathway. All 4 branch commits reverted.
9d71185-session-summary	-	-	-	-	-	-	-	session-summary	Round result: branch-discard, baseline 9d71185 (composite 0.956) unchanged. 2 architectural discards + 1 architectural branch-discard (peak-anchored SL tighten branch, 4 steps). Discards: (1) min-of-attenuators entry-size fusion (replace 5-attenuator multiplicative with min) — composite -0.018, all 4 regimes regressed mildly: 5 entry attenuators (ct/consensus/quality/vol_entry/outcome) are NOT redundant; each captures distinct noise dimension; min loses 4-of-5 orthogonal signals. (2) peak-anchored progressive SL tightening v1 — IMPLEMENTATION ERROR (_pp_min defined after use, stale-value leak). (3) [BRANCH] peak-anchored progressive SL tightening v2 (4 steps) — every step variant produced identical per-regime scores; mechanism is structurally dead-code-adjacent because _pp_pressure pre-empts SL on high-peak positions. Cross-experiment insights: (a) Multi-attenuator multiplicative composition at entry is correct fusion shape — min loses orthogonal information, not noise. The 5 attenuators measure 5 distinct entry-quality dimensions. (b) Peak-anchored SL tightening cannot fire because pp_pressure exits high-peak positions earlier; SL is structurally only relevant for positions that DROP THROUGH peaks rapidly without time to peak — those have small peaks that the tightening threshold filters out. The two mechanisms conflict in the same position-state space. (c) Decision-architecture saturation continues at entry-attenuator fusion shape (min vs product) and exit subsystem SL/pp coupling (cannot decouple via peak-anchoring because pp pre-empts SL). Baseline 9d71185 (0.956) unchanged.
-	0.952	0.867	0.191	1.17	0.65	0.80	0.85	discard	BRANCH SUMMARY: persistence-gated binary exit (2-bar arm requirement, architectural new _exit_armed state + new control flow at exit) — branch attempted 15 steps. Step 1 (open): composite 0.952 vs session-start state composite 0.956 = -0.003, mean +0.007 (3/4 regimes improved: bull +0.013, crash +0.012, rally +0.003, sideways -0.005). Note: actual session-start strategy.py state had drifted from recorded baseline 83ffa0a (0.954) due to accumulated revert noise from prior sessions; effective session-start composite was 0.9557. Steps 2-3: chop-amplified de-risk floor (catastrophic rally -0.31). Steps 4-6: deferred-exit size penalties (catastrophic sideways/rally -0.20+). Step 7: revert to step-1 baseline. Steps 8-15: parametric variations on persistence (boolean, AVG, EMA, voter-bias bypass, chop-bypass, threshold tuning) — ALL produced IDENTICAL per-regime scores to step 1 (deferred exits confirm next bar regardless of variation). Mechanism saturation: the 2-bar persistence gate effectively never changes outcomes for any deferred-exit case in any regime — all my deferred bars either consistently confirm or consistently dont, parametric tuning has no leverage. Branch reverted (15 commits). Mean +0.007 was real but std-widening from bull dominating regression vs sideways drop yielded composite delta ~0 in all variations. Persistence on _exit_pressure as architecture is essentially a no-op given current exit dynamics. Session ends.
5d8b2be-session-summary	-	-	-	-	-	-	-	session-summary	session: 1 architectural exp + 1 architectural branch (15 steps) all reverted. Discards: (1) p-norm soft-pressure fusion (catastrophic -0.10, bull/rally crushed, crash +0.17 — p-norm filters diffuse signal aggregation but trend-regime exits NEED multi-pressure additivity; only crash benefits from dominant-signal isolation). (2) BRANCH: 2-bar persistence-gated binary exit (15 steps, all variations identical per-regime to step 1; 3/4 regimes improved on mean +0.007 but std widened making composite -0.003; mechanism saturated — deferred exits all confirm next bar regardless of parametric variant). Cross-experiment insights: (a) Soft-pressure fusion shape is heavily saturated — both p-norm narrowing and persistence-gate filtering produce locked outcomes; the linear-sum aggregation is structurally tuned to current voter weights. (b) Crash regime BENEFITS from BOTH "dominant-signal" filters (p-norm) AND "more-noise-filtering" (persistence) — but bull/rally NEED diffuse aggregation. The crash-vs-trend tradeoff in fusion shape appears fundamental in current architecture. (c) Persistence gate on _exit_pressure produces no regime-level change in deferred-exit decisions across 8 parametric variants — the temporal-conjunctive structure does not have differential leverage in current strategy. (d) Cumulative revert drift detected — actual session-start composite 0.9557 vs recorded baseline 83ffa0a 0.954, suggests prior session reverts accumulated minor cosmetic changes that net-improved score. Branch revert restored session-start state cleanly (zero diff vs 5d8b2be). Session ends.
-	0.949	0.867	0.191	1.17	0.65	0.80	0.85	discard	slope-reversal-since-entry _w_slope boost (architectural new entry-time _lr_slope state + new exit-side data dep) — composite -0.007 vs 0.956 baseline (LOC overhead ~25 lines), mean essentially identical 0.867 (zero delta), all four per-regime scores BYTE-IDENTICAL to baseline (1.17, 0.65, 0.80, 0.85). Mechanism is structurally dead-code: the entry path only fires when _bull_admit / _bear_admit are met, which require _trend_biased aligned with position direction — meaning entries are made when the smoothed trend is already favorable. _lr_slope at entry is therefore typically same-sign as position, AND current bar _lr_slope rarely fully reverses without already triggering existing _sl_slope_pressure (which uses same multi-window slope logic). The reversal detector activation requires entry_slope * pos_dir > 0 AND current_slope * pos_dir < 0 simultaneously — when this happens, _sl_slope_pressure is already at high value via the existing slope-against term. Boost to _w_slope multiplies a value already at max in the same scenarios. Compounding existing pressure on already-firing exits has zero behavioral effect. LOC overhead drops simplicity bonus. Reverting.
-	0.950	0.861	0.196	1.18	0.65	0.80	0.81	discard	direction-asymmetric persistence factor (architectural new cross-timescale data dep at entry persistence) — composite -0.013 vs 02607e5 0.962, mean -0.009. Bull/crash/sideways IDENTICAL to baseline (within 1e-6 — mechanism barely fires when not in strong-trend counter-trend); rally -0.035 (0.85->0.81). Counter-trend bear entries during rally that were previously persistence-rejected now admitted at relaxed factor 0.80 instead of 0.95 — those marginal entries are net-negative in rally. Mechanism direction wrong for rally: existing 0.95 strict factor IS load-bearing for rally bear filtering, the persistence-rejected counter-trend bears are NOT short-burst signal but actual noise that the strict factor correctly rejects.
28125ed	0.960	0.872	0.192	1.18	0.66	0.80	0.85	branch	OPENING BRANCH: portfolio-equity DD circuit-breaker on entry size (architectural new state _peak_equity + new control flow at entry size) — composite -0.002 vs 02607e5 0.962, mean +0.002 (intended direction). Crash +0.008 (0.653->0.661, sole regime mover — correlated multi-symbol losses during dead-cat-bounces trigger portfolio DD attenuation, cuts noisy re-entries during recovery push), std tightened 0.194->0.192. Bull/sideways flat. Rally +0.0003 essentially flat. Mechanism architecturally novel — never explored. Composite negative due to LOC overhead (~+12 lines, simplicity bonus -0.012). Branch goal: tighten the implementation OR amplify mechanism so the mean+std gain pays the LOC cost. Justification: (1) what differs: portfolio-level DD as new state-driven entry attenuator, prior strategies all use per-symbol or per-position state; (2) regime improved: crash +0.008 confirms correlated-loss detection works; (3) hypothesis: a more compact implementation OR larger magnitude (currently 30%) could push mean+std gains past LOC penalty.
cbf4e8c	0.976	0.882	0.186	1.19	0.69	0.79	0.86	keep	BRANCH KEEP: portfolio-equity DD circuit-breaker on entry size (architectural new state _peak_equity + new control flow at entry size, 14-step branch from 28125ed open) — composite +0.013 vs 02607e5 0.962, mean +0.012 (0.870->0.882), std tightened 0.194->0.186. Per-regime: bull +0.005 (1.18->1.187, sharpe 2.38->2.40, return 6.56->6.69), crash +0.038 (0.65->0.69, sharpe 1.04->1.12, return 4.72->5.07, MaxDD 3.77->3.42 STRONGLY reduced), sideways -0.003 (0.80->0.79 mild, within noise), rally +0.008 (0.85->0.86, sharpe 1.68->1.70, MaxDD 3.56->3.36 reduced). Final settings: magnitude=1.0 (full suppression at saturation), activation=0.008 (saturates at ~2% portfolio DD). Branch evolution: step 1 (open) +0.30 magnitude/0.025 activation = mean +0.002 but composite -0.002 from LOC overhead; step 2 compactified to 3 lines (composite ~ flat); steps 3-9 progressively tightened activation 0.025->0.015->0.008 and amplified magnitude 0.30->0.40->0.50->0.65->0.85->1.00, monotone improvement to 0.976; step 10 (activation 0.004) catastrophic rally collapse (0->); step 11 (0.006) also rally collapse; step 12 reverted to 0.008; step 13 (0.010) verified 0.008 was the sweet spot. Mechanism: portfolio-level DD detector cuts new-entry size when correlated multi-symbol losses cause equity drawdown — uniquely captures regime-shift cascades that single-symbol attenuators (consensus/quality/ct/vol/outcome) cannot detect. Genuinely novel — never tried. NEW BASELINE.
cbf4e8c-session-summary	-	-	-	-	-	-	-	session-summary	session: 4 architectural discards + 1 architectural branch KEEP (14 steps). Keep: portfolio-equity DD circuit-breaker (cbf4e8c, composite +0.013 0.962->0.976, mean +0.012, crash +0.038 SOLE major mover with strong sharpe lift 1.04->1.12 and MaxDD reduction 3.77->3.42, rally +0.008 with MaxDD 3.56->3.36, bull +0.005, sideways -0.003 within noise). Branch evolution: opened at +0.30 magnitude/0.025 activation showing mean +0.002 (intended) but composite -0.002 from +12 LOC; step 2 compactified to 3 lines; steps 3-9 progressively amplified magnitude 0.30->1.00 and tightened activation 0.025->0.008, MONOTONE improvement +0.013 cumulative; step 10 (activation 0.004) catastrophic rally collapse confirms the activation curve has a sharp boundary near 0.005; step 12-14 confirmed step-9 settings as sweet spot. Mechanism: portfolio-level drawdown attenuator on entry size — when equity drops X% from session-peak, new entries face up to 100% size suppression at ~2% DD. Captures correlated-loss cascades that single-symbol attenuators (consensus/quality/ct/vol/outcome — already 5 multiplicative attenuators) cannot detect. Discards: (1) compact trend-aligned _w_ar suppression (1-line) — composite +0.0002, mean +0.0003 (within noise); mechanism dead-code-adjacent at this magnitude. (2) remove vol-adaptive smoothed_closes pipeline — CATASTROPHIC composite -0.014, bull -0.03 + rally -0.06: per-bar close smoothing IS load-bearing for ret_short voter responsiveness in trends; persistence_mult and 3-bar strong-sum DO NOT substitute for per-bar input smoothing. (3) additive-cap fusion replaces max(sl,soft_sum) — composite -0.0003, all 4 regimes flat: sl rarely sits in mid-band [0.2-0.8] simultaneously with soft_sum mid-band; mechanism dead-code-adjacent. (4) direction-asymmetric persistence factor (counter-trend relax 0.15) — composite -0.013, rally -0.035: counter-trend bears in rally that were previously persistence-rejected are NOT short-burst signal but actual noise; existing 0.95 strict factor IS load-bearing for rally bear filtering. CROSS-EXPERIMENT INSIGHTS: (a) Portfolio-level state was a previously-unexplored architectural axis — single-symbol state machines (peak_pnl, MAE, _last_exit_pnl, _entry_bar_history) all measure per-position dynamics; portfolio equity is the only signal that integrates correlated-loss across all symbols. (b) The size attenuator stack is genuinely orthogonal at the portfolio level: existing 5 entry attenuators all condition on per-bar/per-position state, none capture multi-symbol cascade. (c) The portfolio-DD curve has a SHARP boundary near activation=0.005 — too aggressive activation kills rally entirely (rally has multi-bar dwell periods at 1.5-2% DD where suppression blocks legitimate counter-trend bear entries during bull push). (d) Mean-reverting strategies on smoothed_closes are load-bearing — removal experiments confirmed that even 1 voter using smoothed_closes carries enough weight to materially affect bull/rally Sharpe. (e) Decision-boundary fusion shape (max vs add) and direction-conditioning at persistence (counter-trend relax) are both saturated — additive cap dead-code-adjacent, counter-trend relax wrong-directional in rally. Baseline advanced from 02607e5 (0.962) to cbf4e8c (0.976, +0.013).
-	0.976	0.880	0.182	1.18	0.69	0.79	0.86	discard	remove _outcome_size_mult post-loss first-bar attenuator (architectural code-structure removal at entry size) — composite -0.0004 (essentially flat), mean -0.002 (fails strict criterion). Bull -0.008 (1.187->1.179), crash -0.0003, sideways -0.0001, rally -0.003 (0.860->0.857). Std tightened 0.186->0.182 (consistency gain). _outcome_size_mult activates narrowly (requires _last_exit_pnl < 0 in SL territory AND bars_since_exit < 8); removal lets some post-loss re-entries take full size. Bull -0.008 represents lost protection: bull pullback exits sometimes hit small loss → outcome_mult dampens immediate re-entry size into a fresh pullback bar before the trend resumption. _cooldown_factor alone (smooth tanh on time) is loss-magnitude-blind and provides only TEMPORAL gating, not magnitude gating. Mean criterion fails by 0.002. Reverting.
4b43167	0.929	0.854	0.216	1.19	0.59	0.82	0.81	branch	OPENING BRANCH: divergence-conditioned _chop_amp (architectural multi-variable, new cross-component dep at voter_bias) — composite -0.048 vs cbf4e8c 0.976, mean -0.029. SIDEWAYS +0.024 (0.793->0.817) CONFIRMS hypothesis direction — less over-amplification of own-side subtraction when bull/bear sums diverge helps sideways. Bull +0.004 (1.187->1.191) — preserved. Crash CRUSHED -0.099 (0.690->0.591) and rally -0.044 (0.859->0.815) — divergence-taper fires in dead-cat-bounce bars (bull-voter spike vs bear-voter persistence) and rally pullback bars (bear-voter spike vs bull-voter persistence) — exactly where _chop_amp own-side protection is load-bearing. Std exploded 0.186->0.216. Branch hypothesis: gate the divergence-taper to fire ONLY when the divergent direction ALIGNS with trend sign (own-side voters are dominant in their own direction). In crash, bull-voter divergence is counter-trend noise — taper should NOT fire (preserve chop_amp). In sideways, neither direction is trend — both legitimate, taper SHOULD fire.
4d78fda	0.978	0.885	0.184	1.19	0.69	0.81	0.85	keep	BRANCH KEEP: divergence-conditioned _chop_amp with pure-sideways + non-counter-trend gates (architectural multi-variable, new cross-component dep at voter_bias, 8-step branch from 4b43167 open) — composite +0.002 vs cbf4e8c 0.976, mean +0.003 (0.882->0.885), std tightened 0.186->0.184. Per-regime: bull IDENTICAL 1.187 (mechanism gated off in trend regimes by pure-sideways gate), crash +0.001 (chop interludes preserved by gate), sideways +0.018 (0.793->0.812, sole major mover — divergence-taper kicks in when strong-sums diverge in pure sideways, reduces over-amplification of own-side subtraction allowing legitimate directional signals to fire exits more freely), rally -0.007 (0.860->0.852, mild — pure-sideways gate occasionally activates in deep-pullback bars). All MaxDDs <4%. Branch evolution: step 1 (initial open, unrestricted taper) catastrophic crash -0.099 + rally -0.044; step 2 added pos-alignment gate but didnt help (taper still fires for held-side dominant); step 3 added pure-sideways gate (|ret_long|<0.015) — recovered crash to baseline, rally still -0.025; step 4 added not-counter-trend gate — rally regression narrowed to -0.007 with sideways gain preserved (composite -0.003 from LOC); steps 5-8 progressively compactified implementation (32 lines -> 3 lines) recovering LOC bonus until composite crossed positive. Mechanism: in PURE sideways (|ret_long|<0.015) when position is NOT counter-trend, taper _chop_amp toward 1.0 by strong-sum divergence — high divergence (one side >> other) indicates directional signal hiding in low-trend backdrop where full 1.7x own-side subtraction over-protects. Crash/rally chop interludes (|ret_long| 0.015-0.030) and counter-trend holds preserve full _chop_amp_chop. Genuinely novel — previous _chop_amp asymmetric attempts (sign-aware, trend-aligned) failed; divergence-as-conditioning was an unexplored axis. NEW BASELINE.
