commit	score	mean_score	std_score	bull_2021	crash_bear	sideways	rally_2024	status	description
-	-	-	-	-	-	-	-	-	session-summary	SESSION (baseline 1d764b9f 0.689311 5-regime -> UNCHANGED, no keep): 5 independent ARCHITECTURAL experiments (Exp1-5, ALL discards) + 0 exploration branches. SESSION-START: reverted an in-flight Exp5 partnerdvp x btcvol branch left dangling by prior interrupted session at HEAD=255ad6b7 step5 (stagnated 5 steps at sub-noise +0.0016, no credible path to +0.003 keep; mixed gain +0.0068 too small once diluted across 5 regimes, rally -0.0017 unseparable). Baseline 1d764b9f re-verified byte-identical 0.689311 post-revert (0 diff). EXIT RULE: 5 consecutive architectural discards MET (>=5 architectural attempted, no branch). results.tsv append-only preserved (path-scoped git checkout -- strategy.py for every revert, never git revert). THEME: probed 5 genuinely-different architectural axes -- (1) direction-asymmetric peak-profit giveback; (2) low-trade-density admission relaxation (inverse of _freq_factor); (3) profit-scaled stop-loss width; (4) giveback-velocity amplifier on pp_pressure; (5) multi-source agreement bonus on soft_max fusion. CROSS-EXPERIMENT CONCLUSIONS (all measured this session, verifiable): (A) SELF-EXCLUSIONARY WALL (Exps 1, 3): a lever conditioned on PROFIT/position-DIRECTION does NOT bind because the exit path it targets fires on the OPPOSITE condition. Exp1 (direction-asymmetric giveback): tighter SHORT giveback inert because crash shorts exit via giveback-ratio/slope-against BEFORE reaching the _pp_min profit threshold (peak-profit harvest never engages on crash -- same crash-exits-before-harvest wall as prior de-risk cushion). Exp3 (profit-scaled stop): tighter stop on WINNERS inert because _sl_pressure only fires on LOSERS (pos_pnl<=0 -> profit-gate 0 -> byte-identical); a winning position has _loss<0 -> _sl_pressure already 0. The profit-gate and the stop/harvest-pressure are ANTI-CORRELATED by construction -> never overlap. GENERAL RULE CONFIRMED: to bind on a target exit path, the lever must fire on the SAME condition as that path. (B) OVER-HARVEST WALL (Exps 4, 5): amplifying exit pressure on noise-sensitive giveback/agreement signals EXPLODES trade counts and DD. Exp4 (giveback-velocity amp): +0.40 on every giveback spike -> bull 52->198t, DD 3.09->19.15pct, all regimes -999. Exp5 (agreement bonus): +0.10 on multi-source trend agreement -> bull 52->80t, DD 3.09->8.14pct; rally 102->117t, DD 5.17->6.98pct. In TRENDS, dual-source pressure spikes (slope+pp firing together) are PULLBACK-NOISE within an ongoing trend, not reversal-confirmation -> boosting them over-harvests trend-aligned winners (churn -> DD -> Sharpe down). (C) mixed_2025 sample_factor headroom IS REAL but UNREACHABLE cleanly: Exp2 (low-density admission relaxation) -> catastrophic -999 (admitting marginal-conviction trades in low-trend regimes admits ~coin-flips -> loss-streak cascade -> DD>10pct on ALL regimes, including a 102->3t rally collapse). Exp4 incidentally pushed mixed to 54 trades (past the 50 knee) but via an unsound over-harvest amplifier that destroyed everything else. mixed's 100pct WR is PRECIOUS and reflects CORRECT high-conviction filtering, not over-tight admission -- the sample_factor penalty is a REAL reflection of fewer high-conviction opportunities in mixed's low-trend regime, not an artifact addressable by admission loosening. Reconfirms the documented mixed structural floor on a new axis (admission-frequency inverse). (D) MAX fusion + single-source attenuator is at confirmed optimum: the agreement bonus (Exp5) regressed -- MAX was a deliberate keep (rejects correlated-noise addition); adding any agreement boost over-harvests because trend dual-source spikes are pullback-noise. SATURATION RECONFIRMED: strategy at confirmed deep local optimum reconfirmed via 5 novel architectural axes spanning the harvest subsystem (giveback direction + giveback velocity), the stop subsystem (profit-scaled width), the admission subsystem (low-density inverse), and the fusion subsystem (agreement bonus). NEW BASELINE 1d764b9f 0.689311 UNCHANGED for future sessions. KEY CAUTION FOR FUTURE SESSIONS: (1) any lever conditioned on profit/direction must be checked for self-exclusion (does the target path fire on the SAME condition?) before committing; (2) exit-pressure amplifiers on giveback/agreement signals over-harvest at far lower amplitudes than expected (+0.10 on agreement already regressed DD 3->8pct) -- the harvest layer is noise-sensitive and MAX-fusion-tuned; (3) admission loosening on low-trend regimes admits coin-flips that cascade via loss-streak tightening -- mixed's WR is filtering not over-conservatism.
62b0801c	0.458017	0.565216	0.357331	0.775783	0.729861	1.011417	0.030966	0.278054	discard	Exp1 (architectural, indep): STRONG-TREND COUNTER-TREND RE-ENTRY BLOCK after a per-symbol loss (in_cooldown=True for 2 bars after a loss when multi-day trend strong, fast-saturating /0.01 ret_vlong gate on EITHER sign -> blocks ct re-entries in rally/solid-uptrend). MEASURED vs 1d764b9f 0.689311: composite -0.231294 CATASTROPHIC, min_stability 0.810->0.654. PER-REGIME: crash BYTE-IDENTICAL 0.729861 (100pctWR _loss_only==0 -> block never fires, sparing confirmed), sideways BYTE-IDENTICAL 1.011417, bull 0.961878->0.775783 (-0.186 -- block is DIRECTION-AGNOSTIC: bull trend-aligned LONG re-entries after a loss get blocked by the bear-ct OR clause since ret_vlong solidly positive fires the >0.5 gate on both signs; bull-ct-rare assumption WRONG), rally 0.662116->0.030966 raw 0.060472 stability_factor 0.512 (BLOCK is a hard on/off decision boundary -> AR(1) perturbs which bars sit in the 2-bar window -> entry set diverges clean vs perturbed -> stability collapse), mixed 0.408468->0.278054 stability 0.681 (mixed ret_vlong occasionally crosses the /0.01 gate -> blocks mixed longs -> raw preserved but stability crashed). FAILURE MECH (architectural fact): a BLOCK entry gate is a binary decision boundary at the cooldown-eligible bar -> the AR(1) correlated noise test shifts the loss-exit bar +-1 -> the 2-bar block window shifts -> different entries admitted across the noise ensemble -> equity-curve tracking error explodes (stability 1.0->0.512). The /0.01 saturation does NOT save it: the BOUNDARY is the loss-exit BAR (integer, but its TIMING relative to the perturbed price path varies), not the ret_vlong level. Confirms documented wall: blocking entries (vs shrinking size) collapses stability. Discard (not branch-worthy): bull regressed too (not isolated to rally) + stability collapse on the binding regimes.
90a6bef1	0.689311	0.754748	0.218125	0.961878	0.729861	1.011417	0.662116	0.408468	discard	Exp2 (architectural, indep): COUNTER-TREND STREAK ATR STOP-TIGHTEN. Tighten _stop_abs by up to 20pct for ct positions (pos_dir opposes 96-bar ret_vlong, fast-saturating /0.01 gate) during an active portfolio loss streak (tanh ramp on _loss_streak), continuous on both axes, applied to HELD positions. MEASURED vs 1d764b9f 0.689311: BYTE-IDENTICAL composite 0.689311 mean 0.754748 std 0.218125, ALL regimes raw==score byte-identical (bull 0.961878, crash 0.729861, sideways 1.011417, rally 0.662116 stab 1.0 streak_gate 1.0 UNCHANGED -> max_consecutive_losses unchanged, mixed 0.408468). FAILURE MECH (architectural fact): the stop-tighten fires on HELD positions but rally losing trades are NOT ct-at-hold -- the ct SHORT re-entries exit fast (slope/stop), incrementing the streak, while the positions HELD during the streak window are trend-aligned LONGS (which then give back in pullbacks -> the losses). For those held longs pos_dir*ret_vlong>0 -> _st_ct_ind=0 -> tighten=1.0 byte-identical. The /0.01 ct gate correctly identifies ct but the LOSING held positions are trend-aligned, not ct (reconfirms documented rally decisive-entry confound from a292f44d/266b3df8: rally losing trades and trend-aligned winners come from the SAME entries). Stop subsystem is the wrong lever for the streak -- the streak is structural (entry COUNT during pullback sequences), not hold-duration. Inert (no risk). Discard.
566041b0	0.689311	0.754748	0.218125	0.961878	0.729861	1.011417	0.662116	0.408468	discard	Exp3 (architectural, indep): POST-LOSS FRESH-ENTRY ATR STOP-TIGHTEN. Cache a stop-tighten factor at entry (max 20pct at bars_since_exit=0, fading to 0 over 8 bars, _loss_only gated), apply to held _stop_abs. MEASURED vs 1d764b9f 0.689311: BYTE-IDENTICAL composite 0.689311 mean 0.754748 std 0.218125, ALL regimes raw==score byte-identical (rally 0.662116 streak_gate 1.0 max_consecutive_losses UNCHANGED). FAILURE MECH (architectural fact): the tighter ATR stop (0.024->0.019 at 20pct) never becomes the BINDING exit for rally losing re-entries -- they exit via slope-against/giveback/pp_pressure well before the ATR stop binds (stop ~0.024-0.035 vs the giveback/slope exits firing at much smaller adverse moves). Tightening a non-binding exit does nothing. Reconfirms (with Exp2) that the STOP subsystem cannot reach the streak -- the losers do not exit via the stop. The streak is structural (entry COUNT during pullback sequences), not hold-duration or stop-distance. Inert (no risk). Discard.
33d6a13b	0.689315	0.754752	0.218123	0.961878	0.729861	1.011417	0.662137	0.408468	discard	Exp4 (architectural, indep): POST-LOSS CONVICTION ADMISSION TIGHTEN (not ct-gated). Raise strong-sum admission threshold for ALL re-entries within 8 bars of a per-symbol loss (continuous ramp, _loss_only gated, not ct-gated, not a block). MEASURED vs 1d764b9f 0.689311: composite +0.000004 SUB-NOISE (<+0.003 threshold), mean +0.000004. PER-REGIME all stab 1.0 raw==score: bull BYTE-IDENTICAL 0.961878, crash BYTE-IDENTICAL 0.729861, sideways BYTE-IDENTICAL 1.011417, rally 0.662116->0.662137 (+0.000021 -- tighten FIRED, slightly changed trade selection, but tiny), mixed BYTE-IDENTICAL 0.408468. rally flip_streak_gate 1.0 (UNCHANGED). FAILURE MECH (architectural fact): the 0.12 max admission tighten barely moved rally trade selection (+0.000021) -- elasticity is tiny: to reach +0.003 composite (~+0.015 rally diluted 1/5) would need an enormous tighten that crashes sample_factor. CRITICAL CORRECTION: this session Exp1-3 were premised on rally streak_gate=0.875 being the lever, but that was a STALE reading from the OLDER baseline (1d6e8b5c rally 0.660252). The CURRENT baseline 1d764b9f (MTM-path-efficiency keep) already raised rally to 0.662116 with stab 1.0 flip_streak_gate 1.0 (raw==score) -- the streak_gate gap is CLOSED. rally binding constraint is now raw Sharpe 1.53, not the streak. Sub-noise discard.
c42f1f54	0.623263	0.670232	0.156563	0.676135	0.733890	0.883708	0.656866	0.400560	discard	Exp5 (architectural, indep): TREND-ALIGNED SLOPE-CONFIRMED WINNER hold extension. Add up to TREND_WIN_HOLD_BARS=2 extra max_hold bars for trend-aligned (96-bar ret_vlong x pos_dir, /0.01 fast-sat) + in-profit (tanh(pos_pnl/|stop|)) + slope-confirmed (_slope_strength) positions. Targets rally raw (raw==score, Sh1.53 raw-limited). MEASURED vs 1d764b9f 0.689311: composite -0.066048 REGRESSION, mean -0.084516. PER-REGIME all stab 1.0 raw==score (no stability crash): bull 0.961878->0.676135 (-0.286 -- trend-aligned longs held through 2021 corrections = overstay), sideways 1.011417->0.883708 (-0.128 -- sideways trend-aligned winners mean-revert, held too long), rally 0.662116->0.656866 (-0.005 -- rally barely moved, the /0.01 ret_vlong gate DID fire for rally longs but the +2 bar extension let rally winners give back in pullbacks net-neutral-to-slightly-negative), crash 0.729861->0.733890 (+0.004 -- crash shorts trend-aligned, small gain), mixed 0.408468->0.400560 (-0.008). FAILURE MECH (architectural fact): the documented SMOOTH-WINNER!=TREND-WINNER wall (reconfirms 0ff4efa4/d6c6bcae this session lineage + 2e33cc75 prior). Trend-aligned (96-bar ret_vlong) does NOT imply the position will keep winning -- bull 2021 trend longs reverse in sharp corrections, sideways trend-aligned winners mean-revert. Extending holds for trend-aligned+profit+slope-conf caught exactly these reversal cases: the position WAS trend-aligned, in profit, slope-confirming AT THE EXTENSION MOMENT, then the trend reversed and the extra hold gave back gains. crash (sustained downtrend, shorts keep working) was the only beneficiary. The slope-conf gate does not see ahead -- it confirms the CURRENT slope, not whether the trend will persist. Discard (not branch-worthy: bull/sideways regression is the established overstay wall, no credible fix via hold-extension tuning).
-	-	-	-	-	-	-	-	-	session-summary	SESSION (baseline 1d764b9f 0.689311 5-regime -> UNCHANGED, no keep): 5 independent ARCHITECTURAL experiments (Exp1-5, ALL discards) + 0 exploration branches. EXIT RULE: 5 consecutive architectural discards -> stop. Baseline 1d764b9f re-verified byte-identical at session end (0 diff). CRITICAL CORRECTION this session: Exp1-3 were premised on rally streak_gate=0.875 being the largest raw-vs-actual score gap (the lever to move), but that was a STALE reading from the OLDER baseline 1d6e8b5c (rally 0.660252). The CURRENT baseline 1d764b9f (MTM-path-efficiency keep) already raised rally to 0.662116 with stability_factor 1.0 flip_streak_gate 1.0 (raw==score) -- the streak_gate gap is CLOSED. rally binding constraint is now raw Sharpe 1.53, not the streak. All 5 regimes raw==score at baseline (all stab 1.0, all flip 1.0) -> NO penalty gap to exploit; the ONLY lever is raising RAW Sharpe/calmar directly. EXP SUMMARY: Exp1 (ct re-entry BLOCK after loss via in_cooldown) catastrophic -0.231 -- a BLOCK is a binary decision boundary the AR(1) test shatters (loss-exit bar shifts +-1 -> block window shifts -> entry set diverges -> stability 1.0->0.512); direction-agnostic gate also caught bull trend-aligned re-entries (bull -0.186). Exp2 (ct-streak ATR stop tighten on HELD pos) byte-identical inert -- rally losers are trend-aligned longs not ct shorts, so the /0.01 ct gate is ~0 for the held losers. Exp3 (post-loss fresh-entry stop tighten, entry-cached) byte-identical inert -- losers exit via slope/giveback/pp_pressure, NOT the ATR stop (stop ~0.024-0.035 never binds before other pressures fire). Exp4 (post-loss conviction admission tighten, not ct-gated, continuous) sub-noise +0.000004 (rally +0.000021) -- mechanism FIRED but elasticity tiny; to reach +0.003 composite would need an enormous tighten crashing sample_factor. Exp5 (trend-aligned slope-confirmed winner hold extension, +2 max_hold bars) regression -0.066 -- the SMOOTH-WINNER!=TREND-WINNER wall (reconfirms 0ff4efa4/d6c6bcae/2e33cc75): trend-aligned+profit+slope-conf AT THE EXTENSION MOMENT does not imply the trend persists; bull 2021 longs -0.286 and sideways winners -0.128 held through reversals. CROSS-EXPERIMENT CONCLUSION: (1) the streak_gate lever is EXHAUSTED at baseline 1d764b9f (raw==score all regimes, no penalty gap) -- future sessions must target RAW Sharpe/calmar, not penalty recovery; (2) the STOP subsystem cannot reach rally losers (they exit via slope/giveback, not the stop -- reconfirmed by Exp2+Exp3 both byte-identical); (3) a HARD entry BLOCK is forbidden (creates a noise-shattering boundary -- Exp1); (4) trend-aligned hold-extension hits the overstay wall (slope-conf sees CURRENT slope not future persistence -- Exp5). Baseline 1d764b9f unchanged.
e5a34eea	0.689054	0.754521	0.218222	0.961878	0.729861	1.011417	0.660979	0.408468	discard	Exp1 architectural indep: FIRST cross-asset data dep at EXIT layer. De-risk convex cushion (_dr_k up to 1.6, lets trend-aligned+profit winners ride pullback giveback) gated ONLY on within-symbol ret_long (_dr_align)+slope_conf+profit. Added 4th gate: BTC 96-bar trend confirmation -- shrink cushion toward linear when alt position direction OPPOSES BTC multi-day trend. Byte-identical for BTC (guarded symbol!=BTC, mirrors xasset). Shrink-only, deep-sat /0.03, smooth. MEASURED vs 1d764b9f 0.689311: composite -0.000257 SUB-NOISE, mean 0.754748->0.754521 (-0.000227). PER-REGIME all stab 1.0 raw==score: bull 0.961878 byte-identical (BTC self gate=1), crash 0.729861 byte-identical, sideways 1.011417 byte-identical, rally 0.662116->0.660979 (-0.001137 Sh1.530->1.5276 -- trend-aligned longs that briefly oppose BTC got cushion trimmed = more giveback), mixed 0.408468 BYTE-IDENTICAL (target MISSED, Sh0.802336 identical). FAILURE MECH (architectural fact): SELF-EXCLUSIONARY -- the cushion requires _pnl_scale>0 (profit gate: _dr_k has max(0,_pnl_scale) factor). mixed's binding constraint is UNREALIZED giveback on held longs that ALREADY gave back (pos_pnl declined -> _pnl_scale<0 -> _dr_k=1.0 linear, cushion already OFF). My BTC gate multiplies a quantity already ~1.0 on mixed -> byte-identical. Cushion only activates on PROFITABLE winners; mixed giveback happens AFTER profit fade where cushion is off. Extends documented self-exclusionary wall (profit/direction-gated levers don't bind on the target path) to the cross-asset-exit axis. 1st architectural discard.
c8894dc5	0.689311	0.754748	0.218125	0.961878	0.729861	1.011417	0.662116	0.408468	discard	Exp2 architectural indep: LOSS-SIDE time-pressure amplification. Existing _w_time = 1.0 + 0.20*max(0,_pnl_scale)*(1-_trend_strength_w) only amps PROFITABLE chop positions (profit-gated, same self-exclusionary pattern as de-risk cushion). mixed's held wrong-side longs are LOSING (pos_pnl<0) in low-trend chop -> base weight 1.0, under-weighted. Added symmetric loss-side amp: _w_time += 0.20*max(0,-_pnl_scale)*(1-_trend_strength_w). (1-_trend_strength_w) gate spares trend regimes (bull/crash/rally losers = recoverable pullback noise). NOT self-exclusionary (fires pos_pnl<0). MEASURED vs 1d764b9f 0.689311: BYTE-IDENTICAL all 5 regimes (composite 0.689311, mixed Sh0.802336 identical, 0 trades changed). FAILURE MECH (architectural fact): _w_time only weights _time_pressure inside the MAX fusion _soft_max=max(_w_slope*_sl_slope, _w_pp*_pp, _w_time*_time, ...). mixed's losing giveback longs exit via a DIFFERENT (larger) soft term or via _sl_pressure (max(_sl_pressure,_soft_max)) or opp-gate BEFORE _time_pressure rises -- amplifying _w_time does not change the MAX's argmax. The time-pressure term is NOT the binding exit source for mixed giveback losers (extends the documented stop/time-subsystem wall: neither stop nor time reaches mixed giveback). Inert by construction: the binding exit source determines the exit; weighting a non-binding term is a no-op. 2nd architectural discard.
2149f8db	0.687203	0.753282	0.220264	0.961361	0.729862	1.011417	0.662399	0.401370	discard	Exp3 architectural simplification: REMOVED _ve_pressure (vol-expansion exit source, 5th of 7 MAX-fusion terms). It was profit-gated (_w_ve=max(0,_pnl_scale)), fired only above vol_expansion>1.3x (6-bar/18-bar vol ratio, rare), and was 1 of 7 MAX terms where only largest binds. Hypothesis: rarely the argmax -> dead-code-adjacent. MEASURED vs 1d764b9f 0.689311: composite -0.002108 SUB-NOISE, mean 0.754748->0.753282 (-0.001466). PER-REGIME all stab 1.0 raw==score: bull 0.961878->0.961361 (-0.0005 Sh1.9995->1.9983), crash byte-identical (0.729862), sideways byte-identical (1.011417), rally 0.662116->0.662399 (+0.0003 Sh1.530->1.5309), mixed 0.408468->0.401370 (-0.007098 Sh0.8023->0.7969 -- the regression). FAILURE MECH (architectural fact): _ve_pressure IS load-bearing -- it WAS the binding MAX argmax for some mixed (and tiny bull) profit-side positions. mixed's winning-side harvest IS served by the vol-expansion regime-shift detector (a 6/18-bar vol ratio spike flags the regime shift that makes earlier slope/peak signals stale -> harvests the winner). So mixed's giveback IS addressed by an existing profit-side pressure; the floor is not from lack of exit pressure but from positions giving back BEFORE the vol-expansion threshold fires (vol_expansion>1.3 rare). Discard (sub-noise, _ve_pressure load-bearing). 3rd architectural discard.
5cc01688	0.689311	0.754748	0.218125	0.961878	0.729861	1.011417	0.662116	0.408468	keep	Exp4 architectural simplification KEEP: REMOVED _ar_pressure (adverse-recovery exit pressure, 5th of 7 MAX-fusion terms). It fired only in a narrow zone (MAE<-0.5*|stop| AND pos_pnl<0 AND recovery_frac>0.5, capped 0.40) and was 1 of 7 MAX terms where only the largest binds. MEASURED vs 1d764b9f 0.689311: BYTE-IDENTICAL all 5 regimes (composite 0.689311, every Sharpe identical: bull 1.999504, crash 1.270529, sideways 2.017203, rally 1.530283, mixed 0.802336; 0 trades changed). _ar_pressure NEVER wins the MAX argmax on ANY regime -> the recovered-to-small-loss zone it targeted is always dominated by another exit pressure (_sl_pressure / slope-against / opp-gate fire first). KEEP RATIONALE: the +0.003 composite threshold filters in-sample NOISE-floor fluctuations; a byte-identical change (deterministically 0.000 across all 5 diverse regimes) is categorically NOT noise -- it is a verified safe dead-code removal. Guidelines explicitly endorse keeping score-neutral simplifications ("if score holds, keep simpler version"; complexity has hidden OOS-generalization cost). Zero in-sample cost + strictly simpler (16 LOC + 1 MAX term + 1 MAE-state read at exit removed; _mae state retained for _ts_supp tp-harvest gate + MAE update). NEW BASELINE 5cc01688 0.689311 (scores identical to 1d764b9f; baseline NUMERICALLY unchanged, code simpler). NOTE for future sessions: _ar_pressure was confirmed dead code across 5 regimes; do NOT re-add unless a new exit pathway makes the recovery zone un-served.
