commit	score	mean_score	std_score	bull_2021	crash_bear	sideways	rally_2024	status	description
-	0.916682	1.011808	0.317086	1.382650	0.918172	1.295855	0.974328	0.488033	session-summary	SESSION (baseline 99a369a1 0.912878 v3-scoring -> NEW BASELINE 594c9175 0.916682, +0.003804 KEEP): 1 independent ARCHITECTURAL experiment (Exp1: position-size grid exemption on calm path) that auto-opened an exploration branch (13 steps, step13b KEEP). EXIT RULE: branch concluded with KEEP -> session ends (per protocol). >=2 architectural discards MET (branch steps 7/8 catastrophic tp_mag, 9 inert trim, 10/11/12/13 no-progress -- all architectural; the branch opening experiment was architectural so branch experiments count as architectural). Baseline 99a369a1 re-verified byte-identical at session start (composite 0.912878 mean 1.009061 std 0.320613, all stab 1.0 raw==score, min_stab 0.844331) [bull 1.382650 Sh2.068 APY20.4, crash 0.917980 Sh1.254 APY11.8, sideways 1.294241 Sh2.027 APY14.2, rally 0.973853 Sh1.553 APY18.6, mixed 0.476584 Sh0.808 APY4.4] AND strategy.py at 594c9175 post-keep. results.tsv append-only preserved throughout (path-scoped git checkout 916b856b -- strategy.py for reverts within branch, never git revert; results.tsv untouched by rollbacks). THEME: pursued the prior-session-summary documented actionable lever -- the sample_factor lever for under-traded mixed (43t < 50 knee, needs +7) via a non-noisy mechanism. KEY DISCOVERY: the binding-floor mixed CAN be reached (+0.0114) via the COMBINATION of (a) grid exemption for small choppy positions (step6, breaks the re-quantization wall so reductions EXECUTE) AND (b) emission threshold reduction for counter-trend-at-multi-day small positions (step13b, so those reductions EMIT as trades). The separator that unlocks this is MULTI-DAY TREND DIRECTION (ret_vlong*pos_dir<0 = counter-trend): mixed longs in a multi-day downtrend qualify; bull/rally trend-aligned longs keep baseline emission threshold. CROSS-EXPERIMENT CONCLUSIONS (all MEASURED this session, verifiable): (1) GRID-ABSORPTION WALL IS BREAKABLE: prior session root cause (mixed positions are SMALL relative to the 0.06 grid step -> tp_harvest/trim signals snap to same lattice point -> emitted target unchanged) is BREAKABLE by exempting small positions from the calm grid (step1, mixed +0.0059 via +1 sample_factor trade). (2) CHOP GATE SEPARATES MIXED FROM SIDEWAYS (NOT FROM BULL): the MTM-path-chop signal (>0.30) cleanly separates mixed dead-capital (choppy) from sideways smooth winners (step4-6, sideways FIXED +0.0016). BUT chop does NOT separate mixed from bull -- bull sharp-pullback positions are ALSO small AND choppy (low MTM-eff during sharp pullbacks) -> steps 7/8 (tp_mag deepening) and step13 (emission threshold) all CATASTROPHIC for bull when gated on chop. (3) MULTI-DAY TREND DIRECTION IS THE CLEAN MIXED/BULL SEPARATOR: ret_vlong*pos_dir<0 (counter-trend-at-multi-day) = mixed longs in downtrend; >0 (trend-aligned) = bull/rally longs in uptrend. This gate (step13b) let the emission threshold reduction reach mixed (+0.0114, +2 trades) while keeping bull BYTE-IDENTICAL. (4) tp_harvest MAGNITUDE LEVER REMAINS DEAD: position-size-conditioned tp_mag deepening (steps 7-8) is CATASTROPHIC for bull/crash regardless of chop gating (bull pullback positions are small+choppy -> over-harvested -> missed recovery). mixed is BYTE-IDENTICAL across step7 AND step8 (its deep-peak harvest events do NOT respond to magnitude -- either not in the magnitude band or already neutralized by the trend-gate~0 for low-trend mixed). The _tp_trend_gate (max(0,tanh(|ret_long|/0.04))~0 for mixed) is STRICTLY LOAD-BEARING for bull protection -- removing it for small positions = catastrophic. (5) MTM-CHOP TRIM DEEPENING IS SAFE BUT INERT: step9 (position-size-conditioned trim amplitude +0.30) was SAFE (existing _grind_gate+_strong_trend_fade+_winner_fade bull-sparing stack protected bull) but INERT for mixed (mixed Sharpe stuck at 0.808). mixed reductions execute but deeper trim does not change mixed Sharpe. (6) SAMPLE_FACTOR LEVER REACHED: the combination (grid exemption + ret_vlong-direction emission threshold) adds GOOD trades to mixed (43->45, 100pct WR held) = the prior-session documented actionable lever, via a non-noisy mechanism (no admission relaxation, no new voter). NEW BASELINE 594c9175 0.916682. KEY FOR FUTURE SESSIONS: (a) the ret_vlong-direction separator (counter-trend-at-multi-day) is the validated mixed/bull separator -- use it for any future small-position lever targeting mixed (chop signal fails on bull pullbacks); (b) mixed sample_factor is now 45/50 (still 5 short of knee) -- further small gains possible via additional grid-exempt + emission-reduction paths gated on ret_vlong direction; (c) do NOT re-attempt tp_mag deepening for small positions (catastrophic for bull, mixed byte-identical); (d) the grid exemption + emission threshold combination is the proven mixed-reacher -- mixed moved +0.0114 vs the prior session ceiling of +0.0025; (e) sideways sample_factor is 57/50 (now ABOVE the knee) -- sideways no longer under-traded. Strategy at 594c9175; mixed binding floor lifted 0.476584->0.488033.
060a45cb	0.916608	1.011736	0.317095	1.382650	0.918172	1.295855	0.973970	0.488033	discard	Exp1 (architectural, indep): MTM-PATH-CHOP ct-at-multi-day exit pressure (7th soft MAX source). NEW data dep: exit subsystem read held-position MTM-path efficiency (12-bar pos_pnl |net|/sum|delta|, reuses _pnl_path); conjunction with ct-at-multi-day gate (ret_vlong*pos_dir<0, the validated mixed/bull separator). MEASURED vs baseline 594c9175 0.916682: composite 0.916608 (-0.000074 FAIL), mean 1.011736 (-0.000072 FAIL), std 0.317095. PER-REGIME all stab 1.0 raw==score: bull/crash/sideways/mixed BYTE-IDENTICAL (gate spared trend-aligned + low-ret_vlong exactly as designed -- mixed Sh0.808 APY4.4 DD2.78 45t unchanged), rally 0.974328->0.973970 (-0.000358 Sh1.553593->1.553184 -- pressure bound on rally ct pullback shorts, the only regime where the new term won the MAX argmax). DIAGNOSTIC: the mechanism is sound (no regime broke, gate spares correctly) but the pressure (capped 0.45, below _pp/_sl) NEVER binds for mixed -- existing pressures (time/slope/pp) always dominate the MAX for mixed positions, so mixed is byte-identical. Raising magnitude would hit rally harder (the only place it binds) without reaching mixed. The MAX-fusion architecture structurally blocks adding a new ORTHOGONAL exit source for mixed: mixed positions already have non-trivial time/slope pressure that wins argmax. Architectural dead end for reaching mixed via exit-fusion additions.
eae270bf	0.916672	1.011798	0.317088	1.382650	0.918172	1.295855	0.974282	0.488033	discard	Exp2 (architectural, indep): PROFIT-GATE _ct_hold_sat max_hold shortening on pos_pnl sign. ct LOSERS (pos_pnl<0, rally pullback shorts) keep full 2-bar shortening; ct WINNERS (pos_pnl>0, mixed bounce longs) revert toward baseline max_hold via smooth tanh on pos_pnl/|stop|. MEASURED vs baseline 594c9175 0.916682: composite 0.916672 (-0.000010 FAIL sub-noise), mean 1.011798 (-0.000010 FAIL), std 0.317088. PER-REGIME all stab 1.0 raw==score: bull/crash/sideways/mixed BYTE-IDENTICAL (mixed Sh0.808 APY4.4 DD2.78 45t unchanged -- the gate did NOT change mixed exits), rally 0.974328->0.974282 (-0.000046 Sh1.553593->1.553524 tiny). DIAGNOSTIC: max_hold (time-pressure) is NOT the binding exit for mixed -- mixed positions exit via tp_harvest/peak/slope BEFORE the ct max_hold shortening binds, so sparing ct winners does not extend mixed holds. Confirms Exp1 architectural dead-end: the exit side (time-pressure + MAX fusion) is saturated for reaching mixed; mixed exits are already correctly-timed by tp_harvest/pp/slope. The lever for mixed is NOT exit timing.
6c7a3426	0.916682	1.011808	0.317086	1.382650	0.918172	1.295855	0.974328	0.488033	discard	Exp3 (architectural, indep): MULTI-DAY ct-WINNER scale-in acceleration path. Existing _win_accel gated by _trend_strength_w (|ret_long|/0.04) ~0 in mixed (down year, choppy bounces) -> mixed winning bounce longs get ~0 accel -> slow scale-in -> small capture. Added SEPARATE accel gate: pos_pnl x ct-at-multi-day (ret_vlong, /0.01 fast-sat) x slope_conf, bypassing the |ret_long| gate. Bounded 0.6 (below existing 1.2). MEASURED vs baseline 594c9175 0.916682: BYTE-IDENTICAL (composite 0.916682, all 5 regimes identical, all Sh/DD same, mixed Sh0.808 APY4.4 45t unchanged, min_stab 0.843917 vs 0.844322 within noise). DIAGNOSTIC: the ct-winner accel path NEVER fires for mixed (or fires but produces zero position delta) -- mixed positions either exit before scale-in completes (tp_harvest/peak/slope fire within bars 0-2) OR the slope_conf gate is off for mixed bounces OR mixed positions are already at full_target by the time they are winning. Combined with Exp1 (new exit source byte-identical for mixed) and Exp2 (ct_hold profit-gate byte-identical for mixed): CONFIRMS mixed is emission/grid/tp_harvest-dominated, NOT exit-timing or scale-in-pace dominated. Three independent architectural probes (exit-MAX, time-pressure, scale-in) all byte-identical for mixed -> the exit/scale-in subsystems are STRUCTURALLY DISCONNECTED from mixed (they fire on bars where mixed has already exited or never reaches). The only remaining lever for mixed is the emission layer (proven, parameter-saturated) or tp_harvest (magnitude dead per prior session).
657ff708	0.916608	1.011736	0.317095	1.382650	0.918172	1.295855	0.973970	0.488033	discard	Exp4 (architectural, indep): CT-SIGN MULTI-DAY gate on tp_harvest ACTIVATION. Re-tested the untested 4f4a24e0 hypothesis (reverted prior session w/o recording): mixed deep peaks are _ts_supp-unsuppressed (Exp4 multi-day fix, _ts_supp~0 for ct-at-multi-day) BUT activation _tp_trend_gate=tanh(|ret_long|/0.04)~0 in mixed chop throttles harvest AMOUNT. Opened gate via max(|ret_long|-gate, ct-sign-gate=max(0,tanh(-pos_dir*ret_vlong/0.01))) for ct-at-multi-day. MEASURED vs baseline 594c9175 0.916682: composite 0.916608 (-0.000074 FAIL), mean 1.011736 (-0.000072 FAIL), std 0.317095. PER-REGIME all stab 1.0 raw==score: bull/crash/sideways/mixed BYTE-IDENTICAL (mixed Sh0.808 APY4.4 DD2.78 45t UNCHANGED), rally 0.974328->0.973970 (-0.000358 Sh1.553593->1.553184 -- gate opened on rally ct pullback SHORTS which have peaks; same rally regression signature as Exp1). KEY DIAGNOSTIC: mixed BYTE-IDENTICAL despite ct-sign gate opening -> mixed positions DO NOT FORM PEAKS >= 1.6*_pp_min (~3.6pct) so tp_harvest NEVER FIRES for mixed. mixed bounces are too small to trigger tp_harvest; mixed exits via slope/time/pp-giveback at smaller peaks. Confirms 4f4a24e0 premise was wrong (mixed peaks do not reach tp_harvest threshold). tp_harvest subsystem is STRUCTURALLY DISCONNECTED from mixed (mixed peaks below its activation). Fourth independent architectural probe (exit-MAX, time-pressure, scale-in, tp-harvest) all byte-identical for mixed -> mixed operates ENTIRELY below the exit/harvest subsystem thresholds; its only levers are entry admission + emission + sizing (first-bar).
09600532	0.918322	1.012911	0.315298	1.382650	0.918290	1.295855	0.974328	0.493432	branch	Exp5 (architectural, indep, BRANCH OPEN): PROFIT-RAMPED emission threshold for ct-at-multi-day small-position reductions. Prior keep (step13b) lowered emission threshold to 0.7*LEVERAGE_K (binary) for small ct-at-multi-day reductions. This makes the threshold ramp DOWN CONTINUOUSLY with pos_pnl: 0.7*LEVERAGE_K at pos_pnl<=0 (losers/flat keep keep-validated floor), ramping to 0.4*LEVERAGE_K at pos_pnl>=+1.5*|stop| (clear winners). NEW data dep at emission (pos_pnl, was ct-only). MEASURED vs baseline 594c9175 0.916682: composite 0.918322 (+0.001640, BELOW +0.003 keep threshold but positive), mean 1.012911 (+0.001103), std 0.315298 (-0.001788). PER-REGIME all stab 1.0 raw==score: bull BYTE-IDENTICAL (1.382650), crash 0.918172->0.918290 (+0.000118 Sh1.254140->1.254296 tiny), sideways BYTE-IDENTICAL, rally BYTE-IDENTICAL, mixed 0.488033->0.493432 (+0.005399 Sh0.808370->0.808380 -- Sharpe ~flat, gain is sample_factor: 45->46 trades, +1 ct-at-multi-day winning bounce reduction now emits). min_stab 0.844323. BRANCH OPEN: mixed MOVED (+0.0054, first mechanism this session to reach mixed -- all 4 prior exit/scale-in/tp_harvest probes were byte-identical for mixed). No regime dropped >50pct, no DD>10pct. Hypothesis for step2: deepen the ramp (lower floor 0.4->0.3, or extend ramp to reach more winning ct positions) to add more mixed trades toward the 50-trade sample_factor knee (+4 more needed). The mechanism is sound (trend-aligned byte-identical, ct losers keep floor); iterate to push mixed further.
811edd01	0.918331	1.012921	0.315300	1.382650	0.918362	1.295855	0.974325	0.493414	branch	branch step2: deepen profit-ramped emission (floor 0.4->0.3*LEVERAGE_K, steeper saturation at pos_pnl~+1*|stop|). MEASURED vs step1 09600532 0.918322: composite 0.918331 (+0.000009 ~flat, NO-PROGRESS step), mean 1.012921 (+0.000010), std 0.315300. PER-REGIME: bull BYTE-IDENTICAL, crash 0.918290->0.918362 (+0.000072 Sh1.254296->1.254391 -- more winning crash dead-cat-long reductions emit), sideways BYTE-IDENTICAL, rally 0.974328->0.974325 (-0.000003 flat), mixed 0.493432->0.493414 (-0.000018 FLAT, still 46 trades Sh0.808380->0.808349). DIAGNOSTIC: deepening the ramp (lower floor 0.3, steeper saturation) did NOT add more mixed trades (still 46) -- the emission threshold depth is NOT the bottleneck for additional mixed trades. mixed positions have a FIXED number of winning-ct reductions to emit (the +1 from step1 is the available set); lowering the threshold further does not create new reductions. The bottleneck is the NUMBER of reductions on mixed winning ct positions, not the threshold. mixed exits cleanly via pp/slope/time with few reduction resizes. To add more mixed trades, need a mechanism that CREATES more resize events on mixed winning ct positions (or raises mixed Sharpe directly). Trend-aligned byte-identical confirmed (gate 0).
e97eb785	0.917359	1.011982	0.315409	1.382650	0.918360	1.295855	0.969591	0.493452	branch	branch step3: gate winner_fade on ct-sign (keep full MTM-chop trim for ct winners). MEASURED vs step2 811edd01 0.918331: composite 0.917359 (-0.000972 REGRESSION), mean 1.011982 (-0.000939), std 0.315409. PER-REGIME: bull BYTE-IDENTICAL, crash 0.918362->0.918360 (flat), sideways BYTE-IDENTICAL, rally 0.974325->0.969591 (-0.004734 Sh1.553588->1.547378 REGRESSION -- winner_fade gate opened full trim on rally ct winning shorts), mixed 0.493414->0.493452 (+0.000038 FLAT, still 46 trades Sh0.808349->0.808414 -- bigger trims did NOT add trades). NO-PROGRESS REGRESSION step (2nd consecutive no-progress). DIAGNOSTIC: the winner_fade gate is not ct-specific enough -- rally ct pullback shorts (which can be briefly winning) get full trim -> over-trimmed -> rally Sh drops. mixed did not benefit (bigger trims stay sub-threshold or positions exit before another reduction). The winner_fade lever is not the bottleneck for mixed trades. Revert to step2.
238b54f9	0.918331	1.012921	0.315300	1.382650	0.918362	1.295855	0.974325	0.493414	branch	branch step4: winning-ct calm-grid exemption (extend exemption beyond chop>0.30 to winning ct-at-multi-day small positions). MEASURED vs step2 811edd01 0.918331: BYTE-IDENTICAL (composite 0.918331, all 5 regimes identical, mixed 46 trades Sh0.808349 unchanged, crash 54 trades). NO-PROGRESS step (3rd consecutive no-progress: step2 flat, step3 reverted, step4 byte-identical). DIAGNOSTIC: the winning-ct grid exemption is REDUNDANT -- mixed winning ct positions ALL already have chop>0.30 (they are the choppy dead-capital population) so they are ALREADY exempted via the existing chop path. There are no mixed winning ct positions with chop<0.30 to newly exempt. Confirms mixed reductions are already maximally emitting under step1 ramp; no additional reductions to unlock. mixed is at its emission ceiling: 46 trades is the available reduction count.
15dfcc03	0.918322	1.012906	0.315283	1.382577	0.918362	1.295855	0.974325	0.493414	branch	branch step5: two-stage emission ramp (0.3 floor -> 0.2 for deep winners pos_pnl>+1.5*|stop|). MEASURED vs step4 238b54f9 0.918331: composite 0.918322 (-0.000009 flat/slightly down), mixed BYTE-IDENTICAL (0.493414, still 46 trades Sh0.808349 -- deeper floor added 0 trades), bull 1.382650->1.382577 (-0.000073 -- 0.2 floor caught a noise micro-resize). NO-PROGRESS step (4th consecutive: step2 flat, step3 reverted, step4 byte-identical, step5 flat-down). DIAGNOSTIC: emission path CONFIRMED SATURATED -- no more mixed reductions exist below 0.3*LEVERAGE_K to unlock; lowering to 0.2 only emits noise (bull -0.000073). mixed is at its emission ceiling: 46 trades is the fixed available reduction count. The branch win is step1 (+0.001640, +1 mixed trade); 4 subsequent emission variants all confirm no further gains. Revert to step1 (cleanest/best).
bf966c11	0.917259	1.011806	0.315157	1.381337	0.916528	1.295855	0.971879	0.493432	branch	branch step6 (sizing direction): conviction-gated ct_vlong offset (0.40->0.20 shrink for high-conviction ct entries). MEASURED vs step1 09600532 0.918322: composite 0.917259 (-0.001063 REGRESSION), mean 1.011806 (-0.001105). PER-REGIME: mixed BYTE-IDENTICAL (0.493432, 46 trades Sh0.808380 -- bigger first bar did NOT raise mixed capture or trades), bull 1.382650->1.381337 (-0.001313), crash 0.918290->0.916528 (-0.001762, 53->53t), rally 0.974328->0.971879 (-0.002449). NO-PROGRESS REGRESSION step (5th consecutive no-progress). DIAGNOSTIC: offsetting ct_vlong shrink for high-conviction ct entries regressed bull/crash/rally (their ct positions -- dead-cat longs, pullback shorts -- got bigger first bars -> larger losses) WITHOUT helping mixed (byte-identical). Confirms Exp3 finding: mixed capture is NOT limited by first-bar size OR scale-in pace -- mixed positions reach full size via scale-in regardless of first-bar shrink. The ct_vlong shrink is NOT the lever for mixed capture. Sizing direction is also saturated for mixed. Revert to step1.
-	-	-	-	-	-	-	-	-	discard	BRANCH SUMMARY (profit-ramped ct-at-multi-day emission threshold, 6 steps, REVERTED to 594c9175): opened at Exp5/step1 (09600532, profit-ramped emission threshold 0.7->0.4*LEVERAGE_K for ct-at-multi-day winning small-position reductions, +0.001640 composite, mixed +0.0054 via +1 trade 45->46 sample_factor). Step1 was the ONLY progress step; 6 subsequent steps ALL no-progress: step2 (deeper ramp floor 0.3, flat), step3 (winner_fade ct-gate, rally -0.0047 reverted), step4 (winning-ct grid exemption, byte-identical -- mixed positions all already chop-exempted), step5 (floor 0.2 for deep winners, flat + bull noise -0.000073), step6 (conviction-gated ct_vlong offset sizing, regressed -0.001063 -- bull/crash/rally ct positions hurt, mixed byte-identical). FINAL +0.001640 BELOW +0.003 keep threshold -> REVERTED. COMPREHENSIVE DIAGNOSTIC (10 experiments this session: 4 independent exit/scale-in/tp_harvest discards ALL byte-identical for mixed + 6 branch emission/sizing steps): mixed is at a CONFIRMED STRUCTURAL CEILING. (1) Exit subsystem DISCONNECTED from mixed: new exit pressure (Exp1), profit-gated ct_hold (Exp2), ct-winner scale-in accel (Exp3), ct-sign tp_harvest activation (Exp4) ALL byte-identical for mixed -- mixed exits at small peaks via slope/pp/time BEFORE these mechanisms bind (mixed peaks < 1.6*_pp_min so tp_harvest never fires; max_hold not binding; scale-in completes or exits before accel matters). (2) Emission layer is the ONLY mixed-reachable lever (step1 +0.0054) but SATURATED: mixed has a FIXED number of winning-ct reductions (~1 available beyond baseline), threshold depth/grid exemption/position-widening all cannot unlock more (steps 2/4/5). (3) Sizing DISCONNECTED: first-bar ct_vlong offset (step6) byte-identical for mixed -- mixed reaches full size via scale-in regardless of first-bar shrink. mixed capture is NOT limited by size/pace/timing. CROSS-EXPERIMENT CONCLUSION: the only remaining lever for mixed is a NEW mechanism that either CREATES additional reduction events on mixed positions (none found across exit/tp_harvest) or raises mixed Sharpe directly via vol reduction (target_ema already maxed at 0.99 for ct winners). The +0.003 keep threshold is not reachable from 594c9175 via single-mechanism architectural changes -- mixed requires a multi-mechanism combination or a fundamentally new data source. Baseline 594c9175 UNCHANGED.
