commit	score	mean_score	std_score	bull_2021	crash_bear	sideways	rally_2024	status	description
-	0.572283	0.707997	0.271427	0.78	0.77	1.01	0.27	discard	ARCHITECTURAL (Exp1 indep #1): churn-gated voter-DISPERSION first-bar entry-size attenuator (within-side std of 7 voter confs; gate len(_eh) tanh((len-1.5)/0.6); shrink-only max 0.30 above disp 0.22). MEASURED vs e5a4defa: composite 0.572148->0.572283 (+0.00014 NOISE-LEVEL), mean 0.707846->0.707997, raw_composite 0.661393->0.661549. crash 0.767586 + sideways 1.013297 BYTE-IDENTICAL (sideways len=2 entries have disp<0.22 so no shrink fired). bull 0.781251->0.781833 (+0.0006). rally raw 0.469498->0.469542, stab 0.672046->0.672043 (FLAT). DISCARD: +0.00014 composite within stability-test noise + adds 22 LOC (guideline sub-0.001/20-line not worth it). LEARNING: within-voter dispersion INERT -> rally bursty re-entries are NOT high-dispersion (voters AGREE on them); rally noise-fragility is NOT voter disagreement. Reverted via git checkout e5a4defa (byte-identical).
51f9645d	0.578052	0.711113	0.266123	0.78	0.77	1.01	0.28	keep	KEEP (NEW BASELINE, SUPERSEDES e5a4defa 0.572148). Counter-trend-DIRECTION-gated temporal EMA smoothing of fused soft exit pressure (alpha=0.5*max(0,tanh(-pos_dir*ret_vlong/0.04)); SL stays raw; reset on exit). MEASURED vs e5a4defa: composite 0.572148->0.578052 (+0.0059), mean 0.707846->0.711113 (+0.0033), std 0.271396->0.266123 (-0.0053), raw_composite 0.661393->0.659469 (-0.0019). bull 0.781251 / crash 0.767586 / sideways 1.013297 raw+score BYTE-IDENTICAL (signed ct gate -> alpha=0 for trend-aligned longs[bull]/shorts[crash], low-ret_vlong sideways spared). rally: raw 0.469498->0.465097 (-0.0044), STABILITY 0.672046->0.682104 (+0.0101), factor 0.573487->0.607014 (+0.0335), score 0.269251->0.282320 (+0.0131). MaxDD bull1.25/crash0.73/sideways0.45/rally1.87 (<10). MECHANISM: smooths exit TIMING only for counter-trend positions (rally pullback shorts); the signed gate solves the bull-regression blocker that sank churn-gated exit-EMA (bull churns->churn-gate caught bull; here bull is trend-aligned->spared). rally stab 0.682 still below 0.80 knee = headroom remains.
cfc48165	0.578194	0.711192	0.265996	0.78	0.77	1.01	0.28	keep	KEEP resolving orphan HEAD cfc48165 (prior session committed strategy.py, never recorded result). Extends counter-trend EMA smoothing (51f9645d baseline mechanism) to the additive _voter_bias exit term via the SAME signed ct gate (alpha=0.5*max(0,tanh(-pos_dir*ret_vlong/0.04))); new per-symbol _voter_bias_ema state, reset on exit. MEASURED vs 51f9645d 0.578052: composite +0.000142, mean +0.000079, std -0.000127, raw_composite 0.659469->0.659696 (+0.000227 DETERMINISTIC). bull 0.781251/crash 0.767586/sideways 1.013297 raw+score BYTE-IDENTICAL (signed ct gate alpha=0 for trend-aligned bull longs/crash shorts; low-ret_vlong sideways spared). rally raw 0.465097->0.465616 (+0.000519), stab 0.682104->0.682105 (flat), factor 0.607014->0.607015, score 0.282320->0.282636 (+0.000316). MaxDD bull1.25/crash0.73/sideways0.45/rally1.87 (<10pct). All keep criteria met. Binding constraint remains rally (stab 0.682 below 0.80 knee).
-	0.556684	0.699307	0.285245	0.78	0.77	1.01	0.24	discard	EXP1 ARCHITECTURAL counter-trend-gated MEDIAN-of-3 pre-filter on entry-readiness EMA margin input (new per-symbol per-side margin history; ct gate prospective_dir*ret_vlong/0.04). vs cfc48165 0.578194: composite 0.578194->0.556684 (-0.0215), mean 0.711192->0.699307. raw_composite BYTE-IDENTICAL 0.659696 (clean entries unchanged: median=raw at sustained-conviction entries). bull 0.781251/crash 0.767586/sideways 1.013297 BYTE-IDENTICAL (ct gate=0 trend-aligned). rally: raw 0.465616 BYTE-IDENTICAL, stability COLLAPSED 0.682105->0.504911 (factor 0.607->0.505), score 0.282636->0.235094. FINDING: median is a RANK statistic - under AR(1) noise the selected median value rank-flips near the decision boundary, AMPLIFYING entry-timing divergence rather than reducing it (echoes prior discarded order-emission median resize filters). Entry-margin filtering exhausted: linear (EMA/RHO) inert, non-linear (median) harmful. Not branch-eligible (no regime improved; mechanism itself is the noise source). Reverted via git checkout cfc48165 -- strategy.py.
-	0.578194	0.711192	0.265996	0.78	0.77	1.01	0.28	discard	EXP2 ARCHITECTURAL counter-trend-gated EMA smoothing of opp_gate reversal-exit trigger (new _opp_ready_ema state; replace instantaneous _opp_strong>=_opp_strong_min with ct-blended EMA effective margin, same signed ct gate as 51f9645d). vs cfc48165 0.578194: BYTE-IDENTICAL on ALL metrics (composite/mean/raw/std + all 4 regime raw+score+stab unchanged). FINDING: the strong-sum crossing (_opp_margin>=0) is NEVER the binding opp_gate condition - when bull_votes>=FLIP_MIN_VOTES(2.80) AND trend_avg>0 fire (real reversal), _opp_margin is already >=0, so EMA-smoothing it changes no firing. The strong-sum condition is effectively redundant with the vote-count condition in the opp_gate. Inert (zero delta, not an improvement) -> discard, not branch-eligible. Reverted via git checkout cfc48165 -- strategy.py.
eff65bdc	0.578481	0.711530	0.266099	0.78	0.77	1.01	0.28	keep	KEEP resolving orphan HEAD eff65bdc (prior session committed strategy.py, never recorded). Cross-asset BTC multi-day-trend confirmation SHRINK on ETH/SOL first-bar entry size: alt entry opposing BTC 96-bar OLS log-HL2 slope (net-return scale) shrunk up to 0.25x via smooth tanh (BTC self-referential -> 1.0 byte-identical). MEASURED vs cfc48165 0.578194: composite +0.000287, mean 0.711192->0.711530, std 0.265996->0.266099, raw_composite 0.659696->0.660004. bull 0.781251->0.782630 (+0.001379, factor 1.0). crash 0.767586 + sideways 1.013297 raw+score BYTE-IDENTICAL (BTC trend agrees/~flat -> alt shrink ~0). rally 0.282636->0.282609 (-0.000027, raw 0.465616->0.465582, factor 0.607015->0.607002, stab 0.682101). MaxDD bull1.25/crash0.73/sideways0.45/rally1.87 pct. All keep criteria met. Binding constraint remains rally (stab 0.682 below 0.80 knee). NEW BASELINE 0.578481.
-	0.5785	0.7116	0.2661	0.78	0.77	1.01	0.28	discard	EXP1 ARCHITECTURAL ct-gated conviction-margin EMA smoothing on entry-size conv_atten (blend _bull/_bear_margin toward _acc readiness EMA, ret_vlong-gated). INERT/HYPOTHESIS FAILED: rally stability 0.682101->0.682096 (byte-flat), crash byte-identical, bull +0.000131 (coincidental); composite +0.000024 = FP noise. Confirms entry-SIZE is NOT the rally-stability lever (consistent with prior "rally raw byte-invariant to size changes"). Reverted strategy.py to 38158e83.
-	0.578408	0.711490	0.266164	0.78	0.77	1.01	0.28	discard	Exp1 (architectural, indep): counter-trend-DIRECTION-gated grid quantization of resize targets (0.06*equity*BASE lattice; gate _ct_pos_str=max(0,tanh(-pos_dir*ret_vlong/0.04))>0.5; resize-only; nearest-snap w/ sign-preserve). MEASURED vs 38158e83 baseline 0.578481: composite->0.578408 (-0.000073), mean 0.711530->0.711490 (-0.000040), raw_composite 0.660004->0.659799. bull 0.782630/crash 0.767586/sideways 1.013297 raw+score BYTE-IDENTICAL (ct gate isolates trend-aligned alpha=0; sideways ret_vlong below 0.5 gate). rally raw 0.465582->0.465113 (-0.000469), stab 0.682101->0.682180 (+0.000079), factor 0.607002->0.607266 (+0.000264), score 0.282609->0.282447 (-0.000162). DECISION: composite+mean both down -> discard. Mechanism confirms ct grid lifts rally stab factor (+0.000264) but rally raw cost (-0.000469) exceeded it; low-churn ct resize surface tiny. Reverted strategy.py to 38158e83.
-	0.578481	0.711530	0.266099	0.78	0.77	1.01	0.28	discard	ARCHITECTURAL (Exp1 indep) counter-trend monotonic de-risk ratchet (clamp |target| no-re-growth for ct positions after scale-in, signed ret_vlong gate). BYTE-IDENTICAL all 4 regimes (composite 0.578481, rally raw 0.465582 stab 0.682101). INERT: held positions do NOT re-grow — after scale-in target is pinned at current_pos and only REDUCED by de-risk/tp-harvest/opp_gate, never recomputed to +-size; ratchet never fired. STRUCTURAL INSIGHT (verified): trajectory = scale-in-UP -> FLAT-at-current_pos -> monotone-de-risk-DOWN -> exit; de-risk already monotone non-increasing. Rally position-value TE is TIMING-dominated (entry/exit timing), not held-position size wobble.
2c70344e	0.531924	0.639093	0.214337	0.78	0.82	0.67	0.28	branch	BRANCH OPEN (architectural, Exp1 indep): surgical clean-trend winner ride-suppression — suppress slope+time exit pressure by 0.75*clean(R2 log-HL2-16)*multiday-align(tanh(ret_vlong*pos_dir/0.04))*winning(tanh(pos_pnl/|SL|)). vs baseline 0.578481[b0.782630 c0.767586 s1.013297 r0.282609]: crash RAW 0.767586->0.824186 (+0.0566 GENUINE, stab 1.0), bull +0.0005, rally raw 0.465582->0.463667 BYTE-IDENTICAL stab FROZEN 0.682101->0.682065 (surgical-by-construction CONFIRMED: rally winners=ct-shorts align=0, aligned-longs lose win=0). BLOCKER: sideways raw 1.013297->0.825545 (-0.188) AND stab 1.0->0.809 — suppression fires on 2023 clean drift-up longs, opposing sideways mean-revert tight-exit alpha. NOTE: noise_test uses FIXED_STABILITY_SEEDS (line44), _strategy_hash UNUSED -> AST re-seed lottery OBSOLETE, stability now deterministic+paired. Branch goal: steepen align gate so sideways weak drift(ret_vlong~0.03) falls off while crash(~0.15) stays.
9bfb4bbf	0.578391	0.711481	0.266179	0.78	0.77	1.01	0.28	branch	branch step5 (INHERITED HEAD eval, prior session committed but never recorded): short-only gate on time-ride-suppression. vs baseline 38158e83 0.578481: composite 0.578391 (-0.00009), bull/crash/sideways BYTE-IDENTICAL, rally raw 0.465283 (-0.0003). INERT - the short-gate killed the crash gain (crash byte-flat), disproving the inherited "crash winners are shorts" hypothesis.
2beaa158	0.556947	0.669612	0.225329	0.78	0.77	0.85	0.28	branch	branch step6: vol_ratio gate (replace short-gate). vs baseline: crash BYTE-IDENTICAL 0.767586 (vol gate did NOT fire in crash), sideways raw 1.013297->0.880646 (-0.133, stab 0.960 - vol gate fired in SIDEWAYS instead), bull +0.0002, rally byte-identical. raw_composite 0.659873->0.646437 regressed. vol_ratio fails to separate crash from sideways (opposite of hypothesis).
9db17fef	0.541058	0.649638	0.217161	0.78	0.83	0.70	0.28	branch	branch step7 DIAGNOSTIC: strip 4th gate, pure clean*align*win time-suppression. DECISIVE - crash raw 0.767586->0.831730 (+0.0641 Sh1.31->1.37 stab1.0 LEVER ALIVE), bull +0.0013, rally BYTE-IDENTICAL, sideways raw 1.013297->0.839338 (-0.174 stab0.835 SOLE blocker). raw_composite 0.652900 (+0.0065 vs step6 = progress). Confirms the crash gain is large+real; sideways drift-up longs are the only casualty.
68a4f961	0.541660	0.650322	0.217324	0.78	0.83	0.70	0.28	branch	branch step8: momentum-confirmation gate (fast exit-slope agreement). vs step7: crash BYTE-IDENTICAL 0.831730, sideways raw 0.839338->0.842243 (+0.003 barely moved), raw_composite 0.652900->0.653367 (+0.0005). FAILS to separate - both crash relief-bounce longs AND sideways drift longs are winning longs with positive agreeing slopes.
8d7ae462	0.519715	0.620012	0.200594	0.68	0.81	0.71	0.28	branch	branch step9: profit-velocity gate (peak_pnl/bars_held). REGRESSED - crash raw 0.831730->0.808181 (gate cut crash gain), bull raw 0.783939->0.680489 (-0.103, velocity gate hurt bull slow-grind winners), sideways flat 0.846847. raw_composite 0.653367->0.625727 NO-PROGRESS #1. Profit velocity fails (bull winners are slow grinds too).
eb84aa36	0.542809	0.651498	0.217377	0.78	0.83	0.71	0.28	branch	branch step10: pp-backstop gate (suppress TIME only when peak>=_pp_min so pp_pressure trailing covers downside). crash raw 0.829644 (+0.062 KEPT), bull 0.784516 (+0.002 PRESERVED), rally byte-identical, BUT sideways raw 0.846847 (-0.166 STILL BROKEN stab0.838). raw_composite 0.653863. Sideways winning drift-longs reach large peaks too = structurally identical to crash relief-bounce longs on peak magnitude.
ae76e753	0.578481	0.711530	0.266099	0.78	0.77	1.01	0.28	discard	BRANCH SUMMARY (surgical clean-trend ride-suppression, INHERITED dangling branch from prior session row742; ran steps 5-10 this session, REVERTED to 38158e83). strategy.py restored byte-identical to baseline 38158e83 0.578481 (git checkout -- strategy.py, verified 0 diff; results.tsv untouched). GENUINE LEVER (step7 diagnostic, all stab 1.0, rally byte-identical): suppress TIME exit pressure for clean(R2)+multiday-aligned(ret_vlong)+winning holds -> crash raw 0.767586->0.831730 (+0.0641 Sh1.31->1.37), bull +0.0013. SOLE BLOCKER: sideways raw 1.013297->0.839338 (-0.174). Tried 6 ORTHOGONAL separators to decouple crash-relief-bounce-longs from sideways-drift-up-longs, ALL FAILED: (step inherited-4) ret_vlong-magnitude, (5) direction/short-only, (6) vol_ratio, (8) slope-momentum, (9) profit-velocity peak/bar [also hurt bull -0.10], (10) pp-backstop peak>=_pp_min [kept crash+bull but sideways still -0.166]. CONCLUSION (load-bearing): crash relief-rally winning longs and sideways drift-up winning longs are STRUCTURALLY IDENTICAL on every noise-robust axis (same position type=clean+multiday-aligned+winning LONG, same large peaks, same agreeing slopes); the inherited "crash=shorts/sideways=longs" diagnosis is WRONG (step5 short-gate killed crash). The only remaining separator is return mean-reversion character = FORBIDDEN smooth regime classifier. Crash +0.064 EXIT-TIMING lever is REAL but walled by sideways coupling. All branch step composites 0.520-0.557 < baseline 0.578481. BASELINE UNCHANGED 38158e83 0.578481 [bull 0.78 crash 0.77 sideways 1.01 rally 0.28 raw0.466 stab0.682 factor0.607=SOLE binding].
f25806bb	0.594627	0.720481	0.251707	0.79	0.76	1.01	0.32	keep	KEEP (NEW BASELINE, SUPERSEDES eff65bdc 0.578481). Exp1 ct-gated temporal EMA on EMITTED position target (final held LEVEL; alpha=0.5*max(0,tanh(-pos_dir*ret_vlong/0.04)); resize-only, exits/flips exempt; reset on full exit). NEW smoothing POINT vs prior exit-pressure EMA (734) + voter_bias EMA (cfc48165) which smooth upstream signals; this catches all resize sources (de-risk ramp+opp-gate+scale-in+tp-harvest) at terminal confluence. MEASURED vs eff65bdc: composite 0.578481->0.594627 (+0.016146), mean 0.711530->0.720481 (+0.008951), std 0.266099->0.251707 (-0.014392), raw_composite 0.660004->0.655536 (-0.004468). rally raw 0.465582->0.455549 (-0.010033) but STABILITY 0.682101->0.709803 (+0.027702), factor 0.607002->0.699344 (+0.092342), rally score 0.282609->0.318585 (+0.035976). bull raw 0.782630->0.785376 (+0.002746, stab 0.828->0.819 still factor 1.0). crash 0.767586->0.764665 (-0.002921, -0.4pct). sideways 1.013297 BYTE-IDENTICAL (low ret_vlong spared). MaxDD bull1.25/crash0.72/sideways0.45/rally1.79 pct all<10. All keep criteria met. NEW BASELINE 0.594627.
-	0.594627	0.720481	0.251707	0.79	0.76	1.01	0.32	discard	Exp2 (architectural, indep): counter-trend-adaptive entry-readiness EMA memory (per-side RHO 0.5->0.78 via tanh(+-ret_vlong/0.04); bull when ret_vlong<0, bear when ret_vlong>0). MEASURED vs f25806bb baseline 0.594627: BYTE-IDENTICAL on all 4 regimes (composite/mean/std/raw_composite AND every per-regime raw+stability identical: rally raw 0.455549 stab 0.709803 unchanged). INERT: the readiness gate _acc>=0 tests the EMA SIGN; when entries fire the conviction margin is persistently signed, so changing EMA memory does not move which bar crosses zero -> neither clean nor perturbed trade set changes. Readiness EMA memory is NOT the entry-timing-binding lever. Discard: no composite improvement.
-	0.594787	0.720569	0.251565	0.79	0.76	1.01	0.32	discard	Exp3 (architectural, indep): ct-gated max_hold shortening (-2*tanh(-pos_dir*ret_vlong/0.04) bars) to route ct exits onto noise-immune time gate. MEASURED vs f25806bb 0.594627: composite +0.000160 (0.594787), mean +0.000088, std -0.000142, raw_composite 0.655536->0.658358 (+0.002822). bull/crash/sideways raw+stability BYTE-IDENTICAL (signed ct gate spares trend-aligned + low-ret_vlong sideways). rally raw 0.455549->0.461988 (+0.006439 = faster ct-loser exit IS raw-positive), but rally STABILITY 0.709803->0.707109 (-0.002694, factor 0.699344->0.690363) -> rally score +0.000354 only (raw gain ~cancels factor drop). DISCARD despite passing gates: +0.00016 composite is noise-floor (0.027pct), degrades binding-constraint rally stability, +18 LOC; design intent (stability LIFT via time-gate routing) FALSIFIED — stability fell. FINDING (non-noise): shortening ct max_hold raises rally raw +0.0064.
-	0.594619	0.720476	0.251714	0.79	0.76	1.01	0.32	discard	Exp4 (architectural, indep): counter-trend-deepened conviction-margin size FLOOR (0.70->0.45 for ct entries via tanh(-+ret_vlong/0.04), decisive margin>=0.40 still 1.0). MEASURED vs f25806bb 0.594627: composite 0.594619 (-0.000008 noise floor), mean -0.000005, raw_composite +0.000003. rally raw 0.455549->0.455554 (+0.000005), rally STABILITY 0.709803->0.709788 (-0.000015) -> both ~identical. bull/crash/sideways BYTE-IDENTICAL. INERT: deepening the ct first-bar size floor is REDUNDANT with the existing _ct_vlong 0.40x shrink that ALREADY minimizes counter-trend first-bar position value -> marginal ct first-bar entries are NOT the residual rally-TE source. Discard: composite did not improve.
b0e5fe37	0.595631	0.721039	0.250816	0.79	0.76	1.01	0.32	keep	KEEP (NEW BASELINE, SUPERSEDES f25806bb 0.594627). Exp5 fast-saturating ct max_hold shortening: _max_hold -= 2.0*max(0,tanh(-pos_dir*ret_vlong/0.01)) (FAST-saturating /0.01 vs Exp3's linear /0.04). Routes counter-trend (rally pullback-short) exits onto the noise-immune bar-counter time gate; saturated tail makes the shortening near-constant so the exit bar does not track noise. MEASURED vs f25806bb: composite 0.594627->0.595631 (+0.001004), mean 0.720481->0.721039 (+0.000558), std 0.251707->0.250816 (-0.000891), raw_composite 0.655536->0.659110 (+0.003574). bull/crash/sideways raw+stability BYTE-IDENTICAL (signed ct gate spares trend-aligned, low-ret_vlong sideways). rally raw 0.455549->0.463707 (+0.008158 faster ct-loser exit), rally STABILITY 0.709803->0.707556 (-0.002247, factor 0.699344->0.691852), rally score 0.318585->0.320817 (+0.002232: raw gain outweighs small stab dip). MaxDD bull1.25/crash0.72/sideways0.45/rally1.78 all<10. All keep gates met. NOTE: Exp3 same mechanism at linear scale 0.04 netted only +0.00016 (raw +0.0064, stab -0.0027); fast-saturation captured larger raw +0.0082 at similar stab cost = net positive. NEW BASELINE 0.595631.
8e5a77da	0.713355	0.788490	0.150270	0.79	0.76	1.01	0.59	keep	BRANCH KEEP step5 (NEW BASELINE, SUPERSEDES b0e5fe37 0.595631). Branch=strengthen Exp1 emitted-target EMA: ct gate linear/0.04 -> fast-saturating/0.01 (Exp5 lesson) + alpha cap swept 0.5->0.70(s1)->0.85(s2)->0.92(s3)->0.97(s4)->0.99(s5). Fast-sat gate makes rally's solidly-positive ret_vlong sit in tanh flat tail -> near-CONSTANT strong alpha low-passing the held counter-trend (rally pullback-short) position LEVEL noise-free. MEASURED step5 vs b0e5fe37: composite 0.595631->0.713355 (+0.117724 +19.8pct), mean 0.721039->0.788490 (+0.067451), std 0.250816->0.150270 (-0.100546), raw_composite 0.659110->0.713355 (+0.054245). rally raw 0.463707->0.591867 (+0.128160, Sharpe 0.84->1.15), rally STABILITY 0.707556->0.804968 (+0.097412, factor 0.691852->1.000000 -> CLEARED 0.80 knee, NO penalty), rally score 0.320817->0.591867 (+0.271050 +84pct). bull 0.785376->0.793478 (+0.008102, bull shorts are ct -> smoothed; stab 0.807 still factor 1.0). crash 0.764665->0.755319 (-0.009346 -1.2pct). sideways 1.013297 BYTE-IDENTICAL (low ret_vlong spared). MaxDD bull1.25/crash0.67/sideways0.45/rally1.83 all<10. flip_count 0 all. Alpha sweep monotonic in composite (s1 0.671->s5 0.713); rally stability factor maxed at 1.0 by s5 (raw saturated ~0.60 by s3, then mild lag erosion) = peak. All keep gates pass decisively. NEW BASELINE 0.713355.
8e5a77da	0.713355	0.788490	0.150270	0.79	0.76	1.01	0.59	session-summary	SESSION: 2 independent architectural KEEPS (Exp1, Exp5) + 1 exploration branch (5 steps) KEPT. NEW BASELINE 0.713355 SUPERSEDES eff65bdc 0.578481 (+0.134874 composite, +0.076960 mean, std 0.266099->0.150270). Anomaly resolved at session start: de412448 0.6393 was OLD scoring; line 703 avg5-seed methodology change re-baselined to eff65bdc 0.578481 (correctly = HEAD). BINDING was rally stability 0.682 (factor 0.607) on healthy raw 0.466. THEME: counter-trend-DIRECTION-gated (signed -pos_dir*ret_vlong) noise reduction on rally pullback-shorts; bull/crash/sideways spared by construction. Exp1 KEEP (0.578481->0.594627): ct-gated temporal EMA on EMITTED position target (final held LEVEL, NEW smoothing point vs prior upstream exit-pressure/voter_bias EMAs) -> rally stab 0.682->0.710. Exp2 discard (INERT): ct-adaptive entry-readiness RHO -> byte-identical (readiness zero-crossing robust to EMA memory). Exp3 discard: ct max_hold shortening linear/0.04 -> rally raw +0.0064 but stab -0.0027, net +0.00016 noise-floor. Exp4 discard (INERT): ct-deepened conv-margin size floor -> redundant with existing _ct_vlong 0.40x shrink. Exp5 KEEP (0.594627->0.595631): SAME max_hold mechanism but FAST-saturating/0.01 -> rally raw +0.0082 (Sharpe 0.82->0.84) net positive. BRANCH (on Exp1's lever): fast-sat gate/0.01 + alpha 0.5->0.99 swept over 5 steps, monotonic composite climb 0.671->0.713 -> rally stability 0.708->0.805 (factor 0.692->1.000 CLEARED 0.80 knee) + rally raw->0.592 (Sharpe->1.15), rally score 0.321->0.592 (+84pct). CROSS-EXPERIMENT CONCLUSION: counter-trend held-position-LEVEL smoothing (emitted target EMA, fast-sat near-constant strong alpha) is the load-bearing rally-stability lever; entry-readiness memory and entry-size floors are INERT (ct first-bar positions already minimized by _ct_vlong); exit-TIMING routing (max_hold) gives small raw gains. strategy.py verified == 8e5a77da, reproduces composite 0.713355. Branch concluded KEEP -> session ends.
