commit	score	mean_score	std_score	bull_2021	crash_bear	sideways	rally_2024	status	description
89593e7	0.649	0.502	0.098	0.66	0.47	0.49	0.39	keep	simplification — remove trend-agreement scale-in override (architectural code-structure removal) — composite +0.004 vs 0.6448 baseline, mean +0.0006. Crash +0.005 (slightly tighter scale-in attenuation in crash recovery doesn't hurt), bull -0.003, sideways flat, rally flat. Std narrowed 0.100->0.098. Trend was already filtered at entry-time by TREND_GATE_DEADZONE; re-checking during scale-in was redundant. LOC reduction contributes simplicity bonus to composite. New baseline.
-	0.385	0.351	0.334	0.66	0.47	0.49	-0.21	discard	simplification — remove count gate from opp_gate (architectural code-structure removal) — catastrophic rally -0.604 (sharpe turned negative). Bull/crash/sideways flat. Removing the bull_votes>=FLIP_MIN_VOTES count gate caused rally bear positions to flip on bull-voter conviction spikes during rally pullbacks (where strong-sum trips but the count gate would have required broader voter agreement). The count gate is load-bearing AT EXIT side even though redundant at entry side — opp_gate fires on coarser sustained-direction signal, where count provides extra noise filter that strong-sum doesn't fully replace.
-	-0.007	0.010	0.401	0.19	-0.47	0.57	-0.25	discard	intra-bar close-position exit-confirmation pressure (architectural new exit term using OHLC intra-bar relationship) — catastrophic composite -0.656 vs 89593e7. Crash crushed -0.94, bull -0.47, rally -0.64. Sideways improved +0.08 (chop closes oscillate, providing balanced pressure). Mechanism fires far too broadly: in trending regimes intra-bar weak/strong closes are NORMAL during pullbacks of winning trend positions (bull positions naturally see some weak-close pullback bars); 0.4 cap is far too high. The intra-bar close-position signal correlates with reversal in chop but not in trends — adding it as an unconditional exit term destroyed trend-regime profits.
-	0.655	0.506	0.096	0.66	0.47	0.49	0.40	discard	simplification — remove dead in_cooldown variable and its gates (architectural code-structure removal) — composite +0.001 vs 291a466 (LOC bonus only), mean exactly flat (all per-regime scores identical to baseline). Pure dead-code removal as expected. Fails strict mean criterion (flat ≠ improved). Behavior preserved; small LOC bonus offset by exact regime match. Note: this dead-code removal could be safely reapplied if the keep criterion were changed to mean ≥ baseline.
291a466	0.654	0.506	0.096	0.66	0.47	0.49	0.40	keep	simplification — remove _ramp_attn pnl-attenuator from scale-in (architectural code-structure removal) — composite +0.005 vs 89593e7 baseline, mean +0.004. Rally +0.014 (largest gain: pnl-attn was paradoxically suppressing some rally entries that had transient pullback during scale-in but then recovered — pure mechanical ramp captures more of those), bull +0.003, crash -0.003 (tiny), sideways -0.005 (tiny). Std flat. Mechanism overlapped with multi-channel adverse-scale-in protection (slope ramp + ct_atten + consensus_atten). LOC reduction contributes simplicity bonus. New baseline. NOTE: row inadvertently missing from initial append; re-appending to restore permanent record.
645c755	0.664	0.509	0.095	0.67	0.46	0.49	0.42	keep	simplification — remove vol_confirm_mult near-constant size multiplier (architectural code-structure removal) — composite +0.009 vs 291a466 baseline, mean +0.003. Rally +0.017 (largest gain — vol_confirm_mult floor 0.98 was tightening rally entries occasionally), bull +0.008, sideways flat, crash -0.007 (small). Std flat. Mechanism was bounded [0.98,1.10] near-constant ~1.0; redundant with vol_ratio/calm_boost/sideways_boost. LOC reduction contributes simplicity bonus. New baseline.
exp5	0.661	0.501	0.103	0.67	0.47	0.48	0.39	discard	simplification — remove trade-frequency self-regulator + _entry_bar_history state (architectural code-structure removal) — composite -0.003 vs 645c755, mean -0.008. Rally -0.034 (0.413 to 0.386, frequency tightening was protecting against rally-pullback entries that pull losses), sideways -0.007. Bull/crash flat. _freq_factor is load-bearing for rally entry filtering despite correlation with strong-sum — the +0..20% extra admission cost appears to filter a small set of frequency-clustered low-quality entries that pure conviction doesnt reject. Reverted.
-	0.616	0.480	0.135	0.67	0.47	0.49	0.29	discard	slope-confirmation gate on opp-side voter_bias (architectural new cross-component data dep) — composite -0.048 vs 645c755, mean -0.029. Rally crushed -0.131 (0.42 to 0.29 — opposite of expectation). When slope still agrees with position, attenuating opp_bias to 0.5x lets bull-voter spikes during rally pullbacks NOT exit rally bear positions; those positions then hold into the rally rebound and lose. Crash +0.018 (intended — winning crash shorts protected from voter false-reversal). Bull/sideways flat. Slope-confirmation is wrong direction for rally where slope frequently flickers within pullbacks of dominant trend.
a6eec7a	0.665	0.512	0.095	0.67	0.47	0.49	0.42	keep	bilateral-conviction-quality entry size attenuator (architectural new cross-voter data dep at entry) — composite +0.0008 vs 645c755, mean +0.003. Crash +0.011 (largest gain — bilateral noise filtering most active in crash where voters split frequently on volatility), sideways +0.0027, rally -0.005 (mild regression — some marginal pullback entries cut size that would have succeeded), bull -0.001 (essentially flat). Std flat at 0.095. All four regimes positive. New baseline.
-	-0.031	-0.049	0.359	-0.27	-0.12	0.55	-0.36	discard	trend-aligned mature-position exit-threshold buffer (architectural new cross-component data dep) — catastrophic composite -0.697 vs a6eec7a. Bull crushed -0.94, rally -0.78, crash -0.59. Sideways +0.063 (the one regime that benefited from longer holds in chop). Extending exit_thresh in trend regimes let positions hold past natural exit and absorbed large drawdowns (bull DD 12.9%, crash DD 11.5%). The mature trend exit_thresh = 1.0 was load-bearing — _exit_pressure crossings at 1.0 in trend regimes are not noise spikes; they are real reversal signals. Reverted.
-	0.660	0.512	0.095	0.67	0.47	0.49	0.41	discard	direction-aware concurrent-position attenuator (architectural new cross-symbol position-sign data dep) — composite -0.005 vs a6eec7a, mean essentially flat (0.512). All per-regime within 0.001 (bull -0.0002, crash -0.0005, sideways +0.001, rally -0.0002). Mechanism barely fires: opposite-direction concurrent positions are rare events because BTC/ETH/SOL move together in dominant regimes. The diversification credit (0.4x weight on opposite positions) is structurally minimal. Loss came from LOC overhead (17 lines).
-	0.661	0.512	0.095	0.67	0.47	0.49	0.41	discard	trend-direction-asymmetric admission threshold (architectural multi-var cross-timescale data dep) — composite -0.003 vs a6eec7a, mean essentially flat (0.512). All per-regime within 0.001 of baseline (rally -0.0003, others identical). Mechanism redundant with existing _ct_atten (counter-trend size cut already at 0.7x in trend); +12% threshold tightening rejects very few marginal entries that were already going through at attenuated size. Loss came from LOC overhead.
-	0.288	0.245	0.300	0.55	0.14	0.49	-0.20	discard	range-extreme profit-lock exit pressure 6th source (architectural new data dep on 20-bar range) — catastrophic composite -0.377 vs a6eec7a. Rally -0.62, crash -0.33, bull -0.12. Range-extreme on winning positions over-fires in trending regimes where prices SHOULD extend through 20-bar range — penalizes legitimate trend continuation. Sideways flat (positions don't reach extremes). Mechanism direction wrong: range-extreme is mean-reverting signal, but winning positions in trends are by definition pushing through ranges.
-	-0.182	-0.172	0.411	-0.36	-0.40	0.54	-0.46	discard	volume-confirmation multiplier on exit soft_sum (architectural new cross-bar volume dep) — catastrophic composite -0.847 vs a6eec7a. Bull/crash/rally crushed (sharpes turned negative). Sideways +0.05 (only beneficiary — chop genuinely had noise reduction). Multiplier dampens slope/pp/time uniformly during low-vol bars even when they carry real signal, holding losing trend positions too long. Volume-confirmation as multiplier is structurally wrong — soft pressures need to fire on adverse moves regardless of volume since slow grinding losses are by definition low-volume.
-	0.274	0.254	0.342	-0.31	0.52	0.54	0.26	discard	smoothmax fusion of soft exit pressures (architectural fusion-topology change) — composite -0.391 vs a6eec7a. Bull crushed -0.97 (sharpe turned negative — extended holds let bull positions absorb deep givebacks). Crash +0.05, sideways +0.05, rally -0.16. Replacing additive sum with smoothmax(k=4) cuts effective exit pressure substantially since concurrent moderate pressures no longer compound; bull regime relied on pressure compounding for timely exits. Additive sum was load-bearing for bull profit-locking via multi-source pressure agreement.
-	0.657	0.512	0.095	0.67	0.47	0.49	0.42	discard	entry-anchored stop-loss magnitude (architectural new state dep on entry-bar ATR) — composite -0.008 vs a6eec7a, mean +0.0001 (flat). Sideways +0.003, crash +0.001, rally -0.005, bull flat. Mechanism barely differentiates: stop_abs is clamped to [0.018, 0.035] so the entry-vs-current ATR delta within position lifetimes is small. Stop magnitude varies little; anchoring vs re-computing produces near-identical exit decisions. Composite loss came from LOC overhead.
-	0.670	0.479	0.047	0.54	0.46	0.50	0.42	discard	simplification — remove per-voter persistence_mult weighting (architectural code-structure removal) — composite +0.005 vs a6eec7a (LOC bonus dominated; mean -0.033). Bull crushed -0.13 (0.67->0.54). Crash -0.01, sideways +0.01, rally flat. Persistence-mult IS load-bearing for bull regime: bull voters DO sustain direction over 8-bar windows in trending bull markets, and the up-to-1.3x weight materially boosts the strong-sum needed for size scaling. Removing collapses bull voter weight to base, reducing effective conviction-based size in bull. Failed mean criterion.
-	0.666	0.510	0.089	0.65	0.45	0.53	0.42	discard	simplification — remove pnl-scale weight amplification from _w_slope and _w_pp (architectural code-structure removal) — composite -0.0004 vs 13e7cf1, mean -0.005. Bull -0.02 (load-bearing: loss-side _w_slope boost was cutting bull pullback losses faster). Crash/sideways/rally flat. Std improved 0.097->0.089 (consistency gain) but mean loss dominates. _w_slope loss-amp is genuine — it adds 15% slope-pressure when in loss, which catches bull pullback reversals faster.
e27634a	0.667	0.518	0.095	0.67	0.45	0.53	0.42	keep	trend-aligned opp-side voter_bias attenuator (architectural new cross-component data dep) — composite +0.002 vs a6eec7a, mean +0.006. Sideways +0.036 (unexpected large gain — opp-bias attenuation actually most active in chop where ret_long is near zero, so attenuation is minimal; the gain must come from secondary effect: trend-aligned positions in marginal trends are more often held through small opp-voter signals, capturing sideways trend continuations). Rally +0.005, bull flat, crash -0.018 (mild — trend-aligned crash shorts during dead-cat bounces held slightly longer, absorbed some bounce DD). Std flat at 0.095. All four regimes positive. New baseline.
-	0.645	0.506	0.089	0.64	0.43	0.53	0.42	discard	exit-pressure persistence gate (architectural temporal hysteresis on soft_sum) — composite -0.022 vs e27634a, mean -0.012. Bull -0.027 (largest regression — single-bar pp/time spikes were legitimately triggering bull profit-locks; gating them softens timely exits). Crash -0.020, sideways -0.004, rally +0.003 (tiny). Persistence gate over-attenuates first-bar of sustained pressure runs — 0.65 floor when prev was zero blocks legitimate fast-pressure exits. Mechanism direction wrong for trending profit regimes.
-	0.663	0.518	0.092	0.67	0.45	0.54	0.41	discard	profit-confirmed scale-in acceleration (architectural new pnl-driven ramp progress) — composite -0.004 vs e27634a, mean +0.000. Sideways +0.010 (small wins reach full size faster), but rally -0.009 (counter-trend rally bear positions transiently profit during pullbacks then reverse — accelerated to full size before the rebound, larger losses). Bull/crash flat. Mechanism direction wrong for rally where transient profits often precede reversals; would need direction-confirmed long-window trend gate.
-	0.661	0.517	0.090	0.67	0.45	0.53	0.42	discard	trend-aligned profit-confirmed scale-in acceleration (architectural multi-var combining exp2 with trend gate) — composite -0.006 vs e27634a, mean -0.001. Sideways +0.004 (preserved some chop gain), rally -0.004 (trend-aligned bull longs in rally accelerated near peaks before reversal pullbacks), bull flat, crash +0.001. The trend-aligned gate filtered counter-trend false acceleration but introduced same-direction over-commitment near rally extremes. Scale-in acceleration mechanism is double-edged — fast position commitment captures alpha but amplifies peak-timing errors.
-	0.653	0.518	0.090	0.67	0.45	0.53	0.42	discard	post-stop-loss same-direction entry attenuation (architectural new exit-type state) — composite -0.014 vs e27634a, mean +0.000. Rally +0.005, crash +0.002, bull flat, sideways -0.004. SL-attenuation does provide rally/crash benefit (regimes with most SL events) but mean is flat and LOC overhead pulls composite down. Mechanism magnitude too small relative to LOC cost; would need broader effect or deeper integration to overcome simplicity penalty.
-	0.451	0.357	0.179	0.08	0.45	0.52	0.38	discard	outcome-feedback admission threshold (architectural new self-correcting state) — catastrophic composite -0.216 vs e27634a. Bull crushed -0.59 (0.67->0.08). Crash flat, sideways -0.008, rally -0.04. Self-correcting feedback over-restricts bull entries: bull regime requires frequent re-entry after small adverse moves; outcome history flips negative after a few losing partial-exits and locks out subsequent valid re-entries during sustained uptrend. Feedback mechanism wrong-directional in trend regimes where loss streaks are noise-on-trend not regime-rejection.
-	0.654	0.514	0.099	0.67	0.45	0.54	0.41	discard	smooth-min fusion of entry size attenuators (architectural composition-rule change) — composite -0.014 vs e27634a, mean -0.004. Sideways +0.005 (chop entries with only 1-2 mild attenuators got larger commitment), bull -0.003, crash -0.004, rally -0.014 (mild compounding of multiple soft attenuators IS load-bearing for rally/crash; smooth-min lets one dominant signal mask multiple mild warnings). Multiplicative product captures cumulative-evidence semantics that smooth-min discards.
-	0.662	0.517	0.092	0.66	0.45	0.53	0.43	discard	conviction-recheck scale-in pause gate (architectural new control flow on scale-in) — composite -0.005 vs e27634a, mean -0.001. Rally +0.006 (intended — fading-conviction marginal rally entries paused mid-scale-in). Crash -0.018 (largest regression — crash short scale-ins frequently hit transient pullback bounces that depress strong-sum below 0.85x threshold mid-ramp; pause prevents reaching full size before the trend resumes). Bull -0.007, sideways -0.004. Mechanism direction wrong for crash where post-entry conviction noise is structural to volatile bear regimes.
-	0.126	0.144	0.409	0.57	-0.19	0.53	-0.33	discard	volume-trend divergence 6th soft exit pressure (architectural new data dep on volume slope) — catastrophic composite -0.541 vs e27634a, mean -0.374. Crash -0.64 (sharpe negative) and rally -0.75 crushed. Bull -0.10, sideways flat. Mechanism wrong-direction in trend regimes: in crash/rally, profitable positions are by definition pushing through declining-volume continuation phases (volume often rises only at exhaustion/reversal points, not during steady trend). Firing exit pressure on declining-volume + favorable-price exits winning trend positions during their core profitable runs.
-	0.649	0.519	0.094	0.67	0.45	0.53	0.43	discard	cross-symbol relative-strength contrarian-entry attenuator (architectural new cross-symbol data dep at entry) — composite -0.018 vs e27634a, mean +0.001 (essentially flat). Rally +0.005, sideways -0.004, bull -0.001, crash flat. Mechanism barely fires: in trending regimes BTC/ETH/SOL move highly correlated so spread between best/worst is small relative to the 0.005 floor; the 0.20 max attenuation rarely meaningfully discounts entries. LOC overhead (37 lines) dominated the composite loss.
-	0.667	0.517	0.095	0.67	0.45	0.53	0.42	discard	simplification — remove _concurrent_atten cross-symbol position attenuator (architectural code-structure removal) — composite +0.0001 (LOC bonus only), mean -0.002. Rally +0.005 (intended — multi-symbol rally pile-ups got more size), but crash -0.005, sideways -0.004, bull -0.001. Concurrent attenuator IS load-bearing for multi-symbol-correlated regimes: 0.82-0.92x size cut on concurrent entries genuinely reduces stress during simultaneous multi-symbol entries that all face same noise. Failed strict mean criterion.
-	0.045	0.055	0.400	0.28	-0.02	0.52	-0.56	discard	voter-consensus-tilted exit threshold (architectural new cross-bar data dep on voter aggregate) — catastrophic composite -0.622 vs e27634a, mean -0.463. Rally crushed -0.97, bull -0.39, crash -0.47 (turned negative). Sideways flat. Voter-mean aggregated across 8 bars and 7 voters is too noisy to modulate exit threshold; signed-mean tilts wrong-direction frequently in trending regimes (e.g., rally pullback voters fire bear briefly, lowering exit thresh on long-bias longs at exactly the wrong moment). Even +/- 8 percent is enough to break exit timing. Mechanism wrong-grain: voter aggregate is per-bar entry signal, not per-bar exit threshold modulator.
-	0.655	0.516	0.098	0.67	0.45	0.53	0.41	discard	bar-range-burst entry size attenuator (architectural new cross-bar intra-bar data dep) — composite -0.012 vs e27634a, mean -0.002. Rally -0.010 (bursts on rally pullback bars are exactly where counter-trend bear entries succeed; burst-attenuating cuts size on those legitimate entries that catch the bounce-then-resume), bull +0.001, crash +0.002, sideways -0.004. Mechanism direction wrong for rally where burst bars correlate with reversal points that benefit from full first-bar commitment.
e084828	0.691	0.545	0.078	0.67	0.45	0.53	0.53	keep	adverse-recovery exit pressure 6th source via new MAE state (architectural new per-symbol low-water state + new control flow) — composite +0.024 vs e27634a, mean +0.027. Rally +0.107 (huge — sharpe 0.92->1.65, annual return 5.1%->10.9%; rally regime had many counter-trend bear positions that dipped then recovered to small loss before reversing into deeper losses, MAE-recovery pressure exits those at small loss). Bull/crash/sideways scores IDENTICAL to baseline (mechanism activates only on losing positions with meaningful MAE depth, which rarely occurs in those regimes given existing slope/sl exits). Std narrowed 0.095->0.078 (consistency gain). All MaxDD<5%. New baseline.
-	0.656	0.522	0.091	0.67	0.46	0.53	0.44	discard	plateau-aware pp_pressure boost via new _peak_bar state (architectural new state dep) — composite -0.035 vs e084828, mean -0.023. Rally -0.095 (catastrophic — plateau boost over-fired on winning rally positions whose peaks plateau during natural pullback phases, eroding the rally gain from MAE state). Bull flat, crash +0.005 (tiny), sideways flat. Plateau-as-stagnation hypothesis wrong-directional for rally where peak-plateau phases often precede further trend resumption rather than reversal. Mechanism conflicts with the recently-keep MAE recovery mechanism.
-	0.690	0.545	0.078	0.67	0.45	0.53	0.53	discard	multi-channel co-firing bonus on exit fusion (architectural new cross-component data dep) — composite -0.001 vs e084828, mean essentially flat. Bull flat, crash +0.001, sideways -0.005, rally -0.001. Mechanism barely fires: sl_pressure rarely co-occurs at moderate magnitude with soft_sum because sl saturates quickly (band 0.06-0.20 of stop_abs gives narrow sl ramp); when sl is firing it's already large, and co-fire bonus is dominated by max(). Multi-channel hypothesis correct directionally but scaling makes the co-fire term marginal.
-	0.357	0.336	0.321	0.65	0.41	0.48	-0.20	discard	smooth opp-gate replacing 3-binary-AND boundary (architectural decision-architecture change) — catastrophic composite -0.334 vs e084828, mean -0.209. Rally crushed -0.730 (turned negative -0.197 from +0.532; sharpe -0.246, annual -0.31%). Crash -0.046, sideways -0.046, bull -0.014. Smooth product fires on weak evidence many times per regime, accumulating tiny scale-downs that erode winning positions. Binary 3-AND gate was load-bearing as a HIGH bar filtering transient evidence — replacing with smooth gradient lets noise accumulate. Decision-architecture change wrong direction: opp-gate needs to be a high bar (binary) precisely because partial fires waste positions to noise.
-	0.216	0.144	0.246	0.28	-0.20	0.45	0.05	discard	simplification — remove _opp_gate (architectural code-structure removal) — catastrophic composite -0.475 vs e084828, mean -0.401. Crash crushed -0.656 (turned negative -0.205, sharpe -0.26, MaxDD 10.1%), rally -0.481 (MaxDD 7.2%), bull -0.388 (MaxDD 4.1%), sideways -0.079. _opp_gate IS load-bearing: when opp votes pass binary threshold, the forced FULL/graduated exit cuts decisively-reversed positions. voter_bias 0.20 weight insufficient to exit reversed positions through standard threshold; they hold too long and absorb deep drawdowns. Reversal-decisiveness pathway (_opp_gate) and reversal-evidence pathway (voter_bias) are NOT redundant — they operate at different evidence-strength regimes.
