commit	score	mean_score	std_score	bull_2021	crash_bear	sideways	rally_2024	status	description
1de1e17	0.392	0.567	0.350	0.436	0.798	0.972	0.061	branch	BRANCH OPEN: squared-pressure derisk mapping replaces linear (architectural, functional-form change at exit graduation). Composite -0.094 vs baseline 5c9e32e 0.486 (0.486->0.392). Per-regime: bull -0.326 (0.761->0.436 raw -0.123 stab 0.823->0.682 - significant regression but >50pct floor 0.381 not breached), crash +0.030 (0.768->0.798 stab 0.825->0.875), SIDEWAYS +0.075 (0.897->0.972 stab 0.884->0.840), rally -0.060 (0.121->0.061 raw 0.411->0.271 stab 0.435->0.363). Sideways/crash gains real (low-vol chop benefits from noise-insensitive near-floor derisk). Bull/rally regression: positions hold deeper into pressure ramp -> later full exit at saturation -> miss exit timing windows in trends. BRANCH HYPOTHESIS: gate squared mapping by inverse trend-strength (continuous blend with linear) - squared in chop/sideways (preserve gains), linear in trends (preserve fast response).
-	0.486	0.637	0.303	0.761	0.768	0.897	0.121	discard	BRANCH SUMMARY (squared-pressure derisk mapping, 7 steps total): all branch steps reverted, baseline 5c9e32e restored. Step 1 OPEN (1de1e17): pure squared mapping - sideways +0.075/crash +0.030/bull -0.326/rally -0.060 (composite -0.094). Step 2 (1237be4): trend-blended (0.04 scale) - rally +0.131 best result/bull -0.241/composite +0.002 mean -0.025 (failed mean criterion). Step 3 (3c0eb5): hybrid 0.5*lin+0.5*sq - sideways crashed -0.779. Step 4 (e28bc75): trend-blended sharp 0.025 - bull recovered/rally regained 0.024 (no rally lift retained). Step 5 (5e0e720): PNL-blended profit-squared - sideways +0.087/bull -0.518 catastrophic. Step 6 (ba3e29e): VOL-blended low-vol-squared - mixed regressions all-around. Step 7 (b262eb5): trend×profit AND blend - bull -0.466/rally +0.014 minimal. CONCLUSION: squared-pressure derisk mapping has fundamental rally-vs-bull conflict that no conditioning dimension (trend, pnl, vol, intersect) resolves. Squared shape held bull positions deeper into pressure ramps causing late saturation exits; conditioning that protected bull cancelled the rally gain. Sideways gain (+0.075 in step 1) is real but cannot be retained while preserving the other 3 regimes. Functional-form shift on exit graduation is structurally hostile to multi-regime balance. SESSION END (branch terminated, 4 independent discards + branch revert).
-	0.327	0.500	0.347	0.255	0.777	0.899	0.070	discard	softmax-weighted exit fusion replaces discrete MAX (architectural, beta=8 softmax blend at _soft_max boundary). Composite -0.159 vs 5c9e32e 0.486->0.327. BULL CATASTROPHIC -0.506 (0.761->0.255 raw 0.736->0.699 small dip but stab 0.823->0.364 — VIOLATES 50pct floor 0.381), rally -0.051 (0.121->0.070 raw 0.394->0.392 flat but stab 0.492->0.180 worse not better — opposite of hypothesis), crash +0.009 (0.768->0.777), sideways +0.002 (0.897->0.899). Mechanism failure: softmax with beta=8 still gives top term ~99pct weight in clear-winner cases but at top-2-close boundaries it BLENDS noise from both. MAX isolates noise to winner only; softmax aggregates noise additively across near-top terms. Bull/rally stability collapsed because pp/slope/time terms often near each other in trending profitable holds — blend now responds to noise in pp AND slope AND time simultaneously instead of just the winner. Fusion-smoothing wrong direction for stability.
-	0.431	0.581	0.300	0.567	0.768	0.887	0.101	discard	trend-adaptive slope windows for exit-slope (architectural multi-variable, window selection data-dep on ret_long, 12-22/16-30/22-40 chop-trend mapping). Composite -0.055 vs 5c9e32e 0.486->0.431. BULL -0.194 (0.761->0.567 raw 0.736->0.764 minor IMPROVE but stab 0.823->0.742 COLLAPSED), crash flat, sideways -0.010, RALLY -0.020 (raw 0.394->0.391 flat but stab 0.492->0.258 WORSE not better — opposite of hypothesis). Mechanism failure: making window LENGTH itself noise-dependent compounds noise — ret_long is noise-affected, window selection depends on ret_long, slope-of-window depends on window-length. Under perturbation, slope output now responds to both noise-in-prices AND noise-in-window-choice multiplicatively. Window-length-as-variable hurt stability everywhere it activated (trend regimes). Counter to hypothesis that longer trend windows would smooth pullback noise — the cost of variable-window is greater than the smoothing gain.
-	0.296	0.480	0.368	0.251	0.768	0.900	0.000	discard	remove _persistence_mult voter weighting (architectural code-structure removal, -21 LOC). Composite -0.190 vs 5c9e32e 0.486->0.296. BULL CATASTROPHIC -0.510 (0.761->0.251 raw 0.736->0.608 stab 0.823->0.412 — VIOLATES 50pct gate 0.381), RALLY HARD-CUTOFF (0.121->0.000 sharpe negative or DD>10pct), crash flat, sideways +0.003. Persistence_mult is load-bearing for bull/rally directional confirmation; removal collapsed entry quality (raw_score drop) AND stability (less filter on noisy voters). Mechanism reversed: persistence weighting NETs to noise REDUCTION in trends (consistent voters get amplified, noisy voters dampened) — removal admitted noisy voters at full weight, increased flip rate of strong-sum near boundaries.
-	0.486	0.632	0.291	0.758	0.763	0.872	0.134	discard	remove _tod_atten 6-harmonic timestamp cyclic product (architectural code-structure removal, -12 LOC). Composite +0.000391 vs 5c9e32e 0.486->0.486 (FLAT, std narrowed dominates), mean -0.005 (0.637->0.632 — FAILS mean criterion). Per-regime: bull -0.003 (0.761->0.758), crash -0.006 (0.768->0.763), sideways -0.025 (0.897->0.872), rally +0.013 (0.121->0.134). Stabs: bull/crash/sideways all 1.0 (raw=score, perfect), rally stab 0.49->0.33 (regression). _tod_atten cycle stack DOES carry small load-bearing signal in sideways/crash but adds noise to rally. Net: removing redistributes effects (slight raw drop in 3 regimes + rally small gain) — not productive. Net composite improvement only via std narrowing; mean fails. Real harmonic content too small to be meaningfully overfit but too embedded to safely remove. Discard.
-	0.469	0.628	0.317	0.761	0.768	0.897	0.086	discard	smooth tanh _pp_activation replaces hard binary threshold at peak==pp_min (architectural primitive change). Composite -0.017 vs 5c9e32e 0.486->0.469, mean -0.009 (0.637->0.628). Bull flat (+0.000), crash flat (+0.000), sideways flat (-0.001), RALLY -0.035 (0.121->0.086 raw flat 0.391 but stab 0.492->0.221 WORSE). Mechanism failure: smoothing the activation EXPANDED the noise-sensitive boundary region instead of eliminating it. The hard binary at peak/pp_min=1.0 was actually noise-immune because peak_pnl is a high-water-mark monotonic upward — it crosses 1.0 once and stays there; binary then gives full weight constantly. Smoothing introduces a 0.95-1.05 ratio band where _pp_activation now varies under noise even after peak has stabilized, because peak_pnl itself sits near pp_min throughout in marginal rally trades. Rally has many small-peak trades exactly in this range. Counter to hypothesis: smooth boundary worse than hard boundary when peak distribution clusters near it. Discard.
5b4d318-session-summary	-	-	-	-	-	-	-	session-summary	session: 5 independent architectural discards (no branch opened). Baseline 5c9e32e unchanged 0.486/0.637/0.303 [bull 0.761, crash 0.768, sideways 0.897, rally 0.121]. EXP1 softmax-weighted exit fusion (beta=8 replaces discrete MAX): composite -0.159, BULL CATASTROPHIC -0.506 (stab 0.823->0.364) — softmax aggregates noise across near-top terms additively where MAX isolated to winner. EXP2 trend-adaptive slope windows (12-22/16-30/22-40 chop->trend): -0.055, BULL -0.194 stab collapse 0.823->0.742 — making window LENGTH itself noise-dependent compounds noise multiplicatively (ret_long noisy → window noisy → slope-of-window noisy). EXP3 remove _persistence_mult voter weighting: -0.190, BULL -0.510 stab 0.823->0.412, RALLY hard-cutoff — persistence is load-bearing for stability not against it (admits/dampens individual voters in trends). EXP4 remove _tod_atten 6-harmonic timestamp cycle stack: composite +0.0004 FLAT (std narrow), mean -0.005 FAILS — bull/crash/sideways ALL went to perfect stab=1.0 (improvement) but raw_scores dropped slightly across 3 regimes; rally +0.013. Cycle stack carries small load-bearing signal too embedded to safely remove. EXP5 smooth tanh _pp_activation at peak==pp_min boundary: -0.017, RALLY -0.035 stab 0.492->0.221 — counter-intuitive: smoothing a binary threshold made stab WORSE because peak_pnl is monotonic high-water-mark crosses once and stays, binary actually noise-immune; smooth band activates _pp_pressure variability around pp_min for marginal-peak rally trades clustered at that ratio. CROSS-EXPERIMENT INSIGHTS: (a) MAX fusion is noise-isolating not noise-creating — replacing with smooth alternatives compounds noise. (b) Persistence/voter-weighting subsystem is load-bearing, NOT noise source despite cross-bar state cost. (c) Hard binary thresholds on monotonic high-water-mark variables (peak_pnl/pp_min) are NOISE-IMMUNE because the variable does not oscillate — smoothing them creates a band where noise activates that previously was past the boundary. Counter-intuitive: smoothing not always stab-positive. (d) Variable-length windows on noise-affected inputs create multiplicative noise channels. (e) Cycle harmonic stacks carry small irreducible signal even when individually overfit-prone. RALLY STABILITY (0.49) APPEARS STRUCTURALLY ENTRENCHED — multiple distinct architectural attacks (fusion smoothing, slope window adaptation, voter weighting removal, cycle removal, activation smoothing) all failed. Rally raw=0.39 but stab=0.49: the noise channel is in the post-MAX exit pressure -> position trajectory mapping, not in any single component. Future direction: (i) probe rally-specific raw_score improvement (raw 0.39 vs sideways 0.90 leaves room) — rally voter conviction quality, scale-in pace. (ii) AVOID further attempts at exit-fusion smoothing (MAX is the noise-isolator). (iii) AVOID removing voter weighting components (load-bearing). (iv) AVOID variable-length window experiments. SESSION END (5 architectural discards, no branch).
-	0.299	0.483	0.368	0.259	0.776	0.897	0.000	discard	bilateral-conviction admission inflation (architectural, opp-side strong-sum inflates own-side strong_min by up to 30%). Composite -0.187 vs 5c9e32e 0.486. BULL CATASTROPHIC -0.502 (0.761->0.259 raw 0.736->0.608 minor + stab 0.823->0.426 — VIOLATES 50pct gate 0.381), RALLY hard-cutoff (0.121->0.000 Sharpe -0.06 negative), crash +0.008, sideways flat. Mechanism failure: in trends (bull/rally), pullback bars produce bilateral voter spikes (both bull AND bear voters fire); inflating GATE during these moments killed legitimate trend-aligned entries that would later be winners. Counter-intuitive: opposite-side conviction is NOT predominantly noise in trending pullbacks — it is signal of pullback magnitude, but does not invalidate trend-aligned entry. Inflating gate filtered exactly the correct entries.
-	0.451	0.605	0.308	0.668	0.770	0.893	0.090	discard	remove profit-target partial harvest path (architectural code-structure removal, -13 LOC). Composite -0.035 vs 5c9e32e 0.486. Bull -0.093 (0.761->0.668, raw 0.736->0.668 dropped, stab perfect 1.0), crash -0.002 flat, sideways -0.004 flat, rally -0.032 (0.121->0.090 raw 0.394->0.323 dropped, stab 0.492->0.277 worse). Mechanism failure: tp-harvest is NOT redundant with _pp_pressure - it scales down BEFORE giveback occurs (proactive realization of peak gains in trends), while _pp_pressure only fires AFTER giveback. Removing exposed positions to full giveback cycle before any harvest, reducing realized PnL on legitimate trend extensions. Both paths load-bearing: tp-harvest captures realized peak progress; pp_pressure reacts to retracement.
-	0.359	0.520	0.323	0.271	0.776	0.897	0.137	discard	remove VWAP voter (architectural code-structure removal, -9 LOC, 7->6 voters). Composite -0.127 vs 5c9e32e 0.486. BULL CATASTROPHIC -0.490 (0.761->0.271 raw 0.736->0.677 small drop but stab 0.823->0.399 COLLAPSED — VIOLATES 50pct gate 0.381), crash +0.008 flat, sideways flat, rally +0.016 (0.121->0.137 raw 0.394->0.365 dropped but stab 0.492->0.374 also worse — net positive via lower final score). Mechanism: VWAP voter provides orthogonal volume-based directional signal that anchors bull stability — without it, voter ensemble more noise-sensitive, _bull_strong oscillates more under perturbation, stab collapses 0.4. Bull raw barely moved (mechanism not eliminating signal) but stability halved — VWAP was the stabilizing diversifier. Confirms VWAP load-bearing for stability not raw.
-	0.451	0.618	0.335	0.761	0.768	0.897	0.046	discard	peak-anchored giveback-to-loss recovery pressure (architectural addition, new control flow). Composite -0.035 vs 5c9e32e 0.486. Bull/crash/sideways near-flat (all stab=1.0 unchanged). RALLY -0.075 (0.121->0.046 raw 0.394 PRESERVED but stab 0.492->0.117 CATASTROPHIC — VIOLATES 50pct floor 0.061). Mechanism failure: peak-anchored AR adds noise channel exactly to rally — many small-peak trades that giveback into modest loss and bounce; new pressure fires on every minor bounce, but the BOUNCE itself is exactly where rally noise lives (chop pullback-and-recover). Stab collapse without raw drop confirms: the architecture is creating a pressure-source that responds to noise-driven bounces rather than to genuine reversals. Conditioning AR by peak/giveback geometry adds a noise-sensitive dimension to rally specifically.
-	0.429	0.607	0.354	0.761	0.768	0.897	0.000	discard	remove _freq_factor trade-frequency self-regulator (architectural code-structure removal, -7 LOC). Composite -0.057 vs 5c9e32e 0.486. Bull/crash/sideways near-flat (all stab=1.0 unchanged). RALLY HARD-CUTOFF (0.121->0.000 sharpe negative or DD>10pct; MaxDD 2.159pct fine). The Sharpe must have gone negative - removing freq_factor admitted more rally pullback false entries that aggregated into losing trades. _freq_factor IS load-bearing for rally entry quality despite redundancy with cooldown mechanisms (cooldown smooths post-exit re-entry on time axis; freq_factor regulates within-window density irrespective of cooldown completion). Confirms multi-layer dampening structure load-bearing.
b7aa839-session-summary	-	-	-	-	-	-	-	session-summary	session: 5 independent architectural discards (no branch opened). Baseline 5c9e32e unchanged 0.486/0.637/0.303 [bull 0.761, crash 0.768, sideways 0.897, rally 0.121]. EXP1 bilateral-conviction admission inflation (opp_strong inflates own strong_min up to +30pct): composite -0.187, BULL CATASTROPHIC -0.502 (stab 0.823->0.426 violates 50pct gate 0.381), RALLY hard-cutoff Sharpe -0.06 — inflating GATE during trending pullbacks killed legitimate trend-aligned entries (opp-voter spikes in pullbacks NOT predominantly noise). EXP2 remove profit-target partial harvest path (-13 LOC, eliminate 3rd size-decision path): composite -0.035, bull -0.093 raw -0.068, rally -0.032 raw -0.071. Mechanism failure: tp-harvest is proactive realization of peak gains BEFORE giveback, not redundant with _pp_pressure giveback-trailing — both load-bearing. EXP3 remove VWAP voter (-9 LOC, 7->6 voters): composite -0.127, BULL CATASTROPHIC -0.490 (stab 0.823->0.399 collapsed), rally +0.016. VWAP voter (smallest weight 0.55..1.05) is the stabilizing diversifier for bull — raw barely moved, stab halved. Volume channel orthogonal anchor for bull stability. EXP4 peak-anchored giveback-to-loss recovery pressure (architectural addition, supplements MAE-anchored AR with peak-anchored bounce-off-giveback): composite -0.035, bull/crash/sideways flat (perfect stab 1.0 throughout), RALLY -0.075 (raw 0.394 PRESERVED but stab 0.492->0.117 catastrophic — violates floor). Adding ANY new pressure source responding to bounce patterns hurts rally stab without raw drop — rally noise lives in bounce-off-giveback geometry; conditioning on it amplifies stab penalty. EXP5 remove _freq_factor trade-frequency self-regulator (-7 LOC): composite -0.057, bull/crash/sideways flat, RALLY HARD-CUTOFF (0.121->0.000 Sharpe negative). _freq_factor regulates within-window entry density (orthogonal to cooldown time-axis dampening) — load-bearing for rally entry quality despite apparent layered redundancy. CROSS-EXPERIMENT INSIGHTS: (a) Every removal hurts at least one regime; the baseline is in a tight local optimum where each component is load-bearing for at least one regime stability. (b) Every architectural addition responding to position trajectory patterns (bounce/recover/giveback) collapses rally stab while leaving raw intact — rally is structurally near a stab boundary and any new noise-responsive pressure source crosses it. (c) Inflating ADMISSION (vs SIZE) during trends filters legitimate trend-aligned entries during pullbacks; opp-voter spikes are not noise in trends. (d) Three independent regulatory layers (cooldown, freq_factor, persistence) appear redundant but each protects a different regime — removing any catastrophically hits rally. (e) Bull/crash/sideways now achieve perfect stab=1.0 (raw=score) — improvement on bull/crash/sideways comes only from raw_score, not from stab dimension; rally stab=0.49 is the dominant headroom but every attack so far worsens it. STRUCTURAL CONCLUSION: rally raw 0.39 (vs sideways 0.90) AND rally stab 0.49 (vs others 1.0) both gating — rally cannot be improved by component-level addition or removal at this architecture. Architectural rewrite of rally-specific signaling (NOT just adding/removing single components) would be required, but the lack of regime-detection rules (forbidden) prevents targeting rally specifically. SESSION END (5 architectural discards, no branch).
-	0.444	0.591	0.295	0.56	0.77	0.91	0.13	discard	volume-decay exit pressure as 7th soft term (architectural new data dep at exit fusion, profit-only). Composite -0.043 vs 5c9e32e baseline 0.486. Bull -0.196 (0.761->0.565, raw flat 0.761, stab 0.823->0.742 — volume-MAX-fires divergent timing causes stability divergence under price-noise even though volume itself unperturbed). Crash flat. Sideways +0.009 (0.897->0.906). Rally +0.005 (0.121->0.126). Mechanism works in chop/rally as intended; bull regression via stability path divergence — when _vd dominates MAX in bull, any noise-induced reordering of soft_terms produces small exit-bar shifts that compound. Single-experiment fix not obvious; trying a narrower variant later.
-	0.477	0.630	0.307	0.76	0.77	0.88	0.11	discard	cross-symbol directional-agreement entry size attenuator (architectural new cross-asset data dep at entry size, BTC/ETH/SOL LONG_WINDOW return alignment, +/-20pct range). Composite -0.009 vs 5c9e32e baseline 0.486. Bull +0.002 (0.761->0.763 raw improved), crash +0.001 flat, sideways -0.013 (0.897->0.884), rally -0.016 (0.121->0.106). Mechanism partially works on bull (cross-asset agreement does identify higher quality entries) but rally regression dominates: rally 2024 saw asymmetric BTC leadership (ETH/SOL lagging), so BTC bull entries got attenuated by lagging others when they should not have been. Cross-symbol agreement assumes synchronous regime; broken in BTC-led 2024 ETF rally. Reverting.
-	0.476	0.632	0.312	0.76	0.77	0.90	0.10	discard	remove FLIP_MIN_VOTES count gate from _opp_gate (architectural code-structure simplification, mirrors b162697b entry-path pattern). Composite -0.011 vs 5c9e32e baseline 0.486. Bull/crash/sideways flat. Rally -0.022 (0.121->0.100) — main mover. Mechanism failure: removing count gate widened opp_gate firing in rally where structural pullbacks frequently produce strong_sum spikes on opp side WITHOUT corresponding voter-count majority. Count gate was load-bearing as a SECOND noise filter at the flip boundary; the entry-path removal (b162697b) succeeded because entry has additional persistence + admission gates downstream — opp_gate has no such downstream filtering. Asymmetric: simplification valid at entry, NOT valid at reversal. Reverting.
-	0.201	0.377	0.353	0.70	0.05	0.76	0.00	discard	ARCHITECTURAL subsystem redesign: re-engagement controller (shrink-only -> bidirectional position controller, regrow de-risked positions toward _pos_hwm when exit pressure recedes + own-side conviction persists). Composite -0.285 vs 5c9e32e 0.486. ALL 4 REGIMES REGRESSED: bull -0.058 (0.761->0.703), CRASH CATASTROPHIC -0.718 (0.768->0.050 MaxDD 0.89->4.68pct), sideways -0.141 (0.897->0.756), RALLY hard-cutoff (0.121->0.000 raw 0.394->0.000 MaxDD 1.78->4.76pct). Mechanism failure: regrowth re-adds size on pressure-recede+voter-fire = the toxic buy-the-bounce pattern. In crash, dead-cat bounces recede pressure + fire bull voters -> regrow into the next adverse leg (MaxDD 5x). Matches prior structural conclusion: rally noise lives in bounce-off-giveback geometry; any pressure-trajectory-responsive size addition crosses the stab boundary. Confirms shrink-only controller is load-bearing. Reverted.
6d2efe3	0.346	0.497	0.302	0.26	0.74	0.85	0.14	branch	BRANCH OPEN: proportional trade-admission deadband at execution layer (architectural, resize must move >=12pct of current pos; entries/exits/flips exempt). Composite -0.140 vs 5c9e32e 0.486. Per-regime: BULL CATASTROPHIC -0.496 (0.761->0.265 raw collapse, violates 50pct gate 0.381), crash -0.032 (0.768->0.736), sideways -0.047 (0.897->0.850), RALLY +0.018 (0.121->0.139 raw flat 0.394->0.384 but STABILITY 0.492->0.578 factor 0.308->0.361 — TARGET MECHANISM WORKED). Bull regression cause: bidirectional deadband holds bulls protective de-risk/TP micro-shrinks, lagging graduated de-risk -> positions held into giveback -> raw collapse. BRANCH HYPOTHESIS: make deadband growth-only (exempt ALL shrinks, which are risk-reducing/protective and must always execute); only suppress discretionary sub-threshold GROWTH churn. Test if rally stability gain survives growth-only form while bull recovers.
