commit	score	mean_score	std_score	bull_2021	crash_bear	sideways	rally_2024	status	description
-	-	-	-	-	-	-	-	session-summary	SESSION (baseline 91c4496a 0.776043 -> NEW BASELINE 637f5e53 0.779314, +0.003271 KEEP): 1 keep (Exp3) + 7 independent architectural discards (Exp1,2,4,5,6,7,8). EXIT RULE: 5 consecutive architectural discards triggered (Exp4,5,6,7,8) -> stop. User 2-arch-discard minimum exceeded (5 consecutive + 2 earlier). Baseline 637f5e53 re-verified reproduces 0.779314 byte-identical [bull 0.923316 Sh1.936 DD3.71pct, crash 0.730154 Sh1.274 DD3.04pct, sideways 1.012687 Sh2.001 DD2.75pct, rally 0.632168 Sh1.470 DD6.36pct; all stab 1.0, all raw==score, min_stab 0.807]. THEME: discovered and exhausted the VOL-BLIND BAR-UNIT TIMING vein. The strategy had several timing parameters expressed in BAR units (vol-blind: N bars in calm == N bars in vol-spike, but N vol-spike bars = a larger REAL price move). KEEP (Exp3): vol-normalize the time-pressure max_hold CENTER -- scale max_hold UP with vol_ratio (max +12pct at vol_ratio>=1.5, calm byte-identical). Time-pressure is NON-BINDING for crash (exits via giveback/slope) and rally (exits via DD-adaptive giveback-tightening), so the change is SAFE for the binding regimes; it IS binding for sideways (low-vol mean-reversion winners held by time-pressure) where vol-normalization unlocked +0.019 sideways (+0.001 bull) via longer vol-spike holds. The vol-normalization is itself smooth+vol-correlated so adds NO exit-timing noise (stability held 1.0). composite +0.003271 clears keep. NEW BASELINE 637f5e53. VEIN EXHAUSTION (5 consecutive discards after the keep, all probing the same vol-blindness principle or related novel mechanisms): Exp4 profit-magnitude slope-against threshold loosening -- BYTE-IDENTICAL INERT (slope-against is non-binding for binding-regime WINNERS too; extends prior ct-LOSER inert finding). Exp5 vol-normalized time-pressure ramp SHAPE (offset+width) -- sub-noise -0.000120 regression (wider vol-spike ramp let sideways winners give back more; max_hold CENTER alone is optimal). Exp6 cross-symbol leader-divergence exit pressure (loss-side only, NEW cross-symbol exit data dep) -- BYTE-IDENTICAL INERT (binding-regime losers exit via time/giveback/opp-gate before cross-symbol divergence dominates the MAX fusion; cross-symbol info adds no incremental value at the EXIT decision, only at entry). Exp7 vol-normalized cooldown window -- sub-noise +0.000035 (cooldown is second-order re-entry timing, non-binding for binding regimes; lacks max_holds leverage). Exp8 vol-normalized scale-in pace -- -0.002348 regression (slower vol-spike scale-in missed trend capture, outweighed giveback-protection; scale-in pace is delicately tuned by prior sessions). CROSS-SESSION CONCLUSION (all measured this session): (a) the VOL-BLIND BAR-UNIT TIMING vein is REAL but NARROW -- max_hold (time-pressure CENTER) is the UNIQUE bar-unit parameter where vol-blindness mattered beneficially, because it directly closes sideways winners (a BINDING exit path); all other bar-unit params (ramp-shape, cooldown, scale-in pace) are either non-binding for the binding regimes (crash/rally) or delicately-tuned-against (scale-in) so vol-normalizing them is inert or counterproductive. (b) Exit-path INERTNESS confirmed across 3 NEW mechanisms this session (peak-stall Exp2, profit-magnitude-slope Exp4, cross-symbol-divergence Exp6) -- the binding regimes exit decisions are fully determined by giveback(pp)+time; no additional exit source (slope-against for deep-profit, peak-stall, cross-symbol divergence) changes them. (c) Entry-shrink vol-regime-agreement (Exp1) showed crash +0.0034 / bull +0.0023 (agreement-spared broad-market sizing) but net sub-noise +0.000141 with rally stability regression (min_stab 0.798 below knee) -- the entry-shrink noise wall. (d) The binding regimes (rally DD-bound 6.36pct near 8pct knee; crash return-limited Sh1.27 100pct WR) remain unconquered; exit paths inert, entry saturated, vol-blindness vein tapped, DD-reduction at cliffs (prior sessions), leverage ceiling 5x (prior sessions). NEXT SESSION: the strategy sits at a deeper local optimum after the max_hold vol-normalization keep; remaining avenues are the documented structural-exploration subsystem rewrite (voter-aggregation quintic-ramp power, the one core mechanism not directly varied per grep) -- but prior sessions judged this low-EV (subsystems already rewritten, walls fundamental to 5x/scoring structure not implementation); the return-side (crash Sharpe via signal quality) remains the unmet objective but is walled by crash-sideways coupling on hold-extension and exit-path inertness. results.tsv append-only preserved (path-scoped git checkout -- strategy.py throughout, never git revert); all 7 discards reverted to 637f5e53.
5f003b68	-999.0	-249.180484	432.908526	0.573100	0.710883	0.994080	-999.0	discard	Exp1 (architectural, indep): RETURN-AUTOCORRELATION persistence gate on the de-risk convex cushion. NEW lightly-explored signal (4 prior AC experiments, none on the de-risk cushion). Lag-1 AC of 24-bar log-returns measures momentum PERSISTENCE (finer durable-trend signal than slope-dir or R2-linearity); faded cushion strength 1.0->0.60x for non-persistent (mean-reverting) trends so choppy/exhausting winners harvest faster. MEASURED vs 637f5e53 0.779314: CATASTROPHIC composite -999 (rally -999 hard cutoff). PER-REGIME: rally raw -999 (max_dd 7.34->12.72pct BREACHED 10pct cutoff -> hard -999; Sh1.470->1.062, AnnRet 16.6pct, stab 1.0 but DD blew), bull 0.923316->0.573100 (stab 1.0->0.853, raw 0.672 -- cushion change perturbed bull winner-exit timing too), crash 0.730154->0.710883 (raw 0.711 stab 1.0, near-flat), sideways 1.012687->0.994080 (raw 0.994 stab 1.0, -0.019). KEY FINDING: the de-risk convex cushion is LOAD-BEARING on rally ct positions -- fading it (even gently, 0.60 floor) let rally ct positions ride giveback into deeper DD (7.34->12.72pct), confirming the row-931 structural-exploration discard (de-risk power-ramp form load-bearing on rally ct, the ONLY regime where de-risk is the binding exit path). Extends the wall: not just the cushion FORM (power vs sigmoid) but the cushion STRENGTH gating is rally-fragile. crash/sideways near-flat (de-risk non-binding there, exits giveback/slope-dominated). Confirms exit-winner-timing changes that touch the cushion are rally-DD-fragile. Not branch-eligible (rally DD hard-cutoff, no recoverable regime signal). Reverted to 637f5e53.
a56d9338	0.752027	0.793956	0.139766	0.800821	0.730154	1.012687	0.632163	discard	Exp2 (architectural, indep): SLOW-DECAYING loss-memory EMA for ct admission tightening. New state (_loss_streak_ema, gradual decay +0.6 loss/-0.4 win clipped [0,6]) replaces the hard-reset _loss_streak counter at the ct-ADMISSION gate only; escalating ramp tanh((ema-1)/2.5) (no early saturation) + ceiling 10pct->14pct so a 4th consecutive ct re-entry faces a higher bar. Hypothesis: hard counter zeroes tightening on any mid-burst win; gradual EMA keeps it elevated through pullback bursts -> filters 4th ct re-entry -> breaks rally 4-loss streak (streak_gate 0.876 drag, 4->3 ~= rally +0.021). MEASURED vs 637f5e53 0.779314: composite -0.027287 (0.752027), mean -0.030625 (0.793956), std -0.011124 (0.139766 tighter). PER-REGIME all stab 1.0 all flip 1.0 all raw==score: bull 0.923316->0.800821 (-0.122495 BIG regression -- the persistent EMA over-tightened bull-2021 correction bear-shorts through choppy sequences; bull entries are trend-aligned ct-indicator 0 so not directly tightened, but bear shorts during corrections WERE, changing bull trade set), crash BYTE-IDENTICAL 0.730154, sideways BYTE-IDENTICAL 0.012687, rally 0.632168->0.632163 (-0.000005 BYTE-IDENTICAL -- streak NOT reduced; flip_streak_gate 1.0, raw unchanged). KEY FINDING: ct admission tightening DOES NOT break rally 4-loss streak -- rally byte-identical proves the 4 ct losers persist regardless of a higher admission bar (they are strong-conviction enough to pass even 14pct tighter, OR the streak is not from ct re-entries the gate touches). The persistent EMA only damaged bull (over-tightening correction bear-shorts). Extends the documented streak-is-structural conclusion: the streak is not breakable via ct admission filtering. Not branch-eligible (target regime rally byte-identical -- no signal to iterate on; bull regression is over-persistent tightening with no rally gain to recover). Reverted to 637f5e53.
92238786	0.752160	0.794061	0.139668	0.800898	0.730155	1.012687	0.632504	discard	Exp3 (architectural, indep): REALIZED-SKEWNESS giveback-harvest modulator. NEW signal (0 prior). 24-bar realized skewness measures return ASYMMETRY (fat tail in trade direction); when a trend-aligned winners same-direction skew fades (tail-cohesion breaking) raise giveback ratio +12pct -> harvest earlier before reversal. Safe direction (only harvests, never rides longer); trend-align gate spares sideways. MEASURED vs 637f5e53 0.779314: composite -0.027154 (0.752160), mean -0.030520 (0.794061), std -0.011222 (0.139668 tighter). PER-REGIME all stab 1.0 all raw==score: bull 0.923316->0.800898 (-0.122418 -- skew-fade harvest over-harvested bull-2021 correction longs: skew fades during corrections -> earlier harvest -> bull winners cut short; the skew-fade signal cannot distinguish correction-within-uptrend [hold] from genuine reversal [harvest]), crash 0.730154->0.730155 (+0.000001 byte-identical), sideways BYTE-IDENTICAL 1.012687 (trend-align gate spared), rally 0.632168->0.632504 (+0.000336 SUB-NOISE tiny -- rally longs harvested marginally better but below +0.003 threshold). KEY FINDING: realized-skewness as a harvest trigger structurally over-harvests bull (corrections fade skew same as reversals); the same mechanism that makes hold-longer backfire (prior session -0.082) makes harvest-earlier-on-fade backfire on bull. rally gain sub-noise. Not branch-eligible (rally +0.0003 sub-noise = no strong signal to iterate; bull regression structural to the mechanism with no recoverable rally gain). Reverted to 637f5e53. CONCLUSION (3 arch discards this session): de-risk cushion strength rally-DD-fragile (Exp1); streak unbreakable via ct admission (Exp2); skew-fade harvest over-harvests bull (Exp3). All 3 confirm documented walls under v2.2 with NEW signals (AC, loss-EMA, skew) -- the strategy is at a deep local optimum where novel exit/admission signals either blow rally DD or over-harvest bull.
040992b3	0.779307	0.824572	0.150884	0.923280	0.730154	1.012687	0.632168	discard	Exp4 (architectural, indep): DOWNTREND BOUNCE-TOP bear-entry commitment boost (textbook sell the bounce). In confirmed downtrend (ret_vlong<0), bear entry after recent counter-trend bounce (ret_short>0) gets +10pct first-bar size (bounce-top = higher-quality short before resumption). BEAR-side only; ret_vlong<0 gate -> rally/bull byte-identical by construction. MEASURED vs 637f5e53 0.779314: BYTE-IDENTICAL/INERT composite -0.000007 (0.779307, sub-noise), mean -0.000009, all 4 regimes byte-identical (crash 0.730154 Sh1.273617 UNCHANGED, DD3.04; bull 0.923280; sideways 1.012687; rally 0.632168). The boost NEVER FIRES: crash bear entries occur on DOWN-LEGS (ret_short<0, momentum already down), NOT at bounce-tops; when a bounce occurs (ret_short>0) bear voters are weak -> bear admission does not pass -> no bear entry to boost. The bounce-top entry TIMING is unreachable via the current admission structure (bounces suppress the bear-voter gate that admits bear entries). KEY FINDING: the strategy CANNOT enter bounce-tops at all -- the sell-the-bounce timing is structurally inaccessible because the same bounce that creates the opportunity suppresses the bearish-voter admission requirement. To capture bounce-top shorts would require a NEW ADMISSION PATH (a bounce-detection trigger that admits bear entries independent of the bear-voter gate) -- a candidate for a follow-up experiment/branch. Not branch-eligible as-is (inert, nothing to iterate on the boost itself). Reverted to 637f5e53.
88102dcb	0.779314	0.824581	0.150890	0.923316	0.730154	1.012687	0.632168	branch:open	Exp5 (architectural, indep): BOUNCE-EXHAUSTION bear-entry TRIGGER -- a NEW ADMISSION PATH (second bear-admission OR-branch). Exp4 proved bounce-top shorts are structurally inaccessible (bounces suppress bear voters -> _bear_ready fails). This bypasses the voter-EMA gate when a bounce is EXHAUSTING in a strong downtrend: _dt (ret_vlong<0) x _bounce (max(0,ret_short)) x _exhaust (3-bar mean log-ret down) > 0.5 -> admit bear even with _bear_ready False; still requires _bear_admit (trend<0); 0.55x size (riskier voter-bypass entries). Targets crash (return-limited Sh1.274, DD3.04pct headroom) by adding genuinely new shorts. MEASURED vs 637f5e53 0.779314: BYTE-IDENTICAL/INERT (composite 0.779314 unchanged, all 4 regimes byte-identical incl Sharpe and trade counts -- zero new trades). The trigger NEVER FIRES: _bounce=max(0,ret_short) uses an 8-16-bar median reference, so _bounce>0 in a downtrend requires a bounce LARGER than 8 bars ago -- too long for crash short bounces; combined with the demanding 3-factor >0.5 threshold the condition is never met. BRANCH OPENED (new-mechanism eligibility): diagnosis = bounce-detection window misaligned with crash dynamics (too long); fix hypothesis = switch to a SHORT-window (2-3 bar) bounce + last-bar exhaustion pattern and loosen the threshold so the trigger actually fires, then measure whether added bounce-top shorts improve crash Sharpe (winners on resumption) or lower crash 100pct WR (losers on bounce-continuation). rally/bull byte-identical by construction (ret_vlong<0 gate); only crash/bear-legs affected.
-	-	-	-	-	-	-	-	branch:discard	BRANCH (bounce-exhaustion bear-entry path) REVERTED to 637f5e53 after 1 step (step1 short-window bounce + loosened threshold 0.5->0.25). Opened from Exp5 (inert new-mechanism admission path). PREMISE FALSIFIED: the branch hypothesized bounce-top shorts are structurally inaccessible (Exp4 boost inert, Exp5 trigger inert). Step1 loosened the bounce window (8-16bar ret_short -> 2-bar) and threshold (0.5->0.25) so the trigger WOULD fire -- but result was STILL BYTE-IDENTICAL (zero new trades). Diagnosis: the trigger only adds entries when _bear_bounce_trigger AND NOT _bear_ready; byte-identical across 3 attempts proves whenever the bounce-exhaustion pattern fires, _bear_ready is ALREADY true (bear voters RSI/MACD/slope/EMA remain strong on bounce-exhaustion bars because the 20-bar trend and slope are still down in a downtrend). The strategy ALREADY enters bounce-top shorts via the normal admission path -- the sell-the-bounce opportunity is NOT being missed. Exp4/Exp5 premise (bounce-tops inaccessible) was WRONG. No amount of gate-loosening adds value (the trades already happen). Terminated early (1 no-progress step) rather than consuming the 7-step stagnation guard. Reverted to 637f5e53. results.tsv append-only preserved (path-scoped git checkout -- strategy.py throughout, never git revert).
-	-	-	-	-	-	-	-	session-summary	SESSION (baseline 637f5e53 0.779314 -> UNCHANGED, no keep): 5 independent architectural experiments (Exp1-5, all discards) + 1 exploration branch (bounce-exhaustion entry, 1 step, reverted). EXIT RULE: 5 consecutive architectural discards (Exp1-5) -> opened branch on Exp5 (new-mechanism eligibility) before exiting. User 2-arch-discard minimum exceeded (5). Baseline 637f5e53 re-verified reproduces 0.779314 byte-identical [bull 0.923316 Sh1.936 DD3.71pct, crash 0.730154 Sh1.274 DD3.04pct, sideways 1.012687 Sh2.001 DD2.75pct, rally 0.632168 Sh1.470 DD6.36pct; all stab 1.0, all raw==score, min_stab 0.807]. THEME: probed 5 NOVEL signals/mechanisms (none previously tested under v2.2) -- all confirmed documented walls or were inert. Exp1 return-AUTOCORRELATION persistence gate on de-risk cushion: CATASTROPHIC rally DD 7.34->12.72pct (10pct cutoff -> -999); de-risk cushion STRENGTH (not just form) is rally-DD-fragile (extends row-931 de-risk-form-load-bearing finding). Exp2 slow-decaying loss-memory EMA for ct admission tightening: bull -0.122 (over-tightened correction bear-shorts) while rally streak UNCHANGED (byte-identical) -- streak NOT breakable via ct admission (extends streak-is-structural). Exp3 REALIZED-SKEWNESS giveback-harvest modulator: bull -0.122 (skew-fade over-harvested correction longs; skew cant distinguish correction-from-reversal) + rally +0.0003 sub-noise. Exp4 downtrend bounce-top bear-entry BOOST: BYTE-IDENTICAL inert. Exp5 bounce-exhaustion bear-entry TRIGGER (new admission path): BYTE-IDENTICAL inert. BRANCH (bounce-exhaustion entry, 1 step): PREMISE FALSIFIED -- bounce-exhaustion bars already have _bear_ready true via normal bear voters, so the strategy ALREADY enters bounce-top shorts; the sell-the-bounce opportunity is NOT being missed (Exp4/Exp5 premise was wrong). CROSS-SESSION CONCLUSIONS (all measured this session): (a) the de-risk convex cushion is rally-DD-fragile on STRENGTH gating (not just form) -- any cushion weakening lets rally ct positions ride giveback into DD breach; the cushion is at its exact calibrated value. (b) rally 4-loss streak is NOT breakable via ct admission tightening (persistent EMA only damaged bull); the streak is structural to rally pullback dynamics and unbreakable from the admission side. (c) bull (Sh1.936, correction-prone) is the regime that absorbs perturbations -- BOTH admission-tightening (Exp2) and exit-harvesting (Exp3) changes that touch bulls correction-period trades cost bull ~-0.122; bull is a fragile high-Sharpe regime. (d) the strategy ALREADY captures bounce-top shorts via normal bear voters (the sell-the-bounce timing is not inaccessible); new bounce-entry paths are inert because the trades already fire. (e) 3 genuinely novel signals (AC, loss-EMA, realized-skew) + 1 novel entry path (bounce trigger) all failed -- the strategy is at a deep local optimum where novel signals either blow rally DD (cushion), over-harvest bull (skew/admission), or are inert (bounce, AC on inert paths). NEXT SESSION: the binding regimes (rally DD-bound 6.36pct, crash return-limited Sh1.274 100pct WR) remain unconquered. Cushion-strength, streak-admission, skew-harvest, bounce-entry all ruled out this session. The remaining documented avenue is the structural-exploration subsystem rewrite of voter-aggregation (quintic-ramp) -- NOT attempted this session because it perturbs rally admission timing (the knife-edge where a noise-immune TOD tilt blew rally DD 7.34->14.90pct) and would very likely breach the 10pct DD cutoff on step 1 (which the relaxed gates do NOT relax); prior sessions judged it low-EV. results.tsv append-only preserved (path-scoped git checkout -- strategy.py throughout, never git revert); all 5 discards + branch reverted to 637f5e53.
