commit	score	mean_score	std_score	bull_2021	crash_bear	sideways	rally_2024	status	description
54816436	0.549793	0.695510	0.291434	0.78	0.77	1.01	0.22	discard	ARCHITECTURAL multi-day counter-trend exit accelerator: amplify soft exit pressure (x1.5 max) for positions opposing 96-bar ret_vlong trend; new (ret_vlong,pos_dir) dep at exit fusion. HYP: cut rally counter-trend shorts (presumed losers) faster -> less drag -> rally raw up. RESULT composite 0.6393->0.5498, raw_composite 0.6393->0.5968 (-0.043). bull 0.781251 + crash 0.767586 + sideways 1.013297 ALL BYTE-IDENTICAL (accelerator only altered rally trades). rally raw DROPPED 0.4194->0.3239 (-0.095) = OPPOSITE of intended; rally stab re-seed 0.801->0.704 factor 0.679. MEASURED CONCLUSION: faster counter-trend(short) exit in rally LOWERS rally raw -> rally counter-trend shorts are NET WINNERS not losers (falsifies counter-trend-short=drag premise; matches hygiene note that entry-side-share causal claim was wrong). No regime improved; premise falsified -> not branched. Discard #2 architectural.
a45a24f5	0.467720	0.650571	0.365702	0.78	0.77	1.01	0.04	discard	ARCHITECTURAL multi-day counter-trend WINNER-RIDE (inverse of Exp2): REDUCE soft exit pressure (x0.65 min) for WINNING positions opposing 96-bar ret_vlong; profit-gated. HYP: Exp2 cut counter-trend faster=rally raw -0.095, so inverse (let winners ride) should raise rally raw. RESULT composite 0.6393->0.4677, raw_composite 0.6393->0.6305 (-0.009). bull/crash/sideways ALL BYTE-IDENTICAL again. rally raw 0.4194->0.3993 (-0.020 mild drop); rally stab re-seed 0.801->0.530 factor 0.101 (bad draw). CROSS-EXP (Exp2+Exp3): perturbing counter-trend exit timing EITHER direction hurts rally raw (faster -0.095, slower -0.020) -> baseline counter-trend exit timing is a TUNED LOCAL OPTIMUM, rally raw not improvable via this lever. All 3 my exps left bull/crash/sideways byte-identical (no winning counter-trend positions on modified path there). No regime improved -> not branched. Discard #3 architectural.
4e913217	-999	-999	0	-999	-999	-999	-999	branch	BRANCH-OPEN passive multi-day trend-core overlay (subsystem redesign, emission layer): hold small noise-immune ret_vlong-driven core on flat bars to raise clean_vol (stability denominator, UNTESTED lever). RESULT catastrophe composite -999 ALL regimes, MaxDD ~17pct uniform, trades EXPLODED ~10-12k/regime (baseline rally ~68). DIAGNOSIS: _core_target = continuous tanh(ret_vlong) drifts every bar; the >1.0 emission gate is far too fine for it -> core re-emits EVERY bar -> fee death + whipsaw -> 17pct DD. Mechanism is sound but bypasses the deadband/grid turnover machinery. FIX (step2): make core STICKY via coarse deadband (only resize when core deviates > frac of its max magnitude). Branch-eligible: fundamentally new mechanism + clear failure diagnosis + clear fix.
63d398c5	-999	-749.25	432.58	-999	0.00	-999	-999	discard	BRANCH SUMMARY passive trend-core overlay (4 steps, REVERTED to de412448). Goal: raise clean_vol (stability DENOMINATOR, the one structurally-untested lever - all prior work + my Exp1-3 attacked the tracking-error NUMERATOR) by holding a small noise-immune ret_vlong-driven core on flat bars. STEP1 (exclusive core, per-bar): -999 all, 10-12k trades (continuous core target bypasses >1.0 gate -> re-emits every bar). STEP2 (sticky coarse deadband): trades cut (crash 12186->3339) but bull stayed 9347 - exclusive design makes flat=nonzero-core so active strategy thrashes against core on every entry/exit. STEP3 (ADDITIVE separate-accounting, active operates on real-core, emit active+core): fixed thrash but core is UNMANAGED DIRECTIONAL -> bull Sharpe 1.556->-1.25, DD 19pct (core rides bull-2021 May crash with no stop), raw_composite -965. STEP4 (shrink CORE_WEIGHT 0.30->0.08): bull Sharpe recovered 1.14 BUT DD still 13.5pct (bull)/12.5(sideways)/13.4(rally) ALL >10pct -> -999; sideways raw 1.94->0.73 degraded. CONCLUSION (dead end): a passive core large enough to move clean_vol is an unmanaged directional bet that rides reversals -> breaches 10pct DD AND degrades active raw; the denominator lever is NOT reachable via a passive core (needs full risk mgmt = 2nd strategy). Negative result rules out passive cores for future sessions. Branch counts as architectural (opening exp was architectural).
de412448	0.6393	0.7454	0.2120	0.78	0.77	1.01	0.42	session-summary	SESSION: 3 independent architectural discards + 1 exploration branch (4 steps, REVERTED). Baseline de412448 UNCHANGED 0.6393 [bull 0.781251 Sh1.556, crash 0.767586 Sh1.311, sideways 1.013297 Sh1.941, rally 0.419353 Sh0.736 stab0.800755 at the 0.80 knee; all factors 1.0]. Reproduced EXACTLY at session start (composite 0.639349); strategy.py verified byte-identical to de412448 at end. EXP1 (entry-conviction size cap, persistent scale-in ceiling): raw_composite 0.6382~=0.6393 NO-OP; bull+crash BYTE-IDENTICAL (entries high-conviction, cap never binds), rally raw 0.417 flat -> rally instability is NOT entry-size-driven (whole-hold size of marginal entries irrelevant to rally stab); rally stab re-seed 0.605. EXP2 (counter-trend exit ACCELERATOR, x1.5 soft pressure opposing 96-bar ret_vlong): rally raw 0.4194->0.3239 (-0.095), bull/crash/sideways BYTE-IDENTICAL -> DIRECT EVIDENCE counter-trend(short) positions in rally are NET WINNERS not losers (falsifies counter-trend-short=drag premise). EXP3 (counter-trend winner-RIDE, inverse, x0.65 for winning counter-trend): rally raw 0.4194->0.3993 (-0.020), bull/crash/sideways BYTE-IDENTICAL. CROSS-EXP(2+3): perturbing counter-trend exit timing EITHER direction hurts rally raw -> baseline counter-trend exit timing is a TUNED LOCAL OPTIMUM. BRANCH (passive trend-core overlay, 4 steps, the stability-DENOMINATOR lever - all prior work + Exp1-3 attacked the tracking-error NUMERATOR; nobody had tried raising clean_vol): step1 exclusive core re-emits every bar (10-12k trades, -999); step2 sticky deadband cut core churn but exclusive design thrashes active; step3 additive separate-accounting (active on real-core, emit active+core) fixed thrash but UNMANAGED DIRECTIONAL core rode bull-2021 crash -> Sh1.56->-1.25 DD19pct; step4 shrink 0.30->0.08 -> bull Sh recovered 1.14 but DD STILL 13.5/12.5/13.4pct (>10pct) all regimes + sideways raw 1.94->0.73. DEAD END: passive core big enough to move clean_vol is an unmanaged directional bet breaching 10pct DD AND degrading active raw; denominator lever NOT reachable via passive core (needs full risk mgmt). METHODOLOGICAL: all 3 indep exps left bull/crash/sideways BYTE-IDENTICAL (insensitive to counter-trend exit/entry-size perturbations); only rally responds (worse-or-reseed) -> reconfirms de412448 deep seed-locked optimum where rally alpha==rally instability. FUTURE: denominator(clean_vol) remains the only structurally-untested lever but requires a RISK-MANAGED mechanism to add low-vol-regime exposure (not a naked core). All reverted via git checkout -- strategy.py; results.tsv append-only intact.
4321f17f	0.4536	0.6432	0.3791	0.78	0.77	1.01	0.01	branch	BRANCH-OPEN continuous entry-admission redesign (soft 3-gate strength scales entry size, admitted SET identical to baseline). MEASURED vs de412448: raw_composite 0.639349->0.639881 (ALL 4 raw >= baseline: bull 0.781251->0.783042 +0.0018, crash 0.767586 byte-identical, sideways 1.013297->1.013417, rally 0.419353->0.419604 +0.0003 ~byte-identical). bull stability 0.810->0.845 (ROSE off 0.80 knee, factor stays 1.0); crash 0.974->0.967, sideways 0.849->0.839 (both factor 1.0). rally stability 0.801->0.506 (rally raw ~byte-identical -> consistent with AST-seed re-roll per prior diagnostic; factor 1.0->~0.02 -> rally score 0.419->0.009). composite 0.6393->0.4536 BLOCKED by rally re-seed. Branch justification: (1) new arch = continuous admission-strength eliminates entry-size discontinuity; (2) rally regressed via stability re-roll, raw preserved; (3) fix: extend smoothing to causally engage rally entries (rally raw ~flat = unengaged) to lift rally stability as it did bull.
0dc1669d	0.4214	0.6265	0.4102	0.78	0.77	1.02	-0.06	branch	branch step2 (conv_band 0.40->1.20, persist 0.30->0.60: down-weight low-conviction entries more). MEASURED: rally raw 0.419604->-0.063285 (Sharpe INVERTED +0.736->-0.063), rally stability 0.506->1.000 (factor->1.0 but raw negative). bull raw 0.783042->0.784759 stab 0.845->0.837; crash byte-identical; sideways raw 1.013417->1.016921 stab 0.839->0.833. raw_composite 0.639881->0.421376 (no-progress vs step1). CAUSAL (counterfactual in-branch): shifting rally size-weighting toward high-conviction entries inverts rally Sharpe -> rally positive PnL is carried by its LOW-conviction entries; high-conviction rally entries are net losers. Reproduces prior 3-bar-persistence finding (stab 1.0 but Sharpe negative) via a different mechanism.
e6e2fa52	0.5256	0.6798	0.3086	0.76	0.77	1.01	0.17	branch	branch step3 (conv_band 1.20->0.10, persist 0.60->0.15: boost low-conviction entries toward full size, smooth at boundary). MEASURED: rally raw 0.419548 (~baseline 0.419353 = INVARIANT, boosting low-conviction did NOT raise rally raw), rally stability re-seeded 0.625 (factor 0.417 -> rally score 0.175). bull raw 0.783042 stab 0.793 (FELL below 0.80 knee, factor 0.977 -> bull score 0.764); crash byte-identical; sideways raw 1.013200 stab 0.888. raw_composite 0.639836 (~step1 flat). composite 0.5256<0.6393. CAUSAL: bull stability tracks smoothing-band width (0.845@0.40, 0.793@0.10) -> wider entry-size-smoothing improves bull stability. rally raw invariant + stability seed-lottery (0.506/0.625 draws, both <0.785) across the sweep.
52a187ea	0.6393	0.7454	0.2120	0.78	0.77	1.01	0.42	discard	BRANCH SUMMARY (continuous entry-admission redesign, 3 steps, REVERTED to de412448). New arch: hard 3-gate boolean entry (strong>=min AND trend-admit AND persist) + 0.70-floored conv_atten replaced by a continuous admission-strength = conv_soft*admit_soft*persist_soft, each factor ZERO at its original boundary (admitted SET identical to baseline) ramping to 1.0 over a band -> entry SIZE continuous (no 0->0.70*frac jump). RESULT: raw-neutral-positive at conv_band 0.40 (raw_composite 0.639349->0.639881, all 4 raw>=baseline) and lifts BULL stability 0.810->0.845 off the 0.80 knee (NEW entry-side stability lever; distinct from prior exit-side raw levers). BLOCKED from keep: (1) bull-stab gain is latent (bull already factor 1.0 at baseline); (2) rally raw INVARIANT ~0.419 across conv_band sweep {0.10,0.40,1.20} and rally stability is a seed-lottery (drew 0.506/0.625, need >=0.785), so composite stayed 0.45-0.53<0.6393; (3) pushing the mechanism to engage rally (wide band) INVERTS rally Sharpe (0.736->-0.063) -> rally edge is its low-conviction entries, un-stabilizable without deleting alpha. Reverted via git checkout de412448 -- strategy.py; results.tsv append-only intact.
de412448-session-summary	0.6393	0.7454	0.2120	0.78	0.77	1.01	0.42	session-summary	session: 1 indep architectural exp (=branch-open) + 1 exploration branch (3 steps, REVERTED). Baseline de412448 UNCHANGED 0.6393 [bull 0.781251 Sh1.556 stab0.810, crash 0.767586 Sh1.311 stab0.974, sideways 1.013297 Sh1.941 stab0.849, rally 0.419353 Sh0.736 stab0.801; all factors 1.0; binding constraint rally]. strategy.py verified byte-identical to de412448 (reproduces 0.639349, min_stability 0.800755). NEW MECHANISM (entry-admission subsystem redesign): replaced the hard 3-gate boolean + 0.70-floored conv_atten with a continuous admission-strength (conv_soft*admit_soft*persist_soft), each factor 0 at its original hard boundary so the admitted SET is identical to baseline but entry SIZE ramps continuously from 0 (eliminates the 0->0.70*frac discontinuity that AR(1) noise flips across). FINDINGS (all MEASURED, conv_band sweep {0.10,0.40,1.20}): (a) raw-neutral-to-positive at conv_band 0.40: raw_composite 0.639349->0.639881, ALL 4 raw>=baseline (bull +0.0018, crash byte-identical, sideways +0.0001, rally +0.0003) -> conviction-weighted entry sizing does NOT cost alpha (refines: marginal-entry shrink is raw-safe when conviction-weighted, unlike the binary 3-bar persistence filter). (b) NEW STABILITY LEVER: bull stability tracks smoothing-band width (0.793@conv_band0.10, 0.845@0.40) -> wider entry-size-discontinuity smoothing genuinely lifts bull stability off the 0.80 knee; this is an ENTRY-side stability lever, orthogonal to the documented surgical EXIT-side raw lever (8bb8523c). (c) bull-stab gain is LATENT/unrewardable (bull already factor 1.0 at baseline; composite bottlenecked solely by rally). (d) rally CONFIRMED un-improvable on the conviction axis: rally raw INVARIANT ~0.419 across non-inverted band widths, and CAUSAL counterfactual: widening conv_band 0.40->1.20 (down-weighting low-conviction entries) INVERTS rally Sharpe 0.736->-0.063 while raising rally stability to 1.000 -> rally positive PnL is carried by its LOW-conviction (marginal) entries; high-conviction rally entries are net losers (sharpens prior 3-bar-persistence finding with the conviction dimension). (e) rally stability is seed-dominated (drew 0.506 @0.40, 0.625 @0.10; both <0.785 knee), matching prior NO-OP diagnostic; composite blocked at 0.45-0.53. CONCLUSION: de412448 remains a seed-locked deep optimum; rally alpha/instability entanglement reconfirmed (now localized to low-conviction entries). FUTURE: the continuous-admission entry-stability lever is keepable only if (i) bull/sideways stability ever becomes binding, or (ii) combined with a rally-robustness solution, or (iii) metric is reseed-averaged. Did NOT seed-fish. Reverted via git checkout de412448 -- strategy.py; results.tsv append-only intact.
e8c2e61a	0.5187	0.6764	0.3155	0.77	0.77	1.01	0.16	discard	ARCHITECTURAL simplification: removed multi-day counter-trend entry-size shrink (_bull_ct_vlong/_bear_ct_vlong->1.0). Direction-split PnL diagnostic (this session, MEASURED): rally LONG 20tr -380.7 40%WR (drag), rally SHORT 48tr +2381.6 77%WR (alpha), crash all-LONG 45tr +4367 100%WR, bull LONG 40tr +4137 92%WR / SHORT 3tr -226. RESULT: raw_composite 0.6383 vs 0.6393 FLAT (bull raw 0.7796 -0.0016, crash 0.7659 -0.0017, sideways 1.0133 BYTE-IDENTICAL, rally raw 0.4187 Sh0.7349 ~identical). Entry-SIZE channel SATURATED reconfirmed: this attenuator near-inert on raw. Composite 0.5187<0.6393 PURELY from rally stability re-seed 0.8008->0.6136 (factor 1.0->0.379) -> rally final 0.419->0.159 (-62% breaches 50% gate). Discard; not branch-eligible (no regime raw improved).
d0a5ca3d	0.2299	0.4640	0.4682	-0.21	0.77	1.01	0.28	discard	ARCHITECTURAL: removed counter-trend admission tightening (the two +0.15*tanh terms on _bull_strong_min/_bear_strong_min). RESULT catastrophic: bull Sharpe 1.556->-0.206 (raw 0.781->-0.206, MaxDD 1.25->4.61pct) — removing bull-side tightening admitted LOSING dip-buy counter-trend longs during bull local pullbacks (bull counter-trend longs are LOSERS, FALSIFIES general counter-trend=winner; tightening LOAD-BEARING for bull). rally raw FLAT 0.41925 vs 0.41935 Sh0.7361->0.7361 — removing bear-side tightening did NOT change rally (its winning shorts pass admission regardless; tightening not binding) => ADMISSION is NOT a rally lever. crash 0.76763 (+0.00004) sideways 1.01337 (+0.00007) byte-flat. CROSS-EXP(1+2): both entry-SIZE and ADMISSION channels confirmed non-levers for rally direction mix. Composite 0.2299<0.6393; discard (bull -127pct). Not branch-worthy.
ba7cd2fb	0.5214	0.6799	0.3171	0.78	0.77	1.01	0.16	branch	BRANCH OPEN: NEW stale-loss exit term (_stale_pressure = ramp(bars_held 8->14) * adversity(-pos_pnl/0.6stop), added to MAX soft-exit fusion). SURGICAL: bull/crash/sideways raw+Sharpe BYTE-IDENTICAL (winners 86-100%WR dont sit underwater). rally raw 0.41935->0.43505 (+0.0157), Sharpe 0.7363->0.7720 (+0.036), MaxDD 1.850->1.787. raw_composite 0.6463>baseline 0.6394 — FIRST genuine rally raw lift this session (cuts losing-long slow bleeders, the 40%WR drag from direction-split). Composite 0.5214<0.6393 ONLY due to rally stability re-seed 0.8008->0.6086 (factor 1.0->0.362; bull/crash/sideways held factor 1.0). Branch goal: strengthen bleeder-cut to raise rally stability robustly (bleeders ARE the noise-sensitive trades). KEEP needs rally stab>=0.789 w/ others at factor 1.0 -> composite ~0.646.
4d... 	0.4493	0.6405	0.3825	0.78	0.77	1.01	0.00	branch	branch step2: stronger stale-loss cut (bar5-10, 0.45stop). bull/crash/sideways BYTE-IDENTICAL. rally Sharpe 0.7363->0.7773 (raw lever still rising), MaxDD 1.850->1.778. rally stability re-seed 0.467 (factor 0.0) -> rally final 0.0. composite 0.4493. Confirms raw lever monotonic in strength; stability seed-dominated.
4d... 	0.4666	0.6498	0.3664	0.78	0.77	1.01	0.04	branch	branch step3: stronger still (bar3-8, 0.30stop). bull/crash/sideways BYTE-IDENTICAL. rally Sharpe 0.7788 (PLATEAU: 0.772/0.777/0.779 across steps1-3 -> raw lever saturates ~Sh0.78), MaxDD 1.775, trades 68 WR66.2 (cuts loss SIZE not count). raw_composite 0.6474>baseline 0.6394 (raw-optimal of the mechanism). rally stability re-seed 0.526 (factor 0.087) -> doesnt keep.
4d... 	0.4757	0.6549	0.3585	0.78	0.77	1.01	0.06	branch	branch step4: REFORMULATION (fold bleeder-cut into existing stop via time-tightening, no new MAX term). RESULT INERT: ALL 4 regimes BYTE-IDENTICAL to baseline (raw_composite 0.639349 EXACT). The ATR stop is not the binding exit for bleeders (slope/time pressures close them first) -> stop-fold cannot reproduce the gain. raw REGRESSION vs step3 (no-progress step 1). The separate MAX term is the working mechanism.
4d... 	0.4493	0.6405	0.3825	0.78	0.77	1.01	0.00	branch	branch step5: restored MAX term, WIDE/SMOOTH ramps (bar6-12, 0.80stop) to reduce new-boundary noise-sensitivity. bull/crash/sideways BYTE-IDENTICAL, rally Sharpe 0.7723 (raw lever intact). rally stability re-seed 0.414 (WORST draw; smoothing did NOT help) -> factor 0.0. Stability draws across branch {0.609,0.467,0.526,0.541,0.414} all seed-dominated, NONE >=0.79; mechanism does NOT robustly raise rally stability (cutting noisy bleeders is offset by the new exit boundary re-seeding).
ba7cd2fb	0.6393	0.7454	0.2120	0.78	0.77	1.01	0.42	discard	BRANCH SUMMARY (5 steps, REVERTED to de412448): NEW stale-loss exit term (cut positions underwater past ~bar 5-8 by adversity, added to MAX soft-exit fusion). VALIDATED GENUINE SURGICAL RALLY-RAW LEVER: across all working variants bull/crash/sideways raw+Sharpe BYTE-IDENTICAL (winners 86-100%WR never sit underwater), rally Sharpe 0.7363->~0.78 (+0.04, plateaus), rally MaxDD 1.850->1.78, raw_composite 0.6393->0.6474 (step3). Mechanism cuts the losing-long slow bleeders (direction-split: rally LONG 20tr -380 40%WR drag vs SHORT 48tr +2381 77%WR alpha). BLOCKED FROM KEEP by rally stability seed-lock: 5 draws {0.609,0.467,0.526,0.541,0.414} ALL <0.79 (need >=0.789 for rally factor 1.0); cutting noisy bleeders does NOT robustly raise rally stability (new exit boundary re-seeds, draws cluster low). Stop-fold reformulation (step4) INERT (ATR stop not the binding bleeder exit). raw-optimal variant (step3) drew 0.526 -> does not keep; reaching >=0.79 would require seed-selection = FISHING (refused). Same wall as inherited surgical-ride-suppression lever. Reverted via git checkout de412448 -- strategy.py.
