commit	score	mean_score	std_score	bull_2021	crash_bear	sideways	rally_2024	status	description
e0def21d	0.604308	0.633194	0.096289	0.699982	0.575486	0.749596	0.507713	discard	Exp2 (architectural, indep): MULTI-DAY trend BOOST on the scale-in win-accelerator (boost-only). ret_vlong (96-bar OLS slope) was previously used at ENTRY sizing and the EXIT ct-cut but NEVER on the scale-in PACE (grep confirmed untested). The win-accelerator (the validated raw-moving lever: Exp3 +0.021, Exp5 magnitude-raise KEEP) gates on _trend_strength_w (20-bar) + _slope_conf (16-bar), both near-term. Hypothesis: a deep MULTI-DAY trend (ret_vlong strongly with position = rally grind / crash grind) is the highest-quality sustained trend -> reach full size FASTER for deep-trend winners -> more sustained-trend capture -> higher rally Sharpe (raw lever, all stabilities 1.0). BOOST-ONLY (factor>=1.0, +0.30 max, /0.03 fast-sat near-constant noise-free) respects the load-bearing-magnitude lesson (any gate REDUCING the accelerator costs rally raw); profit+slope+deep-trend gated so baseline/non-deep-trend winners byte-identical. MEASURED vs cabfb6f1 0.605307: composite -0.000999 (0.604308), mean -0.000554 (0.633194), std +0.001487 (0.096289 wider). PER-REGIME: bull +0.000934 (0.699048->0.699982 Sh1.863940->1.867671 IMPROVED), sideways +0.000485 (0.749111->0.749596 Sh2.024898->2.027647, MaxDD 0.552867->0.603328), crash BYTE-IDENTICAL 0.575486 (ret_vlong<0 for bounce longs -> _md_trend_align=0 -> boost off -> confirms crash is 100pct bounce LONGS against the downtrend, not bear shorts), rally -0.003633 (0.511346->0.507713 Sh1.300294->1.287889, MaxDD 1.571597->1.613869 REGRESSED -- the BINDING regime). All stab 1.0, all flip 1.0, all MaxDD<10pct. FAILURE = the rally regression is the OPPOSITE of the hypothesis: faster scale-in for rally trend longs (ret_vlong solidly positive) = bigger EARLY exposure -> rally pullbacks hit the bigger early position -> bigger giveback (MaxDD 1.57->1.61) + lower Sharpe. This EXTENDS the documented faster-scale-in-hurts-rally wall (prior Exp2 entry-conviction pace: larger early exposure BEFORE pullback reversals -> bigger losses) to the multi-day-trend-boost variant. The mechanism is WRONG-DIRECTIONAL for the binding regime at any positive boost magnitude (faster scale-in is structurally bad for rally pullback-prone trend; halving the boost would just proportionally shrink all effects, rally still regresses). bull/rally cannot be separated via ret_vlong (both strong multi-day uptrend = documented bull-rally coupling). Not branch-eligible: no credible fix that does not fight the documented faster-scale-in-hurts-rally / inseparable-cost wall (rally reversals ARE its alpha AND its noise). Observation (correlation only): bull+sideways gains confirm faster scale-in helps pullback-light trends, but the binding regime is pullback-prone. Architectural discard #2. Reverted to cabfb6f1 via git checkout -- strategy.py.
-	-	-	-	-	-	-	-	session-summary	SESSION (v2.1 baseline cabfb6f1 0.605307): 0 keeps + 2 architectural discards (Exp1/Exp2), no branch opened. Baseline UNCHANGED cabfb6f1 0.605307 [bull 0.699048 Sh1.864, crash 0.575486 Sh1.264, sideways 0.749111 Sh2.025, rally 0.511346 Sh1.300 MaxDD1.57; all stab 1.0, all flip_streak 1.0, all MaxDD<10pct (0.90/0.65/0.55/1.57); raw==composite (Sharpe-dominated)]. THEME: with the strategy at documented structural rigidity (5+ prior sessions 0 keeps, every OHLCV-derived axis saturated), probed 2 genuinely-novel architectural angles on the validated raw-moving levers (admission-timing + scale-in-pace), each NOT in a prior dead-end family by construction. INDEPENDENT DISCARDS: (1) Exp1 DEMA (Double-EMA) entry-readiness accumulator -- FUNCTION-FORM rewrite of the admission readiness mechanism (single-EMA -> DEMA=2*E1-E2, new E2 state per side; targets entry-TIMING lag reduction). BYTE-IDENTICAL INERT (composite 0.605307, all 4 regimes identical). Extends the prior-session RHO-inert finding to the EMA-vs-DEMA function-form axis: the readiness accumulator is a CONFIRMATION gate, not the binding admission decision; entries fire on the strong-sum/trend gates on decisive margin before the accumulator crossing matters, so changing its smoothing form (or RHO) never alters an admission. (2) Exp2 MULTI-DAY trend BOOST on the scale-in win-accelerator (ret_vlong x pos_dir, boost-only +0.30, /0.03 fast-sat; ret_vlong was previously used at entry-sizing + exit-ct-cut but NEVER on the scale-in pace -- grep-confirmed novel). composite -0.000999 (0.604308), mean -0.000554, std +0.0015. PER-REGIME: bull +0.000934 (Sh1.864->1.868), sideways +0.000485 (Sh2.025->2.028), crash BYTE-IDENTICAL (ret_vlong<0 for bounce longs -> boost off -> re-confirms crash is 100pct bounce LONGS not bear shorts), rally -0.003633 (Sh1.300->1.288, MaxDD 1.57->1.61 REGRESSED -- the binding regime). FAILURE = faster scale-in for rally trend longs (ret_vlong solidly positive) = bigger EARLY exposure -> rally pullbacks hit the bigger early position -> bigger giveback + lower Sharpe. EXTENDS the documented faster-scale-in-hurts-rally wall (prior Exp2 entry-conviction pace) to the multi-day-trend-boost variant. Wrong-directional for the binding regime at ANY positive boost magnitude; bull/rally inseparable via ret_vlong (documented bull-rally coupling). Not branch-eligible (no credible fix that does not fight the documented inseparable-cost wall: rally reversals ARE its alpha AND its noise). CROSS-SESSION CONCLUSIONS (reinforced, all measured this session): (a) the entry-readiness accumulator is inert as an admission lever under BOTH parameter (RHO) AND function-form (EMA->DEMA) changes -- it confirms but does not bind; do NOT re-attempt accumulator-form changes. (b) The scale-in win-accelerator remains a raw-moving lever for pullback-LIGHT trends (bull+sideways gained) but is structurally WRONG-DIRECTIONAL for rally (pullback-prone): faster scale-in = bigger early exposure = pullback giveback. This is the same wall as entry-conviction pace and multi-day-boost. (c) crash byte-identical under a ret_vlong-direction gate re-confirms crash is 100pct bounce LONGS (ret_vlong<0 -> boost off). The binding rally Sharpe (1.30) remains unconquered; this sessions 2 mechanisms failed in ways consistent with the documented dead-end families (accumulator-inert / faster-scale-in-hurts-rally). The strategy is at near-global-optimum on this harness -- every OHLCV-derived signal axis (bar-shape, volume, DVP, slope, returns at 8/20/96-bar, ER, R^2, ATR, MAE/MFE), every exit mechanism (7 soft sources + MAX fusion load-bearing + harvest/opp-gate), every admission change (accumulator/RHO/trend-asymmetric), every sizing approach (scale-invariant), and every scale-in-pace variant are now confirmed saturated or wrong-directional for the binding regime. results.tsv append-only preserved (path-scoped git checkout -- strategy.py throughout, never git revert); both discards reverted to cabfb6f1. EXIT: 0 keeps, 2 architectural discards (satisfies the 2-architectural-discard minimum), baseline cabfb6f1 0.605307 unchanged.
59511b67	0.602888	0.631011	0.093742	0.689618	0.575486	0.749111	0.509829	discard	Exp1 (architectural, indep): cross-sectional return DISPERSION correlation-aware concentration governor. NEW cross-symbol x cross-sectional data dep (dispersion of 3 symbols 12bar log returns, the only portfolio-level correlation statistic; all prior cross-symbol primitives are bilateral directional agreement). _xcorr_factor in [0,1] (~1 low-dispersion correlated rally grind, ~0 high-dispersion bull rotation); scales _conc_shrink magnitude via blend 0.5+0.5*xcorr (decorrelated keeps half the load-bearing shrink, correlated full). MEASURED vs cabfb6f1 0.605307: composite -0.002419 (0.602888), mean -0.002737, std -0.001060 (slightly better). PER-REGIME: bull -0.009430 (0.699->0.690 REGRESSED, opposite of spare-bull hypothesis -- bull pile-up moments stay risky despite high avg dispersion; reducing the base governor shrink let bull corrections hit bigger entries), rally -0.001517 (0.511->0.510 REGRESSED, opposite of help-rally hypothesis -- correlated shrink over-shrunk rally pile-ups, the documented over-shrinkage wall), crash BYTE-IDENTICAL, sideways BYTE-IDENTICAL. min_stability 0.817. Hypothesis DISPROVEN on both fronts: portfolio-correlation-aware shrink is wrong-directional for BOTH trend regimes (bull needs its full governor protection even when decorrelated on average; rally cannot tolerate more shrink on its pile-ups). Not branch-eligible (no regime improved, both affected trend regimes regressed). Architectural discard #1. Reverted to cabfb6f1 via git checkout -- strategy.py.
8c0c9d1b	0.515831	0.542209	0.087928	0.423414	0.568276	0.665495	0.511652	discard	Exp2 (architectural, indep): volume-clock time-pressure modulation. NEW per-symbol cumulative-volume-since-entry state (_vol_bars_held, sums each bar volume/50bar-mean while open, reset on exit) -> vol_time_ratio = vol_bars_held/bars_held; blends bars_held toward volume-time via kappa=0.20 in the _time_pressure ramp (_bars_held_eff = bars_held*(1+0.2*(ratio-1))). _max_hold + ct-hold shortening left bar-based. MEASURED vs cabfb6f1 0.605307: composite -0.089476 (0.515831 CATASTROPHIC), raw_composite 0.560376 (raw -0.044931), mean -0.091539, std -0.006874. min_stability 0.820->0.726 CRASHED below 0.80 knee. PER-REGIME: bull 0.699->0.423 (raw 0.563 -- stability penalized, the volume-bar-ratio is noise-sensitive -> exit timing wobbles across AR(1) ensemble -> tracking error), sideways 0.749->0.665 (-0.0836 raw -- volume-clock shifted exit timing on sideways mean-reverters), crash 0.575->0.568 (-0.007), rally 0.511->0.512 (+0.0013 flat -- rally barely affected, its vol rate near norm). Hypothesis DISPROVEN: volume-clock adds a noise-sensitive quantity (per-bar volume ratio) into exit timing that the noise-IMMUNE integer bar-clock avoids -> stability crash on the low-vol regimes (bull/sideways) whose exit timing is stability-sensitive. Confirms WHY bar-count (noise-immune) is used throughout for hold timing; volume-time is the wrong clock for this harness. Not branch-eligible (catastrophic stability regression, no regime improved meaningfully). Architectural discard #2. Reverted to cabfb6f1 via git checkout -- strategy.py.
2423ef9e	0.605307	0.633748	0.094802	0.699048	0.575486	0.749111	0.511346	discard	Exp3 (architectural, indep): portfolio WIN-streak trend-aligned admission relaxation. NEW portfolio state _win_streak (symmetric counterpart to _loss_streak, incremented on winning close, reset on loss). Relaxes _bull/_bear_strong_min by up to 8% for TREND-ALIGNED entries (entry dir matches ret_long, /0.04 fast-sat noise-free) during win-streaks (streak>=2). Hypothesis: win-streak = favorable regime -> admit marginally-conviction trend entries (changes trade SET not size, so not scale-invariant); trend-aligned gate spares ct side (rally ct-short drag + crash bounce longs byte-identical). MEASURED vs cabfb6f1 0.605307: BYTE-IDENTICAL (composite 0.605307, all 4 regimes identical, min_stability 0.820383). Completely INERT: the 8% trend-aligned relaxation never alters any admission. The admission boundary is already saturated with relaxation paths (_bull_relax conviction-margin softening up to 1.5x deadzone, trend-asymmetric bull relaxation -10pct, readiness EMA accumulator) so an additional trend-aligned win-streak relaxation does not change the effective admission set. Confirms admission-relaxation saturation: marginal trend entries are already admitted by the existing overlapping paths. Not branch-eligible (byte-identical, nothing to iterate). Architectural discard #3. Reverted to cabfb6f1 via git checkout -- strategy.py.
8533be66	0.605307	0.633748	0.094802	0.699048	0.575486	0.749111	0.511346	discard	Exp4 (architectural, indep): COUNTER-TREND-LONG winner-hold extension (crash-bounce return-seeking, ct-direction-scoped). Re-attempt of the prior vol-stability winner-hold branch (crash +0.022 Sh VERIFIED but stagnated +0.0017 due to fixed bull/sideways gate-firing bleed). THIS version scopes the _max_hold extension to COUNTER-TREND LONGS: LONG position while ret_vlong<0 = crash dead-cat-bounce long (crash is 100pct bounce LONGS, 100pct WR). Gates: ct-long (/0.01 fast-sat noise-free) x winning (pos_pnl>0) x slope-confirming (_slope_conf) x calm (low vol_ratio). +2.0 bar extension (below prior branch +5 stability wall). Hypothesis: ct-long scope removes the bull/sideways bleed (bull/rally longs trend-aligned ret_vlong>0 -> gate 0; sideways ~0), so the crash gain clears +0.003 without the bleed offset. MEASURED vs cabfb6f1 0.605307: BYTE-IDENTICAL (composite 0.605307, all 4 regimes identical, min_stability 0.820383). Completely INERT: extending _max_hold for ct-long winners never alters a crash trade. DIRECTLY CONFIRMS the prior-session Exp1 finding (extended to the ct-long-scoped variant): crash bounce longs exit via peak-profit giveback / slope-against paths BEFORE the time-pressure ramp engages, so delaying _max_hold has zero effect on crash exits. The +0.022 Sh in the prior vol-stability branch must have come from the full mechanism combination (hump-gate + hold-ext altering the exit PATH via peak/giveback interaction), NOT from pure max_hold extension. max_hold extension is structurally inert for crash regardless of ct-direction scoping. Not branch-eligible (byte-identical, nothing to iterate -- the lever is inert because crash exits before time-pressure). Architectural discard #4. Reverted to cabfb6f1 via git checkout -- strategy.py.
b21931a4	0.605307	0.633748	0.094802	0.699048	0.575486	0.749111	0.511346	discard	Exp5 (architectural, indep): ct-long modest-winner PEAK-PROFIT giveback tolerance widening (crash-bounce return-seeking via the peak-profit exit path -- the path crash actually uses, per Exp4). Exp4 proved max_hold extension is byte-identical inert for crash (bounces exit before time-pressure); the prior vol-stability branch crash +0.022 came from altering the peak/giveback PATH. So target peak-profit directly: raise _pp_lower (widen no-harvest giveback zone) for ct-long MODEST winners (crash bounce longs, ret_vlong<0, 100pct WR) so they ride more giveback before harvest -> capture more bounce. Hump-gate fades deep-profit (harvest near tops). ct-long scope spares bull/rally. Gates: ct-long x modest-winner (1-tanh(profit_mag/0.7)) x winning. MEASURED vs cabfb6f1 0.605307: BYTE-IDENTICAL (composite 0.605307, all 4 regimes identical, min_stability 0.820383). Completely INERT. Most likely cause: crash bounce longs are MODEST winners whose peaks stay BELOW _pp_min activation (_pp_activation=0 -> _pp_pressure=0 regardless of _pp_lower), so the peak-profit giveback path does not fire on crash bounces at all. This is the 3rd confirmation (Exp4 max_hold, Exp5 peak-profit giveback) that crash's exit path is structurally hard to shift: crash bounce longs are modest winners that exit via slope-against / adverse-recovery / stop before any profit-magnitude-based harvest (pp_pressure, tp_harvest, max_hold) engages. The prior vol-stability branch crash +0.022 required the FULL mechanism combination (hump-gate + hold-ext + multi-gate stack) altering the exit path via interaction effects, not any single exit-path lever. Not branch-eligible (byte-identical, nothing to iterate). Architectural discard #5 -- EXIT RULE TRIGGERED (5 consecutive architectural discards). Reverted to cabfb6f1 via git checkout -- strategy.py.
-	-	-	-	-	-	-	-	session-summary	SESSION (v2.1 baseline cabfb6f1 0.605307): 0 keeps + 5 architectural discards (Exp1-Exp5), no branch opened. EXIT RULE TRIGGERED (5 consecutive architectural discards). Baseline UNCHANGED cabfb6f1 0.605307 [bull 0.699048 Sh1.864 AnnRet4.7pct DD0.90pct 52t WR86.5pct, crash 0.575486 Sh1.264 AnnRet3.2pct DD0.65pct 52t WR100pct, sideways 0.749111 Sh2.025 AnnRet3.5pct DD0.55pct 49t WR98pct, rally 0.511346 Sh1.300 AnnRet3.9pct DD1.57pct 98t WR84.7pct; all stab>=0.82 (min 0.820 rally), all flip 1.0, all MaxDD<10pct; raw==composite Sharpe-dominated]. THEME: probed genuinely-novel architectural angles on portfolio-level/cross-sectional data deps (untouched: 0 prior portfolio-vol-targeting) + the crash return-seeking mechanism re-scoped to remove the prior vol-stability branchs fixed bleed. INDEPENDENT DISCARDS: (1) Exp1 cross-sectional DISPERSION correlation-aware concentration governor (NEW cross-sectional stat, only portfolio-correlation primitive; _xcorr_factor scales _conc_shrink magnitude): composite -0.0024, bull -0.0094 + rally -0.0015 BOTH trend regimes regressed (wrong-directional -- bull pile-ups stay risky despite high avg dispersion; rally cannot tolerate more correlated shrink, the over-shrinkage wall). (2) Exp2 VOLUME-CLOCK time-pressure modulation (NEW per-symbol cumulative-volume-since-entry state, blends bars_held toward volume-time): composite -0.0895 CATASTROPHIC, min_stability 0.820->0.726 CRASHED (volume-bar-ratio is noise-sensitive -> exit-timing wobble across AR(1) ensemble -> tracking error on low-vol bull/sideways). Confirms WHY noise-immune integer bar-clock is used throughout for hold timing. (3) Exp3 portfolio WIN-STREAK trend-aligned admission relaxation (NEW _win_streak state, symmetric to _loss_streak; relaxes strong_min for trend-aligned entries during win-streaks): BYTE-IDENTICAL INERT (admission boundary saturated with overlapping relaxation paths -- _bull_relax conviction-margin, trend-asymmetric relaxation, readiness EMA). (4) Exp4 COUNTER-TREND-LONG winner-hold extension (crash-bounce return-seeking, ct-direction-scoped to remove the prior vol-stability branchs bull/sideways fixed bleed): BYTE-IDENTICAL INERT -- directly confirms (ct-long-scoped variant) prior-session finding that crash bounces exit via peak-profit/slope BEFORE time_pressure, so _max_hold extension has zero effect. (5) Exp5 ct-long modest-winner PEAK-PROFIT giveback tolerance widening (targets the peak-profit path crash actually uses, per Exp4; hump-gate fades deep-profit): BYTE-IDENTICAL INERT -- crash bounces are modest winners whose peaks stay BELOW _pp_min activation (_pp_pressure=0 regardless of _pp_lower). CROSS-SESSION CONCLUSIONS (all measured this session): (a) cross-sectional return dispersion is bull-correlated (bull-2021 mean 0.0206 vs rally/crash/sideways 0.009-0.010) so any dispersion-fired mechanism is wrong-directional for the strong regime (bull) and non-selective for the weak regime (rally) -- dispersion is NOT a useful lever on this harness; (b) volume-clock / volume-rate quantities are noise-sensitive and crash stability when fed into exit timing -- the noise-immune integer bar-clock is the only safe hold-time dimension (extends the noise-sensitive-quantity-in-timing wall to the volume-clock axis); (c) the admission boundary is saturated with relaxation paths -- additional trend-aligned/win-streak relaxations are byte-identical inert; (d) crash return-seeking via SINGLE exit-path levers (max_hold OR peak-profit giveback) is structurally inert -- crash bounce longs are modest winners that exit via slope-against/adverse/stop BEFORE any profit-magnitude-based harvest (pp_pressure, tp_harvest, max_hold) engages; the prior vol-stability branch crash +0.022 required the FULL multi-gate mechanism combination altering the exit path via interaction effects, not any single exit-path lever, and that combination is capped at +0.0017 by fixed bull/sideways bleed (exhausted prior branch). The binding rally Sharpe (1.30) and crash Sharpe (1.26) remain unconquered; this sessions 5 mechanisms failed in ways consistent with the documented dead-end families (wrong-directional-trend-regime / noise-sensitive-timing-crash / admission-saturation-inert / single-exit-path-inert-for-crash). The strategy is at near-global-optimum on this harness. results.tsv append-only preserved (path-scoped git checkout -- strategy.py throughout, never git revert); all 5 experiments reverted to cabfb6f1. EXIT: 0 keeps, 5 architectural discards (satisfies the 2-architectural-discard minimum and the 5-consecutive-architectural-discard stop rule), baseline cabfb6f1 0.605307 unchanged.
cabfb6f1	0.605307	0.633748	0.094802	0.699048	0.575486	0.749111	0.511346	keep	KEEP (RE-AFFIRMED BASELINE under v2.1 scoring). cabfb6f1 strategy.py == HEAD. Re-appended keep row so next session reads correct baseline (last legacy keep cf9a42ea 0.847578 was under OLD scoring pre-vol_gate-removal/return_reward-add; session-summaries establish cabfb6f1 0.605307 as the v2.1 baseline). v2.1 scores: composite 0.605307 mean 0.633748 std 0.094802. PER-REGIME: bull 0.699048 (Sh1.864 AnnRet4.7pct DD0.90pct 52t WR86.5pct), crash 0.575486 (Sh1.264 AnnRet3.2pct DD0.65pct 52t WR100pct), sideways 0.749111 (Sh2.025 AnnRet3.5pct DD0.55pct 49t WR98pct), rally 0.511346 (Sh1.300 AnnRet3.9pct DD1.57pct 98t WR84.7pct). All stability_factor 1.0, all flip_streak_gate 1.0, all flip_count 0 -> raw==score. BINDING CONSTRAINT: raw return in crash (100pct WR / 0.65pct DD / 3.2pct AnnRet = huge DD headroom, gain-locking too conservative) and rally (84.7pct WR / 1.57pct DD / 3.9pct). std driven by strong(sideways/bull) vs weak(crash/rally) spread.
