commit	score	mean_score	std_score	bull_2021	crash_bear	sideways	rally_2024	status	description
-	0.916682	1.011808	0.317086	1.382650	0.918172	1.295855	0.974328	0.488033	session-summary	SESSION (baseline 594c9175 0.916682 -> UNCHANGED, no keep): 5 independent ARCHITECTURAL experiments (Exp1-5: MTM-path-chop exit pressure, profit-gated ct_hold_sat, ct-winner scale-in accel, ct-sign tp_harvest activation, profit-ramped ct emission [BRANCH OPEN]) + 1 exploration branch (profit-ramped ct-at-multi-day emission, 6 steps, REVERTED). EXIT RULE: branch concluded with revert -> session ends. >=2 architectural discards MET (4 independent byte-identical exit/scale-in discards + 6 branch steps all architectural). Baseline 594c9175 re-verified byte-identical at session start AND post-revert (composite 0.916682 mean 1.011808 std 0.317086, all stab 1.0 raw==score, min_stab 0.844322) [bull 1.382650 Sh2.068 APY20.4, crash 0.918172 Sh1.254 APY11.8, sideways 1.295855 Sh2.027 APY14.3, rally 0.974328 Sh1.553 APY18.6, mixed 0.488033 Sh0.808 APY4.4 45t] AND strategy.py at 594c9175 post-revert. results.tsv append-only preserved throughout (path-scoped git checkout 09600532/594c9175 -- strategy.py for reverts, never git revert; results.tsv untouched). THEME: targeted mixed_2025 (binding floor Sh0.808 45t < 50-trade knee). KEY DISCOVERY (10 experiments): mixed is at a CONFIRMED STRUCTURAL CEILING -- 4 independent exit/scale-in/tp_harvest probes ALL byte-identical for mixed (exit subsystem disconnected: mixed exits at small peaks < 1.6*_pp_min before tp_harvest/max_hold bind), emission layer is the ONLY mixed-reachable lever (step1 +0.001640 via +1 sample_factor trade) but saturated (fixed reduction count), sizing disconnected (first-bar offset byte-identical). NEXT SESSION: mixed requires a multi-mechanism combination or a fundamentally new orthogonal data source (the emission-threshold-reduction + grid-exemption stack from 594c9175 keep is maxed; single-mechanism architectural changes cannot reach +0.003 from here).
aa76fed0	0.820417	0.899761	0.264481	0.956507	0.918172	1.296042	0.861560	0.466524	discard	Exp1 (architectural, indep): 9th voter on MULTI-DAY TREND DIRECTION (ret_vlong /0.02, weight 0.55). Prior session sanctioned lower-frequency voter work. MEASURED vs baseline 594c9175 0.916682: composite 0.820417 (-0.096 FAIL), mean 0.899761 (-0.112 FAIL), std 0.264481. PER-REGIME all stab 1.0 raw==score: bull 1.382650->0.956507 (-0.426, 69pct of baseline -- within 50pct gate but large), rally 0.974328->0.861560 (-0.113), mixed 0.488033->0.466524 (-0.021), crash BYTE-IDENTICAL, sideways 1.295855->1.296042 (+0.0002). DIAGNOSTIC: ret_vlong>0 throughout bull incl pullbacks (96-bar trend stays up) -> voter adds bull conviction to PULLBACK entries that should be filtered -> over-admission. The trend-DIRECTION signal over-admits pullback noise (same failure as prior sessions trend-direction attempts). LESSON: lower-frequency voter must be DIRECTION-AGNOSTIC (like the 8th range/close efficiency measuring trend CLEANLINESS not direction); a directional multi-day voter duplicates ret_long/ret_vlong admission bias. min_stab 0.833669. Reverted to 594c9175.
2b8c7e96	-999.0	-199.580	399.710	0.639381	-999.0	0.000000	0.269821	0.193264	d	Exp2 (architectural, indep): 9th voter on 48-bar range/close efficiency (lower-freq analog of validated 8th). MEASURED vs baseline 594c9175: composite -999 (CATASTROPHIC -- crash_bear -999 hard cutoff, sideways 0.0, min_stab 0.032). PER-REGIME: bull 1.382650->0.639381 (-0.743, 46pct of baseline -- 50pct GATE BREACHED), crash 0.918172->-999 (hard cutoff: >10pct DD or lost >15pct -- the 48-bar efficiency signal LAGS turns, staying trending past actual exhaustion -> over-commits wrong-side entries at crash tops/bottoms), sideways 1.296->0.000 (score-zeroed via stability 0.03), rally 0.974->0.270, mixed 0.488->0.193. 50pct gate breached on bull AND crash. NOT branch-eligible (catastrophic break, not a tunable regression -- the failure mode is a LAGGING signal causing wrong-side entries at regime turns, structurally incompatible with the admission gate). LESSON: longer-window efficiency signals have lag that over-commits at turns; the 8th voter 12-bar window is the validated sweet spot (fast enough to not lag, slow enough to not flip). Lower-frequency voter work via LONGER windows is dead; the viable lower-frequency direction must avoid lag (e.g. a signal that is low-frequency WITHOUT being a moving average). Reverted to 594c9175.
11f213b2	0.843978	0.917351	0.244575	0.926630	0.899744	1.258046	1.003538	0.498797	branch	branch step1 OPEN: entry-conviction-modulated de-risk floor. Cache _bull/_bear_margin at entry; profit-side de-risk floor -0.08 for cached margin>0.40. MEASURED vs baseline 594c9175 0.916682: composite 0.843978 (-0.073), mean 0.917351 (-0.094), std 0.244575 (-0.073). PER-REGIME all stab 1.0 raw==score: rally 0.974328->1.003538 (+0.029 -- TARGET GAIN, high-conviction winners ridden through pullback giveback), mixed 0.488033->0.498797 (+0.011 -- BINDING FLOOR LIFTED, +0.011 via entry-quality cushion), bull 1.382650->0.926630 (-0.456, 67pct of baseline -- within 50pct gate but large: bull clean-trend winners over-held through giveback that reverses), sideways 1.295855->1.258046 (-0.038), crash 0.918172->0.899744 (-0.018). BRANCH OPENED: 2 regimes improved incl mixed (binding floor) + fundamentally new entry->exit data dep. FIX HYPOTHESIS: bull/sideways regression is the cushion firing when near-term slope has WEAKENED (giveback is a real reversal, not noise). The existing _dr_k convex cushion is ALREADY gated by _dr_slope_conf (16-bar multi-window slope confirming position); gate the new entry-conv floor reduction by the SAME _dr_slope_conf so it only rides giveback when slope still confirms. min_stab 0.843819.
128cad1a	0.877697	0.954692	0.256650	1.117484	0.899744	1.253947	1.003537	0.498747	branch	branch step2: gate entry-conv floor reduction by _dr_slope_conf. MEASURED vs step1 0.843978: composite 0.877697 (+0.034 PROGRESS), mean 0.954692 (+0.037), std 0.256650. PER-REGIME all stab 1.0 raw==score: bull 0.926630->1.117484 (+0.191 -- slope gate recovered most of bull loss), rally 1.003538->1.003537 (flat, +0.029 vs baseline KEPT), mixed 0.498797->0.498747 (flat, +0.011 vs baseline KEPT), sideways 1.258046->1.253947 (-0.004), crash 0.899744->0.899744 (flat). vs BASELINE 0.916682: composite -0.039, mean -0.057. Bull still -0.266 (cushion fires on slope-confirmed bull winners but bull slope stays positive into early pullback -> rides first giveback that reverses). NEXT: gate by vol_ratio (low-vol only) -- bull-2021 high-vol sharp pullbacks excluded, rally/mixed low-vol grind kept (documented bull/rally separator). min_stab 0.839949.
26301af6	0.881320	0.959687	0.261224	1.129784	0.899740	1.266746	1.003419	0.498747	branch	branch step3: vol-regime gate (low-vol grind only) on entry-conv cushion. MEASURED vs step2 0.877697: composite 0.881320 (+0.004 PROGRESS), mean 0.959687 (+0.005), std 0.261224. PER-REGIME: bull 1.117484->1.129784 (+0.012), sideways 1.253947->1.266746 (+0.013 -- recovered), rally 1.003537->1.003419 (flat), mixed 0.498747->0.498747 (flat), crash flat. vs BASELINE: composite -0.035, mean -0.052. rally +0.029 mixed +0.011 KEPT. Bull still -0.253 (vol gate helped sideways more than bull -- bull-2021 vol_ratio likely <1.3 for much of its run so the gate does not exclude it). NEXT: halve magnitude 0.08->0.04 (preserve rally/mixed gains at half-bull-cost) AND add _dr_align trend-align gate (match _dr_k full stack). min_stab 0.839949.
0692bbfe	0.915848	1.008828	0.309933	1.382619	0.916834	1.258183	0.997096	0.489410	branch	branch step4: full-gate stack (align+slope-conf+vol+conv) + halve magnitude 0.08->0.04. MEASURED vs step3 0.881320: composite 0.915848 (+0.035 BIG PROGRESS), mean 1.008828 (+0.049). PER-REGIME: bull 1.129784->1.382619 (+0.253 FULLY RECOVERED, byte-identical to baseline 1.382650 -- full gate stack excludes bull), rally 1.003419->0.997096 (-0.006, still +0.023 vs baseline), mixed 0.498747->0.489410 (-0.010, back to near baseline 0.488), sideways 1.266746->1.258183 (-0.009), crash 0.899740->0.916834 (+0.017). vs BASELINE: composite -0.0008 (SUB-NOISE, not a keep), mean -0.003. TRADE-OFF CONFIRMED: magnitude 0.08 -> rally/mixed gains but bull -0.253; magnitude 0.04 full-gates -> bull preserved but rally/mixed gains vanish. The bull/rally coupling (prior session documented) means cushion cannot reach rally/mixed without a bull cost at this gate stack. NEXT: tighten vol gate to vol_ratio<0.9 (exclude bull-2021 whose vol_ratio ~1.0-1.2 partial under current gate) so cushion fires ONLY in very-low-vol grind (rally/mixed). min_stab 0.844452.
fde731bf	0.872316	0.951628	0.264373	1.129805	0.871793	1.263537	1.001359	0.491644	branch	branch step5: tighten vol gate (0.7-1.1 band) + restore magnitude 0.08. MEASURED vs step4 0.915848: composite 0.872316 (-0.044 REGRESSION), mean 0.951628. PER-REGIME: bull 1.382619->1.129805 (-0.253 -- bull regressed AGAIN: tighter vol gate did NOT exclude bull), rally 0.997096->1.001359 (+0.004), mixed 0.489410->0.491644 (+0.003), crash 0.916834->0.871793 (-0.045), sideways 1.258183->1.263537 (+0.006). DIAGNOSTIC: bull-2021 vol_ratio is NOT 1.0-1.2 -- it must be BELOW 0.9 (so the tighter gate still admits bull). bull-2021 is a sharp uptrend but its realized vol relative to the DYNAMIC target vol is low (grinding despite sharp). The vol_ratio separator does NOT cleanly separate bull from rally/mixed for the giveback-riding cushion (distinct from _grind_gate which gates a reduction throttle). 1st no-progress step. Reverted to step4 (best 0.915848).
941315f5	0.691766	0.795175	0.344697	0.314630	0.916834	1.257845	0.997158	0.489409	branch	branch step6: replace vol gate with ER gate (exclude sideways). MEASURED vs step4 0.915848: composite 0.691766 (-0.224 CATASTROPHIC), mean 0.795175. PER-REGIME: bull 1.382619->0.314630 (-1.068 CATASTROPHIC -- ER gate ~1.0 for bull (high ER directional) -> full cushion -> over-holds bull far worse than step4 vol gate which PARTIALLY dampened bull), sideways 1.258183->1.257845 (flat -- ER gate DID exclude sideways as intended), rally 0.997096->0.997158 (flat), mixed flat, crash flat. DIAGNOSTIC: step4 preserved bull ONLY because its vol gate PARTIALLY dampened bull cushion (vol_ratio ~0.9-1.3 -> gate 0.4-0.8); any FULL-strength cushion (ER gate ~1.0 for bull) over-holds bull catastrophically. CONFIRMS the entry-conv de-risk cushion is BULL/RALLY COUPLED -- bull and rally share high ER + trend-align + slope-conf + directional, so NO clean gate separates them. The prior session documented exact bull/rally coupling (ct_vlong shrink); it holds for this mechanism too. 2nd no-progress step. Reverted to step4 (ceiling 0.915848 sub-noise).
b7ee0a81	0.915990	1.011065	0.316916	1.382649	0.918172	1.294577	0.971893	0.488033	branch	branch step7: REVERSE direction -- raise de-risk floor for LOW-conviction entries (cut marginal winners faster). MEASURED vs step4 0.915848: composite 0.915990 (+0.0001 FLAT), mean 1.011065. PER-REGIME: bull BYTE-IDENTICAL (1.382649), crash BYTE-IDENTICAL, sideways 1.295855->1.294577 (-0.001), rally 0.974328->0.971893 (-0.002), mixed BYTE-IDENTICAL. DIAGNOSTIC: low-conviction entries rarely reach the profit-side de-risk ramp (they exit via stop-loss/slope/opp-gate before profit de-risk fires) -> raising their floor is INERT. The cut-marginal-winners direction is a no-op. 3rd no-progress step. BOTH directions of the entry-conv->de-risk-floor mechanism explored: ride-giveback (lower floor for high-conv) is bull/rally coupled (steps1-6, ceiling sub-noise step4); cut-marginal (raise floor for low-conv) is inert (step7). Mechanism structurally incapable of +0.003 keep. vs BASELINE: composite -0.0007 (sub-noise). min_stab 0.844319.
92e4d21a	0.889160	0.976403	0.290810	1.358186	0.928793	1.158872	0.950540	0.485624	branch	branch step8: entry-conviction-modulated TIME-PRESSURE weight (_w_time). MEASURED vs step4 0.915848: composite 0.889160 (-0.027 REGRESSION), mean 0.976403. PER-REGIME: sideways 1.295855->1.158872 (-0.137 -- extending max_hold hurts mean-reverter), rally 0.974328->0.950540 (-0.023 -- pullback shorts over-held), bull 1.382650->1.358186 (-0.025), crash 0.918172->0.928793 (+0.011), mixed -0.002. 4th no-progress step. DIAGNOSTIC: extending max_hold for high-conviction entries couples sideways/rally/bull (mean-reverters and pullback shorts over-held). The entry-conviction -> EXIT modulation mechanism is structurally coupled across ALL 3 fusion levers tested (de-risk floor ride-giveback steps1-6, de-risk floor cut-marginal step7, time-pressure weight step8) -- every exit-side use of cached entry conviction hits the bull/rally/sideways coupling the prior session documented for sizing. TERMINATING BRANCH: 4 consecutive no-progress steps, design space exhausted (3 levers, both directions). Branch ceiling = step4 composite 0.915848 (-0.0008 vs baseline, sub-noise). vs BASELINE: composite -0.028. Reverting to 594c9175.
9f1a10d9	0.916682	1.011808	0.317086	1.382650	0.918172	1.295855	0.974328	0.488033	discard	BRANCH REVERTED (entry-conviction exit modulation, 8 steps, ceiling step4 0.915848 sub-noise). Opening Exp3 cached the entry conviction margin (_bull/_bear_margin at entry) and modulated the EXIT subsystem via 3 distinct fusion levers: (1) de-risk FLOOR ride-giveback cushion for high-conviction entries (steps1-6: ungated, slope-conf-gated, vol-gated, ER-gated, magnitude-tuned -- ceiling step4 composite 0.915848 -0.0008 sub-noise, bull fully recovered but rally/mixed gains vanished at the bull-safe magnitude; full-magnitude variants catastrophic for bull via the exact bull/rally coupling); (2) de-risk floor RAISE for low-conviction entries (step7, inert -- low-conviction entries exit via stop-loss/slope/opp-gate before the profit de-risk ramp fires); (3) TIME-PRESSURE weight reduction for high-conviction entries (step8, regressed sideways -0.137 + rally -0.023 -- extending max_hold couples mean-reverters and pullback shorts). CROSS-EXPERIMENT CONCLUSION (measured this session): the entry-conviction -> EXIT modulation mechanism is structurally coupled across ALL 3 fusion levers -- every exit-side use of cached entry conviction hits the bull/rally/sideways coupling the prior session documented for sizing mechanisms (bull and rally share high ER + trend-align + slope-conf + directional, so no clean gate separates them for any ride-giveback or hold-longer mechanism). The mechanism is structurally incapable of a +0.003 keep. KEY FOR FUTURE SESSIONS: (a) do NOT re-attempt entry-conviction -> exit modulation (3 levers, both directions, all bull/rally coupled); (b) the entry-margin cache (_entry_margin_cache) is a validated clean cross-component dep but its only viable use is on the ENTRY side (already used by _bull_conv_atten size attenuator) NOT the exit side; (c) the bull/rally coupling for exit-hold mechanisms is EXACT and unbreakable by vol/ER/slope-conf/trend-align gates (all 4 tested, none separate). Reverted to 594c9175 byte-identical. results.tsv append-only preserved (path-scoped git checkout 594c9175 -- strategy.py for all reverts, never git revert).
-	0.916682	1.011808	0.317086	1.382650	0.918172	1.295855	0.974328	0.488033	session-summary	SESSION (baseline 594c9175 0.916682 -> UNCHANGED, no keep): 2 independent ARCHITECTURAL experiments (Exp1 9th ret_vlong voter, Exp2 9th 48-bar efficiency voter, BOTH discards) + 1 exploration branch (entry-conviction exit modulation, 8 steps, REVERTED). EXIT RULE: branch concluded with revert -> session ends (per protocol: branch revert is a strong enough signal to conclude the round). >=2 architectural discards MET (Exp1, Exp2, + 8 branch steps all architectural). Baseline 594c9175 re-verified byte-identical at session start (composite 0.916682 mean 1.011808 std 0.317086, all stab 1.0 raw==score, min_stab 0.844322) [bull 1.382650 Sh2.068 51t, crash 0.918172 Sh1.254 52t, sideways 1.295855 Sh2.027 57t, rally 0.974328 Sh1.553 DD5.16, mixed 0.488033 Sh0.808 45t] AND post-branch-revert (composite 0.916682 byte-identical). results.tsv append-only preserved throughout (path-scoped git checkout 594c9175 -- strategy.py for every discard/revert, never git revert; results.tsv untouched by rollbacks). THEME: pursued the prior-session-sanctioned direction (lower-frequency voter work) AND a new entry->exit cross-component data dep. CROSS-EXPERIMENT CONCLUSIONS (all MEASURED this session, verifiable): (1) LOWER-FREQUENCY VOTER WORK IS NARROWER THAN EXPECTED. The prior session sanctioned lower-frequency voters after the 8th range/close efficiency (12-bar) succeeded and the 9th 2nd-derivative (acceleration) failed. This session tested TWO lower-frequency voters: Exp1 (ret_vlong 96-bar trend DIRECTION, /0.02) regressed bull -0.426 rally -0.113 -- ret_vlong>0 throughout bull incl pullbacks -> over-admits pullback noise (directional multi-day voter duplicates ret_long admission bias). Exp2 (48-bar range/close efficiency, the slow analog of the 8th) was CATASTROPHIC: composite -999, crash -999 hard cutoff, bull 46pct of baseline (50pct gate breached) -- the 48-bar window LAGS turns, staying trending past exhaustion -> over-commits wrong-side entries at crash tops/bottoms. LESSON: longer-WINDOW efficiency voters have lag that over-commits at turns; the 8th voter 12-bar window is the validated sweet spot (fast enough to not lag, slow enough to not flip). Lower-frequency voter work via LONGER windows is dead; the viable lower-frequency direction must avoid lag (a signal low-frequency WITHOUT being a moving average). The ret_vlong directional approach is also dead (duplicates admission bias). (2) ENTRY-CONVICTION -> EXIT MODULATION IS BULL/RALLY/SIDEWAYS COUPLED (8-step branch, 3 fusion levers, REVERTED). Caching entry conviction margin and feeding it to the exit subsystem was tested via 3 distinct levers: (a) de-risk FLOOR ride-giveback cushion (steps1-6): the bull/rally coupling is EXACT and unbreakable by vol/ER/slope-conf/trend-align gates (all 4 tested) -- any full-strength cushion over-holds bull (step6 ER-gate bull -1.07 catastrophic) while any dampened cushion leaves rally/mixed gains sub-noise (step4 ceiling 0.915848 -0.0008); (b) de-risk floor RAISE for low-conviction (step7): inert (low-conviction entries exit via stop-loss/slope/opp-gate before the profit de-risk ramp fires); (c) TIME-PRESSURE weight reduction for high-conviction (step8): regressed sideways -0.137 + rally -0.023 (extending max_hold couples mean-reverters and pullback shorts). The coupling mirrors the prior-session-documented exact bull/rally coupling for sizing mechanisms -- bull and rally share high ER + trend-align + slope-conf + directional, so no exit-side use of entry conviction separates them. SATURATION RECONFIRMED: lower-frequency voter axis dead (directional over-admits, longer-window lags); entry->exit conviction modulation dead (3 levers, both directions, all coupled); mixed binding floor 0.488 still walled (no mechanism reached it this session; the +0.011 mixed gain at branch step1 was the bull/rally-coupled cushion which could not be kept). NEW BASELINE 594c9175 0.916682 UNCHANGED. KEY FOR FUTURE SESSIONS: (a) do NOT re-attempt lower-frequency voters via longer windows (lag catastrophic) or ret_vlong direction (duplicates admission bias); (b) do NOT re-attempt entry-conviction -> exit modulation (3 fusion levers tested, all bull/rally/sideways coupled); (c) the entry-margin cache is a clean cross-component dep but only viable on the ENTRY side (already used by _bull_conv_atten); (d) the bull/rally coupling for exit-HOLD mechanisms is EXACT and unbreakable by vol/ER/slope-conf/trend-align gates (all 4 tested this session); (e) the validated 8th range/close efficiency voter 12-bar window is the sweet spot -- do not lengthen; (f) any future mechanism that rides giveback or extends holds will couple bull/rally and is unlikely to keep. Strategy remains at confirmed deep local optimum 594c9175; the search for a +0.003 path from here remains open but the entry->exit and lower-frequency-voter axes are now closed.
44b93d1d	0.916681	1.011807	0.317086	1.382650	0.918172	1.295855	0.974325	0.488033	discard	Exp1 (architectural, indep): 9th VOTER realized-vol-rank calm-trend continuation. NEW orthogonal data source: 24-bar realized vol ranked against own 200-bar rolling distribution (vol_percentile in [0,1]); no existing primitive reads vol-relative-to-own-history (vol_ratio=vs TARGET_VOL, calm/sideways_boost=ratios not distributional rank, _target_vol_dyn=baseline into threshold not voter). Rank is low-frequency WITHOUT lagging (no MA overshoot at turns). Signed by 12-bar close dir (bull uptrend/bear downtrend). Deep-saturated calm side /0.30 (only percentile<~0.4 contributes). Appended weight 0.55 (8th-voter envelope, untouched by _wt_shift). MEASURED vs baseline 594c9175 0.916682: composite -0.000001 (SUB-NOISE/INERT); mean -0.000001; std +0.000000. PER-REGIME all stab 1.0 all raw==score: bull BYTE-IDENTICAL 1.382650, crash BYTE-IDENTICAL 0.918172, sideways BYTE-IDENTICAL 1.295855, rally 0.974328->0.974325 (-0.000003 sub-noise), mixed BYTE-IDENTICAL 0.488033. KEY FINDING: the vol-rank voter is INERT -- same failure mode as the 9th lag-1 autocorr voter (03ba558b): it adds conviction to bars that ALREADY pass admission (calm-regime trends where the 8 existing voters co-fire), so it changes zero trade-selection. The deep-saturated /0.30 calm gate means it fires ONLY on calm bars which are exactly where existing voters already saturate admission. Confirms the voter-aggregation wall EXTENDS to a distributional vol-rank signal: trend-continuation voters are redundant-in-effect because trend persistence is already captured by the co-firing of ret_short/EMA_cross/slope voters in calm trends. Not branch-eligible (no regime improved; inert, no path to keep). Reverted to 594c9175. Architectural discard #1.
