commit	score	mean_score	std_score	bull_2021	crash_bear	sideways	rally_2024	status	description
03ba558b	0.793893	0.837107	0.144048	0.962109	0.731300	0.994833	0.660186	discard	Exp1 (architectural, indep): 9th VOTER lag-1 return autocorrelation (trend-PERSISTENCE quality, max(0,ac)/0.3 signed by 24-bar dir, weight 0.55 appended untouched). Genuinely new voter data source (AC tried only as gates/modulators at OLD baselines 2bc413c/637f5e53, never as a directional voter). MEASURED vs 5a748c8a 0.793917: composite -0.000024 SUB-NOISE; mean -0.000019; std +0.000019. PER-REGIME all stab 1.0 all raw==score: bull 0.962118->0.962109 (-0.000009 Sh2.000->1.9997), crash BYTE-IDENTICAL 0.731300 (Sh1.2727 -- CONFIRMS crash admission-saturation extends to a 9th persistence voter; AC never fires crash conviction on new bars), sideways BYTE-IDENTICAL 0.994833 (Sh2.006->2.002), rally 0.660252->0.660186 (-0.000066 Sh1.526->1.5254). KEY FINDING: the AC voter is INERT -- it adds conviction to bars that ALREADY pass admission (the 8 existing voters co-fire on persistent trends), so it changes zero trade-selection. Confirms the voter-aggregation wall EXTENDS to a 9th persistence-quality signal: like the 8th efficiency voter it is orthogonal-in-definition but redundant-in-effect because trend persistence is already captured by the co-firing of ret_short/EMA_cross/slope voters in trends. Not branch-eligible (no regime improved; inert, no path to keep). Reverted to 5a748c8a. Architectural discard #1.
daeb1d14	0.783358	0.827276	0.146392	0.941347	0.731303	0.996181	0.640272	discard	Exp2 (architectural, indep): SMOOTH the 8th voter direction sign (binary _rc_dir=sign(closes[-1]-closes[-12]) -> continuous tanh(net/0.02)). Removes the zero-crossing boundary (a noise-flip source under AR(1) on flat 12-bar nets). MEASURED vs 5a748c8a 0.793917: composite -0.010559 REGRESSION; mean -0.009850; std +0.002363. PER-REGIME all stab 1.0 all raw==score: bull 0.962118->0.941347 (-0.020771 Sh2.000->1.929), crash 0.731300->0.731303 (+0.000003 byte-identical), sideways 0.994833->0.996181 (+0.001348 Sh2.002->2.006 RECOVERED to pre-8th-voter level), rally 0.660252->0.640272 (-0.019980 Sh1.526->1.471). KEY FINDING: smoothing the sign HURT bull+rally (the regimes the 8th voter helped) while helping sideways. MECHANISM: the binary sign saturates to +-1 for ANY non-zero 12-bar net -> full directional conviction in trends; tanh(net/0.02) gives only ~0.76 at 2pct net -> LESS than full conviction on moderate-trend continuation bars, weakening the voters contribution exactly where it helped (bull/rally). The binary sign is LOAD-BEARING for the 8th voters bull/rally gains -- full trend conviction is the point, not a flaw. Not branch-eligible: the fix (smaller scale -> saturate near +-1 outside a tiny band) would either be byte-identical to baseline or restore the binary flip-noise for negligible sideways upside (+0.0013 max, sub-keep); no plausible path to keep. Confirms the 8th voter binary-sign mechanism is at its optimum. Reverted to 5a748c8a. Architectural discard #2.
b891e56a	0.767529	0.816290	0.162533	0.945044	0.731304	0.995540	0.593270	discard	Exp3 (architectural, indep): DECOUPLE the 8th voter sign lookback from efficiency window (efficiency stays 12-bar; binary direction sign 12->24-bar net). Hypothesis: 24-bar sign halves zero-crossing frequency -> more stable in sideways, while trends saturate +-1 either way. MEASURED vs 5a748c8a 0.793917: composite -0.026388 REGRESSION; mean -0.020836; std +0.018504. PER-REGIME all stab 1.0 all raw==score: bull 0.962118->0.945044 (-0.017074 Sh2.000->1.938), crash 0.731300->0.731304 (byte-identical), sideways 0.994833->0.995540 (+0.000707 PARTIAL recovery Sh2.002->2.0045), rally 0.660252->0.593270 (-0.066982 BIG Sh1.526->1.370). KEY FINDING: the 24-bar sign HURT both trend regimes (bull -0.017, rally -0.067) despite only marginally helping sideways (+0.0007). MECHANISM: in rally (grinding uptrend with frequent multi-bar pullbacks) the 12-bar net correctly flips negative during pullbacks -> the 8th voter REDUCES bull-conviction on pullback bars (appropriate de-risking of continuation signal); the 24-bar sign LAGS, staying bullish through pullbacks -> OVER-COMMITS to continuation on pullback bars where the short-term signal had turned -> mis-signs rally entries. The 12-bar sign lookback is LOAD-BEARING for the voters trend-regime calibration: its faster flipping is the feature, not a bug (correctly dampens conviction during pullbacks). The 12-bar efficiency x 12-bar sign coupling is calibrated; decoupling to a slower sign degrades trend timing. Not branch-eligible (rally -0.067 dominant, 12-bar sign load-bearing, no path to keep). Reverted to 5a748c8a. Architectural discard #3.
c5fdf9fb	0.690295	0.742096	0.172671	0.737883	0.731299	0.993542	0.505660	discard	Exp4 (architectural, indep): 9th VOTER cross-symbol BTC range/close EFFICIENCY (market-breadth quality, signed by BTC 12-bar dir, weight 0.55 appended). Genuinely new cross-symbol quality voter (existing cross-symbol deps use BTC price/volume as SIZE boosts, never BTC efficiency as a directional voter). MEASURED vs 5a748c8a 0.793917: composite -0.103622 CATASTROPHIC; mean -0.095030; std +0.028642. PER-REGIME: bull 0.962118->0.737883 (-0.224235 Sh2.000->1.654), crash BYTE-IDENTICAL 0.731299, sideways 0.994833->0.993542 (-0.001291 Sh2.002->1.999), rally 0.660252->0.505660 (-0.154592, raw 0.660->0.631, STABILITY_FACTOR 1.0->0.801 COLLAPSED below 0.80 knee, min_stability 0.810->0.740). KEY FINDING: cross-symbol BTC efficiency coupling is noise-DESTABILIZING -- BTC high/low/close are AR(1)-perturbed and routing them into alt conviction via a new path amplifies tracking error on rally (the high-churn regime). bull -0.224 (BTC efficiency mis-signs alt entries when BTC and the alt diverge -- common in bull where alts lead/lag BTC). Extends the prior CROSS-EXPERIMENT CONCLUSION (ANY per-bar position-VALUE dependence on a price-derived cross-symbol signal collapses rally stab) from the SIZE path to the VOTER-CONVICTION path. Not branch-eligible (rally stab collapsed below 0.80 knee = the binding regime destabilized; bull -0.224 catastrophic; no path to keep -- the noise-amplification is structural to cross-symbol voter coupling). Reverted to 5a748c8a. Architectural discard #4.
b1c68d74	0.793917	0.837126	0.144029	0.962118	0.731300	0.994833	0.660252	discard	Exp5 (architectural, indep): EFFICIENCY-coupled exit bias (8th voter _rc_eff/_rc_dir routed to the additive _voter_bias: -0.15*eff_align*tanh((eff-1)/0.5) anti-exit for trend-aligned clean-trend winners). New cross-subsystem data dep (entry-voter signal -> exit bias). MEASURED vs 5a748c8a 0.793917: BYTE-IDENTICAL (composite 0.793917, mean 0.837126, std 0.144029). PER-REGIME all byte-identical: bull 0.962118 Sh1.9997, crash 0.731300, sideways 0.994833 Sh2.002, rally 0.660252 Sh1.5256; all stab 1.0, all raw==score. KEY FINDING: the efficiency-coupled exit bias is INERT -- the _eff_hold term (magnitude <=0.15) never materially shifts an exit decision because the existing exit pressures (slope/pp/time MAX fusion + the -0.20 chop / +0.20 opp bias terms) fire on the same bars before the small efficiency bias binds. The 8th efficiency voters entry-side signal does NOT transfer to the exit-bias path -- exit timing is fully governed by the existing MAX-fusion + chop/opp-bias stack. Extends the exit-timing inertness wall to an efficiency-coupled bias. Not branch-eligible (byte-identical inert, no regime improved, no path to keep). Reverted to 5a748c8a. Architectural discard #5 -- EXIT RULE (5 consecutive architectural discards) MET.
-	-	-	-	-	-	-	-	session-summary	SESSION (baseline 5a748c8a 0.793917 -> UNCHANGED, no keep): 5 independent architectural experiments (Exp1-5, ALL discards), no exploration branch opened. EXIT RULE: 5 consecutive architectural discards MET -> stop (user 2-arch-discard minimum exceeded: 5). Baseline 5a748c8a re-verified reproduces 0.793917 byte-identical at session start AND post-revert [bull 0.962118 Sh1.9997 DD3.09pct, crash 0.731300 Sh1.273 DD2.46pct 100pct WR, sideways 0.994833 Sh2.002 DD2.21pct 48t sample_factor 0.980, rally 0.660252 Sh1.526 DD5.19pct; all stab 1.0, all raw==score, min_stab 0.810456]. strategy.py matches 5a748c8a byte-identical (0 diff verified post-revert). THEME: comprehensively probed the VOTER axis (the prior-session-identified ONLY un-disproven axis since the 8th-voter keep) -- 4 voter experiments (Exp1-4) + 1 exit-coupling (Exp5). CROSS-EXPERIMENT CONCLUSIONS (all measured this session, verifiable): (1) Exp1 (9th VOTER lag-1 return AUTOCORRELATION persistence, max(0,ac)/0.3 signed by 24-bar dir, wt 0.55): SUB-NOISE -0.000024 INERT. AC is a trend-PERSISTENCE quality signal but REDUNDANT-IN-EFFECT with existing trend-voter CO-FIRING (ret_short/EMA_cross/slope voters already capture persistence when they co-fire on trends). Crash byte-identical (admission-saturation extends to a 9th persistence voter). Confirms: a new voter is inert if its signal is implicit in existing voter co-firing. The 8th efficiency voter worked because range/close efficiency is NOT implicit in co-firing. (2) Exp2 (SMOOTH 8th voter sign: binary _rc_dir -> tanh(net/0.02)): REGRESSION -0.010559. Hurt bull -0.021 + rally -0.020 (the regimes the 8th voter helped), helped sideways +0.0013. MECHANISM: the binary sign saturates to +-1 for ANY non-zero 12-bar net = FULL trend conviction; tanh(net/0.02) gives only ~0.76 at 2pct net = ATTENUATED conviction on moderate-trend bars, weakening the voter where it helped. The BINARY SIGN is LOAD-BEARING for the 8th voters bull/rally gains -- full trend conviction is the point, not a flaw. (3) Exp3 (DECOUPLE 8th voter sign LOOKBACK: 12->24-bar binary sign, efficiency stays 12-bar): REGRESSION -0.026388. Hurt rally -0.067 (BIG) + bull -0.017, sideways +0.0007 partial. MECHANISM: in rally (grinding uptrend w/ frequent pullbacks) the 12-bar net correctly flips negative during pullbacks -> voter REDUCES bull-conviction on pullback bars (appropriate de-risking); the 24-bar sign LAGS, staying bullish through pullbacks -> OVER-COMMITS on pullback bars where short-term signal had turned -> mis-signs rally entries. The 12-bar sign LOOKBACK is LOAD-BEARING for trend-regime calibration (faster flipping is the feature). The 12-bar efficiency x 12-bar sign coupling is calibrated; decoupling degrades trend timing. (4) Exp4 (9th VOTER cross-symbol BTC range/close EFFICIENCY, market-breadth quality, signed by BTC 12-bar dir, wt 0.55): CATASTROPHIC -0.103622. bull -0.224, rally -0.155 with STABILITY_FACTOR 1.0->0.801 COLLAPSED below 0.80 knee (min_stab 0.810->0.740). MECHANISM: cross-symbol BTC efficiency coupling is NOISE-DESTABILIZING -- BTC high/low/close are AR(1)-perturbed; routing them into alt conviction via a new path amplifies tracking error on rally (high-churn). bull -0.224 (BTC efficiency mis-signs alt entries when BTC and alt diverge, common in bull where alts lead/lag BTC). EXTENDS the prior CROSS-EXPERIMENT CONCLUSION (ANY per-bar position-VALUE dependence on a price-derived cross-symbol signal collapses rally stab) from the SIZE path to the VOTER-CONVICTION path. (5) Exp5 (EFFICIENCY-coupled EXIT bias: route 8th voter _rc_eff to additive _voter_bias as anti-exit for trend-aligned clean-trend winners, mag <=0.15): BYTE-IDENTICAL INERT (0.793917). The _eff_hold term never materially shifts an exit decision -- existing exit pressures (slope/pp/time MAX fusion + -0.20 chop / +0.20 opp bias terms) fire on the same bars before the small efficiency bias binds. The 8th voters entry-side signal does NOT transfer to the exit-bias path. Extends exit-timing inertness wall to efficiency-coupled bias. KEY LOAD-BEARING CONCLUSIONS: (A) the 8th voter (binary sign, 12-bar window, weight 0.55, fixed) is FULLY CALIBRATED -- sign magnitude (Exp2), sign lookback (Exp3) both load-bearing; further perturbation regresses. (B) the voter axis is now SATURATED: 9 discards since the 8th-voter keep (Exp5/6/7/8/9 prior + Exp1/2/3/4 this session) -- same-symbol persistence voter inert, cross-symbol quality voter catastrophic, 8th-voter perturbations regress, weight/window tuning sub-noise. (C) NEW VOTERS REDUNDANT-WITH-CO-FIRING ARE INERT (Exp1 AC); the ONLY voter that worked (8th efficiency) measured a quality dimension NOT implicit in co-firing. No remaining un-mined orthogonal quality dimension identified (price-derived ratios exhausted; volume-microstructure used as boosts; funding_rate zeros; cross-symbol quality noise-destabilizing). (D) crash 0.731 REMAINS the binding floor (byte-identical on ALL 5 experiments -- admission-saturated, 100pct WR, structurally small-move-capped; no voter/exit/signal moves it). REMAINING UNCONQUERED: rally (0.660, stability-factor-1.0 capped no headroom, ct-exit fully optimized, 8th-voter calibrated) and crash (0.731, structural floor). Both binding regimes at non-addressable structural limits. Structural-exploration NOT attempted: trigger met (3+ arch discards) but no coherent subsystem-rewrite hypothesis with a plausible path (every core mechanism converted+tuned by prior 10+ sessions; the two binding-regime limits are structural properties of the regime data -- rally ct-loser peak magnitude, crash bounce move size -- not of the strategy mechanism, so no subsystem rewrite can address them). results.tsv append-only preserved (path-scoped git checkout -- strategy.py throughout, never git revert); all 5 discards reverted to 5a748c8a; strategy.py matches 5a748c8a byte-identical (0 diff verified). NEW BASELINE 0.793917 unchanged for future sessions.
50669520	0.763123	0.800148	0.123416	0.818398	0.730001	0.990909	0.661285	discard	Exp1 (architectural, indep): profit-DECELERATION pre-peak harvest exit source (7th soft MAX source). NEW forward-looking peak-prediction data dep: EMA of 1-bar pos_pnl delta (velocity) and its delta (acceleration); fires when winner STILL RISING (vel>0) BUT DECELERATING (accel<0) = peak-forming BEFORE giveback begins (pp=0, slope still with pos) so it is the SOLE firing source on those bars, intended to evade the documented MAX-fusion dominance wall. MEASURED vs 5a748c8a 0.793917: composite -0.030794 REGRESSION; mean -0.036978 (0.800148); std -0.020613 (0.123416 tighter). PER-REGIME all stab 1.0 all raw==score all DD<10pct: bull 0.962118->0.818398 (-0.143720 BIG, Sh2.000->1.723, AnnRet22.0->18.1pct -- deceleration harvested bull TREND winners too early; bull-2021 grinding uptrend has normal deceleration PAUSES that resume, not peaks), crash 0.731300->0.730001 (-0.001299 near-flat), sideways 0.994833->0.990909 (-0.003924), rally 0.660252->0.661285 (+0.001033 the intended target, Sh1.526->1.528, DD5.19->5.18 -- tiny, sub-noise). KEY FINDING: the mechanism FIRED (not MAX-dominated -- the pre-peak evasion insight held) but its rally DD-relief benefit is negligible (+0.001) while its cost is large bull trend-winner harvesting (-0.144). The deceleration signal does NOT discriminate peak-forming from trend-pause in the trending regimes where winners are biggest -- a deceleration pause in a strong bull uptrend is followed by resumption, so harvesting there cuts the big trend wins. Extends the trend-winner-harvesting wall: forward-looking peak PREDICTION (2nd derivative of pos_pnl) is too noisy a peak signal in trends to harvest on; the backward pp giveback (fires only AFTER a confirmed peak + giveback) remains the only viable harvest trigger. Not branch-eligible (rally gain +0.001 sub-noise, bull -0.144 dominant, no plausible gate that spares bull trend pauses while keeping the negligible rally gain -- deceleration IS the pause signal in bull). Reverted to 5a748c8a. Architectural discard #1.
30cd6960	0.793899	0.837113	0.144044	0.962099	0.731302	0.994846	0.660203	discard	Exp2 (architectural, indep): LOW-CHURN relaxation of the sideways chop-tightening on the admission floor. NEW data dep: gate the +0.20*(1-rsi_trend_str) chop-tightening magnitude on the noise-immune integer len(_eh) (halve it in low-churn/sparse-entry, full in high-churn bursts). Targeted the ONE concrete quantified penalty: sideways 48 trades below the 50-trade sample_factor knee (sample_factor 0.980 = -2pct; +0.020 if 50 trades recover at same Sharpe). MEASURED vs 5a748c8a 0.793917: composite -0.000018 SUB-NOISE/FLAT; mean -0.000013; std +0.000015. PER-REGIME all stab 1.0 all raw==score: bull 0.962118->0.962099 (-0.000019), crash 0.731300->0.731302 (+0.000002), sideways 0.994833->0.994846 (+0.000013, Sh2.002->2.0019, STILL 48 TRADES -- sample_factor unchanged 0.980), rally 0.660252->0.660203 (-0.000049, Sh1.526->1.5255, DD5.19 unchanged, 100 trades). KEY FINDING: the chop-tightening relaxation recovered ZERO sideways trades (48->48). The admission floor magnitude is NOT the binding constraint on sideways trade count: in sideways, voter conviction either clearly exceeds the floor (entry) or falls well below it (no entry) -- there are NO marginal bars sitting between the relaxed (0.10) and unrelaxed (0.20) floor. Confirms and extends the prior-session THRESHOLD-DOMINATED inertness finding (the EMA accumulator RHO was inert; here the _strong_min chop-tightening MAGNITUDE is inert too -- sideways trade count is fixed by WHERE voter conviction appears, not by the admission threshold level). The sample_factor 0.980 penalty on sideways is STRUCTURAL (voter signal structure in chop), not admission-addressable. Not branch-eligible (no regime improved meaningfully, sideways +0.000013 is noise; no path to recovering trades via admission). Reverted to 5a748c8a. Architectural discard #2.
51e85737	0.770789	0.820497	0.165695	0.962138	0.731301	0.994808	0.593743	discard	Exp3 (architectural, indep): 9th VOTER -- STOCHASTIC %K range-position (0 prior mentions as a voter). %K=(close-lowest_low_14)/(highest_high_14-lowest_low_14), centered (2*%K-1) signed by 14-bar close direction; weight 0.55 appended (9th). Genuinely new derivation (no voter reads close position within the recent high-low range). MEASURED vs 5a748c8a 0.793917: composite -0.023128 REGRESSION; mean -0.016629; std +0.021666. PER-REGIME all stab 1.0 all raw==score all DD<10pct: bull 0.962118->0.962138 (+0.000020 byte-identical), crash 0.731300->0.731301 (byte-identical), sideways 0.994833->0.994808 (-0.000025 flat), rally 0.660252->0.593743 (-0.066509 BIG, Sh1.526->1.371, AnnRet18.4->14.7pct, 100->95 trades, WR85.0->77.9pct -- MORE losers). KEY FINDING: the stochastic %K directional voter HURT rally (the binding regime) -- not inert, actively harmful. In rally grinding uptrend w/ pullbacks, close pressing the range top during uptrend stretches OVER-ADMITS rally continuation entries / mis-signs pullback bars -> rally WR collapsed 85->78pct (marginal trend losers admitted). Extends the prior CROSS-EXPERIMENT CONCLUSION: a 9th DIRECTIONAL voter over-amplifies trend conviction on rally (same failure mode as the ret_vlong voter catastrophe c4c31861 -0.115). bull/crash byte-identical (voter does not change their trade selection -- already high-conviction / voter does not fire in crash sustained downtrend). Confirms the voter axis saturation EXTENDS to a stochastic range-position signal: directional level-in-range voters are redundant-with-co-firing at best (bull/crash inert) and trend-over-amplifying at worst (rally -0.066). Not branch-eligible (rally -0.066 dominant, directional-voter-over-amplification is structural, no path to keep). Reverted to 5a748c8a. Architectural discard #3.
71e329f2	0.419584	0.484697	0.217043	0.429021	0.728251	0.157988	0.623528	discard	Exp4 (architectural, indep): EXIT-FUSION CONFIRMATION AMPLIFICATION. Extended the multi-source _agree_gate from ATTENUATE-ONLY (0.75-1.0) to ALSO AMPLIFY (+10pct at full 2nd-source agreement, trend-gated by _chop_atten_w). Tested the MAX-fusion wall boundary: does confirmation amplification add real exit signal, or re-introduce the correlated-noise addition MAX was chosen to eliminate? MEASURED vs 5a748c8a 0.793917: CATASTROPHIC composite -0.374333 (0.419584); mean -0.352429; std +0.073014; min_stability 0.810->0.794 (below 0.80 knee). PER-REGIME: bull 0.962->0.429 (-0.533, Sh2.000->1.200, DD3.09->6.61pct, 52->79 trades, WR86.5->74.7pct -- over-exited on correlated noise, churned), crash 0.731->0.728 (-0.003 byte-identical-ish), sideways 0.995->0.158 (-0.837 CATASTROPHIC, Sh2.002->1.130, DD2.21->9.70pct NEAR 10pct HARD CUTOFF, 48->104 TRADES -- amplification fired on chop noise co-firing -> massive over-trading/over-exiting), rally 0.660->0.624 (-0.037, Sh1.526->1.429, stab0.810->0.799 below knee). KEY FINDING: CONFIRMS the MAX-fusion wall is STRUCTURAL. Amplifying on agreement re-introduces EXACTLY the correlated-noise addition that the weighted-sum fusion had and the element-wise MAX was specifically chosen to eliminate (sideways trades exploded 48->104 from noise co-firing amplified into micro-exits; sideways DD 2.21->9.70pct nearly breached the 10pct hard cutoff). The MAX-fusion discards agreement information BY DESIGN -- that information is irreducibly correlated-noise-contaminated and cannot be recovered via amplification without re-amplifying the noise. Extends the documented exit-fusion saturation wall: not only are additional exit SOURCES inert under MAX (prior sessions), but the MAX fusion MECHANISM itself cannot be softened with agreement-amplification -- the wall is at the fusion architecture level, not just the source-count level. Not branch-eligible (catastrophic -0.374, sideways near hard-cutoff breach, structural failure). Reverted to 5a748c8a. Architectural discard #4.
