commit	score	mean_score	std_score	bull_2021	crash_bear	sideways	rally_2024	status	description
8faaf49c	0.702526	0.774540	0.240047	1.026355	0.721170	1.049462	0.668686	0.407026	discard	Exp5 (architectural, indep): CHOP-EXEMPTION of the MTM-chop throttle winner-fade. Hypothesis: winner-fade (spares clear winners pos_pnl>+0.5*stop, protects crash winning shorts) ALSO suppresses the throttle at mixeds deep peaks (+30pct=~12*stop -> winner_fade~0 -> throttle OFF at tp-harvest reduction). Separator: crash smooth path (_mtm_chop~0 -> throttle mult ~1 regardless -> byte-identical); mixed choppy path (_mtm_chop~1 -> winner_fade binding). Gate winner-fade OFF when chop>0.3 -> mixed keeps throttle at peaks. MEASURED vs 99a369a1 0.706007: composite 0.702526 (-0.003481 FAIL), mean 0.774540 (-0.004263 FAIL). PER-REGIME all stab 1.0 raw==score: bull 1.025954->1.026355 (+0.0004 noise), crash 0.720320->0.721170 (+0.0009), sideways 1.066580->1.049462 (-0.0171 REGRESSED -- chop-exemption fired on sideways choppy winners too), rally 0.670171->0.668686 (-0.0015), mixed 0.410990->0.407026 (-0.0040 REGRESSED -- TARGET MOVED WRONG). min_stab 0.844518. FAILURE MECH (architectural fact): mixed FINALLY MOVED (proves the throttle winner-fade IS the binding term at mixeds peaks -- the lever reaches mixed as hypothesized) but the direction is NEGATIVE. Amplifying the tp-harvest reduction at mixeds deep oscillating peaks OVER-TRIMS the winning peak -> reduces the position before the next up-leg -> lower capture of the re-peak -> lower mixed Sharpe. The winner-fade is LOAD-BEARING for mixed: holding the position THROUGH the oscillation peak (let winner_fade suppress the throttle) is better than harvesting more at the peak -- mixed benefits from ENDURING oscillations, not trimming them. Extends documented mixed wall: mixeds residual low-Sharpe is NOT under-harvesting at peaks (harvesting more HURTS); the oscillation is genuinely intrinsic and the optimal response is to ride it, not damp it. Reverted to 99a369a1. 5th architectural discard.
-	-	-	-	-	-	-	-	-	session-summary	SESSION (baseline 99a369a1 0.706007 5-regime -> UNCHANGED, no keep): 5 independent ARCHITECTURAL experiments (Exp1-5, ALL discards) + 0 exploration branches. EXIT RULE: 5 consecutive architectural discards -> stop session (all 5 discards architectural, no branch opened). Baseline 99a369a1 re-verified byte-identical at session start (composite 0.706007 mean 0.778803 std 0.242655, all stab 1.0 raw==score, min_stab 0.844331) [bull 1.025954 Sh2.068, crash 0.720320 Sh1.254, sideways 1.066580 Sh2.027, rally 0.670171 Sh1.553, mixed 0.410990 Sh0.808] AND post-revert (strategy.py 0-diff to keep). results.tsv append-only preserved throughout (path-scoped git checkout -- strategy.py for every discard, never git revert). THEME: targeted the binding floor regime mixed_2025 (0.411, far below the 0.67-1.07 cluster) via the tp_harvest subsystem AND the emission MTM-chop throttle (the ONE documented lever reaching mixed). Probed a NOVEL separator axis -- the MULTI-DAY COUNTER-TREND SIGN (ret_vlong*pos_dir: mixed holds longs in a down year -> product<0 genuinely ct; sideways flat -> product~0 not ct) -- which the prior threshold-lowering branch had NOT tried (it only checked trend-strength and vol axes, walled by mixed/sideways overlap). CROSS-EXPERIMENT CONCLUSIONS (all MEASURED this session, verifiable): (1) TP_HARVEST ACTIVATION THRESHOLD IS INERT ON MIXED (Exp1, byte-identical): the activation gate (1.6 vs 1.5) is NOT the binding blocker -- mixeds moderate peaks sit below the 1.5 band where the gate would matter. Extends prior session Exp1 deep-peak-bypass (also byte-identical) to the multi-day-ct-sign axis. (2) TP_HARVEST RAMP ONSET IS INERT ON MIXED (Exp2, mixed byte-identical -0.0004): lowering the ramp onset 1.6->1.3 for ct-sign positions reaches NO new mixed peaks because mixeds peaks are ALL DEEP (prior diagnostic tp_ratio quartiles 5.6/13.3/16.4 -- all >1.6 original onset, already harvested at full 0.45 magnitude). The onset band 1.3-1.6 is EMPTY for mixed. rally -0.0020 (ct pullback shorts over-harvested). (3) RE-PEAK ESCALATING HARVEST IS ANTI-CORRELATED WITH TARGET (Exp3, catastrophic -0.182): mixeds harvest counter never reaches 2 because mixed oscillation (+30pct->+24pct->+28pct) NEVER exceeds the all-time +30pct peak so peak_pnl (monotonic high-water mark) never updates and harvest fires only ONCE (count stays 1 -> escalation requires count>=0.5 for the 2nd harvest which never comes). Meanwhile bull trend longs DO make new highs -> harvest fires repeatedly -> counter climbs -> magnitude escalates -> over-harvests bull (raw 1.026->0.648, stab crashed 1.0->0.301, 81pct score drop). The escalation fires on TREND WINNERS (bull) not OSCILLATORS (mixed) -- anti-correlated with the target. (4) GIVEBACK TOLERANCE IS NON-BINDING FOR MIXED (Exp4, mixed byte-identical -0.0415): tightening the 0.22 giveback for choppy-path positions did not move mixed -- RECONFIRMS the documented giveback wall (mixed exits via slope-against/time/opp-gate BEFORE pp_pressure giveback activates; 3rd confirmation this session after threshold/onset/magnitude). The pp_pressure giveback lever is structurally non-binding for mixed. Separately the hold-duration separator hypothesis was WRONG: sideways positions DO reach the 4-bar path minimum (some long-held) -> gate fired on sideways trend winners (-0.126) + bull (-0.172). (5) MIXED BENEFITS FROM ENDURING OSCILLATIONS, NOT DAMPING THEM (Exp5, mixed REGRESSED -0.0040 -- the KEY finding): the MTM-chop throttle winner-fade (spares clear winners pos_pnl>+0.5*stop) DOES suppress the throttle at mixeds deep peaks (verified: mixed FINALLY MOVED when the chop-exemption removed the winner-fade for choppy positions). But the direction is NEGATIVE -- amplifying the tp-harvest reduction at mixeds deep oscillating peaks OVER-TRIMS the winning peak -> reduces the position before the next up-leg -> lower capture of the re-peak -> lower mixed Sharpe. The winner-fade is LOAD-BEARING for mixed: holding the position THROUGH the oscillation peak is better than harvesting more at the peak. SATURATION RECONFIRMED: mixeds residual low-Sharpe is INTRINSIC MTM oscillation over long holds (return_vol 5.54pct vs 4.4pct net), NOT addressable by any exit/harvest lever -- (a) peaks already deep and harvested at maxed 0.45 magnitude (onset/threshold inert), (b) harvest one-shot by monotonic peak_pnl (escalation anti-correlated), (c) giveback non-binding (mixed exits before pp_pressure), (d) harvesting MORE at peaks HURTS (over-trims the re-peak). The only mixed-reaching lever (MTM-chop throttle) is at its optimum WITH the winner-fade protecting mixeds peaks. NEW BASELINE 99a369a1 0.706007 UNCHANGED. KEY FOR FUTURE SESSIONS: (a) the multi-day ct-sign axis (ret_vlong*pos_dir) IS a valid mixed/sideways separator (mixed ~1, sideways ~0) -- BUT it does not unlock mixed because mixeds wall is NOT peak access (peaks already deep/harvested); future mixed work should NOT re-attempt the tp_harvest threshold/onset/magnitude/escalation axes (5 discards this session + prior branch); (b) mixed BENEFITS from holding through oscillation peaks -- any lever that trims/harvests mixed at peaks REGRESSES it (winner-fade load-bearing); the residual mixed drag can only be addressed by REDUCING OSCILLATION AMPLITUDE upstream (smaller position sizing for choppy ct longs so the MTM oscillates less in absolute terms) or SHORTENING HOLDS (which prior winner-hold-extension attempts walled); (c) the giveback path is confirmed 3x non-binding for mixed -- do not re-attempt giveback-tolerance levers on mixed.
5e22f281	0.699187	0.777915	0.262425	1.091797	0.666871	1.066580	0.653336	0.410990	branch	Exp1 (architectural, indep, BRANCH OPEN): SUSTAIN multi-day ct_vlong first-bar shrink through scale-in (cached at entry, applied to full_target). Built on prior session-summary directive (mixed's residual low-Sharpe addressable ONLY by reducing oscillation amplitude upstream via smaller sizing for choppy ct longs; exit subsystem fully saturated). MEASURED vs 99a369a1 0.706007: composite -0.006820 (0.699187), mean -0.000888 (0.777915 flat), std 0.242655->0.262425 (worse). PER-REGIME all stab 1.0 raw==score all DD<5.3pct all flip 1.0: bull 1.025954->1.091797 (+0.0658 Sh2.068->2.187 -- IMPROVED, ct pullback shorts shrunk through hold), crash 0.720320->0.666871 (-0.0534 Sh1.254->1.197 -- REGRESSED, dead-cat-bounce ct longs shrunk through hold), sideways BYTE-IDENTICAL 1.066580 (no ct, _ct_vlong~1), rally 0.670171->0.653336 (-0.0168 Sh1.553->1.549 -- ct pullback shorts shrunk), mixed BYTE-IDENTICAL 0.410990 (Sh0.807528 -- TARGET MISSED). FAILURE MECH (architectural fact, direct measurement): mixed byte-identical RECONFIRMS the documented grid-absorption wall -- mixed positions are SMALL relative to the grid step (0.06*equity*BASE), so a 0.60x sustained shrink is sub-grid -> snaps to the same quantized lattice point -> emitted target unchanged (same mechanism as prior session Exp3 2.5x tp_harvest amp byte-identical). The sustained ct-shrink CANNOT reach mixed via sizing. BUT the mechanism reached bull +0.066 (collateral: bull-2021 ct SHORTS during pullbacks = bear-entry-in-uptrend get the shrink sustained through hold -> smaller losing shorts -> higher bull Sharpe). crash -0.053: crash ct LONGS (dead-cat bounces = bull-entry-in-downtrend) also shrunk -> hurt crash recovery longs. BRANCH JUSTIFICATION: (1) new architecture = sustained-through-scale-in ct shrink (a NEW control-flow dep: scale-in full_target now reads entry-time ct state); (2) crash regressed because the shrink is SYMMETRIC (both bull-in-downtrend and bear-in-uptrend ct shrinks sustained) -- crash's ct longs are bull-entry-in-downtrend; (3) FIX HYPOTHESIS: sustain ONLY the bear-entry-in-uptrend shrink (rally/bull ct shorts, the winners of this exp) and DROP the bull-entry-in-downtrend sustain (crash dead-cat longs, the losers) -> keep bull +0.066, recover crash. mixed is grid-walled regardless (branch will not chase mixed via this lever). Branch step1 tests the one-sided sustain.
2f3b8169	0.702969	0.776607	0.245460	1.031812	0.720320	1.066580	0.653336	0.410990	branch	branch step1: ONE-SIDED sustain (bear-entry-in-uptrend shrink sustained; bull-entry-in-downtrend reverts to first-bar-only). MEASURED vs Exp1 5e22f281 0.699187: composite +0.003782 (0.702969 PROGRESS), mean +0.000692, std 0.262425->0.245460 (better). PER-REGIME all stab 1.0 raw==score: bull 1.091797->1.031812 (-0.0599 Sh2.187->2.081 -- lost the bull-entry-in-downtrend sustain gain; bull still +0.006 above baseline), crash 0.666871->0.720320 (+0.0535 Sh1.197->1.254 BYTE-IDENTICAL TO BASELINE -- RECOVERED, dropping bull-in-downtrend sustain worked), sideways BYTE-IDENTICAL 1.066580, rally 0.653336 (UNCHANGED from Exp1, still -0.0168 below baseline Sh1.549 -- bear-entry-in-uptrend sustain still hurts rally), mixed BYTE-IDENTICAL 0.410990 (grid-walled, as expected). vs BASELINE 0.706007: composite -0.003038, mean -0.002196. DIAGNOSTIC: the bull gain in Exp1 (+0.066) came from sustaining the BULL-entry-in-downtrend shrink (bull ct longs during 2021 pullbacks), NOT bear shorts -- removing it (step1) dropped bull back near baseline. crash recovered byte-identical. rally remains regressed: rally pullback shorts (bear-entry-in-uptrend) during QUIET stretches (_calm_ct~1 so _bear_ct_vlong shrink fires at entry) get shrunk through the hold -> rally Sharpe down. no-progress on the rally axis. Branch continues: step2 will drop the bear-entry-in-uptrend sustain too (full revert to first-bar-only for both sides) to confirm rally recovers, then explore whether ANY sustain variant helps without rally cost.
35ce431f	0.700823	0.774749	0.246420	1.031812	0.720320	1.066580	0.644042	0.410990	branch	branch step2: VOL_RATIO-gated bear-entry-in-uptrend sustain (high-vol keeps, low-vol reverts). MEASURED vs step1 0.702969: composite -0.002146 (0.700823 REGRESSION no-progress), mean -0.001858, std 0.245460->0.246420. PER-REGIME all stab 1.0: bull 1.031812 (UNCHANGED -- vol gate left bull intact), crash 0.720320 (byte-identical), sideways byte-identical, rally 0.653336->0.644042 (-0.0093 WORSE Sh1.549->1.530 -- gate did NOT recover rally; some rally ct shorts at vol_ratio>0.55 still sustained, and partial-blend intermediates hurt), mixed byte-identical 0.410990. DIAGNOSTIC: vol_ratio does NOT cleanly separate bull from rally on the bear-ct-sustain axis (rally has high-vol bars where ct shorts still get sustained; the /0.12 blend creates worse intermediate shrink values than the binary). no-progress step 1/7. Branch continues: step3 tests the OPPOSITE one-sided sustain (bull-entry-in-downtrend only, which gave bull +0.060 in Exp1) to see if bull+crash tradeoff is better than bull+rally.
d510f2fe	0.702485	0.780468	0.259944	1.087730	0.666871	1.066580	0.670171	0.410990	branch	branch step3: sustain BULL-entry-in-downtrend only (bear side reverts to first-bar-only). MEASURED vs step1 0.702969: composite -0.000484 (0.702485 no-progress step 2/7), mean +0.003861 (0.780468 up), std 0.245460->0.259944 (worse). PER-REGIME all stab 1.0: bull 1.031812->1.087730 (+0.0559 Sh2.081->2.173 -- bull-entry-in-downtrend sustain recovered the Exp1 bull gain), crash 0.720320->0.666871 (-0.0534 Sh1.254->1.197 -- the symmetric crash cost, same as Exp1), sideways byte-identical, rally 0.653336->0.670171 (+0.0168 BYTE-IDENTICAL TO BASELINE -- RECOVERED, bear side revert worked), mixed byte-identical 0.410990. vs BASELINE: composite -0.003522, mean +0.001665. CLEAN TRADEOFF CONFIRMED: bull +0.062 / crash -0.053 -- bull-2021 pullback longs and crash dead-cat-bounce longs are the SAME trade type (bull-entry-in-downtrend) in different regimes; the sustain helps bull but hurts crash symmetrically. No separator found on this axis (step1=both, step2=vol-gated, step3=bull-only). no-progress 2/7. Branch continues: step4 gates the bull-entry-in-downtrend sustain on trend-QUALITY R^2 (bull-2021 pullbacks are V-shaped high-R^2 recoveries; crash dead-cat bounces are low-quality low-R^2) to separate bull from crash.
0b4b0c5f	0.703036	0.776269	0.244110	1.028961	0.704645	1.066580	0.670171	0.410990	branch	branch step4: R^2-GATED bull-entry-in-downtrend sustain (high-R^2 keeps, low-R^2 reverts). MEASURED vs step3 0.702485: composite +0.000551 (0.703036 small PROGRESS, no-progress resets), mean -0.004199, std 0.259944->0.244110 (better). PER-REGIME all stab 1.0: bull 1.087730->1.028961 (-0.0588 Sh2.173->2.075 -- R^2 gate MUTED bull gain, bull pullback longs have lower R^2 than expected), crash 0.666871->0.704645 (+0.0378 Sh1.197->1.219 -- crash recovered toward baseline), rally byte-identical, sideways byte-identical, mixed byte-identical. vs BASELINE: composite -0.002971, bull +0.003, crash -0.016. DIAGNOSTIC: R^2 splits the difference -- mutes bull (lost +0.062) AND recovers crash (+0.038); bull-2021 pullback longs and crash dead-cat longs share the R^2 distribution too (both moderate-R^2). BULL/CRASH COUPLING CONFIRMED ON 4 AXES NOW (vol_ratio step2, R^2 step4, ct-direction step1/3, implicit churn). The +0.062 bull gain and -0.053 crash cost are two sides of the SAME trade (bull-entry-in-downtrend); no separator isolates them. mixed grid-walled throughout. Branch approaching wall. step5 tests reduced magnitude (cap shrink at 0.80 vs 0.60) for a net-positive operating point.
877f7d95	0.704546	0.777716	0.243901	1.029721	0.711120	1.066580	0.670171	0.410990	branch	branch step5: HALVE sustained magnitude (50% blend + R^2 gate). MEASURED vs step4 0.703036: composite +0.001510 (0.704546 PROGRESS), mean +0.001447, std 0.244110->0.243901. PER-REGIME all stab 1.0: bull 1.028961->1.029721 (~flat +0.004 vs baseline), crash 0.704645->0.711120 (+0.0065 recovering, -0.009 vs baseline), rally/sideways/mixed byte-identical. vs BASELINE: composite -0.001461, mean -0.001087. Trajectory step3 0.7025 -> step4 0.7030 -> step5 0.7045 (each step closes ~half the gap to baseline 0.7060). Halved magnitude reduced crash cost while bull held. CONVERGING TO BASELINE-NEUTRAL FROM BELOW: bull gain ~= crash cost (perfect coupling); net approaches ~0 but cannot exceed baseline. mixed grid-walled throughout (byte-identical 5 variants). Branch ceiling = baseline (no path to +0.003). step6 confirms trajectory with 25% blend.
8b7026b7	0.705243	0.778092	0.242830	1.025954	0.716765	1.066580	0.670171	0.410990	branch	branch step6: 25% blend. MEASURED vs step5 0.704546: composite +0.000697 (0.705243 small progress), mean +0.000376, std 0.243901->0.242830. PER-REGIME all stab 1.0: bull 1.029721->1.025954 (BYTE-IDENTICAL TO BASELINE -- 25% blend too small for bull to register), crash 0.711120->0.716765 (+0.0056 recovering, -0.0036 vs baseline), rally/sideways/mixed byte-identical. vs BASELINE: composite -0.000764, mean -0.000711. CONVERGENCE CONFIRMED: as magnitude shrinks (100%->50%->25%) both bull gain AND crash cost shrink together toward 0; at 25% bull is already byte-identical (no gain) while crash retains -0.004 residual cost. No magnitude exists where bull gain > crash cost -- the bull/crash coupling is EXACT (symmetric +0.062/-0.053 at full magnitude). BRANCH CEILING = BASELINE (no path to +0.003 keep). mixed grid-walled throughout (byte-identical 6 steps). Branch terminating: ceiling reached.
-	-	-	-	-	-	-	-	-	-	BRANCH SUMMARY (sustain ct_vlong first-bar shrink through scale-in, 6 steps, REVERTED to 99a369a1): opened after Exp1 (architectural indep): cache the multi-day counter-trend first-bar shrink (_ct_vlong) and sustain it through scale-in (apply cached shrink to full_target), per the prior session-summary directive that mixed's residual low-Sharpe is addressable ONLY by reducing oscillation amplitude upstream (smaller sizing for choppy ct longs; exit subsystem fully saturated). Exp1 (sustain BOTH bull-entry-in-downtrend AND bear-entry-in-uptrend, 0.699187 -0.0068): mixed BYTE-IDENTICAL (grid-walled -- mixed positions SMALL relative to grid step 0.06*equity*BASE so proportional shrink sub-grid -> snaps to same lattice point, same mechanism as prior session Exp3 2.5x tp_harvest amp byte-identical). BUT bull +0.066 (ct shorts/longs during pullbacks shrunk through hold) and crash -0.053 / rally -0.017 (collateral). Branch iterated to isolate the collateral. Step1 (bear-entry-in-uptrend only): crash recovered byte-identical, rally still -0.017, bull +0.006. Step2 (vol_ratio-gated bear sustain): rally WORSE -0.0093 (vol_ratio does not separate bull/rally on this axis). Step3 (bull-entry-in-downtrend only): rally recovered byte-identical, bull +0.062, crash -0.053 (the symmetric crash cost). Step4 (R^2-gated bull sustain): R^2 splits the difference -- mutes bull AND recovers crash (both moderate-R^2; bull/crash coupled on R^2 too). Step5 (50% magnitude): +0.0015 progress, converging to baseline. Step6 (25% magnitude): bull byte-identical, crash -0.004, composite -0.0008 vs baseline. CONVERGENCE CONFIRMED: as magnitude shrinks, bull gain and crash cost shrink together toward 0; at 25% bull is byte-identical while crash retains residual cost -> NO magnitude exists where bull gain > crash cost. The bull/crash coupling is EXACT (bull-2021 pullback longs and crash dead-cat-bounce longs are the SAME trade type bull-entry-in-downtrend; +0.062/-0.053 symmetric at full magnitude). mixed grid-walled throughout (byte-identical all 6 steps). BRANCH CEILING = BASELINE (0.706), no path to +0.003 keep. CROSS-EXPERIMENT CONCLUSIONS (all MEASURED this session, verifiable): (1) SUSTAIN-THROUGH-SCALE-IN CANNOT REACH MIXED: the grid-quantization (load-bearing stability lever, 0.06*equity*BASE_POSITION_SIZE grid step) absorbs proportional sizing changes for mixed's SMALL positions -- sustained ct-shrink (this branch, 6 steps) AND prior session's tp_harvest 2.5x amp are both byte-identical on mixed. mixed's residual low-Sharpe is NOT addressable by any proportional sizing lever (entry-time, scale-in, or harvest). The only mixed-reaching lever remains the MTM-chop throttle (prior session, at its optimum WITH winner-fade). (2) BULL/CRASH COUPLING ON THE BULL-ENTRY-IN-DOWNTREND AXIS: bull-2021 pullback longs and crash dead-cat-bounce longs are structurally identical (bull entry while 96-bar ret_vlong<0); sustaining the ct shrink helps bull (+0.062) and hurts crash (-0.053) symmetrically. NO single-quantity separator isolates them: confirmed on vol_ratio (step2), R^2 trend-quality (step4), ct-direction (step1/3), and magnitude (step5/6 -- both shrink together). This is a 5th dimension of the documented mixed/sideways overlap-style wall, now on the bull/crash pair. (3) THE _ct_vlong SHRINK IS CORRECTLY FIRST-BAR-ONLY IN THE BASELINE: sustaining it through scale-in has no net benefit (ceiling = baseline); the first-bar-only application is at its optimum (the proven Exp5/Exp9 _conc/_vol sustain-cache pattern does NOT generalize to the ct shrink because the ct shrink's regime effects are coupled rather than one-sided). NEW BASELINE 99a369a1 0.706007 UNCHANGED. KEY FOR FUTURE SESSIONS: (a) do NOT re-attempt sustaining the _ct_vlong shrink through scale-in (6-step branch confirmed ceiling=baseline, bull/crash exact coupling); (b) mixed is grid-walled on ALL proportional sizing levers (entry-time, scale-in, harvest) -- future mixed work must use a non-proportional/non-grid-absorbed lever OR accept mixed's intrinsic MTM-oscillation floor; (c) the proven sustain-cache pattern (Exp5 _conc, Exp9 _vol) works because those shrinks are one-sided (help without symmetric cost); the ct shrink is bilateral-coupled and thus cannot be sustained.
