commit	score	mean_score	std_score	bull_2021	crash_bear	sideways	rally_2024	status	description
-	-	-	-	-	-	-	-	session-summary	SESSION (baseline 637f5e53 0.779314 -> UNCHANGED, no keep): 2 independent architectural experiments (Exp1-2, BOTH discards), no branch opened (neither branch-worthy -- no regime improved meaningfully in either; both confirmed documented walls). EXIT RULE: 2-architectural-discard minimum MET; exited on saturation (strategy at confirmed deep local optimum across 6+ prior sessions ~25 arch discards; both experiments confirmed walls). Baseline 637f5e53 re-verified reproduces 0.779314 byte-identical at session start AND post-revert [bull 0.923316 Sh1.936 DD3.71pct, crash 0.730154 Sh1.274 DD3.04pct, sideways 1.012687 Sh2.001 DD2.75pct, rally 0.632168 Sh1.470 DD6.36pct; all stab 1.0, all raw==score, all flip_streak_gate 1.0, min_stab 0.807]. strategy.py matches 637f5e53 byte-identical (0 diff verified post-revert). THEME: targeted the two UN-MAXED levers identified by prior sessions -- (Exp1) the rally streak_gate (0.886, largest un-maxed lever; DD-reduction maxed at 0.50) via a per-direction loss-streak, and (Exp2) the sideways 50-trade sample_factor fragility that BLOCKS the one viable v2.2 lever (leverage 5->4 dd_gate gain) via a vol-modulated calm-grid. Exp1 (DIRECTION-SPECIFIC loss-streak: replace portfolio _loss_streak with _loss_streak_long/_short; bull ct keys on long-streak, bear ct on short-streak): composite -0.027549 (0.751765), bull -0.122505 BIG MISFIRE (bull-2021 multi-bar corrections accumulate the long-streak; when ret_vlong dips negative the next bull long -- a winning dip-buy -- is flagged ct and shrunk -> cuts bull alpha), rally -0.000775 (NO streak_gate gain -- shrinking ct-short SIZE does not prevent a LOSS; streak_gate counts consecutive LOSSES not magnitude; the +0.10 admission tighten is too weak to BLOCK high-conviction ct shorts = admission-inertness wall). Exp2 (VOL-MODULATED calm-grid: finer 0.045 lattice at vol_ratio<0.7 in the never-bursting calm partition): composite -0.011397 (0.767917), crash -0.031325 BIG (crash is a calm-partition symbol whose vol_ratio dips <1 in calm inter-bounce periods -> finer grid added churn/fees -> lower Sharpe; crash is return-limited Sh1.274 fee-sensitive), sideways -0.003879 (at 5x sideways is ALREADY sample_factor-saturated at 52 trades -> raising trade count gives NO sample_factor benefit; precision gain negligible vs fee cost). CROSS-EXPERIMENT CONCLUSIONS (all measured this session, verifiable): (1) RALLY streak_gate (0.886) is NOT reducible via the ct SIZE-SHRINK path -- the loss-streak is structural to high-conviction ct re-entries; streak_gate counts consecutive LOSSES (count) not loss MAGNITUDE, so shrinking the Nth ct-short does not break the streak; only ADMISSION BLOCKING breaks a streak, and aggressive ct blocking hits the rally alpha-trade wall (shrinking/blocking ANY rally entries cuts rally alpha). The admission-inertness wall (crash bounces cross thresholds same-bar) EXTENDS to the streak-reduction axis -- rally ct shorts are similarly high-conviction, so mild admission tightening does not block them. (2) The per-direction streak MISFIRES on bull: bull-2021 corrections make longs look counter-trend (ret_vlong dips negative), so a long-direction loss-streak catches dip-buy losses then penalizes the recovery long (the winner) -- direction-specific loss tracking is wrong-directional for trend-regime corrections. (3) The sideways 50-trade fragility that blocks leverage reduction CANNOT be addressed via the calm grid: at 5x sideways is sample_factor-SATURATED (more trades do not help), and the grid fires for crash too (calm inter-bounce periods) where finer granularity adds fee-churn to a return-limited regime. The leverage-reduction unblock path remains walled (would need sideways trade-count headroom WITHOUT adding crash/sideways churn). (4) Both un-maxed levers probed (streak_gate, sideways trade-count) are structurally walled under the current architecture. The binding rally (DD6.36 near 8pct knee, all DD-reduction levers maxed, streak structural, alpha-trade wall on entry) and crash (return-limited Sh1.274, bounce-LONG, exit-path-inert, fee-sensitive) remain unconquered. results.tsv append-only preserved (path-scoped git checkout -- strategy.py throughout, never git revert); both discards reverted to 637f5e53; strategy.py matches 637f5e53 byte-identical (0 diff verified).
04df4b0d	0.779314	0.824581	0.150890	0.923316	0.730154	1.012687	0.632168	discard	Exp1 (architectural, indep): COUNTER-TREND giveback-tolerance tightening (3rd peak-harvesting DD lever on giveback subsystem, distinct from maxed PORT_DD _pp_tighten which is ~0 on rally + tp-harvest-relax). Tighten giveback tolerance for ct positions (pos_dir opposite 96-bar ret_vlong, fast-saturating /0.01 noise-free) so ct peaks harvest faster (less giveback) -> cap rally DD via the rally-safe peak-harvesting family. Trend-aligned keep base giveback. MEASURED vs 637f5e53 0.779314: BYTE-IDENTICAL INERT (composite/mean/std/all 4 regimes unchanged incl Sharpe/trade counts/MaxDD: bull 56t Sh1.936 DD3.71, crash 52t Sh1.274 DD3.04, sideways 52t Sh2.001 DD2.75, rally 100t Sh1.470 DD6.36; all stab 1.0, all raw==score, min_stab 0.807). ROOT CAUSE (verifiable): the ct giveback tightening never moves any exit decision. KEY FINDING: rally DD source is TREND-ALIGNED LONG giveback (winners giving back profits through pullbacks), NOT ct-short giveback -- rally ct pullback shorts are LOSERS that dont reach meaningful peaks (pp_activation gate peak>=_pp_min rarely fires for them), so tightening their harvest tolerance is inert. Distinct from prior run-up-velocity (widened grind-peak giveback -> rally DD UP 6.36->7.58) which DID move rally because it touched the trend-aligned long giveback that IS the DD source. The giveback-tolerance magnitude axis is inert on ct positions (extends exit-inertness wall to ct-giveback-magnitude). Reverted to 637f5e53. 1st architectural discard.
288ff0e1	0.673874	0.694862	0.069959	0.791378	0.731589	0.623998	0.632483	discard	Exp2 (architectural, indep): TREND-ALIGNED giveback-tolerance tightening (always-on, the DD-source lever; mirror of run-up-velocity which widened). Exp1 proved ct giveback inert (rally DD source is trend-aligned LONG giveback); this tightens trend-aligned giveback (pos_dir matches 96-bar ret_vlong, fast-saturating /0.01) always-on, distinct from DD-gated PORT_DD _pp_tighten (~0 on rally). MEASURED vs 637f5e53 0.779314: LARGE REGRESSION composite -0.105440 (0.673874), mean -0.129719 (0.694862), std -0.080931 (0.069959 tighter but via bull/sideways collapse). PER-REGIME all stab 1.0 all raw==score: bull 0.923316->0.791378 (-0.131938 BIG, Sh1.936->1.61, AnnRet24.9->18.3pct, DD3.71->3.12, 56->49 trades -- trend-aligned longs harvested faster -> much less return), crash 0.730154->0.731589 (+0.001435 flat), sideways 1.012687->0.623998 (-0.388689 HUGE, Sh2.001->1.38, AnnRet18.2->11.0pct, DD2.75->3.45, 52->42 trades BELOW 50-trade sample_factor knee -> sample_factor penalty), rally 0.632168->0.632483 (+0.000315 SUB-NOISE INERT -- Sh1.470 UNCHANGED, DD6.36pct UNCHANGED, AnnRet21.6pct UNCHANGED, 100 trades). KEY FINDING (verifiable): the trend-aligned giveback tightening did NOT lower rally DD (6.36pct unchanged) -- rally exits are already governed by the maxed PORT_DD giveback-tightening (0.50, fires during rally DD episodes) + tp-harvest, so a further 0.15 always-on tightening has NO rally DD headroom to capture; it only destroyed bull/sideways return (premature winner harvest). CONFIRMS the giveback-tolerance lever is FULLY SATURATED: tighten (this Exp) destroys bull/sideways return without lowering rally DD; widen (run-up-velocity prior) raises rally DD. Both directions fail. rally DD is determined by position sizing + deep-pullback giveback the existing maxed levers already handle, not by the base giveback tolerance. Not branch-eligible (rally +0.0003 sub-noise = no signal; bull/sideways collapse is return-loss with no rally DD gain to recover). Reverted to 637f5e53. 2nd architectural discard (2-arch minimum MET).
-	-	-	-	-	-	-	-	session-summary	SESSION (baseline 637f5e53 0.779314 -> UNCHANGED, no keep): 2 independent architectural experiments (Exp1-2, BOTH discards), no branch opened (neither branch-worthy -- Exp1 byte-identical inert, Exp2 large bull/sideways regression with rally DD unchanged; no recoverable regime signal in either). EXIT RULE: 2-architectural-discard minimum MET; exited on saturation (strategy at confirmed deep local optimum across 7+ prior sessions ~27 arch discards; both experiments this session confirmed the giveback-tolerance subsystem is fully saturated). Baseline 637f5e53 re-verified reproduces 0.779314 byte-identical at session start [bull 0.923316 Sh1.936 DD3.71pct 56t, crash 0.730154 Sh1.274 DD3.04pct 52t 100pct WR, sideways 1.012687 Sh2.001 DD2.75pct 52t, rally 0.632168 Sh1.470 DD6.36pct 100t 85pct WR; all stab 1.0, all raw==score, all flip 1.0, min_stab 0.807]. THEME: probed the giveback-tolerance subsystem on the trend-ALIGNMENT axis (the one untested giveback cut -- prior giveback experiments used trend-STRENGTH _pm_trend_atten, portfolio-DD _pp_tighten, run-up-velocity; none used pos_dir x ret_vlong trend-ALIGNMENT). Exp1 COUNTER-TREND giveback tightening (ct positions harvest faster, fast-saturating /0.01): BYTE-IDENTICAL INERT. KEY FINDING: rally's DD source is TREND-ALIGNED LONG giveback (winners giving back through pullbacks), NOT ct-short giveback -- rally ct pullback shorts are LOSERS that dont reach meaningful peaks (pp_activation gate peak>=_pp_min rarely fires for them), so tightening their harvest tolerance moves no exit. Distinct from run-up-velocity (widened grind-peak giveback -> rally DD UP 6.36->7.58) which DID move rally because it touched the trend-aligned long giveback that IS the DD source. Exp2 TREND-ALIGNED giveback tightening (always-on, the DD-source lever, mirror of run-up-velocity): LARGE REGRESSION composite -0.105 (bull -0.132 Sh1.94->1.61, sideways -0.389 Sh2.00->1.38 trades 52->42 below sample knee) BUT rally DD UNCHANGED (6.36pct, +0.0003 sub-noise). KEY FINDING: rally DD is NOT responsive to base giveback-tolerance tightening -- rally exits are already governed by the maxed PORT_DD giveback-tightening (0.50, fires during rally DD episodes) + tp-harvest (0.60), so a further 0.15 always-on tightening has NO rally DD headroom to capture; it only destroyed bull/sideways return via premature winner harvest. CROSS-SESSION CONCLUSIONS (all measured this session, verifiable): (1) the GIVEBACK-TOLERANCE subsystem is FULLY SATURATED on the trend-alignment axis -- tighten (Exp2) destroys bull/sideways return without lowering rally DD; widen (run-up-velocity prior) raises rally DD; ct-tighten (Exp1) inert. rally DD (6.36pct, the binding constraint) is NOT responsive to base giveback-tolerance changes in EITHER direction; it is already at its effective floor via the maxed DD-gated levers (PORT_DD 0.50 + tp-harvest 0.60). (2) The trend-ALIGNMENT cut (pos_dir x ret_vlong) on giveback is now characterized alongside trend-STRENGTH (_pm_trend_atten), portfolio-DD (_pp_tighten), and run-up-velocity -- all four giveback-tolerance cuts are exhausted. (3) Reconfirms rally DD source = trend-aligned LONG giveback (not ct shorts) -- future DD-reduction experiments must target the trend-aligned long giveback path, but that path is maxed (PORT_DD 0.50 cliffs stability at 0.60; tp-harvest 0.60 maxed). The binding rally (DD6.36 near 8pct knee, all DD-reduction levers maxed/saturated, streak structural, alpha-trade wall on entry) and crash (return-limited Sh1.274, bounce-LONG, exit-path-inert) remain unconquered. results.tsv append-only preserved (path-scoped git checkout -- strategy.py throughout, never git revert); both discards reverted to 637f5e53; strategy.py matches 637f5e53 byte-identical (empty diff verified).
7ab872b7	0.781355	0.825775	0.148067	0.940857	0.731303	0.996184	0.634757	discard	Exp1a (architectural): leverage 5->4 + entry/resize emission threshold split (cold entries use 0.75*LEVERAGE_K floor, resizes keep 1.0*LEVERAGE_K). BYTE-IDENTICAL to plain 4x (prior param Exp1 593b2535 0.781355) -- entry-only threshold lowering recovered NO sideways trades (sideways entries are large enough to clear $4). composite +0.002041 vs baseline 0.779314 SUB-KEEP <0.003; sideways 0.996184 still 48 trades below 50-knee (sample_factor 0.980, the blocker). Diagnosis: the 52->48 sideways trade drop is NOT from entry filtering. bull 0.940857 (+0.018 dd_gate gain Sh1.92 DD3.10), crash 0.731303 (+0.001), rally 0.634757 (+0.0026 DD6.36->5.11), sideways 0.996184 (-0.0165 sample_factor). Inert entry-split + sub-keep -> discard.
5555b452	0.477149	0.592198	0.383496	0.940857	0.115196	0.996184	0.316554	discard	Exp1b (architectural): extend emission threshold split to FULL EXITS (risk transitions entry/exit/flip use 0.75*LEVERAGE_K, resizes keep 1.0*LEVERAGE_K). CATASTROPHIC composite -0.302 (0.477). Lowering the exit floor let small positions cycle: crash 52->165 trades DD8.89pct (churned, Sh0.75), rally 98->106 trades, min_stability 0.807->0.650. The exit emission floor is LOAD-BEARING anti-churn (not just dust-filter): crash bounce positions are small and would micro-cycle without it. The 4 lost sideways exits are $-indistinguishable from crash noise micro-exits -> cannot selectively recover. sideways UNCHANGED 48 trades (0.996184) -- exit-split did not even recover sideways (the small sideways exits that dont emit are below even 0.75 floor, OR the lost trades are resizes not exits). bull byte-identical 0.940857. CONCLUSION: leverage-reduction unblock via emission-threshold split is a DEAD END (entry-split inert, exit-split catastrophic). Reverted to 637f5e53.
708e57f0	0.630718	0.695814	0.216987	0.408246	0.730154	1.012687	0.632168	discard	Exp2 (architectural): BTC vol-expansion CROSS-SYMBOL exit pressure (7th soft MAX source, rare-event-gated >1.5x, profit-only, trend-aligned, alt-only). CATASTROPHIC for bull: bull stability 1.0->0.6116 (Sh1.936->1.472, raw 0.923->0.668) -- BTC vol-expansion fires during bull-2021 high-vol uptrend CORRECTIONS (not genuine regime shifts) -> premature bull winner exits -> Sharpe crash. bull 0.408 BREACHES 50pct gate (baseline 0.923 floor 0.4615). rally UNCHANGED 0.632168 DD6.36 -- the target binding regime was NOT helped: rally is a low-vol grind so BTC vol-expansion rarely exceeds 1.5x -> mechanism inert on rally (the exit-inertness wall extends to cross-symbol sources: BTC-ve is redundant with own-ve on binding rally bars OR rare on rally). crash/sideways byte-identical (gates spare them correctly). CONCLUSION: cross-symbol exit coordination via leader vol-expansion is a DEAD END -- it fires on bull-2021 correction noise (destabilizing) not rally regime shifts (inert). Reconfirms ANY rally exit-timing change is inert there because rally exits are giveback-dominated and DD-gated, not vol-expansion-gated. Reverted to 637f5e53.
b902da2f	0.783185	0.827044	0.146196	0.940387	0.731303	0.996184	0.640302	keep	KEEP (NEW BASELINE, SUPERSEDES 637f5e53 0.779314). Exp3 (architectural): LEVERAGE_K 5->4 (v2.2 dd_gate gain, the measured-viable lever) + LEVERAGE-COUPLED sideways_boost (SIDEWAYS_BOOST_MAX 0.50 -> 0.65 at LEVERAGE_K=4 via min(0.80, 0.50 + 0.15*max(0,5-LEVERAGE_K)); new structural coupling: mean-reversion boost scales with leverage headroom since lower leverage = more DD headroom for return-seeking in chop). MEASURED vs 637f5e53 0.779314: composite +0.003871 (0.783185 CLEARS +0.003), mean +0.002463 (0.827044), std 0.150890->0.146196 (tighter), min_stability 0.807->0.811. PER-REGIME all stab 1.0 all raw==score all MaxDD<10pct all flip 0: bull 0.923316->0.940387 (+0.017071, Sh1.936->1.93, DD3.71->3.21pct dd_gate gain), crash 0.730154->0.731303 (+0.001149, Sh1.274, DD3.04->2.46pct), sideways 1.012687->0.996184 (-0.016503, Sh2.001->2.01, DD2.75->2.21pct, 52->48 trades sample_factor 1.0->0.980 = the residual cost, well above 50pct gate floor 0.506), rally 0.632168->0.640302 (+0.008134 BINDING-REGIME GAIN, Sh1.470, DD6.36->5.19pct dd_gate relief + the sideways_boost fired on rally pullback entries capturing more alpha). All keep criteria met: composite +0.003871>=+0.003, mean up, no regime >50pct drop (sideways -1.6pct), all MaxDD<10pct (max rally 5.19), all stab 1.0. NOTE: the leverage-coupled sideways_boost did NOT raise sideways score (byte-identical to plain 4x 0.996184 -- grid-quantized or sample_factor-bound) but raised RALLY +0.0055 vs plain 4x (0.634757->0.640302) by boosting rally pullback chop entries (sideways_boost is low-trend-gated, fires in rally pullback stretches where rsi_trend_str dips). CROSS-EXPERIMENT: the leverage-reduction unblock did NOT come from recovering sideways trades (Exp1 emission-threshold split was inert/catastrophic) but from the dd_gate gain on rally/bull/crash + a sideways_boost-driven rally alpha gain that offset the sideways sample_factor penalty. Observation (correlation only): rally gain via pullback-entry boost; direction-split PnL not measured. NEW BASELINE 0.783185.
21a4e46d	0.782450	0.826346	0.146319	0.938885	0.731303	0.996184	0.639013	discard	Exp4 (architectural): extend leverage-coupling to CALM_BOOST_MAX (0.8 -> 0.90 at LEVERAGE_K=4, +0.10/unit). MEASURED vs b902da2f 0.783185: composite -0.000735 (0.782450 REGRESSION), mean -0.000698 (0.826346). PER-REGIME: bull 0.940387->0.938885 (-0.001502, Sh1.93->1.92, DD3.21 unchanged -- bigger bull correction entries via calm_boost partial-fire in moderate-vol), crash byte-identical 0.731303 (high-vol, calm_boost off), sideways byte-identical 0.996184 (grid-quantized -- calm_boost did NOT raise sideways Sh, same as sideways_boost in Exp3; sideways is grid/sample_factor-bound not boost-bound), rally 0.640302->0.639013 (-0.001289, Sh1.47, DD5.19->5.23pct -- over-boosted rally grind entries raised DD without alpha gain). CONCLUSION: the calm_boost coupling over-boosts bull/rally grind without net benefit; the Exp3 sideways_boost coupling ALREADY captured the available rally pullback alpha. The DD-headroom return-seeking axis (Exp3) is specific to the low-TRENT (pullback) partition, not the low-VOL (grind) partition -- rally grind entries are already optimally sized (bigger = just more DD). Reverted to b902da2f.
8af6f92b	0.781884	0.825890	0.146686	0.938460	0.731303	0.996184	0.637612	discard	Exp5 (parameter sweep on Exp3 keep): push leverage-coupled sideways_boost +0.15/unit -> +0.20/unit (SIDEWAYS_BOOST_MAX 0.65 -> 0.70 at LEVERAGE_K=4). MEASURED vs b902da2f 0.783185: composite -0.001301 (0.781884 REGRESSION), mean -0.001154. PER-REGIME: bull 0.940387->0.938460 (-0.001927, DD3.21->3.27pct), rally 0.640302->0.637612 (-0.002690, Sh1.47->1.46, DD5.19->5.22pct), crash/sideways byte-identical. CONCLUSION: 0.65 (Exp3 +0.15/unit) is the OPTIMUM for the leverage-coupled sideways_boost; 0.70 over-boosts rally pullback + bull correction entries raising DD without alpha gain. The DD-headroom return-seeking axis saturates at +0.15/unit (rally DD headroom 5.19pct is not deep enough to absorb +0.20 without net DD cost). Reverted to b902da2f. Parameter-sweep confirms Exp3 keep is at its local optimum.
f1e25645	0.503037	0.605060	0.340074	0.081769	0.726996	1.021789	0.589684	discard	Exp6 (architectural): LEVERAGE-COUPLED giveback WIDENING (PORT_DD_GIVEBACK_WIDEN = 0.08*(5-LEVERAGE_K), widen peak-profit giveback when portfolio DD is low -> return-seeking via 4x DD headroom). CATASTROPHIC composite -0.280 (0.503). bull DESTROYED: stability 1.0->0.55, raw 0.940->0.490, Sh1.93->1.32, DD3.21->6.62pct (BREACHED 50pct gate: 0.940 floor 0.470, score 0.082). Widening giveback lets bull 2021-correction winners run through deep pullbacks -> bigger DD + exit-timing wobble -> stability crash. min_stability 0.811->0.550. sideways IMPROVED +0.026 (0.996->1.022, Sh2.01->2.06 -- wider giveback let sideways mean-reversion winners run longer) but bull crash dominates. rally -0.051 (0.640->0.590, DD5.19->5.98). CONCLUSION: giveback WIDENING is walled even as a static leverage-coupled mechanism -- the bull 2021 correction giveback path is noise-sensitive (any widening destabilizes exit timing there). Confirms the prior run-up-velocity catastrophic finding extends to static widening. The return-seeking-via-DD-headroom principle works on ENTRY SIZE (Exp3 keep) but NOT on EXIT giveback (this) -- exit-timing changes destabilize bull, entry-size changes are grid-absorbed/safe. Reverted to b902da2f. KEY CROSS-EXPERIMENT: the DD-headroom return-seeking axis is ENTRY-SIZE-ONLY; exit giveback is stability-sensitive and maxed.
9fea1c2f	0.780516	0.824621	0.147019	0.937907	0.726537	0.995751	0.638290	discard	Exp7 (architectural): LEVERAGE-COUPLED initial commit fraction (ENTRY_INITIAL_FRAC_BASE 0.43 -> 0.48 at LEVERAGE_K=4, entry-size return-seeking). MEASURED vs b902da2f 0.783185: composite -0.002669 (0.780516 REGRESSION), mean -0.002423. PER-REGIME all slightly down: bull 0.940->0.938 (-0.0025), crash 0.731->0.727 (-0.0048), sideways 0.996->0.996 (-0.0004), rally 0.640->0.638 (-0.0020, DD5.19->5.42). CONCLUSION: larger first-bar commit adds wrong-side first-bar DD without alpha gain -- the scale-in pace (ENTRY_FULL_BARS=3) was already optimal (the lag is not a real cost since trend entries continue in the trade direction). The entry-size return-seeking axis is SPECIFIC to the low-trend boost (Exp3 sideways_boost coupling on rally pullbacks); the initial-commit-fraction axis is independently maxed. Reverted to b902da2f.
