commit	score	mean_score	std_score	bull_2021	crash_bear	sideways	rally_2024	status	description
-	-	-	-	-	-	-	-	-	session-summary	SESSION (baseline 1d764b9f 0.689311 5-regime -> UNCHANGED, no keep): 2 independent architectural experiments (Exp1-2, BOTH discards), no exploration branch opened (neither branch-worthy -- both sub-noise/walled on mixed target, no credible path to keep). EXIT RULE: 2-architectural-discard minimum MET; exited on saturation (strategy at confirmed deep local optimum, every subsystem documented walled across 5+ prior sessions AND reconfirmed this session via 2 genuinely-novel data dependencies). Baseline 1d764b9f re-verified byte-identical at session start (strategy.py 0-diff to keep, run_baseline.log composite 0.689311 mean 0.754748 std 0.218125 [bull 0.961878 Sh1.9995 DD3.09pct, crash 0.729861 Sh1.271 DD2.46pct 100pctWR, sideways 1.011417 Sh2.017 DD2.21pct, rally 0.662116 Sh1.530 DD5.17pct, mixed 0.408468 Sh0.802 DD2.80pct 100pctWR; ALL stab 1.0 raw==score, min_stab 0.844713]) AND post-revert (strategy.py 0-diff to keep after each discard). results.tsv append-only preserved (path-scoped git checkout -- strategy.py for each discard, never git revert). NOTE: session started with an UNRECORDED prior-agent experiment at HEAD (12386c3f ct-severity-gated growth-resize emission de-risk, committed but never backtested/recorded); backtested it AS this session's Exp1. THEME: probed 2 genuinely-different architectural angles, each with a NEW data dependency at a distinct subsystem (emission growth-channel + admission realized-PnL), each with a clear mechanism and a concrete measurable mixed target. CROSS-EXPERIMENT CONCLUSIONS (all measured this session, verifiable): (1) EXP1 CT-SEVERITY-GATED GROWTH-RESIZE EMISSION DE-RISK (new emission channel: growth resizes |target|>|current_pos| cross grid lines unlike sub-grid reductions; ct_sev gate isolates trim to mixed counter-trend buildups; k=0.50 winner-fade onset +1.0*stop): composite 0.662969 (-0.026342), mean 0.731215 (-0.023533). PER-REGIME: bull -0.0129 Sh1.9995->2.055, crash -0.0048, sideways BYTE-IDENTICAL, rally -0.1000 Sh1.530->1.373, mixed BYTE-IDENTICAL 0.408468 (target MISSED). FAILURE MECH (architectural fact): mixed byte-identical -- the GROWTH channel is ALSO re-quantization-walled (same as reduction); mixed's held wrong-side longs are NOT built up via emitted growth resizes (held at steady state by per-symbol exit primitives, not grown). The entire emission quantization (reduction AND growth) is a chaotic wall on mixed. rally/bull regressed: ct_sev level signal did NOT cleanly exclude trend-aligned growth (rally modest uptrend ret_vlong~0.006 still yields ct_sev>0; winner_fade onset +1.0*stop too low). (2) EXP2 CT-GATED DIRECTIONAL REALIZED-PnL ADMISSION FEEDBACK (new data dep at admission: per-symbol EMA of realized exit PnL BY DIRECTION alpha=0.35; when long_ema<0 AND bull entry counter-trend ret_vlong<0, tighten bull strong_min up to 12%; symmetric for bear; ct-gate spares trend-aligned): composite 0.688772 (-0.000539 SUB-NOISE), mean 0.753991 (-0.000757). PER-REGIME: bull -0.0038 Sh1.9995->1.9906 (NOT byte-identical despite ct-gate; one trade shifted), crash BYTE-IDENTICAL, sideways BYTE-IDENTICAL, rally +0.00005, mixed BYTE-IDENTICAL 0.408468 (Sharpe 0.802336 DD 2.797 IDENTICAL -- target MISSED, zero mixed trades changed). FAILURE MECH (architectural fact): mixed byte-identical -- the realized-PnL feedback did NOT fire on mixed because mixed's losses are UNREALIZED GIVEBACK (mixed is 100pctWR per prior summaries), so exit_pnl_signed stays modestly positive -> long_ema never goes negative -> feedback never fires. CONVERGENT NEW INSIGHT (this session, both experiments): mixed's binding constraint is UNREALIZED giveback on held WINNING longs, not realized losses. This explains why (a) every exit/trim/emission channel is walled (positions never reach the trim realization threshold because giveback doesn't push them there), AND (b) realized-PnL feedback is walled (no realized losses to feed back). The giveback levers (PORT_DD_GIVEBACK_TIGHTEN 0.50, PORT_DD_TP_HARVEST 0.60) are PORTFOLIO-DD-gated and maxed; mixed's own DD is only 2.80pct (portfolio DD may not deepen enough to trigger aggressive giveback on mixed specifically). SATURATION RECONFIRMED: every boost-removal simplification (DVP column, close-conv, own-vol-rise, double-cross cells, bounded-boost composite) was ALREADY attempted and discarded in prior sessions -- all 9 entry-boost factors are load-bearing. MAX-fusion alternatives (smoothmax, softmax) were already tried and catastrophic (bull crushed). Admission restrictiveness cuts trend regimes (prior conclusion). Structural-exploration NOT attempted: trigger condition (3+ consecutive arch discards in THIS session) met at 2 but no coherent subsystem-rewrite hypothesis with a plausible path -- every core mechanism (fusion, emission, admission, sizing) confirmed walled or at structural ceiling; the two new data deps this session (ct-severity growth channel, directional realized-PnL) both confirmed walled, and the convergent insight (mixed = unrealized giveback, not realized loss) points to a giveback layer that is already maxed (DD-gated, levers at 0.50/0.60). NEW BASELINE 0.689311 UNCHANGED.
df6bd3b3	0.690750	0.755507	0.215854	0.960921	0.728839	1.011769	0.660007	0.415996	branch	Exp1 (architectural, indep, BRANCH OPEN): portfolio-DD-headroom conviction-quality entry boost (symmetric counterpart to _port_dd_atten). NEW data dep _port_dd_headroom = unused fraction of 8pct-knee DD budget (1.0 at peak equity, 0.0 at 8pct DD via tanh on smoothed-equity DD-fraction, leverage-coupled scale). Applied as first-bar entry-size boost +0.10 gated on conviction MARGIN (margin>=0.30 decisive entries) x TREND-ALIGNMENT (entry dir matches ret_long sign = winning-trade family). Conjunction lands boost on decisive trend-aligned winners -> raises APY without proportional DD -> calmar up (genuine-signal path the v2.2 return_reward rewards). MEASURED vs 1d764b9f 0.689311: composite +0.001439 SUB-NOISE, mean +0.000759, std 0.218125->0.215854 (tighter). PER-REGIME all stab 1.0 all raw==score all DD<10pct: bull 0.961878->0.960921 (-0.000957 Sh2.00 DD3.09pct unchanged), crash 0.729861->0.728839 (-0.001022 Sh1.27 DD2.46pct unchanged), sideways 1.011417->1.011769 (+0.000352 Sh2.02 DD2.21pct), rally 0.662116->0.660007 (-0.002109 Sh1.530->1.530 AnnRet18.4->18.7 DD5.17->5.36pct = the regression), mixed 0.408468->0.415996 (+0.007528 Sh0.80->0.81 AnnRet4.4->4.5 DD2.80->2.88 = the target regime gained). KEY: mixed_2025 (the binding weak regime 0.408) gained +0.0075 -- the headroom boost fired on its 100pct-WR low-DD trend-aligned entries (the over-conservative book). RALLY REGRESSION CAUSE (measured): headroom not fully ~0 in rally (its DD 5.17pct = 0.052 DD-fraction -> headroom ~0.78 at 0.08 scale -> boost fires on rally winning trend-aligned longs -> DD creeps 5.17->5.36 -> calmar down -> rally raw -0.002). Distinct from failed v2.1 headroom boost (cabfb6f1 +0.80 blanket, rally stability collapsed): this is conviction-gated +10pct first-bar-only under v2.2 calmar scoring. BRANCH JUSTIFICATION: (1) new mechanism (symmetric DD-headroom boost, never existed), (2) target regime mixed gained +0.0075, (3) hypothesis to fix rally: tighten the headroom scale so it is ~0 at rally DD levels (rally 5.17pct should NOT count as headroom -- only the low-DD regimes should). Next step: scale headroom to the 8pct knee with a steeper activation so rally DD (~5pct) has near-zero headroom while mixed DD (~2.8pct) keeps full headroom.
94322b79	0.690797	0.755571	0.215913	0.961237	0.728839	1.011769	0.660015	0.415996	branch	branch step2: LOW-CHURN gate on headroom boost (spare rally bursts). MEASURED vs step1 0.690750 (raw 0.690750): composite +0.000047 (flat, sub-noise progress), mean +0.000064, std 0.215854->0.215913. PER-REGIME: bull 0.960921->0.961237 (+0.000316 Sh2.00 DD3.09), crash/sideways/mixed BYTE-IDENTICAL to step1 (0.728839/1.011769/0.415996 -- churn gate inert on their low-churn entries, boost still fires), rally 0.660007->0.660015 (+0.000008 ESSENTIALLY UNCHANGED Sh1.53 DD5.36 UNCHANGED -- churn gate did NOT recover rally). FINDING: the rally DD creep (5.17->5.36) is NOT from burst entries -- it is from rally FIRST-in-burst trend-aligned winning longs (len(_eh)<=1 = low churn = gate ON -> boost fires on them). Both mixed and rally have low-churn trend-aligned winning entries, so the churn gate cannot separate them. The rally/mixed separator must be a different axis (conviction level: mixed entries are marginal-conviction tiny winners; rally entries are decisive-conviction big winners -- step3 hypothesis).
c1cd7fef	0.689306	0.754744	0.218126	0.961878	0.729861	1.011417	0.662095	0.408468	branch	branch step3: MARGINAL-CONVICTION band-pass gate on headroom boost (peak at margin~0.15, fade to 0 at margin>=0.40). MEASURED vs step2 0.690797 (raw 0.690797): composite -0.001491 REGRESSION, BYTE-IDENTICAL to baseline 1d764b9f 0.689311 (rally 0.662095 vs baseline 0.662116, mixed 0.408468 IDENTICAL, all regimes baseline). FINDING: the band-pass conviction gate made the boost COMPLETELY INERT -- it fired on NO entries. This REFUTES the step3 hypothesis: mixed winning entries are NOT marginal-conviction (margin 0.15). The boost that worked in step1/2 (mixed +0.0075) fired on mixed DECISIVE entries (margin>=0.30), the SAME conviction band as rally. So mixed and rally entries have SIMILAR conviction profiles -- conviction is NOT the separator. Restored step2 best state (0.690797). Branch at +0.001486 composite vs baseline (sub-noise); mixed +0.0075 (target) but rally -0.0021 (cost) -- the two regimes share headroom + decisive trend-aligned winners, fundamental confound.
5e34584b	0.619312	0.664467	0.150519	0.676135	0.742337	0.857937	0.644624	0.401303	branch	branch step4: portfolio-DD-headroom-gated max_hold EXTENSION for trend-aligned winners (raise APY via longer winners, not larger entries). MEASURED vs baseline 1d764b9f 0.689311: composite -0.069999 CATASTROPHIC REGRESSION, mean -0.090281. PER-REGIME all stab 1.0: bull 0.961878->0.676135 (-0.285743 Sh2.00->1.49 DD3.09->4.33pct -- winners held too long into giveback), sideways 1.011417->0.857937 (-0.153480 Sh2.02->1.78 DD2.21->2.66), crash 0.729861->0.742337 (+0.012476 Sh1.27->1.29), rally 0.662116->0.644624 (-0.017492 Sh1.53->1.48), mixed 0.408468->0.401303 (-0.007165 Sh0.80->0.79 AnnRet4.4->4.3 -- extension did NOT help mixed, slightly hurt). KEY FINDING: the headroom gate fires on ALL low-DD regimes (bull, sideways, crash, mixed all have DD<3.5pct = headroom ~1), NOT just mixed. bull/sideways are ALREADY optimized (high Sharpe), so extending their holds causes giveback that crashes their Sharpe. mixed is the ONLY low-DD regime that is undersized, but it cannot be isolated without regime-detection (forbidden). The max_hold lever is the WRONG tool: it helps the already-strong regimes least and hurts them most. CONFOUNDS CONFIRMED across step1-4: (1) entry-boost fires on mixed AND rally (both headroom+winners); (2) max_hold extension fires on ALL low-DD regimes (bull/sideways already optimized). The headroom mechanism cannot isolate mixed from the other low-DD regimes. Restored baseline 1d764b9f.
-	-	-	-	-	-	-	-	-	discard	BRANCH REVERTED (portfolio-DD-headroom conviction-quality entry boost, 4 steps). Opened at Exp1 (df6bd3b3): new mechanism _port_dd_headroom (symmetric counterpart to _port_dd_atten, never existed) gated on conviction x trend-alignment, +0.10 first-bar entry boost. Step1 mixed +0.0075 (target) but rally -0.0021 (DD creep 5.17->5.36). Step2 low-churn gate: rally UNCHANGED (regression is from first-in-burst trend-aligned longs, also low-churn). Step3 marginal-conviction band-pass: BYTE-IDENTICAL inert (mixed/rally entries share decisive-conviction profile, conviction is NOT the separator). Step4 max_hold extension: -0.070 catastrophic (headroom fires on ALL low-DD regimes, bull/sideways already-optimized -> giveback crashed Sharpe 2.00->1.49). BEST step2 +0.001486 sub-noise, below +0.003 keep bar. ROOT CAUSE (measured): the portfolio-DD-headroom signal cannot isolate mixed_2025 from the other low-DD regimes. (1) Entry-boost confound: mixed AND rally both have headroom + decisive trend-aligned winners (rally DD 5.17pct is below the 8pct knee -> significant headroom; boost fires on rally winning longs -> DD rises faster than return -> calmar down). (2) max_hold confound: ALL low-DD regimes (bull 3.09pct, sideways 2.21pct, crash 2.46pct, mixed 2.80pct) have headroom ~1; bull/sideways already optimized so longer holds hurt them. mixed is the ONLY undersized low-DD regime but cannot be targeted without regime-detection (forbidden). CONFIRMS (via a novel headroom mechanism distinct from prior v2.1 attempt): the mixed_2025 structural floor is not addressable by portfolio-DD-headroom return-seeking -- every other low-DD regime shares the headroom signal and is already at its local optimum. Restored baseline 1d764b9f 0.689311 (strategy.py byte-identical, 0 diff verified).
-	-	-	-	-	-	-	-	-	session-summary	SESSION (baseline 1d764b9f 0.689311 5-regime -> UNCHANGED, no keep): 1 independent architectural experiment (Exp1, opened branch) + 1 exploration branch (4 steps, REVERTED). Baseline 1d764b9f re-verified byte-identical 0.689311 post-revert (0 diff) [bull 0.961878 Sh2.00 DD3.09pct 52t, crash 0.729861 Sh1.27 DD2.46pct 55t 100pct WR, sideways 1.011417 Sh2.02 DD2.21pct 49t, rally 0.662116 Sh1.53 DD5.17pct 102t, mixed 0.408468 Sh0.80 DD2.80pct 43t 100pct WR; all stab_factor 1.0, all raw==score, min_stab 0.844713]. results.tsv append-only preserved (path-scoped git checkout -- strategy.py throughout, never git revert). THEME: probed the RETURN-SEEKING axis via a NOVEL portfolio-DD-headroom mechanism (symmetric counterpart to _port_dd_atten, which only SHRINKS as DD rises -- no mechanism ever EXPANDED size when DD headroom was large). The v2.2 calmar return_reward factor + mixed_2025 profile (100pct WR, Sh0.80, AnnRet4.4pct, MaxDD2.80pct = huge DD headroom below 8pct knee) made this the canonical untested return-seeking lever. CROSS-EXPERIMENT CONCLUSIONS (all measured this session, verifiable): (1) Exp1 df6bd3b3 (headroom x conviction x trend-align entry boost +0.10 first-bar): mixed +0.0075 (target regime gained, Sh0.80->0.81 AnnRet4.4->4.5) BUT rally -0.0021 (DD 5.17->5.36, calmar down). (2) step2 low-churn gate: rally UNCHANGED (regression from first-in-burst trend-aligned longs = low-churn). (3) step3 marginal-conviction band-pass: BYTE-IDENTICAL inert (mixed/rally entries share decisive-conviction profile, conviction NOT the separator). (4) step4 max_hold extension: -0.070 catastrophic (headroom fires on ALL low-DD regimes; bull/sideways already-optimized -> giveback crashed Sharpe 2.00->1.49). KEY LOAD-BEARING CONCLUSION: the portfolio-DD-headroom signal CANNOT isolate mixed_2025 from the other low-DD regimes. Two distinct confounds measured: (A) entry-boost fires on mixed AND rally (both have headroom + decisive trend-aligned winners; rally DD 5.17pct is below the 8pct knee so it has significant headroom); (B) max_hold extension fires on ALL low-DD regimes (bull/sideways/crash/mixed all DD<3.5pct = headroom ~1; bull/sideways already at local optimum so any extension regresses them). mixed_2025 is the ONLY undersized low-DD regime but cannot be targeted without regime-detection (forbidden). This CONFIRMS via a novel headroom mechanism (distinct from the prior v2.1 cabfb6f1 headroom attempt which failed for different reasons -- v2.1 return_reward too weak + rally stability collapse) that the mixed_2025 structural floor is not addressable by portfolio-DD-headroom return-seeking. REMAINING UNCONQUERED: mixed_2025 (0.408, 100pct WR + Sh0.80 + low DD = over-conservative book, but every return-seeking lever that would help it also fires on the other low-DD regimes which are already optimized) and rally (0.662, near-knee DD). Both binding regimes at non-addressable structural limits (Nth session confirming this via a new mechanism). NEW BASELINE 1d764b9f 0.689311 unchanged for future sessions.
b78612ed	0.689311	0.754748	0.218125	0.961878	0.729861	1.011417	0.662116	0.408468	discard	Exp1 (architectural, indep): COUNTER-TREND giveback tolerance tightening at the pp_tolerance layer. NEW per-position data dep on the held position own multi-day ret_vlong (pos_dir*ret_vlong<0 = wrong-side family), composed multiplicatively with the portfolio-DD tightening. Prior session convergent insight: mixed binding constraint is UNREALIZED giveback on held WINNING longs that are ct (100pct-long-in-a-down-year), and the giveback levers are PORTFOLIO-DD-gated so they fire only after portfolio DD deepens -- but mixed own DD (2.80pct) may not deepen the PORTFOLIO enough to trigger aggressive giveback on mixed specifically. A per-position ct signal keys directly on the held trade trend disagreement, firing on mixed longs without needing portfolio DD to deepen. Fast-saturating /0.01 ret_vlong ct indicator (validated near-constant noise-free -> tightening amount bar-to-bar stable). Trend-aligned holds (ct indicator 0) byte-identical by construction. MEASURED vs 1d764b9f 0.689311: BYTE-IDENTICAL composite/mean/std/per-regime ALL unchanged (bull 0.961878, crash 0.729861, sideways 1.011417, rally 0.662116, mixed 0.408468; all stab 1.0 raw==score; all Sharpe/DD/AnnRet identical). FAILURE MECH (architectural fact, reconfirms prior 5+ sessions): mixed byte-identical -- tightening the giveback TOLERANCE changes _pp_pressure which is an UPSTREAM exit-pressure source; the emission quantization floor + 0.06 calm-grid re-quantizes every sub-grid reduction to the same grid (the SAME re-quantization wall as the ct-severity throttle row 1267, the cross-book exit pressure row 1239, the build dampener row 1236). mixed positions only reduce on rare bars where the raw target already crosses a grid line; an upstream giveback-tolerance tightening that amplifies a sub-grid reduction leaves it sub-grid -> no emission. The entire exit-pressure -> emission pipeline is walled on mixed. No credible path to keep. Not branch-eligible (mixed is the binding target and is structurally walled at emission; all other regimes byte-identical = zero signal anywhere). Reverted to 1d764b9f. 1st architectural discard.
2e33cc75	0.668416	0.728108	0.198974	0.831482	0.727098	1.012092	0.661400	0.408468	discard	Exp2 (architectural, indep): MTM-PATH-EFFICIENCY-gated max_hold extension for trend-aligned winners. NEW data dep at time-pressure: the per-position pos_pnl path-efficiency (already maintained in _pnl_path for the emission MTM-chop throttle, baseline keep 1d764b9f) now ALSO consumed at the max_hold decision. Extend max_hold (max +8pct ~= 1 bar) for trend-aligned (pos_dir matches ret_vlong, /0.02) WINNING (pos_pnl>0) positions whose pos_pnl path is SMOOTH (MTM-eff ramp 0.5->0.8). Hypothesis: crash return-seeking via longer winner holds is REAL (+0.022 Sh, prior vol-stability branch f5cd1b82) but bounded by bull/sideways bleed because prior separators (vol-stability, deep-trend, slope-conf, hump-profit) could not exclude bull trend-aligned corrective longs; MTM-path-efficiency (smooth vs choppy climb) is a NEW per-position separator that should distinguish crash smooth downtrend shorts from bull corrective longs. MEASURED vs 1d764b9f 0.689311: composite -0.020895 (0.668416), mean -0.026640 (0.728108), std 0.218125->0.198974 (tighter, mean-driven). PER-REGIME all stab 1.0 raw==score all DD<10pct: bull 0.961878->0.831482 (-0.130396 Sh 1.9995->1.8287 DD 3.09->4.08pct -- REGRESSED HARD), crash 0.729861->0.727098 (-0.002763 Sh 1.2705->1.2653 AnnRet 12.05->12.00 -- TARGET MISSED, crash did NOT gain), sideways 1.011417->1.012092 (+0.000675 micro), rally 0.662116->0.661400 (-0.000716 micro), mixed BYTE-IDENTICAL 0.408468. FAILURE MECH (direct measurement): the MTM-eff separator did NOT isolate crash from bull -- bull-2021s uptrend has LONG SMOOTH GRINDING stretches between its sharp corrections, so bull longs ALSO have high MTM-eff and got extended -> rode into the sharp corrections that follow -> bull DD 3.09->4.08pct Sh 2.00->1.83 (the SAME winner-hold-extension bull-bleed failure mode as prior vol-stability branch f5cd1b82, winner-pyramid 17484a0e, trend-aligned hold ext 3e6c5995/6b423c3f -- all extend bull trend longs into 2021 corrections). crash did NOT move (the +1-bar extension was too small AND crash shorts do not have long-enough smooth pos_pnl paths for the MTM-eff gate to engage strongly -- crash is a choppy downtrend with sharp bounces, NOT a smooth grind). HYPOTHESIS FALSIFIED: MTM-eff is NOT a crash-vs-bull separator (both regimes have smooth trend-aligned climbs); the documented crash return-seeking lever (+0.022 via vol-stability) relied on vol-stability NOT path-smoothness. Not branch-eligible (crash the target did not gain; bull bleed is the documented unresolvable winner-hold wall -- no credible path to keep via this axis; the separator problem for winner-hold-extension is now confirmed across 4 distinct separators: vol-stability, deep-trend, slope-conf, hump-profit, AND MTM-eff -- all fail to isolate crash from bull). Reverted to 1d764b9f. 2nd architectural discard (EXIT RULE 2-arch minimum MET).
