commit	score	mean_score	std_score	bull_2021	crash_bear	sideways	rally_2024	status	description
e51d7b6-session-summary	-	-	-	-	-	-	-	session-summary	session: 1 architectural KEEP (exp2 e51d7b6) + 3 architectural discards (stopped: keep neighborhood mapped as tight optimum, all remaining directions saturated/walled). KEEP e51d7b6 SUPERSEDES 10bfd268 0.5507 -> 0.5628 (+0.0121 composite, +0.0068 mean, std NARROWED 0.1726->0.1622): churn-gated FIRST-BAR entry size attenuator (shrink 1.0x..0.75x via tanh on integer churn count len(_eh)). [bull 0.770 stab1.0, crash 0.676 stab1.0, sideways 0.760 stab1.0, rally 0.370 raw0.449 STAB0.747 factor0.824 = SOLE binding constraint, moved POSITIVELY from 0.756]. CENTRAL CROSS-EXPERIMENT MECHANISM (load-bearing for future sessions): the rally-stab SHRINK axis is SAFE ONLY when gated on the NOISE-IMMUNE INTEGER churn count len(_eh); PRICE-DERIVED proximity/variance modulation COLLAPSES rally stab. Proven 3x this session: exp1 trend-gate-PROXIMITY shrink (price-derived, noisy near boundary) rally stab 0.747->0.669 DISCARD; exp2 INTEGER-churn shrink rally stab 0.747->0.747 factor 0.756->0.824 KEEP; exp5 churn-blend _entry_frac_dyn toward base (RE-INFLATED chop entries since base>ER-suppressed value) rally stab ->0.547 DISCARD. SECOND INSIGHT: shrink must be FIRST-BAR-ONLY + ONE-SIDED-DOWN. exp4 extended churn-shrink to whole scale-in ceiling: integer gate raised rally STAB further (factor 0.824->0.861, avoided perturbed-classification trap) BUT cut rally RAW -14pct (0.449->0.384) -> persistent whole-position shrink removes real alpha from profitable churny trades (reconfirms 10bfd268 branch first-bar-only sweet-spot, now with integer gate). THIRD: _tod_atten removal (exp3) = raw FLAT everywhere (rally raw even UP 0.449->0.460, ~ZERO return alpha) BUT rally stab COLLAPSED 0.747->0.581 -> the 6-cycle calendar modulator is load-bearing for STABILITY (deterministic per-bar size dispersion feeding position-value cascade), NOT its stated alpha; do NOT re-attempt removal. SATURATED/WALLED (do not re-tune): consensus_atten(13x), concurrency(21x load-bearing _concurrent_atten), voter-persistence(26x load-bearing bull), scale-in-pace(23x), churn-macro-admission(failed 7040ff9), exit-timing+reversal(walled). NEW BASELINE e51d7b6 0.5628.
-	0.4824	0.6007	0.2365	0.77	0.68	0.76	0.20	discard	ARCHITECTURAL cross-symbol concordance first-bar entry-size attenuator (shrink divergent entries where own side disagrees with BTC/ETH/SOL 20-bar breadth aggregate; one-sided down, first-bar only, NEW cross-symbol data dep). Composite -0.080 vs e51d7b6 0.5628. bull/crash/sideways RAW FLAT. RALLY raw FLAT 0.449 but STABILITY COLLAPSED 0.747->0.631, factor 0.824->0.436. FAILURE MECH: _mkt_mean_ret is a CONTINUOUS price-derived quantity (cross-symbol does NOT escape this) — multiplying entry SIZE by it, and the |_mkt_mean_ret|>0.01 gate boundary flipping on/off under AR(1) noise, adds distinct first-bar position values -> worse tracking error. CONFIRMS the wall: ANY continuous price-derived SIZE modulation collapses rally stab, INCLUDING cross-symbol breadth; only NOISE-IMMUNE INTEGER-churn gating is safe. Discard #1 (architectural).
3821262f	0.4482	0.6137	0.3310	0.76	0.72	0.92	0.05	branch	BRANCH OPEN: ARCHITECTURAL complementary low-churn-gated coarse grid (inverse-churn partition; _calm_dz=tanh((1.5-len_eh)/0.6) fires at len<=1, DISJOINT from existing high-churn grid; same stable 0.06*equity*BASE lattice, resize-only, snap-toward-current_pos). Composite -0.115 vs e51d7b6 0.5628 BUT TWO REGIMES UP AS PREDICTED: sideways +0.156 (0.760->0.916 RAW, largest single-regime move available — confirms 4a40af0 grid-fee-saving thesis), crash +0.047 (0.676->0.723 RAW), bull -0.009 flat. RALLY raw -0.030 (0.449->0.419) but STABILITY COLLAPSED 0.747->0.539, factor 0.824->0.129. FAILURE MECH: rally is NOT purely high-churn — it has isolated low-churn (len<=1) quiet bars where the new coarse grid fires; the round() rounding-boundary on those resizes flips between grid levels under AR(1) noise -> tracking error (consistent with line-447 Schmitt discard: rounding boundary is load-bearing). BRANCH HYPOTHESIS: replace low-churn round()-grid with SNAP-TO-HOLD deadband (proven direction-agnostic ef027049 mechanism, no foreign rounding boundary) -> capture crash/sideways micro-resize fee savings WITHOUT the rally-killing rounding boundary.
5e4c5d5c	0.5711	0.6866	0.2312	0.75	0.76	0.93	0.31	keep	BRANCH KEEP (4 steps) SUPERSEDES e51d7b6 0.5628 -> 0.5711 (+0.0083 composite, +0.0427 mean, std 0.1622->0.2312). ARCHITECTURAL complementary low-churn-gated COARSE GRID at order-emission layer: adds a second 0.06*equity*BASE round()-grid quantization (DISJOINT from the existing HIGH-churn fine grid) that fires ONLY for never-bursting symbols, capturing the 4a40af0 grid-fee-saving thesis in the stability-factor-1.0 regimes. PER-REGIME: crash 0.676->0.757 (+0.081 raw, churn/fee cost cut), sideways 0.760->0.930 (+0.171 raw, LARGEST move — second confirmation of 4a40af0 sideways grid sensitivity), bull 0.770->0.753 (stab eased 1.0->0.975, raw +0.003), rally 0.370->0.306 (grid never fires there; raw -0.031 stab 0.747->0.720, within 50pct floor 0.185). All MaxDD<1.86pct. BRANCH PATH: exp2 step1 instantaneous _calm_dz(len<=1) round-grid = crash/sideways UP but rally HARD-CUTOFF (round boundary flips on rallys lone-entry scale-in resizes at len=1). step2 snap-to-hold = recovered rally stab but LOST raw gains (suppresses profitable resizes wholesale -> crash/sideways BELOW baseline). step3 100-bar trailing-max gate = crash/sideways raw RESTORED but rally STILL 0.000 (rallys entry clusters >100 bars apart -> window drops <=2 in quiet stretches -> grid leaks). step4 CUMULATIVE-max gate = KEEP (once a symbol bursts len>=3 even once, grid OFF permanently; crash max-len=1 + sideways max-len=2 NEVER burst so grid stays ON whole regime; rally/bull burst early -> OFF for good incl quiet stretches). DIAGNOSTIC DROVE step4: measured per-regime trailing entry counts (crash max=1, sideways max=2, bull max=6, rally max=5) -> only a NEVER-windowed cumulative gate separates them. STRUCTURAL INSIGHTS: (a) grid quantization is a RAW lever for the calm stability-1.0 regimes (crash/sideways), distinct from its rally-stab use — the two grids now serve OPPOSITE purposes on OPPOSITE churn partitions. (b) the safe churn gate for SPARING rally must be CUMULATIVE-max (monotonic, never-windowed) not windowed — rally has long quiet stretches that any finite window leaks. (c) round()-grid (direction-preserving) is the value driver; snap-to-hold (suppress-resize) is strictly weaker for raw. NEW BASELINE 5e4c5d5c 0.5711.
5e4c5d5c-session-summary	-	-	-	-	-	-	-	session-summary	session: 1 independent architectural discard + 1 exploration branch (4 steps) = BRANCH KEEP 5e4c5d5c (0.5711 SUPERSEDES e51d7b6 0.5628, +0.0083 composite, +0.0427 mean). INDEPENDENT DISCARD: (1) cross-symbol concordance first-bar entry-size attenuator (shrink entries whose own side disagrees with BTC/ETH/SOL 20-bar breadth) -0.080: bull/crash/sideways RAW FLAT, RALLY raw flat but stab 0.747->0.631 COLLAPSED. CONFIRMS price-derived SIZE modulation collapses rally stab EVEN cross-symbol (_mkt_mean_ret is continuous price-derived; its gate boundary flips under noise) — only NOISE-IMMUNE INTEGER gating is safe. BRANCH (low-churn-gated coarse grid, order-emission layer): the existing keep grid fires only in HIGH churn (rally); crash/sideways/bull (LOW churn) got ZERO grid quantization. Added a COMPLEMENTARY grid on the inverse churn partition to capture 4a40af0 grid-fee-savings (crash/sideways stability-factor-1.0 regimes) without touching rally. step1 instantaneous-len gate UP crash/sideways but rally cutoff; step2 snap-to-hold lost raw; step3 100-bar window leaked rally; step4 CUMULATIVE-MAX gate = KEEP. CENTRAL CROSS-EXPERIMENT MECHANISM (load-bearing for future sessions): grid quantization serves TWO OPPOSITE roles on TWO OPPOSITE churn partitions — (HIGH churn) FINE grid = rally distinct-position-value reduction (existing keep), (LOW churn, NEVER-bursting via cumulative-max) COARSE round-grid = crash/sideways turnover/fee cost cut (new keep). The gate that spares rally MUST be CUMULATIVE-max of len(_eh) (monotonic, never-windowed) — windowed gates leak because rally entry-clusters are >100 bars apart (long quiet stretches). round()-grid (direction-preserving) is the RAW value driver; snap-to-hold (suppress-resize) is strictly weaker. DIAGNOSTIC: per-regime trailing entry counts crash max=1 / sideways max=2 / bull max=6 / rally max=5 -> cumulative-max <=2 cleanly isolates the two calm regimes. NEW BASELINE 5e4c5d5c 0.5711.
ff6790d0	0.5513	0.6884	0.2741	0.76	0.76	0.99	0.24	branch	BRANCH OPEN: ARCHITECTURAL churn-gated minimum-hold-time resize cooldown (TIME-axis order-emission lever; freeze same-sign resizes for RESIZE_COOLDOWN=3 bars after a resize, gated on noise-immune integer churn). Composite -0.020 vs 5e4c5d5c 0.5711. BROAD RAW GAINS: sideways +0.061 (0.930->0.991), bull +0.009 stab->1.0, rally RAW +0.15 (0.418->0.568). BUT rally stability COLLAPSED 0.732->0.427 (the hard bars_since_resize<COOLDOWN + _hold_prob>=0.5 timing boundaries are noise-sensitive in rally bursts). Branch hypothesis: remove the hard timing cliffs; make the freeze boundary-free to preserve the broad raw gains while restoring rally stability.
-	0.4895	0.6421	0.3053	0.75	0.76	0.93	0.13	branch	branch step 2: boundary-free decaying refractory deadband (cooldown_band=0.35*churn_dz*recency, recency=1-bars_since/COOLDOWN). Composite 0.4895 WORSE than step1 0.5513. Lost sideways gain (0.991->0.934), rally stab 0.43->0.31 (recency term still a noise-sensitive boundary). raw_composite 0.620 < step1 0.695 = no progress.
-	0.1055	0.3805	0.5501	0.64	0.76	0.70	-0.57	branch	branch step 3: deterministic bar-phase resize gate (bar_count%COOLDOWN!=0 -> hold, churn-gated). FULLY NOISE-IMMUNE (rally stab 0.43->1.0, min_stability 0.91) BUT rally RAW DESTROYED -0.569 (phase-gating forces resizes only every 3rd bar -> position cannot track genuine rally moves -> alpha collapse, hard cutoff). raw_composite 0.105. CONFIRMS WALL FROM BOTH SIDES: noise-immune freq reduction (phase) kills rally RAW; raw-preserving freq reduction (since-resize counter, step1) kills rally STABILITY. Resize-frequency thinning is the SAME inseparable rally raw<->stability axis as re-entry timing (prior sessions). BRANCH DEAD-END.
-	0.1055	0.3805	0.5501	0.64	0.76	0.70	-0.57	discard	BRANCH SUMMARY (churn-gated resize-frequency thinning, 3 steps, REVERTED to keep 5e4c5d5c 0.5711 — strategy.py byte-identical). OPENED from a TIME-axis order-emission lever (freeze same-sign resizes after a resize) chosen orthogonal to the well-explored SPACE-axis grids. Step1 (since-resize hard freeze): broad RAW gains sideways +0.061, bull +0.009 stab->1.0, rally raw +0.15 -- BUT rally STABILITY collapsed 0.732->0.427 (since-resize integer boundary + hold_prob>=0.5 threshold are noise-sensitive in rally bursts). Step2 (smoothly-decaying refractory band): recency term still a noise boundary, rally stab 0.31, sideways gain lost, raw_composite regressed. Step3 (deterministic bar_count%K phase gate, fully noise-immune): rally STAB->1.0 min_stability 0.91 BUT rally RAW DESTROYED -0.569 (phase-gating starves the position of resizes it needs to track genuine rally moves -> alpha hard-cutoff). CROSS-EXPERIMENT CONCLUSION (load-bearing): resize-FREQUENCY thinning is the SAME inseparable rally raw<->stability axis as re-entry timing -- raw-preserving thinning (since-resize counter) kills stability; noise-immune thinning (clock phase) kills raw. The grid keeps work ONLY because they quantize the resize LEVEL (space) while leaving resize FREQUENCY/TIMING untouched. CONFIRMED-WALL: any lever that changes WHEN/HOW-OFTEN rally resizes (vs WHAT VALUE it resizes to) is walled. Future rally-stability levers must preserve resize timing exactly and act only on the emitted position VALUE or the held-equity-path smoothing that does not gate emission frequency.
5e4c5d5c-session-summary	-	-	-	-	-	-	-	session-summary	session: 0 independent discards + 1 exploration branch (3 steps, REVERTED). Baseline 5e4c5d5c UNCHANGED 0.5711 [bull 0.753 stab0.975, crash 0.757 stab1.0, sideways 0.930 stab1.0, rally 0.306 raw0.418 STAB0.732 = SOLE binding constraint]. THEME: TIME-axis order-emission lever (churn-gated resize-frequency thinning) chosen orthogonal to the saturated SPACE-axis grids. Branch tested 3 freq-thinning variants, all DEAD ENDS along the SAME inseparable rally raw<->stability axis: (1) since-resize hard freeze -> broad raw gains (sideways +0.061, rally raw +0.15) but rally stab COLLAPSED 0.732->0.427; (2) decaying refractory band -> recency boundary still noise-sensitive, rally stab 0.31, sideways gain lost; (3) deterministic bar_count%K phase gate -> fully noise-immune (rally stab->1.0, min_stab 0.91) but rally RAW DESTROYED -0.569 (starves position of needed resizes). CONFIRMED-WALL (load-bearing): resize-FREQUENCY/TIMING thinning is walled identically to re-entry timing -- raw-preserving thinning kills stability, noise-immune thinning kills raw. The execution-layer grids work ONLY because they quantize the resize LEVEL (space) and leave emission frequency untouched. Future rally levers must preserve resize timing exactly and act on the emitted position VALUE or held-equity-path smoothing without gating emission frequency.
-	0.4638	0.6317	0.3359	0.78	0.76	0.93	0.06	discard	ARCHITECTURAL cross-sectional gross-exposure risk budget (NEW cross-symbol data dep: each symbol first-bar entry size attenuated by OTHER symbols aggregate gross/equity, tanh ramp max -25pct). Composite 0.4638 vs 0.5711 baseline. RALLY COLLAPSED 0.306->0.062 (stability 0.720->0.545, stab_factor 0.732->0.149) while rally RAW PRESERVED 0.418->0.414 + max_dd unchanged 1.857->1.851. bull +0.025 (0.753->0.778), crash/sideways FLAT. DIAGNOSIS: peer gross-exposure ratio is a PRICE-DERIVED noise-sensitive quantity (peers positions perturb under AR(1)); multiplying it into rally entry VALUE added the exact variance the wall warns against — cross-symbol entry-size coupling is walled IDENTICALLY to single-symbol entry-size variance. Raw preserved + stability killed = the classic rally wall signature. NOT branch-worthy (known-walled axis). NEW CONCLUSION: cross-sectional coupling at ENTRY-SIZE layer = same rally wall.
-	0.4690	0.6344	0.3307	0.77	0.76	0.93	0.07	discard	ARCHITECTURAL vol-expansion-gated first-bar entry size attenuator (NEW data dep: vol-of-vol 6bar/18bar realized vol, used only as EXIT pressure before; shrink entries up to 30pct when expansion>1.3x; DD-targeted Sharpe-neutral). Composite 0.4690 vs 0.5711. RALLY COLLAPSED 0.306->0.074 (stability 0.720->0.553, stab_factor 0.732->0.177). DECISIVE: rally RAW byte-identical 0.417980->0.417980 AND max_dd byte-identical 1.856851 -> attenuator INERT on clean rally path (vol6/vol18<1.3 at all clean entry bars) yet stability collapsed because PERTURBED runs cross the 1.3 threshold -> entry-size divergence -> TE up. CROSS-EXP CONCLUSION (with exp1): price-derived entry-size modulation WITH A THRESHOLD is walled for rally EVEN WHEN INERT on clean path; noise crosses the external threshold independently of the entry decision. Keep-family conv-margin attenuators are safe because they are functions of the ENTRY OWN conviction not an external price quantity. ENTRY-SIZE price-threshold axis = CONFIRMED WALLED.
-	0.4152	0.5895	0.3487	0.70	0.76	0.90	0.00	discard	ARCHITECTURAL geometric log-spaced lattice quantization at high-churn order-emission layer (grid points at ref*exp(k*0.12*churn_dz), constant RELATIVE spacing; replaces additive constant-absolute fine grid; same stable equity*BASE ref, integer-churn gated, resize-only). Composite -0.156 vs 5e4c5d5c 0.5711. crash FLAT 0.757, bull -0.057 (0.753->0.696 stab 0.792->0.771), sideways -0.025 (0.930->0.905). RALLY HARD-CUTOFF 0.306->0.000 (raw 0.418->0.000 clean sharpe<=0). FAILURE MECH: geometric lattice is COARSER at LARGE |target| and FINER at small — but rally DWELLS near full position and needs FINE resolution THERE to track genuine moves; coarse-at-dwell distorts directional alpha -> raw collapse. Mechanism is the INVERSE of rallys need (confirmed: additive uniform grid 0.06 is the delicate optimum; relative-spacing that coarsens the dwell point kills rally). Magnitude-adaptive resolution direction wrong; a finer log_step only re-approaches the additive grid. Not branch-eligible (no regime improved).
-	0.4180	0.5869	0.3377	0.75	0.75	0.84	0.01	discard	ARCHITECTURAL anchor scale-in full-position magnitude to entry-bar size (new _entry_size state; during bars 0-3 grow toward size-at-entry instead of per-bar-recomputed equity*BASE*combined_mult). Composite -0.153 vs 5e4c5d5c 0.5711. bull score FLAT 0.753->0.749 (stab IMPROVED 0.792->0.904 factor->1.0 BUT raw 0.773->0.749 OFFSETS), crash flat 0.757->0.754, sideways RAW -0.091 (0.930->0.839, anchor freezes adaptive sideways_boost that chop raw depends on), RALLY COLLAPSED 0.306->0.005 (raw 0.400 stab 0.720->0.504 factor 0.013). FAILURE MECH = CONFIRMED FREEZE-TRAP (10bfd268 'live per-bar size recompute AVERAGES OUT noise; freezing/lag is destabilizing'): anchoring locks the entry-bars single noise sample of combined_mult and propagates it across scale-in -> rally (frequent near-boundary entries) DIVERGES; live recompute averages it out. bull (fewer decisive entries) benefits but raw-offset. NOT branch-worthy: no clean per-regime score gain; gate-to-spare-rally via churn wouldnt recover sideways raw (sideways never-bursting -> still anchored -> still loses adaptive boost). Acting on emitted VALUE via FREEZE is walled; the value-axis lever must NOT lag/freeze a noisy reference.
-	0.0456	0.1733	0.2554	0.32	0.12	0.46	-0.22	discard	ARCHITECTURAL 3-bar MEDIAN resize filter at order-emission layer (rank-statistic value smoothing: target=median(prev2,prev1,raw) on same-sign resizes; new _target_hist state). Composite -0.525 vs 5e4c5d5c 0.5711 CATASTROPHIC. ALL regimes collapsed: bull 0.753->0.320 (MaxDD 1.25->4.40pct), crash 0.757->0.125 (MaxDD 0.73->4.39), sideways 0.930->0.465 (MaxDD 0.47->4.42), RALLY 0.306->-0.217 (raw NEGATIVE, stability 1.000 but sharpe<0). FAILURE MECH (two-fold): (1) DE-RISK LATCH — appending the POST-filter target to history means median([100,100,50])=100 SUPPRESSES de-risk for a bar, and the suppressed value re-enters history -> de-risk never fires until raw crosses for 2 consecutive bars -> MaxDD blows up to 4.4pct in EVERY regime (positions dont cut risk). (2) rally stability->1.000 confirms median fully removes noise sensitivity BUT raw goes NEGATIVE = SAME inseparable wall as slew-damper(row450)/freeze(exp2): noise-immune value-smoothing kills raw. Median is in the WALLED value-smoothing family (lag destroys responsiveness) AND its post-filter-feedback latches the de-risk path. Not branch-eligible (all regimes down). CONFIRMS: rank-statistic smoothing on emitted VALUE is walled like low-pass/freeze; rally stab 1.0 is achievable but ALWAYS at raw<0.
605fc1af	0.4463	0.5654	0.2382	0.72	0.79	0.58	0.17	branch	BRANCH OPEN: calm-gated EMA smoothing of fused exit pressure (architectural, new _exit_ema state; alpha=0.6 blend on exit_pressure for never-bursting symbols _cm<=2, SL-exempt). Composite -0.125 vs 5e4c5d5c 0.5711 BUT CRASH +0.030 (0.757->0.787 raw, stab 0.945->0.981, the FIRST positive per-regime signal in ~4 sessions) — CONFIRMS prior finding that smoothing the fused OUTPUT (not margins) filters dead-cat-bounce single-bar voter spikes that fire crash-short exits at adverse local lows. REGRESSIONS: sideways -0.354 (0.930->0.576, smoothing delays chop exits at THIS baseline's MAX-fusion stack), bull -0.029 (early-regime leak: cumulative-max starts 0 so smoothing fires before bull's first burst), rally -0.131 (same early-leak + price-path). (1) NEW ARCH: 2-bar EMA on fused exit_pressure scalar, calm-churn-gated, opp_gate reversal detection preserved (smooths output not margins -> avoids row-200 crash-margin trap). (2) REGRESSED: sideways (inseparable from crash in calm partition by churn alone) + bull/rally early-bar leak. (3) FIX HYPOTHESIS: isolate smoothing to the dead-cat-bounce SETUP = SHORT position in a sustained downtrend (tanh(-ret_long) * short-indicator). Fires for crash (shorts in downtrend) but NOT sideways (ret_long~0), NOT bull (longs), NOT rally (uptrend). If crash +0.030 holds with others flat -> composite ~0.578 KEEP.
