commit	score	mean_score	std_score	bull_2021	crash_bear	sideways	rally_2024	status	description
2c378642	0.775663	0.819238	0.145249	0.922586	0.730154	0.993310	0.630901	branch:noprogress	Branch step2 REMOVE own-vol x other-price boosts (Exp6 own-vol x partner-price, Exp7 own-vol x BTC-price). REGRESSED vs step1 b5d59fd1 0.776922: composite -0.001259 (0.775663, below baseline), raw_composite 0.776529 vs 0.776922 (no-progress). rally 0.634821->0.630901 (-0.003920 REGRESSED the binding regime, min_stability 0.799<0.80 knee -- rally stability_factor dropped), bull +0.000528, crash byte-identical. LESSON: own-vol x other-price boosts ARE load-bearing for rally (unlike step1's BTC-vol/partner-vol x other-price which were redundant-harmful). Distinction: OWN volume rising is a real participation signal; OTHER's volume is redundant with the price boosts. Reverted to step1. Branch no-progress count=1.
b22e82ad	0.773834	0.817844	0.146700	0.922132	0.730315	0.993049	0.625880	branch:noprogress	Branch step3 REMOVE other-symbol DVP boosts (BTC-DVP, partner-DVP), keep own-DVP. REGRESSED vs step1 b5d59fd1 0.776922: composite -0.003088 (0.773834, below baseline), raw_composite 0.775739 vs 0.776922 (no-progress). rally 0.634821->0.625880 (-0.008941 BIG regression, min_stability 0.797<0.80 knee), crash +0.000161. LESSON: BTC-DVP and partner-DVP ARE load-bearing for rally (directional volume of OTHER symbols is NOT redundant with their price -- DVP captures buy/sell-side balance the price-momentum gates miss). Only the Exp8/Exp9 OTHER-VOLUME-magnitude x other-price cells were redundant-harmful (step1). Reverted to step1. Branch no-progress count=2.
a974aeba	0.776751	0.819967	0.144051	0.922058	0.730154	0.993325	0.634330	branch:noprogress	Branch step4 REMOVE alt-pair-volume x BTC-price boost on BTC entries (BTC-side analog of step1). NEAR-FLAT vs step1 b5d59fd1 0.776922: composite -0.000171 (0.776751), raw_composite 0.776751 vs 0.776922 (no-progress, delta -0.000171). rally 0.634821->0.634330 (-0.000491 tiny regression), bull/sideways/crash near-identical, min_stability 0.800. LESSON: the BTC-side alt-pair-vol boost is marginally load-bearing (NOT redundant-harmful like step1's Exp8/9). Only Exp8/Exp9 (other-symbol VOLUME x third-symbol price on ALTS) were redundant-harmful. Reverted to step1. Branch no-progress count=3. Pruning direction tapped: step1 +0.000879 is the isolated gain (sub-keep +0.003 threshold); every other boost tested (Exp6/7 own-vol-other-price, BTC/partner-DVP, BTC-side alt-pair-vol) is load-bearing or neutral.
573e546b	0.775047	0.818716	0.145562	0.922082	0.730235	0.993111	0.629437	branch:noprogress	Branch step5 REMOVE Exp4 own-ret_vlong x BTC-trend conjunction boost. REGRESSED vs step1 b5d59fd1 0.776922: composite -0.001875 (0.775047), raw_composite 0.776132 vs 0.776922 (no-progress). rally 0.634821->0.629437 (-0.005384, min_stability 0.799<0.80 knee). LESSON: the own-trend x BTC-trend conjunction is load-bearing (NOT redundant with _xasset_boost -- the own ret_vlong adds independent signal beyond BTC-agreement). Reverted to step1. Branch no-progress count=4. CONFIRMED: only Exp8/Exp9 (other-symbol VOLUME magnitude x third-symbol price) are redundant-harmful; ALL other tested boosts (Exp4/6/7/BTC-DVP/partner-DVP/BTC-side-alt-pair-vol) are load-bearing. Step1 +0.000879 is the isolated ceiling of the pruning direction (sub-keep +0.003).
56496f00	0.776953	0.820122	0.143895	0.922151	0.730154	0.993320	0.634861	branch:noprogress	Branch step6 portfolio-DD-adaptive reduction of xasset alt-trend boost (after fixing _port_dd_frac NameError that zeroed trades on first attempt). INERT vs step1 b5d59fd1 0.776922: composite +0.000031 (0.776953, sub-noise), raw_composite 0.776953 vs 0.776922 (no-progress delta +0.000031). rally 0.634821->0.634861 (+0.000040 negligible, DD 6.24 unchanged). The xasset boost's contribution during DD episodes is too small for the 0.40 cut to move rally DD. LESSON: entry-side DD-adaptive boost cuts are inert (the boosts fire on broad-trend entries which are the desirable trend longs; cutting them during DD loses trend capture at little DD-relief gain -- unlike step1's removal of GENUINELY redundant boosts which was pure over-commit reduction). Reverted to step1. Branch no-progress count=5 (steps 2,3,4,5,6). NOTE: first step6 attempt had a NameError (_port_dd_frac used in entry branch but only defined in held-position branch) -> 0 trades -> -999; fixed by computing _port_dd_frac at bar top.
81009e95	0.775256	0.818860	0.145347	0.922132	0.730183	0.993039	0.630086	branch:noprogress	Branch step7 REMOVE Exp2 partner-alt lead-lag boost. REGRESSED vs step1 b5d59fd1 0.776922: composite -0.001666 (0.775256), raw_composite 0.776238 vs 0.776922 (no-progress). rally 0.634821->0.630086 (-0.004735, min_stability 0.799<0.80). LESSON: the partner-alt lead-lag (ETH leads SOL at 20-bar) is a genuinely INDEPENDENT signal (not redundant with the BTC 96-bar trend -- different leader, shorter timescale). Reverted to step1. Branch no-progress count=6 (steps 2,3,4,5,6,7). CONCLUSIVE: ONLY Exp8/Exp9 (other-symbol VOLUME MAGNITUDE x third-symbol price) are redundant-harmful; every other boost tested across 6 attempts is load-bearing. Step1 +0.000879 is the isolated ceiling of the entry-boost pruning direction, sub-keep (+0.003 threshold).
-	-	-	-	-	-	-	-	branch:discard	BRANCH DISCARD (entry-boost pruning, 7 steps, reverted to baseline 91c4496a). Direction: systematically remove redundant deep-saturated entry boosts from the {own,BTC,partner}x{vol,price,DVP} grid to reduce rally alt-entry over-commit (rally DD 6.36pct = the binding-regime DD source). STEP1 (remove Exp8 BTC-vol x partner-price + Exp9 partner-vol x BTC-price) = the ONLY gain: +0.000879 composite (rally 0.632->0.635 +0.0027, DD 6.36->6.24), SUB-KEEP below +0.003 threshold. STEPS 2-7 (6 consecutive no-progress): every other removal REGRESSED rally below the 0.80 stability knee -- Exp6/7 own-vol x other-price (-0.0039/-0.0047 wait step2 rally -0.0039), BTC-DVP/partner-DVP (-0.0089), Exp4 own-trend x BTC (-0.0054), partner-lead Exp2 (-0.0047), BTC-side alt-pair-vol (-0.0005 marginal), DD-adaptive xasset cut (inert +0.00003). CONCLUSIVE FINDING: ONLY the other-symbol VOLUME-MAGNITUDE x third-symbol-price cells (Exp8/9) are redundant-harmful; ALL other boosts are load-bearing (own-vol, other-symbol DVP, partner-lead, own-trend x BTC all carry independent signal). The +0.000879 step1 gain is sub-noise per the +0.003 keep threshold -> branch reverts (sub-noise improvements accumulate overfitting without meaningful signal). The entry-boost pruning direction is SATURATED. Cross-session: combined with this session's exp1/exp2 (stop + slope-against exit paths both BYTE-IDENTICAL inert on ct losers), the strategy is at a deeply saturated local optimum on BOTH exit (stop/slope inert; giveback/tp-harvest at cliffs) and entry (only 2 of ~12 boosts removable, sub-keep) sides.
-	-	-	-	-	-	-	-	session-summary	SESSION (baseline 91c4496a 0.776043 -> UNCHANGED, no keep): 3 independent architectural experiments + 1 exploration branch (7 steps, reverted). INDEPENDENT: exp1 counter-trend stop-loss tightening (BYTE-IDENTICAL inert -- ATR stop not binding for ct losers), exp2 counter-trend slope-against threshold cut (BYTE-IDENTICAL inert -- slope-against not binding for ct losers), exp3 remove 2 mixed-cell partner-volume boosts (+0.000879 sub-keep, rally +0.0027 -> opened branch). BRANCH (entry-boost pruning, 7 steps): step1 = the only gain (+0.000879, sub-keep); steps 2-7 = 6 consecutive no-progress (every other boost removal regressed rally below 0.80 stability knee). Branch reverted to baseline (sub-noise gain below +0.003 keep threshold). User 2-arch-discard minimum met (exp1+exp2 architectural discards, both inert). KEY STRUCTURAL FINDINGS (load-bearing for future): (1) EXIT SIDE SATURATED -- the ATR stop AND slope-against pressure are BOTH non-binding for ct losers in crash/rally (ct positions exit via time/giveback/opp-gate/de-risk first); giveback/tp-harvest at confirmed magnitude cliffs (prior session); 'hold longer backfires' (prior session). (2) ENTRY SIDE SATURATED -- only 2 of ~12 cross-symbol entry boosts are removable (Exp8/Exp9 = other-symbol VOLUME-MAGNITUDE x third-symbol price, redundant-harmful, +0.000879 sub-keep); ALL other boosts (own-vol x other-price, other-symbol DVP, partner-lead, own-trend x BTC) are LOAD-BEARING (independent signal: own-vol=participation, DVP=directional balance, partner-lead=shorter-timescale different leader). (3) The strategy sits at a deeply saturated local optimum on BOTH exit and entry sides; the only positive signal this session (Exp8/9 removal, +0.000879) is sub-noise. CROSS-EXPERIMENT CONCLUSION: the {own,BTC,partner}x{vol,price,DVP} entry-boost grid is fully explored -- the 2 redundant cells are identified, the rest are load-bearing; future sessions should NOT re-attempt entry-boost removal/pruning (saturated). NEXT SESSION: the return side (crash Sharpe via signal quality) remains the unmet objective -- but exp1/exp2 proved the exit stop/slope paths are inert on ct losers, and entry pruning is sub-keep, so the remaining avenue is a STRUCTURAL-EXPLORATION subsystem rewrite (exit-fusion MAX mechanism or voter-aggregation quintic-ramp strong-sum) per the structural-exploration mode (3+ architectural discards now met in-session eligibility, but a non-reverting core-mechanism replacement must be identifiable). Baseline 91c4496a 0.776043 unchanged and re-verified.
dfb319cc	0.776184	0.819685	0.145002	0.924400	0.733580	0.991418	0.629341	discard	Exp1 (architectural, indep): cross-symbol VOL-REGIME AGREEMENT entry shrink. NEW data dep (not in the saturated {own,BTC,partner}x{vol,price,DVP} volume-price grid): compare alt vol_ratio to BTC vol_ratio (_btc_vol_ratio precomputed once/bar, mirrors per-symbol vol_ratio scale). Alt volatile while BTC calm = idiosyncratic alt move (noise) -> shrink first-bar size up to 10pct. AGREEMENT (crash all-symbols-volatile-together) -> no shrink. Deep-sat /0.40 divergence, shrink-only safe family, BTC byte-identical. MEASURED vs 91c4496a 0.776043: composite +0.000141 (0.776184 SUB-NOISE <0.003), mean +0.000196 (0.819685), std +0.000182. PER-REGIME: bull 0.922090->0.924400 (+0.002310), crash 0.730154->0.733580 (+0.003426 -- agreement-spared broad-market bounces HELPED crash the return-limited regime), sideways 0.993544->0.991418 (-0.002126), rally 0.632168->0.629341 (-0.002827 -- raw 0.632569 +0.000401 BUT stability_factor 1.0->0.994897, min_stability 0.820->0.798 BELOW 0.80 knee). All flip 0, all MaxDD<10pct. DISCARD: composite sub-noise +0.000141 <0.003 threshold AND rally regressed below stability knee (entry-shrink introduced exit/entry-timing noise on rally grinding pullbacks = documented entry-shrink noise wall). Crash +0.0034 signal (agreement-spared broad-market sizing) noted but net not keepable. Reverted to 91c4496a.
a2abd692	0.776115	0.819600	0.144947	0.922090	0.730154	0.993976	0.632178	discard	Exp2 (architectural, indep): PEAK-STALL exit pressure (7th soft MAX source). NEW data dep: peak_pnl tracked but only MAGNITUDE used (giveback); TIME since last confirmed peak never read. A profitable winner whose peak has not made a new high for N bars has STALLED (consolidating at top, momentum died) -> harvest before consolidation breaks into giveback. Catches the gap _pp (giveback~0 on flat-top), _sl_slope (gentle plateau has positive slope), _time (total hold not since-peak) all miss. Vol-scaled activation (6+4*min(1,vol_ratio) bars), profit-side only, 0.45 cap. MEASURED vs 91c4496a 0.776043: composite +0.000072 (0.776115 NEAR-INERT SUB-NOISE), mean +0.000111, std -0.000127. PER-REGIME: bull BYTE-IDENTICAL 0.922090, crash BYTE-IDENTICAL 0.730154, sideways 0.993544->0.993976 (+0.000432), rally 0.632168->0.632178 (+0.000010 noise). raw_composite==composite (all stab 1.0, all raw==score, min_stab 0.807 above knee). All flip 0, all MaxDD<10pct. DISCARD: near-inert -- stall clock dominated by _pp (giveback fires first) and _sl_slope (slope-against fires first); winners either keep making new peaks (stall resets) or give back before stall activation crosses threshold. The gap it targeted is not a binding exit path. Reverted to 91c4496a.
637f5e53	0.779314	0.824581	0.150890	0.923316	0.730154	1.012687	0.632168	keep	KEEP (NEW BASELINE, SUPERSEDES 91c4496a 0.776043). Exp3 (architectural, indep): VOL-NORMALIZED time-pressure max_hold. NEW data dep in the time-pressure subsystem: max_hold (BAR units) was vol-blind -- 6 bars in calm sideways == 6 bars in crash, but 6 crash bars = a larger REAL price move (high vol) than 6 sideways bars, so time-pressure fired too fast in real-move terms in vol-spike periods, cutting winners before the bigger per-bar move fully played out. Scale max_hold UP with vol_ratio via continuous tanh on (vol_ratio-1)/0.5, max +12pct at vol_ratio>=1.5; calm (vol_ratio<1) gate floored at 0. Vol-normalized hold window (same amount of REAL price move before time-pressure fires). MEASURED vs 91c4496a 0.776043: composite +0.003271 (0.779314 CLEARS +0.003), mean +0.005092 (0.824581), std +0.005943 (0.150890 looser -- sideways pulling ahead). PER-REGIME all stab 1.0 all raw==score all MaxDD<10pct all flip 0: bull 0.922090->0.923316 (+0.001226, Sh1.934->1.936, DD3.71 unchanged), crash BYTE-IDENTICAL 0.730154 (Sh1.274 DD3.04 -- crash bounces exit via giveback/slope before time-pressure is binding, so extending max_hold does not change crash), sideways 0.993544->1.012687 (+0.019143 BINDING-GAIN -- Sh2.017->2.001, AnnRet 18.3->18.2pct, DD2.75 unchanged; sideways vol_ratio spikes above 1.0 during vol bursts (adaptive _target_vol_dyn blends 200-bar baseline) -> extension fires on those bursts -> vol-spike sideways winners held longer through the burst -> more mean-reversion capture; the vol-normalization is itself smooth+vol-correlated so it adds NO exit-timing noise, stability held 1.0), rally BYTE-IDENTICAL 0.632168 (Sh1.470 DD6.36 -- rally exits via DD-adaptive giveback-tightening before time-pressure binding). All keep criteria met: composite +0.003271>=+0.003, mean improved, no regime dropped >50pct (all improved or byte-identical), all MaxDD<10pct (max rally 6.36), all stability_factor 1.0, all flip_streak_gate 1.0. NEW BASELINE 0.779314. CROSS-EXPERIMENT: time-pressure is NON-BINDING for crash (exits via giveback/slope) and rally (exits via giveback-tightening) -- confirmed by their byte-identical results; it IS binding for sideways (low-vol mean-reversion winners held by time-pressure) where vol-normalization unlocks return. Observation (correlation only): sideways gain via longer vol-spike holds; direction-split PnL not measured.
66a31b70	0.779314	0.824581	0.150890	0.923316	0.730154	1.012687	0.632168	discard	Exp4 (architectural, indep): PROFIT-MAGNITUDE-AWARE slope-against threshold loosening. NEW data dep: _slope_thresh (vol-conditioned only) never read profit magnitude. Deep-profit winner (large peak_pnl cushion) tolerates looser slope-against threshold (minor slope wobble cannot threaten it) -> ride continuation (crash V-bounces return-limited). Loosen _slope_thresh UP max +30pct for deep profit; giveback path still cuts real reversals. Profit-gated (losers byte-identical). MEASURED vs 637f5e53 0.779314: BYTE-IDENTICAL (composite 0.779314 unchanged, all 4 regimes byte-identical incl MaxDD bull3.71 crash3.04 sideways2.75 rally6.36, all stab 1.0, all raw==score). DISCARD: the loosened threshold never changes the exit decision on deep-profit winners -- either slope-against stays below even the loosened threshold (deep-profit winners exit via giveback/time, not slope-against), or when slope-against is high enough the MAX fusion is dominated by giveback/other pressures anyway. Confirms slope-against is NON-BINDING for the binding regimes WINNERS too (extends prior session ct-LOSER inert finding to winners). The slope-against exit path is inert on the binding regimes entirely. Reverted to 637f5e53.
a27dbea0	0.779194	0.824409	0.150718	0.923029	0.730154	1.012283	0.632168	discard	Exp5 (architectural, indep): VOL-NORMALIZED time-pressure ramp SHAPE (offset+width). Extension of the vol-normalized max_hold CENTER (keep 637f5e53): the ramp pre-activation offset (+3.0) and width (/4.0) are also vol-blind bar units; scale both by _vol_hold_ext so the full ramp shape (center+offset+steepness) is vol-normalized. MEASURED vs 637f5e53 0.779314: composite -0.000120 (0.779194 SUB-NOISE REGRESSION), mean -0.000172, std -0.000172. PER-REGIME all stab 1.0 all raw==score: bull 0.923316->0.923029 (-0.000287), crash BYTE-IDENTICAL 0.730154, sideways 1.012687->1.012283 (-0.000404 -- wider vol-spike ramp = more gradual pressure build let sideways winners give back more before time-exit), rally BYTE-IDENTICAL 0.632168. All MaxDD<10pct. DISCARD: the ramp-SHAPE vol-normalization is mildly counterproductive -- the max_hold CENTER extension (keep 637f5e53) alone is the correct configuration; widening the ramp steepens-vs-widens tradeoff net lets giveback accumulate. Confirms the keep 637f5e53 center-only form is optimal. Reverted to 637f5e53.
9135a746	0.779314	0.824581	0.150890	0.923316	0.730154	1.012687	0.632168	discard	Exp6 (architectural, indep): CROSS-SYMBOL LEADER-DIVERGENCE exit pressure (loss-side only). NEW data dep at the EXIT decision: cross-symbol data (_btc_trend 96-bar leader, _alt_lead 20-bar partner) used ONLY at entry sizing today, never at exit. A LOSING position whose leader/partner momentum turned against the position direction is in a broad-market-against move -> cut loser faster. Loss-side only (sidesteps the documented rally-pullback-reverts-up wall -- a loser has no recovering upside to miss). Deep-sat /0.02 leader-trend scale, 0.35 cap, MAX fusion. MEASURED vs 637f5e53 0.779314: BYTE-IDENTICAL (composite 0.779314 unchanged, all 4 regimes byte-identical incl MaxDD, all stab 1.0, all raw==score). DISCARD: the binding regimes losers exit via time/giveback/opp-gate BEFORE the cross-symbol divergence pressure becomes the dominant MAX term -- adding another loss-side exit signal is inert. Extends the documented exit-path inertness to CROSS-SYMBOL loss-side signals (slope-against, ATR-stop, hard-TP, peak-stall, AND now cross-symbol divergence ALL inert on binding-regime losers). Cross-symbol info adds no incremental value at the EXIT decision (only at entry sizing). Reverted to 637f5e53.
04d013d1	0.779349	0.824617	0.150891	0.923611	0.730154	1.012533	0.632168	discard	Exp7 (architectural, indep): VOL-NORMALIZED cooldown recovery window. Same vol-blind bar-unit family as the max_hold keep 637f5e53: _cd_window is vol-blind (N bars cooldown = larger real move in vol-spike -> re-entry too fast in real-move terms -> re-entering into ongoing volatile burst is lower-quality). Scale _cd_window UP with vol_ratio (max +12pct, calm byte-identical). MEASURED vs 637f5e53 0.779314: composite +0.000035 (0.779349 SUB-NOISE <<0.003), mean +0.000036, std ~unchanged. PER-REGIME all stab 1.0 all raw==score: bull 0.923316->0.923611 (+0.000295), crash BYTE-IDENTICAL 0.730154, sideways 1.012687->1.012533 (-0.000154), rally BYTE-IDENTICAL 0.632168. All MaxDD<10pct. DISCARD: sub-noise -- cooldown vol-normalization lacks max_holds leverage: max_hold DIRECTLY closes sideways winners (binding exit path) so vol-normalizing it unlocked +0.019 sideways; cooldown only affects RE-ENTRY TIMING (second-order, and non-binding for crash/rally whose re-entry is unaffected). max_hold was the ONLY bar-unit parameter where vol-blindness mattered substantially -- the vol-blindness vein is now fully tapped (max_hold center=keep, ramp-shape=regression, cooldown=sub-noise). Reverted to 637f5e53.
101048ef	0.776966	0.821401	0.148118	0.915349	0.730154	1.007934	0.632168	discard	Exp8 (architectural, indep): VOL-NORMALIZED scale-in pace. Last bar-unit vol-blind parameter (same family as max_hold keep 637f5e53): _entry_full_bars_dyn (scale-in window, bar units) is trend-conditioned but vol-blind. In vol-spike, N scale-in bars = larger real move -> full size reached in bigger move -> bigger early exposure before confirmation -> pullback giveback (faster-scale-in-hurts-rally in real-move terms). Scale window UP with vol_ratio (vol-normalized pace, smaller early exposure in volatile periods). MEASURED vs 637f5e53 0.779314: composite -0.002348 (0.776966 REGRESSION), mean -0.003180 (0.821401), std -0.002772. PER-REGIME all stab 1.0 all raw==score: bull 0.923316->0.915349 (-0.007967), crash BYTE-IDENTICAL 0.730154, sideways 1.012687->1.007934 (-0.004753), rally BYTE-IDENTICAL 0.632168. All MaxDD<10pct. DISCARD: lengthening vol-spike scale-in HURT -- slower buildup missed trend capture (bull/sideways winners built too slowly), outweighing the giveback-protection hypothesis. Scale-in pace is delicately tuned (prior sessions); vol-normalizing either direction hurts. CONFIRMS max_hold (time-pressure CENTER) was the UNIQUE bar-unit parameter where vol-blindness mattered beneficially -- it directly closes sideways winners (binding exit), while scale-in/cooldown/ramp-shape vol-normalization is either inert or counterproductive. The vol-blindness vein is fully exhausted. Reverted to 637f5e53.
