commit	score	mean_score	std_score	bull_2021	crash_bear	sideways	rally_2024	status	description
3902e2d6	-0.006005	0.118571	0.249153	0.19	0.15	0.41	-0.28	discard	Exp1 (architectural, indep): winner-pyramiding for established trend-aligned profitable positions (grow up to 1.35x beyond full size via fast-saturating pos_dir*ret_vlong/0.01 align gate * deep-profit tanh). MEASURED vs 8e5a77da 0.713355: composite -0.006005 (-0.719), mean 0.788490->0.118571, all regimes collapsed. max_dd EXPLODED every regime: bull 1.25->4.42, crash 0.67->4.64, sideways 0.45->4.62, rally 1.83->5.05. Sharpe: bull 1.59->0.56, crash 1.27->0.25, sideways 1.94->1.39, rally 1.15->-0.28. sideways NOT spared (raw 1.013->0.457) despite supposed ret_vlong~0 — the /0.01 fast-sat gate saturates ~everywhere (2023 has multi-week drifts that read as trend at 96-bar scale), so pyramiding adds max exposure near local tops -> DD explosion across ALL regimes. No bright spot anywhere; NOT branch-eligible. Mechanism net-negative in this harness.
3669216b	0.713355	0.788490	0.150270	0.79	0.76	1.01	0.59	discard	Exp2 (architectural, indep): portfolio equity-vol-target overlay, shrink-only first-bar size (new per-strategy _equity_hist state + closed-loop equity-curve feedback: fast24/slow120 equity-return-std ratio -> tanh shrink to 0.70x floor). MEASURED vs 8e5a77da 0.713355: BYTE-IDENTICAL all 4 regimes (composite 0.713355, every raw unchanged). FINDING: equity-vol bursts and entry events are temporally DISJOINT — when realized equity-vol spikes, price-vol is also high so existing price-vol entry gates already block entries; when entries fire, equity is calm so mult~1.0. Redundant with price-vol entry gating. NOT branch-eligible (0 positive regime delta; redirect to de-risk existing positions overlaps _port_dd_atten circuit breaker already present).
51129b13	0.702269	0.781573	0.158608	0.79	0.76	1.01	0.57	discard	Exp3 (architectural, indep): never-burst cumulative-churn admission relaxation (strong_min *= 0.94 when cumulative-max churn<=2, same _calm_gate signal). MEASURED vs 8e5a77da 0.713355: composite 0.702269 (-0.011), mean 0.788490->0.781573. crash 0.755319->0.755352 (+0.00003 FLAT, trades 45->45) + sideways 1.013297->1.012749 (-0.0005 FLAT, trades 49->49) = NO marginal entries exist near the threshold in calm regimes to admit (signal-starved at margin; lowering thresh 6% admits ~0 trades). rally REGRESSED 0.591867->0.566196 (-0.026, trades 95->98, Sharpe 1.15->1.08): cumulative-max gate does NOT spare rally EARLY (before its first burst cumulative-max<=2 -> relaxation fired on early rally entries, admitting 3 low-quality trades). bull 0.793478->0.791993. FINDING: sub-50 calm regimes are sample-LIMITED by genuine signal scarcity not threshold height; relaxing admission only hurts the over-trading regime. NOT branch-eligible (0 positive regime delta; premise falsified).
45359249	0.714306	0.789397	0.150182	0.80	0.76	1.01	0.59	keep	KEEP (NEW BASELINE, SUPERSEDES 8e5a77da 0.713355). Exp4 (architectural, indep): portfolio same-direction GROSS-EXPOSURE governor on first-bar entry size (new cross-symbol data dep: sum same-sign notional across OTHER symbols / equity -> tanh shrink, floor 0.65x, CONC_EXP_FLOOR=0.05 SCALE=0.06 MAX_SHRINK=0.35). MEASURED vs 8e5a77da 0.713355: composite +0.000951 (0.714306), mean +0.000907 (0.789397), std 0.150270->0.150182. PER-REGIME: bull 0.793478->0.796736 (+0.00326, Sh 1.593->1.60), rally 0.591867->0.592237 (+0.00037), crash 0.755319 + sideways 1.013297 BYTE-IDENTICAL (their entries temporally spread -> ~0 concurrent same-dir exposure -> governor inert there). All max_dd ~unchanged (bull 1.250->1.250, rally 1.832->1.832): gain is from Sharpe/variance on bull correlated-pile-up legs, NOT DD reduction (hypothesis partially wrong on mechanism — bull not rally was the beneficiary). All stability factors remain 1.0 (bull stab 0.806, rally 0.804 still above 0.80 knee). All keep criteria met.
5a79ab80	0.724108	0.800103	0.151989	0.84	0.76	1.01	0.59	keep	KEEP (NEW BASELINE, SUPERSEDES 45359249 0.714306). Exp5 (architectural, indep): sustain Exp4 concentration shrink through scale-in (cache entry-time _conc_shrink at entry, apply to scale-in full_target so concentrated book stays proportionally smaller whole hold instead of ramping back to un-shrunk size after bar1). MEASURED vs 45359249 0.714306: composite +0.009802 (0.724108), mean +0.010706 (0.800103), raw_composite 0.714306->0.742724. PER-REGIME: bull TRANSFORMED raw 0.796736->0.938257 (+0.1415, Sharpe 1.60->1.92, DD 1.25->0.89, trades 43->47) — sustaining the concentration reduction cut bull DD/variance dramatically; bull final 0.796736->0.839923 (+0.0432). crash 0.755319 + sideways 1.013297 BYTE-IDENTICAL. rally 0.592237->0.591873 (~flat). CAVEAT: bull stability 0.806->0.769 (below 0.80 knee) -> stability_factor 0.895 penalty, so bull final 0.840 captures only part of the 0.938 raw. All keep criteria met (composite+mean up, no regime down >50%, max_dd<10% [rally 1.70%]). Branch opportunity: recover bull stability to capture more of 0.938 raw.
-	0.724108	0.800103	0.151989	0.84	0.76	1.01	0.59	discard	BRANCH SUMMARY (recover-bull-stability, 4 steps, REVERTED to 5a79ab80 Exp5 keep 0.724108). Branch goal: bull raw 0.938 only partly realized (final 0.840) because Exp5 dropped bull stability 0.806->0.769 (factor 0.895). Steps: (1) quantize cached held-shrink to 0.05 grid -> INERT (bull stab 0.769->0.769, composite 0.724078); (2) snap held-shrink to {1.0,deep} via wide deadzone -> bull stab 0.766 WORSE, composite 0.722843; (3) graduated held-depth 0.5 -> bull stab RECOVERED 0.797 but raw COLLAPSED 0.938->0.794 (final 0.786), composite 0.712305; (4) depth 0.85 -> raw 0.818 stab 0.783 final 0.771, composite 0.708929. MAPPED CURVE: bull raw/stability are coupled through sustained-shrink DEPTH; final score vs depth is NON-MONOTONIC with a sharp jump 0.85->1.0 (raw 0.818->0.938) -> FULL depth (Exp5 keep) is OPTIMAL; the 0.895 stability penalty at full depth is over-compensated by the raw surge. CONCLUSION: Exp5 full-depth held-shrink sits at the best point on the depth axis; discretizing the shrink VALUE (steps 1-2) cannot decouple raw from stability. All 4 steps below the 0.724108 keep. Baseline 5a79ab80 UNCHANGED 0.724108.
5a79ab80	0.724108	0.800103	0.151989	0.84	0.76	1.01	0.59	session-summary	SESSION: 3 independent architectural discards (Exp1,2,3) + 2 independent architectural KEEPS (Exp4,5) + 1 exploration branch (4 steps, REVERTED). NEW BASELINE 5a79ab80 0.724108 SUPERSEDES 8e5a77da 0.713355 (+0.010753 composite, +0.011613 mean 0.788490->0.800103, std 0.150270->0.151989). KEEPS: Exp4 portfolio same-direction GROSS-EXPOSURE governor (sum same-sign notional across OTHER symbols/equity -> tanh first-bar shrink floor 0.65x) -> bull +0.0033 via correlated-leg variance reduction (crash/sideways byte-identical: entries temporally spread; rally ~flat); Exp5 SUSTAIN that shrink through scale-in (cache at entry, apply to full_target) -> bull raw TRANSFORMED 0.797->0.938 (Sh 1.60->1.92, DD 1.25->0.89), bull final 0.840 (stability 0.806->0.769 incurs 0.895 factor). LOAD-BEARING/MECHANISM FINDINGS: (1) strategy at TIGHT exposure optimum — Exp1 any size INCREASE (winner-pyramiding 1.35x) caused UNIFORM DD explosion all 4 regimes (max_dd 3-10x, composite -0.72); (2) Exp2 equity-vol-target overlay BYTE-IDENTICAL inert (equity-vol bursts temporally DISJOINT from entries; redundant w/ price-vol gates); (3) Exp3 calm-admission relaxation: sub-50-knee regimes (bull43/crash45/sideways49) are sample-LIMITED by genuine signal scarcity NOT threshold height — relaxing admits 0 calm trades, only hurt over-trading rally; (4) concentration-shrink raw-gain vs bull-stability are COUPLED through sustained DEPTH, final-vs-depth NON-MONOTONIC, FULL depth optimal (branch mapped 0.5/0.85/1.0 -> finals 0.786/0.771/0.840). bull stability 0.769 + rally 0.834 + sideways 0.858 above/near 0.80 knee; crash stab 0.965.
8c6cd8c8	0.719771	0.795176	0.150810	0.82	0.76	1.01	0.59	branch	BRANCH OPEN (per-voter predictive-skill weighting, architectural). NEW MECHANISM: weight each voter by realized magnitude-weighted next-bar-return agreement over rolling 25-bar buffer, skill in [-1,1] -> mult [0.7,1.3]. Orthogonal to _persistence_mult (sign-consistency). MEASURED vs baseline 5a79ab80 0.724108: composite 0.719771 (-0.0043), mean 0.795176 (-0.0049). bull stability 0.768559->1.0 (factor 0.895->1.0, ELIMINATED only penalty in strategy, min_stability 0.769->0.839) BUT bull raw 0.938257->0.820695 (-0.1176, DD 0.886->1.126), net bull 0.839923->0.820695. crash 0.755361 (+0.00004), sideways 1.012842 (-0.0005), rally 0.591806 (-0.0001) ~flat. Branch goal: capture bull stability gain at lower bull raw cost via gentler/asymmetric skill weight.
5a79ab80	0.724108	0.800103	0.151989	0.84	0.76	1.01	0.59	discard	BRANCH SUMMARY (per-voter predictive-skill weighting, 6 steps, REVERTED to 5a79ab80; strategy.py byte-identical, reproduces composite 0.724108 / bull 0.839923 / min_stability 0.768559). NEW MECHANISM: weight each voter by realized magnitude-weighted next-bar-return agreement over rolling window (skill in [-1,1]), distinct from _persistence_mult (sign-consistency). MEASURED frontier (all variants INERT on crash 0.7553/sideways 1.013/rally 0.5919 — 4th confirmation those regimes are voter-saturated, reweighting cannot change decisive votes): rescale [0.85,1.15] amp0.15 -> bull raw 0.938->0.823 (DD 0.886->1.112), stab 0.769->1.0, bull net 0.840->0.823, composite 0.720; mean-preserving (normalize mult to mean 1.0) amp0.15 -> bull raw 0.938 PRESERVED but stab 0.769->0.690 (ADDS noise to identical trade set), bull net 0.647, composite 0.664; rescale amp0.06 -> bull raw 0.823 (same), stab 0.910, net 0.749, composite 0.702; 60-bar window amp0.15 -> bull raw 0.823 IDENTICAL to 25-bar (DD 1.112). CONCLUSION: bull raw drop to 0.823 is a near STEP-function robust to amplitude (0.06-0.30) AND window (25-60) = deterministic trade-set change (DD 0.886->1.112), not tunable noise. Rescale's stab lift to 1.0 is INCIDENTAL to a higher-DD trade set (not genuine same-trade noise-robustness); mean-preserving redistribution alone HURTS stability. Entire raw/stab frontier DOMINATED by baseline bull net 0.840. No keep criteria met (composite/mean down).
5a79ab80	0.724108	0.800103	0.151989	0.84	0.76	1.01	0.59	session-summary	SESSION: 1 independent architectural experiment (Exp1 = branch-open, immediately branch-eligible: new mechanism + bull stability improved 0.769->1.0) + 1 exploration branch (6 steps, REVERTED). Baseline 5a79ab80 UNCHANGED 0.724108 [bull 0.839923 raw 0.938257 stab 0.768559 (SOLE penalty in strategy, factor 0.895), crash 0.755319 stab 1.0, sideways 1.013297 stab 1.0, rally 0.591873 raw0.592 stab 1.0 = lowest score/binding raw constraint]. THEME: per-voter PREDICTIVE-SKILL weighting (weight voters by realized forward-return hit rate, orthogonal to existing persistence=sign-consistency weighting), targeting bull stability (documented #1 branch opportunity, raw 0.938 only 0.840-realized at factor 0.895). NEW LOAD-BEARING/MECHANISM FINDINGS: (1) skill-reweighting is INERT on crash/sideways/rally (4th independent confirmation these regimes are voter-SATURATED — their decisive votes do not change under any voter reweighting; matches prior calm-admission-relaxation and dispersion-transform inertness findings); (2) on bull the mechanism traces a raw/stability FRONTIER both of whose endpoints are DOMINATED by baseline: rescale form drops bull raw 0.938->0.823 as a near STEP-function (robust to amplitude 0.06-0.30 AND window 25-60 -> deterministic trade-set change raising DD 0.886->1.112, NOT tunable noise) while lifting stab to 1.0; mean-preserving form keeps bull's exact trade set (raw 0.938) but ADDS noise -> stab 0.769->0.690. KEY: bull's stability-factor penalty (0.895) is NOT reachable by voter reweighting — the stab lift only appears alongside a different higher-DD trade set that costs more raw than the factor saves. CROSS-EXPERIMENT: confirms the strategy sits at a tight bull raw/DD optimum (consistent with prior session winner-pyramiding DD-explosion finding); bull stability 0.769 is structurally coupled to bull's high-Sharpe/low-DD trade set and cannot be decoupled by reweighting voters. Branch concluded; session ends per one-branch-per-session rule.
4671025a	0.337289	0.462354	0.250131	0.38	0.68	0.70	0.09	discard	Exp1 (architectural): extend emitted-target EMA to TREND-ALIGNED positions via base alpha (TE_BASE_ALPHA=0.30; alpha=0.30+0.69*ct_str, was 0.99*ct_str -> 0 for trend-aligned). MEASURED vs 5a79ab80 0.724108: composite 0.724108->0.337289 (-0.387), mean 0.800103->0.462354, raw_composite ->0.424587. CATASTROPHIC: bull 0.839923->0.384617 (raw 0.938257->0.384617 -0.554, stab 0.768559->1.0 factor 0.895->1.0 BUT raw collapse dwarfs factor gain), rally 0.591873->0.086743 (raw 0.592->0.279, STABILITY 1.0->0.310861 factor 1.0->0.311), crash 0.755->0.675, sideways 1.013->0.703 (stab 1.0->0.934). CONCLUSION: smoothing trend-aligned (strong-trend) held levels is fundamentally different from ct (noisy pullback) smoothing - trend-aligned level IS the signal, EMA lag destroys raw faster than stability lifts. Even clearing bulls 0.80 knee (factor 0.895->1.0, +0.098 potential) costs -0.554 raw = net catastrophic. Confirms+extends prior-session finding: bull stability 0.769 coupling to trade set extends to LEVEL-smoothing too, not just voter reweighting. No alpha can clear the knee without destroying raw (frontier dominated, same as shrink-depth branch row 762). NOT branched: cannot articulate a fix path (smaller alpha wont clear 0.80 knee). Bull-stability lever dead via held-level smoothing.
4b8d0162	0.721732	0.796797	0.150129	0.82	0.76	1.01	0.59	branch	BRANCH OPEN (collapse 3-stage ct EMA pipeline to terminal emitted-target EMA only; architectural simplification). Removed exit-pressure EMA (on _soft_max) + voter_bias EMA (on _voter_bias), both alpha0.5 ct-gated; kept terminal emitted-target EMA (alpha0.99 ct, fast-sat). MEASURED vs 5a79ab80 0.724108: composite 0.724108->0.721732 (-0.0024), mean 0.800103->0.796797, raw_composite 0.742724->0.743945 (+0.0012). rally 0.591873->0.594731 (raw 0.592->0.594 +0.003, stab 1.0 - binding constraint IMPROVED: terminal EMA subsumes upstream for rally, less double-smoothing lag). bull 0.839923->0.823840 (raw 0.938257 UNCHANGED, stab factor 0.895->0.878 - REGRESSED: bull ct-shorts lost upstream exit-SIGNAL smoothing). crash 0.755319 + sideways 1.013297 BYTE-IDENTICAL (ct-gate spares). KEY: upstream EMAs smooth exit-pressure SIGNAL before max/threshold crossing (changes WHICH bar exit fires); terminal level-EMA smooths emitted LEVEL after (cant un-fire an exit) = NOT substitutable for bull shorts. JUSTIFICATION: (1) simplification collapses EMA pipeline; (2) bull regressed via ct-short exit-timing lost; (3) FIX step2=re-add ONLY exit-pressure EMA (dominant _soft_max signal, load-bearing for bull timing) keep voter_bias EMA removed (smaller additive term, likely redundant) -> recover bull, keep rally gain + partial simplification.
15bbb2ba	0.725520	0.801057	0.151075	0.84	0.76	1.01	0.59	keep	KEEP (NEW BASELINE, SUPERSEDES 5a79ab80 0.724108). Branch step3: remove ONLY exit-pressure EMA (on _soft_max), KEEP voter_bias EMA (on additive _voter_bias). Architectural simplification - removes one per-symbol EMA state + control-flow branch. MEASURED vs 5a79ab80 0.724108: composite 0.724108->0.725520 (+0.001412), mean 0.800103->0.801057 (+0.000954), std 0.151989->0.151075 (-0.000914), raw_composite 0.742724->0.743945 (+0.001221). PER-REGIME: rally 0.591873->0.594731 (raw 0.592->0.594731 +0.002858, stab 1.0, Sharpe 1.14; the binding/lowest regime IMPROVED - exit-pressure EMA was redundant given terminal emitted-target EMA alpha0.99 which subsumes _soft_max smoothing at stronger alpha+terminal point; removing it cut double-smoothing lag on rally ct shorts). bull 0.839923->0.840883 (raw 0.938257 UNCHANGED, stab factor 0.895->0.896 +0.001; voter_bias EMA kept = bull ct-short exit timing preserved). crash 0.755319 + sideways 1.013297 BYTE-IDENTICAL (ct-gate spares trend-aligned). MaxDD bull0.89/crash0.67/sideways0.45/rally1.70 all<10pct. flip_count 0 all. DIAGNOSIS (measured across branch steps): step1 remove BOTH EMAs -> rally +0.003 (exit-pressure redundant) BUT bull -0.016 (voter_bias load-bearing); step2 re-add exit-pressure keep voter_bias removed -> rally gain vanished + bull still regressed; step3 remove exit-pressure keep voter_bias -> rally gain captured + bull held. The two upstream EMAs have OPPOSITE value: exit-pressure EMA net-negative (redundant, removing helps rally), voter_bias EMA net-positive (load-bearing for bull ct-short exit timing - smooths additive voter_bias term before max/threshold, not substitutable by terminal level-EMA). All keep criteria met. NEW BASELINE 0.725520.
15bbb2ba	0.725520	0.801057	0.151075	0.84	0.76	1.01	0.59	session-summary	SESSION: 1 independent architectural discard (Exp1) + 1 exploration branch (Exp2 open -> 3 steps, KEPT). NEW BASELINE 15bbb2ba 0.725520 (SUPERSEDES 5a79ab80 0.724108, +0.001412). [bull 0.840883 raw0.938257 stab0.768865 factor0.896 (SOLE penalty, unchanged), crash 0.755319 stab1.0, sideways 1.013297 stab1.0, rally 0.594731 raw0.594731 stab1.0 (binding/lowest, +0.0029)]. Exp1 discard (architectural): extend emitted-target EMA to trend-aligned positions via base alpha 0.30 - CATASTROPHIC (composite 0.724->0.337); smoothing trend-aligned (strong-trend) held levels destroys raw (bull 0.938->0.385) faster than stability lifts - confirms+extends prior-session finding that bull stability 0.769 is structurally coupled to its high-Sharpe/low-DD trade set, NOT decouplable by level-smoothing either (only voter reweighting was proven before). Bull-stability lever dead via held-level smoothing. Exp2 BRANCH (EMA-pipeline simplification): tested whether the two upstream ct-gated EMAs (exit-pressure on _soft_max alpha0.5, voter_bias on _voter_bias alpha0.5) are redundant given the terminal emitted-target EMA was strengthened to alpha0.99+fast-sat (8e5a77da) AFTER they were added. Branch steps isolated OPPOSITE value: exit-pressure EMA is NET-NEGATIVE/REDUNDANT (terminal level-EMA subsumes _soft_max smoothing at stronger alpha+terminal point; removing it cuts double-smoothing lag -> rally +0.0029, bull neutral); voter_bias EMA is NET-POSITIVE/LOAD-BEARING for bull (smooths additive voter_bias term before max/threshold crossing, not substitutable by terminal level-EMA which smooths AFTER and cant un-fire exits; removing costs bull -0.016). KEEP (step3): remove ONLY exit-pressure EMA, keep voter_bias EMA -> rally gain captured + bull held = simplification keep (removes one EMA state + branch, better OOS generalization). CROSS-EXPERIMENT LOAD-BEARING FINDING: of the three cascaded ct smoothing stages (exit-pressure EMA, voter_bias EMA, terminal emitted-target EMA), the terminal alpha0.99 stage subsumes the exit-pressure stage but NOT the voter_bias stage (voter_bias smooths an additive signal-term pre-threshold, a functionally distinct role from post-decision level-smoothing). crash/sideways remain voter/behavior-saturated (byte-identical across all branch steps). Branch concluded (KEEP) -> session ends per one-branch-per-session rule.
ea799e38	0.725520	0.801003	0.150966	0.84	0.76	1.01	0.59	discard	Exp1 (architectural, indep): cross-symbol SHORT-WINDOW (8-bar) momentum-confirmation gate on first-bar entry size (new cross-symbol data dep: other symbols price-momentum sign-agree in [-2,+2], distinct from BTC slow 96-bar trend and from open-position notional). Shrink-only XMOM_MAX_SHRINK=0.20 on opposed side. MEASURED vs 15bbb2ba 0.725520: composite FLAT 0.725520 (+0.000000), mean 0.801057->0.801003 (-0.000054), std 0.151075->0.150966. bull 0.840883->0.841012 (raw 0.938257->0.938460 +0.0002 noise-scale), rally 0.594731->0.594724 (FLAT), crash+sideways BYTE-IDENTICAL. INERT: most entries already fire when cross-symbol momentum agrees (correlated regimes), so the gate rarely shrinks meaningfully; where it fires the size delta is too small to move Sharpe. Confirms cross-symbol short-momentum is redundant with existing _btc_trend+_conc_shrink+_xasset confirmation channels at this baseline. No regime signal -> not branched.
bq724os0	0.743083	0.828724	0.171281	0.91	0.80	1.04	0.57	branch	BRANCH OPEN (convex de-risk ramp, architectural). New mechanism: replace linear de-risk ramp (1-x) with convex (1 - x^k) where k=1+0.6*max(0,_pnl_scale) (1.0 loss, up to 1.6 deep profit). Holds near full size through mid-range exit pressure (absorbing giveback/slope noise) then cuts sharply at saturation. MEASURED vs baseline 15bbb2ba 0.725520: composite 0.725520->0.743083 (+0.0176), mean 0.801057->0.828724 (+0.0277), raw_composite 0.743945->0.743083 (-0.0009), std 0.151075->0.171281. ELIMINATED bull stability penalty (the SOLE penalty): bull stab 0.768865->0.834158 factor 0.896->1.0, bull 0.840883->0.905310 (+0.064, raw 0.938->0.905 -0.033 BUT factor gain dominates). crash 0.755->0.803 (+0.048), sideways 1.013->1.037 (+0.024). REGRESSION: rally 0.594731->0.569338 (-0.025, raw 0.595->0.569, Sharpe 1.14->1.07, trades 91->93) = convex cushion holds rally winners longer through chop giveback, they reverse and lose more. MaxDD all <2pct (rally 1.81). JUSTIFICATION: (1) new exit-decision function shape; (2) rally regressed via winners held through choppy giveback; (3) FIX step2 = trend-strength-gate the convex amp (strong cushion in clean trends bull/crash, weak/zero in rally chop) so trend-aligned winners keep cushion, rally choppy positions revert to near-linear fast cut. Target: keep bull/crash/sideways gains, recover rally to >=0.595.
