commit	score	mean_score	std_score	bull_2021	crash_bear	sideways	rally_2024	status	description
af42db4c	0.689311	0.754748	0.218125	0.961878	0.729861	1.011417	0.662116	0.408468	discard	Exp3 architectural indep: PROFIT-PLATEAU scale-in freeze. NEW control-flow dep at the scale-in decision, routed through the scale_frac multiplier (NOT a new MAX-fusion exit source -- prior peak-stall EXIT sources were walled under MAX-fusion, a2abd692/83ffa0a). When a WINNING position pos_pnl has STALLED (declined from its recent local peak during the scale-in window), freeze further scale-in: a stalling winner (trend fading) should not grow bigger. Uses _pnl_path (already maintained for emission throttle, baseline 1d764b9f) to compute recent local peak over last <=6 bars; giveback-from-peak >0.30 triggers freeze (max 0.40). Byte-identical when losing or at recent peak. MEASURED vs 1d764b9f 0.689311: BYTE-IDENTICAL (composite 0.689311, mean 0.754748, std 0.218125, all 5 regimes identical, all stab 1.0 raw==score, min_stab 0.844713). FAILURE MECH (architectural fact, direct measurement): the freeze NEVER fired -- structurally inert by construction. The scale-in window (bars_held <= _entry_full_bars_dyn = 2-3 bars) is too short for pos_pnl to peak-then-stall: _pnl_path has at most 2-3 entries during scale-in, and the giveback-from-recent-peak >0.30 condition requires the position to have first risen to a peak THEN given back 30pct of that peak -- impossible within 2-3 bars. EXTENDS the documented scale-in-window-too-short-for-stateful-signals wall (the 2-3 bar pace prior sessions tuned leaves no room for plateau-detection state to bind). Not branch-eligible (byte-identical = zero regime delta; mechanism structurally inert not fixable). 3rd architectural discard.
94501f16	0.685896	0.752418	0.221739	0.961995	0.729861	1.011232	0.661870	0.397134	discard	Exp4 architectural simplification indep: REMOVE the two MIXED-cell boosts (Exp8 BTC-vol x partner-price, Exp9 partner-vol x BTC-price). Prior session 5b1af270 measured these combined as sub-noise -0.000025 (microscopically load-bearing, double-count clean 2-way keeps). Re-tested at current baseline 1d764b9f for simplification value (removes 2 multipliers +~26 LOC). MEASURED vs 1d764b9f 0.689311: composite -0.003415 (0.685896 FAIL), mean -0.002330 (0.752418 FAIL), std 0.218125->0.221739. PER-REGIME all stab 1.0 raw==score: bull 0.961878->0.961995 (+0.000117 micro), crash BYTE-IDENTICAL 0.729861, sideways 1.011417->1.011232 (-0.000185 micro), rally 0.662116->0.661870 (-0.000246 micro), mixed 0.408468->0.397134 (-0.011334 REGRESSED -- the binding lowest regime). FAILURE MECH (direct measurement): the mixed-cell boosts are NOT redundant at the current baseline -- mixed regressed -0.0113 (the BTC-vol x partner-price and partner-vol x BTC-price conjunctions DO add signal on mixed alt entries now). CROSS-EXPERIMENT INSIGHT: prior session 5b1af270 measured these as sub-noise -0.000025 at an older baseline, but the strategy EVOLVED (mixed_2025 added as 5th regime + subsequent keeps) so mixed alt entries now depend on the mixed-cell conjunctions. A component documented sub-noise in a prior session can become load-bearing as the baseline shifts -- simplification removals must be RE-TESTED not assumed. Not branch-eligible (composite -0.0034 fails keep gate negatively, mean -0.0023 fails, mixed target regressed -0.011; no positive regime signal to build on -- bull/crash flat, all others down). 4th architectural discard.
7e62d512	0.690908	0.755730	0.216075	0.961642	0.729861	1.011425	0.660457	0.415265	branch	Exp5 architectural indep (BRANCH OPEN): PARTNER-alt-DVP x BTC-leader-VOLUME-RISE conjunction boost on ALT entries -- last missing cell of the {own,BTC,partner}x{vol,price,DVP} 3-way grid. Builds on Exp4 finding (mixed-cell breadth boosts are load-bearing on mixed at current baseline). partner buy/sell-side volume pressure x BTC leader volume-participation rise. Deep-saturated both gates (/0.15 partner DVP, /0.30 BTC vol). First-bar-only +0.05 max. MEASURED vs 1d764b9f 0.689311: composite +0.001597 SUB-NOISE (below +0.003 keep), mean +0.000982 (0.755730 improved), std 0.218125->0.216075 (tighter). PER-REGIME all stab 1.0 raw==score all DD<10pct all flip 0: bull 0.961878->0.961642 (-0.000236 micro), crash BYTE-IDENTICAL 0.729861, sideways 1.011417->1.011425 (+0.000008 micro), rally 0.662116->0.660457 (-0.001659 small regression), mixed 0.408468->0.415265 (+0.006797 TARGET LOWEST REGIME GAINED). BRANCH JUSTIFICATION: (1) new architecture = partnerdvp x btcvol conjunction (last DVP-column mixed cell, structurally distinct from the 4 existing DVP/vol boosts); (2) mixed regressed? NO -- mixed GAINED +0.0068 (the binding lowest regime, documented walled at emission layer but responsive at entry-sizing); rally regressed -0.0017 (the documented low-DD-regime over-commit confound -- breadth boost fires on rally alt entries too); (3) hypothesis for next step: gate the boost to spare rally -- rally alt entries are decisive trend winners (do not need the breadth boost) while mixed alt entries are marginal (benefit from confirmation). A trend-strength or conviction gate that mutes the boost on rally decisive entries while keeping it on mixed marginal entries should recover rally without losing the mixed gain. Branch opened (separate budget, no fixed depth).
fba78743	0.689311	0.754748	0.218125	0.961878	0.729861	1.011417	0.662116	0.408468	branch	branch step1: CONVICTION-MARGIN gate on the partnerdvp-btcvol boost (fade boost as own-side margin rises above 0.15, spare decisive entries). MEASURED vs Exp5 opening 0.690908: BYTE-IDENTICAL to BASELINE 0.689311 (composite delta -0.001597 vs previous step = NO-PROGRESS). The gate KILLED the boost entirely -- it never fires because the boost condition (partnerdvp on-side AND btc_vol_rise) only co-occurs with DECISIVE-margin entries (_bull_margin>0.15), so the (1-decisiveness) gate zeros it exactly where it would fire. KEY INSIGHT: the Exp5 mixed +0.0068 gain AND the rally -0.0017 regression come from the SAME entries (decisive trend-aligned alt entries) -- conviction margin CANNOT separate them (reconfirms the documented rally/mixed decisive-entry confound from prior headroom sessions). Reverted to Exp5 opening state. no-progress step 1/7.
67e20eca	0.689945	0.755108	0.217209	0.961500	0.729861	1.011430	0.661424	0.411325	branch	branch step2: AMPLIFY boost magnitude 0.05->0.08 (test elasticity). MEASURED vs Exp5 opening 0.690908: composite -0.000963 (0.689945 NO-PROGRESS), mean -0.000622, std 0.216075->0.217209. PER-REGIME: bull 0.961642->0.961500 (-0.000142), crash BYTE-IDENTICAL, sideways +0.000005, rally 0.660457->0.661424 (-0.001033 WORSE), mixed 0.415265->0.411325 (-0.003940 GAIN SHRANK). FAILURE MECH: elasticity is WRONG -- amplifying over-commits mixed entries (they then give back more, mixed gain shrank) AND hurts rally more. 0.05 amplitude is near-optimal; diminishing/negative returns above. Reverted to Exp5 opening. no-progress step 2/7.
2b22d9b6	0.689943	0.755141	0.217329	0.961644	0.729861	1.011770	0.661040	0.411392	branch	branch step3: add complementary btcdvp x partnervol-rise boost (2nd DVP-mixed-cell). MEASURED vs Exp5 opening 0.690908: composite -0.000965 (0.689943 NO-PROGRESS), mean -0.000589, std 0.216075->0.217329. PER-REGIME: bull -0.000002, crash BYTE-IDENTICAL, sideways +0.000345, rally 0.660457->0.661040 (-0.000417), mixed 0.415265->0.411392 (-0.003873 GAIN SHRANK). FAILURE MECH: SAME pattern as step2 amplify -- adding more breadth confirmation to mixed decisive entries over-commits them -> giveback shrinks the net mixed gain (mixed +0.0068 -> +0.0029). The single Exp5 boost 0.05 is at the PEAK of the mixed-response curve; any additional entry-side confirmation (amplify OR 2nd boost) shrinks mixed via over-commit giveback. CONVERGENT with step2: entry-side breadth on mixed has diminishing/negative returns above 0.05. no-progress step 3/7.
71cf385c	0.690920	0.755748	0.216092	0.961733	0.729861	1.011422	0.660457	0.415265	branch	branch step4: INVERSE-PORTFOLIO-DD gate on the boost (mute as _port_dd_atten drops). MEASURED vs Exp5 opening 0.690908: composite +0.000012 (ESSENTIALLY FLAT, rally+mixed BYTE-IDENTICAL to Exp5: rally Sh1.530096 MaxDD5.241379, mixed Sh0.807355 MaxDD2.813720). FAILURE MECH: the gate had ZERO effect -- _port_dd_atten is ~1.0 at entry bars (portfolio DD is near 0 at the MOMENT of entry; DD accumulates over the HOLD not at entry) so the gate never fires when the boost fires. Same timing-mismatch wall as Exp2 (cross-symbol loss condition not met at decision moment). no-progress step 4/7.
fe443e24	0.689311	0.754748	0.218125	0.961878	0.729861	1.011417	0.662116	0.408468	discard	SESSION-START REVERT of in-flight Exp5 partnerdvp x btcvol branch (prior session interrupted at HEAD=255ad6b7 step5). Branch stagnated across 5 steps at sub-noise +0.0016 (best step4 0.690920 vs baseline 1d764b9f 0.689311; +0.0016 below +0.003 keep). No credible path to keep: even theoretical best (full rally -0.0017 recovery + mixed +0.0068 retained) reaches only ~+0.0023 composite. mixed gain too small once diluted across 5 regimes; amplify 0.05->0.08 HURT (composite 0.690908->0.689945, rally worsened -0.0017->-0.0028); conviction-margin gate byte-identical (boost fires only on decisive-margin entries = the SAME entries that regress rally, per documented rally/mixed decisive-entry confound). Reverted strategy.py ONLY to 1d764b9f via path-scoped git checkout (0 diff to keep), results.tsv append-only preserved. Baseline 1d764b9f 0.689311 5-regime [bull 0.961878, crash 0.729861, sideways 1.011417, rally 0.662116, mixed 0.408468] re-verified. Fresh session begins; independent experiments follow.
fd30ac73	0.689311	0.754748	0.218124	0.961878	0.729861	1.011417	0.662117	0.408468	discard	Exp1 architectural indep: DIRECTION-ASYMMETRIC peak-profit giveback. NEW data dep on POSITION DIRECTION at the harvest subsystem core parameter: PEAK_PROFIT_GIVEBACK_SHORT=0.15 (tighter giveback for shorts, squeeze protection) vs PEAK_PROFIT_GIVEBACK=0.22 baseline for longs. _pp_base_giveback blends by -pos_dir (tanh, smooth form; sign never ambiguous so selects one branch). DD-tightening multiplier still applies identically to both (DD risk is direction-agnostic). General mechanism (all shorts/longs across all regimes, NOT regime-detection): crypto adverse excursion is direction-asymmetric (shorts face squeezes=fast vertical winner re-traces; longs face grinding pullbacks) so a symmetric giveback over-lets shorts re-trace through dead-cat bounces. MEASURED vs 1d764b9f 0.689311: BYTE-IDENTICAL composite/mean/std/per-regime ALL unchanged (bull 0.961878, crash 0.729861, sideways 1.011417, rally 0.662117->0.662117 +0.000001 rounding, mixed 0.408468; all stab 1.0 raw==score all DD<10pct all flip 1.0). FAILURE MECH (architectural fact, direct measurement): the peak-profit giveback _pp_pressure fires ONLY when peak_pnl>=_pp_min (_pp_ratio>=1.0, peak profit>=2.5pct notional). Crash shorts exit via giveback-ratio/slope-against BEFORE reaching the _pp_min profit threshold (same crash-exits-before-harvest-engages wall documented for the de-risk cushion in prior 2 sessions) -> the tighter short giveback NEVER BINDS on crash (the short-dominated regime where it would matter). Longs keep baseline 0.22 by construction (byte-identical). So the change touches nothing active. Not branch-eligible (no positive regime signal -- all byte-identical; no path to keep from an inert mechanism). 1st architectural discard.
471534d8	-999.000000	-599.255503	489.585030	0.491841	0.230645	-999.000000	-999.000000	-999.000000	discard	Exp2 architectural indep: LOW-TRADE-DENSITY admission relaxation (inverse regime of _freq_factor). NEW control flow + cross-component data dep: when a symbol has been persistently under-trading (40+ bars since last entry, scaled /60 to max), RELAX _bull_strong_min/_bear_strong_min by max 8pct to admit marginal-conviction entries. Hypothesis: mixed_2025 under-trades (43t < 50 sample_factor knee = 7.6pct drag); relaxing on the long-gap condition admits more trades without firing on high-churn regimes. MEASURED vs 1d764b9f 0.689311: CATASTROPHIC composite -999 (hard cutoff). PER-REGIME: bull 0.961878->0.491841 (DD 3.09->6.77pct, 52->19 trades), crash 0.729861->0.230645 (DD 2.46->4.40pct, 55->11t, WR 100->90.9pct), sideways -999 (DD 59.75pct, 49->12t), rally -999 (DD 34.63pct, 102->3t, WR 85.3->0pct), mixed -999 (DD 20.53pct, 43->8t). TRADE COUNTS COLLAPSED ACROSS ALL REGIMES (not just mixed) -- the opposite of intended. FAILURE MECH (direct measurement): the relaxation admitted marginal-conviction entries EARLY (at lower strong-sum) -- these are weak-signal ~coin-flip trades that LOSE -> loss-streak triggers _streak_ct_admit threshold TIGHTENING -> cascades into fewer net entries + catastrophic DD (sideways 59.75pct, rally 34.63pct, mixed 20.53pct all >10pct hard cutoff). The relaxation ALSO fired on rally (which has 102t/yr but multi-bar gaps between bursts DO exceed 40 bars during rally consolidation -> relaxation admitted bad rally entries -> rally collapsed to 3 trades 0pct WR). The 100pct WR on mixed/crash was PRECIOUS -- marginal-conviction admissions are not directionally correct in low-trend regimes so they destroy Sharpe far faster than sample_factor recovers. Reconfirms the documented admission-sensitivity wall (loosening persist/threshold admits noise-sensitive trades) on a NEW axis (trade-density inverse). Not branch-eligible (catastrophic -999, multiple regimes breach 50pct floor AND 10pct DD cutoff; no positive signal). 2nd architectural discard.
7c1f8537	0.689311	0.754748	0.218125	0.961878	0.729861	1.011417	0.662116	0.408468	discard	Exp3 architectural indep: PROFIT-SCALED stop-loss width. NEW data dep at stop subsystem core: effective stop _stop_abs_eff = _stop_abs*(1 - 0.40*_profit_stop_gate) where _profit_stop_gate=tanh(pos_pnl/_stop_abs) -- tighter stop (floor 0.60x) as unrealized profit builds, locking gains toward breakeven+; losers keep full ATR stop (gate 0). Mechanism: a confirmed winner can afford a tighter stop (directionally proven); losers breathe. Distinct from _pp_pressure (trailing on PROFIT) -- this tightens the DOWNSIDE stop on winners, capping DD from riding winners through pullbacks (rally DD drag). MEASURED vs 1d764b9f 0.689311: BYTE-IDENTICAL composite/mean/std/per-regime ALL unchanged (bull 0.961878, crash 0.729861, sideways 1.011417, rally 0.662116 DD5.166719, mixed 0.408468; all Sharpe/DD/trade-counts identical). FAILURE MECH (architectural fact, direct measurement): SELF-EXCLUSIONARY pattern -- _sl_pressure only fires when _loss(=-pos_pnl) approaches the stop (position LOSING), but _profit_stop_gate only activates when pos_pnl>0 (WINNING). On bars where the stop matters (losing, _loss rising toward stop), pos_pnl<=0 -> gate=0 -> _stop_abs_eff=_stop_abs (byte-identical). The tighter stop only applies while winning, but a winning position has _loss<0 -> _sl_pressure=0 already (stop not binding). The profit-gate and the stop-pressure are anti-correlated by construction -> never overlap -> tightening never binds. Same self-exclusionary family as Exp1 (direction-asymmetric giveback, harvest path inert) and prior MAE-cleanliness gate. The stop-loss path is structurally unreachable from a profit-conditioned lever. Not branch-eligible (byte-identical, no positive signal). 3rd architectural discard.
5a6847b2	-999.000000	-799.186533	399.626935	-999.000000	-999.000000	-999.000000	-999.000000	0.067336	discard	Exp4 architectural indep: GIVEBACK-VELOCITY amplifier on pp_pressure. NEW data dep at harvest subsystem: the RATE of pos_pnl decline from recent peak (giveback VELOCITY) from _pnl_path[-4:]. _pp_vel_amp = 1 + 0.40*pp_activation*tanh((gb_vel-0.15)/0.30) where gb_vel = recent 3-bar peak-to-now decline normalized by _stop_abs. Amplify pp_pressure up to +40pct on sharp pullbacks (momentum-against-winner). Fires on SAME condition as pp_pressure (winning, giving back from peak>=_pp_min) so intended to AVOID the self-exclusionary trap of Exps 1,3. MEASURED vs 1d764b9f 0.689311: CATASTROPHIC composite -999 (hard cutoff). PER-REGIME: bull -999 (DD 3.09->19.15pct, 52->198 trades, WR 86.5->59.1pct), crash -999 (DD 2.46->19.27pct, 55->257t, WR 100->68.5pct), sideways -999 (DD 2.21->10.32pct, 49->175t), rally -999 (DD 5.17->15.50pct, 102->335t, WR 85.3->60pct), mixed 0.067336 (DD 2.80->4.66pct, 43->54t PAST 50 knee, WR 100->88.9pct, stab 0.299). TRADE COUNTS EXPLODED 4x (over-harvest -> premature exits -> re-entry churn -> DD explosion). FAILURE MECH (direct measurement): the +0.40 amplifier on EVERY giveback spike massively over-harvested -- gb_vel normalized by _stop_abs fired on routine chop givebacks (not just sharp pullbacks) -> positions exited on every minor giveback -> churned -> DD exploded across all regimes. The giveback-velocity signal is the most NOISE-SENSITIVE harvest input (giveback spikes are ubiquitous in chop); amplifying it amplified noise. INTERESTING: mixed SURVIVED (gained to 54 trades past the 50 knee, confirming the sample_factor headroom is real) because mixed's LOW giveback velocity kept the amp low -- but at the cost of its stability (0.299) and WR (100->88.9pct). The amplifier is structurally unsound (over-harvests noise). Not branch-eligible (catastrophic -999, 4 regimes breach DD cutoff; the mixed survival is a side-effect not a buildable signal). 4th architectural discard.
8029a914	0.493389	0.570129	0.255801	0.308952	0.707579	0.990271	0.520955	0.322891	discard	Exp5 architectural indep: MULTI-SOURCE AGREEMENT BONUS on soft_max -- bilateral counterpart to the existing single-source attenuator. NEW control flow at the exit-fusion agreement layer: _agree_bonus = 1 + 0.10*_agree_gate*_trend_w_bonus where _trend_w_bonus=tanh(|ret_long|/0.04) (mirror of _chop_atten_w). The attenuator penalizes single-source in chop (-25pct); this rewards multi-source agreement in TREND (+10pct). Mechanism: MAX fusion discards agreement signal; a bounded bonus on co-active INDEPENDENT sources is confirmation not noise addition. MEASURED vs 1d764b9f 0.689311: REGRESSION composite -0.195922 (0.493389 FAIL), mean -0.184619 (0.570129 FAIL), std 0.218125->0.255801. PER-REGIME all stab 1.0 raw==score all flip 1.0: bull 0.961878->0.308952 (-0.6526, DD 3.09->8.14pct, 52->80t, WR 86.5->71.2pct -- near 10pct DD cutoff), crash 0.729861->0.707579 (-0.0223, DD 2.46 byte-idem, 55->48t), sideways 1.011417->0.990271 (-0.0211, DD 2.21 byte-idem, 49->50t), rally 0.662116->0.520955 (-0.1412, DD 5.17->6.98pct, 102->117t, WR 85.3->75.2pct), mixed 0.408468->0.322891 (-0.0856, DD 2.80->3.06pct, 43->56t, WR 100->89.3pct). FAILURE MECH (direct measurement): the +10pct agreement bonus in trends OVER-HARVESTED trend-regime WINNERS -- in trends, dual-source pressure spikes (slope-against + pp-giveback firing together) are often PULLBACK-NOISE within an ongoing trend, not reversal-confirmation. Boosting them harvested bull/rally trend-aligned winners on normal corrections -> churn (bull 52->80t, rally 102->117t) -> DD up (bull 3.09->8.14pct, rally 5.17->6.98pct) -> Sharpe down (bull 2.00->0.93, rally 1.53->1.21). Same over-harvest family as Exp4 (giveback-velocity amp) but milder. Reconfirms the MAX fusion + single-source attenuator is at its optimum: MAX was a deliberate keep (rejects correlated-noise addition); adding an agreement boost regresses because trend dual-source spikes are pullback-noise not confirmation. Not branch-eligible (5 of 5 regimes regressed, no positive signal; composite -0.196 far below +0.003 keep). 5th architectural discard. EXIT RULE SATISFIED: 5 consecutive architectural discards (Exp1 inert, Exp2 -999, Exp3 inert, Exp4 -999, Exp5 -0.196); >=5 architectural attempted; no branch opened.
