commit	score	mean_score	std_score	bull_2021	crash_bear	sideways	rally_2024	status	description
de412448	0.6393	0.7454	0.2120	0.78	0.77	1.01	0.42	session-summary	session: 5 independent architectural discards (EXIT RULE at 5 consecutive architectural), 0 branches (none branch-worthy: no regime SCORE improved in any exp). Baseline de412448 UNCHANGED 0.6393 [bull 0.781 crash 0.768 sideways 1.013 rally 0.419]. EXACT DECOMP this session (annvol=annret/sharpe): score=signal_quality(ln(1+Sharpe)) x sample_factor(sqrt(min(trades/50,1))) x dd_gate(1/(1+DD/100)) x vol_gate(1/(1+annvol)) x streak_gate(exp(-max_consec_losses/30)). dd_gate>0.98 ALL (DDs<2pct, NOT a lever); vol_gate 0.97-0.985 ALL (positions already small, NOT a lever); bull/crash sample_factor 0.93/0.95 (43/45 trades<50). rally drags: signal_quality 0.552 (Sharpe 0.736, dominant) + streak_gate 0.792 (max_consec_losses~7). LESSONS: L1 bull/crash trade count NOT admission-limited (Exp1 loosen->0 trades added, calm positions held long). L2 new price-derived term at admission BOUNDARY collapses rally stab (Exp1 R2-relax: rally stab 0.80->0.51, others byte-identical). L3 size-UP amplification collapses rally stab (Exp2: rally RAW UP 0.419->0.432 Sharpe 0.736->0.767 but stab 0.80->0.50 -> rally clean longs UNDER-sized, stability forbids size-up; calm raw slightly down). L6 rally max_consec~7 is CROSS-SYMBOL interleaved (Exp3 per-symbol loss-escalator never fires on rally, hurts bull, outcome-feedback drops rally stab 0.80->0.73). L7 rally WINNERS are bull DIP-BUYS during portfolio DD (Exp4 block-all-entries-in-DD -> rally Sharpe 0.736->-0.275 catastrophe, trades 68->17). L8 rally counter-trend SHORTS are protective DD HEDGES not loss-source (Exp5 block-bear-in-DD -> rally trades 68->87, DD 1.85->2.84, Sharpe 0.736->0.388). CONCLUSION: rally capped by Sharpe+streak_gate; both reachable only via admission-boundary or size changes that hit the rally-stability wall; vol/dd gates saturated (small positions); strong regimes sample-limited with no safe trade-add. Hard local optimum re-confirmed.
-	0.5403	0.6902	0.2998	0.78	0.77	1.01	0.20	discard	ARCHITECTURAL churn-gated multi-day over-extension (pct-displacement from 96-bar HL2 mean) entry-size shrink, onset 5pct K0.30, _calm gate. composite 0.6393->0.5403. bull RAW 0.781251->0.781259 BYTE-IDENTICAL, crash 0.767586 BYTE-IDENTICAL, sideways 1.0133->1.0130 (-0.0003): strong regimes entry-size-INERT to this signal (entries do NOT reach 5pct displacement from 4-day mean -> the documented bull over-extension alpha is EXIT-side ride-up, entries happen near the mean). rally raw 0.4194->0.4169 (flat) stab 0.801->0.478 factor 0.478 (pure re-seed collapse). Not branch-worthy: NO strong-regime raw gain (target inert), only rally re-seed downside. CONFIRMS over-extension alpha unreachable from entry side; exit-side remains rally-walled.
-	0.5165	0.6662	0.2994	0.69	0.77	1.01	0.19	discard	ARCHITECTURAL trend-quality(R2)-gated giveback-trail amplification on low-R2 (choppy) holds, churn-gated, MODULATES existing pp giveback ratio (not a new MAX term). composite 0.6393->0.5165. ALL FOUR regimes RAW BYTE-IDENTICAL (bull 0.781251, crash 0.767586, sideways 1.013297, rally 0.419353): pp-giveback is NOT the binding exit driver on targeted holds - positions reaching profit-giveback territory are high-R2 clean trends; low-R2 choppy holds rarely reach a profit peak to give back from, so the R2 amplification never altered the MAX exit term. Modulating an ACTIVE pressure was still inert. Only effect: AST re-seed dropped bull stab 1.0->0.889 (score 0.694), rally stab 0.801->0.453 (score 0.190). Not branch-worthy (no raw gain). RECONFIRMS exit-fusion modulations inert on strong regimes (pp-giveback specifically not binding for choppy holds).
7e2d12fd	0.5162	0.6801	0.3278	0.78	0.77	1.03	0.14	branch	BRANCH-OPEN: ARCHITECTURAL trend-quality(R2)-gated de-risk FLOOR. In low-R2 (choppy) holds lower _de_floor by up to 0.15 (churn-gated via instantaneous len(_eh)) so the graduated partial-exit ramp engages earlier. composite 0.6393->0.5162. ENGAGED with REAL raw gains: sideways RAW 1.013297->1.029788 (+0.0165, Sharpe 1.9409->1.9926 +0.052 = genuine behavioral, not re-seed), rally RAW 0.419353->0.426881 (+0.0075, Sharpe 0.736->0.753). bull RAW 0.781251->0.781247 / crash 0.767586->0.767623 ~byte-identical (high-R2 holds, no floor change). Composite dropped ONLY from rally STAB re-seed 0.801->0.332 (factor 0.332, score 0.142) - documented AST-reseed lottery, NOT mechanism regression (rally raw ROSE). De-risk ramp is the proven-engageable exit lever (moved bull via ratchet); R2-gating its floor is risk-reduction (faster exit on choppy holds), generalizing direction. Branch will iterate to recover rally stab >=0.80 while preserving sideways gain.
7ba38262	0.5460	0.6965	0.3011	0.78	0.77	1.03	0.21	branch	branch step2: cumulative-max churn gate (_cm<=2, noise-immune monotonic int) replaces instantaneous len(_eh) on R2 de-risk floor. composite 0.5162->0.5460 (progress, raw_composite up). bull RAW 0.781251 BYTE-IDENTICAL (gate off - bull bursts early), crash 0.767623 ~byte-id, sideways 1.029788 (+0.0165 gain PRESERVED), rally RAW 0.419353->0.434398 (+0.0150 UP Sharpe 0.736->0.770) but stab 0.801->0.477 (factor 0.477 score 0.207). Mechanism good (sideways + rally raw both up, bull/crash neutral) but rally stab re-seeded: de-risk floor tracks PER-BAR R2 (re-rolls every bar under AR(1) noise -> position wobble = documented per-bar-position-dependence wall). Pre-burst rally holds also still gated ON. Next: fast-saturate R2 gate (near-constant floor change where it fires = noise-free).
4e31aefc	0.6201	0.7390	0.2377	0.78	0.77	1.04	0.37	branch	branch step3: FAST-SATURATE R2 gate (scale 0.25->0.05) -> near-constant floor change where it fires (removes per-bar R2 noise). composite 0.5460->0.6201 (BIG progress, near baseline 0.6393). bull 0.781251 BYTE-ID, crash 0.767628 ~byte-id, sideways RAW 1.013297->1.035794 (+0.0225 Sharpe 1.9409->2.0117), rally RAW 0.419353->0.436132 (+0.0168 Sharpe 0.774). rally STAB recovered: stability 0.643->0.755, factor 0.477->0.851 - fast-saturation WORKED (per-bar R2 tracking was the killer). Gap to KEEP: rally stab 0.755 needs 0.80 for factor 1.0 (then composite ~0.649 > baseline). Next: narrow R2 transition band further (scale 0.03).
74e9e992	0.5069	0.6714	0.3290	0.78	0.77	1.01	0.13	branch	branch step4: narrow R2 band (scale 0.05->0.03). composite 0.6201->0.5069 (REGRESSION, no-progress #1). Scale change RE-ROLLED seed: rally stab 0.755->0.587 (factor 0.851->0.290) WORSE, sideways RAW 1.0358->1.0102 (gain shrank, Sharpe 2.0117->1.9975). CONFIRMS within fast-saturated regime the exact scale value re-rolls rally stab (re-seed dominates over narrow-band mechanism); step3 0.755 was a better draw not 0.05 mechanically superior. Next: revert to scale 0.05 + reduce MAGNITUDE 0.15->0.10 (genuine sensitivity reduction toward baseline rally behavior).
c53b80db	0.4741	0.6575	0.3667	0.78	0.77	1.03	0.05	branch	branch step5: reduce magnitude 0.15->0.10 (scale 0.05). composite 0.6201->0.4741 (no-progress #2). RE-ROLLED again: rally stab 0.534 (factor 0.113), sideways RAW 1.031944 (+0.0186 still real, Sharpe 1.999). CONFIRMS rally stab RE-SEED DOMINATED ~[0.53,0.76] across param tweaks (step3 scale.05/mag.15=0.755, step4 scale.03=0.587, step5 mag.10=0.534) - magnitude/scale re-roll without shifting the distribution up. sideways raw consistently +0.018-0.022 (real, deterministic Sharpe gain). Need rally stab>=0.785 for keep. Next: add noise-immune bars_held LONG-HOLD gate (rally holds short <8 bars vs crash/sideways longer) to genuinely cut rally share of the change + shift its stab distribution up.
8fc136bb	0.5963	0.7256	0.2585	0.78	0.77	1.04	0.32	branch	branch step6: add noise-immune bars_held long-hold gate tanh((bars_held-6)/4), step3 config scale.05/mag.15. composite 0.4741->0.5963 (progress vs step5). sideways RAW 1.035714 (+0.0224 PRESERVED - choppy overstays ARE long holds), bull/crash byte-id, rally RAW 0.435209 (+0.0159 STILL moves) stab 0.719 (factor 0.730). bars_held did NOT separate rally: rally affected holds are LONG (bars_held>6) overlapping crash/sideways duration. churn cumulative-max + bars_held BOTH leak rally. Best draw still step3 0.755 < needed ~0.787. Next: fast-saturated LOW-trend-strength chop gate (rally trending high|ret_long| vs sideways range-bound) to exclude rally trending holds.
0a3520cc	0.5461	0.6972	0.3022	0.78	0.77	1.03	0.21	branch	branch step7: replace bars_held with fast-saturated low-trend-strength chop gate (1-tanh((|ret_long|-0.015)/0.008)) - rally trending excluded, sideways chop ON. composite 0.5963->0.5461 (no-progress #1). chop gate DID cut rally exposure: rally raw move +0.0159->+0.0092 (0.428549), crash 0.767590 toward baseline, sideways +0.0200 (1.033252 slightly less). BUT rally stab DREW 0.644 (factor 0.483) LOWER than step6 0.719 despite LESS rally exposure. DECISIVE: rally stab UNCORRELATED with mechanism rally-exposure = pure re-seed lottery (draws step3 0.755/step4 0.587/step5 0.534/step6 0.719/step7 0.644; need >=0.787, max 0.755). Even step3 best draw composite 0.6201<baseline 0.6393. Next: combine ALL gates (churn+bars_held+chop) for maximal rally exclusion toward byte-identical.
d4551a68	0.4468	0.6363	0.3791	0.73	0.77	1.03	0.01	branch	branch step8: combine ALL gates (churn cum-max + bars_held + chop) for maximal rally exclusion. composite 0.5461->0.4468 (no-progress #2, worst draw). rally raw STILL moved +0.0089 (0.428212) - NOT byte-identical even with 3 gates (rally has consolidation phases passing calm+long+rangebound). rally stab DREW 0.508 (factor 0.026 catastrophic), bull stab also re-seeded 1.0->0.939 (score 0.733), sideways 1.033166 (+0.0199 preserved). CONCLUSIVE: 7 branch draws of rally stab = 0.477/0.755/0.587/0.534/0.719/0.644/0.508, uncorrelated with mechanism rally-exposure (pure AST re-seed lottery), max 0.755 < required 0.787. TERMINATING branch.
-	0.6393	0.7454	0.2120	0.78	0.77	1.01	0.42	discard	BRANCH REVERTED to de412448 0.6393 (strategy.py restored byte-identical, verified 0 diff). Branch = R2-gated de-risk FLOOR (faster graduated exit on low-R2 choppy holds). REAL deterministic gain found: sideways RAW 1.013297->~1.0358 (+0.022, Sharpe 1.9409->2.0117) across all branch steps - faster exit on choppy long holds genuinely raises sideways Sharpe; bull/crash byte-identical. FAILURE CAUSE: rally STABILITY is a pure AST-reseed lottery - 7 branch draws 0.477/0.755/0.587/0.534/0.719/0.644/0.508 (factor 0.026-0.851), UNCORRELATED with deliberate mechanism rally-exposure (step7 chop-gate HALVED rally raw move yet drew LOWER stab; step8 3-gate combine drew 0.508). Required rally stab >=0.787 for composite>baseline; max draw 0.755 (step3 composite 0.6201<0.6393). Even fast-saturation (step3, removed per-bar R2 tracking -> stab 0.643->0.755) could not reach threshold. Rally never byte-identical (raw moved +0.009-0.016 every step: churn cum-max leaks pre-burst, bars_held overlaps duration, chop leaks rally consolidations). Terminated early (decided): mechanism CANNOT beat baseline without top-percentile rally seed = meta-overfit (abfb9591 cross-ex failure mode). sideways de-risk mechanism is real + candidate for future IF rally re-seed barrier solved.
de412448	0.6393	0.7454	0.2120	0.78	0.77	1.01	0.42	session-summary	session: 2 independent architectural discards + 1 exploration branch (8 steps, REVERTED). Baseline de412448 UNCHANGED 0.6393 [bull 0.781251 Sh1.556, crash 0.767586 Sh1.311, sideways 1.013297 Sh1.941, rally 0.419353 Sh0.736 stab0.801 = all factors 1.0; binding constraint rally]. strategy.py verified byte-identical to de412448 (0 diff). EXP1 (indep discard): churn-gated multi-day over-extension (pct-displacement from 96-bar HL2 mean) ENTRY-size shrink -> bull RAW 0.781251->0.781259 + crash BYTE-IDENTICAL (entries do NOT reach 5pct displacement from 4-day mean), rally re-seed. CONFIRMS the documented bull over-extension alpha is EXIT-side ride-up, UNREACHABLE from entry (you enter near the mean, position rides to extension). EXP2 (indep discard): R2-gated giveback-trail amplification on low-R2 holds (modulates EXISTING pp giveback) -> ALL 4 regimes RAW BYTE-IDENTICAL: pp-giveback is NOT the binding exit driver (low-R2 choppy holds rarely reach a profit peak to give back from). EXP3 = BRANCH OPEN: R2-gated de-risk FLOOR (lower _de_floor on low-R2 choppy holds -> graduated partial-exit ramp engages earlier). NEW ENGAGEABLE LEVER FOUND: sideways RAW 1.013297->1.035794 (+0.0225, Sharpe 1.9409->2.0117, DETERMINISTIC not re-seed) - faster exit on choppy long holds genuinely raises sideways Sharpe; bull/crash byte-identical. The de-risk RAMP is engageable (unlike pp-giveback Exp2 / new MAX-fusion terms) because it is active in every regime hold. BRANCH (8 steps) to recover rally stab: step2 cumulative-max churn gate, step3 FAST-SATURATE R2 gate (removed per-bar R2 tracking -> rally stab 0.643->0.755 BEST), step4 narrow band/step5 reduce mag (re-rolls), step6 bars_held gate, step7 chop gate (HALVED rally raw move yet stab DREW LOWER), step8 combine-all-gates (stab 0.508). CONCLUSIVE FINDING: rally stability is a PURE AST-reseed lottery - 7 draws 0.477/0.755/0.587/0.534/0.719/0.644/0.508 UNCORRELATED with deliberate mechanism rally-exposure; required >=0.787 for composite>baseline, max draw 0.755 (step3 composite 0.6201<0.6393). Rally NEVER byte-identical (raw moved +0.009-0.016 every step: churn cum-max leaks pre-burst, bars_held overlaps crash/sideways duration, chop leaks rally consolidations - no exit-time signal cleanly identifies a rally hold). Terminated early (decided): even step3 best-draw below baseline, and beating it needs a top-percentile rally seed = meta-overfit (abfb9591 cross-ex fail mode). NEW KNOWLEDGE for future: (a) de-risk FLOOR is a real engageable sideways lever via risk-reduction (faster exit on choppy holds, +0.022 raw deterministic) - distinct from the saturated entry-size channel and the non-binding pp-giveback; revisit IF a rally-robust delivery is found. (b) RECONFIRMED rally stab uncorrelated-with-mechanism re-seed lottery (cleanest proof yet: chop-gate cut rally exposure but stab dropped) - baseline rally 0.801 is a lucky top-of-range seed; the 0.80-knee makes every code change a downside-only rally re-seed. Baseline de412448 0.6393 UNCHANGED; all reverted via git checkout -- strategy.py; results.tsv append-only intact.
ae9618c8	0.5321	0.6731	0.2821	0.68	0.77	1.01	0.23	discard	architectural Exp1: persistent-churn admission throttle (+30pct strong_min at cum-max churn _cm>=5, read prior-bar _churn_hist, noise-immune integer gate). composite 0.6393->0.5321 DISCARD. KEY: rally raw BYTE-IDENTICAL 0.419353->0.419358 (tightening cut ZERO rally entries - rally entries sit DEEP above admission like strong regimes; cannot shed marginal rally trades via admission). rally stab=0.6667 factor0.556 = pure RE-SEED (4th byte-id-trade draw: 0.80/0.69/0.51/0.667). bull raw DROPPED 0.781->0.679 Sh1.556->1.282 (bull DOES occasionally burst _cm>=3 -> throttle cut bull entries; "bull never bursts" assumption WRONG). crash 0.768 + sideways 1.013 BYTE-IDENTICAL (never burst _cm<=2). NO regime improved -> no branch. CONCLUSION: count-reduction-via-admission is NOT a rally lever (rally entries deep above threshold).
52c0f131	0.3981	0.5665	0.3369	0.73	0.88	0.65	0.00	branch	BRANCH OPEN (R2-gated clean-trend exit ride-suppression). composite 0.6393->0.3981. SIGNAL: crash raw 0.767586->0.882704 (+0.115!) Sh1.311->1.496 DETERMINISTIC (crash stab 0.90 factor1.0) = riding clean-trend winners is a GENUINE raw lever in stability-SAFE regime. REGRESSIONS: bull 0.781->0.728 Sh1.556->1.269 (over-held pullback-grind winners), sideways 1.013->0.659 Sh1.941->1.261 (suppression fired on high-R2 sub-trends, sideways needs FAST exits), rally raw 0.419->0.314 churn-gate LEAKED (quiet len<=1 stretches) stab re-seed 0.50. FIX HYPOTHESIS: narrow gate to DEEP+MULTI-DAY-SUSTAINED+clean trends (isolate crash-like deep legs from bull shallow grind / sideways brief trends) via |ret_long|+ret_vlong-aligned requirements.
3aa38f0e	0.4024	0.5229	0.2409	0.56	0.76	0.65	0.12	branch	branch step2 (deep+sustained narrow): NO PROGRESS rawcomp 0.541. KILLED crash gain (0.883->0.758, deep-|ret_long|>0.05 gate excluded crash moderate rides) + bull WORSE 0.728->0.607 (multi-day-sustained gate fires HARDEST in bull, the most-sustained uptrend). ret_vlong-align is a BAD discriminator (lumps bull with crash).
57bb78ec	0.5369	0.6420	0.2102	0.74	0.87	0.66	0.30	branch	branch step3 (loose-R2 x ret_vlong-align x winning): rawcomp 0.537. crash gain RECOVERED 0.867 (+0.099), bull 0.742, but sideways STILL collapsed 0.658 (ret_vlong-align did NOT exclude sideways - 2023 has trending sub-periods). rally drew lucky 0.826 factor1.0 but rally RAW changed 0.419->0.302 (blanket soft_max suppression leaked into rally). Blanket suppression hurts sideways by deferring peak-profit giveback.
8bb8523c	0.4700	0.6716	0.4032	0.78	0.83	1.07	0.00	branch	branch step4 (SURGICAL: suppress ONLY slope+time, keep pp/ve/ar/SL): DETERMINISTIC RAW BREAKTHROUGH - bull 0.781->0.783, crash 0.768->0.829 (+0.062), sideways 1.013->1.074 (+0.060 Sh1.94->2.13) ALL THREE strong regimes UP simultaneously. rally Sharpe 0.736257~=baseline 0.736314 = trades BYTE-IDENTICAL (surgical version does NOT fire in rally, unlike blanket steps1-3). bull+crash+sideways raw sum 2.562->2.686 (+0.124 best in branch). composite 0.470 sunk ONLY by this draw rally stab 0.484 factor0 (pure re-seed lottery, unlucky). Mechanism: keeping peak-profit protection fixes sideways; suppressing slope/time lets crash+bull ride sustained winners.
cb0bc3a1	0.5498	0.7130	0.3264	0.78	0.83	1.06	0.18	branch	branch step5 (surgical depth 0.40->0.55): deterministic b+c+s raw sum 2.674 (vs step4 2.686, slightly WORSE - sideways dipped 1.074->1.061); depth 0.40 is the optimum. KEY: raw_composite 0.6585 > baseline 0.6393 (rally factor 0.424>0 so rally raw 0.419 shows true) - the deterministic raw structure BEATS baseline when rally factor nonzero. rally Sharpe 0.736253 byte-id, drew stab 0.627 factor0.424 -> composite 0.550.
df79a3cd	0.4932	0.5936	0.2008	0.77	0.82	0.37	0.42	branch	branch step6 (BROAD winner-ride, drop clean-sustained gate, depth 0.30): TWO findings. (1) clean-sustained GATE IS NECESSARY - broad slope/time deferral COLLAPSED sideways 1.013->0.372 Sh1.94->0.70 (sideways mean-reverting winners NEED fast slope/time exits). (2) RALLY-CHURN HYPOTHESIS FALSIFIED - rally Sharpe 0.735932~=baseline 0.736314 byte-id (broad deferral did NOT change rally trades -> rally exits are NOT slope/time-driven -> cannot reduce rally churn via this lever). rally drew stab 0.798 factor0.994. b+c+s sum 1.958.
8f61bc0b	0.6393	0.7454	0.2120	0.78	0.77	1.01	0.42	discard	BRANCH SUMMARY (surgical clean-trend ride-suppression, 6 steps, REVERTED to de412448). GENUINE RAW LEVER FOUND (best=step4 8bb8523c): suppress ONLY slope+time exit pressures for clean(R2)+multiday-aligned(ret_vlong)+winning holds, keep pp/ve/ar/SL full. MEASURED step4 (all stab factors 1.0, deterministic): bull 0.781251->0.783360, crash 0.767586->0.829368 (+0.062 Sh1.311->1.360), sideways 1.013297->1.073733 (+0.060 Sh1.941->2.128) - ALL 3 strong regimes UP simultaneously; b+c+s raw sum 2.562->2.686 (+0.124). rally Sharpe 0.736257~=baseline byte-identical (surgical version does NOT fire in rally). raw_composite 0.6585>baseline 0.6393 (step5, rally factor>0). BLOCKED FROM KEEP: composite needs rally stab factor ~1.0 but rally is byte-identical pure RE-SEED - drew 0.484(step4)/0.627(step5) -> factor 0.0/0.42 -> composite 0.470/0.550<0.639. step6 proved (a) clean-sustained gate necessary (broad version sideways collapse), (b) rally exits not slope/time-driven (churn irreducible). NOT fishing for lucky rally seed (abfb9591 overfit mode). Mechanism is general trend-following improvement (ride clean sustained winners, keep giveback protection) - better generalization story than abfb9591; future sessions could revisit if rally robustness is solved.
