commit	score	mean_score	std_score	bull_2021	crash_bear	sideways	rally_2024	status	description
55b0e53f	0.572148	0.707846	0.271396	0.78	0.77	1.01	0.27	branch	BRANCH step2 (reset readiness accumulator on full exit). MEETS ALL KEEP CRITERIA vs baseline a5c60e3a (FALLBACK KEEP STATE = commit 55b0e53f). MEASURED: composite 0.519521->0.572148 (+0.0526), mean 0.678880->0.707846 (+0.029), std 0.318718->0.271396, raw_composite 0.639349->0.661393. bull 0.781251 + crash 0.767586 + sideways 1.013297 ALL BYTE-IDENTICAL raw (reset makes re-entry require fresh conviction = matches baseline 2-bar persist in strong/clear regimes -> step1 bull churn -0.222 FULLY RECOVERED). rally RAW 0.419353->0.469498 (+0.0501, Sharpe 0.736->0.86), rally STABILITY 0.609732->0.672046 (+0.0623), factor 0.365774->0.573487, rally score 0.153388->0.269251 (+0.116). MaxDD bull1.25/crash0.73/sideways0.45/rally1.85 (<10). FINDING: EMA readiness gate + reset-on-exit reproduces baseline clean trades in strong regimes (byte-identical) while EMA noise-robustness lifts BOTH rally raw and rally stability. THRESH=0 first-crossing is RHO-independent on clean data (accum bar1=(1-RHO)*margin, sign=sign(margin)) so RHO tuning is rally-isolated. Continuing branch: tune RHO up for more rally stability toward 0.80 knee.
c1bf3761	0.572148	0.707846	0.271396	0.78	0.77	1.01	0.27	branch	BRANCH step3 (RHO 0.5->0.65). BYTE-IDENTICAL to step2 on ALL metrics (composite 0.572148, every regime raw + stability factor identical). FINDING: RHO is INERT in [0.5,0.65] — reset-on-exit gate fires on the FIRST bar with margin>=0 after exit/flat (accum_1=(1-RHO)*m1, ready iff m1>=0, RHO-independent even under noise); the EMA multi-bar smoothing rarely engages since entries happen bar 1. RHO is NOT a useful lever; the reset + margin>=0 boundary are what matter. No progress (raw_composite delta 0; stagnation count 1/7). Next: probe THRESH>0 to move the entry decision boundary off the noisy margin~0 zone (rally-isolated: strong regimes have margin>>0 so stay byte-identical).
06747711	0.444655	0.638011	0.386711	0.78	0.77	1.01	-0.01	branch	BRANCH step4 (THRESH 0->0.10, RHO reverted to 0.5). bull/crash/sideways BYTE-IDENTICAL (THRESH rally-isolated: strong regimes margin>>0.10 -> enter bar1 unchanged). rally OVERSHOT: raw 0.469498->-0.010090 (Sharpe 0.86->-0.01 COLLAPSE), stability 0.672046->0.830 (factor 0.573487->1.0), score 0.269251->-0.010090. composite 0.572148->0.444655. FINDING: THRESH cleanly controls the rally raw/stability trade-off, BUT rally alpha LIVES in marginal-conviction entries (0<margin<0.2); excluding them (THRESH=0.10 needs m>=0.20 bar1) kills the edge to break-even while maxing stability. Steep curve -> optimum THRESH near 0. No progress (composite down; stagnation 2/7). Next: probe THRESH=0.03 for a shallow sweet spot, else conclude branch at step2 THRESH=0 (composite 0.572148, commit 55b0e53f).
601351fc	0.444655	0.638011	0.386711	0.78	0.77	1.01	-0.01	branch	BRANCH step5 (THRESH 0.10->0.03). BYTE-IDENTICAL to step4 (rally raw -0.010090, factor 1.0, composite 0.444655). FINDING: rally raw collapses to break-even already by THRESH=0.03 (m>=0.06 on bar1) -> rally marginal alpha lives in ULTRA-marginal entries (margin in (0,0.06)); any meaningful THRESH buffer excludes them. THRESH>0 is a DEAD END (knife-edge in-sample fit). Optimum confirmed at THRESH=0 (step2). No progress (stagnation 3/7). CONCLUDING branch at step2 (THRESH=0, RHO=0.5, commit 55b0e53f, composite 0.572148): reset-on-exit makes marginal rally alpha noise-robust WITHOUT excluding it.
e5a4defa	0.572148	0.707846	0.271396	0.78	0.77	1.01	0.27	keep	KEEP (NEW BASELINE, SUPERSEDES a5c60e3a 0.519521). Entry-readiness EMA-of-margin admission gate + reset-on-exit (subsystem redesign). MECHANISM: replaced instantaneous strong-sum threshold + max(curr,prev) anti-dip + min-over-2 persist stack with ONE EMA (RHO=0.5) of threshold-normalized conviction margin; enter when EMA-margin >= 0 (THRESH=0) AND trend-admit; accumulator RESET to 0 on every full exit so re-entry requires fresh conviction. MEASURED vs a5c60e3a: composite 0.519521->0.572148 (+0.0526), mean 0.678880->0.707846 (+0.0290), std 0.318718->0.271396, raw_composite 0.639349->0.661393. bull 0.781251 + crash 0.767586 + sideways 1.013297 raw BYTE-IDENTICAL (reset matches baseline 2-bar fresh-persist timing in strong/clear regimes; all stab factor 1.0). rally RAW 0.419353->0.469498 (+0.0501, Sharpe 0.736->0.86), rally STABILITY 0.609732->0.672046 (+0.0623), factor 0.365774->0.573487, rally score 0.153388->0.269251 (+0.1159). MaxDD bull1.25/crash0.73/sideways0.45/rally1.85 pct (<10). WHY (measured): no-reset variant cross-position EMA memory caused fast post-exit re-entry churn (bull raw -0.222); reset-on-exit eliminates it (bull byte-identical) while EMA noise-robustness lifts BOTH rally raw and rally stability vs discrete min/max gates. Branch: step1 no-reset (bull -0.222); step2 reset-on-exit THE FIX (this keep); step3 RHO 0.5->0.65 INERT; step4 THRESH 0.10 + step5 THRESH 0.03 both collapse rally raw (alpha in ultra-marginal margin-in-(0,0.06) entries). Re-run verified byte-identical (deterministic). NEW BASELINE 0.572148.
e5a4defa	0.572148	0.707846	0.271396	0.78	0.77	1.01	0.27	session-summary	SESSION: 2 independent architectural experiments (Exp1 discard, Exp2 branch-open) + 1 exploration branch (5 steps) KEPT. NEW BASELINE 0.572148 SUPERSEDES a5c60e3a 0.519521 (+0.0526 composite, +0.0290 mean). Exp1 discard: 2-of-3 majority persist gate -> rally raw +0.0436 but rally stab 0.610->0.176 + bull raw -0.222 (persist min-over-2 unanimity load-bearing). Exp2 branch-open: EMA-of-margin readiness gate (RHO=0.5 THRESH=0) replacing strong-sum threshold + anti-dip + persist; step1 no-reset gave SAME clean trades as Exp1 but rally stab 0.320 (EMA more noise-robust than majority-count for IDENTICAL trades = mechanism validated). BRANCH: step2 reset-on-exit = KEEP (bull/crash/sideways byte-identical, rally raw 0.469498 + stab 0.672046 both up); step3 RHO inert at THRESH=0; step4/5 THRESH>0 collapse rally raw. MECHANISM INSIGHTS: (a) EMA-smoothing the entry DECISION (not size) reduces entry-timing divergence = the rally-stability lever the persist catch-22 could not reach; (b) reset-on-exit prevents cross-position conviction-memory re-entry churn (recovered bull); (c) rally alpha lives in ultra-marginal (margin 0-0.06) entries so any THRESH buffer kills raw; (d) RHO inert at THRESH=0 (entries fire bar1 on first margin>=0). CROSS-EX CAUTION: rally gain via a GENERAL noise-robustness mechanism with other 3 regimes byte-identical (NOT a single-regime in-sample spike like cross-ex-failed abfb9591); recommend cross-exchange check before production. Branch concluded -> session ends.
30b5b144	0.5721	0.7082	0.2722	0.78	0.77	1.01	0.27	discard	ARCHITECTURAL continuous-admission entry-size ramp (floor-0.70 conv_atten -> size ramps 0..1 over EMA-margin _acc/ENTRY_RAMP_SCALE=0.40). INERT: composite 0.572148->0.572104, rally raw 0.469498->0.469623, rally stab 0.672046->0.671458; bull 0.781251->0.782104, crash byte-identical, sideways 1.013297->1.014709. FINDING: EMA-readiness gate already makes entries fire at solidly-positive margin (_acc above ~0.40 where ramp==conv_atten==1.0), so first-bar size STEP at admission boundary is NOT a tracking-error source; rally stability bottleneck is timing/existence of solidly-firing trades not boundary size.
9acd50f5	0.5672	0.7029	0.2715	0.79	0.74	1.01	0.27	branch	BRANCH OPEN: counter-trend scale-in PACE stretch (cache entry-dir-vs-ret_vlong counter-trend strength at entry; stretch _entry_full_bars_dyn by CT_PACE_STRETCH=2.5*ct, [2.0,3.0]->[2.0,5.5]). MECHANISM MOVES rally stability 0.672046->0.708619 (factor 0.573->0.695) = noise-immune per-trade pace spread cuts the timing-jitter tracking error. REGRESSION: too aggressive -> rally raw 0.469498->0.384889 (Sharpe 0.858->0.633), crash raw 0.767586->0.739812 (dead-cat longs over-slowed); bull 0.781251->0.790965, sideways byte-identical. rally final 0.269251->0.267651 (stab gain ~cancels raw loss). composite 0.572148->0.567168. FIX HYPOTHESIS: reduce CT_PACE_STRETCH to keep most stability gain (first bit of spreading helps most) while recovering counter-trend raw.
1ec97cd4	0.5739	0.7068	0.2660	0.79	0.74	1.01	0.28	branch	branch step2: CT_PACE_STRETCH 2.5->1.0. composite 0.567168->0.573870 (>baseline 0.572148) but mean 0.706846 (<baseline 0.707846 by 0.001 -> NOT a keep). rally final 0.267651->0.281972 (raw 0.453814, stab 0.686402, factor 0.621 -> stability gain now beats raw loss), bull 0.793269 (+0.012), crash 0.738848, sideways byte-identical. KEY: crash raw 0.739812(s=2.5)->0.738848(s=1.0) ~UNCHANGED => crash damage saturates at any stretch; crash -0.0287 is the sole drag pulling mean below baseline.
f73f8d7b	0.5736	0.7066	0.2659	0.79	0.74	1.01	0.28	branch	branch step3: vol_ratio gate (0.9-1.4) on the stretch to spare crash. INERT: all 4 regimes byte-identical to step2 (crash 0.738848, rally 0.281972 stab 0.686402, bull 0.792099, sideways 1.013297). FINDING: vol_ratio is regime-NORMALIZED (adaptive 200-bar baseline divides out each regime structural vol) so it sits ~1.0 in BOTH crash and rally -> cannot separate them. composite 0.573625, mean 0.706554.
548e6d79	0.5712	0.7051	0.2679	0.79	0.74	1.01	0.28	branch	branch step4: mild-|ret_vlong| gate (knee0.045 width0.030) to fade steep-drift stretch. WRONG AXIS: crash 0.738848->0.739140 (NOT spared, dead-cat longs have SMALL |ret_vlong| - bounces occur at a momentarily-flat 96-bar slope), rally raw 0.453814->0.473616 but stab 0.686402->0.675320 (rally shorts oppose a STRONG grinding uptrend = large |ret_vlong|, so the gate faded RALLY). rally final 0.281972->0.276781, composite 0.573870->0.571195, mean down. FINDING: |ret_vlong| magnitude separates crash/rally the WRONG way; the clean separator is drift SIGN (rally/bull counter-trend=shorts in uptrend, crash=longs in downtrend).
f5a9a58e	0.5732	0.7059	0.2652	0.79	0.74	1.01	0.28	branch	branch step5: uptrend-drift gate (smooth tanh, width0.03) to spare crash. rally kept (stab 0.686622 final 0.282536), bull 0.785698, crash 0.738848->0.741907 (only +0.003, barely spared), sideways identical. composite 0.573243, mean 0.705859 (still <baseline, NOT keep). ROOT CAUSE diagnosed: crash Sharpe ROSE 1.3106->1.3398 but score fell because crash TRADES 45->41 (below 50-trade sample_factor knee) + MaxDD 0.734->0.807. PROBE (ctv/vol): helped[bull,rally]/hurt[crash] split is regime-DIRECTIONAL, NOT separable by per-bar feature: ret_vlong sign mixed in all regimes (crash 45% up-drift, rally 46% down-drift); abs vol fails (bull median 0.68 HIGHEST yet helped, crash 0.47); rally beneficial shorts at near-zero drift = same as crash harmful trades.
be330ea3	0.5729	0.7058	0.2658	0.79	0.74	1.01	0.28	branch	branch step6: remove gate, gentler ungated stretch 1.0->0.5 to preserve crash trades. crash STILL 41 trades (45 baseline) => trade-count drop is a STEP effect at ANY stretch>0, NOT tunable. composite 0.572925, mean 0.705819 (worse than step2). rally final 0.281427 stab 0.684565 (still up). CONCLUSION: mechanism cannot reach keep.
-	0.5721	0.7078	0.2714	0.78	0.77	1.01	0.27	discard	BRANCH REVERTED to e5a4defa (strategy.py byte-identical, reproduces 0.572148). Counter-trend scale-in PACE stretch (cache entry-dir-vs-ret_vlong counter-trend strength; stretch _entry_full_bars_dyn). NEW FINDING (valuable): this is the first mechanism in many sessions to genuinely MOVE rally stability up — 0.672046->0.708619 (stretch2.5), ->0.686402 (stretch1.0); spreading counter-trend entry build cuts the per-bar position step from 1-bar entry-timing jitter. BEST (ungated stretch1.0, 1ec97cd4): composite 0.573870 (+0.0017), rally final 0.269251->0.281972 (+0.0127, raw 0.453814 x factor 0.621), bull 0.781251->0.793269, sideways byte-identical. BLOCKER: crash 0.767586->0.738848 because crash TRADES 45->41 (below 50-trade sample_factor knee) at ANY stretch magnitude (step effect, not tunable) + MaxDD 0.734->0.807; crash Sharpe ROSE 1.311->1.330 (not alpha loss). mean 0.706846 (-0.001) just below baseline = keep blocker. NOT GATE-ABLE: helped[bull,rally]/hurt[crash] split is regime-directional; vol_ratio inert (regime-normalized), |ret_vlong| separates backwards (crash dead-cat at near-flat 96-bar slope), abs vol fails (bull highest-vol yet helped), drift-sign keeps crash mixed-drift trades + rally beneficial shorts sit at near-zero drift = same as crash harmful trades. FUTURE: rally-timing-jitter IS movable; need a path that does not perturb crash sub-knee trade count.
e5a4defa	0.5721	0.7078	0.2714	0.78	0.77	1.01	0.27	session-summary	SESSION: 1 independent ARCHITECTURAL discard (Exp1) + 1 exploration branch (Exp2, 6 steps, REVERTED). Baseline e5a4defa UNCHANGED 0.572148 [bull 0.781251 stab0.830, crash 0.767586 stab0.966 (45 trades, sub-50-knee), sideways 1.013297 stab0.836, rally 0.469498 raw x 0.573 factor =0.269251 stab0.672046; binding=rally raw AND only stab-penalized regime]. strategy.py byte-identical to e5a4defa. Exp1 discard: continuous-admission entry-size ramp (floor-0.70 conv_atten -> ramp 0..1 over EMA-margin) INERT (rally stab byte-flat 0.672) — EMA-readiness gate already fires entries at solidly-positive margin, so the first-bar size STEP at the admission boundary is NOT a tracking-error source. Exp2 BRANCH (counter-trend scale-in pace stretch): FIRST mechanism in many sessions to MOVE rally stability up (0.672->0.709 at stretch2.5, ->0.686 at 1.0) by spreading counter-trend entry build (cuts per-bar position step from 1-bar entry-timing jitter); best ungated stretch1.0 composite 0.573870 (+0.0017) rally final +0.0127 bull +0.012 sideways flat, BUT crash 45->41 trades (below 50 sample_factor knee, STEP effect at any stretch>0, NOT tunable) + DD 0.734->0.807 -> crash -0.029 (Sharpe ROSE 1.311->1.330, not alpha) -> mean -0.001 = keep blocker. Split NOT gate-able (regime-directional): vol_ratio inert (regime-normalized), |ret_vlong| backwards, abs-vol fails (bull highest-vol yet helped). CROSS-EXPERIMENT: rally entry-timing-jitter IS a movable stability lever (validated); blocker is crash sub-knee trade-count fragility, not the rally mechanism.
9ce52003	0.5351	0.6644	0.2585	0.65	0.77	0.98	0.27	branch	BRANCH OPEN (architectural): churn-gated scale-in pace stretch STRETCH=1.0 gate tanh((len(_eh)-1.5)/0.6). vs e5a4defa: crash BYTE-IDENTICAL 0.767586 (gate off len<=1, preserves crash trade count = addresses prior blocker). rally stab 0.672046->0.708676 (factor 0.573487->0.695586, validated stretch lever works under churn gate) but rally raw 0.469498->0.382637 (-0.087 Sh0.86->0.63), rally score 0.269251->0.266157. bull raw 0.781251->0.646663 (-0.135 Sh1.556->1.244), bull stab 0.830->0.902 (unrewarded factor 1.0). sideways raw 1.013297->0.977053 (-0.036). composite 0.572148->0.535109, mean 0.707846->0.664365. DISCARD criteria but branch-eligible (new mechanism + rally stab up). Hypothesis for raw drop: stretch slows trend-aligned bursty entries (favor fast build). NEXT: AND a counter-trend gate so only counter-trend bursty entries stretch.
37d3165e	0.5700	0.7068	0.2736	0.78	0.77	1.01	0.26	branch	BRANCH step2: AND counter-trend gate ct_gate=tanh(-ret_long*pos_dir/0.04) on churn-gated stretch. vs e5a4defa: bull/crash/sideways BYTE-IDENTICAL (0.782435~0.781251 / 0.767586 / 1.013297) = ct gate fixes Exp1 trend-aligned raw damage. rally raw 0.469498->0.460123 (-0.009), rally stab 0.672046->0.672106 (FLAT). Comparing Exp1 (all bursty stab 0.709) vs step2 (ct-only bursty stab 0.672): the Exp1 stab gain originated from trend-aligned bursty entries (the component step2 removes). rally score 0.269251->0.263966. composite 0.570014 (-0.0021), mean 0.706821 (-0.001), raw_composite 0.657569 (step1 0.586->step2 0.658 progress). NEXT: soften churn gate center (len-1.5)/0.6 -> (len-1.0)/0.5 to catch more ct rally entries at len=2 (crash len=1 stays gate=0).
3b5f32f1	0.5697	0.7067	0.2739	0.78	0.77	1.01	0.26	branch	BRANCH step3: soften churn gate center 1.5->1.0 width 0.6->0.5 (len=1 stays gate=0 crash-protected, len=2 fires 0.96 vs 0.68). vs step2: bull/crash/sideways BYTE-IDENTICAL (0.782435/0.767586/1.013297); rally raw 0.460123->0.459234 (-0.0009 DOWN), rally stab 0.672106->0.672038 (flat). raw_composite 0.657569->0.657180 (-0.0004 NO PROGRESS). Catching more counter-trend bursty rally entries did NOT recover rally raw or move stab -> counter-trend bursty entries are not the lever. composite 0.569736, mean 0.706667.
e5a4defa	0.5721	0.7078	0.2714	0.78	0.77	1.01	0.27	session-summary	SESSION: 1 exploration branch (churn-gated scale-in PACE stretch, 3 steps, REVERTED), opened on Exp1 (no independent discards). Baseline e5a4defa UNCHANGED 0.572148 [bull 0.781251 Sh1.556 stab0.830, crash 0.767586 Sh1.311 stab0.966 (45tr sub-50-knee), sideways 1.013297 Sh1.941 stab0.838, rally 0.469498 raw x0.573 factor =0.269251 stab0.672046; binding=rally stab]. strategy.py verified byte-identical to e5a4defa post-revert. MECHANISM: stretch _entry_full_bars_dyn multiplicatively, gated on integer churn count len(_eh). NEW VALIDATED RESULT (load-bearing): the churn count len(_eh) IS a clean CRASH-PROTECTION gate — at len=1 (crash max) tanh((len-c)/w) is exactly 0 so crash stayed BYTE-IDENTICAL 0.767586 across ALL 3 steps; this SOLVES the prior session counter-trend-stretch blocker (crash 45->41 trades). Any future scale-in/entry-trajectory mechanism can churn-gate on len(_eh) to preserve crash trade count. STEP FINDINGS: Exp1 (churn-only STRETCH=1.0, ALL bursty entries): rally stab 0.672046->0.708676 (factor 0.573->0.696, the validated stretch lever) BUT bull raw 0.781251->0.646663 (-0.135 Sh1.556->1.244), rally raw 0.469498->0.382637 (-0.087), sideways raw -0.036; composite 0.535109. Step2 (AND counter-trend gate ct=tanh(-ret_long*pos_dir/0.04)): bull/crash/sideways BYTE-IDENTICAL (raw fully recovered), rally raw 0.460123 (-0.009), rally stab 0.672106 FLAT; composite 0.570014 raw_comp 0.657569. Step3 (soften gate (len-1.5)/0.6->(len-1.0)/0.5, catch len=2 ct entries): bull/crash/sideways byte-identical, rally raw 0.459234, stab flat; composite 0.569736 raw_comp 0.657180 (NO PROGRESS vs step2). CROSS-EXP CONCLUSION: the pace-stretch rally-STABILITY gain appears ONLY when TREND-ALIGNED bursty entries are stretched (Exp1 all-bursty moved stab +0.037; ct-only steps2/3 left stab FLAT 0.672 — the delta is exactly the trend-aligned component). But trend-aligned bursty stretching costs bull raw -0.135 (bull factor 1.0, unprotected). Counter-trend-only stretch is raw-safe but stab-inert. Best step composite 0.570014 < baseline 0.572148. Separating rally trend-aligned losers from bull trend-aligned winners needs a ret_vlong multi-day-trend classifier (bull +0.027 vs rally +0.006) = forbidden regime-detection overfit. PACE-STRETCH LEVER cannot beat baseline; CATALOGUED: len(_eh) churn-gate = reusable noise-immune crash-trade-count protector. Reverted via git checkout e5a4defa -- strategy.py; results.tsv append-only intact.
443690ed	0.435642	0.541252	0.211220	0.57	0.82	0.56	0.22	discard	ARCHITECTURAL temporal-EMA smoothing of fused soft EXIT pressure (RHO=0.5, SL path raw) — orphan HEAD 443690ed tested (prior session committed, never recorded). MEASURED vs e5a4defa: composite 0.572148->0.435642 (-0.1365), mean 0.707846->0.541252 (-0.166), raw_composite 0.661393->0.487225. bull raw 0.781251->0.568050 (-27pct), crash 0.767586->0.815415 (+6pct), sideways 1.013297->0.560008 (-45pct, stab 1.0->0.952), rally 0.269251->0.221534 (-18pct) but rally stab 0.672046->0.704741 (+0.033). DISCARD: composite+mean both down; bull/sideways catastrophic. EMA-smoothing soft exit pressure DELAYS exits — aids trending crash + rally stab but destroys tight-exit alpha in mean-reverting bull/sideways; exit-timing smoothing NOT symmetric to proven entry-timing EMA.
7808240e	0.553920	0.697526	0.287213	0.64	0.77	1.09	0.29	branch	BRANCH OPEN (churn-gated temporal-EMA smoothing of soft exit pressure). NEW MECHANISM: exit-pressure EMA, RHO=EXIT_EMA_RHO*tanh((len(_eh)-1.5)/0.6) — smooths exit timing only in high-churn bursts, raw exits when churn low. MEASURED vs e5a4defa: composite 0.572148->0.553920 (-0.018), mean 0.707846->0.697526, raw_composite 0.661393->0.635632. crash 0.767586 BYTE-IDENTICAL (low churn->gate off). rally raw 0.469498->0.487979 (+0.018), stab 0.672046->0.678464, score 0.269251->0.290288 (+0.021 on binding constraint). sideways raw 1.013297->1.092355 (+0.079, stab 1.0->0.860 factor still 1.0). bull raw 0.781251->0.639874 (-0.141 -18pct; stab 0.962->0.916 factor 1.0). WHY REGRESSION: bull churn bursts -> EMA delays pullback exits -> giveback Sharpe drag (crash spared by low churn). FIX HYP: attenuate exit-EMA gate in strong trends (abs(ret_long)) — bull strongest-trend WITH churn; keep moderate-trend rally + chop sideways gains.
-	0.487017	0.638104	0.302174	0.44	0.77	1.06	0.28	discard	INHERITED BRANCH RESOLVED (prior session interrupted mid-branch): churn-gated temporal-EMA smoothing of soft EXIT pressure (7808240e open + steps2-5 committed-but-unrecorded). Measured final HEAD 66a14b04 step5 vs baseline e5a4defa: composite 0.572148->0.487017 (-0.0851), mean 0.707846->0.638104, raw_composite 0.661393->0.560692. bull 0.781251->0.436805 (-44pct raw, stab 0.830->0.917: exit-EMA delayed bull pullback exits -> giveback Sharpe drag; steps2-5 trend/peak/align gates did NOT recover bull, WORSE than branch-open 0.640). crash 0.767586 BYTE-IDENTICAL (low-churn gate off). sideways 1.013297->1.064763 (+0.051). rally 0.269251->0.283263 (+0.014, raw 0.469498->0.478752, stab 0.672046->0.677501). DISCARD: composite+mean both down, bull catastrophic. 3rd CONFIRMATION (cf 443690ed, cf3add9f): EXIT-pressure smoothing/delay destroys bull+sideways tight-exit alpha = DEAD END, do not retry exit smoothing. Reverted strategy.py via git checkout e5a4defa (byte-identical verified). Baseline e5a4defa UNCHANGED 0.572148.
