commit	score	mean_score	std_score	bull_2021	crash_bear	sideways	rally_2024	status	description
a626ded6	0.914942	1.011627	0.322285	1.382833	0.918171	1.295813	0.989660	0.471659	discard	Exp2 (architectural, indep): LOW-VOL counter-trend bounce-long admission relaxation. NEW data dep: _bull_strong_min depends on (ret_vlong, vol_ratio) -- calm ct bounce-longs (ret_vlong<0, vol_ratio<1) get 8pct lower admission bar. MEASURED vs baseline feda0ffa 0.919756: composite 0.914942 (-0.004814 REGRESSION), mean 1.011627 (-0.003207). PER-REGIME: mixed 0.487707->0.471659 (-0.0160 REGRESSED, trade count unchanged 45, WR 100->97.8pct -- admitted WORSE bounce-longs not more of them), rally +0.00001 flat, sideways/crash/bull byte-identical (ct indicator ~0 / calm gate 0 as designed). CONCLUSION (verifiable): mixed is NOT admission-constrained -- its 45 trades are already the quality bounces; lowering the bar adds losers (WR down) without adding count, diluting score. Counter to feda0ffa entry-boost direction: size on CONFIRMED bounces helps, but admitting UNCONFIRMED ones hurts.
4cbcd9d3	0.920001	1.015074	0.316908	1.382833	0.918172	1.295813	0.990845	0.487707	discard	Exp3 (architectural, indep): MULTI-DAY COUNTER-TREND small-winner de-risk floor RAISE. NEW data dep: _de_floor depends on (ret_vlong, pos_dir, peak_pnl) -- ct-at-multi-day (ret_vlong*pos_dir<0) small-peak (peak<1.6*_pp_min) winners get floor 0.55->0.80 (near-binary fast harvest). MEASURED vs baseline feda0ffa 0.919756: composite 0.920001 (+0.000245 SUB-NOISE, <0.003 threshold), mean 1.015074 (+0.000240). PER-REGIME: mixed BYTE-IDENTICAL 0.487707 (gate did NOT fire for mixed -- mixed bounce-longs ret_vlong modestly negative so /0.04 tanh is mid-range not ~1, OR peak already above 1.6*_pp_min for the trades that matter; hypothesis untested), rally 0.989648->0.990845 (+0.001197 -- gate fired on RALLY pullback-shorts pos_dir=-1 in uptrend ret_vlong>0, raising their floor = faster harvest of small ct shorts), sideways/crash/bull byte-identical. Sub-noise + mixed untouched -> discard. OBSERVATION (correlational): the ct-small-winner floor-raise mechanism has a real rally pullback-short effect, just sub-threshold here.
43bad5cf	0.913933	1.009205	0.317574	1.382833	0.918172	1.295813	0.961499	0.487707	discard	Exp4 (architectural, indep): MULTI-DAY COUNTER-TREND early-winner scale-in ACCELERATOR. NEW data dep: scale-in pace depends on (ret_vlong, pos_dir, pos_pnl) -- ct-at-multi-day early winners get 0.8-bar faster scale-in. MEASURED vs baseline feda0ffa 0.919756: composite 0.913933 (-0.005823 REGRESSION), mean 1.009205 (-0.005629). PER-REGIME: mixed BYTE-IDENTICAL 0.487707 (gate did NOT fire for mixed -- KEY LEARNING: mixed_2025 is decline+rally+chop+crash, ret_vlong(96-bar) is NOT reliably negative; the ct-direction gate ret_vlong*pos_dir<0 misses mixed's chop-phase longs where ret_vlong~0 or positive), rally 0.989648->0.961499 (-0.0282 REGRESSED -- gate fired on RALLY pullback-shorts pos_dir=-1 in uptrend ret_vlong>0, growing them bigger pre-loss), sideways/crash/bull byte-identical. CROSS-EXPERIMENT CONCLUSION (verifiable, this session): direction-keyed ret_vlong gates (ret_vlong*pos_dir<0, requires multi-day DOWN for longs) do NOT target mixed reliably because mixed_2025 contains rally+chop phases with positive/zero ret_vlong. The feda0ffa keep's |ret_vlong| (WEAK-trend, direction-AGNOSTIC) gate is the correct mixed separator, not direction-keyed. Do not use ret_vlong*pos_dir sign to target mixed.
f4fc769b	0.919698	1.014755	0.316856	1.382833	0.918172	1.295414	0.989648	0.487708	discard	Exp5 (architectural, indep): WEAK-TREND x LOW-ER small-winner de-risk floor RAISE. NEW data dep: _de_floor depends on (ret_vlong, _er, peak_pnl, pos_pnl). Uses feda0ffa-correct DIRECTION-AGNOSTIC weak-trend gate (1-tanh(|ret_vlong|/0.03)) x low-ER chop separator (fires ER<0.25, sideways ER higher -> byte-identical) x small-peak x winning. MEASURED vs baseline feda0ffa 0.919756: composite 0.919698 (-0.000058 SUB-NOISE flat), mean 1.014755 (-0.000079). PER-REGIME: mixed BYTE-IDENTICAL 0.487708 (5th exit-side experiment -- gate did NOT fire for mixed; CROSS-SESSION CONFIRMED: mixed's held positions rarely reach the de-risk ramp with gate active because mixed exits via TIME pressure crossing the binary _exit_thresh, NOT via the de-risk floor ramp), sideways 1.295813->1.295414 (-0.0004 minor leak), rally/crash/bull byte-identical. CROSS-EXPERIMENT CONCLUSION (verifiable, this session): mixed EXIT-SIDE is SATURATED -- 3 exit-side experiments (Exp3 de-risk floor, Exp4 scale-in accel, Exp5 de-risk floor weak-trend) all BYTE-IDENTICAL for mixed because mixed's binding exit is TIME pressure (binary threshold path), not the de-risk ramp. Exit-side changes do not engage mixed. Only ENTRY-side (feda0ffa) moves mixed.
-	0.919756	1.014834	0.316927	1.382833	0.918172	1.295813	0.989648	0.487707	session-summary	SESSION (baseline feda0ffa 0.919756 -> UNCHANGED, no keep): 5 independent ARCHITECTURAL experiments (Exp1-5, ALL discards, exit rule met). BASELINE: composite 0.919756, mixed 0.488 is the binding low regime (Sh 0.81, APY 4.4pct, 45 trades, 100pct WR, sample_factor 0.949). Exp1 weak-trend x winning max_hold EXTENSION (time-pressure) -- mixed -0.019, rally -0.026 (longer holds = more giveback in chop, hypothesis WRONG). Exp2 low-vol ct bounce-long admission relaxation -- mixed -0.016, WR 100->97.8pct (admitted worse trades not more; mixed not admission-constrained). Exp3 multi-day-ct small-winner de-risk floor raise -- mixed BYTE-IDENTICAL (gate missed mixed), rally +0.0012 (fired on rally pullback-shorts). Exp4 multi-day-ct early-winner scale-in accelerator -- mixed BYTE-IDENTICAL, rally -0.028 (fired on rally ct shorts, grew losers). Exp5 weak-trend x low-ER small-winner de-risk floor (feda0ffa-correct gate) -- mixed BYTE-IDENTICAL, sideways -0.0004. CROSS-EXPERIMENT CONCLUSIONS (verifiable, this session): (1) DIRECTION-KEYED ret_vlong*pos_dir gates MISS mixed because mixed_2025 = decline+rally+chop+crash, ret_vlong not reliably negative -- the feda0ffa DIRECTION-AGNOSTIC weak-trend gate (1-tanh(|ret_vlong|/0.03)) is the correct mixed separator. (2) mixed EXIT-SIDE is SATURATED: 3 exit-side experiments (Exp3/4/5, different gates) all BYTE-IDENTICAL for mixed because mixed's binding exit is TIME pressure crossing the binary _exit_thresh, NOT the de-risk ramp / scale-in / pp_pressure -- exit-side changes do not engage mixed's trades. (3) mixed is NOT admission-constrained (Exp2) and does NOT benefit from longer holds (Exp1). Only ENTRY-SIDE weak-trend boosts (feda0ffa) move mixed. NEXT SESSION: mixed entry-side is the only live lever; consider entry-SIZE deepening on the feda0ffa gate (magnitude/cap), or accept mixed at 0.488 floor and target rally/crash (the next-weakest) instead. Exit rule: 5 consecutive architectural discards -> stop.
37736c79	0.910635	1.007394	0.322532	1.384375	0.918832	1.295780	0.964615	0.473371	discard	Exp1 (architectural, indep): PRICE-EXTENSION attenuator on entry-boost product. NEW data dep (close vs slow EMA distance, vol-normalized z-score) + new control point (boost product multiplier, fires when extension>1.5 vol-units in a trend, max 0.20 cut). Targeted rally DD-reduction lever (feda0ffa keep proved rally DD-relief via entry over-commitment removal is viable). MEASURED vs baseline feda0ffa 0.919756: composite 0.910635 (-0.009121 FAIL), mean 1.007394 (-0.007440 FAIL), std 0.322532 (+0.0056 worse). PER-REGIME all stab 1.0 raw==score: bull 1.382833->1.384375 (+0.001542 Sh2.068->2.070 DD2.49 unchanged), crash 0.918172->0.918832 (+0.000660 Sh1.254->1.255), sideways 1.295813->1.295780 (flat), rally 0.989648->0.964615 (-0.025033 Sh1.552->1.524 DD5.120863->5.120846 UNCHANGED), mixed 0.487707->0.473371 (-0.014336 Sh0.808->0.794). MECHANISM WRONG: hypothesis was entry-boost over-commitment at extended prices drives rally DD; measured rally DD UNCHANGED at 5.1208 (byte-identical) while Sh dropped -- the attenuator cut rally trend-entry SIZE (shrinking winners -> lower Sharpe) but DD is giveback-PATH-driven (riding winners through pullbacks via _pp/_ts_supp/_max_hold), NOT first-bar-entry-size-driven. feda0ffa's DD gain came from removing the 2 SPECIFIC mixed-cell terms (targeted), not a blanket boost-product attenuator. mixed -0.0143: mixed bounce-longs also attenuated (smaller winners). bull/crash marginal gains sub-noise. NOT branch-eligible: target regime (rally) regressed via the mechanism's own hypothesis being wrong (DD path is exit-side, entry-size attenuator cannot reach it); no architectural promise in this direction. Reverted to feda0ffa (path-scoped git checkout, results.tsv untouched). KEY: rally DD 5.12 is giveback-PATH-driven (exit-side), confirming prior-session exit-side saturation for rally DD-reduction via entry-size; the feda0ffa entry-over-commitment lever is SPECIFIC-term-removal (mixed-cell terms), not a blanket extension gate.
09677594	0.774583	0.843341	0.229195	1.131101	0.918172	0.685354	0.994373	0.487707	discard	Exp2 (architectural simplification, indep): REMOVE vol-conditioned profit-side _w_pp amplification (the +20pct pp-weight boost in high-vol). Hypothesis: it over-harvested crash 100pct-WR shorts (contradicting 99a369a1 keep that proved crash winners need harvest protection); crash return-limited with DD headroom -> removing lets winners ride -> higher APY. MEASURED vs baseline feda0ffa 0.919756: composite 0.774583 (-0.145173 CATASTROPHIC), mean 0.843341 (-0.171493), std 0.229195. PER-REGIME all stab 1.0 raw==score: bull 1.382833->1.131101 (-0.251732 Sh2.068->1.715 APY20.4->16.1 DD2.49->2.60), crash 0.918172->0.918172 (BYTE-IDENTICAL Sh1.254 APY11.82 DD2.46 -- TARGET REGIME INERT), sideways 1.295813->0.685354 (-0.610459 Sh2.030->1.306 APY14.2->6.94 -- 52.9pct of baseline, near 50pct gate), rally 0.989648->0.994373 (+0.004725 Sh1.552->1.558), mixed BYTE-IDENTICAL 0.487707. min_stab 0.815927. FAILURE MECH (direct measurement): crash was BYTE-IDENTICAL because crash's _pp_pressure rarely wins the MAX argmax (slope-against/slope/time/sl dominate crash exits) -> changing _w_pp weight does not alter crash exit decisions. The _vol_w_pp amplification IS load-bearing but for SIDEWAYS and BULL not crash: sideways has vol_ratio>1.0 vol-spike stretches where the +20pct pp amplification harvested sideways winners; removing it let those winners ride into giveback -> sideways Sharpe collapsed 2.030->1.306. Bull-2021 high-vol stretches likewise. The hypothesized mechanism contradiction (crash over-harvest) was WRONG -- crash pp is inert; the amplification helps sideways/bull vol-spike winners. CONFIRMS _vol_w_pp is load-bearing (do NOT remove). NOT branch-eligible: target regime (crash) byte-identical (premise wrong), sideways catastrophic -0.610 (near 50pct gate breach, not a tunable regression -- the amplification is structurally required for sideways vol-spike exits). Reverted to feda0ffa (path-scoped git checkout, results.tsv untouched). LESSON: crash exits are dominated by slope-against/sl/time NOT pp -- pp-weight changes cannot reach crash; crash's return-limitation is NOT pp-over-harvest (it's a different cause, possibly position sizing or the bear move being shallow). KEY: _vol_w_pp is load-bearing for sideways/bull vol-spike harvesting; crash pp is argmax-inert.
60852931	0.863116	0.948083	0.283224	1.379646	0.918819	0.964003	0.990241	0.487707	discard	Exp3 (architectural, indep): BTC-LEADER-CONFIRMATION factor on tp-extension harvest suppression (_ts_supp). NEW cross-symbol data dep on EXIT harvest path: 4th multiplicative factor tanh(_btc_trend*pos_dir/0.03) on _ts_supp -> drops suppression (harvests winner) when BTC multi-day trend turns AGAINST a winning alt position (leader reversal), byte-identical when BTC confirms. Routed through existing _tp_scale (NOT a new MAX source). Hypothesis: BTC leads alts on regime turns; harvesting at leader reversal caps the giveback-path DD (Exp1 confirmed entry-size cannot reach rally DD). MEASURED vs baseline feda0ffa 0.919756: composite 0.863116 (-0.056640 FAIL), mean 0.948083 (-0.066751), std 0.283224 (lower). PER-REGIME all stab 1.0 raw==score: bull 1.382833->1.379646 (-0.003187 Sh2.068->2.065 APY20.4->20.4 DD2.49), crash 0.918172->0.918819 (+0.000647 Sh1.254 APY11.8 DD2.46), sideways 1.295813->0.964003 (-0.331810 Sh2.030->1.543 APY14.2->9.44 DD1.88->1.11 -- 74.4pct of baseline), rally 0.989648->0.990241 (+0.000593 Sh1.552->1.553 DD5.120863 BYTE-IDENTICAL -- TARGET UNREACHED), mixed BYTE-IDENTICAL 0.487707. min_stab 0.839533. FAILURE MECH (direct measurement): rally DD byte-identical because rally's BTC 96-bar trend is STRONGLY positive throughout rally (confirms rally longs at every pullback) -> _btc_leader_confirm~1 -> _ts_supp unchanged -> mechanism never fires for rally (the target). Instead the factor fires on SIDEWAYS: sideways is chop where BTC trend is WEAK and often mildly against sideways winning positions -> _btc_leader_confirm drops -> _ts_supp drops -> harvest fires prematurely on sideways winners -> Sh collapses 2.030->1.543 (DD did drop 1.88->1.11 confirming harvest fired, but at Sharpe cost far exceeding DD gain). CONFIRMS: BTC leader-reversal does NOT separate rally pullbacks (BTC stays strongly up) from genuine reversals; the leader trend is too SLOW/coarse to distinguish a rally pullback (BTC 96-bar trend intact) from a real regime turn. CROSS-EXPERIMENT: BTC-leader cross-symbol exit signals are inert for rally (BTC confirms rally) and harmful for sideways (BTC weakly against chop winners) -- extends the documented cross-symbol EXIT wall to the tp_harvest path. NOT branch-eligible: target (rally) byte-identical (premise wrong -- BTC does not reverse against rally pullbacks), sideways -0.332 catastrophic (not tunable -- the slow BTC trend is structurally too coarse for sideways chop). Reverted to feda0ffa (path-scoped git checkout, results.tsv untouched). LESSON: BTC 96-bar trend does NOT reverse during rally pullbacks (too slow/coarse); leader-reversal exit signals cannot reach rally DD. KEY: rally's BTC trend is strongly positive throughout -> any BTC-leader exit gate is byte-identical for rally; the giveback-path rally DD requires a FASTER/own-symbol signal than BTC 96-bar trend.
ae79c4b0	0.918167	1.013359	0.317306	1.383214	0.918363	1.295177	0.983246	0.486795	discard	Exp4 (architectural simplification, indep): REMOVE _btcdvp_boost (BTC DVP x BTC-price-trend-agreement conjunction boost, Exp2-keep). Simplification/redundancy re-test at feda0ffa baseline (baselines shift -- prior 775a7d5b tested _dvp_boost removal at older baseline). Hypothesis: fires +0.05 for rally trend entries (BTC uptrend + BTC buy-volume both saturate in rally) = candidate rally over-committer (feda0ffa pattern: removing over-committing terms gains rally DD relief); risk = also confirms crash shorts. MEASURED vs baseline feda0ffa 0.919756: composite 0.918167 (-0.001589 SUB-NOISE FAIL), mean 1.013359 (-0.001475), std 0.317306. PER-REGIME all stab 1.0 raw==score: bull 1.382833->1.383214 (+0.000381 Sh2.068->2.069 byte-near-identical), crash 0.918172->0.918363 (+0.000191 Sh1.254 byte-near-identical), sideways 1.295813->1.295177 (-0.000636 Sh2.030->2.032), rally 0.989648->0.983246 (-0.006402 Sh1.552->1.545 APY18.5->18.3 DD5.120863->5.120860 BYTE-IDENTICAL), mixed 0.487707->0.486795 (-0.000912 Sh0.808->0.807). min_stab 0.843242. FAILURE MECH (direct measurement): _btcdvp_boost is LOAD-BEARING for rally Sharpe (genuine trend-entry confirmation -- removing cut rally winners -> Sh1.552->1.545, APY18.5->18.3) BUT rally DD stayed BYTE-IDENTICAL at 5.1209 (entry-size reduction does NOT reduce rally DD). CROSS-EXPERIMENT CONCLUSION (verifiable, this session -- 2nd confirmation after Exp1): rally DD is UNAFFECTED by entry-boost/entry-size changes. Exp1 (blanket extension attenuator, rally DD 5.1208 byte-identical) AND Exp4 (removing a specific boost term, rally DD 5.1209 byte-identical) BOTH cut rally entry sizes without moving DD. The feda0ffa keep's rally DD drop (5.158->5.121) was therefore NOT from entry-size reduction -- it must have been from the mixed-cell terms altering WHICH rally entries fired (a cascade through scale-in/grid/emission timing), not their SIZE. This SEPARATES two mechanisms: (a) entry-SIZE reduction does NOT reduce rally DD (Exp1, Exp4); (b) the feda0ffa mixed-cell removal reduced rally DD via entry-SET/timing changes (not size). The 'remove over-committing terms for rally DD relief' lever is NOT generalizable to size -- only the specific mixed-cell terms' timing effect worked. NOT branch-eligible: rally -0.0064 (term load-bearing for Sharpe, not over-committing DD); target mechanism (DD-reduction via size) confirmed inert by 2 experiments. Reverted to feda0ffa (path-scoped git checkout, results.tsv untouched). LESSON: _btcdvp_boost is load-bearing (genuine rally trend confirmation); entry-SIZE is decoupled from rally DD (2x confirmed); rally DD-reduction via entry-size/boost removal is a DEAD axis except for the specific feda0ffa mixed-cell timing-cascade.
