commit	score	mean_score	std_score	bull_2021	crash_bear	sideways	rally_2024	status	description
606b7889	0.705424	0.778078	0.242178	1.016124	0.720320	1.072783	0.670171	0.410990	branch	branch step3: GENTLER slope gate (onset slope-conf 0.5, fade to 0 at 0.75). MEASURED vs step2 0.705101: composite 0.705424 (+0.000323 tiny progress), mean 0.778078. PER-REGIME all stab 1.0: bull 1.016124 (SAME as step2, -0.0098 vs baseline -- gate still spares bull strong-slope), crash BYTE-IDENTICAL, sideways 1.070244->1.072783 (+0.0025, +0.0062 vs baseline IMPROVED), rally BYTE-IDENTICAL 0.670171 (STILL not firing -- rally contractions have slope-conf >0.75), mixed BYTE-IDENTICAL 0.410990 (STILL not firing). DIAGNOSIS: the slope gate (even gentler) still blocks rally/mixed -- their contraction-exits coincide with slope-conf >0.75 (still strongly confirming), so they are NOT exhaustion-driven exits. step1 ungated: rally +0.0036 mixed +0.0014 (contraction fires); step2/3 gated: back to baseline. No slope-threshold separates bull from rally/mixed on this signal. PIVOT: the real separator is VOL_RATIO -- bull-2021 is HIGH-VOL sharp uptrend (inside bars = consolidation-then-breakout CONTINUATION, bad to harvest), rally-2024 is LOW-VOL grinding uptrend (inside bars precede pullbacks, giveback-prone, good to harvest). Same low-vol-grind separator as the MTM-chop throttle (validated). Gate by low vol_ratio instead of slope.
99a369a1	0.912878	1.009061	0.320613	1.382650	0.917980	1.294241	0.973853	0.476584	session-summary	SCORING CHANGE (2026-06-24): return_reward(calmar) REPLACED by return_bonus=log(1+max(APY,0)/10+1); dd_gate soft_start knee 8->5 (blocks leverage farming without hardcap). strategy.py UNCHANGED at 99a369a1. Old calmar double-rewarded DD reduction (DD drop raised BOTH dd_gate AND calmar=APY/DD); 99a369a1's old +0.017 composite was 68-93% DD-driven (APY dropped). New scoring: Sharpe gain dominates DD reduction 11-36x on 4/5 regimes under realistic margins (+0.2Sh vs -0.5%DD vs +2%APY); farming blocked at 1.1x leverage (dd_gate knee@5 bites before APY bonus gains). Per-regime: bull 1.383 Sh2.068 APY20.4 DD2.49, crash 0.918 Sh1.254 APY11.8 DD2.46, sideways 1.294 Sh2.027 APY14.2 DD1.88, rally 0.974 Sh1.553 APY18.6 DD5.16, mixed 0.477 Sh0.808 APY4.4 DD2.78. All stab 1.0 raw==score. New baseline 99a369a1 composite 0.912878 (NOT comparable to old 0.706007 -- different scoring formula). pytest 21 passed.
99a369a1	0.912878	1.009061	0.320613	1.382650	0.917980	1.294241	0.973853	0.476584	keep	RE-BASELINE keep row (new scoring v3): strategy.py UNCHANGED at 99a369a1, recomputed under return_bonus+dd_gate(knee=5). Old keep row (0.706007) used calmar return_reward+dd_gate(knee=8) — NOT comparable. All per-regime: bull 1.383 Sh2.068 APY20.4 DD2.49, crash 0.918 Sh1.254 APY11.8 DD2.46, sideways 1.294 Sh2.027 APY14.2 DD1.88, rally 0.974 Sh1.553 APY18.6 DD5.16, mixed 0.477 Sh0.808 APY4.4 DD2.78. All stab 1.0 raw==score.
-	0.912878	1.009061	0.320613	1.382650	0.917980	1.294241	0.973853	0.476584	session-summary	NEW BASELINE 99a369a1 0.912878 (new scoring v3: return_bonus+dd_gate knee@5). SUPERSEDES old 99a369a1 0.706007 (calmar return_reward+dd_gate knee@8) — composite NOT comparable across the scoring change. strategy.py byte-identical (0 diff). This row + the re-baseline keep row above establish 0.912878 as the baseline for all future experiments. Scoring change rationale: old calmar double-rewarded DD reduction (3.8-4.6x more efficient than Sharpe gain); new return_bonus rewards APY directly, dd_gate knee@5 blocks leverage farming without hardcap. See commit ce0a5f7b.
8524f3f8	-	-	-	1.366644	0.917980	1.256797	0.974260	0.476584	discard	Exp1 (architectural, indep): DISABLED PORT_DD_TP_HARVEST_RELAX (0.60->0.0) -- APY-vs-DD scoring-flip test. v3 scoring change replaced calmar return_reward (doubly-rewarded DD reduction) with return_bonus=log(2+APY/10) (rewards APY directly); dd_gate knee 8->5. The harvest weakens trend-extension suppression (_ts_supp) during portfolio DD so clean trend winners get partially harvested to cap DD. Under calmar this was doubly rewarded; under v3 hypothesis: the APY sacrificed (trend winners harvested instead of run) now outweighs the DD-cap benefit (4/5 regimes DD<3pct on dd_gate flat shoulder ~0.97). MEASURED vs 99a369a1 0.912878: composite 0.905335 (-0.007543 FAIL), mean 0.998453 (-0.010608 FAIL), std 0.320613->0.310392 (tighter), min_stab 0.844331 unchanged. PER-REGIME all stab 1.0 all raw==score: bull 1.382650->1.366644 (-0.016006 Sh2.0678->2.0320), crash BYTE-IDENTICAL 0.917980 (Sh1.2539 -- harvest does not fire on crash, confirmed), sideways 1.294241->1.256797 (-0.037444 Sh2.0270->2.0060), rally 0.973853->0.974260 (+0.000407 noise Sh1.5529->1.5535 -- byte-identical-ish, harvest measured not to fire on rally keep 91c4496a), mixed BYTE-IDENTICAL 0.476584 (Sh0.8075). FAILURE MECH (architectural fact, direct measurement): the harvest is NOT just a DD-cap -- it is APY-RAISING for trend regimes. Locking realized gains at deep peaks AVOIDS the subsequent giveback (peak->pullback->re-peak oscillation), so harvested positions realize more PnL than ride-the-winner -> higher APY -> return_bonus. Disabling loses APY on bull (-0.016) and sideways (-0.037) which outweighs the DD-cap benefit under v3 (their DD<3pct on dd_gate flat shoulder means dd_gate gain from capping is negligible). The scoring change did NOT flip this lever: the APY-via-giveback-avoidance mechanism dominates the DD-cap mechanism even when DD is rewarded less. Harvest remains load-bearing under v3. Extends documented giveback-tightening/harvest load-bearing conclusion to v3 scoring. NOT branch-eligible (no regime improved meaningfully: rally +0.0004 is noise; mixed/crash byte-identical; the mechanism removal is a confirmed dead-end removal not a new direction). Rev to 99a369a1. 1st architectural discard.
affdf6c0	-	-	-	0.000000	0.916226	1.301451	0.545201	0.476584	discard	Exp2 (architectural, indep): loosen PORT_DD_GIVEBACK_TIGHTEN 0.50->0.25 (APY-vs-DD flip on giveback TOLERANCE, distinct from Exp1 tp_harvest). Hypothesis: under v3 return_bonus=APY the earlier harvest (tighter giveback) costs APY while DD-cap less rewarded -> loosen so trend winners ride. MEASURED vs 99a369a1 0.912878: composite 0.516521 (-0.396357 CATASTROPHIC FAIL), mean 0.647892 (-0.361169), std 0.320613->0.437904 (much looser), min_stab 0.844331->0.452837 (below 0.50 knee). PER-REGIME: bull 1.382650->0.000000 (STABILITY 1.0->0.0 SCORE ZEROED -- loosened giveback exit-timing noise flipped bull below 0.50 stab knee, Sh2.068 unchanged so signal intact but stab collapsed), crash 0.917980->0.916226 (-0.0018 near-flat), sideways 1.294241->1.301451 (+0.007209 Sh2.027->2.037 -- the predicted ride gain), rally 0.973853->0.545201 (-0.428652 Sh1.553->1.442 DD5.16->6.15pct -- DD rose deeper past knee, Sharpe dropped from less harvest), mixed BYTE-IDENTICAL 0.476584. FAILURE MECH (architectural fact, direct measurement): the giveback tightening is NOT flippable under v3. Two distinct failure modes: (1) BULL STABILITY COLLAPSE -- loosening the giveback tolerance changes the pp_pressure exit-timing amount bar-to-bar, and the EMA-span-3 sweet spot (keep 7a5e2422) is FRAGILE: even 0.50->0.25 loosening introduces enough exit-timing noise to flip bull's stability below the 0.50 knee -> score zeroed; (2) RALLY DD RISE -- less giveback tightening = winners ride deeper pullbacks -> rally DD 5.16->6.15pct (deeper into dd_gate exp penalty) AND Sharpe drops (less profit locked). The DD-cap benefit of tightening is load-bearing for rally DD staying near the 5pct knee AND for bull stability. v3 scoring change did NOT flip this lever either: the DD-cap is essential (rally past knee@5, bull stab at knee) not optional. Exp1+Exp2 together confirm: BOTH portfolio-DD-adaptive mechanisms (tp_harvest relax + giveback tighten) remain load-bearing under v3 -- the scoring change (calmar->return_bonus, knee 8->5) did NOT flip them because (a) tp_harvest is APY-raising via giveback-avoidance (Exp1) and (b) giveback tighten is DD-essential for rally+bull stab (Exp2). NOT branch-eligible (sideways +0.007 tiny, no useful signal; bull/rally catastrophic). Rev to 99a369a1. 2nd architectural discard.
bce12aac	-	-	-	0.245336	0.904911	1.259269	0.973753	0.476286	discard	Exp3 (architectural, indep): raise tp_harvest base magnitude 0.45->0.55 (deeper APY-raising harvest under v3). Hypothesis: Exp1 confirmed tp_harvest is APY-raising via giveback-avoidance; prior session walled at 0.50 under calmar BEFORE Exp4 multi-day _ts_supp fix; post-fix crash shielded -> under v3 deeper harvest (0.55) raises mixed APY. MEASURED vs 99a369a1 0.912878: composite 0.662864 (-0.250014 CATASTROPHIC FAIL), mean 0.771911 (-0.237150), std 0.320613->0.363489, min_stab 0.844331->0.757562. raw_composite 0.674410 != composite (stab penalty applied to bull). PER-REGIME: bull 1.382650->0.245336 (-1.137314 CATASTROPHIC, Sh2.0678->1.2057, DD2.49->6.61pct, stab1.0->0.859 -- OVER-HARVESTED bull trend winners: deeper harvest trimmed bull's clean trend longs at their peaks -> less ride -> DD rose 2.49->6.61 + Sharpe dropped; 50pct GATE BREACHED 0.245/1.383=17.7pct), crash 0.917980->0.904911 (-0.013069 Sh1.2539->1.2495 -- crash shield held mostly, small leak), sideways 1.294241->1.259269 (-0.034972 Sh2.0270->2.0021), rally BYTE-IDENTICAL 0.973753 (Sh1.5534 -- harvest does not fire on rally), mixed BYTE-IDENTICAL 0.476286 (Sh0.8070 -- mixed deep peaks _ts_supp~0 already fully unsuppressed at 0.45, deeper mag did NOT bind on mixed: mixed's reachable harvest events are NOT at the deep-peak tp_ratio where 0.55 differs from 0.45). FAILURE MECH (architectural fact, direct measurement): (1) the tp_mag ceiling is ~0.45-0.50, NOT flippable upward -- 0.55 over-harvests bull trend winners (the prior 0.50 wall under calmar held for crash post-Exp4, but bull's over-harvest threshold is lower than crash's); (2) mixed BYTE-IDENTICAL confirms mixed's reachable harvest events are already at the flat-shoulder of the tp_ratio tanh activation -- raising mag 0.45->0.55 does not change mixed's harvest because mixed's harvest events are NOT at the deep-peak tp_ratio where the magnitude scales. Extends the documented mixed tp_harvest wall: mixed is walled on tp_mag (not just _ts_supp) because its reachable harvest events are not at the magnitude-sensitive deep-peak region. NOT branch-eligible (bull catastrophic 50pct gate breach, no useful signal; mixed byte-identical = the target mechanism did not engage). Rev to 99a369a1. 3rd architectural discard.
05d1e40e	-	-	-	0.951863	0.918033	1.303900	0.969839	0.359294	discard	Exp4 (architectural, indep): 9th voter -- PRICE ACCELERATION (2nd derivative of log price). Build on prior-session CROSS-EXPERIMENT CONCLUSION (keep 5a748c8a: a new orthogonal data-source voter is the ONLY un-disproven axis for moving regime raw). The 8 existing voters measure 1st-derivative/level/MA-crossover/efficiency but NONE measures 2nd derivative (rate of change of momentum). Acceleration = difference of two 8-bar OLS log-HL2 slopes (recent minus older), signed by 12-bar close direction. Multi-bar OLS -> noise-robust. Appended with small fixed weight 0.55 (like 8th range/close voter). MEASURED vs 99a369a1 0.912878: composite 0.809257 (-0.103621 FAIL), mean 0.900586 (-0.108475), std 0.320613->0.304430 (tighter), min_stab 0.844331->0.839904. PER-REGIME all stab 1.0 all raw==score: bull 1.382650->0.951863 (-0.430787 Sh2.0678->1.6952 DD2.49 unchanged 51->36 TRADES -- the acceleration voter FILTERED 15 bull entries: deceleration periods blocked entries that would have been trend-continuation winners; Sh dropped 0.37), crash 0.917980->0.918033 (+0.000053 BYTE-IDENTICAL-ish Sh1.2539 -- acceleration ~0 in crash sustained downtrend), sideways 1.294241->1.303900 (+0.009659 Sh2.0270->2.0447 48->50 TRADES -- REACHED 50-trade sample_factor knee=1.0, +2 trades were good sideways mean-reversion entries), rally 0.973853->0.969839 (-0.004014 Sh1.5529->1.5521 100->100 trades), mixed 0.476584->0.359294 (-0.117290 Sh0.8075->0.6386 DD2.78->3.03 43->56 TRADES WR100->89.3pct -- the acceleration voter ADMITTED 13 more mixed trades that were BAD: decelerating mixed longs (the wrong-side book) had momentary acceleration that passed the gate then lost -> Sharpe dropped 0.17, DD rose; the voter could not distinguish a decelerating downtrend long (mixed losers) from a genuine accelerating uptrend entry). FAILURE MECH (architectural fact, direct measurement): acceleration is a NOISIER signal than slope/level for entry timing in choppy regimes. A decelerating trend can RE-accelerate (mixed's oscillating longs accelerate during counter-trend bounces -> admitted -> lose), and a genuinely decelerating trend can still be a valid pullback entry (bull's 15 filtered entries were trend-continuation winners). The 2nd derivative flips sign more often than the 1st under AR(1) noise -> more admission-boundary flips -> lower-quality trade selection. Useful SIGNAL: sideways +0.0097 via reaching the 50-trade sample_factor knee confirms the sample_factor lever is REAL for under-traded regimes (sideways 48->50 trades = sqrt(50/50)/sqrt(48/50) = +2.1pct score, matching the +0.0097 gain). NOT branch-eligible: the regression is broad (bull -0.43, mixed -0.117 = the binding floor got WORSE), and mixed's regression is the wrong direction (prior sessions established mixed is grid-walled; adding a voter that hurts mixed moves away from the binding floor). The sideways sample_factor signal is actionable but via a different (non-acceleration) mechanism. Rev to 99a369a1. 4th architectural discard.
013f4130	0.912878	1.009062	0.320613	1.382553	0.908851	1.294241	0.904447	0.373030	branch	STRUCTURAL_EXPLORATION step3: smooth-max sharpness s=50->200. MEASURED vs step2 0.619917: composite +0.292961 PROGRESS (0.912878 = BYTE-IDENTICAL to baseline 99a369a1), mean 0.757972->1.009062, std 0.460183->0.320613, min_stab 0.725850->0.844331. raw_composite 0.912878 == composite (no penalty). PER-REGIME all byte-identical to baseline: bull 1.382553 Sh2.0677, crash 0.908851 Sh1.2541, sideways 1.294241 Sh2.0270 (DD1.88 RESTORED -- sideways fully recovered), rally 0.904447 Sh1.5529 (wait rally 0.904 not 0.974 -- see below). Actually rally 0.904447 vs baseline 0.973853 = -0.069 NOT byte-identical; sideways/crash/bull/mixed byte-identical, rally -0.069 (stab 0.976 not 1.0). Re-check: rally Sh1.4265 vs baseline 1.5529 -- rally NOT restored at s=200. SIDEWAYS restored, rally still slightly regressed. The blend bonus at s=200 is negligible for sideways small terms but rally has larger near-equal terms (pp vs slope) where the ~0.005 blend bonus still shifts a few exit timings -> rally -0.069.
013f4130	0.912878	1.009061	0.320613	1.382650	0.917980	1.294241	0.973853	0.476584	branch	CORRECTION to prior row 013f4130 (which mis-recorded rally 0.904447 from a stale read): step3 smooth-max s=200 is BYTE-IDENTICAL to baseline 99a369a1 across ALL 5 regimes (bull 1.382650 Sh2.0678, crash 0.917980 Sh1.2539, sideways 1.294241 Sh2.0270, rally 0.973853 Sh1.5529, mixed 0.476584 Sh0.8075; all stab 1.0 all raw==score). composite 0.912878 = baseline exactly. The smooth-max at s=200 is functionally inert (blend bonus <0.005 below de-risk floor sensitivity -> no exit decision changes). The prior row's rally 0.904447 was a misread of the regime SUMMARY table (which displays 2dp Sh not score); the actual regime_rally_2024_score line is 0.973853. This correction row supersedes the prior 013f4130 row's per-regime values; the prior row is retained per append-only rule.
-	0.417591	0.525586	0.359984	0.314846	0.918218	0.049559	0.972247	0.373061	branch	STRUCTURAL_EXPLORATION step4: TARGETED top-2 smooth-max (s=20, blend only at near-tie). MEASURED vs step3 0.912878: composite -0.495287 REGRESSION (0.417591), mean 0.525586, std 0.359984, min_stab 0.825542. PER-REGIME: bull 1.382650->0.314846 (-1.068 Sh2.068->1.332 DD2.49->6.73 50->85 trades -- top-2 blend broke bull too: pp/slope near-equal during trend pullbacks -> blend bonus -> premature exits), crash 0.917980->0.918218 (byte-identical-ish), sideways 1.294241->0.049559 (-1.244 Sh2.027->1.116 DD1.88->9.69 50pct gate breached), rally 0.973853->0.972247 (-0.002 byte-identical-ish), mixed 0.476584->0.373061 (-0.104 Sh0.808->0.641). FAILURE MECH: top-2 targeting does NOT isolate sideways -- sideways AND bull both have near-equal top-2 terms (pp vs slope during pullbacks), so any blend strong enough to matter at the argmax-flip boundary breaks BOTH regimes. DEFINITIVE CONCLUSION: smooth-max fusion is a structural dead end. Any blend strong enough to potentially improve Sharpe is too strong for near-equal-term regimes (sideways/bull); any blend weak enough to be safe (s>=200) is byte-identical to MAX (inert). The argmax-flip discontinuity does NOT manifest as a measurable Sharpe cost because the de-risk ramp floor (0.55-0.85) absorbs the sub-threshold blend bonuses. The MAX fusion is confirmed NOT at a structural ceiling -- it is already the correct mechanism.
-	-	-	-	-	-	-	-	-	discard	STRUCTURAL_EXPLORATION branch (smooth-max LogSumExp exit fusion, 4 steps, REVERTED to 99a369a1): opened after 4 consecutive architectural discards (Exp1-4) met the structural-exploration trigger (3+ arch discards). Subsystem rewritten: exit-pressure soft-term FUSION core function form, element-wise MAX -> smooth-max (LogSumExp). Hypothesis: MAX's argmax flips discretely under AR(1) noise when two weighted terms near-equal -> exit-timing discontinuity -> Sharpe cost (binding v3 constraint). 4 steps probed sharpness s and targeting: step1 uniform s=10 (broke sideways Sh2.03->1.13 DD1.88->9.73pct 50pct gate breached, blend bonus on small near-equal terms -> premature exits), step2 uniform s=50 (still broke sideways Sh1.12 DD9.62, +0.035 progress vs step1), step3 uniform s=200 (BYTE-IDENTICAL to baseline 0.912878 -- inert: blend bonus <0.005 below de-risk floor sensitivity), step4 targeted top-2 s=20 (broke sideways AND bull -- near-equal top-2 terms in both regimes -> blend bonus -> premature exits; -0.495). CROSS-EXPERIMENT CONCLUSION (MEASURED, verifiable): the MAX fusion is NOT at a structural ceiling. The argmax-flip discontinuity does NOT manifest as a measurable Sharpe cost because the de-risk ramp floor (0.55-0.85) absorbs sub-threshold blend bonuses: any smooth-max blend strong enough to potentially improve Sharpe is too strong for regimes with near-equal soft terms (sideways low-vol mean-reversion top-2 small near-equal; bull trend pullbacks pp vs slope near-equal) -> premature exits -> Sharpe drops + DD rises; any blend weak enough to be safe (s>=200) is byte-identical to MAX (inert, no change). The MAX fusion is already the correct mechanism for this exit architecture. KEY FOR FUTURE SESSIONS: (a) do NOT re-attempt smooth-max/LogSumExp fusion of exit soft terms -- the de-risk ramp floor makes the argmax-flip discontinuity structurally inert, confirmed dead across 4 steps; (b) the exit-pressure FUSION function form is NOT the Sharpe bottleneck (the binding v3 constraint) -- the Sharpe bottleneck lies elsewhere (signal quality / admission / sizing); (c) sideways is the most fragile regime for exit-timing changes (small near-equal soft terms make ANY blend bonus large relative to term values) -> exit-fusion experiments must preserve sideways byte-identical or be gated off in low-vol. Strategy remains at confirmed deep local optimum 99a369a1.
