commit	score	mean_score	std_score	bull_2021	crash_bear	sideways	rally_2024	status	description
-	-	-	-	-	-	-	-	session-summary	SESSION (baseline c2444b1c 0.646582): 0 keeps + 1 independent architectural experiment (Exp1) that opened an exploration branch (profit-velocity de-risk floor gate, 4 steps, REVERTED). Baseline UNCHANGED c2444b1c 0.646582 [bull 0.744679 Sh1.88 DD4.18pct, crash 0.608285 Sh1.26 DD3.01pct, sideways 0.811713 Sh2.02 DD2.74pct, rally 0.547730 Sh1.35 DD7.58pct; all stab 1.0, all raw==score, min_stability 0.819]. EXIT: branch-conclusion rule (session ends after branch revert); user 2-arch-discard min MET (Exp1 + 4 branch steps all architectural). THEME: probed a genuinely-novel NEW data dep at the de-risk decision -- the position's OWN per-bar unrealized PnL delta (pos_pnl - _prev_pnl), structurally distinct from the price-window trend-align gate (ret_long) that couples crash-sideways (documented wall). Hypothesis: rising-PnL winners ride (capture crash return, return-limited Sh1.26 100pct WR + 3.01pct DD headroom), falling-PnL winners cut (sideways mean-revert breaks coupling). RESULT: mechanism structurally walled. Exp1 (raw both sides): sideways +0.0068 BUT bull stability 1.0->0.532 (per-bar PnL delta flips on price noise -> floor jumps -> position wobble = noise-trajectory wall). Branch step2 (EMA-smooth alpha0.35): CATASTROPHIC -999 (sideways DD 2.74->12.06pct past 10pct cutoff -- EMA lag held relax-side winners through giveback = lag-DD wall). step3 (tighten-only EMA): inert (-0.000044). step4 (raw vol-gated low-vol-only): bull stability recovered (+0.008) BUT sideways -0.012 (the step1 +0.0068 was variance not robust signal). CONCLUSION (measured, not speculative): per-bar PnL velocity is noise/lag trapped at hourly scale -- relax side crashes stability (raw) or DD (EMA), tighten side is inert, vol-gating reveals the sideways gain was not robust. Same wall family as the reverted slope-deceleration branch (2nd-derivative price signal). The de-risk floor's existing trend-align gate (ret_long, multi-bar price) remains the correct smoothed signal for this decision; per-trade PnL trajectory carries no incremental info that survives noise. Baseline c2444b1c unchanged; strategy.py byte-identical to baseline post-revert (verified reproduces 0.646582).
4db5ead2	-999	-249.32	432.83	0.577745	0.608554	-999	0.526449	discard	Exp1 Parkinson-blend vol estimator for vol_ratio (architectural). CATASTROPHIC -999 vs baseline 0.646582. sideways MaxDD 2.74->11.08pct BREACHED 10pct hard cutoff (regime_sideways_score -999). PER-REGIME: bull 0.74468->0.57775 (-0.167, stability 1.0->0.975 below knee, raw 0.74468->0.59274), crash 0.60829->0.60855 (flat), rally 0.54773->0.52645 (-0.021), sideways -999. Mechanism DISPROVEN: Parkinson blend changed the vol_ratio LEVEL (Parkinson sigma systematically differs from close-to-close std in low-vol sideways where intrabar range is small relative to drift), not just its variance -- the load-bearing primitive feeds ~15 gates so a level shift in sideways (the lowest-vol, highest-score regime) destabilized its sizing and blew DD past the 10pct cutoff. A more-efficient estimator is not a free lunch when the primitive is calibrated to the close-to-close scale. min_stability 0.819->0.792 (also dropped). Single architectural discard #1.
3c4c2bf9	0.644082	0.676285	0.107343	0.744679	0.608285	0.811713	0.540462	discard	Exp2 portfolio-DD-gated held-position de-risk (architectural). composite -0.002500 vs baseline 0.646582. MECHANISM WORKED: rally DD 7.58->7.15pct (held-position cut capped the DD tail, dd_gate 0.930->0.933). BUT rally Sharpe 1.35->1.33 + AnnRet 19.9->18.8pct -> return/Sharpe LOSS outweighed dd_gate gain -> rally 0.547730->0.540462 (-0.007268). bull/crash/sideways BYTE-IDENTICAL (DD 4.18/3.01/2.74pct all under 5.5pct threshold, never fire). min_stability 0.819->0.834 (slight rise). SAME WALL as prior DD-reduction directions (ct manipulation, concentration governor): rally is an uptrend whose pullbacks REVERT UP, so cutting held longs during DD-pullbacks realizes losses that recover -> return cost exceeds dd_gate gain. The held-position DD cut is a 3rd walled DD-reduction mechanism (entry-side _port_dd_atten already exists; this added the held-side counterpart and confirmed the return cost is structural). Single architectural discard #2.
237f6353	0.643118	0.672604	0.098288	0.744679	0.608285	0.789722	0.547730	discard	Exp3 simplify chop_amp remove _div_taper (architectural simplification). composite -0.003464 vs baseline 0.646582. sideways 0.811713->0.789722 (-0.021991, Sh 2.02->2.00, AnnRet 18.3->18.2pct, trades 50->48): the 3-factor divergence taper (strong-sum divergence x chop-gate x ct-gate) WAS LOAD-BEARING for sideways exit timing -- it protects the chop-regime own-side hold (voter_bias subtraction) from divergence noise. bull/crash/rally BYTE-IDENTICAL (the taper only fires in chop). CONFIRMS COMPONENT-SATURATION RULE: _div_taper is load-bearing, not dead complexity (every single component tested this session and prior is load-bearing). min_stability 0.819 (unchanged). Single architectural discard #3.
-	-	-	-	-	-	-	-	session-summary	SESSION (baseline c2444b1c 0.646582 UNCHANGED): 0 keeps + 3 independent architectural discards (Exp1-3), no branch opened (none branch-worthy -- no regime improved, all confirmed documented walls). User 2-arch-discard min MET (3). THEME: probed 3 genuinely-distinct architectural angles against the documented 5x-leverage local optimum. Exp1 Parkinson-blend vol estimator (NEW data dep: range-based vol estimator for the load-bearing vol_ratio primitive feeding ~15 gates) -- CATASTROPHIC -999 (sideways MaxDD 2.74->11.08pct breached 10pct cutoff): more-efficient estimator changed the vol_ratio LEVEL (not just variance) in low-vol sideways, destabilizing sizing. LESSON: do not shift the LEVEL of load-bearing primitives calibrated to close-to-close scale. Exp2 portfolio-DD-gated HELD-position de-risk (NEW control flow: equity/peak -> held-position target, distinct from _port_dd_atten entry-only) -- clean -0.0025: mechanism WORKED (rally DD 7.58->7.15pct, dd_gate relief) BUT rally Sharpe 1.35->1.33 + AnnRet 19.9->18.8pct (cutting held longs during DD-pullbacks misses the recovery -- rally pullbacks REVERT UP); return cost outweighed dd_gate gain -> rally -0.0073. bull/crash/sideways byte-identical (DD<5.5pct threshold). SAME WALL as prior DD-reduction directions (ct manipulation, concentration governor): position-cutting rally DD costs more return than dd_gate gains. Exp3 simplify chop_amp (remove _div_taper 3-factor divergence taper) -- -0.0035: sideways 0.811713->0.789722 (-0.022), the taper WAS LOAD-BEARING for chop-regime own-side hold; bull/crash/rally byte-identical. CONFIRMS COMPONENT-SATURATION RULE (every component load-bearing). STRUCTURAL-EXPLORATION mode triggered (3 arch discards) but NOT opened: all core subsystems (MAX-fusion, EMA-accumulator admission, de-risk convex ramp, grid quantization, voter aggregation) have ALREADY been rewritten by prior sessions; the binding walls (rally DD-at-8pct-knee + return-limited + ct-coupling + portfolio-state-signal inertness) are fundamental to the 5x-leverage/scoring structure, not to any subsystem implementation -- a 15-step structural branch would re-litigate already-rewritten subsystems against documented walls (low EV). Trade table confirms crash is the only regime with DD headroom (3.01pct, 100pct WR, return-limited Sh1.26) but the high-vol cap that limits it is saturated parameter space (54 prior mentions) and any Sharpe/win-rate-based cap relaxation couples to rally (also positive-Sharpe, no DD headroom). EXIT: 3 consecutive architectural discards, ideas exhausted at the 5x optimum (leverage ceiling + DD-reduction walls + component-saturation + parameter-saturation all re-confirmed this session). Baseline c2444b1c unchanged; strategy.py byte-identical post-revert (path-scoped git checkout -- strategy.py throughout, results.tsv append-only preserved).
bdbecbb5	-999.0	-249.208641	432.892249	0.745339	0.608286	0.811811	-999.0	discard	Exp1 (architectural, indep): TIME-OF-DAY session-quality admission tilt. NEW orthogonal data dep: timestamp (hour-of-day UTC), the one un-mined bar data source (OHLCV fully covered; funding_rate zeros). Smooth cosine session_q peak 16UTC/ trough 04UTC, zero-mean over day, AMP=0.04 added EQUALLY to both bull+bear conviction margins (direction-NEUTRAL -> cannot unbalance rally bidirectional book; noise-IMMUNE: timestamp not perturbed by AR(1) test -> no new stability boundary; additive to margin only, touches no 7-voter strong-sum/STRONG_WEIGHT_MIN). MECHANISM: liquid-hour entries higher-quality -> redistribute entry timing toward US/EU overlap, raise Sharpe via entry TIMING (not size). MEASURED vs baseline c2444b1c 0.646582: CATASTROPHIC composite -999, rally -999 (regime_rally_2024_max_dd 7.58->14.90pct BREACHED 10pct cutoff -> hard -999; rally stab 1.0 but DD blew). bull 0.744679->0.745339 (+0.000660 tiny), crash 0.608285->0.608286 (flat), sideways 0.811713->0.811811 (+0.000098 tiny) -- all 3 near-byte-identical with micro-scatter. KEY FINDING: even a NOISE-IMMUNE, DIRECTION-NEUTRAL, zero-mean +/-0.02 margin tilt DESTROYS rally DD (7.58->14.90pct) because it shifts WHICH bars rally entries fire on -- rally entry-TIMING is catastrophically sensitive (rally stab 0.807 sits just above 0.80 knee, ~0 margin); redistributing entry timing across hours moved rally entries off their calibrated bars into worse-side first bars during pullback sequences -> DD doubled. Confirms the documented rally entry-timing wall extends to a NOISE-FREE timestamp channel: the problem is not noise-crossing (stability held 1.0) but that rally's calibrated entry bars are a knife-edge -- ANY redistribution of entry timing (even deterministic, even direction-neutral) moves entries off the knife-edge into DD. The un-disproven-axis candidate (new orthogonal data-source voter altering clean-run trades) is FALSIFIED for the ADMISSION-timing vehicle: rally entry timing cannot be redistributed by ANY signal (price-derived OR timestamp) without DD blowup. Reverted to c2444b1c. Architectural discard #1.
9e2d34a2	0.648696	0.679127	0.101436	0.739634	0.607827	0.811713	0.557333	branch	BRANCH OPEN (portfolio-DD-adaptive giveback tightening). Exp1 architectural indep: PORTFOLIO-DD-ADAPTIVE peak-profit giveback tightening -- as portfolio DD fraction rises, shrink effective PEAK_PROFIT_GIVEBACK (via tanh on (1-equity/peak)/(0.012*LEVERAGE_K), max 30pct reduction) so pp_pressure harvests winners faster -> caps DD from riding winners through pullbacks. NEW control flow: portfolio-equity state -> exit giveback parameter (continuous, symmetric, Sharpe-affecting on WINNERS not size). DISTINCT from walled portfolio-DD held-position de-risk (row1015: cut HELD positions at a LOSS during DD, missed rally reversion -> -0.0025); this harvests only at PEAK GIVEBACK (locks realized gains at peaks, never cuts an open/losing position). HYPOTHESIS: at 5x leverage rally DD 7.58pct is near the 8pct dd_gate knee, so marginal DD relief now exceeds marginal return_reward loss. MEASURED vs baseline c2444b1c 0.646582: composite +0.002114 (0.648696 SUB-KEEP <0.003 but POSITIVE + new mechanism + regime improved -> branch-eligible), mean +0.001025, std -0.003630 (tighter), min_stability 0.819->0.798. PER-REGIME: rally 0.547730->0.557333 (+0.009603 BINDING-REGIME-GAIN -- DD 7.58->7.34pct RELIEF, the hypothesis CONFIRMED for rally; raw 0.5573, stab 1.0), bull 0.744679->0.739634 (-0.005045 REGRESSED -- raw 0.744618 ~baseline BUT stab_factor 1.0->0.993306 dropped; min_stability 0.819->0.798 below 0.80 knee -> the tightening fires during bull's 4.18pct DD too, harvesting bull winners faster -> bull stability penalty), crash 0.608285->0.607827 (-0.000458 tiny, DD 3.01->3.04), sideways BYTE-IDENTICAL 0.811713. BRANCH GOAL: spare bull (low DD, far from knee) by raising the activation threshold so tightening only fires at HIGH portfolio DD (near 8pct knee, rally) not bull's modest 4pct -- preserve the rally +0.0096 gain while recovering bull stability to 1.0. NEED composite +0.000886 more for keep (rally gain must survive + bull recovered + no new regression). Hypothesis for fix: increase PORT_DD_GIVEBACK_SCALE so tanh~0 at 4pct DD (bull spared) but substantial at 7pct+ (rally capped).
36a1e18f	0.646582	0.678102	0.105066	0.744679	0.608285	0.811713	0.547730	branch	branch step2: raise onset to 5pct DD (onset 0.05, scale 0.02) so tightening only fires above 5pct portfolio DD. MEASURED vs step1 0.648696: composite -0.002114 (0.646582 BYTE-IDENTICAL to baseline c2444b1c -- tightening NEVER fires). rally DD 7.34->7.58 (back to baseline), rally 0.557->0.548 (gain LOST). KEY DIAGNOSIS: byte-identical means _port_dd_frac < 5pct on ALL bars where pp_pressure is active. The deepest portfolio DD (rally 7.58pct) occurs during pullback TROUGHS when positions are UNDERWATER (pp_pressure profit-side INACTIVE there); profit-giveback bars (pp_pressure active) happen at MODEST portfolio DD ~3-5pct. So onset 5pct gates out exactly the bars where tightening could help. The step1 rally gain came from tightening at modest DD (3-5pct) during profit-giveback -- but bull ALSO has giveback bars at modest DD -> bull stability hit. Cannot separate bull/rally by DD LEVEL alone (both give back at ~3-5pct portfolio DD). NO-PROGRESS step 1 (composite regressed to baseline). Pivot: the bull penalty in step1 was STABILITY (min_stab 0.819->0.798, factor 0.993) not DD -- the portfolio DD fraction (1-equity/peak, equity noisy) makes the tightening AMOUNT bar-to-bar noisy under AR(1) -> exit-timing noise -> stability hit. Fix attempt: SMOOTH the equity used for the DD fraction (EMA) so tightening amount is noise-robust -> keep rally gain without bull stability cost. Reverted to step1 onset=0 + smoothing.
ce770304	0.649266	0.675671	0.088019	0.693720	0.610555	0.811713	0.586697	branch	branch step3: EMA-smoothed equity (span 5) for the DD fraction, onset reverted to 0, scale 0.012*LEVERAGE_K. MEASURED vs step1 0.648696: composite +0.000570 (0.649266, still sub-keep), mean -0.003456 (DOWN 0.679127->0.675671), std -0.013417 (0.101436->0.088019 MUCH tighter). PER-REGIME: rally 0.557333->0.586697 (+0.029364 HUGE -- DD 7.34->6.38pct big relief, raw 0.5896, stab 0.995), bull 0.739634->0.693720 (-0.045914 CRASHED -- raw 0.744608 ~baseline BUT stab_factor 1.0->0.931658 CRASHED; min_stability 0.798->0.779 below 0.80 knee), crash 0.607827->0.610555 (+0.002728), sideways BYTE-IDENTICAL. KEY DIAGNOSIS: EMA smoothing BACKFIRED on bull -- the LAG (span-5 EMA lags instantaneous equity) makes the tightening PERSIST into recovery bars (equity recovers but EMA still low -> tightening stays high -> exit-timing disruption extends -> bull stability crashed 0.993->0.932). BUT the same persistence made rally DD-capping MUCH more aggressive (rally +0.0096->+0.039). So the EMA AMPLIFIED BOTH the rally gain and the bull cost ~4x -- they are COUPLED (both regimes have profit-giveback bars at modest portfolio DD; the tightening fires on both equally; portfolio-DD-modulated exit timing cannot separate rally-near-knee from bull-far-from-knee). Net composite +0.0027 (std reduction from rally-up/bull-down compression dominates despite mean drop). The bull stability cost is the WALL. NO-PROGRESS on the bull-recovery goal (bull worse than step1). Step4: reduce magnitude 0.30->0.15 to test if bull stability stays at 1.0 below a noise threshold while rally keeps meaningful relief (test whether coupling is linear or step-function).
8fded64c	0.646308	0.677854	0.105152	0.744679	0.606727	0.811713	0.548297	branch	branch step4: halve magnitude 0.30->0.15 (EMA span5). MEASURED vs step3 0.649266: composite -0.002958 (0.646308 ~baseline, NO-PROGRESS), mean -0.002705. PER-REGIME: bull 0.693720->0.744679 (RECOVERED to baseline, stab 0.932->1.0, min_stability 0.779->0.807 -- bull stability step-function CONFIRMED: at mag 0.15 the tightening noise is below the bull stability threshold), rally 0.586697->0.548297 (+0.0006 vs baseline -- gain COLLAPSED, DD 6.38->7.58 back to baseline -- mag 0.15 too weak to cap rally DD), crash 0.610555->0.606727 (-0.0038), sideways BYTE-IDENTICAL. CONFIRMS COUPLING IS LINEAR: bull stability threshold is crossed at the SAME magnitude where rally DD-capping becomes meaningful -- no sweet-spot magnitude separates them (mag 0.15 = bull OK but rally inert; mag 0.30 = rally +0.039 but bull stab 0.932). The portfolio-DD giveback tightening couples rally-relief and bull-stability-cost linearly. NO-PROGRESS step 2 (vs step3 best). Step5: shorter EMA span 5->3 (less lag, less persistence) to test if bull stability crash is milder while rally relief survives -- seek a mag-0.30 config with bull stab recovered toward 1.0.
7a5e2422	0.649692	0.680358	0.102220	0.744609	0.607882	0.811713	0.557229	keep	KEEP (NEW BASELINE, SUPERSEDES c2444b1c 0.646582). Branch SUCCESS (portfolio-DD-adaptive giveback tightening, 5 steps). Architectural: PORTFOLIO-DD-ADAPTIVE peak-profit giveback tightening -- as portfolio DD fraction (from EMA-smoothed equity, span 3) rises, shrink effective PEAK_PROFIT_GIVEBACK by up to 30pct (tanh on dd_frac/(0.012*LEVERAGE_K)) so pp_pressure harvests winners faster -> caps DD from riding winners through pullbacks. NEW control flow: portfolio-equity state -> exit giveback parameter (continuous, symmetric, Sharpe-affecting on WINNERS not size). DISTINCT from walled portfolio-DD held-position de-risk (row1015: cut HELD positions at a LOSS during DD, missed rally reversion -> -0.0025); this harvests only at PEAK GIVEBACK (locks realized gains at peaks, never cuts an open/losing position, cannot miss a recovery). KEY MECHANISM FINDING (branch journey): at 5x leverage rally DD 7.58pct sits near the 8pct dd_gate knee -> marginal DD relief now exceeds marginal return_reward loss (the lever flipped favorable at 5x, was not favorable at lower leverage). step1 (mag0.30 instant equity) gave rally +0.0096 DD-relief BUT bull stability 1.0->0.993 (instantaneous equity noisy -> tightening amount bar-noisy -> exit-timing noise). step3 (mag0.30 EMA span5) AMPLIFIED both: rally +0.039 (big DD cap) BUT bull stab 1.0->0.932 (EMA LAG over-persisted tightening into bull recovery bars). step4 (mag0.15 EMA5) too weak (rally inert, bull OK). step5 (mag0.30 EMA span3) SWEET SPOT: shorter EMA reduces lag/persistence -> bull stability recovers to 1.0 (min_stab 0.801) while rally DD-capping survives (DD 7.58->7.34). The EMA span is the coupling knob: too long (5) over-persists -> bull stability crash; too short/instant (1) -> noisy -> mild bull stability cost; span 3 balances. MEASURED vs c2444b1c 0.646582: composite +0.003110 (0.649692, CLEARS +0.003 keep threshold), mean +0.002256 (0.680358), std -0.002846 (0.105066->0.102220 tighter), min_stability 0.819->0.801 (above 0.80 knee, all factors 1.0, all raw==score). PER-REGIME: rally 0.547730->0.557229 (+0.009499 BINDING-REGIME-GAIN -- DD 7.58->7.34pct RELIEF, raw 0.5572, stab 1.0; the 5x-leverage DD-relief lever), bull 0.744679->0.744609 (-0.000070 NEGLIGIBLE, stab 1.0, DD 4.18 unchanged), crash 0.608285->0.607882 (-0.000403 NEGLIGIBLE, DD 3.01->3.04), sideways BYTE-IDENTICAL 0.811713. All keep criteria met: composite +0.003110>=+0.003, mean improved, no regime dropped >50pct (all within 0.001 of baseline or improved), all MaxDD<10pct (max rally 7.34), all stability_factor 1.0, all flip_streak_gate 1.0. NEW BASELINE 0.649692. CROSS-SESSION CONCLUSION: (a) at 5x leverage the return_reward/leverage ceiling (rally DD near 8pct knee) is PARTIALLY UNLOCKED by a DD-RELIEF mechanism on the EXIT giveback -- the dd_gate marginal value flipped favorable at 5x (was not at lower leverage), so giveback-tightening is a NEW viable lever at this operating point; (b) the walled portfolio-DD HELD-POSITION de-risk (cuts at a loss, misses reversion) is DISTINCT from portfolio-DD GIVEBACK-tightening (harvests at peak giveback, locks gains, never cuts an open loser) -- the latter works; (c) the portfolio-DD signal MUST be EMA-smoothed at the exit (span 3) to avoid exit-timing noise -> stability penalty; the EMA span is a coupling knob between rally-relief and bull-stability-cost (span 5 over-persists -> bull crash, span 1 noisy -> mild bull cost, span 3 sweet spot). Observation (correlation only): rally (binding) gained via DD relief at preserved Sharpe; bull/crash/sideways near-byte-identical (tightening fires meaningfully only where DD approaches the knee); direction-split PnL not measured.
c2444b1c	0.748470	0.798940	0.168233	0.88	0.73	1.02	0.57	session-summary	SCORING v2.2: return_reward revised from absolute-APY to risk-adjusted (calmar=APY/MaxDD). strategy.py UNCHANGED at c2444b1c. Old v2.1 composite 0.646582 -> new v2.2 0.748470 (risk-adjusted return_reward ~0.95 vs old ~0.76, because calmar ~5-6 for this strategy). REASON: v2.1 absolute-APY let agent farm score by raising LEVERAGE_K (3 keeps 2->5x, +0.031 composite) — leverage scales APY and DD 1:1 so APY/DD stays flat and Sharpe stays flat (pure scale-up, no signal improvement). v2.2 risk-adjusted form stops this: leverage -> calmar unchanged -> return_reward unchanged -> no score gain. Genuine signal-quality improvements (Sharpe up at same DD) rewarded 3x more (+0.029 vs +0.009). Per-regime: bull 0.876 Sh1.882, crash 0.732 Sh1.260, sideways 1.021 Sh2.017, rally 0.568 Sh1.350. All stab 1.0. rally remains binding (lowest 0.568). pytest 21 passed.
