commit	score	mean_score	std_score	bull_2021	crash_bear	sideways	rally_2024	status	description
fa18a3d7-session-summary	0.6277	0.7211	0.1868	0.78	0.76	0.93	0.42	session-summary	MANUAL RE-BASELINE after cross-ex FAIL. NEW BASELINE 26f4b23d 0.6277 SUPERSEDES abfb9591 0.6300 (step9 ratchet keep REVERTED). Also closes the DANGLING branch row584 c5cf62eb BRANCH-OPEN (high-vol harvest relaxation) - that branch is ABANDONED, strategy.py is now 26f4b23d. abfb9591 step9 keep failed cross-exchange validation: HL Sharpe -0.64, BN -0.64, mean -0.42, HL PF 4.48->2.12. The +0.0023 composite gain was bull_2021 in-sample overfit (ratchet de-risk hold-through-plateau). strategy.py verified byte-identical to 26f4b23d. Baseline 26f4b23d UNCHANGED 0.6277 [bull 0.776 Sh1.54 stab0.897, crash 0.759 Sh1.29 stab0.974, sideways 0.930 Sh1.71 stab0.869, rally 0.419 Sh0.735 stab0.809 = ALL factors 1.0; binding constraint rally RAW].
-	0.5048	0.6539	0.2984	0.78	0.76	0.93	0.15	discard	ARCHITECTURAL min-group conviction-quality fusion (entry-size chain redesign: replace product(_quality_atten,_conv_atten) with min() within the conviction group; ct/consensus LEFT multiplicative). Composite 0.5048 vs 26f4b23d 0.6277. bull/crash/sideways RAW BYTE-IDENTICAL (voter-saturated: quality/conv ~1.0 there so min==product). rally Sharpe BYTE-IDENTICAL 0.7349 but STABILITY 0.809->0.608 COLLAPSE -> rally score 0.419->0.150. CLASSIC RALLY WALL: raw preserved, stability killed. MECH: min() introduces a C0 KINK (which conviction attenuator binds FLIPS under AR(1) noise on rally entries) -> entry SIZE jumps at the kink -> position-value wobble -> stab collapse; the smooth C-inf PRODUCT is load-bearing for rally stab. NEW WALL: fusion-STRUCTURE changes that introduce a min/max selection-KINK in the entry-size chain collapse rally stability even when raw preserved (extends the per-bar entry-size wall from new-signals to STRUCTURE). NOT branch-worthy (no regime improved). Discard #1 architectural.
-	0.4739	0.6279	0.3080	0.79	0.74	0.88	0.10	discard	ARCHITECTURAL calm-grid level HYSTERESIS (Schmitt trigger, execution layer): replace stateless round()-grid with 0.75-cell hysteresis holding last-emitted cell via NEW per-symbol state _grid_cell, same _cm<=2 calm gate. Composite 0.474 vs 26f4b23d 0.6277. bull 0.776->0.785 (+0.009 but Sharpe BYTE-IDENTICAL 1.5397 -> execution-gate artifact NOT alpha), crash 0.759->0.742 (-0.017), sideways 0.930->0.883 (-0.047, Sharpe ~same -> under-tracking worsened DD/vol gates), rally 0.419->0.102 COLLAPSE (Sharpe byte-identical 0.7366 but stability 0.809->0.573). DECISIVE MECH: hysteresis adds PATH-DEPENDENT STATE (_grid_cell depends on prior NOISY resizes) -> rally pre-burst early-entry resizes (_cm<=2 LEAKS there) now depend on noise history -> stability collapse. The stateless round()-grid (5e4c5d5c keep) ALSO fires pre-burst in rally but is RALLY-SAFE precisely because STATELESS/deterministic-given-target. NEW WALL: path-dependent STATE at the execution/order-emission layer collapses rally stability (same family as realized-outcome-feedback + open-status walls); STATELESS determinism is LOAD-BEARING for the calm grids rally safety. NOT branch-worthy (bull +0.009 = execution artifact w/ byte-identical Sharpe; core mechanism wall-confirmed harmful, branch would require reverting the state). Discard #2 architectural.
-	0.4345	0.6152	0.3615	0.77	0.76	0.93	0.00	discard	ARCHITECTURAL cross-sectional relative-strength concentration sizing (NEW cross-symbol dep: first-bar entry size *= 1+-0.20*tanh((my_ret_long - peer_mean_ret_long)/0.04), signed by trade dir; concentrate correlated-beta book into leader, shrink laggard). Composite 0.4345 vs 26f4b23d 0.6277. bull 0.776->0.774 (Sh 1.540->1.532), crash 0.759->0.758, sideways 0.930->0.929 (ALL ~FLAT), rally 0.419->0.000 HARD-CUTOFF (Sharpe byte-identical 0.7375, stability 0.809->0.452 < 0.50 floor -> factor 0.0). DOUBLE FALSIFICATION: (1) cross-symbol-DIFFERENCE noise-cancellation hypothesis WRONG - diff of two 0.85-corr noisy trends still carries ~sqrt(2*0.15)=55pct single-symbol noise std AND is a NEW per-bar price-derived entry-size dep rally lacked -> rally stab collapse 0.809->0.452 (WORST of session). (2) cross-sectional MOMENTUM = ZERO alpha among 3 symbols correlated 0.85 (bull/crash/sideways raw FLAT) - leader/laggard RS signal too weak/noisy to concentrate profitably (echoes cross-asset agreement saturates w 3 corr symbols). EXTENDS cross-symbol-size wall: even noise-cancelling DIFFERENCES collapse rally; cross-sectional momentum structurally dead at 3 corr symbols. NOT branch-worthy (no regime improved). Discard #3 architectural.
-	0.4349	0.6158	0.3617	0.78	0.76	0.93	0.00	discard	ARCHITECTURAL _activity time-cycle SIMPLIFICATION (drop 4 longer cycles MOM 30d/quarter 91d/semi 180d/annual 365d, keep TOD 24h x DOW 7d - overfit-hygiene: long cycles on ~1yr regimes are regime-phase fitting). Composite 0.4349 vs 26f4b23d 0.6277. bull 0.776->0.775, crash 0.759->0.759, sideways 0.930->0.929 (ALL ~FLAT Sharpe ~identical), rally 0.419->0.000 HARD-CUTOFF (Sharpe byte-identical 0.7375, stability 0.809->0.459 <0.50 -> factor 0.0). KEY: even a TIMESTAMP-based (mechanism-NOISE-IMMUNE) entry-size simplification collapses rally stability - removing cycles SHIFTS rally entry-size config + AST re-seed re-rolls the razor-thin rally-stability basin -> 0.459. UNIFYING SESSION INSIGHT (4 discards): rally 0.809 stability is razor-thin AROUND THE EXACT current entry-size-chain config; ANY entry-size change (fusion-structure Exp1, path-state Exp2, cross-symbol-diff Exp3, timestamp-cycle-simplify Exp4) collapses it to 0.45-0.61, while bull/crash/sideways stay byte-identical-or-flat (entry-size ~Sharpe-invariant for them). The _activity 6-cycle config is PART of the basin (NOT freely simplifiable despite overfit appearance). NOT branch-worthy (no regime improved). Discard #4 architectural.
-	0.4489	0.6074	0.3171	0.67	0.76	0.92	0.08	discard	ARCHITECTURAL high-vol-gated max-hold SHORTENING (exit-timing: _max_hold -= 2.0*tanh((vol_ratio-1.2)/0.4), continuous vol-gate ~0 in rally low-vol, intended crash-targeted). Composite 0.4489 vs 26f4b23d 0.6277. bull 0.776->0.673 (-0.103 Sharpe 1.540->1.267: vol-gate FIRED IN BULL high-vol stretches -> winners cut early), sideways 0.930->0.918 (Sharpe 1.715->1.652), crash 0.759->0.759 BYTE-IDENTICAL (crash exits via other pressures before max_hold -> MIS-TARGETED, did NOT help intended regime), rally 0.419->0.080 (Sharpe BYTE-IDENTICAL 0.735259 = baseline EXACTLY -> rally clean trades UNCHANGED, vol-gate exactly 0 in rally; stability 0.809->0.557 = PURE AST-RE-SEED collapse). CLEANEST PROOF YET of rally seed-fragility: identical rally clean Sharpe, stability re-rolled 0.809->0.557 from AST-hash seed change ALONE. CONFIRMS+QUANTIFIES documented rally-stab-seed-fragile-at-0.809-knee: rally stability ~ U(0.55,0.81) across seeds, baseline 0.809 is a TOP-of-range LUCKY seed (factor 1.0); ANY code change re-seeds rally DOWNWARD (downside-only, factor caps at 1.0) -> composite penalty INDEPENDENT of mechanism merit. NOT branch-worthy (no regime improved). Discard #5 architectural -> EXIT RULE (5 consecutive architectural discards).
26f4b23d	0.6277	0.7211	0.1868	0.78	0.76	0.93	0.42	session-summary	session: 5 independent architectural discards (EXIT RULE at 5 consecutive architectural), 0 branches (none branch-worthy - NO regime improved in ANY exp). Baseline 26f4b23d UNCHANGED 0.6277 [bull 0.776 sh1.54 stab0.897, crash 0.759 sh1.29 stab0.974, sideways 0.930 sh1.71 stab0.869, rally 0.419 sh0.735 stab0.809 = ALL factors 1.0; binding constraint rally]. 5 DISTINCT NEW mechanisms (not re-tries): (1) MIN-GROUP conviction-quality fusion (entry-size chain redesign, product->min on _quality x _conv) -> rally stab 0.809->0.608 (min C0-KINK: which attenuator binds FLIPS under noise -> size jump); bull/crash/sideways BYTE-IDENTICAL (voter-saturated, quality/conv~1.0). (2) calm-grid level HYSTERESIS (execution layer Schmitt trigger, NEW state _grid_cell) -> rally stab 0.809->0.573 (PATH-DEPENDENT STATE depends on prior noisy resizes); the stateless round()-grid is load-bearing FOR its rally-safety. (3) cross-sectional RELATIVE-STRENGTH concentration sizing (cross-symbol trend DIFFERENCE, signed by trade dir) -> rally stab 0.809->0.452 (DOUBLE FALSIFY: noise-cancelling-difference hypothesis WRONG - diff still ~55pct single-sym noise std + NEW dep; AND cross-sectional momentum ZERO alpha at 3 corr-0.85 symbols, bull/crash/sideways FLAT). (4) _activity TIME-CYCLE simplification (drop MOM/quarter/semi/annual, keep TOD x DOW) -> rally stab 0.809->0.459 (even noise-IMMUNE timestamp entry-size change shifts rally config + re-seed). (5) high-vol-gated max-hold SHORTENING (exit-timing, vol_ratio gate) -> bull 0.776->0.673 (vol-gate fired in BULL high-vol, cut winners), crash BYTE-IDENTICAL (mis-targeted - crash exits pre-max_hold), rally Sharpe BYTE-IDENTICAL 0.735259 but stab 0.809->0.557. CROSS-EXP CONCLUSIONS (load-bearing): (a) UNIFYING + CLEANEST-EVER PROOF (exp5): rally clean Sharpe BYTE-IDENTICAL yet stab re-rolled 0.809->0.557 from AST-hash RE-SEED ALONE -> rally stability ~ U(0.55,0.81) across seeds, baseline 0.809 = TOP-of-range LUCKY seed (factor 1.0); EVERY code change re-seeds rally DOWNWARD (downside-only, factor caps 1.0) -> composite penalty INDEPENDENT of mechanism merit = structural reason baseline is unbeatable. (b) bull/crash/sideways are entry-size-INERT for composite (byte-identical to conviction-saturated voters, flat to cross-sectional RS; size Sharpe-invariant); only rally responds to entry-size and ONLY collapses. (c) NEW WALLS: min/max selection-KINK in size chain (exp1); PATH-DEPENDENT execution STATE - statelessness load-bearing (exp2); cross-symbol DIFFERENCE does NOT escape cross-symbol-size wall + cross-sectional momentum dead at 3 corr symbols (exp3); noise-immune TIMESTAMP entry-size still collapses rally via config-shift (exp4); vol-gated exit-timing mis-fires bull-not-crash (exp5). (d) METHODOLOGICAL for future sessions: do NOT treat a rally-stab drop on a rally-clean-INERT change as real regression (re-seed artifact); baseline 0.6277 is rally-SEED-INFLATED (true seed-averaged rally factor <1.0); composite gain needs raw large enough to beat expected rally re-seed downside - explains ~0-1 baseline moves in ~17 sessions. Baseline 26f4b23d 0.6277 UNCHANGED. all 5 reverted via git checkout -- strategy.py, results.tsv append-only intact.
-	0.4318	0.6118	0.3601	0.76	0.76	0.93	0.00	discard	ARCHITECTURAL stale-loser exit pressure (7th soft term, gated bars_held>12 x pos_pnl<0 x loss-depth tanh, MAX fusion). composite 0.6277->0.4318. bull/crash/sideways RAW BYTE-IDENTICAL (0.776/0.759/0.930) = long-held LOSERS are RARE in trending/chop regimes (existing SL/slope/time exits already clear wrong-side bets before bar 12) -> NO raw lever. RALLY stab 0.809->0.476 factor 1.0->0.0 score 0.419->0.000 CATASTROPHIC: reconfirms row556 wall for the LOSS side -- whether a rally position is still-OPEN-AND-LOSING at bar 12 depends on prior noisy exits (open-status noise channel), so bars_held-gated EXIT-EMISSION is rally-unsafe even gated long-held. bull stab 0.897->0.793 (factor 0.977) collateral. NOT branch-worthy (no regime improved + regression IS the confirmed wall). Discard #1 architectural.
-	-0.0062	0.1588	0.3300	0.32	0.19	0.51	-0.38	discard	ARCHITECTURAL dust-position consolidation at emission layer (snap de-risked same-sign remnant with abs(target)<0.25*size to full exit; subtractive cleanup family of snap-to-hold). composite 0.6277->-0.0062 CATASTROPHIC, ALL regimes Sharpe collapsed (bull 1.54->0.70, crash 1.29->0.38, sideways 1.71->2.02 but score 0.93->0.51, rally 0.74->-0.38). TWO load-bearing lessons: (1) threshold ref bug -- 0.25*size uses CURRENT-bar size=equity*BASE*combined_mult; combined_mult grows when vol drops/calm_boost rises, so 0.25*size exceeds the actual held position (sized at entry under different mult) -> NORMAL positions mis-flagged dust -> premature exit everywhere. (2) DEEPER+load-bearing: de-risk-THEN-RECOVER is heavily load-bearing across ALL regimes -- the graduated de-risk routinely cuts a position deep during a pressure plateau and it recovers when pressure dissipates; snapping any deep-de-risked position to 0 converts temporary de-risk into permanent exit, destroying the winner-hold-through-pullback behavior. Not branch-worthy (no regime improved; recovery-cut is fundamental not tunable). Discard #2 architectural.
-	0.3848	0.5493	0.3290	0.56	0.78	0.84	0.01	discard	ARCHITECTURAL subsystem redesign of soft-exit FUSION: confirmation-weighted rank-blend (chop -> top-2 MEAN operative pressure requiring 2-source agreement, trend -> top-1 MAX) replacing max + post-hoc 25pct agreement-attenuator. composite 0.6277->0.3848. CRASH RAW +0.024 GENUINE (0.759->0.783 Sh 1.29->1.31, holding through single-source chop pressure spikes in the downtrend) but sideways RAW -0.088 (0.930->0.842, over-held losers/gaveback in chop), bull RAW -0.068 (0.776->0.709 Sh 1.54->1.33) + stab 0.897->0.739, rally stab 0.809->0.507 + raw 0.419->0.385. RECONFIRMS (new vehicle) the documented crash-vs-sideways INSEPARABILITY wall (rows478-479: crash+0.030 from hold-through-chop is INSEPARABLE from sideways loss, both calm/chop, NO churn/trend separator over a 6-step branch): my crash gain is the SAME hold-through-chop effect on the SOURCE-axis (rank-blend) that the prior branch hit on the TIME-axis (EMA) -> same coupling, same wall. Plus exit-surface change collapses rally stab (any fusion change touches rally exit range). NOT branch-worthy (re-treads confirmed-failed crash/sideways separation + rally stab). Discard #3 architectural.
-	0.4109	0.6031	0.3843	0.78	0.76	0.93	-0.05	discard	ARCHITECTURAL multi-day-trend DIRECTION-ASYMMETRIC voter reweighting (route ret_vlong through VOTER WEIGHTS not size/admission-threshold/exit: trend-voters idx1,4,5 x(1+0.2*tanh(ret_vlong/0.01)) for bull strong-sum, x(1-...) for bear; fast-sat). composite 0.6277->0.4109. NEW FINDINGS: (1) bull/crash/sideways BYTE-IDENTICAL (voter-saturated -- weight changes flip NO admission there; reconfirms entry-inert). (2) RALLY STABILITY STAYED 1.000 (NOT collapsed!) -- the voter-WEIGHT channel for ret_vlong is NOISE-SAFE (fast-sat scale 0.01 puts rally |ret_vlong| 0.02-0.04 in flat tanh tail = noise-free weight), UNLIKE the admission-THRESHOLD channel (row505 stab collapse) and exit channel -- a genuinely new noise-safe vehicle for ret_vlong beyond first-bar SIZE. (3) BUT rally RAW collapsed 0.419->-0.053: biasing toward multi-day trend (upweight bull trend-voters in uptrend) ADDS marginal longs (loosened bull admission -> buys pullback tops) AND removes shorts -> FALSIFIES fewer-counter-trend-shorts=better-rally. Rally near-tied long/short mix is already optimal; directional bias hurts. Not branch-worthy (no regime improved, bias direction falsified). Discard #4 architectural. NOTE: noise-safe voter-weight channel is a reusable finding even though trend-bias direction fails.
4b34f56d	0.6277	0.7211	0.1868	0.78	0.76	0.93	0.42	note	RETRACTION of an unverified attribution in rows ~495/504 (a named causal diagnosis about rally counter-trend shorts). It inferred causation from entry-side share + win rate only, never from direction-split PnL — does not meet the description-hygiene bar (see program-stateless.md). Treat that claim as RETRACTED; form hypotheses from raw numbers, not from it. MEASURED FACTS @26f4b23d (reproducible, no interpretation): direction-split realized PnL on rally_2024 — LONG -$380 (20 trades, WR 40%); SHORT +$2379 (48 trades, WR 77%). Counterfactual (force all long targets->0, full backtest): rally Sharpe 0.735->1.028, DD 1.85->1.06pct; controls bull/crash/sideways all go negative Sharpe (long-dominant). NON-bottleneck checks (so future sessions don't re-litigate): 21/21 hand-calc engine tests pass; rally stability 0.809 deterministic (2x identical run) with short-run-penalty branch firing 0/20 trials (divergence is real, not a test artifact); zero-cost rally Sharpe only 0.735->0.923 (trading cost is not the ceiling). NOTE: 'force long->flat' is a measurement probe, NOT a deployable change (it destroys the other 3 regimes; any real change must be continuous + noise-immune, and regime detection remains forbidden). baseline 26f4b23d UNCHANGED.
9a257e3b	0.6277	0.7211	0.1868	0.78	0.76	0.93	0.42	discard	DANGLING EXPERIMENT cleanup (interrupted before result recorded): one-sided counter-trend voter-weight discount (downweight trend-confirming voters idx1,4,5 ONLY on the counter-multi-day-trend side via fast-sat ret_vlong, scale 0.01). The exp commit landed but its regime_test run was KILLED mid-execution (run.log shows only 'Running 4 regimes...' + resource_tracker warning, NO composite_score / result table) and the session handed off before recording or reverting. NO RESULT MEASURED — not scored, not evaluated. strategy.py reverted to baseline 26f4b23d (git checkout, byte-identical verified 0-diff). Recorded per durability rule so the next session sees a clean baseline. baseline 26f4b23d UNCHANGED 0.6277.
-	0.4246	0.6031	0.3569	0.72	0.76	0.93	0.00	discard	ARCHITECTURAL noise-immune min-hold soft-exit clock ramp (suppress _soft_max first 5 bars via bars_held clock, floor 0.35; stop-loss+opp-gate exempt). Composite 0.6277->0.4246. bull Sharpe 1.54->1.39 raw 0.776->0.723 (-0.053, factor stayed 1.0 = GENUINE raw drop, not re-seed). crash+sideways BYTE-IDENTICAL (soft exits not in early-hold window). rally Sharpe 0.735->0.61 AND stab 0.809->0.494 (factor 0, score 0). NO regime improved -> not branch-eligible. Delaying soft exits gives back trend gains in bull+rally = net negative. REVERTED via git checkout.
-	0.3711	0.5678	0.3934	0.67	0.76	0.93	-0.09	discard	ARCHITECTURAL 8th orthogonal voter = Chaikin money-flow (close-location-in-range x volume, 12bar; rescaled STRONG_WEIGHT_MIN 1.75->1.97 + FLIP_MIN_VOTES 2.80->3.20). Composite 0.6277->0.3711. MEASURED: bull Sharpe 1.54->1.27 raw 0.776->0.673 (factor 1.0 = genuine), crash Sharpe FLAT 1.29 raw +0.00007, sideways Sharpe 1.71->1.72 raw +0.0028 (tiny genuine), rally Sharpe 0.735->-0.09 raw 0.419->-0.094 (turned +1.4% annual into -0.2%). NOTE: this AST re-seeded ALL stabilities high (min_stability 0.809->0.932, every factor 1.0) yet rally RAW collapsed independently -> confirms raw, not stability, is the rally wall. CMF (contrarian accumulation) misfires in grinding trends (bull+rally). sideways +0.0028 too small to branch. REVERTED via git checkout.
-	0.4680	0.6341	0.3322	0.78	0.76	0.93	0.07	discard	ARCHITECTURAL SUBSYSTEM REDESIGN (entry-admission): hard trend-gate boolean (_bull_admit/_bear_admit at _trend_biased=+-deadzone) -> smooth trend-alignment SIZE ramp (0->1 over one deadzone width). Composite 0.6277->0.4680. CLEAN RE-SEED INSTANCE: rally RAW BYTE-IDENTICAL 0.41888->0.41900 (smooth gate didn't change clean trades) but rally stab 0.809->0.550 (factor 1.0->0.168) -> rally score 0.419->0.070. bull/crash/sideways BYTE-IDENTICAL (buffered, factors stayed 1.0). Confirms verified re-seed wall: raw-neutral AST change still tanks composite via rally stability re-roll. NO regime improved -> not branch-eligible. REVERTED via git checkout.
-	0.4681	0.6150	0.2939	0.67	0.76	0.90	0.13	discard	ARCHITECTURAL dangling experiment cleanup (1c537437 sizing-pipeline redesign, interrupted before recording): combined_mult chop-boosts multiplicative->additive-deviation blend. composite 0.6277->0.4681. crash byte-identical 0.759, but rally stab 0.809->0.301 (rally 0.419->0.126, >50pct floor breach) + bull stab 1.0->0.872 (bull 0.776->0.673) + sideways raw 0.930->0.902 from AST re-seed. Confirms sizing-cascade STRUCTURE change re-seeds rally downward (documented wall). Rolled back strategy.py to 26f4b23d via git checkout.
26f4b23d	0.6277	0.7211	0.1868	0.78	0.76	0.93	0.42	keep	RE-APPENDED baseline keep row (integrity rule: most recent keep abfb9591 0.6300 REVERTED cross-ex-fail per row586/592 session-summaries; true baseline 26f4b23d 0.6277 confirmed by re-run this session). Verified composite 0.627701 mean 0.721094 std 0.186786 [bull 0.776303 stab1.0, crash 0.758959 stab1.0, sideways 0.930234 stab1.0, rally 0.418878 stab1.0 min_stab 0.808894]. ALL stability factors 1.0; binding constraint rally RAW 0.419.
-	0.4353	0.6164	0.3621	0.78	0.76	0.93	0.00	discard	ARCHITECTURAL cross-symbol market-vol de-risk overlay (NEW pre-pass: size *= 1-0.35*tanh((mean_sym(short24_vol/100bar_baseline)-1.3)/0.5), shrink-only, stateless cross-symbol dep). composite 0.6277->0.4353. bull/crash/sideways BYTE-IDENTICAL (0.776/0.759/0.930) = overlay INERT there: in SUSTAINED-vol regimes the short/long vol RATIO normalizes ~1.0 (100bar baseline catches up to crash vol) so NO shrink fired in crash (the intended target). rally COLLAPSED 0.419->0.000 (stab 0.809->0.493 <0.50 floor -> factor 0): rally calm uptrend has TRANSIENT short-vol spikes (>1.3x baseline) that DID fire the shrink, changing rally entries + AST re-seed. LESSON: short/long vol RATIO detects transient spikes (present in rally) NOT sustained turbulence (crash baseline normalizes); reconfirms SIZE changes are bull/crash/sideways-INERT and only rally responds (downward). NOT branch-worthy (fire-in-crash-not-rally = regime detection, forbidden). Rolled back via git checkout.
