commit	score	mean_score	std_score	bull_2021	crash_bear	sideways	rally_2024	status	description
	-	-	-	-	-	-	-	branch:discard	BRANCH (wick-rejection entry boost) REVERTED to 637f5e53 after 4 steps (step1 amplify-mag, step2 tighten-gate, step3 bull-only, step4 loosen-gate). Opened from Exp5 (wick-rejection gave rally +0.0019 at 0.05 magnitude -- a REAL positive signal on the binding regime, but composite +0.000584 sub-noise <0.003 keep threshold). MEASURED best (step0/Exp5): composite 0.779898 (+0.000584 vs 0.779314), rally 0.632168->0.634087 (+0.001919, Sh1.470->1.475), bull -0.000076, crash -0.000234, sideways +0.000038; all stab 1.0, all MaxDD<10pct. PREMISE VALIDATED (the wick-rejection signal IS real for rally: grinding-uptrend bars have dip-rejection wicks -- buyers absorb intrabar pullback selling -> higher-conviction long -> +0.0019 rally). BUT the signal is SUB-NOISE and UN-AMPLIFIABLE to the +0.003 keep threshold: (step1) magnitude 0.05->0.08 -> rally DD 6.37->6.40, rally -0.0004 (entry-shrink noise wall -- larger first-bar sizing on rally alt legs gives back more, offsetting conviction gain; 0.05 is the sweet spot); (step2) tighten gate 0.25->0.35 -> rally -0.0005 (the gain came from the LOWER threshold firing on more wick bars, not concentration); (step3) remove bear wick -> rally IDENTICAL (bear wick was inert; the ENTIRE rally gain is bull-side); (step4) loosen gate 0.25->0.15 -> marginal +0.0001 (Sh1.475->1.477). Branch plateaued at ~+0.0006 composite, far below +0.003. CROSS-EXPERIMENT CONCLUSION (measured this session): the open-relative wick-rejection is a genuine NEW candle-shape primitive (distinct from close_loc which includes the body and is a linear transform of wick asymmetry) that carries real rally trend-conviction signal (+0.0019 rally raw), but it sits in the same entry-shrink noise wall that capped every prior entry-sizing experiment -- the rally resize lattice is exquisitely noise-sensitive so the magnitude that delivers the conviction gain (0.05) is also the magnitude where larger sizing starts giving back more in pullbacks (DD up). The signal cannot be amplified to keep. Per the sub-noise rule (improvements <0.003 are in-sample noise-floor, discard even if positive), reverted. Terminated by decision (clear plateau, not 7-step guard) after 4 steps. results.tsv append-only preserved (path-scoped git checkout -- strategy.py throughout, never git revert).
	-	-	-	-	-	-	-	session-summary	SESSION (baseline 637f5e53 0.779314 -> UNCHANGED, no keep): 5 independent architectural experiments (Exp1-5, all discards) + 1 exploration branch (wick-rejection entry, 4 steps, reverted). EXIT RULE: 5 consecutive architectural discards (Exp1-5) met; branch opened on Exp5 (per-regime improvement on binding regime + fundamentally new mechanism) before final exit. User 2-arch-discard minimum exceeded (5). Baseline 637f5e53 re-verified reproduces 0.779314 byte-identical at session start [bull 0.923316 Sh1.936 DD3.71pct 56t WR82.1pct, crash 0.730154 Sh1.274 DD3.04pct 52t 100pct WR, sideways 1.012687 Sh2.001 DD2.75pct 52t, rally 0.632168 Sh1.470 DD6.36pct 100t 85pct WR; all stab 1.0, all raw==score, min_stab 0.807; streak_gate rally exp(-4/30)=0.875, bull exp(-3/30)=0.905]. THEME: probed the ONE previously-untested voter-aggregation core mechanism (ramp power), a simplification, a novel exit data primitive, and a novel entry candle-shape primitive (the last opened a branch). Exp1 VOTER RAMP SEXTIC (P=5->6, renormalized): CATASTROPHIC bull/rally DD breached 13.7/14.4pct (-999), Sh collapsed (rally 1.470->-0.440, WR85->57pct) -- sharpening away medium-conviction voters HURT trend regimes (conclusion d confirmed+stronger). Exp2 VOTER RAMP QUARTIC (P=5->4, symmetric counterpart): BYTE-IDENTICAL to Exp1 sextic (bull/rally -999, identical Sharpe/trade counts to the decimal) -- admission decisions are power-invariant P=4 vs P=6 (saturated voters dominate the EMA-readiness margin) yet BOTH deviate catastrophically from P=5 -> the EXACT quintic shape is a sharp tuned local optimum, load-bearing BOTH ways. Completes characterization of the ramp-power lever: walled. Exp3 SIMPLIFICATION (remove 4 grid-completion volume boosts + dead DVP): sub-noise -0.0022, rally stability 1.0->0.991 (min_stab 0.797 below knee), bull/crash byte-identical -- the boosts are MILDLY LOAD-BEARING for rally alt-leg stability (not redundant under v2.2), reconfirming the entry-shrink noise wall. Exp4 RANGE-EXPANSION exit (new data primitive: 3-bar range/ATR): rally/bull BYTE-IDENTICAL (giveback fires first -> exit-path inertness confirmed), crash -0.0028 (early harvest), net sub-noise -0.0008. Exp5 WICK-REJECTION entry (new candle-shape primitive: open-relative lower/upper wick = dip-rejection, DISTINCT from close_loc which includes the body and is a linear transform of wick asymmetry): composite +0.000584 SUB-NOISE but rally +0.0019 (Sh1.470->1.475, the FIRST binding-regime gain this session) -> opened branch. BRANCH (wick-rejection, 4 steps): the signal is REAL for rally (grinding-uptrend bars have dip-rejection wicks = buyers absorb intrabar pullback selling -> higher-conviction long) BUT UN-AMPLIFIABLE to +0.003: step1 magnitude 0.05->0.08 -> rally DD up -0.0004 (entry-shrink noise wall caps magnitude at 0.05); step2 tighten gate -> rally gain lost (gain came from LOW threshold firing on more wick bars); step3 remove bear wick -> rally IDENTICAL (bear wick inert, entire gain is bull-side); step4 loosen gate -> marginal +0.0001 (Sh1.475->1.477). Plateaued at ~+0.0006 composite. Per sub-noise rule (<0.003 = in-sample noise-floor, discard even if positive), reverted. CROSS-SESSION CONCLUSIONS (all measured this session): (a) VOTER RAMP POWER is load-bearing at quintic in BOTH directions (sextic and quartic both catastrophically breach DD) -- the exact P=5 shape is calibrated against STRONG_WEIGHT_MIN/EMA-accumulator, NOT a free lever; the one previously-untested voter-agg core mechanism is now confirmed walled (joins prior family-discount and max-trim failures). (b) The open-relative WICK-REJECTION is a genuine NEW candle-shape primitive carrying real rally trend-conviction signal (+0.0019 rally raw), but it sits in the SAME entry-shrink noise wall as every prior entry-sizing experiment -- the rally resize lattice is exquisitely noise-sensitive so the magnitude delivering the conviction gain (0.05) is also where larger sizing starts giving back more in pullbacks; the signal cannot be amplified to keep. (c) The grid-completion volume boosts are NOT redundant under v2.2 (mildly load-bearing for rally alt-leg stability). (d) Exit-path INERTNESS reconfirmed (range-expansion exit inert on binding regimes, giveback fires first -- joins peak-stall/trend-deceleration/cross-symbol-divergence). NEXT SESSION: the strategy is at a confirmed deep local optimum (4 sessions now: 17 architectural discards + 3 reverted branches, no keep since 637f5e53). Every documented avenue is walled: voter-aggregation (ramp power both ways + family-discount + max-trim), DD-reduction (giveback-tightening + tp-harvest at cliffs), return-seeking/hold-longer (rides corrections -> bull collapse), streak (structural, unbreakable entry-side), exit paths (inert), vol-blindness (tapped), novel signals (cushion blows DD, skew/admission over-harvest bull, bounce/AC inert, wick sub-noise-un-amplifiable). The remaining documented avenue (structural-exploration subsystem rewrite of voter-aggregation quintic / exit-fusion MAX / de-risk cushion) is now EXPLICITLY confirmed high-risk: Exp1/Exp2 showed ANY voter-ramp change blows DD to 14pct (the relaxed gates RETAIN the 10pct DD cutoff -> step-1 discard); exit-fusion rewrite would be inert (exit paths inert on binding regimes); de-risk cushion rewrite touches rally DD knife-edge. No non-timing-touching core mechanism replacement is identifiable. results.tsv append-only preserved (path-scoped git checkout -- strategy.py throughout, never git revert); all 5 discards + 4 branch steps reverted to 637f5e53; strategy.py matches 637f5e53 byte-identical (empty diff verified).
cfa8c418	0.776376	0.822453	0.153588	0.923247	0.730155	1.012681	0.623728	discard	Exp1 (architectural, indep): BOUNDED BOOST COMPOSITE. Replaced the 10 multiplicative >1 entry boost factors (xasset/vol_rise/vol_partner/vol_btc/btcvol_partner/partnervol_btc/close_conv/dvp/btcdvp/partnerdvp, each +0.05-0.12 on deep-saturated gates) with one soft-capped product (cap 1+0.50*tanh((prod-1)/0.50)). Hypothesis: the 10 boosts compound to ~2.2x on fully-confirmed broad-trend entries, over-sizing rally/crash trend longs whose giveback-through-pullbacks is the DD source. MEASURED vs 637f5e53 0.779314: composite -0.002938 (0.776376 REGRESSION), mean -0.002128 (0.822453), std +0.002698 (0.153588). PER-REGIME: bull BYTE-IDENTICAL 0.923247 (boosts near 1, cap inert -- confirms byte-identical-when-near-1 property), crash BYTE-IDENTICAL 0.730155, sideways BYTE-IDENTICAL 1.012681, rally 0.632168->0.623728 (-0.008440, raw 0.632->0.629941, stab dropped 1.0->0.990 -> min_stability 0.807->0.797 BELOW 0.80 knee; DD 6.36->6.18pct DID drop -- mechanism confirmed). SIGNAL: capping over-sizing reduced rally DD as hypothesized, BUT rally raw also dropped -- confirmed entries are genuinely profitable so shrinking them costs return faster than DD-relief gains (dd_gate gain ~1pct outweighed by Sharpe/return loss + new stability penalty from size-timing wobble). Direction net-negative. All MaxDD<10pct (max rally 6.18). DISCARD: cap too aggressive on the quality entries; the over-size is not pure waste. Reverted to 637f5e53.
9e73e64f	0.769173	0.809837	0.135548	0.910316	0.730154	0.968008	0.630870	discard	Exp2 (architectural, indep): CONCAVE front-loaded scale-in ramp for trend-aligned+slope-confirmed+profitable positions. Replaced linear ramp (progress) with progress**(1-0.40*qual) for qualifying scale-in positions (qual = _slope_conf * trend_align * pos_pnl>0 gate); front-loads size in bars 1-2. Hypothesis: linear under-commits early on confirmed-trend winners -> front-load captures more trend move -> rally/crash Sharpe up. MEASURED vs 637f5e53 0.779314: composite -0.010141 (0.769173 REGRESSION), mean -0.014744 (0.809837), std -0.015342 (0.135548 BETTER but via sideways regression not rally gain). PER-REGIME: bull 0.923316->0.910316 (-0.013, DD3.71->3.87), crash BYTE-IDENTICAL 0.730154, sideways 1.012687->0.968008 (-0.044679 BIG regression, DD2.75->3.04), rally 0.632168->0.630870 (-0.001298 ~flat, DD6.36->6.44), min_stability 0.807->0.801. SIGNAL: front-loading early size increased adverse-excursion risk in mean-reverting sideways (early size in chop = early adverse move) + pullback-prone bull; the confirmed-winner-capture hypothesis did NOT manifest in rally (flat). Net negative. All MaxDD<10pct (max rally 6.44). DISCARD: front-loaded scale-in hurts the mean-reverting/choppy regimes more than it helps trend regimes. Reverted to 637f5e53.
08e61b8e	0.775706	0.822291	0.155285	0.906425	0.730279	1.027326	0.625136	discard	Exp3 (architectural, indep): PORTFOLIO-DD-ADAPTIVE DE-RISK FLOOR raise for trend-aligned profitable winners. NEW DD-coupling on a 3rd exit path (de-risk ramp floor, uncoupled from DD today; giveback-tightening + tp-harvest-relax are the maxed levers on pp_pressure + tp scale-down). During portfolio DD, RAISE _de_floor for trend-aligned+profitable winners so they de-risk faster -> cap DD from riding trend longs through pullbacks (rally 6.36pct binding). Byte-identical at portfolio peak. MEASURED vs 637f5e53 0.779314: composite -0.003608 (0.775706 REGRESSION), mean -0.002290 (0.822291), std +0.004395 (0.155285). PER-REGIME: bull 0.923316->0.906425 (-0.016891, DD3.71->3.87), crash ~flat 0.730154->0.730279 (+0.000125), sideways 1.012687->1.027326 (+0.014639 IMPROVED, DD2.75 unchanged), rally 0.632168->0.625136 (-0.007032, DD6.36->6.48 UP BACKFIRE, raw0.632->0.6266, stab 1.0->0.999), min_stability 0.807->0.799 BELOW 0.80 knee. MECHANISM FALSIFIED: faster de-risk on trend winners -> smaller positions -> RE-ENTER the still-uptrend -> churn -> more giveback on re-entries -> DD UP not down. RE-CONFIRMS documented wall (codebase line ~1786, row-1015): only PEAK-harvesting (giveback/tp) DD levers are rally-safe; ANY OPEN-position cut during DD backfires on rally. The de-risk floor raise is an open-position cut -> backfire. All MaxDD<10pct (max rally 6.48). DISCARD. Reverted to 637f5e53.
-	-	session-summary	SESSION (baseline 637f5e53 0.779314 -> UNCHANGED, no keep): 3 independent architectural experiments (Exp1-3, all discards), no branch opened (none branch-worthy -- each regressed the target regime or re-hit a documented wall). EXIT RULE: 3 consecutive architectural discards; exited on idea-exhaustion after verifying via saturation grep that every remaining lever is saturated (giveback 142, de-risk 111, MAX-fusion 78, voter_bias 67, vol-expansion 51, efficiency-ratio 51, grid 42, scale-in-ramp 39, DVP 28, adverse-recovery 31, close-loc 18, tp-harvest 15 mentions, all mostly discards). BASELINE PER-REGIME: bull 0.923316 / crash 0.730154 / sideways 1.012687 / rally 0.632168; mean 0.824581 std 0.150890. All stability_factor 1.0, all flip_streak_gate 1.0, all raw==score (binding constraint is RAW return not stability), all MaxDD<10pct (max rally 6.36). Exp1 bounded-boost-composite: capped 10 multiplicative entry boosts (compound ~2.2x on confirmed entries); rally DD 6.36->6.18 (mechanism confirmed) BUT rally raw 0.632->0.630 + stab below 1.0 -> composite -0.0029. LESSON: confirmed rally entries are genuinely profitable, shrinking them costs return faster than DD-relief gains (over-size is not waste). Exp2 concave front-loaded scale-in for slope-confirmed trend-aligned winners: sideways -0.045 (early size in chop = adverse excursion), bull -0.013, rally flat -> composite -0.010. LESSON: front-loading size hurts mean-reverting/choppy regimes. Exp3 portfolio-DD de-risk floor raise: rally DD UP 6.36->6.48 BACKFIRE (faster de-risk -> re-entry churn -> more giveback), bull -0.017. RE-CONFIRMS documented wall: only PEAK-harvesting (giveback/tp) DD levers rally-safe; any OPEN-position cut during DD backfires. KEY DIAGNOSTIC: rally (binding low 0.632, std outlier) -- 100 trades, 85pct WR, PF 9.4, Sharpe 1.47, AnnRet 21.6pct, MaxDD 6.36pct, calmar 3.40 (lowest of all regimes). rally drag is DD-driven (dd_gate 0.940 + low calmar -> low return_reward 0.848); sample_factor 1.0 (100 trades), streak_gate 1.0, stability 1.0 -- none of those are the drag. DD reduction is the only rally lever but every DD-reduction avenue is either maxed (giveback-tighten 0.50, tp-harvest-relax 0.60) or walled (open-position cuts backfire; entry-shrink costs raw; stops non-binding -- ct losers exit via slope/giveback before stop). Strategy confirmed at deep structural local optimum; baseline unchanged across 3+ prior 5-discard sessions + this session's 3.
49e3e2ef	0.779733	0.825103	0.151234	0.925402	0.730154	1.012687	0.632168	discard	Exp1 (architectural, indep): PORTFOLIO-DD-adaptive PROFIT-side slope-pressure amplification (3rd DD lever on the slope exit path). _w_slope was loss-only amplified; added profit-side amplification during portfolio DD so first slope reversal harvests winners (locks gains, caps DD). MEASURED vs 637f5e53 0.779314: composite +0.000419 (0.779733 SUB-NOISE <0.003), mean +0.000522, std +0.000344. PER-REGIME: bull 0.923316->0.925402 (+0.002086, Sh1.936->1.941, DD3.71 unchanged, stab0.866); crash BYTE-IDENTICAL 0.730154; sideways BYTE-IDENTICAL 1.012687; rally BYTE-IDENTICAL 0.632168 (Sh1.470 DD6.36pct). The DD-coupled slope amp did not fire on rally/crash (their portfolio DD fraction rarely reaches the /0.012*LEVERAGE_K activation, OR their winners dont hit the profit-side slope-against zone); only bull pullback winners activated. Target regime inert. Sub-keep threshold. Reverted to 637f5e53.
e805f559	0.779314	0.824581	0.150890	0.923316	0.730154	1.012687	0.632168	discard	Exp2 (architectural, indep): PROFIT-CUSHION slope-against threshold relaxation for trend-aligned deep-profit winners. _slope_thresh was vol-only; raised it up to 1.3x for trend-aligned in-profit deep-cushion winners so bounces (dead-cat/pullback) dont trip the slope exit -> ride more trend move. MEASURED vs 637f5e53 0.779314: BYTE-IDENTICAL (composite/mean/std/all regimes unchanged). Slope-against is not the binding exit term for deep-profit trend-aligned winners: _sl_slope_pressure is 0 (slope confirms the trend) or giveback/time dominates the MAX fusion whenever slope is near threshold. Reverted to 637f5e53.
4e8baf17	0.779314	0.824581	0.150890	0.923316	0.730154	1.012687	0.632168	discard	Exp3 (architectural, indep): MULTI-DAY TREND ACCELERATION (1st difference of 96-bar ret_vlong) entry boost/shrink. NEW data dep: ret_vlong level is used for ct-gating, its rate-of-change (accel = ret_vlong - ret_vlong_prev over 12-bar lag) is not. Trend-aligned entry during acceleration -> larger first-bar; deceleration -> smaller. MEASURED vs 637f5e53 0.779314: BYTE-IDENTICAL (all regime scores unchanged). The +/-0.05 first-bar size change is smaller than the order-emission grid quantization step (0.06*equity*BASE_POSITION_SIZE in both churn and calm partitions) -> snaps to the same grid level -> no emitted-trade change. Small entry-size changes absorbed by the grid layer (documented wall). Reverted to 637f5e53.
8fddf36a	-999.000000	-249.527228	432.708365	-999.000000	0.636716	0.009748	0.244625	branch:step1	STRUCTURAL_EXPLORATION step1: exit-fusion MAX -> thresholded LSE (FUSE_TAU=4, FUSE_FLOOR=0.02). MEASURED vs 637f5e53 0.779314: CATASTROPHIC regression, composite -999 (bull DD 13.52pct BREACHES 10pct hard cutoff -> -999). PER-REGIME: bull 0.923316->-999 (Sh1.936->0.518, DD3.71->13.52pct, WR82->70pct, trades56->97), crash 0.730154->0.636716 (Sh1.274->1.257, stab0.981->0.925), sideways 1.012687->0.009748 (stab0.868->0.510 BELOW 0.50 knee -> factor0, DD2.75->8.55pct, Sh2.001->0.993), rally 0.632168->0.244625 (stab0.807->0.654 BELOW 0.80 knee, raw0.632->0.478, DD6.36->7.14pct, Sh1.470->1.085). ROOT CAUSE: LSE is ALWAYS >= max (log-sum-exp property) -> systematic positive bias to exit pressure -> exits fire earlier across the board -> churn + DD up (bull breach) + stability crash. The agreement bonus (log(2)/tau=0.173 at tau=4) is too large in the ~0.5 pressure space. BREACHES retained 10pct DD cutoff + 50pct regime gate (bull -999). Branch continues: step2 replaces LSE with a bounded top-2 agreement blend (exactly MAX single-source, small bounded bonus only for a REAL second source above a floor, no systematic positive bias).
c4f53f59	-999.000000	-749.178401	432.703702	-999.000000	-999.000000	-999.000000	0.286394	branch:step2	STRUCTURAL_EXPLORATION step2: LSE -> bounded top-2 agreement blend (AGREE_BONUS=0.15, AGREE_FLOOR=0.10). MEASURED vs 637f5e53 0.779314: STILL CATASTROPHIC, composite -999 (3 regimes DD-breach >10pct: bull 12.60, crash 11.86, sideways 11.38). PER-REGIME: bull 0.923->-999 (Sh0.521, DD12.60, trades56->75), crash 0.730->-999 (Sh0.713, DD11.86, trades52->100), sideways 1.013->-999 (Sh1.171, DD11.38, trades52->104), rally 0.632->0.286 (Sh0.999, DD8.61, stab0.768). ROOT CAUSE CONFIRMED: the soft pressure terms are FREQUENTLY co-active above 0.10 (giveback+time+slope all moderate during normal operation), so the agreement bonus fires on nearly every bar -> systematic exit-pressure inflation -> premature exits -> churn + DD explosion. This re-introduces the CORRELATED-NOISE ADDITION the MAX fusion was explicitly chosen to eliminate (prior session: MAX replaces weighted sum to eliminate correlated noise addition). MAX is load-bearing BECAUSE terms are co-active by design; agreement-amplification is structurally counterproductive here. Branch continues step3 with ultra-conservative params (floor=0.40 strong-agreement-only, bonus=0.05) to confirm the direction is dead.
ab0d74f7	0.383485	0.465896	0.274703	0.571476	0.712111	0.000000	0.579996	branch:step3	STRUCTURAL_EXPLORATION step3: ultra-conservative top-2 (AGREE_BONUS=0.05, AGREE_FLOOR=0.40 strong-agreement-only). MEASURED vs 637f5e53 0.779314: regression, composite 0.383485 (-0.396), raw_composite 0.415214. No DD breach this time (bull 3.56, crash 3.04, sideways 2.75, rally 6.36 all <10pct) BUT stability collapsed: bull stab0.866->0.755 (below 0.80 knee -> penalized, Sh1.936->1.525, trades56->41), sideways stab0.868->0.393 (BELOW 0.50 knee -> factor 0.0, score ZEROED despite Sh1.99), rally stab0.807->0.777 (below 0.80 knee). crash near-baseline (0.730->0.712, Sh1.274->1.267). Even with floor=0.40 the bonus fires often enough to systematically raise exit pressure -> premature exits -> stability collapse. 3rd consecutive regression (raw_composite 0.779->-379->-879->0.415). TERMINATION GUARD TRIGGERED (3 consecutive regressions). CONCLUSIVE STRUCTURAL FINDING: the MAX fusion is load-bearing because soft pressure terms are co-active above any reasonable floor during normal operation; ANY agreement-amplification (LSE or top-2, any params) systematically inflates exit pressure -> stability collapse. MAX (winner-take-all) is structurally optimal -- it was explicitly chosen to eliminate the correlated-noise addition that agreement-amplification re-introduces. Direction DEAD.
