commit	score	mean_score	std_score	bull_2021	crash_bear	sideways	rally_2024	status	description
26f4b23d-session-summary	-	-	-	-	-	-	-	session-summary	session: 5 independent architectural discards (EXIT RULE triggered at 5 consecutive architectural), 0 branches opened (none branch-worthy). Baseline 26f4b23d UNCHANGED 0.6277 [bull 0.776 sh1.54 stab0.897 f1.0, crash 0.759 sh1.29 stab0.974 f1.0, sideways 0.930 sh1.71 stab0.869 f1.0, rally 0.419 sh0.735 stab0.809 f1.0 = ALL factors 1.0; binding constraint rally RAW]. EXPERIMENTS (all NEW mechanisms, not re-tries): (exp1) equity-return-VOLATILITY self-feedback size atten [NEW signal: 2nd moment of own equity curve, distinct from _port_dd_atten drawdown depth] -> bull/crash/sideways BYTE-IDENTICAL (inert ratio~1) but rally raw flat + stab COLLAPSE 1.0->0.454; equity-vol-ratio is same noise-sensitive family as ret_vlong. (exp2) HIERARCHICAL two-family exit fusion subsystem redesign [trajectory{slope,time,ve} + giveback{pp,ep,ar}, MAX-within then bounded soft-OR a+b-ab; NOVEL vs flat noisy-OR/softmax/log-sum-exp redesigns] -> rally raw BYTE-IDENTICAL but stab COLLAPSE 1.0->0.046; ANY change to exit-pressure->threshold surface in rallys range kills rally stab. (exp3) PROFIT-PYRAMID winner-growth past size [NOVEL: all prior layers CAP at size; grow deep-profit+trend-aligned winners +25pct] -> CATASTROPHIC -0.164, DD BLOWUP 4-5x ALL regimes (pyramiding puts MAX exposure at PEAK -> giveback amplified -> DD explodes; strategy finely tuned <1.9pct DD forbids winner-growth). (exp4) low-volume ADMISSION tightening [NOVEL volume-LEVEL gate, changes trade SET = can move raw] -> crash +0.008 + sideways +0.001 GENUINE raw gains BUT rally COLLAPSE 0.419->-0.093 (low-vol=GOOD rally pullback-accumulation entry but BAD crash/sideways = cross-regime DIRECTIONAL conflict). (exp5=PHASE-3 COMBO) exp4 volume-gate x _cm<=2 churn-partition -> crash/sideways gains kept BUT rally STILL collapses (byte-id to exp4) + bull stab 1.0->0.929; DECISIVE: _churn_hist RESETS per-regime so _cm=0 at every regime START -> volume gate ON for rallys EARLY entries before burst registers -> admission damage PRECEDES the burst signal -> _cm partition (proven at EXECUTION/resize layer) does NOT transfer to ADMISSION layer. NEW CROSS-EXPERIMENT CONCLUSIONS (load-bearing): (1) rally RAW remains unmovable: ct-shrink is Sharpe-scale-invariant(raw-neutral), trade-set changes hit price-noise boundary OR cross-regime conflict, winner-growth blows up DD. (2) volume-LEVEL admission is regime-directionally-CONFLICTED (low-vol good for rally accumulation, bad for crash/sideways) — unresolvable by symmetric knob or by _cm (resets per-regime, gate fires before burst). (3) confirmed walls extended: equity-return-vol-ratio joins ret_vlong family (per-bar position-value noise); hierarchical exit fusion joins flat-fusion-redesign family (exit-threshold-surface noise); pyramiding ruled out (DD). all 5 reverted via git checkout -- strategy.py, results.tsv append-only intact.
-	0.5503	0.6787	0.2567	0.78	0.76	0.93	0.25	discard	ARCHITECTURAL continuous-interpolated adaptive median window (linear blend of 5-bar median at two adjacent integer windows, replaces int(round) in ret_short voter). MOTIVATED by row530 (fixed-window gave rally stab 1.0 but killed Sharpe; this is the untried MIDDLE: keep vol-adaptivity, remove only the discrete jump). RESULT: rally raw BYTE-IDENTICAL 0.41896 (alpha preserved as intended) but rally stab 0.809->0.679 factor 1.0->0.595 = WORSE not better. composite 0.6277->0.5503. MECH: discrete adaptive_med was FLAT between its 365 rounding-crossings (stable median ref except at jumps); continuous interp makes _med_frac=f(vol_ratio) vary EVERY bar -> blended median ref wobbles continuously under AR(1) across ALL bars -> ret_short (foundational voter + strength_scale sizing) noisier than discrete. CONCLUSION (extends row530): adaptive-median alpha and noise COUPLED - the discrete-flat-between-jumps form is STRICTLY better than continuous interp (same raw, higher stab); the middle path is the WORST of both. Not branch-worthy. Discard #1 architectural.
-	0.5330	0.6692	0.2724	0.78	0.76	0.93	0.21	discard	ARCHITECTURAL age-gated profit harvest (integer bars_held>14 separator, row440-flagged UNTESTED, fast-sat tanh, profit-only, 10pct max, SL-exempt). TARGET: crash sample_factor+return-smoothing lever (D4). RESULT: composite 0.6277->0.5330. crash/sideways/bull trade counts BYTE-IDENTICAL 43/45/49 (harvest reduces ABSORBED by  emission gate / grid -> ZERO sample_factor gain) + their raw byte-flat. rally raw byte-identical 0.418889 but stab 0.809->0.652 factor 1.0->0.505 COLLAPSED. FALSIFIES row440 hypothesis ('integer bars_held gate untested, rally short-held vs crash long-held may separate'): rally DOES hold long trend-side winners >14 bars -> high-bars_held does NOT isolate calm regimes from rally; harvest fired in rally, action diverges under AR(1). Reconfirms row440/534: rally tolerates NO timing-variable realizing event regardless of how noise-immune the gate; a harvest ACTION (not just rounding) always adds a divergent reduce event. crash harvest reduces too small to cross emission gate anyway. Not branch-worthy (no regime improved). Discard #2 architectural.
-	0.2735	0.4067	0.2663	0.34	0.60	0.68	0.00	discard	ARCHITECTURAL subsystem redesign: rolling-dispersion STANDARDIZED voter confidence transform (rescale each of 7 voter signals by its own recent mean-abs dispersion, 50/50 blend w fixed scale, floor 0.5; reuses _voter_sign_history). Distinct from row93 (vol_ratio EXTERNAL divisor) and all aggregation redesigns (changes per-voter conf VALUES). RESULT: composite 0.6277->0.2735 catastrophic. Trade counts EXPLODED bull43->57 crash45->105 sideways49->104 rally68->192 (self-normalization DE-SATURATES voters: marginal signals look strong vs recent calm dispersion -> 3x over-trading). crash RAW +0.030 (0.759->0.789 wrong target) but bull raw 0.776->0.539 + sideways 0.930->0.681 (over-trading dilutes profit/trade). rally 0.000 HARD CUTOFF (stab 0.493); bull stab 0.690 crash stab 0.729 ALL collapsed. CONCLUSION (load-bearing): the FIXED per-voter divisors are LOAD-BEARING - voter confidence is DELIBERATELY saturated (genuine trend = all voters max conf = the trend signal); rolling-dispersion standardization (a) makes conf a fn of recent price-derived dispersion = noise-sensitive = canonical rally wall, (b) de-saturates -> triples turnover -> Sharpe dilution everywhere. Not branch-worthy (rally cutoff, bull/sideways raw down, crash raw=wrong-target rally-inseparable, over-trading intrinsic = no fix). Discard #3 architectural.
-	0.5059	0.6507	0.2896	0.75	0.76	0.93	0.16	discard	ARCHITECTURAL integer minimum-hold floor (bars_held>=3) on SOFT de-risk + tp-harvest exit paths (SL binary + opp-gate reversal exempt; scale-in unaffected). NEW control flow on noise-immune entry-anchored integer. TARGET: rally over-trading (D2 churn). RESULT: composite 0.6277->0.5059. crash/sideways BYTE-IDENTICAL 45/49 (hold long, floor never bites); bull raw 0.776->0.749 (fewer early exits); rally trades 68 unchanged, rally RAW BYTE-IDENTICAL 0.418878 (floor inert clean: early soft-exits already rare) but stab 0.809->0.618 factor 1.0->0.394 COLLAPSED. CANONICAL SIGNATURE (load-bearing, NEW form): a HARD integer bars_held floor is noise-immune in VALUE but NOT in its INTERACTION with open-position STATUS - whether a position is still OPEN at bar 3 depends on prior NOISY exits, so the floor's bite-point shifts per noise path -> divergent exit timing -> rally collapse (matches row534 'scale-out at noise-sensitive open-status bars'). Integer-time gate is rally-safe ONLY for SIZE/rounding (deterministic given open), NOT for any exit-EMISSION decision (open-status itself is the noise channel). No regime improved. Not branch-worthy. Discard #4 architectural.
-	0.4060	0.6006	0.3891	0.78	0.76	0.93	-0.06	discard	ARCHITECTURAL subsystem redesign: SMOOTH breadth co-firing amplifier on strong-sum (reward broad voter agreement, continuous excess-sum NO count boundary, symmetric both sides, max +12pct). Structural INVERSE of failed family-discount (row525), aligned w strongest insight 'price-trend voters co-firing IS the signal' (525d/429d). RESULT: composite 0.6277->0.4060. bull/crash/sideways BYTE-IDENTICAL (voters already saturated -> breadth~max~constant -> amp inert; CONFIRMS row429d/525 voter-saturation: those regimes raw NOT voter/admission-bound). RALLY raw 0.419->-0.063 NEGATIVE (Sharpe 0.735->-0.06, WR 66->56pct, trades 68->78) despite stability 1.000: the strong-sum amplification LOWERS the effective admission bar -> rally admits 10 more marginal counter-trend entries -> Sharpe collapses. Canonical 'breadth loosening = rally noise' wall (rows 525/436): symmetric smooth reward does NOT escape it - amplification reaches rally's admission crossing regardless of shape. No regime improved. Not branch-worthy. Discard #5 architectural. EXIT RULE TRIGGERED (5 consecutive architectural discards).
26f4b23d-session-summary	-	-	-	-	-	-	-	session-summary	session: 5 independent architectural discards (EXIT RULE triggered at 5 consecutive architectural), 0 branches opened (none branch-worthy). Baseline 26f4b23d UNCHANGED 0.6277 [bull 0.776 sh1.54 stab0.897 f1.0, crash 0.759 sh1.29 stab0.974 f1.0, sideways 0.930 sh1.71 stab0.869 f1.0, rally 0.419 sh0.735 stab0.809 f1.0 = ALL factors 1.0; binding constraint rally RAW]. EXPERIMENTS (each FALSIFIED a specific prior FUTURE hypothesis or extended a wall): (exp1) CONTINUOUS-INTERP adaptive median window [row530-flagged untried MIDDLE between discrete-adaptive and fixed-constant: keep vol-adaptivity, remove int(round) jump via linear blend of 5-bar median at 2 adjacent integer windows] -> rally raw BYTE-IDENTICAL 0.41896 but stab 0.809->0.679 WORSE: discrete adaptive_med was FLAT between its 365 rounding-crossings (stable except at jumps); continuous interp makes _med_frac=f(vol_ratio) vary EVERY bar -> blended median ref wobbles continuously under AR(1) across ALL bars -> STRICTLY WORSE than discrete. (exp2) AGE-gated profit harvest [row440-flagged 'integer bars_held untested, rally short-held vs crash long-held may separate'] -> FALSIFIED: rally DOES hold long trend-side winners >14 bars; harvest fired in rally, stab 0.809->0.652; crash got 0 new trades (reduces grid-absorbed). (exp3) ROLLING-DISPERSION standardized voter confidence transform [rescale each signal by own recent mean-abs] -> composite 0.273 catastrophic: DE-SATURATES voters -> over-trading 68->192 rally, fixed divisors are LOAD-BEARING (voter saturation is deliberate). (exp4) integer MIN-HOLD floor (bars_held>=3) on soft/de-risk/harvest exits [SL+opp exempt] -> rally raw byte-identical but stab 0.809->0.618: NEW load-bearing insight - integer-time gate is noise-immune in VALUE but NOT in INTERACTION with open-position STATUS (whether pos still open at bar 3 depends on prior noisy exits) -> rally-safe ONLY for SIZE/rounding, NOT exit-EMISSION. (exp5) SMOOTH breadth co-firing amplifier on strong-sum [inverse of family-discount, symmetric] -> rally raw NEGATIVE -0.063 (admits 10 marginal entries via lowered effective admission bar); bull/crash/sideways BYTE-IDENTICAL (voter-saturated). CROSS-EXPERIMENT CONCLUSIONS (load-bearing): (a) 4 prior-session FUTURE hypotheses NOW FALSIFIED: continuous-interp median (worse than discrete), bars_held harvest separator (rally holds long too), bars_held exit-emission floor (open-status is noise channel), symmetric breadth-reward (still loosens rally admission). (b) NEW WALL: integer bars_held is rally-safe for SIZE/rounding (deterministic given open) but NOT for any EXIT-EMISSION decision - the open-position-status at the gate bar is itself noise-dependent. (c) RECONFIRMED voter-saturation (exp3 de-sat=over-trade, exp5 amp=byte-identical bull/crash/sideways): those 3 regimes raw are NOT voter/admission-bound; fixed divisors + saturated confs are load-bearing. (d) rally RAW remains unmovable across ALL vehicles now spanning ~16 sessions: size(Sharpe-invariant), admission/breadth(loosening=noise), exit-timing/harvest/de_floor(price-boundary OR open-status noise), voter-transform(de-saturation), median-window(alpha-coupled). 26f4b23d is a CONFIRMED deep global optimum (1 move in ~12, rally stab seed-fragile at 0.809 knee). all 5 reverted via git checkout -- strategy.py, results.tsv append-only intact.
8c9dfee	0.4508	0.5903	0.2790	0.69	0.75	0.81	0.11	discard	ARCHITECTURAL remove multi-source agreement attenuator from exit MAX fusion (22 LOC removed). Composite -0.177 vs 26f4b23d 0.6277, mean -0.131 (0.7211->0.5903). ALL regimes down: bull 0.776->0.694 (-0.082), crash 0.759->0.746 (-0.013), sideways 0.930->0.809 (-0.121), rally 0.419->0.112 (-0.307). RALLY STAB COLLAPSED 0.809->0.573 (factor 1.0->0.244) — the agreement attenuator was LOAD-BEARING for rally exit stability. Without it, single-source pressure spikes in chop (common in rally's low-vol regime) fire at full MAX strength -> noise-driven position-value divergence. MAX alone is insufficient noise filter. Bull/sideways also down significantly (slope-against alone in chop fires harder). REVERTED.
dbead8e	0.5420	0.6639	0.2437	0.70	0.76	0.93	0.27	discard	ARCHITECTURAL remove portfolio-DD circuit breaker (_port_dd_atten=1.0 constant). Composite -0.086 vs 26f4b23d 0.6277, mean -0.057 (0.7211->0.6639). bull 0.776->0.697 (-0.079, raw 0.776->0.759 + stab 0.897->0.775), crash 0.759->0.759 FLAT, sideways 0.930 FLAT, rally 0.419->0.269 (-0.150, raw 0.418->0.410 + stab 0.809->0.696). LOAD-BEARING for bull/rally stability: the _port_dd_atten with sharp tanh/0.008 acts as a size-smoother at moderate DD levels, reducing position-size variance under AR(1) noise. Removing it lets full-size entries through during DD wobbles -> larger position-value dispersion. REVERTED.
68c936a	0.4842	0.6337	0.2991	0.71	0.76	0.93	0.14	discard	ARCHITECTURAL remove _churn_size_atten churn-gated first-bar size attenuator. Composite -0.144 vs 26f4b23d 0.6277, mean -0.087 (0.7211->0.6337). bull 0.776->0.710 (-0.066, stab 0.897->0.775), crash 0.759 FLAT, sideways 0.930 FLAT, rally 0.419->0.135 (-0.284, raw 0.418->0.425 + stab 0.809->0.595). LOAD-BEARING for rally/bull stability: _churn_size_atten attenuates first-bar entry size during bursty re-entry periods, reducing position-value variance under noise. Its integer churn gate len(_eh) is noise-immune in VALUE but the ATTENUATION ACTION it gates (shrinking burst entries) is the rally-stability mechanism. REVERTED.
f98612e	0.5785	0.6934	0.2299	0.77	0.76	0.93	0.31	discard	ARCHITECTURAL remove Kaufman ER deep-chop entry attenuation (-8 LOC). Composite -0.049 vs 26f4b23d 0.6277, mean -0.028 (0.7211->0.6934). bull 0.776->0.771 (-0.005, stab 0.897->0.798), crash 0.759 FLAT, sideways 0.930 FLAT, rally 0.419->0.313 (-0.106, raw 0.418->0.419 but stab 0.809->0.724). ER gate still LOAD-BEARING at this baseline maturity — 8 accumulated quality filters do NOT absorb its function. REVERTED.
3ac778e	0.4353	0.6164	0.3621	0.78	0.76	0.93	0.00	discard	ARCHITECTURAL remove dead-code exit pressure layer (_ep_pressure + _ar_pressure, MAX fusion 6->4 terms, -36 LOC). Composite -0.192 vs 26f4b23d 0.6277, mean -0.105 (0.7211->0.6164). bull 0.776->0.776 FLAT (stab 0.897->0.854, raw preserved), crash 0.759 FLAT, sideways 0.930 FLAT, rally 0.419->0.000 HARD-CUTOFF (stab 0.406<0.50 floor). _ar_pressure was NOT dead-code — removing it from the MAX fusion tuple structure changed the 2nd-highest ratio in the agreement attenuator, altering rally exit behavior. The 6-term tuple's size and composition are load-bearing for the agreement attenuator's ratio computation. REVERTED.
26f4b23d-session-summary	-	-	-	-	-	-	-	session-summary	session: 5 independent architectural discards (EXIT RULE triggered at 5 consecutive architectural), 0 branches opened (none branch-eligible - no regime improved in any experiment). Baseline 26f4b23d UNCHANGED 0.6277 [bull 0.776 sh1.54 stab0.897 f1.0, crash 0.759 sh1.29 stab0.974 f1.0, sideways 0.930 sh1.71 stab0.869 f1.0, rally 0.419 sh0.735 stab0.809 f1.0 = ALL factors 1.0; binding constraint rally RAW]. EXPERIMENTS: (1) remove multi-source agreement attenuator from exit MAX fusion (-22 LOC) -> rally stab 0.809->0.573 factor 0.244, all regimes down: LOAD-BEARING confirmation that single-source pressure spikes in chop need the agreement attenuator. (2) remove portfolio-DD circuit breaker _port_dd_atten=1.0 -> bull stab 0.897->0.775, rally stab 0.809->0.696: LOAD-BEARING for bull/rally stability even at DD<1.86pct. (3) remove _churn_size_atten from first-bar entry size chain -> rally stab 0.809->0.595, bull stab 0.897->0.775: LOAD-BEARING — churn-gated size attenuation is the rally-stability mechanism. (4) remove Kaufman ER deep-chop entry attenuation -> bull stab 0.897->0.798, rally stab 0.809->0.724: ER gate still LOAD-BEARING at this baseline, 8 accumulated quality filters do NOT absorb. (5) remove _ep_pressure + _ar_pressure from MAX fusion (6->4 terms) -> rally 0.000 hard-cutoff: _ar_pressure was NOT dead-code, the 6-term tuple composition is load-bearing for the agreement attenuator ratio computation. CROSS-EXPERIMENT CONCLUSIONS: (a) Every component removal regresses at least one regime — the strategy is at a confirmed deep global optimum where every subsystem is load-bearing. (b) Even components flagged as dead-code in prior sessions (_ar_pressure, _ep_pressure) are load-bearing through their presence in the MAX fusion tuple — the agreement attenuator's ratio computation depends on the full term count. (c) The rally stab 0.809 knee remains extremely fragile — any removal touching the exit path or entry size chain regresses it. (d) Simplification via removal is no longer viable at this architecture maturity. Future direction: subsystem REDESIGN (not removal) of the entry size chain or exit fusion might find a different local optimum, but component-level changes are exhausted. Baseline 26f4b23d 0.6277 UNCHANGED.
-	0.5888	0.7008	0.2240	0.78	0.77	0.93	0.33	discard	ARCHITECTURAL multi-day price-LEVEL (mid vs 96-bar HL2 mean, noise-immune) counter-trend ADMISSION tightening, both sides. composite 0.6277->0.5888 (-0.039). DECOMPOSITION: rally RAW byte-identical 0.4189 (gate doesnt change clean trades) but rally STAB 1.0->0.786 (admission-boundary noise from _md_bear_tighten = the documented admission wall). crash +0.0085 (0.759->0.767) from _md_bull_tighten blocking dead-cat longs, NO stab cost. bull/sideways flat. Bear-side and bull-side independent: bear-side=pure rally-stab cost, bull-side=clean crash gain. Next: isolate bull-side only.
-	0.4423	0.6201	0.3557	0.78	0.76	0.93	0.02	discard	ARCHITECTURAL bull-side-only multi-day LEVEL counter-trend admission tightening. composite 0.6277->0.4423 (-0.185 catastrophic). rally RAW byte-identical 0.4189 but rally STAB 1.0->0.036: in rally LONGS dominate, during consolidations price oscillates around 4-day mean so _md_level crosses zero -> AR(1) noise flips bull-admission boundary on the DOMINANT trades. crash NOT improved (0.759 baseline) - exp1 crash gain was NOT from bull-side. CONCLUSION: admission channel is fundamentally WALLED for any zero-crossing signal (slope OR level); fast-saturation cannot rescue admission (razor-thin steep region flips 0<->1 fully at crossing). Abandon admission channel.
-	0.3804	0.5428	0.3248	0.83	0.75	0.59	0.00	discard	ARCHITECTURAL deep multi-day-extension profit harvest (sample_factor lever: peel trend-aligned winners when |_md_level|>5pct). composite 0.6277->0.3804 (-0.247). bull RAW +0.052 (0.776->0.829 Sh1.54->1.60: selling over-extension genuinely helps bull Sharpe). crash -0.008 (trades 45->44, did NOT add trades). sideways COLLAPSED 0.930->0.592 (Sh1.71->1.00: sideways has frequent mild extensions, harvest over-fires cutting profit/trade). rally HARD-CUTOFF 0.000 (raw Sharpe ROSE 0.735->0.91 GENUINE but stab 0.809->0): rally longs DO reach >5pct above 4-day mean on strong legs -> harvest fires at the _md_extension>0.05 boundary -> AR(1) crosses it -> ensemble divergence. ASSUMPTION WRONG: deep-extension NOT rally-safe (rally grind reaches >5pct extension). Same exit-TIMING boundary wall as row 506. CONFIRM: any exit-fraction trigger with a price-derived threshold collapses rally stab.
-	0.5519	0.6797	0.2555	0.78	0.76	0.93	0.25	discard	ARCHITECTURAL anti-chase first-bar entry-size attenuator (shrink trend-aligned entries opened >4pct extended from 4-day mean, fast-sat tanh _md_level scale 0.015, first-bar-only proven-safe channel). composite 0.6277->0.5519 (-0.076). bull/crash/sideways BYTE-FLAT (their entries rarely reach >4pct above 4-day mean = attenuator inert there). rally raw ~flat 0.412 but stab 1.0->0.612: attenuator fires ONLY in rally and rally entries sit AT the 4-5pct extension ONSET (not deep in flat tail) where AR(1) still modulates the shrink. 4TH confirmation this session that ANY _md_level-gated mechanism firing in rally moves rally stab (admission/exit-frac/first-bar-size all walled). KEY: fast-saturation rally-safety requires rally to operate DEEP in tail; rally actually STRADDLES the extension onset. Not branch-worthy (no regime improved, rally regressed).
