commit	score	mean_score	std_score	bull_2021	crash_bear	sideways	rally_2024	status	description
-	-	-	-	-	-	-	-	session-summary	SESSION: 0 keeps + 5 architectural discards (EXIT RULE at 5 consecutive architectural). Baseline UNCHANGED cabfb6f1 0.850107 (bull 0.975603, crash 0.811799, sideways 1.054002, rally 0.717771). THEME: target the binding constraint rally (Sharpe 1.30 lowest, MaxDD 1.57pct highest, 98 trades 2x normal, 84.7pct WR lowest; raw_score==final 0.7178, stability 0.820 just above 0.80 floor, flip_count 0 - drag is genuinely low raw Sharpe, not penalties). 5 experiments across exit + entry-scale-in, all targeting rally. DISCARDS: (1) Exp1 slope-conf SUPPRESSION on take-profit harvest (-0.138): held bull trend winners through 2021 corrections -> bull Sh 1.86->1.30, stab 1.0->0.852, MaxDD 0.90->1.62. Harvest is load-bearing gain-locking in bull. (2) Exp2 loss-side ve TERM in MAX fusion (byte-identical INERT): slope-against already dominates MAX when both fire -> additive sub-dominant term cannot move max. (3) Exp3 vol-expansion AMPLIFICATION of _w_slope for losers (byte-identical INERT): for losing positions under severe vol expansion + slope-against, the STOP-LOSS (_sl_pressure) already dominates _soft_max -> amplifying slope weight (raises only _soft_max) cannot move max(_sl_pressure, _soft_max). (4) Exp4 MAE-cleanliness AMPLIFIER on de-risk cushion (-0.232): bigger cushion for clean-MAE winners destroyed bull stab 1.0->0.413 (below 0.50 rejection floor) - 2021 corrections preceded by clean-MAE/slope-confirming winners that reverse hard. (5) Exp5 BTC-leader-confirmation amplifier on win-accelerator (-0.001): faster alt scale-in when BTC confirms over-committed ETH/SOL longs into rally pullbacks -> rally -0.004 (MaxDD 1.57->1.61, Sh 1.30->1.29); bull/sideways sub-noise gains. CROSS-EXPERIMENT CONCLUSIONS: (a) EXIT SIDE FOR LOSERS IS SATURATED - losing positions exit via the stop or saturated slope-against on the same bar; no marginal weight amplification changes exit timing (Exp2+Exp3 inert). To move loser exits would require changing the STOP level itself (a different decision point), but rally MaxDD 1.57pct < stop ceiling 3.5pct so positions exit before the stop anyway - stop-tightening would not help rally. (b) ANY mechanism that widens the giveback cushion / suppresses gain-locking for clean/confirmed trend winners DESTROYS bull (Exp1 stab 0.852, Exp4 stab 0.413) - bull's 2021 corrections are preceded by clean-MAE, slope-confirming, small-MAE winners that then reverse hard. The cushion magnitude (DERISK_CONVEX_AMP=0.6) and the take-profit harvest are at their productive CEILING; bull's correction-protection need caps how much giveback-riding any winner can earn. Do NOT amplify the cushion or suppress the harvest. (c) The win-accelerator (scale-in pace) magnitude is at its productive ceiling - amplifying it (leader-confirmation) over-commits into pullbacks (rally MaxDD up). The prior-session keeps (adaptive floor + slope-conf gate) are the calibrated optimum. (d) rally's drag is genuinely low raw Sharpe (1.30) with the highest return (+3.9pct) - the issue is equity-curve VOL from 98-trade churn, NOT premature gain-locking (Exp1 harvest suppression did not help rally) and NOT over-cautious sizing. FUTURE: the exit and scale-in subsystems are saturated at this baseline. Productive new directions likely require a genuinely new DATA SOURCE at a genuinely new decision point (neither the exit soft-pressure MAX, the de-risk cushion, the take-profit harvest, nor the scale-in accelerator - all calibrated to ceiling). rally's 2x trade count (98 vs ~50) remains the unexplained structural anomaly - a churn-reduction mechanism at the ADMISSION gate (beyond the existing EMA readiness accumulator, which prior Exp3 found inert) targeting same-direction re-entry frequency without widening cushions or amplifying scale-in is the most promising unexplored axis, but prior churn-axis experiments (churn EMA, churn size_atten, churn_ct_atten) heavily explored. results.tsv append-only preserved (path-scoped git checkout -- strategy.py throughout); all 5 discards reverted to cabfb6f1. EXIT: 0 keeps, 5 architectural discards (satisfies exit rule), baseline cabfb6f1 0.850107 unchanged.
afd7041f	0.349960	0.390751	0.135971	0.437981	0.385320	0.558025	0.181677	discard	Exp1 (architectural, indep): TREND-ALIGNED WINNER emitted-level smoothing (target_ema extension beyond ct-only). CATASTROPHIC: composite 0.850107->0.349960 (-0.500), ALL regimes regressed. Trade counts TRIPLED (bull 52->150, crash 52->136, sideways 49->141, rally 98->155) -> the level-smoothing LAG made the emitted target trail the raw target, and each lagged-vs-raw delta became a fresh resize signal -> 3x churn -> fee drag + equity vol. Sharpe collapsed everywhere (bull 1.86->1.14, crash 1.26->0.82, sideways 2.02->1.11, rally 1.30->0.87). Stability dropped below 0.80 knee (bull 0.84->0.76, crash 0.97->0.75, rally 0.82->0.65) -> stability_factor <1 for 3 regimes. The deep-profit + slope-conf + trend-align gates did NOT prevent it (they gate WHEN smoothing fires, not the lag-induced churn it causes once active). HYPOTHESIS DISPROVEN: low-passing the emitted LEVEL of trend-aligned holds does NOT reduce equity vol -- it INCREASES churn because the smoothed target lags the raw resize target and every lag delta emits a resize. The ct-only target_ema works because ct holds are a small minority; extending to the majority trend-aligned holds polluted the whole position-value cascade. Reverted to cabfb6f1. CONCLUSION (correlation only): emitted-level temporal smoothing is counterproductive on trend-aligned (majority) holds -- the lag-churn cost dominates any vol-reduction benefit. Distinct from the ct-only keep (minority subset where the lag-churn is bounded).
6d1eb361	0.799936	0.854670	0.182444	0.975603	0.811799	1.054002	0.577275	discard	Exp2 (architectural, indep): CHURN-GATED readiness-accumulator THRESHOLD raise (admission churn filter, summary FUTURE guidance axis). Composite 0.850107->0.799936 (-0.050), mean 0.889794->0.854670 (-0.035), std UP 0.132290->0.182444. bull/crash/sideways BYTE-IDENTICAL (churn gate fires only during bursts = rally; calm regimes len<=1 -> gate 0 -> unchanged). ONLY rally changed: score 0.717771->0.577275, raw 0.717771->0.694783 (-0.023), Sharpe 1.300294->1.239735, stability 0.820383->0.749261 (BELOW 0.80 knee -> stability_factor 0.831), trades STAYED 98 (unchanged), WR 84.7pct unchanged, PF 8.5->7.5. KEY FINDING: the THRESH raise did NOT reduce trade count (98 unchanged) - it filtered nothing useful, instead SHIFTED entry timing (delayed some entries by a bar) which lowered raw AND damaged stability. The marginal re-entries it targeted were alpha. CONFIRMS the reversal-cooldown dead end inseparable-cost wall in softer form: rally 98-trade churn is necessary bidirectional alpha, and filtering re-entries (even softly via higher conviction bar) trades raw-vs-stability ~1:1 loss. The churn-axis at admission is confirmed SATURATED (this was the last unexplored churn-admission knob - THRESH vs prior inert RHO; both fail). Reverted to cabfb6f1. CONCLUSION: rally churn-reduction via admission filtering is a dead end (alpha re-entries); productive directions must NOT target rally trade COUNT.
210f5b33	0.849437	0.889298	0.132869	0.975473	0.811799	1.053996	0.715923	discard	Exp3 (architectural, indep): 50-bar path-linearity R^2 SUSTAINED-TREND entry-size BOOST (trend-persistence family, distinct from saturated participation-confirmation boosts and 16-bar _tq_atten R^2 shrink). Composite 0.850107->0.849437 (-0.000670), mean 0.889794->0.889298 (-0.000496), std 0.132290->0.132869 (+0.000579). MECHANISM ERROR (mis-targeted): crash (the intended target, 100pct WR +3.2pct return return-limited 0.65pct MaxDD headroom) was BYTE-IDENTICAL (Sharpe 1.263849, MaxDD 0.648860 exact) - the boost NEVER FIRED for crash because a crash is a JAGGED descent (sharp drops + dead-cat bounces) -> LOW 50-bar linear-fit R^2, below the 0.50 activation gate. R^2 measures LINEARITY not trend strength. rally (grinding LINEAR uptrend) has HIGH 50-bar R^2 -> boost FIRED for rally (the binding MaxDD-sensitive constraint) -> bigger rally longs -> pullback losses bigger -> rally MaxDD 1.5716->1.6351, Sharpe 1.300294->1.296557, score 0.717771->0.715923 (-0.001848). bull -0.000130 (Sharpe 1.863940->1.863538), sideways -0.000006 (negligible). Safe-envelope (trend_w x ER x ret_vlong-confirm x slope-conf) did NOT separate crash from rally because both are sustained trends passing all gates - the only difference (jagged vs linear) is exactly what R^2 measures, and it points the WRONG way (boosts the linear grind rally, not the jagged crash). CONFIRMS rally is extremely size-UP sensitive (any boost to rally longs raises MaxDD and lowers Sharpe - consistent with summary warning that rally DD is the binding low-score driver). No regime improved -> not branch-eligible. Reverted to cabfb6f1. CONCLUSION: path-linearity R^2 is the wrong signal for crash (jagged descent); and sizing UP rally longs is uniformly harmful. Productive crash-targeting needs a signal that fires for JAGGED high-vol bear trends, not linear grinds.
cabfb6f1	0.605307	0.633748	0.094802	0.70	0.58	0.75	0.51	keep	RE-BASELINE under v2 scoring (return_reward added with APY annualization). strategy.py UNCHANGED at cabfb6f1 (byte-identical). Old v1 composite 0.850107 -> new v2 0.605307 (ratio 0.712, from return_reward ~0.71 uniform scaling). return_reward = log(1+max(APY,0)/100+1) where APY=(1+total_return)^(8760/hours)-1; regime windows differ in length (bull 273d, crash 426d, sideways 365d, rally 366d) so raw total_return was not comparable. Per-regime: bull 0.699 Sh1.864, crash 0.575 Sh1.264, sideways 0.749 Sh2.025, rally 0.511 Sh1.300. All stab 1.0. rally remains binding (lowest 0.511).
cabfb6f1	0.605307	0.633748	0.094802	0.70	0.58	0.75	0.51	session-summary	SCORING REFACTOR v2 (not agent session). NEW BASELINE cabfb6f1 0.605307. Two changes vs v1: (1) return_reward = log(1+max(APY,0)/100+1) added to compute_score — without it, score rewarded DD/Sharpe but not return; verified 3x-DD+3x-return simulation flips winner under v2. Uses APY not raw total_return (regime windows differ in length). (2) keep threshold restored to +0.003 absolute (was 'any positive delta' which let ~27 sub-noise keeps through). dd_gate params unchanged (real DD 0.45-1.70% is far below 5% soft-exp knee). strategy.py byte-identical to cabfb6f1. pytest 21 passed.
cabfb6f1	0.605307	0.633748	0.094802	0.70	0.58	0.75	0.51	session-summary	SCORING v2.1: dd_gate soft_start 5->8, scale 10->2 (8%后惩罚加重). strategy.py UNCHANGED at cabfb6f1. Composite 0.605307 unchanged from v2 (real DD 0.45-1.70% is far below 8%, so dd_gate change has zero effect on current baseline — it opens up the 5-8% range for future return-seeking experiments). Hard cutoff 10% unchanged. pytest 21 passed.
6aa58a01	0.602201	0.630969	0.095894	0.692955	0.575486	0.749867	0.505570	discard	Exp1 (architectural, indep): knee-aligned _port_dd_atten deadzone (v2.1 return-seeking). Redesigned _port_dd_atten: added 2pct deadzone (PORT_DD_DEADZONE) + 0.025 knee-aligned ramp (PORT_DD_SCALE), replacing scale-0.008 no-deadzone form calibrated for old 5pct knee. Hypothesis: under v2.1 (return_reward + 8pct dd_gate knee), the old form over-shrunk entries during normal intra-regime drawdowns (real MaxDD 0.55-1.57pct is 5-15x below knee); un-shrinking would raise APY/return_reward with Sharpe scale-invariant. MEASURED vs cabfb6f1 0.605307: composite -0.003106, mean -0.002779, std +0.001092. PER-REGIME: bull 0.699048->0.692955 (-0.006093, Sh 1.864->1.84, AnnRet 4.7->4.6), crash 0.575486 unchanged (Sh 1.26), sideways 0.749111->0.749867 (+0.000756), rally 0.511346->0.505570 (-0.005776, Sh 1.30->1.28, AnnRet 3.9->3.8). MaxDD barely moved (0.90/0.65/0.55/1.57->0.90/0.65/0.55/1.66) and AnnReturn barely moved (4.7/3.2/3.5/3.9->4.6/3.2/3.6/3.8). CONCLUSION (correlation only): _port_dd_atten was NOT the return bottleneck — realized sizes barely changed, so most entries fire near peak equity where atten was already 1.0; the deadzone touched few entries, and those few (taken during DD) were slightly net-negative (Sharpe dropped). The low AnnReturn (~3-5pct) is structural to edge frequency, not to this sizing multiplier, so return_reward cannot be easily moved by un-shrinking _port_dd_atten. All stab 1.0, all MaxDD<10pct. Discard (composite <baseline, mean <baseline).
77a606a1	0.579931	0.616733	0.122674	0.684062	0.582710	0.764321	0.435839	branch	BRANCH OPEN (portfolio-DD-headroom size boost, v2.1 return-seeking). Exp2 (architectural, indep): NEW data dep _port_dd_headroom = unused fraction of the 8pct dd_gate knee (1 at peak equity, 0 at 8pct DD); boost = 1+0.8*headroom applied to the DOMINANT size base (entry target + cached-through-scale-in full_target). Strategy was under-leveraged (Sharpe 1.3 but 4pct return, MaxDD 0.55-1.57pct = 5-15x below knee). MEASURED vs cabfb6f1 0.605307: composite -0.025376 BUT raw_composite +0.001179 (0.606486) -- mechanism works pre-stability. AnnReturn ~doubled (4.7/3.2/3.5/3.9 -> 8.4/5.7/6.3/6.2). PER-REGIME: crash 0.575486->0.582710 (+0.007224, Sh 1.26 held, AnnRet 3.2->5.7, DD 0.65->1.15), sideways 0.749111->0.764321 (+0.015210, Sh 2.02->2.01, AnnRet 3.5->6.3, DD 0.55->1.00), bull 0.699048->0.684062 (-0.014986, Sh 1.864->1.84, AnnRet 4.7->8.4, DD 0.90->1.55), rally 0.511346->0.435839 (-0.075507, raw 0.511346->0.510739 ~flat Sh 1.30->1.29, AnnRet 3.9->6.2, DD 1.57->2.75, STABILITY_FACTOR 1.0->0.853 = stability 0.756 below 0.80 knee -> penalty crushed raw gain). BRANCH-ELIGIBLE: raw_composite up + crash/sideways improved + new mechanism. Diagnosis (correlation only): uniform boost over-sizes rally's high-churn (98 trades) noise-driving positions -> bigger equity-curve tracking error -> stability penalty; crash/sideways (52/49 trades, lower churn) scaled cleanly (Sh held, return up). NEXT: gate the boost on the noise-immune low-churn partition (len(_eh), the validated safe family) -- full boost for sparse-entry regimes (crash/sideways/bull), reduced/no boost for rally bursts -> capture crash/sideways return gains while sparing rally stability. All MaxDD<10pct (max 2.75pct), all stab>=0.756, all flip_streak 1.0.
3156e180	0.603398	0.632244	0.096154	0.673670	0.582710	0.764321	0.508275	branch	branch step2: churn-gate the headroom boost (len(_eh), spare rally bursts). MEASURED vs step1 0.579931 (raw 0.606486): composite -0.025376 -> -0.001909 vs baseline (BIG recovery); raw_composite 0.606486 -> 0.603398 (raw DROPPED -0.003 vs step1 because churn gate reduced rally boost, but rally raw was ~flat anyway). PER-REGIME: rally stability_factor 0.853 -> 1.0 (RECOVERED, min_stability 0.756 -> 0.804, back above knee) -- churn gate worked; rally 0.435839->0.508275 (-0.003071 vs baseline, Sh 1.30->1.29, AnnRet 3.9->5.4, DD 1.57->2.61). crash +0.007224 (held), sideways +0.015210 (held) -- gains PRESERVED. NEW PROBLEM: bull 0.699048->0.673670 (-0.025378, Sh 1.864->1.81, AnnRet 4.7->7.6, DD 0.90->1.31) -- bull is ALSO low-churn (len<=1) so gets FULL boost, but bull's high Sharpe + 2021 sharp corrections mean bigger positions drop Sharpe (-0.019 signal_quality) more than return_reward gains (+0.014). Diagnosis (correlation only): boost trades Sharpe for return; crash/sideways (clean trends, Sh held) gain but bull-2021 (choppy w/ corrections, Sh dropped) loses. NEXT: gate boost on path-cleanliness (_er efficiency ratio -- crash/sideways directional, bull-2021 choppy) + reduce magnitude 0.8->0.5 so clean-trend regimes keep the return boost while choppy bull is spared. All stab 1.0, all MaxDD<10pct (max 2.61pct).
29a4e67d	0.605125	0.632954	0.092764	0.696651	0.580508	0.744694	0.509962	branch	branch step4: revert _er gate, churn-gate-only + magnitude 0.4. MEASURED vs step3 0.592484: composite +0.012641 (recovered); vs baseline 0.605307: -0.000182 (FLAT, not a keep). raw_composite 0.605125 (all stab 1.0, min_stability 0.835). PER-REGIME: crash 0.575486->0.580508 (+0.005022, Sh 1.26->1.27, AnnRet 3.2->4.5, DD 0.65->0.90 -- the one consistent gainer, return-limited 100pct WR), bull 0.699048->0.696651 (-0.002397, Sh 1.864->1.83, AnnRet 4.7->6.1, DD 0.90->1.11), sideways 0.749111->0.744694 (-0.004417, Sh 2.02 held, AnnRet 3.5->4.9, DD 0.55->0.77), rally 0.511346->0.509962 (-0.001384, Sh 1.30 held, AnnRet 3.9->4.7, DD 1.57->2.12). CONCLUSION: branch is NET-FLAT-TO-NEGATIVE across all magnitudes (0.8->0.4). crash gain (+0.005) < bull+sideways+rally losses. Root cause (measured): return_reward = log(2+APY/100) ~0.71 is near-constant at this strategy's low APY (~4pct) -- too weak a lever to overcome the Sharpe cost of bigger positions in volatile regimes (bull/rally Sharpe drops under size scaling). Score remains Sharpe-dominated under v2.1. Branch best raw was step1 0.606 (+0.001) but that collapsed rally stability; no step reached +0.003 keep. Branch TERMINATED -- reverting.
3fefab73	0.605307	0.633748	0.094802	0.699048	0.575486	0.749111	0.511346	discard	BRANCH REVERTED (portfolio-DD-headroom size boost, v2.1 return-seeking). 4-step branch (step1 open raw 0.606 +0.001 but rally stability collapsed 0.853; step2 churn-gate fixed stability raw 0.603 but bull over-boost -0.025; step3 _er path-cleanliness gate + mag 0.5 REGRESSED raw 0.592 -- _er was wrong discriminator, suppressed sideways grind + rally; step4 revert _er gate + mag 0.4 = FLAT raw 0.605 -0.0002, crash +0.005 the only gainer). CONCLUSION: under v2.1 scoring return_reward = log(2+APY/100) is ~0.71 near-constant at this strategy's low APY (~4pct) -- the return-seeking size-boost lever is TOO WEAK to overcome the Sharpe cost of bigger positions in volatile regimes (bull/rally Sharpe drops under size scaling; only crash -- return-limited 100pct WR -- gains). Score remains Sharpe-dominated under v2.1. CROSS-EXPERIMENT LESSON: do NOT pursue return-seeking sizing under v2.1 until APY is structurally higher (return_reward only differentiates meaningfully above ~15pct APY where log(2+0.15)=0.78 vs 0.71). The DD-headroom (0.55-1.57pct vs 8pct knee) cannot be monetized via size because Sharpe is scale-invariant-and-fragile (drops under non-uniform grid/deadband/fee interactions) while return_reward moves sub-linearly. Baseline cabfb6f1 0.605307 UNCHANGED. strategy.py reverted to cabfb6f1 (byte-identical).
3fefab73	0.605307	0.633748	0.094802	0.699048	0.575486	0.749111	0.511346	session-summary	SESSION: 0 keeps + 2 architectural discards (Exp1 _port_dd_atten deadzone, branch portfolio-DD-headroom size boost) + 4-step exploration branch (reverted). Baseline cabfb6f1 0.605307 UNCHANGED [bull 0.699048, crash 0.575486, sideways 0.749111, rally 0.511346; all stab 1.0, all flip_streak 1.0, all MaxDD<10pct (0.90/0.65/0.55/1.57)]. FIRST SESSION UNDER v2.1 SCORING (return_reward + 8pct dd_gate knee, refactored 2026-06-20, no prior session had run under it). THEME: test whether the new return_reward + DD-headroom opens a return-seeking sizing lever. FINDING (negative, measured): NO -- return_reward = log(2+APY/100) ~0.71 is near-constant at this strategy's low APY (~3-5pct per regime: bull 4.7, crash 3.2, sideways 3.5, rally 3.9). Even doubling size (Exp2/step1, AnnReturn ~doubled to 6-8pct) only moves return_reward 0.71->0.73 (+2.8pct), which does NOT overcome the Sharpe cost of bigger positions (bull Sharpe 1.864->1.81, rally stability 1.0->0.853 under uniform boost). crash (return-limited, 100pct WR) is the one regime that gains (+0.005-0.007) but bull+sideways+rally losses dominate. CROSS-EXPERIMENT CONCLUSION: the v2.1 return_reward lever is structurally too weak at this strategy's operating point to drive keeps via sizing; score remains Sharpe-dominated. return_reward only differentiates meaningfully above ~15pct APY. The 5-15x DD headroom (real DD 0.55-1.57pct vs 8pct knee) cannot be monetized through position-size scaling because (a) Sharpe is scale-invariant in theory but drops in practice under non-uniform grid-quantization/deadband/fee interactions, and (b) return_reward moves sub-linearly (log). Do NOT re-attempt return-seeking sizing until APY is structurally higher (more frequent/larger edges, not bigger size on the current edges). Future sessions: the binding levers remain rally Sharpe (1.30, lowest) and crash Sharpe (1.26) -- Sharpe-improvement, not return-seeking, is the path under v2.1.
