commit	score	mean_score	std_score	bull_2021	crash_bear	sideways	rally_2024	status	description
-	-	-	-	-	-	-	-	session-summary	SESSION (baseline 637f5e53 0.779314 -> NEW BASELINE b902da2f 0.783185, +0.003871 KEEP): 7 experiments (1 keep Exp3 + 6 discards Exp1a/1b/2/4/5/6/7), no exploration branch (Exp3 was a direct keep; branch not needed). EXIT RULE: 5 architectural discards met (Exp1a entry-split, Exp1b exit-split, Exp2 BTC-ve exit, Exp6 giveback-widening, Exp7 commit-frac; plus 2 param discards Exp4/Exp5); 4 consecutive discards since the keep (Exp4/5/6/7); exited on saturation of the leverage-coupling direction (the only productive axis). Baseline b902da2f re-verified reproduces 0.783185 byte-identical post-revert [bull 0.940387 Sh1.93 DD3.21pct, crash 0.731303 Sh1.274 DD2.46pct, sideways 0.996184 Sh2.01 DD2.21pct 48t sample_factor 0.980, rally 0.640302 Sh1.47 DD5.19pct; all stab 1.0, all raw==score, min_stab 0.811]. HEADLINE: under v2.2 calmar scoring the LEVERAGE_K=5 level (set under old v2.1 absolute-APY return_reward) is NO LONGER OPTIMAL -- 5->4 gives a real dd_gate gain (rally DD 6.36->5.19, bull 3.71->3.21, crash 3.04->2.46). The prior blocker (sideways 52->48 trades, sample_factor 1.0->0.980, -2pct) was UNBLOCKED not by recovering sideways trades (Exp1 emission-threshold split: entry-only BYTE-IDENTICAL, exit-side CATASTROPHIC crash 52->165 trades DD8.89pct -- the 4 lost sideways exits are $-indistinguishable from crash noise micro-exits, unrecoverable) but by a LEVERAGE-COUPLED sideways_boost (SIDEWAYS_BOOST_MAX 0.50 -> 0.65 at LEVERAGE_K=4 via +0.15/unit leverage headroom) whose gain localized to RALLY pullback entries (+0.0055 vs plain 4x) -- the low-trend boost fires in rally pullback stretches (rsi_trend_str dips), bigger pullback entries captured more rally alpha, offsetting the sideways sample_factor penalty. sideways itself was byte-identical to plain 4x (grid/sample_factor-bound, not boost-bound). NEW STRUCTURAL RELATIONSHIP: DD-headroom return-seeking -- at lower leverage, sizing magnitudes scale up to exploit the dd_gate headroom below the 8pct knee. CROSS-EXPERIMENT CONCLUSIONS (all measured this session, verifiable): (1) the DD-headroom return-seeking axis is ENTRY-SIZE-ONLY and SPECIFIC to the low-TREND (pullback) boost: Exp3 sideways_boost coupling KEEP (+0.0039); Exp4 calm_boost coupling (vol-axis, rally grind) DISCARD (over-boosts grind, -0.0007); Exp5 push to +0.20/unit DISCARD (0.65 is the optimum, -0.0013); Exp6 giveback WIDENING (exit-side) CATASTROPHIC (bull stability 1.0->0.55, DD3.21->6.62 BREACHED 50pct gate -- exit giveback is stability-sensitive, confirms run-up-velocity catastrophic finding extends to static widening); Exp7 initial-commit-frac coupling DISCARD (scale-in pace was optimal, -0.0027). The return-seeking lever works on entry SIZE (grid-absorbed/safe) NOT on exit TIMING (stability-sensitive). (2) the leverage-reduction unblock via emission-threshold split is a DEAD END: entry-only split inert (byte-identical to plain 4x), exit-split catastrophic (churns crash 52->165). The 4 lost sideways exits at 4x are $-indistinguishable from crash noise micro-exits. (3) cross-symbol EXIT coordination (Exp2 BTC vol-expansion -> alt exit) is a DEAD END: fires on bull-2021 correction noise (destabilizes bull, Sh1.936->1.472, BREACHES 50pct gate) while inert on rally (the target -- rally is low-vol grind so BTC vol-expansion rarely exceeds 1.5x; rally exits are giveback/DD-gated not vol-expansion-gated). Reconfirms ANY rally exit-timing change is inert (giveback-dominated) and ANY exit-timing change touching bull destabilizes it. The binding rally (0.640, DD5.19pct now with headroom) and crash (0.731, return-limited, bounce-LONG, exit-inert) remain; rally DD headroom opened by 4x is partially exploited (Exp3) but the entry-size axis saturates at +0.15/unit. results.tsv append-only preserved (path-scoped git checkout -- strategy.py throughout, never git revert); strategy.py matches b902da2f byte-identical (0 diff verified). NEW BASELINE 0.783185 for future sessions.
06d27f42	0.783074	0.826878	0.146014	0.940289	0.731303	0.995619	0.640302	discard	Exp1 (architectural, indep): GATE the vol-hold extension (+12pct high-vol max_hold) on profit+trend-align+slope-conf. Was unconditional -- lengthened losing/ct high-vol positions (bigger losses). Gate so only winning trend-aligned slope-confirmed positions ride the larger real-move (crash return-limited Sh1.274 DD2.46pct headroom); losers/ct revert to base hold (faster exit, smaller losses); slope-conf protects bull corrections. MEASURED vs b902da2f 0.783185: composite -0.000111 (0.783074 sub-noise), mean -0.000166 (0.826878). PER-REGIME all stab 1.0 all raw==score: bull 0.940387->0.940289 (-0.000098 Sh1.93->1.927), crash BYTE-IDENTICAL 0.731303 (Sh1.274->1.273 -- crash positions already all winning+trend-align+slope-conf so gate=1.0 for all crash trades -> no change), sideways 0.996184->0.995619 (-0.000565 Sh2.01->2.005), rally BYTE-IDENTICAL 0.640302 (low-vol -> _vol_hold_ext~0 -> gate inert). CONCLUSION: the mechanism was wrong -- the unconditional extension was NOT hurting losers in a gating-fixable way; gating only REMOVED beneficial extensions from sideways/bull losing/slope-weak positions (faster base-hold exit -> smaller wins/worse timing). Crash/rally (the targets) byte-identical. Not branch-eligible (no regime improved). Reverted to b902da2f. Architectural discard #1.
7f6019ee	0.780515	0.822973	0.141525	0.941243	0.731303	0.979043	0.640302	discard	Exp2 (architectural, indep): EXTRA +8pct high-vol hold extension for confirmed trend winners (profit+trend-align+slope-conf gated), ADDED on top of the base 12pct (base preserved for all to avoid Exp1 removal failure). Hypothesis: crash return-limited (Sh1.274 100pct WR high-vol) -> let confirmed high-vol trend winners run longer -> bigger wins. MEASURED vs b902da2f 0.783185: composite -0.002670 (0.780515), mean -0.004071 (0.822973), std -0.004671 tighter (0.141525). PER-REGIME all stab 1.0 all raw==score: bull 0.940387->0.941243 (+0.000856 Sh1.93->1.929), crash BYTE-IDENTICAL 0.731303 (Sh1.273 -- extra hold did NOT change crash: crash exits are giveback-dominated NOT time-gated, extends exit-timing inertness wall to crash), sideways 0.996184->0.979043 (-0.017141 Sh2.01->1.986 -- extra hold fired on sideways winning trend-aligned stretches during higher-vol mini-trends -> mean-reversion hurt), rally BYTE-IDENTICAL 0.640302 (low-vol). KEY FINDING: crash return-limitation is NOT from time-pressure cutting winners early (byte-identical under +8pct hold extension) -- the time-pressure subsystem is dead for crash AND rally (both giveback-dominated exits). Not branch-eligible: target inert (hypothesis refuted); fixing sideways only recovers to ~baseline (bull +0.0009 sub-noise), no path to keep. Reverted to b902da2f. Architectural discard #2.
181be965	0.774580	0.816853	0.140911	0.903284	0.731303	0.996184	0.636644	discard	Exp3 (architectural, indep): VOLUME-WEIGHTED exit-slope blend (50/50 with unweighted mean of 12/16/22-bar OLS log-HL2). NEW data dep: volume is NOISE-IMMUNE in AR(1) test (only prices perturbed) so volume-weighted OLS uses noise-immune weights (safe family). Hypothesis: high-volume bars carry more conviction -> more robust trend signal for slope-against exit pressure + de-risk cushion -> fewer false slope-reversal exits on winners, sharper loser cuts -> higher Sharpe. MEASURED vs b902da2f 0.783185: composite -0.008605 (0.774580), mean -0.010191 (0.816853), std -0.005285 tighter (0.140911). PER-REGIME all stab 1.0 all raw==score: bull 0.940387->0.903284 (-0.037103 BIG, Sh1.93->1.847 -- volume-weighting emphasized high-vol up-bars in bull-2021 -> slope stayed positive longer through corrections -> delayed reversal detection / de-risk -> bigger giveback), crash BYTE-IDENTICAL 0.731303 (Sh1.273 -- exit-slope not crash bottleneck, giveback-dominated), sideways BYTE-IDENTICAL 0.996184 (Sh2.01->2.006 -- low volume variance, weighting barely changes slope), rally 0.640302->0.636644 (-0.003658 Sh1.471->1.461 -- slope-conf gates perturbed). KEY FINDING: the unweighted exit slope is LOAD-BEARING; volume-weighting it hurts bull (delays correction-reversal detection). crash/sideways byte-identical reconfirms exit-slope is not the bottleneck for giveback-dominated regimes. Not branch-eligible (no regime improved). Reverted to b902da2f. Architectural discard #3.
-	-	-	-	-	-	-	-	session-summary	SESSION (baseline b902da2f 0.783185 -> UNCHANGED, no keep): 3 independent architectural experiments (Exp1-3, ALL discards), no exploration branch opened (none branch-worthy -- Exp1/Exp3 no regime improved; Exp2 had bull +0.0009 but target crash byte-IDENTICAL so hypothesis refuted, no path to keep). EXIT RULE: 2-architectural-discard minimum MET (3 attempted); exited on idea exhaustion (strategy at confirmed deep local optimum, ~27 prior arch discards across sessions; every direction this session reconfirmed a wall). Baseline b902da2f re-verified reproduces 0.783185 byte-identical at session end [bull 0.940387 Sh1.93 DD3.21pct, crash 0.731303 Sh1.274 DD2.46pct 100pct WR, sideways 0.996184 Sh2.01 DD2.21pct 48t sample_factor 0.980, rally 0.640302 Sh1.47 DD5.19pct 100t 85pct WR; all stab 1.0, all raw==score, min_stab 0.811]. KEY: at this baseline ALL stability factors are 1.0 and raw==score, so stability levers are TAPPED OUT -- only raw signal-quality (Sharpe/DD/calmar) improvements can help. THEME: probed the TIME-PRESSURE (exit-timing) subsystem and the exit SLOPE. CROSS-EXPERIMENT CONCLUSIONS (all measured this session, verifiable): (1) EXIT-TIMING (max_hold / vol-hold extension) is INERT on BOTH crash AND rally: Exp1 (gated vol-hold) crash/rally BYTE-IDENTICAL; Exp2 (extra +8pct hold for confirmed trend winners) crash BYTE-IDENTICAL (Sh1.273 unchanged under +8pct hold extension). crash and rally exits are GIVEBACK-DOMINATED (pp/giveback/slope), NOT time-gated -- the time-pressure subsystem is DEAD for the two low-Sharpe regimes. The documented rally exit-timing inertness wall now extends to crash. (2) Exp2 sideways -0.017: a high-vol hold extension fired on sideways winning trend-aligned mini-trend stretches -> mean-reversion hurt (sideways winners must be harvested, not extended); confirms ANY hold extension touching sideways is damaging. (3) Exp3 VOLUME-WEIGHTED exit-slope blend (50/50): bull -0.037 (Sh1.93->1.847), rally -0.0037, crash/sideways BYTE-IDENTICAL. The UNWEIGHTED exit slope is LOAD-BEARING; volume-weighting (noise-immune weights, safe family) emphasized high-vol up-bars in bull-2021 -> slope stayed positive longer through corrections -> delayed reversal detection / de-risk -> bigger giveback. crash/sideways byte-identical reconfirms exit-slope is NOT the bottleneck for giveback-dominated regimes. REMAINING UNCONQUERED: rally (0.640, DD5.19pct, exit-timing inert, entry-size/ct-shrink/admission all saturated) and crash (0.731, return-limited Sh1.274, 100pct WR, exit-timing inert, giveback maxed, sample_factor already 1.0 at 52 trades). Both regimes' exit paths are giveback-dominated and maxed (PORT_DD_GIVEBACK_TIGHTEN 0.50, PORT_DD_TP_HARVEST_RELAX 0.60); entry-size axis saturated at +0.15/unit; ct admission tightening walled (stability collapse at ret_vlong=0 boundary); boost removal/capping walled (rally stability drops below 0.80 knee / costs raw faster than DD-relief). Structural-exploration NOT attempted: no coherent subsystem-rewrite hypothesis with a plausible path (all core mechanisms converted+tuned by prior sessions; giveback/exit rewrite risks the documented catastrophic bull destabilization). results.tsv append-only preserved (path-scoped git checkout -- strategy.py throughout, never git revert); all 3 discards reverted to b902da2f; strategy.py matches b902da2f byte-identical (0 diff verified).
0a999dc6	0.782297	0.826403	0.147017	0.940387	0.731303	0.996184	0.637737	discard	Exp1 (architectural, indep): COUNTER-TREND peak-profit ACTIVATION floor reduction (CT_PP_MIN_REDUCE=0.55, lowers _pp_min for ct positions via fast-sat /0.01 ret_vlong gate). Builds on prior 04df4b0d finding (ct giveback-TOLERANCE tightening was BYTE-IDENTICAL inert because ct peaks < _pp_min -> pp_pressure never activates). This lowers the upstream ACTIVATION floor so the giveback trail engages small ct peaks -> harvest above breakeven -> break rally loss streak. MEASURED vs b902da2f 0.783185: composite -0.000888 (0.782297), mean -0.000641 (0.826403), std +0.000821. PER-REGIME all stab 1.0 all raw==score: bull/crash/sideways BYTE-IDENTICAL (ct-gate spared trend-aligned/chop correctly); rally 0.640302->0.637737 (-0.002565, Sh1.4709->1.4689, AnnRet17.7->17.4pct, DD5.19 UNCHANGED, streak_gate STILL 1.0 -> streak did NOT break). CONCLUSION: lower _pp_min harvested ct WINNERS earlier (cutting rally return/Sharpe) WITHOUT converting ct LOSERS to wins -- the losing ct shorts peak below even the 0.45x lowered floor (0.95pct) so never engage the giveback trail -> ride to stop as losses. The ct-loser peak magnitude is the wall: a giveback-trail mechanism (harvest-on-giveback) cannot convert a ct position whose peak is too small to activate. Not branch-eligible (no regime improved; streak mechanism refuted, no path to keep -- pushing CT_PP_MIN_REDUCE deeper would only cut more ct winners short without breaking the streak). Reverted to b902da2f. Architectural discard #1.
a9828e80	0.777667	0.822656	0.149964	0.934783	0.731303	0.997774	0.626765	discard	Exp2 (architectural, indep): TREND-ALIGNED entry sparing of portfolio-DD circuit breaker (_port_dd_atten). Gate the DD entry-size shrink to ct entries only (spare trend-aligned, fast-sat /0.01 ret_vlong gate); activation point unchanged (unlike fcae6004). Hypothesis: crash is deep DD -> trend-aligned shorts shrunk throughout -> return-limited; sparing them -> full size -> higher crash return. MEASURED vs b902da2f 0.783185: composite -0.005518 (0.777667), mean -0.004388 (0.822656), std +0.003768. PER-REGIME all stab 1.0 all raw==score: crash BYTE-IDENTICAL 0.731303 (Sh1.273 -- crash entries were NOT size-shrunk by _port_dd_atten in the first place, crash portfolio DD fraction below the 0.032 activation threshold -> hypothesis REFUTED, crash return limit is NOT entry-size); rally 0.640302->0.626765 (-0.013537 Sh1.4709->1.4462 DD5.19->5.37pct -- sizing up trend-aligned rally longs makes the 15pct losers bigger); bull 0.940387->0.934783 (-0.005604 Sh1.927->1.921); sideways 0.996184->0.997774 (+0.001590 Sh2.006->2.009). KEY FINDING: crash is NOT _port_dd_atten-size-shrunk (byte-identical) -> crash return limit is small move size + early harvest, NOT entry size. Confirms fcae6004-style _port_dd_atten sensitivity extends to magnitude-gating (sizing up trend-aligned entries in DD hurts rally/bull). Not branch-eligible (target crash byte-IDENTICAL=inert, rally regressed, no path to keep). Reverted to b902da2f. Architectural discard #2.
4314b2ef	0.783077	0.826936	0.146199	0.940354	0.731303	0.995989	0.640100	discard	Exp3 (architectural, SIMPLIFICATION): REMOVE the two double-cross volume-boost entry cells (Exp8 _btcvol_partner_boost = BTC-vol x partner-price, Exp9 _partnervol_btc_boost = partner-vol x BTC-price) -- the MIXED cells of the {own,BTC,partner}x{vol,price} grid, flagged at creation as possibly redundant with the single-cross cells (own-vol x partner-price / own-vol x BTC-price) which already multiply. -2 entry-target multipliers, -16 LOC. MEASURED vs b902da2f 0.783185: composite -0.000108 SUB-NOISE (0.783077), mean -0.000108 (0.826936), std +0.000003. PER-REGIME all stab 1.0 all raw==score: crash BYTE-IDENTICAL 0.731303 (boosts only fire on ALT entries with partner present; BTC self-referential crash unreached); bull 0.940387->0.940354 (-0.000033 Sh1.9270->1.9272); sideways 0.996184->0.995989 (-0.000195 Sh2.006->2.007); rally 0.640302->0.640100 (-0.000202 Sh1.4709->1.4683). CONCLUSION: the double-cross boosts are NOT dead code -- each contributes ~0.0001 marginal alpha (below the +0.003 keep threshold but nonzero). Confirms the tight local optimum: even redundant-looking +5pct boosts with deep-saturated near-constant gates are microscopically load-bearing. Simplification does not hold score (very slightly lowers it). Not branch-eligible (no regime improved). Reverted to b902da2f. Architectural discard #3.
-	-	-	-	-	-	-	-	session-summary	SESSION (baseline b902da2f 0.783185 -> UNCHANGED, no keep): 3 independent architectural experiments (Exp1-3, ALL discards), no exploration branch opened (none branch-worthy -- Exp1 target rally regressed with streak mechanism REFUTED, no path; Exp2 target crash BYTE-IDENTICAL=inert, hypothesis refuted, no path; Exp3 simplification sub-noise negative, no regime improved). EXIT RULE: 2-architectural-discard minimum MET (3 attempted); exited on idea exhaustion (strategy at confirmed deep local optimum; every direction this session reconfirmed a wall -- ct exit subsystem fully saturated, crash return-limit identified as structurally non-addressable). Baseline b902da2f re-verified reproduces 0.783185 byte-identical at session start AND end [bull 0.940387 Sh1.927 DD3.21pct, crash 0.731303 Sh1.274 DD2.46pct 100pct WR, sideways 0.996184 Sh2.01 DD2.21pct 48t sample_factor 0.980, rally 0.640302 Sh1.471 DD5.19pct 100t 85pct WR; all stab 1.0, all raw==score, min_stab 0.811]. CROSS-EXPERIMENT CONCLUSIONS (all measured this session, verifiable): (1) Exp1 (ct peak-profit ACTIVATION floor reduction, CT_PP_MIN_REDUCE=0.55): builds on prior 04df4b0d finding that ct giveback-TOLERANCE tightening is byte-identical inert (ct peaks < _pp_min -> pp_pressure never activates). This lowered the upstream ACTIVATION floor instead (the untried lever 04df4b0d pointed at). MEASURED: composite -0.0009, rally -0.0026 (Sh1.471->1.469, streak_gate STILL 1.0 -> streak did NOT break), bull/crash/sideways byte-identical. CONCLUSION: the losing ct shorts peak BELOW EVEN the 0.45x lowered floor (~0.95pct) so never engage the giveback trail -> ride to stop as losses. The ct-loser PEAK MAGNITUDE is the wall: a giveback-trail (harvest-on-giveback) mechanism structurally cannot convert a ct position whose peak is too small to activate. The rally loss streak (4 consec, streak_gate 0.873) is unbreakable via any exit-harvest mechanism. (2) Exp2 (trend-aligned entry sparing of _port_dd_atten, gate DD entry-size shrink to ct only): MEASURED composite -0.0055, crash BYTE-IDENTICAL, rally -0.0135 (Sh1.471->1.446 DD5.19->5.37), bull -0.0056. CONCLUSION: crash is NOT _port_dd_atten-size-shrunk -- crash is PROFITABLE (100pct WR, +12.1pct AnnRet) so its portfolio equity is near peak, _port_dd_frac < the 0.032 activation threshold -> the DD entry-size breaker does NOT fire on crash -> sparing trend-aligned entries is byte-identical. CRASH RETURN LIMIT IS NOT ENTRY SIZE. Combined with the prior-session finding (crash exits giveback-dominated, hold-extension byte-identical) and this finding (not size-shrunk, not DD-over-harvested since DD mechanisms dont fire), crash return limit = genuinely small move size of crash bounces + base PEAK_PROFIT_GIVEBACK(0.22) harvest, both at their walls (giveback widening walled -> bull stability collapse; move size is exogenous). Crash is structurally return-capped. Also confirms fcae6004-style _port_dd_atten sensitivity extends to magnitude-gating: sizing up trend-aligned rally longs makes the 15pct losers bigger (rally -0.0135). (3) Exp3 (simplification: remove double-cross volume-boost cells Exp8/Exp9): MEASURED composite -0.000108 SUB-NOISE, crash byte-identical, bull/sideways/rally each -0.00003 to -0.0002. CONCLUSION: the double-cross boosts are NOT dead code -- each contributes ~0.0001 marginal alpha below the +0.003 keep threshold. Confirms the TIGHT LOCAL OPTIMUM: even redundant-looking +5pct boosts with deep-saturated near-constant gates are microscopically load-bearing; no simplification holds score. REMAINING UNCONQUERED: rally (0.640, streak_gate 0.873 from 4 consecutive ct-short losses unbreakable via exit-harvest, DD5.19pct, entry-size/ct-admission/ct-exit all saturated) and crash (0.731, return-limited Sh1.274 100pct WR, structurally small-move-capped, not size/DD-addressable). Both binding regimes are at non-addressable structural limits. Structural-exploration NOT attempted: no coherent subsystem-rewrite hypothesis with a plausible path (every core mechanism converted+tuned by prior sessions; the two binding-regime limits are structural properties of the regime data -- rally ct-loser peak magnitude, crash bounce move size -- not of the strategy mechanism, so no subsystem rewrite can address them). results.tsv append-only preserved (path-scoped git checkout -- strategy.py throughout, never git revert); all 3 discards reverted to b902da2f; strategy.py matches b902da2f byte-identical (0 diff verified). NEW BASELINE 0.783185 unchanged for future sessions.
