commit	score	mean_score	std_score	bull_2021	crash_bear	sideways	rally_2024	status	description
-	0.3700	0.5219	0.3040	0.65	0.68	0.76	0.00	discard	ARCHITECTURAL deep-downtrend short-hold slope-against attenuator (SHORT+in-profit, gated deep-neg ret_long * inverse-churn, attenuate _sl_slope_pressure up to 45pct, targeting crash-short ride-the-bear). Composite -0.129 vs d2ad8cc 0.4986. CRASH EXACTLY FLAT (raw 0.676 sharpe IDENTICAL) — KEY: element-wise MAX fusion means _sl_slope_pressure is NOT the binding exit term for winning crash shorts (pp_pressure or time_pressure dominates the MAX). The recommended crash-short SLOPE-path target is WRONG — slope is dominated. BULL stab 0.866->0.761 (score 0.751->0.652): bull_2021 has counter-trend SHORT positions; short-only attenuator destabilized them. RALLY HARD-CUTOFF raw 0.458->0.000 stab 0.656->0.378: Nth confirmation any price-derived term on rally book collapses it; inverse-churn gate did NOT spare rally (its pullback down-legs have neg ret_long + the gate fired). CONCLUSION: crash-short exit binding term is pp/time NOT slope; rally walled; bull has shorts too (short-only changes are not bull-safe).
eda1bf3	0.3320	0.4990	0.3341	0.64	0.68	0.76	-0.07	branch	BRANCH OPEN: deterministic churn-gated re-entry refractory (block fresh entry 1 bar after exit when len(_eh)>=3/30bars; integer gate, noise-immune, symmetric, entry-only). Composite -0.167 vs d2ad8cc 0.4986. RALLY STABILITY 0.656->1.000 (PERFECT — definitively confirms diagnostic c265424d: fast re-entries ARE the entire rally instability) BUT raw 0.458->-0.074 (blocked re-entries include profitable ones). BULL raw 0.751->0.635 (trades 41->37, bull churns enough to hit gate, WR 85->76). crash/sideways EXACTLY FLAT (low churn, gate never fired — spared by construction as designed). BRANCH HYPOTHESIS: gate refractory on PRIOR-EXIT OUTCOME (only settle after LOSING exit = churn-loss spiral; let WINNING-exit re-entries=trend-continuation alpha pass). Novel separation axis vs prior session f978677 (which gated NEW-entry conviction-release and failed 1:1). _last_exit_pnl already tracked; naturally spares high-WR bull/crash/sideways.
6a63f80	0.3486	0.5213	0.3452	0.72	0.68	0.76	-0.07	branch	branch step 3: REVERSAL-ONLY refractory (block only re-entry OPPOSITE to just-exited side; same-dir buy-the-dip passes). raw_composite 0.332->0.349 (+0.017 PROGRESS vs step2). bull recovered 0.635->0.724 (trades 37->39). crash/sideways FLAT (spared). RALLY BYTE-IDENTICAL to step2 (-0.074, 54 trades) — rallys blocked re-entries are 100pct REVERSALS and net-positive alpha (blocking -> neg sharpe). 3RD cross-session confirmation rally reversal-block is 1:1 raw<->stab wall. Step2 was inert (delta 0). NEXT: flip churn-gate polarity to INVERSE (block reversals in LOW churn = bull/crash/sideways, spare HIGH churn = rally by construction) to capture bull reversal-noise benefit while leaving rally at baseline 0.238.
b71deae	0.3879	0.5465	0.3172	0.75	0.68	0.76	0.00	branch	branch step 4: gate reversal-refractory on REALIZED DIRECTIONAL PERSISTENCE (|mean(recent entry signs)|>=0.6) not churn, per c265424d separator advice. raw_composite 0.349->0.388 (+0.039 progress). bull/crash/sideways ALL RESTORED to baseline (0.751/0.676/0.760 — gate inert on clean run, blocks nothing). RALLY raw RESTORED 0.458 + 58 trades (clean run blocks nothing in rally) BUT stability COLLAPSED 0.656->0.454 HARD-CUTOFF score 0.000. DECISIVE: on clean run the persistence>=0.6 gate blocks ZERO rally entries yet rally stab dropped — the HARD BOOLEAN BOUNDARY (persistence>=0.6, prior_loss, bars_since_exit<=1) is ITSELF noise-flippable (perturbed paths cross it). 5th confirmation: ANY added entry-side boundary amplifies rally noise even when inert on clean path. NEXT: convert hard boolean to CONTINUOUS persistence-scaled SIZE attenuation (no threshold) to test if removing the boundary itself preserves rally stab.
6d35eba	0.3879	0.5465	0.3172	0.75	0.68	0.76	0.00	branch	branch step 5: CONTINUOUS THRESHOLD-FREE reversal-size attenuation (size mult=1-0.70*persist*recency*loss, all smooth deterministic, NO boolean gate). raw_composite 0.3879 IDENTICAL to step4 (delta -0.000007, NO PROGRESS). DECISIVE: even with the hard boundary COMPLETELY REMOVED, RALLY stab still collapsed 0.656->0.406 HARD-CUTOFF. FINAL ANSWER: it is NOT the boundary — ANY reversal-touching mechanism (block/boolean-gate/continuous-size) makes rallys deep-in-market bidirectional book noise-sensitive because _rev_atten_strength varies trade-to-trade with realized history and AR(1) noise shifts WHICH trades are reversals, cascading position diffs. Reversal-touching WALLED at every granularity AND every separator (churn/outcome/persistence). 2 consecutive no-progress steps (4->5).
-	0.4986	0.6060	0.2149	0.75	0.68	0.76	0.24	discard	BRANCH SUMMARY (deterministic re-entry refractory, 5 steps, REVERTED to d2ad8cc 0.4986). Branch opened from exp3 (churn-gated re-entry refractory: block fresh entry 1 bar after exit when len(_eh)>=3): RALLY STABILITY 0.656->1.000 PERFECT (definitively confirms diagnostic c265424d: fast re-entries ARE the entire rally instability) but raw 0.458->-0.074 (blocks profitable re-entries too); bull raw 0.751->0.635. Steps 2-5 tried to recover rally raw while keeping the stab mechanism: step2 outcome-gate (prior-loss only) INERT delta 0 (every blocked re-entry already post-loss); step3 reversal-only direction-separation raw_composite 0.332->0.349 bull recovered 0.724 but rally byte-identical neg (its blocked re-entries 100pct reversals=alpha); step4 gate on REALIZED DIRECTIONAL PERSISTENCE (c265424d named separator) raw_composite 0.388 bull/crash/sideways RESTORED but rally stab 0.656->0.454 HARD-CUTOFF (boolean boundary itself noise-flippable even blocking zero on clean run); step5 CONTINUOUS THRESHOLD-FREE size-attenuation (no boolean) rally stab STILL collapsed 0.656->0.406 NO PROGRESS (delta -0.000007). DECISIVE FINAL CONCLUSION: rally reversal-touching is WALLED at EVERY granularity (block/boolean-gate/continuous-size) AND every separator (churn/outcome/persistence) — not the boundary, but that ANY trade-to-trade-varying reversal mechanism makes rallys 99pct-in-market bidirectional book noise-sensitive (AR(1) noise shifts WHICH trades are reversals -> cascading position diffs). The bull reversal-noise benefit (step3 0.724 fewer trades) is real but inseparable from rally collapse (4th cross-session confirmation, now via persistence-separator too). NEVER crossed baseline. REVERTED.
d2ad8cc-session-summary	-	-	-	-	-	-	-	session-summary	session: 2 independent architectural discards + 1 branch (5 steps, REVERTED). Baseline d2ad8cc UNCHANGED 0.4986 [bull 0.751 stab0.866 41trades WR85, crash 0.676 stab0.945 36trades WR100, sideways 0.760 stab0.851 33trades WR97, rally 0.238 raw0.458 STAB0.656 f0.520 58trades = SOLE binding constraint]. THEME: post-audit sample_factor lever (counts COMPLETED trades; bull/crash/sideways all <50 -> throttled x0.81-0.91, extreme WR=over-selective) + rally-stability via re-entry timing. INDEPENDENT DISCARDS: (1) two-sided trade-rate servo (under-trade admission relaxation, LOWER strong_min when flat+idle>40bars) -0.104: bull/crash/sideways EXACTLY IDENTICAL raw AND trade-counts (41/36/33) — 3RD CONFIRMATION those regimes are VOTER-SATURATED not admission-bound (lowering threshold creates ZERO entries voter conviction doesnt already pass); rally stab 0.656->0.510 (relaxation leaked into idle gaps). KEY: sample_factor lever is REAL but UNREACHABLE via admission breadth — marginal entries dont exist at current voter conviction; trade count is VOTER-SIGNAL-bound. (2) deep-downtrend short-hold slope-against attenuator (SHORT+in-profit, crash-ride-the-bear) -0.129: CRASH EXACTLY FLAT (raw/sharpe identical) — element-wise MAX fusion means _sl_slope_pressure is NOT the binding crash-short exit (pp/time dominates MAX); the recommended crash-short SLOPE-path target is WRONG; bull stab 0.866->0.761 (bull HAS counter-trend shorts, short-only changes not bull-safe); rally HARD-CUTOFF. BRANCH (deterministic re-entry refractory, 5 steps): exp3 OPEN churn-gated block-fresh-entry-1bar-after-exit drove RALLY STAB 0.656->1.000 PERFECT (definitively proves diagnostic: fast re-entries = entire rally instability) but raw->-0.074; steps 2-5 chased rally raw recovery: step2 outcome-gate INERT (all blocked already post-loss), step3 reversal-only direction-sep raw_composite 0.349 bull recovered 0.724 rally still neg (blocked=100pct reversals=alpha), step4 REALIZED-DIRECTIONAL-PERSISTENCE gate (c265424d named separator) bull/crash/sideways restored but rally stab 0.454 HARD-CUTOFF (boolean boundary itself noise-flippable blocking zero on clean run), step5 CONTINUOUS THRESHOLD-FREE size-atten rally stab STILL 0.406 collapse NO PROGRESS. CROSS-EXPERIMENT CONCLUSIONS: (a) DEFINITIVE NEW: bull/crash/sideways trade-count (sample_factor throttle) is VOTER-SIGNAL-bound NOT admission-bound — admission relaxation adds ZERO trades (voter conf~0.9 saturated). To lift their raw via trade count needs a VOTER-SIGNAL change (new/relaxed voter), not any gate/threshold. (b) DEFINITIVE NEW: crash-short binding exit is pp/time NOT slope (slope-atten left crash byte-identical via MAX fusion) — the oft-recommended crash-short-slope redesign is mis-targeted; must target pp/time path (but that is the SHARED rally-walled timing layer). (c) rally reversal-touching WALLED at EVERY granularity (block/boolean-gate/continuous-size) AND every separator (churn/outcome/persistence) — 4th+ cross-session confirmation; AR(1) noise shifts WHICH trades are reversals -> cascading diffs in 99pct-in-market bidirectional book; even threshold-free deterministic size-scaling collapses it. (d) bull reversal-noise benefit REAL (step3 bull 0.724 with fewer trades, blocking post-loss counter-trend reversals) but inseparable from rally even via the persistence-separator that c265424d hypothesized would work — persistence boundary is itself noise-flippable for rally. (e) bull HAS counter-trend shorts (not pure-long) — short-only mechanisms destabilize bull. FUTURE: (i) bull/crash/sideways raw needs VOTER-SIGNAL changes (the only untested lever for their <50-trade throttle) — relax a voter sharpness or add a voter that fires more in those low-WR-headroom regimes WITHOUT touching rally admission; (ii) AVOID admission-threshold changes for trade count (voter-saturated, proven inert); (iii) AVOID all rally reversal-touching (walled every granularity+separator); (iv) crash-short exit improvement must target pp/time path not slope, but that shared layer is rally-walled — likely needs a crash-isolated NON-price-derived gate; (v) bull reversal-block is real isolated alpha if a rally-safe separator exists, but persistence (the last hypothesized one) is now falsified. Baseline d2ad8cc 0.4986 unchanged.
-	0.3263	0.4773	0.3020	0.77	0.69	0.44	0.00	discard	ARCHITECTURAL subsystem redesign exit-fusion aggregator: log-sum-exp smooth-max replaces hard max(_soft_terms) (LSE m+(1/p)log sum exp(p(t-m)), p=40, clamped<=1, >=max never dilutes unlike failed softmax-SUM row382). Composite -0.172 vs d2ad8cc 0.4986. bull +0.024 (0.751->0.775), crash +0.019 (0.676->0.695) — both stab-1.0 free regimes improved (LSE offset shifts exit-threshold crossing slightly earlier, marginally beneficial). sideways -0.320 (0.760->0.440 stab 1.0, early-exit bias hurts chop winners), RALLY HARD-CUTOFF 0.000 (stab 0.656->0.478). ROOT CAUSE: LSE offset is ALWAYS positive (>=max) AND BAR-VARYING (magnitude depends on how many terms cluster near max) -> the bar-to-bar variation is a NEW noise channel in rally/sideways. NOT branch-worthy: only credible fix (bias-correct mean offset) removes mean bias but NOT the bar-to-bar VARIANCE of the offset -> rally stab stays depressed -> doesnt address failure mechanism. Reverted.
d2ad8cc-session-summary	-	-	-	-	-	-	-	session-summary	session: 5 independent architectural discards (cap reached, no branch — none met branch-eligibility, each failed for a CONFIRMED-WALL reason not a fixable one). Baseline d2ad8cc UNCHANGED 0.4986 [bull 0.751 stab1.0, crash 0.676 stab1.0, sideways 0.760 stab1.0, rally 0.238 raw0.458 STAB0.656 f0.520 = SOLE binding constraint]. THEME: stateless-vs-stateful position/exit timing mechanisms. EXP1 deterministic scale-OUT rate cap (profit-side shrink<=0.5/bar, SL/opp/full/loss exempt): composite 0.144, ALL final regressed BUT CRASH RAW 0.676->0.846 (+0.17! slower profit-exit lifts crash returns) — path-dependent cap (carries current_pos fwd) collapses stab (crash 1.0->0.067, rally 0.656->0.273). EXP2 stateless conviction-margin entry-size ramp (size*=tanh(max(0,margin)/0.25)): composite 0.388, bull/crash/sideways PERFECTLY PRESERVED (large margin->ramp~1.0, proves saturated regimes far above threshold) but RALLY stab 0.656->0.314 WORSE — ramp SPREADS margin-noise across the [0,2scale] band where rally clusters (more per-bar size variance, not less). EXP3 stateless high-vol profit-hold de-rate of soft_max (soft_max*=1-0.30max(0,pnl_scale)tanh((vol_ratio-1)/0.4)): composite 0.346, CRASH EXACTLY FLAT 0.676 (NOT EXP1 0.846!) -> crash winning-short exits do NOT route via soft de-risk ramp (exit via pp/time MAX-dominant or tp-harvest/opp_gate); rally stab 0.656->0.029 (rally 2024 HAS vol_ratio>1 spikes -> low-vol-gate STILL fires intermittently -> low-vol=rally-safe is FALSE). EXP4 entry-frozen scale-in destination (self._entry_size at entry-bar): composite 0.375, rally HARD-CUTOFF (stab 0.316) SAME CLASS AS EXP1 — freeze removes per-bar self-correction, locks one entry-bar noise realization for whole hold -> divergence. EXP5 SUBSYSTEM REDESIGN log-sum-exp smooth-max exit-fusion (>=max, never dilutes, unlike failed softmax-SUM row382): composite 0.326, bull +0.024 crash +0.019 (free regimes like) but sideways -0.320 + rally HARD-CUTOFF (stab 0.478) — LSE offset always-positive AND bar-varying = new noise channel. CROSS-EXPERIMENT CONCLUSIONS: (a) DECISIVE GENERAL PRINCIPLE — per-bar STATELESS RECOMPUTE is self-correcting under AR(1) noise (CONVERGES back each bar) = stable; ANY FREEZE (EXP4) or PATH-ACCUMULATING CAP (EXP1) propagates a single bars noise realization forward through the whole hold = stab collapse. The ONLY timing-lever win ever (9d730c7) changed a stateless FORMULA COEFFICIENT, froze nothing. (b) NEW WALL: stateless does NOT guarantee rally-safe — EXP2 (margin-ramp) and EXP5 (LSE offset) are stateless yet collapse rally because they make a per-bar quantity VARY MORE under noise; the test is whether the mechanism INCREASES or DECREASES per-bar output variance, not statefulness alone. (c) crash RAW has real +0.17 headroom (EXP1) via holding winners but it routes through tp-harvest/opp_gate NOT soft de-risk (EXP3) and is unreachable without a path/freeze mechanism that collapses stab — crash-raw and rally-stab appear to share the SAME timing-robustness wall. (d) rally 2024 carries vol_ratio>1 spikes (EXP3) — vol-gating is NOT a clean rally isolator. NEXT-SESSION PIVOT: the ONLY proven-productive lever is changing a stateless decision FORMULA that REDUCES per-bar output variance (9d730c7 archetype). Avoid: freezes, path-caps, margin/size ramps that widen variance, vol-gates assumed rally-safe, tp-harvest (load-bearing c3eecd1), reversal/re-entry timing (confirmed wall x6), directional sizing (confirmed wall). Note: stability metric is INVARIANT to uniform position scaling -> all sizing-magnitude changes are stab-inert by construction; only TIMING/STRUCTURE of position CHANGES matters.
-	0.414	0.544	0.260	0.75	0.70	0.63	0.10	discard	BRANCH SUMMARY (profit-milestone harvest ladder, 3 steps, REVERTED to d2ad8cc 0.4986, strategy.py byte-identical). Opened from exp3: realize 12pct each time peak_pnl crosses integer multiple of _pp_min (sample_factor lever — all 3 strong regimes throttle <50 trades). STEP1 (full ladder, hi-water 0.414): CRASH RAW +0.022 (0.676->0.698 stab1.0 CLEAN) + RALLY RAW +0.053 (0.458->0.511 GENUINE — lifts flagged headroom) but RALLY stab COLLAPSED 0.656->0.559 f0.197; sideways stab 0.851->0.750; bull flat. STEP2 (vol_ratio gate tanh(vr-1)/0.3): REGRESSED 0.390 — crash vol_ratio NOT reliably>1 (deep bear, not vol-spike) so gate KILLED crash gain (crash byte-flat); rally worse. STEP3 (deep-peak floor level>=3, vol-independent): 0.379 — crash STILL byte-flat (_pp_min vol-scaled so 3x rarely reached in crash either), rally STILL 0.000 (rare harvests collapse 99pct-in-market book). CONCLUSION: harvest crash-benefit and rally-collapse are INSEPARABLE — same realizing events cause both; no non-regime non-price quantity separates crash-deep-peak from rally-peak (both profitable trending). Realizing-event TIMING varies under noise (peak crosses threshold at noise-dependent bar) -> rally equity divergence — Nth confirmation rally cannot tolerate timing-variable events. sample_factor lever is REAL (crash+rally raw both rose) but un-deployable for rally. Branch peaked step1 0.414 < baseline. Revert.
d2ad8cc-session-summary	-	-	-	-	-	-	-	session-summary	session: 2 independent architectural discards + 1 branch (3 steps, REVERTED). Baseline d2ad8cc UNCHANGED 0.4986 [bull 0.751 stab0.866 f1.0, crash 0.676 stab0.945 f1.0, sideways 0.760 stab0.851 f1.0, rally 0.238 raw0.458 STAB0.656 f0.520 = SOLE binding]. THEME: NEW NON-EXIT levers (voter-weight path-efficiency; realized-PnL; sample_factor harvest). EXP1 path-efficiency Kaufman-ER added to voter-weight-shift trend driver via max(): ISOLATION CONFIRMED bull/crash/sideways BYTE-FLAT (saturated voters, quintic dominates) but rally clean BYTE-IDENTICAL too (ZERO upside) + rally stab COLLAPSED 0.656->0.216 -> 5th confirm wall(b) price-derived voter-agg term amplifies rally noise. EXP2 realized winning-streak EMA _win_frac loosens BINDING giveback trail: BULL +0.027 GENUINE raw (clean uptrend winners run) but SIDEWAYS CATASTROPHIC -0.688 (raw 0.760->0.472 AND stab 0.851->0.545) + rally->0.000 -> _win_frac noise-robust ONLY in clean-directional bull; in chop/near-tied PnL oscillates ~0 so rising/falling flips under noise. BRANCH harvest-ladder (sample_factor lever, peak_pnl integer-multiple milestones): DEFINITIVE NEW POSITIVE — CRASH RAW +0.022 (stab1.0 clean) AND RALLY RAW +0.053 (lifts flagged headroom) both rose, sample_factor lever WORKS; but rally stab collapsed 0.656->0.559 and steps2-3 (vol-gate, deep-peak-floor) BOTH regressed: crash benefit inseparable from rally collapse (same realizing events; crash vol_ratio not>1 so vol-gate kills crash; _pp_min vol-scaled so deep-floor rarely hit in crash either; rally collapses on even rare harvests). CROSS-EXPERIMENT: (a) NEW: sample_factor IS a real raw lever (crash+rally raw both rose via realizing events) but rally cannot tolerate ANY timing-variable realizing event (peak-crossing bar varies under noise -> 99pct-in-market book diverges) — Nth rally-timing confirmation. (b) bull raw gains REAL from both _win_frac(+0.027) and looser-trail but inseparable from sideways/rally chop-noise without forbidden regime switch. (c) crash raw +0.022 reachable via profit-lock realizing events but only un-gated (any non-regime gate kills it). FUTURE: (i) sample_factor lever for crash needs a CRASH-ISOLATED noise-immune harvest trigger that does NOT fire in rally — integer bars_held gate untested (rally short-held vs crash long-held may separate); (ii) bull-isolated looser-trail if a bull-vs-chop non-price separator exists. NEW BASELINE: unchanged d2ad8cc 0.4986.
-	0.4986	0.6060	0.2149	0.75	0.68	0.76	0.24	discard	BRANCH SUMMARY (post-exit re-entry attenuation, 6 steps incl opening exp, REVERTED to d2ad8cc 0.4986, strategy.py byte-identical). Opened from exp1 (re-entry conviction hysteresis: smooth decaying admission-threshold premium). TWO AXES tested, BOTH falsified: (A) ADMISSION axis steps1-3 (premium MAX 0.02/0.06/0.25): rally raw collapses to IDENTICAL -0.093 at ALL THREE magnitudes (stab->0.83/1.0 full win but raw gone) - rally raw alpha lives in the SAME immediate zero-margin re-entries that are the stability killers => inseparable on admission axis (reconfirms 2 prior sessions, now as smooth mechanism). (B) SIZE axis steps4-6: step4 bar-1-only cut PRESERVED raw (0.455) bull +0.006 but rally stab 0.656->0.635 (cut made rally LESS stable); step5 whole-trade persist cut winners (raw 0.407) + stab 0.564 (bars_since_exit gating = noise channel: exit timing shifts under noise); step6 flat 30pct cut in 6-bar window collapsed rally raw to 0.000 (rally high-churn, most entries within window). CORE HYPOTHESIS FALSIFIED: smaller re-entry size does NOT improve rally stability (all 3 variants stab<=baseline). ROOT: any bars_since_exit-gated mechanism inherits exit-timing noise. Best step composite 0.484<baseline.
