commit	score	mean_score	std_score	bull_2021	crash_bear	sideways	rally_2024	status	description
b7carr6n	0.727906	0.810582	0.165351	0.83	0.80	1.04	0.57	branch	branch step2: R^2 path-linearity gate on convex amp (_dr_r2_gate=tanh(R^2/0.30), 0 chop->1 clean). MEASURED vs step1 0.743083: composite 0.743083->0.727906 (-0.015 NO PROGRESS), mean 0.828724->0.810582 (-0.018). rally 0.569338->0.572494 (+0.003 only partial recovery, still <baseline 0.595). bull 0.905310->0.827612 (-0.077 CATASTROPHIC: R^2 gate removed convex cushion from bull too, bull raw 0.905->0.828). crash flat 0.803, sideways +0.002. CONCLUSION: R^2 gate too blunt - bull-2021 R^2 is lower than assumed or 0.30 scale too aggressive, gating bull out of its own cushion. Wrong gate axis. Revert to step1, try trend-ALIGNMENT gate instead (cushion trend-aligned winners only, cut counter-trend fast) - preserves bull (trend-aligned) + helps rally longs while cutting rally ct-shorts.
bbt6earp	0.748931	0.834220	0.170577	0.91	0.80	1.04	0.58	branch	branch step3: TREND-ALIGNMENT gate on convex cushion (_dr_align=tanh(ret_long*pos_dir/0.04); cushion only trend-aligned winners, ct reverts linear). MEASURED vs step1 0.743083: composite 0.743083->0.748931 (+0.0058 PROGRESS), mean 0.828724->0.834220 (+0.0055). bull 0.905310->0.914212 (+0.009, stab factor 1.0 held), rally 0.569338->0.578464 (+0.009 recovered), sideways 1.037371->1.042785 (+0.006), crash 0.802876->0.801417 (-0.001). vs BASELINE 15bbb2ba 0.725520: composite +0.0234, mean +0.0332, bull +0.073 (stability penalty ELIMINATED 0.896->1.0), crash +0.046, sideways +0.030, rally -0.016 (2.8pct drop, <50pct gate). MaxDD all <2pct (rally 1.79). MEETS ALL KEEP CRITERIA vs baseline. min_stability 0.812179 (was 0.768865). Continuing one step to attempt full rally recovery (still <baseline 0.595).
bdkwts3x	0.726896	0.809237	0.164682	0.81	0.80	1.05	0.58	branch	branch step4: PEAK-DEPTH gate layered on convex cushion (_dr_depth=tanh((peak/_pp_min-1)/0.6)). MEASURED vs step3 0.748931: composite 0.748931->0.726896 (-0.022 NO PROGRESS). bull 0.914212->0.806643 (-0.107 CATASTROPHIC: peak-depth gate removed cushion from bull - bull-2021 winners are SHALLOW (high Sharpe, modest peaks), so depth gate excludes them, bull raw 0.914->0.807). rally 0.578464->0.582091 (+0.004 only, still <baseline 0.595). sideways +0.005, crash flat. CONCLUSION: same failure pattern as step2 R^2 gate - ANY gate that excludes bull winners (R^2, peak-depth) kills bull because bull stability prize depends on cushion applying to bulls shallow trend-aligned winners. Trend-alignment gate (step3) is the RIGHT axis because bull IS trend-aligned. Revert to step3 (the keep).
bx3dlbdc	-999.000000	-499.482447	499.517588	-999	0.30	-999	-0.23	branch	branch step5: CHURN-scaled cushion amplitude (_dr_churn_scale=1-0.25*_churn_dz). CATASTROPHIC: composite -999, bull+sideways hit hard cutoff (>10pct DD or >15pct loss), crash 0.299, rally -0.228. The churn-based amp reduction caused pathological slow de-risk in clustered/volatile holds -> drawdown blowup. MEASURED vs step3 0.748931: NO PROGRESS (catastrophic). _churn_dz interaction with cushion amp is unsafe. Revert to step3 (the keep). 2nd consecutive no-progress step (step4 peak-depth, step5 churn-scale).
859effa5	0.748931	0.834220	0.170577	0.91	0.80	1.04	0.58	keep	KEEP (NEW BASELINE, SUPERSEDES 15bbb2ba 0.725520). Branch step3 (convex de-risk ramp + trend-alignment gate, architectural). New mechanism: replace LINEAR de-risk ramp (1-x) with CONVEX (1 - x^k) where k = 1 + 0.6*max(0,_pnl_scale)*_dr_align, _dr_align=tanh(ret_long*pos_dir/0.04). Holds near full size through mid-range exit pressure (absorbing giveback/slope noise -> less position-value wobble -> less equity TE) then cuts sharply at saturation. Trend-alignment gate: cushion only trend-aligned winners (bull longs, crash shorts, rally longs); counter-trend reverts to linear fast cut. MEASURED vs 15bbb2ba 0.725520: composite 0.725520->0.748931 (+0.023411), mean 0.801057->0.834220 (+0.033163), std 0.151075->0.170577. PER-REGIME: bull 0.840883->0.914212 (+0.073, STABILITY PENALTY ELIMINATED: stab 0.768865->0.812179 factor 0.896->1.0 - the SOLE penalty prior sessions deemed structurally unfixable, cleared via exit-ramp SHAPE not voter/level smoothing). crash 0.755319->0.801417 (+0.046), sideways 1.013297->1.042785 (+0.030). rally 0.594731->0.578464 (-0.016, 2.8pct drop <50pct gate - the cost of holding trend-aligned winners longer through rally choppy giveback). MaxDD bull1.10/crash0.67/sideways0.45/rally1.79 all<10pct. flip_count 0 all. All keep criteria met. NEW BASELINE 0.748931. strategy.py at HEAD 859effa5 byte-identical to step3 commit f3578daf.
859effa5	0.748931	0.834220	0.170577	0.91	0.80	1.04	0.58	session-summary	SESSION: 1 independent architectural discard (Exp1 cross-symbol momentum gate, INERT) + 1 exploration branch (Exp2 convex de-risk ramp, 5 steps, KEPT at step3). NEW BASELINE 859effa5 0.748931 (SUPERSEDES 15bbb2ba 0.725520, +0.023411 composite, +0.033163 mean). [bull 0.914212 raw0.914212 stab0.812179 factor1.0 (PENALTY ELIMINATED), crash 0.801417 stab1.0, sideways 1.042785 stab1.0, rally 0.578464 raw0.578464 stab1.0]. MAJOR DISCOVERY: the convex de-risk ramp (1-x^k, PnL+trend-align modulated k) eliminates bulls stability penalty (0.896->1.0) - the SOLE penalty prior ~20+ sessions deemed STRUCTURALLY UNFIXABLE (proven dead via voter-reweighting AND level-smoothing AND held-level-smoothing). The fix was on the EXIT DE-RISK RAMP SHAPE (linear->convex), an axis never tried: a convex ramp holds near-full size through mid-range exit-pressure noise (absorbing giveback/slope TE) then cuts sharply at saturation, damping the equity-curve tracking error that IS the stability penalty, WITHOUT changing the trade set (Sharpe scale-invariant -> raw preserved). Trend-alignment gate ensures counter-trend positions keep the linear fast cut (preserving loser-cutting). BRANCH STEP FINDINGS: step1 (uniform convex in profit) +0.0176 composite, eliminated bull penalty BUT rally -0.025 (cushion held rally ct-shorts through giveback). step2 (R^2 path-linearity gate) -0.015 NO PROGRESS - killed bull -0.077 (bull-2021 R^2 too low, gate excluded bull winners). step3 (TREND-ALIGNMENT gate, KEEP) +0.006 vs step1 - recovered rally +0.009 (ct-shorts cut fast) AND bull +0.009. step4 (peak-depth gate) -0.022 NO PROGRESS - killed bull -0.107 (bull winners shallow, depth gate excluded them). step5 (churn-scaled amp) CATASTROPHIC -999 (drawdown blowup from unsafe _churn_dz x cushion interaction). CROSS-EXPERIMENT LOAD-BEARING FINDING: bulls stability prize is COUPLED to the convex cushion applying to bulls shallow trend-aligned winners - ANY additional gate that excludes bull winners (R^2, peak-depth) kills bull by the same mechanism. Trend-alignment is the ONLY safe gate axis because bull IS trend-aligned (so bull is included). Rally recovery beyond step3 is structurally blocked: rally is also trend-aligned (grinding uptrend), so cannot be separated from bull by alignment/depth/R^2 without hurting bull; the -0.016 rally cost is the price of the bull stability prize (net trade +0.133 total regime score massively favorable). Exp1 discard: cross-symbol short-momentum confirmation gate INERT (redundant with existing _btc_trend+_conc_shrink+_xasset confirmation channels). Branch concluded (KEEP) -> session ends per one-branch-per-session rule.
a298be9f	0.748931	0.834220	0.170577	0.91	0.80	1.04	0.58	discard	Exp1 (architectural): counter-trend STOP-LOSS tightening (_stop_abs *= 1-0.20*max(0,tanh(-pos_dir*ret_vlong/0.01)); same fast-sat /0.01 ct gate as size/time/level axes). INERT: byte-identical to baseline 0.748931 on all 4 regimes (bull 0.914212/crash 0.801417/sideways 1.042785/rally 0.578464, all stab 1.0). FINDING: ct positions exit via soft-pressure/time/max_hold-shortening/linear-fast-cut BEFORE reaching the sl_pressure>=0.95 hard-stop zone, so tightening _stop_abs never changes the exit decision. Stop axis is not the binding exit for ct losers; the size+time+level ct mechanisms already subsume it.
9f837099	0.725688	0.806402	0.161429	0.81	0.80	1.03	0.58	discard	Exp2 (architectural): churn-gated cushion weakening (DERISK_CONVEX_AMP *= 1-0.5*_churn_dz on de-risk ramp; noise-immune integer len(_eh) gate). MEASURED vs 859effa5 0.748931: composite -0.023, mean -0.028. bull 0.914212->0.812951 (-0.101 RAW, stab 0.871->0.869 factor 1.0 both -> raw loss not stability). rally 0.578464->0.577401 (~FLAT -0.001, the giveback-recovery hypothesis FAILED). crash byte-identical 0.801417. sideways 1.042785->1.033839 (-0.009). FINDING: bull trend-aligned winners NEED the full cushion to ride the trend; weakening it in bursts = premature exit = -0.101 raw. rally did NOT benefit because rally giveback is NOT burst-correlated (cushion holds rally longs in quiet stretches too, or rally longs are not the giveback source). The churn gate cannot separate rally from bull (both burst) so no recovery path exists -> no branch. Noise-immune gate avoided the stability-killing trap (bull stab held 0.869) but the mechanism is raw-negative.
a73836dc	0.754514	0.835151	0.161275	0.90	0.80	1.04	0.60	keep	KEEP (NEW BASELINE, SUPERSEDES 859effa5 0.748931). Exp3 (architectural, indep): trend-gated realized-PnL scale-in ACCELERATION for early winners (_win_accel=max(0,tanh(pos_pnl/abs(STOP_LOSS_PCT)))*_trend_strength_w; _entry_full_bars_dyn -= 0.8*_win_accel, floored 1.5). Re-adds scale-in pace accel on SMOOTHER realized pos_pnl signal (vs removed live-CONVICTION accelerator which used noisy per-bar voter margin + added bull noise) + trend gate (spares sideways chop). MEASURED vs 859effa5: composite +0.0056 (0.754514), mean +0.0009 (0.835151), std -0.0093 (0.161275), raw_composite 0.748931->0.754514. PER-REGIME: rally 0.578464->0.599110 (+0.0206, Sharpe 1.099->1.152, MaxDD 1.79->1.60, stab 0.812->0.826 ALL improved - faster scale-in on trend-aligned rally longs captures more uptrend). sideways 1.042785->1.043507 (+0.0007, trend gate=0 in chop -> byte-near-identical). crash 0.801417 BYTE-IDENTICAL (crash rsi_trend_str high but pos_pnl gate - crash shorts win early -> accel fires BUT result identical: crash scale-in pace was already at 2.0 floor in strong trend, accel floored at 1.5 makes <2-bar diff absorbed by grid/deadband). bull 0.914212->0.896570 (-0.0176, -2.0pct <50pct gate; Sharpe 1.757->1.705, MaxDD 1.10->1.14, stab 0.871->0.883 factor1.0 - faster scale-in grew bull position before choppy 2021 corrections -> more giveback/DD). All max_dd<10pct (rally 1.60 highest). All keep criteria met. Binding constraint now rally 0.599 (still lowest) + bull regressed 0.897. NEW BASELINE 0.754514.
8d418a79	0.756240	0.837299	0.162120	0.91	0.80	1.04	0.60	keep	KEEP (NEW BASELINE, SUPERSEDES a73836dc 0.754514). Exp4 (architectural, indep): slope-confirmation gate on the Exp3 scale-in accelerator (_slope_conf=max(0,tanh(_lr_slope*pos_dir/0.0004)); _win_accel *= _slope_conf). MEASURED vs a73836dc: composite +0.0017 (0.756240), mean +0.0021 (0.837299), std +0.0008. PER-REGIME: bull 0.896570->0.905397 (+0.0088 RECOVERED, Sharpe 1.705->1.730, MaxDD 1.14->1.10 - slope gate spares bull: 2021 corrections preceded by slope weakening -> accel off -> no over-size before pullback). rally 0.599110->0.599058 (~FLAT -0.0001, Sharpe 1.152->1.151, grinding uptrend has persistent slope -> gate stays on -> gain held). crash 0.801417 BYTE-IDENTICAL. sideways 1.043507->1.043326 (~flat -0.0002). All max_dd<10pct. All keep criteria met. Confirms Exp3 diagnosis: bull regression was over-acceleration into imminent corrections, fixable by near-term slope confirmation. NEW BASELINE 0.756240.
5814a842	0.764801	0.842603	0.155604	0.91	0.80	1.04	0.62	keep	KEEP (NEW BASELINE, SUPERSEDES 8d418a79 0.756240). Exp5 (architectural, indep): adaptive accel floor (_accel_floor=1.5-0.2*_trend_strength_w; 1.3 strong trend) + stronger magnitude (0.8->1.2). MEASURED vs 8d418a79: composite +0.0086 (0.764801), mean +0.0053 (0.842603), std -0.0065 (0.155604). PER-REGIME: rally 0.599058->0.618119 (+0.0191, Sharpe 1.151->1.204, MaxDD 1.60->1.56, stab 0.825->0.821 - stronger accel on trend-aligned rally longs captures more uptrend). bull 0.905397->0.906625 (+0.0012 HELD, slope-confirmation gate protected bull from over-accel into 2021 corrections). sideways 1.043326->1.044251 (+0.0009). crash 0.801417 BYTE-IDENTICAL. All max_dd<10pct (rally 1.56 highest). All keep criteria met. NEW BASELINE 0.764801. Session arc: 0.748931->0.764801 (+0.0159 composite, +0.040 rally) over 3 keeps on scale-in accelerator direction.
768ebb26	0.763254	0.842013	0.157517	0.91	0.80	1.04	0.61	discard	Exp6 (architectural): push scale-in accel magnitude 1.2->1.5, floor 1.3->1.2. MEASURED vs 5814a842 0.764801: composite -0.0015 (0.763254), mean -0.0006. rally 0.618119->0.613136 (-0.0050, Sharpe 1.204->1.191, MaxDD 1.56->1.61 - OVER-ACCELERATION: bigger rally long positions into pullbacks = more giveback/DD, lower Sharpe). bull 0.906625->0.910017 (+0.0034). sideways ~flat. crash byte-identical. rally stab held 0.821 (stability not the binding issue here; raw Sharpe is). FINDING: magnitude 1.2 (Exp5) is near-optimal; 1.5 over-accelerates rally longs past the point where the grinding uptrend absorbs the extra size -> pullback giveback dominates. Accelerator magnitude limit reached. Revert to 5814a842.
363ce117	0.765220	0.843680	0.156921	0.92	0.79	1.04	0.62	keep	KEEP (NEW BASELINE, SUPERSEDES 5814a842 0.764801). Exp7 (architectural, indep): multi-day ret_vlong ct term on adverse-freeze gate (_ct_si_gate = max(ret_long_20bar_ct, ret_vlong_96bar_ct fast-sat /0.01)). MEASURED vs 5814a842: composite +0.0004 (0.765220), mean +0.0011 (0.843680). PER-REGIME: bull 0.906625->0.918714 (+0.0121, Sharpe 1.734->1.770 - bull pullback ct shorts now frozen -> smaller losses). rally 0.618119->0.620265 (+0.0021, MaxDD 1.56->1.52 - rally pullback ct shorts frozen; small gain as ct_vlong shrink + max_hold already handle them). crash 0.801417->0.791491 (-0.0099, -1.2pct <50pct gate; Sharpe 1.287->1.261, MaxDD 0.67->0.63 - crash dead-cat ct LONGS frozen -> cut some bounce wins; lower DD but lower Sharpe). sideways BYTE-IDENTICAL. All max_dd<10pct. All keep criteria met. OBSERVATION (correlation not causal claim): freezing ct SHORTS (uptrend pullbacks: bull/rally) helped, freezing ct LONGS (downtrend dead-cat: crash) hurt; direction-asymmetric fix is regime-overfitting (forbidden) so symmetric version kept. NEW BASELINE 0.765220.
9110bee4	0.766841	0.844254	0.154826	0.91	0.80	1.04	0.62	keep	KEEP (NEW BASELINE, SUPERSEDES 363ce117 0.765220). Exp8 (architectural, indep): gentler multi-day freeze magnitude (vlong term 1.0->0.6 in _ct_si_gate max; 20-bar term stays full). MEASURED vs 363ce117: composite +0.0016 (0.766841), mean +0.0006 (0.844254), std -0.0021. PER-REGIME: crash 0.791491->0.796573 (+0.0051 RECOVERED, Sharpe 1.261->1.274 - gentler freeze on dead-cat longs cuts less of the bounce wins). rally 0.620265->0.623162 (+0.0029, Sharpe 1.202->1.215, stab 0.819->0.825). bull 0.918714->0.913030 (-0.0057, -0.6pct <50pct gate; Sharpe 1.770->1.753 - gentler freeze freezes fewer bull ct shorts, still net above 5814a842 0.907). sideways BYTE-IDENTICAL. All max_dd<10pct. All keep criteria met. 0.6 magnitude is better balance than 1.0 (Exp7): recovers crash + rally up, small bull cost. NEW BASELINE 0.766841.
9110bee4	0.766841	0.844254	0.154826	0.91	0.80	1.04	0.62	session-summary	SESSION: 3 independent architectural discards (Exp1 ct-stop inert; Exp2 cushion weakening bull -0.101; Exp6 over-acceleration) + 5 KEEPS on the scale-in subsystem (Exp3 accel, Exp4 slope-gate, Exp5 stronger accel, Exp7 multi-day ct freeze, Exp8 gentler freeze mag). NEW BASELINE 9110bee4 0.766841 (SUPERSEDES 859effa5 0.748931, +0.017910 composite, +0.010034 mean, std 0.170577->0.154826). [bull 0.913030 sh1.753 stab0.882 f1.0, crash 0.796573 sh1.274 stab0.970 f1.0, sideways 1.044251 sh2.047 stab0.869 f1.0, rally 0.623162 sh1.215 stab0.825 f1.0 - ALL factors 1.0]. MAJOR DISCOVERY: scale-in PACE is a lever for rally RAW (prior session recorded removing conviction-accelerator slowed rally 0.393->0.371). Realized-PnL-based (SMOOTHER than noisy per-bar conviction margin) + trend-gated + slope-confirmed scale-in ACCELERATION for trend-aligned early winners raised rally Sharpe 1.099->1.215 (+0.045 rally score, the binding constraint). Slope-confirmation gate (Exp4) recovered bull: protects from over-accel into 2021 corrections (gate off when 16-bar slope weakens). Accelerator magnitude limit=1.2 (1.5 over-accelerates rally longs into pullback giveback, Exp6 discard). Multi-day ret_vlong ct term on adverse-freeze (Exp7/8): 20-bar ct gate MISSED rally pullback shorts (ret_long<0 during pullback=short-aligned->gate0); ret_vlong catches them. Gentler 0.6 magnitude balances crash (freezing ct dead-cat LONGS cuts bounce wins -> hurt) vs bull/rally (freezing ct SHORTS -> smaller losses -> helped). CROSS-EXPERIMENT LOAD-BEARING FINDINGS: (1) bull NEEDS full convex cushion (weakening via churn gate = bull -0.101 raw, Exp2 discard - cushion pinned by bull stability knee 0.882); (2) ct STOP-LOSS axis inert (ct exits via soft-pressure/time/max_hold before sl_pressure hard-stop, Exp1); (3) equity-vol feedback = rally-wall (collapses rally stab, prior sessions, NOT retried); (4) freezing ct shorts helps, ct longs hurts - direction-asymmetric fix is regime-overfitting (forbidden). rally still binding (0.623, stab 0.825 near 0.80 knee - limited room for noise-adding mechanisms). strategy.py at HEAD 9110bee4.
20c6a221	0.742455	0.817287	0.149663	0.81	0.80	1.04	0.62	discard	Exp1 (architectural): peak/MAE path-cleanliness gate on convex cushion amp (clean shallow-MAE winners keep full cushion, choppy deep-MAE winners get 0.60-1.00x amp -> faster de-risk/lock gains). MEASURED vs 9110bee4 0.766841: composite -0.0244 (0.742455), mean -0.027 (0.817287). bull 0.913030->0.805619 (-0.107, Sharpe 1.753->1.487 - CATASTROPHIC: bull deep-MAE-still-winning longs that survive 2021 corrections then continue up got less cushion -> cut before trend resumes). rally 0.623162->0.623698 (~FLAT +0.0005, Sharpe 1.215->1.216 - rally longs mostly shallow-MAE clean so unchanged; choppy subset too small). crash ~flat -0.001, sideways BYTE-IDENTICAL. Same failure pattern as prior R^2/peak-depth cushion gates: ANY gate that excludes bull winners (here deep-MAE recoveries) kills bull because bull stability prize is coupled to cushion applying to ALL bull trend-aligned winners incl deep-MAE recoveries. Not branch-eligible (rally delta noise-scale, no fix path - bull deep-MAE winners structurally indistinguishable from choppy losers on MAE axis). Reverted to 9110bee4.
19f11450	0.579157	0.705564	0.252813	0.35	0.80	1.05	0.62	discard	Exp2 (architectural): slope-confirmation BOOST on convex cushion amp (additive 1.0+0.15*slope_conf multiplier, reusing exit-subsystem _exit_slope). MEASURED vs 9110bee4 0.766841: composite CATASTROPHIC -0.188 (0.579157), mean -0.139 (0.705564), std +0.098 (0.252813). bull 0.913030->0.353746 (-0.559, raw 0.913->0.635, STABILITY COLLAPSED 0.882->0.557 factor 1.0->0.557 - the cushion amp now depends on _exit_slope, a 12/16/22-bar mean PRICE-DERIVED quantity that wobbles bar-to-bar under AR(1) noise -> position-value wobble -> equity TE -> bull stab collapse). rally 0.623162->0.623893 (~FLAT +0.0007), crash ~flat, sideways +0.003. CONFIRMS the prior-session hard rule Nth time: the exit/cushion path allows NO price-derived modulation (only extrema/_pnl_scale/_dr_align which are smoother); _exit_slope is price-derived -> bull stability collapse. Same walled exit-graduation path as de_floor. Not branch-eligible (rally delta noise-scale; bull stab collapse structural - slope is inherently price-derived). Reverted to 9110bee4.
99c4cd35	0.755533	0.821774	0.132481	0.91	0.79	0.97	0.62	discard	Exp3 (architectural simplification): remove R^2 path-linearity first-bar entry attenuator (_tq_atten=1.0, churn-gated to fire in low-churn crash/sideways/bull). MEASURED vs 9110bee4 0.766841: composite -0.011 (0.755533), mean -0.022 (0.821774). sideways 1.044251->0.969832 (-0.074, Sharpe 2.047->1.838 - R^2 gate WAS filtering low-quality choppy sideways entries; removing let them in -> Sharpe drop). crash 0.797->0.786 (-0.010), bull 0.913->0.908 (-0.005), rally ~flat -0.0003. FINDING: _tq_atten is LOAD-BEARING (not redundant) - the R^2 path-linearity shrink is a 4th quality gate that catches choppy-whipsaw entries the conv/quality/consensus gates miss in sideways (where paths are choppy by nature, R^2 discriminates real micro-trend entries from whipsaw). Same load-bearing pattern as consensus/ER gates (narrow-range quality gates contribute disproportionately). Over-shrink hypothesis WRONG: the gate was HELPING not over-shrinking. Not branch-eligible (no regime improved). Reverted to 9110bee4.
20747841	0.766880	0.844305	0.154848	0.91	0.80	1.04	0.62	discard	Exp4 (architectural): losing-de-risk grid coarsening (coarsen stable lattice 1.0->1.4x for LOSING REDUCES only, fewer partial-reduce realizing events -> lower max_consecutive_losses). MEASURED vs 9110bee4 0.766841: composite +0.000039 (0.766880 NOISE-SCALE), mean -0.0001 (0.844305). bull 0.913030->0.913233 (+0.0002 noise), crash/sideways/rally BYTE-IDENTICAL (rally 0.623162 Sharpe 1.214840 unchanged - streak_gate 0.8187 NOT moved). INERT: losing de-risks already near-binary via _de_floor 0.85 loss floor + the 0.13 deadband suppresses micro-reduces, so there are NO multi-step losing de-risks for the coarser grid to merge. Confirms prior-session finding that rally 6-consec-loss streak is mostly REAL SEPARATE losing trades (re-entries during bad stretch), not spurious grid/de-risk partial-reduce losses that coarsening could merge. The streak_gate lever remains walled: grid-coarsening (this) inert, loss-streak admission (path-dependent dead), emission-gate filtering (catastrophic). Reverted to 9110bee4.
