commit	score	mean_score	std_score	bull_2021	crash_bear	sideways	rally_2024	status	description
71d3888c	0.844658	0.885401	0.135809	0.969762	0.812359	1.054755	0.704726	keep	KEEP (NEW BASELINE, SUPERSEDES 9c61a6fc 0.844320). Exp1 (architectural, indep): BTC leader-VOLUME x BTC-price-trend-agreement alt entry boost. NEW cross-symbol x cross-data-type data dep: prior cross-symbol deps used BTC PRICE (96-bar trend) feeding alt sizing; this uses BTC VOLUME (6/18-bar mean ratio, deep-saturated /0.30) as leader-PARTICIPATION confirmation, conjuncted with the /0.03 BTC-price-trend agreement gate. An alt trend entry confirmed by BOTH leader-direction-agreement AND leader-volume-building is a higher-quality broad-market-trend entry -> larger first-bar commitment. Distinct from own-vol-rise (Exp5: own symbol volume) and BTC-price boost (Exp3 9cdb2a9a: price only). First-bar-only, +0.05 max, deep-saturated both gates (near-constant -> noise-free, validated safe family). BTC self-referential -> not reached (alt branch only). MEASURED vs 9c61a6fc 0.844320: composite +0.000338 (0.844658), mean +0.000190 (0.885401), std -0.000494 (tighter). PER-REGIME: rally 0.703526->0.704726 (+0.001200 BINDING CONSTRAINT - Sh 1.261946->1.265102, DD 1.5369->1.5372 flat; correlated alt longs on building leader volume get broader confirmation -> bigger committed trend capture), bull 0.970040->0.969762 (-0.000278 sub-noise, /0.03 gate spared most weak-trend 2021 stretches), crash BYTE-IDENTICAL 0.812359 (crash alt shorts agree w/ BTC downtrend but rising BTC volume rarer in sustained downtrend + conservative gate), sideways 1.054920->1.054755 (-0.000165 sub-noise, BTC~flat -> no agreement). All stability_factor 1.0, all MaxDD<10pct (rally 1.537). All keep criteria met. NEW BASELINE 0.844658. Observation (correlation only): rally gain consistent with broad-market leader-volume-confirmed trend hypothesis but direction-split PnL not measured.
80c34929	0.844674	0.885420	0.135821	0.969840	0.812359	1.054755	0.704726	discard	Exp2 (architectural, indep): BTC leader-volume x price-trend-DISAGREEMENT alt entry shrink (bilateral counterpart to Exp1 boost). An alt entry opposing BTC trend WHILE BTC volume rising (leader participating in moving away) shrunk. MEASURED vs 71d3888c 0.844658: composite +0.000016 (0.844674), mean +0.000019, std +0.000012 flat. PER-REGIME: bull 0.969762->0.969840 (+0.000078), crash BYTE-IDENTICAL 0.812359, sideways BYTE-IDENTICAL 1.054755, rally BYTE-IDENTICAL 0.704726 (binding constraint unmoved). All stab 1.0, all MaxDD<10pct. SUB-NOISE/inert: /0.03 deep-disagreement gate + rising-BTC-volume conjunction fires rarely; only bull moved marginally. Passed keep gates (composite+mean positive) but delta far below noise floor -> keeping would add BTC-volume-disagreement data dep for no real signal (overfit hygiene, same precedent as BTC-8bar inert row 847). Not branch-eligible in practice (rally byte-identical, no regime-level signal to iterate on). CONCLUSION: the Exp1 boost (agreement) is the productive side; the symmetric disagreement shrink is inert (alt entries strongly opposing BTC trend on rising leader volume are rare - the existing /0.06 BTC-trend shrink + ct_vlong already handle the counter-broad-market cases). Reverted to 71d3888c.
37efc71e	0.844977	0.885606	0.135429	0.969773	0.812359	1.054581	0.705710	keep	KEEP (NEW BASELINE, SUPERSEDES 71d3888c 0.844658). Exp3 (architectural, indep): partner-alt VOLUME-rise x partner-alt-price-agreement alt entry boost. NEW cross-symbol x cross-data-type dep: prior cross-alt dep used partner alt PRICE (20-bar momentum _alt_lead); this uses partner alt VOLUME (6/18-bar mean ratio, deep-saturated /0.30). Rising partner-alt volume = broad alt-market participation building (both alts accumulating volume together). Conjunction with the /0.02 partner-price-agreement gate (same as validated Exp2 partner lead-lag boost): an alt trend entry confirmed by BOTH partner-price-agreement AND partner-volume-building is a broad-alt-trend entry -> larger first-bar commitment. Distinct from Exp1 (BTC leader volume) and Exp5 (own volume): cross-alt PARTNER volume. First-bar-only, +0.05 max, deep-saturated both gates (near-constant -> noise-free, validated safe family). BTC self-referential -> not reached (alt branch only). MEASURED vs 71d3888c 0.844658: composite +0.000319 (0.844977), mean +0.000205 (0.885606), std -0.000380 (tighter). PER-REGIME: rally 0.704726->0.705710 (+0.000984 BINDING CONSTRAINT - Sh 1.265102->1.267693, DD 1.537 flat; correlated alt longs on building partner volume get broader confirmation -> bigger committed trend capture), bull 0.969762->0.969773 (+0.000011 flat), crash BYTE-IDENTICAL 0.812359, sideways 1.054755->1.054581 (-0.000174 sub-noise). All stability_factor 1.0, all MaxDD<10pct (rally 1.537). All keep criteria met. NEW BASELINE 0.844977. Observation (correlation only): rally gain consistent with broad-alt-participation trend hypothesis but direction-split PnL not measured.
6c897625	0.844978	0.885606	0.135428	0.969773	0.812359	1.054581	0.705712	discard	Exp4 (architectural, indep): partner-alt VOLUME-rise x price-DISAGREEMENT alt entry shrink (bilateral counterpart to Exp3 boost). An alt entry opposing partner-alt momentum WHILE partner volume rising (partner participating in moving away) shrunk. MEASURED vs 37efc71e 0.844977: composite +0.000001 (0.844978 ~byte-identical), mean BYTE-IDENTICAL 0.885606, std flat. PER-REGIME: bull BYTE-IDENTICAL, crash BYTE-IDENTICAL, sideways BYTE-IDENTICAL, rally 0.705710->0.705712 (+0.000002 byte-identical Sh 1.267693->1.267698). All stab 1.0, all MaxDD<10pct. INERT: the /0.02 deep-disagreement gate + rising-partner-volume conjunction never fires meaningfully - the existing /0.02 partner-price disagreement shrink (Exp3-prior 45c4e3e0) already handles counter-alt-trend cases; adding the partner-VOLUME conjunction does not bind (same inert pattern as Exp2 BTC-vol disagree shrink). CONCLUSION: the partner-volume boost (Exp3, agreement side) is the productive side; the symmetric disagreement shrink is inert (alt entries strongly opposing partner trend on rising partner volume are rare). Bilateral volume-disagreement shrinks are consistently inert (Exp2 + Exp4) - the disagreement shrink family on volume conjunctions does not bind. Reverted to 37efc71e.
1708056d	0.845063	0.885665	0.135340	0.969773	0.812359	1.054563	0.705963	keep	KEEP (NEW BASELINE, SUPERSEDES 37efc71e 0.844977). Exp5 (architectural, indep): alt-pair VOLUME-rise x BTC-self-trend-agreement BTC entry boost. NEW cross-symbol x cross-data-type dep: BTC entry sizing previously read NO alt data (only own self-trend boost); this reads the alt pair (ETH+SOL) average 6/18-bar VOLUME rise (deep-saturated /0.30). When the followers (alts) are participating (volume building) in the SAME direction as a BTC trend-aligned entry, the broad market confirms the leader move -> larger first-bar commitment. Mirror of Exp1 (BTC volume -> alt) and Exp3 (partner volume -> alt) but for BTC entries (alt-pair volume -> BTC). Volume (participation) is the differentiated signal (cross-symbol VOLUME non-redundant per Exp1/Exp3, unlike saturated cross-symbol price-agreement). Deep-saturated both gates (/0.30 alt-pair vol, /0.03 BTC trend -> near-constant, noise-free, validated safe family). First-bar-only, +0.05 max. MEASURED vs 37efc71e 0.844977: composite +0.000086 (0.845063), mean +0.000059 (0.885665), std -0.000089 (tighter). PER-REGIME: rally 0.705710->0.705963 (+0.000253 BINDING CONSTRAINT - Sh 1.267693->1.268359, DD 1.537 flat; BTC longs confirmed by alt-pair participating get broader confirmation -> bigger committed trend capture), bull BYTE-IDENTICAL 0.969773 (/0.03 BTC-trend gate spared weak-trend 2021 stretches), crash BYTE-IDENTICAL 0.812359, sideways 1.054581->1.054563 (-0.000018 sub-noise). All stability_factor 1.0, all MaxDD<10pct (rally 1.537). All keep criteria met. NEW BASELINE 0.845063. Smaller than Exp1/Exp3 (BTC is 1/3 of symbols + alt-pair-confirming-BTC is more indirect) but surgical (bull/crash byte-identical shows /0.03 gate clean). Observation (correlation only): rally gain consistent with broad-market-participation-confirms-leader hypothesis but direction-split PnL not measured.
63788ff5	0.845399	0.885891	0.134975	0.969679	0.812359	1.054535	0.706993	keep	KEEP (NEW BASELINE, SUPERSEDES 1708056d 0.845063). Exp6 (architectural, indep): OWN-volume-rise x PARTNER-alt-price-agreement conjunction boost on ALT entries. Completes the {own,BTC,partner}x{vol,price} agreement grid for alt entries: Exp1=BTC-vol x BTC-price->alt; Exp3=partner-vol x partner-price->alt; Exp5=alt-pair-vol x BTC-price->BTC; existing vol-rise=own-vol x OWN-price->all; THIS=own-vol x PARTNER-price->alt. An alt trend entry confirmed by BOTH own volume building (this alt is itself participating) AND the partner alt 20-bar momentum agreeing is a high-quality broad-alt-trend entry -> larger first-bar commitment. Distinct from Exp3 (PARTNER volume, not own) and existing vol-rise (OWN trend, not partner). Deep-saturated both gates (/0.30 own vol, /0.02 partner price -> near-constant, noise-free, validated safe family). First-bar-only, +0.05 max. BTC self-referential has no partner -> 1.0 byte-identical (guarded). MEASURED vs 1708056d 0.845063: composite +0.000336 (0.845399), mean +0.000226 (0.885891), std -0.000365 (tighter). PER-REGIME: rally 0.705963->0.706993 (+0.001030 BINDING CONSTRAINT - Sh 1.268359->1.271076, DD 1.537 flat; alt trend longs on own building volume + partner confirmation get broader participation -> bigger committed trend capture), bull 0.969773->0.969679 (-0.000094 sub-noise), crash BYTE-IDENTICAL 0.812359, sideways 1.054563->1.054535 (-0.000028 sub-noise). All stability_factor 1.0, all MaxDD<10pct (rally 1.537). All keep criteria met. NEW BASELINE 0.845399. Observation (correlation only): rally gain consistent with own-participation + partner-confirmation broad-alt-trend hypothesis but direction-split PnL not measured.
e039e46a	0.845765	0.886116	0.134505	0.969346	0.812359	1.054517	0.708241	keep	KEEP (NEW BASELINE, SUPERSEDES 63788ff5 0.845399). Exp7 (architectural, indep): OWN-volume-rise x BTC-price-trend-agreement conjunction boost on ALT entries. Last clean cell of the {own,BTC,partner}x{vol,price} agreement grid (own-vol x BTC-price -> alt). An alt trend entry where the alt itself is participating (own volume rising) AND the leader (BTC) confirms the direction is a high-quality broad-market entry (own participation + leader confirmation) -> larger first-bar commitment. Distinct from Exp1 (BTC VOLUME, not own) and Exp6 (PARTNER price, not BTC). Deep-saturated both gates (/0.30 own vol, /0.03 BTC trend -> near-constant, noise-free, validated safe family). First-bar-only, +0.05 max. BTC self-referential -> 1.0 byte-identical (guarded). MEASURED vs 63788ff5 0.845399: composite +0.000366 (0.845765), mean +0.000225 (0.886116), std -0.000470 (tighter). PER-REGIME: rally 0.706993->0.708241 (+0.001248 BINDING CONSTRAINT - Sh 1.271076->1.274419, DD 1.5376->1.5405 flat; alt trend longs on own building volume + leader confirmation get broadest participation -> bigger committed trend capture), bull 0.969679->0.969346 (-0.000333 sub-noise), crash BYTE-IDENTICAL 0.812359, sideways 1.054535->1.054517 (-0.000018 sub-noise). All stability_factor 1.0, all MaxDD<10pct (rally 1.540). All keep criteria met. NEW BASELINE 0.845765. Completes the {own,BTC,partner}x{vol,price} 2-way agreement grid for alt entries (5 keeps cumulative on the volume-participation axis: Exp1/3/5/6/7). Observation (correlation only): rally gain consistent with own-participation + leader-confirmation broad-market hypothesis but direction-split PnL not measured.
4419d46f	0.846509	0.886621	0.133706	0.969283	0.812359	1.054360	0.710481	keep	KEEP (NEW BASELINE, SUPERSEDES e039e46a 0.845765). Exp8 (architectural, indep): BTC-volume-rise x PARTNER-alt-price-agreement conjunction boost on ALT entries. 3-symbol breadth-participation signal (leader VOLUME x follower PRICE): an alt trend entry where the leader (BTC) is participating (volume building) AND the partner alt confirms the direction is a broad-market move with leader participation -> larger first-bar commitment. Tests the MIXED cell of the {own,BTC,partner}x{vol,price} grid beyond the 5 clean 2-way keeps. Distinct from Exp1 (BTC-vol x BTC-PRICE) and Exp3 (PARTNER-vol x partner-price). Deep-saturated both gates (/0.30 BTC vol, /0.02 partner price -> near-constant, noise-free, validated safe family). First-bar-only, +0.05 max. BTC self-referential -> 1.0 byte-identical (guarded). MEASURED vs e039e46a 0.845765: composite +0.000744 (0.846509), mean +0.000505 (0.886621), std -0.000799 (tighter). PER-REGIME: rally 0.708241->0.710481 (+0.002240 BINDING CONSTRAINT - Sh 1.274419->1.280230, DD 1.5405->1.5347; broad-market alt longs (leader participating + partner confirming) get strongest confirmation -> biggest committed trend capture), bull 0.969346->0.969283 (-0.000063 sub-noise), crash BYTE-IDENTICAL 0.812359, sideways 1.054517->1.054360 (-0.000157 sub-noise). All stability_factor 1.0, all MaxDD<10pct (rally 1.535). All keep criteria met. NEW BASELINE 0.846509. STRONGEST keep this session (+0.000744) - the mixed 3-symbol conjunction is genuinely ADDITIVE, NOT redundant with the existing bilateral Exp1(BTC-vol)x partner-boost(partner-price) multiplication. Observation (correlation only): rally gain consistent with leader-participation + follower-confirmation broad-market hypothesis but direction-split PnL not measured.
1c503346	0.846892	0.886866	0.133245	0.969298	0.812359	1.054133	0.711673	keep	KEEP (NEW BASELINE, SUPERSEDES 4419d46f 0.846509). Exp9 (architectural, indep): PARTNER-alt-volume-rise x BTC-price-trend-agreement conjunction boost on ALT entries. Symmetric mixed cell to Exp8 (follower VOLUME x leader PRICE): an alt trend entry where the partner alt is participating (volume building) AND the leader (BTC) confirms the direction is a broad-market move with follower participation -> larger first-bar commitment. Last cell of the full {own,BTC,partner}x{vol,price} 2-way grid. Distinct from Exp3 (PARTNER-vol x PARTNER-price) and Exp8 (BTC-vol x partner-price). Deep-saturated both gates (/0.30 partner vol, /0.03 BTC trend -> near-constant, noise-free, validated safe family). First-bar-only, +0.05 max. BTC self-referential -> 1.0 byte-identical (guarded). MEASURED vs 4419d46f 0.846509: composite +0.000383 (0.846892), mean +0.000245 (0.886866), std -0.000461 (tighter). PER-REGIME: rally 0.710481->0.711673 (+0.001192 BINDING CONSTRAINT - Sh 1.280230->1.283437, DD 1.535 flat; broad-market alt longs (follower participating + leader confirming) get broad confirmation -> bigger committed trend capture), bull 0.969283->0.969298 (+0.000015 flat), crash BYTE-IDENTICAL 0.812359, sideways 1.054360->1.054133 (-0.000227 sub-noise). All stability_factor 1.0, all MaxDD<10pct (rally 1.538). All keep criteria met. NEW BASELINE 0.846892. Completes the full {own,BTC,partner}x{vol,price} 2-way agreement grid (7 keeps on volume-participation axis: Exp1/3/5/6/7/8/9). Observation (correlation only): rally gain consistent with follower-participation + leader-confirmation broad-market hypothesis but direction-split PnL not measured.
1f40100b	0.846936	0.886888	0.133172	0.969217	0.812359	1.054124	0.711850	discard	Exp10 (architectural, indep): 3-way conjunction OWN-vol x BTC-vol x PARTNER-price boost on alt entries. Broadest 3-symbol breadth (alt participating + leader participating + follower confirming). MEASURED vs 1c503346 0.846892: composite +0.000044 (0.846936), mean +0.000022, std -0.000073. PER-REGIME: rally 0.711673->0.711850 (+0.000177 Sh 1.283437->1.283992), bull -0.000081 sub-noise, crash BYTE-IDENTICAL, sideways -0.000009 sub-noise. All stab 1.0, all MaxDD<10pct. SUB-NOISE: gain far below noise floor (+0.000044 = ~1/17 of Exp8 +0.000744) - clear drop-off from the 2-way keeps. The 3-way gate is narrow (fires only when all 3 deep-saturated signals ~1 = rare deep broad trends) so marginal signal is tiny. Passed keep gates (composite+mean positive) but discarded on overfit-hygiene grounds: a 3rd-order interaction (3-way conjunction) tuned on in-sample regimes is high selection-bias risk, and +0.000044 is the kind of fragile gain the hygiene rules warn against (adding 18 LOC for no robust signal). CONCLUSION: the complete 2-way grid (Exp1/3/5/6/7/8/9, 7 keeps) is the productive ceiling of the volume-participation axis; 3-way conjunctions drop into sub-noise/overfit territory. Reverted to 1c503346.
-	-	-	-	-	-	-	-	session-summary	SESSION: 7 KEEPS (Exp1 +0.000338, Exp3 +0.000319, Exp5 +0.000086, Exp6 +0.000336, Exp7 +0.000366, Exp8 +0.000744, Exp9 +0.000383) + 3 architectural discards (Exp2/Exp4 inert disagreement shrinks, Exp10 sub-noise 3-way). NEW BASELINE 1c503346 0.846892 (SUPERSEDES 9c61a6fc 0.844320, +0.002572 composite, +0.001655 mean 0.885211->0.886866, std 0.136303->0.133245 tighter). [bull 0.970040->0.969298, crash 0.812359 BYTE-IDENTICAL, sideways 1.054920->1.054133, rally 0.703526->0.711673 BINDING +0.008147 Sh 1.261946->1.283437]. THEME: completed the {own,BTC,partner}x{vol,price} 2-way VOLUME-PARTICIPATION agreement grid at alt/BTC entry sizing. NEW data deps (cross-symbol x cross-data-type): prior cross-symbol deps used BTC/alt PRICE momentum; this session used VOLUME (6/18-bar mean ratio, deep-saturated /0.30) as the PARTICIPATION signal, conjuncted with price-trend agreement gates (/0.03 BTC, /0.02 partner). Volume (participation) proved NON-REDUNDANT (unlike saturated cross-symbol price-agreement): each of the 7 grid cells added real signal. The 7 keeps: Exp1 BTC-vol x BTC-price->alt; Exp3 partner-vol x partner-price->alt; Exp5 alt-pair-vol x BTC-price->BTC (BTC sizing read alt data for first time); Exp6 own-vol x partner-price->alt; Exp7 own-vol x BTC-price->alt; Exp8 BTC-vol x partner-price->alt (3-symbol mixed, STRONGEST +0.000744); Exp9 partner-vol x BTC-price->alt (mixed). All deep-saturated (near-constant -> noise-free, the validated safe family that escapes the continuous-price-derived-size-modulation rally-stab wall), first-bar-only, +0.05 max, bilateral (boost on agreement). KEY MECHANISM INSIGHT: cross-symbol VOLUME rising confirms broad-market participation; an alt/BTC trend entry confirmed by ANOTHER symbols volume-building (leader or follower) + price agreement is a higher-quality broad-market-trend entry -> larger first-bar commitment captures more confirmed trend (rally binding constraint Sharpe +0.0215). The mixed 3-symbol cells (Exp8 leader-VOL x follower-PRICE; Exp9 follower-VOL x leader-PRICE) were the STRONGEST (Exp8 +0.000744) - genuinely additive, NOT redundant with the existing bilateral Exp1(BTC-vol) x partner-price-boost multiplication. CONCLUSIONS: (1) the AGREEMENT/boost side of the volume-participation grid is productive across ALL 7 cells; (2) the DISAGREEMENT/shrink side is INERT (Exp2 BTC-vol disagree +0.000016 byte-identical, Exp4 partner-vol disagree +0.000001 byte-identical) - alt entries strongly opposing cross-symbol trend on rising cross-symbol volume are rare, the existing /0.06 BTC-trend + /0.02 partner-price shrinks + ct_vlong already handle counter-broad-market cases; bilateral volume-disagreement shrinks do not bind; (3) 3-WAY conjunctions (Exp10 own-vol x BTC-vol x partner-price +0.000044) drop to sub-noise - the narrow 3-way gate (all 3 deep-saturated signals ~1 = rare) fires too rarely, and 3rd-order interactions are high selection-bias risk; the complete 2-way grid is the productive ceiling of the volume-participation axis. DISCARD DETAIL: Exp2 +0.000016 and Exp4 +0.000001 passed keep gates (composite+mean positive) but were discarded on overfit-hygiene grounds (far below noise floor, byte-identical on binding constraint -> adding a data dep for no real signal); Exp10 +0.000044 similarly discarded (sub-noise + 3rd-order overfit risk). CROSS-EXPERIMENT: this session confirms cross-symbol VOLUME is the differentiated productive signal (vs saturated cross-symbol PRICE-agreement per row 304/778); the deep-saturation (/0.30 vol, /0.03-/0.02 price) + first-bar-only + bilateral-boost envelope remains the only safe family for entry-size modulation (escapes the rally-stab wall that kills continuous price-derived size modulation). rally STILL binding (0.7117, Sh 1.283) but moved +0.0082 this session (largest single-session rally gain in many sessions) via the volume-participation entry-boost axis. crash BYTE-IDENTICAL across all 10 experiments (crash alts/BTC trend entries rarely coincide with rising cross-symbol volume in the sustained downtrend + conservative /0.03 gates spare it). strategy.py at 1c503346. results.tsv append-only preserved across all rollbacks (path-scoped git checkout -- strategy.py). FUTURE: the 2-way volume-participation grid is COMPLETE; 3-way is sub-noise. Next productive axis needs a genuinely NEW data source (open is forbidden as noise-artifact; funding is zeros; OHLCV fully exploited) or a new DECISION-ARCHITECTURE change outside entry-sizing (exit-timing/admission/smoothing all walled per prior sessions). The volume axis is now 10-deep (3 prior keeps Exp3/5/6-last-session + 7 this session); further volume experiments would be incremental tuning or 3-way+ overfit.
