commit	score	mean_score	std_score	bull_2021	crash_bear	sideways	rally_2024	status	description
-	0.5710	0.6846	0.2443	0.77	0.76	0.93	0.28	discard	BRANCH SUMMARY (calm-gated EMA smoothing of fused exit pressure, 6 steps incl opening exp4, REVERTED to 5e4c5d5c 0.5711 — strategy.py byte-identical, verified composite 0.571052). Opened from exp4 (calm-churn-gated 2-bar EMA on the fused exit_pressure scalar AFTER max(sl,soft_max)+voter_bias, SL-exempt): crash +0.030 (0.757->0.787, FIRST positive per-regime signal in ~4 sessions — confirms prior crash dead-cat finding) but sideways -0.354 + bull/rally early-leak. STEP PATH (high-water = step2 composite 0.571031, a -0.000021 TIE, NOT a keep): step2 SHORT+downtrend gate (tanh(-ret_long/0.04)) -> bull +0.020 (stab 0.792->0.909 factor->1.0, stabilizes counter-trend bull pullback SHORTS), sideways/rally RECOVERED, crash BYTE-IDENTICAL (gain was NOT shorts); step3 strengthen short (/0.025,0.50) -> rally COLLAPSED 0.045 (leaked rally pullback shorts); step4 broaden to ANY+downtrend@0.40 -> rally +0.023 (0.297->0.320) but bull -0.097 (losing dip-buy longs destabilized), crash STILL byte-identical; step5 pnl-gate longs (winning-only) -> bull 0.717 rally 0.215 (pnl-gate excluded rallys LOSING dip-buys which were the ones needing smoothing); step6 short@0.45 -> bull stab 0.851 rally 0.278 (over-strength leaked); step7 side-asym short0.40/long0.20 -> rally CRUSHED 0.100 (ANY long-side smoothing destabilizes rallys losing dip-buys regardless of weight). DECISIVE CONCLUSIONS (load-bearing): (a) crash +0.030 is from UNCONDITIONAL calm-symbol smoothing (step1) = INSEPARABLE from sideways -0.354 (both calm/never-bursting; churn cannot split them, trend cannot either since crash gain survives NO directional gate -> it is the low-trend bounce bars step1 caught). (b) SHORT+downtrend smoothing = clean bull +0.020 (stab factor 0.975->1.0) but composite TIE (std widens to offset). (c) LONG-side smoothing trades bull-stab for rally-stab on the SAME mechanism (dip-buy noise vs dip-buy reversal) — NO weight or pnl-gate composes them. (d) the exit-pressure-EMA family confirmed: helps calm/counter-trend, walled for a composite keep at this baseline. Best step -0.000021 < baseline. REVERTED.
5e4c5d5c-session-summary	-	-	-	-	-	-	-	session-summary	session: 3 independent architectural discards + 1 exploration branch (exp4 + 6 steps, REVERTED). Baseline 5e4c5d5c UNCHANGED 0.5711 [bull 0.753 stab0.792 f0.975, crash 0.757 stab1.0, sideways 0.930 stab1.0, rally 0.306 raw0.418 stab0.720 f0.732 = SOLE binding constraint]. INDEPENDENT DISCARDS (all 3 = NEW mechanisms reconfirming rally-stab wall): (1) GEOMETRIC log-spaced lattice quantization (ref*exp(k*churn_dz), constant RELATIVE spacing replacing additive grid): -0.156, RALLY HARD-CUTOFF 0.306->0.000 — coarse-at-LARGE-|target| INVERTS rallys need (it DWELLS near full position, needs FINE resolution THERE); confirms additive uniform 0.06 grid is the delicate optimum. (2) SCALE-IN size ANCHOR (grow toward entry-bar size not per-bar combined_mult): -0.153, bull stab 0.792->0.904 (factor->1.0) BUT raw offsets, sideways raw -0.091 (freezes adaptive sideways_boost), RALLY COLLAPSED 0.306->0.005 — CONFIRMED FREEZE-TRAP (locks entry-bars single noise sample; live recompute AVERAGES OUT noise). (3) 3-bar MEDIAN resize filter (rank-statistic value smoothing): -0.525 CATASTROPHIC all regimes MaxDD->4.4pct — post-filter feedback LATCHES the de-risk path (median([100,100,50])=100 suppresses de-risk) + noise-immune smoothing kills raw (rally stab 1.000 but sharpe<0). BRANCH (calm-gated exit-pressure EMA): crash +0.030 FIRST positive signal in ~4 sessions; step2 SHORT+downtrend gate = clean bull +0.020 (stab factor 0.975->1.0) but composite -0.000021 TIE; all broaden/strengthen/asym variants regressed. CENTRAL CROSS-EXPERIMENT MECHANISM (load-bearing): exit-pressure-EMA helps calm + counter-trend SHORTS (bull) but (a) crash gain INSEPARABLE from sideways loss (both calm, unconditional smoothing), (b) LONG-side smoothing trades bull-stab vs rally-stab on the same dip-buy mechanism with NO composition, (c) SHORT-side clean bull +0.020 but std-offset -> TIE. VALUE-SMOOTHING family (low-pass row450 / freeze exp2 / median exp3 / EMA exp4) all confirmed WALLED for rally: noise-immune smoothing achieves rally stab 1.0 but ALWAYS at raw<0. Baseline 5e4c5d5c 0.5711 UNCHANGED.
-	0.4185	0.5952	0.3533	0.75	0.70	0.92	0.00	discard	smoothstep S-curve scale-in trajectory replaces linear ramp (architectural). RALLY COLLAPSED 0.306->0.000 (stab 0.720->0.450 factor->0.000, >50pct gate fail). MECHANISM: smoothstep e^2(3-2e) flattens endpoints but STEEPENS middle (deriv 1.5x linear at progress=0.5); rallys active scale-in bars sit in mid-region so steeper middle ADDED position-value dispersion exactly where rally is noise-sensitive. Linear ramp is load-bearing. No regime improved -> not branch-eligible.
-	0.4930	0.5893	0.1925	0.69	0.79	0.60	0.28	discard	soft-argmax temperature-softmax pooling (T=0.20) replaces hard max in exit fusion (architectural). RECONFIRMS crash<->sideways smoothing wall: crash +0.032 (0.757->0.789 GENUINE) but sideways -0.327 (0.930->0.603 raw, factor=1.0) + rally DOWN 0.306->0.276 (binding constraint UNHELPED). MECHANISM: convex softmax pool <= max -> LOWERS exit pressure -> crash shorts run longer (good) but sideways late-exits give back (bad). Same inseparable signature prior sessions found walled (NO churn/trend/pnl composition). Not branch-worthy: rally unhelped so fixing sideways alone cannot keep.
-	0.4427	0.6198	0.3543	0.77	0.76	0.93	0.02	discard	high-churn-gated ENTRY-target quantization (architectural). RALLY COLLAPSED 0.306->0.017 (stab 0.720->0.513 factor->0.042, >50pct gate fail) via documented ROUND-BOUNDARY-FLIP wall: one-shot entry from zero has lattice boundaries the entry value sits randomly against -> AR(1) noise flips it across nearest boundary (full grid-step divergence seeds whole hold). UNLIKE resizes which snap toward current_pos (bounded) + converge to a lattice point over repeats (hysteresis-like). FINDING: bull IMPROVED +0.022 (stab 0.792->0.852 factor 0.975->1.0, raw flat) — entry-quant helps bull stability — but INSEPARABLE from rally collapse (both burst, churn cannot split bull from rally; cumulative-max puts both on same side). Not branch-worthy.
-	0.4852	0.6426	0.3148	0.77	0.76	0.93	0.11	discard	trend-aligned stop-loss widening up to 1.3x (architectural). RAW BYTE-IDENTICAL to baseline (0.626170, every regime raw_score identical) = ZERO clean-path exit change; PURE STABILITY REDISTRIBUTION: bull stab 0.792->0.880 factor 0.975->1.0 (+0.020) but RALLY stab 0.720->0.579 factor->0.263 score->0.110 (>50pct gate fail). ROOT MECHANISM DISCOVERED (load-bearing): the entry-anchored STOP acts as a noise-REDUCING clamp in rally — rallys NON-stop exits (slope/pp/time) are noise-sensitive, so widening removes the clean clamp and exposes positions to MORE noisy-exit divergence. Bulls non-stop exits are stable so removing perturbed early-stops helps tracking. IMPLICATION: rally stab is helped by MORE noise-immune ENTRY-ANCHORED exits, not fewer.
-	0.3131	0.4525	0.2789	0.49	0.76	0.56	0.00	discard	entry-anchored take-profit pressure 7th soft term K=2.2 (architectural). HYPOTHESIS DISPROVEN: rally->0.000 (stab 0.481 factor 0), bull stab collapsed 0.792->0.690, sideways raw 0.930->0.563 (sharpe 1.71->1.04 capped winners = lost alpha), crash byte-identical (never reaches +2.2*stop). ERROR: assumed entry-anchored level = discrete exit timing, but SOFT BAND + graduated de-risk path converts it to CONTINUOUS position-value modulation = the walled price-derived-size-modulation failure mode. The STOP is noise-immune ONLY because it saturates BINARY (full exit >=0.95) on a LOSS cut; a soft graduated profit-side term is structurally different and noise-SENSITIVE. CONCLUSION: entry-anchoring alone is insufficient for noise-immunity — the exit must ALSO be binary/saturating, but a binary profit ceiling removes rallys rare big-runner alpha (raw floor). Take-profit family is on the stability<->raw wall.
5e4c5d5c-session-summary	-	-	-	-	-	-	-	session-summary	session: 5 independent architectural discards (EXIT RULE triggered), 0 branches opened. Baseline 5e4c5d5c UNCHANGED 0.5711 [bull 0.753 raw0.773 stab0.792 f0.975, crash 0.757 stab0.945 f1.0, sideways 0.930 stab0.918 f1.0, rally 0.306 raw0.418 STAB0.720 f0.732 = SOLE binding constraint]. THEME: attack rally binding constraint via untried axes, then pivot to rally RAW after stability axes walled. DISCARDS: (1) SMOOTHSTEP scale-in S-curve replacing linear ramp: rally->0.000 (stab 0.720->0.450) — smoothstep flattens ENDPOINTS but STEEPENS middle (deriv 1.5x linear at progress=0.5); rallys active scale-in bars sit mid-region so steeper middle ADDED position-value dispersion. LINEAR scale-in ramp is LOAD-BEARING. (2) SOFTMAX exit-fusion pooling (T=0.20 convex pool replacing hard max): RECONFIRMS crash<->sideways smoothing wall — crash +0.032 GENUINE but sideways -0.327 + rally DOWN (unhelped); convex pool<=max LOWERS exit pressure (crash shorts run, sideways late-exits give back); same inseparable signature last session 6-step-branch-reverted. (3) ENTRY-target quantization (extend grid family to entry first-bar value): rally->0.017 via ROUND-BOUNDARY-FLIP wall (one-shot entry from zero sits randomly vs lattice, AR(1) flips it full-grid-step; UNLIKE resizes which snap toward current_pos=bounded). FINDING: bull +0.022 (factor 0.975->1.0) but INSEPARABLE from rally (both burst, cumulative-max churn cannot split bull max=6 from rally max=5). (4) TREND-ALIGNED stop widening 1.3x: RAW BYTE-IDENTICAL (0.626170 all regimes) = ZERO clean exits changed, PURE stab redistribution bull+0.020 / rally collapse 0.720->0.579. ROOT DISCOVERY (load-bearing): entry-anchored STOP is rallys ONLY noise-immune exit; rallys NON-stop exits (slope/pp/time/ve) are path/peak-dependent + noise-sensitive; widening stop REMOVES the clean clamp -> exposes MORE noisy-exit divergence. (5) ENTRY-ANCHORED take-profit pressure (symmetric to _sl_pressure, K=2.2*stop): hypothesis from exp4 DISPROVEN — rally->0.000, bull stab->0.690, sideways sharpe 1.71->1.04 (capped alpha). ERROR: SOFT BAND + graduated de-risk converts entry-anchored level into CONTINUOUS value modulation (walled family); stop is noise-immune ONLY because it saturates BINARY on loss cut, but a binary profit ceiling removes rallys rare big-runner alpha. CENTRAL CROSS-EXPERIMENT INSIGHTS (load-bearing for future sessions): (a) BULL-RALLY COUPLING: bull factor-0.975 residual penalty is capturable in ISOLATION (3 mechanisms did it: entry-quant exp3, stop-widen exp4, both factor->1.0) but ALWAYS inseparable from rally collapse — they share the burst/entry-cluster mechanism, and the cumulative-max churn gate (the only rally-sparing gate) puts BOTH on the same partition (bull max-len=6, rally max=5 both >=3). Capturing bulls +0.020 requires a NON-churn separator not yet found. (b) RALLY EXIT NOISE-IMMUNITY requires BOTH entry-anchoring AND binary saturation — entry-anchoring alone (soft TP exp5) is noise-sensitive; the stop works because it does both, but binary profit ceilings kill big-runner alpha (raw floor). (c) rally NON-stop profit exits (pp-giveback/slope/time/ve) are the stability ceiling but cannot be made noise-immune without removing alpha = the deep wall. (d) RECONFIRMED walls: value-smoothing (smoothstep middle / softmax pool), entry quantization (round-boundary-flip), stop-level modulation (clamp removal), soft take-profit (value modulation). Baseline 5e4c5d5c 0.5711 UNCHANGED.
-	0.4874	0.6438	0.3128	0.77	0.76	0.93	0.11	discard	ARCHITECTURAL churn-deepened conviction floor on marginal-entry fade (floor 0.70->0.50 as integer churn rises). RALLY COLLAPSED 0.306->0.115 (stab_factor 0.732->0.275), raw BYTE-IDENTICAL 0.41798. Mechanism backfired: deepening floor steepened margin ramp slope (0.75->1.25/unit), amplifying entry-size sensitivity to noise-derived _margin in rally bursts -> larger position divergence under AR(1). Bull stab incidentally 0.975->1.0 (+0.02). RECONFIRMS margin-keyed size-sensitivity amplification = rally wall.
-	0.4047	0.5772	0.3451	0.65	0.76	0.90	0.00	discard	ARCHITECTURAL churn-gated sizing-INPUT 3-bar MEAN smoother (avg out AR(1) in size channel, blended by integer churn). RALLY HARD-CUTOFF 0.306->0.000 (raw AND stab ->0). Bull stab 0.975->0.861, sideways raw -0.028. RECONFIRMS position-value smoothing wall EXTENDS to sizing-INPUT: rolling-mean lags size during rally equity-compounding grind-up -> systematic position-path mismatch vs perturbed run. Mean is order-1 linear (no rank latch like median) but still introduces path lag = same wall.
306f500e	0.5364	0.6592	0.2457	0.69	0.76	0.93	0.26	discard	ARCHITECTURAL churn-gated FLATTENING of conv-margin entry-size coupling (DANGLING from interrupted prior session, now backtested+recorded for durability). RAW BYTE-IDENTICAL (bull raw 0.773085, rally raw 0.417970 == baseline 5e4c5d5c) = pure stability change. Flattening margin->size coupling in high churn HURT stability: bull stab 0.792->0.767 (score 0.753->0.688), rally stab 0.720->0.688 (0.306->0.262), composite 0.5711->0.5364. CONCLUSION: conv-margin->size coupling is LOAD-BEARING for bull+rally stability — BOTH steepening (prior exp1) AND flattening collapse rally. Local optimum, do not retune.
593764dc	0.4342	0.6149	0.3615	0.77	0.76	0.93	0.00	branch	BRANCH OPEN: ARCHITECTURAL entry-size MIN-fusion subsystem redesign (replace product of 4 price-derived quality attenuators ct/consensus/quality/conv with min()). BULL 0.753->0.772 stab 0.792->1.0 (noise-reduction VALIDATED: min applies fewer compounded noise channels, min>=product), crash/sideways FLAT. RALLY 0.306->0.000: sharpe 0.732~=baseline 0.733 (raw alpha INTACT) but stab 0.720->0.476 — hard min introduces argmin-switch boundary that flips under noise in near-tied bidirectional rally entries. FIX HYPOTHESIS (step2): churn-gate the fusion (min for calm/low-churn=bull/crash/sideways, product for bursty/high-churn=rally) per proven grid keep-family pattern -> capture bull gain, spare rally.
4e_T030	0.4543	0.6215	0.3345	0.77	0.75	0.91	0.05	branch	branch step 4: raise soft-min T 0.15->0.30. WORSE: rally 0.181->0.052 (stab 0.630->0.537). Higher T -> soft-min toward MEAN -> all 4 noise channels re-contribute (toward product compounding). Confirms LOWER T (emphasize single binding discount) is the right direction. Step3 T=0.15 (0.515) remains branch best.
5e_1sided	0.4312	0.6100	0.3576	0.77	0.75	0.91	0.00	branch	branch step 5: add one-sidedness gate (opp/own ratio) to fusion. WORSE: rally 0.181->0.000. The opp_ratio gate is a NOISY price-derived quantity with its steep transition at ratio~0.5 = EXACTLY rally near-tied entries operating point -> noisy-quantity-gating mistake (documented). Confirms gating fusion on continuous price quantity at rally op-point is walled. Step3 (T=0.15 churn-only, 0.515) remains branch best.
6e_AST	0.4311	0.6100	0.3576	0.77	0.75	0.91	0.00	branch	branch step 6: CRITICAL DIAGNOSIS — step-3 logic re-expressed with inlined sum() (functionally identical) gave rally 0.181->0.000 / composite 0.515->0.431. CAUSE: noise_test seeds from AST hash of strategy.py; trivial AST change -> different seed -> rally flipped sides of the noise cliff. CONCLUSION: this entry-fusion mechanisms rally stability is SEED-FRAGILE (0.181 vs 0.000 is a coin-flip near cliff), not robust. Exact step3 commit 572b008d reproduces 0.515/0.181 deterministically, but that number is partly seed-luck and STILL 0.056 below baseline.
-	0.5711	0.6866	0.2312	0.75	0.76	0.93	0.31	discard	BRANCH SUMMARY (entry-size MIN/soft-min fusion subsystem redesign, 6 steps, REVERTED to 5e4c5d5c 0.5711 — strategy.py byte-identical, composite re-verified 0.5711). OPENED from entry-size MIN-fusion (replace product of 4 price-derived quality attenuators ct/consensus/quality/conv with min): BULL 0.753->0.772 stab 0.792->1.0 (noise-reduction VALIDATED, min<=product fewer compounded channels), crash/sideways flat, RALLY 0.306->0.000 (raw 0.418 INTACT, stab->0.476: hard min argmin-switch boundary flips at near-tied bidirectional rally entries). Step2 churn-gate min/product: rally 0.000->0.060. Step3 SOFT-min T=0.15 (differentiable, no argmin boundary): rally 0.060->0.181 composite 0.515 (branch best, still <baseline). Step4 T=0.30: WORSE (toward mean = all 4 noise channels re-contribute). Step5 one-sidedness gate (opp/own ratio): rally->0.000 (gating on noisy price ratio at rally op-point = walled). Step6 CRITICAL: step-3 logic with inlined sum() (functionally identical) gave rally 0.181->0.000 — noise_test seeds from strategy.py AST hash, trivial change flips rally across noise cliff. CONCLUSION: bull noise-reduction via entry-size fusion is REAL+robust (+0.018 stab->1.0) but INSEPARABLE from rally collapse (same near-tied bidirectional entries the fusion boundary destabilizes); rally stability for this mechanism is SEED-FRAGILE near the cliff. Entry-size combination function is on the same rally stability<->bull wall.
5e4c5d5c-session-summary	-	-	-	-	-	-	-	session-summary	session: 1 dangling-experiment discard (recorded+reverted for durability) + 1 independent architectural experiment (= branch open) + 1 exploration branch (6 steps, REVERTED). Baseline 5e4c5d5c UNCHANGED 0.5711 [bull 0.753 raw0.773 stab0.792 f0.975, crash 0.757 stab0.945 f1.0, sideways 0.930 stab0.918 f1.0, rally 0.306 raw0.418 STAB0.720 f0.732 = SOLE binding constraint]. DANGLING: interrupted prior session left 306f500e (conv-margin churn-flattening) committed but unrecorded -> backtested 0.5364 (bull+rally stab regression, raw byte-identical), recorded discard, reverted. THEME: entry-size FUSION subsystem redesign (component-saturation rule -> redesign the entry-size combination function, not individual attenuators). BRANCH (entry-size MIN/soft-min fusion replacing product of 4 price-derived quality attenuators): NEW CONCLUSIONS — (a) bull stability IS improvable via entry-size fusion: MIN/soft-min cuts compounded entry-size noise channels, bull 0.753->0.772 stab 0.792->1.0 GENUINE+robust (+0.018). (b) but rally COLLAPSES (0.306->0.000-0.181) because the fusion combination boundary (hard min argmin-switch, OR soft-min value shift, OR any gate on price-derived quantity) destabilizes rally near-tied bidirectional entries — SAME inseparable rally-stability wall as reversal/directional-sizing/quantization. (c) soft-min (differentiable, T=0.15) beats hard-min and beats high-T (high T -> mean -> re-compounds all noise); churn-gating helps but rally lone-entry leak persists. (d) NEW METHODOLOGY INSIGHT: rally stability for marginal entry-size mechanisms is SEED-FRAGILE — noise_test seeds from strategy.py AST hash, so a functionally-identical edit (inlined sum) flipped rally 0.181<->0.000 across the noise cliff; near-cliff rally numbers are partly seed-luck, not robust signal. (e) bull/crash/sideways raw EXACTLY FLAT under entry-size fusion (confirms again their raw is entry-SATURATED). FUTURE: entry-size combination function joins the confirmed rally-wall list; bull stab headroom (0.792->1.0) is real but cannot be captured without a rally-safe separator, which price-derived gates cannot provide at rally op-point. Pivot away from entry-size; the only baseline-moving keeps remain order-emission position-VALUE quantization (grids).
-	0.4340	0.5998	0.3317	0.65	0.77	0.93	0.05	discard	ARCHITECTURAL multi-day(96bar) counter-trend ADMISSION tightening (ret_vlong layered on bear/bull strong_min). DIAGNOSIS: rally has 50% short entries(6/12) in grinding uptrend = the rally killer (WR66% vs 86-100%, 7 consec losses). Filtering preserved rally RAW (0.418->0.421) but rally STABILITY collapsed 0.720->0.536 (factor 0.732->0.122): admission threshold creates noise-sensitive pass/fail boundary at ret_vlong=0 in rally chop stretches. Bull raw also dropped 0.773->0.653 (shorts removed were +sharpe hedges). MECH lesson: counter-trend insight sound but ADMISSION is wrong vehicle -> route via continuous SIZE attenuation next.
188dd305	0.4765	0.6278	0.3253	0.78	0.76	0.94	0.09	branch	BRANCH OPEN: ARCHITECTURAL multi-day(96bar) counter-trend SIZE attenuator (_bull_ct_vlong/_bear_ct_vlong on first-bar size, continuous no-boundary). bull +0.023 (raw 0.773->0.776 AND stab 0.792->0.843), sideways +0.005, crash flat, RALLY -0.217 (raw 0.419 PRESERVED, stab 0.720->0.563). JUSTIFY: (1)new mechanism shrinks multi-day counter-trend entries; (2)rally regressed bc ret_vlong=(closes[-1]-closes[-96])/closes[-96] uses 2 SINGLE noisy endpoints -> position sizes wobble under AR(1) -> rally(50% ct entries)transmits most noise; (3)FIX next: compute multi-day trend via OLS slope over full 96-bar window (averages out per-bar noise) -> sizes stop wobbling -> rally stab recovers, keep bull gain.
dd64466c	0.4838	0.6253	0.3173	0.78	0.76	0.93	0.11	branch	branch step 2: OLS-slope 96-bar multi-day trend (noise-averaged vs 2-endpoint). rally stab 0.563->0.576, bull held 0.776. progress.
676f831a	0.5310	0.6269	0.2734	0.77	0.76	0.93	0.21	branch	branch step 3: LOW-CHURN per-bar gate (_calm_ct) on ct-shrink. comp 0.484->0.531, rally 0.105->0.209 stab 0.576->0.650. bull +0.021. BEST so far. residual: rally stab still <baseline 0.720.
0e11bbc0	0.5214	0.6274	0.2822	0.77	0.76	0.93	0.19	branch	branch step 4: cumulative-max hard churn gate (_cm<=2). WORSE than step3 (rally 0.188<0.209): hard cliff at _cm 2->3 lands on perturbation-dependent burst bar. learning: smooth>hard for rally.
fb89d15b	0.4349	0.4349	0.3618	0.78	0.76	0.93	0.00	branch	branch step 5: tighten scale 0.06->0.03. rally COLLAPSED to 0 (stab 0.480): tightening made MORE bars noise-sensitive at small ret_vlong. wrong direction.
ddc735ba	0.4609	0.6269	0.3376	0.77	0.76	0.93	0.06	branch	branch step 6: AND per-bar + hard cumulative gates. rally 0.057: hard cumulative cliff noise-sensitive. confirms smooth>hard.
