commit	score	mean_score	std_score	bull_2021	crash_bear	sideways	rally_2024	status	description
-	-	-	-	-	-	-	-	-	session-summary	SESSION (baseline 5cc01688 0.689311 -> UNCHANGED, no keep): 3 independent ARCHITECTURAL experiments (Exp1-3) + 1 exploration branch (vol-gated tp_harvest magnitude, 8 steps, REVERTED). Baseline 5cc01688 re-verified byte-identical at session start (composite 0.689311 mean 0.754748 std 0.218125, all stab 1.0 raw==score, min_stab 0.844713) [bull 0.961878 Sh1.9995 DD3.09pct 52t, crash 0.729861 Sh1.271 DD2.46pct 55t 100pctWR, sideways 1.011417 Sh2.017 DD2.21pct, rally 0.662116 Sh1.530 DD5.17pct, mixed 0.408468 Sh0.802 DD2.80pct 43t 100pctWR] AND post-branch-revert (strategy.py 0-diff to keep). EXIT RULE: branch reverted -> session ends. >=2 architectural discards MET (Exp1, Exp2, Exp3-opening all architectural). results.tsv append-only preserved throughout (path-scoped git checkout -- strategy.py for every discard/revert, never git revert). THEME: targeted the binding regime mixed_2025 (Sh0.80, 100pctWR, 0.10pct/trade). KEY DIAGNOSTIC (this session, verifiable): mixed_2025 holds ~3 LONG-lived positions (only 3 fresh opens, 54 modifies, 43 realized-PnL events = partial-realizes) -- positions reach LARGE unrealized peaks (peak/|stop| quartiles 5.6/13.3/16.4, i.e. peak_pnl 13-39pct of price) but REALIZE only 4.4pct (100pctWR) -- positions ride to +30pct, give back to ~+24pct (22pct giveback tolerance), partially realize small pieces, ride again (turnover 856912 from constant resizing). The low Sharpe is intrinsic: the position MTM oscillates over the long hold (return_vol 5.54pct annualized) relative to the 4.4pct net. CROSS-EXPERIMENT CONCLUSIONS (all MEASURED this session, verifiable): (1) GIVEBACK/PP PATH NON-BINDING ON MIXED: Exp1 small-peak giveback attenuation BYTE-IDENTICAL -- mixed positions exit via slope-against/time/opp-gate before pp giveback activates (reconfirms the documented giveback wall on mixed). (2) SLOPE-AGAINST PATH NON-BINDING ON MIXED: Exp2 small-peak winner slope-against threshold relaxation BYTE-IDENTICAL -- the small-peak (peak/|stop|<0.5) condition never fires because mixed peaks are LARGE (5-16x stop), and slope-against at 0.0003 rarely binds in mixed grind (mixed exits via time/opp-gate). Extends the exit-fusion wall: BOTH giveback AND slope-against are non-binding for mixed. (3) TP_HARVEST IS BINDING FOR MIXED (the one productive exit lever found): Exp3 raising tp_harvest magnitude 0.30->0.50 moved mixed +0.0023 Sharpe (0.802->0.807) -- the FIRST lever this session to move mixed. BUT over-harvested bull (-0.647: _ts_supp did NOT protect bull trend winners at higher magnitude -- bull tp-harvested positions have _ts_supp<0.5, moderate peaks not deep enough to saturate _ts_supps deep-peak factor). (4) VOL_RATIO IS THE BULL/MIXED SEPARATOR (diagnostic: bull vol_ratio 0.54/0.72/0.96 HIGH vs mixed 0.32/0.45/0.61 LOW -- nearly disjoint; crash 0.40/0.54/0.73, rally 0.35/0.46/0.62, sideways 0.25/0.38/0.55 OVERLAP mixed 0.40-0.61). Branch step3 (gate tp_mag on vol_ratio, 0.50 at low vol / 0.30 at high vol) cleanly separated bull -> bull recovered + ABOVE baseline (0.970, +0.0085) AND mixed gained (+0.0025) AND rally gained (+0.0043): composite +0.0021. (5) MAGNITUDE CEILING = 0.58-0.62 (CRASH WALL at 0.65): step4 (0.65) crashed crash stability 1.0->0.225 (crash RECOVERY phases are low-vol too, over-harvested); step6 (0.58) and step7 (0.62) crash-safe but composite plateaus ~0.6918 (+0.0025). (6) THRESHOLD CEILING = 1.6 (CRASH-STABILITY WALL at 1.45): step5 (threshold 1.45) moved mixed strongly (+0.0185 Sharpe 0.808->0.836!) but crashed crash stability 1.0->0.206 (lower threshold -> more harvest events -> noise-sensitive -> stab collapse; mixed/crash overlap on vol_ratio 0.40-0.61 cannot separate). The activation THRESHOLD is stability-sensitive; MAGNITUDE is not. (7) BRANCH CEILING +0.002573 (step6, magnitude 0.58, gate center 0.75) -- BELOW the +0.003 keep threshold -> sub-noise discard. mixed plateaus at +0.0025 Sharpe gain; bull/rally low-vol gains saturate; gate center 0.70 regresses bull (over-harvests bull moderate-vol bars 0.70-0.75). NO CRASH-SAFE PATH TO +0.003 via tp_harvest. SATURATION RECONFIRMED: the tp_harvest magnitude/threshold levers are walled by crash-overlap (mixed and crash share the low-vol regime 0.40-0.61; only bull is cleanly separable by high vol). The mixed-vs-crash low-vol overlap is the binding structural wall on the tp_harvest subsystem. NEW BASELINE 5cc01688 0.689311 UNCHANGED. KEY FOR FUTURE SESSIONS: (a) tp_harvest IS the one binding exit lever for mixed (unlike giveback/slope which are byte-identical inert); (b) vol_ratio cleanly separates ONLY bull from the crash/rally/sideways/mixed cluster -- a mixed-vs-crash separator does NOT exist on vol_ratio (they overlap 0.40-0.61); (c) the tp_harvest magnitude ceiling is 0.58-0.62 (crash wall 0.65) and threshold ceiling is 1.6 (crash-stability wall 1.45); (d) mixed peaks are LARGE (5-16x stop), not small -- the small-peak gating axis (Exp1/Exp2) is structurally inert on mixed; (e) mixed holds ~3 long-lived positions with constant partial-realize churn -- the low Sharpe is intrinsic MTM oscillation over long holds, not early exit.
b7798fe8	0.599668	0.663864	0.213987	0.519394	0.725542	1.035273	0.630643	0.408468	discard	Exp1 (architectural, indep): TREND-ALIGNMENT-gated giveback amplification (was direction-agnostic abs(ret_long) STRENGTH). Switched _pm_trend_atten gate from abs(ret_long) trend-magnitude to ret_vlong*pos_dir multi-day ALIGNMENT so counter-trend/chop winners (mixed longs in downtrend) get FULL amplification (tighter trailing) while trend-aligned winners stay protected. MEASURED vs 5cc01688 0.689311: composite 0.599668 (-0.0896), mean 0.663864 (-0.0909). PER-REGIME: bull 0.961878->0.519394 (-0.443, 46pct drop BREACHES 50pct gate floor 0.481), crash 0.729861->0.725542 (-0.004), sideways 1.011417->1.035273 (+0.024), rally 0.662116->0.630643 (-0.032), mixed BYTE-IDENTICAL 0.408468 (target MISSED). All stab 1.0 raw==score. FAILURE MECH (architectural fact): mixed BYTE-IDENTICAL reconfirms the giveback-amplification path is NON-BINDING for mixed (mixed exits via slope-against/time/opp-gate before pp giveback activates -- the documented giveback wall, extends prior sessions small-peak giveback attenuation finding to the amplification axis). bull CATASTROPHIC: switching from abs(ret_long) strength (which protected bull via its high |ret_long|) to ret_vlong*pos_dir alignment removed protection because bull-2021s multi-day (96-bar) ret_vlong is less saturated than rallys grinding uptrend -> _pm_align did not saturate -> bull winners got full amplification -> premature trailing. CONCLUSION: the giveback amplification gate CANNOT reach mixed (same giveback wall); ret_vlong alignment is the WRONG separator for the giveback gate (bull needs magnitude-based protection not alignment-based). Reverted.
8f0ecc8d	0.665460	0.724481	0.196734	0.810541	0.729861	1.011417	0.662116	0.408468	discard	Exp2 (architectural, indep): MAE-CLEANLINESS-gated tp_harvest magnitude amplification. Amplified tp_harvest magnitude up to 1.5x for LARGE-MAE (whipsaw/oscillating) peaks, baseline 1.0x for clean-MAE. Hypothesis: MAE is the orthogonal separator vol_ratio lacked (mixed whipsaws large MAE, crash trends cleanly small MAE). MEASURED vs 5cc01688 0.689311: composite 0.665460 (-0.0239), mean 0.724481 (-0.0303). PER-REGIME: bull 0.961878->0.810541 (-0.151 large-MAE over-harvest -- bull-2021 sharp uptrend pullbacks give LARGE adverse excursion, so the amplification fired on bull not mixed), crash BYTE-IDENTICAL 0.729861 (small MAE clean trend, amp ~1.0 as predicted), sideways BYTE-IDENTICAL, rally BYTE-IDENTICAL, mixed BYTE-IDENTICAL 0.408468 (target MISSED). All stab 1.0. FAILURE MECH (architectural fact): (1) mixed BYTE-IDENTICAL -- either tp_harvest does not fire for mixed (peak<1.6*_pp_min OR _tp_trend_gate~0 since mixed is low-|ret_long| chop) OR mixed MAE is NOT large; the amplification never binds on mixed. (2) MAE does NOT cleanly separate mixed from bull -- bull-2021 (high-vol sharp uptrend) has LARGE pullback MAE, so a large-MAE-gated amp over-harvests bull trend winners (-0.151, same bull-over-harvest wall as the prior tp_mag branch at magnitude 0.65). CONCLUSION: MAE is NOT the mixed/crash separator (bull shares mixeds large-MAE regime); and the tp_harvest block appears non-binding for mixed under this gate (mixed byte-identical despite amp). The mixed/crash/mixed/bull overlap on MAE reconfirms the structural wall: any single-quantity separator that amplifies harvest for mixed also amplifies for bull (large MAE) or crash (clean trend). Reverted.
242b4a9e	0.689311	0.754748	0.218125	0.961878	0.729861	1.011417	0.662116	0.408468	discard	Exp3 (architectural, indep): MAE-GATED tp_harvest magnitude with GRID-CLEARING amplification (2.5x amp for whipsaw/mixed, 1.0x for clean/crash, 0.70 safety cap). Built on this-session DIAGNOSTIC: mixed tp_harvest DOES fire (tp_scale mean 0.109, n=1.1M, tp_ratio mean 16.47 deep peaks) and MAE/stop cleanly separates mixed (mean 13.5) from crash (mean 1.8) -- disjoint, unlike vol_ratio. Exp2 1.5x amp was byte-identical -> hypothesized grid-absorption (0.9 grid steps). MEASURED vs 5cc01688 0.689311: composite BYTE-IDENTICAL 0.689311, ALL 5 regimes BYTE-IDENTICAL (every Sharpe identical: bull 1.999504, crash 1.270529, sideways 2.017203, rally 1.530283, mixed 0.802336). All stab 1.0. FAILURE MECH (architectural fact): 2.5x amp -> mixed tp_scale 0.109->0.275 (target 0.891x->0.725x, a 0.166 position delta) STILL emitted byte-identical. Root cause: mixed positions are SMALL relative to the grid step (0.06*equity*BASE_POSITION_SIZE = 0.0156*equity) -- a 16.6pct harvest of a small position is <1 grid step -> snaps to the same quantized lattice point -> emitted target unchanged. The grid quantization (the load-bearing stability lever) ABSORBS the ENTIRE tp_harvest signal for small-position regimes. CONCLUSION: the tp_harvest PATH is STRUCTURALLY WALLED for mixed by the grid-vs-position-size ratio -- NO magnitude change can reach mixed (even 2.5x is sub-grid). The prior session +0.0025 at magnitude 0.50 was a single grid-crossing edge case, not a tunable lever. To reach mixed's intrinsic MTM-oscillation low-Sharpe, the tp_harvest would need to be EXEMPT from the grid (risky -- grid is load-bearing for rally stability) OR a different exit path used. Reverts the tp_harvest-magnitude axis entirely; mixed requires a non-grid-absorbed exit lever.
a481f7bc	0.695846	0.763847	0.226671	0.975641	0.730948	1.037956	0.666222	0.408468	keep	Exp4 architectural KEEP: MULTI-DAY ret_vlong trend-align factor in _ts_supp (was 20-bar ret_long*pos_dir). _ts_supp (the 22-step-branch-keep trend-extension harvest suppression) gates tp_harvest suppression by MAE-clean x trend-align x deep-peak. The trend-align factor used 20-bar ret_long*pos_dir; switching to 96-bar ret_vlong*pos_dir keys suppression to the MULTI-DAY trend (the scale that distinguishes a genuine trend extension from a counter-trend bounce). MEASURED vs 5cc01688 0.689311: composite 0.695846 (+0.006535, clears +0.003), mean 0.763847 (+0.009099), std 0.226671 (+0.0085). PER-REGIME: bull 0.961878->0.975641 (+0.0138 Sh1.9995->2.0120), crash 0.729861->0.730948 (+0.0011 Sh1.2705->1.2726), sideways 1.011417->1.037956 (+0.0265 Sh2.0172->2.0413), rally 0.662116->0.666222 (+0.0041 Sh1.5303->1.5421), mixed BYTE-IDENTICAL 0.408468 (Sh0.802336 unchanged). All stab 1.0 raw==score, min_stab 0.844713 unchanged. max_dd all <5.2pct (bull 2.96, crash 2.46, sideways 2.00, rally 5.17, mixed 2.80). MECHANISM (measured): trend-aligned regimes (bull/crash/sideways/rally) improved because the 20-bar factor FAILED to protect trend winners during 20-bar pullbacks -- it treated pullback bars as counter-trend (ret_long*pos_dir<0) -> _ts_supp->0 -> harvest fired -> cut trend winners during normal pullbacks. The 96-bar ret_vlong sees THROUGH 20-bar pullbacks (multi-day trend intact) -> _ts_supp stays high -> harvest suppressed -> trend winners ride the pullback -> higher Sharpe (+0.0138/+0.0265/+0.0041/+0.0011). mixed BYTE-IDENTICAL: mixed's reachable tp_harvest events already had trend-align factor ~0 (already unsuppressed), so switching ret_long->ret_vlong did not change mixed's harvest -- mixed remains the binding floor (0.408). NEW BASELINE a481f7bc 0.695846. NOTE: ret_vlong is the validated multi-day trend; the prior 20-bar ret_long factor was a scale-mismatch (too short to distinguish trend extension from counter-trend bounce) -- a general principle fix, not regime-targeted.
99a369a1	0.706007	0.778803	0.242655	1.025954	0.720320	1.066580	0.670171	0.410990	keep	Exp5 architectural KEEP: raise tp_harvest base magnitude 0.30->0.45. Built on Exp4 KEEP (multi-day ret_vlong _ts_supp trend-align factor) which unblocked the prior session crash-wall: the prior tp_mag branch walled at 0.50 because the OLD 20-bar ret_long _ts_supp mis-classified crash recovery shorts as counter-trend (product<0 -> no suppression -> over-harvested crash winners -> stability collapse 1.0->0.225). With Exp4's multi-day ret_vlong factor, crash shorts in a multi-day downtrend (ret_vlong<0, pos_dir=-1 -> product>0) are correctly trend-aligned -> _ts_supp HIGH -> harvest SUPPRESSED -> crash shielded at the magnitude raise. MEASURED vs a481f7bc 0.695846: composite 0.706007 (+0.010161), mean 0.778803 (+0.014956), std 0.242655 (+0.0160). PER-REGIME: bull 0.975641->1.025954 (+0.0503 Sh2.0120->2.0678), crash 0.730948->0.720320 (-0.0106 Sh1.2726->1.2539, -1.5pct well above 50pct floor), sideways 1.037956->1.066580 (+0.0286 Sh2.0413->2.0270), rally 0.666222->0.670171 (+0.0040 Sh1.5421->1.5529), mixed 0.408468->0.410990 (+0.0025 Sh0.802336->0.807528 -- FINALLY moved, the +0.0025 gain the prior branch found but could not keep). All stab 1.0 raw==score, min_stab 0.844331. max_dd all <5.2pct (bull 2.49, crash 2.46, sideways 1.88, rally 5.16, mixed 2.78). MECHANISM (measured): the magnitude raise deepened per-fire harvest (0.30->0.45 = +50pct). mixed's deep peaks (tp_ratio 16.47, MAE-clean, _ts_supp~0 = fully unsuppressed) get +50pct more paper->realized conversion per re-peak -> smaller remaining position -> less giveback on next oscillation -> lower MTM oscillation -> +0.0025 mixed Sharpe (the binding-floor lever finally reached). bull/sideways/rally trend winners (deep clean peaks, _ts_supp high via ret_vlong) ALSO benefited: deeper harvest at their deep peaks locked more realized gain -> +0.050/+0.029/+0.004. crash -0.0106: the magnitude raise touched crash recovery shorts slightly (the _ts_supp shield is not perfect at all bars -- some crash bars have ret_vlong weak -> partial suppression -> partial harvest amplification) but the net is strongly positive. NEW BASELINE 99a369a1 0.706007. NOTE: the Exp4+Exp5 combination (multi-day _ts_supp + raised magnitude) is the path the prior session's tp_mag branch could not reach (walled at 0.50 by the 20-bar _ts_supp mis-classification); the structural fix (Exp4) unblocked the magnitude lever.
7f32c69c	0.648215	0.708840	0.202084	0.703437	0.708961	1.047968	0.671201	0.412635	discard	Exp6 (architectural, indep): raise tp_harvest magnitude 0.45->0.58 (prior session ceiling 0.58-0.62, walled by crash at 0.65). Tested whether Exp4 multi-day _ts_supp lifts the crash wall to push mixed further. MEASURED vs 99a369a1 0.706007: composite 0.648215 (-0.0578), mean 0.708840 (-0.0700). PER-REGIME: bull 1.025954->0.703437 (-0.323, 31pct drop, Sh2.0678->1.6433 BREACHES near-50pct gate -- over-harvested trend winners), crash 0.720320->0.708961 (-0.011 Sh1.2539->1.2466 -- multi-day _ts_supp DID shield crash at 0.58, confirming Exp4 fix lifted the crash wall as hypothesized), sideways 1.066580->1.047968 (-0.019 Sh2.0270->1.9894), rally 0.670171->0.671201 (+0.001 Sh1.5529->1.5561), mixed 0.410990->0.412635 (+0.0016 Sh0.8075->0.8108 -- continued climbing). All stab 1.0. FAILURE MECH (architectural fact): Exp4 multi-day _ts_supp shields CRASH (ret_vlong<0, shorts product>0 -> trend-aligned -> suppressed) but NOT BULL at high magnitude. bull-2021 is a sharp high-vol uptrend where the 96-bar ret_vlong is LESS consistently saturated than rallys grinding uptrend -> _ts_supp does not fully suppress bulls deep peaks at 0.58 -> over-harvested (-0.323). The magnitude ceiling shifted from crash-walled (0.50 under 20-bar _ts_supp) to bull-walled (0.58 under multi-day _ts_supp). CONCLUSION: 0.45 (Exp5) is the sweet spot -- the multi-day shield lifts crash enough to reach 0.45 (mixed +0.0025) but bull limits further magnitude raises. mixed +0.0016 at 0.58 does not justify bulls -0.323. Reverted to 99a369a1.
44a2aa76	0.703699	0.772577	0.229596	1.015590	0.720407	1.031312	0.677769	0.417808	branch	branch step1 (BRANCH OPEN): lower tp_harvest activation threshold 1.6->1.5. Prior session walled threshold 1.45 on crash STABILITY (1.0->0.206). MEASURED vs 99a369a1 0.706007: composite 0.703699 (-0.0023 sub-noise), mean 0.772577 (-0.0062). PER-REGIME: bull 1.025954->1.015590 (-0.0104 Sh2.0678->2.0555), crash 0.720320->0.720407 (+0.0001 BYTE-IDENTICAL Sh1.2539->1.2544 -- multi-day _ts_supp HELD crash stability at 1.5, confirming Exp4 lifted the crash-stability wall!), sideways 1.066580->1.031312 (-0.0353 Sh2.0270->1.9867), rally 0.670171->0.677769 (+0.0076 Sh1.5529->1.5689), mixed 0.410990->0.417808 (+0.0068 Sh0.8075->0.8219 -- BIG mixed gain, lower threshold reaches mixeds MODERATE peaks not just deep ones). All stab 1.0 (NO crash-stability collapse at 1.5 -- the multi-day _ts_supp shield works). max_dd all <5.1pct. BRANCH OPEN: mixed +0.0068 and rally +0.0076 are real structural gains (the lower threshold finally reaches mixeds moderate oscillating peaks); sideways -0.035 is the regression to fix (lower threshold harvests sideways small mean-reverting peaks prematurely). FIX HYPOTHESIS: gate the lower threshold by trend-strength or MAE so it fires for mixed/rally deep trend peaks but NOT sideways small mean-reverting peaks. Branch iterates to recover sideways while keeping the mixed/rally gains.
99a74b8e	0.703771	0.774298	0.235092	1.022333	0.719729	1.039905	0.678778	0.410745	branch	branch step3 (STEEPER trend gate, NO-PROGRESS): replaced step2 linear threshold blend with steep tanh (onset rsi_trend_str 0.35) so sideways stays at 1.6. MEASURED vs step2 0.704771: composite 0.703771 (-0.001 regression). PER-REGIME: bull 1.019603->1.022333 (+0.0027), crash 0.720979->0.719729 (-0.0012), sideways 1.048794->1.039905 (-0.0089 WORSE not better), rally 0.675234->0.678778 (+0.0035), mixed 0.413266->0.410745 (-0.0025 -- BACK TO BASELINE). FAILURE MECH: the steeper gate (onset 0.35) EXCLUDED mixeds moderate peaks -- mixeds beneficial moderate-peak harvests occur in LOWER-trend bars (rsi_trend_str<0.35), so the steep gate routed them back to 1.6 (no harvest) -> mixed lost its +0.0023 gain. Sideways also regressed (the steep gate is not the right sideways separator). CONCLUSION: mixeds moderate-peak gains live in LOW-trend bars (mixed is choppy), so a TREND gate cannot both reach mixed AND protect sideways -- they share the low-trend regime (same overlap wall as vol_ratio). step2 linear blend (composite 0.704771) is the branch best. Reverted to step2.
373b494f	0.704771	0.775575	0.236015	1.019603	0.720979	1.048794	0.675234	0.413266	branch	branch step2 (trend-adaptive threshold 1.6chop->1.5trend): MEASURED vs step1 0.703699: composite 0.704771 (+0.0011 progress). PER-REGIME: bull 1.015590->1.019603 (+0.004), crash 0.720407->0.720979, sideways 1.031312->1.048794 (+0.0175 RECOVERED), rally 0.677769->0.675234 (-0.0025), mixed 0.417808->0.413266 (-0.0045 -- lost some mixed as trend gate excluded moderate mixed peaks). All stab 1.0. Trend gate recovered sideways but lost mixed (mixed low-trend). Composite -0.0012 vs baseline 0.706007 (below keep).
6f3d13dc	0.707226	0.779766	0.241801	1.024222	0.721160	1.066534	0.676170	0.410745	branch	branch step4 (raise chop ceiling 1.65->1.5trend): MEASURED vs step2 0.704771: composite 0.707226 (+0.0025 progress; +0.0012 vs baseline -- branch best but sub-noise). PER-REGIME: bull 1.022333->1.024222, crash 0.719729->0.721160, sideways 1.039905->1.066534 (+0.027 RECOVERED to baseline-byte-identical), rally 0.678778->0.676170, mixed 0.410745 (BACK TO BASELINE -- 1.65 chop ceiling raised mixeds threshold too, blocking moderate mixed peaks). All stab 1.0. Sideways fully recovered but mixed lost its gain -> the mixed/sideways low-trend overlap wall: raising chop threshold protects BOTH sideways AND mixed (indistinguishable). Composite +0.0012 sub-noise, not keepable.
50447cb3	0.674955	0.734415	0.198198	0.842829	0.723906	1.015658	0.674407	0.415275	branch	branch step5 (chop-reduced magnitude 0.30chop->0.45trend, threshold 1.5 fixed -- NO-PROGRESS): MEASURED vs step4 0.707226: composite 0.674955 (-0.032 REGRESSION). PER-REGIME: bull 1.024222->0.842829 (-0.183 CRASHED -- magnitude reduction in chop hurt bull which has moderate rsi_trend_str in pullbacks), crash 0.721160->0.723906, sideways 1.066534->1.015658 (-0.051 WORSE), rally 0.676170->0.674407, mixed 0.410745->0.415275 (+0.0045 -- the ONE gain). FAILURE MECH: decoupling magnitude from threshold failed -- the chop-magnitude reduction interacted badly with the low threshold (bull over-harvested at 1.5 threshold AND under-magnitude-protected). 2nd no-progress step (step3, step5). Wall confirmed: mixed/sideways share low-trend regime; no rsi_trend_str gating separates them.
