commit	score	mean_score	std_score	bull_2021	crash_bear	sideways	rally_2024	status	description
6b13ab58	0.848030	0.887565	0.131786	0.969095	0.811820	1.053595	0.715753	keep	KEEP (NEW BASELINE, SUPERSEDES cf9a42ea 0.847578). Exp2 (architectural, indep): BTC leader DVP x BTC-trend-agreement alt entry boost. NEW cross-symbol x cross-data-type dep - the DIRECTIONAL-VOLUME column of the validated {own,BTC,partner}x{vol,price} volume grid (vol-RISE and price columns were saturated). _btc_dvp = sum(vol[i]*sign(close[i]-close[i-1]))/sum(vol[i]) over 12 bars on BTC = leader volume-DIRECTION balance (buy-side vs sell-side), distinct from _btc_trend (leader price direction) and _btc_vol_rise (leader volume magnitude). Conjunction with /0.03 BTC-trend agreement gate (same as validated Exp1 BTC-vol-rise boost): leader volume on same side as BTC-confirmed alt trend entry -> broad-market leader participation is DIRECTIONAL -> larger first-bar commitment. Deep-saturated both gates (near-constant, noise-free, validated safe family), first-bar-only, +0.05 max. BTC self-referential -> not reached (alt branch). MEASURED vs cf9a42ea 0.847578: composite +0.000452, mean +0.000229, std -0.000737 (tighter). PER-REGIME: rally 0.714024->0.715753 (+0.001729 BINDING - Sh 1.289841->1.294639, BTC buy-side volume confirming alt longs in the broad rally), bull 0.969307->0.969095 (-0.000212 sub-noise Sh1.846), crash 0.811923->0.811820 (-0.000103 sub-noise Sh1.264), sideways 1.054088->1.053595 (-0.000493 - /0.03 BTC-trend gate spares sideways BTC~flat but small leak, 0.047pct relative drop well under 50pct gate). All stab 1.0, all flip_streak_gate 1.0, all MaxDD<10pct (rally 1.557). All keep criteria met. NEW BASELINE 0.848030. New cross-data-type dep at alt entry sizing. Observation (correlation only): rally gain consistent with leader-volume-direction-confirmed broad-market-long hypothesis but direction-split PnL not measured.
a465684a	0.848733	0.888073	0.131132	0.969117	0.811798	1.053595	0.717782	keep	KEEP (NEW BASELINE, SUPERSEDES 6b13ab58 0.848030). Exp3 (architectural, indep): partner-alt DVP x partner-price-agreement alt entry boost. Completes the DVP column of the {own,BTC,partner}x{vol,price,DVP} volume grid (own-DVP=Exp1 keep cf9a42ea, BTC-DVP=Exp2 keep 6b13ab58, this=partner cell). _partner_dvp = sum(vol[i]*sign(close[i]-close[i-1]))/sum(vol[i]) over 12 bars on the partner alt = partner volume-DIRECTION balance, distinct from _partner_lead (partner price momentum) and _partner_vol_rise (partner volume magnitude). Conjunction with /0.02 partner-price-agreement gate (same as validated Exp2 partner lead-lag boost): partner volume on same side as partner-confirmed alt trend entry -> broad alt-market participation is DIRECTIONAL -> larger first-bar commitment. Deep-saturated both gates (near-constant, noise-free, validated safe family), first-bar-only, +0.05 max. MEASURED vs 6b13ab58 0.848030: composite +0.000703, mean +0.000508, std -0.000654 (tighter). PER-REGIME: rally 0.715753->0.717782 (+0.002029 BINDING - Sh 1.294639->1.300357 BROKE 1.30, partner alt buy-side volume confirming alt longs in broad rally), bull 0.969095->0.969117 (+0.000022 flat Sh1.844), crash 0.811820->0.811798 (-0.000022 flat Sh1.264), sideways BYTE-IDENTICAL 1.053595 (/0.02 partner gate + sideways partner~flat -> no leak). All stab 1.0, all flip_streak_gate 1.0, all MaxDD<10pct (rally 1.573). All keep criteria met. NEW BASELINE 0.848733. DVP column of volume grid now COMPLETE (own/BTC/partner all keeps). Observation (correlation only): rally gain consistent with partner-volume-direction-confirmed broad-alt-long hypothesis but direction-split PnL not measured.
-	-	-	-	-	-	-	-	discard	Exp4 (architectural, indep): partner-alt DVP x BTC-trend-agreement mixed conjunction boost on ALT entries (DVP-column mixed cell, analogous to validated Exp9 partner-VOL x BTC-price keep). NEW cross-symbol x cross-data-type dep: _partner_dvp (follower volume-DIRECTION) x /0.03 BTC-trend agreement gate (leader price). MEASURED vs a465684a 0.848733: composite -0.000749, mean -0.000541, std +0.000696 (looser). PER-REGIME: rally 0.717782->0.715701 (-0.002081 BINDING - Sh 1.300357->1.295700, DD 1.573->1.621 - over-confirmation: partner-DVP and BTC-trend are BOTH broad-market signals whose conjunction over-sizes rally entries, raising DD not Sharpe), bull 0.969117->0.969128 (+0.000011 sub-noise), crash 0.811798->0.811697 (-0.000101 sub-noise), sideways 1.053595->1.053602 (+0.000007 sub-noise). All stab 1.0, all MaxDD<10pct (rally 1.621). Reverted to a465684a. CONCLUSION: unlike the vol-grid mixed cells (Exp8/9 were keeps), the DVP-column mixed cell is REDUNDANT/HARMFUL - partner-DVP and BTC-trend overlap as broad-market confirmation, so their conjunction over-confirms rather than adds orthogonal signal (same 3rd-order overfit character as the vol-grid Exp10 3-way discard). DVP-column CLEAN cells (own/BTC/partner) are productive; DVP MIXED cells are not. No regime improved (not branch-eligible). DVP column now fully explored: 3 clean-cell keeps + 1 mixed-cell discard.
-	-	-	-	-	-	-	-	discard	Exp5 (architectural, indep): MULTI-WINDOW (12/24/48) own-DVP consensus replacing single 12-bar. Mirrors validated multi-window exit-slope pattern (line ~1444): mean of per-window sign-aggregated normalized OBV across 3 windows. Hypothesis: sign-based DVP noise-robustness generalizes under multi-window aggregation. MEASURED vs a465684a 0.848733: composite -0.000119, mean -0.000097, std +0.000073. PER-REGIME: rally 0.717782->0.717491 (-0.000291 - Sh 1.300357->1.299652 - the lagging 24/48-bar DVPs DILUTED the responsive 12-bar signal; rally grind is captured best by recent bars), bull 0.969117->0.969064 (-0.000053 sub-noise), crash BYTE-IDENTICAL 0.811798, sideways 1.053595->1.053551 (-0.000044 sub-noise). All stab 1.0, all MaxDD<10pct (rally 1.577). Reverted to a465684a. CONCLUSION: the 12-bar DVP window is OPTIMALLY RESPONSIVE - the signal is real but short-horizon (grinding-uptrend buy-side volume is a near-term continuation signal, not a sustained multi-day structure). Multi-window aggregation adds lag that dilutes it. The 12-bar scale is load-bearing for the own-DVP boost. Do not lengthen the DVP window.
-	-	-	-	-	-	-	-	discard	Exp6 (architectural, indep): alt/BTC RELATIVE STRENGTH (ratio momentum) trend-aligned alt entry boost. NEW data axis: relative value - _rs = ret_long (own 20-bar return) - _btc_ret20 (BTC 20-bar return), +rs = alt outperforming leader. An alt LONG outperforming BTC = high relative strength -> larger first-bar commitment; alt SHORT underperforming -> boost. Trend-aligned + ER grind gate + deep-saturated /0.04 + first-bar-only +0.05 max bilateral. MEASURED vs a465684a 0.848733: composite -0.000835, mean -0.000619, std +0.000720 (looser). PER-REGIME: rally 0.717782->0.715568 (-0.002214 BINDING - Sh 1.300357->1.294952, DD 1.573->1.600 - the return SPREAD is momentum-chasing: an alt that already outperformed BTC has run up, boosting it over-commits to extended alts -> giveback), bull 0.969117->0.968995 (-0.000122 sub-noise), crash 0.811798->0.811660 (-0.000138 sub-noise), sideways 1.053595->1.053591 (-0.000004 sub-noise). All stab 1.0, all MaxDD<10pct (rally 1.600). Reverted to a465684a. CONCLUSION: relative-strength (performance-spread) momentum is a DEAD-END for entry boosting - unlike participation-confirmation signals (DVP, vol-rise, close-loc which confirm a move WITHOUT chasing), relative-strength OVER-COMMITS to already-extended alts (the return spread is largest AFTER the alt has run up). Confirms the productive entry-boost family is PARTICIPATION-CONFIRMATION (volume/positioning confirming an ongoing move), not PERFORMANCE-MOMENTUM (chasing prior outperformance). Price-axis relative-value signals are redundant with the existing ret_long trend (already captures absolute alt momentum); the cross-symbol SPREAD adds no orthogonal alpha. No regime improved (not branch-eligible).
-	-	-	-	-	-	-	-	discard	Exp7 (architectural, indep): VOLUME-WEIGHTED close-loc. Replace equal-weighted 3-bar mean close_loc with volume-weighted mean so high-participation bars dominate the conviction measure (high-volume close-near-high = conviction WITH participation). Refines the validated close-loc keep (6e765b0f) within the participation-confirmation family. MEASURED vs a465684a 0.848733: composite -0.000039 (SUB-NOISE), mean -0.000024, std -0.000053 (tighter). PER-REGIME: rally 0.717782->0.717647 (-0.000135 sub-noise - Sh 1.300357->1.299998, DD 1.573 unchanged), bull 0.969117->0.969140 (+0.000023 sub-noise), crash 0.811798->0.811797 (~flat), sideways 1.053595->1.053613 (+0.000018 sub-noise). All stab 1.0, all MaxDD<10pct. Reverted to a465684a. CONCLUSION: volume-weighting the close-loc is SUB-NOISE NEUTRAL-to-slightly-negative - the equal-weighted 3-bar mean already captures the continuation signal; high-volume bars in the rally grind are NOT systematically cleaner continuation bars than low-volume ones (volume is roughly uniform across the grind bars). The close-loc keep equal-weighting is load-bearing/optimal. Confirms the close-loc signal is a POSITION signal, not a volume-position conjunction (unlike DVP/vol-rise which ARE volume signals). No regime improved (not branch-eligible).
-	-	-	-	-	-	-	-	discard	Exp8 (architectural, indep): DVP-based counter-trend entry SHRINK. Symmetric counterpart to the validated DVP boost (Exp1 keep): shrink a bear ct short (rally pullback) when DVP is still buy-side (volume confirms the multi-day uptrend the short opposes). Distinct signal SOURCE (volume-direction) from the existing price-based ct shrinks (ct_vlong/vd_ct_shrink/churn_ct which gate on ret_vlong or volume-decline). Mirrors validated _vd_ct_shrink envelope: /0.01 ret_vlong gate, direction-aware, shrink-only max 0.12, first-bar-only. MEASURED vs a465684a 0.848733: BYTE-IDENTICAL (composite 0.848733, all 4 regime scores unchanged, rally 0.717782 Sh 1.300359). The DVP-ct-shrink NEVER FIRES on any clean trade. Reverted to a465684a. CONCLUSION: the ct-shrink space is SATURATED even for a different signal SOURCE - the existing price-based ct shrinks (ct_vlong, vd_ct_shrink, churn_ct) already FULLY cover the rally ct-short entries; there are NO ct shorts that DVP catches but the price-trend/volume-decline shrinks miss (a rally pullback short that is ct at multi-day has ret_vlong>0 AND, it turns out, DVP buy-side simultaneously - the conditions coincide exactly, so the DVP gate adds zero incremental coverage). This extends the prior-session ct-shrink-saturation conclusion to volume-direction as a signal source. No regime improved (not branch-eligible).
-	-	-	-	-	-	-	-	session-summary	SESSION: 3 KEEPS (Exp1 +0.000561, Exp2 +0.000452, Exp3 +0.000703) + 5 architectural discards (EXIT RULE at 5 consecutive architectural). NEW BASELINE a465684a 0.848733 (SUPERSEDES 6e765b0f 0.847017, +0.001716 composite, +0.001130 mean 0.886943->0.888073, std 0.133086->0.131132 tighter). [bull 0.969313->0.969117, crash 0.812148->0.811798, sideways 1.054095->1.053595, rally 0.712218->0.717782 BINDING +0.005564 Sh 1.284884->1.300359 BROKE 1.30]. THEME: NEW DATA AXIS - DIRECTIONAL VOLUME PRESSURE (DVP = normalized OBV = sum(vol[i]*sign(close[i]-close[i-1]))/sum(vol[i]) over 12 bars, range [-1,+1]), the volume-DIRECTION balance (buy-side vs sell-side pressure). Genuinely orthogonal to VWAP voter (level deviation), vol_rise (total volume magnitude trend), vol_z (level spike), slope (price) - NONE measured directional balance of volume. close-to-close sign uses only close (noise-perturbed -> legitimately noise-sensitive, NOT the open-price artifact). Used as a trend-aligned first-bar entry boost in the validated deep-saturated + first-bar-only + bilateral + ER-grind-gate + ret_vlong>0-bull-gate safe-family envelope (mirrors the close-loc keep 6e765b0f EXACTLY). Completed the DVP COLUMN of the {own,BTC,partner}x{vol,price,DVP} volume grid: own-DVP (Exp1 keep), BTC-leader-DVP (Exp2 keep), partner-alt-DVP (Exp3 keep) - all 3 clean cells were KEEPS, each improving the binding rally regime. KEY MECHANISM INSIGHT (load-bearing for future sessions): (1) DVP is a genuine new productive data axis - buy-side volume confirms grinding-uptrend longs even when TOTAL volume is flat (the case vol_rise misses); rally grind bars have volume on up-bars -> boost fires on genuine continuation longs. (2) The PRODUCTIVE ENTRY-BOOST FAMILY is PARTICIPATION-CONFIRMATION (DVP/vol_rise/close_loc confirm an ONGOING move WITHOUT chasing) - NOT performance-momentum. Exp6 (alt/BTC relative-STRENGTH = return spread) REGRESSED rally -0.0022 because it CHASES already-extended alts (the spread is largest AFTER the alt ran up) -> over-commits -> giveback (DD 1.573->1.600). Price-axis relative-value signals are redundant with ret_long (absolute alt momentum); the cross-symbol spread adds no orthogonal alpha. (3) The 12-bar DVP window is OPTIMALLY RESPONSIVE - Exp5 multi-window (12/24/48) consensus DILUTED rally -0.0003 (lagging windows add lag; the signal is short-horizon near-term continuation, not sustained multi-day structure). Do not lengthen the DVP window. (4) DVP MIXED cells (partner-DVP x BTC-trend, Exp4) are REDUNDANT like the vol-grid 3-way - partner-DVP and BTC-trend overlap as broad-market confirmation, over-confirms rather than adds orthogonal signal (DD 1.573->1.621). Only CLEAN cells (own/BTC/partner) are productive. (5) The ct-shrink space is SATURATED even for volume-direction as a signal source - Exp8 DVP-ct-shrink was BYTE-IDENTICAL/INERT (the existing price-based ct shrinks ct_vlong/vd_ct_shrink/churn_ct already FULLY cover rally ct shorts; a pullback short that is ct at multi-day has ret_vlong>0 AND DVP buy-side simultaneously - conditions coincide exactly, DVP gate adds zero incremental coverage). (6) Volume-weighting the close-loc keep (Exp7) is SUB-NOISE NEUTRAL - close-loc is a POSITION signal not a volume-position conjunction (high-volume bars in the rally grind are NOT systematically cleaner continuation bars; volume is roughly uniform across grind bars); the equal-weighted 3-bar mean is optimal. CONCLUSIONS: (a) DVP/normalized-OBV is the most productive new data axis found in many sessions (+0.001716 composite, all on the binding rally); the 3 clean cells are now in the baseline. (b) The participation-confirmation vs performance-momentum distinction is the key lens for evaluating future entry-boost candidates - only participation-confirmation (volume/positioning confirming an ongoing move) is productive; momentum/relative-strength that chases prior outperformance is a dead-end. (c) The DVP column is now COMPLETE (3 keeps + 1 mixed discard + 1 multi-window discard + 1 ct-shrink inert) - do not pursue further DVP entry-boost cells. (d) The volume axis is now thoroughly explored (vol_rise grid + DVP column + vol_z + VWAP voter); future new-axis work should look beyond volume. strategy.py at a465684a (byte-identical to keep).
eccefad0	0.848774	0.888098	0.131082	0.969098	0.811798	1.053581	0.717915	branch	BRANCH OPEN (effort/result entry boost). Exp1 (architectural, indep): NEW data dep volume/range_pct (Wyckoff effort/result) trend-aligned entry boost. MEASURED vs a465684a 0.848733: composite +0.000041, mean +0.000025, std -0.000050. PER-REGIME: rally 0.717782->0.717915 (+0.000133 TARGET signal, Sh unchanged), bull 0.969117->0.969098 (-0.000019), sideways 1.053595->1.053581 (-0.000014), crash byte-identical 0.811798. All stab 1.0, all MaxDD<10pct. Sub-noise composite (cf row 855 +0.000016 discarded as overfit hygiene) BUT rally moved +0.000133 = genuine regime-level signal on a NEW mechanism. Branch: iterate to amplify rally gain (magnitude/gate tuning) toward a real keep; revert if cannot clear noise floor.
11fba0d7	0.847993	0.887533	0.131799	0.969083	0.811781	1.053569	0.715698	branch	branch step2: widen easy-gate center 1.15 /0.70 (fire on neutral-effort trend bars). MEASURED vs step1 0.848774: composite -0.000781, rally 0.717915->0.715698 (-0.002217 BELOW baseline). Widening HURT: neutral-effort bars (rising vol, ratio~1.0) are noise not clean-continuation signal. Deep /0.50 gate correct. No-progress step.
6b407895	0.848797	0.888113	0.131052	0.969087	0.811798	1.053573	0.717993	branch	branch step3: revert gate to /0.50, raise magnitude 0.05->0.08. MEASURED vs step1 0.848774: composite +0.000023 (0.848797), rally +0.000078 (0.717993). vs baseline a465684a: composite +0.000064, rally +0.000211. Peak of branch. Still sub-noise (typical keeps ~+0.0005).
459dbcf8	0.847948	0.887499	0.131837	0.969073	0.811798	1.053562	0.715562	branch	branch step4: magnitude 0.08->0.12. MEASURED vs step3 0.848797: composite -0.000849, rally 0.717993->0.715562 (-0.002431 BELOW baseline). Non-monotonic: 0.05->+0.000133, 0.08->+0.000211, 0.12->-0.002221 rally. Over-commits to easy-bar longs that reverse (low-volume blips not sustained trend). No-progress step.
-	-	-	-	-	-	-	-	discard	BRANCH REVERTED (effort/result volume-per-range entry boost). 4-step branch (step1 open +0.000041, step2 widen-gate regress, step3 magnitude0.08 peak +0.000064 composite/rally +0.000211, step4 magnitude0.12 regress -0.000849). CONCLUSION: effort/result (Wyckoff volume/range_pct) is a genuinely-new non-redundant data axis (rally moved +0.000211 at peak = real directional signal) BUT the effect is sub-noise: the deep gating (trend_w x ER x vlong x easy) that keeps it safe also makes it near-inert (fires only on rare low-volume large-range bars), and amplifying via magnitude is NON-MONOTONIC (0.05->+0.000133, 0.08->+0.000211, 0.12->-0.002221 rally -- over-commits to easy-bar blips that reverse). Peak +0.000064 composite is ~8x below typical keep noise floor (~0.0005); keeping 43 LOC + 6 extra history reads/bar for sub-noise effect fails overfit hygiene (cf row 855 +0.000016 discarded). Reverted to a465684a. Branch did not clear noise floor.
4a621334	0.795675	0.839985	0.147701	0.856014	0.811798	1.053595	0.638535	discard	Exp1 (architectural, indep): PORTFOLIO consecutive-loss-streak risk-off escalator. NEW state: portfolio-level _loss_streak counter (mirrors max_consecutive_losses which is computed over chronological trade_pnls in prepare.py). On each closed loss (any symbol) increment, reset on win. Drives _streak_escal=tanh((streak-1)/2) (0 at streak<=1, ~1 at streak>=3) -> (a) cooldown-window stretch x1.8, (b) first-bar size shrink -20pct, (c) admission strong_min +10pct. Hypothesis: rally streak ~4 -> streak_gate 0.875 is the largest raw-vs-actual gap; escalating risk-off after consecutive losses breaks clustered losing re-entries. MEASURED vs a465684a 0.848733: composite -0.053058, mean -0.048088, std +0.016569. PER-REGIME: bull 0.969117->0.856014 (-0.113103 CATASTROPHIC, Sh 1.84->1.52, DD 0.90->1.17, trades 52->51), rally 0.717782->0.638535 (-0.079247, Sh 1.30->1.20, DD 1.57->1.62, trades 96->107 MORE not fewer), crash byte-identical 0.811798, sideways byte-identical 1.053595. The cooldown stretch BACKFIRED (rally churn rose 96->107) and admission/size shrink cost bull Sharpe. streak_gate was NOT improved (rally score fell with Sharpe). No regime improved. Reverted to a465684a.
d881e261	0.848591	0.887898	0.131025	0.968418	0.811798	1.053595	0.717782	discard	Exp2 (architectural, indep): VWAP-SLOPE exit pressure (new data dep in exit MAX fusion). VWAP is only read as a LEVEL (7th entry voter, close vs 12-bar VWAP); its SLOPE was unused. New 8th soft source: 12-bar OLS log-VWAP slope against position, profit-side only (_w_vs=_pnl_scale), deep-saturated tanh /0.0006, max 0.45. Hypothesis: participation-confirmed distribution (VWAP falling while close flat) that close-slope misses -> earlier winner harvest -> rally/crash Sharpe up. MEASURED vs a465684a 0.848733: composite -0.000142, mean -0.000175. PER-REGIME: rally BYTE-IDENTICAL 0.717782 (Sh 1.30, DD 1.57, trades 96 all unchanged), crash byte-identical 0.811798, sideways byte-identical 1.053595, bull 0.969117->0.968418 (-0.000699 - slight early harvest cut a winner; Sh 1.84 held, trades 52->51). Source is effectively INERT: the MAX fusion + multi-source agreement attenuator + existing 7 sources (slope/pp/time/ve/ar/vc/ep) already cover the exit-pressure space, so a new profit-side source never dominates the MAX. Confirms exit-fusion is closed (new sources do not help). Reverted to a465684a.
