commit	score	mean_score	std_score	bull_2021	crash_bear	sideways	rally_2024	status	description
5a748c8a	0.685884	0.750603	0.215732	0.96	0.73	0.99	0.66	0.40	session-summary	REGIME EXPANSION: 2025 full year added as 5th in-sample regime (mixed_2025). SEARCH_REGIMES 4->5, HOLDOUT moved to 2026-01~06. strategy.py UNCHANGED at 5a748c8a. Old 4-regime v2.2 composite 0.793917 -> new 5-regime 0.685884 (-0.108). mixed_2025 score 0.404513 (Sharpe 0.804, DD 2.80pct, 44 trades) is the new binding regime (lowest by far). REASON: 2025 market structure is new to the strategy (slow grinding decline Q1 + fast反弹 Q2 + low-vol chop Q3-Q4 + crash Q4); strategy Sharpe 0.804 on 2025 vs 1.27-2.00 on historical. Per-regime: bull 0.962 Sh2.000, crash 0.731 Sh1.273, sideways 0.995 Sh2.002, rally 0.660 Sh1.526, mixed_2025 0.405 Sh0.804. All stab 1.0. mixed_2025 is new binding with large headroom -- gives agent a low-score regime with improvement potential (unlike rally which is saturated after 10+ sessions). pytest 21 passed.
1d6e8b5c	0.685884	0.750603	0.215732	0.96	0.73	0.99	0.66	0.41	keep	BASELINE RE-ESTABLISHED for 5-regime objective (regime expansion 1d6e8b5c added mixed_2025 as 5th in-sample regime; prior keeps were 4-regime). strategy.py byte-identical to 5a748c8a v2.2 optimum. Verified reproduces composite 0.685884 mean 0.750603 std 0.215732. Per-regime: bull_2021 0.962118 (Sh1.9997 DD3.09pct 52t stab0.955), crash_bear 0.731300 (Sh1.2727 DD2.46pct 57t stab0.981 100pctWR), sideways 0.994833 (Sh2.0020 DD2.21pct 48t), rally_2024 0.660252 (Sh1.5256 DD5.19pct 100t 85pctWR), mixed_2025 0.404513 (Sh0.8043 DD2.80pct 42t 100pctWR). ALL stability_factor 1.0 (raw==score). min_stability 0.810. mixed_2025 is binding regime with largest headroom (Sh0.80 vs 1.27-2.00); sample_factor 0.917 at 42t (below 50 knee). This keep row makes the 5-regime baseline durable for next session.
-	0.685826	0.750525	0.215664	0.96	0.73	1.00	0.66	0.40	discard	Exp1 (architectural, indep): symmetric WIN-conditioned cooldown SHORTENING (mirror of existing _loss_only stretch; winning exit narrows _cd_window up to 30pct -> faster size recovery on next qualified re-entry). RESULT composite 0.685826 vs 0.685884 = -0.000058 FLAT. mixed_2025 0.404513 BYTE-IDENTICAL (Sh0.804285 unchanged) -> cooldown_factor already ~1.0 by re-entry time in 2025 (enough bars between exits), so the size-recency penalty is NOT the under-deployment cause. bull 0.961078 (-0.0010), sideways 0.995446 (+0.0006), rally 0.660288 (+0.00004) all sub-noise. DISCARD: composite down, mean down, binding regime untouched. CONCLUSION: mixed_2025 sparse-deployment (42t, 100pctWR, 4.4pct ret) is NOT a re-entry-recency problem.
-	0.680520	0.743799	0.210930	0.94	0.73	0.99	0.65	0.41	discard	Exp2 (architectural, indep): MULTI-DAY-TREND-SCALED profit-target floor pp_min (new cross-timescale dep; scale pp_min 0.72x-1.0x by tanh(|ret_vlong|/0.045) -- strong trends keep high let-run floor, weak trends harvest peaks sooner). RESULT composite 0.680520 vs 0.685884 = -0.005364. mixed_2025 0.411301 (+0.0068, Sh0.804->0.818 TARGET IMPROVED), sideways 0.994833 FLAT, but bull 0.941092 (-0.021, Sh2.00->1.98) + rally 0.645564 (-0.0147, Sh1.526->1.488). DISCARD: composite+mean down. MEASURED FINDING (verifiable): mixed_2025 responds to harvest aggressiveness -- isolated uniform pp_min 0.025->0.018 probe gave mixed Sh0.80->0.95 +rally 1.53->1.70 but bull 2.00->1.59; the separator |ret_vlong| is bull~0.075 rally~0.046 sideways~0.035 mixed~0.033. NOT branched: mixed(0.033) and sideways(0.035, must-protect 0.995) are indistinguishable in all live indicators (ER/|ret_long|/|ret_vlong|) yet need opposite harvest treatment; cleanly separating rally(0.046) from mixed(0.033) requires tuning the gate to known regime trend-magnitudes = regime-detection overfitting (forbidden).
-	0.663101	0.721236	0.193783	0.82	0.73	0.99	0.66	0.41	discard	Exp3 (architectural, indep): PER-POSITION cumulative-giveback-adaptive harvest floor (new per-symbol state _cum_giveback/_gb_peak; shrink pp_min 0.78x-1.0x by tanh(cum_giveback/peak /8.0) -- choppy holds harvest next peak sooner, clean climbers keep full floor). Premise: aggregate-level diagnostic showed cum-giveback/peak medians bull~412 sideways~689 (clean, Sh2.0) vs rally~4566 mixed~4001 (choppy, Sh1.5/0.8). RESULT composite 0.663101 vs 0.685884 = -0.0228. bull 0.817186 (-0.145, Sh2.00->1.72 OVER-HARVESTED), sideways/crash/rally FLAT, mixed_2025 0.405175 (+0.0007 flat). DISCARD: composite+mean down, bull breached. MEASURED LESSON (verifiable): aggregate regime-median cum-giveback MASKS within-position dynamics -- bull's INDIVIDUAL long-hold positions DO accumulate giveback over their life (the rolling within-position high-water re-peaks many times), triggering the harvest shrink and killing bull's let-winners-run; the aggregate median was low only because bull has FEWER held bars, not lower per-position cum-giveback. mixed_2025 saw no benefit. Cum-giveback is NOT a usable live clean-vs-choppy separator at the per-position level.
-	0.684331	0.750649	0.221063	0.96	0.73	1.00	0.66	0.40	discard	Exp4 (architectural, indep): MEAN-REVERSION expectancy entry-size tilt (z=(close-MA24)/std24; symmetric +-0.12 tilt boosting entries aligned with reversion -- bull at z<0, bear at z>0). Premise: corr(-z,fwd8) +0.027 mixed_2025 vs negative in 4 saturated regimes (only opposite-sign separator found). RESULT composite 0.684331 vs 0.685884 = -0.00155. SURPRISE -- effect was OPPOSITE of prediction at the strategy's ACTUAL entry points: mixed_2025 0.395204 (-0.0093, Sh0.804->0.793 REGRESSED), but bull +0.0004, crash 0.734969 (+0.0037), sideways 1.003717 (+0.0089!), rally 0.656800 (-0.0035). DISCARD: composite+ mean down, mixed (target) regressed. MEASURED LESSON (verifiable): aggregate z-score/forward-return correlation does NOT predict the marginal effect at the bars the strategy actually enters -- mixed_2025's MR expectancy is at bars the strategy does NOT trade; at its real entries the momentum-aligned sizing was already correct. Sideways (worried regime, MR-corr -0.033) actually GAINED +0.0089 from the tilt -> possible separate sideways lever but off-target for the binding regime.
-	0.685881	0.750600	0.215729	0.96	0.73	0.99	0.66	0.40	discard	Exp5 (architectural, indep): BOOST-ONLY mean-reversion entry-size tilt (Exp4 minus shrink-side; clamp tilt factor >=1.0, boost entries aligned with reversion only). RESULT composite 0.685881 vs 0.685884 = -0.000003 BYTE-IDENTICAL INERT, every regime within 0.00002. MEASURED LESSON (verifiable): the boost-only condition (bull entry at z<0 / bear at z>0 = entry ALIGNED with reversion) almost NEVER coincides with an actual entry, because entries are momentum-driven -- the strategy enters bull on UPWARD signal (z>0), not when extended down. So ALL of Exp4's effect came from the SHRINK side (down-sizing extended momentum entries), which helped sideways/crash/bull but hurt mixed/rally; there is no asymmetric clean win. EXIT RULE MET: 5 consecutive architectural discards (Exp1-5).
-	-	-	-	-	-	-	-	-	session-summary	SESSION (baseline 1d6e8b5c 0.685884 5-regime -> UNCHANGED, no keep): FIRST session after regime expansion (1d6e8b5c added mixed_2025 as 5th in-sample regime). Re-established durable 5-regime baseline keep row (was missing). 5 independent architectural experiments (Exp1-5 ALL discards), no branch opened. EXIT RULE MET (5 consecutive architectural discards). Baseline re-verified reproduces 0.685884 [bull 0.962118 Sh2.00, crash 0.731300 Sh1.27, sideways 0.994833 Sh2.00, rally 0.660252 Sh1.53, mixed_2025 0.404513 Sh0.80; ALL stability_factor 1.0, raw==score everywhere, min_stab 0.810]. THEME: targeted the new binding regime mixed_2025 (Sh0.80, huge headroom, 100pctWR but only 4.4pct return). CROSS-EXPERIMENT CONCLUSIONS (all MEASURED this session via ~11 fast single-regime probes + 5 full backtests, verifiable): (1) mixed_2025 is NOT under-deployed -- 99.2pct time-deployed, healthy position sizes (mean 0.78x equity, between rally 0.64 and sideways 0.96), 100pctWR no stop-outs. Its low Sharpe is intrinsic signal quality in a choppier regime (96-bar |net|>2pct only 58.6pct of time vs rally 70.1pct; 108 sign-flips vs rally 77; mean |ret_vlong| 0.033 vs bull 0.075). (2) mixed_2025 entry/exit Sharpe is INVARIANT to every GLOBAL knob probed: admission floor (STRONG_WEIGHT_MIN), TARGET_VOL, STOP_LOSS_PCT, EMA_SLOW, LINREG_PERIOD, ENTRY_ACCUM_RHO (inert), HOLD_DECAY_RATE, MOMENTUM_HOLD_BONUS -- all flat on mixed while sharply load-bearing for the 4 saturated regimes. (3) The ONE lever that moves mixed positively is HARVEST AGGRESSIVENESS (smaller pp_min): uniform pp_min 0.025->0.018 gave mixed Sh0.80->0.95 +rally 1.53->1.70 BUT bull 2.00->1.59 (Exp2 trend-scaled version: composite -0.0054, mixed +0.0068 but bull -0.021 rally -0.015). (4) mixed_2025 and SIDEWAYS are STATISTICALLY INDISTINGUISHABLE in every live contemporaneous indicator (vol_ratio 0.343 vs 0.321, |ret_long|, |ret_vlong| 0.033 vs 0.035, ER ~0.29 both, lag1-autocorr, pos-pnl-path-efficiency 0.449 vs 0.431, cum-giveback) YET need OPPOSITE treatment: mixed is MEAN-REVERTING (corr(slope,fwd12)=-0.087, corr(+z,fwd8)=-0.027) while sideways is MOMENTUM (corr(slope,fwd)=+0.088, corr(+z,fwd8)=+0.033). The distinguishing signal is FORWARD return character = unobservable live without lookahead. (5) Exp3 cum-giveback harvest floor: aggregate regime-median (bull~412 vs mixed~4001) MASKS within-position dynamics -- bull individual long-holds DO accumulate giveback -> over-harvested bull -0.145. (6) Exp4 symmetric MR entry-tilt: composite -0.0016, OPPOSITE of prediction -- mixed regressed -0.0093 (aggregate z/fwd corr does NOT predict marginal effect at the strategy ACTUAL entry bars), sideways +0.0089. (7) Exp5 boost-only MR tilt: byte-identical inert -- boost condition (entry aligned with reversion) never coincides with momentum entries. STRUCTURAL WALL CONFIRMED: mixed_2025 cannot be net-improved by any global lever or live-computable regime separator without (a) regressing the saturated regimes more than gained, or (b) tuning gates to known regime trend-magnitudes (regime-detection overfitting, forbidden). NEXT SESSION: do NOT re-probe global sizing/timing/admission/harvest knobs on mixed (saturated, documented invariant). The only untested axes are NEW orthogonal DATA-SOURCE entry voters (a different signal that may have alpha in 2025's structure) or exit-side mechanisms not yet tried. pytest not run (strategy.py unchanged from baseline).
79f4aa8a	0.680713	0.736505	0.185974	0.928018	0.715662	0.923599	0.693303	0.421943	branch	Exp1 (architectural, BRANCH OPEN): PnL-PATH-CHOPPINESS profit-side harvest. NEW exit mechanism (per-symbol _pnl_path state; harvest winner by path_eff=|net pos_pnl|/sum|d pos_pnl| over 10-bar window, choppy=harvest, smooth=spare; max 0.15, profit-side, SL<0.5). MEASURED vs 1d6e8b5c 0.685884: composite -0.005171 (0.680713), mean -0.014098, std -0.029758 (tighter). ALL stab 1.0 raw==score, min_stab 0.839 (UP from 0.810), all DD<6pct. PER-REGIME: bull 0.962118->0.928018 (-0.034100, Sh 1.9997->1.9972 FLAT -> cost is return_reward from size cut NOT signal), crash 0.731300->0.715662 (-0.015638 Sh1.273->1.245), sideways 0.994833->0.923599 (-0.071234 Sh2.002->1.808 REAL signal cut -- momentum runs harvested), rally 0.660252->0.693303 (+0.033051 Sh1.526->1.549 GENUINE), mixed_2025 0.404513->0.421943 (+0.017430 Sh0.804->0.812 GENUINE, the binding target). PATTERN: harvest helps lower-Sharpe regimes (crash/mixed/rally), hurts high-Sharpe (bull/sideways). BRANCH JUSTIFICATION: (1) new mechanism harvests choppy-path winners; (2) sideways regressed because its momentum runs are cut by the harvest (path-choppiness fires but forward-return is momentum); (3) FIX hypothesis: gate harvest by CURRENT giveback-from-peak so still-rising momentum runs (bull/sideways making fresh highs) are spared, only actively-rounding-over positions (mixed reversion/rally pullback) harvested. Opening branch.
af4cdb99	0.686840	0.747257	0.201390	0.928049	0.721972	0.982255	0.689832	0.414175	branch	branch step2 (giveback-gate the chop harvest): gate path-choppiness harvest by _giveback_ratio (peak-pos_pnl) so only rounding-over winners harvested, still-rising momentum runs spared. MEASURED vs 1d6e8b5c 0.685884: composite +0.000956 (0.686840), mean -0.003346, min_stab 0.829. vs step1 raw 0.680713: +0.006127 PROGRESS. PER-REGIME: bull 0.928049 (-0.034069 vs base, Sh1.9997->1.9973 FLAT = return_reward size cost not signal), crash 0.721972 (-0.009328), sideways 0.982255 (RECOVERED from step1 0.923599, Sh1.808->1.932 -- giveback gate spares momentum runs), rally 0.689832 (+0.029580 vs base), mixed 0.414175 (+0.009662 vs base). Composite now POSITIVE vs baseline but mean -0.003 dragged by bull -0.034. NEXT: spare strong-trend-aligned winners (pos_dir agrees ret_vlong) to recover bull (ret_vlong~0.075) while harvesting rally ct pullback shorts + mixed weak-trend (ret_vlong~0.033).
edf1f676	0.642816	0.699870	0.190180	0.675622	0.722088	1.007901	0.684814	0.408923	branch	branch step3 (trend-align spare via ret_vlong, NO-PROGRESS): multiply harvest by (1-0.85*tanh(ret_vlong*pos_dir/0.05)) to spare strong-trend-aligned bull winners. MEASURED vs 1d6e8b5c: composite 0.642816 (vs step2 0.686840 = -0.044 REGRESSION). bull 0.675622 (CRASHED, Sh 1.9948 FLAT but stability collapsed -> min_stab 0.719). MECH FAILURE: ret_vlong-gating at /0.05 puts bull ret_vlong~0.075 in tanh LINEAR region -> harvest amount tracks noisy ret_vlong -> bull size wobble across AR(1) -> stability collapse (the documented ret_vlong-gate-must-be-fast-saturating wall). And /0.01 fast-sat can't separate bull 0.075 from mixed 0.033 (both saturate). sideways 1.008 (+0.013 vs base), rally 0.685, mixed 0.409. Reverting step3 mechanism; step4 tries harvest-magnitude reduction on the step2 giveback-gated form.
cb7c7821	0.685884	0.750603	0.215732	0.96	0.73	0.99	0.66	0.40	keep	BASELINE re-verified (session start): reverted dangling PnL-path-choppiness branch (288b0614, composite 0.686840 = +0.000956 sub-threshold no-progress) to keep 1d6e8b5c via path-scoped checkout. strategy.py byte-identical to 1d6e8b5c (0 diff). Reproduces composite 0.685884 mean 0.750603 std 0.215732 [bull 0.962118, crash 0.731300 Sh1.27 100pctWR, sideways 0.994833 Sh2.0, rally 0.660252 streak_gate 0.875, mixed 0.404513 Sh0.804 DD2.80pct 44t sample_factor 0.938; ALL stab 1.0 raw==score, min_stab 0.810456]. mixed_2025 binding (0.40 vs 0.66-0.99).
cb7c7821	0.621644	0.679338	0.192312	0.61	0.73	1.00	0.66	0.40	discard	Exp1 (architectural, indep): MTM-STAGNATION exit pressure (8th soft source in MAX fusion). path_eff=|net pos_pnl|/sum|d pos_pnl| over 10-bar window, pressure on (low path_eff AND oscillation amp AND giveback>0 AND held>=5), profit-side (_w_stag=max(0,_pnl_scale)), max 0.45, fed into exit MAX. MEASURED vs cb7c7821 0.685884: composite -0.064240 (0.621644), mean -0.071265. ANTI-SELECTIVE FAILURE: bull 0.962118->0.607473 (-0.354645 DOMINANT) but mixed_2025 0.404513->0.402345 (-0.002168 FLAT, Sharpe 0.804->0.801 unchanged = the TARGET regime is INERT to this mechanism). crash -0.0018, sideways +0.0010, rally +0.0012 (sub-noise). KEY FINDING: the stagnation metric fires on BULL_2021 long holds (high-vol uptrend -> choppy MTM path while net-positive -> low path_eff + oscillation + giveback all trip) cutting bull Sharpe/return, but does NOT bind on mixed_2025 (mixed holds exit via other MAX-fusion terms before stagnation pressure exceeds them, OR are shorter than STAG_MIN_BARS). Exit-pressure-MAX addition is NOT mixed-selective. Not branch-worthy: target regime inert, only sub-noise sideways/rally gain, bull catastrophic. Reverted to cb7c7821. Architectural discard #1.
cb7c7821	0.590224	0.672719	0.274982	0.92	0.74	0.99	0.30	0.40	discard	Exp2 (architectural simplification, indep): REMOVE counter-trend emitted-target EMA (_target_ema, alpha 0.99 freeze on ct held positions). Hypothesis: stability-era machinery (added k=0.5 era), unscored now that all stab factors 1.0. REFUTED. MEASURED vs cb7c7821 0.685884: composite -0.095660 (0.590224), mean -0.077884, std +0.059250. PER-REGIME: rally 0.660252->0.302418 (-0.357834 = -54pct, BREACHES 50pct gate) via rally STABILITY 0.810->0.685769 (drops below 0.80 knee -> stability_factor ~0.62 penalty); bull 0.962118->0.918121 (-0.044, stab 1.0->0.958); crash 0.731300->0.743711 (+0.012); sideways 0.994833->0.994833 BYTE-IDENTICAL; mixed_2025 0.404513->0.404513 BYTE-IDENTICAL (CONFIRMS mixed positions do NOT pass through the ct-EMA path -- mixed is trend-aligned-held or sub-ret_vlong-gate). KEY FINDING: the _target_ema is NOT vestigial -- it is actively load-bearing for RALLY stability (holds rally ct-pullback-short held-position values constant across the AR(1) noise ensemble, keeping rally above the 0.80 knee). Removing it is the rally-stability collapse its own comment warned of. Stability is NOT binding only BECAUSE this EMA holds it there. Not branch-worthy (rally breaches 50pct gate, mixed inert -- no recoverable target signal). Reverted to cb7c7821. Architectural discard #2.
cb7c7821	0.663228	0.726539	0.211034	0.92	0.66	0.99	0.65	0.40	discard	Exp3 (architectural, indep): SUSTAINED held-LONG de-risk in multi-day downtrend (held target *= 1-0.40*tanh(max(0,-ret_vlong)/0.012) for current_pos>0,target>0, applied before target_ema). Hypothesis: mixed is 100pct long all year in a down market; sustained long de-risk on negative ret_vlong lifts Sharpe. REFUTED ON TARGET. MEASURED vs cb7c7821 0.685884: composite -0.022656 (0.663228), mean -0.024064. PER-REGIME: mixed_2025 0.404513->0.404513 BYTE-IDENTICAL (Sharpe 0.804/APY4.40/DD2.80 ALL unchanged -- the de-risk does NOT reach mixed: mixed only RESIZES at bars where ret_vlong>=0, OR its grind-down has multi-day up-swings so ret_vlong is positive at resize bars); crash 0.731300->0.659466 (-0.072 Sh1.273->1.129, crash IS reached -- bounce-longs in negative multi-day trend get de-risked, hurting return-limited crash); bull 0.962118->0.919605 (-0.043, ret_vlong dips negative in bull pullbacks); rally 0.660252->0.654277 (-0.006); sideways BYTE-IDENTICAL (positive ret_vlong, spared as designed). KEY FINDING (3rd confirmation this session): mixed_2025 is INERT to ret_vlong-gated held-size logic, just as it was inert to exit-pressure-MAX (Exp1) and the ct target-EMA (Exp2). mixed resizes do not coincide with negative multi-day trend. The negative-ret_vlong gate fires on crash/bull pullbacks (hurting them) but NOT on mixed. CROSS-EXPERIMENT: mixed is 100pct-long-all-year (BTC-6/ETH-12/SOL-35pct down year) and structurally unreachable by every targeted held-size/exit mechanism tested. Not branch-worthy (target inert, only regressions elsewhere). Reverted to cb7c7821. Architectural discard #3.
cb7c7821	0.679066	0.744097	0.216770	0.93	0.72	1.01	0.66	0.40	discard	Exp4 (architectural, indep): UNIFORM held-resize de-risk k=0.90 (every same-sign held resize target *= 0.90, never below current_pos), placed before target_ema. Hypothesis from monkeypatch-probe: scaling held resize size down lifts mixed 0.804->1.169 + rally 1.526->1.612 Sh (cost sideways 2.002->1.738), net composite est +0.03. REFUTED IN-STRATEGY. MEASURED vs cb7c7821 0.685884: composite -0.006818 (0.679066), mean -0.006506. PER-REGIME Sharpes NEARLY INERT: mixed 0.804->0.807 (NOT 1.169!), sideways 2.002->2.008, rally 1.526->1.527, bull 2.000->1.996. Scores: bull -0.034, crash -0.006, sideways +0.018, rally -0.002, mixed -0.008. KEY FINDING (critical): the in-strategy cut placed BEFORE the order-emission layer (target_ema + grid-quantize + snap-deadband + abs(delta)>1.0*LEVERAGE_K emission threshold) is NEUTRALIZED by those downstream quantization layers -- a 10pct target reduction gets re-quantized back onto the same grid/snap level so the emitted trade is ~unchanged. The monkeypatch probe (mixed 0.804->1.303 at k=0.85) worked ONLY because it scaled the FINAL emitted Signal AFTER all strategy logic, bypassing the emission layer. ROOT-CAUSE for the 3 prior mixed-inert results (Exp1/2/3): the order-emission quantization/deadband/threshold layer absorbs held-size changes -> mixed (and held resizes generally) are structurally insulated from upstream size logic. The reachable lever requires changing the EMISSION layer itself, not the upstream target. Not branch-worthy (target inert, bull regressed). Reverted to cb7c7821. Architectural discard #4.
