commit	score	mean_score	std_score	bull_2021	crash_bear	sideways	rally_2024	status	description
92a093e6	0.626746	0.674995	0.160832	0.42	0.66	0.93	0.72	0.64	branch	Exp5 (architectural, BRANCH OPEN): EMISSION-LAYER held-resize de-risk k=0.90 (final emitted same-sign held-resize target *= 0.90, downstream of grid/snap/EMA -- the ONE placement Exp4 proved is not re-quantized away; growth-only guard REMOVED -- diagnostic isolated that the lift comes from scaling REDUCTIONS harder = exit-acceleration on partial trims). MEASURED vs cb7c7821 0.685884: composite -0.059138 (0.626746), mean -0.075608, std -0.054900 (TIGHTER). PER-REGIME: mixed_2025 0.404513->0.642277 (+0.237764!! Sh0.804->1.169 DD2.80->1.34 -- the binding regime FINALLY moved), rally 0.660252->0.721769 (+0.061517 Sh1.526->1.612), sideways 0.994833->0.925256 (-0.070 Sh2.002->1.738), crash 0.731300->0.662240 (-0.069 Sh1.273->1.138), bull_2021 0.962118->0.423433 (-0.538685 CATASTROPHIC -56pct Sh2.00->1.16 BREACHES 50pct gate). ALL stab still healthy (min 0.816). BRANCH JUSTIFICATION: (1) NEW mechanism = emission-layer resize de-risk (first lever this session to move the structurally-inert mixed_2025, +0.237). (2) bull regressed because UNIFORM held-resize trimming destroys bull_2021 strong trend-riding -- bull NEEDS to hold/grow winners, trimming them harder cuts its Sh2.0 trend capture. (3) FIX hypothesis: gate the de-risk OFF for strong trend-aligned WINNERS (bull signature: trend-aligned + profitable + smooth) while keeping it for choppy/wrong-side held resizes (mixed/rally signature). The mixed+rally gain (+0.30 combined) is large enough that recovering bull yields a clear keep. Branch step 1.
12c658d8	0.703095	0.750039	0.156478	0.84	0.68	1.00	0.67	0.56	branch	Branch step2 (trend-aligned-winner spare on emission-layer resize de-risk): _hr_spare=tanh(ret_long*pos_dir/0.04)*tanh(pos_pnl/|stop|), de-risk=1-(1-0.90)*(1-spare). MEASURED vs cb7c7821 0.685884: composite +0.017211 (0.703095) ABOVE +0.003 threshold, std 0.2157->0.1565 (much tighter), BUT mean_score 0.750039 vs 0.750603 = -0.000564 (FAILS mean-improvement keep gate by a hair). PER-REGIME vs baseline: mixed 0.404513->0.556007 (+0.151494!), rally 0.660252->0.671143 (+0.011), sideways 0.994833->1.004674 (+0.010), crash 0.731300->0.676883 (-0.054), bull 0.962118->0.841488 (-0.121, RECOVERED from step1 -0.539 via the spare but still below baseline). All regimes pass 50pct gate, all stab healthy (min 0.833). NOT yet keepable: composite passes but mean fails (-0.0006). Branch continues: strengthen the trend-aligned-winner spare to recover more bull/crash while holding mixed gain.
-	0.679851	0.732893	0.176808	0.82	0.71	1.00	0.67	0.46	branch	Branch step3 (restrict emission de-risk to REDUCTIONS only, |target|<|current_pos|): MEASURED vs cb7c7821 0.685884: composite -0.006033 (0.679851), mean -0.017710. NO-PROGRESS vs step2 (raw_composite 0.703->0.680, DOWN). PER-REGIME vs baseline: mixed 0.459076 (DROPPED from step2 0.556 -- the GROWTH-resize trim was contributing to mixed gain; restricting to reductions lost it), bull 0.822365 (still -0.140, only marginally better than step2 -0.121), crash 0.713928 (recovered from step2 0.677), rally 0.672844, sideways 0.996252. CONCLUSION: reductions-only restriction hurts mixed MORE than it helps bull -- step2 (all same-sign resizes + trend-aligned-winner spare) is the better branch state. Reverted strategy.py to step2 (12c658d8). Branch continues: strengthen the trend-aligned-winner spare from step2 to recover bull/crash mean drag.
-	0.664858	0.714999	0.167136	0.70	0.68	1.02	0.66	0.51	branch	Branch step4 (strengthen spare: either-horizon max(ret_long,ret_vlong)-align + breakeven-floored profit): MEASURED vs cb7c7821 0.685884: composite -0.021026 (0.664858). NO-PROGRESS vs step2 (raw 0.703->0.665 DOWN). BACKFIRED: bull 0.841->0.702 (WORSE not better -- the ret_vlong either-horizon max over-sprayed, sparing mixed/rally beneficial trims while not helping bull), mixed 0.556->0.510 (lost gain). CONCLUSION: step2 simple ret_long*pos_dir*profit spare is better than either-horizon max. Reverted to step2 (12c658d8). Branch continues: try gentler k (0.90->0.93) on step2 spare to reduce bull/crash drag while keeping mixed.
-	0.675765	0.723467	0.159007	0.72	0.69	1.01	0.67	0.52	branch	Branch step5 (gentler k=0.90->0.93): MEASURED vs cb7c7821 0.685884: composite -0.010119 (0.675765). NO-PROGRESS vs step2 (raw 0.703->0.676 DOWN). NON-MONOTONIC: gentler trim made bull WORSE (0.841->0.722) and mixed worse (0.556->0.521) -- de-risk feeds back into loss-streak/cooldown/peak state which cascades non-linearly, so k is not a clean monotone dial. step2 (k=0.90) remains best branch state. Reverted to step2. Branch continues.
-	0.669875	0.717299	0.158079	0.71	0.69	1.00	0.66	0.52	branch	Branch step6 (soften profit co-factor floor 0.5, keep step2 ret_long-align): MEASURED vs cb7c7821 0.685884: composite -0.016009 (0.669875). NO-PROGRESS vs step2 (raw 0.703->0.670 DOWN). Sparing MORE made bull WORSE (0.841->0.711) + mixed worse (0.556->0.521) -- CONFIRMS non-monotonic state feedback (loss-streak/cooldown/peak cascade): spare-more != bull-better. step2 remains best. Reverted to step2. 4th consecutive no-progress (steps 3,4,5,6). Branch continues: try STRONGER k=0.85 (probe showed mixed Sh peaks at lower k; feedback non-monotone so test the other direction).
-	0.682179	0.724582	0.141343	0.72	0.65	1.00	0.64	0.61	branch	Branch step7 (stronger k=0.85): MEASURED vs cb7c7821 0.685884: composite -0.003705 (0.682179), std 0.141 (tightest). mixed 0.614 (higher) but bull0.719/crash0.653/rally0.639 all lower -> net below step2. step2(k0.90) is the clear PEAK of this mechanism (steps 3-7 all < 0.703). Reverted to step2. Branch continues: step2 fails ONLY mean gate (-0.0006); try a precise nudge.
-	0.676299	0.727873	0.171914	0.74	0.68	1.03	0.68	0.50	branch	Branch step8 (hold-duration ramp, spare short scalps): MEASURED vs cb7c7821 0.685884: composite -0.009585 (0.676299). NO-PROGRESS vs step2. Ramp delayed de-risk -> mixed gain lost (0.556->0.504), crash barely moved (0.684). step2 still peak. Reverted to step2. Branch: try concentration-gate (spare single-position holds, de-risk only multi-correlated-long pileups = mixed signature).
-	0.690962	0.735989	0.150089	0.77	0.68	1.00	0.68	0.56	branch	Branch step9 (concentration gate: de-risk correlated same-side pileups, spare isolated holds): MEASURED vs cb7c7821 0.685884: composite +0.005078 (0.690962) ABOVE +0.003 BUT mean 0.735989 < 0.750603 (FAILS mean gate). mixed 0.556 (full gain kept), rally 0.676, sideways 1.005, crash 0.677, bull 0.767 (LOWER than step2 0.841 -- concentration gate made bull worse). NO-PROGRESS vs step2 (raw 0.703->0.691). step2 still peak. Reverted to step2. Branch: try growth-side boost for trend-aligned winners to recover bull mean.
-	0.692864	0.739190	0.154418	0.84	0.68	0.98	0.64	0.55	branch	Branch step10 (growth-side +4pct boost for trend-aligned winners): MEASURED vs cb7c7821 0.685884: composite +0.006980 (0.692864) ABOVE +0.003 BUT mean 0.739190 < 0.750603 (FAILS mean gate). bull 0.842 (flat vs step2), sideways 0.983 (hurt), rally 0.644 (hurt). NO-PROGRESS vs step2 (0.703). step2 still peak after 8 refinements (steps 3-10 all < 0.703). Reverted to step2. Branch: final k-scan k=0.88 (non-monotone; mixed dominates mean delta).
-	0.679708	0.723651	0.146477	0.69	0.67	1.01	0.67	0.58	branch	Branch step11 (k-scan 0.88): composite 0.679708 < step2. mixed higher (0.579) but bull crashed (0.691). step2 (k=0.90) is the unbeaten PEAK across full k-range [0.85,0.93] and all 9 gate refinements (steps 3-11). Branch CONCLUDING: revert.
-	-	-	-	-	-	-	-	-	session-summary	SESSION (baseline cb7c7821==1d6e8b5c 0.685884 5-regime -> UNCHANGED, no keep): cleaned 1 dangling branch (prior PnL-path-choppiness, reverted) + 4 independent architectural discards (Exp1-4) + 1 exploration branch (Exp5, 11 steps, REVERTED). Baseline re-verified byte-identical 0.685884 at session start AND post-branch-revert [bull 0.962118, crash 0.731300 Sh1.27 100pctWR, sideways 0.994833 Sh2.0, rally 0.660252, mixed 0.404513 Sh0.804; ALL stab 1.0 raw==score]. results.tsv append-only preserved (path-scoped git checkout -- strategy.py throughout). THEME: structural diagnosis of mixed_2025 (the binding regime, 0.405 vs 0.66-0.99) + the order-emission layer. KEY MEASURED FINDINGS (all verifiable this session): (1) mixed_2025 STRUCTURE: the strategy is 100pct LONG every bar all year (BTC -6/ETH -12/SOL -35pct = a DOWN year), opens 3 longs and never flips/exits, realizes via 54 small positive resizes. Sharpe 0.804 (100pct closed-WR but choppy held-equity, equity-return lag1 autocorr -0.427 = severe MTM whipsaw, the ONLY regime with strongly negative eq-autocorr). Under-returns (4.4pct APY at 2.8pct DD). (2) mixed is UNDETECTABLE by online signals: variance-ratio (mixed 0.884 vs sideways 0.813 -- WRONG direction), price-return autocorr (all regimes ~0 +/-0.04), equity-curve efficiency (all ~0.21), ROLLING eq-autocorr (no separation at usable windows). The -0.427 full-sample autocorr does NOT survive to any online-measurable timescale -- confirms the documented mixed structural-invariance wall. (3) Exp1 (MTM-stagnation exit pressure, 8th MAX-fusion source): composite -0.064, bull -0.355 (fired on bull choppy-but-net-positive holds) but mixed BYTE-IDENTICAL -- exit-pressure-MAX additions do not bind on mixed (mixed exits via other terms first). (4) Exp2 (REMOVE ct target-EMA, stability-era machinery): composite -0.096, rally stability 0.810->0.686 (below 0.80 knee, -54pct breaches gate), mixed BYTE-IDENTICAL. The target-EMA is NOT vestigial -- it is load-bearing for rally stability (the ONLY reason all stab factors are 1.0). (5) Exp3 (sustained ct-long de-risk on negative ret_vlong): composite -0.023, crash -0.072, mixed BYTE-IDENTICAL (mixed resizes do not coincide with negative ret_vlong). (6) Exp4 (uniform held-resize de-risk k=0.90, UPSTREAM placement): composite -0.007, NEARLY INERT everywhere (mixed Sh 0.804->0.807) -- ROOT-CAUSE DISCOVERY: the order-emission layer (target_ema + grid-quantize + snap-deadband + abs(delta)>1.0*LEVERAGE_K threshold) RE-QUANTIZES an upstream target cut back onto the same lattice level, NEUTRALIZING it. This is WHY mixed (and held resizes generally) are inert to all upstream size logic. (7) Exp5 BRANCH (emission-layer held-resize de-risk, downstream of all quantization -- the ONE placement not absorbed): FIRST mechanism to move mixed_2025 in many sessions. Diagnostic isolated the active lever = scaling REDUCTIONS harder (exit-acceleration on partial trims of a wrong-side book). Branch step2 (k=0.90 + trend-aligned-winner spare _hr_align*_hr_profit): composite +0.017211 (0.703095), mixed 0.404513->0.556007 (+0.151!!), rally +0.011, sideways +0.010, crash -0.054, bull -0.121 (recovered from step1 uniform -0.539 via the spare). ALL regimes pass 50pct gate, all stab healthy. BUT mean_score 0.750039 < 0.750603 (-0.000564) -- FAILS the mean-improvement keep gate by a hair (composite gain is ALL from std reduction 0.216->0.156, a pure variance-reduction trade). Steps 3-11 (9 refinements: reductions-only, either-horizon spare, k=0.85/0.88/0.93, profit-floor softening, hold-duration ramp, concentration gate, growth-side boost) ALL underperformed step2 -- step2 is the unbeaten efficient-frontier peak of this mechanism, and the system has NON-MONOTONE state feedback (loss-streak/cooldown/peak cascade) so spare-more != bull-better. Branch reverted (best state fails mean gate). CONCLUSIONS FOR FUTURE SESSIONS: (A) the emission-layer resize-derisk is a REAL mechanism that lifts mixed +0.15 -- the FIRST to break mixed inertness. It is blocked ONLY by the mean gate (it trades bull/crash mean for mixed/std). If a future scoring revisit lowers the mean-gate hardness OR raises std-weight k, this becomes an immediate keep. (B) the binding tension is FUNDAMENTAL: the same emission-trim that lifts worst-regime mixed lowers best-regimes bull/crash, netting mean ~flat; no gate refinement separated them (non-monotone feedback). (C) ROOT CAUSE of mixed inertness now known: upstream size logic is re-quantized away by the emission layer; only emission-layer changes reach mixed. Future mixed work MUST act at emission. (D) mixed is 100pct-long-in-a-down-year and statistically undetectable online -- its low Sharpe is structural (wrong-side persistent long), not a fixable signal defect. NEW BASELINE 0.685884 unchanged.
6d68e5df	0.635630	0.691994	0.187880	0.678855	0.693458	0.987989	0.705217	0.394450	branch	Exp1 (architectural, BRANCH OPEN): MTM-path-efficiency emission-layer REDUCTION throttle. New per-position pos_pnl 12-bar path state; eff=|net|/sum|delta|; chop=1-eff; reduction resize distance *= (1+0.60*chop), reduction-only, downstream of all quantization. MEASURED vs cb7c7821 0.685884: composite -0.050254, mean -0.058609, std 0.215732->0.187880 (tighter). PER-REGIME all stab 1.0 raw==score all DD<10pct: bull 0.962118->0.678855 (-0.283 Sh2.0->1.628 -- winning-long de-risk trims over-amplified, bull winners have choppy intra-hold MTM too), crash 0.731300->0.693458 (-0.038), sideways 0.994833->0.987989 (-0.007), rally 0.660252->0.705217 (+0.044965 Sh1.526->1.583 DD5.19->5.10 -- choppy pullback positions trimmed faster = less giveback; consistent with prior stale-loss lever rally +0.04 now UNBLOCKED at stab 1.0), mixed 0.404513->0.394450 (-0.010 -- MTM-chop did NOT isolate mixed as hypothesized). (1) new mechanism (2) bull regressed: throttle over-amplifies bull WINNING-long de-risk trims (3) FIX: gate throttle on low/negative pos_pnl to spare net winners (bull longs high pos_pnl) while trimming rally's choppy losing/breakeven positions. Branch open.
-	0.637801	0.694582	0.189270	0.670195	0.725205	1.002209	0.667447	0.407854	branch	Branch step2 (profit-fade gate on MTM-chop throttle: full at pos_pnl<=0 fading ~0 for strong winners). MEASURED vs cb7c7821 0.685884: composite -0.048083, mean 0.694582 (raw_composite step1 0.691994->step2 0.694582 = +0.002588 PROGRESS monotone up). PER-REGIME vs baseline: bull 0.678855->0.670195 (still -0.29, profit-fade did NOT fix bull -- bull loss is NOT from winning-trim), crash 0.693->0.725205 (recovered), sideways 0.988->1.002209 (above baseline), rally 0.705217->0.667447 (gain SHRANK +0.045->+0.007 -- profit-fade KILLED rally gain), mixed 0.394->0.407854 (+0.003). KEY LEARNING: rally's benefit is from trimming choppy WINNING-but-grinding positions (profit-fade removed them); bull loss not from winning-trim. Real separator = VOL REGIME: bull-2021 high-vol SHARP uptrend (pullbacks recover fast, trim hurts) vs rally low-vol GRIND (pullbacks deeper, trim helps) -- documented separator. Step3: replace profit-fade with low-vol grind gate.
-	0.662265	0.720747	0.194938	0.809016	0.693458	0.994477	0.712333	0.394450	branch	Branch step3 (low-vol grind gate: throttle full at vol_ratio<=0.8, fade to 0 at vol_ratio>=1.3, replaces step2 profit-fade). MEASURED vs cb7c7821 0.685884: composite -0.023619 (0.662265), mean 0.720747 (raw_composite step2 0.694582->step3 0.720747 = +0.026165 PROGRESS monotone up). PER-REGIME vs baseline: bull 0.678855->0.809016 (RECOVERED from step1, still -0.153 vs base 0.962 -- residual = winning-long trims in bull calm stretches), crash 0.693458 (-0.038), sideways 0.994477 (flat), rally 0.660252->0.712333 (+0.052081 Sh1.526->1.602 -- BIGGER than step1, binding regime), mixed 0.394450 (-0.010 not helped). The vol-grind gate WORKS (separates rally low-vol grind from bull high-vol sharp). Remaining: bull -0.153 (deep winning-long trims), crash -0.038, mixed -0.010. PATH TO KEEP: spare bull/crash DEEP winners (soft profit fade only at large pos_pnl) while keeping rally's modest-PnL trims -> mean ~0.76>0.7506, composite ~0.70. Step4: add soft deep-winner profit fade x grind gate.
-	0.668397	0.727703	0.197685	0.807244	0.720966	1.022582	0.675152	0.412568	branch	Branch step4 (deep-winner fade scale 2.5x stop x grind gate). MEASURED vs cb7c7821 0.685884: composite -0.017487 (0.668397), mean 0.727703 (raw_composite step3 0.720747->step4 0.727703 = +0.006956 PROGRESS monotone). PER-REGIME vs baseline: bull 0.809016->0.807244 (FLAT -- deep-winner fade did NOT recover bull, bull loss is NOT deep winners), crash 0.693458->0.720966 (recovered, -0.010), sideways 0.994477->1.022582 (+0.028 above base), rally 0.712333->0.675152 (shrank +0.052->+0.015, deep fade ate rally), mixed 0.394450->0.412568 (+0.018, above base). KEY: bull -0.155 is now the ENTIRE remaining gap (all other regimes at/above baseline). bull loss is trimming bull pullback positions that RECOVER (sharp bull); grind gate threshold 1.3 too permissive (bull moderate-vol stretches pass). Step5: sharpen grind gate (lower center) to exclude bull's moderate vol while keeping rally's calm grind.
-	0.688340	0.753675	0.217782	0.961321	0.728019	1.009945	0.660360	0.408729	branch	Branch step5 (strong-uptrend fade ret_vlong*pos_dir /0.02 x grind gate, replaces deep-fade). MEASURED vs cb7c7821 0.685884: composite +0.002456 (0.688340 JUST UNDER +0.003 keep thresh), mean 0.753675 (+0.003072 >0.7506 PASSES mean gate), std 0.217782 (raw_composite step4 0.727703->step5 0.753675 = +0.025972 PROGRESS). PER-REGIME vs baseline: bull 0.807244->0.961321 (RECOVERED to ~baseline 0.962 -- strong-uptrend fade IS the bull fix), crash 0.728019 (-0.003), sideways 1.009945 (+0.015 above base), rally 0.712->0.660360 (gain GONE -- fade /0.02 from zero faded rally too, rally fade 0.71), mixed 0.408729 (+0.004 above base). Net gain now from sideways+mixed; bull/crash/rally ~flat. KEY: bull(ret_vlong~0.027) and rally(~0.006) WELL-SEPARATED in multi-day trend strength. Step6: SHIFTED fade (steep transition centered ~0.016) keeps rally full throttle (fade~1) while sparing bull (fade~0) -> recover rally +0.05 -> composite ~0.70 KEEP.
-	0.685397	0.750453	0.216853	0.961549	0.725537	0.999895	0.660784	0.404501	branch	Branch step6 (shifted steep fade center 0.016 width 0.006). MEASURED vs cb7c7821 0.685884: composite -0.000487 (0.685397), raw_composite step5 0.753675->step6 0.750453 = -0.003222 NO-PROGRESS (regression vs step5). PER-REGIME: bull 0.961549 (spared, ~base), crash 0.725537, sideways 1.009945->0.999895 (LOST step5 gain), rally STILL 0.660784 (did NOT recover -- rally's beneficial trims NOT cleanly separable from bull by ret_vlong at trim-time; the documented bull/rally non-separability wall), mixed 0.408729->0.404501 (LOST gain). The shift hurt sideways+mixed via non-monotone state feedback without recovering rally. step5 remains branch PEAK (0.688340). Restoring step5 fade. No-progress #1.
-	0.688330	0.753759	0.218096	0.961052	0.725744	1.011493	0.662055	0.408450	branch	Branch step7 (amplitude 0.60->0.80). MEASURED vs cb7c7821 0.685884: composite +0.002446 (0.688330), mean 0.753759 (raw step5 0.753675->step7 0.753759 = +0.000084 FLAT, amplitude SATURATED). PER-REGIME deltas vs baseline: bull -0.001066, crash -0.005556, sideways +0.016660, rally +0.001803, mixed +0.003937. KEY: the ONLY negative deltas are crash (-0.0056) and bull (-0.001). COMPUTED: recovering crash to baseline 0.7313 alone -> mean 0.75487 std 0.21797 composite 0.68948 > 0.688884 KEEP THRESH. sideways(+0.017)+mixed(+0.004) have aligned_vlong~0/<0 -> strong_trend_fade leaves them FULLY throttled = UNAFFECTED by fade scale; only bull/crash/rally (trending) gated by it. Step8: tighten fade scale 0.02->0.012 to spare crash bounce-trims MORE without touching sideways/mixed.
-	0.685677	0.750485	0.216025	0.961851	0.728022	0.996465	0.661662	0.404424	branch	Branch step8 (tighten fade scale 0.02->0.012). MEASURED vs cb7c7821 0.685884: composite -0.000207 (0.685677), raw step7 0.753759->step8 0.750485 = -0.003274 NO-PROGRESS. crash 0.725744->0.728022 (barely +0.0023, did NOT fully recover) BUT sideways 1.011493->0.996465 (-0.015 LOST) + mixed 0.408450->0.404424 (-0.004 LOST) -- NON-MONOTONE STATE FEEDBACK: tightening fade changed crash trim -> cascaded into sideways/mixed via shared loss-streak/cooldown/peak state (documented cascade). step7 (0.688330) remains PEAK. No-progress #2. Restoring step7. Step9: gate throttle on near-breakeven-or-losing pos_pnl (mixed dead capital low-PnL; crash reduced-shorts are winners) -- distinct from step2 continuous profit-fade.
