commit	score	mean_score	std_score	bull_2021	crash_bear	sideways	rally_2024	status	description
-	-	-	-	-	-	-	-	-	session-summary	BRANCH SUMMARY (tp_harvest threshold/magnitude tuning, 5 steps, REVERTED to 99a369a1): opened after Exp5 keep (the multi-day _ts_supp fix unblocked the prior crash wall, motivating a re-test of the tp_mag/threshold levers the prior session found walled). Step1 (threshold 1.6->1.5 fixed): mixed +0.0068 (BIG -- lower threshold reaches mixeds MODERATE peaks not just deep ones) BUT sideways -0.035 (premature harvest of small mean-reverting peaks); crash stability HELD at 1.0 (multi-day _ts_supp shield WORKS -- the prior crash-stability wall at 1.45 is LIFTED by Exp4). Composite -0.0023. Step2 (trend-adaptive threshold 1.6chop->1.5trend): recovered sideways +0.0175 but lost mixed -0.0045 (trend gate excluded mixeds moderate peaks -- mixed is choppy/low-trend). Step3 (steeper trend gate): no-progress -0.001, mixed back to baseline. Step4 (raise chop ceiling 1.65->1.5trend): sideways FULLY recovered (byte-identical) BUT mixed back to baseline (1.65 ceiling raised mixeds threshold too). Composite +0.0012 sub-noise. Step5 (chop-reduced magnitude): -0.032 regression, bull crashed. CONCLUSION: the tp_harvest threshold/magnitude axis is WALLED by the mixed/sideways LOW-TREND OVERLAP -- mixed and sideways BOTH occupy the low-rsi_trend_str regime (mixed is a choppy down-year, sideways is chop), so ANY rsi_trend_str-based gate that protects sideways ALSO blocks mixed (and vice-versa: reaching mixed requires the low threshold that also hits sideways). This is the SAME structural overlap wall the prior session hit on vol_ratio (mixed/crash overlap 0.40-0.61) -- now confirmed on the trend-strength axis too (mixed/sideways overlap on rsi_trend_str). The multi-day _ts_supp fix (Exp4) lifted the CRASH wall (threshold 1.5 now crash-stable) but the mixed/sideways overlap wall remains: there is NO single-quantity separator that reaches mixed without also hitting sideways (or crash, or bull). mixed +0.0068 in step1 is the max mixed gain reachable via threshold-lowering, but it costs sideways -0.035 (3.3x asymmetry) -> net negative. Reverted to 99a369a1 (Exp5 keep, composite 0.706007 -- the 2 keeps Exp4+0.0065 and Exp5+0.0102 stand; +0.0167 session total). KEY FOR FUTURE SESSIONS: (a) Exp4 multi-day ret_vlong _ts_supp is a KEEP -- it correctly keys the tp-harvest trend-extension suppression to the multi-day scale (the 20-bar ret_long was a scale-mismatch); (b) Exp5 magnitude 0.30->0.45 is a KEEP -- the multi-day shield unblocked the crash wall, reaching mixed +0.0025; (c) the magnitude ceiling is now BULL-walled at 0.58 (was crash-walled at 0.50 under 20-bar _ts_supp) -- bull-2021s ret_vlong is less consistently saturated than rallys grinding uptrend; (d) the threshold-lowering path is mixed/sideways-overlap-walled -- mixed and sideways share the low-trend regime, no rsi_trend_str gate separates them; (e) crash stability at threshold 1.5 is now SAFE (multi-day _ts_supp holds) -- the prior 1.45 crash-stability wall is lifted, so future threshold experiments need not fear crash stability. NEW BASELINE 99a369a1 0.706007 UNCHANGED (branch reverted).
0e7c3649	0.705780	0.778603	0.242745	1.025954	0.720321	1.066580	0.669171	0.410990	discard	Exp1 (architectural, indep): DEEP-PEAK-BYPASSED tp_harvest activation gate. _tp_trend_gate = max(tanh(|ret_long|/0.04), tanh((tp_ratio-3.0)/1.0)) -- let peak DEPTH bypass the 20-bar trend requirement for genuinely deep peaks (tp_ratio>=4). Symmetric counterpart to Exp4 keep (which fixed _ts_supp SUPPRESSION scale-mismatch ret_long->ret_vlong; this fixes the ACTIVATION scale-mismatch). Hypothesis: mixed deep oscillating peaks form during modest local bounces (low |ret_long|) where the trend gate partially blocks harvest; depth-bypass reaches them while sparing sideways small peaks (tp_ratio~1.6-2.5). MEASURED vs 99a369a1 0.706007: composite 0.705780 (-0.000227 sub-noise FAIL), mean 0.778603 (-0.000200 FAIL). PER-REGIME all stab 1.0 raw==score: bull BYTE-IDENTICAL 1.025954 (Sh2.0678), crash BYTE-IDENTICAL 0.720321 (Sh1.2539 -- _ts_supp~1 suppresses trend-aligned), sideways BYTE-IDENTICAL 1.066580 (small peaks tp_ratio<3 -> bypass 0 -> trend-gate held, PROTECTED as designed), rally 0.670171->0.669171 (-0.001000 Sh1.5529->1.5502 -- deep-peak-bypass fired on rally COUNTER-TREND shorts during pullbacks where _ts_supp not fully 1 -> premature harvest), mixed BYTE-IDENTICAL 0.410990 (Sh0.8075 -- TARGET MISSED). FAILURE MECH (architectural fact): mixed byte-identical proves the activation gate is NOT the binding blocker on mixed deep peaks -- they already saturate _tp_trend_gate (deep peaks form during strong-enough local bounces that |ret_long|/0.04 already ~1). The rally regression proves deep-peak-bypass is NOT mixed-specific (rally ct peaks are also deep). Extends documented mixed wall: harvest magnitude (0.45) AND activation are both maxed for mixed deep peaks; residual mixed low-Sharpe is grid-absorption + intrinsic MTM oscillation, not activation gating. Reverted to 99a369a1.
603f8793	0.703877	0.775752	0.239583	1.026021	0.720465	1.053033	0.667895	0.411346	discard	Exp2 (architectural, indep): CHOP-MODULATED winner_fade in MTM-chop throttle. _winner_fade *= (1 - 0.50*_mtm_chop) so SMOOTH winners (crash profit-takes, low chop) keep full fade (spared, crash-protecting) while CHOPPY winners (mixeds oscillating moderate peaks) get fade reduced -> throttle active -> moderate peaks trimmed. New control-flow dep: winner_fade depends on MTM-chop x PnL conjunction. Hypothesis: winner_fade onset +0.5*stop kills the throttle for mixed MODERATE peaks (pos_pnl 1.5-3x stop, the prior sessions biggest mixed signal +0.0068 via threshold-lowering, walled sideways); chop-modulation reaches them while sparing crash (smooth). MEASURED vs 99a369a1 0.706007: composite 0.703877 (-0.002130 FAIL), mean 0.775752 (-0.003051 FAIL), std 0.242655->0.239583 (lower). PER-REGIME all stab 1.0 raw==score all DD<5.2pct all flip 0: bull 1.025954->1.026021 (+0.00007 noise), crash 0.720320->0.720465 (+0.000145 noise Sh1.2539->1.2541 -- CRASH PROTECTED as designed: smooth trend shorts keep full winner_fade), sideways 1.066580->1.053033 (-0.013547 Sh2.0270->2.0205 -- REGRESSED), rally 0.670171->0.667895 (-0.002276 Sh1.5529->1.5487 DD5.16->5.19), mixed 0.410990->0.411346 (+0.000356 Sh0.8075->0.8083 -- TARGET MOVED, moderate-peak path reachable). FAILURE MECH (architectural fact): mixed +0.000356 confirms the moderate-peak path IS reachable via the throttle (NOT grid-absorbed for moderate peaks where position is larger earlier in hold) -- the chop-modulation correctly let mixeds choppy moderate peaks get trimmed. BUT sideways is ALSO a chop regime (choppy winners) -> the chop-modulation reduced the fade for sideways winners too -> premature trimming -> sideways Sharpe down -0.0065. This is the SAME mixed/sideways overlap wall now confirmed on the CHOP dimension (prior: trend-strength overlap, vol_ratio overlap). mixed and sideways share choppy + low-trend + moderate-peak regime; no single-quantity separator (trend, vol, chop) distinguishes them. mixed gain tiny (+0.000356, throttle is grid-amplified modestly) vs sideways cost (-0.0135, 38x asymmetry). Not branch-worthy: same fundamental overlap wall as the reverted threshold-lowering branch (5 steps, walled); no new separator identified. Reverted to 99a369a1. STRUCTURAL FINDING: chop-modulated winner_fade is a NEW mechanism that reaches mixed moderate peaks (extending the deep-peak-only Exp5 keep path), confirming moderate peaks are NOT grid-walled; the blocker is the mixed/sideways chop-overlap (3rd dimension of the same wall).
c4849c9b	0.702376	0.774407	0.240105	1.026356	0.721142	1.049463	0.668051	0.407024	discard	Exp3 (architectural, indep): COUNTER-TREND-ISOLATING strong_trend_fade. Replace _strong_trend_fade = 1-tanh(max(0,product)/0.02) [1.0 for product<=0 incl NEUTRAL, fade for aligned] with max(0,tanh(-product/0.02)) [~0 at neutral product=0, 1.0 for counter-trend product<<0, 0 for aligned]. Full throttle ONLY for genuinely counter-trend-at-multi-day (mixed longs in downtrend, product<0); fade for neutral (sideways) and aligned (bull/rally). Uses the ONE dimension (multi-day counter-trend direction) distinguishing mixed from sideways. MEASURED vs 99a369a1 0.706007: composite 0.702376 (-0.003631 FAIL), mean 0.774407 (-0.004396 FAIL), std 0.242655->0.240105. PER-REGIME all stab 1.0 raw==score all DD<5.2pct all flip 0: bull 1.025954->1.026356 (+0.000402 noise Sh2.0678->2.0681), crash 0.720320->0.721142 (+0.000822 Sh1.2539->1.2549 small gain), sideways 1.066580->1.049463 (-0.017117 Sh2.0270->2.0124 -- REGRESSED WORSE than Exp2 -0.0135), rally 0.670171->0.668051 (-0.002120 Sh1.5529->1.5471), mixed 0.410990->0.407024 (-0.003966 -- SCORE DOWN but Sharpe UP 0.8075->0.8095: less trimming -> fewer realizing events -> lower APY/sample_factor outweighs the Sharpe gain). FAILURE MECH (architectural fact, INVERTS hypothesis): turning the throttle OFF for neutral (sideways) HURT sideways (-0.0171) because the baseline throttle trimming of sideways's moderate peaks is BENEFICIAL (sideways is mean-reverting -> trimming peaks LOCKS GAINS before they revert). mixed score also dropped (less trimming -> fewer realizes -> lower APY). This proves the baseline MTM-chop throttle is at a LOCAL OPTIMUM where BOTH mixed AND sideways BENEFIT from moderate-peak trimming -- they share the choppy-moderate-peak regime where trimming helps both. No gate (counter-trend, chop, trend-strength, vol) isolates them because the BENEFIT is shared, not just the activation. Exp2 over-trimmed sideways (chop-modulation reduced winner_fade); Exp3 under-trimmed sideways (turned throttle off); baseline 0.80 amp + 3 gates is the sweet spot. Reverted to 99a369a1. STRUCTURAL FINDING (3rd dimension of mixed/sideways wall): the coupling is not just on activation (which bars fire) but on BENEFIT (both regimes gain from trimming); the throttle cannot be mixed-isolated because mixed and sideways are the SAME regime type (choppy mean-reverting moderate peaks) at the throttle's operating point. mixed differs from sideways only in multi-day trend DIRECTION (down vs flat) which does NOT modulate the throttle benefit.
4fda378b	0.706007	0.778803	0.242655	1.025954	0.720320	1.066580	0.670171	0.410990	discard	Exp1 (architectural, indep): OWN-DVP-OPPOSITION exit pressure (7th soft MAX source). EXIT counterpart of the validated entry own-DVP boost (a465684a): a held winning long whose 12-bar own-DVP turns negative (sell-side volume = distribution) -> harvest. Profit-side only (avoids self-exclusionary wall), rare-event gated (DVP opposition >0.30 onset per MAX-fusion lesson). MEASURED vs 99a369a1 0.706007: BYTE-IDENTICAL composite 0.706007 mean 0.778803 std 0.242655, ALL 5 regimes score/Sh/AnnRet/MaxDD/trades byte-identical (bull 1.025954 Sh2.0678 51t, crash 0.720320 Sh1.2539 52t, sideways 1.066580 Sh2.0270 50t, rally 0.670171 Sh1.5529 101t, mixed 0.410990 Sh0.8075 43t). All stab 1.0, all flip 1.0. FAILURE MECH (architectural fact): the _do_pressure NEVER FIRES on any clean trade that reaches the MAX argmax -- the rare-event gate (DVP opposition >0.30) AND the profit-side weight (_pnl_scale>0) AND the MAX argmax dominance never co-occur: held winning peaks in trends have DVP CONFIRMING the position (same sign, opposition<0 -> gate 0); in chop |DVP| is structurally small (<0.30 -> gate 0); the deep-DVP-opposition-at-a-winning-peak state is rarer than the >0.30 onset assumes. Extends the MAX-fusion rare-event-lesson: a profit-side+deep-gate MAX source must fire on a state that ACTUALLY co-occurs with winning-peak exits, not merely be theoretically rare. Not branch-eligible (no regime improved; mechanism provably inert; amplifying an inert mechanism is pointless per the DVP-ct-shrink precedent). Reverted to 99a369a1. 1st architectural discard.
c97a70d4	0.706005	0.778801	0.242653	1.025945	0.720320	1.066580	0.670171	0.410990	discard	Exp2 (architectural, indep): RISING-OPP-MARGIN opp-gate exit-fraction modulation. Cache per-symbol prior _opp_margin (1-bar lag); modulate the graduated opp-gate exit fraction so a RISING opp conviction (reversal building, tanh on margin delta /0.15) pushes toward FULL exit while fading keeps the graduated partial. New per-symbol state + new control-flow dep at opp-gate graduation. MEASURED vs 99a369a1 0.706007: composite -0.000002 SUB-NOISE (0.706005), mean -0.000002 (0.778801), std -0.000002 (0.242653 tighter). PER-REGIME all stab 1.0 all flip 1.0 all flip_count 0: bull 1.025954->1.025945 (-0.000009 Sh 2.067798->2.067780, trades 51->50 -- ONE bull opp-gate exit shifted fraction), crash BYTE-IDENTICAL 0.720320 (Sh1.253888), sideways BYTE-IDENTICAL 1.066580 (Sh2.026981), rally BYTE-IDENTICAL 0.670171 (Sh1.552859), mixed BYTE-IDENTICAL 0.410990 (Sh0.807528->0.807529). min_stab 0.844331 unchanged. FAILURE MECH (architectural fact): the opp-gate population is too narrow for the derivative signal to materially bind -- the opp-gate requires (opp_votes>=FLIP_MIN_VOTES AND opp_strong>=opp_strong_min AND trend_avg opposes pos) which rarely co-occurs (flip_count=0 all regimes at baseline -> opp-gate rarely fires a sign-flip; its graduated partial-exit path fires on a small subset of exits). On the bars it DOES fire, the rising-margin delta is typically already captured by the level (a rising margin crosses the gate the same bar). Only 1 bull trade shifted. Extends the documented opp-gate rigidity wall (session 8839fcc Exp5 VWAP-confirmation byte-identical) to the margin-DERIVATIVE axis: the opp-gate population is structurally too narrow for ANY modulation (level, confirmation, or derivative) to materially shift a regime. Not branch-eligible (no regime improved; sub-noise negative; confirms a documented wall). Reverted to 99a369a1. 2nd architectural discard.
57671aa6	0.706007	0.778803	0.242655	1.025954	0.720320	1.066580	0.670171	0.410990	discard	Exp1 (architectural, indep): MULTI-DAY CT-SIGN gate on tp_harvest activation threshold. Prior session threshold-lowering branch walled on mixed/sideways low-trend overlap (rsi_trend_str); this gates the 1.6->1.5 threshold lowering on the multi-day ct SIGN (ret_vlong*pos_dir) instead -- mixed holds longs in a down year (product<0, genuinely ct) while sideways is flat (product~0, not ct). MEASURED vs 99a369a1 0.706007: composite BYTE-IDENTICAL 0.706007, mean 0.778803, all 5 regimes raw==score byte-identical (bull 1.025954, crash 0.720320, sideways 1.066580, rally 0.670171, mixed 0.410990), min_stab 0.844331. FAILURE MECH (architectural fact): the activation threshold (1.6 vs 1.5) is NOT the binding blocker on mixed moderate peaks -- the gate fired at 1.5 for ct-sign (mixed) positions but mixed did not move, confirming mixeds bulk moderate peaks sit BELOW 1.5 (the prior branchs +0.0068 came from reaching peaks in the 1.5-1.6 band, a thin slice). Extends the documented tp_harvest activation-inert wall (prior session Exp1 deep-peak-bypass byte-identical) to the multi-day-ct-sign axis: neither activation THRESHOLD depth NOR the trend-gate bypass reaches mixeds binding moderate-peak population. Reverted to 99a369a1.
aa8ea260	0.705559	0.778409	0.242832	1.025954	0.720320	1.066580	0.668200	0.410990	discard	Exp2 (architectural, indep): MULTI-DAY CT-SIGN gate on tp_harvest RAMP ONSET (1.6->1.3 for ct positions). Builds on Exp1 (activation-gate, byte-identical): the ramp ONSET is the lever that reaches moderate peaks, not the activation threshold. MEASURED vs 99a369a1 0.706007: composite 0.705559 (-0.000448 sub-noise FAIL), mean 0.778409 (-0.000394 FAIL). PER-REGIME all stab 1.0 raw==score: bull BYTE-IDENTICAL 1.025954, crash BYTE-IDENTICAL 0.720320, sideways BYTE-IDENTICAL 1.066580 (ct-sign ~0 as designed -- flat ret_vlong -> onset 1.6), rally 0.670171->0.668200 (-0.0020 Sh1.5529->1.5487 -- REGRESSED), mixed BYTE-IDENTICAL 0.410990 (TARGET MISSED, flip_count 0). FAILURE MECH (architectural fact): mixed byte-identical confirms mixeds peaks are ALL DEEP (prior diagnostic tp_ratio quartiles 5.6/13.3/16.4 -- all >1.6 original onset), so lowering the onset to 1.3 reaches NO new mixed peaks (they were already above 1.6 and already harvested at full 0.45 magnitude). The onset band 1.3-1.6 is empty for mixed. rally -0.0020: rally pullback SHORTS are counter-trend at multi-day (pos_dir=-1, ret_vlong>0 -> product<0 -> ct_sign ~1 -> onset 1.3 -> over-harvested). Extends documented mixed wall: mixeds binding constraint is NOT peak ACCESS (onset/threshold -- both inert) -- peaks are deep and already harvested at maxed magnitude 0.45; residual mixed low-Sharpe is intrinsic MTM oscillation over long holds (return_vol 5.54pct vs 4.4pct net), not under-harvesting. Reverted to 99a369a1.
5afecece	0.524330	0.612912	0.295271	0.195471	0.721766	1.066580	0.669753	0.410990	discard	Exp3 (architectural, indep): RE-PEAK ESCALATING tp_harvest magnitude via per-position harvest-count state. Hypothesis: mixed peak_pnl is all-time high-water mark -> harvest one-shot at all-time peak -> re-peaks unharvested; escalating magnitude per prior harvest damps oscillation. MEASURED vs 99a369a1 0.706007: composite 0.524330 (-0.182 CATASTROPHIC), raw_composite 0.640305, mean 0.612912 (-0.166). PER-REGIME: bull 1.025954->0.195471 raw 0.648431 stab 0.301452 (raw DROPPED 1.026->0.648 AND stab crashed 1.0->0.301 -- over-harvested trend longs, 50pct gate BREACHED 81pct drop), crash 0.720320->0.721766 (+0.001 noise), sideways BYTE-IDENTICAL 1.066580, rally 0.670171->0.669753 (-0.0004), mixed BYTE-IDENTICAL 0.410990 (TARGET MISSED again, flip_count 0). min_stab 0.590436. FAILURE MECH (architectural fact): (a) mixed byte-identical proves mixeds harvest counter never reaches 2 -- mixed oscillation (+30pct->+24pct->+28pct) NEVER exceeds the all-time +30pct peak so peak_pnl never updates and harvest fires only ONCE (count stays 1 -> escalation requires count>=0.5 for 2nd harvest which never comes). Confirms documented mixed wall: mixeds binding constraint is NOT under-harvesting -- the harvest is one-shot by the monotonic peak_pnl high-water mark and mixed never re-peaks above it. (b) bull crashed because bull trend longs DO make new highs (peak_pnl updates upward repeatedly -> harvest fires repeatedly -> counter climbs -> magnitude escalates to 0.65 -> over-harvests bull trend winners -> raw down + stability collapse). The escalation is ANTI-CORRELATED with the target: it fires on trend winners (bull) not oscillators (mixed). Reverted to 99a369a1. 3rd architectural discard.
37f7fa5d	0.664503	0.718900	0.181326	0.853664	0.718457	0.940527	0.670865	0.410990	discard	Exp4 (architectural, indep): MTM-CHOP GIVEBACK TIGHTENING (path-length-weighted, hold-duration separator). Hypothesis: tighten the 0.22 giveback tolerance for positions whose 12-bar pos_pnl path is choppy (low MTM-efficiency, mixeds oscillating longs) -> harvest peak faster -> less per-cycle giveback -> higher mixed Sharpe. Hypothesized separator vs prior MTM-chop emission throttle (walled mixed/sideways overlap): 12-bar path requires long-held positions -> sideways short-held trades exit before accumulating path chop -> spared by hold-duration. MEASURED vs 99a369a1 0.706007: composite 0.664503 (-0.0415 FAIL), mean 0.718900 (-0.0599 FAIL), std 0.181326 (lower). PER-REGIME all stab 1.0 raw==score: bull 1.025954->0.853664 (-0.1723 Sh2.068->~1.92 -- trend winners have path wobble -> tightened), crash 0.720320->0.718457 (-0.0019), sideways 1.066580->0.940527 (-0.1260 Sh2.027->1.92 -- REGRESSED, separator hypothesis WRONG: sideways positions DO hold long enough to accumulate path chop), rally 0.670171->0.670865 (+0.0007), mixed BYTE-IDENTICAL 0.410990 (TARGET MISSED again, flip_count 0). min_stab 0.829547. FAILURE MECH (architectural fact): mixed byte-identical RECONFIRMS the documented giveback wall on mixed -- mixed positions exit via slope-against/time/opp-gate BEFORE pp_pressure giveback activates (prior session Exp1 small-peak giveback attenuation byte-identical), so tightening the giveback tolerance cannot affect mixeds exit path. The pp_pressure giveback lever is structurally NON-BINDING for mixed (3rd confirmation: threshold/onset inert, magnitude one-shot, giveback-tolerance inert). Separately the hold-duration separator hypothesis was wrong: sideways positions DO reach the 4-bar path minimum (sideways is 365d with ~49 trades incl modifications, some long-held) -> the gate fired on sideways trend winners too. Reverted to 99a369a1. 4th architectural discard.
