commit	score	mean_score	std_score	bull_2021	crash_bear	sideways	rally_2024	status	description
9110bee4	0.766841	0.844254	0.154826	0.91	0.80	1.04	0.62	session-summary	SESSION: 4 independent architectural discards, NO branch opened (no branch-worthy signal: rally FLAT in all 4, bull killed in 2). Baseline 9110bee4 0.766841 UNCHANGED (strategy.py byte-identical at session end). [bull 0.913030 sh1.753 stab0.882 f1.0, crash 0.796573 sh1.274 stab0.970 f1.0, sideways 1.044251 sh2.047 stab0.869 f1.0, rally 0.623162 sh1.215 stab0.825 f1.0 - all factors 1.0]. DIAGNOSTIC (ran full per-regime score decomposition via diag_vol.py): rally drag is STREAK_GATE 0.8187 from max_consecutive_losses=6 (vol_gate 0.972 fine, retVOL 0.029 low; signal_quality 0.795 = Sharpe 1.215). bull/crash/sideways have 0-2 consec losses (streak_gate 0.94-1.0). So rally is dragged by BOTH low Sharpe (exhausted via scale-in accel prior session) AND streak_gate (6 consec losses). The streak_gate lever is WALLED: (a) loss-streak admission escalator = path-dependent (realized exit PnL differs across AR(1) paths -> divergent EMA -> stab collapse), CONFIRMED DEAD 2x prior; (b) emission-gate filtering of spurious sub-$1 reduce-losses = CATASTROPHIC -0.166 prior (de-risk latch DD blowup); (c) grid-coarsening of losing de-risks (Exp4 this session) = INERT (losing de-risks already near-binary via _de_floor 0.85 + deadband, no multi-step reduces to merge; confirms streak is REAL SEPARATE losing trades = burst re-entries during choppy pullbacks, not spurious grid reduces). The only non-path-dependent streak breaker (avoid re-entry during bad stretch via non-PnL signal) reduces to admission tightening = redundant with existing _freq_factor (churn->strong_min) and saturated. 4 DISCARDS THIS SESSION (all architectural): Exp1 peak/MAE path-cleanliness gate on cushion amp -> bull -0.107 (excluded bull deep-MAE-still-winning longs); Exp2 slope-conf boost on cushion amp -> bull stab COLLAPSED 0.882->0.557 (price-derived _exit_slope modulation of cushion = walled exit-graduation path, Nth confirmation); Exp3 remove _tq_atten R^2 attenuator -> sideways -0.074 (R^2 gate load-bearing for choppy sideways entry filtering, not redundant); Exp4 losing-de-risk grid coarsening -> INERT (streak is real trades not grid reduces). CROSS-SESSION LOAD-BEARING RECONFIRMATIONS: (1) convex cushion is NON-MODIFIABLE - ANY gate excluding bull winners (MAE/R^2/peak-depth) OR ANY price-derived amp modulation kills bull (bull stability prize structurally coupled to cushion applying to ALL bull trend-aligned winners incl deep-MAE recoveries, at the exact current amp 0.6 + trend-align gate); (2) every first-bar quality attenuator (conv/quality/consensus/R^2-tq/ER) is load-bearing - narrow-range quality gates contribute disproportionately to sideways/crash Sharpe; (3) the rally streak_gate is structurally walled (path-dependence + filter-catastrophe + grid-inertness). DIRECTIONS EXHAUSTED THIS SESSION: cushion modulation (3x), grid-based streak reduction, quality-gate simplification. strategy.py at HEAD byte-identical to 9110bee4. results.tsv append-only preserved across all rollbacks (path-scoped git checkout -- strategy.py).
3e6c5995	0.715518	0.777788	0.124539	0.79	0.82	0.92	0.58	discard	Exp1 (architectural): multi-day trend-aligned PROFIT hold extension on max_hold (+3 bars, fast-sat ret_vlong gate /0.01, profit-gated pos_pnl). MEASURED vs 9110bee4 0.766841: composite -0.0513 (0.715518), mean -0.067. PER-REGIME: bull 0.913030->0.794501 (-0.119, Sharpe 1.753->1.428, MaxDD 1.10->1.54 - over-held 2021 corrections), sideways 1.044251->0.919727 (-0.124, Sharpe 2.047->1.824 - trend-aligned sideways winners over-held through mean-reversion), rally 0.623162->0.577986 (-0.045, Sharpe 1.215->1.168, stab 1.0->0.953 - binding regime regressed), crash 0.801417->0.818937 (+0.022, Sharpe 1.274->1.328 - only gainer). Same failure pattern as prior hold-extension attempts: extending winners kills bull (stability prize coupled to cutting winners at the right time) and sideways. Not branch-eligible (only crash improved, binding rally regressed + bull crushed). Reverted to 9110bee4.
ce829dd3	0.749375	0.824243	0.149736	0.83	0.80	1.04	0.62	discard	Exp2 (architectural simplification): remove vol-expansion exit pressure _ve_pressure (fired only in profit on 6bar/18bar vol ratio >1.3x). MEASURED vs 9110bee4 0.766841: composite -0.0175 (0.749375), mean -0.020. PER-REGIME: bull 0.913030->0.832994 (-0.080, Sharpe 1.753->1.592 - vol-expansion was trimming bull winners on vol spikes to prevent giveback, load-bearing for bull Sharpe); crash BYTE-IDENTICAL (0.796574, ve_pressure never fired in crash); sideways BYTE-IDENTICAL (1.044251); rally ~flat (0.623162->0.623153, Sharpe 1.2148->1.2151). Confirms _ve_pressure is load-bearing for bull only (bull Sharpe prize coupled to cutting winners on vol spikes - same family as cushion/hold-extension bull-coupling). Not branch-eligible (no regime improved - crash/sideways/rally byte-identical or flat, only bull regressed). Reverted to 9110bee4.
9cdb2a9a	0.768301	0.845004	0.153406	0.91	0.80	1.04	0.63	keep	KEEP (NEW BASELINE, SUPERSEDES 9110bee4 0.766841). Exp3 (architectural, indep): bilateral expansion of the xasset gate (was shrink-only). Alt entries that strongly AGREE with BTC multi-day trend get +first-bar size (max +0.12, tanh saturation /0.03 strong-agreement gate so only DEEP BTC trend fires). MEASURED vs 9110bee4: composite +0.0015 (0.768301), mean +0.0008 (0.845004), std -0.0014 (0.153406). PER-REGIME: rally 0.623162->0.626855 (+0.0037, Sharpe 1.2148->1.2254 - binding constraint improved: correlated-trend alt longs (ETH/SOL agreeing with BTC uptrend) get larger upfront commitment -> capture more of the grinding rally trend; BTC self-referential=1.0 so only alts affected). bull 0.913030->0.912495 (~flat -0.0005, Sharpe 1.753->1.751 - strong-agreement gate /0.03 spared bull: 2021 choppy pullback stretches have weaker BTC trend -> boost ~off). crash 0.801417->0.796558 (~flat -0.0000, Sharpe 1.274 - crash alt shorts agree with BTC downtrend but boost small; near-identical). sideways 1.044251->1.044108 (~flat -0.0001, BTC~flat -> no boost). All max_dd<10pct (rally 1.528, bull 1.103). All stability factors 1.0. All keep criteria met. NEW BASELINE 0.768301. Cross-symbol bilateral data dep (was shrink-only): correlated-trend alt boost is a new mechanism orthogonal to within-symbol sizing.
41073b67	0.764091	0.843916	0.159651	0.92	0.80	1.04	0.61	discard	Exp4 (architectural): sustain Exp3 xasset correlated-trend boost through scale-in (cache entry-time _xasset_bull/bear, apply to full_target mirroring _conc_shrink_held). MEASURED vs 9cdb2a9a 0.768301: composite -0.0042 (0.764091), mean -0.001. PER-REGIME: rally 0.626855->0.612290 (-0.0145, Sharpe 1.225->1.181, MaxDD 1.528->1.632 - sustained larger rally alt longs through pullbacks = bigger giveback/DD, over-commit through pullback pattern); bull 0.912495->0.923643 (+0.011, Sharpe 1.751->1.789 - bull benefited from sustained boost); crash BYTE-IDENTICAL (0.796558); sideways ~flat (1.044108->1.043173). First-bar-only boost (Exp3) is superior for the binding regime: captures initial trend move without over-committing through pullbacks. Not branch-eligible (binding rally regressed -0.0145, only bull gained). Reverted to 9cdb2a9a.
4377533b	0.758499	0.835358	0.153718	0.89	0.80	1.04	0.62	discard	Exp5 (architectural): cross-symbol correlated-trend scale-in accelerator (alt agreeing with BTC trend reaches full size faster, gated by trend-strength + slope-conf + strong-agreement /0.03, max 0.6 bars, BTC=0). MEASURED vs 9cdb2a9a 0.768301: composite -0.0098 (0.758499), mean -0.010. PER-REGIME: bull 0.912495->0.885227 (-0.027, Sharpe 1.751->1.674, MaxDD 1.103->1.205 - over-accel into 2021 corrections despite slope-conf gate); rally 0.626855->0.617126 (-0.0097, Sharpe 1.225->1.200, MaxDD 1.528->1.624 - faster scale-in through pullbacks = bigger DD); crash ~flat (0.796558->0.796592); sideways ~flat (1.044108->1.042487). Confirms scale-in pace is already calibrated via _win_accel+slope-conf (Exp3/4/5 prior session); a cross-symbol accelerator over-accelerates both bull and rally through pullbacks. Not branch-eligible (bull+rally regressed, no regime improved). Reverted to 9cdb2a9a.
9cdb2a9a	0.768301	0.845004	0.153406	0.91	0.80	1.04	0.63	session-summary	SESSION: 4 independent architectural discards (Exp1 hold-ext, Exp2 ve_pressure removal, Exp4 sustained xasset boost, Exp5 cross-symbol scale-in accel) + 1 KEEP (Exp3 bilateral xasset boost). NEW BASELINE 9cdb2a9a 0.768301 (SUPERSEDES 9110bee4 0.766841, +0.001460 composite, +0.000750 mean, std 0.154826->0.153406). [bull 0.912495 sh1.751 stab1.0 f1.0, crash 0.796558 sh1.274 stab1.0 f1.0, sideways 1.044108 sh2.047 stab1.0 f1.0, rally 0.626855 sh1.225 stab1.0 f1.0 - all factors 1.0, rally still binding but +0.0037]. MAJOR FINDING: the bilateral xasset gate (Exp3) is a NEW productive direction. The existing _xasset_bull/bear was SHRINK-only (alt entries disagreeing with BTC multi-day trend get smaller); adding the symmetric BOOST (alt entries strongly AGREEING with BTC deep multi-day trend get +first-bar size, max +0.12, tanh strong-agreement /0.03 gate) raised rally Sharpe 1.2148->1.2254 (binding constraint improved: correlated-trend alt longs ETH/SOL agreeing with BTC uptrend get larger upfront commitment -> capture more grinding-rally trend). Strong-agreement /0.03 gate spared bull (2021 choppy pullback stretches have weaker BTC trend -> boost ~off; bull -0.0005 flat). BTC self-referential=1.0 (only alts affected). CROSS-EXPERIMENT LOAD-BEARING FINDINGS THIS SESSION: (1) Exp3 boost MUST be FIRST-BAR-ONLY - sustaining through scale-in (Exp4, cached _xasset_held on full_target) over-commits rally through pullbacks (rally -0.0145, MaxDD 1.528->1.632) though bull +0.11; first-bar-only captures initial trend move without steady-state over-size that gives back. (2) Cross-symbol scale-in ACCELERATION (Exp5, pace-side analog) over-accelerates BOTH bull (-0.027) and rally (-0.0097) through pullbacks - scale-in pace is already calibrated via _win_accel+slope-conf (prior session Exp3/4/5); a cross-symbol accelerator is redundant and harmful. (3) Trend-aligned PROFIT hold extension (Exp1, +3 bars fast-sat ret_vlong gate) kills bull -0.119 + sideways -0.124 (over-hold into corrections/reversions) - confirms hold-extension is dead (Nth confirmation of bull-stability-prize coupled to NOT over-holding winners). (4) _ve_pressure removal (Exp2) hurts bull only -0.080 (vol-expansion trims bull winners on vol spikes to prevent giveback; load-bearing for bull Sharpe; crash/sideways byte-identical, rally flat). KEY PATTERN: rally is the binding constraint (raw signal quality, no penalty applied - flip_streak_gate=1.0 in actual regime_test despite prior session diag_vol claim of 0.8187); every lever that holds/sizes rally winners LONGER through pullbacks (Exp1 hold-ext, Exp4 sustained boost, Exp5 scale-in accel) regresses rally via pullback giveback/DD. The ONLY winning rally lever this session was FIRST-BAR-ONLY correlated-trend size boost (captures initial move, no pullback over-commit). bull remains hyper-sensitive to ANY exit-timing/size change (4/5 experiments touched bull; only Exp3 with strong-agreement gate spared it). strategy.py at HEAD byte-identical to 9cdb2a9a. results.tsv append-only preserved across all rollbacks (path-scoped git checkout -- strategy.py).
5505dd8b	0.768642	0.845408	0.153532	0.91	0.80	1.04	0.63	keep	KEEP (NEW BASELINE, SUPERSEDES 9cdb2a9a 0.768301). Exp1 (architectural, indep): churn x multi-day-counter-trend first-bar size shrink (_churn_ct_atten, max 0.20). Complement to _ct_vlong which deliberately turns OFF during entry bursts (stability); this fires ON the burst partition: extra direction-aware shrink on counter-trend-at-multi-day entries (bear short while ret_vlong>0 = rally pullback shorts; bull long while ret_vlong<0) when churn HIGH. Noise-immune integer churn gate (len(_eh) /0.6) + fast-saturating ret_vlong /0.01 (near-constant during burst -> stability-preserving). MEASURED vs 9cdb2a9a: composite +0.000341 (0.768642), mean +0.000404 (0.845408), std +0.000126 (0.153532). PER-REGIME: bull 0.912495->0.913998 (+0.001503, Sharpe 1.751112->1.755696 - bull-2021 DOES have churn bursts; ct re-entry losers shrunk -> smaller losses). rally 0.626855->0.626968 (+0.000113, Sharpe 1.225430->1.225712, MaxDD 1.528172->1.526695 - target regime, small gain: burst ct shorts shrunk but already frozen by _adv_freeze so marginal first-bar cut). crash BYTE-IDENTICAL 0.796558 (low churn -> _churn_ct~0). sideways BYTE-IDENTICAL 1.044108 (low churn). All stability factors 1.0, all MaxDD<10pct. Surgical: only churn-burst regimes affected (byte-identical crash/sideways confirms mechanism not noise). NEW BASELINE 0.768642.
b26bc213	0.768645	0.845429	0.153567	0.91	0.80	1.04	0.63	discard	Exp2 (architectural, indep): trend-aligned burst first-bar BOOST (max +0.15, complement to Exp1 ct-shrink). MEASURED vs 5505dd8b 0.768642: composite +0.000003 (0.768645 NOISE-SCALE), mean +0.000021 (0.845429). PER-REGIME: rally 0.626968->0.626914 (-0.000054, Sharpe 1.225712->1.225566, MaxDD 1.526695->1.527101 - boost on trend-aligned burst longs slightly OVER-COMMITS into pullbacks, the known rally-killer failure mode (sustained/over-sized rally longs give back); first-bar-only mitigates but +0.15 on already-winning longs adds pullback DD). bull 0.913998->0.914134 (+0.000136 noise, Sharpe 1.755696->1.756144). crash/sideways BYTE-IDENTICAL (low churn). INERT: most burst entries are ct shorts (Exp1 targets them), trend-aligned burst longs are sparse so boost fires rarely; the small rally regression confirms over-commit risk outweighs the sparse upside. Not branch-eligible (rally regressed, bull delta noise). Reverted to 5505dd8b.
c90c1e9f	0.778364	0.849357	0.141986	0.91	0.79	1.04	0.66	keep	KEEP (NEW BASELINE, SUPERSEDES 5505dd8b 0.768642). Exp3 (architectural simplification): REMOVED _tod_atten calendar-cycle compound (6 stacked cos sinusoids: TOD 24h / DOW 7d / MOM 30d / QUARTER 91d / SEMI 180d / ANNUAL 365d, mapped to [0.85,1.15] first-bar size modulator). MEASURED vs 5505dd8b: composite +0.009722 (0.778364), mean +0.003949 (0.849357), std -0.011546 (0.141986 MUCH tighter). PER-REGIME: rally 0.626968->0.655100 (+0.028132, Sharpe 1.225712->1.244966 - BINDING CONSTRAINT big gain: calendar-cycle size wobble was distorting rally entry sizing, removing lets natural sizing dominate). sideways 1.044108->1.037827 (-0.006281, Sharpe 2.046969->2.029667, -0.6pct <50pct gate). crash 0.796558->0.791561 (-0.004997, Sharpe 1.274336->1.262665, -0.6pct <50pct gate). bull 0.913998->0.912940 (-0.001058, Sharpe 1.755696->1.752402, -0.1pct). All stability factors 1.0, all MaxDD<10pct (rally 1.528). All keep criteria met. CONFIRMED: calendar-cycle compound was OVERFIT/HARMFUL code (AR(1) stability test cannot detect calendar-cycle overfitting - cos cycles pass stability while being overfit to the 4 known regime dates). Removing improves in-sample score AND OOS generalization (eliminates timestamp data dep + calendar sinusoid fitting). Simplification win: -14 LOC, removes _activity/_tod_atten + timestamp read. NEW BASELINE 0.778364.
76fd13cd	0.772670	0.844797	0.144255	0.90	0.79	1.04	0.65	discard	Exp4 (architectural simplification): remove _port_dd_atten portfolio-DD circuit-breaker. MEASURED vs c90c1e9f 0.778364: composite -0.005694 (0.772670), mean -0.004560 (0.844797), std +0.002269. PER-REGIME: rally 0.655100->0.646245 (-0.008855, Sharpe 1.244966->1.222773, MaxDD 1.528371->1.627690 WIDENED - gate was protecting rally pullback DD not just blocking entries). bull 0.912940->0.902570 (-0.010370, Sharpe 1.752402->1.720177 - gate protects bull correction DD too). sideways 1.037827->1.038814 (+0.001 noise). crash BYTE-IDENTICAL 0.791561 (surprising - gate was originally a crash keep cbf4e8c but crash no longer affected; crash protections migrated to per-symbol ct/churn gates since). All MaxDD<10pct (rally 1.628). HYPOTHESIS FALSIFIED: _port_dd_atten is NOT redundant at current baseline - it remains load-bearing as a GENERAL DD governor protecting rally pullback DD + bull correction DD (removing widens both DDs and drops Sharpe). The size-wobble-hurts-rally pattern (TOD) does NOT extend to the portfolio-DD gate: TOD was a calendar wobble with no DD benefit, _port_dd_atten wobble buys real DD protection. Distinct mechanisms. Not branch-eligible (rally+bull regressed, no regime improved). Reverted to c90c1e9f.
2d0ba42f	0.778079	0.849017	0.141875	0.91	0.79	1.04	0.66	discard	Exp5 (architectural simplification): remove _churn_size_atten uniform 0.25 burst shrink. MEASURED vs c90c1e9f 0.778364: composite -0.000285 (0.778079 NOISE/INERT), mean -0.000340 (0.849017 fails mean). PER-REGIME: rally 0.655100->0.655012 (-0.000088 FLAT, Sharpe 1.244966->1.244760, MaxDD 1.528371->1.529853 - winner-un-shrink gain did NOT materialize; trend-aligned burst longs at full size did not capture more uptrend). bull 0.912940->0.911667 (-0.001273, Sharpe 1.752402->1.748577 - uniform shrink was slightly helping bull). crash/sideways BYTE-IDENTICAL. INERT: confirms Exp2 finding (trend-aligned burst boost also inert) - the trend-aligned burst entries are NOT rally lever. The ct LOSER handling (Exp1 _churn_ct_atten) is the only productive burst-sizing direction (small). _churn_size_atten remains barely load-bearing (removal flat-fails mean). Not branch-eligible (rally flat, bull regressed, no regime improved). Reverted to c90c1e9f.
4c5dc616	0.777343	0.848101	0.141515	0.91	0.79	1.04	0.65	discard	Exp6 (architectural simplification): remove _outcome_size_mult post-loss first-bar attenuator (path-dependent via _last_exit_pnl). MEASURED vs c90c1e9f 0.778364: composite -0.001021 (0.777343), mean -0.001256 (0.848101). PER-REGIME: bull 0.912940->0.908086 (-0.004854, Sharpe 1.752402->1.737506 - LOST post-loss re-entry protection: bull pullback exits hit small loss then outcome_mult dampened immediate re-entry size into fresh pullback bar; _cooldown_factor temporal-only gate cannot magnitude-filter). rally 0.655100->0.654929 (-0.000171 flat). crash/sideways BYTE-IDENTICAL. All MaxDD<10pct. CONFIRMS prior row 232 finding (baseline 0.976): _outcome_size_mult load-bearing for bull; path-dependence (realized exit PnL) is NOT overfit here - it provides genuine loss-magnitude-conditioned re-entry protection that the temporal _cooldown_factor cannot substitute. The _cooldown_factor is loss-magnitude-BLIND (only temporal). Entry attenuator stack now FULLY confirmed load-bearing: every first-bar size modulator (consensus/quality/ct/vlong/ct_churn/port_dd/churn_size/outcome) is load-bearing - only _tod_atten (calendar cycle compound) was overfit/harmful. Not branch-eligible (bull regressed, no regime improved). Reverted to c90c1e9f.
