commit	score	mean_score	std_score	bull_2021	crash_bear	sideways	rally_2024	status	description
-	-	-	-	-	-	-	-	-	-	SESSION (baseline 99a369a1 0.706007 5-regime -> UNCHANGED, no keep): 1 independent ARCHITECTURAL experiment (Exp1) that auto-opened an exploration branch (sustain ct_vlong first-bar shrink through scale-in, 6 steps, REVERTED). Baseline 99a369a1 re-verified at session start (composite 0.706007 mean 0.778803 std 0.242655, all stab 1.0 raw==score, min_stab 0.844331) [bull 1.025954 Sh2.068, crash 0.720320 Sh1.254, sideways 1.066580 Sh2.027, rally 0.670171 Sh1.553, mixed 0.410990 Sh0.808] AND post-branch-revert (strategy.py 0-diff to keep). EXIT RULE: branch reverted -> session ends (per protocol: branch revert is a strong-enough signal to conclude the round). >=2 architectural discards MET via the branch (Exp1 opening + 6 branch steps all architectural: new data dep + control flow -- scale-in full_target now reads entry-time ct state). results.tsv append-only preserved throughout (path-scoped git checkout 99a369a1 -- strategy.py for the revert, never git revert; results.tsv untouched by rollback). THEME: pursued the prior session-summary's documented untested upstream lever for mixed (reduce oscillation amplitude upstream via smaller sizing for choppy ct longs -- the EXIT subsystem is fully saturated with 5+ discards). The _ct_vlong multi-day counter-trend first-bar shrink (the validated mixed-reacher: mixed holds longs in a down year so _bull_ct_vlong~0.60) is applied at FIRST BAR ONLY in the baseline; scale-in ramps the position back to un-shrunk size over 2-3 bars, undoing the shrink after bar 1. Exp1 cached the entry-time ct shrink and sustained it through scale-in (the proven Exp5 _conc_shrink_held / Exp9 _vol_shrink_held pattern). CROSS-EXPERIMENT CONCLUSIONS (all MEASURED this session, verifiable): (1) SUSTAIN-THROUGH-SCALE-IN CANNOT REACH MIXED (the intended target): mixed BYTE-IDENTICAL across ALL 6 branch steps (Exp1 both-sides, step1 bear-only, step2 vol-gated, step3 bull-only, step4 R^2-gated, step5 50% magnitude, step6 25% magnitude). The grid-quantization (load-bearing stability lever, grid step 0.06*equity*BASE_POSITION_SIZE) absorbs proportional sizing changes for mixed's SMALL positions -- a 0.60x sustained shrink is sub-grid -> snaps to the same quantized lattice point -> emitted target unchanged. This is the SAME mechanism as prior session Exp3 (2.5x tp_harvest amp -> mixed tp_scale 0.109->0.275 STILL byte-identical). GENERAL RULE CONFIRMED: mixed is grid-walled on ALL proportional sizing levers (entry-time first-bar, scale-in sustain, harvest magnitude). mixed's residual low-Sharpe is NOT addressable by any proportional sizing lever; the intrinsic MTM oscillation (return_vol 5.54pct vs 4.4pct net) is the floor. (2) BULL/CRASH EXACT COUPLING ON THE BULL-ENTRY-IN-DOWNTREND AXIS: sustaining the ct shrink helped bull (+0.062 at full magnitude) and hurt crash (-0.053) SYMMETRICALLY -- bull-2021 pullback longs and crash dead-cat-bounce longs are the SAME trade type (bull entry while 96-bar ret_vlong<0). NO single-quantity separator isolates them: confirmed on vol_ratio (step2 -- rally WORSE), R^2 trend-quality (step4 -- splits the difference, both moderate-R^2), ct-direction (step1 bear-only / step3 bull-only -- each recovers one regime at the cost of the other), and magnitude (step5 50% / step6 25% -- both shrink together toward 0). As magnitude -> 0, composite -> baseline from BELOW (step3 0.7025 -> step4 0.7030 -> step5 0.7045 -> step6 0.7052, approaching 0.7060); at 25% blend bull is byte-identical (no gain) while crash retains -0.004 residual cost -> NO magnitude exists where bull gain > crash cost. This is a 5th dimension of the documented mixed/sideways overlap-style wall, now on the bull/crash pair: bull and crash share the bull-entry-in-downtrend regime and no gate (vol_ratio, R^2, churn, ct-direction, magnitude) separates them. (3) THE _ct_vlong SHRINK IS CORRECTLY FIRST-BAR-ONLY IN THE BASELINE: the proven Exp5/Exp9 sustain-cache pattern (which works for _conc_shrink and _vol_entry_spike because those are one-sided -- they help without symmetric cost) does NOT generalize to the ct shrink because the ct shrink's regime effects are bilateral-coupled (bull gain = crash cost). First-bar-only is the optimum. SATURATION RECONFIRMED: mixed grid-walled on proportional sizing (this session + prior tp_harvest branch); exit subsystem fully saturated (prior session 5 discards); the only mixed-reaching lever remains the MTM-chop throttle (at its optimum WITH winner-fade protecting mixed peaks). NEW BASELINE 99a369a1 0.706007 UNCHANGED. KEY FOR FUTURE SESSIONS: (a) do NOT re-attempt sustaining the _ct_vlong shrink through scale-in (6-step branch confirmed ceiling=baseline, bull/crash exact coupling); (b) mixed is grid-walled on ALL proportional sizing levers (entry-time, scale-in, harvest) -- future mixed work must use a non-proportional / non-grid-absorbed lever (e.g. a lever that changes WHICH grid cell a mixed position lands in rather than scaling within a cell, OR a lever on the HOLD-DURATION / exit-timing axis that does not pass through grid quantization) OR accept mixed's intrinsic MTM-oscillation floor (0.411, Sh0.808); (c) bull and crash are coupled on the bull-entry-in-downtrend axis -- future bull-gain experiments that route through ct sizing will symmetrically cost crash; (d) the sustain-cache pattern requires a one-sided shrink to generalize -- bilateral shrinks (like ct) do not.
53a20076	0.706007	0.778803	0.242655	1.025954	0.720320	1.066580	0.670171	0.410990	discard	Exp1 (architectural, indep): multi-day-CT-LOSER full-exit threshold reduction. Lowered _exit_thresh (de-risk ramp -> target=0 full-exit crossing) by up to 0.20 for positions BOTH losing (pos_pnl<0) AND counter-trend at multi-day scale (ret_vlong*pos_dir<0, /0.01 fast-saturating noise-free). FIRST test of a grid-BYPASSING exit-timing lever: full exits (target=0) are grid-EXEMPT (entries/exits/flips bypass churn-gated quantization), so unlike prior partial-harvest tp_harvest/giveback levers (grid-WALLED for mixed small positions), promoting ct losers to full exit reaches the position-value axis. Loss-gated (spares mixed winning oscillators per winner-fade lesson); ct-gated (spares trend-aligned bull/crash/rally longs -> byte-identical by construction); max 0.20 continuous tanh. MEASURED vs baseline 99a369a1 0.706007: composite BYTE-IDENTICAL 0.706007, ALL 5 regimes BYTE-IDENTICAL (bull 1.025954, crash 0.720320, sideways 1.066580, rally 0.670171, mixed 0.410990), all stab 1.0 raw==score, min_stab 0.844331. FAILURE MECH (architectural fact): ct losers (ret_vlong*pos_dir<0 AND pos_pnl<0) are closed by SL (_sl_pressure, ATR stop), opp-gate, and binary-SL paths BEFORE exit_pressure reaches the [0.80,1.0] zone where the lowered full-exit terminal matters. The de-risk full-exit TERMINAL is not the binding close path for ct losers. CONCLUSION: extends exit-saturation to the grid-bypassing full-exit-TIMING axis (5th exit axis walled this branch+prior: tp_harvest threshold/onset/magnitude/escalation + giveback all inert on mixed; now full-exit-timing inert on ct losers). Reverted to 99a369a1.
91e77494	0.706344	0.779101	0.242522	1.025954	0.720320	1.066580	0.671660	0.410990	discard	Exp2 (architectural, indep): PROFIT-BOOSTED counter-trend target-EMA. Symmetric untested counterpart to the loss-gate (which CUTS ct target-EMA smoothing for losers to let them de-risk faster). Here BOOST alpha up to +30pct (capped 0.997) for clear WINNERS (pos_pnl>+0.5*|stop|, same onset as the load-bearing winner-fade) so the winning ct held position is low-passed more strongly -> damps the oscillation PEAK -> less giveback on re-peak -> lower MTM amplitude -> higher Sharpe. Consistent with prior-session finding that mixed BENEFITS from holding through peaks (no harvest; EMA holds the LEVEL). ct-gated (trend-aligned byte-identical); loss-gate preserved; profit-continuous tanh. MEASURED vs baseline 99a369a1 0.706007: composite 0.706344 (+0.000337 SUB-NOISE), mean 0.779101 (+0.000298), std 0.242655->0.242522. PER-REGIME all stab 1.0 raw==score: bull byte-identical 1.025954, crash byte-identical 0.720320, sideways byte-identical 1.066580, rally 0.670171->0.671660 (+0.001489 Sh1.553->1.556, the mechanism reaches rallys larger ct positions), mixed BYTE-IDENTICAL 0.410990 (the EMA changes target LEVEL but mixeds small positions snap to the same grid cell regardless -> grid-walled on the target-EMA axis, reconfirming the documented proportional-sizing wall). min_stab 0.844331 unchanged, max_dd all <5.5pct (rally 5.16->5.43). FAILURE MECH: mechanism is REAL on rally (larger positions, the EMA level change crosses a grid step) but does NOT reach the binding floor mixed (small positions, sub-grid level change absorbed). The +0.000337 is noise-floor (single-regime mover, sub-+0.003). Reverted to 99a369a1.
6e97e61a	0.609437	0.675435	0.219994	0.555534	0.720320	1.066580	0.623754	0.410990	discard	Exp3 (architectural, indep): MULTI-DAY ret_vlong OR-in on opp-gate flip condition. Blended a 96-bar ret_vlong supplement into the 20-bar trend_avg flip term so the grid-BYPASSING opp-gate full exit fires on more bars for mixed ct longs (whose ret_vlong stays negative through chop while trend_avg oscillates). MEASURED vs baseline 99a369a1 0.706007: composite 0.609437 (-0.0966 REGRESSION), mean 0.675435 (-0.1034), std 0.242655->0.219994. PER-REGIME: bull 1.025954->0.555534 (-0.470 raw 1.026->0.827 stab 1.0->0.672 STABILITY CRASH -- the multi-day supplement fired opp-gate exits on bull-2021 pullback longs when ret_vlong dipped momentary), crash byte-identical 0.720320, sideways byte-identical 1.066580, rally 0.670171->0.623754 (-0.046), mixed BYTE-IDENTICAL 0.410990 (opp-gate STILL did not fire on mixed). min_stab 0.844->0.701. max_dd all <5.7pct (rally 5.16->5.65). FAILURE MECH (architectural fact): the opp-gate binding gate for mixed is bear_votes>=FLIP_MIN_VOTES AND _bear_strong>=_bear_strong_min (voter conviction), NOT trend_avg -- bear voters rarely reach FLIP_MIN_VOTES during mixeds choppy down-year, so the ret_vlong OR on the trend sub-condition fires NO new mixed opp-gates. CONCLUSION: (a) the opp-gate flip CONDITION (trend term) is NOT the binding blocker for mixed -- the VOTER-COUNT gate is; (b) ret_vlong OR-in is catastrophic for bull (momentary multi-day dips fire wrong exits on trend longs -- the 20-bar trend_avg gate was already correctly stricter). Reverted to 99a369a1.
cb75a4d7	0.368627	0.502458	0.446105	1.011767	0.185747	1.066580	0.000000	0.248197	branch	STRUCTURAL_EXPLORATION step1: opp-gate flip gate hard voter-count -> continuous margin-EMA accumulator (_bear_flip_ready/_bull_flip_ready, FLIP_ACCUM_RHO=0.7, FLIP_ACCUM_THRESH=0.0). trend_avg (20-bar) retained. MEASURED vs baseline 99a369a1 0.706007: composite 0.368627 (-0.337 EXCEEDS relaxed -0.08), raw_composite 0.472160, mean 0.502458 (-0.276 EXCEEDS relaxed -0.05), std 0.242655->0.446105. PER-REGIME: bull 1.025954->1.011767 (-0.014 stab 1.0 raw 1.012), crash 0.720320->0.185747 (raw 0.471 stab 1.0->0.394 CRASHED -- flip gate over-fires on crash recovery), sideways byte-identical 1.066580 (no flip-side positions), rally 0.670171->0.000000 (stab 0.0 -- flip gate fires catastrophically on rally pullback shorts/longs), mixed 0.410990->0.248197 (raw 0.410923 ~BYTE-IDENTICAL to baseline 0.410990 = the rewrite REACHES mixed raw but stability crashed 1.0->0.604). min_stab 0.844->0.428. 50pct regime gate BREACHED (rally 0.000 from 0.670, mixed 0.248 from 0.411). DIAGNOSIS: FLIP_ACCUM_THRESH=0.0 is far too low -- the margin EMA crosses 0 on marginal/sustained-low conviction (unlike the hard count gate which was much stricter), so the grid-bypassing full exit over-fires on rally/crash trend positions (noise-sensitive threshold-0 crossing = the exact stability killer). The KEY finding: the rewrite REACHES mixed raw (0.410923 ~= baseline) -- the mechanism is correct, only the threshold calibration is catastrophic. Step2: RAISE FLIP_ACCUM_THRESH so the flip gate fires only on genuinely sustained STRONG opposite-side conviction (match the implicit strictness of the hard count gate), recovering rally/crash while keeping mixed access. Branch continues (intermediate regression expected; 10-step stagnation guard, 3-step monotonic window on raw_composite).
9aa04963	0.188367	0.241504	0.177123	0.191059	0.203418	0.548088	0.264953	0.000000	branch	STRUCTURAL_EXPLORATION step2: raise FLIP_ACCUM_THRESH 0.0->0.40. MEASURED vs step1 0.368627: composite 0.188367 (-0.180 REGRESSION), raw_composite 0.472160->0.247446 (-0.225), mean 0.502458->0.241504. PER-REGIME: bull 1.012->0.191 (DD 2.49->6.83pct -- positions not closing), crash 0.186->0.203 (stab 0.394->0.452), sideways 1.067->0.548 (stab 1.0->0.952 -- now affected), rally 0.000->0.265 (stab 0.0->0.825), mixed 0.248->0.000 (raw 0.411->0.000 -- threshold 0.40 too high, mixed never reaches it, flip never fires AND something broke). min_stab 0.428. DIAGNOSIS: 0.40 threshold broke mixed (never fires) + destabilized bull/sideways (positions not closing -> DD up). 3-step window step1->step2 REGRESSION (raw 0.472->0.247).
57815611	0.706007	0.778803	0.242655	1.025954	0.720320	1.066580	0.670171	0.410990	branch	STRUCTURAL_EXPLORATION step3: count gate PRIMARY + margin-EMA+ct SUPPLEMENT (OR). Restored the hard count gate as the primary flip condition; added the margin-EMA as a SUPPLEMENT firing when count gate fails BUT _bear_margin>0.30 AND multi-day ct (ret_vlong*pos_dir<0) AND trend_avg<0. MEASURED vs step2: composite 0.706007 (BYTE-IDENTICAL TO BASELINE), raw_composite 0.706007, all 5 regimes BYTE-IDENTICAL, all stab 1.0. FAILURE MECH (fundamental architectural insight): the supplement NEVER fires because margin and vote-count are NOT independent -- both derive from the same _bull_confs/_bear_confs. When the count gate fails (bear voters < FLIP_MIN_VOTES), _bear_margin is by definition LOW (margin=(strong-strong_min)/strong_min; if strong<strong_min margin is negative). So _bear_margin>0.30 requires strong to be 30pct ABOVE strong_min = EXACTLY when the count gate ALSO fires. The supplement is logically redundant with the count gate -> adds zero new opp-gates -> byte-identical. CONCLUSION: a margin-based opp-gate rewrite is STRUCTURALLY INCAPABLE of reaching mixed, because mixed issue is bear conviction is genuinely LOW (not just below a count threshold). The margin-EMA path (this branch) is a dead end for mixed access.
3c12a731	0.708387	0.780911	0.241746	1.025954	0.720320	1.066580	0.680712	0.410990	branch	STRUCTURAL_EXPLORATION step4: VOTER-INDEPENDENT oscillation supplement. Replaced the step3 margin-EMA supplement (which was redundant with the count gate) with a PURELY STRUCTURAL trigger independent of voter conviction: a held COUNTER-TREND (multi-day ret_vlong*pos_dir<0, /0.01 fast-sat) position, held past scale-in (bars_held>ENTRY_FULL_BARS), that is NEAR BREAKEVEN (|pos_pnl|<0.5*|stop| = the oscillating dead capital neither SL nor pp_pressure harvests). Fires the grid-BYPASSING full exit (target->0) on mixed-style persistent near-breakeven ct positions without requiring voter reversal. MEASURED vs step3 (byte-identical baseline 0.706007): composite 0.708387 (+0.002380 PROGRESS, best this session), raw_composite 0.706007->0.708387 (MONOTONIC UP), mean 0.778803->0.780911 (+0.002108), std 0.242655->0.241746. PER-REGIME all stab 1.0: bull byte-identical 1.025954, crash byte-identical 0.720320, sideways byte-identical 1.066580, rally 0.670171->0.680712 (+0.010541 Sh1.553->1.566, DD5.16->5.12pct -- the supplement reached rallys persistent near-breakeven ct PULLBACK SHORTS that voter conviction could not close), mixed byte-identical 0.410990 (longs not yet reached). min_stab 0.844331->0.844977. max_dd all <5.2pct. BREAKTHROUGH: the voter-independent structural trigger IS reaching rally (a regime the count-gate opp-gate could not help) -- the mechanism is REAL. Not yet +0.003 keep (+0.0024). Branch continues: step5 widens mixed reach (mixed trend_avg oscillates so the trend_avg<0 long condition may only fire on half the bars).
239545e5	0.697575	0.771095	0.245067	1.025954	0.687258	1.066580	0.664696	0.410990	branch	STRUCTURAL_EXPLORATION step5: replace trend_avg with multi-day ct gate (_ct_pos_flip) for the oscillation supplement (keep count gate on trend_avg). MEASURED vs step4 0.708387: composite 0.697575 (-0.010812 REGRESSION), raw_composite 0.708387->0.697575 (REGRESSION in monotonic window), mean 0.780911->0.771095. PER-REGIME all stab 1.0: bull byte-identical 1.025954, crash 0.720320->0.687258 (-0.033 -- the multi-day gate fired on crash dead-cat-bounce LONGS (pos>0, ret_vlong<0 -> ct_pos_flip~1) that are near-breakeven, closing them cost crash; trend_avg<0 in step4 SPARED these because crash bounces have trend_avg>0 momentarily), sideways byte-identical 1.066580, rally 0.680712->0.664696 (-0.016), mixed BYTE-IDENTICAL 0.410990 (STILL not reached even with multi-day gate). min_stab 0.844977->0.847438. DIAGNOSIS: removing trend_avg lost crash protection (dead-cat longs) WITHOUT gaining mixed (mixed near-breakeven longs still do not satisfy the condition). trend_avg guard was load-bearing. 3-step window step3(0.706)->step4(0.708)->step5(0.698): NOT monotonic (step4->step5 down) but only 1 regression (not 3). Revert to step4 (best).
5b0b175f	0.706338	0.779096	0.242524	1.025954	0.720320	1.066580	0.671634	0.410990	branch	STRUCTURAL_EXPLORATION step6: widen near-breakeven band to 1.0*stop + longer hold (bars_held>10). MEASURED vs step4 0.708387: composite 0.706338 (-0.002049 REGRESSION), raw_composite 0.708387->0.706338 (down), mean 0.780911->0.779096. PER-REGIME all stab 1.0: bull byte-identical 1.025954, crash byte-identical 0.720320, sideways byte-identical 1.066580, rally 0.680712->0.671634 (-0.009 -- the bars_held>10 threshold excluded the shorter rally ct holds that step4 caught), mixed BYTE-IDENTICAL 0.410990 (STILL not reached). min_stab 0.844977->0.844331. DIAGNOSIS: widening the band + longer hold REDUCED the rally gain (fewer qualifying bars) WITHOUT reaching mixed. mixed persistent longs do not satisfy the ct+near-breakeven+held+trend_avg<0 conjunction. Revert to step4 (best, +0.0024).
bec17890	0.708387	0.780911	0.241746	1.025954	0.720320	1.066580	0.680712	0.410990	branch	STRUCTURAL_EXPLORATION step7: widen near-breakeven band 0.5->0.65*stop. MEASURED vs step4 0.708387: BYTE-IDENTICAL (composite 0.708387, all 5 regimes identical, all stab 1.0). The 0.65 band catches the SAME rally ct shorts as 0.5 -- no marginal shorts exist in the 0.5-0.65*stop band. Band width is NOT the lever; step4 0.5 band already captures the available rally ct shorts. NO-PROGRESS (3rd step without improvement over step4: step5 regress, step6 regress, step7 byte-identical). step4 +0.0024 is the CEILING for the oscillation supplement on rally. Remaining gap to +0.003 keep (+0.0006) cannot come from band-tuning.
67c05b7f	0.708387	0.780911	0.241746	1.025954	0.720320	1.066580	0.680712	0.410990	branch	STRUCTURAL_EXPLORATION step8: soften long-side trend_avg guard <0 -> <0.005. MEASURED vs step4: BYTE-IDENTICAL 0.708387. Softening to <0.005 fired NO new exits -- mixeds longs STILL not reached (4th no-progress step over step4: step5/6/7/8). mixed persistent longs do not satisfy the ct+near-breakeven+held+trend conjunction for a structural reason not reachable via trend_avg softening.
b27f9631	0.693124	0.767139	0.246716	1.025954	0.651458	1.066580	0.680712	0.410990	branch	STRUCTURAL_EXPLORATION step9: lower bars_held threshold >ENTRY_FULL_BARS -> >=2. MEASURED vs step4 0.708387: composite 0.693124 (-0.015263 REGRESSION), raw_composite 0.708387->0.693124. PER-REGIME all stab 1.0: bull byte-identical 1.025954, crash 0.720320->0.651458 (-0.069 -- the >=2 threshold fired the supplement on crash EARLY dead-cat-bounce longs (bars 2-3, near-breakeven, trend_avg<0) that were going to recover -> closed them at a loss), sideways byte-identical 1.066580, rally byte-identical 0.680712 (NO new gain -- the shorter rally ct shorts dont exist or dont help), mixed byte-identical 0.410990. min_stab 0.844977. DIAGNOSIS: bars_held>=2 too low (catches crash bounces); step4 ENTRY_FULL_BARS threshold is correct. 5th no-progress/regression step over step4 (step5-9 all failed to beat step4 +0.0024). Branch is at step4 ceiling. Revert to step4.
00753140	0.708387	0.780911	0.241746	1.025954	0.720320	1.066580	0.680712	0.410990	branch	STRUCTURAL_EXPLORATION step10: OR MAE-based dead-capital detector (small-loss pos_pnl in [-0.8,-0.3]*stop AND shallow |MAE|<0.8*stop = oscillators not trending against). MEASURED vs step4: BYTE-IDENTICAL 0.708387. The MAE band caught NO new rally ct shorts beyond the near-breakeven band -- the small-loss+shallow-MAE oscillators dont exist in rally (rallys reverting ct shorts either stay near-breakeven or hit SL). 6th no-progress step over step4 (step5-10). BRANCH CEILING = step4 +0.0024 (below +0.003 keep). mixed structurally walled (margin/vote-count identity step3 + oscillation supplement cant reach mixed longs steps4-10 all byte-identical on mixed).
