commit	score	mean_score	std_score	bull_2021	crash_bear	sideways	rally_2024	status	description
83f05345	0.605307	0.633748	0.094802	0.699048	0.575486	0.749111	0.511346	discard	Exp2 (architectural, indep): VOLUME x BODY-SHAPE absorption entry attenuator. NEW cross-data-type conjunction orthogonal to all existing entry primitives: body_ratio=|close-open|/(high-low) in [0,1] (NET directional body share; 1=full-body trend bar, 0=doji); combined with entry-bar volume z-score. High-volume + small-body = absorption/congestion (Wyckoff effort-with-no-result) -> lower-quality entry -> smaller first-bar. Shrink-only (caps 1.0, safe family), deep-saturated both gates (vol z>1.5 /1.0, body<0.35 /0.20 -> near-constant where it fires, noise-free), 3-bar mean body for noise-robustness, direction-agnostic, max 0.20, first-bar only. MEASURED vs cabfb6f1 0.605307: BYTE-IDENTICAL (composite 0.605307, all 4 regimes identical, all stab 1.0, min_stability 0.820383). Completely INERT: the absorption gate (vol z>1.5 AND body<0.35) never co-occurs on a bar that PASSES the strong-sum conviction admission gate -> the attenuator never fires on an actual entry. Entries are already conviction-filtered (strong-sum + trend + readiness EMA), so the subset of high-volume-small-body bars that would be attenuated are not admitted in the first place. Extends the entry-shrink-attenuator inertness pattern (deep-saturated entry gates rarely fire on admitted entries). Not branch-eligible (byte-identical, no regime improved, no firing mechanism to iterate -- loosening the gates to fire would attenuate on noise not signal, and the strong-sum gate already filters the low-quality set). Architectural discard #2. Reverted to cabfb6f1 via git checkout -- strategy.py.
76f7a8e9	0.429797	0.515581	0.285946	0.699040	0.573603	0.756004	0.033676	branch	BRANCH OPEN (slope-deceleration exit pressure, 2nd-derivative leading reversal). Exp3 architectural indep: NEW 7th soft source in MAX fusion -- slope DECELERATION (2nd derivative) via disjoint-half proxy (_slp_recent=OLS[8bar], _slp_older=OLS[prev 8bar]; decel=(older-recent)*pos_dir). All existing slope exit logic uses slope LEVEL (1st deriv, LAGGING -- the documented slope-lags-reversal wall); decel is LEADING (slope still confirming but falling -> harvest before slope crosses zero). Profit-side only, gated slope-still-confirming (/0.0003) + strong-decel (/0.00015). MEASURED vs cabfb6f1 0.605307: composite -0.175510 (0.429797), raw_composite 0.518504 (raw -0.086803), mean -0.118167, std +0.191144, min_stability 0.820->0.537 CRASHED. PER-REGIME: bull BYTE-IDENTICAL 0.699040 (deep gates exclude bull's strong trends), sideways +0.006893 (0.749111->0.756004 IMPROVED -- decel-at-swing-top IS a real mean-reversion signal in chop), crash -0.001883 (0.575486->0.573603), rally -0.477670 (0.511346->0.033676 CATASTROPHIC: raw 0.270544 + stability_factor 0.124473 CRASHED -- the 8-bar decel fires erratically on rally grinding deceleration phases that RESUME -> cuts trend runners (raw collapse) + noise-sensitive 8bar decel timing wobbles across AR(1) ensemble (stability crash)). BRANCH HYPOTHESIS: the return-seeking-exit-axis coupling wall reproduces (sideways-BENEFIT vs rally-HARM -- mean-reverter vs trend-follower on the decel surface). FIX = gate the decel pressure on WEAK multi-day ret_vlong (96bar, noise-IMMUNE fast-sat, NOT a cleanliness gate): fire only where decel is a real mean-reversion signal (weak-trend sideways), OFF in strong trends (rally/bull/crash where decel phases resume). This separator is genuinely different from the prior exit-thresh-raise / deep-peak branches which coupled crash-sideways on the 20bar trend surface and walled on noise-unstable R^2/ER cleanliness gates. ret_vlong cleanly separates strong-trend rally from weak-trend sideways. Step2 tests the ret_vlong weak-trend gate (expect rally byte-identical recovery + sideways gain kept).
2857a5fc	0.606390	0.634745	0.094518	0.699048	0.575486	0.750704	0.513743	branch	branch step2: WEAK-MULTI-DAY-TREND (ret_vlong) gate on decel pressure. MEASURED vs cabfb6f1 0.605307: composite +0.001083 (0.606390 PROGRESS, sub-keep <0.003), mean +0.000997, std -0.000284 (better), min_stability 0.820->0.813 (within noise). PER-REGIME: bull BYTE-IDENTICAL 0.699048, crash BYTE-IDENTICAL 0.575486, sideways +0.001593 (0.749111->0.750704, decel-at-swing-top gain kept but slightly trimmed vs step1 +0.0069 since weak-trend gate also trims some sideways bars), rally +0.002397 (0.511346->0.513743 IMPROVED -- stability_factor recovered 1.0; the gate turns OFF the harmful decel in strong-trend rally AND the residual weak-ret_vlong phases help rally slightly). ALL stab 1.0, all MaxDD<10pct, no regime regressed. KEY: the ret_vlong weak-trend gate CLEANLY SEPARATED sideways/rally (the wall prior exit-thresh-raise + deep-peak branches could not cross -- they coupled crash-sideways on 20bar trend + walled on R^2/ER cleanliness gates; ret_vlong 96bar noise-immune separator works). composite +0.001083, need +0.001917 more for keep. Amplify magnitude (0.40 -> higher) -- the gate protects rally stability so headroom exists.
44b43e6e	0.435128	0.518745	0.278723	0.699048	0.575486	0.751593	0.048853	branch	branch step3: amplify decel magnitude 0.40->0.65. MEASURED vs step2 0.606390: composite -0.171262 (0.435128 CRASHED), rally 0.513743->0.048853 (raw 0.267507, stability_factor 0.182624 CRASHED), sideways +0.000889 (0.750704->0.751593 rose), bull/crash byte-identical. WALL: the /0.02 weak-trend gate does NOT fully exclude rally's weak-ret_vlong phases (rally has intermittent low-ret_vlong pullback stretches), and at higher magnitude the decel pressure fires too hard on those rally phases -> stability crash + raw collapse (same wall as step1 magnitude 0.40 ungated). magnitude 0.40 (step2) is near the ceiling. Reverted to step2 (best +0.001083).
925b9166	0.431581	0.516311	0.282434	0.699048	0.575486	0.750967	0.039743	branch	branch step3b: probe magnitude 0.50. MEASURED vs step2 0.606390: composite -0.174809 (0.431581 CRASHED), rally 0.513743->0.039743 (stability 0.148798 CRASHED). WALL IS SHARP between magnitude 0.40 (step2 rally 0.514 stab 1.0) and 0.50 (rally 0.040 stab 0.149). magnitude 0.40 is the firm ceiling. Reverted to step2.
d78c63a9	0.430097	0.515115	0.283395	0.699048	0.575486	0.749286	0.036640	branch	branch step4: sharper weak-trend gate /0.01 + magnitude 0.60. MEASURED vs step2 0.606390: composite -0.176293 (0.430097 CRASHED), rally 0.513743->0.036640 (stability 0.137202 CRASHED), sideways 0.750704->0.749286 (-0.0014 -- sharper gate trimmed sideways too). WALL IS FUNDAMENTAL: rally has enough NEAR-ZERO-ret_vlong bars (early rally, deep pullback stretches where 96bar ret_vlong dips to ~0) that the weak-trend gate CANNOT exclude them; at any magnitude >0.40 the decel pressure fires on those rally bars -> stability crash. The gate/magnitude are coupled; lowering magnitude is the only lever, 0.40 is the firm ceiling. Reverted to step2.
0458be8b	0.606351	0.634717	0.094554	0.699048	0.575486	0.750704	0.513630	branch	branch step5: loosen decel_strength gate /0.00015->/0.00022. MEASURED vs step2 0.606390: composite -0.000039 (0.606351 NO-PROGRESS within noise), sideways identical 0.750704, rally 0.513630 (-0.000113 within noise). Loosening the strength gate adds noise-neutral captures, no gain. Reverted to step2.
4139ec22	0.430364	0.515470	0.283687	0.699048	0.575486	0.750704	0.036643	branch	branch step6: tighten decel_conf /0.0005 + magnitude 0.55. MEASURED vs step2 0.606390: composite -0.176026 (0.430364 CRASHED), rally 0.036643 (stability 0.137199 CRASHED), sideways byte-identical 0.750704. WALL CONFIRMED FUNDAMENTAL: rally has phases matching ALL gates (strongly-confirming slope + strong decel + near-zero ret_vlong during deep pullbacks), so no conf/strength/weak-trend gate tuning protects rally above magnitude 0.40. 5 consecutive no-progress/regression steps past step2 ceiling +0.001083. Reverted to step2.
-	-	-	-	-	-	-	-	discard	BRANCH SUMMARY (slope-deceleration exit pressure): REVERTED to cabfb6f1. Opened after Exp3 (architectural indep, 2nd-derivative leading-reversal signal) showed sideways +0.0069 (real mean-reversion gain-locking) but rally CATASTROPHIC (-0.478, stability 0.124). 6 branch steps. BEST = step2 (composite +0.001083, 0.606390, sub-keep <0.003): added WEAK-MULTI-DAY-TREND (ret_vlong /0.02) gate so decel fires only in weak-trend sideways, OFF in strong-trend rally/bull/crash. step2: ALL regimes improved or byte-identical (bull/crash byte-identical, sideways +0.0016, rally +0.0024 from gate turning off harm + weak-ret_vlong phases helping), stability recovered 1.0, no regression. KEY STRUCTURAL FINDING: the ret_vlong weak-trend gate CLEANLY SEPARATED sideways/rally -- the wall prior exit-thresh-raise + deep-peak branches could NOT cross (they coupled crash-sideways on the 20bar trend surface and walled on noise-unstable R^2/ER cleanliness gates; ret_vlong 96bar noise-IMMUNE separator works). AMPLIFICATION WALL (5 attempts, ALL failed): step3 magnitude 0.65 CRASHED rally (0.040 stab 0.149), step3b magnitude 0.50 CRASHED rally (0.040 stab 0.149), step4 sharper gate /0.01 + mag 0.60 CRASHED rally, step5 loosen decel_strength /0.00022 NO-PROGRESS (0.606351 = step2 within noise), step6 tighten decel_conf /0.0005 + mag 0.55 CRASHED rally. WALL IS FUNDAMENTAL: rally has phases matching ALL gates (strongly-confirming slope + strong decel + near-zero ret_vlong during deep pullbacks), so no conf/strength/weak-trend gate tuning protects rally above magnitude 0.40. Ceiling +0.001083 (sub-keep, well below +0.003). CROSS-SESSION CONCLUSIONS (all measured this session): (a) slope DECELERATION (2nd derivative) is a REAL leading-reversal exit signal for mean-reverting regimes (sideways swing-top gain-locking) -- distinct from slope-LEVEL (1st derivative, lagging, the documented slope-lags-reversal wall); (b) the ret_vlong weak-trend gate is a VALID noise-IMMUNE separator of weak-trend (sideways, decel=reversal) from strong-trend (rally, decel phases resume) regimes -- a NEW partial-separator finding (the prior branches' 20bar-trend + R^2/ER cleanliness gates could not separate them); (c) BUT the amplification ceiling is fundamental: rally's near-zero-ret_vlong deep-pullback phases match every gate, so any magnitude >0.40 crashes rally stability -- the decel mechanism's benefit is bounded at ~+0.001 composite (sideways gain ~+0.0016 + rally gain ~+0.0024 = composite +0.0011) and cannot reach +0.003 without crashing rally. (d) The return-seeking-exit-axis coupling wall (mean-reverter-benefits/trend-follower-harmed) is PARTIALLY breakable via the ret_vlong separator (keeps rally byte-identical-to-improved vs prior branches' rally destruction) but the ceiling remains sub-keep. The slope-deceleration mechanism extends the documented dead-end family (slope-lags-reversal -> slope-deceleration-LEADS but is amplification-walled via rally near-zero-ret_vlong phases). results.tsv append-only preserved (path-scoped git checkout -- strategy.py throughout, never git revert); branch reverted to cabfb6f1. Session ends (branch concluded).
-	-	-	-	-	-	-	-	session-summary	SESSION (v2.1 baseline cabfb6f1 0.605307): 0 keeps + 2 independent architectural discards (Exp1, Exp2) + 1 exploration branch (slope-deceleration exit pressure, 6 steps, REVERTED) = 3 architectural discards total. EXIT: branch-conclusion rule (session ends after branch revert); user-required 2-architectural-discard minimum met (3). Baseline UNCHANGED cabfb6f1 0.605307 [bull 0.699048 Sh1.864, crash 0.575486 Sh1.264 WR100pct, sideways 0.749111 Sh2.025, rally 0.511346 Sh1.300; all stab 1.0, all raw==score]. THEME: probed a genuinely-novel 2nd-derivative exit signal (slope DECELERATION, the LEADING counterpart to the documented lagging slope-LEVEL wall) + 2 other novel angles. INDEPENDENT DISCARDS: (1) Exp1 COUNTER-TREND-LONG HARD take-profit (modest ATR-scaled gain ~1.2pct below _pp_min, ct-long gate ret_vlong<-0.01): BYTE-IDENTICAL INERT -- 4th confirmation (after Exp4 max_hold, Exp5 pp-giveback, single-exit-path-inert) that crash bounce longs exit via slope-against BEFORE reaching even +1.2pct (peaks below the TP level); a hard TP at any modest level is inert for crash. (2) Exp2 VOLUME x BODY-SHAPE absorption entry attenuator (NEW cross-data-type conjunction, body_ratio x vol-z, shrink-only): BYTE-IDENTICAL INERT -- the absorption gate never co-occurs on a bar that PASSES the strong-sum conviction admission gate; entry-side shrink attenuators with deep-saturated gates rarely fire on admitted entries (extends the entry-shrink-attenuator inertness pattern). BRANCH (slope-deceleration exit pressure, 6 steps): REAL mechanism. step1 (ungated): sideways +0.0069 (decel-at-swing-top IS a real mean-reversion signal) BUT rally CATASTROPHIC (-0.478, stability 0.124 -- 8bar decel fires erratically on rally grinding decel phases that resume + noise-sensitive timing wobble). step2 (WEAK-MULTI-DAY-TREND ret_vlong /0.02 gate): BEST composite +0.001083 (0.606390, sub-keep) -- ALL regimes improved or byte-identical (bull/crash byte-identical, sideways +0.0016, rally +0.0024 from gate turning off harm), stability recovered 1.0. The ret_vlong weak-trend gate CLEANLY SEPARATED sideways/rally -- the wall prior exit-thresh-raise + deep-peak branches could NOT cross (they coupled crash-sideways on 20bar trend + walled on noise-unstable R^2/ER cleanliness gates; ret_vlong 96bar noise-IMMUNE separator works). 5 amplification attempts ALL FAILED (magnitude 0.65/0.50, sharper gate /0.01+mag0.60, loosen strength /0.00022, tighten conf /0.0005+mag0.55): wall is FUNDAMENTAL -- rally has phases matching ALL gates (strongly-confirming slope + strong decel + near-zero ret_vlong during deep pullbacks), so no gate tuning protects rally above magnitude 0.40. Ceiling +0.001083 (sub-keep <0.003). CROSS-SESSION CONCLUSIONS (all measured this session): (a) slope DECELERATION (2nd derivative) is a REAL leading-reversal exit signal for mean-reverting regimes (sideways) -- distinct from slope-LEVEL (1st derivative, lagging, the documented slope-lags-reversal wall); (b) ret_vlong weak-trend gate is a VALID noise-IMMUNE separator of weak-trend (sideways, decel=reversal) from strong-trend (rally, decel-resumes) -- NEW partial-separator finding (prior 20bar-trend + R^2/ER gates could not); (c) the return-seeking-exit-axis coupling wall is PARTIALLY breakable via ret_vlong (keeps rally byte-identical-to-improved vs prior branches rally destruction) BUT the amplification ceiling is fundamental (rally near-zero-ret_vlong deep-pullback phases match every gate -> magnitude>0.40 crashes rally stability) and the decel benefit is bounded at ~+0.001 composite, sub-keep; (d) crash exit-path inertness now confirmed across 4 mechanisms (max_hold, pp-giveback, hard-TP, single-exit-path) -- crash bounce longs are modest winners exiting via slope-against before any profit-magnitude/time lever engages; (e) entry-side deep-saturated shrink gates are inert because the strong-sum conviction admission already filters the low-quality subset. The binding rally Sharpe (1.30) and crash Sharpe (1.26) remain unconquered; this sessions mechanisms failed in ways consistent with the documented dead-end families (single-exit-path-inert-for-crash / entry-shrink-inert / slope-deceleration-amplification-walled-via-rally-near-zero-ret_vlong). results.tsv append-only preserved (path-scoped git checkout -- strategy.py throughout, never git revert); all experiments reverted to cabfb6f1. EXIT: 0 keeps, 3 architectural discards (>=2 required, satisfied) + 1 reverted branch, baseline cabfb6f1 0.605307 unchanged.
fcae6004	0.429862	0.508607	0.262485	0.630124	0.584720	0.752943	0.066642	discard	Exp1 (non-arch, mechanism-backed): naive 2x leverage via BASE_POSITION_SIZE 0.065->0.13. HYPOTHESIS: return_reward (added 2026-06-20) is in low concave region at APY 3-5%; 2x doubles APY raising rr on every regime; Sharpe+stability scale-invariant under uniform leverage. RESULT: composite 0.605->0.430 (-0.175), mean 0.634->0.509, std 0.095->0.262. FAILURE: strategy has SIZE-DEPENDENT feedback loops that break scale-invariance -- _port_dd_atten uses equity/peak with FIXED 0.008 DD-fraction scale, _conc_shrink uses FIXED notional/equity thresholds (CONC_EXP_FLOOR 0.05, CONC_EXP_SCALE 0.06). At 2x leverage portfolio DD is 2x deeper -> circuit-breakers fire harder and erratically under AR(1) noise -> entry sizes change -> equity path changes. PER-REGIME: rally stability 1.0->0.230 CRASHED (raw 0.511->0.290, Sh 1.300->1.038, DD 1.57->4.71), bull 0.699->0.630 (Sh 1.864->1.578, DD 0.90->1.79), crash 0.575->0.585 (Sh 1.264->1.265 flat, DD 0.65->1.28), sideways 0.749->0.753 (Sh 2.025->2.014, DD 0.55->1.09). Sharpe DROP (not just scale) proves trade selection/feedback changed, not just magnitude. KEY INSIGHT: leverage is NOT safe because risk-circuit-breaker thresholds are fixed in fraction-space while the DD they react to scales with size -> the breakers activate at different operating points. crash/sideways (high stability 0.97/0.87) survived; rally (lowest stability 0.82) collapsed first. Reverted to cabfb6f1. NEXT: behavior-preserving leverage (scale port_dd + conc thresholds in lockstep with BASE_POSITION_SIZE) to isolate the return_reward gain.
0dbf270c	0.429572	0.509070	0.264992	0.635474	0.584720	0.753564	0.062522	branch	BRANCH OPEN (behavior-preserving return-seeking leverage). Exp2 architectural indep: scale BASE_POSITION_SIZE 0.065->0.13 (LEVERAGE_K=2.0) AND scale the two size-fraction circuit-breaker thresholds in lockstep (port_dd_atten DD-scale 0.008->0.016, CONC_EXP_FLOOR 0.05->0.10, CONC_EXP_SCALE 0.06->0.12) so they activate at baseline operating points. MECHANISM: return_reward factor (added 2026-06-20, no session tested global leverage since) is in low concave region at baseline APY 3-5% (~0.71); 2x doubles APY raising rr on every regime; Sharpe+stability are scale-invariant IF decision logic is invariant. RESULT vs cabfb6f1 0.605307: composite 0.605->0.430 (-0.175), mean 0.634->0.509, std 0.095->0.265. PER-REGIME: bull 0.699->0.635 (Sh 1.864->1.597, DD 0.90->1.79), crash 0.575->0.585 (+0.010 Sh 1.264->1.265 flat DD 0.65->1.28), sideways 0.749->0.754 (+0.004 Sh 2.025->2.016 DD 0.55->1.09), rally 0.511->0.063 CATASTROPHIC (Sh 1.300->0.935, DD 1.57->5.35, stability 1.0->0.235, raw 0.511->0.266). The port_dd+conc threshold scaling did NOT fix it (nearly identical to Exp1 naive leverage). DIAGNOSED ROOT CAUSE (trade counts): rally trades EXPLODED 98->151 (WR 84.7->70.9), bull 52->49, sideways 49->48, crash 52->52 UNCHANGED. The $1 ABSOLUTE minimum-trade threshold (strategy.py line ~2306 abs(target-current_pos)>1.0, AND prepare.py line 471 abs(delta)>1.0 unmodifiable) breaks scale-invariance: during rally quiet stretches no grid fires -> continuous target -> sub-$1 micro-resizes suppressed at baseline but ~2x at 2x cross $1 -> become noise-driven trades -> highly noise-sensitive -> stability crash + WR drop. crash (low churn, grids fire -> no continuous micro-resizes) UNAFFECTED. NEXT BRANCH STEP: scale the strategy's $1 emission threshold by LEVERAGE_K (1.0->2.0) to filter the sub-$2 micro-resizes back out, restoring trade-count invariance. Equity=100000+2*PnL compounding nonlinearity (~4pct size deviation at end-of-rally) remains a backtest artifact (INITIAL_CAPITAL fixed) but is small vs the $1 threshold effect.
