commit	score	mean_score	std_score	bull_2021	crash_bear	sideways	rally_2024	status	description
bbed902d	0.706007	0.778803	0.242655	1.025954	0.720320	1.066580	0.670171	0.410990	discard	Exp1 (architectural, indep): RETURN-DISTRIBUTION SKEWNESS entry shrink. NEW orthogonal data axis genuinely orthogonal to all 8 voters + sizing attenuators (they read MEAN/TREND/VOL/DIRECTION/PATH-SHAPE; NONE reads ASYMMETRY / 3rd moment). 96-bar log-return skew = E[((r-mean)/std)^3]; direction-aware shrink: neg skew shrinks long (left-tail pullback risk), pos skew shrinks short (right-tail bounce risk). Trend-strength-gated (|ret_long|/0.04, spares sideways chop), shrink-only max 0.15, first-bar-only. MEASURED vs 99a369a1 0.706007: BYTE-IDENTICAL (composite 0.706007, all 5 regimes identical to 4dp, all stab 1.0 raw==score, all flip_count 0). min_stab 0.844331 unchanged. FAILURE MECH (architectural fact): the shrink is grid-absorbed -- max 0.15*trend_w*tanh magnitude is a sub-grid proportional entry-side resize that the churn/calm grid quantization (0.06*equity*BASE_POSITION_SIZE lattice) and the 1.0*LEVERAGE_K emission threshold snap back to the same quantized target. Extends the documented grid-absorption wall (prior sessions: mixed grid-walled on proportional sizing) to the CLUSTER regimes at first-bar entry -- small proportional entry shrinks cannot bind on ANY regime, not just mixed. The skew signal itself is orthogonal and real but routing it through a grid-quantized sizing path makes it inert. NOT branch-eligible (no regime improved; byte-identical confirms inert not directional). Rev to 99a369a1. 1st architectural discard.47a2ffa8	0.665655	0.724171	0.195054	0.972982	0.735603	0.850370	0.668063	0.393839	branch	BRANCH OPEN (Exp2 multi-day slope-confirmed hold extension). Architectural: extend _max_hold (grid-EXEMPT exit timing -- full exits target==0 are grid-exempt so this BINDS unlike Exp1) when 96-bar ret_vlong strongly confirms position direction (tanh(ret_vlong*pos_dir/0.03), fast-saturating). Trend-aligned winners ride longer before time-pressure fires -> more trend capture. MEASURED vs 99a369a1 0.706007: composite -0.040352 (0.665655), mean -0.054632 (0.724171), std -0.047601 (0.195054 tighter). PER-REGIME all stab 1.0 all raw==score all flip 0: bull 1.025954->0.972982 (-0.052972, Sh2.068->1.996, DD2.49->2.71), crash 0.720320->0.735603 (+0.015283 TARGET HIT Sh1.254->1.282 -- return-limited trend regime benefits from longer holds as hypothesized), sideways 1.066580->0.850370 (-0.216210 BIG REGRESSION Sh2.027->1.788 -- mean-reverters hurt by riding the slow 2023 recovery drift), rally 0.670171->0.668063 (-0.002108), mixed 0.410990->0.393839 (-0.017151). min_stab 0.842570. JUSTIFICATION: (1) new arch = multi-day trend-align hold extension (96-bar ret_vlong*pos_dir, was vol+16bar-slope+ct only); (2) crash REGRESSED-UP +0.015 confirms crash is return-limited and benefits -- the target mechanism is real; (3) FIX HYPOTHESIS: sideways -0.216 because the extension fires on sideways mean-reverting longs riding the slow 2023 recovery drift (ret_vlong modestly positive). Require the SHORT-TERM _exit_slope to ALSO confirm (currently-trending, not drifting) so only genuine ongoing-trend positions extend -- sideways mean-reverters have flat/negative short slope -> excluded. Next step: add short-slope-confirmation gate.	0.666846	0.725657	0.196036	0.972982	0.735603	0.857797	0.668063	0.393839	branch	branch step2: short-slope-confirmation gate on multi-day hold extension. Gate the extension on _exit_slope*pos_dir (/0.0004) so only currently-trending positions extend. MEASURED vs step1 0.665655: composite +0.001192 (0.666846 PROGRESS), mean +0.001486, std +0.000982. PER-REGIME all stab 1.0: bull BYTE-IDENTICAL 0.972982, crash BYTE-IDENTICAL 0.735603 (crash gain preserved), sideways 0.850370->0.857797 (+0.007427 small recovery), rally BYTE-IDENTICAL 0.668063, mixed BYTE-IDENTICAL 0.393839. min_stab 0.842570. The short-slope gate barely caught sideways mean-reverters (sideways up-legs have positive short slope -> gate still fires for them). sideways still -0.209 vs baseline. Insight: short-slope confirmation conflates trend-up with mean-reversion-up-leg. Next: reduce magnitude + raise multi-day confirmation bar so only STRONG sustained trends extend.	0.686783	0.750402	0.212063	0.956943	0.726227	0.991550	0.668598	0.408690	branch	branch step3: tune multi-day hold extension (mag 0.18->0.10, /0.03->/0.02 deeper confirmation bar). MEASURED vs step2 0.666846: composite +0.019937 PROGRESS (0.686783), mean +0.024745, std +0.016027. PER-REGIME all stab 1.0: bull 0.972982->0.956943 (-0.016039), crash 0.735603->0.726227 (-0.009376 -- lost most crash gain, mag too low), sideways 0.857797->0.991550 (+0.133753 HUGE RECOVERY toward baseline 1.0666), rally 0.668063->0.668598 (+0.000535), mixed 0.393839->0.408690 (+0.014851 recovering toward baseline 0.411). min_stab 0.844830. Still -0.0192 vs baseline 0.706007. TENSION: crash wants strong extension, sideways wants weak -- coupled via trend-align signal. /0.02 bar separates strong(crash) from modest(sideways drift) but 0.10 mag too gentle for crash. Next: vol-scaled magnitude (crash high-vol big real moves -> strong ext; sideways low-vol -> gentle).	0.684062	0.745777	0.205717	0.969464	0.724569	0.954246	0.669174	0.411436	branch	branch step4: vol-scaled extension magnitude (calm 0.06, high-vol 0.16). MEASURED vs step3 0.686783: composite -0.002721 REGRESSION (0.684062, stagnation step1), mean -0.004625, std -0.006346. PER-REGIME: bull 0.956943->0.969464 (+0.012521), crash 0.726227->0.724569 (-0.001658 -- NOT restored, Sh1.2646->1.2616), sideways 0.991550->0.954246 (-0.037304 REGRESSED -- low-vol sideways still extends), rally 0.668598->0.669174 (+0.000576), mixed 0.408690->0.411436 (+0.002746). min_stab 0.844574. Vol-scaling FAILED: crash vol_ratio during downtrend is moderate not high (episodic spikes, mean moderate) so crash didnt get strong ext; sideways low-vol got 0.06 but still extends -> regressed. vol_ratio is the WRONG separator (crash and sideways both moderate vol). Next: gate magnitude on _trend_strength_w (|ret_long|/0.04) -- the structurally correct separator (sideways low trend_strength mean-reverting, crash high trend_strength trending).9c566da5	0.671791	0.730024	0.194108	0.972982	0.730725	0.872672	0.668013	0.405728	branch	branch step5: trend-strength-gated ext magnitude (chop 0.04, strong-trend 0.18). MEASURED vs step4 0.684062: composite -0.012271 REGRESSION (0.671791, stagnation step2), mean -0.015753, std -0.011609. PER-REGIME: bull BYTE-IDENTICAL 0.972982, crash 0.724569->0.730725 (+0.006156 Sh1.2616->1.2731 partially restored), sideways 0.954246->0.872672 (-0.081574 BIG REGRESSION -- sideways 2023 has high-trend-strength legs too so the gate fires on them), rally 0.669174->0.668013 (-0.001161), mixed 0.411436->0.405728 (-0.005708). min_stab 0.842185. INSIGHT: _trend_strength_w does NOT cleanly separate sideways from crash -- sideways recovery has trending legs (high trend_strength) so the gate fires on sideways mean-reverters during their trending up-legs. NO single-quantity separator (vol_ratio, trend_strength, short-slope, ret_vlong) cleanly isolates crash-trend from sideways-mean-reversion because sideways HAS trending legs. Reverted to step3 (branch best 0.686783).	0.685912	0.752928	0.223386	0.965727	0.722382	1.013102	0.669060	0.394368	branch	branch step6: still-climbing gate on hold extension (pos_pnl>=0.85*peak). MEASURED vs step3 0.686783: composite -0.000871 FLAT (0.685912, stagnation step3), mean +0.002526, std +0.011323. PER-REGIME: bull 0.956943->0.965727 (+0.008784), crash 0.726227->0.722382 (-0.003845 Sh1.2646->1.2575 -- gate blocked crash ext too, crash shorts also peak-then-pullback), sideways 0.991550->1.013102 (+0.021552 RECOVERED near baseline 1.0666), rally 0.668598->0.669060 (+0.000462), mixed 0.408690->0.394368 (-0.014322). min_stab 0.844291. The still-climbing gate is the BEST separator so far (sideways recovered to -0.054 of baseline) BUT crash also peak-then-pullbacks so the gate blocks crash extension too -> no crash gain. INSIGHT: crash trend shorts and sideways mean-reversion longs BOTH peak-then-revert at the time-pressure bar -> still-climbing cannot separate them either. The crash +0.015 (step1) was ONLY achievable by a broad extension that also hit sideways -0.216. 6th-dimension coupling wall: no separator (short-slope/vol/trend-strength/ret_vlong-depth/still-climbing) gives crash gain without sideways cost. Branch plateau ~0.686, -0.019 below baseline 0.706.	0.676711	0.739050	0.207799	0.965727	0.720536	0.943237	0.669749	0.396003	branch	branch step7: stricter climb gate (0.85->0.92) + higher mag (0.10->0.14). MEASURED vs step6 0.685912: composite -0.009201 REGRESSION (0.676711, stagnation step4), mean -0.013878, std -0.015587. PER-REGIME: bull BYTE-IDENTICAL 0.965727, crash 0.722382->0.720536 (-0.001846 Sh1.2575->1.2541 -- back to baseline, no gain), sideways 1.013102->0.943237 (-0.069865 REGRESSED -- higher mag hurt sideways when it fires), rally 0.669060->0.669749 (+0.000689), mixed 0.394368->0.396003 (+0.001635). min_stab 0.844248. CONFIRMS coupling wall: stricter gate + higher mag gives crash NOTHING (back to baseline Sh1.254) while costing sideways -0.07. BRANCH TERMINATED: 4 stagnation steps (step4/5/6/7 all <= step3 0.6868). Branch best step3 0.686783 = -0.019 below baseline 0.706007, nowhere near +0.003 keep.-	-	-	-	-	-	-	-	-	-	BRANCH SUMMARY (multi-day slope-confirmed hold extension, 7 steps, REVERTED to 99a369a1): opened after Exp1 (architectural indep byte-identical discard). Exp2 (the branch opener) = extend _max_hold when 96-bar ret_vlong strongly confirms position direction (grid-EXEMPT exit timing, BINDS unlike Exp1 grid-absorbed sizing). Exp2 opener: crash +0.015 (TARGET HIT, Sh1.254->1.282, return-limited trend regime benefits as hypothesized) BUT sideways -0.216 (mean-reverters hurt riding slow 2023 recovery drift). 7 branch steps probed 5 SEPARATORS to isolate crash-trend from sideways-mean-reversion: (1) short-slope confirmation /0.0004 -- step2 +0.0012 progress only (sideways up-legs have positive short slope); (2) deeper multi-day bar /0.03->/0.02 + gentler mag 0.18->0.10 -- step3 +0.0199 BEST (sideways recovered 0.992) but crash lost gain; (3) vol-scaled mag -- step4 -0.0027 (crash vol moderate not high); (4) trend-strength-gated mag -- step5 -0.0123 (sideways has high-trend-strength legs); (5) still-climbing gate pos_pnl>=0.85*peak -- step6 flat -0.0009 (BEST separator, sideways recovered 1.013) but crash also peak-then-pullbacks so gate blocked crash too; (6) stricter 0.92 + higher mag 0.14 -- step7 -0.0092 (crash NOTHING, sideways -0.07). CROSS-EXPERIMENT CONCLUSION (MEASURED, 6th-dimension coupling wall): crash trend shorts and sideways mean-reversion longs BOTH peak-then-revert at the bar time-pressure fires, so EVERY separator (short-slope, vol, trend-strength, ret_vlong-depth, still-climbing) that admits crash trend legs ALSO admits sideways mean-reversion up-legs (they look identical at the time-pressure bar: trend-aligned, positive short slope, near peak). The crash +0.015 gain (step1 opener) was achievable ONLY by a broad extension that also hit sideways -0.216. This extends the documented coupling wall (prior sessions: bull/crash coupled on bull-entry-in-downtrend; mixed/sideways coupled; mixed grid-walled) to the EXIT-TIMING axis: crash and sideways are coupled on the trend-aligned-hold-extension axis. Branch best -0.019 below baseline. KEY FOR FUTURE SESSIONS: (a) do NOT re-attempt trend-aligned hold EXTENSION via ret_vlong*pos_dir (crash/sideways coupling wall, 5 separators failed); (b) the still-climbing gate (pos_pnl near peak) is the BEST separator found but it blocks crash too (crash shorts also peak-then-pullback) -> a crash-specific gain via hold-extension is unreachable; (c) crash return-limitation (Sh1.254) is NOT addressable by extending trend-aligned holds (coupled cost > gain); future crash work should target a non-hold-extension axis. NEW BASELINE 99a369a1 0.706007 UNCHANGED. results.tsv append-only preserved (path-scoped git checkout 99a369a1 -- strategy.py for revert, never git revert).-	-	-	-	-	-	-	-	-	session-summary	SESSION (baseline 99a369a1 0.706007 5-regime -> UNCHANGED, no keep): 1 independent ARCHITECTURAL experiment (Exp1, discard) + 1 exploration branch (multi-day slope-confirmed hold extension, 7 steps, REVERTED). Baseline 99a369a1 re-verified byte-identical at session start (composite 0.706007 mean 0.778803 std 0.242655, all stab 1.0 raw==score, min_stab 0.844331) [bull 1.025954 Sh2.068, crash 0.720320 Sh1.254, sideways 1.066580 Sh2.027, rally 0.670171 Sh1.553, mixed 0.410990 Sh0.808] AND post-branch-revert (strategy.py 0-diff to keep). EXIT RULE: branch reverted -> session ends (per protocol: branch revert is a strong-enough signal to conclude the round; >=2 architectural discards MET via Exp1 + 7 branch steps all architectural). results.tsv append-only preserved throughout (path-scoped git checkout 99a369a1 -- strategy.py for branch revert, never git revert; results.tsv untouched by rollback). THEME: Exp1 probed a NEW orthogonal data axis (return-distribution SKEWNESS / 3rd moment) via entry sizing -> byte-identical (grid-absorbed, extends the grid wall to cluster regimes at first-bar entry). The branch then pursued the ONE grid-BYPASSING axis for crash (return-limited Sh1.254): EXIT TIMING via _max_hold extension (full exits target==0 are grid-EXEMPT, so unlike Exp1 this BINDS). The opener hit crash +0.015 (target) but sideways -0.216; 7 steps probed 5 separators (short-slope, deeper-multi-day-bar, vol-scaled, trend-strength-gated, still-climbing pos_pnl-near-peak) -- all failed to isolate crash-trend from sideways-mean-reversion. CROSS-EXPERIMENT CONCLUSIONS (all MEASURED this session, verifiable): (1) ENTRY-SIZE PROPORTIONAL SHRINKS ARE GRID-ABSORBED ON ALL REGIMES (Exp1 byte-identical): the 0.06*equity*BASE_POSITION_SIZE churn/calm grid quantization + 1.0*LEVERAGE_K emission threshold snap small proportional entry shrinks (max 0.15*trend_w*tanh) back to the same quantized lattice point. Extends the documented mixed grid-wall to the CLUSTER regimes at first-bar entry: small proportional entry-side resizes cannot bind on ANY regime. To bind, a change must be grid-EXEMPT (entries current_pos==0 / full exits target==0 / sign flips) OR large enough to cross a grid line. (2) CRASH/SIDEWAYS COUPLING ON THE TREND-ALIGNED-HOLD-EXTENSION AXIS (branch, 6th-dimension coupling wall): crash trend shorts and sideways mean-reversion longs BOTH peak-then-revert at the bar time-pressure fires, so they look IDENTICAL at the time-pressure bar (trend-aligned, positive short slope, near peak). EVERY separator that admits crash trend legs admits sideways mean-reversion up-legs too. The crash +0.015 gain was achievable ONLY by a broad extension that also hit sideways -0.216. Extends the documented coupling wall (bull/crash on bull-entry-in-downtrend; mixed/sideways; mixed grid) to EXIT-TIMING. (3) STILL-CLIMBING GATE (pos_pnl near peak) IS THE BEST SEPARATOR BUT BLOCKS CRASH TOO (branch step6): it recovered sideways to 1.013 (near baseline) but crash shorts also peak-then-pullback so the gate blocked crashs extension -> no crash gain. crash return-limitation (Sh1.254) is NOT addressable by extending trend-aligned holds. SATURATION RECONFIRMED: mixed walled on all tested axes (prior sessions); crash/sideways coupled on hold-extension (this session); entry-sizing grid-walled on proportional shrinks (this session + prior). NEW BASELINE 99a369a1 0.706007 UNCHANGED. KEY FOR FUTURE SESSIONS: (a) do NOT re-attempt trend-aligned hold EXTENSION via ret_vlong*pos_dir (crash/sideways coupling wall, 5 separators failed in this branch); (b) entry-side proportional sizing shrinks are grid-absorbed on ALL regimes (use grid-EXEMPT paths or large magnitude); (c) crash return-limitation is NOT addressable by extending trend-aligned holds -- future crash work should target a non-hold-extension, non-entry-sizing axis (e.g. ATR stop tuning, tp_harvest on crash deep peaks, or a grid-bypassing full-exit path); (d) the still-climbing gate is the best-found separator for trend-vs-mean-reversion at the time-pressure bar but it is symmetric (blocks both sides peak-then-pullback) -> cannot give a one-sided gain.
77c457b8	0.702265	0.775341	0.243586	1.025954	0.703011	1.066580	0.670171	0.410990	discard	Exp1 (architectural, indep): voter-independent oscillation supplement as PARTIAL DE-RISK (target->0.5*current_pos) instead of step4 full exit. Re-tested the prior-session STRUCTURAL_EXPLORATION step4 breakthrough (3c12a731, rally +0.0105 via voter-independent structural trigger) but with a PARTIAL shrink action -- the ONE variant step4's branch did NOT try (it only widened band/hold/multi-day-ct after the full-exit action). MEASURED vs 99a369a1 0.706007: composite 0.702265 (-0.003742 FAIL), mean 0.775341 (-0.003462 FAIL). PER-REGIME all stab 1.0 raw==score: bull BYTE-IDENTICAL 1.025954 (Sh2.0678), crash 0.720320->0.703011 (-0.017309 Sh1.254->1.224 -- REGRESSED), sideways BYTE-IDENTICAL 1.066580, rally BYTE-IDENTICAL 0.670171 (Sh1.5529 -- TARGET MISSED, the partial action did NOT reach rallys persistent near-breakeven ct shorts unlike step4s full exit), mixed BYTE-IDENTICAL 0.410990. max_dd all <5.2pct. FAILURE MECH (architectural fact, direct measurement): partial de-risk is STRICTLY INFERIOR to step4 full-exit -- (1) rally byte-identical because a partial shrink keeps the position OPEN so it persists in the near-breakeven ct zone (vs full exit which closes it -> the giveback-cap only realizes if the position CLOSES before the adverse leg; a shrunk-but-open position still rides the adverse leg, just on smaller size -> the Sharpe gain step4 got from CLOSING does not materialize); (2) crash -0.017 because the partial shrink PERSISTS through bars accumulating on crash dead-cat-bounce longs (counter-trend to multi-day downtrend, trend_avg<0 so the long-side trend_avg guard PASSES them -- same crash wall step5 hit, the trend_avg<0 guard does NOT protect crash dead-cat longs which are themselves trend_avg<0). CONCLUSION: the partial-action variant is dominated by the full-exit action; step4s full exit was not just sufficient but NECESSARY (closing the position is the mechanism, not shrinking it). Extends the step4 branch conclusion: the voter-independent oscillation supplement only works as a FULL exit. Not branch-eligible (rally byte-identical = no positive regime signal; crash regression has no clean fix per step5/step9). 1st architectural discard.
d0f1882f	0.706007	0.778803	0.242655	1.025954	0.720320	1.066580	0.670171	0.410990	discard	Exp2 (architectural, indep): WIN-STREAK-gated exit-threshold relaxation for TREND-ALIGNED winners. NEW portfolio state _win_streak (mirror of _loss_streak, increment on winning close, reset on loss -- noise-IMMUNE integer counter). Raise the de-risk graduation threshold _exit_thresh by up to EXIT_THRESH_WINSTREAK_RELAX (0.10) when on portfolio win-streak>=2 AND position trend-aligned (pos_dir matches ret_long, /0.04 fast-sat noise-free gate). Hypothesis: win-streak = favorable aligned regime -> let trend-aligned winners ride more giveback before de-risk -> more capture. Targets crash (100pct WR = permanently on win-streak, return-limited Sh1.254). Trend-align gate spares rally ct shorts + crash dead-cat longs. MEASURED vs 99a369a1 0.706007: BYTE-IDENTICAL (composite 0.706007, all 5 regimes identical, every Sharpe identical: bull 2.067798, crash 1.253888, sideways 2.026981, rally 1.552859, mixed 0.807528). The mechanism NEVER binds -- completely INERT. FAILURE MECH (architectural fact, direct measurement): raising the de-risk graduation _exit_thresh changes ZERO exit decisions because positions exit via _sl_pressure (stop) / _soft_max (slope-against + time + pp + ve + vc MAX fusion) BEFORE the de-risk graduation threshold is reached. This is the SAME single-exit-path INERTNESS wall documented in row 988 session-summary conclusion (d): crash return-seeking via SINGLE exit-path levers (max_hold OR peak-profit giveback OR exit_thresh) is structurally inert -- crash bounces exit via slope-against/adverse/stop BEFORE any profit-magnitude or graduation-threshold lever engages. Extends that wall to the _exit_thresh graduation path (3rd single-exit-path lever confirmed inert for crash, after _max_hold row 988 Exp4 and _pp_pressure row 988 Exp5). The _win_streak state is correctly tracked but has no binding exit-path lever to act on (the de-risk graduation is downstream of the binding MAX-fusion/SL exit decision). Prior session row 985 tested _win_streak on the ADMISSION side (byte-identical inert, admission saturated); this confirms the EXIT side is also inert for the graduation-threshold lever. Not branch-eligible (byte-identical = no positive regime signal; the inertness is structural, no fix path -- the graduation threshold is architecturally downstream of the binding exit decision). 2nd architectural discard.
