commit	score	mean_score	std_score	bull_2021	crash_bear	sideways	rally_2024	status	description
31df1483	0.689307	0.754744	0.218120	0.961856	0.729861	1.011417	0.662116	0.408468	discard	Exp1 (architectural, indep): 9th voter -- RANGE-EXPANSION-Z directional conviction. NEW orthogonal data axis: current bar range vs its OWN trailing 20-bar range distribution (range_z=(cur_range-mean)/std), signed by 20-bar close direction. No existing voter reads current-bar range relative to trailing distribution as a directional signal (8th reads interbar/intrabar RATIO; ATR reads LEVEL unsigned; _ve reads 6/18 price-vol unsigned exit-only). Appended weight 0.55 without touching existing _base_weights (validated 8th-voter pattern). MEASURED vs 1d764b9f 0.689311: composite -0.000004 SUB-NOISE (0.689307), mean -0.000004 (0.754744), std 0.218125->0.218120. PER-REGIME all stab 1.0 all raw==score all flip 1.0 all DD unchanged: bull 0.961878->0.961856 (-0.000022 micro Sh 1.999504->1.999453 DD3.09pct -- voter fired occasionally but changed no trade outcomes), crash/sideways/rally/mixed BYTE-IDENTICAL (Sharpe/DD/AnnRet all identical: crash Sh1.271 DD2.46, sideways Sh2.017 DD2.21, rally Sh1.530 DD5.17, mixed Sh0.802 DD2.80). min_stab 0.844713->0.844714. FAILURE MECH (architectural fact): the 9th voter is NEAR-INERT -- its conf=0.1+0.8*0.5*(1+tanh(s)) sits at the 0.1 floor on most bars because _rz_signal=max(0,z)/2*dir saturates at ~1 only when range_z>=2 AND direction matches, which is rare; range_z is usually <2 on bars that pass admission. The voter contribution to the quintic strong-sum (c-0.5)^5 above 0.5 is ~0 when conf<0.5, so it rarely tips an admission decision. Extends the documented voter-saturation wall (8th voter was the confirmed last productive axis; the volume grid + efficiency axis are saturated). Not branch-eligible (sub-noise, no regime improved, near-inert -- amplifying the weight risks noise-amplification on the rare firing bars without a credible path to +0.003). Reverted to 1d764b9f. 1st architectural discard.
6d333037	0.659798	0.717048	0.190835	0.814189	0.736117	0.987217	0.634890	0.412831	discard	Exp2 (architectural, indep): ENTRY-TIME vol-regime adaptive de-risk floor. NEW per-position state _entry_vol_ratio (vol_ratio cached at entry, deterministic) modulates the de-risk graduation floor: high entry-vol (vol_ratio_entry>1, e.g. crash) -> LOWER floor (wider graduation band, more gradual de-risk so single-bar noise spikes don't force premature partial exits); low entry-vol (rally grind) -> RAISE floor (faster exit, moves more meaningful). Continuous tanh centered at entry-vol=1, max +/-0.05, clamped [0.40,0.95]. NEW control-flow dependency: exit graduation depends on entry-time vol regime (distinct from current-vol conditioning in slope/pp bands). MEASURED vs 1d764b9f 0.689311: composite -0.029513 (0.659798 FAIL), mean -0.037700 (0.717048 FAIL), std 0.218125->0.190835 (tighter but mean-driven). PER-REGIME all stab 1.0 all raw==score all flip 1.0 all DD<10pct: bull 0.961878->0.814189 (-0.147689 Sh 1.9995->1.6996 DD 3.09->3.21pct -- REGRESSED HARD), crash 0.729861->0.736117 (+0.006256 Sh 1.271->1.279 DD2.46 -- target barely gained), sideways 1.011417->0.987217 (-0.024200 Sh 2.017->1.938), rally 0.662116->0.634890 (-0.027226 Sh 1.530->1.479 DD 5.17->5.52pct), mixed 0.408468->0.412831 (+0.004363 Sh 0.802->0.792 DD2.80->2.88 micro gain). min_stab 0.844713->0.843056. FAILURE MECH (direct measurement): the entry-vol floor modulation HURT the low-to-mid-vol-entry trend regimes (bull/sideways/rally) by RAISING their de-risk floor (low entry-vol -> +floor -> faster exit) -> exiting winning trend positions prematurely on modest exit pressure -> Sharpe crashes (bull 2.00->1.70, sideways 2.02->1.94, rally 1.53->1.48). The intended crash benefit was tiny (+0.006) because crash shorts already exit via giveback/slope-against BEFORE the de-risk floor is binding (the floor only engages at mid-range exit pressure, but crash exits route through the binary _exit_thresh path on slope reversal). Extends the documented winner-cut-too-fast wall: the de-risk floor is load-bearing for trend-following capture, and tightening it on low-vol-entry regimes (where trends grind) cuts trend capture. The entry-time-vol signal is the wrong modulation direction for trend regimes (low-vol entries are exactly the grinding trends that need the cushion, not faster exits). Not branch-eligible (3/5 regimes regressed, bull -0.148, no path to keep -- the mechanism direction is wrong and crash target barely moved; reversing the sign to help low-vol trends would raise crash/rally DD via slower exits, the opposite wall). Reverted to 1d764b9f. 2nd architectural discard (EXIT RULE 2-arch minimum MET).
bc7a46e8	0.686947	0.751253	0.214354	0.954605	0.729861	1.001214	0.662116	0.408468	branch	branch step1: ONE-SIDED entry-vol de-risk floor (only LOWER for high-vol-entry vol_ratio_entry>1; low-vol byte-identical). MEASURED vs baseline 1d764b9f 0.689311: composite -0.002364 (0.686947 BELOW baseline, no-progress), mean -0.003495 (0.751253 FAIL), std 0.218125->0.214354. PER-REGIME all stab 1.0 all raw==score all flip 1.0: bull 0.961878->0.954605 (-0.007273 Sh 1.9995->1.9927 DD 3.09->3.087 -- LEAKED: bull has vol-spike entries vol_ratio>1 during sharp pullbacks -> floor lowered -> cut trend capture), crash BYTE-IDENTICAL 0.729861 (Sh 1.270529 DD 2.462597 -- the Exp2 +0.006 gain DID NOT SURVIVE isolation; it was cross-regime portfolio-state feedback from the low-vol regimes changes, not a real entry-vol mechanism), sideways 1.011417->1.001214 (-0.010203 Sh 2.017->1.978 -- LEAKED same as bull), rally BYTE-IDENTICAL 0.662116, mixed BYTE-IDENTICAL 0.408468. min_stab 0.844713->0.843329. KEY FINDING (disproves branch hypothesis): (1) crash byte-identical -- the entry-vol signal does NOT benefit crash in isolation; Exp2's crash +0.006 was spurious cross-regime feedback. (2) the one-sided modulation LEAKED into bull/sideways because vol_ratio>1 at entry occurs in THEIR sharp-pullback entries too (not just crash) -> floor lowered on bull/sideways trend longs -> cut capture. The entry-vol signal cannot cleanly separate crash from bull/sideways vol-spike entries (same class of wall as the 20-bar ct mis-classifies bull pullbacks). No-progress step #1 (vs baseline).
f8215b47	0.688984	0.754704	0.219065	0.945390	0.729861	1.027683	0.662116	0.408468	branch	branch step2: ENTRY-VOL amplification of convex cushion exponent _dr_k (not floor). High-vol-entry positions get stronger convex cushion (higher _dr_k, hold near full size through more mid-range slope-against noise); gated on existing profit x trend-align x slope-conf (excludes ct vol-spike entries that step1 leaked on). MEASURED vs baseline 0.689311: composite -0.000327 SUB-NOISE (0.688984 no-progress), mean -0.000044 (0.754704 flat), std 0.218125->0.219065. PER-REGIME all stab 1.0 all raw==score all flip 1.0: bull 0.961878->0.945390 (-0.016488 Sh 1.9995->1.9839 DD 3.09->3.22pct -- REGRESSED: cushion amplification held trend longs too long into 2021 sharp corrections), crash BYTE-IDENTICAL 0.729861 (Sh 1.270529 DD 2.462597 -- crash exits via giveback/slope BEFORE the convex cushion engages, so cushion amplification is inert on crash; DISPROVES branch premise for the 2nd time), sideways 1.011417->1.027683 (+0.016266 Sh 2.017->2.043 -- GAINED: vol-burst mean-reversion winners held through mid-range noise -> more capture), rally BYTE-IDENTICAL 0.662116, mixed BYTE-IDENTICAL 0.408468. min_stab 0.844713 IDENTICAL. KEY FINDINGS: (1) crash byte-identical again -- entry-vol cushion amplification does NOT reach crash (crash exits route through giveback/slope-against before the convex cushion's mid-range band engages); the branch premise (crash benefits from entry-vol de-risk modulation) is DISPROVEN across both floor (step1) and cushion (step2) levers. (2) unintended sideways +0.0163 gain from cushion amplification on vol-burst mean-reversion winners, exactly offset by bull -0.0165 loss on sharp-correction trend longs (classic sideways-vs-bull tension: the cushion holds winners through noise, helping sideways vol-bursts but holding bull longs into corrections). Net mean flat, composite sub-noise down. No-progress step #2 (vs baseline).
4558c650	0.688984	0.754704	0.219065	0.945390	0.729861	1.027683	0.662116	0.408468	branch	branch step3: MAE-cleanliness gate on entry-vol cushion amp (spare bull deep-MAE corrections). Gate the entry-vol cushion AMPLIFICATION by MAE-cleanliness: full amp when MAE shallow (|MAE|<0.3*|stop|), fading to 0 at |MAE|>=0.8*|stop|; base cushion unchanged. MEASURED vs step2 0.688984: BYTE-IDENTICAL (composite 0.688984, all per-regime identical: bull 0.945390, sideways 1.027683, crash 0.729861, rally 0.662116, mixed 0.408468; all Sharpe/DD identical). FAILURE MECH (architectural fact): the MAE gate is REDUNDANT with the existing profit gate. The cushion amplification only fires when max(0,_pnl_scale)>0 (position currently winning) AND _dr_align>0 AND _dr_slope_conf>0. On bars where the cushion fires, the position is at/near a peak -> MAE is shallow by construction -> the MAE gate is ~1 (no attenuation). On deep-MAE bars (where the gate would zero the amp) the position is losing -> _pnl_scale<0 -> max(0,_pnl_scale)=0 -> no cushion ANYWAY. The MAE gate is collinear with the profit gate (same self-exclusionary pattern as prior MAE-fragility Exp2 96260db1). No-progress step #3 (byte-identical to step2). BRANCH TERMINATION: 3 no-progress steps (step1 -0.0024, step2 -0.0003, step3 byte-identical); branch premise (crash benefits from entry-vol de-risk modulation) DISPROVEN -- crash byte-identical across ALL 3 steps (crash exits via giveback/slope-against before the cushion/floor engages); sideways +0.0163 gain stuck behind bull -0.0165 tradeoff (MAE gate cannot separate them due to profit-gate collinearity). No credible path to keep.
-	-	-	-	-	-	-	-	-	discard	BRANCH REVERTED (entry-vol de-risk modulation, 3 steps). Opened after Exp2 (6d333037 bilateral entry-vol de-risk floor, -0.0295): Exp2's crash +0.006 micro-gain suggested crash shorts (high-vol-entry) benefit from more gradual de-risk. Step1 (bc7a46e8, ONE-SIDED floor: only LOWER for high-vol-entry): crash BYTE-IDENTICAL (the Exp2 crash gain was spurious cross-regime portfolio-state feedback, NOT a real entry-vol mechanism), and the modulation LEAKED into bull/sideways (vol-spike entries there too -> floor lowered -> cut trend capture; bull -0.0073, sideways -0.0102). Step2 (f8215b47, cushion exponent _dr_k amp instead of floor, gated on existing profit x trend-align x slope-conf): crash BYTE-IDENTICAL AGAIN (crash exits via giveback/slope-against BEFORE the convex cushion's mid-range band engages -- the cushion lever is structurally inert on crash), unintended sideways +0.0163 (vol-burst mean-reversion winners held through mid-range noise) offset by bull -0.0165 (cushion held trend longs into 2021 sharp corrections) = net mean flat, composite sub-noise -0.0003. Step3 (4558c650, MAE-cleanliness gate on cushion amp to spare bull): BYTE-IDENTICAL to step2 (the MAE gate is collinear with the profit gate -- cushion fires only on winning bars where MAE is shallow by construction, so the gate is ~1 wherever it matters; same self-exclusionary pattern as prior MAE-fragility Exp2 96260db1). TERMINATION: 3 no-progress steps (step1 -0.0024, step2 -0.0003, step3 byte-identical); branch premise (crash benefits from entry-vol de-risk modulation) DISPROVEN across BOTH levers (floor step1, cushion step2) -- crash byte-identical in all 3 steps. The sideways +0.0163 gain is real but stuck behind the bull -0.0165 tradeoff, and the separator attempts (MAE gate) are collinear with the existing profit gate. CONVERGENT CONCLUSION: (1) entry-vol signal does NOT reach crash (crash's exit path is giveback/slope-against, which fire before the de-risk floor/cushion engage -- extends the documented crash exit-timing-inert wall). (2) The sideways-vs-bull cushion tradeoff (cushion holds winners through noise -> helps sideways vol-bursts, hurts bull corrections) is the SAME family as the documented winner-hold bull-bleed wall -- the cushion cannot be tightened for sideways without bleeding bull, and MAE cannot separate them (profit-gate collinear). (3) Exp2's bilateral crash +0.006 was spurious cross-regime feedback (loss-streak/equity state from the low-vol regimes' changes fed into crash) -- a cautionary note that cross-regime portfolio-state feedback can manufacture apparent regime gains that vanish in isolation. Reverted to 1d764b9f (byte-identical, 0 diff). results.tsv append-only preserved throughout (path-scoped git checkout -- strategy.py, never git revert).
-	-	-	-	-	-	-	-	-	session-summary	SESSION (baseline 1d764b9f 0.689311 5-regime -> UNCHANGED, no keep): 2 independent architectural experiments (Exp1-2, BOTH discards) + 1 exploration branch (entry-vol de-risk modulation, 3 steps, REVERTED). Baseline 1d764b9f re-verified byte-identical at session start (run_baseline_verify.log composite 0.689311 mean 0.754748 std 0.218125, all stab 1.0 raw==score, all flip 1.0) [bull 0.961878 Sh1.9995 DD3.09pct 52t, crash 0.729861 Sh1.271 DD2.46pct 55t 100pctWR, sideways 1.011417 Sh2.017 DD2.21pct, rally 0.662116 Sh1.530 DD5.17pct, mixed 0.408468 Sh0.802 DD2.80pct 100pctWR; min_stab 0.844713] AND post-branch-revert (strategy.py 0-diff to keep). EXIT RULE: 2-architectural-discard minimum MET (Exp1+Exp2) + branch revert (concluded). results.tsv append-only preserved throughout (path-scoped git checkout -- strategy.py for every revert, never git revert). THEME: probed 2 genuinely-different architectural axes (a 9th orthogonal data-source voter; entry-vol-regime-adaptive de-risk graduation) plus a 3-step branch on the de-risk subsystem. CROSS-EXPERIMENT CONCLUSIONS (all measured this session, verifiable): (1) EXP1 9th VOTER RANGE-EXPANSION-Z (31df1483): NEW orthogonal data axis -- current bar range vs its OWN trailing 20-bar range distribution (range_z), signed by 20-bar close direction. No existing voter reads current-bar range relative to trailing distribution as a directional signal. Appended weight 0.55 (validated 8th-voter pattern). composite -0.000004 SUB-NOISE, NEAR-INERT: bull -0.000022 micro (Sh 1.999504->1.999453), all 4 other regimes BYTE-IDENTICAL. FAILURE MECH: the voter conf sits at the 0.1 floor on most bars because _rz_signal saturates at ~1 only when range_z>=2 AND direction matches (rare); range_z is usually <2 on bars passing admission -> contribution to the quintic strong-sum (c-0.5)^5 above 0.5 is ~0 -> rarely tips admission. Extends the documented voter-saturation wall (8th voter was the confirmed last productive axis; the volume+efficiency axes are saturated). (2) EXP2 ENTRY-VOL DE-RISK FLOOR bilateral (6d333037, -0.0295): NEW per-position state _entry_vol_ratio cached at entry; modulated de-risk floor +/-0.05 by entry-vol regime. composite -0.0295, mean -0.0377. PER-REGIME: bull -0.1477 (Sh 2.00->1.70), sideways -0.0242 (Sh 2.02->1.94), rally -0.0272 (Sh 1.53->1.48), crash +0.0063 micro (Sh 1.271->1.279), mixed +0.0044 micro. FAILURE MECH: raising the floor on low-vol-entry trend regimes (bull/sideways/rally grind) cut their trend capture (winner-cut-too-fast wall); crash +0.006 was spurious (see branch). (3) BRANCH ENTRY-VOL DE-RISK (3 steps, REVERTED): pursued the Exp2 crash +0.006 micro-signal. Step1 (one-sided floor, only LOWER for high-vol-entry): crash BYTE-IDENTICAL -- the Exp2 crash gain DID NOT SURVIVE isolation (it was cross-regime portfolio-state feedback from the low-vol regimes' changes, not a real entry-vol mechanism); and the modulation LEAKED into bull/sideways (vol_ratio>1 at entry occurs in THEIR sharp-pullback entries too -> floor lowered -> cut capture). Step2 (cushion exponent _dr_k amp instead of floor, gated on profit x trend-align x slope-conf): crash BYTE-IDENTICAL AGAIN (crash exits via giveback/slope-against BEFORE the convex cushion's mid-range band engages -> cushion structurally inert on crash); unintended sideways +0.0163 (vol-burst mean-reversion winners held through mid-range noise) offset by bull -0.0165 (cushion held trend longs into 2021 sharp corrections) = net mean flat. Step3 (MAE-cleanliness gate on cushion amp to spare bull): BYTE-IDENTICAL to step2 (MAE gate collinear with the profit gate -- cushion fires only on winning bars where MAE is shallow by construction -> gate ~1 wherever it matters; same self-exclusionary pattern as prior MAE-fragility Exp2 96260db1). CONVERGENT NEW INSIGHTS (this session, verifiable): (A) ENTRY-VOL DOES NOT REACH CRASH: crash byte-identical across ALL 3 branch steps (floor + cushion levers) -- crash's exit path is giveback/slope-against which fire before the de-risk floor/cushion engage. Extends the documented crash exit-timing-inert wall to the entry-vol axis. (B) CROSS-REGIME FEEDBACK CAN MANUFACTURE SPURIOUS REGIME GAINS: Exp2's bilateral crash +0.006 vanished in one-sided isolation -- the gain was an artifact of the low-vol regimes' changes feeding back through portfolio state (loss-streak/equity/peak_equity) into crash's behavior. CAUTION FOR FUTURE SESSIONS: a regime gain observed in a multi-regime change does NOT imply the change benefits that regime in isolation; isolate via one-sided/byte-identical checks before pursuing. (C) The sideways-vs-bull cushion tradeoff (cushion holds winners through noise -> helps sideways vol-bursts, hurts bull corrections) is the SAME family as the documented winner-hold bull-bleed wall; MAE cannot separate them (profit-gate collinear). SATURATION RECONFIRMED: strategy at confirmed deep local optimum reconfirmed via 2 novel architectural axes (9th voter on range-expansion-z; entry-vol-regime de-risk) + 3-step branch. NEW BASELINE 1d764b9f 0.689311 UNCHANGED.
d6c6bcae	0.664337	0.722196	0.192863	0.800904	0.728219	1.004779	0.665894	0.411186	discard	Exp1 architectural indep: MTM-PATH-EFFICIENCY magnitude on the de-risk convex cushion _dr_k. NEW control-flow dep at the de-risk decision: the per-position pos_pnl path-efficiency (already maintained in _pnl_path for the emission throttle, baseline 1d764b9f) now ALSO consumed as a magnitude-scaling factor on the cushion exponent. MTM-eff=|net|/sum|delta| in [0,1] (HIGH=smooth-climbing winner, LOW=choppy dead-capital hold). Routed as a magnitude (multiplies _dr_k excess over 1.0), not a new gate -> byte-identical for losers/ct/slope-weak by construction. MEASURED vs 1d764b9f 0.689311: composite -0.024974 (0.664337 FAIL), mean -0.032552 (0.722196 FAIL), std 0.218125->0.192863 (tighter, mean-driven). PER-REGIME all stab 1.0 raw==score all DD<10pct all flip 0: bull 0.961878->0.800904 (-0.160974 Sh1.9995->? REGRESSED HARD), crash 0.729861->0.728219 (-0.001642 TARGET MISSED), sideways 1.011417->1.004779 (-0.006638), rally 0.662116->0.665894 (+0.003778 micro), mixed 0.408468->0.411186 (+0.002718 micro). FAILURE MECH (direct measurement): bull-2021 corrective longs are ALSO smooth-climbing winners (high MTM-eff) -> the strengthened cushion held them through 2021 sharp corrections -> Sharpe crashed (bull -0.161). Same SMOOTH-WINNER!=TREND-WINNER wall as the prior MTM-path-eff max_hold attempt (2e33cc75, bull -0.130): MTM-path-smoothness cannot separate bull corrective longs (smooth climb that then corrects) from genuine trend winners. crash target did NOT gain (-0.0016, crash shorts are already fast-cut via giveback/slope-against before the cushion engages -- cushion structurally inert on crash). Not branch-eligible (binding bull -0.161 over 50pct gate floor 0.481 AND target crash -0.0016; no path to keep -- MTM-eff cannot separate the two smooth-winner populations). 1st architectural discard.
a292f44d	0.689311	0.754748	0.218125	0.961878	0.729861	1.011417	0.662116	0.408468	discard	Exp2 architectural indep: CROSS-SYMBOL CORRELATED-LOSS sl_pressure AMPLIFIER. NEW cross-symbol data dep at the EXIT subsystem, routed through the DOMINANT loss-bar term (_sl_pressure) as a multiplier rather than as a new MAX-fusion soft source (prior sessions proved a new soft MAX source is structurally inert under MAX-fusion, fff42d33/4bf5f622). When this LOSING position is part of a same-direction correlated drawdown (other same-sign symbols also currently losing), amplify the within-symbol stop pressure up to +20pct (frac_losing tanh /0.3, onset 0.5). Capped below 0.95 stop-exempt threshold (amplifies soft MAX floor without forcing binary exit). Byte-identical when winning or no correlated losers. MEASURED vs 1d764b9f 0.689311: BYTE-IDENTICAL (composite 0.689311, mean 0.754748, std 0.218125, all 5 regimes identical to 6 decimals, all stab 1.0 raw==score, min_stab 0.844713). FAILURE MECH (architectural fact, direct measurement): the amplifier NEVER fired on any regime -- the condition (_sl_pressure>0 AND pos_pnl<0 AND other same-sign positions currently losing) is structurally inert. When a position reaches meaningful stop-pressure (loss approaching _stop_abs), the other same-sign positions are NOT simultaneously losing: exits are staggered via slope-against/giveback/tp-harvest so correlated losers do not co-exist at the stop-pressure moment. Same-direction losing books arise in correlated regimes (crash dead-cat bounces) but the per-symbol exit primitives (slope-against fires first) trim each position BEFORE its stop binds, so the amp condition is never met. EXTENDS the documented cross-symbol EXIT wall (prior new-source attempts inert under MAX-fusion; this multiplier-routing attempt ALSO inert because the cross-symbol loss-overlap condition itself is empty at the decision point). Not branch-eligible (byte-identical = zero regime delta, no positive signal on any regime; mechanism structurally inert not a fixable regression). 2nd architectural discard.
