commit	score	mean_score	std_score	bull_2021	crash_bear	sideways	rally_2024	status	description
dccf0da1	0.615508	0.643637	0.093764	0.713850	0.584613	0.753564	0.522521	keep	KEEP (NEW BASELINE, SUPERSEDES cabfb6f1 0.605307). Branch SUCCESS (behavior-preserving return-seeking leverage, 2 steps). Architectural: scale BASE_POSITION_SIZE 0.065->0.13 (LEVERAGE_K=2.0) AND scale the three size-dependent ABSOLUTE/fraction-space decision gates in lockstep so the strategy's DECISION LOGIC is leverage-invariant, isolating the return_reward gain: (1) port_dd_atten DD-fraction scale 0.008->0.016, (2) CONC_EXP_FLOOR 0.05->0.10 + CONC_EXP_SCALE 0.06->0.12, (3) the $1 absolute min-trade emission threshold 1.0->2.0. MECHANISM: the return_reward factor (added 2026-06-20, log(1+APY%/100+1)) was in its low concave region at baseline APY 3-5% (~0.71); no prior session tested global leverage since (all 11 sizing experiments pre-date return_reward, targeted scale-invariant Sharpe). 2x doubles APY (6-10%) raising rr to ~0.73-0.74 on every regime. Sharpe is scale-invariant; stability = 1-TE/clean_vol is scale-invariant (both num and den scale by k); DD scales by 2 but stays well under the 8% knee (rally 1.57->3.12%). KEY DIAGNOSIS (branch step1->step2): naive leverage (Exp1 fcae6004) and fraction-only threshold scaling (Exp2 step1 0dbf270c) BOTH crashed rally stability to 0.23 because the $1 ABSOLUTE min-trade threshold (strategy.py + prepare.py line 471) breaks scale-invariance -- at 2x, sub-$1 quiet-stretch micro-resizes (suppressed at baseline) cross $1 and become noise-driven trades (rally trades 98->151, WR 84.7->70.9). Scaling the emission threshold by LEVERAGE_K (step2) filtered them back out -> rally trades 99 (baseline 98), stability restored to 1.0 (raw stability 0.818 vs baseline 0.820). MEASURED vs cabfb6f1 0.605307: composite +0.010201 (0.615508), mean +0.009889 (0.643637), std -0.001038 (0.093764 tighter), min_stability 0.820->0.818 (unchanged). PER-REGIME: bull 0.699048->0.713850 (+0.014802 - Sh 1.864->1.858, AnnRet 4.7->9.5pct, DD 0.90->1.79), crash 0.575486->0.584613 (+0.009127 - Sh 1.264->1.265 flat, AnnRet 3.2->6.3pct, DD 0.65->1.28, 100pct WR held), sideways 0.749111->0.753564 (+0.004453 - Sh 2.025->2.016, AnnRet 3.5->7.1pct, DD 0.55->1.09), rally 0.511346->0.522521 (+0.011175 BINDING-REGIME-GAIN - Sh 1.300->1.320, AnnRet 3.9->7.9pct, DD 1.57->3.12, stability 0.820->0.818 factor 1.0). ALL regimes improved (no 50pct drop), all stability_factor 1.0, all flip_streak_gate 1.0, all flip_count 0, all MaxDD<10pct (max rally 3.12). All keep criteria met. NEW BASELINE 0.615508. CROSS-SESSION CONCLUSION: (a) the return_reward lever is REAL and was under-explored -- the strategy was drastically under-sized relative to DD headroom (0.5-1.6pct DD vs 10pct cutoff); (b) leverage is NOT naively scale-invariant in this codebase because of ABSOLUTE thresholds ($1 min-trade) and fraction-space circuit-breakers (port_dd, conc) -- all must be scaled in lockstep with size; (c) the $1 min-trade threshold is the dominant nonlinearity (fraction-space circuit-breakers alone did not fix it). Observation (correlation only): rally (binding) gained most via return_reward at preserved Sharpe; direction-split PnL not measured.
60c61b25	0.615142	0.643285	0.093809	0.713334	0.583720	0.753564	0.522521	discard	Exp3 (architectural, indep): direction-asymmetric ct_vlong shrink -- reduce bull-ct (crash bounce long, 100pct WR) shrink 0.40->0.20, keep bear-ct (rally pullback short) at 0.40. HYPOTHESIS: symmetric shrink over-shrinks high-quality capitulation-bounce longs (long-against-downtrend=mean-reversion) while correctly shrinking low-quality grinding-pullback fades (short-against-uptrend); asymmetric lets crash commit more to bounce longs (return_reward). RESULT vs dccf0da1 0.615508: composite -0.000366 (0.615142 sub-noise), mean -0.000352. PER-REGIME: crash 0.584613->0.583720 (-0.000893 REGRESSED - Sh 1.264547->1.261886 DROPPED, AnnRet FLAT 6.3pct, DD 1.278 unchanged -- un-shrinking bounce longs added VARIANCE without proportional return -> Sharpe down, return_reward flat), bull 0.713850->0.713334 (-0.000516 Sh 1.858->1.856), rally BYTE-IDENTICAL 0.522521 (bear-ct unchanged), sideways BYTE-IDENTICAL 0.753564. KEY FINDING: the direction-asymmetry hypothesis is NOT confirmed by data -- the bounce-long Sharpe is slightly BETTER with the symmetric shrink (shrink cuts variance more than return), so the symmetric 0.40 is well-calibrated, not over-shrinking. Un-shrinking is NOT Sharpe-neutral (contrary to the scale-invariance argument): scaling up a SUBSET of trades (bounce longs only) changes the equity-curve shape and lowered crash Sharpe. Reverted to dccf0da1. Architectural discard #1.
7e5a86d8	0.615193	0.643439	0.094155	0.713869	0.584613	0.753768	0.521508	discard	Exp4 (architectural simplification): REMOVED the two mixed-cell entry boosts (_btcvol_partner_boost=BTC-vol x PARTNER-price, _partnervol_btc_boost=PARTNER-vol x BTC-price). Code's own comments flagged these as 'may be redundant with Exp1 (BTC-vol) x Exp2-partner-boost (partner-price) which already multiply'. HYPOTHESIS: near-constant +0.05 deep-saturated multipliers are redundant double-counting -> removal score-neutral (simplification aids OOS). RESULT vs dccf0da1 0.615508: composite -0.000315 (0.615193 sub-noise), mean -0.000198. PER-REGIME: rally 0.522521->0.521508 (-0.001013 REGRESSED - Sh 1.319708->1.316169, the mixed BTC-vol x partner-price confirmation slightly helped rally alt longs), sideways 0.753564->0.753768 (+0.000204 Sh 2.016->2.018), bull 0.713850->0.713869 (+0.000019 flat), crash BYTE-IDENTICAL 0.584613 (mixed boosts are alt-only). FINDING: the mixed cells are NOT pure redundancy -- they carried marginal orthogonal signal (rally alt-long broad-market confirmation via leader-vol x follower-price). Net slightly negative (rally loss > sideways/bull gain), sub-noise. Reverted to dccf0da1. Architectural discard #2. NOTE: at this experiment count even a sub-noise -0.0003 simplification is a discard (no +0.003 gain), but the marginal-signal finding (mixed cells are not redundant) is a clean structural conclusion.
-	-	-	-	-	-	-	-	session-summary	SESSION (baseline cabfb6f1 0.605307 -> NEW BASELINE dccf0da1 0.615508, +0.010201 KEEP): 1 keep (behavior-preserving 2x leverage branch) + 1 non-arch discard (Exp1) + 2 architectural discards (Exp3, Exp4). User 2-arch-discard minimum MET (2). Baseline cabfb6f1 0.605307 [bull 0.699048 Sh1.864, crash 0.575486 Sh1.264, sideways 0.749111 Sh2.025, rally 0.511346 Sh1.300; all stab 1.0] -> dccf0da1 0.615508 [bull 0.713850 Sh1.858, crash 0.584613 Sh1.265, sideways 0.753564 Sh2.016, rally 0.522521 Sh1.320; all stab 1.0, all DD<3.12pct, all raw==score]. THEME: discovered the return_reward lever was UNDER-EXPLORED -- the return_reward factor (added 2026-06-20) sits in its low concave region at baseline APY 3-5pct (~0.71) because the strategy is drastically under-sized (DD 0.5-1.6pct vs 10pct cutoff); NO prior session tested global leverage since the factor was added (all 11 sizing experiments pre-date it, targeted scale-invariant Sharpe). KEY MECHANISM FINDINGS (all measured): (1) naive uniform leverage is NOT scale-invariant in this codebase -- ABSOLUTE thresholds (the $1 min-trade gate at strategy.py + prepare.py line 471) and fraction-space circuit-breakers (_port_dd_atten 0.008 DD-scale, _conc_shrink notional thresholds) have FIXED thresholds, so 2x deeper portfolio DD fired them harder/erratically -> rally stability crashed 1.0->0.23 (Exp1 fcae6004). (2) scaling the fraction-space circuit-breakers ALONE (Exp2 step1 0dbf270c) did NOT fix it -- the $1 ABSOLUTE min-trade threshold is the DOMINANT nonlinearity: at 2x, sub-$1 quiet-stretch micro-resizes (suppressed at baseline) cross $1 -> become noise-driven trades (rally trades exploded 98->151, WR 84.7->70.9). (3) scaling the $1 emission threshold by LEVERAGE_K (branch step2 dccf0da1) restored trade-count invariance (rally 99 trades, stability 1.0) -> the behavior-preserving leverage isolates the return_reward gain: Sharpe + stability preserved, DD scales but stays under 8pct knee, every regime +2-4pct via return_reward. KEEP composite +0.010201, all 4 regimes improved, mean +0.0099, std tighter. ARCHITECTURAL DISCARDS: Exp3 direction-asymmetric ct_vlong shrink (bull-ct 0.40->0.20 crash bounce longs, keep bear-ct 0.40 rally pullback shorts) -- DISCARD, crash regressed -0.0009 (Sh 1.2645->1.2619, AnnRet FLAT 6.3pct); finding: un-shrinking a SUBSET of trades (bounce longs) is NOT Sharpe-neutral (adds variance without proportional return), and the symmetric ct shrink is well-calibrated (bounce-long Sharpe slightly BETTER with the shrink) -- the direction-asymmetry hypothesis (bounce longs higher quality -> less shrink) is NOT confirmed by data. Exp4 remove mixed-grid entry boosts (_btcvol_partner x _partnervol_btc, flagged 'may be redundant') -- DISCARD, net -0.000315 sub-noise (rally -0.001, sideways +0.0002, crash byte-identical); finding: the mixed cells carry MARGINAL orthogonal signal (rally alt-long broad-market confirmation), not pure redundancy. results.tsv append-only preserved (path-scoped git checkout -- strategy.py throughout, never git revert); Exp3/Exp4 reverted to dccf0da1. EXIT: 1 keep (branch) + 2 architectural discards (>=2 required, MET) + 1 non-arch discard; branch concluded (keep) then 2 arch discards per user exit rule. NEW BASELINE dccf0da1 0.615508.
1b3f5316	0.626075	0.655942	0.099557	0.715089	0.592725	0.784751	0.531204	keep	Exp1 LEVERAGE_K 2.0->3.0. return_reward ceiling NOT reached -- 3x clears keep. MEASURED vs baseline dccf0da1 0.615508: composite +0.010567, mean +0.012305, std 0.0938->0.0996. PER-REGIME all improved + all stab 1.0 + all raw==score: bull 0.71385->0.71509 (+0.00125, Sh1.858->1.890, AnnRet->14.6pct, DD2.51pct), crash 0.58461->0.59273 (+0.00811, Sh1.265->1.263 flat, AnnRet9.4pct, DD1.86pct), sideways 0.75356->0.78475 (+0.03119, Sh2.016->2.021, AnnRet10.8pct, DD1.64pct), rally 0.52252->0.53120 (+0.00868, Sh1.320->1.330, AnnRet11.9pct, DD4.65pct). DD scales ~linearly (rally 3.14->4.65pct) stays well under 8pct knee + 10pct cutoff. Concavity prediction (rally ~flat) WRONG: return_reward gain dominates dd_gate penalty at 3x. NEW BASELINE.
8f49828e	0.640185	0.671489	0.104348	0.757200	0.602383	0.788276	0.538098	keep	Exp2 LEVERAGE_K 3.0->4.0. return_reward lever still paying. MEASURED vs baseline 1b3f5316 0.626075: composite +0.014110, mean +0.015547, std 0.0996->0.1043. PER-REGIME all improved + all stab 1.0 + raw==score: bull 0.71509->0.75720 (+0.04211, Sh1.890->1.890 flat, AnnRet14.6->19.8pct, DD2.51->3.35pct), crash 0.59273->0.60238 (+0.00966, Sh1.263->1.270, AnnRet9.4->12.6pct, DD1.86->2.44pct), sideways 0.78475->0.78828 (+0.00353, Sh2.021->2.010, AnnRet10.8->14.5pct, DD1.64->2.20pct), rally 0.53120->0.53810 (+0.00689, Sh1.330->1.340, AnnRet11.9->15.7pct, DD4.65->6.12pct). DD scales linearly, rally 6.12pct approaching 8pct knee but no exp penalty yet. AnnRet roughly doubles per 2x as expected. NEW BASELINE.
c2444b1c	0.646582	0.678102	0.105066	0.744679	0.608285	0.811713	0.547730	keep	Exp3 LEVERAGE_K 4.0->5.0. return_reward lever still pays but narrowing + bull now regressing. MEASURED vs baseline 8f49828e 0.640185: composite +0.006397, mean +0.006613, std 0.1043->0.1051. PER-REGIME all stab 1.0 raw==score: bull 0.75720->0.74468 (-0.01252, Sh1.890->1.880, AnnRet19.8->24.8pct, DD3.35->4.18pct -- dd_gate base penalty biting), crash 0.60238->0.60829 (+0.00590, Sh1.270->1.260, AnnRet12.6->15.6pct, DD2.44->3.01pct), sideways 0.78828->0.81171 (+0.02344, Sh2.010->2.020, AnnRet14.5->18.3pct, DD2.20->2.74pct), rally 0.53810->0.54773 (+0.00963, Sh1.340->1.350, AnnRet15.7->19.9pct, DD6.12->7.58pct -- AT 8pct knee edge). Bull regression = dd_gate base penalty (1/(1+DD)) overtaking rr gain as DD rises. Rally DD 7.58pct near knee; 6x would cross 8pct -> steep exp penalty. NEW BASELINE.
-	0.646646	0.678170	0.105080	0.744905	0.608285	0.811700	0.547789	discard	Exp4 portfolio equity-slope entry shrink (architectural). SUB-NOISE +0.000064 vs baseline 0.646582. Mechanism inert: EMA(0.3) equity-slope rarely crosses activation threshold 0.0015*LEVERAGE_K=0.0075 (5x); shrink near-constant 1.0. PER-REGIME all flat (bull +0.00023, sideways -0.00001, rally +0.00006, crash flat), all DDs byte-identical (rally 7.58pct unchanged). Portfolio-aggregate equity slope is too gradual/slow to fire before the DD-LEVEL _port_dd_atten already acts; the rate-of-change signal carries no incremental info at this timescale. Reverted to c2444b1c.
-	0.641905	0.680368	0.128210	0.799989	0.591621	0.811713	0.518150	discard	Exp5 sustained multi-day ct de-leverage on scale-in full_target (architectural). composite -0.004677 vs baseline 0.646582. PER-REGIME: bull 0.74468->0.79999 (+0.05531, Sh1.880->1.980, DD4.18->3.75pct -- bull ct shorts shrunk -> Sharpe up), crash 0.60829->0.59162 (-0.01666, Sh1.263->1.220, DD3.01->2.75pct), sideways flat, rally 0.54773->0.51815 (-0.02958, Sh1.350->1.290, DD7.58->7.54pct). std blew 0.105->0.128 (divergence). HYPOTHESIS DISPROVEN: rally ct shorts are NET WINNERS (WR~66pct) so sustained de-leverage cuts more gain than loss; bull BENEFITS (its ct shorts are losers) but rally CRASHES. The asymmetry proves bull-ct and rally-ct are structurally different (bull ct = dead-cat bounce losers; rally ct = pullback shorts, often winners). Existing first-bar-only ct shrinks are correct: cut initial commitment without crippling winning ct trades through the hold. Reverted to c2444b1c. 2nd architectural discard (exit-rule min MET).
-	0.522214	0.572673	0.168196	0.343059	0.608285	0.811713	0.527635	discard	Exp6 leverage-coupled concentration governor cap (architectural). CATASTROPHIC composite -0.124368 vs baseline 0.646582. PER-REGIME: bull raw 0.745->0.553 (-0.192) AND stability_factor 1.0->0.620 (below 0.80 knee) -> bull final 0.745->0.343 (-0.402); crash flat; sideways flat; rally 0.548->0.528 (-0.020, DD 7.58->7.39 barely moved). min_stability 0.819->0.686. TWO failure modes: (1) the governor reads CONCURRENT portfolio positions which shift under AR(1) noise -> scaling the shrink cap up amplified position-value wobble -> bull stability crashed below knee (the exact failure mode naive 2x leverage hit); (2) concurrent same-direction exposure does NOT isolate rally -- bull_2021 is ALSO a correlated-long regime (BTC/ETH/SOL grind up together in bull too) so the deeper shrink cut bull's trend-aligned longs (raw -0.192). Rally DD barely moved (its DD is not primarily first-bar entry concentration). Reverted to c2444b1c. 3rd architectural discard.
-	-	-	-	-	-	-	-	session-summary	SESSION (baseline dccf0da1 0.615508 -> NEW BASELINE c2444b1c 0.646582, +0.031074 via 3 keeps): 3 keeps (Exp1-3, all the SAME validated mechanism -- behavior-preserving leverage LEVERAGE_K 2.0->3.0->4.0->5.0) + 3 architectural discards (Exp4-6). User 2-arch-discard minimum MET (3). THEME: continued the prior session's return_reward lever discovery -- the factor (log(1+APY/100+1), added 2026-06-20) is concave but the dd_gate penalty (1/(1+DD%) base, exp steep only >8pct) does NOT bite until DD crosses 8pct, so uniform behavior-preserving leverage (circuit-breaker thresholds + $1 emission floor scaled by LEVERAGE_K, the 2x-keep discipline) kept raising composite well past 2x: 2x->3x +0.0106, 3x->4x +0.0141, 4x->5x +0.0064. At 5x rally DD 7.58pct (at the 8pct knee edge) + bull started regressing (dd_gate base penalty overtaking rr gain); 6x would cross 8pct -> exp penalty collapse (not tested, clearly catastrophic). Final baseline c2444b1c [bull 0.744679 Sh1.88 DD4.18pct, crash 0.608285 Sh1.26 DD3.01pct, sideways 0.811713 Sh2.02 DD2.74pct, rally 0.547730 Sh1.35 DD7.58pct; all stab 1.0, all raw==score, min_stability 0.819 just above 0.80 knee]. KEYS: (1) the return_reward lever ceiling is ~5x (DD approaches 8pct knee); the 2x-keep's LEVERAGE_K-coupled circuit-breaker scaling remains correct at 3x/4x/5x (stability held 1.0, scale-invariance preserved). (2) AnnReturn roughly scales linearly with LEVERAGE_K (rally 11.9->19.9pct 2x->5x). ARCHITECTURAL DISCARDS (all targeting the new binding constraint -- rally DD/dd_gate at high leverage): Exp4 portfolio equity-SLOPE entry shrink -- INERT +0.000064 (EMA-slope of portfolio aggregate equity too gradual to cross activation threshold before the DD-LEVEL _port_dd_atten already acts; rate-of-change carries no incremental info at this timescale). Exp5 sustained multi-day ct de-leverage on scale-in full_target -- DISCARD -0.0047, HYPOTHESIS DISPROVEN: bull ct shorts are losers (shrinking helped bull +0.055 Sh1.88->1.98) but rally ct shorts are NET WINNERS (WR~66pct, shrinking hurt rally -0.030 Sh1.35->1.29) -> the documented bull/rally ct coupling wall (cannot separate on ret_vlong); existing first-bar-only ct shrinks are correct (cut initial commitment without crippling winning ct trades through hold). Exp6 leverage-coupled concentration governor cap -- CATASTROPHIC -0.124, bull stability crashed 1.0->0.62 below knee (governor reads concurrent portfolio positions -> noise-sensitive -> scaling shrink cap amplified position-value wobble, the naive-2x failure mode) AND bull_2021 is also a correlated-long regime (concurrent exposure does NOT isolate rally, cut bull trend longs raw -0.192). CONCLUSION: the return_reward/leverage lever is now at its ceiling (5x); DD-reduction via ct manipulation is walled (bull/rally coupling) and via concentration-governor scaling is walled (bull coupling + stability). The strategy sits at a tight local optimum on the dd_gate/return_reward frontier at 5x leverage. results.tsv append-only preserved (path-scoped git checkout -- strategy.py throughout); Exp4/5/6 reverted to c2444b1c. EXIT: 3 keeps + 3 architectural discards (>=2 required, MET); ideas exhausted (leverage ceiling reached, DD-reduction directions saturated/walled).
5a6e0562	0.531103	0.580712	0.165362	0.354948	0.604633	0.818504	0.544763	branch	BRANCH OPEN (profit-velocity de-risk floor gate). Exp1 architectural indep: NEW data dep at de-risk floor = per-bar PnL delta (pos_pnl - _prev_pnl); rising-PnL winners ride (-0.08 floor relax), falling-PnL winners cut (+0.06 tighten). MEASURED vs c2444b1c 0.646582: composite -0.115479 (0.531103), mean -0.09739, std +0.06030. PER-REGIME: bull 0.74468->0.35495 (raw 0.74468->0.66695, stability_factor 1.0->0.532 CRASHED below 0.80 knee -- per-bar PnL delta is noise-sensitive: 1 bar of price noise flips velocity sign -> floor jumps -> position wobbles -> stability penalty; noise-trajectory wall). crash 0.60829->0.60463 (-0.004 flat), sideways 0.81171->0.81850 (+0.0068 REAL -- choppy velocity cuts sideways winners correctly), rally 0.54773->0.54476 (-0.003). FIX HYPOTHESIS: smooth velocity over 3-4 bars (EMA of PnL delta, or pos_pnl vs EMA-smoothed-PnL N bars ago) to dampen single-bar noise -> recover bull stability while keeping sideways gain.
120e1bdb	-999.0	-249.337485	432.817856	0.500904	0.601035	-999.0	0.548120	branch	branch step2: EMA-smooth velocity (alpha0.35 ~3-bar) both sides. MEASURED vs step1 0.531103: CATASTROPHIC composite -999 (raw_composite -379). sideways DD 2.74->12.06pct BREACHED 10pct hard cutoff (EMA lag held relax-side winners through giveback -> DD explosion); bull stability 0.532->0.654 still below 0.80 knee. NO-PROGRESS (catastrophic regression). EMA lag is the DD-blower on the relax side.
5aaaa4a2	0.646538	0.678253	0.105716	0.746528	0.608001	0.811726	0.546757	branch	branch step3: TIGHTEN-ONLY velocity gate (drop relax side; keep only sustained-falling-PnL cut via EMA). MEASURED vs baseline c2444b1c 0.646582: composite -0.000044 (0.646538 SUB-NOISE/INERT), mean -0.00185, std +0.00065. PER-REGIME: bull 0.74468->0.74653 (+0.0019), crash -0.0003, sideways +0.00001, rally -0.0010. All stability 1.0 recovered, no DD blowout (tighten-only cannot blow DD). NO-PROGRESS (inert -- EMA velocity rarely confirms sustained fall strongly enough to fire on bars that matter). Tighten-only EMA gate is dead code-adjacent.
ee6b042f	0.644155	0.675374	0.104063	0.752728	0.601696	0.799824	0.547248	branch	branch step4: raw-velocity both sides, VOL-GATED to fire only in low vol_ratio. MEASURED vs baseline c2444b1c 0.646582: composite -0.002427 (0.644155), mean -0.00273, std -0.00100. PER-REGIME: bull 0.74468->0.75273 (+0.0081, stability 1.0 RECOVERED -- vol-gate protected bull), crash 0.60829->0.60170 (-0.0066), sideways 0.81171->0.79982 (-0.0119 -- step1 +0.0068 did NOT survive vol-gating = was variance not signal), rally -0.0005. NO-PROGRESS (net -0.0024). Vol-gate fixes bull but sideways gain was not robust.
-	-	-	-	-	-	-	-	discard	BRANCH SUMMARY (profit-velocity de-risk floor gate): REVERTED to c2444b1c. Opened after Exp1 (architectural indep, NEW per-bar PnL-delta data dep at de-risk floor) showed sideways +0.0068 but bull stability crashed 1.0->0.532 (raw per-bar velocity flips on price noise -> floor jumps -> wobble). 4 branch steps. step2 EMA-smooth -> CATASTROPHIC -999 (EMA lag held relax-side winners through giveback -> sideways DD 2.74->12.06pct past 10pct cutoff). step3 tighten-only EMA -> inert (composite 0.6465, -0.000044 vs baseline; EMA rarely confirms sustained fall). step4 raw-velocity vol-gated -> bull stability recovered (+0.008) BUT sideways -0.012 (the step1 sideways +0.0068 was variance, not robust signal). CONCLUSION: PnL-velocity de-risk floor modulator is structurally walled -- relax side: raw=stability crash, EMA=DD blowout, vol-gated=sideways gain vanishes; tighten side: inert. Same noise-trajectory + lag-DD wall family as the reverted slope-deceleration branch. No configuration improves on baseline. Per-bar PnL delta is noise/lag trapped at hourly scale.
