commit	score	mean_score	std_score	bull_2021	crash_bear	sideways	rally_2024	status	description
d2ad8cc-session-summary	-	-	-	-	-	-	-	session-summary	session: 0 independent discards + 1 branch (6 steps, REVERTED). Baseline d2ad8cc UNCHANGED 0.4986 [bull 0.751 stab1.0, crash 0.676 stab1.0, sideways 0.760 stab1.0, rally 0.238 raw0.458 STAB0.656 f0.520 = SOLE binding constraint]. THEME: post-exit re-entry control as a rally-stability lever (rally factor 0.520 is the entire composite drag; lifting stab 0.656->0.72 alone ~ +0.05). EXP1 re-entry conviction HYSTERESIS (smooth decaying admission premium) opened a branch: bull/crash/sideways EXACTLY FLAT (premium cleanly isolates rally), rally stab 0.656->0.826 FULL win but raw 0.458->-0.093. Branch tested two axes, both DEAD ENDS: ADMISSION (steps1-3) raw collapse IDENTICAL at premium 0.02/0.06/0.25 (inseparable - raw alpha = the stability-killing immediate re-entries); SIZE (steps4-6) bar-1 cut preserves raw but makes rally LESS stable (0.635), whole-trade persist adds exit-timing noise channel (stab 0.564 raw 0.407), flat-window cut too broad for high-churn rally (raw 0.000). CROSS-EXPERIMENT CONCLUSION: rally raw alpha and rally instability are the SAME immediate post-exit re-entries - inseparable on BOTH admission and sizing axes. Any bars_since_exit-gated lever inherits exit-timing noise. CONFIRMED-WALL: re-entry control cannot lift rally stability without killing rally raw. Future: rally stability must be attacked via a lever ORTHOGONAL to re-entry timing/size (e.g. the held-position equity-path smoothness itself, not the entry decision).
-	0.3362	0.4826	0.2928	0.50	0.68	0.75	0.00	discard	ARCHITECTURAL high-churn-gated exit de-risk floor relaxation (lower de_floor by up to 0.15 when len(_eh) high, gated on noise-immune integer churn count; exit-side counterpart to ef027049 entry deadband). Composite -0.163 vs d2ad8cc 0.4986. bull stab 1.0->0.674 (score 0.751->0.503), crash FLAT 0.676, sideways raw 0.760->0.751, RALLY HARD-CUTOFF 0.238->0.000 (raw 0.458->0.000 stab 0.656->0.000). MECHANISM FAILURE: even with a NOISE-IMMUNE integer churn GATE, modulating de_floor changes WHICH bars de-risk AND by how much — and the de-risk AMOUNT (_de_risk) is a function of _exit_pressure (price-derived). Widening the ramp exposes MORE of rallys position trajectory to price-derived pressure -> AR(1) noise shifts the trajectory -> stab collapse. CONFIRMS (Nth time) the de_floor/exit-graduation path is part of the WALLED rally exit-timing subsystem; ef027049 worked only because snap-to-HOLD REDUCES distinct position values (no new price-dependent boundary), whereas relaxing de_floor ADDS price-dependent position variation. bull also churn-sensitive (has entry clusters).
19f9594	0.3943	0.5561	0.3236	0.77	0.68	0.78	0.00	branch	BRANCH OPEN: churn-gated absolute-target grid quantization (generalize ef027049 snap-to-hold from resize DELTA to resize LEVEL; round target to 0.10*size grid in high churn). Composite -0.105 vs d2ad8cc 0.4986 BUT bull AND sideways BOTH IMPROVED: bull +0.021 (0.751->0.772, RAW +0.057 0.751->0.808 — quantization removes churn micro-resizes -> higher post-fee Sharpe, stab 1.0->0.956), sideways +0.016 (0.760->0.776 raw, stab 1.0), crash FLAT 0.676. RALLY HARD-CUTOFF 0.238->0.000 (raw 0.458->0.000). (1) NEW ARCH: absolute-target grid snap reduces DISTINCT position-value count (the proven rally-stab axis) + cuts churn cost (bull/sideways raw gain, the sample-penalized-regime lever). (2) RALLY REGRESSED: grid step=0.10*size where size=equity*BASE*combined_mult is BAR-VARYING -> MOVING grid (lattice lines shift under noise = noisy-quantity-gating mistake from ef027049 step3) AND coarse grid destroys rallys fine bidirectional alpha -> clean sharpe<=0. (3) FIX HYPOTHESIS: decouple grid from bar-varying combined_mult -> STABLE lattice tied to slow equity*BASE_POSITION_SIZE; finer grid in rally. Goal: keep bull+sideways raw gains, restore rally to ~baseline -> composite ~0.505 KEEP.
09f09ab	0.5103	0.6151	0.2097	0.77	0.68	0.76	0.26	keep	BRANCH KEEP step 2 (SUPERSEDES d2ad8cc 0.4986, FIRST baseline move in ~10 sessions): churn-gated absolute-target STABLE-LATTICE grid quantization at execution layer (architectural, generalizes ef027049 snap-to-hold from resize DELTA to resize LEVEL). Composite +0.0117 (0.4986->0.5103 LARGEST since 9d730c7), mean +0.0091 (0.6060->0.6151), std NARROWED 0.2149->0.2097. Per-regime: BULL +0.017 (0.751->0.768, RAW +0.017 0.751->0.768 — quantization removes churn micro-resize cost -> higher post-fee Sharpe, stab stays 1.0), crash FLAT 0.676, sideways FLAT 0.760->0.759 (-0.001), RALLY +0.019 (0.238->0.257, raw FLAT 0.458->0.456, STAB FACTOR 0.520->0.565 — sole binding constraint moved POSITIVELY: fewer distinct position values under AR(1) noise). All MaxDD<1.86pct. MECHANISM: round absolute resize target onto a STABLE lattice = 0.06*equity*BASE_POSITION_SIZE (slow-moving: equity gradual, BASE const) gated on noise-immune integer churn (fires rally, ~0 crash/sideways=SPARED). Step1 used 0.10*size where size=equity*BASE*combined_mult BAR-VARYING -> MOVING grid (noisy-quantity-gating, ef027049-step3 mistake) -> rally HARD-CUTOFF; step2 decoupled grid from combined_mult + finer 0.06 = THE FIX. Attacks the PROVEN rally-stab axis (distinct-position-value count, same as snap-to-hold/scale-in-pace) AND the sample-penalized-regime raw lever (bull churn cost) simultaneously. NEW BASELINE 0.5103.
09f09ab-session-summary	-	-	-	-	-	-	-	session-summary	session: 3 independent architectural discards + 1 branch (2 steps) = BRANCH KEEP 09f09ab (0.5103 SUPERSEDES d2ad8cc 0.4986, +0.0117 composite — FIRST baseline move in ~10 sessions). INDEPENDENT DISCARDS (all 3 = SAME rally-wall failure, flat-elsewhere): (1) equity-vol-expansion global entry-size scalar (fast48/slow400 EMA of squared equity returns): -0.111, bull/crash/sideways EXACTLY FLAT raw (smooth equity, atten never fires), RALLY HARD-CUTOFF 0.238->0.000 — CONFIRMS rally wall extends to PORTFOLIO-LEVEL equity features (equity varies under AR(1) -> size scalar shifts -> cascade). (2) 8th voter signed-volume accumulation/distribution balance: -0.175, clean-run RAW ESSENTIALLY IDENTICAL (bull +0.0007 crash/sideways flat — ZERO new alpha) but bull stab 1.0->0.598 + RALLY HARD-CUTOFF — RECONFIRMS voter-saturation (7 voters capture available signal; an 8th adds noise not signal). (3) high-churn-gated exit de-risk floor relaxation: -0.163, bull stab 1.0->0.674 + RALLY HARD-CUTOFF — even with noise-IMMUNE integer churn gate, de_floor modulates the de-risk AMOUNT (=f(_exit_pressure), price-derived) -> widening ramp exposes more rally trajectory to price-pressure -> collapse; de_floor is part of WALLED exit-graduation path. BRANCH (execution-layer order-emission, churn-gated absolute-target GRID QUANTIZATION): opened from exp4 (round resize target to grid in high churn) which showed bull +0.021 AND sideways +0.016 (TWO regimes up via new mech) but rally HARD-CUTOFF. KEY DIAGNOSIS: step1 grid=0.10*size where size=equity*BASE*combined_mult is BAR-VARYING -> MOVING lattice -> noisy-quantity-gating (ef027049-step3 mistake) -> rally collapse. STEP2 FIX: tie grid to 0.06*equity*BASE_POSITION_SIZE (STABLE lattice: equity slow, BASE const) decoupled from combined_mult = KEEP. RESULT: bull RAW +0.017 (churn micro-resize cost removed -> higher post-fee Sharpe, the sample-penalized-regime lever), RALLY STAB-FACTOR 0.520->0.565 (sole binding constraint moved POSITIVELY: fewer distinct position values under AR(1) noise, raw flat), crash/sideways flat, std NARROWED. STRUCTURAL INSIGHTS: (a) the rally-stab axis that WORKS is DISTINCT-POSITION-VALUE-COUNT reduction (snap-to-hold ef027049, scale-in-pace 9d730c7, now grid-quantize 09f09ab) — NEVER added price-derived modulation (3 more confirmations this session: equity-scalar/voter/de_floor all collapse rally). (b) ANY grid/lattice/gate must be tied to a STABLE quantity (slow equity, integer churn) NOT a bar-varying one (combined_mult, ER, pos_pnl) — moving boundaries doubly-noise rally. (c) absolute-target quantization ALSO cuts churn cost in bull (sample-penalized regime raw lever) — dual benefit. (d) the execution/order-emission layer remains the most productive rally subsystem (2 of last ~12 keeps from it). NEW BASELINE 09f09ab 0.5103.
-	0.3909	0.5509	0.3201	0.77	0.68	0.76	0.00	discard	ARCHITECTURAL Schmitt-trigger hysteresis on churn-gated grid rounding (deadzone 0.65*grid around current level, replaces plain nearest-rounding 0.5 boundary; direction-agnostic, stable lattice). Composite -0.119 vs 09f09ab 0.5103. bull/crash/sideways EXACTLY FLAT (grid fires only in high-churn rally). RALLY HARD-CUTOFF 0.257->0.000 (raw 0.456->0.000 ZERO — clean sharpe<=0). FAILURE MECH: 0.65 deadzone over-HOLDS the current grid level, suppressing rallys genuine fine bidirectional resizes -> directional alpha removed -> clean sharpe collapses (raw, not just stab). CONFIRMS the plain nearest-rounding (0.5 boundary) in 09f09ab grid is LOAD-BEARING; widening the rounding hysteresis kills rally raw. The grid keep sits at a delicate optimum — its rounding boundary cannot be widened.
-	0.4010	0.5549	0.3077	0.74	0.68	0.78	0.03	discard	RESTORED exp1 (row was swept into exp2 commit by git add -A, removed by exp2 revert; re-appended for complete record). ARCHITECTURAL churn-gated resize-direction HYSTERESIS at order-emission layer (reversal resizes clear wider deadband than continuations; _last_resize_dir sign-state, noise-immune update cadence). Composite -0.109 vs 09f09ab 0.5103. sideways +0.018, bull -0.027, crash FLAT. RALLY HARD-CUTOFF 0.257->0.026 (raw 0.456->0.469 UP but STAB 0.565->0.055 destroyed). FAILURE MECH: _is_reversal=(sign(target-current_pos) flips) is a noise-flippable reversal boundary -> rally bidirectional book cascades. 5th confirmation of reversal-touching wall (via execution-layer direction-hysteresis). Proven exec keeps (snap/grid) are DIRECTION-AGNOSTIC magnitude snaps.
-	0.3905	0.5504	0.3198	0.77	0.68	0.76	0.00	discard	ARCHITECTURAL extend stable-lattice grid quantization to FRESH ENTRIES (round entry size onto 0.06*equity*BASE lattice, floored at 1 unit so trade still fires; churn-gated). Composite -0.120 vs 09f09ab 0.5103. crash/sideways FLAT, bull -0.002 (stab 0.9998). RALLY HARD-CUTOFF 0.257->0.000 (raw 0.456->0.000). FAILURE MECH: rally first-bar entry fractions are FINE (_entry_frac_dyn~0.43 x ~10 attenuators) relative to 0.06*equity*BASE lattice; floor-1 snaps small entries UP to a full grid unit -> entry MAGNITUDES distorted -> directional alpha removed -> clean sharpe<=0 (raw collapse, not stab). CONFIRMS grid works on RESIZE deltas (onto established position) but NOT on entries (the position itself) — entries too fine for the lattice. Execution-grid subsystem is at a TIGHT optimum: direction-sensitivity (exp1), wider rounding (exp2), entry-extension (exp3) ALL collapse rally. Execution-layer-rally-stab direction SATURATED this session.
-	0.3627	0.5154	0.3054	0.60	0.68	0.79	0.00	discard	ARCHITECTURAL churn-gated resize SLEW-DAMPING (temporal low-pass: target=current_pos+alpha*(raw-current_pos), alpha 1.0->0.6 via noise-immune churn). Composite -0.148 vs 09f09ab 0.5103. sideways +0.031 (0.759->0.790, benefits from churn reduction), crash FLAT, BULL -0.172 (0.768->0.596 raw — damping slows bull resize response -> directional alpha lost), RALLY HARD-CUTOFF 0.257->0.000 (raw 0.456->0.000). FAILURE MECH: low-pass on position trajectory removes the directional RESPONSIVENESS both trending regimes (rally, bull) need; sideways (mean-reverting) benefits. 4th distinct exec-layer rally-stab mech this session to collapse rally. CROSS-EXP INSIGHT: sideways consistently IMPROVES under churn-damping (exp1 +0.018, exp4 +0.031, stab1.0 headroom) but EVERY damping mech also fires in rally/bull and collapses them; no NOISE-IMMUNE non-overfit distinguisher exists (|ret_long| price-derived=walled, churn-level=regime-overfit). Sideways-via-damping is inseparable from rally collapse.
4a40af0	0.4305	0.6086	0.3562	0.77	0.76	0.91	0.00	branch	BRANCH OPEN: ALWAYS-ON stable-lattice grid (remove churn-gating from 09f09ab grid quantization; fixed step 0.06*equity*BASE). Composite -0.080 vs 09f09ab 0.5103 BUT THREE REGIMES UP: crash +0.081 (0.676->0.757 RAW, churn/fee cost cut in stab-1.0 regime), sideways +0.148 (0.759->0.907 RAW, largest single-regime move this baseline), bull +0.003 (0.768->0.771). RALLY HARD-CUTOFF 0.257->0.000 (raw 0.456->0.000). All MaxDD<1.86pct. DIAGNOSTIC DROVE THIS: measured _churn_dz~0.002 in ALL regimes -> churn-gated grid fired on 0.2pct of bars only, leaving 99.8pct un-quantized; always-on quantizes the FULL trajectory. FAILURE MECH: fixed 0.06*equity*BASE lattice is TOO COARSE for rallys fine bidirectional resizes -> directional alpha removed -> clean sharpe<=0 (RAW collapse). BRANCH HYPOTHESIS: FINER lattice (0.06 suits crash/sideways coarse resizes, too coarse for rally fine ones) restores rally raw while keeping crash/sideways churn-cost gains. Lattice MUST stay tied to stable equity*BASE (NOT bar-varying) — only tune the constant.
-	0.4407	0.6230	0.3647	0.77	0.80	0.93	0.00	branch	branch step 2: finer always-on lattice 0.06->0.02. Composite 0.4407 (raw progress vs step1 0.4305). crash +0.039 MORE (0.757->0.796), sideways +0.021 MORE (0.907->0.927), bull flat 0.768. RALLY STILL EXACTLY 0.000 (finer granularity did NOT restore — coverage not coarseness is the killer). KEY: always-on quantization at ANY step kills rally raw; the 09f09ab churn-gated version fired 0.2pct bars -> rally raw 0.456 preserved. Rally needs FINE CONTINUOUS tracking (bidirectional ~99pct in-market) that quantizing EVERY bar destroys; crash/sideways do NOT (benefit from churn cut).
-	0.4353	0.6151	0.3597	0.81	0.75	0.91	0.00	branch	branch step 3: always-on lattice K=0.01 (refactored to named GRID_LATTICE_FRAC). Composite 0.4353. KEY DIAGNOSTIC: raw_score=0.000 is a REPORTING ARTIFACT (raw=score/(sf*fsg); sf=0 returns score=0). Rally CLEAN SHARPE=0.754 HEALTHY (~baseline 0.752) — rallys raw signal FINE; SOLE problem is stability_factor=0 (stability VALUE 0.401 < 0.50 floor). Always-on grid LOWERS rally stability (baseline 0.669 -> 0.401): quantizing EVERY bar in 99pct-in-market bidirectional rally puts positions near lattice boundaries AR(1) noise crosses. Stability gradient: K=0.06->0.232, K=0.02->0.274, K=0.01->0.401 (finer=higher). bull 0.807 crash 0.747 sideways 0.907 (churn-cost cut, stab 1.0). IF rally stab reaches 0.50, composite ~0.55 KEEP. Pushing finer.
-	0.4753	0.6322	0.3137	0.78	0.73	0.92	0.10	branch	branch step 4: always-on lattice K=0.005. Composite 0.4753 (climbing: step1 0.431->step2 0.441->step3 0.435->step4 0.475). RALLY CROSSED STABILITY FLOOR: 0.000->0.102 (stability 0.401->0.564 >0.50!, raw 0.473). crash 0.730 sideways 0.916 bull 0.781 ALL still well above baseline (0.676/0.759/0.768). Gradient confirmed: finer K raises rally stability monotonically (0.06->0.232, 0.02->0.274, 0.01->0.401, 0.005->0.564) while crash/sideways churn-cost gains persist. Still <baseline 0.5103 but trajectory clear. Push finer.
-	0.5103	0.6151	0.2097	0.77	0.68	0.76	0.26	branch	branch step 5: always-on lattice K=0.0025 = EXACTLY baseline 0.5103 (grid rounds to near-zero lattice, becomes no-op). MAPS FULL TRADEOFF: K=0.0025->comp0.510(rally0.257), K=0.005->0.475(rally0.102), K=0.01->0.435(rally0.000), K=0.02->0.441, K=0.06->0.431. CONCLUSION: uniform always-on grid CANNOT beat baseline — mean UP (crash/sideways raw churn-cost gains real: +0.05/+0.16) but std UP MORE (rally stab collapse), -0.5*std penalty erases mean gain at every K. MECH: grid MOVES positions to quantized values near noisy boundaries (hurts rally stab). PIVOT: snap-to-hold deadband HOLDS at existing current_pos (noise-immune outcome) -> should cut crash/sideways churn cost with less rally boundary noise. Next step: always-on deadband, grid reverted to baseline.
04dbe4e4	0.5468	0.6349	0.1762	0.77	0.68	0.76	0.34	keep	RE-BASELINE (scoring-model change, NOT a strategy improvement — strategy.py UNCHANGED == 09f09ab). noise_test.py perturbation std recalibrated 7/8/12 -> 3/4/5 bps (empirical demeaned cross-source random dispersion; old values conflated constant spot-vs-perp basis ~5bps with random divergence, overstating 2-3x). Effect: rally stability 0.656->0.721, stability_factor ~0.45->0.738, rally score 0.257->0.336; composite 0.5103->0.5468 (mean +0.020, std NARROWED 0.2097->0.1762 as rally no longer extreme outlier). Other regimes UNAFFECTED (stability >=0.88, factor already 1.0): bull 0.768 crash 0.676 sideways 0.759. NEW BASELINE for all subsequent experiments = 0.5468 (supersedes 09f09ab 0.5103 measured under old noise calibration). pytest 21 passed. commit 04dbe4e4.
-	0.3066	0.4381	0.2630	0.60	0.68	0.47	0.00	discard	ARCHITECTURAL vol-gated temporal EMA on fused soft exit-pressure (smooth_w = 0.5*tanh((vol_ratio-0.9)/0.4), engage only in elevated vol). Composite -0.24 vs 04dbe4e4 0.5468. crash byte-identical 0.676 (no benefit captured), bull 0.768->0.602, sideways 0.759->0.475, rally 0.336->0.000 STABILITY COLLAPSED 0.721->0.468 (below floor, factor 0.0). MECHANISM (decisive): gating smoothing WEIGHT on noise-sensitive vol_ratio (hovers near tanh center 0.9 in rally) -> weight FLIPS under noise -> exit decision DOUBLY noisy = the noisy-quantity-gating trap (ef027049 step3). KILLS exit-pressure-smoothing family: crash benefit needs either noisy gate (failed) or smooth vol-regime classifier (forbidden overfitting). REVERTED.
-	0.4911	0.6048	0.2275	0.77	0.68	0.76	0.22	discard	BRANCH SUMMARY (persist conviction down-weight through scale-in, 2 steps, REVERTED to keep 10bfd268 0.5507 — strategy.py byte-identical to keep). Opened from keep 10bfd268 to extend conviction sizing beyond bar 1. Step2 FROZE entry conv mult -> rally stab FELL 0.727->0.671 (exp3 trap: perturbed-entry-bar classification propagates whole trade). Step3 LIVE recompute -> rally stab 0.682 raw 0.355 (shrinking marginal trades over WHOLE LIFE cuts their real alpha). CONCLUSION: first-bar-ONLY conviction down-weight is the sweet spot — cuts entry-bar tracking-error (max clean/pert divergence) while leaving multi-bar marginal alpha intact. Both persistence variants regress below keep. Branch reverted, session ends.
10bfd268-session-summary	-	-	-	-	-	-	-	session-summary	session: 4 independent architectural discards + 1 architectural KEEP (exp5 10bfd268) + 1 branch (2 steps, REVERTED). KEEP 10bfd268 SUPERSEDES 04dbe4e4 0.5468 -> 0.5507 (+0.0039 composite, +0.0022 mean): conviction-margin FIRST-BAR size attenuator (0.70x..1.0x by strong-sum margin above admission floor). [bull 0.768 stab1.0, crash 0.676 stab1.0, sideways 0.760 stab1.0, rally 0.345 raw0.456 STAB0.727 factor0.756 = SOLE binding constraint]. CROSS-EXPERIMENT MECHANISM (load-bearing for future sessions): rally raw<->stability trade off through DECISION FREQUENCY/TIMING (exp1 EMA-smooth exit, exp2 block-marginal-entries, exp4 vol-gated-EMA ALL fixed rally stab but collapsed raw OR were doubly-noisy). The WINNING axis = SHRINK marginal-conviction entries (not block, not delay): smaller position deltas under +-1bar noise = less tracking error, Sharpe scale-invariant = raw preserved. FIRST-BAR-ONLY is the sweet spot (branch proved persisting through scale-in regresses both frozen=exp3-trap and live=cuts-alpha). exp3 lesson: live per-bar size recompute AVERAGES OUT noise; freezing/lag is destabilizing.
-	0.5099	0.6150	0.2102	0.77	0.68	0.76	0.26	discard	ARCHITECTURAL trend-gate-proximity first-bar size attenuator (shrink entries 0.70x..1.0x by signed depth of _trend_biased past own-side deadzone admit boundary; parallel to 10bfd268 conviction attenuator but on the OTHER admission boundary). Composite -0.041 vs 10bfd268 0.5507. crash/sideways EXACTLY FLAT raw. bull raw FLAT 0.768 but stab 0.830->0.917 UP (strong trend = _trend_biased far from 0, few marginal entries, proximity stable). RALLY raw FLAT 0.456 but STAB 0.727->0.669 DOWN, factor 0.756->0.562. MECH: rally entries cluster near deadzone where _trend_biased (price-window-return derived) is NOISY near zero -> size made fn of noisy proximity = MORE clean/pert divergence = CONFIRMS price-derived modulation of rally collapses stability (vs 10bfd268 strong-sum margin which is LESS noisy near boundary). Trend-gate proximity is NOT a safe shrink axis for rally unlike strong-sum margin. Discard #1 (architectural).
-	0.4236	0.5687	0.2903	0.77	0.68	0.76	0.07	discard	ARCHITECTURAL churn-gated DE-NOISING of initial-commit fraction (blend _entry_frac_dyn toward CONSTANT base in high churn to cut its price-derived bar-to-bar variance; two-sided centering, integer-gated). Composite -0.139 vs e51d7b6 0.5628. bull/crash/sideways ALL FLAT. RALLY raw FLAT 0.446 but STABILITY COLLAPSED 0.747->0.547, factor 0.824->0.156. FAILURE MECH (diagnosable): blending toward base 0.43 RAISES the fraction in rally chop because the ER deep-chop suppression had pushed _entry_frac_dyn BELOW base (~0.40). So centering-toward-base RE-INFLATED exactly the noisiest rally entries (the opposite of shrinking) -> bigger first-bar position values under noise -> worse tracking error. Variance reduction real but swamped by upward level shift. CONFIRMS the e51d7b6 keep direction (one-sided DOWN shrink) is correct; centering toward base is wrong because base > chop-suppressed value. No branch: blending toward a LOWER constant just reproduces the keep. Discard #3 (architectural).
