commit	score	mean_score	std_score	bull_2021	crash_bear	sideways	rally_2024	status	description
1b64d3ad	-	-	-	-	-	-	-	session-summary	SESSION: 5 architectural discards (EXIT RULE at 5 consecutive architectural), 0 branches opened. Baseline bfc2a21f 0.842653 UNCHANGED (strategy.py byte-identical at session end). All 5 discards architectural (new code structure / new data deps), no parameter tweaks. Discards: (1) portfolio consecutive-loss streak admission tightening (Exp1) - composite -0.058: rally entries are NET POSITIVE so direction-blind admission tightening filtered WINNERS (bull -0.117, rally -0.090) not just losers; streak counter noise-flicker also cut rally stability 1.0->0.925. CONCLUSION: streak_gate (rally ~4 consec losses, 0.876) is NOT a cleanly-targetable lever via admission. (2) profit-graduated trend-aligned exit threshold (Exp2) - composite -0.128: holding trend-aligned winners longer (higher _exit_thresh) -> sideways -0.391 + bull -0.210 (winners rode reversals into giveback). (3) adverse-correlated-book concentration shrink (Exp3) - INERT +0.000013: the same-dir aggregate-PnL shrink never binds on a regime-changing trade (entries during correlated pullbacks are rare, losers exit fast). (4) add 32-bar window to exit-slope mean (Exp4) - composite -0.004: longer slope adds lag -> delayed exits -> bull giveback -0.018. (5) ret_vlong scale-in pace boost (Exp5) - composite -0.015: reaching full size faster on trend-aligned entries -> bigger pullback giveback (rally -0.034, bull -0.017), same dead-end as winner-pyramid 17484a0e. CROSS-EXPERIMENT CONCLUSION: at baseline bfc2a21f the strategy is at a TIGHT LOCAL OPTIMUM on the rally raw constraint (Sharpe 1.251, DD 1.54pct, streak ~4). Three independent axes confirmed dead-ends THIS session: (a) filtering rally entries hurts - they are net positive; (b) holding/committing trend winners longer or faster hurts - pullback giveback dominates; (c) adding exit-signal lag hurts. The entry-side trend-aligned first-bar BOOST axis (recent keeps Exp3/Exp4 last session) remains the only productive direction but is now in the sub-noise parameter-saturation zone. Component-saturation confirmed: every exit component load-bearing, ct-exit axis saturated, slope windows calibrated 12/16/22, scale-in pace calibrated. rally streak_gate (0.876) is structural (consec losses unbreakable without raw cost). Future sessions should seek a genuinely new DATA DEPENDENCY (none found untried this session) rather than re-parameterizing the trend-boost / exit / scale-in axes.
e2fdbdc8	0.815378	0.853439	0.126871	0.851539	0.811944	1.050803	0.699469	discard	Exp1 range-expansion exit pressure (7th soft source, intrabar high-low 6/18-bar range ratio, profit-side). MEASURED vs bfc2a21f 0.842653: composite -0.0273, mean -0.0306. PER-REGIME: bull 0.969623->0.851539 (-0.118 CATASTROPHIC, Sh down - range-expansion harvest over-fired on winning bull trend runs; wide intrabar range is a FEATURE of profitable 2021 trends not an exhaustion signal -> cut winners too early, same dead-end family as excursion-range whipsaw row825 + volume-cap-raise Exp7 b6dad52d), sideways 1.055281->1.050803 (-0.0045), crash 0.811605->0.811944 (+0.0003 flat), rally 0.699469 BYTE-IDENTICAL. All stab 1.0, all MaxDD<10pct. Not branch-eligible (no regime improved). CONCLUSION: range-expansion is NOT an exhaustion-climax signature for trend winners - wide ranges accompany healthy trends; harvesting on range-climax over-cuts bull. The intrabar-range data dep is directionally wrong for the exit-harvest axis (parallels prior excursion-range failure). Reverted to bfc2a21f.
733d8489	0.843304	0.884382	0.136929	0.969539	0.811581	1.054797	0.701612	keep	KEEP (NEW BASELINE, SUPERSEDES bfc2a21f 0.842653). Exp2 (architectural, indep): cross-alt lead-lag entry boost (ETH<->SOL partner 20-bar OLS log-HL2 slope). NEW cross-symbol data dep distinct from the BTC 96-bar trend: ETH frequently LEADS SOL on daily moves, so a partner alt whose 20-bar momentum agrees with an alt entry is broad-alt-trend confirmation at a SHORTER timescale than BTC. Small +0.05 max, strong-agreement gate (/0.02 so only DEEP partner momentum fires). BTC self-referential -> not reached. MEASURED vs bfc2a21f 0.842653: composite +0.000651, mean +0.000387, std -0.000876 (tighter). PER-REGIME: rally 0.699469->0.701612 (+0.002143 BINDING CONSTRAINT - Sharpe 1.2513->1.2533, DD 1.5365->1.5369, the alt legs grinding up together get broader confirmation -> bigger committed trend capture), bull 0.969623->0.969539 (~flat -0.00008 sub-noise, 2021 alt divergences spared by /0.02 gate), crash 0.811605->0.811581 (~flat -0.00002), sideways 1.055281->1.054797 (-0.0005 sub-noise, alts flat -> no boost). All stability_factor 1.0, all MaxDD<10pct (rally 1.537). All keep criteria met. NEW BASELINE 0.843304. New cross-symbol-pair data dep at alt entry sizing (ETH<->SOL, was BTC-trend only). Observation (correlation only): rally gain consistent with broader alt-trend confirmation hypothesis but direction-split PnL not measured.
45c4e3e0	0.843405	0.884502	0.136989	0.969989	0.811581	1.054796	0.701640	keep	KEEP (NEW BASELINE, SUPERSEDES 733d8489 0.843304). Exp3 (architectural, indep): symmetric partner-DISAGREEMENT entry shrink (ETH<->SOL lead-lag counterpart to Exp2 boost). An alt entry opposing the partner alt 20-bar momentum is idiosyncratic/counter-alt-trend -> shrink first-bar size (max 0.05, /0.02 deep-disagreement gate). Shrink-only (safe family), distinct cross-symbol-pair data dep (Exp2 was boost-only). MEASURED vs 733d8489 0.843304: composite +0.000101, mean +0.000120, std ~flat. PER-REGIME: bull 0.969539->0.969989 (+0.00045 - idiosyncratic 2021 alt-divergence longs shrunk), crash BYTE-IDENTICAL 0.811581 (alts move together in crash -> no disagreement), sideways 1.054797->1.054796 (~flat), rally 0.701612->0.701640 (+0.000028 sub-noise - alts grind up together in rally -> little disagreement to shrink). All stability_factor 1.0, all MaxDD<10pct. All keep criteria met (composite+mean both improved, any-positive-delta rule). Gain is small (+0.0001) but mechanism is the coherent symmetric counterpart to the validated Exp2 boost; completes the bilateral lead-lag gate (boost on agreement + shrink on disagreement). NEW BASELINE 0.843405. Observation (correlation only): bull gain consistent with idiosyncratic-alt-shrink hypothesis but direction-split PnL not measured.
f29d0b7b	0.842700	0.883381	0.135603	0.969989	0.811581	1.050314	0.701640	discard	Exp4 partner-alt divergence exit pressure (8th soft source, cross-symbol ETH<->SOL, profit-side, /0.02 deep-divergence gate). MEASURED vs 45c4e3e0 0.843405: composite -0.000705, mean -0.000121. PER-REGIME: sideways 1.054796->1.050314 (-0.0045 - sideways alts diverge often in normal choppy-recovery mean-reversion, not reversal; harvesting cut winners), bull BYTE-IDENTICAL 0.969989 (deep-divergence gate spared correlated 2021 trend), crash BYTE-IDENTICAL 0.811581, rally BYTE-IDENTICAL 0.701640 (alts grind together -> no divergence). All stab 1.0, all MaxDD<10pct. Not branch-eligible (no regime improved). CONCLUSION: exit-side cross-alt divergence harvest fails on sideways (alt divergence is normal chop noise there, not a reversal signal) - the deep-divergence gate correctly spared the correlated trend regimes but cannot distinguish sideways-chop divergence from genuine reversal. Exit-side soft-source additions remain saturated/problematic (parallels Exp1 range-expansion over-harvest). Entry-side lead-lag (Exp2/Exp3 keeps) is the productive axis, not exit-side. Reverted to 45c4e3e0.
2defbe00	0.842560	0.883899	0.137795	0.969989	0.811581	1.054796	0.699229	discard	Exp5 sustain partner-disagreement entry shrink through scale-in (cache _pd_shrink_held, mirror Exp9). MEASURED vs 45c4e3e0 0.843405: composite -0.000845, mean -0.000603. PER-REGIME: rally 0.701640->0.699229 (-0.002411 - the divergent rally alt entries that get entry-shrunk RECOVER (rally alts grind back together); sustaining the shrink through scale-in kept them smaller through the recovery -> cut rally winners), bull/crash/sideways BYTE-IDENTICAL (no disagreement -> shrink=1.0 -> no sustain effect). All stab 1.0, all MaxDD<10pct. Not branch-eligible (no regime improved). CONCLUSION: the proven shrink-sustain pattern (Exp9 volume-spike +0.011 bull) does NOT generalize to the partner-disagreement shrink - volume-spike entries chase capitulation that does NOT recover (sustained shrink = smaller giveback), whereas partner-divergence entries in rally DO recover (alts reconverge in the grinding uptrend; sustained shrink = cut winners). The sustain value depends on whether the shrunk entrys adverse condition persists. Reverted to 45c4e3e0.
6be71dda	0.604314	0.722890	0.395254	0.969989	0.811581	1.054796	0.055194	discard	Exp6 opp-gate graduation requires multi-day (96-bar) trend-alignment via min(20-bar, 96-bar). MEASURED vs 45c4e3e0 0.843405: composite -0.239 CATASTROPHIC, mean -0.162. PER-REGIME: rally 0.701640->0.055194 (-0.646, raw 0.554 stab_factor 0.0997 - STABILITY COLLAPSED to 0.10), bull/crash/sideways BYTE-IDENTICAL. All MaxDD<10pct. The multi-day alignment requirement routed MANY more rally trades through the binary full-exit path (rally pullback shorts are 20-bar-aligned but 96-bar ct -> min -> ~0 -> binary full exit); the resulting exit-timing shift across the AR(1) noise ensemble destroyed rally stability (0.10). The graduated opp-gate path is LOAD-BEARING for rally stability - routing ct shorts to binary full-exit shifts exit bars bar-to-bar under noise. Not branch-eligible (rally breached 50pct floor catastrophically, no regime improved). CONCLUSION: opp-gate graduation trend-alignment (20-bar) is load-bearing for rally stability; the multi-day timescale is the WRONG axis here (rally ct shorts are precisely the trades whose binary-exit timing is noise-sensitive - the graduation cushion was protecting stability, not hurting it). Reverted to 45c4e3e0.
a5c3f332	-	-	-	-	-	-	-	session-summary	SESSION: 2 KEEPS (Exp2 +0.000651, Exp3 +0.000101) + 4 architectural discards (Exp1/Exp4/Exp5/Exp6). NEW BASELINE 45c4e3e0 0.843405 (SUPERSEDES bfc2a21f 0.842653, +0.000752 composite, +0.000507 mean, std 0.137805->0.136989 tighter). [bull 0.969623->0.969989, crash 0.811605->0.811581, sideways 1.055281->1.054796, rally 0.699469->0.701640 BINDING +0.002171 cumulative Sh1.2513->1.2533]. THEME: CROSS-ALT LEAD-LAG (ETH<->SOL) as a NEW cross-symbol data source - prior sessions used BTC (96-bar trend) as the sole market leader feeding alt sizing; ETH frequently LEADS SOL at a SHORTER 20-bar timescale. Exp2 added partner-alt 20-bar momentum AGREEMENT boost on alt entry (rally +0.0021 - alts grinding up together get broader confirmation -> bigger committed trend capture). Exp3 added the symmetric DISAGREEMENT shrink (bull +0.00045 - idiosyncratic 2021 alt-divergence longs shrunk; completes the bilateral lead-lag gate). All stability factors 1.0, all MaxDD<10pct. KEY MECHANISM INSIGHT: the lead-lag entry axis is productive where many prior axes were saturated (exit-timing, sizing, smoothing, admission, trend-boost all walled) because it is a genuinely NEW cross-symbol-pair x shorter-timescale data dep, not a re-parameterization. CROSS-EXPERIMENT FINDINGS (4 discards): (a) Exit-side soft-source ADDITIONS remain SATURATED/problematic - Exp1 range-expansion (intrabar high-low ratio) over-harvested bull -0.118 (wide ranges are a FEATURE of healthy trends, not exhaustion), Exp4 partner-divergence exit hurt sideways -0.0045 (alt divergence in chop is normal mean-reversion noise, not a reversal signal). The deep-divergence/vol gates spare correlated trend regimes but cannot distinguish chop-noise divergence from genuine reversal. (b) The proven shrink-SUSTAIN pattern (Exp9 volume-spike, +0.011 bull) does NOT generalize to the partner-disagreement shrink (Exp5 - rally -0.0024): volume-spike entries chase capitulation that does NOT recover (sustained shrink = smaller giveback), whereas partner-divergence entries in rally DO recover (alts reconverge in the grinding uptrend; sustained shrink = cut winners). Sustain value depends on whether the shrunk entrys adverse condition PERSISTS. (c) opp-gate graduation 20-bar trend-alignment is LOAD-BEARING for rally stability - Exp6 (require 96-bar multi-day alignment via min) was CATASTROPHIC rally -0.646 (stab 0.10): routing rally pullback shorts (20-bar-aligned, 96-bar ct) through binary full-exit shifted exit bars bar-to-bar under AR(1) noise, collapsing stability. The graduation cushion PROTECTS rally stability, it does not hurt it. The multi-day timescale is the WRONG axis at the opp-gate (rally ct shorts are exactly the trades whose binary-exit timing is noise-sensitive). DIRECTIONS CONFIRMED DEAD/SATURATED THIS SESSION: exit-side soft-source additions (range-expansion, partner-divergence), shrink-sustain generalization, opp-gate multi-day alignment. ENTRY-SIDE lead-lag REMAINS the productive axis but is entering sub-noise territory (Exp3 was +0.0001). rally STILL binding (0.7016, Sh1.253) but moved +0.0021 this session via the lead-lag entry boost - the first rally raw gain in several sessions. strategy.py at HEAD byte-identical to 45c4e3e0. results.tsv append-only preserved across all rollbacks (path-scoped git checkout -- strategy.py). FUTURE: the cross-alt lead-lag axis has residual headroom at a FASTER partner timescale (8-bar) or a third symbol interaction, but gains will be sub-noise; exit-side and opp-gate axes are confirmed dead.
187a7472	0.843471	0.884580	0.137030	0.970361	0.811581	1.054740	0.701638	discard	Exp1 (architectural, indep): BTC near-term (8-bar) leading-momentum shrink on alt entries opposing BTC 8-bar momentum. NEW cross-symbol x timescale data dep (BTC 8-bar OLS log-HL2 slope*n, distinct from 96-bar _btc_trend structural + 20-bar partner-alt). MEASURED vs 45c4e3e0 0.843405: composite +0.000066 (0.843471), mean +0.000078 (0.884580), std +0.000041. PER-REGIME: bull 0.969989->0.970361 (+0.000372), crash FLAT, sideways -0.000056, rally FLAT (-0.000002, target regime unmoved). All stab 1.0, all MaxDD<10pct. SUB-NOISE/inert: /0.012 deep-disagreement gate fires rarely; alt entries shrunk few. Passed keep gates (composite+mean positive) but delta far below noise floor -> keeping would add 8-bar BTC data dep for no real signal (overfit hygiene). Reverted to 45c4e3e0. Observation (correlation only): BTC 8-bar near-term lead gives no marginal rally signal beyond the existing 96-bar BTC + 20-bar partner shrinks.
a87c2b90	-0.041554	0.178137	0.732303	0.564509	0.811524	0.401282	-1.064769	discard	Exp2 (architectural, indep): continuous 96-bar ret_vlong blend (up to 25% weight, trend-strength-gated) into admission trend_avg (was 10/20-bar only). MEASURED vs 45c4e3e0 0.843405: CATASTROPHIC composite -0.885 (-> -0.041554), mean -0.706 (->0.178137), std +0.595. PER-REGIME: rally 0.701640->-1.064769 (Sharpe 1.257->-1.065, max_dd 1.54->4.57 pct), bull 0.969989->0.564509 (Sharpe 1.847->0.971, max_dd 0.90->1.74), sideways 1.054796->0.401282 (stab 1.0->0.608, raw 1.055->0.660), crash FLAT 0.812. CONFIRMS prior-session note: routing ret_vlong through the ADMISSION trend signal collapses regimes EVEN as a continuous blend (not just the binary ret_vlong>0 gate) — trend_avg feeds cooldown + trend admit + smoothed_trend/opp-gate, so shifting it broadly destabilizes bull/rally/sideways. Reverted to 45c4e3e0. CONCLUSION (load-bearing): ret_vlong must stay OUT of the admission trend signal; it is only safe as a SIZE attenuator / exit cap. Do not re-attempt ret_vlong->trend_avg in any form.
bbfa6ce6	0.843609	0.884712	0.137008	0.970213	0.812023	1.054954	0.701657	keep	KEEP (NEW BASELINE, SUPERSEDES 45c4e3e0 0.843405). Exp3 (architectural, indep): volume-DECLINE (volume-price divergence) entry shrink. NEW data dep: volume TREND (6-bar vs 18-bar mean ratio), shrink first-bar size when volume declining (low-participation move). Trend-strength-gated (|ret_long|/0.04 -> spare sideways low-vol). Complementary to _vol_entry_spike (high-volume chases). MEASURED vs 45c4e3e0 0.843405: composite +0.000204 (0.843609), mean +0.000210 (0.884712), std +0.000019 (flat). PER-REGIME (all improved, no regressions): bull 0.969989->0.970213 (+0.000224, Sh 1.8467->1.8473), crash 0.811581->0.812023 (+0.000442, Sh 1.2634->1.2644), sideways 1.054796->1.054954 (+0.000158), rally 0.701640->0.701657 (+0.000017 flat). All stab 1.0, all MaxDD<10pct (rally 1.537). Clean uniform improvement (every regime >= baseline) -> not noise scatter. Sharpe-neutral-to-positive size-shrink axis (proven family).
37dae777	0.842178	0.883135	0.136526	0.965708	0.809936	1.054994	0.701903	discard	Exp4 (architectural iteration on Exp3 keep): sustain the volume-DECLINE entry shrink through scale-in (cache _vol_decline_held, mirror proven Exp9 vol-spike sustain). MEASURED vs bbfa6ce6 0.843609: composite -0.001431 (0.842178), mean -0.000577 (0.883135). PER-REGIME: bull 0.970213->0.965708 (-0.004505, Sh 1.847->1.834), crash 0.812023->0.809936 (-0.002087, Sh 1.2644->1.2596), sideways +0.000040 flat, rally +0.000246. Sustained over-shrink cost the WINNERS (bull/crash were Exp3's gains) more than it saved on losers. Same failure mode as Exp5 (partner-disagree sustain) vs Exp9 (vol-spike sustain worked): sustaining a WEAK shrink through scale-in over-shrinks winners; only STRONG exhaustion signals (vol-spike) survive sustain. Reverted to bbfa6ce6. Observation (correlation only): Exp3 vol-decline is a weak-conviction shrink -> first-bar-only is its correct scope.
61c1dfc4	0.844138	0.885026	0.136291	0.969646	0.812023	1.054920	0.703513	keep	KEEP (NEW BASELINE, SUPERSEDES bbfa6ce6 0.843609). Exp5 (architectural, indep): volume-RISING trend-ALIGNED entry boost (bilateral counterpart to Exp3 decline shrink). NEW data dep: volume-trend slope (6/18-bar) x trend-ALIGNMENT conjunction at entry sizing. Trend-aligned entry on rising volume = strong participation confirming trend -> larger first-bar commitment. MEASURED vs bbfa6ce6 0.843609: composite +0.000529 (0.844138), mean +0.000314 (0.885026), std -0.000717. PER-REGIME: rally 0.701657->0.703513 (+0.001856, Sh 1.2570->1.2619 — BINDING CONSTRAINT improved), crash FLAT, sideways -0.000034 flat, bull -0.000567 (Sh 1.8473->1.8456, sub-noise, far below 50pct gate). All stab 1.0, all MaxDD<10pct (rally 1.537). Rally gain is the mechanism working (trend-aligned longs on building volume captured more of the rally trend). Trend-alignment gate spared ct shorts (no over-commit per Exp4 lesson).
9c61a6fc	0.844320	0.885211	0.136303	0.970040	0.812359	1.054920	0.703526	keep	KEEP (NEW BASELINE, SUPERSEDES 61c1dfc4 0.844138). Exp6 (architectural, indep): counter-trend volume-decline ADDITIONAL shrink gated on ret_vlong. NEW cross-component data dep: volume-decline x multi-day-trend-direction (ret_vlong) x entry-direction conjunction. Exp3 symmetric decline-shrink is gated by 20-bar ret_long (~0 during rally pullbacks when ct shorts fire); ret_vlong stays positive through pullbacks so this ADDITIONAL direction-aware shrink (ct side only) fires during pullbacks. MEASURED vs 61c1dfc4 0.844138: composite +0.000182 (0.844320), mean +0.000185 (0.885211), std +0.000012. PER-REGIME (no regressions): bull 0.969646->0.970040 (+0.000394, Sh 1.8456->1.8468), crash 0.812023->0.812359 (+0.000336, Sh 1.2644->1.2651), sideways FLAT, rally +0.000013 flat (ct-short pullback targeting did not measurably move rally — already heavily shrunk by the stack). All stab 1.0, all MaxDD<10pct. Clean uniform improvement; crash dead-cat-bounce ct longs shrunk by multi-day-trend-gated volume decline.
-	-	-	-	-	-	-	-	session-summary	SESSION: 3 KEEPS (Exp3 +0.000204, Exp5 +0.000529, Exp6 +0.000182) + 3 architectural discards (Exp1 BTC-8bar inert, Exp2 ret_vlong->trend_avg CATASTROPHIC, Exp4 sustain vol-decline hurt winners). NEW BASELINE 9c61a6fc 0.844320 (SUPERSEDES 45c4e3e0 0.843405, +0.000915 composite, +0.000709 mean, std 0.136989->0.136303). Theme: developed the VOLUME-PARTICIPATION axis at entry sizing (new data dep: 6/18-bar volume trend). Exp3 shrink on DECLINING volume (low-participation entries), Exp5 boost on RISING volume trend-aligned entries (bilateral pair), Exp6 ADDITIONAL ct-only decline-shrink gated on ret_vlong (fires during rally pullbacks where 20-bar ret_long gate zeros Exp3). Rally (binding constraint) 0.701640->0.703526 (+0.0019). CONCLUSIONS: (1) ret_vlong must stay OUT of admission trend_avg in ANY form (Exp2 catastrophic -0.885, confirms prior binary-gate failure extends to continuous blend — trend_avg feeds too many downstream subsystems); (2) sustaining WEAK shrinks through scale-in hurts winners (Exp4, same as Exp5-prior partner-disagree sustain); only STRONG exhaustion signals (vol-spike Exp9) survive sustain; (3) BTC 8-bar near-term lead gives no marginal rally signal beyond existing 96-bar+20-bar cross-symbol shrinks (Exp1 inert). Volume axis now 3-deep; further volume experiments would be incremental tuning (selection-bias risk). strategy.py at 9c61a6fc.
