commit	score	mean_score	std_score	bull_2021	crash_bear	sideways	rally_2024	status	description
83ffa0a-session-summary	-	-	-	-	-	-	-	session-summary	session: 5 architectural discards (cap reached, baseline 83ffa0a unchanged at 0.954). All 5 architectural. Discards: (1) peak-stall exit pressure 7th source (new _peak_bar state + 7th soft pressure on bars-since-peak) — CATASTROPHIC composite -0.323, rally CRUSHED 0.85->0.00: counter-trend rally bears rarely make new peaks during rally upward push, bars_since_peak accumulates rapidly, peak-stall fires uniformly on every counter-trend position past 3 bars regardless of whether stalling is real. (2) MAE-progress freeze on scale-in (freeze scale-in growth on bars where pos_pnl < prior MAE) — CATASTROPHIC composite -0.241, rally CRUSHED 0.85->0.21: rally counter-trend bear positions sit at fresh MAE frequently during rally upward push, scale-in blocked indefinitely so positions never reach full size for capturing pullback recovery. (3) counter-trend-aware _pp_min reduction (30% reduction when counter-trend in strong trend) — composite -0.004, mean +0.0004 essentially flat: mechanism activates narrowly, _giveback_ratio normalization to peak/_pp_min cancels much of the timing change; LOC overhead (11 lines) drops composite. (4) position-direction-sign-aware _chop_amp (decompose by pos_dir × sign(ret_long), narrow tanh saturation 0.005) — composite -0.003, sideways +0.011 (PARTIAL prior-session-hint confirmation), but rally -0.020: rally counter-trend bears lose load-bearing _chop_amp protection from bull-voter spikes when their position opposes ret_long sign. _chop_amp is BILATERAL (both trend-aligned and counter-trend in chop need own-side amplification), not trend-aligned-only. Sign decomposition fails. (5) slope-confirmation requirement on _opp_gate (require both trend_avg and _exit_slope to confirm reversal direction) — CATASTROPHIC composite -0.463, crash CRUSHED 0.64->0.00: making opp_gate stricter delays legitimate fast-reversals in crash dead-cat-bounces; slope requirement filters NOISE flips (would help rally) but also filters SIGNAL flips (kills crash). Cross-experiment insights: (a) Rally counter-trend bears are EXTREMELY sensitive — three of five experiments crushed rally to <0.4 (peak-stall 0.00, MAE-freeze 0.21, slope-confirm 0.34). Any new exit pressure or scale-in gating that fires uniformly across position types breaks them because they spend significant time AT MAE / WITHOUT new peaks during rally upward push, behavior identical to "stalled bad position" but with different recovery dynamics. (b) "Stalling winner" / "MAE-bleed" / "trend reversal" criteria all fail to distinguish legitimate counter-trend hold from genuine stale-loser pattern — temporal signatures are similar. (c) _chop_amp asymmetric decomposition by sign-alignment: confirms _chop_amp is bilateral (sideways +0.011 from removing on counter-trend was real but rally regression -0.020 dominated); cannot be cleanly isolated to trend-aligned positions. (d) opp_gate strictness is calibrated for crash — stricter strictness (slope-confirm) catastrophically delays crash dead-cat reversals; opp_gate is structural for crash bear short rotation. (e) The current baseline 83ffa0a represents a tightly-constrained local optimum where rally counter-trend handling, crash fast-reversal, _chop_amp bilateral signaling, and persistence-weighted voter aggregation are all foundational and orthogonal — no single-mechanism architectural change has been able to improve any one without regressing another. Decision-architecture saturation continues across exit-pressure 7th sources (peak-stall added to long discard list with stale, conviction-decay), scale-in gating modes (freeze, MAE-pace, anchor all failed), voter_bias modulator decomposition (sign-aware, asymmetric-trend, joint-removal all failed), and reversal-gate strictness (slope-confirm catastrophic, persistence catastrophic). Baseline 83ffa0a (0.954) unchanged.
-	0.706	0.728	0.406	1.16	0.06	0.85	0.84	discard	2-bar EMA-smoothed margins at voter_bias (architectural new per-symbol state + new control flow at exit fusion) — CATASTROPHIC composite -0.248 vs 83ffa0a 0.954, mean -0.133. Crash CRUSHED 0.645->0.059 (MaxDD 3.84%->8.34%, sharpe collapse): smoothing _opp_margin DELAYS the dead-cat-bounce reversal signal — when bull voter spikes during crash bounces, the smoothed _opp_margin lags by 1 bar so voter_bias addition fires late, missing the fast reversal window that opp_gate depends on. Same fundamental pattern as prior EMA-smoothed-exit-pressure branch (7 gating variants tried, all failed): crash dead-cat bounce requires fast bilateral signal propagation. Bull untouched (persistence-weighted strong-sums preserved upstream — confirmed orthogonal). Sideways +0.054 (0.796->0.850) CONFIRMS smoothing-helps-chop hypothesis, rally near-flat (+0.001), but crash collapse dominates. Same insight as prior branch — no gating variant can isolate crash-protection from smoothing-helps-chop because crash bounces have single-bar voter spike signatures identical to chop noise. Reverting.
-	0.885	0.800	0.218	1.16	0.64	0.80	0.60	discard	remove _ar_pressure adverse-recovery 6th exit pressure (architectural code-structure removal) — composite -0.069 vs 83ffa0a 0.954, mean -0.060. Rally CRUSHED -0.241 (0.844->0.604, sole regime impacted), bull/crash/sideways IDENTICAL to baseline. _ar_pressure fires only in rally where counter-trend bear positions reach deep MAE during upward push then recover to small loss — exiting at recovery prevents holding through subsequent reversal that would otherwise stop out. Mechanism is NOT duplicative with slope/time/sl: slope-against requires actual reversal (recovery from MAE has slope-favorable bars), time fires past _max_hold (recoveries usually within hold window), sl only fires at full -2.4% (recovery is from deeper). _ar_pressure is the unique exit-trigger for the 'recovered but still losing' rally pattern. Load-bearing for rally. Reverting.
-	0.954	0.858	0.187	1.15	0.64	0.80	0.84	discard	remove _quality_atten bilateral-conviction-quality entry size attenuator (architectural code-structure removal) — composite -0.000185 vs 83ffa0a 0.954 (LOC bonus essentially offset by mean drop), mean -0.002 (fails mean-must-improve criterion). All four per-regime scores within 0.006 of baseline (bull -0.002, crash -0.004, sideways +0.003, rally -0.006). Mechanism is dead-code-adjacent: _quality_atten size-cut overlaps heavily with _consensus_atten (multi-window slope alignment fires hardest on split-voter cases) and _persist_ok 2-bar entry persistence — three correlated split-voter filters. Sideways +0.003 hint suggests quality_atten may be slight drag in chop where bilateral signals cross frequently. Mean criterion fails by 0.002. Reverting.
-	0.951	0.860	0.187	1.16	0.64	0.80	0.84	discard	opp-margin-conditioned _chop_amp fade (architectural new cross-component data dep at voter_bias) — composite -0.003 vs 83ffa0a 0.954, mean -0.001. Bull/sideways IDENTICAL to baseline (mechanism barely fires there: opp_margin is structurally negative or near-zero for the held side during most hold bars by admission/persistence asymmetry). Crash flat +0.000017, rally -0.003 (counter-trend bears occasionally see moderate opp_margin from bull voter spikes during rally chop, fade engages partially, slight hold reduction). Mechanism is dead-code-adjacent in chop+sideways: by construction (admission threshold + persistence), the held side has positive _side_margin and the opp side has negative _opp_margin near zero → tanh(opp_margin/0.40)≈0 → no fade. The intended mechanism (fade _chop_amp when bilateral noise) requires both margins to be positive simultaneously, but persistence_mult-weighted margins make this extremely rare. LOC overhead (12 lines) caused composite drop. Mean criterion fails. Reverting.
-	0.929	0.841	0.200	1.16	0.61	0.80	0.80	discard	remove calm_boost size multiplier (architectural code-structure removal) — composite -0.025 vs 83ffa0a 0.954, mean -0.019. Bull +0.005 (1.157->1.162, slight gain — less over-sizing during BTC calming bars within bull pullbacks), crash -0.035 (0.644->0.609, MaxDD 3.84->3.75 but sharpe regression: post-crash dead-cat bounce calming periods need calm_boost to size up correctly for the resume leg), sideways IDENTICAL (calm_boost rarely active in sideways — sideways_boost rsi_trend_str dominates, calm_boost vol_short/vol_long ratio rarely triggers since sideways has sustained moderate vol), rally -0.046 (0.844->0.798: rally pullback consolidation periods experience vol_short<vol_long pattern, calm_boost was sizing up entries during dwell points; removing under-sizes those entries). calm_boost IS orthogonal to vol_ratio direct — vol_ratio fires on absolute level, calm_boost fires on RELATIVE COMPRESSION (vol_short<vol_long). The two are NOT redundant — calm_boost catches vol-compression bars regardless of absolute level. Std widened 0.186->0.200. Reverting.
83ffa0a-session-summary	-	-	-	-	-	-	-	session-summary	session: 5 architectural discards (cap reached, baseline 83ffa0a unchanged at 0.954). All 5 architectural. Discards: (1) 2-bar EMA-smoothed conviction margins at voter_bias — CATASTROPHIC composite -0.248, crash CRUSHED 0.645->0.059 + DD 3.84->8.34: smoothing _opp_margin DELAYS dead-cat-bounce reversal signal; sideways +0.054 confirms smoothing-helps-chop hypothesis but crash collapse dominates. Same fundamental pattern as prior EMA-smoothed-exit-pressure branch. (2) remove _ar_pressure adverse-recovery 6th exit pressure — composite -0.069, rally CRUSHED -0.241 (sole regime impacted, bull/crash/sideways IDENTICAL): _ar_pressure uniquely covers rally counter-trend bear MAE-recovery exit pattern; not duplicative with slope/time/sl since recovery bars have favorable slope and within-hold-window timing. _ar_pressure load-bearing for rally. (3) remove _quality_atten bilateral-conviction-quality entry size attenuator — composite essentially flat -0.000185, mean -0.002 fails criterion: dead-code-adjacent due to overlap with _consensus_atten and _persist_ok (three correlated split-voter filters). LOC bonus offset by 0.002 mean drop. Sideways +0.003 hint that quality_atten is slight chop drag. (4) opp-margin-conditioned _chop_amp fade — composite -0.003, all per-regime within 0.003: mechanism dead-code-adjacent because by construction (admission threshold + persistence_mult) the held side has positive _side_margin while opp side has _opp_margin near zero or negative; tanh(opp_margin/0.40)~0 so fade rarely engages. The intended bilateral-noise scenario is structurally rare. (5) remove calm_boost size multiplier — composite -0.025, crash -0.035 + rally -0.046, bull +0.005, sideways flat: calm_boost is genuinely orthogonal to vol_ratio direct — vol_ratio fires on absolute level, calm_boost fires on RELATIVE vol-compression (vol_short<vol_long). Crash post-bounce calming bars and rally pullback dwell periods both depend on calm_boost size-up. Std widened 0.186->0.200. Cross-experiment insights: (a) Smoothing margins at voter_bias has same crash failure as prior smoothing-exit-pressure branch — fast bilateral signal propagation requirement is structural for crash dead-cat detection; cannot be smoothed at any level (margin, voter_bias output, soft_sum) without crash collapse. (b) _ar_pressure uniquely covers rally counter-trend bear MAE-recovery; bull/crash/sideways IDENTICAL when removed (the 6th source has perfect regime selectivity for rally). (c) Size attenuators (_quality_atten) and voter_bias modulators (_chop_amp_fade) are dead-code-adjacent due to admission threshold and persistence_mult upstream filtering; their intended decision-boundary cases are structurally rare. (d) calm_boost vol-compression detection is orthogonal to absolute vol level — captures crash-post-bounce and rally-pullback-dwell calming bars that absolute vol_ratio misses (those bars have moderate absolute vol but compressed relative to recent average). (e) The local optimum at 83ffa0a continues to be tightly defended: every architectural change in this session either (i) regressed catastrophically due to fast-signal-propagation requirement [crash dead-cat], (ii) regressed regime-selectively due to unique mechanism coverage [rally _ar_pressure], (iii) failed mean criterion despite LOC savings [dead-code-adjacent simplifications], or (iv) regressed mildly due to genuine orthogonal coverage [calm_boost]. Decision-architecture saturation continues across margin smoothing (crash-failure pattern confirmed at 3 levels), exit-pressure source removal (_ar uniquely covers rally), entry size attenuators (consensus/quality/persistence are 3 correlated filters), voter_bias modulators (admission filtering makes intended cases rare), and size multiplier stack (calm_boost orthogonal). Baseline 83ffa0a (0.954) unchanged.
-	0.842	0.737	0.154	0.97	0.57	0.77	0.64	discard	voter-breadth admission gate (architectural new decision boundary at entry) — composite -0.112 vs 83ffa0a, mean -0.123. ALL four regimes regressed: bull -0.19, crash -0.07, sideways -0.03, rally -0.20. The breadth>=3.5 threshold (4-of-7 voters above 0.55) is too restrictive — strong-narrow entries (3 saturated voters carrying signal) are LEGITIMATE in trend regimes where a few clearly-directional voters (slope, EMA_cross, MACD) dominate while mean-reverting voters (RSI) sit neutral. Cutting those entries removes large fraction of profitable trades. Mechanism direction wrong: breadth is correlated with NOISE not with signal quality in trending markets where the structural voters carry orthogonal signal that mean-reverting voters do not.
-	0.901	0.816	0.202	1.16	0.64	0.69	0.77	discard	time-decayed EMA strong-sum unified entry admission (architectural unified persistence+admission) — composite -0.053 vs 83ffa0a, mean -0.044. Sideways crushed -0.11 (0.80->0.69) and rally -0.07 (0.84->0.77). Bull/crash flat. The 3-bar EMA weight [0.5/0.3/0.2] retains 50% of past-bar signal in current admission, but sideways direction signals naturally oscillate bar-to-bar — averaging stale bars with current bar suppresses CURRENT signal that should trigger entry, and admits trades when prior bars carry stale conviction that opposes current direction. Unifying persistence+admission into a weighted sum is wrong-directional: persistence works by gating on MINIMUM (sustained), not weighted-sum (averaged); replacing min with EMA loses the noise-rejection property.
-	0.901	0.816	0.202	1.16	0.64	0.69	0.77	discard	time-decayed EMA strong-sum unified entry admission (architectural unified persistence+admission) — composite -0.053 vs 83ffa0a, mean -0.044. Sideways crushed -0.11 (0.80->0.69) and rally -0.07 (0.84->0.77). Bull/crash flat. The 3-bar EMA weight [0.5/0.3/0.2] retains 50% of past-bar signal in current admission, but sideways direction signals naturally oscillate bar-to-bar — averaging stale bars with current bar suppresses CURRENT signal that should trigger entry, and admits trades when prior bars carry stale conviction that opposes current direction. Unifying persistence+admission into a weighted sum is wrong-directional: persistence works by gating on MINIMUM (sustained), not weighted-sum (averaged); replacing min with EMA loses the noise-rejection property.
-	0.949	0.860	0.186	1.16	0.64	0.80	0.84	discard	dual-trigger SL with slope-acceleration arm (architectural new SL decision boundary) — composite -0.005 vs 83ffa0a, mean +0.0001 (essentially flat). Rally +0.006 (1.519->1.535 sharpe nudge — sole positive mover; accel-arm rarely fires but trims a few mid-loss positions that were going to breach stop). Bull -0.005 (1.16->1.16 essentially identical), crash flat, sideways flat. The slope_against>0.0005 threshold mid-loss is structurally rare (positions only spend 1-2 bars in 50%-loss zone before either recovering or stopping). Mechanism does what intended but case structurally infrequent; net composite worse via LOC penalty offsetting marginal rally gain.
-	-999	-749	432.83	-999	0.58	-999	-999	discard	remove _voter_bias entire exit term (architectural code-structure removal) — CATASTROPHIC composite -999, bull/sideways/rally all hit hard cutoff. Crash unaffected (0.58). The own-side subtraction in _voter_bias was LOAD-BEARING for winner-holding semantics — without it, _exit_pressure cleanly fires on slope/pp/time without the conviction-discount that lets winners run. Result: massive over-trading, DD>10% or <10 trades hard cutoff. _voter_bias is structurally required at exit even though it reuses voter data — the bilateral-additive term is the only mechanism letting strong-conviction positions ignore moderate exit pressures. Different from prior modulator-removal (which kept the term, just removed modulators); removing the term itself collapses winner-hold mechanism.
-	0.951	0.859	0.186	1.16	0.66	0.80	0.82	branch	pnl-conditioned scale-in pace (architectural new control flow at scale-in) — composite -0.003 vs 83ffa0a, mean -0.002. 3 of 4 regimes improved: crash +0.011 (0.64->0.66), sideways +0.006 (0.80->0.81), bull near-flat (+0.0003). Rally regressed -0.029 (0.84->0.82): rally counter-trend bear positions face transient pos_pnl dips on pullback bars; pnl-pace mult shrinks scale-in during those dips, leaving smaller commitment when the position resumes profitable trajectory. Opening exploration branch — branch hypothesis: gate _pnl_pace_mult activation to trend-aligned positions only (no shrinking on counter-trend dips); preserves crash/sideways/bull gain while restoring rally.
-	0.952	0.858	0.183	1.16	0.66	0.81	0.82	branch-discard	BRANCH SUMMARY (6 steps): pnl-conditioned scale-in pace (architectural new control flow at scale-in). Step progression: 0.951 (pos_pnl bidirectional, rally -0.029) -> 0.947 (trend-align gate, lost crash gain) -> 0.951 (positive-only) -> 0.952 (amplitude 0.5x, best step but still -0.002) -> 0.948 (slope-aligned replacement, bull regression) -> 0.943 (dual-confirm AND-gate). Best intermediate (step 4) achieved 3-of-4 regime improvements (crash +0.011, sideways +0.011, bull -0.001) but rally -0.029 dragged composite below baseline. The rally regression pattern: counter-trend bear positions in rally regime experience transient pos_pnl dips that interact with ANY pnl-based scale-in modulation, AND slope-aligned positions in bull/rally over-commit when modulation accelerates standard pace. Mechanism conflicts with existing trend-conditioned pace (2-4 bars by rsi_trend_str) which already captures structural trend differences. Branch terminated at step 6 with no clear path to surpass baseline. All 6 branch steps reverted.
83ffa0a-session-summary	-	-	-	-	-	-	-	session-summary	session: 4 architectural discards + 1 architectural branch-discard (pnl-conditioned scale-in pace branch, 6 steps). Discards: (1) voter-breadth admission gate — composite -0.112, ALL 4 regimes regressed, breadth>=4-of-7 too restrictive in trend regimes where 3 saturated voters carry legitimate signal. (2) time-decayed EMA strong-sum entry admission — composite -0.053, sideways -0.11 + rally -0.07, EMA averages stale bars contradicting current direction; persistence works via min-of-N not weighted-sum. (3) dual-trigger SL with slope-acceleration arm — composite -0.005, rally +0.006 only positive (slope_against>0.0005 mid-loss structurally rare). (4) remove _voter_bias entire exit term — CATASTROPHIC -999, own-side voter_bias subtraction is LOAD-BEARING for winner-hold semantics. (5) [BRANCH] pnl-conditioned scale-in pace branch (6 steps) — best step 0.952 vs baseline 0.954; rally counter-trend bear positions transient-pnl-dips interact with ANY pnl-based modulation; slope-based replacement caused bull regression. Cross-experiment insights: (a) Entry-gate restrictiveness (breadth, EMA-min) almost always regresses by cutting trend regime entries — narrow-deep voter conviction is structural. (b) _voter_bias own-side term is irreplaceable winner-hold mechanism. (c) Scale-in pace modulation conflicts with existing trend-conditioned pace; rally counter-trend transient dips break pnl-modulators. (d) Decision-architecture saturation continues: every architectural change either regresses catastrophically (voter_bias removal, breadth gate), regresses regime-selectively (rally drag from scale-in modulation), or yields near-flat composite (SL accel arm). Baseline 83ffa0a (0.954) unchanged.
-	0.861	0.766	0.176	1.04	0.63	0.79	0.60	discard	max-plus-half-residual soft exit fusion (architectural fusion shape change) — composite -0.093 vs 83ffa0a 0.954, mean -0.095. Bull -0.122 (1.164->1.042), rally -0.244 (0.84->0.60), crash -0.012, sideways -0.027. Mechanism: max+0.5*residual was meant to reduce mild-multi-source over-firing (crash dead-cat correlated). Instead BREAKS trend regimes where ALL soft pressures need full weight — bull peak-fatigue is multi-source legitimate (pp+time+slope all signal real exhaustion in long-held bull positions); half-weighting cuts exit signal when multiple pressures together represent confirmed peak. Rally similar — counter-trend bear exits need full pressure aggregation when slope-against+time+ep all fire mildly together. Fusion shape change wrong-direction in trend regimes. Reverting.
