commit	score	mean_score	std_score	bull_2021	crash_bear	sideways	rally_2024	status	description
-	-	-	-	-	-	-	-	-	session-summary	SESSION (baseline 1d764b9f 0.689311 5-regime -> UNCHANGED, no keep): 2 independent architectural experiments (Exp1-2, BOTH discards), no exploration branch opened (neither branch-worthy -- both sub-noise, targets structurally walled, no credible path to keep). EXIT RULE: 2-architectural-discard minimum MET; exited on saturation (strategy at confirmed deep local optimum, every subsystem documented walled across 5+ prior sessions). Baseline 1d764b9f re-verified byte-identical at session start AND post-revert (composite 0.689311, all stab 1.0 raw==score, no flips) [bull 0.961878 Sh1.9995 DD3.09pct 52t, crash 0.729861 Sh1.271 DD2.46pct 55t 100pctWR, sideways 1.011417 Sh2.017 DD2.21pct 49t sample_factor 0.9899, rally 0.662116 Sh1.530 DD5.17pct 102t 85pctWR, mixed 0.408468 Sh0.802 DD2.80pct 43t; min_stab 0.844713]. results.tsv append-only preserved (path-scoped git checkout -- strategy.py for each discard, never git revert). NOTE: session started with an UNRECORDED prior-agent experiment at HEAD (4bf5f622 cross-book wrong-side exit pressure, committed but never backtested/recorded); backtested it AS this session's Exp1. THEME: probed 2 genuinely-different architectural angles across exit-fusion + entry-admission subsystems, each with a clear mechanism and a concrete measurable target. CROSS-EXPERIMENT CONCLUSIONS (all measured this session, verifiable): (1) EXP1 CROSS-BOOK WRONG-SIDE EXIT PRESSURE (8th MAX-fusion soft source; NEW cross-symbol data dep -- exit pressure from portfolio NET exposure x BTC multi-day leader trend, fires when book is net-long AND BTC in sustained downtrend = mixed's all-year wrong-side-long signature; saturating tanh gates for noise-robustness): composite +0.000041 SUB-NOISE, mean +0.000037. PER-REGIME: bull/crash/sideways BYTE-IDENTICAL, rally +0.000184 (marginal), mixed BYTE-IDENTICAL 0.408468 (target MISSED). FAILURE MECH (architectural fact): the wrong-side exit pressure did NOT fire on mixed -- mixed's 3 longs are held by per-symbol exit primitives that never individually saturate, the portfolio net-exposure gate DID activate yet produced ZERO mixed movement. Reconfirms prior-session root-cause (row 1236): mixed positions never exit because the EMISSION quantization floor re-quantizes every reduction to the same grid; an exit-PRESSURE source adds to the MAX fusion upstream but the downstream emission floor still rounds reductions to zero. The exit-pressure layer is upstream of emission -> inert on mixed by the same re-quantization wall as Exp1-build/Exp2-targetEMA/Exp3-deriv prior session. mixed is at the HARD STRUCTURAL FLOOR (100pct-long-in-a-down-year, reductions tiny/re-quantized). (2) EXP2 LINEARITY-CONDITIONED ADMISSION RELAXATION (R^2 x trend-strength conjunction at admission boundary): composite -0.000023 SUB-NOISE, mean -0.000015. PER-REGIME: bull BYTE-IDENTICAL 0.961878, sideways BYTE-IDENTICAL 1.011416 (target MISSED), rally +0.000006, crash +0.000001, mixed -0.000081. TRADES UNCHANGED: sideways 49 (target 50 NOT reached -- relaxation did NOT add a trade). FAILURE MECH (architectural fact): the relaxation was INERT on sideways trade count -- the 49->50 marginal sideways trade was NOT sitting just below the admission threshold on a high-R^2 low-trend bar; the chop-tightening was NOT the binding constraint for the missing sideways trade. The tiny mixed -0.000081 wobble (all others moved <0.000006) indicates the offset activated on a mixed bar shifting one entry timing marginally, but added no net trade. Confirms: sideways sample_factor damping (sqrt(49/50)=0.9899) is NOT recoverable via admission relaxation -- the missing marginal trade is not chop-tightening-bound; the 4x-leverage sideways trade-count drop (52->48->49 via SIDEWAYS_BOOST) is a grid/structure property, not an admission-threshold lever. CONVERGENT CONCLUSION: both experiments reconfirm the strategy is at a confirmed deep local optimum. mixed remains at its HARD STRUCTURAL FLOOR (emission-reduction layer + 3 gates at efficient frontier; all upstream layers re-quantization-walled). sideways trade count is grid-bound (not admission-bound). rally (0.662, streak structurally unbreakable, ct-exit fully optimized, DD-reduction maxed at giveback 0.50 + tp-harvest 0.60) and crash (0.730, return-limited Sh1.271 100pctWR, exit-timing inert) remain at non-addressable structural limits. The binding regimes' limits are structural properties of the regime data (mixed wrong-side persistent long; rally ct-loser peak magnitude + streak count; crash bounce move size), not of the strategy mechanism. Structural-exploration NOT attempted: trigger condition (3+ consecutive arch discards in THIS session) met at 2 but no coherent subsystem-rewrite hypothesis with a plausible path (every core mechanism converted+tuned by prior sessions; the two new data deps this session -- cross-book exit pressure, R^2-admission -- both confirmed walled). NEW BASELINE 0.689311 UNCHANGED.
423ad6b7	0.679875	0.747313	0.224794	0.980099	0.694906	1.011417	0.641676	0.408468	discard	Exp1 (architectural, indep): SUSTAIN multi-day counter-trend entry shrink through scale-in. The _bull_ct_vlong/_bear_ct_vlong first-bar shrink (0.40x max for entries against the 96-bar ret_vlong trend) is first-bar-only; scale-in ramps position back to full size over 3 bars. Cache the entry-time shrink and apply to full_target (same pattern as _conc_shrink_held/_vol_shrink_held) so wrong-side entries stay at reduced commitment for the whole hold. MEASURED vs 1d764b9f 0.689311: composite -0.009436 (0.679875), mean -0.007435 (0.747313), std 0.218125->0.224794. PER-REGIME all stab 1.0 raw==score all DD<10pct all flip_count 0: bull 0.961878->0.980099 (+0.018221 Sh 1.9995->2.1003 -- trend-aligned longs benefit from sustained ct-shrink on bull's ct legs), crash 0.729861->0.694906 (-0.034955 Sh 1.271->1.209), sideways BYTE-IDENTICAL 1.011417 (ret_vlong~flat -> gate 0 -> cache 1.0), rally 0.662116->0.641676 (-0.020440 Sh 1.530->1.515), mixed BYTE-IDENTICAL 0.408468 (Sh 0.8023 unchanged, target MISSED). FAILURE MECH (direct measurement): mixed is BYTE-IDENTICAL -- the sustained ct-shrink did not move the emitted mixed position. Reconfirms the documented emission re-quantization wall (5+ prior sessions): mixed realizes via 54 small reductions that the emission quantization floor re-rounds to the same grid; an upstream entry-time size-shrink cache does not alter the emitted position value. Not branch-eligible (mixed is the binding target and is structurally walled; bull gain offset by crash/rally regression with no credible path to keep via this axis). Reverted to 1d764b9f.
c84c644e	0.667476	0.737196	0.232400	0.970866	0.707963	1.021795	0.576398	0.408958	discard	Exp2 (architectural, indep): PORTFOLIO-DD-ADAPTIVE SCALE-IN PACE SLOWING. Third distinct DD-reduction lever: the two existing (giveback-tightening 0.50, tp-harvest 0.60, both maxed) act on EXIT timing/magnitude; this acts on the BUILD side. During portfolio DD, lengthen _entry_full_bars_dyn (bars-to-full-size window) by a tanh fraction of DD depth so new/early entries commit less per bar -> lower peak exposure during DD -> smaller drawdown. Byte-identical at portfolio peak (dd_frac=0 -> factor 1.0); leverage-coupled scale (PORT_DD_SCALEIN_SCALE*LEVERAGE_K); continuous tanh; max +50pct window lengthening. MEASURED vs 1d764b9f 0.689311: composite -0.021835 (0.667476 FAIL), mean -0.017552 (0.737196 FAIL), std 0.218125->0.232400. PER-REGIME all stab 1.0 raw==score all DD<10pct all flip_count 0: bull 0.961878->0.970866 (+0.008988 Sh 1.9995->1.9519), crash 0.729861->0.707963 (-0.021898 Sh 1.271->1.277), sideways 1.011417->1.021795 (+0.010378 Sh 2.017->2.003), rally 0.662116->0.576398 (-0.085718 Sh 1.530->1.417 -- large regression), mixed 0.408468->0.408958 (+0.000490 Sh 0.802->0.769 -- Sharpe dropped, score nudged via calmar/DD). FAILURE MECH (direct measurement): rally regressed -0.086 because slowing scale-in during rally pullbacks (the DD source) slowed the BUILD of rally's trend-aligned longs -> captured less of the grinding uptrend -> lower Sharpe. The DD-reduction hypothesis was mechanistically wrong: rally's DD is dominated by HELD-WINNER GIVEBACK (riding longs through pullbacks), not by new-entry peak exposure, so slowing the build does not reduce DD but does reduce return. Confirms rally DD is a giveback/timing property (addressed by the maxed giveback+tp-harvest levers), not a build-pace property. Not branch-eligible (binding regime rally regressed badly, wrong mechanism, no credible path). Reverted to 1d764b9f.
074978cb	-999.000000	-999.000000	0.000000	-999	-999	-999	-999	-999	discard	Exp3 (architectural, indep): MULTI-DAY trend-ALIGNED max_hold EXTENSION. Symmetric counterpart to _ct_hold_sat (which SHORTENS ct holds via ret_vlong): extend max_hold for trend-ALIGNED winning positions (pos_dir matches 96-bar ret_vlong sign, profit-only via max(0,_pnl_scale)) so winners ride the multi-day trend longer -> higher Sharpe in crash (1.271 100pctWR return-limited) + rally. Fast-saturating /0.01; +15pct max extension. MEASURED vs 1d764b9f 0.689311: CATASTROPHIC FAILURE -- ALL regimes -999 (hard cutoff DD>10pct). Per-regime MaxDD: bull 52.81pct, crash 99.38pct, sideways 33.51pct, rally 69.68pct, mixed 100.60pct. All breach the 10pct hard cutoff AND the 50pct regime gate massively. FAILURE MECH (direct measurement): _pnl_scale=tanh(pos_pnl/|stop|) stays POSITIVE for positions that BEGAN winning then reversed (peak_pnl anchors the positive scale even as pos_pnl gives back) -> the extension keeps applying to positions riding INTO deep reversals -> held far past their exit point -> catastrophic DD. The profit-gating was insufficient: profit must be CURRENT and the extension must release instantly on reversal, but tanh(pos_pnl) lags. Also max_hold extension delays time-pressure onset for ALL held positions in strong trends, removing the structural exit floor. Mechanistically wrong: extending hold duration on trend-aligned winners is not viable via max_hold because the time-pressure ramp is the structural exit-floor that bounds DD. Not branch-eligible (all regimes at -999, no recoverable signal). Reverted to 1d764b9f.
b3e61690	0.691368	0.755040	0.212239	0.930502	0.730706	1.019949	0.683268	0.410773	branch	Exp4 (architectural, indep, BRANCH OPEN): CHOP-ADAPTIVE low-churn emission grid width. The fixed 0.06 low-churn grid (calm_gate, never-bursting symbols) over-rounds reductions for choppy held books. Make grid step = 0.06*(1-0.5*chop) in [0.03,0.06] where chop = 1-MTM-path-eff over the 12-bar pos_pnl path (same signal as baseline throttle). Finer grid for choppy books -> more granular reductions -> less over-rounding. New cross-component data dep: emission grid width depends on held MTM-path-efficiency. MEASURED vs 1d764b9f 0.689311: composite +0.002057 (0.691368, below +0.003 keep but positive), mean +0.000292 (0.755040), std 0.218125->0.212239 (-0.005886 better consistency). PER-REGIME all stab 1.0 raw==score all DD<10pct all flip_count 0: bull 0.961878->0.930502 (-0.031376 Sh 1.9995->1.9982 -- KEEP-BLOCKER, regressed), crash 0.729861->0.730706 (+0.000845 Sh 1.271->1.271 byte-near-identical), sideways 1.011417->1.019949 (+0.008532 Sh 2.017->2.014), rally 0.662116->0.683268 (+0.021152 Sh 1.530->1.529 -- improved), mixed 0.408468->0.410773 (+0.002305 Sh 0.802->0.807 -- BINDING regime MOVED, broke re-quantization wall via grid-width change). BRANCH OPEN: fundamentally new emission mechanism reaching mixed for first time; multi-regime gains (rally+sideways+mixed); bull -0.031 is keep-blocker. HYPOTHESIS for fix: bull-2021 is high-vol SHARP uptrend whose held longs have choppy MTM paths despite being net winners (sharp pullbacks = low MTM-eff at positive net) -> finer grid over-rounds bull reductions -> churn. Gate the narrowing by low-vol (grind_gate envelope (1.3-vol_ratio)/0.5): fire finer grid only in low-vol choppy books (mixed/rally grind), bull high-vol keeps 0.06 baseline.
d69c93c0	0.690417	0.754303	0.212956	0.930800	0.730706	1.021170	0.678067	0.410773	branch	branch step2: LOW-VOL GRIND gate on grid narrowing. MEASURED vs step1 0.691368: composite -0.000951 (0.690417 no-progress vs step1), mean 0.755040->0.754303. PER-REGIME: bull 0.930502->0.930800 (still -0.031 vs baseline, grind_gate did NOT spare bull -- bull vol_ratio moderate not >1.3 so gate fired partially), crash 0.730706 byte-identical, sideways 1.019949->1.021170 (+0.010), rally 0.683268->0.678067 (-0.005 rally regressed), mixed 0.410773 byte-identical (gain held). No-progress step #1. The grind_gate hurt rally without fixing bull.
1eca7a1b	0.686980	0.748099	0.203730	0.926726	0.730676	0.990518	0.678754	0.413820	branch	branch step3: DEAD-CAPITAL (near-breakeven pos_pnl) gate ANDd with grind_gate. MEASURED vs step2 0.690417: composite -0.003437 (0.686980 no-progress, BELOW baseline 0.689311), mean 0.754303->0.748099. PER-REGIME: bull 0.930800->0.926726 (-0.004 WORSE -- dead_cap did NOT spare bull, bull has near-breakeven pullback positions too), sideways 1.021170->0.990518 (-0.031 regressed -- dead_cap caught sideways near-breakeven positions), rally 0.678067->0.678754 (+0.001), mixed 0.410773->0.413820 (+0.003 improved further). No-progress step #2. Dead_cap gate over-restricted: removed sideways benefit without fixing bull. Confirms chop signal cannot cleanly separate mixed dead-capital from bull/sideways pullback giveback.
00f9c928	0.608521	0.670614	0.206976	0.512270	0.731599	1.024491	0.659130	0.425579	branch	branch step4: REDUCE narrowing amplitude 0.5->0.25 (grid [0.045,0.06]). MEASURED vs step1 0.691368: composite -0.082847 (0.608521 CATASTROPHIC no-progress). PER-REGIME: bull 0.930502->0.512270 (-0.418 COLLAPSED -- Sh 1.998->1.390 DD 3.07->6.62pct; grid resonance: 0.045 step lands bull resizes badly -> churn), crash 0.731 (+0.002), sideways 1.019949->1.024491 (+0.005), rally 0.683->0.659 (-0.024), mixed 0.410773->0.425579 (+0.0148 BIG improvement Sh 0.807->0.809). Non-monotonic: smaller narrowing hurt bull MORE (grid-quantization resonance with bull price path). No-progress step #3. Confirms bull is hypersensitive to exact grid step; amplitude tuning is not a viable path.
366e2ede	0.677936	0.741128	0.210639	0.929598	0.724724	0.990277	0.663314	0.397727	branch	branch step5: STRONG-UPTREND fade (ret_vlong*pos_dir/0.02, baseline throttle bull-sparer) on grid narrowing. MEASURED vs step1 0.691368: composite -0.013432 (0.677936 no-progress, BELOW baseline). PER-REGIME: bull 0.930502->0.929598 (-0.032 vs baseline, NOT spared -- strong_trend_fade did not isolate bull), crash 0.730->0.725 (-0.005), sideways 1.019949->0.990277 (-0.021), rally 0.683268->0.663314 (-0.020 lost step1 gain), mixed 0.410773->0.397727 (-0.011 BELOW baseline -- mixed regressed despite ret_vlong<0 implying full narrowing should fire). No-progress step #4. Non-monotonic: the gate changed WHICH bars narrow, flipping mixed benefit to loss via grid resonance.
629db7e2	0.671198	0.731993	0.202650	0.930300	0.730548	0.946692	0.658919	0.393508	branch	branch step6: FULL baseline-throttle gate stack (chop x grind x strong_trend_fade x winner_fade) on grid narrowing. MEASURED vs step1 0.691368: composite -0.020170 (0.671198 no-progress, BELOW baseline). PER-REGIME: bull 0.930 (-0.032 still NOT spared by all 4 gates), crash 0.731 (flat), sideways 1.019949->0.946692 (-0.064 badly regressed), rally 0.659 (-0.003), mixed 0.410773->0.393508 (-0.015 BELOW baseline). No-progress step #5. DEFINITIVE: even the baseline throttle's own validated mixed-isolating gate stack does NOT make the grid narrowing help mixed -- mixed regressed. The chop-adaptive grid is resonance-dominated: the grid quantization interacts chaotically with each regime price path, and no gate combination reliably targets mixed. step1 +0.002057 was a lucky resonance landing (below +0.003 keep bar), not a real mechanism signal.
-	0.689311	0.754748	0.218125	0.961878	0.729861	1.011417	0.662116	0.408468	discard	BRANCH REVERTED (chop-adaptive low-churn emission grid width). Opened at Exp4 (b3e61690, +0.002057 composite, mixed MOVED +0.0023 broke re-quantization wall via grid-width change -- first mechanism to reach mixed). 5 branch steps (step2-6) ALL no-progress vs step1, composite never exceeded step1's 0.691368 (+0.002057, below +0.003 keep bar). step2 grind_gate 0.690417, step3 dead_cap 0.686980, step4 amplitude 0.25 -> 0.608521 (bull collapsed 0.512), step5 strong_trend_fade 0.677936, step6 full gate stack 0.671198. CONCLUSION: the chop-adaptive grid is GRID-QUANTIZATION RESONANCE-DOMINATED -- non-monotonic across every gate/amplitude variant (bull 0.51-0.93, mixed 0.39-0.43 at identical intent). The grid rounds same-sign resizes onto a lattice; changing the step shifts which lattice cell each regime resize lands on, and that landing is path-dependent chaos NOT explained by the mechanism logic. step1 +0.002 was a lucky resonance, not signal (every principled gate variant -- the baseline throttle own validated mixed-isolating stack included -- FAILED to reproduce or beat it). Even mixed (the binding target the mechanism was designed to reach) regressed under 3 of 5 gate variants. Reverted to 1d764b9f (byte-identical). CROSS-EXPERIMENT: extends the mixed re-quantization wall -- the emission GRID WIDTH itself (not just upstream pressures) is resonance-dominated; tuning it is not a viable mixed lever. results.tsv append-only preserved (path-scoped git checkout -- strategy.py throughout, never git revert).
-	-	-	-	-	-	-	-	-	session-summary	SESSION (baseline 1d764b9f 0.689311 5-regime -> UNCHANGED, no keep): 3 independent architectural experiments (Exp1-3, ALL discards) + 1 exploration branch (chop-adaptive low-churn emission grid width, 6 steps, REVERTED). Baseline 1d764b9f re-verified byte-identical at session start AND post-branch-revert (composite 0.689311, all stab 1.0 raw==score, no flips) [bull 0.961878 Sh1.9995 DD3.09pct 52t 86.5pctWR, crash 0.729861 Sh1.271 DD2.46pct 55t 100pctWR, sideways 1.011417 Sh2.017 DD2.21pct 49t 98pctWR, rally 0.662116 Sh1.530 DD5.17pct 102t 85.3pctWR, mixed 0.408468 Sh0.802 DD2.80pct 43t 100pctWR; min_stab 0.844713]. results.tsv append-only preserved throughout (path-scoped git checkout -- strategy.py, never git revert). EXIT RULE: 3+ architectural discards + branch revert (concluded). THEME: probed the emission layer (the ONLY layer documented to reach mixed) via grid-width adaptation, plus 2 independent architectural angles (ct-shrink scale-in sustain, DD-adaptive scale-in slowing, trend-aligned max_hold extension). CROSS-EXPERIMENT CONCLUSIONS (all measured this session, verifiable): (1) EXP1 SUSTAIN CT SHRINK THROUGH SCALE-IN (cache _bull/_bear_ct_vlong at entry, apply to full_target like conc/vol shrink caches): composite -0.009436, mixed BYTE-IDENTICAL 0.408468 (re-quantization wall reconfirmed -- upstream entry-time size-shrink caches do not move the emitted mixed position; only the grid/throttle emission layer reaches mixed). bull +0.018 but crash -0.035 rally -0.020. (2) EXP2 DD-ADAPTIVE SCALE-IN PACE SLOWING (third DD-reduction lever on BUILD side vs the two maxed EXIT-side levers): composite -0.021835, rally -0.086 Sh 1.530->1.417. FAILURE MECH: rally DD is HELD-WINNER GIVEBACK (riding longs through pullbacks), not new-entry peak exposure; slowing the build does not reduce DD but reduces trend capture -> mechanistically wrong. Confirms rally DD is a giveback/timing property (giveback+tp-harvest levers maxed). (3) EXP3 TREND-ALIGNED MAX_HOLD EXTENSION (symmetric counterpart to _ct_hold_sat): CATASTROPHIC all regimes -999 (DD>10pct: bull 52.8pct crash 99.4pct mixed 100.6pct). FAILURE MECH: _pnl_scale=tanh(pos_pnl/|stop|) stays positive for positions that BEGAN winning then reversed -> extension keeps applying through deep reversals -> held past exit floor -> catastrophic DD. Confirms max_hold/time-pressure is the structural exit-floor bounding DD; extending it on trend-aligned winners is not viable (profit-gating insufficient; tanh lags reversal). (4) BRANCH CHOP-ADAPTIVE GRID WIDTH (Exp4 opened +0.002057, mixed MOVED +0.0023 -- first mechanism to reach mixed via grid-width not upstream pressure): 5 steps ALL no-progress, never exceeded +0.002057 (below +0.003 keep). DEFINITIVE FINDING: the emission grid is GRID-QUANTIZATION RESONANCE-DOMINATED -- non-monotonic across every gate/amplitude variant (bull 0.51-0.93, mixed 0.39-0.43 at identical intent). Even the baseline throttle own validated mixed-isolating gate stack (chop x grind x strong_trend_fade x winner_fade) FAILED to reproduce step1 gain or help mixed. step1 +0.002 was a lucky resonance landing, not signal. CONVERGENT CONCLUSION: strategy at confirmed deep local optimum reconfirmed via 3 independent angles + 1 emission-layer branch. mixed remains at HARD STRUCTURAL FLOOR (emission grid width now ALSO confirmed resonance-walled alongside upstream pressures; the entire emission quantization is a chaotic quantizer not tunable toward mixed). NEW BASELINE 0.689311 UNCHANGED.
aa26e0fc	0.600034	0.665926	0.219641	0.510865	0.739682	1.041012	0.637106	0.400963	discard
