commit	score	mean_score	std_score	bull_2021	crash_bear	sideways	rally_2024	status	description
-	-	-	-	-	-	-	-	session-summary	SESSION (v2.1 baseline cabfb6f1 0.605307): 0 keeps + 5 architectural discards + 1 STRUCTURAL_EXPLORATION discard (failed relaxed gates). Baseline UNCHANGED cabfb6f1 0.605307 [bull 0.699048 Sh1.864, crash 0.575486 Sh1.264, sideways 0.749111 Sh2.025, rally 0.511346 Sh1.300 MaxDD1.57; all stab 1.0, all flip 1.0, all MaxDD<10pct]. MID-SESSION the owner added program-stateless.md STRUCTURAL_EXPLORATION mode (commit 7f1b296c) for breaking rigidity at 3+ architectural discards; honored with ONE structural-exploration attempt after the 5th architectural discard. 5 ARCHITECTURAL DISCARDS: (1) Exp1 realized-excess-kurtosis entry-size attenuator (NEW 4th-moment dep, /8.0 deep-sat) INERT -0.000031 (gate never fires at hourly scale). (2) Exp2 additive-bounded fusion of 8 volume/DVP entry boosts (x->+bounded cap 0.20) -0.000894 rally -0.0026 (compound-over-commit hypothesis DISPROVEN: boosts are genuine rally alpha, capping removes it). (3) Exp3 counter-trend bars-held direct exit pressure (7th soft source, re-test row-701 under v2.1 headroom) -0.000416 rally -0.0012 (stability did NOT drop = headroom confirmed, but RAW gain absent: baseline already has 4 ct-cutting mechanisms -> 5th over-cuts). (4) Exp4 LSE soft-exit fusion blend (MAX->smooth-LSE) CATASTROPHIC -0.212 (bull stab 1.0->0.691, rally stab 1.0->0.835; 7 shared-input terms added by LSE -> correlated-noise amplification -> stability collapse; MAX load-bearing. rally raw +0.018 = multi-source-agreement has small positive signal but blend wrong vehicle). (5) Exp5 stale-loss sustained-underwater exit pressure (7th soft source, re-test row-775 under v2.1, new consecutive-underwater state) BYTE-IDENTICAL INERT (losers exit via ATR stop/slope-against before accruing 4 underwater bars). STRUCTURAL_EXPLORATION: de-risk power-ramp -> normalized-logistic-sigmoid rewrite FAILED relaxed first-step gates (composite 0.382 < floor 0.525, mean 0.461 < floor 0.584; rally stab 1.0->0.102 from sigmoid slow-end tail letting ct losers linger). CROSS-SESSION CONCLUSIONS (reinforced, all measured): (a) v2.1 stability headroom is REAL (Exp3/Exp5 stability did not drop) but does NOT unblock exit-loser levers - they are inert-by-construction in the CURRENT baseline (row-701/775 were on older de412448 without the ATR-stop/slope-against/ar-pressure/ct-cutting stack that pre-empts slow/ct bleeders). (b) EXIT-LOSER AXIS SATURATED across sub-mechanisms: Exp3 (ct x bars_held) over-cuts, Exp5 (adverse x duration) inert - losers exit via existing stop/slope-against same bar (row-924 confirmed with 2 NEW mechanisms). (c) ENTRY VOLUME-CONFIRMATION BOOSTS ARE GENUINE ALPHA not over-commitment (Exp2 capping removes rally alpha) - extends rally-re-entries-are-alpha to the volume axis. (d) MAX soft-exit fusion load-bearing against any additive/blend replacement (Exp4); _soft_atten already captures multi-source agreement noise-safely via single-source attenuation. (e) Higher-moment (kurtosis) signals inert at hourly scale. (f) NEW from STRUCTURAL_EXPLORATION: the de-risk power-ramp FUNCTION FORM is load-bearing on RALLY ct positions specifically (the only regime where de-risk is the binding exit path, not stop/slope); the convex hold-then-cut shape (sharp approach to 0) is calibrated to rally ct-loser exit timing; a symmetric sigmoid lacks the sharp near-saturation cut -> ct losers linger -> stability collapse. crash/sideways are de-risk-shape-INVARIANT (exits stop/slope-dominated there). The binding rally Sharpe (1.30) remains unconquered; all 6 mechanisms (5 architectural + 1 structural) failed in ways consistent with documented dead-end families (inert/alpha-wall/noise-wall/saturation/function-form-load-bearing). results.tsv append-only preserved (path-scoped git checkout -- strategy.py throughout, never git revert); all 6 reverted to cabfb6f1. EXIT: 0 keeps, 5 architectural discards (exit rule satisfied) + 1 structural-exploration discard (failed relaxed gates, frequency limit 1/session), baseline cabfb6f1 0.605307 unchanged.
09153c38	0.604427	0.633083	0.095519	0.698806	0.575365	0.749105	0.509053	discard	Exp1 (architectural, indep): CROSS-SECTIONAL RELATIVE-STRENGTH first-bar size reallocation. NEW cross-symbol ranking dep (own 20-bar ret_long vs cross-sectional mean across BTC/ETH/SOL -- ranks symbols against each other, vs prior leader->follower directional confirmations). Leader trend-aligned entries boosted +0.06, laggards shrunk -0.06, trend-alignment gated (spares ct shorts + chop), first-bar only, deep-saturated /0.03. MEASURED vs cabfb6f1 0.605307: composite -0.000880 (0.604427), mean -0.000665. PER-REGIME: rally -0.002293 (0.511346->0.509053, BINDING constraint dropped), bull -0.000242, crash -0.000121, sideways -0.000006 (~byte-identical). All stab 1.0, all MaxDD<10pct (rally 1.606). All regimes slightly down, rally most. Wrong-directional for binding regime. FAILURE = alpha-trade wall extended: in rally the laggard trend longs (e.g. BTC lagging SOL) are STILL profitable trend alpha; shrinking them via RS-ranking removes alpha (same family as marginal-conviction-entries-are-alpha + laggard-sustain). Reallocation away from laggard trend entries = structurally a shrink on real alpha. Not branch-eligible (no regime improved; wrong-directional). Architectural discard #1. Reverted to cabfb6f1.
aaf4ed2e	0.604656	0.632930	0.094247	0.695776	0.575486	0.749111	0.511346	discard	Exp2 (architectural, indep): SCALE-IN-CLEARED gate on take-profit harvest (bars_held > _entry_full_bars_dyn before proactive harvest engages). NEW bars_held dep on harvest timing. Hypothesis: harvesting a position that peaks during scale-in is contradictory (grow vs harvest same bars); delaying lets fast-trend winners reach full size first. MEASURED vs cabfb6f1 0.605307: composite -0.000651 (0.604656), mean -0.000818. PER-REGIME: bull -0.003272 (0.699048->0.695776), crash BYTE-IDENTICAL 0.575486, sideways BYTE-IDENTICAL 0.749111, rally BYTE-IDENTICAL 0.511346. All stab 1.0, all MaxDD<10pct. The gate fired ONLY in bull (bull positions peak during scale-in and were harvested -> that early harvest is load-bearing); crash/sideways/rally peaks develop post-scale-in so harvest was already post-scale-in -> no change. CONFIRMS the bull-correction wall extends to the harvest: early bull peaks are harvested precisely to pre-empt the 2021 corrections that follow clean run-ups (same family as MAE-cleanliness cushion Exp4 row 908 -- letting clean bull winners run destroys bull). Not branch-eligible (no regime improved; bull regression + 3 byte-identical). Architectural discard #2. Reverted to cabfb6f1.
9cc27f33	0.522220	0.545061	0.076135	0.586243	0.575492	0.604123	0.414385	discard	Exp3 (architectural, indep): TREND-CONDITIONED strong-sum ramp exponent (voter-aggregation function form rewrite). exp=3+4*_trend_strength_w (cubic chop, ~septic trend), renormalized to preserve f(1.0)=3.05 (admission threshold calibration intact). MEASURED vs cabfb6f1 0.605307: composite -0.083087 (0.522220), raw_composite 0.562565, mean -0.088687. PER-REGIME: bull -0.112805 (0.699->0.586), sideways -0.144988 (raw 0.748 stab 0.807->final 0.604), rally -0.096961 (raw 0.462 stab 0.896->final 0.414), crash ~identical 0.575492. FIRST stability penalties this session (sideways 1.0->0.807, rally 1.0->0.896, min_stability 0.820->0.742). The softer chop ramp let mid-conviction voters (c~0.7) contribute -> their AR(1)-noise flips now move the strong-sum -> entry-timing tracking error -> stability collapse. The sharper trend ramp changed trend entry timing -> raw drop. CONFIRMS the quintic (c-0.5)^5 ramp SHAPE is load-bearing for noise-robustness: the steep quintic near-zeroes mid-conviction voters (exactly the noise-sensitive ones), so only decisive (far-from-boundary) voters drive the sum -> noise-immune by construction. Any softer ramp re-introduces mid-conviction voter noise. Not branch-eligible (catastrophic broad regression, no regime improved; the rewrite IS the noise problem). Architectural discard #3. Reverted to cabfb6f1. CROSS-SESSION: voter-aggregation ramp shape is a confirmed dead end for structural rewrite (quintic calibrated for stability); do NOT re-attempt ramp-shape changes.
29d2df10	0.605639	0.634154	0.095049	0.700601	0.575486	0.749111	0.511416	branch	BRANCH OPEN (prior-trade-MAE attenuator). Exp4 architectural indep: NEW cross-trade data dep -- entry sizing reads MOST RECENTLY CLOSED trade max adverse excursion (cached at exit), distinct from _last_exit_pnl (prior PnL OUTCOME). Deep prior |MAE| (chopped-around prior trade) -> symbol noisy local state -> next entry lower quality -> smaller first-bar (max 0.18 shrink, deep-sat /0.5*|stop|, shrink-only, first-bar only). MEASURED vs cabfb6f1 0.605307: composite +0.000332 (0.605639 SUB-NOISE <0.003), mean +0.000406. PER-REGIME: bull +0.001553 (0.699048->0.700601 IMPROVED), rally +0.000070 (~flat), crash BYTE-IDENTICAL 0.575486, sideways BYTE-IDENTICAL 0.749111. All stab 1.0, all MaxDD<10pct. No regime regressed. FIRST positive signal this session (after 3 arch discards all walled). Branch-eligible: bull improved + fundamentally new mechanism. JUSTIFICATION: (1) new cross-trade MAE dep shrinks re-entries into choppy symbol states; (2) NO regime regressed (bull up, 3 inert -- pattern consistent with real-but-small mechanism not scattered noise); (3) hypothesis: mechanism real but under-powered (max 0.18, /0.5 sat near-inert) -> amplify (larger max, less-sat gate) to push bull past +0.003 composite keep threshold while monitoring crash/sideways byte-identical + rally flat. Branch step1 = this commit (kept in place).
9cf2835b	0.605819	0.634370	0.095172	0.701411	0.575486	0.749111	0.511473	branch	branch step2: amplify prior-MAE atten (max 0.18->0.26, sat 0.5->0.35). MEASURED vs cabfb6f1 0.605307: composite +0.000512 (0.605819, sub-noise but improved over step1 +0.000332), mean +0.000622. raw_composite delta vs step1 = +0.000180 (PROGRESS). PER-REGIME: bull +0.002363 (0.699048->0.701411, +0.000810 vs step1 -- still rising), rally +0.000127 (flat-positive), crash BYTE-IDENTICAL, sideways BYTE-IDENTICAL. All stab 1.0, all MaxDD<10pct. Mechanism monotonic (amplify -> bull up, others inert/flat). bull gain per step diminishing (+0.0015 -> +0.0008). Continue amplifying; monitor for alpha-trade-wall on rally.
aae9796b	0.606009	0.634598	0.095298	0.702252	0.575486	0.749111	0.511544	branch	branch step3: amplify prior-MAE atten (max 0.26->0.34, sat 0.35->0.25). MEASURED vs cabfb6f1 0.605307: composite +0.000702 (0.606009, +0.000190 vs step2 PROGRESS), mean +0.000850. PER-REGIME: bull +0.003204 (0.699048->0.702252, +0.000841 vs step2 -- still rising linearly), rally +0.000198 (flat-pos), crash BYTE-IDENTICAL, sideways BYTE-IDENTICAL. All stab 1.0, all MaxDD<10pct. Mechanism remarkably clean: bull rises, crash/sideways untouched (gate genuinely does not fire there -- no deep-MAE prior trades), rally flat (no alpha-trade wall hit). Gains diminishing per step (+0.0008 bull/step). Composite +0.0007 still far from +0.003 keep. Push harder to find the wall or confirm headroom.
219bd59f	0.606255	0.634894	0.095462	0.703342	0.575486	0.749111	0.511637	branch	branch step4: push prior-MAE atten (max 0.34->0.44, sat 0.25->0.18). MEASURED vs cabfb6f1 0.605307: composite +0.000948 (0.606255, +0.000246 vs step3 PROGRESS), mean +0.001146. PER-REGIME: bull +0.004294 (0.699048->0.703342, +0.001090 vs step3 -- ACCELERATING, no wall), rally +0.000291 (flat-pos), crash BYTE-IDENTICAL, sideways BYTE-IDENTICAL. All stab 1.0. std rising 0.094802->0.095462 (bull pulling ahead -> consistency penalty partially offsets mean gain). KEY REALIZATION: single-regime bull amplification CANNOT clear +0.003 composite -- std drag caps it (est. ceiling ~+0.0017 if bull reaches +0.009 alone). Need a SECOND regime to improve (preferably rally=lowest, raising it lowers std = doubly valuable). prior-MAE gate fires only after deep-MAE prior trades (bull produces these; crash/sideways do not -> byte-identical). rally flat-pos (+0.0003) suggests gate fires slightly there. Pivot: lower saturation to fire on shallower prior MAE -> more regimes affected.
c0abadd0	0.606326	0.634975	0.095498	0.703622	0.575486	0.749111	0.511682	branch	branch step5: lower prior-MAE sat (0.18->0.10). MEASURED vs cabfb6f1 0.605307: composite +0.001019 (0.606326, +0.000071 vs step4 -- near-stagnation), mean +0.001227. PER-REGIME: bull +0.004574 (+0.000280 vs step4 -- gain collapsed from +0.00109 to +0.00028), rally +0.000336 (flat), crash BYTE-IDENTICAL, sideways BYTE-IDENTICAL. Shallow-MAE gate did NOT unlock crash/sideways (their prior trades structurally ~0 MAE -- exit too cleanly). Mechanism is bull-ONLY and SATURATING (deep-MAE prior trades are a finite set; once fully shrunk, more magnitude does nothing). raw_composite delta +0.000071 (barely progress). Structurally capped below +0.003 keep (bull-only + std-drag + saturation). Near-stagnation step #1.
8f9e0ee2	0.606708	0.635436	0.095763	0.705328	0.575486	0.749111	0.511820	branch	branch step6: max prior-MAE atten (0.44->0.60, sat 0.10->0.08). MEASURED vs cabfb6f1 0.605307: composite +0.001401 (0.606708, +0.000382 vs step5 -- progress RESUMED, bigger jump), mean +0.001688. PER-REGIME: bull +0.006280 (0.699048->0.705328, +0.001706 vs step5 -- jumped again, NOT saturating), rally +0.000474 (flat-pos), crash BYTE-IDENTICAL, sideways BYTE-IDENTICAL. All stab 1.0. Lowering sat to 0.08 + bigger max re-engaged the mechanism. Headroom remains. std 0.095763 rising (bull pulling ahead). To reach +0.003 composite need ~+0.010 more bull (std-drag caps single-regime). Continue pushing max.
5c86a12a	0.607177	0.636005	0.096092	0.707425	0.575486	0.749111	0.511996	branch	branch step7: max prior-MAE atten (0.60->0.80, sat 0.08->0.06). MEASURED vs cabfb6f1 0.605307: composite +0.001870 (0.607177, +0.000469 vs step6 PROGRESS steady), mean +0.002257. PER-REGIME: bull +0.008377 (0.699048->0.707425, +0.002097 vs step6 -- ~+0.002/step linear), rally +0.000650 (flat-pos, +0.000176), crash BYTE-IDENTICAL, sideways BYTE-IDENTICAL. All stab 1.0. No alpha-trade wall (rally not regressing). composite +0.0019, need +0.00113 more for keep (~2-3 steps at current rate). bull would reach ~0.712.
f970b58f	0.231730	0.348310	0.388602	0.346268	0.575486	0.749111	-0.277623	branch	branch step8: max prior-MAE atten (0.80->1.00, sat 0.06->0.05) -- CATASTROPHIC WALL. MEASURED vs cabfb6f1 0.605307: composite -0.373577 (0.231730), mean -0.285438. PER-REGIME: bull COLLAPSED -0.352780 (0.707->0.346, MaxDD 0.896->0.623), rally NEGATIVE -0.788969 (0.512->-0.278, MaxDD 1.563->2.076), crash BYTE-IDENTICAL, sideways BYTE-IDENTICAL. Over-aggressive shrink (max 1.00 = full shrink on deep-MAE priors, sat 0.05 = fires on shallow MAE) hit the ALPHA-TRADE WALL: shrank too many entries including trend-resumption winners -> bull collapsed + rally went negative + MaxDD rose. Mechanism works only in NARROW range (max ~0.60-0.80, sat ~0.06-0.08); breaks catastrophically beyond. Stagnation/wall step #1. Reverting to step7 params (best, composite +0.00187).
c31423a9	0.607239	0.636063	0.096078	0.708032	0.575486	0.748710	0.512024	branch	branch step9: add prior-trade-GIVEBACK attenuator (max 0.30, sat 0.4*|stop|) atop step7 MAE params. MEASURED vs cabfb6f1 0.605307: composite +0.001932 (0.607239, +0.000062 vs step7 -- barely progress), mean +0.002315. PER-REGIME: bull +0.008984 (+0.000607 vs step7 slight bump), rally +0.000678 (+0.000028 vs step7 barely moved), sideways -0.000401 (REGRESSED -- giveback gate fires in sideways: sideways trades peak-then-fade -> high giveback -> shrinks next sideways entry -> removes sideways alpha), crash BYTE-IDENTICAL. Giveback complement did NOT unlock rally (fires sideways harmfully more than rally -- prior-trade giveback does not distinguish rally bad re-entries from sideways normal mean-reversion). Branch plateauing: step7 +0.001870 (best clean), step8 wall, step9 +0.001932 (giveback barely helps + regresses sideways). Mechanism fundamentally capped ~+0.0019 composite (bull-only + std-drag + giveback fails to unlock 2nd regime). Below +0.003 keep. Near-stagnation.
-	-	-	-	-	-	-	-	discard	BRANCH SUMMARY (prior-trade-MAE attenuator): REVERTED. Opened after Exp4 showed bull +0.001553 (only positive signal after 3 arch discards). 9 branch steps. The prior-trade-MAE attenuator (NEW cross-trade data dep: entry sizing reads most-recently-closed trade max-adverse-excursion, cached at exit; deep prior |MAE| = choppy symbol state = lower-quality next entry = smaller first-bar) is a REAL bull-improving mechanism: 7 monotonic amplification steps pushed bull +0.0084 (0.699->0.707) at the sweet spot (max 0.80, sat 0.06*|stop|), crash/sideways BYTE-IDENTICAL throughout (structurally MAE-free -- their trades exit too cleanly via stop/slope to produce deep prior MAE), rally flat-positive (+0.0007, no alpha-trade wall in range). BUT structurally CANNOT reach +0.003 keep: (1) bull-ONLY (crash/sideways byte-identical by construction), (2) std-drag caps single-regime gain (bull pulling ahead raises std 0.0948->0.0961, partially offsetting mean), (3) catastrophic wall beyond max~0.80/sat~0.06 (step8 max 1.00/sat 0.05 hit alpha-trade wall: bull collapsed -0.35, rally NEGATIVE -0.79, MaxDD rose -- over-shrinkage of trend-resumption winners). Step9 prior-trade-GIVEBACK complement (distinct prior signal: peak-to-exit fade) FAILED to unlock a 2nd regime -- fires harmfully in sideways (sideways trades peak-then-fade = high giveback -> shrinks sideways alpha, -0.0004) more than rally (+0.00003); prior-trade giveback does not distinguish rally bad re-entries from sideways normal mean-reversion. Best state composite +0.00193 (sub-noise, below +0.003 keep threshold). CROSS-SESSION CONCLUSIONS: (a) prior-trade-MAE is a real but sub-keep bull-only lever, std-drag-capped -- do NOT re-amplify solo (ceiling ~+0.0019); (b) prior-trade-GIVEBACK is NOT a rally-unlocking signal (sideways-harmful); (c) the bull-correction chop that prior-MAE shrinks is a genuine edge but too small/single-regime to clear keep under v2.1 +0.003 floor. Reverted to cabfb6f1. Session ends (branch concluded).
2a645bd9	0.605307	0.633748	0.094802	0.699048	0.575486	0.749111	0.511346	session-summary	SESSION (v2.1 baseline cabfb6f1 0.605307): 0 keeps + 3 architectural discards (Exp1/Exp2/Exp3) + 1 exploration branch (prior-trade-MAE attenuator, 9 steps, REVERTED). Baseline UNCHANGED cabfb6f1 0.605307 [bull 0.699048 Sh1.864, crash 0.575486 Sh1.264, sideways 0.749111 Sh2.025, rally 0.511346 Sh1.300 MaxDD1.57; all stab 1.0, all flip 1.0, all MaxDD<10pct]. THEME: with all stability factors 1.0 (raw==score, Sharpe-dominated per session 920), probed genuinely-novel architectural mechanisms then branched on the one positive signal. INDEPENDENT DISCARDS: (1) Exp1 CROSS-SECTIONAL RELATIVE-STRENGTH size reallocation (NEW cross-symbol RANKING dep, own ret_long vs peer mean -- leader boost + laggard shrink): rally -0.0023 (alpha-trade wall -- laggard trend longs are alpha too), bull -0.0002, crash/sideways ~byte-identical. (2) Exp2 SCALE-IN-CLEARED gate on take-profit harvest (bars_held dep on harvest timing): bull -0.0033 (early-harvest is load-bearing bull correction protection -- bull-correction wall), crash/sideways/rally BYTE-IDENTICAL. (3) Exp3 TREND-CONDITIONED strong-sum ramp EXPONENT (voter-aggregation function form rewrite, cubic-chop/septic-trend renormalized): CATASTROPHIC -0.083, FIRST stability penalties this session (sideways 1.0->0.807, rally 1.0->0.896) -- quintic ramp SHAPE is load-bearing for noise-robustness (steep quintic near-zeroes mid-conviction voters = the noise-sensitive ones); any softer ramp re-introduces mid-conviction voter noise. BRANCH (prior-trade-MAE attenuator, opened from Exp4 positive signal): NEW cross-trade data dep (entry sizing reads most-recently-closed trade MAE cached at exit). Real bull-improving mechanism (7 monotonic steps, bull +0.0084 at sweet spot max0.80/sat0.06), crash/sideways byte-identical throughout (structurally MAE-free), rally flat-pos. BUT capped +0.0019 composite (sub-noise <0.003 keep): bull-ONLY + std-drag + catastrophic wall beyond max~0.80 (step8 max1.00 hit alpha-trade wall, rally -0.79 NEGATIVE). Step9 prior-trade-GIVEBACK complement failed to unlock rally (sideways-harmful). CROSS-SESSION CONCLUSIONS: (a) voter-aggregation ramp SHAPE is a confirmed dead end (quintic load-bearing for stability); (b) prior-trade-MAE is real but sub-keep bull-only, std-drag-capped -- do NOT re-amplify solo; (c) prior-trade-GIVEBACK is sideways-harmful not rally-targeting; (d) alpha-trade wall now confirmed to extend to RS-ranking laggard shrink AND harvest-delay (let-clean-runners-run); (e) bull-correction wall confirmed to extend to harvest-timing and prior-MAE over-amplification. Baseline cabfb6f1 0.605307 unchanged. Session ends (branch reverted).
