commit	score	mean_score	std_score	bull_2021	crash_bear	sideways	rally_2024	status	description
9efc350-session-summary	-	-	-	-	-	-	-	session-summary	session: 5 independent experiments, 1 KEEP (exp1) + 4 discards. Keep: trend-magnitude-gated conviction-acceleration on scale-in pace (9efc350, architectural new cross-timescale data dep gating fff46ce live-conviction accelerator by (1 - tanh(|ret_long|/0.05))) — composite +0.005407 (1.012924->1.018331), mean +0.0158 (0.9100->0.9258), std +0.019 (0.148->0.167 widened). Per-regime: BULL RECOVERED +0.056 (1.145->1.201, fixes fff46ce regression as predicted), crash +0.014, sideways -0.017, rally +0.008. Mechanism: in strong trends the accelerator mutes (trend itself supplies signal continuity, no need for live-margin commit acceleration); in chop/transitions still active. Discards: (1) PnL-conditioned scale-in pace modulator ±0.5 bars (cross-component data dep) — composite -0.012, double-counted with conv-accel (voter margin sustains when price moves with us, so pos_pnl pace adds the same signal). Sideways +0.007 sole gain, bull/crash/rally all worse. (2) RSI-price divergence exit pressure (new control flow, 7th soft source, 12-bar) — composite -0.445 CATASTROPHIC: rally 0.000 (hard cutoff DD>10%). Div activation gate too permissive ("price >= 0.999*12bar_max"), any rally pullback toward recent high satisfies it; div pressure fires on legitimate dwell instead of momentum-decay regime. (3) HOW (hour-of-week 168h single-cycle) replacing TOD*DOW two-product (architectural simplification, -3 lines) — composite -0.0015, mean essentially flat (0.92580->0.92579), per-regime: bull/rally +0.001-0.004, crash/sideways -0.002-0.003. Two-product captures slightly more variance than single-cycle even though signal is fundamentally the same weekly seasonal. (4) slope-acceleration entry size modulator (NEW STATISTIC slope-of-slope, side-aware ±15%, 16-bar slope-now vs 16-bar-ending-4-bars-ago) — composite -0.0064 mean -0.0015, all regimes mild regressions (bull -0.002, crash -0.003, rally -0.001, sideways +0.001 only). Second-derivative redundant with existing first-derivative slope-consensus_atten + ret_long primitives. CROSS-EXPERIMENT INSIGHTS: (a) The fff46ce + 9efc350 paired keeps show a clear pattern — adding a powerful new mechanism (live-conviction accelerator) creates a side-effect regression (bull -0.076), then GATING that mechanism by an orthogonal dimension (trend-magnitude) recovers the regression while preserving the gains. This GATE-A-NEW-MECHANISM-BY-TREND-MAGNITUDE pattern is a productive direction at the current baseline. (b) Scale-in pace is now a 3-input function: rsi_trend_str + live-conviction-with-trend-mute. Adding pos_pnl as a 4th input (exp2) over-determined the pace; future scale-in modulators should target the existing 3 inputs not add a 4th. (c) Adding 7th-8th exit pressure terms (exp3 RSI-div) catastrophically hard-cutoff when activation gate is loose — multi-bar fusion sums to >1.0 on any spurious trigger when 6 other pressures are already moderately active. Future exit-pressure additions need MUCH stricter activation gates (deeper saturation requirement, multi-bar confirmation) or to REPLACE existing terms rather than add. (d) Simplifications of mature timestamp cycles (TOD*DOW->HOW) preserve mean but lose tiny variance (~0.001 composite). Marginal at this maturity. (e) Slope-acceleration as an entry size modulator with ±15% range is dead-code-adjacent — too transient and noisy, redundant with existing first-derivative primitives. Future direction: continue probing the GATE-A-NEW-MECHANISM-BY-TREND-MAGNITUDE pattern. Candidate gates: trend-magnitude on de-risk floor, on opp-gate graduation, on persistence_mult amplitude. Avoid: scale-in pace 4th input, 7th+ exit pressure terms without stricter activation gates, slope-acceleration as size modulator. NEW BASELINE: 9efc350 1.018331.
-	0.343	0.384	0.429	0.16	0.27	1.11	0.00	discard	live-conviction exit-threshold bonus orthogonal to scale-in lifecycle (architectural new cross-bar data dep, max-blend with scale-in bonus) — composite -0.675 CATASTROPHIC vs 9efc350 1.018331->0.342938. Bull -1.04 (1.20->0.16), crash -0.49 (0.75->0.27), sideways +0.23 (0.88->1.11 BIG GAIN), rally -0.87 (0.87->0.00 HARD CUTOFF MaxDD>4%). Mechanism: live-conviction bonus raised exit threshold up to +0.15 whenever winning + voter margin>0.30. In trend regimes voter margin stays high during entire trend duration — bonus fires continuously, blocks giveback exits, MaxDD explodes (rally 3.41->4.34, crash 2.94->4.89, bull 0.82->4.81 6x worse). Tradeoff: sideways +0.23 (chop low conviction = no bonus = unchanged exits, but turnover may have improved). Net catastrophic. The +0.15 max-blend with scale-in bonus was too aggressive — sustained voter agreement is NOT same as scale-in window (3 bars); cross-trend protection structurally over-holds winners. Reverting.
fb49c7b	1.019	0.928	0.166	1.20	0.75	0.88	0.88	keep	trend-magnitude amp on opp_bias exit-pressure (architectural new factor at bilateral voter_bias fusion, _opp_trend_amp = 0.5 + 0.5*tanh(|ret_long|/0.04)) — composite +0.000971 vs 9efc350 1.018331->1.019302, mean +0.001703 (0.925797->0.927500), std NARROWED -0.000535 (0.166932->0.166397). Per-regime: bull IDENTICAL (1.201365), crash +0.00005 (0.751509->0.751560), sideways IDENTICAL (0.878520), rally +0.0068 (0.871795->0.878557 main mover). All MaxDDs unchanged. Mechanism: opp_bias contribution in rally regime — rally has strong trend backing AND opp-voter spikes during pullbacks are genuine reversal signal; 0.5x amp in chop (sideways unchanged because formula only mutes when opp_bias would fire, and chop opp-spikes were noise-only). Bull/crash unchanged because their opp-voter activations already paired with trend backing (multiplied by 1.0). Net effect: rally pullback opp-voter spikes get full activation as designed, while chop noise-only opp activations get muted — selective gain isolated to rally without harming other regimes. Confirms session prior GATE-A-MECHANISM-BY-TREND-MAGNITUDE pattern productive at this baseline. NEW BASELINE.
fb49c7b-session-summary	-	-	-	-	-	-	-	session-summary	session: 5 independent experiments, 1 KEEP (exp5) + 4 architectural discards. Keep: trend-magnitude amp on opp_bias exit-pressure (fb49c7b, architectural new factor at bilateral voter_bias fusion, _opp_trend_amp = 0.5 + 0.5*tanh(|ret_long|/0.04)) — composite +0.000971 (1.018331->1.019302), mean +0.001703 (0.925797->0.927500), std NARROWED -0.000535. Per-regime: rally +0.0068 (sole mover, 0.8718->0.8786), bull/crash/sideways IDENTICAL or +0.00005. Mechanism: chop-only opp-voter spikes lacking trend backing now get 0.5x weight at fusion (noise-mute); rally pullback opp-voter spikes (genuine reversal candidates) keep full 1.0x activation. Selective rally gain isolated without harming other regimes. Discards: (1) trend-magnitude gate on _de_floor loser-tightening (architectural cross-timescale data dep) — composite -0.001, all 4 regimes within 0.00006 (DEAD-CODE-ADJACENT: _de_floor branch reached only when (losing position) ∩ (mid-range exit pressure) ∩ (strong trend) — empty intersection in current regimes; pure LOC overhead). (2) trend-magnitude gate on opp-gate graduated-exit floor (architectural cross-timescale dep) — composite -0.002, all 4 regimes IDENTICAL (DEAD-CODE: opp_gate firing on winning trend-aligned positions essentially never happens since they exit via giveback/time/slope before opp-voters reach FLIP_MIN_VOTES). (3) trend-magnitude muted persistence deviation around population mean (architectural new control flow at voter aggregation) — composite -0.016, sideways -0.080 MAJOR (chop bursts of |ret_long| spikes briefly mute deviation right when chop needs full per-voter differentiation), crash +0.020 + rally +0.016 (trend-side voter saturation noise reduced, gains real but sideways cost dwarfs). (4) live-conviction exit-threshold bonus (architectural new cross-bar data dep, max-blend with scale-in bonus) — composite -0.675 CATASTROPHIC, rally 0.000 (hard cutoff MaxDD>4%), bull -1.04, crash -0.49, sideways +0.23. Voter margin>0.30 stays high during entire trends, +0.15 thresh bonus blocks giveback exits, MaxDD explodes 6x in bull. Sideways gain alone real (chop low conviction = no bonus). CROSS-EXPERIMENT INSIGHTS: (a) Three of four discards aimed at GATE-A-MECHANISM-BY-TREND-MAGNITUDE pattern were dead-code: gates protected ALREADY-RARE intersections (de-risk path requires losing+mid-pressure; opp-gate on winning trend-aligned never fires; _de_floor change firing zone empty). The pattern is correct in principle but the targets were saturated subsystems. (b) Exp5 succeeded because it gated a mechanism that DID fire frequently (opp_bias is a primary contributor to _exit_pressure across all regimes) — gating something already-active produced selective improvement. The lesson: GATE-A-MECHANISM pattern works when the mechanism it gates is non-saturated; gating dead-code-adjacent paths produces zero signal. (c) Exp4 catastrophic failure (rally hard-cutoff) reaffirms exit-threshold bonus stacking is dangerous — sustained voter conviction is NOT same as scale-in window (3 bars); cross-trend protection structurally over-holds winners into peak reversion. (d) Persistence multiplier (exp3) is genuinely fragile — modifications even with same-algebra in chop fail because chop has |ret_long| bursts that briefly activate the trend-gating path; downstream side effects accumulate. Future direction: continue probing GATE-A-MECHANISM-BY-TREND-MAGNITUDE on FREQUENTLY-FIRING mechanisms — _voter_bias own-side contribution (currently always-on with _chop_amp), _giveback_ratio amplification (currently always-on with _pm_trend_atten existing), _ar_pressure activation. Avoid: gating dead-code-adjacent paths (_de_floor, opp-gate graduated, persistence_mult deviation), exit-threshold bonuses orthogonal to lifecycle. NEW BASELINE: fb49c7b 1.019302.
-	1.006	0.914	0.148	1.15	0.74	0.88	0.88	discard	pnl-confirmed scale-in pace asymmetry gated on trend-aligned positions (architectural multi-variable, ±0.6 bars via tanh(pos_pnl/STOP_LOSS) * trend_align_si). Composite -0.013 vs fb49c7b 1.019303->1.005873, mean -0.014 (0.928->0.914). Per-regime: bull -0.051 (1.201->1.151 main regression), crash -0.009 (0.752->0.742), sideways +0.005 (0.879->0.883), rally NEUTRAL +0.001 (0.879->0.879 — trend-align gate successfully eliminated rally counter-trend regression from prior attempt). Mechanism failure: bull trend-aligned LONG positions in early winning bars (pos_pnl > 0, ret_long > 0) get accelerated scale-in via _pnl_pace > 0; the early winning bars in bull are also the most volatile (early-trend pullback noise), and front-loading position size during this window widens DD. The trend-align-gating successfully isolated rally effect (counter-trend exclusion) but exposed that BULL also gets hurt by acceleration during the very window that the existing trend-magnitude pace was designed to slow down. Same load-bearing pattern as fff46ce keep mechanism — trend-magnitude pace slowdown for trends is intentional, pnl-confirmed acceleration over-rides this protection. Cannot fix by gating on trend-alignment alone; would require additional gating on bars_held or vol_ratio to avoid early-trend-pullback acceleration. Architectural blind alley: pnl-confirmed scale-in conflicts with existing trend-magnitude protection mechanism. Reverting.
95c0e5e	1.019	0.928	0.166	1.20	0.75	0.88	0.88	keep	semi-annual cycle (~180d cos peak day 90 mid-half-year) compounded into TOD*DOW*MOM*QUARTER*SEMI activity (architectural NEW DATA SOURCE 5th calendar cycle, +0 LOC fused into single _activity expression, scaled 0.85-1.0 smallest amplitude). Composite +0.000033 vs fb49c7b 1.019303->1.019336, mean +0.000023 (0.927500->0.927523), std unchanged 0.166. Per-regime: bull IDENTICAL 1.201365 (semi-annual phase aligned with bull period TOD-saturation), crash +0.00008 (0.751560->0.751640), sideways +0.000006 (0.878520->0.878526), rally +0.000005 (0.878557->0.878562). All MaxDDs <4% (bull 0.82, crash 2.94, sideways 0.43, rally 3.41). Mechanism: half-year market rhythm orthogonal to TOD/DOW/MOM/QUARTER frequencies. 5th timestamp-derived keep this branch. Smallest gain magnitude as predicted by per-cycle decay pattern (TOD +0.0001 -> DOW +0.0006 -> MOM +0.0003 -> QUARTER +0.0001 -> SEMI +0.00003). Crash main mover (small but consistent). NEW BASELINE.
0f4f890	1.019	0.928	0.166	1.20	0.75	0.88	0.88	keep	annual cycle (~365d cos peak day 182 mid-year) compounded into TOD*DOW*MOM*QUARTER*SEMI*YEAR activity (architectural NEW DATA SOURCE 6th calendar cycle, +0 LOC, scaled 0.9-1.0 smallest amplitude). Composite +0.000064 vs 95c0e5e 1.019336->1.019400, mean +0.000085 (0.927523->0.927608), std unchanged 0.166. Per-regime: bull +0.000160 (1.201365->1.201525), crash +0.000060 (0.751640->0.751699), sideways +0.000135 (0.878526->0.878661), rally -0.000015 (0.878562->0.878547 marginal regression). 3/4 regimes improved. All MaxDDs <4%. Mechanism: yearly market rhythm orthogonal to all prior cycles (24h, 7d, 30d, 91d, 180d). 6th timestamp-derived keep this branch. Despite prior session prediction of <0.0001, gain was +0.000064 — slightly above expectation. Cycle-stacking pattern remains productive at this baseline maturity. NEW BASELINE.
0f4f890-session-summary	-	-	-	-	-	-	-	session-summary	session: 4 independent experiments, 2 KEEPS (exp3+exp4) + 2 architectural discards. Keep1: semi-annual cycle ~180d (95c0e5e, +0.000033 composite, 4-regime micro-positive crash main mover). Keep2: annual cycle ~365d (0f4f890, +0.000064 composite, 3/4 regimes positive sideways main mover +0.000135, rally marginal -0.000015). SESSION NET: composite +0.000097 (fb49c7b 1.019303->0f4f890 1.019400), mean +0.000108 (0.927500->0.927608). Discards: (1) vol-trend (recent 30-bar vs earlier 30-bar realized vol slope) as scale-in pace modulator (architectural NEW DATA SOURCE second-derivative of price, ±0.5 bars via tanh) — composite -0.0104, bull -0.019 + crash -0.011 + rally -0.015 (3/4 regimes regressed) sideways +0.007 sole gain. Mechanism wrong-direction for trends: pullback bars have transient vol-trend positive (vol rising during pullback) which slows scale-in just when fast commitment is needed for trend resumption capture. Crash also regressed despite hypothesis match. Sideways gain confirms signal direction is right for chop only (vol stabilizing in sideways = faster commit captures small reversion). Same regime-asymmetry as prior conviction-trajectory entry gates (chop benefits, trends regress). (2) pnl-confirmed scale-in pace asymmetry gated on trend-aligned positions (architectural multi-variable, new cross-component dep) — composite -0.013, bull -0.051 sole major regression (1.201->1.151), rally NEUTRAL (trend-align gate successfully eliminated rally counter-trend regression from prior attempt). Mechanism failure: bull trend-aligned LONG positions in early winning bars (pos_pnl>0, ret_long>0) get accelerated scale-in via _pnl_pace>0; early winning bars in bull are also most volatile (pullback noise), front-loading position size widens DD. Trend-align-gating isolated rally effect but exposed BULL gets hurt by same acceleration. Trend-magnitude pace slowdown for trends is load-bearing for fff46ce keep mechanism. Cross-experiment insights: (a) Timestamp-derived continuous cyclic features REMAIN the SOLE reliable axis at this baseline maturity — 6 timestamp-derived keeps in a row (TOD 22b425a, DOW 2bc413c, MOM bbccdb1, QUARTER e55e430, SEMI 95c0e5e, YEAR 0f4f890). Composite gain per cycle decreased monotonically: TOD +0.0001 -> DOW +0.0006 -> MOM +0.0003 -> QUARTER +0.0001 -> SEMI +0.00003 -> YEAR +0.00006. Diminishing returns confirmed but still positive. Further cycle additions (e.g. bi-annual 730d, 5-year 1825d) likely yield <+0.00001 — likely fail LOC offset since data has only ~1.5 cycles of 365d. (b) Scale-in pace modulation continues to be a structurally rigid subsystem — vol-trend (exp1), pnl-confirmed gated by trend-align (exp2) both regress; the trend-magnitude pace + conv-accel formula is load-bearing in trends. Prior keep mechanisms (fff46ce live-conviction, 9efc350 trend-magnitude-gated conv-accel) already saturated this subsystem. Any new pace input that fires during trend-pullback bars confounds with bull/rally pullback noise. (c) Second-derivative price signals (vol-of-vol direction) carry sideways alpha but trend regression — same pattern as 4d78fda slope-acceleration earlier; trend regimes are too noisy at the bar level to use derivative signals for adaptive sizing/pacing. Future direction: (i) calendar-cycle stacking approaching saturation at +0.00003-0.00006 per cycle, may need to look beyond timestamp; (ii) avoid scale-in pace modifications (saturated subsystem); (iii) vol-trajectory signals at exit (potential _w_ve generalization to longer timescale) untried; (iv) MAE-depth gate on opp-side voter_bias untried; (v) hold-duration-amplified _ar_pressure on early recovery untried; (vi) consider strategic SIMPLIFICATIONS — strategy.py 1029 LOC with many tactical patches accumulated. NEW BASELINE: 0f4f890 1.019400.
-	0.977	0.896	0.184	1.20	0.75	0.88	0.75	discard	MAE-depth gate on opp-side voter_bias (architectural new cross-component dep, _mae_depth_amp 0.6-1.0 multiplied into opp_atten*opp_trend_amp). Composite -0.042 vs 0f4f890 1.019->0.977. Mean -0.031 (0.928->0.896). Per-regime: bull IDENTICAL 1.20, crash IDENTICAL 0.75, sideways IDENTICAL 0.879, RALLY -0.126 (0.879->0.753 catastrophic). Mechanism failure: rally bear-short positions held during pullbacks have CLEAN MAE (winning, MAE near 0) → 0.6x opp_bias suppression mutes legitimate bull-voter reversal spikes that signal rally continuation; positions over-hold past peaks. The MAE-depth axis is the WRONG direction — clean-MAE rally positions are MORE vulnerable to reversal (rally bears are counter-trend), not less. Discard.
-	1.009	0.927	0.167	1.20	0.75	0.88	0.88	discard	wick-body ratio entry size modulator (architectural NEW DATA SOURCE 6-bar mean upper/lower wick fractions, attenuator [0.88, 1.00]). Composite -0.010 vs 0f4f890 1.019->1.009. Mean essentially flat -0.0001 (0.9276->0.9275). Per-regime: bull +0.0004, crash IDENTICAL, sideways +0.0003, rally -0.001. All within noise. LOC overhead (+19 lines) overwhelmed signal. Wick signal real but too weak — 6-bar mean dilutes per-bar rejection patterns; symmetric application across bull/bear sides cancels in chop. Discard.
-	1.020	0.926	0.164	1.19	0.75	0.88	0.88	discard	simplify by removing _outcome_size_mult redundant loss attenuator (architectural code-structure removal, -7 LOC). Composite +0.000395 vs 0f4f890 1.0194->1.0198 (LOC bonus + std narrow), but MEAN -0.002 (0.928->0.926) FAILS keep criteria. Per-regime: bull -0.0075 (1.2015->1.1940 sole regression), crash -0.0006, sideways -0.0001, rally -0.0000. Std narrowed (0.166->0.164). Mechanism: 8-bar additional loss-only attenuator IS load-bearing for bull early-trend protection — removing allows larger first-bar size after recent losses during bull volatile early-trend bars, amplifying DD. _cooldown_factor cd_window stretch alone insufficient as the second timescale (8-bar) was orthogonal cover to the cooldown ramp window. Counter-evidence to redundancy hypothesis: two timescales of loss attenuation are both load-bearing. Discard despite composite gain — mean criterion fails.
-	1.018	0.928	0.166	1.20	0.75	0.88	0.88	discard	hold-duration amplification on _ar_pressure recovery cap (architectural multi-variable, _ar_dur_amp = 1.0+0.5*tanh((bars_held-6)/4)). Composite -0.001 vs 0f4f890 1.019->1.018. Mean IDENTICAL 0.928. Per-regime: bull IDENTICAL, crash IDENTICAL (0.7517 unchanged), sideways IDENTICAL, rally -0.000003. DEAD-CODE-ADJACENT: _ar_pressure activation requires (MAE<-0.5*stop) AND (pos_pnl<0) AND (recovery_frac>0.5) — by bar 6+, positions in this state have already exited via slope/pp/sl pressure. Empty intersection across regimes. Pure LOC overhead. Discard.
-	0.345	0.313	0.283	0.23	0.25	0.77	0.00	discard	trend-magnitude mute on profit-side _w_time amp (architectural multi-variable). Composite -0.674 CATASTROPHIC vs 0f4f890 1.019->0.345. Mean -0.615. Per-regime: bull -0.97 (1.20->0.23), crash -0.50 (0.75->0.25), RALLY 0.000 (negative Sharpe), sideways -0.106. All MaxDDs 4-5% range. Mechanism failure: profit-side _w_time amp is critical time-exit safety in trends — winning positions over-hold massively when amp muted, exiting after major reversal instead of locking gains. Symmetric pattern to fb49c7b does NOT generalize from opp_bias to time-pressure-weight: opp_bias is exit-direction-specific (own vs opp), time-pressure is structural (clock-based). Trend-mute on time-amp removes the only profit-locking mechanism in time-pressure path. Discard.
