commit	score	mean_score	std_score	bull_2021	crash_bear	sideways	rally_2024	status	description
4d78fda-session-summary	-	-	-	-	-	-	-	session-summary	session: 4 architectural discards + 1 architectural branch KEEP (8 steps). Keep: divergence-conditioned _chop_amp (4d78fda, composite +0.002 0.976->0.978, mean +0.003, sideways +0.018 SOLE major mover, bull IDENTICAL preserving trend protection, crash +0.001 preserved by chop-interlude gate, rally -0.007 mild). Branch evolution: step 1 (initial open unrestricted) catastrophic crash -0.099 + rally -0.044; steps 2-4 progressively narrowed gate to (pure_sideways AND not_counter_trend); steps 5-8 progressively compactified (32 LOC -> 3 LOC) until LOC bonus + mean improvement crossed positive composite. Mechanism: in PURE sideways (|ret_long|<0.015) AND held-position NOT counter-trend, taper _chop_amp toward 1.0 by strong-sum divergence (directional signal hiding in low-trend); trend-interludes + counter-trend holds preserve full _chop_amp_chop=1.7x. Captures previously-noted sideways +0.019 hint from prior remove-_chop_amp discard, but isolated to pure-sideways via narrow gate. Discards: (1) pos_pnl-velocity exit pressure 7th source — CATASTROPHIC composite -0.510, rally crushed 0.86->0.00: 1-bar pnl drop velocity over-fires uniformly in mid-zone where rally counter-trend bears spend most of their hold time. (2) chop-dampened opp-bias addition (chop_amp_opp mirror) — composite -0.001 essentially flat: opp_margin near zero in chop by construction (voters split), so dampening 1.0->0.6 has minimal effect. Dead-code-adjacent. (3) trend-alignment-asymmetric SL band — composite -0.005, all 4 regimes near-identical to baseline: SL rarely binds because pp_pressure/slope_against/opp_gate preempt SL on trend-aligned positions; counter-trend positions exit via opp_gate before reaching SL. Same dead-code-adjacent pattern as prior peak-anchored SL branch. (4) remove _outcome_size_mult post-loss first-bar attenuator — composite -0.0004 essentially flat, mean -0.002 fails strict criterion: bull -0.008 represents lost protection (post-loss bull pullback re-entries took larger size into a fresh pullback bar). _cooldown_factor alone is loss-magnitude-blind (only temporal). CROSS-EXPERIMENT INSIGHTS: (a) Strong-sum divergence is a NEW orthogonal axis to existing voter_bias modulators (trend-magnitude _chop_amp_chop, position-trend-alignment _opp_atten); divergence captures DIRECTIONALITY-EVIDENCE in low-trend backdrop that those modulators miss. (b) _chop_amp asymmetric attempts have a long history (sign-aware, trend-aligned, joint-removal — all failed because chop_amp_chop is bilateral/load-bearing for trend-chop interludes); the divergence-conditioning architectural axis succeeds where all prior decompositions failed because it gates on STRONG-SUM-LEVEL signal, not on TREND-LEVEL signal. (c) Pos_pnl-derivative signals (velocity, acceleration) over-fire in rally counter-trend regime — same failure pattern as multiple prior pos_pnl-state-based exit pressures. (d) Mid-zone exit pressures (between SL and PP territories) compete with existing slope_against/sl_pressure stack and tend to be either dead-code (peak-anchored SL, asymmetric SL) or over-firing (velocity, acceleration). (e) Compactification was load-bearing for this keep — mean +0.003 was real but LOC overhead from initial multi-variable implementation drained composite below threshold; only after 3 compactification steps (32->3 LOC) did the LOC bonus tip composite positive. Future architectural changes targeting std-tightening or sideways-alone improvements should aim for <5 lines net to ensure LOC bonus survives. Baseline advanced from cbf4e8c (0.976) to 4d78fda (0.978, +0.002).
-	0.927	0.844	0.199	1.19	0.72	0.75	0.72	discard	half-life EMA persistence at voter aggregation (architectural function shape change) — composite -0.051 vs 4d78fda 0.978, mean -0.041. Bull IDENTICAL (1.187, persistence weighting mostly aligned in sustained bull). Crash +0.030 (0.69->0.72, half-life recency improves crash bear voter responsiveness as crash dynamics shift quickly). SIDEWAYS -0.058 (0.81->0.75) + RALLY -0.144 (0.85->0.72): half-life recency makes voters more reactive — in sideways and rally regimes, voter signals legitimately oscillate around their thresholds, the uniform window averaged over more bars giving sustained-pattern weight; half-life shifts weight to recent flips which over-represents single-bar noise in chop-heavy regimes (sideways, rally consolidations). Half-life is wrong-directional for chop regimes; the uniform 8-bar window IS the noise-rejection mechanism for sideways/rally. Reverting.
-	0.963	0.880	0.185	1.19	0.69	0.81	0.83	discard	slope-against streak amplifier (architectural new per-symbol state _slope_against_streak + new control flow at exit slope subsystem) — composite -0.015 vs 4d78fda 0.978, mean -0.005. Bull IDENTICAL (1.187, slope-against rare in sustained bull). Crash +0.001 (essentially flat — slope-against streak rare in crash because crash slope is bear-aligned with bear positions). SIDEWAYS flat (0.812 essentially identical — sideways slope-against rarely persists 2+ bars). RALLY -0.020 (0.852->0.832): rally counter-trend bear positions face sustained upward slope (slope-against) during rally upward push — streak amplifier fires REPEATEDLY on these positions, accelerating their exit before pullback recovery. Mechanism wrong-directional for rally: persistent slope-against in rally is the NORMAL counter-trend hold environment, not reversal signal. Single-bar slope-against in chop was already low; streak amplification only matters when slope-against is sustained (= rally counter-trend), where it's NOT signal. Reverting.
-	0.409	0.399	0.350	0.11	0.68	0.81	0.00	discard	trend-aligned own-side voter_bias amplifier (architectural symmetric extension of _opp_atten) — CATASTROPHIC composite -0.570 vs 4d78fda 0.978, mean -0.486. BULL CRUSHED 1.19->0.11 (sharpe 2.40->0.13, MaxDD 0.80->4.39 — 5x), RALLY CRUSHED 0.85->0.00 (sharpe negative -1.05, MaxDD 4.34). Crash flat (-0.01), sideways flat. Mechanism over-suppressed exits in trend-aligned positions — amplified own-side subtraction held bull/rally winning trend positions through ENTIRE drawdowns. The 1.4x own-side amp (max 28% subtraction from exit_pressure) combined with peak_pnl giveback created over-protection: positions hit peak then gave back entire profit + entered drawdown before exit_pressure could overcome the amplified subtraction. Trend-aligned own-side voter_bias is structurally NOT under-protected — _chop_amp + _opp_atten + persistence-weighted strong-sums already provide trend-protection; symmetric own-side amplification creates over-hold catastrophe. Reverting.
-	0.930	0.852	0.212	1.19	0.65	0.69	0.88	discard	portfolio-DD-tightened admission threshold (architectural new cross-component data dep at entry) — composite -0.048 vs 4d78fda 0.978, mean -0.033. Bull IDENTICAL (1.187, no DD activations in bull). RALLY +0.027 (0.852->0.879, sole gain — rally has shallow DDs that don't trigger but high-vol counter-trend bear admissions filtered out by DD-tightening). CRASH -0.043 (0.690->0.648) and SIDEWAYS -0.119 (0.812->0.693): DD-tightening _dd_min_amp fires whenever _port_dd_atten<1.0, which activates much more frequently than expected in sideways (small persistent DDs from chop entries) and crash (correlated DDs). Tightening admission during these conditions blocks LEGITIMATE entries — sideways needs FREQUENT marginal entries to capture small mean-reversion gains; crash needs DEAD-CAT-BOUNCE counter-trend longs. Composes wrong-directionally with existing _port_dd_atten (which already cuts size); double-filtering during DD is over-restrictive. Mechanism direction wrong: DD periods may be the BEST entry opportunities (mean reversion to peak) not WORST. Reverting.
-	0.936	0.853	0.198	1.19	0.69	0.81	0.73	discard	entry-time-frozen _pp_min (architectural new per-symbol state _entry_pp_min at exit subsystem) — composite -0.042 vs 4d78fda 0.978, mean -0.032. Bull near-identical (1.187), crash -0.003 (essentially flat), sideways IDENTICAL (0.812 — sideways pp_min rarely triggers). RALLY -0.124 (0.852->0.728): rally counter-trend bear entries during dwell periods (low vol_ratio at entry) get small frozen pp_min that triggers pp_pressure FAR too early on subsequent peak — these were positions that needed RUNNING profit through later vol expansion not early lockup. Conversely, entries during high-vol rally pullback bars freeze a large pp_min that delays exit on positions that should give back. Vol changes during rally hold time are PART of the rally regime structure, not a noise source — freezing at entry-time disrupts the regime-adaptive sizing. Mechanism direction wrong for rally where adaptive pp_min IS the load-bearing mechanism. Reverting.
4d78fda-session-summary	-	-	-	-	-	-	-	session-summary	session: 5 architectural discards (cap reached, baseline 4d78fda unchanged at 0.978). All 5 architectural. Discards: (1) half-life EMA persistence at voter aggregation — composite -0.051, mean -0.041: half-life recency made voters more reactive; uniform 8-bar window IS the noise-rejection mechanism for sideways/rally where voter signals legitimately oscillate; chop regimes lost large fraction of mean while crash gained +0.030. (2) slope-against streak amplifier (per-symbol _slope_against_streak state) — composite -0.015, rally -0.020: streak only fires when slope-against persists 2+ bars which in rally is the NORMAL counter-trend hold environment (rally upward push), not reversal signal; sideways/bull rare slope-against meant streak rarely fired there. (3) trend-aligned own-side voter_bias amplifier (symmetric extension of _opp_atten) — CATASTROPHIC composite -0.570, bull -1.08 + rally -0.85, MaxDD bull/rally 4-5x baseline: 1.4x own-side subtraction held trend-aligned positions through ENTIRE drawdowns; trend-aligned own-side is structurally NOT under-protected — _chop_amp + _opp_atten + persistence-weighted strong-sums already provide trend-protection. (4) portfolio-DD-tightened admission threshold (new _dd_min_amp at strong_min) — composite -0.048, sideways -0.119 + crash -0.043: DD periods are FREQUENT in sideways/crash; tightening admission during these blocks LEGITIMATE entries (sideways needs marginal mean-reversion entries; crash needs dead-cat-bounce counter-trend longs); composes wrong-directionally with existing _port_dd_atten (already cuts size). (5) entry-time-frozen _pp_min (per-symbol _entry_pp_min state) — composite -0.042, rally -0.124: rally vol-changes during hold are PART of regime structure not noise; small frozen pp_min from low-vol-entry triggers pp_pressure too early on later peaks; large frozen from high-vol-entry delays exit. Adaptive pp_min IS load-bearing for rally. CROSS-EXPERIMENT INSIGHTS: (a) Voter aggregation function shape (half-life vs uniform) trades crash gain (recency = faster crash response) against sideways/rally loss (uniform = noise rejection in chop) — uniform window IS the load-bearing chop noise filter. (b) Per-symbol streak counters at exit slope subsystem only matter when slope-against PERSISTS, which is structurally the counter-trend hold environment in rally — wrong direction for amplification. (c) Symmetric extension of voter_bias modulators is asymmetric in IMPACT — _opp_atten attenuates an existing addition that fires in chop noise (genuine), but symmetric own-side amp compounds an existing subtraction that already fires when conviction strong (over-protection). (d) Portfolio-state attenuators on entry size (_port_dd_atten) are orthogonal but equivalent attenuators on entry threshold over-restrict sideways/crash where DD-during-recovery is the mean-reversion entry opportunity. (e) Entry-time-frozen state for vol-derived parameters (pp_min) breaks rally where vol changes ARE part of regime structure — adaptive parameters are load-bearing. Decision-architecture saturation continues across voter-aggregation function shape (uniform vs half-life), exit-side persistence amplifiers (per-symbol streak counters), bilateral voter_bias modulator extensions (symmetric own-side amp), entry threshold conditioning (DD-tightening overlaps with size attenuation), and entry-time freezing of adaptive parameters (pp_min). Baseline 4d78fda (0.978) unchanged.
-	0.973	0.885	0.184	1.19	0.69	0.81	0.85	discard	two-bar exit confirmation gate (architectural new state _prev_exit_ratio + new control flow at exit decision) — composite -0.005 vs 4d78fda 0.978, mean essentially flat (+0.0001). Bull IDENTICAL (1.187), crash +0.001 (within noise), sideways IDENTICAL (0.812), rally -0.0001 (within noise). Mechanism either rarely fires (most exits already meet 1.3x burst criterion or 2-bar persistence) or fires symmetrically (defers some legitimate exits but also some noise exits). Net mean change negligible; LOC overhead (12 lines) drops composite below baseline. Confirmation gating at exit boundary is dead-code-adjacent in current architecture because soft-pressure stack already ramps smoothly — when _exit_pressure crosses 1.0, it typically blew past 1.3x in the same bar (slope+pp+time stack saturates fast).
-	0.429	0.366	0.242	0.12	0.38	0.22	0.75	discard	voter-6 residualized vs voter-4 (architectural new cross-voter data dep at signal definition) — CATASTROPHIC composite -0.549 vs 4d78fda 0.978, mean -0.519. Bull CRUSHED 1.19->0.12, sideways CRUSHED 0.81->0.22, crash 0.69->0.38, rally 0.85->0.75. The 3.0x projection coefficient was based on rough scale ratio (0.0005/0.00015~3.33) but actual covariance between EMA_slope and linreg_slope is much weaker than implied by scale ratio. Subtracting 3x linreg_slope destroyed most of EMA_slope signal, leaving residual dominated by linreg_slope offset/sign. Voter 6 effectively became a noise-inverted version of voter 4. The decorrelation approach is structurally sound but requires actual covariance estimation, not a hardcoded scale-ratio coefficient.
-	0.891	0.790	0.160	0.99	0.79	0.83	0.54	discard	conviction-trajectory entry gate (architectural new check at entry decision) — composite -0.087 vs 4d78fda 0.978, mean -0.094. RALLY CRUSHED 0.85->0.54 (-0.31, dominant regression — rally counter-trend bear entries have noisy single-bar conviction dips during sustained rally upward push; trajectory gate blocks legitimate sustained-bear entries when bull voters spike up briefly). BULL -0.20 (1.19->0.99): even strong bull conviction has noise-driven single-bar dips where strong-sum decreases 5pct+ from 1 bar to next. CRASH +0.10 (0.69->0.79) and SIDEWAYS +0.02 (small gains): chop entries benefit from trajectory filter as expected. The 5pct slack is too tight in the saturated-tanh regime where small magnitude signal differences create large multiplicative noise. Trajectory gating is wrong-directional for trend regimes where conviction-noise around saturation IS normal regime structure.
-	0.828	0.714	0.129	0.53	0.66	0.81	0.85	discard	high-volume-against exit pressure 8th soft source (architectural new term in fusion sum) — composite -0.151 vs 4d78fda 0.978, mean -0.171. BULL CRUSHED 1.19->0.53 (-0.66, dominant regression — high-vol single-bar adverse moves in sustained bull are routine pullbacks NOT reversal signals; exit pressure fires repeatedly through normal bull pullback bars cutting winning trend exposure). Crash -0.03 (slight negative — high-vol adverse against crash bears DOES happen during dead-cat bounces but cuts legitimate counter-trend captures). Sideways/rally IDENTICAL (vol-shock+adverse-move rare in chop, mostly inactive). Mechanism wrong-directional for trends: high-vol adverse moves in trends are MEAN-REVERTING noise (pullback then continuation), not capitulation. Volume-shock as exit signal is structurally tied to regime — only useful in chop, dead-code in trends.
-	0.978	0.882	0.182	1.18	0.69	0.81	0.84	discard	remove _cooldown_factor from cold-entry path (architectural code-structure removal) — composite +0.0001 vs 4d78fda 0.978 (essentially flat), mean -0.003 (FAILS strict keep criterion). Bull -0.006 (1.187->1.181, slight regression — losing post-exit cooldown allowed faster bull re-entries some of which were noise-driven first-bar reversals), crash +0.001 (within noise), sideways FLAT (0.812), rally -0.007 (0.852->0.845, mild regression — fast re-entries in rally counter-trend bear regime caught some on noisy upward push bars). Std slightly tighter 0.184->0.182. The mechanism is essentially dead-code-adjacent: composite delta is dominated by LOC bonus (~+0.005) offsetting mean regression (~-0.003). _cooldown_factor IS load-bearing — provides ~0.4-0.6x size attenuation in bars 1-2 post-exit, which catches the noise-driven rapid re-entry pattern. Multi-layer entry attenuation hypothesis was wrong: each attenuator captures different noise; cooldown specifically captures TEMPORAL re-entry pattern that none of the conviction-based attenuators catch. Reverting.
4d78fda-session-summary	-	-	-	-	-	-	-	session-summary	session: 5 architectural discards (cap reached, baseline 4d78fda unchanged at 0.978). All 5 architectural. Discards: (1) two-bar exit confirmation gate (new state _prev_exit_ratio + new control flow at exit decision) — composite -0.005, mean essentially flat (+0.0001): soft-pressure stack already saturates fast (slope+pp+time stack typically blew past 1.3x threshold in same bar that crossed 1.0); confirmation gating dead-code-adjacent. (2) voter-6 EMA_slope residualized vs voter-4 linreg_slope (new cross-voter data dep at signal definition) — CATASTROPHIC composite -0.549, bull crushed -1.07 + sideways crushed -0.59: 3.0x projection coefficient based on scale ratio overshot actual covariance; residual dominated by linreg-slope offset/sign. Decorrelation approach structurally sound but requires actual covariance estimation. (3) conviction-trajectory entry gate (new check at entry — non-decreasing strong-sum) — composite -0.087, RALLY -0.31 + bull -0.20: 5pct slack too tight for tanh-saturated regime where small magnitude noise creates large multiplicative differences; trajectory gating wrong-directional for trend regimes where conviction-noise around saturation IS normal regime structure. Crash +0.10 + sideways +0.02 (chop entries did benefit). (4) high-volume-against exit pressure 8th source (new term in fusion sum) — composite -0.151, BULL CRUSHED -0.66: high-vol single-bar adverse moves in sustained bull are routine pullbacks NOT reversal signals; mechanism wrong-directional for trends. Sideways/rally identical (vol-shock+adverse-move rare in chop). Volume-shock as exit signal is structurally tied to regime — only useful in chop, dead-code in trends. (5) remove _cooldown_factor from cold-entry path (architectural code-structure removal) — composite +0.0001 essentially flat, mean -0.003 (fails strict): bull -0.006 + rally -0.007: cooldown_factor IS load-bearing — provides 0.4-0.6x size attenuation in bars 1-2 post-exit catching noise-driven rapid re-entry pattern; multi-layer hypothesis was wrong (each attenuator captures different noise, cooldown specifically captures TEMPORAL pattern). CROSS-EXPERIMENT INSIGHTS: (a) Exit-decision boundary smoothing (confirmation gate) is structurally redundant in current architecture because soft-pressure stack saturates fast — when stack crosses 1.0 it typically blew past 1.3x same bar; multi-bar confirmation only helps marginal cases that are rare. (b) Voter-signal-level decorrelation requires actual covariance estimation — hardcoded scale-ratio coefficients fail because correlation strength depends on regime not magnitude scaling. (c) Trajectory-based entry gates (rising-conviction-only) are wrong-directional for trend regimes where conviction noise around tanh-saturation IS normal regime structure; chop regimes (sideways/crash) DO benefit but trend regression dominates. (d) Volume-based exit signals are regime-asymmetric: high-vol adverse moves in TRENDS are routine pullbacks (mean-reverting noise) but in CHOP they could indicate breakout — but vol-shock+adverse-move rare in chop, so the mechanism collapses to dead-code in chop and wrong-direction in trends. (e) Cooldown_factor is NOT redundant with the conviction-attenuator stack — it captures TEMPORAL post-exit noise (re-entry on first 1-2 bars after exit which are most noise-vulnerable) which the conviction-based attenuators (strong-sum, persistence, ct_atten, quality_atten) do not capture; multi-layer attenuation does NOT eliminate the temporal noise channel. Decision-architecture saturation continues across exit-boundary smoothing, voter-signal decorrelation, entry conviction-trajectory, regime-asymmetric exit pressure terms, and post-exit temporal protection (cooldown_factor is load-bearing). Baseline 4d78fda (0.978) unchanged.
-	0.317	0.227	0.188	0.18	0.21	0.52	0.00	discard	hold-duration-conditioned voter_bias attenuator (architectural new cross-bar data dep at exit voter_bias subsystem) — CATASTROPHIC composite -0.661 vs 4d78fda 0.978, mean -0.658. ALL regimes crushed: bull 1.19->0.18, crash 0.69->0.21, sideways 0.81->0.52, rally 0.85->0.00. The voter_bias subtraction (own-side conviction supports holding) is LOAD-BEARING for late-hold trend positions exactly when they most need exit-pressure suppression. Attenuating voter_bias by bars_held linearly reduces winners' protection from soft exit pressures during normal pullback bars; in trend regimes positions routinely hold 8-15 bars and the late-hold attenuation removed the conviction shield, causing slope/pp/time pressures to fire on benign pullback bars. Hypothesis reverse-directional: voter conviction validates HELD positions through pullbacks, not stale-entry-thesis. Reverting.
