commit	score	mean_score	std_score	bull_2021	crash_bear	sideways	rally_2024	status	description
b0e4443	0.458	0.457	0.348	1.023	0.419	0.302	0.085	keep	remove _vol_entry_atten low-volume entry size attenuator (architectural code-structure removal, -16 LOC, -3 cross-bar volume reads). Composite +0.028 vs 0f7f188 0.430->0.458, mean +0.081 (0.376->0.457), std WIDENED +0.111 (0.237->0.348). Per-regime: bull +0.295 (0.728->1.023 MASSIVE), crash -0.013 (0.432->0.419 small), sideways +0.047 (0.255->0.302), rally -0.005 (0.090->0.085 marginal). Simplicity bonus from LOC reduction partially offsets std widening. Bull massive gain: low-volume attenuator was cutting first-bar size on thin-volume bull entries that passed all other quality filters — removing it unleashes correctly-sized entries. Crash and rally small regressions: low-volume bars in these regimes may carry slightly more adverse-selection risk, but the cost is dwarfed by bull upside. Mechanism: _vol_entry_atten was redundant with persistence + consensus + quality gates; removing it eliminates a cross-timescale coupling that was over-attenuating in bull. NEW BASELINE.
-	0.431	0.367	0.233	0.705	0.404	0.302	0.056	discard	remove multi-window slope consensus attenuator (architectural code-structure removal, -17 LOC). Composite -0.027 vs b0e4443 0.458->0.431, mean -0.090 (0.457->0.367). ALL 4 REGIMES REGRESSED: bull -0.318 (1.023->0.705), crash -0.015 (0.419->0.404), sideways FLAT (0.302->0.302), rally -0.029 (0.085->0.056). Consensus attenuator IS load-bearing: 3-window slope alignment captures entry-quality signal orthogonal to persistence + quality + trend gates. The [0.40, 1.00] range is structural, not dead-code.
-	0.421	0.358	0.215	0.675	0.401	0.271	0.083	discard	one-sided trend-aligned quality-atten reduction (architectural multi-variable, 0.30->0.15 max attenuation for trend-aligned entries, following afa6281+0f7f188 asymmetric pattern). Composite -0.037 vs b0e4443 0.458->0.421, mean -0.099 (0.457->0.358). ALL 4 REGIMES REGRESSED: bull -0.348 (1.023->0.675), crash -0.018 (0.419->0.401), sideways -0.031 (0.302->0.271), rally -0.002 (0.085->0.083). Quality attenuator at full 0.30 strength IS load-bearing even in trend-aligned entries. Bilateral voter split is noise, not structural, in ALL regimes — trend-aligned entries still benefit from split filtering. The asymmetric pattern does NOT generalize to quality attenuation.
-	0.399	0.338	0.240	0.735	0.253	0.271	0.093	discard	remove Kaufman efficiency ratio (ER) gate on initial commit fraction (architectural code-structure removal, -13 LOC). Composite -0.059 vs b0e4443 0.458->0.399, mean -0.119 (0.457->0.338). CRASH CATASTROPHIC -0.166 (0.419->0.253), bull -0.288 (1.023->0.735), sideways -0.031 (0.302->0.271), rally +0.008 (0.085->0.093 marginal). ER gate IS load-bearing: the 2.5% deep-chop attenuation on initial fraction protects against noise-filled first-bar entries in crash; removing it exposes crash entries to path-inefficient noisy bars. Mechanism is more important than its small magnitude suggests — it gates the WORST bars, not the average.
b0e4443-session-summary	-	-	-	-	-	-	-	session-summary	session: 5 independent experiments, 2 KEEPS (exp1+exp2) + 3 architectural discards. Keep1: one-sided trend-aligned de-risk floor relaxation (0f7f188, +0.008 composite, +0.013 mean, ALL 4 REGIMES IMPROVED). Keep2: remove _vol_entry_atten (b0e4443, +0.028 composite, +0.081 mean, bull +0.295 MASSIVE). SESSION NET: composite +0.036 (afa6281 0.422->b0e4443 0.458), mean +0.094 (0.363->0.457). Discards: (1) remove slope consensus attenuator — all 4 regimes regressed, consensus IS load-bearing orthogonal to persistence+quality+trend gates. (2) trend-aligned quality-atten reduction — all 4 regimes regressed, bilateral voter split is noise not structural even in trends. (3) remove ER gate — crash catastrophic -0.166, ER gate protects worst-bar entries in crash. CROSS-EXPERIMENT INSIGHTS: (a) The asymmetric one-sided pattern that worked for admission (afa6281) and de-risk floor (0f7f188) does NOT generalize to quality attenuation — bilateral voter split filtering is universally valuable regardless of trend alignment. (b) Simplification via removal of entry-size attenuators is hit-or-miss: _vol_entry_atten was truly redundant (+0.028 composite), but consensus and ER gates are load-bearing. The difference: _vol_entry_atten acted on a narrow range [0.70, 1.00] and only on low-volume bars, while consensus [0.40, 1.00] and ER [0.00, 0.025] cover wider ranges or gate worst bars. (c) The pattern of load-bearing narrow-range gates suggests that structural protection at the worst-10% of entries contributes disproportionately to regime scores. Future direction: (i) continue asymmetric one-sided pattern at exit boundary (de-risk floor keep 0f7f188 confirms it works at exit); (ii) avoid removing narrow-range entry-quality attenuators — they're load-bearing even when optically small; (iii) the _vol_entry_atten removal +0.028 is the largest single-experiment gain this session — consider further volume-related simplifications (e.g. _vol_bar_ratio dead code after removal). NEW BASELINE: b0e4443 0.458220.
53c329a	0.379	0.263	0.131	0.442	0.251	0.282	0.074	discard	remove _ar_pressure dead-code subsystem (architectural code-structure removal, -23 LOC, exit 6->5 soft sources). Composite -0.079 vs b0e4443 0.458->0.379, mean -0.194 (0.457->0.263). ALL 4 REGIMES REGRESSED: bull -0.581 (1.023->0.442), crash -0.168 (0.419->0.251), sideways -0.020 (0.302->0.282), rally -0.011 (0.085->0.074). _ar_pressure IS NOT dead-code despite 2 session summaries claiming empty intersection — removal changes exit timing, which cascades through trade-count into turnover_gate under new scoring. _ar_pressure activation gate fires in a narrow but real zone (positions near breakeven after MAE recovery) that influences exit decisions enough to change trade counts. Lesson: dead-code-adjacent claims from pre-turnover-gate scoring do not generalize to current scoring with turnover_gate.
5a3b4f2	0.388	0.324	0.219	0.678	0.257	0.282	0.078	discard	counter-trend loss cooldown stretch (architectural multi-variable, +0.8*_loss_only*tanh(|ret_long|/0.06) on _cd_window at cooldown boundary). Composite -0.070 vs b0e4443 0.458->0.388, mean -0.133. ALL REGIMES REGRESSED: bull -0.345, crash -0.162, sideways -0.020, rally -0.007. Mechanism failure: losing exits in strong trends ARE followed by legitimate trend-following re-entry (post-pullback continuation). Stretching cooldown prevents recovery — in bull (rare losing exits are brief pullbacks, recovery locked out). Rally and crash also regressed: counter-trend loss exits followed by legitimate pullback entries.
aa67f93	0.440	0.413	0.312	0.914	0.403	0.262	0.074	discard	remove _ep_pressure early-profit-lock exit term (architectural code-structure removal, -27 LOC, exit 6->5 soft sources). Composite -0.018 vs b0e4443 0.458->0.440, mean -0.044. ALL REGIMES REGRESSED (except crash flat): bull -0.109, sideways -0.040, rally -0.012. _ep_pressure IS load-bearing: sub-peak giveback exits protect against premature profit erosion in bull sideways. The small-peak profit locking in rally is real (0.5 cap, 0.15*pp_min floor), not noise-driven turnover. Simplicity bonus from -27 LOC partly compensates std narrowing (0.348->0.312). 3 CONSECUTIVE DISCARDS — ESCALATION REQUIRED for next experiment.
67f46b8	0.466	0.469	0.364	1.023	0.412	0.440	0.000	keep	strong-sum CV admission gate replacing binary persistence (architectural multi-variable, 3-bar strong-sum CV threshold modifier at admission boundary, removes _bull_persist_ok binary gate + _trend_str_persist coupling). Composite +0.008 vs b0e4443 0.458->0.466, mean +0.012 (0.457->0.469), std +0.016 widened. Per-regime: bull IDENTICAL 1.023, crash -0.007 (0.419->0.412), SIDEWAYS +0.138 (0.302->0.440 MASSIVE), rally HARD CUTOFF (0.085->0.000 Sharpe -0.66). Sideways gain: CV gate raises admission when strong-sum is volatile (noise in chop), filters low-quality entries. Rally regression: strong-sum is also volatile during rally pullbacks, CV gate blocks legitimate trend-aligned bull entries. Fix: trend-aligned CV gate relaxation for rally. All MaxDDs <5%. NEW BASELINE.
b0e4443	0.2834	0.4572	0.3477	1.023	0.419	0.302	0.085	keep	RE-BASELINED under new scoring (simplicity bonus removed). composite = mean - 0.5*std only. Previous composite 0.458 included ~0.175 simplicity bonus (175 LOC below baseline 575). New composite 0.2834. Strategy unchanged.
67f46b8	0.2866	0.4688	0.3643	1.023	0.412	0.440	0.000	discard	RE-SCORED under new scoring (simplicity bonus removed). Was keep under old scoring (0.466 included ~0.179 simplicity bonus). Without bonus: composite 0.2866 vs b0e4443 0.2834 (+0.003 only). rally=0.000 (Sharpe -0.66) unacceptable regime collapse — simplicity bonus was masking real damage. REVERTED.
9bc436db	-	-	-	0.370	0.432	0.269	0.000	discard	RE-SCORED under new scoring. Built on reverted 67f46b8 — bull collapsed to 0.370 (from 1.023), rally still 0.000. Discarded as follow-up to reverted base.
67f46b8	0.2866	0.4688	0.3643	1.023	0.412	0.440	0.000	discard	RE-SCORED under new scoring (simplicity bonus removed). Was keep under old scoring (0.466 included ~0.179 simplicity bonus). Without bonus: composite 0.2866 vs b0e4443 0.2834 (+0.003 only). rally=0.000 unacceptable regime collapse — simplicity bonus was masking real damage. REVERTED.
9bc436db	-	-	-	0.370	0.432	0.269	0.000	discard	RE-SCORED under new scoring. Built on reverted 67f46b8 — bull collapsed to 0.370, rally still 0.000. Discarded.
f001f9f	0.061	0.100	0.078	0.203	0.056	0.140	0.000	discard	replace binary opp_gate with continuous opp_pressure in exit fusion (architectural multi-variable, adds 7th soft exit source, removes FLIP_MIN_VOTES from exit path, -18 LOC). Composite -0.225 vs baseline 0.2856. ALL 4 REGIMES REGRESSED. Rally hard cutoff 0.000 (Sharpe -1.46). Bull collapsed 1.023->0.203. Crash 0.416->0.056. The binary opp_gate is load-bearing — removing it destroys exit quality in all regimes. 2 discards.
4fd0f385	0.274	0.451	0.355	1.03	0.41	0.28	0.09	discard	trend-aligned dynamic giveback threshold for pp_pressure (architectural multi-variable, raise PEAK_PROFIT_GIVEBACK from 0.22 to 0.28 in strong trend-aligned positions via tanh, NEW cross-component data dep on ret_long+pos_dir at pp band boundary). Composite -0.009 vs b0e4443 0.283. Mean -0.006 (0.457->0.451). Per-regime: bull +0.011 (1.023->1.034), crash -0.013 (0.419->0.405), sideways -0.024 (0.302->0.278), rally +0.002 (0.085->0.087). Bull sole gain: wider giveback band in trend-aligned positions preserves more bull entries. Sideways regression: giveback widened in mild-trend sideways bars where trend is noise, allowing premature profits to erode. Discard.
-	0.331	0.479	0.295	0.714	0.762	0.415	0.022	discard	trend-aligned consensus floor relaxation (architectural multi-variable, raise floor from 0.40->0.55 for trend-aligned entries). Composite -0.005 vs baseline 0.336->0.331. All regimes regressed: bull -0.001 (0.715->0.714), crash -0.0002 (0.763->0.762), sideways -0.007 (0.423->0.415), rally -0.006 (0.028->0.022). Rally stability collapsed 0.473->0.380 — floor relaxation increased noise sensitivity. The consensus attenuator catches genuine multi-scale noise, not structural trend entires. Asymmetric pattern does NOT generalize to consensus floor. Discard.
34929d1	0.371	0.519	0.295	0.743	0.750	0.559	0.025	discard	trend-magnitude opp-bias attenuation replaces position-direction (architectural). Composite -0.012 vs 0.383 baseline. Sideways -0.045 (0.604->0.559) — counter-trend positions in strong trends need opp-bias to detect trend resumption. Rally flat. Hypothesis invalidated.
f5b3b5d	0.369	0.518	0.298	0.743	0.750	0.561	0.020	discard	raise _ep_peak_floor 0.15→0.30 (architectural param). Composite -0.014 vs 0.383 baseline. Rally stability dropped 0.416→0.330 — tighter boundary = sharper noise at threshold. Narrower activation of early-profit-lock hurt rally, not helped.
7df099c	0.365	0.512	0.293	0.741	0.744	0.536	0.025	discard	remove TOD activity modulator (architectural, -10 LOC calendar cycles). Composite -0.018 vs 0.383 baseline. Sideways -0.068 (0.604->0.536) — calendar was load-bearing for chop. Rally flat. Bull -0.002. Crash -0.006. Calendar cycles add real signal in sideways through time-based size modulation.
f0edfcb	0.374	0.521	0.294	0.742	0.750	0.565	0.028	discard	profit-only opp-gate graduation removes trend-alignment gate (architectural). Composite -0.009 vs 0.383 baseline. Rally raw unchanged 0.096, stability +0.051 (0.416->0.467) — mechanism partially confirmed. Sideways -0.039 (0.604->0.565) — in chop, profitable-but-noise-spiked positions need binary exit, not graduated. 5th consecutive architectural discard. SESSION EXIT.
64191b0	0.362	0.542	0.360	0.381	0.796	0.955	0.035	branch	exp3 BRANCH OPEN: multi-source agreement attenuator on soft_max (architectural multi-variable, NEW cross-source data dep). Composite -0.074 vs baseline 0.435. Per-regime: bull -0.362 (0.743->0.381 raw 0.815->0.510 + stab 0.913->0.795 — CATASTROPHIC >50pct violates direct keep), crash +0.038 (0.758->0.796), SIDEWAYS +0.323 (0.632->0.955 raw 0.823->0.955 stab 0.793->0.856 MASSIVE), rally -0.089 (0.124->0.035 raw 0.444->0.142 collapsed). Sideways gain real — multi-source attenuation correctly filters single-source noise in chop. Bull/rally regression: single dominant source IS real reversal signal in trends; attenuator over-suppresses. BRANCH HYPOTHESIS: gate attenuator by inverse trend-strength — apply in chop, pass-through in trends.
190bbaa	0.457	0.617	0.320	0.736	0.769	0.890	0.071	keep	BRANCH KEEP step 2: multi-source agreement attenuator on soft_max with CHOP-ONLY gating (architectural multi-variable, NEW cross-source data dep AND trend-conditioned activation). Composite +0.022 vs baseline 0.435->0.457, mean +0.053 (0.564->0.617), std widened 0.259->0.320. Per-regime: bull -0.007 (0.743->0.736 minor, raw 0.815->0.736 stab still 0.913), crash +0.011 (0.758->0.769), SIDEWAYS +0.258 (0.632->0.890 raw 0.823->0.890 stab 0.793->0.909 — MAIN MOVER), rally -0.053 (0.124->0.071 raw 0.444->0.411 nearly preserved, stab 0.447->0.277 — single-mover regression but under 50pct gate). All MaxDDs <3%. Mechanism: in chop, single-source pressure spikes are predominantly noise — 25pct attenuation suppresses noise-driven exits without delaying multi-source confirmed reversals. Trend-gating preserves bull/crash/rally exit fidelity (single-source = real signal in trends). Sideways main mover: chop is exactly where single-source spikes most often misfire. NEW BASELINE 0.457.
-	0.434	0.581	0.295	0.549	0.769	0.890	0.116	discard	2-bar exit-pressure persistence gate (architectural, new per-symbol state, new control flow at exit). Composite -0.024 vs baseline 0.457. Rally +0.045 (0.071->0.116, raw flat 0.411, stab 0.277->0.283 only marginal), BULL -0.187 (0.736->0.549, raw 0.815->0.736 plus stab 0.913->0.795). Mechanism mostly stalls bull-side exits one bar at noise-driven peak giveback. Bull positions held into real reversals, losing accumulated profit. Rally raw essentially unchanged - the 2-bar gate did not actually reduce rally exit noise meaningfully, just deferred exit one bar.
7328cf6	0.475	0.627	0.303	0.736	0.769	0.890	0.112	keep	KEEP: remove binary soft-exit path (architectural code-structure removal, -3 LOC, eliminates fresh-entry soft-pressure noise exposure on bars 0-1). Composite +0.018 vs baseline 0.457 (0.457->0.475). Mean +0.010. Per-regime: bull 0.736 (flat — was already at raw=score), crash 0.769 (flat), sideways 0.890 (flat), RALLY +0.041 (0.071->0.112, raw flat 0.411, stab 0.453->0.435 modest, but final score lifted via removed binary noise on bars 0-1 where fresh entries were getting noise-killed before reaching de-risk-gated bars>=2). De-risk ramp identical at bars>=2 (de_risk=0 at pressure=thresh equivalent to binary). All MaxDDs <1.71%. NEW BASELINE 0.475.
-	-999	-499	500	-999	0.79	0.00	-999	discard	remove voter_bias additive from exit_pressure entirely (architectural code-structure removal, -33 LOC). CATASTROPHIC: bull MaxDD 39.6pct, rally MaxDD 13.4pct, sideways score 0. voter_bias was load-bearing: opp-side +0.20 addition was the primary continuous reversal-evidence mechanism (opp_gate binary trigger too restrictive on its own). Without it, positions hold deep into adverse moves. Confirms voter_bias is load-bearing structural component, not just noise injection.
-	0.352	0.486	0.267	0.387	0.773	0.688	0.096	discard	remove only own-side voter_bias subtraction, keep opp-side addition (architectural one-sided removal). Composite -0.123 vs 0.475 baseline. Bull -0.349 (0.736->0.387, raw 0.736->0.537, stab 0.823->0.769), sideways -0.202 (0.890->0.688), crash flat, rally -0.017 (raw improved 0.411->0.564 but stab collapsed 0.435->0.271). Own-side subtraction is structurally load-bearing for bull/sideways winners-hold. De-risk floor relaxation alone insufficient. Confirms BOTH halves of voter_bias load-bearing.
98c89e7	0.470	0.629	0.318	0.787	0.745	0.897	0.087	branch	BRANCH OPEN: pnl-conditioned scale-in adverse-move freeze (architectural, new cross-bar dep at scale-in, freeze growth on adverse bars during fresh entry). Composite -0.005 vs baseline 0.475 (mean +0.002 std widened 0.303->0.318). Per-regime: BULL +0.051 (0.736->0.787 strong improvement, MaxDD 1.18->1.01, mechanism working), crash -0.024 (0.769->0.745), sideways +0.007, RALLY -0.025 (0.112->0.087 raw 0.411->0.383). Bull win real - adverse freeze caps scale-in compounding. Rally regression: rally pullbacks recover - freezing scale-in during rally noise pullbacks loses on the bounce. BRANCH HYPOTHESIS: gate freeze by inverse trend-alignment - freeze fires only on counter-trend adverse moves (real reversals), bypass in trend-aligned scale-in (rally pullback noise).
5c9e32e	0.486	0.637	0.303	0.761	0.768	0.897	0.121	keep	BRANCH KEEP step 2 (SUPERSEDES exp2 7328cf6 baseline 0.475): counter-trend gated pnl-conditioned scale-in adverse-freeze (architectural multi-variable, new cross-bar dep at scale-in + counter-trend gating). Composite +0.011 vs baseline 0.475 (0.475->0.486), mean +0.010 (0.627->0.637), std flat 0.303. Per-regime ALL POSITIVE: bull +0.025 (0.736->0.761, MaxDD 1.18->1.18 flat, stab 0.823->0.824), crash -0.001 flat (0.769->0.768), sideways +0.007 (0.890->0.897, stab 0.858->0.884), RALLY +0.009 (0.112->0.121, raw 0.411->0.394 mild drop, stab 0.435->0.492 stab gain dominates). All MaxDDs <1.79pct. Mechanism: trend-aligned scale-in (rally pullback noise) bypasses freeze, counter-trend scale-in (real reversal) freezes - protects against compounding adverse-move size adds while preserving rally pullback recovery. NEW BASELINE 0.486.
-	0.294	0.434	0.281	0.244	0.574	0.820	0.100	discard	2-bar derisk hysteresis cooldown (architectural, new per-symbol state, new control flow at exit-graduation boundary, suppresses mid-pressure derisks for 2 bars unless near saturation). Composite -0.192 vs 5c9e32e 0.486. ALL 4 REGIMES REGRESSED: bull -0.517 (0.761->0.244 stab 0.823->0.627 catastrophic), crash -0.194 (0.768->0.574), sideways -0.077 (0.897->0.820), rally -0.021 (0.121->0.100). Mechanism failure: hysteresis HOLDS positions through legitimate gradual-pressure derisk windows; pressure then escalates to saturation and binary full-exit fires, losing the entire position instead of partial. The escape valve at 0.95 fires too late — by then positions have already accumulated more loss than the gradual ramp would have. Hysteresis fundamentally incompatible with gradual exit philosophy: graduated derisk IS the noise filter (pressure must persist to keep shrinking); blocking it routes more exits through the lossier binary path.
-	0.208	0.266	0.116	0.292	0.251	0.423	0.098	discard	sustained-conviction margins for voter_bias (architectural, 2-bar MIN strong-sum margin replaces per-bar in voter_bias only). Composite -0.278 vs 5c9e32e 0.486. ALL 4 REGIMES REGRESSED: bull -0.469 (0.761->0.292 stab 0.823->0.666), CRASH -0.517 (0.768->0.251 stab 0.825->0.598 catastrophic), sideways -0.474 (0.897->0.423 stab 0.884->0.778), rally -0.023 (0.121->0.098 stab 0.492->0.397). Mechanism failure: 2-bar MIN systematically pessimizes margins -> voter_bias fires less -> exit_pressure structurally weaker -> positions held into adverse moves. The per-bar voter_bias is NOT noise to filter; it IS the primary continuous reversal-evidence channel. Confirms voter_bias load-bearing per-bar (consistent with prior 374:- discard).
-	0.474	0.630	0.313	0.761	0.768	0.897	0.096	discard	position-fraction ratchet on scale-in (architectural, new per-symbol state, derisk fraction caps future scale-in regrowth). Composite -0.012 vs 5c9e32e 0.486. Bull/crash/sideways IDENTICAL (ratchet rarely fires in trends - positions reach full size before derisk in trends). RALLY -0.025 (0.121->0.096 stab 0.492->0.389). Mechanism wrong direction for rally: rally pullbacks NEED regrowth recovery after small derisks; ratchet locks position permanently at lower fraction, missing the bounce. Ratchet is structurally incompatible with rally chop-and-recover pattern. Reverse-of-intent on the target regime.
