commit	score	mean_score	std_score	bull_2021	crash_bear	sideways	rally_2024	status	description
de5ca08	0.946	0.858	0.190	1.16	0.64	0.78	0.85	keep	simplification — remove _portfolio_freq_factor cross-symbol entry frequency regulator (architectural code-structure removal) — composite +0.032 vs baseline 0.914, mean +0.022. Rally +0.066 (largest gain — 0.78->0.85, sharpe 1.48->1.69, MaxDD 3.65->3.56; portfolio-level admission cost was over-attenuating multi-symbol rally pile-ups, valid correlated rally entries were being filtered), crash +0.025 (0.62->0.64; correlated multi-symbol crash legs no longer double-attenuated by portfolio + per-symbol regulators). Bull/sideways exactly flat (mechanism rarely fired in those regimes). Std narrowed 0.200->0.190. All MaxDDs <4%. Per-symbol _freq_factor alone provides sufficient churn protection; portfolio-level was multiplicatively composing on correlated entries that are STRUCTURAL signal in trending regimes, not noise. New baseline.
-	0.938	0.854	0.187	1.16	0.64	0.78	0.83	discard	voter-strong RATIO bias added to voter_bias (architectural new cross-component data dep — different voter-state representation) — composite -0.008 vs de5ca08, mean -0.004. Bull/crash/sideways exactly flat (ratio bias fires very rarely after opp_atten attenuation in trend-aligned positions, which is when ratio would matter most), rally -0.02 (mild — ratio bias contributes a tiny extra exit pressure on rally bears during pullback bull-voter spikes, eroding the MAE-recovery alpha). The orthogonality hypothesis (margin captures admission-prox, ratio captures balance-shift) is correct in form but the mechanism is dominated by existing opp_margin term: when opp is winning the battle, opp_margin is already high, so the ratio adds little NEW signal. Effectively redundant with opp_margin term in chop and trend-counter regimes; in trend-aligned regimes opp_atten flattens it out. LOC penalty (+24 lines, -1 deletion) without orthogonal effect.
-	0.626	0.674	0.439	1.20	0.00	0.85	0.64	discard	avg-cost basis tracking across scale-in (architectural new state + new control flow) — CATASTROPHIC composite -0.320 vs de5ca08, mean -0.184. Crash crushed -0.64 (0.64->0.00, sharpe -0.18, MaxDD 8.89%): true avg cost during losing crash scale-ins makes pos_pnl look more negative earlier (avg cost shifts toward current losing price), triggering soft exit pressures (slope/time/voter_bias) before legitimate dead-cat rebound that would have allowed recovery into shorts. Bull +0.04 (1.16->1.20), sideways +0.07 (0.78->0.85) — winning trend scale-ins benefited from corrected pos_pnl (peak_pnl no longer over-anchored on entry[0] miss, _pp_min activation more accurate). Rally -0.21 — mixed effect: MAE-recovery gating uses avg-cost-based pos_pnl, shifting recovery_frac threshold and breaking the rally pattern. Cross-bar avg-cost evolution introduces subtle asymmetry: in trends gaining, basis rises (helps); in trends losing, basis falls (HURTS exit timing — exits early on what would otherwise recover). Direction is structurally wrong for crash regime architecture.
-	0.903	0.737	0.059	0.82	0.66	0.71	0.76	discard	simplification — remove _persistence_mult per-voter time-varying weighting (architectural code-structure removal) — composite -0.043 vs de5ca08, mean -0.121. Bull crushed -0.34 (1.16->0.82): persistence_mult was load-bearing for bull where high-persistence voters (EMA_cross + EMA_slope sustained one direction during uptrend) get up to 1.3x weight, amplifying conviction at strong-sum aggregation. Removing flattens to base weights, weakening bull entry conviction. Crash +0.02 (mild gain — bear voters in dead-cat bounces flip more, were getting downweighted by persistence_mult below 1.0; removal restores their voice). Sideways -0.07, rally -0.09 (mixed — sideways/rally have moderate persistence). Std collapsed sharply 0.190->0.059 (huge consistency gain) but bull -0.34 dominates composite. Persistence_mult is load-bearing for bull regime via amplifying sustained-direction voters.
-	0.940	0.854	0.186	1.15	0.65	0.78	0.83	discard	voter-conviction gate on losing scale-in continuation (architectural new cross-component data dep at scale-in path) — composite -0.006 vs de5ca08, mean -0.005. Bull -0.01, crash +0.01, sideways +0.01, rally -0.02. All per-regime deltas <=0.02 — gating mechanism rarely activates meaningfully. The condition (pos_pnl<0 during scale-in AND faded same-side margin) is narrow: most losing scale-ins occur in chop/crash where voter conviction also faded, so the gate fires when scale-in would have added size; but the SIZE of those scale-in additions is small (already partial via _eff_progress), so the cumulative pos_pnl impact is minimal. Existing _w_slope scale-in attenuator (0.5x->1.0x ramp) already provides loss-protection during early bars. Effectively redundant with existing scale-in slope-pressure attenuator.
-	0.379	0.364	0.334	0.61	0.04	0.77	0.03	discard	cross-timescale slope DIVERGENCE replacing mean-of-3 exit slope (architectural new control flow at exit subsystem) — CATASTROPHIC composite -0.567 vs de5ca08, mean -0.494. Bull crushed -0.55 (1.16->0.61), crash -0.60 (0.64->0.04), rally crushed -0.82 (0.85->0.03). Only sideways flat (0.78->0.77). Divergence-aware mechanism over-fires on natural trend pullbacks where short-window slope routinely opposes long-window slope; switching exit_slope to short-window during these pullbacks injects noise into _sl_slope_pressure, triggering soft exits on winning trend positions. Bull/crash/rally all rely on the smoothed mean-slope estimate to hold through transient pullbacks. The mean-of-3 IS load-bearing as a low-pass filter on slope noise — replacing with divergence-conditional switching destroys trend regime alpha. Mechanism direction wrong: short-vs-long divergence during pullback is a FEATURE of trend regimes, not a reversal signal.
-	0.946	0.858	0.190	1.16	0.64	0.78	0.85	discard	bars-held conditioning on _w_ar MAE-recovery weight (architectural new cross-bar data dep) — composite +0.000001 vs de5ca08 (essentially zero), mean +0.0 (flat, fails strict keep criterion). All four per-regime scores within 0.001 of baseline. _ar_pressure activates rarely in early bars (MAE depth <-0.012 + recovery_frac>0.5 takes time to develop), so bars_held conditioning of _w_ar (0.4->1.0 ramp around 4-bar midpoint) has minimal effect on aggregate exit-pressure. The mechanism is essentially dead-code as written; LOC penalty net zero from added comments. Filtered single-bar noise hypothesis was correct in principle but timing of typical _ar_pressure activation is already past the ramp-up zone.
-	0.951	0.863	0.186	1.16	0.65	0.79	0.84	discard	post-peak breakeven-violation 7th soft exit pressure (architectural new control flow at exit subsystem) — composite -0.005 vs fe832d1, mean -0.0003 (essentially flat). All four per-regime scores within 0.002 of baseline (bull flat, crash +0.0007, sideways +0.0006, rally +0.001). _bv_pressure rarely activates meaningfully: condition (peak >= 1.2x _pp_min AND pos_pnl < 0) is narrow because positions that reach 1.2x _pp_min typically have pp_pressure already firing in the giveback ramp before pos_pnl crosses to negative; by the time _bv_pressure fires, exit has likely already triggered via pp_pressure or sl. Mechanism architecturally clean (distinct decision boundary from pp/ep/ar) but the activation gap between 0.95x _pp_min (where ep deactivates) and 1.2x _pp_min (where bv activates) leaves no meaningful exit-pressure void to fill. LOC penalty (+22 lines) caused composite drop. Reverting.
-	0.879	0.751	0.104	0.64	0.90	0.79	0.68	branch	EMA-smoothed exit pressure 2-bar blend (architectural new per-symbol state at exit decision boundary) — composite -0.077 vs fe832d1 0.956, mean -0.112. CRASH +0.253 (0.65->0.90, sharpe 1.03->1.58, MaxDD 3.79->1.34) — major win from filtering dead-cat bounce voter_bias spikes that previously fired exits at adverse local lows. Bull crushed -0.52 (1.16->0.64, sharpe 2.31->1.05, MaxDD 0.85->3.29): smoothing delays exits in winning bull positions when natural pullback voter/slope spikes were previously triggering correct partial trims. Rally -0.17 (0.84->0.68, MaxDD 3.57->3.84). Sideways flat. Std collapsed 0.187->0.104. Mechanism is regime-conditional: crash benefits, trend regimes regress because legitimate exit signals get delayed. Opening branch to gate smoothing on chop/loss states only.
-	0.862	0.729	0.085	0.84	0.65	0.79	0.64	branch step 2	gate exit-pressure smoothing on chop/loss/counter-trend (architectural new control flow conditioning) — composite 0.862 (-0.017 vs step1, -0.094 vs baseline). Bull recovered +0.20 (0.64->0.84) but still -0.32 below baseline. Crash LOST the +0.25 gain (0.90->0.65 = baseline). Rally 0.64 (-0.04 vs step1). Mechanism over-disabled: crash bear shorts in bear trend AND in profit satisfy both gates, so smoothing turns off — losing the dead-cat-bounce filter that drove the crash gain. Need to gate by CHOP-ONLY (not trend-align), so crash trend-aligned positions still get smoothing.
-	0.943	0.857	0.188	1.16	0.65	0.79	0.81	branch step 3	smooth only voter_bias 2-bar blend (architectural narrowed scope) — composite -0.013 vs baseline. Bull/crash/sideways tiny +0.002-0.004 gains, rally -0.030 (sharpe regression — unclear; voter_bias smoothing slightly delays counter-trend exits in rally bears causing held losers). Crash gain from step1 (+0.25) NOT preserved with narrower scope: _voter_bias is too small a component; the dead-cat-bounce filter required smoothing the full exit_pressure including slope/pp components. Bilateral asymmetry: voter_bias smoothing helps bull tiny but hurts rally; fundamental tension unresolved.
-	0.895	0.758	0.074	0.77	0.64	0.78	0.84	branch step 4	vol-conditioned exit pressure smoothing (high-vol full smoothing, low-vol none) — composite -0.061 vs baseline. Bull -0.39 (1.16->0.77, MaxDD 0.85->3.36): high-vol pullback bursts in bull activate the smoothing gate and delay exits, widening DD. Crash 0.64 (LOST the +0.25 gain): vol-conditional smoothing at 0.40 alpha differs from step 1 unconditional 0.35 alpha; crash may have had transient low-vol bars in dead-cat bounces that DONT activate smoothing in step 4 — losing exactly the bars that needed filtering. Std collapsed 0.187->0.074. Vol-gate selectivity is too tight: dead-cat bounce filtering needs the smoothing during the bounce itself, but vol_ratio measure may not align with bounce timing. Cross-bar architecture for noise filtering has fundamental regime-mixed-effect tension that vol-gating cannot resolve.
-	0.938	0.859	0.191	1.16	0.64	0.78	0.85	branch step 5	pos_pnl-conditioned exit pressure smoothing (loss-only) — composite -0.019 vs baseline, mean -0.004. Bull/sideways/rally preserved (+0.003 to +0.005), crash regressed -0.007. Loss-gate misses dead-cat bounce timing: crash bear shorts entered earlier are typically in PROFIT during dead-cat bounces (the move that triggers voter spikes), so loss_gate=0 disables smoothing exactly when needed. Mechanism logic wrong-directional for crash.
-	0.937	0.858	0.190	1.16	0.64	0.78	0.85	branch step 7	smooth slope-pressure loss-only — composite -0.019 vs baseline. All regime scores identical to step 6 to 4 decimals. Mechanism dead-code-adjacent (slope smoothing during loss rarely fires meaningfully — slope spikes occur on profit-side reversals more often, and drawdown bars typically have already-elevated slope-against persistent over multiple bars rather than single-bar spikes).
-	0.935	0.858	0.190	1.16	0.64	0.78	0.85	branch step 6	asymmetric voter_bias smoothing (positive-and-in-loss only) — composite -0.021 vs baseline. All per-regime scores within 0.005 of baseline (mean -0.0001). Narrow gating fires rarely (positive voter_bias AND in loss AND not sl-saturated). Mechanism converged to dead-code-adjacent.
-	0.943	0.859	0.190	1.16	0.65	0.79	0.85	branch-discard	BRANCH SUMMARY (7 steps): EMA-smoothed exit pressure (architectural new per-symbol state at exit decision boundary). Step 1 opening: composite 0.879 (-0.077 vs baseline) but CRASH +0.253 (0.65->0.90, MaxDD 3.79->1.34) — major dead-cat-bounce voter-spike filter signal. Bull crushed -0.52, rally -0.17 (full smoothing delays winning trim). Steps 2-7 attempted to gate smoothing scope to preserve crash gain while restoring bull/rally: step 2 trend-align+profit gate — over-disabled smoothing for crash (lost +0.25 gain); step 3 voter_bias-only smoothing — bull/crash/sideways tiny +gains, rally -0.030, crash gain not preserved (component too small); step 4 vol-conditioned — bull -0.39 (vol-spike bursts during pullbacks delayed exits), crash gain not restored; step 5 pos_pnl-loss-conditioned — bull/rally preserved, crash regressed -0.007 (loss-gate misses bounce timing — bears in profit during bounce); step 6 positive-voter_bias-and-loss-only — composite 0.935, all per-regime within 0.005 of baseline (dead-code-adjacent); step 7 slope-pressure-loss-only — same dead-code result as step 6. Best step 3 at 0.943, gap -0.013 persistent across all gating variants. Cross-step insight: cross-bar exit-pressure smoothing has fundamentally regime-mixed-effect — crash dead-cat bounces benefit from full noise-filter (single-bar voter spike during reversal up-bar), but trend-aligned winning pullbacks need fast trim (filter delays correct exit). NO single conditioning gate (vol_ratio, pos_pnl, trend_align, voter_bias sign) can isolate "crash-bounce filter" from "winning-pullback delay" because the temporal pattern is similar (single-bar elevated exit signal). The smoothing primitive itself is architecturally incompatible with the existing exit-pressure stack which was tuned for fast crossing. Branch reverted (7 commits). Baseline fe832d1 (0.956) unchanged.
-	0.710	0.708	0.355	1.20	0.62	0.80	0.21	discard	own-side conviction-trajectory fade exit-bias (architectural new cross-bar data dep at voter_bias) — CATASTROPHIC composite -0.243 vs 3c394c1, mean -0.152. Rally crushed -0.63 (0.84->0.21, sharpe 1.66->0.41, MaxDD 3.58->8.34): rally BEAR positions face naturally-declining own-side (bear) strong-sum during rally's upward push bars (bull voters fire on rises while bear voters fade), triggering false 'conviction fade' exits that look identical to genuine reversal — exits the counter-trend bear at adverse local highs. Bull +0.03 (1.16->1.20 — winning bull positions get earlier-than-normal exits on conviction fading, locks profits cleanly). Sideways +0.005, crash -0.02. Mechanism direction asymmetric: helps trend-aligned positions in stable trends (bull), catastrophic for counter-trend positions (rally bears). The asymmetry can't be gated cleanly because the trajectory IS the mechanism — gating on trend-align would disable it for the very positions that may need it. Reverted.
3c394c1-session-summary	-	-	-	-	-	-	-	session-summary	session: 5 architectural discards (cap reached). All 5 architectural. Discards: (1) remove _chop_amp own-side voter_bias amplifier — crash -0.12, rally -0.07: _chop_amp 1.7x own-side subtraction in chop/low-trend is load-bearing for trend-onset bars where _opp_atten attenuator is still low (trend not yet strong enough). (2) remove _ve_pressure vol-expansion exit pressure — CATASTROPHIC bull -0.46, rally -0.21, crash -0.18: _ve_pressure profit-side regime-shift detection (vol_6/vol_18) catches winning trend positions when vol explodes BEFORE reversal; load-bearing across all trend regimes. (3) defer MAE updates until scale-in completes — flat (composite -0.001, mean +0.0001): _ar_pressure activation requires meaningful MAE depth which is rare in first 3 bars; deferring barely shifts behavior. (4) convex de-risk curve replacing linear partial-exit — CATASTROPHIC rally -0.59: linear ramp IS load-bearing for rally; mid-band exit pressure in rally is genuine signal not noise, convex retains too much position late into reversals. (5) own-side conviction-trajectory fade exit-bias — CATASTROPHIC rally -0.63: counter-trend (rally bear) positions face naturally-declining own-side strong-sum during rally's upward pushes, mechanism cannot distinguish 'genuine fade' from 'normal counter-trend regime' — exits at adverse local highs. Cross-experiment insights: (a) voter_bias subsystem is heavily saturated — both removing existing components (_chop_amp) and adding new components (conviction-trajectory) both regress significantly; instantaneous-margin formulation is finely tuned. (b) _ve_pressure is structurally load-bearing for ALL trend regimes via vol-expansion catching late-stage trend-vol spikes BEFORE reversal — profit-side regime-shift detector cannot be substituted by other mechanisms. (c) MAE-update timing is dead-code-adjacent: scale-in MAE pollution doesn't materially shift _ar_pressure activation. (d) Linear de-risk shape is calibrated for rally — convex curves over-hold positions through real reversals; mid-band exit pressure is signal not noise in trend regimes. (e) Voter-trajectory features at exit have asymmetric regime impact: helpful for trend-aligned positions (bull catches peaks early), catastrophic for counter-trend (rally bears) — gating cannot resolve because trajectory IS the mechanism. Decision-architecture saturation continues across exit-pressure fusion subsystem (_ve, _chop_amp, de-risk shape, voter trajectory) and entry MAE state. Baseline 3c394c1 (0.954) unchanged.
-	0.909	0.755	0.069	0.75	0.64	0.80	0.83	discard	remove _pm_trend_atten profit-magnitude trend attenuator (architectural code-structure removal) — composite -0.037 vs de5ca08 0.946, mean -0.103. Bull -0.41 (1.16->0.75, sharpe 1.23 vs ~2.4 prior), rally -0.024 (0.85->0.83). Removing the trend attenuator amplifies _pp_pressure too aggressively in strong trends — peak giveback ratio fires earlier on rising peaks, exiting winning trend positions before they extend. _pm_trend_atten IS load-bearing: in trends, peak_pnl IS large so amplification would fire pp_pressure prematurely; the 70% attenuation lets trend positions ride extended peaks before locking. Mechanism inverted from hypothesis.
a44612e	0.952	0.858	0.187	1.16	0.64	0.80	0.84	keep	simplification — remove _scale_in_w slope-pressure attenuator (architectural code-structure removal) — composite +0.006 vs de5ca08 0.946, mean +0.0005. Sideways +0.016 (largest gain — slope-against during sideways scale-in now fires full pressure, exiting marginal early reversals before they grow into losses), crash +0.004, bull -0.003 (essentially flat), rally -0.013 (mild — some scale-in slope dips that previously ramped to recovery now exit; offset by sideways/crash gains). Std slightly tighter 0.190->0.187. Mechanism: slope-against during scale-in IS signal not noise — early reversals deserve full slope-pressure response. The 0.5x->1.0x ramp was structurally opposing the slope-against early-warning function. New baseline.
-	0.608	0.634	0.417	1.16	0.61	0.77	0.00	discard	stale-position exit pressure 7th source (architectural new control flow at exit subsystem) — CATASTROPHIC composite -0.34 vs a44612e 0.952, mean -0.22. Rally CRUSHED 0.84->0.00 (sharpe 1.64->-0.19, MaxDD 3.56->5.86): rally has many counter-trend bear positions that sit near zero pnl during consolidation legs before resolving; staleness gate exits them prematurely AND winning trend positions during consolidations get hit. Crash -0.03, sideways -0.03 (small). Bull untouched. Mechanism wrong-directional: near-zero pnl + held >=10 bars is COMMON during trend pauses, not just bad trades. Cannot distinguish stale loser from consolidating winner.
-	0.948	0.858	0.187	1.16	0.64	0.80	0.84	discard	2-bar persistence on slope-against pressure (architectural new per-symbol state at exit subsystem) — composite -0.004 vs a44612e 0.952 (LOC bonus drop only), mean EXACTLY flat (per-regime scores identical to baseline to 6 decimals). Mechanism is structurally dead-code: min(curr, prev) never reduces below curr because consecutive _sl_slope_pressure values are nearly equal in the relevant pressure band (pressure builds smoothly via vol/slope, not single-bar spikes). The slope-pressure already has built-in smoothing via 3-window mean. Persistence requirement adds state without behavioral impact. Fails strict mean criterion.
83ffa0a	0.954	0.860	0.186	1.16	0.64	0.80	0.84	keep	fresh-entry exemption from de-risk path (architectural new control flow at exit) — composite +0.002 vs a44612e 0.952, mean +0.002. Rally +0.008 (sole regime mover — sharpe 1.638->1.661, MaxDD 3.56->3.59 essentially flat; counter-trend bear entries on volatile bars 0-1 no longer partial-exit while scale-in tries to grow them). Bull/crash/sideways IDENTICAL to baseline (mechanism only fires when _de_risk path was active in bars 0-1, primarily rally). Std slightly tighter 0.187->0.186. New baseline.
-	0.953	0.861	0.186	1.16	0.64	0.80	0.85	discard	slope-confirmation gate on opp_bias additive term (architectural new cross-component data dep at voter_bias) — composite -0.001 vs 83ffa0a 0.954 (fails composite improvement criterion), mean +0.001. Bull -0.003 (1.157 vs 1.160), crash +0.005 (0.645 vs 0.640), sideways -0.005 (0.796 vs 0.800), rally +0.006 (0.846 vs 0.840). Mechanism activates as designed but the per-regime impact is roughly zero-sum: crash/rally tiny gains offset by bull/sideways tiny losses. Slope-confirmation downweights voter-only spikes (bull/sideways with low slope-against) BUT also amplifies opp_bias when slope confirms (crash/rally trend-against bars), exiting trend-aligned counter-trend positions sooner. The mechanism is architecturally clean (slope confirms voter_bias opp signal) but the bilateral nature (down-weight AND up-weight) creates regime-mixed effects that net near zero. Std slightly tighter 0.187->0.186 (consistency edge) but mean essentially flat.
