commit	score	mean_score	std_score	bull_2021	crash_bear	sideways	rally_2024	status	description
1d764b9f	0.689311	0.754748	0.218125	0.961878	0.729861	1.011417	0.662116	0.408468	keep	BRANCH KEEP step9 (NEW BASELINE, SUPERSEDES cb7c7821 0.685884). MTM-path-efficiency emission-layer REDUCTION throttle + 3 gates. MECHANISM: new per-symbol pos_pnl 12-bar path state; MTM-eff=|net|/sum|delta| in [0,1]; chop=1-eff. At emission layer (downstream of all quantization -- the ONLY layer reaching mixed per prior root-cause finding), a same-sign REDUCTION resize distance is amplified by (1+0.80*chop*grind_gate*strong_trend_fade*winner_fade), reduction-only, clamped same-sign and never past full-close. GATES: grind_gate=clamp((1.3-vol_ratio)/0.5) spares high-vol SHARP bull pullbacks (recover fast) vs low-vol GRIND (giveback-prone); strong_trend_fade=1-tanh(max(0,ret_vlong*pos_dir)/0.02) spares strong-uptrend bull winners; winner_fade=1-(pos_pnl/|stop|-0.5)/1 spares crash profit-take winning-short reductions (onset +0.5stop so mixed breakeven + rally modest-PnL keep full throttle). MEASURED vs cb7c7821 0.685884: composite +0.003427 (0.689311>=+0.003 PASS), mean +0.004145 (0.754748 PASS), std 0.215732->0.218125. PER-REGIME all stab 1.0 raw==score all DD<10pct: bull 0.962118->0.961878 (-0.0002 noise Sh1.9997->1.9995), crash 0.731300->0.729861 (-0.0014 Sh1.273->1.271), sideways 0.994833->1.011417 (+0.016584 Sh2.002->2.017 DD2.21 -- choppy chop-hold positions trimmed = less giveback), rally 0.660252->0.662116 (+0.001864 Sh1.526->1.530), mixed 0.404513->0.408468 (+0.003955 Sh0.804->0.802 DD2.68->2.80 -- whippy wrong-side-long book trimmed faster). No regime >50pct drop, all DD<10pct. Branch arc: step1 raw throttle (rally +0.045 bull -0.283) -> step3 grind gate (bull recovered) -> step5 strong-trend fade (bull to baseline) -> step9 winner-fade (crash recovered) = KEEP. NEW BASELINE 0.689311.
-	-	-	-	-	-	-	-	-	session-summary	SESSION (baseline cb7c7821 0.685884 5-regime -> NEW BASELINE 1d764b9f 0.689311, +0.003427 composite, +0.004145 mean): 1 independent architectural experiment (Exp1, opened branch) + 1 exploration branch (9 steps, KEPT at step9). Baseline cb7c7821 re-verified byte-identical at session start (composite 0.685884, all stab 1.0 raw==score) [bull 0.962118, crash 0.731300, sideways 0.994833, rally 0.660252, mixed 0.404513]. THEME: NEW DATA AXIS -- per-position MTM-PATH-EFFICIENCY (eff=|net pos_pnl|/sum|bar-to-bar pos_pnl delta| over a 12-bar rolling pos_pnl path, in [0,1]) consumed at the EMISSION layer (downstream of all quantization -- the ONLY layer reaching mixed per prior session root-cause finding). chop=1-eff drives a same-sign REDUCTION-resize throttle: reduction distance *= (1+0.80*chop*grind_gate*strong_trend_fade*winner_fade), reduction-only (risk-reducing), clamped same-sign and never past full-close. Trims choppy dead-capital held positions faster; smooth climbers (chop~0) byte-identical. BRANCH ARC (each gate added to fix the prior step's regression, mechanism-identified): step1 raw throttle amp 0.60 -> rally +0.045 (binding-regime gain, the documented stale-loss/giveback lever now UNBLOCKED at stab 1.0) but bull -0.283 (over-trimmed winning-long pullbacks). step2 profit-fade (scale 1x stop) -> killed rally gain, did NOT fix bull (bull loss not winning-trim). step3 LOW-VOL GRIND gate clamp((1.3-vol_ratio)/0.5) -> bull recovered to 0.809, rally +0.052 (SEPARATOR: bull-2021 high-vol SHARP uptrend pullbacks recover fast=trim hurts; rally low-vol GRIND giveback-prone=trim helps). step4 deep-winner fade -> crash/sideways/mixed recovered but ate rally; bull unfixed (not deep winners). step5 STRONG-UPTREND fade 1-tanh(max(0,ret_vlong*pos_dir)/0.02) -> bull FULLY recovered to 0.961 (SEPARATOR: bull strong multi-day uptrend ret_vlong~0.027 vs rally weak ~0.006); composite +0.00246 near-keep, mean PASS, but rally gain faded. step6 shifted fade center 0.016 -> NO-PROGRESS (lost sideways/mixed, rally unrecovered; bull/rally non-separable at trim-time). step7 amp 0.80 -> saturated flat; crash -0.0056 isolated as the sole keep-blocker. step8 tighten fade 0.012 -> NO-PROGRESS (cascaded sideways/mixed down via non-monotone loss-streak/cooldown/peak state feedback). step9 WINNER fade 1-(pos_pnl/|stop|-0.5)/1 (onset +0.5stop) -> spares crash profit-take WINNING-short reductions (crash 100pctWR) while mixed breakeven + rally modest-PnL keep full throttle = crash recovered to 0.7299 -> KEEP (composite 0.689311, mean 0.754748, all gates pass). KEY MEASURED FINDINGS: (1) MTM-path-efficiency is a genuine NEW productive data axis reaching mixed AND lifting sideways -- the emission-layer resize-derisk that prior session proved reaches mixed, now made KEEPABLE by gating with 3 orthogonal separators (vol-regime grind, multi-day-trend-strength, winner-PnL) that the prior session's single trend-alignment gate lacked. (2) The bull/rally separation IS achievable at the emission layer via VOL-REGIME (grind_gate) + MULTI-DAY-TREND-STRENGTH (strong_trend_fade) jointly -- bull is high-vol+strong-uptrend (doubly spared), rally is low-vol+weak-uptrend (doubly trimmed). (3) crash's drag was front-running profit-take reductions of winning shorts (winner_fade fixed). (4) NON-MONOTONE STATE FEEDBACK reconfirmed (step8: fade-scale change cascaded across regimes via shared loss-streak/cooldown/peak state) -- gate calibration interacts globally, so each gate was validated by full backtest not local reasoning. Net keep is modest (+0.0034) and std rose slightly (0.2157->0.2181, mean-driven gain not variance-driven). results.tsv append-only preserved throughout (path-scoped git checkout -- strategy.py for the 2 no-progress restores, never git revert). NEW BASELINE 1d764b9f 0.689311.
31144c84	0.688170	0.753739	0.218564	0.961843	0.729943	1.011438	0.657000	0.408470	discard	Exp1 architectural indep: MTM-chop BUILD DAMPENER -- symmetric complement of the just-kept reduction throttle, on the same-sign INCREASE branch at emission. Damps same-sign builds of choppy dead-capital positions, shrink increase toward current_pos, using the SAME MTM-path-efficiency axis + 3 proven gates, grind_gate/strong_trend_fade/winner_fade. MEASURED vs 1d764b9f 0.689311: composite -0.001141, mean -0.000009 flat, std +0.000439. PER-REGIME all stab 1.0 raw==score no flips: bull 0.961878->0.961843 flat Sh1.9995, crash 0.729861->0.729943 +0.0001, sideways 1.011417->1.011438 flat, rally 0.662116->0.657000 -0.005116 Sh1.530->1.521, a rally scale-in BUILD got dampened costing a beneficial add, mixed 0.408468->0.408470 BYTE-IDENTICAL +0.000002. FAILURE MECH verified architectural fact: the build dampener is INERT on mixed by construction -- mixed opens 3 longs and never flips/scales-in via increases; its emission-layer resizes are REDUCTIONS, the 54 small partial trims, NOT builds. Reconfirms prior session root-cause finding, mixed path is reductions-only at emission. The build side is structurally dead for mixed specifically. Only effect was rally -0.005 a dampened scale-in build. Reverted strategy.py to 1d764b9f path-scoped checkout. 1st architectural discard.
e12e25e7	0.673022	0.740743	0.225737	0.961878	0.729861	1.011417	0.592093	0.408468	discard	Exp2 architectural indep: MTM-chop AMPLIFIER on the target-EMA loss-gate (upstream of emission quantization). A counter-trend LOSING position that is ALSO choppy, low MTM-path-efficiency dead capital, gets the EMA alpha cut further, up to 30pct more, so it tracks the raw shrinking target faster -> de-risk sooner. NEW data dep: the MTM-path-efficiency axis, proven at the emission reduction throttle baseline 1d764b9f, now ALSO feeds the upstream target-EMA loss-gate. MEASURED vs 1d764b9f 0.689311: composite -0.016289, mean -0.014005, std +0.007612, min_stability 0.845->0.773. PER-REGIME: bull/crash/sideways BYTE-IDENTICAL, rally 0.662116->0.592093 -0.070023 raw 0.662->0.651824 -0.010 stab 1.0->0.908 BELOW knee, rally is the only ct-heavy regime where this gate bites, its pullback shorts are ct+losing+choppy, faster alpha-cut changed exit timing -> stab collapse + raw drop, mixed 0.408468 BYTE-IDENTICAL. FAILURE MECH verified architectural fact: the target-EMA is UPSTREAM of emission quantization, so the MTM-chop amplifier here is INERT on mixed, same re-quantization wall as Exp1 build side and prior-session root cause row 1221 finding 6/7. The chop axis only reaches mixed at the EMISSION reduction layer downstream of all quantization. Reconfirms: ANY mechanism not at the emission reduction layer is structurally inert on mixed. Only rally, the ct-loser regime, was affected, and negatively. Reverted strategy.py to 1d764b9f path-scoped checkout. 2nd architectural discard.
3ec0f9fe	0.687770	0.753636	0.219555	0.962364	0.730121	1.010531	0.661382	0.403785	discard	Exp3 architectural indep: EFFICIENCY-TREND modulator on the emission reduction throttle. The chop signal is the LEVEL of MTM-path-efficiency; its DERIVATIVE is a new orthogonal axis. Splits 12-bar pos_pnl path into halves, compares per-half efficiency, maps the delta through symmetric tanh: declining efficiency, deteriorating dead capital, amplify chop trim harder; rising efficiency, recovering into a winner, attenuate chop spare it. Modulates _mtm_chop by [0.5,1.5]. NEW data axis + new control flow on the emission reduction layer, the one reaching mixed. MEASURED vs 1d764b9f 0.689311: composite -0.001541, mean -0.000112 flat, std +0.001430. PER-REGIME all stab 1.0 raw==score no flips: bull 0.961878->0.962364 +0.000486, crash 0.729861->0.730121 +0.000260, sideways 1.011417->1.010531 -0.000886, rally 0.662116->0.661382 -0.000734, mixed 0.408468->0.403785 -0.004683 REGRESSED. FAILURE MECH: the derivative axis DOES reach mixed, unlike Exp1/Exp2, confirming emission-reduction-layer exclusivity, but the modulation DIRECTION is wrong. mixed wrong-side longs in a downtrend have a smoothly DECLINING pos_pnl path, whose path efficiency is HIGH, a smooth monotonic bleed is efficient even though losing. The efficiency-trend signal classifies mixed smooth-bleed positions as not-deteriorating-in-choppiness, stable efficiency, little modulation, and where it did modulate it ATTENUATED trims of positions briefly recovering, rising efficiency, sparing dead capital that then bled more. Net negative on mixed. KEY FINDING: the level-based chop signal, baseline, is correct because it flags whipsaw regardless of PnL sign; the efficiency-DERIVATIVE conflates smooth with good which breaks for wrong-side-trend positions, a smooth losing trend is efficient but bad. Do not use efficiency-derivative as a goodness signal for wrong-side positions. Reverted strategy.py to 1d764b9f path-scoped checkout. 3rd architectural discard.
e131fbba	0.689386	0.754819	0.218110	0.962351	0.729861	1.011058	0.662358	0.408468	discard	Exp1 architectural indep: CROSS-SYMBOL MTM-PATH-CHOPPINESS entry shrink. NEW cross-symbol x cross-state data dep: _conc_shrink reads aggregate same-direction NOTIONAL (magnitude); this reads aggregate same-direction MTM-PATH QUALITY (the _pnl_path state the kept reduction throttle validated). When other same-direction held positions are choppy dead capital (low path-eff), a new correlated same-dir entry is a low-quality pile-up (mixed 3 correlated longs whipsaw) -> smaller first-bar commitment. Shrink-only max 0.20, pos-weighted, direction-aware. MEASURED vs 1d764b9f 0.689311: composite +0.000075 SUB-NOISE, mean +0.000071. PER-REGIME all stab 1.0 raw==score: bull 0.961878->0.962351 +0.000473, crash 0.729861 BYTE-IDENTICAL, sideways 1.011417->1.011058 -0.000359, rally 0.662116->0.662358 +0.000242, mixed 0.408468 BYTE-IDENTICAL. FAILURE MECH (architectural fact): the peer-chop gate is structurally INERT on mixed by construction -- mixed opens its 3 correlated longs ~simultaneously, so at each entry the peer symbols have <4 bars of _pnl_path (len(_ppp)>=4 gate skips them) -> peer_chop=0 -> no shrink. By the time peers accumulate path history, no new entry is occurring. Entry-side peer-path cannot reach simultaneous correlated entries. Reverted to 1d764b9f. Architectural discard.
-	-	-	-	-	-	-	-	-	session-summary	SESSION (baseline 1d764b9f 0.689311 5-regime -> UNCHANGED, no keep): 3 independent architectural experiments (Exp1-3, all discards), no branch. Baseline 1d764b9f re-verified byte-identical at session start (composite 0.689311, all stab 1.0 raw==score, no flips) [bull 0.961878 Sh1.9995, crash 0.729861 Sh1.271, sideways 1.011417 Sh2.017, rally 0.662116 Sh1.530, mixed 0.408468 Sh0.802 DD2.80; mixed is the binding regime, 3x below next-weakest rally]. results.tsv append-only preserved throughout (path-scoped git checkout -- strategy.py for each discard, never git revert). THEME: extend the just-kept MTM-path-efficiency emission reduction throttle (baseline 1d764b9f, +0.0034 keep last session) to its symmetric/orthogonal complements to find further mixed headroom. KEY MEASURED FINDINGS (all verifiable this session): (1) EXP1 BUILD DAMPENER -- symmetric complement on the same-sign INCREASE branch at emission (damp builds of choppy dead capital, same 3 gates). mixed BYTE-IDENTICAL (+0.000002). FAILURE MECH verified architectural fact: mixed opens 3 longs and never flips/scales-in via increases; its emission-layer resizes are REDUCTIONS (the 54 small partial trims), NOT builds. The build side is structurally dead for mixed. rally -0.005 (a dampened scale-in build). (2) EXP2 TARGET-EMA CHOP AMPLIFIER -- feed MTM-chop into the upstream target-EMA loss-gate (cut alpha more for choppy ct-losers). mixed BYTE-IDENTICAL. rally STABILITY COLLAPSE 1.0->0.908 (raw -0.010, score -0.070) -- faster alpha-cut changed ct-loser exit timing. FAILURE MECH: target-EMA is UPSTREAM of emission quantization, so MTM-chop there is inert on mixed (same re-quantization wall as Exp1 + prior-session row 1221 finding 6/7). Only rally, the ct-loser regime, was affected, and negatively. (3) EXP3 EFFICIENCY-TREND MODULATOR -- on the emission reduction layer (the one reaching mixed); second-order path signal = DERIVATIVE of MTM-efficiency (declining efficiency = deteriorating dead capital -> amplify trim; rising = recovering -> spare). mixed MOVED (-0.0047, NOT inert -- confirms the derivative axis DOES reach mixed via the emission reduction layer) but DIRECTION WRONG: mixed's wrong-side longs in a downtrend have a smoothly DECLINING pos_pnl path whose path efficiency is HIGH (smooth monotonic bleed is efficient even though losing), so the derivative conflates smooth-with-good and breaks for wrong-side-trend positions -- it attenuated trims of briefly-recovering dead capital that then bled more. CONVERGENT CONCLUSION (3 experiments, 3 different layers/axes, same verdict): mixed responds ONLY at the emission reduction layer; there, the LEVEL-based chop signal (baseline) is correct because it flags whipsaw regardless of PnL sign, while the DERIVATIVE conflate smooth-with-good (wrong for wrong-side trends); the build side and all upstream layers are structurally inert on mixed (re-quantization wall). The reduction throttle's 3 gates (grind_gate/strong_trend_fade/winner_fade) are at their efficient frontier (prior 9-step branch saturated steps 6/7/8). mixed is at a HARD STRUCTURAL FLOOR: 100pct-long-in-a-down-year, never exits (build/flip/exit branches all inert), reductions tiny (re-quantized by emission floor +grid), statistically undetectable online (prior row 1221 finding 2). No further non-regime-detection mechanism plausibly moves mixed. NOTE: an interleaved commit e131fbba (another agent's cross-symbol MTM-path-choppiness entry shrink) landed on this shared branch mid-session; my path-scoped checkout -- strategy.py to baseline 1d764b9f for the Exp3 discard overwrote its strategy.py content (commit remains in history). Final strategy.py verified byte-identical to baseline 1d764b9f (diff exit 0). NEW BASELINE 0.689311 UNCHANGED.
4bf5f622	0.689352	0.754785	0.218109	0.961878	0.729861	1.011417	0.662300	0.408468	discard	Exp1 architectural indep: CROSS-BOOK WRONG-SIDE exit pressure (8th MAX-fusion soft source; NEW cross-symbol data dep -- exit pressure from portfolio NET exposure x BTC multi-day leader trend, fires when book is net-long AND BTC in sustained downtrend = mixed's all-year wrong-side-long signature; saturating tanh gates). MEASURED vs 1d764b9f 0.689311: composite +0.000041 SUB-NOISE, mean +0.000037. PER-REGIME all stab 1.0 raw==score no flips: bull BYTE-IDENTICAL 0.961878, crash BYTE-IDENTICAL 0.729861, sideways BYTE-IDENTICAL 1.011417, rally 0.662116->0.662300 +0.000184 (marginal), mixed BYTE-IDENTICAL 0.408468. FAILURE MECH (architectural fact): the wrong-side exit pressure did NOT fire on mixed -- mixed's 3 longs are held by per-symbol exit primitives that never individually saturate, BUT the portfolio net-exposure gate (deep net-long AND BTC downtrend) DID activate yet produced zero mixed movement, reconfirming prior-session root-cause row 1236 finding: mixed positions never exit because the EMISSION quantization floor re-quantizes every reduction to the same grid; an exit-PRESSURE source adds to the MAX fusion but the downstream emission floor still rounds reductions to zero. mixed is at the HARD STRUCTURAL FLOOR (100pct-long-in-a-down-year, reductions tiny/re-quantized, statistically undetectable online). The exit-pressure layer is upstream of emission -> inert on mixed by the same re-quantization wall as Exp1-build/Exp2-targetEMA/Exp3-deriv prior session. Only rally moved marginally (+0.0002). Reverted strategy.py to 1d764b9f path-scoped checkout. 1st architectural discard.
6a7756ab	0.689288	0.754733	0.218149	0.961878	0.729862	1.011416	0.662122	0.408387	discard	Exp2 architectural indep: LINEARITY-CONDITIONED admission relaxation (R^2 x trend-strength conjunction at admission boundary). The chop-tightening (0.20*(1-rsi_trend_str)) assumes low-trend=chop; but a low-trend HIGH-R^2 path is a clean sideways mini-trend. Partially offset the tightening (up to 40pct) when path R^2 is high, so a marginal clean sideways trade clears admission (target: 49->50 trades, sample_factor 0.9899->1.0, sideways +0.01). NEW admission-boundary data dep distinct from entry-size _tq_atten (opposite R^2 tail, size axis). MEASURED vs 1d764b9f 0.689311: composite -0.000023 SUB-NOISE, mean -0.000015. PER-REGIME all stab 1.0 raw==score: bull BYTE-IDENTICAL 0.961878, crash 0.729861->0.729862 +0.000001, sideways 1.011417->1.011416 -0.000001 BYTE-IDENTICAL, rally 0.662116->0.662122 +0.000006, mixed 0.408468->0.408387 -0.000081. TRADES UNCHANGED: sideways 49 (target 50 NOT reached -- relaxation did NOT add a trade), bull 52, crash 55, rally 102, mixed 43. FAILURE MECH (architectural fact): the relaxation was INERT on sideways trade count -- the 49->50 marginal sideways trade was NOT sitting just below the admission threshold on a high-R^2 low-trend bar; either no qualifying bar existed (the chop-tightening was not the binding constraint for the missing sideways trade) or the relaxation fired but changed no discrete entry decision. The tiny mixed -0.000081 wobble (no other regime moved >0.000006) indicates the offset activated on a mixed bar (mixed has low-trend stretches) shifting one entry timing marginally, but added no net trade. Confirms: sideways sample_factor damping (sqrt(49/50)=0.9899) is NOT recoverable via admission relaxation -- the missing marginal trade is not chop-tightening-bound. The 4x-leverage sideways trade-count drop (52->48->49 via SIDEWAYS_BOOST) is a grid/structure property, not an admission-threshold lever. Reverted strategy.py to 1d764b9f path-scoped checkout. 2nd architectural discard.
