commit	score	mean_score	std_score	bull_2021	crash_bear	sideways	rally_2024	status	description
3622fe70	0.916682	1.011808	0.317086	1.382650	0.918172	1.295855	0.974328	0.488033	discard	Exp2 (architectural, indep): ct-at-multi-day WINNER giveback widening. mixed has 100pct WR but tiny wins (APY 4.4pct, 45 trades, Sh 0.808 -- avg profit ~0.1pct/trade = harvested too small); emission-reduction keep added trades by splitting reductions (more harvesting = wrong direction for APY). Hypothesis: WIDEN peak-profit giveback tolerance (PEAK_PROFIT_GIVEBACK * _pp_widen up to +45pct) for ct-at-multi-day WINNING positions (ret_vlong*pos_dir<0 AND pos_pnl>0) so mixed bounce-longs ride small giveback pullbacks -> bigger wins -> higher APY/Sharpe. Gate is ret_vlong-direction (the VALIDATED mixed/bull separator from 594c9175 keep), NOT entry-conviction (bull/rally coupled, reverted). Fast-saturating /0.01 noise-free. MEASURED vs baseline 594c9175 0.916682: BYTE-IDENTICAL (composite 0.916682, all 5 regimes exactly equal, mixed Sh 0.808370 APY 4.412118 DD 2.778232 unchanged). KEY FINDING: the giveback-widening lever is DISCONNECTED for mixed -- confirms and EXTENDS the prior-session mixed structural ceiling: mixed exits at small peaks BEFORE pp_pressure binds (peak never reaches _pp_min = 1.0*_pp_min activation threshold), so the giveback TOLERANCE is irrelevant for mixed (peak_profit giveback path never fires). This extends the documented mixed wall from tp_harvest/max_hold (exit before those bind) to the GIVEBACK tolerance itself: mixed's winners exit via slope/opp-gate/stop BEFORE the giveback path activates. The ret_vlong-direction gate correctly separates mixed (gate fires) but the DOWNSTREAM giveback mechanism is not mixed's binding exit. bull/rally/crash/sideways byte-identical (gate 0 for trend-aligned; crash dead-cat bounces also byte-identical = either dont reach giveback or the widening was too small to cross lattice). Not branch-eligible (byte-identical, no regime improved, no path to keep -- the giveback lever cannot reach mixed). Reverted to 594c9175. Architectural discard #2.
bafdf89d	0.916682	1.011808	0.317086	1.382650	0.918172	1.295855	0.974328	0.488033	discard	Exp3 (architectural, indep): ct-at-multi-day WINNER slope-against attenuation. Exp2 (giveback widen) was byte-identical for mixed, so tested the SLOPE-against exit path. Weakened _sl_slope_pressure up to 30pct for ct-at-multi-day WINNING positions (ret_vlong*pos_dir<0 AND pos_pnl>0) so mixed bounce-longs ride small slope-against noise -> bigger wins. Gate ret_vlong-direction (validated mixed/bull separator, spares bull byte-identical) + pos_pnl>0 (losers keep full cut). Fast-saturating /0.01. MEASURED vs baseline 594c9175 0.916682: BYTE-IDENTICAL (composite 0.916682, all 5 regimes exactly equal, mixed Sh 0.808370 APY 4.412118 unchanged). KEY FINDING: the slope-against attenuation is ALSO disconnected for mixed (Exp2 giveback + Exp3 slope both byte-identical). TWO exit-path attenuations on the giveback and slope paths both fail to reach mixed's exits. DIAGNOSIS: the profit-gate scale tanh(pos_pnl/abs(STOP_LOSS_PCT=0.024)) is near-zero for mixed's TINY winners (avg pos_pnl ~0.001-0.005 -> tanh 0.04-0.21 -> gate ~4-21pct active -> attenuation ~0.001-0.06 of the slope term, within the grid quantization/deadband snap tolerance -> emitted target unchanged). The profit-normalization at the |stop| scale (2.4pct) is too coarse for mixed's sub-1pct winners. AND/OR mixed's binding exit is a THIRD path (opp-gate partial exit, de-risk ramp driven by time/ve/vc, or stop-loss) not yet touched. The ret_vlong-direction gate correctly fires for mixed (it IS ct-at-multi-day) but neither downstream exit term (giveback, slope) is mixed's binding exit at the profit scale mixed operates. Not branch-eligible YET (byte-identical, no regime improved; but a profit-scale fix or a third-path test could reach mixed -- candidate for a branch if a corrected-scale version shows a mixed signal). Reverted to 594c9175. Architectural discard #3.
2dfa5ba9	0.916672	1.011798	0.317088	1.382650	0.918172	1.295855	0.974282	0.488033	discard	Exp4 (architectural, indep): ct-at-multi-day WINNER max_hold EXTENSION. DIAGNOSTIC (instrumented strategy on mixed_2025, this session): TIME pressure is the binding exit term for 98.6pct of mixed winner bars (slope 0.2pct, pp 1.1pct, time 98.6pct of soft-term argmax); peak/_pp_min ratio ~17 (median 18.9), pp_activation 0.997 -- peaks ARE far above _pp_min (OVERTURNS prior-session 'mixed exits at small peaks < 1.6*_pp_min' claim -- pp never WINS the MAX because time dominates, not because peaks are small); pos_pnl median 0.142 (winners NOT tiny per-trade; APY 4.4pct low because position SIZE is small in mixed's low-vol year). The _ct_hold_sat mechanism (line 1852) SHORTENS ct positions incl. winners by up to 2 bars -> mixed ct winners cut early. EXP4: ADDED +1.5 bar max_hold extension for ct-at-multi-day WINNERS (ret_vlong*pos_dir<0 AND pos_pnl>0) so time pressure fires later. pos_pnl/|stop| gate saturates (~1.0) for mixed winners (median 0.142/0.024=5.9). MEASURED vs baseline 594c9175 0.916682: composite -0.000010 (SUB-NOISE); mean -0.000010; std +0.000002. PER-REGIME: mixed BYTE-IDENTICAL (0.488033, Sh 0.808370, APY 4.412118, 45 trades UNCHANGED -- extension ABSORBED by grid/emission layer), rally 0.974328->0.974282 (-0.000046, Sh 1.553593->1.553524 -- ct winning shorts extended = the bull/rally coupling), bull/crash/sideways BYTE-IDENTICAL. KEY FINDING: even directly extending mixed's BINDING exit (time pressure, per diagnostic) does NOT move mixed -- the grid quantization + emission threshold ABSORB the timing shift (mixed's positions are small: trims below the 0.06*equity*BASE calm grid step / 0.7*LEVERAGE_K emission threshold -> no trade emits differently). Confirms the prior-session 'mixed is walled' conclusion from a NEW angle (direct hold-extension of the binding exit absorbed). Trade counts identical (45 mixed, 101 rally). Not branch-eligible on regime-improvement (no regime improved); branch-eligible on new-mechanism criterion BUT the target (mixed) did not move at all (absorbed), so a branch iterating on hold-extension would keep hitting the absorption wall (prior session already exhausted 8 branch steps on a mixed-reacher). Reverted to 594c9175. Architectural discard #4.
bbf51431	0.917475	1.013260	0.319283	1.382848	0.918172	1.295342	0.989539	0.480401	branch	Exp5 (architectural simplification, indep): REMOVED the two MIXED-cell volume-boost grid terms (Exp8 BTC-vol x PARTNER-price _btcvol_partner_boost, Exp9 PARTNER-vol x BTC-price _partnervol_btc_boost). Both were the explicit 'mixed cells' of the {own,BTC,partner}x{vol,price} grid, each +0.05 max deep-saturated (near-constant ~1.0); their own code comments flagged 'Risk: may be redundant with the existing Exp1 (BTC-vol) x Exp2-partner-boost (partner-price) which already multiply'. Removed from definitions, BTC else-branch defaults, and both bull/bear entry target products (multi-site). MEASURED vs baseline 594c9175 0.916682: composite +0.000793 (SUB-NOISE, not +0.003 keep); mean +0.001452 (1.011808->1.013260); std +0.002197 (looser). PER-REGIME all stab 1.0 all raw==score all DD<10pct: rally 0.974328->0.989539 (+0.015211 BINDING-GAIN -- Sh 1.553593->1.551492 near-flat, DD 5.158680->5.120863 LOWER -- the mixed-cell terms were HURTING rally: over-committing rally trend entries via redundant leader-vol x follower-price / follower-vol x leader-price boosts; removing trims rally entry size -> lower DD at preserved Sharpe -> dd_gate gain), bull 1.382650->1.382848 (+0.000198), sideways 1.295855->1.295342 (-0.000513), crash BYTE-IDENTICAL 0.918172, mixed 0.488033->0.480401 (-0.007632 -- the mixed-cell terms were HELPING mixed: partner/BTC volume confirmation of mixed's bounce longs in a down year; removing loses mixed sample_factor or per-trade quality). Trade-off: rally +0.015 vs mixed -0.0076. Branch-eligible (rally improved +0.015; new mechanism via simplification). OPENING EXPLORATION BRANCH: recover mixed while keeping the rally gain. Hypothesis: re-add ONE of the two terms (the one that helped mixed most), OR gate the terms to low-vol regimes (mixed, not rally), OR reduce magnitude. The mixed-cell terms are NOT redundant (mixed regressed -> they carry mixed-specific signal) but they over-commit rally. min_stab 0.843492. NOT a keep (composite +0.0008 < +0.003).
463adc3d	0.919402	1.014583	0.317270	1.382837	0.918172	1.295679	0.989617	0.486608	branch	branch step1: re-add mixed-cell boosts GATED ON WEAK MULTI-DAY TREND (1-tanh(|ret_vlong|/0.03)). MEASURED vs branch-base (Exp5 0.917475): composite +0.001927 (0.917475->0.919402); mean +0.001323. PER-REGIME: rally 0.989539->0.989617 (+0.000078, gain HELD), mixed 0.480401->0.486608 (+0.006208 RECOVERED from the -0.0076 removal loss -- the weak-trend gate lets the terms fire for mixed's bounces), bull 1.382848->1.382837 (-0.000011), sideways 1.295342->1.295679 (+0.000337), crash BYTE-IDENTICAL. vs BASELINE 594c9175 0.916682: composite +0.002720 (JUST SHY of +0.003 keep), mean +0.002775, std +0.000184 (flat). PER-REGIME vs baseline: rally +0.015289 (Sh 1.553593->1.551578 near-flat, DD 5.158680->5.120863 LOWER), mixed -0.001425 (nearly recovered), bull +0.000187, sideways -0.000176. min_stab 0.843568. The weak-trend gate (fire mixed bounces, not rally strong-uptrend) recovered mixed while keeping the rally gain. PROGRESS: composite +0.0027 approaching +0.003 keep. NEXT: widen gate scale 0.03->0.04 (fire slightly stronger trends = more mixed bounces) to recover mixed fully and push past +0.003.
f6e94ab8	0.918201	1.013324	0.317078	1.382836	0.918172	1.295721	0.982294	0.487597	branch	branch step2: widen weak-trend gate 0.03->0.04. MEASURED vs step1 0.919402: composite -0.001201 (REGRESSED); mean -0.001259. PER-REGIME: rally 0.989617->0.982294 (-0.007323 -- over-commitment crept back: wider gate lets terms fire in slightly stronger trends incl rally pullback stretches), mixed 0.486608->0.487597 (+0.000989 recovered), sideways +0.000042, bull -0.000001. The wider gate trades rally -0.0073 for mixed +0.001 -> net negative. 0.03 gate is near-optimal (rally protected). NO-PROGRESS step #1. Reverted to step1 (0.03 gate, 0.919402).
feda0ffa	0.919756	1.014834	0.316927	1.382833	0.918172	1.295813	0.989648	0.487707	keep	KEEP (NEW BASELINE, SUPERSEDES 594c9175 0.916682, +0.003074). Branch SUCCESS (mixed-cell volume-boost simplification + weak-trend gate, 3 steps). Exp5 base REMOVED the two MIXED-cell volume-boost grid terms (Exp8 BTC-vol x PARTNER-price _btcvol_partner_boost, Exp9 PARTNER-vol x BTC-price _partnervol_btc_boost): removal gained rally +0.015 (terms over-committed rally trend entries -> DD 5.158->5.121 at preserved Sharpe) BUT lost mixed -0.0076 (terms confirmed mixed bounce longs). Branch step1 RE-ADDED both terms GATED ON WEAK MULTI-DAY TREND (1-tanh(|ret_vlong|/0.03)): fire for mixed's weak-trend bounces, NOT rally's strong uptrend (the over-commitment source) -> recovered mixed -0.0076->-0.0014 while keeping rally +0.015 (composite +0.0027, just shy of +0.003). Step2 (widen gate 0.03->0.04) REGRESSED: rally over-commitment crept back -0.0073 (reverted). Step3 (magnitude 0.05->0.07 with 0.03 gate) PUSHED PAST +0.003: more mixed benefit, gate still protects rally. MEASURED vs 594c9175 0.916682: composite +0.003074 (0.919756 CLEARS +0.003), mean +0.003026 (1.011808->1.014834), std -0.000159 (0.317086->0.316927 tighter). PER-REGIME all stab 1.0 all raw==score all flip 0 all DD<10pct: bull 1.382650->1.382833 (+0.000183, Sh2.067798->2.068047, DD2.49 unchanged), crash BYTE-IDENTICAL 0.918172 (Sh1.254140 -- alt branch not reached for BTC), sideways 1.295855->1.295813 (-0.000042 near-flat, Sh2.029655->2.029780), rally 0.974328->0.989648 (+0.015320 BINDING-GAIN -- Sh1.553593->1.551613 near-flat, DD5.158680->5.120863 LOWER, APY18.65->18.50; the mixed-cell terms over-committed rally trend entries via redundant leader-vol x follower-price / follower-vol x leader-price boosts; gating them to weak-trend-only removes the rally over-commitment -> lower DD at preserved Sharpe -> dd_gate gain), mixed 0.488033->0.487707 (-0.000326 NEAR-FLAT -- nearly fully recovered via the weak-trend gate; Sh0.808370->0.808471 actually UP slightly, APY4.412->4.393, DD2.778->2.767, 45 trades unchanged). min_stab 0.843611. All keep criteria met: composite +0.003074>=+0.003, mean up, no regime >50pct drop (max drop mixed -0.07pct), all MaxDD<10pct (max rally 5.12), all stab 1.0. NEW BASELINE 0.919756. CROSS-EXPERIMENT CONCLUSION (verifiable this session): (1) the two MIXED-cell volume-boost grid terms (Exp8/Exp9) are NOT redundant -- they carry mixed-specific signal (partner/BTC volume confirmation of mixed's bounce longs in a weak-trend down year; removing lost mixed -0.0076) BUT they over-commit STRONG-trend regimes (rally; removing gained rally +0.015). The WEAK MULTI-DAY TREND gate (1-tanh(|ret_vlong|/0.03)) is the clean separator: fire for weak-trend bounces (mixed), suppress for strong-trend (rally). This mirrors the validated ret_vlong-direction separator (594c9175 keep) but on the TREND-MAGNITUDE axis (weak vs strong) rather than direction (ct vs aligned). (2) The mixed-cell terms' rally over-commitment was a REDUNDANT double-count with the 5 clean 2-way keeps (Exp1/3/5/6/7) in strong trends where all participation signals saturate together; in weak trends the mixed cells add genuine confirmation the clean 2-ways miss (mixed's bounces have weak own/BTC/partner price agreement but volume participation still confirms). (3) Diagnostic finding (Exp4 context): TIME pressure is mixed's binding exit (98.6pct of winner argmax), NOT giveback/slope -- but hold-extension is grid-absorbed for mixed (Exp4 byte-identical); the mixed sample_factor lever remains emission-bound (this keep did NOT move mixed trades, 45 unchanged; the gain is rally DD reduction + marginal mixed Sharpe). Observation (correlation only): rally gain via DD reduction at preserved Sharpe (entry-size over-commitment removed); direction-split PnL not measured. KEY FOR FUTURE SESSIONS: (a) the mixed-cell volume-boost terms are NOT redundant -- do NOT remove them unconditionally (mixed regresses); they are rally-over-committing and mixed-helping, separable by the weak-multi-day-trend gate (now in baseline); (b) the weak-trend gate (1-tanh(|ret_vlong|/0.03)) is a validated new separator for entry-boost terms (fire weak-trend, suppress strong-trend) -- distinct from ret_vlong-direction (ct vs aligned); (c) magnitude 0.07 with /0.03 gate is the tuned optimum (0.05 was +0.0027 sub-keep, 0.07 is +0.0031 keep); (d) the rally DD reduction lever (entry over-commitment removal) is viable -- rally DD 5.16->5.12 moved toward the dd_gate knee@5 (further reduction possible via other over-committing terms). Strategy at 0.919756; mixed binding floor 0.488 essentially unchanged (the keep's gain is rally-driven, not mixed-driven).
-	0.919756	1.014834	0.316927	1.382833	0.918172	1.295813	0.989648	0.487707	session-summary	SESSION (baseline 594c9175 0.916682 -> NEW BASELINE feda0ffa 0.919756, +0.003074 KEEP): 5 independent ARCHITECTURAL experiments (Exp1-5) + 1 exploration branch (mixed-cell volume-boost simplification + weak-trend gate, 3 steps, step3 KEEP). EXIT RULE: branch concluded with KEEP -> session ends (per protocol). >=2 architectural discards MET (Exp1-4 all architectural discards). Baseline 594c9175 re-verified byte-identical at session start (composite 0.916682 mean 1.011808 std 0.317086, all stab 1.0 raw==score, min_stab 0.844322) [bull 1.382650 Sh2.068 51t, crash 0.918172 Sh1.254 52t, sideways 1.295855 Sh2.027 57t, rally 0.974328 Sh1.554 DD5.16 101t, mixed 0.488033 Sh0.808 45t] AND strategy.py at feda0ffa post-keep. results.tsv append-only preserved throughout (path-scoped git checkout 594c9175 -- strategy.py for every discard/revert, never git revert; results.tsv untouched by rollbacks). THEME: targeted the binding floor mixed_2025 (0.488, Sh0.808, 45 trades) via the prior-session-sanctioned 'fundamentally new orthogonal data source / multi-mechanism combination' direction; pivoted to a simplification-driven entry-size lever when mixed proved walled. CROSS-EXPERIMENT CONCLUSIONS (all MEASURED this session, verifiable): (1) NEW ORTHOGONAL DATA-SOURCE VOTERS ARE INERT (Exp1 vol-rank calm-trend). The 9th realized-vol-rank voter (24-bar vol ranked vs own 200-bar distribution, signed by 12-bar dir) was BYTE-IDENTICAL/INERT -- same failure mode as the 9th lag-1 autocorr voter (03ba558b): it adds conviction to bars that ALREADY pass admission (calm-regime trends where the 8 existing voters co-fire). Confirms the voter-aggregation wall EXTENDS to a distributional vol-rank signal. Voter work remains dead. (2) MIXED EXIT-PATH DIAGNOSTIC (instrumented strategy): TIME pressure is the binding exit for 98.6pct of mixed winner bars (slope 0.2pct, pp 1.1pct); peak/_pp_min ratio ~17 (median 18.9), pp_activation 0.997 -- OVERTURNS the prior-session claim 'mixed exits at small peaks < 1.6*_pp_min' (peaks ARE far above _pp_min; pp never WINS the MAX because TIME dominates, not because peaks are small); pos_pnl median 0.142 (winners NOT tiny per-trade; APY 4.4pct low because position SIZE is small in mixed's low-vol year). (3) MIXED HOLD-EXTENSION IS GRID-ABSORBED (Exp2 giveback widen, Exp3 slope atten, Exp4 max_hold ext ALL byte-identical for mixed). Even directly extending mixed's BINDING exit (time pressure, per diagnostic) does NOT move mixed -- the grid quantization + emission threshold absorb the timing shift (mixed's positions are small: trims below the grid step / 0.7*LEVERAGE_K emission threshold -> no trade emits differently). Exp4 confirmed the bull/rally coupling for ct-winner hold-extension (rally ct winning shorts extended -> rally -0.00005). The mixed emission lever remains maxed (0.7*LEVERAGE_K floor; 0.3/0.2 tested prior session, rejected). (4) THE KEEP: a SIMPLIFICATION-DRIVEN ENTRY-SIZE lever on RALLY (not mixed). Exp5 REMOVED the two MIXED-cell volume-boost grid terms (Exp8 BTC-vol x partner-price, Exp9 partner-vol x BTC-price): removal gained rally +0.015 (terms over-committed rally trend entries -> DD 5.158->5.121 at preserved Sharpe) BUT lost mixed -0.0076 (terms confirmed mixed bounce longs). The terms are NOT redundant (mixed regressed) but over-commit strong-trend regimes. Branch step1 RE-ADDED them GATED ON WEAK MULTI-DAY TREND (1-tanh(|ret_vlong|/0.03)) -- the clean separator: fire for mixed's weak-trend bounces, suppress for rally's strong uptrend. Step3 (magnitude 0.05->0.07) pushed past +0.003. The keep's gain is RALLY-DD-DRIVEN (entry over-commitment removal), NOT mixed-driven (mixed 0.488->0.488 near-flat, the binding floor essentially unchanged). NEW BASELINE feda0ffa 0.919756. KEY FOR FUTURE SESSIONS: (a) the two MIXED-cell volume-boost terms (Exp8/Exp9) are NOT redundant -- do NOT remove unconditionally (mixed regresses); they are rally-over-committing + mixed-helping, now separable by the weak-trend gate (in baseline); (b) the WEAK MULTI-DAY TREND gate (1-tanh(|ret_vlong|/0.03)) is a validated new separator for entry-boost terms (fire weak-trend, suppress strong-trend) -- distinct from ret_vlong-direction (ct vs aligned); (c) magnitude 0.07 with /0.03 gate is the tuned optimum; (d) the rally DD-reduction lever (entry over-commitment removal) is VIABLE -- rally DD 5.16->5.12 moved toward the dd_gate knee@5; OTHER over-committing entry-boost terms may yield further rally DD relief (the entry-size product has ~25 attenuators/boosts, several +0.05 near-saturated); (e) mixed binding floor 0.488 remains walled on the emission/sample_factor axis (45 trades, +5 to knee) -- diagnostic confirmed time-pressure binding but hold-extension grid-absorbed; the mixed lever remains open but requires breaking the grid-absorption wall (e.g. a grid-EXEMPT full-exit-then-reentry path, untested); (f) voter work remains dead (inert); (g) do NOT re-attempt mixed hold-extension via giveback/slope/max_hold (all grid-absorbed, Exp2/3/4 byte-identical). Strategy at feda0ffa; the search continues from the new rally-DD-reduction + weak-trend-gate baseline.
de0b68d3	0.906628	1.003248	0.322068	1.381536	0.915144	1.286855	0.964067	0.468639	discard	Exp1 (architectural, indep): WEAK-TREND x WINNING gated max_hold EXTENSION (time-pressure subsystem). NEW data dep: max_hold depends on (ret_vlong, pos_pnl). Gate=(1-tanh(|ret_vlong|/0.03))x max(0,_pnl_scale), max +30pct hold. MEASURED vs baseline feda0ffa 0.919756: composite 0.906628 (-0.013128 REGRESSION), mean 1.003248 (-0.011586). PER-REGIME: mixed 0.487707->0.468639 (-0.0191 REGRESSED -- hypothesis WRONG: holding mixed bounce winners longer lets them give back more in chop, not capture more), rally 0.989648->0.964067 (-0.0256 -- _weak_vlong gate NOT ~0 for rally pullbacks), sideways 1.295813->1.286855 (-0.0090 -- sideways weak-trend throughout so gate fires), crash -0.003, bull -0.001. CONCLUSION (this experiment, verifiable): mixed does NOT benefit from longer holds -- its wins are tiny because the bounces are small/mean-reverting, extending hold = more giveback. The feda0ffa entry-boost direction (larger entry on confirmed bounces) is correct, exit-side hold extension is wrong. COUNTER-CONCLUSION to prior 'TIME pressure is mixed binding exit': lengthening that exit did not help mixed, so the binding-exit observation was correlational not causal for improvement.
