commit	score	mean_score	std_score	bull_2021	crash_bear	sideways	rally_2024	status	description
6c78bf0e	0.5232	0.6726	0.2990	0.78	0.76	0.97	0.17	branch	BRANCH-OPEN (architectural, new mechanism): trend-QUALITY R2 entry-size attenuator (_tq_atten=0.65+0.35*tanh(R2(log HL2,16)/0.30), shrink low-linearity entries). raw_composite 0.6277->0.6303 IMPROVED. RAW gains all 3 trend regimes: bull 0.776->0.780, crash 0.759->0.763, sideways 0.930->0.973 (+0.043!) - shrinking choppy whipsaw entries lifts trend-following Sharpe. rally raw ~flat 0.419->0.411 (-1.9pct). DISCARD-as-direct only due to rally STAB re-seed 0.809->0.628 (factor 0.426 -> rally final 0.175); IF rally stab held 1.0 composite=0.6304>baseline (raw_composite confirms). BRANCH HYPOTHESIS: strengthen R2 shrink on low-R2 entries to (a) amplify sideways/crash/bull raw and (b) shrink rally whipsaw entries enough to raise rally stab robustly. New non-zero-crossing signal (R2 always>=0, not walled admission-boundary family).
a4f0b2fa	0.5542	0.6956	0.2826	0.78	0.77	1.00	0.23	branch	branch step2: strengthen R2 shrink floor 0.65->0.40. raw_composite 0.6303->0.6317 (vs baseline 0.6277). RAW: bull 0.782 crash 0.766 sideways 1.001(+0.071 vs base) rally 0.405. rally STAB factor 0.426->0.576 (shrinking whipsaw entries DOES raise rally stab - hypothesis confirmed). composite 0.5232->0.5542. gap to keep = pure rally stab.
b7bc12e4	0.5627	0.7029	0.2805	0.78	0.77	1.01	0.25	branch	branch step3 (BRANCH BEST): deepen R2 shrink floor 0.40->0.25. raw_composite 0.6319. RAW bull 0.784 crash 0.768 sideways 1.013 rally 0.401. rally stab factor 0.576->0.616. composite 0.5627. Both raw_composite AND rally-stab gains DIMINISHING per floor step (+0.15 then +0.04 stab). IF rally stab held 1.0 composite=0.6316>baseline.
ebe17018	0.4476	0.5898	0.2842	0.47	0.76	0.94	0.19	branch	branch step4 (REGRESS): apply R2 atten to scale-in (RECOMPUTED mid-build). bull raw COLLAPSED 0.784->0.687, sideways 1.013->0.936. CAUSE: 16-bar R2 at scale-in time (bars1-3) reflects stale pre-entry choppy window -> wrongly shrinks clean-trend builds. raw_composite 0.632->0.600. scale-in via recomputed R2 = dead end (timing mismatch).
b33020e3	0.4611	0.6403	0.3585	0.81	0.74	0.97	0.04	branch	branch step5 (REGRESS): scale-in uses ENTRY-TIME frozen R2 (fix step4 timing). bull raw +0.029 (0.813, clean builds full) but crash 0.743 sideways 0.969 dropped AND rally STAB COLLAPSED 0.616->0.101 (factor 0.10). CAUSE: frozen-at-entry _entry_tq = PATH-DEPENDENT STATE (size depends on noisy entry-bar R2 + whether entry fired) -> diverges under noise -> hits statelessness-load-bearing wall. Both scale-in variants WALLED; entry-only stateless R2 (step3) is the safe state.
de412448	0.6393	0.7454	0.2120	0.78	0.77	1.01	0.42	keep	BRANCH KEEP step6 (SUPERSEDES 26f4b23d 0.6277 -> 0.6393, +0.0116 composite, +0.0243 mean 0.7211->0.7454, std 0.1868->0.2120). NEW MECHANISM: trend-QUALITY R2 entry-size attenuator, CHURN-GATED. _tq_r2=R2 of OLS fit of log(HL2) over 16 bars (continuous [0,1] path-linearity, no zero-crossing). _tq_atten=0.25+0.75*tanh(_tq_r2/0.30) shrinks low-R2 (choppy/whipsaw) ENTRIES; then gated _tq_atten=1-(1-_tq_atten)*_tq_calm with _tq_calm=1-max(0,tanh((len(_eh)-1.5)/0.6)) so shrink is FULL at low entry-churn (len<=1) and OFF at high churn (len>=3). Applied to first-bar entry size only (bull+bear). MEASURED (all stab factor 1.0): bull 0.776->0.781 Sh1.54->1.56, crash 0.759->0.768 Sh1.29->1.31, sideways 0.930->1.013 Sh1.71->1.94 (DOMINANT driver), rally 0.419->0.419 Sh0.735->0.736 (FLAT, stab 1.0 preserved by churn-gate). MaxDD bull1.25 crash0.73 sideways0.45 rally1.85 pct (all<10). min_stability 0.801. Byte-identical re-run verified. WHY IT WORKS (measured): un-gated R2 atten DROPPED rally stab 0.809->0.616 (R2-sizing on bursty rally entries adds noise); churn-gate turns shrink OFF in high-churn rally -> rally positions un-attenuated -> stab restored to 1.0, while sparse-entry sideways/crash keep the shrink+raw gains. Gain is sideways/crash dominated (NOT bull) - distinct from reverted bull-overfit abfb9591. Branch path: step1 open(floor0.65 rally stab0.426), step2 floor0.40(stab0.576), step3 floor0.25(stab0.616 raw banked), step4 scale-in recomputed-R2 (bull raw collapse, timing mismatch), step5 scale-in entry-time-R2 (rally stab 0.101, path-dependent-state wall), step6 CHURN-GATE = THE FIX. NEW BASELINE 0.6393.
de412448	0.6393	0.7454	0.2120	0.78	0.77	1.01	0.42	session-summary	session: cleaned 1 dangling exp + 2 independent architectural discards + 1 exploration branch (6 steps, KEPT). NEW BASELINE de412448 0.6393 SUPERSEDES 26f4b23d 0.6277 (+0.0116 composite, +0.0243 mean 0.7211->0.7454, std 0.1868->0.2120 WIDER from sideways outlier-high). FIRST baseline move since reverted abfb9591 - and this one is NOT bull-overfit (gain is sideways/crash dominated). DANGLING CLEANUP: 1c537437 (sizing chop-boost multiplicative->additive) interrupted before recording -> composite 0.4353, rally stab collapse, discard+rollback. INDEP EXP1 (discard): cross-symbol market-vol de-risk overlay (size*=1-0.35tanh((mean short/100bar vol -1.3)/0.5)) -> bull/crash/sideways BYTE-IDENTICAL (short/long vol RATIO normalizes in sustained crash -> inert) + rally collapse 0.419->0.000 (transient rally vol spikes fire the shrink). INDEP EXP2 = branch open: trend-QUALITY R2 entry-size attenuator (NEW orthogonal signal = OLS-fit R2 of log(HL2,16), path linearity, continuous [0,1] NO zero-crossing -> escapes the slope-sign admission wall). BRANCH JOURNEY: step1 R2 atten floor0.65 -> raw_composite 0.6277->0.6303 (bull/crash/sideways RAW all up, sideways +0.043) but rally STAB re-seed 0.809->0.628; steps2-3 deepen shrink floor->0.25 (sideways raw->1.013, rally stab recover 0.426->0.616 - shrinking whipsaw entries DOES raise stab, but un-gated R2-sizing keeps rally stab BELOW baseline 0.809); step4 R2-on-scale-in RECOMPUTED (bull raw collapse 0.784->0.687, 16bar R2 at scale-in reflects stale pre-entry window = timing mismatch); step5 scale-in FROZEN entry-R2 (rally stab 0.101 = PATH-DEPENDENT-STATE wall, reconfirms statelessness load-bearing); step6 CHURN-GATE the R2 shrink (_tq_atten=1-(1-_tq_atten)*(1-max(0,tanh((len(_eh)-1.5)/0.6)))) = THE FIX: shrink FULL at low entry-churn (sparse sideways/crash keep raw gains) OFF at high churn (bursty rally un-attenuated -> stab back to 1.0). FINAL all stab factors 1.0: bull 0.781 Sh1.56, crash 0.768 Sh1.31, sideways 1.013 Sh1.94 (DOMINANT, was 1.71), rally 0.419 Sh0.736 flat. MaxDD all<1.85pct. min_stability 0.801. Byte-identical re-run verified. CROSS-EXP CONCLUSIONS (load-bearing): (a) NEW PRODUCTIVE SIGNAL: trend R2 (path linearity) entry-size shrink lifts choppy-regime (sideways/crash) Sharpe - orthogonal to slope direction(walled)+magnitude(_consensus). (b) THE ENABLER = churn-gate: a NEW entry-SIZE signal that previously hit the rally-stab wall becomes net-positive when gated OFF in high-churn rally (same noise-immune integer-churn gate the baseline grids use); this CHURN-GATING-A-SIZE-SIGNAL pattern may unlock OTHER previously-rally-walled size filters. (c) WALLS RECONFIRMED: scale-in via recomputed-R2 (timing mismatch hurts clean-trend raw); scale-in via frozen-entry-R2 (path-dependent state collapses rally stab). (d) rally stab is RESET to 1.0 at new baseline -> the AST re-seed problem restarts from this new file; baseline std now WIDER (sideways high 1.013) so future sessions could attack std via rally/bull/crash raw or extend churn-gated-R2. (e) cross-exchange validation of this keep is UNKNOWN (not run this session); mechanism is general risk-reduction on low-linearity entries (more likely to generalize than bull-specific winner-holding) but future sessions should be alert if cross-ex is later checked.
-	0.5369	0.6887	0.3036	0.78	0.77	1.01	0.19	discard	ARCHITECTURAL vol-expansion-at-entry quality shrink (_ve_6/_ve_18 ratio, tanh shrink max -30pct, churn-gated by _tq_calm like R2 atten). MEASURED: composite 0.6393->0.5369, raw_composite 0.6396 (FLAT vs 0.6393). crash BYTE-IDENTICAL 0.767586 (vol_6/vol_18 RATIO normalizes to ~1 in sustained-vol crash -> filter inert, no shrink fired -> ZERO crash discrimination). bull 0.781251->0.781724 (+0.0005), sideways 1.013297->1.014366 (+0.001) tiny raw gains only. rally raw BYTE-IDENTICAL 0.419353 Sh0.736314 (churn-gate kept shrink OUT of rally entries) BUT stability_factor 1.0->0.455 (rally score 0.419->0.191), min_stability 0.8008->0.6366. Rally drop = pure AST re-seed artifact (raw byte-identical per row592 conclusion-a) NOT mechanism regression -> NOT branch-worthy (no fix for re-seed except removal). Breaches 50pct regime floor (rally -54pct). Architectural discard #1.
-	0.4927	0.6642	0.3431	0.78	0.77	1.01	0.09	discard	ARCHITECTURAL close-location-value (CLV=(close-low)/(high-low) avg 6 bars) intrabar-conviction entry shrink, direction-specific (bull shrinks at low CLV=distribution, bear at high CLV=bounce), churn-gated by _tq_calm. Uses only HLC (no open artifact). MEASURED: composite 0.6393->0.4927, raw_composite 0.6387 (FLAT). crash BYTE-IDENTICAL 0.767586, sideways BYTE-IDENTICAL 1.01331 (+0.00001), bull 0.781251->0.781519 (+0.0003 noise). rally raw 0.419353->0.417699 (CLV fired in a few low-churn rally entries) stab 1.0->0.226 score 0.094, min_stab 0.5678. CROSS-EXP w/ row612(vol-expansion): TWO orthogonal entry-size quality signals BOTH byte-identical in crash AND sideways -> entry-size quality-shrink channel SATURATED at de412448: upstream admission gates (persistence/consensus/trend) already pre-filter low-quality entries, surviving entries uniformly decent -> nothing for a new quality signal to selectively shrink (R2 keep took the last available drop). rally re-seeds down on every edit. Architectural discard #2.
-	0.5191	0.6784	0.3186	0.78	0.77	1.01	0.15	discard	ARCHITECTURAL churn-gated over-extension exit pressure (7th soft term; _oe_z=(mid-mean(HL2,24))/std(HL2,24) signed to pos dir, fires above z=2.0, *noise-immune churn gate =0 in bursty rally, profit-amp weight). MEASURED: composite 0.6393->0.5191, raw_composite 0.6389 (FLAT). bull BYTE-IDENTICAL 0.781249 (bull positions rarely reach 2-std vs their own 24-bar trailing mean in a grind -> term never fires; documented bull over-extension alpha is PROFIT/level-based 5-9pct per row568, NOT 24-bar price-z). crash raw 0.767586->0.765569 (-0.002, Sh1.311->1.305, term fired + marginally HURT crash shorts). sideways BYTE-IDENTICAL 1.013297. rally raw BYTE-IDENTICAL 0.419353 Sh0.736314 (churn-gate=0 made term ROBUSTLY inert across rally NOISE ENSEMBLE = design worked, escapes harvest-wall RAW collapse row568-B) BUT stab factor 1.0->0.366 (re-seed lottery, independent of inertness). KEY CONFIRM: churn-gate CAN make an EXIT term rally-raw-robust (byte-identical not just clean-inert) but (a) NO raw gain in bull(byte-id)/crash(-0.002), (b) rally stability still re-seeds. NOT branch-worthy (no regime improved). Architectural discard #3.
-	0.4493	0.6405	0.3825	0.78	0.77	1.01	0.00	discard	ARCHITECTURAL (selection) post-loss re-entry persistence tightening: _entry_persist_factor += 0.20*_loss_only*max(0,1-_bars_since_exit/8), raising the persistence floor for re-entries soon after a losing exit. MEASURED: composite 0.6393->0.4493, raw_composite 0.4493. bull/crash/sideways ALL BYTE-IDENTICAL (0.781251/0.767586/1.013297) -> post-loss re-entry suppression is ALREADY handled by the cooldown subsystem (_cooldown_factor size ramp + _loss_only cooldown-window stretch + _outcome_size_mult) -> this gate REDUNDANT, changed ZERO strong-regime trades. rally raw collapsed 0.419353->0.000 (stab factor 0.0, min_stab 0.429<0.50; gate blocked rally fast post-loss re-entries -> rally trade-count/stability collapsed). NOT branch-worthy (no regime improved; strong regimes byte-identical=redundant, rally collapsed). Architectural discard #4. CONFIRMS cooldown subsystem already saturates post-loss re-entry control.
-	0.6072	0.7273	0.2402	0.78	0.77	1.01	0.35	discard	ARCHITECTURAL SUBSYSTEM REDESIGN (entry admission): replaced binary strong-sum gate (_strong>=_strong_min) with continuous smoothstep admission->size ramp [0.85x,1.25x]*threshold, keeping trend+persistence gates. MEASURED: composite 0.6393->0.6072 (BEST of session 5 exps), raw_composite 0.63941 (FLAT). bull/crash/sideways ALL BYTE-IDENTICAL (0.781251/0.767586/1.013297) -> strong-regime entries sit DEEP above 1.25x threshold (saturated ramp region _adm=1.0) = identical to binary gate; their high-conviction entries do NOT live near the admission boundary, so even REMOVING the hard gate changes nothing. rally raw 0.419353->0.419484 (+0.0001 noise, mostly byte-id) stab factor 1.0->0.827 (stab 0.748, LEAST-BAD re-roll of session vs 0.636/0.568/0.366/0.429 -> consistent with removing-hard-boundary helps stability, but insufficient + no raw gain to compensate). NOT branch-worthy (strong regimes byte-identical=no raw signal to deepen; rally 0.748=re-seed not mechanism regression, unfixable). Architectural discard #5 -> EXIT RULE TRIGGERED (5 consecutive architectural discards).
de412448	0.6393	0.7454	0.2120	0.78	0.77	1.01	0.42	session-summary	session: 5 independent architectural discards (EXIT RULE at 5 consecutive architectural), 0 branches (none branch-worthy - NO regime raw improved in ANY exp). Baseline de412448 UNCHANGED 0.6393 [bull 0.781251 Sh1.556, crash 0.767586 Sh1.311, sideways 1.013297 Sh1.941, rally 0.419353 Sh0.736 stab0.801 = ALL factors 1.0; binding constraint rally]. 5 DISTINCT NEW mechanisms across 4 subsystems: (1) vol-expansion-at-entry size shrink churn-gated -> composite 0.5369, crash BYTE-IDENTICAL (vol_6/vol_18 ratio normalizes to ~1 in sustained-vol crash=inert), bull/sideways +0.0005/+0.001, rally raw byte-id stab re-seed 0.801->0.636. (2) close-location-value (CLV) intrabar-conviction shrink churn-gated -> composite 0.4927, crash+sideways BOTH BYTE-IDENTICAL, rally stab 0.568. (3) churn-gated over-extension EXIT pressure 7th soft term (_oe_z=(mid-mean(HL2,24))/std signed) -> composite 0.5191, bull BYTE-IDENTICAL (bull never reaches 2-std vs own 24-bar mean -> documented bull over-extension alpha is PROFIT/level 5-9pct NOT price-z), crash -0.002, rally raw BYTE-IDENTICAL (churn-gate=0 made term ROBUSTLY ensemble-inert in rally=escapes harvest-wall RAW collapse) stab 0.366. (4) post-loss re-entry persistence tightening (selection) -> composite 0.4493, bull/crash/sideways ALL BYTE-IDENTICAL (REDUNDANT: cooldown subsystem already saturates post-loss re-entry control), rally raw collapsed 0.000. (5) SUBSYSTEM REDESIGN smooth admission->size ramp replacing binary strong-sum gate -> composite 0.6072 (best), bull/crash/sideways ALL BYTE-IDENTICAL (strong-regime entries sit DEEP above 1.25x threshold = even REMOVING the hard gate changes nothing), rally raw +0.0001 stab 0.748. UNIFYING CROSS-EXP CONCLUSION (load-bearing for future sessions): bull/crash/sideways are BYTE-IDENTICAL across ALL 5 exps spanning entry-size(2)+exit-fusion(1)+selection-cooldown(1)+admission-boundary-redesign(1) -> the strong regimes are at a FROZEN optimum: their high-conviction entries sit DEEP inside EVERY decision boundary (admission/size-attenuators/exit/cooldown), so no entry-size, exit-fusion, cooldown, or admission-boundary change alters their TRADES. Entry-size quality channel specifically SATURATED (admission pre-filters low-quality entries -> survivors uniformly decent -> 2 orthogonal quality signals byte-identical; R2 keep took the last available drop). rally is the ONLY responsive regime and ONLY via the stability RE-SEED LOTTERY (every edit re-rolls rally stab DOWNWARD from lucky 0.801: drew 0.636/0.568/0.366/0.429/0.748; raw mostly byte-id=pure re-seed). CONFIRMED churn-gate CAN make an EXIT term rally-raw-robust (exp3 byte-id via gate=0, de412448 predicted unlock at RAW level) but rally STABILITY still re-seeds + no strong-regime raw gain. DIRECTION FOR FUTURE: do NOT retry entry-size/exit-fusion/cooldown/admission-boundary changes expecting strong-regime gains (all byte-identical). Beating 0.6393 needs a strong-regime RAW gain big enough to absorb the rally re-seed downside; NO such lever found across 4 subsystems. Remaining hope = a NEW entry TRIGGER (orthogonal to the 7 voters) that creates NEW strong-regime trades rather than re-weighting existing ones, OR accept near-global-optimum on this harness. Baseline de412448 0.6393 UNCHANGED. All 5 reverted via git checkout -- strategy.py; results.tsv append-only intact; strategy.py verified byte-identical to de412448 + baseline reproduces 0.639349.
-	0.4567	0.6446	0.3757	0.78	0.77	1.01	0.02	discard	ARCHITECTURAL R2-gated trend-aligned admission loosening (_r2_clean=tanh((R2(logHL2,16)-0.5)/0.2), loosen trend-aligned strong_min up to 12pct in clean trends). composite 0.6393->0.4567. bull/crash/sideways RAW BYTE-IDENTICAL (0.781/0.768/1.013) AND trade counts UNCHANGED (43/45/49) -> admission loosening added ZERO trades (strong-sum already far above threshold in clean trends; trade count NOT admission-limited there, sample_factor haircut not recoverable via threshold). rally raw/Sharpe/trades IDENTICAL (0.419/0.736/68) but stability 0.801->0.512 (factor 1.0->0.039) COLLAPSE -> new price-derived R2 term at admission DECISION BOUNDARY perturbs rally entry timing under AR(1) noise (rally at 0.80 cliff). Discard #1 architectural.
-	0.4488	0.6394	0.3812	0.78	0.76	1.01	0.00	discard	ARCHITECTURAL conviction-confirmed entry-size AMPLIFICATION (first size-UP in pipeline; _amp=1+0.20*qual*_tq_calm, qual=tanh(margin/0.4)*consensus_align*tanh(R2/0.3)). composite 0.6393->0.4488. CALM regimes RAW SLIGHTLY DOWN: bull 0.781->0.781 (Sharpe 1.556->1.554), crash 0.768->0.765 (Sharpe 1.311->1.303), sideways 1.013->1.011 (Sharpe 1.941->1.935) -> amplifying best calm trades raised variance >= mean (conviction NOT predictive of per-trade risk-adj return there). rally RAW UP 0.419->0.432 (Sharpe 0.736->0.767 clean-backtest) -> amp leaked into rally quiet-stretch entries (_tq_calm~1 at len(_eh)<=1), sizing-up clean trend-aligned longs improved rally Sharpe; BUT rally stability 0.801->0.501 (factor 1.0->0.003) COLLAPSE -> size-UP increases position-value noise sensitivity (opposite of proven rally-stab levers SHRINK+grid-quantize). L4: rally clean longs are UNDER-sized (raw responds + to more size) but stability forbids. Discard #2 architectural.
-	0.5708	0.6951	0.2486	0.68	0.77	1.01	0.32	discard	ARCHITECTURAL consecutive-loss admission escalator (per-symbol _loss_streak, +40pct strong_min by streak>=5 ramp from streak>2, reset on win; targets streak_gate). composite 0.6393->0.5708. crash+sideways BYTE-IDENTICAL (streak~0-1, escalator inert). bull HURT 0.781->0.679 (Sharpe 1.556->1.284, trades 43->42): bull HAS per-symbol >=3-loss clusters in its uptrend, pausing misses trend re-entries. rally raw BYTE-IDENTICAL (0.419/Sharpe0.736/68trades) -> escalator never fired on clean rally: rally max_consec_losses~7 is CROSS-SYMBOL interleaved (BTC/ETH/SOL), not per-symbol, no single sym reaches streak>=3. BUT rally stability 0.801->0.729 (factor 1.0->0.764) -> outcome counter flips under AR(1) noise (marginal rally trades flip win<->loss -> admission differs), boundary noise even w/ identical clean behavior. L6: rally streak is cross-symbol; outcome-feedback at admission = rally-stab wall (re-confirmed). Discard #3 architectural.
-	0.3226	0.5718	0.4985	0.78	0.77	1.01	-0.27	discard	ARCHITECTURAL portfolio-DD entry skip (block ALL entries when _port_dd_atten<0.15 ~portfolio DD>1.1pct; extends existing size-shrink to entry-block; targets cross-symbol streak). composite 0.6393->0.3226. bull/crash/sideways BYTE-IDENTICAL (crash shorts PROFIT in downtrend->portfolio in profit not DD; bull/sideways DD shallow) -> skip rally-specific as predicted. rally CATASTROPHE Sharpe 0.736->-0.275 NEG, trades 68->17, WR 66->47, ann_ret +1.68->-0.33, raw 0.419->-0.275. L7: rally WINNING entries are DIP-BUYS during portfolio drawdowns (buy pullback->catch rally continuation); blocking entries during DD removes rally alpha, keeps worse non-DD top-chasing entries. rally edge = mean-reversion/dip-buy within uptrend NOT trend-chase. Cross-symbol streak interleaved WITH dip-buy winners (likely counter-trend SHORTS during pullbacks, not longs). Discard #4 architectural.
-	0.5445	0.6926	0.2962	0.78	0.77	1.01	0.21	discard	ARCHITECTURAL bear-only portfolio-DD entry skip (block SHORT entries when _port_dd_atten<0.15; built on L7 to cut counter-trend shorts in pullbacks). composite 0.6393->0.5445. bull/crash/sideways BYTE-IDENTICAL. rally HURT: Sharpe 0.736->0.388, trades 68->87 (UP not down), WR 66.2->64.4, max_dd 1.85->2.84 (UP), ann_ret 1.68->0.99, raw 0.419->0.208 (stability fine 0.805). MEASURED MECH: blocking shorts during pullbacks RAISED trades (68->87) and RAISED rally DD (1.85->2.84) -> longs then absorb the full pullback; the counter-trend shorts were NOT the loss-streak source, consistent with them HEDGING pullback DD. L8: rally counter-trend shorts are protective (DD hedge), refutes L7 short-culprit hypothesis. Discard #5 architectural -> EXIT RULE (5 consecutive architectural discards, 0 branches).
