commit	score	mean_score	std_score	bull_2021	crash_bear	sideways	rally_2024	status	description
8da68a5b	0.849413	0.888861	0.131496	0.972003	0.811798	1.053595	0.718050	discard	Exp3 (architectural, indep): CHURN-CONDITIONED entry-readiness EMA RHO. The readiness accumulator admits entry when an EMA-smoothed conviction margin crosses threshold (RHO=0.5 fixed). Raise RHO to 0.65 max for HIGH-churn symbols (len(_eh)>=2 via the noise-immune fast-saturating /0.6 sigmoid) so admission requires more sustained conviction -> hypothesis: filters rally's churny re-entries (98 trades=2x others) AND reduces entry-timing divergence across the noise ensemble (stability up off the 0.82 knee). Low-churn symbols keep RHO=0.5 -> byte-identical. MEASURED vs 1b0f2c46 0.849413: BYTE-IDENTICAL (composite 0.849413, all 4 regime scores/Sharpe/AnnRet/MaxDD unchanged, rally 0.718050 Sh1.301039, min_stability 0.820424 identical). Reverted to 1b0f2c46. CONCLUSION (mechanism-level, measured directly): the churn-conditioned RHO bump NEVER shifts an admission decision. Entries are admitted on DECISIVE margin crossings that do not move under RHO 0.5->0.65; the churny/marginal crossings the slower EMA would filter do not occur at admission bars (during entry bursts len(_eh) rises AFTER the entry opens, but the current_pos==0 gate blocks re-admission during the hold, so the high-RHO state never coincides with a marginal crossing that would have shifted). rally's 98 trades are NOT from marginal churny crossings a slower EMA filters - they are from decisive-but-frequent signals. So entry-timing divergence is NOT fixable via RHO tuning at the admission point. Confirms the prior-session entry-timing work reached the EMA accumulator as the calibrated endpoint (RHO=0.5 is optimal/non-lever). The accumulator RHO is NOT a lever. Amplifying an inert mechanism is pointless per the DVP-ct-shrink + effort/result precedents. Not branch-eligible (no regime improved; mechanism provably non-functional/inert). CROSS-EXPERIMENT: the len(_eh) churn signal fires during bursts but entry admission happens on the rising edge before churn accumulates, so churn-gating the ADMISSION decision is structurally inert (only churn-gating SIZE/order-emission, which act DURING the hold, is productive - consistent with the validated churn-gated grids/churn_size_atten which act post-entry).
ce66fec6	0.849695	0.889292	0.131990	0.973328	0.811800	1.054242	0.717799	keep	KEEP (NEW BASELINE, SUPERSEDES 1b0f2c46 0.849413). Exp4 (architectural, indep): SLOPE-CONFIRMATION gate on the de-risk convex cushion. The convex cushion (k>1 -> hold near full size through moderate giveback, the validated stability lever via DERISK_CONVEX_AMP) was gated only on trend-ALIGNMENT (ret_long*pos_dir) + profit. The win-accelerator (line ~1488) is ALREADY gated by _slope_conf (16-bar OLS slope confirming the position, added by a prior session to protect bull). Extend the SAME _slope_conf to the de-risk cushion: the convex cushion (ride giveback) now requires the near-term slope to STILL CONFIRM the position; when slope weakens (trend faltering, pullback deepening) _slope_conf->0 -> k->1 -> LINEAR fast cut (exit through giveback faster instead of riding it). Mechanism: a trend-aligned winner whose slope STILL confirms is a genuine ongoing trend -> ride small giveback (cushion); a winner whose slope weakened is facing a real near-term reversal -> cut fast (linear). Consistent with the Exp2 lesson this session (near-term slope/ret_long is the CORRECT exit signal for rally; multi-day ret_vlong was too slow and catastrophic). _slope_conf reused (computed unconditionally for held positions at line ~1488 before the scale-in if) -> no new price-derived computation, just a new control-flow dep at the de-risk decision. Smooth tanh (no boundary), direction-agnostic. MEASURED vs 1b0f2c46 0.849413: composite +0.000282 (0.849695), mean +0.000431 (0.889292), std +0.000494 (0.131990 looser), min_stability 0.8204->0.8203 (~unchanged). PER-REGIME: bull 0.972003->0.973328 (+0.001325 BINDING-GAIN - Sh 1.852842->1.856923, MaxDD 0.8955 unchanged - 2021 correction giveback cut faster when slope weakened), sideways 1.053595->1.054242 (+0.000647 - Sh 2.023603->2.025660, MaxDD 0.5529 unchanged - mean-reversion giveback cut faster), crash 0.811798->0.811800 (+0.000002 byte-identical Sh1.263851), rally 0.718050->0.717799 (-0.000251 NEGLIGIBLE - Sh 1.301039->1.300367, MaxDD 1.5716 unchanged, 0.035pct drop well under 50pct gate; some rally grind bars have momentarily-weaker slope that got cut slightly faster, missing a bit of trend capture). All stability_factor 1.0, all flip_streak_gate 1.0, all MaxDD<10pct. All keep criteria met. NEW BASELINE 0.849695. Observation (correlation only): bull gain dominates (slope-weakening cuts 2021 correction giveback); direction-split PnL not measured. rally (binding) near-flat - the slope-conf gate is near-inert on rally's grinding uptrend (slope persistently confirms) and the small regression is from momentary slope dips during pullbacks.
cabfb6f1	0.850107	0.889794	0.132290	0.975603	0.811799	1.054002	0.717771	keep	KEEP (NEW BASELINE, SUPERSEDES ce66fec6 0.849695). Exp5 (architectural, indep): SEPARATE SMOOTHER slope-confirmation for the de-risk cushion, replacing the shared single-16-bar _slope_conf. Exp4 (keep ce66fec6) validated slope-conf on the de-risk cushion (bull +0.001325, sideways +0.000647) BUT rally regressed -0.000251: the single 16-bar _lr_slope is sensitive to MOMENTARY 1-bar dips during rally pullbacks -> those dip bars got cut slightly faster. Use the MULTI-WINDOW _exit_slope (mean of 12/16/22-bar OLS slopes, already computed at line ~1602 for the exit subsystem) instead: a momentary dip in one window is averaged with the other two -> only SUSTAINED slope weakening triggers the linear cut. Isolates the de-risk ramp from the win-accelerator's calibration (accelerator keeps the validated single-16-bar _slope_conf at line 1488; prior sessions tuned it there -> unchanged). New separate gate source at the de-risk decision (3-window mean already available -> no new price-derived reads). Same /0.0004 scale. MEASURED vs ce66fec6 0.849695: composite +0.000412 (0.850107), mean +0.000502 (0.889794), std +0.000300 (0.132290 looser - bull pulling ahead), min_stability 0.8203->0.8204 (~unchanged). PER-REGIME: bull 0.973328->0.975603 (+0.002275 BINDING-GAIN - Sh 1.856923->1.863940, MaxDD 0.8955 unchanged - the multi-window mean better identifies SUSTAINED slope weakening across all 3 windows in 2021 corrections -> cleaner giveback cut), sideways 1.054242->1.054002 (-0.000240 - Sh 2.025660->2.024898, 0.023pct drop well under 50pct gate - the smoother slope cut slightly less sideways mean-reversion giveback), crash 0.811800->0.811799 (byte-identical Sh1.263849), rally 0.717799->0.717771 (-0.000028 NEGLIGIBLE - Sh 1.300367->1.300294, MaxDD 1.5716 unchanged, 0.004pct drop; the smoother slope did NOT recover the Exp4 rally regression as hoped but did not worsen it - rally's grinding uptrend slope confirms persistently across windows so the gate is near-inert on rally either way; the residual -0.000279 vs ORIGINAL baseline 1b0f2c46 persists). All stability_factor 1.0, all flip_streak_gate 1.0, all MaxDD<10pct. All keep criteria met. NEW BASELINE 0.850107. Observation (correlation only): bull gain dominates again (multi-window sustained-slope-weakening detection); direction-split PnL not measured. rally (binding) near-flat - slope-conf gate near-inert on rally's persistently-confirming grinding uptrend. CROSS-EXPERIMENT: the slope-confirmation signal value IMPROVES with smoothness at the de-risk decision (single-16bar +0.000282 -> multi-window-mean +0.000412, both keeps); the multi-window mean separates SUSTAINED reversal (cut) from MOMENTARY dip (ride), which is the correct discrimination for a giveback-riding cushion.
-	-	-	-	-	-	-	-	session-summary	SESSION: 2 KEEPS (Exp4 +0.000282, Exp5 +0.000412) + 3 architectural discards (Exp1 inert, Exp2 catastrophic, Exp3 byte-identical). NEW BASELINE cabfb6f1 0.850107 (SUPERSEDES 1b0f2c46 0.849413, +0.000694 composite, +0.000933 mean 0.888861->0.889794, std 0.131496->0.132290 looser). [bull 0.972003->0.975603, crash 0.811798->0.811799, sideways 1.053595->1.054002, rally 0.718050->0.717771 (-0.000279 residual)]. THEME: SLOPE-CONFIRMATION on the EXIT de-risk cushion. The win-accelerator (line ~1488) was already gated by _slope_conf (16-bar OLS slope confirming the position, added by a prior session to protect bull); this session EXTENDED that validated signal to the de-risk convex cushion (line ~2064). Mechanism: the convex cushion (k>1, ride moderate giveback - the validated stability lever) was gated only on trend-ALIGNMENT (ret_long*pos_dir) + profit; adding slope-conf means the cushion (ride giveback) now requires the near-term slope to STILL CONFIRM the position - when slope weakens (sustained reversal) k->1 -> LINEAR fast cut (exit through giveback faster); when slope confirms (ongoing trend) full cushion rides small giveback. Consistent with the Exp2 lesson this session (near-term slope/ret_long is the CORRECT exit signal; multi-day ret_vlong too slow/catastrophic). DISCARDS: (1) Exp1 SYMMETRIC ret_vlong<0 gate on bear close-loc boost - INERT (+0.000002 sub-noise): the bear close-loc boost is near-inert across all regimes (does not meaningfully fire on rally ct shorts); gating an inert mechanism is inert. close-loc axis now FULLY exhausted (own-boost=keep, own-shrink=dead-end, cross-symbol=redundant, scale-in=catastrophic, bear-gate=inert). (2) Exp2 opp-gate graduation uses MULTI-DAY ret_vlong instead of 20-bar ret_long - CATASTROPHIC (-0.241): rally Sh 1.30->0.96, stability 1.0->0.112 (near 0.50 rejection floor), score 0.718->0.065. Holding rally longs through 20-bar pullbacks (graduated partial exits instead of binary full) destroys BOTH stability (longer holds through noisy pullback regions = more position-value variance) AND raw (pullbacks are REAL giveback not temporary noise). The 20-bar ret_long flip detecting pullbacks is LOAD-BEARING for rally exit graduation. KEY CROSS-EXPERIMENT INSIGHT: exit-side trend gates MUST use the NEAR-TERM (20-bar) trend, NOT the multi-day trend - the exit decision needs a RESPONSIVE reversal detector; multi-day smoothness costs stability+raw. Do NOT re-route exit-side trend gates to ret_vlong. (3) Exp3 churn-conditioned entry-readiness EMA RHO - BYTE-IDENTICAL: the RHO bump never shifts an admission crossing (entries admitted on decisive margin before churn accumulates; during bursts len(_eh) rises AFTER the entry opens, current_pos==0 gate blocks re-admission). rally's 98 trades are decisive-but-frequent, not marginal-churny. The accumulator RHO is NOT a lever; churn-gating the ADMISSION decision is structurally inert (only churn-gating SIZE/order-emission, which act DURING the hold, is productive). KEEPS: (4) Exp4 slope-conf on de-risk cushion (single 16-bar _slope_conf) - +0.000282: bull +0.001325 (Sh 1.853->1.857, 2021 correction giveback cut faster when slope weakened), sideways +0.000647 (Sh 2.024->2.026), rally -0.000251 (momentary 16-bar slope dips during pullbacks cut slightly faster). (5) Exp5 SMOOTHER multi-window _exit_slope (12/16/22 mean) for the de-risk slope-conf - +0.000412: bull +0.002275 (Sh 1.857->1.864 - multi-window mean separates SUSTAINED slope weakening across all 3 windows from MOMENTARY 1-bar dips), sideways -0.000240, rally -0.000028 (flat). CROSS-EXPERIMENT (Exp4->Exp5): slope-conf signal value IMPROVES with smoothness at the de-risk decision (single-16bar +0.000282 -> multi-window-mean +0.000412); the multi-window mean is the correct discrimination (sustained reversal=cut, momentary dip=ride) for a giveback-riding cushion. CONCLUSIONS: (a) slope-confirmation is a productive NEW exit-side signal at the de-risk cushion (2 keeps, +0.000694); the validated slope-conf extends from the accelerator (scale-in) to the de-risk ramp (exit graduation). (b) The multi-window slope mean is SUPERIOR to the single-window slope at the de-risk decision (sustained-vs-momentary discrimination). (c) Exit-side trend gates must be NEAR-TERM (20-bar ret_long / 16-bar slope), NOT multi-day ret_vlong (Exp2 catastrophic). (d) The close-loc axis and entry-admission RHO are exhausted. rally (binding) is NEAR-FLAT across both keeps (slope-conf near-inert on rally's persistently-confirming grinding uptrend; residual -0.000279 vs original from momentary pullback dip cuts); the keeps improved BULL (now 0.9756, Sh 1.864) and sideways. std crept up (0.1315->0.1323) as bull pulls ahead of rally. FUTURE: the slope-conf direction is well-explored at the de-risk ramp; extending to the take-profit harvest risks correlated double-counting (prior _vt_factor removal warned against); recovering the tiny rally regression via ret_vlong-sparing is the Exp2 failure mode (stability crash). Productive new directions likely require a genuinely new DATA SOURCE or a different exit decision point not yet slope-gated. results.tsv append-only preserved (path-scoped git checkout -- strategy.py throughout); 3 discards reverted to 1b0f2c46, 2 keeps (cabfb6f1) in baseline. EXIT: 2 keeps secured, 3 architectural discards (satisfies the 2-architectural-discard minimum), slope-conf direction exhausted at de-risk ramp.
ad87dab9	0.712157	0.771744	0.198626	0.501259	0.816235	1.053755	0.715728	discard	Exp1 (architectural, indep): SLOPE-CONF suppression on the take-profit harvest (NEW exit decision point slope-gated). Mirror of the validated Exp4/Exp5 de-risk slope-conf: suppress harvest up to 40pct when multi-window _exit_slope still confirms the position (let confirmed trend run); full harvest when slope weakens. MEASURED vs cabfb6f1 0.850107: composite -0.137950 (0.712157), mean -0.118050, std +0.066336, min_stability 0.8204->0.7557. PER-REGIME: bull 0.975603->0.501259 (CATASTROPHIC -0.474344 - Sh 1.863940->1.302685, MaxDD 0.8955->1.6221, stability_factor 1.0->0.852334), crash 0.811799->0.816235 (+0.004436 Sh 1.263849->1.273979), sideways 1.054002->1.053755 (-0.000247 Sh 2.024898->2.058991), rally 0.717771->0.715728 (-0.002043 Sh 1.300294->1.294847, MaxDD 1.5716 unchanged). The harvest suppression DESTROYED bull: holding trend winners through the 2021 sharp corrections (harvest was locking gains pre-correction) blew MaxDD 0.90->1.62pct and crashed stability below the 0.80 penalty threshold. Exactly the failure mode the win-accelerator slope-conf gate was added to prevent; the session summary explicitly warned extending slope-conf to the harvest 'risks correlated double-counting'. crash +0.004 was the only positive (rally near-flat, did NOT improve the binding constraint). DISCARD: not opening a branch - the mechanism structurally conflicts with bull correction-protection (harvest is load-bearing gain-locking in bull, not premature profit-capping); iterating would not recover bull. Reverted to cabfb6f1.
bbaf732e	0.850107	0.889794	0.132290	0.975603	0.811799	1.054002	0.717771	discard	Exp2 (architectural, indep): LOSS-SIDE vol-expansion exit pressure gated on slope-against confirmation. Extended _w_ve from profit-only to bilateral: profit-side full (0.60) + loss-side 0.30 gated on (losing AND multi-window _exit_slope against position). Hypothesis: correlated rally pullback vol explodes before slope reverses -> slope-against lags -> losing longs hold into drawdown (rally MaxDD 1.57pct). MEASURED vs cabfb6f1 0.850107: BYTE-IDENTICAL (composite 0.850107, all 4 regimes identical to 1e-6, all Sharpe/MaxDD/stability unchanged). The loss-side ve contribution is STRUCTURALLY INERT: _ve_pressure requires _vol_expansion>1.3 to be nonzero; when a losing position ALSO has slope-against (the loss-side gate), _sl_slope_pressure already fires at comparable-or-greater magnitude -> the MAX fusion (_soft_max = max of weighted terms) is already dominated by slope-against -> adding 0.30*ve does not change the max. Same inertness pattern as prior Exp3 (churn EMA) / Exp5 (streak ct exit): a sub-dominant term added to a MAX fusion already dominated by another term is inert. CONCLUSION: to cut losers faster at confirmed regime shifts via the ve channel, the slope-against pressure itself would need to be AMPLIFIED under vol expansion (fusion weight change), not an additive loss-side ve term. Reverted to cabfb6f1.
b46f47a3	0.850107	0.889794	0.132290	0.975603	0.811799	1.054002	0.717771	discard	Exp3 (architectural, indep): VOL-EXPANSION amplification of slope-against weight (_w_slope) for LOSING positions. Structural fix for Exp2's inert additive term: AMPLIFY the dominant term itself (boost _w_slope by up to +0.45 when losing AND severe vol expansion >1.5x) rather than add a sub-dominant ve term. MEASURED vs cabfb6f1 0.850107: BYTE-IDENTICAL (composite 0.850107, all 4 regimes/Sharpe/MaxDD/stability unchanged). CONCLUSION: even amplifying the dominant slope-against weight is inert for losing positions. The exit fusion is _exit_pressure = max(_sl_pressure, _soft_max) + _voter_bias; for losing positions under severe vol expansion + slope-against, the STOP-LOSS (_sl_pressure) already dominates _soft_max (positions near stop) -> amplifying _w_slope (which only raises _soft_max) cannot move max(_sl_pressure, _soft_max). CROSS-EXPERIMENT (Exp2+Exp3): the LOSING-POSITION exit path is FULLY SATURATED - losing positions exit via the stop or saturated slope-against on the SAME bar regardless of marginal slope-weight amplification. Exit-side regime-shift protection via ve/slope amplification is a dead end (2 inert experiments). To move rally MaxDD would require changing the STOP itself (e.g. tighter stop under vol expansion) - a different decision point. Reverted to cabfb6f1.
8f6b3c25	0.618102	0.706701	0.295331	0.243259	0.811729	1.057434	0.714383	discard	Exp4 (architectural, indep): MAE-cleanliness amplifier on the de-risk convex cushion. NEW data dep: cushion exponent _dr_k amplified up to +20pct by MAE-cleanliness (small MAE = clean entry -> bigger cushion ride more giveback; large MAE -> smaller cushion). Hypothesis: rally grinding-uptrend longs have small MAE -> bigger cushion -> more trend capture -> higher rally Sharpe. MEASURED vs cabfb6f1 0.850107: composite -0.232005 (0.618102), mean -0.183093, std +0.163041, min_stability 0.8204->0.6238. PER-REGIME: bull 0.975603->0.243259 (CATASTROPHIC -0.732344 - Sh 1.863940->1.306921, MaxDD 0.8955->1.6218, stability_factor 1.0->0.412722 BELOW 0.50 rejection floor), sideways 1.054002->1.057434 (+0.003432 Sh 2.024898->2.035819), crash 0.811799->0.811729 (-0.000070 byte-identical), rally 0.717771->0.714383 (-0.003388 Sh 1.300294->1.291751, MaxDD 1.5716->1.5975 WORSE). The bigger cushion (k up to ~1.92) destroyed bull: clean-MAE bull trend winners (small MAE BEFORE the 2021 corrections) got a wider giveback cushion -> held through the correction reversal -> MaxDD 0.90->1.62pct + stability crashed below rejection. rally did NOT improve (worse) - the bigger cushion did not help rally and slightly raised its MaxDD. CROSS-EXPERIMENT (Exp1+Exp4): ANY mechanism that widens the giveback cushion / suppresses gain-locking for clean/confirmed trend winners DESTROYS bull (stability <0.50) - bull's 2021 corrections are preceded by clean-MAE, slope-confirming winners that then reverse hard. The cushion magnitude is tightly calibrated (DERISK_CONVEX_AMP=0.6); amplifying it is a dead end. CONCLUSION: the de-risk cushion is at its productive ceiling; bull's correction-protection need caps how much giveback-riding any winner can earn. Reverted to cabfb6f1.
efb25e2e	0.849013	0.889216	0.134010	0.976810	0.811799	1.054593	0.713663	discard	Exp5 (architectural, indep): BTC-leader-confirmation amplifier on the win-accelerator (alt scale-in pace). NEW data dep: for alt symbols (BTC is leader), when _btc_trend aligns with alt position direction, amplify _win_accel by up to +30pct (reach full size faster on leader-confirmed trend). Entry-side scale-in (NOT exit cushion) to avoid the Exp1/Exp4 bull-cushion-break. Alts only (BTC self would double-count own trend). Hypothesis: BTC leads rally uptrend -> confirmed alt longs scale in faster -> more trend capture -> higher rally Sharpe. MEASURED vs cabfb6f1 0.850107: composite -0.001094 (0.849013), mean -0.000578, std +0.001720, min_stability 0.8204->0.8206. PER-REGIME: bull 0.975603->0.976810 (+0.001207 Sh 1.863940->1.867671, MaxDD 0.8955 unchanged), sideways 1.054002->1.054593 (+0.000591 Sh 2.024898->2.027404, MaxDD 0.5529->0.5718), crash byte-identical 0.811799, rally 0.717771->0.713663 (-0.004108 Sh 1.300294->1.290029, MaxDD 1.5716->1.6078 WORSE). The amplifier HURT the binding constraint (rally -0.004) - the OPPOSITE of the hypothesis: faster alt scale-in when BTC confirms over-committed ETH/SOL longs into rally pullbacks -> MaxDD 1.57->1.61pct, Sharpe 1.30->1.29. The accelerator's existing calibration is already optimal; amplifying it over-commits. bull/sideways gains were SUB-NOISE (+0.0012/+0.0006, well below prior session keeps ~+0.0004 only when binding constraint also held). Branch NOT opened: the direction (BTC-confirmed scale-in acceleration) shows no robust promise - it hurt the binding constraint and the only gains were sub-noise on non-binding regimes (overfit-prone to chase). CROSS-EXPERIMENT (Exp3-prior + Exp5): the win-accelerator magnitude is at its productive ceiling; both amplifying the magnitude (prior Exp5 adaptive floor kept) and adding a leader-confirmation amp (this Exp5) either were already tuned or over-commit. Reverted to cabfb6f1. 5 consecutive architectural discards -> EXIT RULE.
