commit	score	mean_score	std_score	bull_2021	crash_bear	sideways	rally_2024	status	description
-	-	-	-	-	-	-	-	session-summary	SESSION (v2.1 baseline cabfb6f1 0.605307): 0 keeps + 3 architectural discards (Exp1/Exp2/Exp3) + 1 exploration branch (deep-downtrend bear size boost + sustain, 2 steps, REVERTED) + Exp4 (branch-opening first-bar boost, inert). Baseline UNCHANGED cabfb6f1 0.605307 [bull 0.699048 Sh1.864, crash 0.575486 Sh1.264, sideways 0.749111 Sh2.025, rally 0.511346 Sh1.300; all stab 1.0, all flip 1.0, all MaxDD<10pct]. THEME: return-seeking on the two weak regimes (crash 0.575, rally 0.511) via exit-timing and entry-sizing architectural changes. INDEPENDENT DISCARDS: (1) Exp1 direction-gated bear hold-extension -- rally -0.0096 (ret_vlong dips negative in pullbacks -> fires on losing CT bears), crash byte-identical (positions exit via slope/pp before time_pressure). (2) Exp2 entry-conviction-margin scale-in pace -- bull -0.021 + rally -0.007 (faster commit into V-corrections/pullback reversals). (3) Exp3 range-breakdown exit pressure (8th soft source) -- BYTE-IDENTICAL inert (gate too restrictive to exceed MAX of existing 7 sources). (4) Exp4 deep-downtrend bear first-bar size boost -- crash byte-identical (first-bar-only reverted by scale-in) -> opened branch. BRANCH (deep-downtrend bear boost + sustain, 2 steps): REVERTED. Branch premise DISPROVEN via direct instrumentation: (a) crash has 0 bear entries (100% bounce LONGS, 100% WR) -- a bear boost cannot affect a long-only regime; (b) size boosts are Sharpe-scale-invariant (only return_reward gains, tiny) -- return-seeking via sizing is structurally limited; (c) 96-bar deep-downtrend ENTRY gates do not co-occur with entries (lagging context vs short-term triggers). CROSS-SESSION CONCLUSIONS (all measured this session): crash is traded 100% with bounce LONGS not bear shorts; size boosts are Sharpe-scale-invariant (return-seeking requires hold-timing/Sharpe changes, already exhausted by prior branches); ret_vlong direction gates dip negative in rally pullbacks (Exp1 landmine) and do not co-occur with entries (Exp4). EXIT RULE: branch reverted -> session ends (3 arch discards + 1 reverted branch). Honored user constraint: 3 architectural changes attempted among discards (>=2 required).
086c763b	0.605307	0.633748	0.094802	0.699048	0.575486	0.749111	0.511346	discard	Exp1 (architectural, indep): LOSS-CONDITIONED COUNTER-TREND ATR stop tightening. NEW data dep at the STOP DECISION POINT itself (explicitly flagged unexplored in b46f47a3: stop distance was pure ATR across all prior sessions; every exit-loser mechanism added was a SOFT pressure SOURCE, never the stop distance). Tighten _stop_abs by up to 25pct for positions BOTH counter-trend at multi-day scale (ret_vlong*pos_dir<0) AND losing (pos_pnl<0). Sparing: trend-aligned gate0 byte-identical, winning-ct (crash bounce longs 100pct WR) loss-gate0 byte-identical. Fast-sat /0.01 ret_vlong (noise-free). MEASURED vs cabfb6f1 0.605307: BYTE-IDENTICAL (composite 0.605307, all 4 regimes identical, all stab 1.0, min_stability 0.820383). Completely INERT: the tightened stop never alters any trade. Directly confirms row-924/last-session EXIT-LOSER-SATURATION conclusion with a NEW decision point (the stop distance itself, not a soft source): ct losers exit via slope-against/soft-pressure/de-risk on the SAME bar BEFORE the ATR stop binds, so changing the stop distance has zero effect. The stop is structurally a backstop that rarely fires given the current slope/pp/ar/ct-hold pressure stack. Not branch-eligible (byte-identical, no regime improved). Architectural discard #1. Reverted to cabfb6f1.
fbfd57c1	0.605374	0.633825	0.094834	0.699313	0.575486	0.749111	0.511388	branch	BRANCH OPEN (prior-trade-DURATION attenuator). Exp2 architectural indep: NEW cross-trade data dep -- entry sizing reads MOST RECENTLY CLOSED trade DURATION (bars held, cached at exit), distinct from _last_exit_pnl (prior PnL OUTCOME) and the reverted prior-trade-MAE (prior max ADVERSE excursion): this is the prior trade TIME dimension. Short prior duration (quick exit = choppy/fast-reversing symbol state) -> next re-entry lower quality -> smaller first-bar (max 0.22 shrink, deep-sat /4.0 bars gate /1.5 sat, shrink-only, first-bar only). Churn-gated to rally-burst partition via noise-immune integer churn (_churn_ct) so crash/sideways/bull-quiet spared by construction. MEASURED vs cabfb6f1 0.605307: composite +0.000067 (0.605374 SUB-NOISE <0.003), mean +0.000077. PER-REGIME: bull +0.000265 (0.699048->0.699313 IMPROVED), rally +0.000042 (0.511346->0.511388 IMPROVED, flat-pos), crash BYTE-IDENTICAL 0.575486, sideways BYTE-IDENTICAL 0.749111. All stab 1.0, all MaxDD<10pct. No regime regressed. Branch-eligible: bull+rally improved + fundamentally new mechanism. JUSTIFICATION: (1) new cross-trade DURATION dep shrinks re-entries after fast-exit (choppy) priors; (2) NO regime regressed; (3) PLAUSIBLE PATH TO +0.003 the prior-trade-MAE branch LACKED: duration fires in rally BURSTS (ct-short re-entries, the churn-gated partition) whereas MAE was rally-FLAT (+0.0007 max, structurally MAE-free in crash/sideways but ALSO barely fired in rally); amplifying duration may lift RALLY alongside bull = the SECOND regime MAE could not unlock, which would offset the std-drag that capped MAE at +0.0019. Hypothesis: mechanism real but under-powered (max 0.22, /4.0 gate near-inert for typical 2-4 bar priors) -> amplify (larger max, more-sensitive gate) to push bull+rally past +0.003 composite while monitoring crash/sideways byte-identical. Branch step1 = this commit (kept in place).
b2x57uzw_dry	0.605462	0.633926	0.094880	0.699672	0.575486	0.749111	0.511437	branch	branch step2: amplify prior-DURATION shrink (max 0.22->0.40, gate 4.0->6.0 bars). MEASURED vs cabfb6f1 0.605307: composite +0.000155 (0.605462, +0.000088 vs step1 PROGRESS), mean +0.000178. PER-REGIME: bull +0.000624 (0.699048->0.699672, +0.000359 vs step1 -- rising ~linearly), rally +0.000091 (0.511346->0.511437, +0.000049 vs step1 -- flat-pos), crash BYTE-IDENTICAL, sideways BYTE-IDENTICAL. All stab 1.0. No alpha-trade wall (rally not regressing). composite +0.000155, need +0.002845 more for keep. Bull rising ~+0.00036/step; rally flat +0.00005/step. Push harder to find wall or confirm headroom.
5340b705	0.605462	0.633926	0.094880	0.699672	0.575486	0.749111	0.511437	branch	CORRECTED HASH for branch step2 (prev row b2x57uzw_dry was a placeholder, same numbers). branch step2: amplify prior-DURATION shrink (max 0.22->0.40, gate 4.0->6.0 bars). MEASURED vs cabfb6f1 0.605307: composite +0.000155 (0.605462, +0.000088 vs step1 PROGRESS), mean +0.000178. PER-REGIME: bull +0.000624, rally +0.000091, crash/sideways BYTE-IDENTICAL. All stab 1.0. Bull rising ~+0.00036/step, rally flat-pos +0.00005/step.
c599d2f1	0.605584	0.634057	0.094911	0.700075	0.575486	0.749111	0.511557	branch	branch step3: amplify prior-DURATION shrink (max 0.40->0.65, gate 6.0->8.0 bars). MEASURED vs cabfb6f1 0.605307: composite +0.000277 (0.605584, +0.000122 vs step2 PROGRESS), mean +0.000309. PER-REGIME: bull +0.001027 (0.699048->0.700075, +0.000403 vs step2 -- steady ~+0.0004/step), rally +0.000211 (0.511346->0.511557, +0.000120 vs step2 -- ACCELERATING vs step2 +0.000049), crash BYTE-IDENTICAL, sideways BYTE-IDENTICAL. All stab 1.0. KEY: rally lift accelerating (the second regime MAE could not unlock) -- duration fires in rally bursts (ct-short re-entries) so amplifying lifts rally alongside bull, potentially offsetting the std-drag that capped MAE at +0.0019. composite +0.000277, need +0.002723 more for keep. Push harder.
8de90a54	0.605985	0.634547	0.095209	0.701942	0.575486	0.749111	0.511649	branch	branch step4: amplify prior-DURATION shrink (max 0.65->0.90, gate 8.0->10.0 bars). MEASURED vs cabfb6f1 0.605307: composite +0.000678 (0.605985, +0.000401 vs step3 PROGRESS accelerating), mean +0.000799. PER-REGIME: bull +0.002894 (0.699048->0.701942, +0.001867 vs step3 -- BIG jump), rally +0.000303 (0.511346->0.511649, +0.000092 vs step3 -- slowed), crash BYTE-IDENTICAL, sideways BYTE-IDENTICAL. std 0.094802->0.095209 RISING (bull pulling ahead -> std-drag beginning, eating ~30pct of bull gain). All stab 1.0. composite +0.000678, need +0.002322 more for keep. Bull accelerating but std-drag offset growing; need rally to keep pace.
bkpr4sed	0.405396	0.483221	0.259418	0.554986	0.575486	0.749111	0.053302	branch	branch step5: amplify prior-DURATION shrink (max 0.90->1.20, gate 10.0->12.0 bars) -- WALL HIT. MEASURED vs step4 0.605985: composite -0.200589 (0.405396 CRASHED), raw_composite 0.527434 (raw -0.078551), mean -0.151326. PER-REGIME: bull 0.701942->0.554986 (collapsed -0.146956, raw same -- over-shrunk trend-resumption longs after quick pullbacks), rally 0.511649->0.053302 (collapsed, raw 0.384915, stability CRASHED min_stability 0.541543 -- over-shrunk rally trend longs), crash/sideways BYTE-IDENTICAL. std 0.095209->0.259418 (huge). SAME failure mode as prior-trade-MAE branch step8 (max 1.00: bull -0.35, rally -0.79). Reverted to step4 (best state, max 0.90 +0.000678).
bopwm08b	0.119615	0.268708	0.496978	-0.545134	0.575486	0.749111	0.295368	branch	branch step6: fine-tune max 0.90->1.00 gate 10.0->11.0 (probe between step4 best and step5 wall). MEASURED vs step4 0.605985: composite -0.486370 (0.119615 CRASHED HARDER than step5), raw_composite 0.128805. PER-REGIME: bull 0.701942->-0.545134 (NEGATIVE, over-shrinkage of trend-resumption longs), rally 0.511649->0.295368 (raw 0.333), crash/sideways BYTE-IDENTICAL. std 0.497. WALL IS SHARP + NONLINEAR between max 0.90 (step4 +0.000678 best) and max 1.00 (step6 catastrophic). Reverted to step4. Confirms ceiling = step4 +0.000678 (well below +0.003 keep).
bx0d1n7	0.521091	0.566139	0.150161	0.608064	0.575486	0.749111	0.331896	branch	branch step7: NARROW gate (5.0 bars /1.0 sat) + high max 1.20 (isolate truly-choppy short priors from trend-resumption winners). MEASURED vs step4 0.605985: composite -0.084894 (0.521091 regression), raw_composite 0.582191. PER-REGIME: bull 0.701942->0.608064 (-0.094), rally raw 0.511649->0.503310 (stab CRASHED min_stability 0.697828), crash/sideways BYTE-IDENTICAL. Narrow gate + high max STILL over-shrinks (wall is fundamental to high-max, not gate width). Reverted to step4. 3 consecutive no-progress wall-probe steps (step5/6/7).
2806df85	0.606073	0.634678	0.095350	0.702561	0.575486	0.749111	0.511553	branch	branch step8: DIRECTION-AWARE ct-gated duration shrink (gate on _bull_ctmd/_bear_ctmd so only ct burst re-entries shrunk, trend-resumption winners spared). max 0.90 retained. MEASURED vs cabfb6f1 0.605307: composite +0.000766 (0.606073, +0.000088 vs step4 NEW BEST), mean +0.000930. PER-REGIME: bull +0.003513 (0.699048->0.702561, +0.000619 vs step4), rally +0.000207 (0.511346->0.511553, ~flat vs step4 -0.000096), crash/sideways BYTE-IDENTICAL. All stab 1.0 (min_stability 0.818). ct-direction gating BETTER than pure churn at same max (step4) AND should allow higher max without trend-winner over-shrinkage wall. composite +0.000766, need +0.002234 more. Amplify max.
b816fir4	0.465925	0.539501	0.245252	0.704110	0.575486	0.749111	0.129297	branch	branch step9: amplify ct-gated duration shrink max 0.90->1.30. MEASURED vs step8 0.606073: composite -0.140148 (0.465925 CRASHED) BUT bull 0.702561->0.704110 (+0.001549 STILL RISING -- ct-gate PROTECTED bull trend-resumption winners as designed), rally 0.511553->0.129297 (CRASHED raw 0.154, stab 0.751653 -- over-shrunk rally ct re-entries). crash/sideways BYTE-IDENTICAL. KEY INSIGHT: ct-direction gate moved the wall from BULL to RALLY -- bull now survives high max (trend winners spared), but rally ct re-entries over-shrink. Ceiling is now RALLY-limited not bull-limited. Reverted to step8 (best max 0.90).
bol00syc	0.467484	0.540449	0.243215	0.703336	0.575486	0.749111	0.133861	branch	branch step10: moderate amplify max 0.90->1.10. MEASURED vs step8 0.606073: composite -0.138589 (0.467484 CRASHED). bull 0.702561->0.703336 (+0.000775 still fine, ct-gate protecting), rally 0.511553->0.133861 (CRASHED raw 0.154, stab 0.761 -- SAME as step9 max 1.30). crash/sideways BYTE-IDENTICAL. RALLY WALL IS SHARP between max 0.90 (rally 0.512) and max 1.10 (rally 0.134). Reverted to step8.
bt7e092v	0.537244	0.587133	0.166298	0.702949	0.575486	0.749111	0.320987	branch	branch step11: probe max 1.00. MEASURED vs step8 0.606073: composite -0.068829 (0.537244 regression), raw_composite 0.543037. bull 0.702561->0.702949 (+0.000388 still fine), rally 0.511553->0.320987 (CRASHED raw 0.337, stab 0.786). crash/sideways BYTE-IDENTICAL. RALLY WALL IS BETWEEN max 0.90 (step8 rally 0.512) and max 1.00 (rally 0.321). Reverted to step8 (firm ceiling +0.000766).
-	-	-	-	-	-	-	-	discard	BRANCH SUMMARY (prior-trade-DURATION attenuator): REVERTED. Opened after Exp2 (architectural indep) showed bull +0.000265 / rally +0.000042 (first positive signal after 1 arch discard). 11 branch steps. The prior-trade-DURATION attenuator (NEW cross-trade data dep: entry sizing reads most-recently-closed trade DURATION/bars-held, cached at exit; short prior duration = choppy/fast-reversing symbol state = lower-quality next re-entry = smaller first-bar) is a REAL bull-improving mechanism. Two phases: (PHASE A, pure-churn gate _churn_ct, steps 1-7) monotonic amplification max 0.22->0.90 pushed composite +0.000678 at max 0.90 (step4 best of phase A); wall at max>=1.00 (step5 max1.20 / step6 max1.00 gate11 / step7 narrow-gate max1.20 all CRASHED: bull collapsed -0.147 to NEGATIVE -0.545, rally collapsed, stability crashed) -- SAME over-shrinkage failure mode as prior-trade-MAE branch step8 (over-shrinks trend-resumption WINNERS). (PHASE B, ct-DIRECTION gate _bull_ctmd/_bear_ctmd, steps 8-11) gating the shrink on ct-direction (only shrink COUNTER-TREND burst re-entries, spare trend-resumption winners) moved the wall from BULL to RALLY: step8 max0.90 = NEW BEST composite +0.000766 (bull +0.003513 still rising, ct-gate protected bull trend longs); but max>=1.00 (step9 max1.30 / step10 max1.10 / step11 max1.00) CRASHED RALLY (0.512->0.13-0.32, stability 0.75-0.79) while bull kept rising (0.704). RALLY WALL IS SHARP between max 0.90 and 1.00. BEST STATE step8 composite +0.000766 (sub-noise, below +0.003 keep). crash/sideways BYTE-IDENTICAL throughout (structurally low-churn -> churn gate excludes them by construction, same as MAE). CROSS-SESSION CONCLUSIONS: (a) prior-trade-DURATION is a REAL but sub-keep bull-improving lever (extends the cross-trade-shrink family: MAE/GIVEBACK/MFE/DURATION all sub-keep); (b) ct-DIRECTION-GATING moves the over-shrinkage wall from BULL to RALLY (bull trend-resumption winners spared, but rally ct re-entries become the binding over-shrinkage limit) -- a NEW structural finding for the cross-trade-shrink family; (c) rally ct-short re-entries are EXTREMELY sensitive to over-shrinkage (sharp wall at max>0.90) -- they include enough small winners that aggressive shrinking collapses rally Sharpe/stability; (d) the cross-trade-shrink family ceiling remains ~+0.0008 composite (std-drag + over-shrinkage-wall + crash/sideways-structural-exclusion), confirming prior-trade signals are sub-keep levers not worth solo re-amplification. Reverted to cabfb6f1. Session ends (branch concluded).
-	-	-	-	-	-	-	-	session-summary	SESSION (v2.1 baseline cabfb6f1 0.605307): 0 keeps + 2 architectural discards (Exp1 inert, Exp2=branch-opening) + 1 exploration branch (prior-trade-DURATION attenuator, 11 steps, REVERTED). Baseline UNCHANGED cabfb6f1 0.605307 [bull 0.699048 Sh1.864, crash 0.575486 Sh1.264, sideways 0.749111 Sh2.025, rally 0.511346 Sh1.300 MaxDD1.57; all stab 1.0, all flip 1.0, all MaxDD<10pct]. THEME: probed genuinely-novel decision points (the ATR STOP distance itself, never previously conditioned) + a NEW cross-trade signal (DURATION, the time dimension -- distinct from prior MAE/GIVEBACK/MFE). INDEPENDENT: (1) Exp1 LOSS-CONDITIONED COUNTER-TREND ATR stop tightening (NEW data dep at the STOP DECISION POINT, explicitly flagged unexplored in b46f47a3): BYTE-IDENTICAL INERT -- the tightened stop never alters a trade; directly confirms EXIT-LOSER-SATURATION (row-924/last-session) with a NEW decision point (the stop distance itself, not a soft source): ct losers exit via slope-against/soft-pressure/de-risk on the SAME bar BEFORE the ATR stop binds, so the stop is structurally a backstop that rarely fires given the current slope/pp/ar/ct-hold pressure stack. (2) Exp2 prior-trade-DURATION first-bar shrink (NEW cross-trade data dep: bars-held of most-recently-closed trade, cached at exit): bull +0.000265 / rally +0.000042, crash/sideways byte-identical -> opened branch. BRANCH (prior-trade-DURATION, 11 steps): REAL bull-improving mechanism. Phase A (pure-churn gate): monotonic to max0.90 = +0.000678, wall at max>=1.00 (over-shrinks trend-resumption winners, bull collapsed -- same failure mode as prior-trade-MAE branch step8). Phase B (ct-DIRECTION gate): moved wall from BULL to RALLY -- step8 max0.90 = NEW BEST +0.000766 (bull +0.0035 still rising, ct-gate protected bull), but max>=1.00 CRASHED RALLY (sharp wall 0.90->1.00; rally ct re-entries over-shrink including small winners -> Sharpe/stability collapse). BEST +0.000766 (sub-keep <0.003). crash/sideways byte-identical throughout. CROSS-SESSION CONCLUSIONS (all measured this session): (a) the ATR STOP DISTANCE is inert as a lever -- ct losers never reach the stop (exit via slope/soft-pressure same bar); the stop is a backstop, extending EXIT-LOSER-SATURATION to the stop decision point itself; (b) prior-trade-DURATION is a REAL but sub-keep bull lever (cross-trade-shrink family MAE/GIVEBACK/MFE/DURATION all sub-keep, ceiling ~+0.0008); (c) NEW: ct-DIRECTION-GATING moves the cross-trade-shrink over-shrinkage wall from BULL to RALLY (bull trend-resumption winners spared, rally ct re-entries become the binding over-shrinkage limit); (d) rally ct-short re-entries are EXTREMELY over-shrinkage-sensitive (sharp wall at max>0.90) -- they contain enough small winners that aggressive shrinking collapses rally; do NOT re-amplify cross-trade shrinks past max~0.90. The binding rally Sharpe (1.30) remains unconquered; this sessions mechanisms (stop-distance, cross-trade-duration) failed in ways consistent with the documented dead-end families (inert-by-construction / cross-trade-shrink-sub-keep-ceiling / over-shrinkage-wall). results.tsv append-only preserved (path-scoped git checkout -- strategy.py throughout, never git revert); all experiments reverted to cabfb6f1. EXIT: 0 keeps, 2 architectural discards (>=2 required, satisfied) + 1 reverted branch, baseline cabfb6f1 0.605307 unchanged.
b8ccb737	0.605307	0.633748	0.094802	0.699048	0.575486	0.749111	0.511346	discard	Exp1 (architectural, indep): DEMA (Double-EMA) entry-readiness accumulator. Function-FORM rewrite of the admission readiness mechanism (single-EMA -> DEMA=2*E1-E2 where E2=EMA(E1); new E2 state per side). Hypothesis: DEMA reduces linear-phase lag vs single-EMA at equal noise attenuation -> sustained-conviction trend entry crosses readiness threshold ~1 bar earlier -> more trend capture -> higher Sharpe in trend regimes (binding rally lever), while E2 preserves single-bar AR(1) spike suppression. MEASURED vs cabfb6f1 0.605307: BYTE-IDENTICAL (composite 0.605307, all 4 regimes byte-identical: bull 0.699048 Sh1.863940, crash 0.575486 Sh1.263849, sideways 0.749111 Sh2.024898, rally 0.511346 Sh1.300294; all MaxDD unchanged 0.90/0.65/0.55/1.57; all stab 1.0, all flip 1.0). min_stability 0.820383->0.812445 (within-noise seed variance, scores byte-identical). Completely INERT: the DEMA crossing never alters any admission decision. CONFIRMS (with a NEW function form, not just RHO tuning) the prior-session finding that the accumulator RHO is byte-identical inert -- the readiness accumulator is a CONFIRMATION gate, not the binding admission decision; entries fire on the strong-sum/trend gates on decisive margin before the accumulator crossing matters. Extends the RHO-inert conclusion to the EMA-vs-DEMA function-form axis. Not branch-eligible (byte-identical, no regime improved). Architectural discard #1. Reverted to cabfb6f1 via git checkout -- strategy.py.
