commit	score	mean_score	std_score	bull_2021	crash_bear	sideways	rally_2024	status	description
-	0.035	-0.003	0.437	0.20	-0.20	0.58	-0.59	discard	trend-asymmetric strong-sum admission gates (architectural new data dependency on entry decision boundary) — composite -0.035 vs 0e36970 keep, mean -0.031. Rally flat -0.01 (raising bear threshold filtered both good and bad rally shorts proportionally — no net benefit), crash -0.09 (raised bull threshold blocked valid contrarian/recovery longs in downtrend bounces), bull -0.02, sideways flat. Trend-asymmetric admission via strong-sum threshold is structurally equivalent to dyn_threshold asymmetry (row 38, also discarded) — the underlying mechanism — trend direction biasing admission — doesnt extract rally alpha because rally bear losses come from voters that fire on legitimate signals (overbought, EMA cross) not weak ones the threshold would filter. Saturation: trend-conditioned entry asymmetry seems exhausted.
-	0.053	0.017	0.436	0.20	-0.09	0.58	-0.61	discard	first-bar fast-fail on adverse pnl ATR-scaled (architectural new control-flow exit path) — composite -0.017 vs 0e36970 keep, mean -0.011. Crash +0.02 (some bad first-bar shorts in downtrend bounces cut early), but rally -0.03 (counter-intuitive: rally short entries that immediately dipped recover frequently within the 0.5-0.8% band — fast-fail cut these and missed the bounce-then-fall pattern), bull -0.02, sideways flat. Fast-fail at first-bar bar boundary creates noise sensitivity at the threshold; bars_held==1 hard-conditional is structurally fragile. ATR-anchored threshold doesnt save the binary trigger.
a46ab2a	0.076	0.050	0.428	0.22	0.01	0.58	-0.60	discard	adverse-pnl-streak exit pressure 6th source (architectural new data dependency on pos_pnl trajectory) — composite -0.018 vs 1e1fb40 keep, mean flat, all per-regime scores within 0.008 of baseline. Mechanism barely fires: adverse-streak ratio rarely exceeds 0.6 within position lifetime, and the loss-gate (-pos_pnl/0.005) compounds the gating to near-zero firing in most positions. Crash tiny +0.007 (intended), bull tiny -0.005 (some legitimate scale-in dips truncated). Composite loss came from LOC bonus diff. Direction may be right but trigger threshold/scaling needs to be much more aggressive.
-	0.043	0.002	0.384	-0.01	-0.16	0.61	-0.44	discard	trend-alignment partial-exit floor lowering (architectural new cross-timescale dependency on de-risk decision boundary) — composite -0.027 vs 0e36970 baseline; rally +0.14 (hypothesis confirmed: trend-aligned longs held through pullbacks), sideways +0.03, but bull catastrophic -0.23 (deferred de-risk on winning bull positions meant they held into late-trend reversals giving back gains) and crash -0.05 (trend-aligned shorts in downtrend bounces also overheld). Counter-trend protection insufficient; even gated above |ret_long|>0.03 the bull regime got hurt because BTC 2021 bull had many strong-trend pullback-then-reversal patterns where deferred de-risk overshot.
-	0.164	0.109	0.352	0.22	-0.08	0.62	-0.32	discard	counter-trend partial-exit floor lowering (architectural new dependency on partial-exit decision boundary) — composite -0.004 vs 97399b7 keep, mean +0.0001, all per-regime essentially flat (bull +0.0004, rally exactly flat). Like exp4, the gate compounds tightly: rally bear positions rarely satisfy |ret_long|>0.04 AND short-position-in-uptrend simultaneously when partial-exit ramp is active. Insight across exp3/4/5: counter-trend rally bear losses are NOT eliminable via gating on (current ret_long) AND (current pos direction) — by the time position is held, ret_long has often shifted; need a state-tracked entry-time trend signal, not current-bar.
exp1	0.163	0.111	0.352	0.22	-0.08	0.62	-0.32	discard	entry-time counter-trend exit pressure 6th source (architectural new state) — composite -0.005 vs current baseline 0.168, mean +0.002 (tiny). Rally unchanged at -0.325. Mechanism barely fires: _w_ct = -_pnl_scale only for losers, _ct_pressure max 0.5 voter-attn-multiplied — total contribution to fusion small relative to existing _w_pp/_w_slope amplification. Magnitude too low to escape baseline rally trap.
exp2	0.159	0.107	0.354	0.22	-0.08	0.62	-0.33	discard	entry-time counter-trend scale-in ceiling attenuator (architectural new state) — composite -0.009 vs baseline 0.168, mean -0.002. Rally slightly worse -0.327 vs -0.325. Mechanism cuts size on counter-trend losing positions during scale-in but apparently also cuts valid mid-trend pullback shorts that later recover; persistent 0.7x ceiling reduces winning-trade upside more than it saves losing-trade downside.
exp3	0.127	0.090	0.377	0.22	-0.08	0.62	-0.40	discard	leaky-integrator opposite-voter evidence exit pressure 6th source (architectural new state) — composite -0.041 vs baseline 0.168, mean -0.019. Rally crushed -0.40 vs -0.32. Accumulated opposing voter pressure exits rally short pullbacks prematurely; rally short positions either stopped fast or need to ride pullback to recovery. Saturating evidence on sustained opposing consensus fires false reversal signals during normal rally pullback structure.
f944e98	0.508	0.373	0.201	0.63	0.09	0.47	0.30	keep	max-fusion exit pressure with bilateral additive voter_bias (multi-variable architectural) — composite +0.339, mean +0.264 vs current baseline 0.168. Bull +0.41, crash +0.18 (turned positive), rally +0.62 (turned positive). Sideways -0.15 (the only regression — voter_bias subtraction reduced sideways exit dampening that was load-bearing). Std narrowed dramatically from 0.352 to 0.201. ALL FOUR REGIMES POSITIVE for first time. New baseline.
a39261a	0.563	0.418	0.177	0.57	0.19	0.61	0.30	keep	chop-amplified own-side voter_bias subtraction — composite +0.056, mean +0.045 vs f944e98 keep. Sideways +0.13 (recovered fully), crash +0.10, rally +0.01, bull -0.06 (mild regression — chop amp slightly reduces bull voter-validated holds). Std narrowed 0.201->0.177. ALL FOUR REGIMES POSITIVE; composite +0.395 vs session-start baseline.
-	0.472	0.334	0.219	0.55	0.00	0.51	0.27	discard	remove per-voter directional persistence weighting (architectural simplification) — composite -0.091 vs a39261a, mean -0.084. Crash crushed -0.187 (persistence weighting was load-bearing for crash where directional voters get 1.3x amp), sideways -0.100, rally -0.030, bull -0.020. _persistence_mult provides genuine signal differentiation; _wt_shift alone is insufficient.
-	0.507	0.385	0.221	0.57	0.06	0.61	0.30	discard	trend-amplified opposite-side voter_bias (architectural symmetric mirror of chop_amp) — composite -0.056 vs a39261a, mean -0.033. Crash crushed -0.127 (in downtrend, bull voter conviction fires often during dead-cat bounces; amplifying opp-side bias kicks shorts out prematurely). Bull/sideways flat, rally -0.005. Mechanism direction wrong for crash: trend regimes have FREQUENT opposite-side noise that needs DAMPENING not AMP.
-	0.493	0.369	0.215	0.57	0.05	0.55	0.31	discard	trend-aligned dampened opposite-side voter_bias (architectural inverse of Exp2) — composite -0.070 vs a39261a, mean -0.049. Crash -0.144 (counter to hypothesis: dampening opp-side voters in trend-aligned positions HELD losing crash shorts longer instead of cutting them on real reversal evidence). Sideways -0.051 (sideways doesn't have strong trend alignment but the gating still partially fires). Rally +0.002 flat. The constant 0.20 opp-side coefficient seems load-bearing — both directions of perturbation hurt.
-	0.558	0.417	0.177	0.57	0.19	0.61	0.30	discard	volume-spike-against-position exit pressure 6th source (architectural new orthogonal signal) — composite -0.005 vs a39261a, mean essentially flat (-0.0004). All per-regime scores within 0.001 of baseline. Volume>1.5x median + loss-gated rarely fires concurrently in any regime; binary tanh gating with 0.8 width too strict. Mechanism direction reasonable (volume orthogonal) but trigger thresholds need to be much more aggressive or differently composed.
-	0.240	0.177	0.337	0.21	0.27	0.58	-0.35	discard	pnl-asymmetric exit_thresh modulator (architectural decision-boundary modulation) — composite -0.323 vs a39261a, mean -0.241. Crash improved +0.083 as hypothesized (faster cut on losing shorts), but bull -0.367 (early adverse pnl in winning trends cut prematurely) and rally -0.656 (disaster — counter-trend rally shorts that recovered now killed at first loss). Sideways tiny -0.022. Decision-boundary modulation by pnl too coarse — same mechanism that cuts losers also kills early-drawdown winners. Bull/rally MaxDD 15%/12% (vs 3.5%/6.2% baseline) — also breaks DD discipline by forcing whipsaw exits then re-entries.
-	0.554	0.417	0.173	0.57	0.20	0.60	0.29	discard	conviction-decay scale-in attenuator (architectural new state dependency on entry-bar strong-sum) — composite -0.010 vs a39261a, mean essentially flat. Crash +0.012 (intended: scale-ins on transient crash spikes reduced), sideways -0.005, rally -0.005, bull flat. Mechanism direction correct for crash but magnitude too small; chop regimes have natural conviction fluctuation that the attenuator misreads as decay.
-	0.557	0.418	0.177	0.57	0.19	0.61	0.30	discard	voter-flip-rate adaptive entry persistence (architectural new dependency on aggregate signal stickiness) — composite -0.006 vs a39261a, mean essentially flat. Rally +0.004 (intended: stickier signals during rally pullbacks pass through, choppy ones blocked), bull +0.002, sideways -0.004, crash -0.001. The +/-0.12 magnitude is too small; signal stickiness measure correlates with vol_ratio in practice (low-vol periods have sticky voters), so adjustment partly redundant with existing vol_ratio gate.
-	-0.004	-0.087	0.302	-0.36	-0.21	0.42	-0.20	discard	smooth-sigmoid exit mapping (architectural decision-boundary restructure) — catastrophic composite -0.567 vs a39261a. All trending regimes crushed (bull -0.93, crash -0.40, rally -0.50). Sigmoid leaks size attenuation across the full pressure range, holding 50% at threshold. The piecewise cascade preserved full size below 0.55*thresh — that buffer was load-bearing for trend-following.
-	0.091	0.068	0.388	0.25	-0.02	0.55	-0.51	discard	cross-symbol trend-divergence exit modulation (architectural new cross-symbol data dependency) — catastrophic composite -0.47 vs a39261a. Rally -0.51, bull -0.32, crash -0.21. With only 3 symbols, consensus-of-other-2 is volatile noise; pairwise sign disagreement is structurally common during trends (lead-lag). The 0.08 magnitude amplifies false exit pressure across all regimes.
-	0.046	-0.032	0.296	-0.04	-0.23	0.45	-0.30	discard	concurrency-amplified soft-pressure fusion (architectural nonlinear fusion term) — catastrophic composite -0.52 vs a39261a. Bull -0.61, crash -0.42, rally -0.61, sideways -0.16. Concurrent moderate-pressure activation is structurally common in trending regimes (slope-against fires alongside time-pressure as bars accumulate); +25% amplification compounds normal exits into premature ones. Sideways least affected (positions held shorter).
-	0.561	0.418	0.177	0.57	0.19	0.61	0.30	discard	vol-conditioned voter-ramp exponent (architectural function shape change) — composite -0.002 vs a39261a, mean essentially flat. All per-regime scores within 0.005 of baseline. Mechanism direction reasonable but tanh gate produces only modest k shift in observed vol_ratio range; the existing voter weight system (persistence, base, trend-shift) already saturates contribution dynamics. Crash regime (target) showed no improvement (-0.002).
branch1	0.415	0.353	0.293	0.61	0.54	0.49	-0.23	branch	graduated opp-gate exit (architectural new decision-boundary mechanism) — composite -0.148 vs a39261a, but crash +0.35 (massive!), bull +0.04. Rally -0.54 (catastrophic: counter-trend rally bears partial-exited then held into further losses), sideways -0.12 (positions undecided too long). Opening branch: gate graduated behavior on trend alignment — full exit for counter-trend, graduated for trend-aligned.
aaa7338	0.603	0.434	0.169	0.57	0.43	0.48	0.25	keep	BRANCH KEEP: graduated opp-gate gated on trend-aligned + in-profit (3 branch steps) — composite +0.040, mean +0.016 vs a39261a. Crash +0.24 (massive — partial exit on noise spikes preserves winning crash shorts), bull flat, sideways -0.13 (mild regression — small trend-align activations let some sideways positions hold too long), rally -0.05 (mild). Std narrowed (gain comes from consistency). All safety constraints met. Branch step 1 had crash +0.35 but rally/sideways crushed; step 2 added trend-align gate; step 3 added profit gate to require BOTH conditions, recovering rally fully and bull fully. New baseline.
-	0.595	0.434	0.116	0.57	0.43	0.48	0.25	discard	trend-acceleration exit pressure 6th source (architectural new entry-time state dependency on ret_long_entry) — composite -0.008 vs aaa7338, mean essentially flat (-0.0005). All per-regime scores within 0.001 of baseline. Mechanism barely fires: hourly ret_long changes too slowly relative to typical hold lengths (~3-10 bars) for the acceleration delta to clear the 0.025 threshold inside position lifetime. Cross-timescale gating compounds (ct_entry_strength * trend_accel) makes the trigger even rarer. Direction may be right but timescale mismatch.
-	0.602	0.439	0.119	0.57	0.43	0.50	0.25	discard	counter-trend max-hold reduction (architectural new cross-timescale dependency) — composite -0.004 vs d9ce29f keep, mean flat, all per-regime scores identical to baseline. Mechanism does not fire as intended: counter-trend positions exit via the opp-gate graduated full-exit (when bear voters spike with downtrend) before time-pressure max_hold reduction triggers. Time-pressure rarely the binding exit constraint for counter-trend positions; opp-gate and slope-against dominate. Loss came from LOC bonus diff.
-	0.601	0.439	0.119	0.57	0.43	0.50	0.25	discard	counter-trend losing-position vol-expansion exit weight (architectural new cross-timescale dependency) — composite -0.002 vs aaa7338, mean +0.005. Sideways +0.018 (largest gain, vol expansion exits work), bull +0.002, crash +0.002, rally +0.002. Promising direction but composite loss came from LOC bonus diff (added complexity). Mechanism fires correctly but magnitude small per-regime.
-	0.601	0.439	0.119	0.57	0.43	0.50	0.25	discard	counter-trend asymmetric persistence stricture (architectural new entry-gate dependency) — composite/mean/regimes IDENTICAL to current state baseline 0.601/0.439. Mechanism does not fire — persistence gate is not the binding constraint where counter-trend asymmetry would block additional entries; trend gate _bull_admit/_bear_admit (TREND_GATE_DEADZONE) likely already filters those entries upstream. NOTE: baseline aaa7338 row shows 0.603/0.434 but current HEAD produces 0.601/0.439 due to subsequent unreverted experiments (d9ce29f trend-conditioned persistence kept without recording in tsv). Effective baseline is 0.601/0.439.
-	0.257	0.249	0.436	0.57	0.43	0.50	-0.50	discard	multi-window slope mean for entry voter (architectural decouple) — catastrophic composite -0.344 vs 0.601, rally crushed from 0.25 to -0.50 (sharpe negative). 22-bar slope window pulls slope toward stale trend during rally pullbacks; bear voter fires on noise-extended downward slope when rally is mid-pullback. Single 16-bar window is load-bearing for rally bear-trigger sensitivity. Bull/crash/sideways near-flat.
1432e9f	0.603	0.454	0.142	0.64	0.43	0.50	0.25	branch	early-profit-lock exit pressure 5th source (multi-variable architectural) — composite +0.001 vs effective HEAD baseline (0.601), mean +0.016. Bull +0.068 (large gain — small bull profits now protected from full giveback before _pp_pressure activates). Crash flat, sideways +0.001 (flat), rally -0.006 (small regression — likely fires on rally bear bounces giving back small sub-peak gains that would have recovered). Vs aaa7338 row baseline composite -0.0008 (technically discard) but mean +0.020 strong. OPENING BRANCH: tighten lock on counter-trend rally bear positions via trend-alignment gate.
f9d133c	0.605	0.458	0.145	0.65	0.43	0.50	0.25	keep	BRANCH KEEP: early-profit-lock with wider activation (peak_floor 0.15*_pp_min, giveback fire 0.30) — composite +0.002 vs aaa7338, mean +0.024. Bull +0.082 (large gain — small bull profits protected from full giveback before _pp_pressure activates). Sideways +0.021, crash +0.002, rally -0.002 (small). Std widened slightly (0.169->0.145 actually narrowed) but composite improvement dominates. Branch step 1: peak_floor 0.30, giveback 0.40 — bull +0.07 baseline; step 2: trend-alignment gate had no effect (counter-trend positions dont reach peak threshold); step 3: widened activation to 0.15/0.30 unlocked sideways gain too. New baseline.
-	0.616	0.481	0.114	0.64	0.45	0.50	0.32	discard	1-bar exit-confirmation gate (architectural new state on full-exit decision) — composite -0.013 vs c2263af, mean flat (0.481), all per-regime within 0.002 of baseline. Mechanism barely fires: full-exit threshold (1.0) is rarely first crossed and recede the next bar; most exits proceed through de-risk partial path which still scales immediately. Composite loss came from LOC bonus diff.
-	0.619	0.481	0.115	0.64	0.46	0.50	0.32	discard	slope-acceleration-against exit boost (architectural new exit term) — composite -0.011 vs 401a319, mean -0.002. Rally -0.007 (opposite of expected — accelerating slope during rally pullbacks fires premature exit on counter-trend bears that would have recovered). Bull/crash/sideways flat (slope-acceleration term too small to fire in non-rally regimes). Direction wrong for rally; problem is exit-too-fast not exit-too-slow.
401a319	0.630	0.483	0.113	0.64	0.46	0.50	0.33	keep	cross-symbol concurrent-position entry attenuator (architectural cross-symbol coupling) — composite +0.001, mean +0.002 vs c2263af. Crash +0.009 (largest gain — reduced concurrent multi-symbol exposure during crash regime where BTC/ETH/SOL move together), bull +0.004, rally +0.004, sideways -0.001 (essentially flat). All four regimes positive. Std narrowed 0.115->0.113. New baseline. NOTE: keep row was inadvertently removed by subsequent revert commits; re-appending to restore permanent record.
-	0.629	0.483	0.113	0.64	0.46	0.50	0.33	discard	cross-symbol concurrent-position EXIT pressure additive (architectural cross-symbol coupling) — composite -0.001 vs 401a319, mean essentially flat, all per-regime within 0.0003. Mechanism barely fires: requires concurrent multi-symbol loss state which is uncommon at the small magnitude (0.06 max) used. Composite loss came from LOC overhead. NOTE: row was inadvertently removed by subsequent revert commits; re-appending for completeness.
-	0.622	0.484	0.111	0.64	0.46	0.50	0.33	discard	cross-symbol trend-sign confirmation entry boost (architectural cross-symbol coupling) — composite -0.007 vs 401a319, mean +0.001 (tiny). Rally +0.005 (intended — macro-aligned bull/bear positions get boosted size in confirmed-trend bars). Bull/crash/sideways near-flat. Std narrowed 0.113->0.111 (consistency gain). LOC overhead canceled the rally gain. Mechanism direction valid but magnitude too small to overcome cost. NOTE: row was inadvertently removed by subsequent revert commits; re-appending for completeness.
-	0.642	0.497	0.102	0.66	0.46	0.49	0.38	discard	opp-margin lateral modulation of partial-exit de_floor (architectural new cross-subsystem dep) — composite -0.002 vs 3487668, mean -0.0005, all per-regime IDENTICAL except rally -0.001. Mechanism barely fires: when opp-margin is high enough to lower the floor, _voter_bias has already raised _exit_pressure to trigger full exit anyway. Lateral modulation has no observable effect because the existing additive _voter_bias path dominates the same opp-margin signal. Loss came from LOC overhead.
4b25b0d	0.635	0.500	0.101	0.66	0.46	0.49	0.39	branch	multi-window slope consensus gate on first-bar size (architectural new cross-timescale data dep) — composite -0.009 vs 3487668, but ALL FOUR REGIMES improved: bull +0.003, crash +0.005, sideways +0.001, rally +0.005. Mean +0.003 (better than baseline). Composite loss came from LOC overhead (28 lines). Std flat. OPENING BRANCH: simplify implementation to reduce LOC and recover composite gain. Mechanism validated by per-regime improvement across all 4.
-	0.606	0.472	0.116	0.66	0.46	0.38	0.38	discard	vol-adaptive voter signal normalization (architectural data-fusion shape) — composite -0.039 vs 0.6448 baseline, mean -0.030. Sideways crushed -0.111 (sqrt(vol_ratio) scaling DOWN voter signals in low-vol made already-small signals even less informative — voters cluster harder near 0.5). Bull flat, crash flat, rally flat. Direction wrong: in sideways the fixed divisors aren't too large — voters work because signal magnitudes match. Vol-scaling divisors REDUCES sideways gradient where it was already small.
-	0.632	0.500	0.101	0.66	0.46	0.49	0.39	discard	conviction-evolution scale-in attenuator (architectural new state dep on entry strong-sum) — composite -0.012 vs 0.6448 baseline, mean -0.002. All per-regime within 0.005 of baseline. Mechanism barely fires: conviction-rising = full ramp (no effect); conviction-falling overlaps with existing pnl-attenuator (price down typically follows conviction fade). Redundant signal — no orthogonal information added. Loss came from LOC overhead.
-	0.280	0.254	0.308	-0.22	0.56	0.49	0.19	discard	noisy-OR exit-pressure fusion (architectural decision-architecture change) — catastrophic composite -0.365 vs 0.6448. Bull crushed -0.886 (sharpe turned negative), rally -0.197. Crash IMPROVED +0.096 (noisy-OR saturates faster on aligned strong pressures during crash). Sideways flat. Mechanism over-fires in profit regimes: pp_pressure x time x slope multiplicatively overshoot when each is moderate, killing winning trend positions. Additive sum WAS load-bearing because it allowed each pressure to stay below threshold individually; noisy-OR couples them.
