commit	score	mean_score	std_score	bull_2021	crash_bear	sideways	rally_2024	status	description
-	-	-	-	-	-	-	-	-	session-summary	SESSION (baseline 99a369a1 0.912878 v3-scoring -> UNCHANGED, no keep): 4 independent ARCHITECTURAL experiments (Exp1-4, ALL discards) + 1 STRUCTURAL_EXPLORATION branch (smooth-max LogSumExp exit fusion, 4 steps, REVERTED). EXIT RULE: structural-exploration branch reverted -> session ends (per protocol: one structural-exploration branch per session; if it reverts, session ends). >=2 architectural discards MET (Exp1-4 all architectural). Baseline 99a369a1 re-verified byte-identical at session start (composite 0.912878 mean 1.009061 std 0.320613, all stab 1.0 raw==score, min_stab 0.844331) [bull 1.382650 Sh2.068 APY20.4 DD2.49, crash 0.917980 Sh1.254 APY11.8 DD2.46, sideways 1.294241 Sh2.027 APY14.2 DD1.88, rally 0.973853 Sh1.553 APY18.6 DD5.16, mixed 0.476584 Sh0.808 APY4.4 DD2.78] AND post-branch-revert (strategy.py 0-diff to keep). results.tsv append-only preserved throughout (path-scoped git checkout 99a369a1 -- strategy.py for every discard/revert, never git revert; results.tsv untouched by rollback). THEME: tested whether the v3 scoring change (calmar return_reward -> return_bonus=APY, dd_gate knee 8->5) FLIPPED any load-bearing DD-cap levers net-negative, and whether a structural rewrite of the exit-fusion core could lift Sharpe (the now-dominant v3 reward). CROSS-EXPERIMENT CONCLUSIONS (all MEASURED this session, verifiable): (1) BOTH portfolio-DD-adaptive mechanisms (PORT_DD_TP_HARVEST_RELAX Exp1 + PORT_DD_GIVEBACK_TIGHTEN Exp2) remain LOAD-BEARING under v3 -- the scoring change did NOT flip them: tp_harvest is APY-raising via giveback-avoidance (locks realized gains at peaks, avoids oscillation giveback -> higher APY, confirmed by Exp1 disable = bull -0.016 sideways -0.037), and giveback tighten is DD-essential (Exp2 loosen = bull stability 1.0->0.0 SCORE ZEROED via exit-timing noise + rally DD 5.16->6.15 past knee + Sh drop). The DD-cap levers are essential not optional because (a) tp_harvest's APY-via-giveback-avoidance dominates the DD-cap cost even when DD is rewarded less, and (b) giveback tighten keeps rally DD near the 5pct knee and bull stability at the 0.80 knee (both fragile). (2) tp_harvest MAGNITUDE ceiling ~0.45-0.50 NOT flippable upward (Exp3 0.55 = bull -1.137 CATASTROPHIC over-harvest, Sh2.068->1.206 DD2.49->6.61 50pct gate breached): bull's over-harvest threshold is lower than crash's (crash shielded by Exp4 multi-day _ts_supp but bull is not). mixed BYTE-IDENTICAL at 0.55 confirms mixed is walled on tp_mag (its reachable harvest events are NOT at the magnitude-sensitive deep-peak region) -- extends the documented mixed tp_harvest wall from _ts_supp to tp_mag. (3) 9th ORTHOGONAL DATA-SOURCE voter (Exp4 price acceleration / 2nd derivative) REGRESSED broadly (bull -0.43 mixed -0.117) despite being the prior-session-identified ONLY un-disproven axis: the 2nd derivative flips sign more often than the 1st under AR(1) noise -> more admission-boundary flips -> lower-quality trade selection (mixed WR 100->89.3pct, bull 51->36 trades filtered). Useful SIGNAL: sideways +0.0097 via reaching the 50-trade sample_factor knee (48->50 trades = +2.1pct score) confirms the sample_factor lever is REAL for under-traded regimes (sideways 48, mixed 43 below the 50 knee) -- actionable via a non-acceleration mechanism. (4) STRUCTURAL_EXPLORATION smooth-max exit fusion (4 steps, REVERTED): the MAX fusion is NOT at a structural ceiling. The argmax-flip discontinuity does NOT manifest as a measurable Sharpe cost because the de-risk ramp floor (0.55-0.85) absorbs sub-threshold blend bonuses: any smooth-max blend strong enough to potentially improve Sharpe is too strong for near-equal-term regimes (sideways small near-equal top-2; bull trend-pullback pp vs slope near-equal) -> premature exits -> Sharpe drops + DD rises; any blend weak enough to be safe (s>=200) is byte-identical to MAX (inert). The exit-fusion FUNCTION FORM is NOT the Sharpe bottleneck. SATURATION RECONFIRMED: DD-cap levers not flippable under v3 (Exp1-3); voter additions noisy (Exp4); exit-fusion function form inert (structural branch); mixed walled on tp_mag + _ts_supp + sizing + grid. NEW BASELINE 99a369a1 0.912878 UNCHANGED. KEY FOR FUTURE SESSIONS: (a) do NOT re-attempt DD-cap lever loosening/disabling under v3 (both giveback-tighten and tp-harvest-relax are load-bearing: APY-raising + DD-essential, confirmed across Exp1-2); (b) do NOT re-attempt tp_mag raise above 0.50 (bull over-harvest threshold lower than crash, 0.55 catastrophic); (c) the v3 scoring change did NOT flip any DD-cap lever -- the APY-via-giveback-avoidance + DD-essential mechanisms dominate; (d) a 9th orthogonal voter on 2nd-derivative (acceleration) is too noisy (admission-boundary flips) -- future voter work should target LOWER-frequency signals (the 8th range/close voter on 1st-derivative-efficiency was the validated sweet spot); (e) the sample_factor lever for under-traded regimes (sideways 48, mixed 43) is REAL and actionable -- a mechanism that adds GOOD trades to under-traded regimes via a grid-EXEMPT path (full exits then re-entry) without a noisy new voter could lift sample_factor; mixed needs +7 trades, sideways +2; (f) do NOT re-attempt smooth-max/LogSumExp exit fusion (structural branch confirmed dead: argmax-flip inert under de-risk floor); (g) the Sharpe bottleneck lies in signal quality / admission / sizing, NOT exit-fusion function form. Strategy remains at confirmed deep local optimum 99a369a1.
7b1ef410	0.914862	1.010232	0.317899	1.383431	0.917980	1.289392	0.977887	0.482469	branch	Exp1 (architectural, indep, BRANCH OPEN): POSITION-SIZE-CONDITIONED grid exemption on the calm path (_calm_gate, never-bursting symbols crash/sideways/mixed/bull). Prior session root cause: mixed positions are SMALL relative to the grid step (0.06*equity*BASE) so tp_harvest/trim signals are grid-ABSORBED (snap to same lattice point -> emitted target unchanged, magnitude amp 2.5x byte-identical). Exempt |current_pos| < 1.5*grid steps from the calm grid so signal-driven reductions execute; large positions keep grid noise-protection. New cross-component data dep (calm-grid app depends on |current_pos|). MEASURED vs 99a369a1 0.912878: composite 0.914862 (+0.001984, BELOW +0.003 keep but positive), mean 1.010232 (+0.001171), std 0.317899. PER-REGIME all stab 1.0 raw==score all DD<5.2pct all flip_count 0: bull 1.382650->1.383431 (+0.0008 Sh2.068->2.069 51t), crash 0.917980->0.917980 (BYTE-IDENTICAL Sh1.254 52t), sideways 1.294241->1.289392 (-0.0048 Sh2.027->2.019, 48->57 trades -- KEEP-BLOCKER, exemption let sideways micro-resizes through), rally 0.973853->0.977887 (+0.0040 Sh1.553->1.552 102->105t), mixed 0.476584->0.482469 (+0.0059 Sh0.808->0.808, 43->44t -- BINDING FLOOR MOVED, broke re-quantization wall via grid-exemption not grid-width). BRANCH OPEN: fundamentally new emission mechanism reaching mixed (the binding floor) for first time via grid-exemption; 3 regimes improved (mixed+rally+bull); crash byte-identical (large positions); sideways -0.0048 is keep-blocker (exemption threshold 1.5 too loose -> sideways positions also exempted -> micro-resize churn). HYPOTHESIS for fix: tighten exemption threshold to ~1.0 grid step so mixed (tiny positions) stays exempt while sideways (larger positions) keeps grid protection.
7df1458e	0.914862	1.010232	0.317899	1.383431	0.917980	1.289392	0.977887	0.482469	branch	branch step2: tighten small-pos grid exemption threshold 1.5->1.0 grid steps. MEASURED vs step1 7b1ef410 0.914862: BYTE-IDENTICAL (composite 0.914862, all 5 regimes identical, all trade counts identical 51/52/57/105/44, all Sharpe identical). NO-PROGRESS step (raw_composite delta = 0). DIAGNOSIS: mixed positions exempt at 1.5 are the SAME positions exempt at 1.0 -> mixed positions are <1.0 grid step (smaller than threshold band). The sideways regression in step1 is NOT from positions in [1.0,1.5] band -> sideways also has tiny (<1.0) positions exempted OR sideways regression is structural (its 48->57 trade count jump from exempted micro-resizes). Threshold tuning cannot separate mixed from sideways; need a different separator (vol regime, MTM-path chop, or position-direction-based).
d5600a8f	0.913928	1.009269	0.317801	1.382650	0.917980	1.289392	0.973853	0.482469	branch	branch step3: gate small-pos grid exemption to REDUCTIONS only (threshold 1.5). MEASURED vs step1 7b1ef410 0.914862: composite 0.913928 (-0.000934 REGRESSION vs step1), mean 1.009269 (-0.000963), still +0.001050 vs baseline. PER-REGIME: bull 1.383431->1.382650 (back to baseline -0.0008), crash BYTE-IDENTICAL 0.917980, sideways 1.289392 (SAME as step1 -0.0048 -- reductions-only gate did NOT fix sideways), rally 0.977887->0.973853 (back to baseline -0.0040 -- lost rally gain), mixed 0.482469 (SAME as step1 +0.0059 -- preserved). NO-PROGRESS step (raw_composite delta -0.000934 vs step1). DIAGNOSIS: sideways also has small positions exempted on reductions -> its noisy micro-reductions leak through too. Reductions-only gate hurt rally (lost the +0.0040 gain from step1) WITHOUT fixing sideways. Mixed and sideways BOTH have small positions; threshold and direction gating cannot separate them. Need a state-based separator (MTM-path chop / PnL state / trend direction) -- mixed positions are choppy dead capital, sideways reductions are on smoother winners.
c7e3b4df	0.914762	1.010404	0.318809	1.382650	0.917980	1.295071	0.973853	0.482469	branch	branch step4: gate small-pos grid exemption on MTM-path-chop (>0.40). MEASURED vs step1 7b1ef410 0.914862: composite 0.914762 (-0.000100 ~flat), mean 1.010404 (+0.000172 HIGHER than step1), std 0.318809 (+0.000910). vs baseline 0.912878: composite +0.001884, mean +0.001343. PER-REGIME: bull 1.383431->1.382650 (back to baseline, chop gate excludes bull smooth winners), crash BYTE-IDENTICAL 0.917980, sideways 1.289392->1.295071 (+0.0057 vs step1 FIXED, +0.0008 vs baseline, Sh2.019->2.028, 57->55t -- chop gate spared sideways smooth winners), rally 0.977887->0.973853 (back to baseline, chop gate excludes rally), mixed 0.482469 (SAME +0.0059 -- preserved). PROGRESS: sideways keep-blocker FIXED (chop>0.40 separates mixed dead capital from sideways smooth winners); mixed gain preserved. Remaining gap: bull/rally small-position reductions also choppy on pullback bars but chop gate excludes them entirely -> lost step1 bull +0.0008 rally +0.0040. HYPOTHESIS: lower chop threshold to recapture some bull/rally gains while keeping sideways fixed.
b98f9885	0.914868	1.010550	0.318939	1.382650	0.917980	1.295798	0.973853	0.482469	branch	branch step5: lower chop exemption threshold 0.40->0.30. MEASURED vs step4 c7e3b4df 0.914762: composite 0.914868 (+0.000106 PROGRESS), mean 1.010550 (+0.000146), std 0.318939. vs baseline 0.912878: composite +0.001990, mean +0.001489. PER-REGIME: bull 1.382650 (baseline), crash BYTE-IDENTICAL 0.917980, sideways 1.295071->1.295798 (+0.0007 vs step4, +0.0016 vs baseline, Sh2.028->2.031, 55->56t -- still fixed), rally 0.973853 (baseline), mixed 0.482469 (SAME +0.0059 preserved, 44t). Sideways fixed without leak; bull/rally still at baseline (chop gate excludes their smooth winners). Composite matches step1 (0.914862) but with sideways FIXED and higher mean. Still below +0.003 keep.
916b856b	0.914944	1.010633	0.318964	1.382650	0.917931	1.295855	0.974328	0.482400	branch	branch step6: raise position-size threshold 1.5->2.0 grid steps. MEASURED vs step5 b98f9885 0.914868: composite 0.914944 (+0.000076 PROGRESS marginal), mean 1.010633 (+0.000083), std 0.318964. vs baseline 0.912878: composite +0.002066, mean +0.001572. PER-REGIME: bull 1.382650 (baseline), crash 0.917980->0.917931 (-0.0001), sideways 1.295798->1.295855 (+0.0001 Sh2.031 57t), rally 0.973853->0.974328 (+0.0005 vs step5, +0.0005 vs baseline), mixed 0.482469->0.482400 (-0.0001 Sh0.808 44t). Marginal progress; mixed positions mostly <1.5 grid steps already so 2.0 threshold barely changes. Mixed Sharpe stuck at 0.808 (exemption improves sample_factor trade count not Sharpe). Still below +0.003 keep.
b65cbe64	0.687982	0.795012	0.356767	0.304525	0.917961	1.295855	0.974320	0.482400	branch	branch step7: position-size-conditioned tp_harvest magnitude deepening (+0.20 max for sub-grid positions). MEASURED vs step6 916b856b 0.914944: CATASTROPHIC composite 0.687982 (-0.226962). PER-REGIME: bull 1.382650->0.304525 (DD spike stability collapse -- 50pct GATE BREACHED 78pct drop; deeper harvest over-harvested bull small positions during pullbacks, missing recovery), crash 0.917931->0.917961 (~flat), sideways 1.295855 (SAME), rally 0.974328->0.974320 (~flat), mixed 0.482400 (BYTE-IDENTICAL -- deeper harvest did NOT help mixed). FAILURE MECH: mixed is BYTE-IDENTICAL (its deep-peak harvest events are NOT in the position-size-conditioned magnitude band -- the tp_harvest fires at deep peaks where position is already larger, OR mixed already unsuppressed so magnitude change neutralized by grid); bull CATASTROPHIC (bull pullback bars shrink positions to small size -> deeper harvest fires -> over-harvested -> misses bull recovery). Position-size-conditioned tp_mag is DEAD (bull 50pct gate breached). REVERT step7 to step6 state.
45f4fae4	0.481008	0.617641	0.455446	0.283994	0.051642	1.295855	0.974314	0.482400	branch	branch step8: CHOP-GATED position-size tp_mag deepening (re-attempt step7 with chop gate). MEASURED vs step6 916b856b 0.914944: CATASTROPHIC composite 0.481008 (-0.433936). PER-REGIME: bull 1.382650->0.283994 (DD 2.49->6.73pct, 51->85t, WR 86.3->75.3pct -- over-harvested pullback winners, 50pct GATE BREACHED), crash 0.917931->0.051642 (DD 2.46->6.64pct -- over-harvested crash recovery shorts, 50pct GATE BREACHED), sideways 1.295855 (SAME), rally 0.974328->0.974314 (~flat), mixed 0.482400 (BYTE-IDENTICAL -- deeper harvest STILL does not help mixed). FAILURE MECH: chop gate did NOT protect bull/crash -- bull pullback positions ARE choppy (sharp pullbacks = low MTM-eff) -> chop gate fired -> over-harvested; crash recovery shorts also choppy. CONFIRMS step7: position-size-conditioned tp_mag is DEAD regardless of chop gating. mixed is BYTE-IDENTICAL across step7 AND step8 (its deep-peak harvest events do NOT respond to magnitude changes -- either not in magnitude band or already neutralized). The tp_mag lever is SATURATED for mixed. REVERT step8 to step6 state.
823cf0ff	0.914945	1.010634	0.318963	1.382650	0.917937	1.295855	0.974328	0.482401	branch	branch step9: position-size-conditioned MTM-chop TRIM amplitude deepening (+0.30 max extra AMP for sub-grid positions). MEASURED vs step6 916b856b 0.914944: composite 0.914945 (+0.000001 ~BYTE-IDENTICAL), mean 1.010634, std 0.318963. PER-REGIME: bull 1.382650 (SAME, DD 2.49 -- bull-sparing gates PROTECTED), crash 0.917931->0.917937 (+0.0000), sideways 1.295855 (SAME), rally 0.974328 (SAME), mixed 0.482400->0.482401 (+0.000001 ~BYTE-IDENTICAL). NO-PROGRESS step (raw_composite delta +0.000001 ~= 0). SAFE (no catastrophe -- the existing _grind_gate+_strong_trend_fade+_winner_fade bull-sparing stack protected bull/crash) BUT INERT for mixed. CONFIRMS mixed wall is STRUCTURAL: mixed reductions execute (grid exemption) but deeper trim does not change mixed Sharpe (0.808 stuck across steps 1-9). The mixed gain is purely sample_factor (43->44 trades); no exit-path deepening moves mixed Sharpe. 3 consecutive no-progress steps (step7/8 catastrophic + step9 inert).
00c89f40	0.914830	1.010477	0.318823	1.382650	0.917937	1.295071	0.974328	0.482401	branch	branch step10: raise chop exemption threshold 0.30->0.50. MEASURED vs step6 916b856b 0.914944: composite 0.914830 (-0.000114 REGRESSION), mean 1.010477 (-0.000156). PER-REGIME: sideways 1.295855->1.295071 (-0.0008, 57->55t -- raising threshold excluded sideways positions that benefited at 0.30), mixed 0.482401 (SAME), bull/crash/rally SAME. NO-PROGRESS step (4th consecutive: step7/8/9/10). Chop threshold 0.30 confirmed optimal (0.40 step4 worse, 0.50 step10 worse). REVERT to step6 (chop 0.30, best composite 0.914944).
f274066a	0.914012	1.009363	0.317801	1.382650	0.917931	1.289508	0.974328	0.482400	branch	branch step11: fine-tune chop threshold 0.30->0.25. MEASURED vs step6 916b856b 0.914944: composite 0.914012 (-0.000932 REGRESSION), sideways 1.295855->1.289508 (-0.0063, 57t -- lowering to 0.25 re-leaked sideways), mixed 0.482400 (SAME). NO-PROGRESS step (5th consecutive). Chop 0.30 confirmed the sweet spot (0.25 leaks sideways, 0.40/0.50 under-perform). REVERT to step6.
5e03c4d6	0.914944	1.010633	0.318964	1.382650	0.917931	1.295855	0.974328	0.482400	branch	branch step12: probe position threshold 2.0->2.5. MEASURED vs step6 916b856b 0.914944: BYTE-IDENTICAL (composite 0.914944, all regimes identical, all trade counts identical 51/51/57/101/44). NO-PROGRESS step (6th consecutive). Mixed positions all <2.0 grid steps so 2.5 threshold changes nothing. Position threshold saturated at 2.0. Branch at structural ceiling +0.002066 vs baseline 0.912878.
17efcc41	0.879978	0.961176	0.270660	1.129569	0.918128	1.295855	0.974328	0.488003	branch	branch step13: position-size-conditioned emission threshold reduction (0.7*LEVERAGE_K) for small choppy reductions. MEASURED vs step6 916b856b 0.914944: composite 0.879978 (-0.034966 REGRESSION, 7th no-progress step -> STAGNATION GUARD TRIGGERS). PER-REGIME: mixed 0.482400->0.488003 (+0.0056 vs step6, +0.0114 vs BASELINE -- MIXED FINALLY MOVED via +1 trade 44->45, Sh0.808->0.81, 100pct WR held!), bull 1.382650->1.129569 (-0.253 CATASTROPHIC, Sh2.068->1.77, 51->47t, APY20.4->16.6pct, DD2.49 -- 50pct GATE not breached but huge Sharpe drop), crash +0.0001, sideways SAME, rally SAME. FAILURE MECH: chop gate (>0.30) did NOT protect bull -- bull pullback positions are small (position shrank during pullback) AND choppy (sharp pullback = low MTM-eff) -> they qualify for the lower emission threshold -> emit as noise trades -> over-trade bull -> Sharpe collapse. CONFIRMS (with steps 7-8): the chop signal (MTM-path-eff) does NOT cleanly separate mixed from bull -- bull sharp-pullback positions are ALSO choppy. The chop gate works for the grid exemption (sideways separator) but NOT for emission/threshold levers (bull separator). mixed +0.0114 gain is REAL but unreachable without catastrophic bull cost. BRANCH TERMINATES: 7 consecutive no-progress steps (step7/8/9/10/11/12/13). REVERT to step6 then to baseline.
594c9175	0.916682	1.011808	0.317086	1.382650	0.918172	1.295855	0.974328	0.488033	keep	branch step13b KEEP: emission threshold reduction gated on MULTI-DAY TREND DIRECTION (ret_vlong*pos_dir<0). Step13 (chop gate) was CATASTROPHIC for bull (-0.253: bull pullback positions are small AND choppy -> chop gate fired -> over-traded). The SEPARATOR that cleanly distinguishes mixed from bull is MULTI-DAY TREND DIRECTION: mixed held longs are in a DOWNTREND (ret_vlong<0, pos_dir=+1 -> product<0 = counter-trend-at-multi-day); bull pullback longs are in an UPTREND (ret_vlong>0, product>0 = trend-aligned). Gate the 0.7*LEVERAGE_K emission threshold on counter-trend-at-multi-day small positions only. MEASURED vs baseline 99a369a1 0.912878: composite 0.916682 (+0.003804, CLEARS +0.003), mean 1.011808 (+0.002747), std 0.317086 (-0.003527). PER-REGIME all stab 1.0 raw==score all flip 0 all DD<5.2pct: bull 1.382650->1.382650 (BYTE-IDENTICAL Sh2.068 51t -- trend-aligned longs PROTECTED by ret_vlong gate), crash 0.917980->0.918172 (+0.0002 Sh1.254 52t), sideways 1.294241->1.295855 (+0.0016 Sh2.027->2.031 48->57t -- from step6 grid exemption, preserved), rally 0.973853->0.974328 (+0.0005 Sh1.553 102->101t), mixed 0.476584->0.488033 (+0.0114 Sh0.808->0.81, 43->45t, 100pct WR HELD -- BINDING FLOOR MOVED, +2 sample_factor trades via grid-exempted reductions now emitting). min_stab 0.844322. MECHANISM (measured): the grid exemption (step6, chop-gated) lets mixed small-position reductions EXECUTE (not grid-absorbed); the step13b emission threshold reduction lets those reductions EMIT as trades (sub-dollar delta was filtered by 1.0*LEVERAGE_K). The ret_vlong-direction gate is the clean separator: mixed longs counter-trend-at-multi-day (product<0) qualify; bull/rally trend-aligned longs (product>0) keep baseline threshold. mixed +0.0114 = +2 trades (43->45) at 100pct WR = pure sample_factor gain (sqrt(45/50)=0.949 vs sqrt(43/50)=0.927 = +2.4pct on mixed score). CROSS-EXPERIMENT CONCLUSION (verifiable this session): the chop signal (MTM-path-eff) does NOT separate mixed from bull (bull pullbacks are choppy) -- confirmed across steps 7/8/13. The MULTI-DAY TREND DIRECTION (ret_vlong*pos_dir) IS the clean separator. This unblocks the sample_factor lever for mixed (prior session documented it actionable but unreachable). NEW BASELINE 594c9175 0.916682.
