commit	score	mean_score	std_score	bull_2021	crash_bear	sideways	rally_2024	status	description
de412448	0.6393	0.7454	0.2120	0.78	0.77	1.01	0.42	discard	BRANCH SUMMARY (TOD-removal, 3 steps, REVERTED to de412448). step1 (TOD _tod_atten=1.0): raw_composite 0.639349->0.641874 (+0.0025), rally RAW 0.419353->0.429756 (+0.0104), bull 0.781251->0.779815, crash 0.767586->0.763421, sideways 1.013297->1.005079. step2 (gap grid = grid bursted-quiet _cm>2 & len(_eh)<=1 resizes): rally STAB 0.5706->0.6670 (factor 0.235->0.557) with raw BYTE-IDENTICAL (zero clean-run cost) -> NEW zero-raw-cost rally-stab lever; the quiet-stretch resize coverage gap is a real ungridded rally-instability source. step3 (gap-state deadband): BROKE rally (raw->0 hard cutoff) - deadband suppression starves rally quiet resizes; GRID quantizes (works), DEADBAND suppresses (breaks). REVERT REASON (decisive, MEASURED): TOD removal LOWERS mean_score 0.745372->0.744518 (strong-regime raw drops bull-0.0014/crash-0.0042/sideways-0.0082 exceed rally +0.0104 in MEAN); even at rally factor 1.0 mean<baseline -> mean-improvement keep criterion UNSATISFIABLE regardless of stability. raw_composite gain was pure std-reduction (rally outlier rose), not mean.
-	0.5360	0.6367	0.2013	0.82	0.77	0.66	0.30	discard	ARCHITECTURAL robust MAD-winsorized (4-sigma, 1.4826*MAD) short realized-vol numerator (new _robust_std helper; vol_ratio now depends on outlier structure of 24-bar log-rets). composite 0.6393->0.5360, mean 0.7454->0.6367. MEASURED: bull raw 0.781->0.817 (Sh 1.556->1.539, stab 0.810->0.873), crash BYTE-FLAT 0.768 (sustained-vol large-MAD = unclipped, confirms mechanism selectivity), rally raw FLAT 0.419->0.419 (vol-change size-invariant AGAIN) but rally STAB 0.801->0.716 (factor 1.0->0.721, score->0.302), sideways raw COLLAPSED 1.013->0.660 (Sh 1.941->1.215). FINDING: winsorizing clips the small-but-real vol structure in LOW-VOL regimes (sideways/rally) -> distorts vol_ratio sizing; only bull (spike-driven vol) benefits. Robust-vol is net-negative for low-vol regimes. Discard (mean down, sideways -35%, rally stab cliff).
-	0.5372	0.6886	0.3028	0.78	0.77	1.01	0.19	discard	ARCHITECTURAL post-counter-trend-loss same-side admission tightening (new _last_exit_dir state; same-side _strong_min raised +30%*recency*loss_mag*counter-trend-ness for ~6 bars after a realized counter-trend losing exit; admission-only, off global _strong_min). composite 0.6393->0.5372. KEY: raw_composite BYTE-IDENTICAL 0.639349 (ALL 4 regime raws unchanged - bull 0.781 crash 0.768 sideways 1.013 rally 0.419) = mechanism INERT on clean data (targeted whipsaw re-entries dont fire / threshold bump too small to change clean decision). But rally STAB COLLAPSED 0.801->0.637 (factor->0.458, score 0.419->0.192), crash stab 0.974->0.959, bull stab 0.810->0.826. FINDING: the threshold-multiplier adds a noise-sensitive admission boundary near rally operating point -> entries flip under AR(1) noise. Reconfirms (a) rally raw byte-invariant to admission tightening, (b) any new noise-sensitive boundary near rally collapses its stability. Discard (inert+harmful, no raw upside to branch on).
-	0.5875	0.7079	0.2409	0.78	0.77	0.97	0.31	discard	ARCHITECTURAL portfolio-concentration-aware first-bar size reduction (cross-symbol: size*=1-0.18*tanh(same-dir concurrent count among other symbols); non-uniform = reshapes equity curve, NOT Sharpe-invariant). composite 0.6393->0.5875, raw_composite 0.6393->0.6382 (~FLAT). MEASURED: bull raw 0.781->0.783 (+0.002), crash BYTE-FLAT 0.768, rally raw 0.419->0.416 (-0.003), sideways raw FLAT 1.013->1.013. Variance-reduction->Sharpe hypothesis FAILED (raw_composite DOWN). STAB DAMAGE: rally 0.801->0.726 (factor->0.753, score->0.314), sideways 0.849->0.787 (factor->0.957, score->0.968). FINDING: cross-symbol concurrent-count is a noise-sensitive boundary (other-symbol positions shift under AR(1)) -> collapses rally+sideways stability. 3rd session confirmation that cross-symbol/size mechanisms are raw-flat AND collapse low-vol-regime stability. Discard.
-	0.5371	0.6867	0.2993	0.78	0.77	1.00	0.19	discard	ARCHITECTURAL simplification: remove 20-bar counter-trend entry-size attenuator (_ct_gate/_bull_ct_atten/_bear_ct_atten; fires at 20-bar|ret_long|>0.03+counter-trend). composite 0.6393->0.5371. KEY: raw_composite 0.639346 ~BYTE-IDENTICAL (bull -0.00001, crash/rally/sideways byte-flat) = 20-bar term INERT on CLEAN data (confirms de412448 claim: 96-bar _ct_vlong is the load-bearing counter-trend size mechanism). BUT removal COLLAPSED stability: rally 0.801->0.639 (factor->0.46, score 0.419->0.194), crash 0.974->0.938, sideways 0.849->0.797. CROSS-EXPERIMENT FINDING (load-bearing): the size attenuators are NOISE-ROBUSTNESS PROPS - clean-inert but STABILIZING under AR(1) noise (they dampen noise-induced counter-trend entries -> reduce position-value tracking error). Removing one looks free on clean data but collapses stability. SIMPLIFICATION-BY-REMOVAL of size attenuators is a TRAP at this baseline. Discard.
-	0.5871	0.7161	0.2581	0.78	0.77	1.01	0.30	discard	ARCHITECTURAL counter-trend-conditional stop tightness (_stop_abs *= 1-0.20*tanh(-pos_dir*ret_vlong/0.02)+0.10*tanh(aligned); tighten counter-multi-day-trend stops, widen aligned). composite 0.6393->0.5871. KEY: raw_composite 0.639349 BYTE-IDENTICAL (ALL 4 regime raws flat) = SL is NOT the binding exit (soft slope/time/ar pressures fire BEFORE the stop), so stop-tightness is inert on clean data. STAB: bull 0.810->0.915 UP, sideways 0.849->0.883 UP, crash 0.974->0.927, rally 0.801->0.716 COLLAPSE (factor->0.721, score 0.419->0.302). FINDING: making the entry-anchored stop depend on price-derived ret_vlong turned the 'noise-immune' stop noise-sensitive near the SL band boundary -> rally exit-timing flips under noise. Even SL-side changes collapse rally stability if they add a price-derived term near the exit boundary. Discard.
de412448	0.6393	0.7454	0.2120	0.78	0.77	1.01	0.42	session-summary	session: 5 independent ARCHITECTURAL discards (EXIT RULE at 5 consecutive architectural), 0 branches (none branch-eligible: every exp was raw-flat/raw-down AND collapsed rally stability - nothing to build on). Baseline de412448 UNCHANGED 0.6393 [bull 0.781 crash 0.768 sideways 1.013 rally 0.419, all stab-factor 1.0, min_stab 0.801]. WALLS CONFIRMED this session (each a distinct mechanism class): (E1) robust MAD-winsorized realized_vol -> sideways raw COLLAPSE 1.013->0.660 + rally stab cliff (clips real low-vol structure; only bull benefits). (E2) post-counter-trend-loss same-side admission tightening -> raw BYTE-IDENTICAL (admission inert on clean rally) + rally stab 0.801->0.637. (E3) portfolio-concentration cross-symbol size cut -> raw ~flat (variance-reduction->Sharpe FAILED) + rally/sideways stab collapse (cross-symbol count = noise boundary). (E4) REMOVE 20-bar _ct_atten -> raw BYTE-IDENTICAL but rally stab 0.801->0.639. (E5) counter-trend-conditional stop tightness -> raw BYTE-IDENTICAL (SL not the binding exit; soft pressures fire first) + rally stab collapse (ret_vlong dep makes stop noise-sensitive). CROSS-EXPERIMENT LOAD-BEARING FINDING: the size attenuators are NOISE-ROBUSTNESS PROPS - clean-inert (removing/altering = byte-identical raw) but STABILIZING under AR(1) noise; removal/alteration looks free on clean data but collapses rally stability. => SIMPLIFICATION-BY-REMOVAL of size attenuators is a TRAP. CONCLUSION: rally raw (0.419, the binding constraint) is BYTE-INVARIANT to size/vol/admission/SL changes (3 byte-identical raws this session); rally+sideways stability sit at the 0.80/0.85 cliff and ANY new price-derived term near entry/size/exit boundaries collapses them. Tight local optimum; raw movers must change voters or the binding (soft) exit, both heavily saturated. Cross-ex note (fa18a3d7) warns in-sample composite gains do not generalize.
d62fc09a	0.5250	0.6819	0.3138	0.78	0.77	1.01	0.17	branch	BRANCH OPEN (multi-day counter-trend exit acceleration). NEW MECHANISM: ret_vlong (96-bar OLS slope) added to EXIT subsystem for first time (was entry-size-only); _ctv_bias=0.25*tanh(-pos_dir*ret_vlong/0.015)*tanh(-pos_pnl/|STOP|) added to _exit_pressure, cuts losing counter-trend holds faster. MEASURED vs de412448: bull/crash/sideways BYTE-IDENTICAL (mechanism rally-isolated by construction; sideways confirms ret_vlong~0). rally RAW 0.419353->0.429024 (+0.0097, Sharpe 0.736314->0.758194 +0.022 = real raw gain on binding constraint), BUT rally stab 0.8008->0.616 (factor 1.0->0.386) so rally final 0.419->0.165 (breaches 50pct floor 0.21). raw_composite 0.6393->0.6436 (+0.0043). WHY REGRESSION: additive exit-pressure shifts rally loser exit-timing -> trade-set changes under AR(1) noise; rally was at 0.80 knife-edge. FIX HYPOTHESIS: convert to GRADUAL size de-risk (continuous, more Sharpe-invariant-like) instead of additive exit-pressure (threshold-cross), per entry-side fast-saturation lesson. Target: rally raw>0.419 with stab>=0.80.
-	0.6393	0.7454	0.2120	0.78	0.77	1.01	0.42	discard	BRANCH SUMMARY (multi-day counter-trend EXIT acceleration, 8 steps, REVERTED to de412448; strategy.py byte-identical, reproduces composite 0.639349 / mean 0.745372 / rally 0.419353 / min_stab 0.800755). NEW MECHANISM (never tried in exit subsystem): ret_vlong (96-bar OLS slope, previously entry-size-only) added to EXITS to cut positions held AGAINST the multi-day trend faster. KEY MEASURED RESULT: mechanism ROBUSTLY raises rally RAW Sharpe 0.736314->0.788465 (+0.052, step3; raw_score 0.419353->0.438337 +0.019) with bull/crash/sideways BYTE-IDENTICAL at mag<=0.25 (confirms rally raw IS movable via EXIT-TIMING of counter-trend holds, distinct from entry-size shrink which prior sessions found Sharpe-invariant; sideways byte-identical confirms ret_vlong~0 there). BUT every variant dropped rally STABILITY from its knife-edge 0.8008, and the stability-factor penalty exceeded the raw gain -> rally FINAL capped at 0.326 (step7) << 0.4194 baseline needed for keep. FRONTIER (rally raw / stab_factor / final): step1 additive instantaneous-pnl gate 0.429/0.386/0.165; step3 additive bars_held gate (BEST) m0.25 scale0.015 0.438/0.674/0.296 composite0.584; step7 mag0.40 0.419/0.778/0.326 but bull stab collapsed 1.0->0.679 (decisive exit leaks into bull counter-trend shorts); step2 geometric size-shrink and step5 mag0.18 both collapsed rally raw->0 (hard cutoff <10 trades). MEASURED gate-robustness ranking (rally stab): bars_held 0.702 > instantaneous-pnl 0.616 > max_hold-route 0.556 > mae-gate 0.166 -- ALL pnl-derived gates (instantaneous, MAE low-water) are noise-sensitive in rally shallow-loss zone; integer bars_held is the most noise-robust trigger. Harder ret_vlong saturation (scale 0.010, step4) steepened the ret_vlong=0 edge and leaked into bull (stab 0.984) while LOWERING rally stab 0.702->0.692. CONCLUSION: counter-trend exit-timing is a real rally-RAW lever (+0.052 Sharpe) but rally's pre-existing 0.8008 knife-edge stability cannot absorb the exit-timing trade-set perturbation; the raw gain (+4.5pct) is too small vs the factor drop (1.0->0.67). Reaching a keep here would first require independently raising rally stability HEADROOM. baseline de412448 UNCHANGED 0.6393.
de412448	0.6393	0.7454	0.2120	0.78	0.77	1.01	0.42	session-summary	SESSION: 1 independent architectural exp (Exp1=branch-open, immediately branch-eligible: new mechanism + rally raw up) + 1 exploration branch (8 steps, REVERTED). Baseline de412448 UNCHANGED 0.6393 [bull 0.781251 Sh1.556, crash 0.767586 Sh1.311, sideways 1.013297 Sh1.941, rally 0.419353 Sh0.736 stab0.8008; all factors 1.0]; strategy.py verified byte-identical, reproduces 0.639349/0.745372/rally 0.419353/min_stab 0.800755. DIRECTION TESTED (NEW, not in prior results.tsv): ret_vlong (96-bar OLS slope) in the EXIT subsystem -- counter-trend exit acceleration (cut holds against the multi-day trend faster). FINDING: robustly raises rally RAW Sharpe 0.736->0.788 (+0.052) / raw_score 0.419->0.438 with bull/crash/sideways BYTE-IDENTICAL at mag<=0.25 -> EXIT-TIMING of counter-trend holds is a genuine rally-RAW lever (distinct from Sharpe-invariant entry-size shrink). BLOCKER: exit-timing perturbs rally trade-set; rally stability fell from its 0.8008 knife-edge to 0.70 (best, bars_held gate) and the factor penalty exceeded the raw gain -> rally FINAL capped 0.326 << 0.419 needed. Measured gate-robustness (rally stab): bars_held 0.702 > instantaneous-pnl 0.616 > max_hold-route 0.556 > MAE-gate 0.166 (all pnl-derived gates noise-sensitive in shallow-loss zone). mag0.40 lifts rally stab to 0.778 but cuts raw to 0.419 AND leaks into bull (stab 0.679); mag0.18 & geometric size-shrink collapsed rally raw->0. CROSS-EXPERIMENT INSIGHT for future sessions: rally raw is improvable via counter-trend exit-timing, but only AFTER independently raising rally stability headroom (rally cannot absorb exit-set changes at 0.8008). NEXT: target rally STABILITY headroom first, OR a Sharpe-asymmetric loser-cut that does not perturb the trade-set count.
12d6c5f9	0.5056	0.6712	0.3313	0.78	0.77	1.01	0.12	keep	RE-BASELINE (scoring methodology change, NOT strategy): commit 12d6c5f9 replaces per-strategy AST-hash stability seed with 5 fixed shared seeds averaged (avg5, 5x20=100 noise realizations). strategy.py UNCHANGED == de412448 logic; raw_composite byte-identical 0.639349 (confirms engine+strategy untouched, only stability MEASUREMENT changed). NET EFFECT: rally stability 0.800755 (AST-hash single lucky right-tail draw) -> 0.587882 (true 5-seed mean), rally factor 1.0->0.292941, rally score 0.419353->0.122846; bull/crash/sideways stability 0.830/0.966/0.838 factor 1.0 UNCHANGED. composite 0.639349->0.505579, mean 0.671245, std 0.331332. pytest 21/21. REGIME_TIMEOUT 420->1020s (avg5 runs 100 perturbed backtests/regime; measured re-baseline wall 673s). SUPERSEDES de412448 0.6393 as baseline.
-	0.505938	0.671594	0.331311	0.78	0.77	1.01	0.12	discard	ARCHITECTURAL exit-density-gated first-bar entry-size GRID quant (new _exit_bar_history; quantize entry target onto 0.06*equity*BASE when >=2 exits within 30 bars). MEASURED vs baseline 12d6c5f9 avg5: composite 0.505579->0.505938 (+0.00036), mean 0.671245->0.671594 (+0.00035), std 0.331332->0.331311. crash/sideways BYTE-IDENTICAL (0.767586/1.013297 gate ~off in sparse regimes); bull raw 0.781251->0.782371 (+0.0011 incidental gate fired on few bull entries); rally raw 0.419353->0.419095; RALLY STABILITY 0.587882->0.588134 (+0.00025 FLAT). HYPOTHESIS FAILED: entry-size quant did NOT move rally stability -> rally te NOT entry-size-bound. +0.00036 composite is incidental bull artifact not the intended rally effect; below simplicity threshold (37 LOC for +0.0004). Discard on hygiene. LEARNING: rally te is TIMING-bound (whether/when marginal trades taken under noise) not size-bound. Discard #1 architectural.
a5c60e3a	0.519521	0.678880	0.318718	0.78	0.77	1.01	0.15	keep	KEEP (NEW BASELINE, SUPERSEDES 12d6c5f9 0.5056). Anti-noise-dip admission stickiness: primary entry gate fires on max(curr,prev-bar) strong-sum; min-over-2 persist gate co-requires sustained conviction so CLEAN trades unchanged. avg5 RE-TEST of 45942a93 (was raw-inert, discarded only via OLD single-seed AST-hash re-roll; avg5 fixed shared seeds removed that artifact). MEASURED: raw_composite 0.639349 BYTE-IDENTICAL (all 4 regime raws identical bull 0.781251/crash 0.767586/sideways 1.013297/rally 0.419353 = zero clean-trade delta, mechanism only acts under noise). RALLY STABILITY 0.587882->0.609732 (+0.0218), factor 0.292941->0.365774, rally score 0.122846->0.153388 (+0.0305). bull stab 0.829622->0.830463, sideways 0.838->0.837238, crash 0.966173 unchanged (all factor 1.0). composite 0.505579->0.519521 (+0.01394), mean 0.671245->0.678880 (+0.00764), std 0.331332->0.318718 (-0.01261). MaxDD bull1.25 crash0.73 sideways0.45 rally1.85 pct (<10). Mechanism reduces rally entry-TIMING divergence under AR(1) noise (single-bar dip no longer cancels sustained marginal entry). rally stability still 0.610 (factor 0.366) = headroom remains toward 0.80 knee.
-	0.268691	0.354169	0.170955	0.40	0.28	0.60	0.14	discard	ARCHITECTURAL winner-protective anti-noise-spike on soft exit pressure (min-over-2 of _soft_max for pos_pnl>0; SL+voter_bias instantaneous; new _soft_max_prev state). CATASTROPHIC vs baseline a5c60e3a: composite 0.519521->0.268691 (-0.251), raw_composite 0.639349->0.408261 (-0.231), mean 0.678880->0.354169. ALL regimes RAW COLLAPSED: bull 0.781251->0.398570 (DD 1.25->2.57), crash 0.767586->0.520115 (stab 0.966->0.660 f0.534, DD 0.73->1.96), sideways 1.013297->0.638826 (stab 0.838->0.783 f0.944), rally raw 0.419353->0.318540 (DD 1.85->2.27). rally STABILITY rose 0.609732->0.629224 (+0.019, directionally correct) but rally raw fell -> rally score 0.153->0.137 DOWN. LEARNING (load-bearing): soft exit pressure for WINNERS is NOT noise -- it is load-bearing PROFIT-LOCKING (pp-giveback/time). Delaying it even 1 bar (min-over-2) lets winners give back gains in ALL regimes -> raw collapse + DD up. Exit-DELAY robustness WALLED (low-pass/freeze/median value-smoothing family). Entry anti-dip was free (persist co-gate); exit anti-spike is NOT. Not branch-eligible (no regime score improved). Discard #1 since Exp2 keep (architectural).
-	0.519521	0.678880	0.318718	0.78	0.77	1.01	0.15	discard	ARCHITECTURAL anti-noise trend-admit gate (Exp2-analog): bull-admit max(curr,prev) trend, bear-admit min(curr,prev) trend; new _prev_trend reuse. MEASURED vs baseline a5c60e3a: composite 0.519521 IDENTICAL (no-op), raw_composite 0.639349 byte-identical (all 4 raws unchanged = clean trades unchanged as hypothesized). bull stability 0.830463->0.844385 (+0.0139 LATENT, bull already factor 1.0). crash/sideways stability unchanged. RALLY STABILITY 0.609732 IDENTICAL -> trend-admit gate is NOT a binding rally noise source (unlike strong-sum gate fixed by Exp2). LEARNING: rally entry-timing divergence is dominated by the STRONG-SUM admission gate; trend-gate anti-noise helps only BULL stability (latent/unrewarded). No composite improvement -> discard (free robustness but +20 LOC for latent gain). Discard #2 since Exp2 keep (architectural).
-	0.519505	0.678872	0.318732	0.78	0.77	1.01	0.15	discard	ARCHITECTURAL stale-loss exit term (new soft source: cut underwater positions held past bar6, adversity band loss>0.48pct, loser-weighted, added to MAX fusion). MEASURED vs baseline a5c60e3a: composite 0.519521->0.519505 (~identical), raw_composite 0.639349 BYTE-IDENTICAL (all 4 regime raws identical), rally stability 0.609732->0.609707 (~identical). INERT: term never exceeded existing soft terms (slope/time/SL already cut held-underwater positions) -> ZERO clean-trade change. LEARNING: at bar6 gate + 0.48pct band + 0.6 magnitude the stale-loss is DOMINATED by existing exit pressures; must fire earlier/stronger (lower band, shallow slow-bleeders) to act as the catalogued rally-raw lever. Discard #3 since Exp2 keep (architectural).
-	0.434062	0.605351	0.342579	0.56	0.77	1.01	0.08	discard	ARCHITECTURAL noise-robust 2-of-3 MAJORITY persistence gate (replaces min-over-2 unanimity; require >=2 of last 3 strong-sum bars >= factor*strong_min). MEASURED vs baseline a5c60e3a: composite 0.519521->0.434062, mean 0.678880->0.605351, raw_composite 0.639349->0.595049. crash 0.767586 + sideways 1.013297 BYTE-IDENTICAL (persist not binding there). rally RAW 0.419353->0.462944 (+0.0436 UP: persist gate IS a rally-raw TIMING lever, admits more net-positive marginal entries on clean data) BUT rally STAB 0.609732->0.175744 (factor 0.366->0.176, score 0.153->0.081 DOWN: the extra marginal entries are noise-sensitive near the boundary). bull RAW 0.781251->0.559162 (-0.222, factor 1.0). FINDING: persist min-over-2 unanimity is LOAD-BEARING for bull raw and rally stability; loosening it raises rally raw but admits noise-sensitive marginal trades (stab collapse) + degrades bull entry set. No regime SCORE improved (bull regressed). Not branch-worthy (fix = stricter persist, opposite mechanism). Discard #1 architectural.
7921c12f	0.463309	0.622006	0.317393	0.56	0.77	1.01	0.15	branch	BRANCH OPEN (entry-readiness EMA-of-margin admission gate, subsystem redesign). Step1: replace strong-sum threshold + max(curr,prev) anti-dip + min-over-2 persist with ONE EMA(RHO=0.5) of conviction margin; enter when EMA>=0. MEASURED vs baseline a5c60e3a: composite 0.519521->0.463309, mean 0.678880->0.622006, raw_composite 0.639349->0.595049. crash 0.767586 + sideways 1.013297 BYTE-IDENTICAL. rally RAW 0.419353->0.462944 (+0.0436), bull RAW 0.781251->0.559162 (-0.222). KEY: clean trade set IDENTICAL to discarded Exp1 majority-persist (same raw_composite 0.595049 + same per-regime raws) = both looser-than-baseline gates admit the SAME marginal entries. BUT rally STAB 0.319648 vs Exp1 0.175744 (+0.144 for IDENTICAL clean trades) = EMA-of-margin IS more noise-robust than majority-count (mechanism validated). rally still < baseline 0.610 (THRESH=0 looser than strict persist + cross-position EMA memory enables fast re-entry). JUSTIFICATION: (1) new admission architecture; (2) bull regressed via fast re-entry churn (EMA carries conviction through hold -> immediate re-entry vs baseline 2-bar fresh persist); rally stab below baseline because THRESH=0 admits marginal noise-sensitive trades; (3) FIX step2=reset accumulator on exit (require fresh conviction for re-entry, recover bull), then raise THRESH (exclude marginal trades, lift rally stab) keeping EMA noise-robustness. Target: bull raw->0.78, rally stab>0.610.
