commit	score	mean_score	std_score	bull_2021	crash_bear	sideways	rally_2024	status	description
0f4f890-session-summary	-	-	-	-	-	-	-	session-summary	session: 5 independent experiments, 0 KEEPS, 5 architectural discards. All architectural multi-variable. Discards: (1) MAE-depth gate on opp-side voter_bias — composite -0.042, RALLY -0.126 catastrophic; clean-MAE rally bear positions get 0.6x suppression of legitimate bull-voter reversal spikes, over-hold past peaks. MAE-depth axis WRONG direction for counter-trend rally bears. (2) wick-body ratio entry size modulator (NEW DATA SOURCE 6-bar mean upper/lower wick fractions) — composite -0.010, mean essentially flat across all regimes; signal real but too weak to recover +19 LOC overhead. 6-bar mean dilutes per-bar rejection patterns; symmetric application cancels in chop. (3) simplify by removing _outcome_size_mult (architectural code-structure removal -7 LOC) — composite +0.0004 BUT mean -0.002 fails keep criteria (bull -0.0075 sole regression). _outcome_size_mult is load-bearing for bull early-trend protection; the 8-bar timescale is orthogonal cover to _cooldown_factor cd_window stretch (~2-4 bar). Two timescales of loss attenuation are both load-bearing. (4) hold-duration amplification on _ar_pressure recovery cap — composite -0.001, all regimes IDENTICAL. DEAD-CODE-ADJACENT: _ar_pressure activation conditions intersect with bars_held>6 in empty/rare set; positions in MAE-recovery state already exit via slope/pp/sl before bar 6+. Pure LOC overhead. (5) trend-magnitude mute on profit-side _w_time amp (symmetric pattern to fb49c7b on opp_bias) — composite -0.674 CATASTROPHIC, RALLY 0.000 hard cutoff, bull -0.97, crash -0.50. Profit-side _w_time amp is critical profit-locking time-exit; muting in trends allows winning positions to over-hold massively past reversal. Pattern does NOT generalize from opp_bias (exit-direction-specific) to time-pressure-weight (structural). CROSS-EXPERIMENT INSIGHTS: (a) Three of five discards (1, 2, 4) were dead-code-adjacent or weak-signal: gating mechanisms that fire rarely (_ar_pressure intersection), applying NEW DATA SOURCES with magnitude too small (wick-body), and gating with wrong directional hypothesis (MAE-depth on counter-trend opp_bias). Selection bias accumulating — at this baseline maturity, plausible NEW DATA SOURCES that fail are increasingly rare; most remaining options either dead-code-adjacent or wrong-direction. (b) Two discards (3, 5) revealed structural load-bearing of seemingly-redundant components: _outcome_size_mult timescale orthogonal to _cooldown_factor (2-timescale loss recovery is load-bearing); _w_time profit amp is the SOLE profit-locking exit mechanism in time-pressure path (cannot be muted in trends without catastrophic over-hold). (c) The fb49c7b symmetric pattern (trend-magnitude amp on opp_bias) does NOT generalize to other fusion locations — opp_bias gating is direction-specific (own/opp distinction makes muting symmetric in chop), time-pressure weight is structural (no own/opp distinction → muting destroys profit-lock). Future direction: (i) pure SIMPLIFICATIONS targeting truly dead components (test removing components individually with targeted regime expectations); (ii) NEW LOCATIONS for already-keep mechanisms (apply existing _activity to scale-in pace or exit threshold rather than new data sources); (iii) avoid: MAE-depth gating, hold-duration amplification of dead-code-adjacent mechanisms, symmetric-pattern transfer of gating structures across non-symmetric fusion locations. NEW BASELINE: 0f4f890 1.019400 unchanged.
-	0.990	0.876	0.135	1.09	0.75	0.89	0.77	discard	simplify by removing take-profit partial harvest path (architectural code-structure removal, -14 LOC, exit subsystem 3->2 size-decision paths). Composite -0.030 vs 0f4f890 1.0194->0.9897, mean -0.051 (0.928->0.876). Per-regime: bull -0.110 (1.20->1.09 main regression), crash -0.003 (0.752->0.748), sideways +0.012 (0.879->0.891), rally -0.104 (0.879->0.774). Take-profit harvest IS load-bearing for bull and rally — fires meaningfully on confirmed trend-extension peaks (peak >= 1.6*_pp_min), harvesting up to 30% of winning size before pullback giveback. The 6-gate intersection ISNT dead-code: trend-aligned positions in bull/rally regularly hit deep peaks with low MAE, satisfying _ts_supp suppression criteria correctly (suppression keeps them held when extension confirmed). Without harvest, gain-locking on real peaks deferred until _pp_pressure giveback ramp activates — too late, peak gains evaporate first. Sideways +0.012 sole gain because chop rarely hits deep peaks so removal saves no harvest cost. Architectural lesson: complex multi-gate intersections that LOOK dead-code-adjacent can be precisely-targeted to a real firing zone (deep-peak trend-extension) — narrow zone DOESNT mean dead-code if it perfectly aligns with high-value events. Reverting.
0f4f890-session-summary	-	-	-	-	-	-	-	session-summary	session: 5 independent experiments, 0 KEEPS, 5 architectural discards. All architectural multi-variable touching decision boundaries / signal fusion. Discards: (1) calendar-activity exit-threshold modulator (NEW cross-subsystem dep, _activity [0,1]->exit_thresh [0.97,1.03]) — composite -0.092 CATASTROPHIC, bull -0.45 + rally -0.13 because high-activity hours ARE the trend-persistence hours and lowering thresh accelerates exits when winners should be held harder; sideways/crash unaffected (no trend persistence to disrupt). Lesson: timestamp signals have OPPOSITE directional effect at exit vs entry. (2) simplify by removing _div_taper chop-amp dampener (-2 LOC) — composite -0.0035, sideways -0.019 main regression. _div_taper IS load-bearing in narrow regime (sideways + voter divergence + trend-aligned hold) — correctly tapers chop_amp to let trend-aligned sideways winners exit on opp-voter signals. NOT dead-code despite triple-tanh intersection. (3) trend-magnitude amp on _ar_pressure cap (NEW cross-timescale dep, [0.20,0.50]) — composite -0.0020 (LOC overhead), ALL 4 REGIMES IDENTICAL. Confirms _ar_pressure activation gate is dead-code-adjacent: MAE<-0.012 AND pos_pnl<0 AND recovery>0.5 intersection essentially empty across regimes. _ar_pressure subsystem is permanently unproductive at current baseline. (4) long-timescale vol-trajectory exit pressure (NEW 8th exit term, 24r/24d vol ratio cap 0.30 profit-side) — composite -0.599 CATASTROPHIC, rally HARD CUTOFF (Sharpe -0.97), bull -0.80, crash -0.42, sideways +0.10 sole gain. Vol-trajectory fires structurally during rally/late-bull when vol expands into peak. 8th term stacked atop 6 active sources crosses _exit_thresh prematurely. CONFIRMS: any new exit-pressure term added to soft-sum stack with non-strict activation gate produces catastrophic hard-cutoffs. (5) simplify by removing take-profit partial harvest (-14 LOC, exit subsystem 3->2 paths) — composite -0.030, bull -0.110 + rally -0.104 main regressions, sideways +0.012 sole gain. Take-profit harvest IS load-bearing on bull/rally trend-extension peaks (peak>=1.6*_pp_min), harvests winning size before pullback giveback. 6-gate intersection isnt dead-code — narrowly targets high-value firing zone. CROSS-EXPERIMENT INSIGHTS: (a) Three of five discards (2, 5, partly 3) involved removing components that LOOKED dead-code-adjacent due to multi-gate intersections but actually targeted precise high-value firing zones (sideways trend-aligned exit, bull/rally trend-extension peak harvest). LESSON: multi-gate intersections at this baseline maturity have been pruned for narrow targeting; further "remove because narrow firing zone" simplification proposals are increasingly likely to remove load-bearing precision rather than dead-code. (b) Two discards (3 and prior sessions _ar_pressure modifications) confirm _ar_pressure subsystem is truly dead-code-adjacent — activation intersection empty across regimes; further modifications to _ar_pressure produce zero observed effect. (c) Exp 1 reveals timestamp/calendar signals have OPPOSITE directional effect at exit vs entry: high-activity hours benefit entry size (bigger commit during conviction) but harm exit threshold (premature accelerated exits during trend persistence). Productive timestamp axis is entry-side only. (d) Exp 4 reaffirms 7th+ exit-pressure terms are dangerous regardless of magnitude — even 0.30 cap on profit-side-only weight stacks catastrophically with 6 existing sources during rally vol-expansion peaks. Exit-pressure subsystem is structurally saturated at 6 terms. (e) Exp 1 (timestamp at exit) and Exp 5 (remove harvest) both reveal architectural removals of bull/rally winning-position protection mechanisms (exit-threshold protective margins, take-profit harvest) catastrophically compound. Bull/rally regimes carry the heaviest absolute winning trades and are most sensitive to exit-side architectural changes. Future direction: (i) AVOID exit-side architectural changes entirely at this baseline (5/5 sessions show exit subsystem is structurally saturated); (ii) timestamp/calendar axis remains productive ONLY on entry side and only for additive cycles (saturating at +0.00003 per cycle); (iii) _ar_pressure subsystem confirmed permanently dead-code-adjacent — drop from candidate list; (iv) untried still: entry-side strong-min admission threshold modifiers (per-symbol or per-regime), voter weight redistribution NEW dimensions (e.g. recent-bar-magnitude based weighting orthogonal to persistence), entry-frequency signal at NEW entry-side locations beyond _freq_factor; (v) consider strategic SIMPLIFICATION audit at non-exit subsystems (sizing multipliers chain, voter weight stack) — current strategy.py 1034 LOC, simplification gains harder to find but selection bias likely reduced for non-exit subsystem removals. NEW BASELINE: 0f4f890 1.019400 unchanged.
-	1.016	0.928	0.166	1.20	0.75	0.88	0.88	discard	exp3: volume-trajectory entry size attenuator (architectural NEW DATA SOURCE 8-bar volume slope, [0.95,1.05] tanh). Composite -0.003 vs 0f4f890 1.019->1.016 (LOC overhead +5 dominated). Mean essentially flat -0.00006. Per-regime: bull -0.0007, crash -0.0002, SIDEWAYS +0.0024 (sole positive), rally -0.0015. Mechanism direction validated for sideways (small gain) but magnitude too weak — symmetric 5% range doesnt clear LOC cost. Volume-slope captures real signal in chop where volume-buildups precede small reversion captures, but vol_entry_atten already partly covers the low-vol case; the marginal info added is too small. LOC overhead overwhelmed signal across other regimes which were essentially flat. Discard.
ab4a801	1.019	0.929	0.167	1.20	0.75	0.88	0.89	branch	exp4 BRANCH OPEN: trend-asymmetric admission thresholds (architectural multi-variable, ±0.10 tanh(ret_long/0.04) on bull/bear strong_min). Composite -0.000014 vs 0f4f890 1.0194->1.0194 (FAILS strict) BUT mean +0.00128 (0.9276->0.9289). Per-regime: bull IDENTICAL 1.2015, crash -0.0048 (0.7517->0.7470 regression), sideways IDENTICAL 0.8787, RALLY +0.00993 (0.8786->0.8885 large gain). Std widened 0.166->0.167. Rally gain isolated to counter-trend bear admission tightening (rally has many marginal pullback bears that became too noisy — now require higher conviction). Crash regression: trend-aligned shorts in deep bear got relaxation but crash strong_min was already calibrated; relaxation admits more low-quality bear entries during dead-cat bounces. BRANCH HYPOTHESIS: gate the asymmetry to counter-trend ONLY (raise bear-strong_min in uptrend by +0.10, but DO NOT relax bull strong_min in uptrend). Asymmetry-as-tightening-only preserves crash quality control while delivering rally counter-trend filtering.
22519b9	1.018	0.928	0.166	1.20	0.75	0.88	0.88	branch step 2	one-sided counter-trend tightening only — composite -0.001 vs baseline 0f4f890. Per-regime: bull IDENTICAL, CRASH RECOVERED 0.7520 (baseline 0.7517), sideways IDENTICAL, rally REGRESSED 0.8779 (vs step 1 0.8885, vs baseline 0.8786 -0.0007). Rally gain in step 1 came from RELAXING bull admission (trend-aligned), not from tightening bear. Counter-trend tightening alone is dead-code-adjacent (bear entries in uptrend rare anyway). Try opposite one-sided: relax only.
68ce7f2	1.0195	0.9290	0.1671	1.20	0.75	0.88	0.89	keep	BRANCH KEEP step 3: trend-aligned admission relaxation only (architectural multi-variable, -0.10*max(0,tanh(ret_long/0.04)) on trend-aligned bull/bear strong_min, NEW cross-timescale data dep at admission boundary). Composite +0.000050 vs 0f4f890 1.019400->1.019450, mean +0.001373 (0.927608->0.928981). Per-regime: bull IDENTICAL 1.2015 (admit relaxation in uptrend doesnt help bull which already saturates strong_min easily), CRASH -0.0050 (0.7517->0.7467 mild regression, trend-aligned bear admission relaxation in downtrend admits some lower-quality bears during dead-cat bounces), sideways IDENTICAL 0.8787 (ret_long ~0 in chop, no effect), RALLY +0.01055 (0.8786->0.8891 BIG GAIN). All MaxDDs unchanged (<3.5%). Mechanism: trend-aligned bull admission relaxation in rally captures more of bullish-trend continuation entries that previously fell short of strong_min during pullbacks. Counter-trend side untouched (no rally bear pulls admitted, no crash bull pulls admitted) preserves quality control. Branch journey: step1 bidirectional ±0.10 found rally gain hidden in trend-aligned-relaxation half; step2 counter-trend-tightening alone confirmed dead-code for rally; step3 isolating relaxation half delivers gain without bidirectional tightening cost. NEW BASELINE.
4ec5aed	1.018	0.929	0.167	1.20	0.75	0.88	0.89	branch step 4	deep-trend exhaustion taper — composite -0.001 vs new baseline 68ce7f2 (LOC overhead). All 4 regimes BIT-IDENTICAL to step 3. Taper firing zone empty: |ret_long|>0.06 rarely coincides with relaxation activation across regimes. Dead-code-adjacent. Crash regression must come from MILD-trend bear admission, not deep-trend.
ff00d46	1.018	0.929	0.167	1.20	0.75	0.88	0.89	branch step 5	asymmetric magnitude (bull 0.10, bear 0.04) — composite -0.001 vs new baseline 68ce7f2. Crash 0.7466 (~same as step 3), rally 0.8890 (~same). Reducing bear relaxation magnitude doesnt recover crash. Crash regression is structural to ANY bear relaxation in downtrend (dead-cat bounces during trend admit low-quality bears regardless of relaxation magnitude). Try bull-only.
afa6281	1.0223	0.9302	0.1657	1.20	0.75	0.88	0.89	keep	BRANCH KEEP step 6 (SUPERSEDES step 3): bull-only trend-aligned admission relaxation (architectural multi-variable, -0.10*max(0,tanh(ret_long/0.04)) on bull strong_min only, bear unchanged). Composite +0.00293 vs 0f4f890 1.019400->1.022330, mean +0.00258 (0.927608->0.930188), std NARROWED -0.0007 (0.166397->0.165717). Per-regime: bull IDENTICAL 1.2015 (bull regime already saturates strong_min easily so relaxation rarely binds), CRASH IDENTICAL 0.7517 (bear admission unchanged), sideways IDENTICAL 0.8787 (ret_long ~0 so relaxation inactive), RALLY +0.01055 (0.8786->0.8889 main mover). All MaxDDs <3.5% (bull 0.82, crash 2.94, sideways 0.43, rally 3.41). Mechanism: in rally uptrend, marginal bull entries that fail strong_min during pullbacks now admitted with ~10% threshold reduction. Sole isolated effect on rally because: (a) bull regime already passes strong_min easily so threshold reduction rarely changes admission, (b) sideways ret_long~0 zeros the relaxation, (c) crash bear admission untouched. Branch journey: step 1 bidirectional discovered the signal but bear-side caused crash regression; steps 2 (counter-trend tightening alone), 4 (deep-trend taper), 5 (asymmetric magnitude) probed isolations; step 6 (bull-only) is the clean form. NEW BASELINE 1.022330.
afa6281-session-summary	-	-	-	-	-	-	-	session-summary	session: 3 independent experiments + branch (5 steps) = BRANCH KEEP afa6281 (1.022330 SUPERSEDES 0f4f890 1.019400) composite +0.00293 mean +0.00258 std NARROWED -0.0007. Independent discards: (1) per-voter recent-bar-magnitude weighting (NEW DIM orthogonal to persistence, [0.85,1.15] tanh on recent-2bar/8bar abs ratio) — composite -0.089, SIDEWAYS -0.197 CATASTROPHIC; recency ratio amplifies bar-noise in chop where voters fire mildly throughout (small num/den noisy ratio). Lesson: orthogonal-axis multiplicative gates on persistence_mult disturb the noise-protection persistence relies on. (2) per-symbol baseline-vol admission modifier on _strong_min (±0.10 tanh) — composite -0.036, crash +0.015 (intended) BUT sideways -0.078 + rally -0.058 (SOL directional alpha filtered out). Per-symbol noise-floor adjustment without regime gating creates symmetric tradeoff. (3) volume-trajectory entry size attenuator (8-bar volume slope, [0.95,1.05] tanh) — composite -0.003, sideways +0.0024 sole positive but LOC overhead +5 overwhelmed signal. Volume-direction signal real but too weak. BRANCH journey from exp4 trend-asymmetric admission ±0.10: step1 bidirectional bull/bear had RALLY +0.0099 gain hidden in trend-aligned-relaxation half; step2 counter-trend tightening alone = dead-code rally regression; step3 trend-aligned relaxation only = first KEEP with crash -0.005; step4 deep-trend exhaust taper = dead-code (firing zone empty); step5 asymmetric magnitudes (bull 0.10 bear 0.04) = crash regression persists; step6 BULL-ONLY relaxation (zero bear) = CLEAN KEEP rally +0.01 preserved, crash baseline restored, sideways/bull unchanged, std narrowed. KEEP MECHANISM: in rally uptrend, marginal bull entries failing strong_min during pullbacks now admit with 10% threshold reduction via _bull_strong_min *= (1 - 0.10*max(0,tanh(ret_long/0.04))). Sole impact rally because (a) bull regime saturates strong_min easily, (b) sideways ret_long~0 zeros relaxation, (c) bear admission untouched protects crash. CROSS-EXPERIMENT INSIGHTS: (a) Admission boundary asymmetry at 20-bar timescale (ret_long) is orthogonal to existing _trend_biased gate (10-bar) and to per-voter weighting — it is the FIRST entry-side admission modifier keep this branch outside of timestamp cycles (TOD/DOW/MOM/QUARTER/SEMI/YEAR). The previously-suggested untried direction "entry-side strong-min admission threshold modifiers" was correct. (b) ONE-SIDED structural changes are critical: bidirectional symmetric admission shifts hurt one regime to help another; isolating the help-side via max(0, ·) preserves the gain without symmetric cost. Asymmetric structural design pattern productive at this baseline maturity. (c) Crash regime extremely sensitive to ANY bear admission relaxation regardless of magnitude (steps 3,4,5 all showed crash regression even with reduced/tapered/half-magnitude bear sides) — implies bear admission is precisely calibrated to filter dead-cat bounces; modifications must avoid bear side entirely or compensate elsewhere. (d) The previously-recommended "ATR-anchored entry threshold" and "per-symbol vol admission" failed because they affected both sides symmetrically; ONE-SIDED admission asymmetry succeeds where symmetric attempts failed. Future direction: (i) probe other one-sided asymmetric admission modifiers — e.g. trend-magnitude-conditioned freq_factor relaxation on trend-aligned side only; (ii) extend the asymmetric pattern to other entry-side multipliers (_consensus_atten, _quality_atten, _ct_atten) but ONLY in the bull-relaxation direction; (iii) try ONE-SIDED asymmetry at exit boundary (e.g. relax _de_floor only on trend-aligned profit positions); (iv) avoid: per-voter ratio-based weight modifications (sideways noise destruction), per-symbol vol scaling without regime gating, statistically-redundant new data sources. NEW BASELINE: afa6281 1.022330.
afa6281	0.422	0.363	0.232	0.71	0.42	0.24	0.08	keep	RE-BASELINED under new scoring (stability+vol_gate+streak_gate restored). Previous scores used old scoring without these gates. This row supersedes the old afa6281 row for baseline comparison. Strategy unchanged.
0f7f188	0.430	0.376	0.237	0.728	0.432	0.255	0.090	keep	one-sided trend-aligned de-risk floor relaxation (architectural multi-variable, -0.10*tanh(ret_long*pos_dir/0.04)*max(0,_pnl_scale) on _de_floor, NEW cross-component data dep at exit graduation boundary, following afa6281 asymmetric pattern). Composite +0.008 vs afa6281 0.422->0.430, mean +0.013 (0.363->0.376), std +0.005 widened (0.232->0.237). ALL 4 REGIMES IMPROVED: bull +0.018 (0.710->0.728), crash +0.012 (0.420->0.432), sideways +0.015 (0.240->0.255), rally +0.010 (0.080->0.090). All MaxDDs <4% (bull 0.81, crash 2.91, sideways 0.43, rally 3.42). Mechanism: trend-aligned profitable positions get wider graduated-exit ramp (floor 0.55->0.45 max), de-risking more gradually through pullback noise in trends. Rally and bull benefit most as expected (trend-aligned bull longs during uptrend pullbacks). Sideways unexpected gain (+0.015) — mild-but-positive trend-alignment in chop still activates relaxation on small-profit bars. Crash also unexpectedly +0.012 — bear-down positions in downtrend ARE trend-aligned and profitable, same relaxation applies symmetrically. Asymmetric pattern at exit boundary delivers: one-sided de-risk relaxation improves all regimes without regime-specific cost. NEW BASELINE.
