commit	score	mean_score	std_score	bull_2021	crash_bear	sideways	rally_2024	status	description
8839fcc-session-summary	-	-	-	-	-	-	-	session-summary	session: 5 architectural discards (cap reached, baseline 8839fcc unchanged at 0.985). All 5 architectural. Discards: (1) giveback-confirmed _tp_scale gate (new data dep on _giveback_ratio at exit harvest) — CATASTROPHIC composite -0.227, crash -0.46 (MaxDD 3.38->4.58), bull -0.07, rally -0.11, sideways +0.014 (intended-direction but minor). Requiring giveback before harvest delays size-scaledown into peak-rebound DD that _tp_scale was designed to preempt; trend regimes need PROACTIVE harvest at peak, not reactive after giveback starts. The prior session sideways +0.046 hint cannot be safely captured by giveback-gating without breaking the proactive-harvest semantics. (2) pnl-confirmed scale-in pace (new cross-bar data dep at scale-in modulation) — composite -0.003, mean essentially flat. Bull +0.001, crash +0.011, sideways +0.005, RALLY -0.026 sole drag. Asymmetric scale-in acceleration (+25% pace in profit, -35% deceleration in loss) over-fires in rally counter-trend bears that briefly recover during pullback peaks before continuing rally — accelerated commit gets MORE size into ultimately-reversing position. Branch-eligible (3 regimes positive) but rally regression mechanism is structural in counter-trend size acceleration; fixing requires gating on trend-aligned (essentially reproducing existing _ct_gate at scale-in stage). (3) counter-trend opp_bias amplifier (asymmetric extension of _opp_atten with new cross-component dep) — composite -0.001, all 4 regimes within 0.001 of baseline (essentially BIT-IDENTICAL). Mechanism dead-code-adjacent: counter-trend positions exit via binary _opp_gate (line 956) when opp votes pass FLIP_MIN_VOTES — opp_margin rarely builds to amplifier-firing magnitude on positions surviving the gate. (4) remove slope-disagrees shortening of _max_hold (architectural double-count removal eliminating cross-pressure with _sl_slope_pressure) — composite +0.002 (LOC bonus only), mean IDENTICAL 0.8937, all 4 regimes BIT-IDENTICAL. Mechanism dead-code-confirmed: slope-against shortening of _max_hold rarely fires meaningfully because _sl_slope_pressure (primary slope-against handling in _soft_sum) drives exit before time-pressure shortening matters. Strict mean-improvement criterion fails (tied does not improve). (5) loss-magnitude-scaled recovery window for _outcome_size_mult (new cross-bar data dep at outcome-conditioned cooldown) — composite -0.0001 essentially flat, all 4 regimes within 0.001. Mechanism dead-code-adjacent: most losses are marginal so recovery window stays near 8 bars (baseline value); rare full-stop losses extend to 14 but the time-scaling effect is dominated by the depth-scaling (0.45 cap × _loss_only) already saturating the mechanism. CROSS-EXPERIMENT INSIGHTS: (a) The previously-noted sideways +0.046 hint from remove-_tp_scale CANNOT be captured by gating _tp_scale on giveback evidence — _tp_scale must be PROACTIVE at peak, not reactive after giveback begins; the gate destroys the trend-regime DD-control function the harvest provides. Sideways gain seems to require a fundamentally different mechanism than gating, possibly removing _tp_scale only in pure-sideways via direct |ret_long| floor without giveback condition (revisits prior trend-gate-only attempts which ARE the existing implementation). (b) Counter-trend opp_bias amplification IS dead-code at typical opp_margin levels surviving the binary _opp_gate — the gate population is too narrow to materially shift any regime. Confirms prior session insight that _opp_gate handles counter-trend reversals decisively, leaving little margin space for amplifier mechanisms. (c) The _max_hold shortening on slope-disagrees IS structurally a double-count with _sl_slope_pressure, but the redundancy is dead-weight — removing produces zero per-regime change. The exit subsystem is highly redundant: removing one channel of slope-against-handling shifts exits to other channels at no measurable score cost. (d) _outcome_size_mult time-scaling is saturated by its existing depth-scaling — modulating window length adds no orthogonal information beyond what _loss_only already provides via the 0.45-cap multiplication. Architectural extensions of already-magnitude-conditioned mechanisms tend to dead-code-adjacent. (e) Three of five experiments produced near-bit-identical results across regimes (3, 4, 5) — confirming the strategy has reached a state where most architectural perturbations affect dead-code-adjacent paths or get absorbed by redundant exit channels. The voter_bias subsystem, opp_gate, and _outcome_size_mult are all structurally rigid. Pnl-confirmed scale-in showed real signal (3 regimes positive) but rally counter-trend regression structural. Baseline 8839fcc (0.985) unchanged.
-	0.976	0.889	0.186	1.19	0.68	0.82	0.87	discard	portfolio-DD exit accelerator (7th soft source, cross-symbol cascade detector) — composite -0.009 vs 8839fcc 0.985, mean -0.005. CRASH -0.013 (sole major mover, OPPOSITE expected direction): _port_dd_severity fires during crash cascades and accelerates exits on losing positions, but those positions are precisely the ones that should HOLD through the cascade for recovery — premature exit locks losses. Bull/sideways IDENTICAL (port_dd_severity rarely activates outside crash). Rally -0.004 mild. Mechanism failure: portfolio-DD severity correlates with REGIME (crash), so the accelerator effectively functions as a regime-asymmetric exit-acceleration on losers — exactly what already-existing _sl_slope_pressure/_ar_pressure handle correctly with per-symbol momentum signals. The portfolio-level signal lacks the per-symbol momentum context to know if THIS losing position is in cascade-bottom (exit fast) vs cascade-recovery (hold). No regime improved. Not branch-eligible.
-	0.922	0.812	0.159	1.07	0.69	0.81	0.67	discard	remove _ep_pressure early-profit-lock 5th soft source (architectural code-structure removal) — CATASTROPHIC composite -0.064 vs 8839fcc 0.985, mean -0.082. Bull -0.116 (1.187->1.071, sharpe 2.40->2.10), RALLY -0.207 (0.879->0.672, sharpe 1.66->1.35, MaxDD 3.36->2.56 reduced but return collapsed), crash IDENTICAL +0.001, sideways -0.005. _ep_pressure is heavily load-bearing for bull/rally profit-locking: rally pullback peaks frequently sit in sub-peak [0.15, 0.95]*_pp_min band where _pp_pressure is inactive (peak below 0.95*_pp_min) and slope-against alone is insufficient to lock the giveback. Bull/rally winners build small-peak gains that need early-lock semantics. _ar_pressure (losing-side gated) and _pp_pressure (post-_pp_min gated) do NOT cover this band — the "narrow transitional" hypothesis was wrong; this band is in fact the dominant profit-locking zone for bull/rally pullback winners. Crash IDENTICAL because crash positions either fully ride to _pp_min territory (handed to _pp_pressure) or hit SL (handed to slope-against) — sub-peak band rare in crash. Reverting.
-	0.982	0.894	0.183	1.19	0.69	0.82	0.88	discard	bilateral-conviction exit pressure (architectural 8th soft source, min(side, opp) margins as uncertainty signal) — composite -0.003 vs 8839fcc 0.985, mean essentially flat (-0.0002). Bull IDENTICAL 1.187342, sideways IDENTICAL 0.817635, crash -0.002 (0.691->0.689), rally +0.001 (0.878954->0.879949 essentially noise). Mechanism dead-code-adjacent: _bilateral_min_margin = min(_side_margin, _opp_margin) — by construction of voter aggregation when one side strong-sum is far above floor, opposite is typically far below floor (voters tend to one direction). So bilateral_min_margin is typically <= 0, tanh activation near 0, _bc_pressure rarely fires meaningfully. The hypothesized "both-sides-strong uncertainty regime" is structurally rare because the voter ensemble is designed to produce net-directional decisions. LOC overhead absorbs the tiny rally noise. Reverting.
-	0.376	0.355	0.322	0.10	0.54	0.79	0.00	discard	pnl-asymmetric _max_hold timing replacing _w_time magnitude amplifier (architectural multi-variable restructure) — CATASTROPHIC composite -0.609 vs 8839fcc 0.985, mean -0.539. Bull -1.09 (1.187->0.096, MaxDD 0.80->4.87 widened sharply), RALLY CRUSHED to 0.000 (MaxDD 4.70 — likely hit hard cutoff), sideways -0.029, crash -0.156. Mechanism failure: extending _max_hold by +2 bars for winning positions caused bull/rally winners to ride deep pullbacks without time-pressure cutoff. The pnl-asymmetric _w_time amplifier (heavier in profit) was actually load-bearing semantics — it rapidly cuts winners as time-pressure ramps up post-_max_hold, locking gains BEFORE pullback widens DD. Replacing weight-asymmetry with hold-extension reverses this: winners now hold LONGER through pullbacks, absorbing the very DD that _w_time was preventing. Removing _w_time alone would have been less destructive than adding hold-extension. Lesson: existing _w_time direction is correct (lock gains on time), the intuition that profit deserves extended hold ignored that bull/rally peaks REVERSE quickly post-development. Reverting.
-	0.979	0.894	0.183	1.19	0.69	0.82	0.88	discard	VWAP-deviation confirmation gate on _opp_gate (architectural multi-variable new cross-component data dep at exit reversal) — composite -0.006 vs 8839fcc 0.985 (LOC overhead only), mean IDENTICAL 0.893735, all 4 regimes BIT-IDENTICAL (bull 1.187342, crash 0.691008, sideways 0.817635, rally 0.878954). Mechanism dead-code-adjacent: when _opp_gate naturally triggers (votes+strong+trend confirm), VWAP_dev typically already aligns with the reversal direction (VWAP is a recent-bar volume-weighted consensus that tracks price flow). When VWAP disagrees, the opp_margin is typically already so high that elevated threshold (max +40%) is still passed. Net result: zero per-regime impact at decision boundary. Same dead-code-adjacent failure pattern as prior counter-trend opp_bias amplifier (both attempted modulation of _opp_gate population which is too narrow to materially shift any regime). Confirms session-summary insight that _opp_gate is structurally rigid — modulation either fails to fire or duplicates existing gate filters. Reverting.
8839fcc-session-summary	-	-	-	-	-	-	-	session-summary	session: 5 architectural discards (cap reached, baseline 8839fcc unchanged at 0.985). All 5 architectural. Discards: (1) portfolio-DD exit accelerator (7th soft source, cross-symbol cascade detector via _port_dd_severity * losing-side-only) — composite -0.009, CRASH -0.013 sole major mover OPPOSITE expected direction: portfolio-DD signal correlates with regime (crash) and accelerates exits on crash-losing positions that should HOLD through cascade for recovery. Bull/sideways IDENTICAL (signal does not fire outside crash). Mechanism failure: portfolio-level signal lacks per-symbol momentum context to distinguish cascade-bottom (exit fast) vs cascade-recovery (hold). (2) remove _ep_pressure 5th early-profit-lock soft source (architectural code-structure removal hypothesizing overlap with _ar_pressure / _pp_pressure) — CATASTROPHIC composite -0.064, RALLY CRUSHED -0.207 (0.879->0.672), bull -0.116, sideways -0.005, crash IDENTICAL. _ep_pressure is heavily LOAD-BEARING for bull/rally profit-locking: rally pullback peaks frequently sit in sub-peak [0.15, 0.95]*_pp_min band where _pp_pressure is inactive and slope-against alone insufficient. _ar_pressure (losing-side gated) and _pp_pressure (post-_pp_min gated) do NOT cover this band — narrow-transitional hypothesis was wrong; sub-peak band is dominant profit-locking zone for bull/rally. (3) bilateral-conviction exit pressure (architectural 8th soft source, min(side, opp) margins as uncertainty signal) — composite -0.003 mean -0.0002 essentially flat, all 4 regimes within 0.002. Mechanism dead-code-adjacent: by construction of voter aggregation, when one side strong-sum is far above floor, opposite is typically far below (voters tend to one direction). bilateral_min_margin typically <=0, tanh activation near 0. The hypothesized "both-sides-strong uncertainty regime" is structurally rare because voter ensemble produces net-directional decisions. (4) pnl-asymmetric _max_hold timing replacing _w_time magnitude amplifier (multi-variable: restructure _max_hold + remove _w_time) — CATASTROPHIC composite -0.609, bull -1.09 (MaxDD 0.80->4.87), RALLY CRUSHED to 0.000 (MaxDD 4.70 hit hard cutoff), sideways -0.029, crash -0.156. Mechanism failure: extending _max_hold +2 bars for winning positions caused bull/rally winners to ride deep pullbacks without time-pressure cutoff. _w_time profit-amplifier was load-bearing semantics — rapidly cuts winners as time-pressure ramps post-_max_hold, locking gains BEFORE pullback widens DD. Replacing weight-asymmetry with hold-extension reverses this: winners now hold LONGER through pullbacks, absorbing the very DD that _w_time was preventing. Original direction (lock gains on time) is correct. (5) VWAP-deviation confirmation gate on _opp_gate (multi-variable new cross-component data dep at exit reversal) — composite -0.006 (LOC overhead only), mean IDENTICAL 0.8937, ALL 4 regimes BIT-IDENTICAL. Mechanism dead-code-adjacent: when _opp_gate naturally triggers, VWAP_dev typically already aligns with reversal direction (VWAP is recent-bar volume-weighted consensus that tracks price flow); when VWAP disagrees, opp_margin is typically already so high that elevated threshold is still passed. Same failure pattern as prior counter-trend opp_bias amplifier — _opp_gate population too narrow to materially shift any regime. CROSS-EXPERIMENT INSIGHTS: (a) Cross-symbol/cross-subsystem signals (portfolio-DD into exit, VWAP into _opp_gate) at the EXIT subsystem fail in TWO distinct ways — either correlate with regime in unhelpful direction (portfolio-DD/crash) or the natural alignment with existing exit signals makes them dead-code-adjacent (VWAP/opp_gate). The exit subsystem's direction-and-magnitude signals already capture the cross-component information. (b) _ep_pressure (sub-peak early-profit-lock) is structurally LOAD-BEARING despite its narrow [0.15, 0.95]*_pp_min band — rally/bull pullback winners produce small-peaks that need pre-_pp_min locking; the cascade _pp_pressure → _ep_pressure → slope-against actually has minimal redundancy. Future direction: do NOT attempt to remove _ep_pressure even with apparent overlap. (c) Bilateral-symmetric voter signals (min(side,opp) margins) are dead-code-adjacent because the voter ensemble structurally produces net-directional outputs — symmetric-bilateral conditions are too rare to materially fire. Asymmetric voter_bias (own-subtract / opp-add) is the ONLY voter-fusion-at-exit form that works; symmetric variants (this experiment + prior chop_amp_opp dampening) all dead-code. (d) The _w_time profit-amplifier direction (heavier in profit) is COUNTER-INTUITIVE but CORRECT — winners need fast time-out after _max_hold to lock gains before pullback widens DD, NOT extended hold. The intuition that "winners deserve more time" is wrong for time-pressure architecture; it's right for slope-pressure architecture (which is already loss-heavier). Don't conflate the two. (e) Three of five experiments (1, 3, 5) produced near-bit-identical or dead-code-adjacent results across regimes — saturation continues. Two experiments (2, 4) revealed load-bearing mechanisms whose removal/restructure CATASTROPHICALLY regresses (rally/bull profit-locking via _ep_pressure, time-pressure architecture via _w_time direction). The strategy has reached structural rigidity where most architectural perturbations either (a) fire on dead-code-adjacent paths, (b) collide with regime-correlation in unhelpful direction, or (c) reveal load-bearing mechanisms whose perturbation breaks profit-lock semantics. Baseline 8839fcc (0.985) unchanged.
3615e08	0.975	0.903	0.218	1.27	0.69	0.83	0.82	branch step 1	MAE-cleanliness gate on _tp_scale (architectural new cross-component data dep at exit harvest) — composite -0.010 vs 8839fcc 0.985 BUT branch-eligible: BULL +0.081 (1.187->1.268, MAJOR lift, sharpe 2.40->2.70), sideways +0.016 (0.818->0.834), crash IDENTICAL, RALLY -0.060 (0.879->0.819) sole regression. Mechanism works in intended direction for bull/sideways (shallow-MAE peaks preserve trend hold). RALLY regression: rally counter-trend bears often have MAE shallow (clean drift before pullback) — suppressing harvest extends those exposures into pullback continuation. Need to gate MAE_clean by trend-alignment: clean-MAE suppression should apply only when position is trend-aligned (bull longs, crash shorts) where peak truly represents trend extension; counter-trend positions (rally bears) need full harvest regardless of MAE because their peaks are mean-reverting by definition. OPENING BRANCH.
41d2720	0.974	0.903	0.217	1.27	0.69	0.83	0.83	branch step 2	trend-aligned MAE-cleanliness gate (added _trend_align_tp multiplier) — composite -0.011 vs 8839fcc 0.985, -0.001 vs step 1. Bull 1.265 (preserved), sideways 0.831 (preserved), RALLY +0.007 (0.819->0.826 partial recovery from step 1 regression), crash IDENTICAL. Trend-alignment narrowing helped rally slightly but bull also lost +0.003 (clean-trend bull longs were already preserved at step 1). Rally still -0.053 vs baseline; not fully recovered. Rally LONG positions during multi-day pullbacks may have clean MAE but their peaks need harvest (just like crash shorts). Need to tighten MAE-cleanliness scale further so only VERY shallow MAE positions get suppression.
4b28798	0.977	0.899	0.201	1.23	0.69	0.83	0.85	branch step 3	tighten MAE-clean scale (denom 0.4->0.2) + reduce magnitude (0.6->0.4) — composite +0.003 vs step 2 0.974, std tightened 0.217->0.201. Bull 1.232 (lost 0.033 vs step 2 1.265), sideways 0.825 (-0.006), RALLY +0.022 (0.826->0.848 nearing baseline 0.879), crash IDENTICAL. Tightening scale + reducing magnitude moved tradeoff toward rally-recovery; but bull gain partially erased. Composite still -0.008 vs 0.985 baseline.
2b7ceac	0.976	0.901	0.209	1.25	0.69	0.83	0.84	branch step 4	middle-ground MAE-clean (scale 0.3, mag 0.5) — composite -0.001 vs step 3 0.977, between step 2-3 on Pareto. Bull 1.249, sideways 0.828, rally 0.837, crash IDENTICAL. Confirmed Pareto: tighter scale (step 3) trades bull for rally; looser (step 1) trades rally for bull. Single MAE-cleanliness signal cannot resolve bull-vs-rally tension because both have shallow-MAE peaks in different regimes (bull: trend extension, rally: pullback peak).
9815eaa	0.975	0.901	0.209	1.25	0.69	0.83	0.84	branch step 5	add slope-magnitude gate (triple-gate MAE_clean × trend_align × slope_mag) — composite -0.002 vs step 3 0.977. Bull 1.248 (better than step 3 1.232 but worse than step 4 1.249), rally 0.839 (worse than step 3 0.848). Slope-mag gate doesn't cleanly separate bull-extension from rally-pullback (both can have positive slope at peak). Triple-gating reduced suppression magnitude where it should fire, hurting rally without helping bull substantially.
efd958a	0.978	0.899	0.197	1.22	0.69	0.83	0.85	branch step 6	deep-peak gate >2.0x_pp_min on MAE-clean suppression — composite -0.007 vs baseline 0.985 (BEST so far in branch). Std tightened 0.197 (vs baseline 0.183 still wider). Bull +0.037 (1.187->1.224), crash +0.001, sideways +0.009 (0.818->0.827), RALLY -0.026 (0.879->0.853 still regressing but reduced from step 1 -0.060). Deep-peak gate isolates super-peaks while excluding rally pullback peaks. Mean 0.899 vs baseline 0.894 (+0.005). Direction is converging.
6ee424f	0.980	0.898	0.191	1.21	0.69	0.83	0.87	branch step 7	deepen peak gate (2.0->2.4) — composite +0.002 vs step 6, -0.005 vs baseline 0.985. Bull 1.210 (+0.022 vs baseline), crash preserved, sideways +0.008, rally 0.865 (-0.014 vs baseline). std 0.191 tightening. Progressive convergence.
4d87706	0.982	0.897	0.187	1.20	0.69	0.83	0.87	branch step 8	peak gate 2.4->2.8 — composite +0.001 vs step 7, -0.003 vs baseline 0.985. Bull +0.013, sideways +0.008, rally -0.007 (close to baseline). std 0.187 close to baseline 0.183.
ede836f	0.982	0.896	0.185	1.20	0.69	0.83	0.87	branch step 9	peak gate 2.8->3.2 — flat vs step 8 (+0.0003). Bull 1.195 small loss, rally 0.874 small gain. Mechanism approaching dead-code-adjacent — at threshold 3.2 most peaks don't qualify, suppression rarely fires.
e87f215	0.982	0.896	0.185	1.19	0.69	0.83	0.87	branch step 10	tighten MAE_clean denom 0.2->0.15 — bit-identical to step 9. Mechanism plateau at peak gate threshold + MAE_clean denom combo. Both knobs saturated.
7444ae9	0.973	0.900	0.214	1.26	0.69	0.82	0.83	branch step 11	replace MAE_clean with at-peak gate (pos_pnl/peak_pnl near 1.0) — composite -0.012 vs baseline. Bull +0.069 (1.187->1.256), but RALLY -0.046 (0.879->0.833). Same bull-vs-rally tradeoff. At-peak fires more frequently than MAE_clean, amplifying both effects. Reverting direction.
7be4172	0.983	0.897	0.187	1.20	0.69	0.83	0.87	branch step 12	compactify step 8 best (8 LOC -> 4 LOC) — composite +0.001 vs step 8 (LOC bonus), -0.003 vs baseline 0.985. Per-regime: bull +0.013, sideways +0.008, rally -0.007, crash preserved. Mean +0.003 vs baseline. Std 0.187 (vs baseline 0.183 wider). Still failing strict composite criterion by -0.003 — std widening offsets mean gain.
3b5f148	0.983	0.896	0.185	1.19	0.69	0.82	0.87	branch step 13	peak gate 3.2 + magnitude 0.4 — composite -0.0001 vs step 12 (flat). Mean 0.896, std 0.185 closer to baseline 0.183. Stagnation step 1.
d41a04e	0.983	0.898	0.188	1.20	0.69	0.83	0.87	branch step 14	amplify magnitude 0.4->0.6 at peak gate 2.8 — composite +0.001 vs step 13 (BEST so far at 0.9831), -0.002 vs baseline 0.985. Bull +0.016, sideways +0.011, rally -0.009, crash preserved. Mean +0.004 vs baseline. Still -0.002 composite short due to std (0.188 vs baseline 0.183).
