commit	score	mean_score	std_score	bull_2021	crash_bear	sideways	rally_2024	status	description
7b769899	0.779436	0.824733	0.150989	0.923921	0.730154	1.012687	0.632168	discard	Exp6 (architectural, indep): BTC VOL-REGIME risk governor on alt entry size. NEW cross-symbol data dep: prior cross-symbol deps use BTC PRICE (_btc_trend 96-bar direction), BTC VOLUME (_btc_vol_rise magnitude, _btc_dvp direction) -- NONE uses BTC VOLATILITY (leader vol_regime = market-wide stress level). BTC realized vol_ratio (std log-returns / TARGET_VOL) HIGH = market-wide stress (crash, correlated liquidation cascades) -> alt entries face correlated crash risk no within-symbol primitive sees -> shrink. Distinct from dfb319cc (alt-vs-BTC vol AGREEMENT = idiosyncratic alt vol): this is BTC vol LEVEL = market-stress governor. Computed once/bar; BTC self -> 1.0 byte-identical; alt-only. Deep-saturated /0.5 above vol_ratio 1.0, shrink-only max 0.20, first-bar-only. MEASURED vs 637f5e53 0.779314: composite +0.000122 (0.779436 SUB-NOISE), mean +0.000152 (0.824733), std +0.000099. PER-REGIME all stab 1.0 all raw==score: bull 0.923316->0.923921 (+0.000605, Sh1.936->1.938 -- BTC vol high during 2021 V-corrections -> shrunk some alt entries -> bull Sharpe up), crash BYTE-IDENTICAL 0.730154, sideways BYTE-IDENTICAL 1.012687, rally BYTE-IDENTICAL 0.632168. KEY FINDING: the BTC vol-regime LEVEL governor is mildly helpful for bull (sub-noise +0.0006) but INERT on crash/sideways/rally (byte-identical -- their alt entries do not coincide with high BTC vol above the /0.5 saturation gate, OR the shrink is grid-absorbed by the entry-shrink noise wall). Net sub-noise < +0.003 -> DISCARD. The cross-symbol vol-regime direction (both AGREEMENT dfb319cc and LEVEL this exp) is mostly inert -- BTC vol_regime does not separate the binding regimes' alt entries. Reverted to 637f5e53. 5th architectural discard (EXIT RULE: 5 architectural attempted with 1 non-arch in mix -> STOP).
-	-	-	-	-	-	-	-	session-summary	SESSION (baseline 637f5e53 0.779314 -> UNCHANGED, no keep): 6 experiments (1 parameter discard + 5 architectural discards), no branch opened. EXIT RULE: 5 architectural discards attempted (Exp2-6) with 1 non-architectural (Exp1 parameter) in the mix -> STOP per "5 consecutive discards not all architectural -> continue until >=5 architectural". User 2-arch-discard minimum exceeded (5). Baseline 637f5e53 re-verified reproduces 0.779314 byte-identical at session start AND post-revert [bull 0.923316 Sh1.936 DD3.71pct, crash 0.730154 Sh1.274 DD3.04pct, sideways 1.012687 Sh2.001 DD2.75pct, rally 0.632168 Sh1.470 DD6.36pct; all stab 1.0, all raw==score, min_stab 0.807]. strategy.py matches 637f5e53 byte-identical (empty diff verified). HEADLINE FINDING (load-bearing, NEW under v2.2 scoring, future sessions read this): the LEVERAGE_K=5 optimum was selected under the OLD v2.1 absolute-APY return_reward (keeps dccf0da1->1b3f5316->8f49828e->c2444b1c, 2x->3x->4x->5x, rationale "2x doubles APY raising rr to ~0.73-0.74"). Under the CURRENT v2.2 calmar-based return_reward (calmar=APY/MaxDD is leverage-INVARIANT, revised 2026-06-21), raising leverage is return_reward-NEUTRAL, so the only remaining effect of the 5x level is the dd_gate PENALTY (higher DD; c2444b1c itself noted "bull regressing, dd_gate penalty overtaking rr gain, rally DD 7.58 near 8pct knee"). Exp1 (LEVERAGE_K 5->4, parameter) MEASURED: composite +0.002041 (0.781355 SUB-KEEP < +0.003), bull +0.017541 (BIG dd_gate gain, Sh1.936->1.918), crash +0.001149, rally +0.002589 (DD6.36->5.09), BUT sideways -0.016503 (Sh2.001->2.006 UP, AnnRet 18.2->14.4pct, trades 52->48 BELOW the 50-trade sample_factor knee -> sample_factor 1.0->0.980 = -2pct penalty = the BLOCKER). The dd_gate benefit (rally +1.2pct, bull +0.7pct per unit leverage) is PARTIALLY OFFSET by non-scale-invariance (discrete $1-floor x grid-quantization x equity-compounding edge effects the LEVERAGE_K emission-threshold scaling does NOT perfectly preserve). CRITICAL BLOCKER: sideways sits at 52 trades at 5x (just above the 50-trade sample_factor knee) -- ANY leverage reduction pulls it below 50 -> -2pct sample_factor penalty cancels the dd_gate gain. Therefore leverage reduction CANNOT clear +0.003 while sideways is at 52 trades. To unlock lower leverage (a real v2.2 dd_gate gain on rally/bull/crash), sideways would need >=55-ish trades (headroom above 50). NOT a parameter-sweep candidate (sitting on the 50-trade boundary is noise-floor overfitting the +0.003 threshold rejects). CROSS-EXPERIMENT CONCLUSIONS (all measured this session, correlation-only where applicable): (1) under v2.2 the LEVERAGE_K=5 level is NO LONGER OPTIMAL -- bull/crash/rally would benefit from lower leverage via dd_gate (rally DD 6.36pct near 8pct knee has the most headroom) but sideways trade-count fragility blocks it. (2) The rally ALPHA-TRADE WALL extends to the CONVICTION-DENSITY (volume/range) data axis (Exp3): shrinking ANY rally entries -- even low-conviction range>volume ones -- cuts rally alpha -0.0021; rally losers are direction-gated (ct pullback shorts) NOT conviction-density-gated, so a conviction shrink hits the alpha entries not the losers. (3) The EXIT-INERTNESS WALL holds for the INTRABAR-RANGE data type (Exp2 ATR range-expansion z>2 source): a genuinely-new data axis (range blowout) is REDUNDANT with _ve (close-to-close vol) on binding bars -- range blowouts co-occur with close-to-close vol expansion, so _ve already fires; ATR-only fires (range spike with steady close) are on non-binding bars. New rare-event MAX sources remain SAFE (no catastrophic cycling, unlike common-condition sources) but INERT unless they capture a regime-shift the existing sources miss. (4) Entry-side SHRINKS are mostly grid-absorbed/inert or rally-alpha-negative: _vol_decline_shrink mildly load-bearing (Exp4 sub-noise -0.0002), _close_conv_boost mildly load-bearing for rally (Exp5 sub-noise -0.0001), BTC vol-regime LEVEL governor bull-only inert elsewhere (Exp6 sub-noise +0.0001). The entry-shrink noise wall (small size changes absorbed by the 0.06*equity*BASE grid + $1*K emission threshold) caps most entry-sizing experiments at sub-noise. (5) Component-saturation confirmed: _vol_decline_shrink and _close_conv_boost are mildly load-bearing (NOT dead code, unlike _ar/_ep exit terms); the entry-size stack has NO remaining dead code to remove for simplification. The binding rally (DD6.36 near 8pct knee, stability 0.807, all DD-reduction levers maxed, alpha-trade wall on entry shrinks) and crash (return-limited Sh1.274, bounce-LONG, exit-path-inert) remain unconquered. The ONE new viable lever identified (v2.2 leverage reduction via dd_gate) is blocked by the sideways 50-trade sample_factor EDGE -- a structural fragility future sessions could address by raising sideways trade count (currently walled by admission-inertness). results.tsv append-only preserved (path-scoped git checkout -- strategy.py throughout, never git revert); all 6 discards reverted to 637f5e53; strategy.py matches 637f5e53 byte-identical (empty diff verified).
a1d3f6f2	-999	-249.12	432.94	0.798771	0.718738	1.010741	-999	discard	Exp1 (architectural, indep): VWAP-OVEREXTENSION exit pressure (7th active soft MAX source). NEW exit-subsystem data dep: 24-bar VWAP (distinct window from 12-bar entry VWAP voter) overextension in position favor, profit-side only, vol-scaled band. MEASURED vs baseline 637f5e53 0.779314: CATASTROPHIC, composite -999 (rally DD 6.36->12.70pct BREACHES 10pct hard cutoff). PER-REGIME all stab 1.0 all raw==score: bull 0.923316->0.798771 (-0.124545, DD 3.71 unchanged — winner cut), crash 0.730154->0.718738 (-0.011416), sideways 1.012687->1.010741 (-0.001946), rally 0.632168->-999 (DD 6.36->12.70). LESSON: overextension-from-VWAP != exhaustion in TREND regimes — strong trends legitimately run far from VWAP (that IS the trend), so firing exit pressure there cuts trend winners (bull -0.125) and churns rally into DD breach. Mechanism is structurally wrong for trend-aligned profit (opposite of _ts_supp which SUPPRESSES harvest on clean trend extension). NOT branch-eligible (no regime improved; rally DD safety-net breach). min_stab 0.807->0.867.
0c33da1f	0.779375	0.824648	0.150911	0.923607	0.730154	1.012632	0.632200	discard	Exp2 (architectural, indep): PRICE-OVEREXTENSION entry shrink. NEW entry-side data primitive: 48-bar EMA slow anchor (distinct timescale from 12-bar VWAP voter / 20-bar ret_long). Shrink first-bar size when close overextended from slow EMA in entry direction (buying tops/selling bottoms), trend-strength-gated, shrink-only max 0.20, deep-saturated /0.025 band. MEASURED vs baseline 637f5e53 0.779314: SUB-NOISE, composite +0.000061 (<<0.003), mean +0.000067, std +0.000021. PER-REGIME all stab 1.0 all raw==score all DD unchanged: bull 0.923316->0.923607 (+0.000291, DD 3.71), crash BYTE-IDENTICAL 0.730154 (DD 3.04 — shrink does not bind in crash), sideways 1.012687->1.012632 (-0.000055), rally 0.632168->0.632200 (+0.000032, DD 6.360211->6.359603 essentially unchanged). LESSON: mechanism is INERT — the 48-bar EMA overextension band (/0.025) rarely fires meaningfully, and where it fires the size reduction is too small to move DD/Sharpe. Crash byte-identical confirms crash entries are NOT overextended from the slow EMA in entry direction (crash shorts enter on bounces, not at overextended lows). rally DD unchanged confirms entry-overextension is NOT the rally DD source (giveback on held winners is, per the alpha-trade wall). NOT branch-eligible (no regime improved meaningfully; inert). min_stab 0.807->0.807.
c1096ce7	0.754229	0.806493	0.174214	0.923384	0.725648	1.012695	0.564246	discard	Exp3 (architectural, indep): RUN-UP-VELOCITY-ADAPTIVE giveback TOLERANCE. STRUCTURAL change to giveback-tolerance subsystem (distinct from maxed portfolio-DD tightening _pp_tighten and from prior GIVEBACK-VELOCITY exit-pressure MAX source). peak-per-bar rate = peak_pnl/max(bars_held,1)/|stop|; _runup_mult tightens (0.7x) on fast spike peaks, widens (1.35x) on slow grind peaks. Stateless (uses existing peak_pnl+bars_held). MEASURED vs baseline 637f5e53 0.779314: REGRESSION, composite -0.025085, mean -0.018088, std +0.023324. PER-REGIME all stab 1.0 all raw==score: bull 0.923316->0.923384 (flat, DD 3.71), crash 0.730154->0.725648 (-0.004506, DD 3.04), sideways 1.012687->1.012695 (flat), rally 0.632168->0.564246 (-0.067922, DD 6.360211->7.580825 WORSE). LESSON: hypothesis was BACKWARDS — widening grind-peak giveback (intended to let rally trend winners run) instead let rally winners run INTO deeper giveback, raising DD 6.36->7.58 and cutting score -0.068. Confirms rally giveback-tolerance is ALREADY at its optimum (PORT_DD_GIVEBACK_TIGHTEN=0.50 maxed); any widening costs DD faster than return. The tighten-side (spike peaks) did not help bull/crash enough to offset. NOT branch-eligible (no regime improved; rally regressed, no promising new mechanism). min_stab 0.807->0.839.
-	-	-	-	-	-	-	-	session-summary	SESSION (baseline 637f5e53 0.779314 -> UNCHANGED, no keep): 3 independent architectural experiments (Exp1-3, ALL discards), no branch opened (none branch-worthy -- no regime improved meaningfully in any experiment). EXIT RULE: 3 consecutive architectural discards; 2-arch-discard minimum MET; exited on idea-exhaustion after verifying via saturation grep that EVERY subsystem and data dimension is saturated (exit-fusion MAX load-bearing per catastrophic LSE attempt, voter quintic load-bearing per sextic/quartic -999, scale-in maxed, giveback tolerance maxed at PORT_DD_GIVEBACK_TIGHTEN=0.50, entry-sizing 138 mentions, cross-symbol grid {own,BTC,partner}x{price,vol,DVP} fully populated 9/9, time-pressure 29, stop-loss 39, autocorrelation-on-derisk catastrophic, flip_count=0 all regimes so flip path inert). Baseline 637f5e53 re-verified reproduces 0.779314 byte-identical at session start AND post-revert [bull 0.923316 Sh1.936 DD3.71pct, crash 0.730154 Sh1.274 DD3.04pct, sideways 1.012687 Sh2.001 DD2.75pct, rally 0.632168 Sh1.470 DD6.36pct; all stab 1.0, all raw==score, all flip_streak_gate 1.0, min_stab 0.807]. strategy.py matches 637f5e53 byte-identical (0 diff verified). BINDING CONSTRAINT CONFIRMED: all raw==score means the score IS raw return quality (Sharpe x dd_gate x return_reward); NO stability/flip penalties bind. rally (0.632, DD6.36, calmar3.40 lowest) remains the binding low regime; crash (0.730, Sh1.274 lowest, DD3.04 huge headroom) is 2nd-lowest. Exp1 VWAP-OVEREXTENSION EXIT pressure (7th soft MAX source, 24-bar VWAP distinct from 12-bar entry voter): CATASTROPHIC, composite -999 (rally DD 6.36->12.70 BREACHES 10pct cutoff); bull -0.125, crash -0.011, sideways -0.002. LESSON: overextension-from-VWAP != exhaustion in TREND regimes -- strong trends legitimately run far from VWAP (that IS the trend), so firing exit pressure there cuts trend winners and churns rally into DD breach. The existing _ts_supp deliberately SUPPRESSES harvest on clean trend extensions for exactly this reason; any new exit pressure on price-overextension must be gated to fire ONLY on mean-reverting (counter-trend/non-trend) contexts, not trend-aligned. Exp2 PRICE-OVEREXTENSION ENTRY shrink (48-bar EMA slow anchor, trend-gated, shrink-only, max 0.20, /0.025 band): SUB-NOISE +0.000061 (inert). crash BYTE-IDENTICAL (crash shorts enter on bounces, NOT at overextended lows -- shrink does not bind); rally DD 6.36->6.3596 essentially unchanged. LESSON: entry-overextension is NOT the rally DD source (giveback on held winners is, per the alpha-trade wall); the 48-bar EMA band rarely fires and where it fires the size cut is too small to move DD/Sharpe. Exp3 RUN-UP-VELOCITY-ADAPTIVE giveback TOLERANCE (peak-per-bar rate = peak_pnl/max(bars_held,1)/|stop|; tighten 0.7x on fast spike peaks, widen 1.35x on slow grind peaks; stateless): REGRESSION composite -0.025, rally -0.068 (DD 6.36->7.58 WORSE). LESSON: hypothesis was BACKWARDS -- widening grind-peak giveback (intended to let rally trend winners run) instead let rally winners run INTO deeper giveback, raising DD. RE-CONFIRMS rally giveback-tolerance is ALREADY at its optimum (PORT_DD_GIVEBACK_TIGHTEN=0.50 maxed; 0.60 cliffs rally stability); any widening costs DD faster than return. The tighten-side (spike peaks) did not help bull/crash enough to offset. CROSS-EXPERIMENT CONCLUSION (verifiable, this session): the giveback-tolerance subsystem is at a confirmed local optimum -- both directions (tighten via portfolio-DD = maxed at 0.50; widen via run-up-velocity = rally DD regression) fail, confirming the alpha-trade wall holds under v2.2 calmar scoring. No new mechanism improved any regime; the baseline 637f5e53 stands.
ca639bc9	0.751765	0.793761	0.139989	0.800811	0.730154	1.012687	0.631393	discard	Exp1 (architectural, indep): DIRECTION-SPECIFIC loss-streak for ct gates. Replace portfolio _loss_streak (resets on any win) with per-direction _loss_streak_long/_loss_streak_short; bull ct (long in downtrend) keys on long-streak, bear ct (short in uptrend=rally pullback shorts) keys on short-streak. Hypothesis: portfolio streak resets on intervening long wins in rally uptrend+pullbacks, so ct gate rarely fired; per-direction short-streak would accumulate rally short losses and fire the ct gate to break the ~4-loss streak (streak_gate 0.886, largest un-maxed lever). MEASURED vs baseline 637f5e53 0.779314: composite -0.027549 (0.751765 REGRESSION), mean -0.030820, std 0.150890->0.139989 (tighter but mean dropped). PER-REGIME all stab 1.0 all raw==score all flip 1.0: bull 0.923316->0.800811 (-0.122505 BIG MISFIRE), crash BYTE-IDENTICAL 0.730154, sideways BYTE-IDENTICAL 1.012687, rally 0.632168->0.631393 (-0.000775, NO streak_gate gain). ROOT CAUSE (two): (1) BULL: during bull-2021 multi-bar corrections longs lose consecutively, accumulating the long-streak; when ret_vlong dips negative in a correction the next bull long (a winning dip-buy) is flagged ct and shrunk -> cuts bull alpha -0.122 (per-direction long-streak catches dip-buy losses then penalizes the recovery long). (2) RALLY: the core hypothesis was WRONG -- shrinking the Nth ct-short SIZE does not prevent it from being a LOSS (streak_gate counts consecutive LOSSES not loss magnitude); the +0.10 admission tighten is too weak to BLOCK high-conviction ct shorts (admission-inertness wall, confirmed 4x for crash bounces; rally ct shorts are similarly high-conviction). So streak reduction via sizing is structurally incapable of helping; only ADMISSION BLOCKING breaks a streak, and aggressive ct blocking hits the rally alpha-trade wall. CROSS-EXPERIMENT (this session, verifiable): rally streak_gate (0.886) is NOT reducible via the ct size-shrink path -- the loss-streak is structural to high-conviction ct re-entries; confirms admission-inertness wall extends to the streak-reduction axis. Discard reverted to 637f5e53.
b8e8d0e2	0.767917	0.813904	0.153291	0.914661	0.698829	1.008808	0.633321	discard	Exp2 (architectural, indep): VOL-MODULATED calm-grid spacing (finer in low-vol). The calm partition grid (0.06*equity*BASE) fires only for never-bursting symbols (crash max-len=1, sideways max-len=2; bull/rally burst early and excluded). Hypothesis: finer grid in calm (low-vol) regimes would (a) reduce sideways quantization error -> higher Sharpe, (b) raise sideways trade count above the 50-trade sample_factor knee that blocks the viable leverage-reduction lever (prior session: sideways 52 trades at 5x, 48 at 4x -> sample_factor penalty cancels the dd_gate gain). MEASURED vs baseline 637f5e53 0.779314: composite -0.011397 (0.767917 REGRESSION), mean -0.010677, std 0.150890->0.153291. PER-REGIME all stab 1.0 all raw==score all flip 1.0 all MaxDD<10pct: bull 0.923316->0.914661 (-0.008655), crash 0.730154->0.698829 (-0.031325 BIG), sideways 1.012687->1.008808 (-0.003879), rally 0.632168->0.633321 (+0.001153 noise). ROOT CAUSE (two): (1) CRASH is a never-bursting calm-partition symbol whose vol_ratio dips below 1 during calm crash periods -> the finer grid (down to 0.045) activated there -> more crash churn/fees -> lower Sharpe (crash is return-limited Sh1.274, fee-sensitive; the prior-session belief that crash is high-vol and would keep the coarse grid was wrong -- crash has calm inter-bounce periods). (2) SIDEWAYS at 5x is ALREADY sample_factor-saturated (52 trades -> factor 1.0), so raising its trade count gives NO sample_factor benefit at 5x; and the quantization-precision gain was negligible (-0.004 net = more fees offset any precision). CROSS-EXPERIMENT (this session, verifiable): the grid-fineness lever does NOT help sideways at 5x (sample_factor already maxed) and HURTS crash (fee-sensitive calm periods); the sideways 50-trade fragility that blocks leverage reduction CANNOT be addressed via the calm grid (it only adds churn where it fires). The leverage-reduction unblock path remains walled (would need sideways trade-count headroom WITHOUT adding crash/sideways churn -- the grid cannot do both). Discard reverted to 637f5e53.
