commit	score	mean_score	std_score	bull_2021	crash_bear	sideways	rally_2024	status	description
-	0.938	0.856	0.191	1.16	0.63	0.80	0.84	discard	entry-conviction decay 7th exit pressure (architectural new per-symbol state + new control flow at exit subsystem) — composite -0.016 vs 83ffa0a 0.954, mean -0.004. Bull/sideways IDENTICAL to baseline (mechanism gated by losing-side weight, rarely activates in trending regimes where positions are profitable). Crash -0.015 (0.645->0.630, sharpe 1.022->0.989, annual 4.65->4.49): bear shorts in crash dead-cat-bounce bars see own-side conviction temporarily drop as bull voters fire on counter-rally; conviction-decay exit cuts these positions before bear thesis re-asserts and they would have recovered into winning. Rally -0.006 (0.846->0.840): rally bears (counter-trend) face naturally-low own-side bear conviction during rally upward push; entry-strong was the local max, decay fires too easily. Mechanism wrong-directional: own-side voter conviction is naturally NOISY around chop bars and counter-trend bars, so decay against the entry-time peak fires on benign noise rather than thesis weakening. Std widened 0.187->0.191. Reverting.
-	0.810	0.740	0.243	1.16	0.63	0.62	0.55	discard	remove _freq_factor per-symbol trade-frequency self-regulator (architectural code-structure removal) — CATASTROPHIC composite -0.144 vs 83ffa0a 0.954, mean -0.120. Sideways crushed -0.184 (0.80->0.62, sharpe 1.28->0.89, annual 2.51->1.73), rally CRUSHED -0.292 (0.85->0.55, sharpe 1.65->0.82, annual 9.67->2.83 — much higher trade volume eats into rally returns), crash -0.011, bull flat. Std exploded 0.187->0.243. Mechanism is heavily load-bearing: per-symbol _freq_factor was filtering NOISE clusters in chop where strong-sum gate alone admits flippy entries (sideways high-trade noise). The parallel-mechanism reasoning was wrong: portfolio-level cross-symbol clusters were redundant with per-symbol gating, but per-symbol temporal clusters in chop ARE noise (same symbol firing repeatedly in a 30-bar window indicates churning, not trend signal). Reverting.
-	0.950	0.855	0.181	1.14	0.65	0.79	0.84	discard	MAE-responsive scale-in pace replacing trend-magnitude pace (architectural new cross-bar data dep + new control flow) — composite -0.004 vs 83ffa0a 0.954, mean -0.005. Bull -0.016 (1.157->1.144, sharpe 2.30->2.26, MaxDD 0.85->0.97): MAE-responsive pace slowed scale-in even on clean bull entries because prior-bar MAE is 0.0 at bars_held=1 (init) — _mae_factor=0 gives pace=3 bars (same as old default), but small post-entry MAE moves trigger pace-slowdown that delays bull commitment. Crash +0.006 (mild gain from slower scale-in into dead-cat-bounce MAE bars). Sideways -0.007, rally -0.007 — both have benign MAE patterns that the mechanism slightly mis-paces. Std tightened 0.187->0.181 (consistency gain) but mean drops dominate composite. Mechanism architecturally clean but trend-magnitude pace was load-bearing for bull commitment timing. Reverting.
-	0.861	0.791	0.240	1.16	0.52	0.82	0.66	discard	joint removal of _chop_amp and _opp_atten voter_bias modulators (architectural code-structure removal) — CATASTROPHIC composite -0.093 vs 83ffa0a 0.954, mean -0.069. Bull +0.007 (1.157->1.164, slight gain), sideways +0.019 (0.80->0.82 — _chop_amp was actually OVER-amplifying own-side subtraction in chop, removal helped sideways slightly!), crash CRUSHED -0.125 (0.645->0.520, sharpe 1.02->0.76, annual 4.65->3.33), rally CRUSHED -0.187 (0.846->0.659, sharpe 1.65->1.11, annual 9.67->5.63). _opp_atten is heavily load-bearing for trend-aligned counter-trend regimes (rally bear shorts, crash bear longs vs dead-cat-bounce bull voters): without the trend-aligned attenuation, opp-voter spikes during pullback/bounce bars exit trend-aligned positions prematurely. Sideways insight (+0.019) is interesting — _chop_amp was a slight DRAG on sideways, not a benefit; the prior session note about sideways_load_bearing was wrong-attributed in earlier baselines. Std exploded 0.187->0.240. The two modulators are NOT mutually-redundant; _opp_atten provides distinct value in trend regimes. Reverting.
83ffa0a-session-summary	-	-	-	-	-	-	-	session-summary	session: 5 architectural discards (cap reached, baseline 83ffa0a unchanged at 0.954). All 5 architectural. Discards: (1) slope-confirmation gate on opp_bias additive term — composite -0.001 (mean +0.001 but composite criterion failed): bilateral nature creates regime-mixed zero-sum effect (down-weights chop noise but amplifies trend-against signal); architecturally clean but no net edge. (2) entry-conviction decay 7th exit pressure — composite -0.016, crash -0.015 + rally -0.006: own-side voter conviction is naturally noisy around chop/counter-trend bars; decay against entry-time peak fires on benign noise rather than thesis weakening; bull/sideways gated out by losing-side weight. (3) remove _freq_factor per-symbol trade-frequency self-regulator — CATASTROPHIC composite -0.144, sideways -0.184 + rally -0.292: per-symbol clustered entries IN CHOP are noise (churning at one symbol), not trend signal; load-bearing for sideways/rally chop noise filtering; parallel-mechanism reasoning to de5ca08 portfolio_freq removal does NOT generalize to per-symbol level. (4) MAE-responsive scale-in pace — composite -0.004, bull -0.016: trend-magnitude pace is load-bearing for bull commitment timing; even small slowdowns from MAE-driven pace adjustment delay bull capture. (5) joint removal of _chop_amp + _opp_atten voter_bias modulators — CATASTROPHIC composite -0.093, crash -0.125 + rally -0.187: _opp_atten is heavily load-bearing for trend-aligned counter-trend regimes (rally bears, crash bears vs dead-cat-bounce); the two modulators are NOT mutually-redundant. INTERESTING: sideways +0.019 from joint removal — _chop_amp was a slight DRAG on sideways (over-amplified own-side subtraction in chop), not a benefit. Cross-experiment insights: (a) opp_bias modulators are heavily saturated in current baseline — both bilateral gates (slope-confirm) and joint removal regress; the opp_atten asymmetric trend-attenuation is foundational to rally/crash counter-trend handling. (b) _freq_factor per-symbol works DIFFERENTLY from portfolio version — per-symbol same-symbol churn IS noise, parallel-mechanism reasoning failed. (c) Conviction-tracking signals (entry_strong, persistence) at exit are noise-prone — voter-state evolution during normal hold periods has chop nature. (d) Scale-in pacing is load-bearing per its current trend-magnitude conditioning; alternative inputs (MAE-responsive) regress because trend-magnitude already captures the regime correlate that determines optimal commitment timing. (e) Sideways +0.019 hint: _chop_amp removal helps sideways slightly — but cannot be removed without compensating opp_atten retention; this combined opportunity may motivate a future "remove _chop_amp only, keep _opp_atten" experiment in next session. Decision-architecture saturation continues across voter_bias subsystem (modulators), entry-frequency gating, conviction-tracking exit pressures, and scale-in pacing inputs. Baseline 83ffa0a (0.954) unchanged.
-	0.917	0.749	0.064	0.82	0.66	0.71	0.80	discard	remove _persistence_mult per-voter persistence weighting (architectural code-structure removal) — composite -0.037 vs 83ffa0a, mean -0.111. Bull CATASTROPHIC -0.34 (sharpe collapse from per-voter weight neutralization), sideways -0.09, rally -0.04; crash +0.02. Std collapsed 0.186->0.064 (huge consistency gain) but mean dominates. Per-voter persistence IS load-bearing — upweights consistent trend voters (EMA cross/slope, MACD) during sustained bull, downweights flip-prone voters (RSI in chop). Aggregate-level _recent_strongs 3-bar persistence operates at different granularity (strong-sum total, not per-voter contribution) — they are complementary noise filters, not redundant.
83ffa0a-session-summary	-	-	-	-	-	-	-	session-summary	session: 5 architectural discards (cap reached, baseline 83ffa0a unchanged at 0.954). All 5 architectural. Discards: (1) remove _chop_amp own-side voter_bias amplifier only — composite -0.062, sideways +0.019 (CONFIRMED prior session prediction) but crash -0.12 + rally -0.07; _chop_amp is bilateral: helps trend-regime hold during chop interludes (load-bearing for crash/rally), hurts pure sideways. No clean isolation possible. (2) remove _vol_entry_atten low-volume entry attenuator — composite -0.008, mild uniform regression; volume-relative-to-average provides genuinely orthogonal signal beyond consensus_atten/quality_atten. (3) directional-asymmetric scale-in pace by trend alignment — composite -0.012, only crash -0.018: counter-trend rebound rallies in crash are SHORT-DURATION (need fast commitment), not patience; "wait for pullback persistence" hypothesis wrong for crash. (4) remove _ep_pressure early-profit-lock — composite -0.035, bull -0.13 + rally -0.11 CATASTROPHIC: trends produce many shorter peaks (0.4-2.4%) below _pp_min activation; _ep_pressure locks these mid-profit gains before slope-against catches up. Activation band is NOT narrow in practice — covers most common bull/rally winning peak sizes. (5) remove _persistence_mult per-voter persistence weighting — composite -0.037, bull CATASTROPHIC -0.34 + sideways -0.09; std collapsed 0.186->0.064 (consistency gain) but mean dominates. Per-voter persistence upweights consistent trend voters (EMA cross/slope, MACD) during sustained bull and is complementary, not redundant, with aggregate _recent_strongs 3-bar strong-sum persistence — they filter noise at different granularities. Cross-experiment insights: (a) _chop_amp confirmed as bilateral mechanism (helps trend-regime chop interludes, hurts pure sideways) — last sessions remove-only hint failed due to substantial chop bars in trend regimes; consider asymmetric trend-aligned _chop_amp scaling in future (only amplify own-side subtraction in trend-aligned positions, not in counter-trend). (b) _ep_pressure activation band is broader than its name suggests; "early peak" 0.15-0.95*_pp_min covers most bull/rally winners — not a narrow corner case. (c) _persistence_mult is structurally orthogonal to _recent_strongs persistence: per-voter level vs aggregate strong-sum level. Both filter noise but at different aggregation depths; removing either creates regime-specific harm. (d) Exit-side simplifications (_ep_pressure removal) and aggregation-side simplifications (_persistence_mult removal) both produce HUGE std-narrowing but at the cost of mean — over-aggressive consistency at the cost of regime-specific edge. (e) Counter-trend handling at scale-in is asymmetric across regimes — crash needs fast counter-trend (rebound capture), rally may need slow counter-trend (fade pullback) — uniform asymmetric pace cannot be load-bearing. Decision-architecture saturation continues across voter aggregation, scale-in pacing, exit-pressure source removal, voter_bias modulator removal. Baseline 83ffa0a (0.954) unchanged.
03cfb6f	0.912	0.770	0.082	0.82	0.63	0.80	0.83	discard	decouple voter_bias from persistence-weighted strong-sums (architectural new cross-component data dep) — composite -0.042 vs 83ffa0a baseline 0.954, mean -0.090. Std collapsed 0.186->0.082 (HUGE consistency gain) but bull CATASTROPHIC -0.34 (1.16->0.82). Crash flat, sideways flat, rally -0.01. Persistence-weighted margins at exit are heavily load-bearing for bull: bull voters sustain direction over 8-bar windows so persistence-weighted strong-sums stay high during bull pullbacks while RAW current-bar strong-sums dip. Raw margins make voter_bias subtraction shrink during bull pullbacks -> _exit_pressure rises -> exits fire on noise. Persistence smoothing IS the mechanism that lets bull positions ride pullbacks. Same pattern as prior _persistence_mult removal experiment (catastrophic bull -0.34) - persistence at exit is structurally orthogonal to other smoothing.
83ffa0a-session-summary	-	-	-	-	-	-	-	session-summary	session: 5 architectural discards (cap reached, baseline 83ffa0a unchanged at 0.954). All 5 architectural. Discards: (1) asymmetric trend-aligned _chop_amp scaling — composite -0.066, sideways +0.02 (predicted) but crash -0.12 + rally -0.06: the trend_align(ret_long*pos_dir) requires moderate-strong trend, but in crash/rally CHOP INTERLUDES (|ret_long| 0.02-0.03) trend_align saturates near zero AND chop_factor activates simultaneously; the two factors are anti-correlated by construction (chop_factor needs small ret_long, trend_align needs large ret_long with matching sign). Decomposition cannot recover crash/rally chop-interlude benefit. (2) anchor scale-in target to entry-bar size — composite -0.056, all 4 regimes regressed: floating-target IS the correct adaptive mechanism. When vol rises during scale-in, combined_mult shrinks (TARGET_VOL/realized_vol attenuator); locking entry-size prevents this protective scale-down so positions grow LARGER than current bar would size them. Inverse of intended noise-protection. (3) adverse-volume exit pressure 7th source — composite -0.177, bull CATASTROPHIC -0.70: bar-level vol*adverse-direction confluence fires on legitimate bull pullback bars (BTC bull markets have frequent volume spikes during healthy retracements before trend continuation). Mechanism cannot distinguish "informed reversal volume" from "pullback consolidation volume" — both have same signature. Volume*direction at exit is structurally noisy in bull. (4) remove _cooldown_factor smooth-decay — composite -0.013, all 4 regimes mildly regressed: post-exit size attenuation is genuinely orthogonal — fast re-entries directly after exit hit the post-exit volatility window where exit-trigger signals may still be active in inverse form. Persistence gate requires 2 sustained bars but does NOT prevent immediate next-bar re-entries; cooldown_factor uniquely attenuates that scenario. (5) decouple voter_bias from persistence-weighted strong-sums — composite -0.042, bull CATASTROPHIC -0.34, std collapsed 0.186->0.082 (consistency huge gain): persistence-weighted margins at exit are heavily load-bearing for bull. Bull voters sustain direction over 8-bar windows so persistence-weighted strong-sums stay high during bull pullbacks while raw current-bar strong-sums dip. Raw margins make voter_bias subtraction shrink during bull pullbacks -> _exit_pressure rises -> exits fire on noise. SAME pattern as prior _persistence_mult removal (-0.34 bull) — persistence at exit is structurally orthogonal to other smoothing, cannot be decoupled or removed without bull catastrophe. Cross-experiment insights: (a) Voter_bias subsystem persistence-coupling is foundational for bull regime — both removing _persistence_mult and decoupling voter_bias from persistence produce identical bull -0.34 catastrophe. Persistence carries pullback-conviction-memory that lets bull positions ride retracements. (b) Asymmetric chop_amp via trend-alignment cannot work because chop_factor and trend_align are anti-correlated by construction (chop needs small ret_long, alignment needs large ret_long). Future direction: try chop_factor * pos_dir-only (decompose by counter-trend vs same-side) without ret_long magnitude in trend_align — i.e., gate amp on whether position direction matches sign(ret_long), regardless of magnitude. (c) Volume*direction confluence at exit is too noisy in bull — pullback volume signature mimics reversal signature. (d) Cooldown_factor is small but uniquely orthogonal — protects post-exit re-entry window not covered by other gates. (e) Floating combined_mult-derived size is the correct adaptive scale-in target; locking entry-bar size inverts the vol-responsive sizing. Decision-architecture saturation continues at voter_bias subsystem (persistence coupling, asymmetric modulators), exit-pressure fusion (volume confluence), entry size attenuators (cooldown removal), and scale-in state (entry-size anchor). Baseline 83ffa0a (0.954) unchanged.
-	0.631	0.672	0.439	1.19	0.62	0.88	0.00	discard	peak-stall exit pressure 7th source (architectural new per-symbol state + new control flow at exit) — CATASTROPHIC composite -0.323 vs 83ffa0a 0.954, mean -0.188. Rally CRUSHED 0.85->0.00 (sharpe 1.66->-0.07 or worse, hard-cutoff likely triggered): rally counter-trend bear positions face upward push environment where own-side (bear) peaks are short-lived AND rare; bars_since_peak rapidly accumulates while pos_pnl drifts in chop near small profit — peak-stall pressure fires on every counter-trend bear that survives more than 3 bars, exiting them prematurely. Bull +0.035 (1.16->1.19), sideways +0.073 (0.80->0.88, mild benefit from earlier stalling-winner exits), crash flat (-0.024 minor: bear shorts in crash legitimately make rolling new peaks during sustained down-moves). Mechanism fundamentally wrong for counter-trend regimes — the "stalling winner" criterion fires uniformly across "actual stall" and "normal counter-trend hold pattern". Reverting.
-	0.713	0.703	0.343	1.17	0.64	0.79	0.21	discard	MAE-progress freeze on scale-in (architectural new control flow at scale-in) — CATASTROPHIC composite -0.241 vs 83ffa0a 0.954, mean -0.157. Rally CRUSHED 0.85->0.21 (sharpe collapse): rally counter-trend bear positions sit at fresh MAE frequently during rally upward push (each up-bar refreshes the bear MAE), the freeze gate blocks scale-in growth so positions never reach full size before pullback reversal recovers them — capturing only fractional pullback gain. Bull +0.011 (mild benefit, fewer winning bull pullback false-MAEs grow size), crash -0.003 (flat: bear shorts in crash legitimately make new MAE during dead-cat-bounces but THEN reverse, freezing during bounce caps the bear position smaller for the genuine resume), sideways -0.011. Mechanism wrong-directional for counter-trend regimes — actively-making-MAE during scale-in is a NORMAL pattern for valid counter-trend entries that the gate cannot distinguish from genuine bad-entry losing scale-in.
-	0.950	0.860	0.186	1.16	0.64	0.80	0.84	discard	counter-trend-aware _pp_min reduction (architectural new cross-component data dep at exit) — composite -0.004 vs 83ffa0a 0.954 (LOC penalty drives drop), mean +0.0004 (essentially flat). All four per-regime scores within 0.005 of baseline. Mechanism activates only on counter-trend positions in strong trends |ret_long|>0.04, which is a narrow population — most positions are trend-aligned. Even where it fires, the 30% _pp_min reduction interacts with _profit_magnitude amplifier and _pm_trend_atten in counter-direction — small peak counter-trend positions get _pp_pressure activation slightly earlier but the giveback ratio normalization to peak/_pp_min cancels much of the timing change. Mean technically improved 0.0004 but composite improvement criterion fails (composite -0.004 from LOC overhead of 11 added lines). Reverting.
-	0.951	0.859	0.186	1.16	0.64	0.81	0.82	discard	position-direction-sign-aware _chop_amp (architectural new cross-component data dep at voter_bias) — composite -0.003 vs 83ffa0a 0.954, mean -0.001. Sideways +0.011 (PARTIAL confirmation of prior session hint — 0.80->0.811), rally -0.020 (0.844->0.824, regression), crash -0.001, bull flat. Mechanism works in intended direction (sideways gain) but RALLY counter-trend bears lose load-bearing _chop_amp when their position is opposite to ret_long sign — bull-side voter spikes during rally chop now over-fire opp_bias addition (since own-side subtraction no longer chop-amplified). The full _chop_amp 1.7x for counter-trend in chop was protecting rally bears from bull-spike noise; sign-decomposition reveals chop_amp is BILATERAL signal not trend-aligned only. Rally regression dominates the sideways gain. Mean fails keep criterion. Reverting.
-	0.491	0.477	0.346	0.93	0.00	0.64	0.34	discard	slope-confirmation requirement on _opp_gate (architectural new cross-component data dep at exit) — CATASTROPHIC composite -0.463 vs 83ffa0a 0.954, mean -0.383. Crash CRUSHED 0.64->0.00 (hard cutoff triggered): adding slope-confirmation requirement to opp_gate makes the gate FIRE TOO RARELY — losing positions in crash that should have been flipped at clear trend_avg<0 + bull voter spike (signal: bull leg recovering) now wait until BOTH trend_avg AND slope agree, holding through the adverse rebound. Bull -0.23 (1.16->0.93), sideways -0.16, rally -0.50 (0.84->0.34). Mechanism direction wrong — opp_gate is the FAST-REVERSE primitive; making it stricter delays reversals during regime-genuine flips. The slope requirement filters NOISE flips (good for rally counter-trend) but ALSO filters SIGNAL flips (bad for crash legitimate dead-cat bounces). Same transient-vs-real problem as other "stricter exit" experiments. Reverting.
