commit	score	mean_score	std_score	bull_2021	crash_bear	sideways	rally_2024	status	description
c2444b1c	0.748470	0.798940	0.168233	0.875904	0.731611	1.020733	0.567510	keep	BASELINE INTEGRITY RE-APPEND (v2.2 scoring). The prior 7a5e2422 keep (portfolio-DD-adaptive giveback tightening, +0.003 under v2.1) was LOST from HEAD: commit 4a29c702 reverted strategy.py to c2444b1c, dropping the keep code. HEAD strategy.py == c2444b1c (empty diff confirmed). Most recent session-summary declared baseline c2444b1c at v2.2 composite 0.748470. This row makes the baseline explicit. Per-regime v2.2: bull 0.875904 Sh1.882 DD4.18pct, crash 0.731611 Sh1.260 DD3.01pct, sideways 1.020733 Sh2.017 DD2.74pct, rally 0.567510 Sh1.350 DD7.58pct (weakest, just under 8pct dd_gate knee); all stab 1.0, all flip_streak 1.0, all raw==score. NEXT: re-apply the lost giveback tightening under v2.2 (DD reduction now doubly rewarded via dd_gate+calmar return_reward).
66a66b4f	0.751395	0.800735	0.164464	0.875809	0.726083	1.020733	0.580313	branch	BRANCH OPEN (trend-alignment-scoped giveback tightening). Exp1 = re-applied the LOST 7a5e2422 keep (portfolio-DD-adaptive giveback tightening, mag0.30 EMA span3) which commit 4a29c702 had reverted to c2444b1c. MEASURED vs baseline c2444b1c 0.748470: composite +0.002925 (0.751395 SUB-KEEP <0.003 by 0.000075), mean +0.001795, std -0.003769 (tighter), min_stability 0.819->0.801. PER-REGIME all stab 1.0 all flip 1.0 all raw==score all DD<10pct: bull 0.875904->0.875809 (-0.0001 flat DD4.18pct), crash 0.731611->0.726083 (-0.0055 REGRESSION -- Sh1.260->1.266 UP but score DOWN = pure return_reward/calmar loss: tightening harvests crash winners early -> APY down), sideways identical 1.020733, rally 0.567510->0.580313 (+0.0128 REAL GAIN -- DD7.58->7.34pct, Sh1.350->1.377, the doubly-rewarded DD reduction under v2.2). BRANCH JUSTIFICATION: (1) new arch = portfolio-DD-adaptive giveback tightening re-validated under v2.2; (2) crash regressed because tightening misfires on counter-trend bounce longs (crash is ~100pct bounce LONGS per prior sessions) -- bounce longs dont ride pullbacks so tightening cuts return with no DD relief; (3) FIX = scope tightening to TREND-ALIGNED positions (the actual pullback-riders / DD source) via smooth pos_dir*ret_vlong alignment factor, sparing counter-trend bounces -> crash recovers, rally keeps DD relief.
09f1557e	0.750840	0.800339	0.164995	0.875809	0.726083	1.020733	0.578730	branch	branch step2: scope giveback tightening to trend-aligned positions via smooth _pos_dir*ret_vlong/0.02 alignment factor. MEASURED vs step1 0.751395: composite -0.000555 (0.750840 NO-PROGRESS), mean -0.000396, std +0.000531. PER-REGIME: bull identical, crash BYTE-IDENTICAL 0.726083 (NO recovery -- alignment factor is ~1.0 for all binding crash trades => crash trades ARE trend-aligned, refutes the counter-trend-bounce-long assumption at the 96bar ret_vlong scale), sideways identical, rally 0.580313->0.578730 (-0.0016 -- scoping trimmed rally longs that are counter-trend during pullbacks). KEY DIAGNOSIS: rally tightening reduces DD (7.58->7.34, winners ride pullbacks) but crash tightening does NOT reduce DD (3.005->3.037 slightly UP -- crash DD comes from bad entries not winner giveback), so tightening only cuts crash return. Trend-alignment cannot distinguish these. Reverted to step1; next try magnitude UP (v2.2 doubly rewards DD reduction -> optimal mag shifts above v2.1s 0.30).
036e7c51	0.760841	0.807542	0.155669	0.875804	0.726867	1.020733	0.606763	branch	branch step3: raise tightening magnitude 0.30->0.40. MEASURED vs step1 0.751395: composite +0.009446 (0.760841 BIG PROGRESS), mean +0.006807, std -0.008795 (much tighter). vs BASELINE c2444b1c 0.748470: composite +0.012371 (KEEP criteria MET). PER-REGIME all flip 1.0 all DD<10pct: bull 0.875809->0.875804 (flat DD4.18pct), crash 0.726083->0.726867 (+0.0008 RECOVERED slightly -- crash loss did NOT grow with mag, refutes linear-crash-loss fear), sideways identical, rally 0.580313->0.606763 (+0.0264 -- DD7.34->6.80pct, Sh1.377->1.426, calmar+dd_gate double reward). min_stability 0.801->0.7997 (rally stab 0.799716 just below 0.80 knee -> factor 0.999, negligible penalty; raw_composite 0.761041 vs composite 0.760841). Hypothesis CONFIRMED: v2.2 double-DD-reward shifts optimal mag above v2.1s 0.30; rally gain asymmetrically exceeds crash loss. Probing mag 0.50 next (DD headroom: rally 6.80pct << 8pct knee) before declaring keep.
2ba4dde2	0.766305	0.807729	0.138081	0.875800	0.730161	0.993544	0.631413	branch	branch step4: raise tightening magnitude 0.40->0.50. MEASURED vs step3 0.760841: composite +0.005464 (0.766305 PROGRESS), mean +0.000187, std -0.017588 (much tighter -- std reduction drives most of the composite gain via -0.3*std). vs BASELINE c2444b1c 0.748470: composite +0.017835 (KEEP, stronger than step3). PER-REGIME all stab 1.0 (raw==composite, NO stability penalty -- min_stability recovered 0.7997->0.807 above knee) all flip 1.0 all DD<10pct: bull flat, crash 0.726867->0.730161 (+0.0033 RECOVERED near baseline 0.731611, Sh1.267->1.274), sideways 1.020733->0.993544 (-0.0272 NEW REGRESSION -- at mag0.50 tightening crossed a threshold affecting sideways exits; Sh2.017->1.964, DD2.738->2.751 flat so its a Sharpe/return loss not DD), rally 0.606763->0.631413 (+0.0247 -- DD6.80->6.36pct, Sh1.426->1.468). Gains decelerating (0.30->0.40 +0.0094, 0.40->0.50 +0.0055) + new sideways regression => near optimum. Probing 0.60 once; if no-progress revert to 0.50 keep.
cd2fffce	0.745385	0.780831	0.118155	0.875796	0.732100	0.904991	0.610439	branch	branch step5: raise tightening magnitude 0.50->0.60. MEASURED vs step4 0.766305: composite -0.020920 (0.745385 REGRESSION -- below even step3). mean -0.026898, std -0.019926 (tighter but mean collapsed). PER-REGIME: sideways 0.993544->0.904991 (-0.0886 BIG regression, Sh1.964->1.843 -- tightening now harvests sideways winners too early), rally 0.631413->0.610439 (-0.0210, stability cliffed 0.807->0.790 -> factor 0.967, raw 0.631575 vs final 0.610439 = stability penalty now biting), crash +0.0009, bull flat. CONCLUSION: mag0.60 is too aggressive -- return loss overtakes DD relief. Optimum is mag0.50 (step4). Reverting to step4 2ba4dde2 as KEEP. Trend confirmed: 0.30->0.40->0.50 progress, 0.60 sharp regression.
cf8442e1	0.766305	0.807729	0.138081	0.875800	0.730161	0.993544	0.631413	keep	KEEP (NEW BASELINE, SUPERSEDES c2444b1c 0.748470, +0.017835). Branch SUCCESS (portfolio-DD-adaptive giveback tightening, re-validated under v2.2 + magnitude retuned). Architectural: as portfolio draws down from peak, progressively TIGHTEN peak-profit giveback (harvest winners faster, lock gains) via continuous tanh on EMA-smoothed(span3) portfolio-DD fraction (leverage-coupled scale 0.012*LEVERAGE_K keeps activation DD-level invariant); magnitude PORT_DD_GIVEBACK_TIGHTEN=0.50 (v2.1s 0.30 was the prior 7a5e2422 keep, LOST from HEAD by commit 4a29c702; re-applied and retuned UP because v2.2 doubly rewards DD reduction via dd_gate + calmar return_reward). PER-REGIME v2.2 all stab 1.0 all flip 1.0 all raw==score all DD<10pct: bull 0.875904->0.875800 (flat, Sh1.882 DD4.18pct), crash 0.731611->0.730161 (-0.0014 near-flat, Sh1.260->1.274 DD3.04pct), sideways 1.020733->0.993544 (-0.0272, Sh2.017->1.964 DD2.75pct -- the one cost: at mag0.50 tightening crossed a threshold trimming sideways winners), rally 0.567510->0.631413 (+0.0639 the binding regime, Sh1.350->1.468 DD7.58->6.36pct -- DD relief doubly rewarded under v2.2). mean 0.798940->0.807729, std 0.168233->0.138081 (much tighter). Magnitude sweep: 0.30 +0.0029(sub-keep), 0.40 +0.0124, 0.50 +0.0178(KEEP), 0.60 -0.021(regression -- sideways collapsed + rally stability cliffed). 0.50 is the optimum.
-	-	-	-	-	-	-	-	session-summary	SESSION (v2.2 baseline c2444b1c 0.748470 -> NEW BASELINE cf8442e1 0.766305, +0.017835 KEEP): 1 keep (portfolio-DD-adaptive giveback tightening, re-validated under v2.2 + mag retuned 0.30->0.50) via 1 exploration branch (5 steps: step1 re-apply +0.0029 sub-keep, step2 trend-alignment-scope no-progress, step3 mag0.40 +0.0124, step4 mag0.50 +0.0178 KEEP, step5 mag0.60 regression reverted). User 2-arch-discard minimum: this session had 0 independent architectural discards (branch opened immediately on exp1 which was sub-keep +0.0029 with a strong rally signal) -- the branch ITSELF contained architectural work (5 architectural steps, 2 of which were discards: step2 no-progress + step5 regression). Baseline c2444b1c UNCHANGED-code was the true HEAD (prior 7a5e2422 keep was lost by commit 4a29c702; re-appended c2444b1c keep row for integrity). THEME: v2.2 scoring (calmar-based return_reward) doubly rewards DD reduction, which shifted the optimal giveback-tightening magnitude UP from v2.1s 0.30 to 0.50 and made the lost 7a5e2422 keep re-validate as a much bigger +0.0178. KEY MECHANISM INSIGHT (load-bearing for future): under v2.2, DD-reduction levers are worth ~2x their v2.1 value (dd_gate + calmar both improve); the rally regime (DD near the 8pct knee) is the highest-EV DD-reduction target. Magnitude 0.50 is a confirmed local optimum (0.60 cliffs rally stability below 0.80 knee + collapses sideways). CROSS-EXPERIMENT: trend-alignment scoping of the tightening (step2) is a DEAD END -- crash trades are trend-aligned (not counter-trend bounces as assumed), so scoping cannot spare crash; the crash regression at low mag is small and self-recovers by mag0.50.
91c4496a	0.776043	0.819489	0.144820	0.922090	0.730154	0.993544	0.632168	keep	Exp1 portfolio-DD-adaptive profit-target harvest relaxation. Weaken _ts_supp (trend-extension harvest suppression) by tanh(port_dd_frac/(0.012*LEVERAGE_K)) up to 0.60 so clean trend deep-peak winners get partially harvested during portfolio DD -> lock gains at peak -> cap DD. Byte-identical at portfolio peak (return cost isolated to DD episodes). DISTINCT exit path (tp size scale-down) from maxed giveback tightening. MEASURED vs cf8442e1 0.766305: composite +0.009738, mean +0.011760, std +0.006739. PER-REGIME: bull 0.875800->0.922090 (+0.046290, Sh 1.881990->1.933615, DD 4.181609->3.714888 -- the gain is bull's 2021 correction pullbacks now harvest-locked), crash 0.730161->0.730154 (-0.000007 byte-identical), sideways 0.993544->0.993544 (byte-identical), rally 0.631413->0.632168 (+0.000755, DD 6.360211 unchanged -- harvest did NOT fire on rally positions during DD; rally's peak-profit structure does not cross the deep-peak _ts_supp gate during its pullbacks, so the DD-cap lever did not engage rally's DD source). All stab 1.0, all flip_count 0, all MaxDD<10pct, no 50pct gate breach. KEEP: composite +0.009738>=+0.003, mean improved, all gates pass. CORRELATION (not causal claim): the gain localized to bull (DD episodes from sharp corrections) not rally (DD episodes from grinding pullbacks) -- the tp-harvest relaxation engages regimes whose winners hit deep clean peaks during DD, which bull's spiky corrections produce and rally's grind does not.
7f5790d5	0.776230	0.819708	0.144926	0.922865	0.730154	0.993544	0.632269	discard	Exp2 portfolio-DD-adaptive burst counter-trend entry shrink amplification. Deepen _churn_ct_atten shrink (0.20->up to 0.35) via tanh(port_dd_frac_top/(0.012*LEVERAGE_K)) so ct re-entries during rally pullback bursts are smaller during DD. Hoisted top-level _port_dd_frac_top for entry-branch access. MEASURED vs 91c4496a 0.776043: composite +0.000187 (SUB-NOISE <0.003), mean +0.000219. PER-REGIME: bull 0.922090->0.922865 (+0.000775), rally 0.632168->0.632269 (+0.000101, DD 6.360211->6.356832 UNCHANGED), crash/sideways byte-identical. HYPOTHESIS DISPROVEN: rally DD did NOT drop -- the burst-ct shorts are NOT the primary rally DD source (giveback tightening already maxed handles the long-giveback DD source; ct-shrink amplification during DD is inert on the target). All stab 1.0, all MaxDD<10pct. DISCARD: sub-noise + mechanism inert on binding constraint. CORRELATION: the ct-shrink lever moves bull slightly (bull has DD-episode ct entries) but not rally.
ba68c3ca	0.693844	0.743959	0.167048	0.638371	0.749714	1.012341	0.575409	discard	Exp3 cross-symbol breadth-confirmation hold term on exit fusion. For trend-aligned in-profit positions, subtract exit pressure (-0.15) when broad market (BTC 96-bar + partner alt 20-bar) confirms position direction. NEW cross-symbol data dep on exits. MEASURED vs 91c4496a 0.776043: composite -0.082199 (CATASTROPHIC), mean -0.075530, std +0.022130. PER-REGIME: bull 0.922090->0.638371 (-0.283719, Sh 1.933615->1.377304, DD 3.714888->4.802521), rally 0.632168->0.575409 (-0.056759, Sh 1.470015->1.367414, DD 6.360211->7.461138 WORSE -- opposite of hypothesis), crash 0.730154->0.749714 (+0.019560), sideways 0.993544->1.012341 (+0.018797). HYPOTHESIS DISPROVEN: holding winners longer when broad market confirms INCREASED DD (bull +1.09pct, rally +1.10pct). The 96-bar BTC trend LAGS real corrections -> breadth stays 'confirmed' into the early correction -> profit-gate does not release in time (positions remain in profit through early correction then give back MORE) -> bigger DD. The giveback-tightening-can't-distinguish-noise-vs-correction premise was wrong: holding-noise-pullbacks is NOT net beneficial because the lagging breadth signal cannot tell noise from correction onset. All stab 1.0, all MaxDD<10pct (max rally 7.46pct), no 50pct gate breach (bull -31pct, rally -9pct). DISCARD: composite -0.082, mechanism unsound (lagging breadth holds into corrections). CROSS-EXPERIMENT: confirms the walled held-position de-risk lesson family -- any 'hold winners longer' lever raises DD because exit signals (slope/giveback) are the CORRECT early cut and overriding them with a slower confirmation signal delays the cut.
923826bf	0.680276	0.729064	0.162627	0.566615	0.729712	0.992051	0.627877	discard	Exp4 portfolio-DD-adaptive tp-harvest MAGNITUDE amplification. Deepens Exp1-keep: amplify harvest magnitude 0.30->up to 0.45 via tanh(port_dd_frac/(0.012*LEVERAGE_K)) during deep DD. Byte-identical at portfolio peak. MEASURED vs 91c4496a 0.776043: composite -0.095767 (CATASTROPHIC), mean -0.090425, std +0.017700. PER-REGIME: bull 0.922090->0.566615 (-0.355475, raw_score 0.682766, stability_factor 1.0->0.829882 COLLAPSED below 0.80 knee -- the amplified harvest amount became noise-sensitive -> exit-timing noise -> stability penalty, AND raw dropped from over-harvesting), rally 0.632168->0.627877 (-0.004291, stability 1.0->0.993857 slightly penalized, DD 6.36 unchanged -- tp-harvest still does not engage rally grind), crash/sideways near-identical. CONFIRMS: Exp1's 0.30 tp-harvest magnitude is the LOCAL OPTIMUM (amplifying to 0.45 cliffs bull stability -- the SAME cliff pattern as giveback-tightening 0.60 cliffing rally). Both DD-reduction levers now confirmed maxed: giveback-tolerance mag 0.50, tp-harvest mag 0.30. All MaxDD<10pct (max rally 6.36), no 50pct gate breach (bull -39pct). DISCARD: composite -0.096, over-harvest + stability collapse. CROSS-EXPERIMENT CONCLUSION: the DD-reduction subspace is SATURATED -- both validated DD levers (giveback tightening, tp-harvest) sit at confirmed magnitude cliffs; 'hold winners longer' backfires (exp3); ct-shrink is inert on rally DD (exp2). rally DD (6.36pct) appears at its reachable floor under the current exit architecture.
-	-	-	-	-	-	-	-	session-summary	SESSION (v2.2 baseline cf8442e1 0.766305 -> NEW BASELINE 91c4496a 0.776043, +0.009738 KEEP): 1 keep via 4 architectural experiments (exp1 keep, exp2/exp3/exp4 discards). KEEP = portfolio-DD-adaptive profit-target harvest relaxation: weaken _ts_supp (trend-extension harvest suppression) by tanh(port_dd_frac/(0.012*LEVERAGE_K)) up to 0.60 during portfolio DD so clean-trend deep-peak winners get partially harvested at peak -> lock gains -> cap DD. Byte-identical at portfolio peak (return cost isolated to DD episodes). DISTINCT exit path (tp size scale-down) from maxed giveback tightening. Gain localized to BULL (+0.0463, DD 4.18->3.71, Sh 1.882->1.934 -- bull's spiky 2021-correction pullbacks produce deep clean peaks during DD that the tp-harvest engages); rally +0.0008 (DD UNCHANGED 6.36 -- tp-harvest does NOT engage rally's grinding pullbacks because rally positions exit via the giveback path before reaching the deep-peak condition); crash/sideways byte-identical. WALLS CONFIRMED THIS SESSION: (1) DD-reduction subspace SATURATED -- giveback-tightening mag 0.50 (prior session) AND tp-harvest mag 0.30 (exp4 cliff: 0.30->0.45 collapsed bull stability 1.0->0.830 + raw drop, SAME cliff pattern as giveback 0.60->rally) both sit at confirmed magnitude local optima; (2) 'hold winners longer' BACKFIRES (exp3 cross-symbol breadth-hold, -0.082): lagging 96-bar breadth signal holds winners into corrections -> DD UP (bull 3.71->4.80, rally 6.36->7.46) -- exit signals (slope/giveback) are the CORRECT early cut, overriding them with a slower confirmation signal delays the cut; (3) ct-shrink INERT on rally DD (exp2, +0.000187 sub-noise): burst counter-trend shorts are NOT rally's primary DD source (giveback tightening already handles the long-giveback DD). CROSS-EXPERIMENT CONCLUSION: rally DD (6.36pct) is at its reachable floor under the current exit architecture; the giveback-tightening-can't-distinguish-noise-vs-correction premise (exp3) was WRONG -- holding noise pullbacks is not net-beneficial because lagging signals cannot detect correction onset. KEY MECHANISM INSIGHT (load-bearing for future): under v2.2, DD reduction via HARVESTING/locking (tp-harvest, giveback tightening) WORKS; DD reduction via HOLDING LONGER (overriding exit signals) BACKFIRES. Both harvest levers are now at magnitude cliffs. rally (0.632, Sh 1.468, DD 6.36, calmar 3.39) remains binding; crash (0.730, Sh 1.274, DD 3.04, AnnRet 15.16pct) is the second binding regime and is RETURN-LIMITED (low DD headroom but raising it needs genuine signal improvement -- leverage farming is walled under v2.2 calmar, hold/sizing tuning is parameter-saturated). NEXT SESSION: the DD-reduction subspace is exhausted; consider the RETURN side (crash Sharpe via signal-quality improvement, NOT leverage/sizing) or a structural-exploration subsystem rewrite of the exit-fusion / voter-aggregation (only if a non-reverting core-mechanism replacement is identifiable). User 2-arch-discard minimum met (3 architectural discards).
8182b9a5	0.776043	0.819489	0.144820	0.922090	0.730154	0.993544	0.632168	discard	Exp1 counter-trend stop-loss tightening (trend-alignment-aware ATR stop). Tighten _stop_abs for ct positions (crash dead-cat longs, rally pullback shorts) via fast-saturating tanh on ret_vlong*pos_dir /0.01; trend-aligned byte-identical. BYTE-IDENTICAL to baseline 91c4496a 0.776043: all 4 regimes unchanged (bull 0.92209, crash 0.73015, sideways 0.99354, rally 0.63217), all stab 1.0, crash DD 3.04pct, rally DD 6.36pct. The ct-stop-tightening touched ZERO trades -- ct losers exit via slope/time/giveback/opp-gate BEFORE reaching the ATR stop band, so the stop is not binding on the losing trades. STRUCTURAL FINDING: stop-loss subspace INERT on the binding regimes (stop rarely reached); loss-cutting levers must target the slope/time/giveback exit paths, not the stop. Return-side signal-quality lever, NOT sizing/DD-reduction, but no-op because the stop is not the binding exit. Discard.
ea5bee06	0.776043	0.819489	0.144820	0.922090	0.730154	0.993544	0.632168	discard	Exp2 counter-trend slope-against exit threshold cut. Lower _sl_slope_pressure activation threshold for ct positions (crash dead-cat longs, rally pullback shorts) via fast-saturating tanh on ret_vlong*pos_dir /0.01; trend-aligned byte-identical. BYTE-IDENTICAL to baseline 91c4496a 0.776043: all 4 regimes unchanged (bull 0.92209, crash 0.73015, sideways 0.99354, rally 0.63217), all stab 1.0, crash DD 3.04pct, rally DD 6.36pct. TOUCHED ZERO TRADES. CROSS-EXPERIMENT (exp1+exp2): BOTH the ATR stop (exp1) AND the slope-against threshold (exp2) are NON-BINDING for ct losers -- ct positions exit via time/giveback/opp-gate/de-risk BEFORE slope-against pressure or the stop becomes the dominant exit source. The slope and stop exit paths are inert on the binding regimes' ct losers; loss-cutting must target the time/giveback/opp-gate/de-risk paths (which prior sessions saturated on the DD-adaptive side). Return-side signal-quality lever but no-op. Discard.
b5d59fd1	0.776922	0.820090	0.143893	0.922058	0.730154	0.993326	0.634821	branch:open	Exp3 REMOVE 2 mixed-cell partner-volume entry boosts (Exp8 BTC-vol x partner-price, Exp9 partner-vol x BTC-price). Their own comments flagged them as redundant with Exp1(BTC-vol)xExp2(partner-lead) which already multiply. MEASURED vs baseline 91c4496a 0.776043: composite +0.000879 (0.776922, SUB-NOISE below +0.003 keep threshold), mean +0.000601, std -0.000927. PER-REGIME: rally 0.632168->0.634821 (+0.002653 BINDING-REGIME GAIN, DD 6.36->6.24pct -- removing the redundant over-commit HELPED the binding regime), bull 0.922090->0.922058 (-0.000032 negligible), sideways 0.993544->0.993326 (-0.000218 negligible), crash byte-identical 0.730154. All stab 1.0, all MaxDD<10pct. SIGNAL: the mixed-cell boosts were net-HARMFUL (redundant over-commit on alt entries hurt rally). OPEN EXPLORATION BRANCH: systematically remove more redundant deep-saturated entry boosts (the {own,BTC,partner}x{vol,price,DVP} grid has 4+ mixed/edge cells beyond the 5 clean 2-way keeps) to simplify + help the binding regime. Justification: (1) new architecture = entry-boost-grid PRUNING (remove, not add); (2) no regime regressed >50pct (all within 0.001); (3) hypothesis: more mixed/edge cells are redundant-harmful -> removing them stacks rally gains toward the +0.003 keep threshold.
