commit	score	mean_score	std_score	bull_2021	crash_bear	sideways	rally_2024	status	description
6d6a9f37	0.605342	0.633797	0.094848	0.699048	0.575486	0.749286	0.511367	discard	Exp1 (architectural, indep): VOLUME-WEIGHTED (WLS) slope-confirmation on the de-risk cushion, replacing equal-weight 12/16/22 mean _exit_slope. NEW computation + data dep at cushion gate: volume-weighted OLS slope (weights=bar volume, multi-window 12/16/22 mean, /0.0004 scale). Mechanism: participation-weighted trend slope emphasizes high-volume continuation bars (volume NOT perturbed by AR(1) test -> weights noise-stable); crash 100%-WR shorts ride volume-backed down-move -> stronger cushion -> more return; bull corrections weaken faster on participation-weighted slope -> protects bull. MEASURED vs cabfb6f1 0.605307: composite +0.000035 (0.605342) SUB-NOISE, mean +0.000049. PER-REGIME: bull 0.699048 BYTE-IDENTICAL (Sh1.864, AnnRet 4.732), crash 0.575486 BYTE-IDENTICAL (Sh1.264, AnnRet 3.176 UNCHANGED -> return-seeking mechanism did NOT fire), sideways +0.000175 (0.749286), rally +0.000021 (0.511367). All stab 1.0, all MaxDD<10pct. NEAR-INERT: the cushion slope_conf is already near-saturation where it fires; volume-weighting rarely changes the gate decision (equal-weight and VW slope agree on the binary-ish tanh(/0.0004) saturation). Not branch-eligible (inert, no regime signal). Architectural discard #1. Observation (correlation only): cushion slope_conf rarely the binding exit decision.
b928b41f	0.561770	0.590200	0.094765	0.525192	0.575134	0.749111	0.511361	discard	Exp2 (architectural simplification): REMOVED vol-expansion exit pressure _ve_pressure (5th soft source, profit-side vol-of-price expansion gain-lock). Redundancy hypothesis (extends row-905 inert finding to profit side): under vol expansion on a winner, slope-against giveback fires same bar and dominates MAX. MEASURED vs cabfb6f1 0.605307: composite -0.043533 (0.561770), mean -0.043548. PER-REGIME: bull 0.699048->0.525192 (-0.173856, Sh1.864->1.414, AnnRet 4.732->3.380, MaxDD 0.896 unchanged) CRUSHED; crash 0.575486->0.575134 (-0.000352, Sh1.264->1.263); sideways BYTE-IDENTICAL 0.749111; rally BYTE-IDENTICAL 0.511361 (Sh1.300, AnnRet 3.890->3.902). All stab 1.0, all MaxDD<10pct. CONCLUSION (directly measured): _ve_pressure is LOAD-BEARING for BULL specifically -- bull 2021's high-vol sharp corrections need the vol-expansion gain-lock to exit winners before the giveback deepens; slope/pp alone lag the vol spike in bull. sideways/rally/crash unaffected (slope/pp dominate there, _ve sub-dominant). 50pct gate: bull 0.525/0.699=75pct (passes gate) but mean regressed -> discard. Not branch-eligible (removal, bull regression, no positive signal). Architectural discard #2.
f5cd1b82	0.572389	0.590819	0.061432	0.609957	0.595830	0.663635	0.493855	branch	BRANCH OPEN (vol-stability winner-hold extension). Exp3 architectural indep: return-seeking lever -- extend _max_hold up to +3 bars for trend-aligned WINNING positions when vol-of-vol is STABLE (vol_6/vol_18 near 1, no expansion). NEW data dep at time-pressure decision: max_hold depends on vol-stability x ret_vlong-trend-align x winning. Mechanism: sustained stable-vol trend (crash 2022 grind, rally 2024 grind) -> ride winner longer -> more return; vol expansion (bull corrections, where _ve is load-bearing) blocks extension. MEASURED vs cabfb6f1 0.605307: composite -0.032918 (0.572389), mean -0.042929. PER-REGIME: crash 0.575486->0.595830 (+0.020344, Sh1.264->1.328, AnnRet 3.176->3.357) RETURN-SEEKING WORKED; bull 0.699048->0.609957 (-0.089091, Sh1.864->1.523, MaxDD 0.896->1.330) stable stretches extended into corrections; sideways 0.749111->0.663635 (-0.085476, Sh2.025->1.854, MaxDD 0.553->0.664); rally 0.511346->0.493855 (-0.017491, stab 1.0->0.987). All MaxDD<10pct. BRANCH JUSTIFICATION: crash +0.020 with Sharpe lift is a real return-seeking signal; regressions are gate-too-permissive (fires on bull/sideways stable stretches). Fix: tighten gate to DEEP trend only (/0.02->/0.04) + require persistent slope conf so pre-correction stable stretches (slope weakening) dont extend.
2c18b7f3	0.578533	0.596430	0.059657	0.609957	0.595397	0.673771	0.506597	branch	branch step2: tighten vol-stability hold ext gate (DEEP trend /0.02->/0.04 + persistent multi-window slope-conf). MEASURED vs step1 0.572389: composite +0.006144 (0.578533), mean +0.005611. PER-REGIME: bull 0.609957 UNCHANGED (slope-conf did NOT protect bull -- stable stretches still have confirming slope, held into corrections); crash 0.595830->0.595397 (-0.000433, still +0.020 vs baseline); sideways 0.663635->0.673771 (+0.010136, Sh1.854->1.864 recovering); rally 0.493855->0.506597 (+0.012742, stab 0.987->1.000 FIXED). Progress: sideways+rally recovered; bull still -0.089 (the drag). vs baseline 0.605307 still -0.026774. Bull landmine: 2021 deep uptrend + stable-vol stretches + confirming slope = gate fires, holds into sharp V-corrections. Need vol-LEVEL gate (bull high-vol regime) to spare bull.
b9c152f0	0.586572	0.610579	0.080023	0.609037	0.595397	0.731284	0.506597	branch	branch step3: add vol-LEVEL calm gate (full ext at vol_ratio<0.9, zero by ~1.2). MEASURED vs step2 0.578533: composite +0.008039 (0.586572), mean +0.014149. PER-REGIME: bull 0.609957->0.609037 (-0.000920, UNCHANGED -- calm gate did NOT spare bull; bull stable stretches are locally calm so vol_ratio<0.9 passes); crash 0.595397 unchanged (+0.020 vs baseline); sideways 0.673771->0.731284 (+0.057513, Sh1.864->2.013 RECOVERED to baseline); rally 0.506597 unchanged (stab 1.0). Progress: sideways fully recovered, rally stable. vs baseline 0.605307: -0.018735. SOLE drag = bull -0.090 (Sh1.864->1.520, MaxDD 0.90->1.33). Bull landmine persists: 2021 deep uptrend stable stretches get extended into sharp V-corrections; no point-in-time gate (deep-trend/slope-conf/vol-stable/calm) distinguishes bull-stable-stretches from crash-sustained-grind. Path to keep: fix bull (recover to 0.699) keeping crash +0.020 -> mean +0.005 -> composite ~+0.004.
7c6fd557	0.606968	0.633523	0.088518	0.690629	0.597091	0.738381	0.507992	branch	branch step4: HUMP-shaped winning gate (replaces monotone tanh). Rises 0->1 by 0.5*stop, fades to 0 by 2.5*stop -- only modest-to-moderate winners extended; deep-profit extended tops (bull V-correction-imminent) get no extension. MEASURED vs step3 0.586572: composite +0.020396 (0.606968), mean +0.022944. PER-REGIME: bull 0.609037->0.690629 (+0.081592, Sh1.520->1.830, MaxDD 1.33->0.895 RECOVERED) -- hump gate FIXED the bull landmine; crash 0.595397->0.597091 (+0.001694, Sh1.326->1.332, +0.022 vs baseline HELD); sideways 0.731284->0.738381 (+0.007097, Sh2.013); rally 0.506597->0.507992 (+0.001395). vs baseline 0.605307: composite +0.001661 (ABOVE baseline), mean -0.000225 (FLAT, just below). std 0.0948->0.0885 IMPROVED (crash rose -> less spread). NOT YET KEEP: composite +0.0017 < +0.003 threshold AND mean not improved. Small residual regressions: bull -0.008, sideways -0.011, rally -0.003 offset crash +0.022. Next: tighten alignment gate to fully spare bull/sideways/rally.
71d9e6eb	0.606401	0.632935	0.088445	0.690629	0.593406	0.738381	0.509322	branch	branch step5: tighten alignment /0.04->/0.06. MEASURED vs step4 0.606968: composite -0.000567 (0.606401) NO-PROGRESS. crash 0.597091->0.593406 (-0.003685, Sh1.332->1.320 LOST gain); bull/sideways UNCHANGED (tighter gate did not spare them further); rally +0.0013. Tighter gate hurt crash more than helped. Revert next.
482c6e4e	0.412310	0.491659	0.264498	0.693979	0.058517	0.718091	0.496051	branch	branch step6: revert /0.06->/0.04, raise magnitude +3->+5. MEASURED vs step4: composite -0.194658 (0.412310) CATASTROPHIC. crash stability COLLAPSED 1.0->0.104 (raw 0.561 Sh1.409 AnnRet4.09 -- raw GOOD but longer holds -> position-value wobble -> stability crash); rally stab 1.0->0.978. STABILITY WALL: crash hold length bounded by stability sensitivity, +5 too aggressive. Revert to +3.
291bcb2e	0.604536	0.631085	0.088499	0.689387	0.589690	0.736809	0.508455	branch	branch step7: revert +5->+3, narrow hump band (/0.5->/0.35, fade 1.5->1.0). MEASURED vs step4: composite -0.002432 (0.604536) NO-PROGRESS. crash 0.597->0.5897 (-0.0074, narrower band excluded crash winners); bull/sideways ~unchanged. Narrower hump hurt crash. Step4 (wide hump) is the optimum.
918b6714	0.604429	0.631114	0.088950	0.689387	0.587365	0.738381	0.509324	branch	branch step8: revert hump to wide (step4), magnitude +3->+2. MEASURED vs step4: composite -0.002539 (0.604429) NO-PROGRESS. crash 0.597->0.587 (-0.0098, Sh1.332->1.301 LOST gain); bull/sideways UNCHANGED (bleed did NOT reduce). KEY FINDING: bull/sideways bleed is a FIXED gate-firing effect (independent of magnitude) -- the extension firing AT ALL causes the small bleed; magnitude only scales crash gain. So +3 maximizes crash gain for fixed bleed cost = step4 is the peak. Branch STAGNATED at step4 +0.0017 (4 no-progress steps: 5,6,7,8).
-	-	-	-	-	-	-	-	discard	BRANCH SUMMARY (vol-stability winner-hold extension): REVERTED. Opened after Exp3 showed crash +0.020 (Sh1.264->1.328) return-seeking signal. 8 branch steps. Mechanism: extend _max_hold for trend-aligned WINNING positions when vol-of-vol stable (vol_6/vol_18~1) + deep multi-day trend + slope-confirming + calm (low vol_ratio) + hump-shaped profit gate (modest winners only, fade deep-profit extended tops). The hump gate (step4) FIXED the bull landmine (bull 0.609->0.691 recovered) by not extending deep-profit winners near V-correction tops. PEAK = step4: composite 0.606968 (+0.001661 vs baseline 0.605307), mean 0.633523 (FLAT -0.000225), std 0.0948->0.0885 improved. PER-REGIME step4 vs baseline: crash +0.0216 (Sh1.264->1.332, AnnRet 3.176->3.367 RETURN-SEEKING VERIFIED), bull -0.0084 (Sh1.864->1.830), sideways -0.0107 (Sh2.025->2.012), rally -0.0034. NOT A KEEP: composite +0.0017 < +0.003 threshold AND mean flat (crash +0.022 exactly offset by fixed bull/sideways/rally bleed -0.022). WALLS HIT: (1) STABILITY WALL at +5 magnitude (crash stability 1.0->0.104 -- hold length bounded by crash position-value variance sensitivity, +3 is the max); (2) FIXED-BLEED WALL -- bull/sideways bleed is a gate-FIRING effect independent of magnitude (reducing +3->+2 cut crash gain but NOT bleed), so +3 maximizes crash gain for fixed bleed = step4 optimum; (3) gate-tightening (/0.04->/0.06) and hump-narrowing both hurt crash more than they spared bleed. Cross-experiment: crash return-seeking via longer winner holds is REAL (Sharpe lift verified) but bounded -- the +0.022 single-regime gain cannot clear +0.003 composite when offset by fixed gate-firing bleed on bull/sideways and bounded by crash stability. Reverted to cabfb6f1.
-	-	-	-	-	-	-	-	session-summary	SESSION (v2.1 baseline cabfb6f1 0.605307): 0 keeps + 2 architectural discards (Exp1 VW cushion slope near-inert, Exp2 remove _ve_pressure crushed bull -0.174) + 1 exploration branch (vol-stability winner-hold extension, 8 steps, REVERTED). Baseline UNCHANGED cabfb6f1 0.605307 [bull 0.699048 Sh1.864, crash 0.575486 Sh1.264, sideways 0.749111 Sh2.025, rally 0.511346 Sh1.300 MaxDD1.57; all stab 1.0, all flip 1.0, all MaxDD<10pct]. THEME: return-seeking (v2.1 scoring opened DD headroom); targeted crash (100pct WR, AnnRet 3.2pct, DD 0.65pct = largest headroom) via longer winner holds. EXP1 (VW slope on de-risk cushion): near-inert (+0.000035) -- cushion slope_conf already near-saturation, VW weighting rarely changes the gate. EXP2 (remove _ve_pressure): bull CRUSHED -0.174 (Sh1.864->1.41) -- DIRECTLY MEASURED that _ve_pressure is LOAD-BEARING for BULL specifically (2021 high-vol V-corrections need vol-expansion gain-lock); crash/sideways/rally unaffected (slope/pp dominate there). BRANCH (vol-stability winner-hold ext): crash return-seeking WORKED (crash +0.022, Sh1.264->1.332 VERIFIED) but stagnated at +0.0017 composite (below +0.003 keep, mean flat). Hump gate fixed bull landmine (step4). Walls: stability at +5 mag (crash stab 1.0->0.104); fixed gate-firing bleed independent of magnitude. Cross-experiment CONCLUSION (measured): crash return is bounded by hold-length stability sensitivity; the single-regime +0.022 cannot clear +0.003 when offset by fixed bull/sideways bleed. EXIT RULE: branch reverted -> session ends (2 arch discards + 1 reverted branch).
6f5e6bf5	0.601982	0.631359	0.097924	0.699048	0.575486	0.749111	0.501792	discard	Exp1 direction-gated bear-in-downtrend winner-hold extension (architectural, new exit-timing control flow: extend _max_hold for winning BEAR shorts in sustained multi-day downtrend + ongoing slope_conf). MEASURED vs cabfb6f1 0.605307: composite -0.003325 (0.601982), mean -0.002389, std +0.003122. PER-REGIME: bull BYTE-IDENTICAL 0.699048 (gate correctly off in uptrend), crash BYTE-IDENTICAL 0.575486 (Sh1.263849 unchanged -- extension had NO effect on crash: crash positions exit via slope-against/peak-profit/stop BEFORE time_pressure onset, so delaying _max_hold does nothing; the prior branch crash +0.022 gain must have come from a different mechanism combination, not pure max_hold extension), sideways BYTE-IDENTICAL 0.749111, rally 0.511346->0.501792 (-0.009554, Sh1.300->1.266 REGRESSED). Rally regression: ret_vlong (96-bar) dips negative during rally pullbacks -> _bear_dt fires on winning rally CT bears -> extends them into reversal -> bigger losses (rally CT shorts are the documented losing-trade drag). Hypothesis DISPROVEN on two fronts: (1) crash does not benefit from max_hold extension (exits via other pressures first), (2) ret_vlong is not cleanly negative only in crash -- dips negative in rally pullbacks, re-creating the fixed-bleed landmine the direction gate was meant to avoid. No regime improved -> not branch-eligible. Reverted to cabfb6f1.
5787a12d	0.598565	0.626785	0.094067	0.678135	0.574861	0.749672	0.504472	discard	Exp2 entry-conviction-margin scale-in pace modulation (architectural, new cross-component data dep: scale-in pace depends on entry-time conviction margin, trend-gated). MEASURED vs cabfb6f1 0.605307: composite -0.006742 (0.598565), mean -0.006963, std -0.000735. PER-REGIME: bull 0.699048->0.678135 (-0.020913, Sh1.864->1.779, MaxDD 0.895->0.969 REGRESSED), crash 0.575486->0.574861 (-0.000625 ~unchanged Sh1.264->1.262), sideways 0.749111->0.749672 (+0.000561 SUB-NOISE, Sh2.025->2.028), rally 0.511346->0.504472 (-0.006874, Sh1.300->1.276 REGRESSED). Hypothesis DISPROVEN: faster scale-in for high-conviction trend entries = larger early exposure BEFORE V-corrections (bull) and pullback reversals (rally) -> bigger losses on the entries that reverse. The trend-gate did NOT spare bull/rally (their decisive entries ARE trend-strong). Sideways sub-noise gain (chop entries scaled slower) is below +0.003 and not a branchable signal (mechanism backfires on the 2 trend regimes that dominate composite). No regime improved meaningfully -> not branch-eligible. Reverted to cabfb6f1.
4636c5d3	0.605307	0.633748	0.094802	0.699048	0.575486	0.749111	0.511346	discard	Exp3 range-breakdown exit pressure (architectural, new 8th soft source in MAX fusion: 20-bar Donchian range-break against position, profit-side only, ATR-scaled). MEASURED vs cabfb6f1 0.605307: BYTE-IDENTICAL (composite +0.000000, all 4 regimes byte-identical: bull 0.699048 Sh1.863940, crash 0.575486 Sh1.263849, sideways 0.749111 Sh2.024898, rally 0.511346 Sh1.300294). Mechanism INERT: the gate (max(0,_pnl_scale) profit-side AND break >0.5 ATR beyond 20-bar range) rarely fires, and when it does the existing 7 soft sources (slope/pp/time/ve/ar/vc) already dominate the MAX -> adding _rb_pressure does not change max(_soft_terms). No regime improved (no signal), no regression (mechanism never activates) -> not branch-eligible (nothing to iterate: a firing range-break would require loosening the profit+0.5ATR gate, which the Exp1/Exp2 lesson shows backfires on trend regimes, and the existing slope/pp/sl already capture range-break reversals). Reverted to cabfb6f1. 3rd consecutive architectural discard.
0ddff35d	0.605275	0.633707	0.094773	0.698883	0.575486	0.749111	0.511346	branch	BRANCH OPEN (deep-downtrend bear size boost sustain): step1 = first-bar-only deep-downtrend bear entry size boost (+0.10, /0.03 deep gate, bear-only). MEASURED vs cabfb6f1 0.605307: composite -0.000032 (0.605275, sub-noise), mean -0.000041. PER-REGIME: crash BYTE-IDENTICAL 0.575486 (Sh1.263849, AnnRet 3.176261 UNCHANGED -- the boost does NOT affect crash return), sideways BYTE-IDENTICAL, rally BYTE-IDENTICAL (deep gate correctly excludes rally pullbacks -- no Exp1 landmine), bull 0.699048->0.698883 (-0.000165 sub-noise, Sh1.863940->1.863344 -- _deep_dt_boost_bull=1.0 constant so this is noise-floor variance, not a mechanism effect). KEY STRUCTURAL FINDING: the boost is FIRST-BAR-ONLY (multiplied into entry target only); scale-in then ramps full_target = size*_conc_held*_vol_held (line 1545) which does NOT include the boost -> the first-bar boost is REVERTED by scale-in over bars 2-3. For crash trades held many bars, bar-1 size is negligible to total PnL -> byte-identical crash. The deep gate FIRES (crash is a deep multi-month downtrend, ret_vlong solidly < -0.03) but the boost cannot affect return while it is first-bar-only. BRANCH HYPOTHESIS: sustain the boost through scale-in (cache _deep_dt_boost at entry like _conc_shrink_held, apply to full_target) -> crash 100% WR + DD 0.65% headroom means over-committing winning shorts is return-positive (return_reward rewards APY; dd_gate flat below 8%). The 'sustaining boosts hurts' lesson was about trend-long regimes (rally/bull reversals); crash 100%-WR is the case where sustaining a deep-downtrend boost should help. Gate is crash-specific via deep-downtrend (excludes rally pullbacks) so bull/rally/sideways stay byte-identical. Opening branch to test sustain.
-	-	-	-	-	-	-	-	discard	BRANCH SUMMARY (deep-downtrend bear size boost + sustain): REVERTED. Opened after Exp4 (first-bar deep-downtrend bear boost) showed crash byte-identical. 2 branch steps (step1 first-bar boost, step2 sustain-through-scale-in), BOTH byte-identical on crash (+0.50 magnitude probe ALSO byte-identical -> gate never fires on crash entries). DEBUG INSTRUMENTATION (direct Strategy.run on crash regime) DISPROVED THE BRANCH PREMISE ON TWO FRONTS: (1) DIRECTION: crash has 0 BEAR entries -- all 52 crash trades are BULL (long) entries on dead-cat bounces, 100% WR (the prior mental model "crash winners are bear shorts" was WRONG; crash return comes from bounce LONGS). A bear-only boost cannot affect a regime traded entirely with longs. (2) SHARPE SCALE-INVARIANCE: position size is scale-invariant for Sharpe (return and vol both scale with size -> Sharpe unchanged); bigger positions only raise return_reward (the small APY factor 0.693-0.81), not signal_quality=log(1+Sharpe) which dominates the score. So return-seeking via SIZE boosts is structurally limited regardless of direction -- return must come from HOLD-TIMING (return/vol ratio = Sharpe), which the prior vol-stability winner-hold branch already exhausted (stability wall at +5, fixed bleed, stagnated +0.0017). DEEP-DOWNTREND GATE NON-CO-OCCURRENCE: crash ret_vlong is < -0.03 on 37.8% of bars (mean -0.0176), but bear entries (if any) fire on short-term downward momentum which does NOT coincide with the lagging 96-bar deep-downtrend state -> a deep-downtrend ENTRY gate structurally cannot align with entries. Reverted to cabfb6f1. CROSS-SESSION CONCLUSIONS (measured): (a) crash is traded 100% with bounce LONGS (100% WR), not bear shorts -- future crash-return experiments must target the LONG side or hold-timing, not bear sizing; (b) size boosts are Sharpe-scale-invariant -> only return_reward (tiny) gains, NOT a viable return-seeking lever -- return-seeking requires hold-timing (Sharpe) changes, already exhausted; (c) deep-downtrend (96-bar ret_vlong) ENTRY gates do not co-occur with entries (lagging context vs short-term entry triggers). Baseline cabfb6f1 0.605307 unchanged.
