commit	score	mean_score	std_score	bull_2021	crash_bear	sideways	rally_2024	status	description
de412448-session-summary	0.6393	0.7454	0.2120	0.78	0.77	1.01	0.42	session-summary	SESSION: 2 independent architectural discards + 1 exploration branch (5 steps, REVERTED). Baseline de412448 UNCHANGED 0.6393 [bull 0.781251 Sh1.556, crash 0.767586 Sh1.311, sideways 1.013297 Sh1.941, rally 0.419353 Sh0.736 stab0.8008; all factors 1.0]; strategy.py verified byte-identical (reproduces composite 0.639349, min_stability 0.800755). VERIFIED noise_test.py/regime_test.py first-hand: base_seed=AST-hash(strategy.py) confirmed (any logic edit re-rolls all stabilities); stability=1-trimmean(te)/clean_vol. CORRECTED inherited assumption: rally has 68 TRADES (sample_factor=sqrt(min(68/50,1))=1.0 MAXED), NOT ~12 (that was directional OPENS); rally low raw is from low Sharpe 0.736 + return-vol (vol_gate), NOT sample size. DIRECTION-SPLIT PnL (MEASURED, realizing events): rally LONG 20tr -380.7 40%WR (drag) / SHORT 48tr +2381.6 77%WR (alpha); crash all-LONG 45tr +4367 100%WR; bull LONG 40tr +4137 92%WR / SHORT 3tr -226 0%WR; sideways all-LONG 49tr +3004 98%WR. EXP1 (arch, remove multi-day ct entry-size shrink _bull/_bear_ct_vlong): raw_composite 0.6383 FLAT (bull -0.0016, crash -0.0017, sideways BYTE-IDENTICAL, rally Sh0.7349 ~identical) -> entry-SIZE channel SATURATED reconfirmed; composite 0.5187 pure rally stab re-seed 0.614. EXP2 (arch, remove counter-trend admission tightening +0.15tanh terms): bull Sharpe 1.556->-0.206 COLLAPSE (admitted losing dip-buy counter-trend longs in bull pullbacks -> bull ct-longs are LOSERS, counter-trend=winner NOT general, tightening LOAD-BEARING for bull); rally raw FLAT (bear-tightening not binding, rally shorts pass regardless) -> ADMISSION not a rally lever. BRANCH (NEW stale-loss EXIT term, cut positions underwater past ~bar5-8 by adversity, MAX-fusion): GENUINE SURGICAL RALLY-RAW LEVER — bull/crash/sideways raw+Sharpe BYTE-IDENTICAL across all variants (winners never sit underwater), rally Sharpe 0.736->~0.78 (+0.04, plateaus), MaxDD 1.850->1.78, raw_composite 0.6474>0.6394. Blocked by rally stability seed-lock: 5 draws {0.609,0.467,0.526,0.541,0.414} ALL <0.79; the bleeder-cut did NOT robustly raise rally stability (new exit boundary re-seeds). Stop-fold reformulation INERT (ATR stop not binding bleeder exit). CALIBRATION: R2(16-bar) uniform ~0.42-0.46 across ALL regimes (does NOT separate rally from bull); ret_vlong differs (bull +0.027, rally +0.006) BUT rally indistinguishable from sideways (+0.003) where longs WIN 98% -> cannot separate rally losing-longs from sideways winning-longs via trend signals w/o regime overfit. CONCLUSION: de412448 remains seed-locked deep optimum; rally alpha/instability entanglement reconfirmed from the EXIT angle. NEW CATALOGUED LEVER for future: stale-loss EXIT term (rally Sharpe +0.04, SURGICAL = others byte-identical, cleaner than ride-suppression) — keepable only if rally robustness solved or metric reseed-averaged. Did NOT seed-fish. All reverted via git checkout de412448 -- strategy.py; results.tsv append-only intact.
-	0.4262	0.6141	0.3757	0.67	0.77	1.01	0.00	discard	ARCHITECTURAL voter-dispersion (boundary-proximity) entry-size attenuator: shrink first-bar size up to 35%*mean Lorentzian 1/(1+(signal/0.5)^2) over 7 voter signals (targets near-midpoint swing voters; orthogonal to strong-sum quintic which weights far-from-midpoint voters). composite 0.6393->0.4262. MEASURED: rally Sharpe 0.736314->0.735895 BYTE-IDENTICAL (attenuator near-inert on rally -> rally entries pass admission with DECISIVE individual voters NOT near-midpoint; REFUTES hypothesis that rally fragility=voters near tanh midpoint). bull raw 0.781251->0.781790(+0.0005), crash 0.767586->0.767704(+0.0001), sideways 1.013297->1.014629(+0.0013) all ~byte-identical (frag~0, decisive entries). Composite collapse PURELY stability re-seed: rally stab 0.801->0.457 (factor 1.0->0.0), bull stab 0.810->0.759 (factor 0.862). NOT branch-worthy (no regime FINAL score up; mechanism inert on rally=no fix path). Discard #1 architectural.
-	0.4437	0.6338	0.3802	0.75	0.77	1.01	0.00	discard	ARCHITECTURAL churn-gated first-bar ENTRY-size grid quantization (round entry target onto 0.06*equity*BASE*_churn_dz lattice, _churn_dz>0; extends resize-grid to the entry path which is normally exempt). composite 0.6393->0.4437. MEASURED: rally Sharpe 0.736314->0.735971 + DD 1.850->1.850 BYTE-IDENTICAL (grid did NOT fire on rally entries -> at each rally entry open len(_eh)<2 so _churn_dz=0; rally "bursts" live in RESIZES/scale-in not in time-clustered fresh entries). crash 0.767586 + sideways 1.013297 raw BYTE-IDENTICAL (churn~0). bull raw 0.781251->0.782656 (+0.0014, bull bursts >=2 occasionally). Composite collapse PURELY stability re-seed: rally stab 0.801->0.478 (factor 1.0->0.0). NOT branch-worthy (rally byte-identical=no engagement, no fix path; no regime FINAL score up). CROSS-EXP(1+2): both entry-size interventions byte-identical on rally -> entry-size channel inert for rally reconfirmed. Discard #2 architectural.
-	0.5404	0.6757	0.2707	0.63	0.79	1.01	0.27	discard	ARCHITECTURAL subsystem redesign (exit-fusion aggregator): hard element-wise MAX of 6 soft exit terms -> softmax-weighted average (smooth-max beta=8, <=max); chop single-source attenuator preserved. composite 0.6393->0.5404, raw_composite 0.6393->0.6309(-0.008). MEASURED: crash raw 0.767586->0.786551(+0.019, crash stab high 0.97 -> FINAL improved, ROBUST not re-seed; smooth-max rides crash shorts longer). bull raw 0.781251->0.730875(-0.050; broad smooth-max over-holds bull through pullbacks). sideways 1.013297->1.012865(~flat). rally raw 0.417999 vs 0.419353 ~BYTE-IDENTICAL (rally exits not argmax-driven, consistent df79a3cd), stab re-seed 0.801->0.693 (factor 0.643). NOT branched: net raw_composite DOWN + crash-gain/bull-regression converges to documented surgical-ride-suppression 8bb8523c (all 3 strong up, raw_composite 0.6585) which is STRICTLY BETTER yet itself blocked by rally re-seed -> strictly dominated by known dead-end; even full bull recovery needs rally stab>=0.785 (P~0.11=fishing) for composite 0.644. Discard #3 architectural.
-	0.4851	0.6613	0.3525	0.78	0.77	1.01	0.07	discard	ARCHITECTURAL cross-asset consensus entry-size attenuator (NEW data source: mean tanh(ret_long/0.04) over BTC/ETH/SOL, direction-aware size-down up to 30% on entries against weak/mixed consensus; orthogonal to 7 single-symbol voters). composite 0.6393->0.4851, raw_composite 0.6393->0.6401(+0.0008 ~flat). MEASURED: ALL 3 strong regimes raw slightly UP -- bull 0.781251->0.784187(+0.0029), crash 0.767586->0.774458(+0.0069, crash stab high->FINAL up), sideways 1.013297->1.017712(+0.0044). rally raw 0.419353->0.414994 (~BYTE-IDENTICAL -0.0044: 2024 rally high cross-asset consensus -> aligned entries full size, near-inert), stab re-seed 0.801->0.553 (factor 0.177). NOT branch-worthy: strong gains TINY (+0.003-0.007 vs ride-suppression +0.124), rally re-seeded; even lucky rally draw >=0.785 gives composite ~0.6395~=baseline (gains too small + rally raw lower). FINDING: cross-asset consensus largely redundant w/ own-trend on strong regimes (crypto correlation), tiny residual; inert on rally. Discard #4 architectural.
-	0.4925	0.6546	0.3242	0.74	0.76	0.99	0.12	discard	ARCHITECTURAL subsystem redesign (position-sizing pipeline): 12-attenuator multiplicative PRODUCT -> MIN-bottleneck (single binding constraint) on first-bar entry size. composite 0.6393->0.4925, raw_composite 0.6393->0.6276(-0.012). MEASURED DD all safe <2% (bull 1.23 crash 0.73 sideways 0.46 rally 1.90 -- MIN only ~1.5-2x larger, binding attenuator already small). strong regimes raw DROPPED: bull 0.781251->0.744933 (Sharpe 1.556->1.420, -0.14), sideways 1.013297->0.993949 (Sh 1.941->1.888), crash 0.767586->0.759646 (Sh 1.311->1.291). FINDING: multiplicative PRODUCT sizing is LOAD-BEARING -- stacking attenuators (each capping a distinct risk dimension) genuinely improves strong-regime Sharpe; MIN discards non-binding caps protection -> worse Sharpe. rally raw 0.419353->0.420252 ~BYTE-IDENTICAL (Sh 0.736->0.739, sizing-structure-invariant=uniform-ish scale), stab re-seed 0.801->0.586 (factor 0.286). Compounding-noise-source hypothesis NOT supported as rally lever (MIN did not reduce rally te). Discard #5 architectural -> EXIT RULE (5 consecutive architectural).
de412448	0.6393	0.7454	0.2120	0.78	0.77	1.01	0.42	session-summary	session: 5 independent architectural discards (EXIT RULE at 5 consecutive architectural), 0 keeps, 0 branches (Exp3 branch-eligible but strictly dominated by documented dead-end). Baseline de412448 UNCHANGED 0.6393 [bull 0.781251 Sh1.556, crash 0.767586 Sh1.311, sideways 1.013297 Sh1.941, rally 0.419353 Sh0.736 stab0.800755; all factors 1.0; binding=rally]; strategy.py verified byte-identical + reproduces 0.639349/rally 0.419353/min_stab 0.800755. FIVE DISTINCT NEW mechanisms across 4 subsystems: (1) voter-DISPERSION entry-size atten (mean Lorentzian 1/(1+(voter_signal/0.5)^2), targets near-midpoint swing voters, orthogonal to strong-sum quintic) -> rally Sharpe 0.736314->0.735895 BYTE-IDENTICAL = NEW: rally fragility is NOT at individual-voter-midpoint level (rally entries pass admission with DECISIVE individual voters); bull/crash/sideways raw ~byte-id; rally stab re-seed 0.457. (2) churn-gated first-bar ENTRY-size GRID quant (extends resize-grid to entry path) -> rally Sharpe 0.735971 + DD 1.850 BYTE-IDENTICAL = grid did NOT fire on rally entries (at each rally entry open len(_eh)<2 -> _churn_dz=0; rally bursts live in RESIZES/scale-in NOT time-clustered fresh entries); stab re-seed 0.478. (3) exit-fusion AGGREGATOR redesign hard-MAX -> softmax smooth-max (beta=8) -> crash raw 0.767586->0.786551 (+0.019 ROBUST, crash stab 0.97) BUT bull 0.781251->0.730875 (-0.050), sideways flat, rally raw byte-id (exits not argmax-driven) stab re-seed 0.693; NOT branched: smooth-max reproduces crash ride-winner gain but STRICTLY DOMINATED by documented surgical-ride-suppression 8bb8523c (all 3 strong UP, raw_composite 0.6585) which is itself rally-wall-blocked. (4) cross-asset CONSENSUS entry-size atten (NEW data source: mean tanh(ret_long/0.04) over BTC/ETH/SOL, orthogonal to 7 single-symbol voters) -> ALL 3 strong raw +0.003-0.007 (tiny), rally raw 0.414994 ~BYTE-IDENTICAL (2024 rally high consensus->aligned full size), raw_composite +0.0008, stab re-seed 0.553; cross-asset largely REDUNDANT w/ own-trend on strong (crypto correlation). (5) sizing-pipeline SUBSYSTEM REDESIGN 12-attenuator PRODUCT -> MIN-bottleneck -> strong Sharpe DROPPED (bull 1.556->1.420 -0.14, sideways 1.941->1.888, crash 1.311->1.291), rally raw 0.420252 ~BYTE-IDENTICAL (Sh0.739, sizing-structure-invariant), DD all safe <2pct, stab re-seed 0.586. UNIFYING CROSS-EXP CONCLUSIONS (load-bearing): (a) rally raw BYTE-IDENTICAL in 4/5 exps (1,2,4,5) + ~flat Exp3 -> rally trades INVARIANT to entry-size/sizing-structure/cross-asset changes; composite moves ONLY via stab re-seed. NARROWS rally-fragility source: NOT individual-voter-midpoint (Exp1), NOT entry-size-wobble (Exp2 grid + Exp5 min BOTH inert), NOT cross-asset (Exp4), NOT admission (priors). With prior 3-bar-persistence (rally stab 1.0 but Sh negative), rally te is intrinsic to WHETHER marginal trades are taken (strong-sum-aggregate crossing admission); size/structure changes leave take/no-take unchanged -> byte-id raw + re-seed. (b) NEW LOAD-BEARING: multiplicative PRODUCT sizing pipeline load-bearing for strong-regime Sharpe (Exp5 MIN dropped bull Sh -0.14) -- do NOT replace product w/ min/single-binding. (c) NEW: exit-fusion AGGREGATOR moves strong regimes (Exp3 smooth-max crash +0.019/bull -0.050) -- MAX not frozen, but dominated by ride-suppression. (d) rally stab draws this session 0.457/0.478/0.693/0.553/0.586 (all <0.785 knee, mean ~0.55) -> baseline 0.801 top-of-range lucky draw, P(>=0.785)~0.11. de412448 remains confirmed seed-locked deep optimum; all 5 reverted via git checkout -- strategy.py; results.tsv append-only intact.
-	0.5001	0.6649	0.3296	0.78	0.77	1.00	0.12	discard	ARCHITECTURAL entry-churn-gated faster choppy-hold de-risk (exit-side R2 complement of de412448 entry-size keep; new per-position _entry_churn state, de-risk-floor -0.15*hold_chop*entry_calm). composite 0.639349->0.500142. rally NOT byte-identical: raw 0.419353->0.431059 (+0.0117 choppy-exit cut bad rally holds) but stability 0.800755->0.580907 re-seed (factor 0.267, score 0.116253). FINDING: entry-time churn tag does NOT isolate rally on EXIT side - burst-leader/consolidation rally positions open at low entry-churn (calm-tagged) then turn choppy mid-hold -> exit fires -> rally trades change (unlike entry-SIZE side where rally entries clean/high-R2 so R2 atten inert). sideways raw 1.013297->0.996052 (-0.017, choppy-exit HURT sideways, did NOT reproduce reverted-branch +0.022). bull 0.781251->0.780269, crash 0.767586->0.767111 near-flat. DISCARD no regime score improved; not branched (reverted R2-de-risk branch already exhausted exit-side choppy de-risk 8 steps).
-	0.2983	0.5557	0.5148	0.78	0.76	1.00	-0.32	discard	SUBSYSTEM REDESIGN voter aggregation: quintic strong-sum (conf-0.5)^5 -> weighted LOG-ODDS Bayesian pooling log(c/(1-c)) (broad-weak vs few-strong philosophy). composite 0.639349->0.298309. min_stability 0.800755->0.859452 (broad pooling MORE noise-robust - voters average out). But trade QUALITY collapsed: rally raw 0.419353->-0.320558 (NEGATIVE; broad-weak admits terrible rally trades), crash 0.767586->0.759106, sideways 1.013297->1.003085, bull near-identical 0.781251->0.781284 (bull entries high-conviction under both aggregators). FINDING: quintic few-strong concentrated-conviction requirement is LOAD-BEARING for trade quality esp rally; concentrated conviction > broad consensus as entry filter (also confirms sample_factor lever is a TRAP - more trades = worse trades). DISCARD architectural, not branch-worthy.
4310256e	0.4522	0.6229	0.3414	0.76	0.77	0.92	0.04	branch	BRANCH OPEN (size-smoothing mechanism, targets stability=binding penalty). Step1 = 3-bar MEDIAN smoothing of combined_mult: composite 0.639349->0.452194 FAILED. rally stability 0.800755->0.531288 (factor 0.104, score 0.0426), sideways stab ~0.80 (factor 0.996, raw 1.013297->0.927392), bull raw 0.781251->0.758859, crash flat, rally raw 0.408909. FINDING: MEDIAN is C0-NONSMOOTH - which of 3 bars is median FLIPS under AR(1) noise -> multiplier JUMPS -> ADDS tracking error (same C0-kink failure as prior MIN-group fusion). JUSTIFICATION to branch: (1) size-smoothing is a NEW mechanism targeting stability via systematic noise reduction (like load-bearing grids); (2) median regressed via C0 kinks (operator wrong, not mechanism); (3) FIX = SMOOTH LINEAR mean genuinely reduces perturbation variance w/o kinks (lag affects raw not clean-vs-pert tracking error). Branch tests mean + window/gating variants.
-	0.5130	0.6658	0.3057	0.75	0.77	0.98	0.16	discard	BRANCH REVERTED to de412448 0.6393 (strategy.py byte-identical, reproduces 0.639349/rally 0.419353/min_stab 0.800755). Branch = temporal smoothing of combined_mult (position-size multiplier) to lift stability. 3 steps: s1 3-bar MEDIAN composite 0.4522 rally_stab 0.531 (C0-kink: median-selection flips under noise -> ADDS tracking error); s2 3-bar MEAN 0.5018 rally_stab 0.594 (smooth, beats median, confirms kink diagnosis); s3 2-bar MEAN 0.5130 rally_stab 0.616. MONOTONIC: as smoothing DECREASES, rally_stab + composite climb toward baseline (0.80/0.6393) - NO smoothing sweet spot. THESIS FALSIFIED: combined_mult is a MINOR input (feeds only first-bar entry + scale-in bars 0-3; post-scale-in positions ride via grids/exit, not combined_mult), so temporal smoothing does NOT systematically reduce equity tracking error - it only re-seeds rally stability LOWER + lags raw (bull/sideways down). CONCLUSION: temporal averaging (median/mean) of size is a dead end; only CURRENT-value quantization (grids/deadbands, no lag) systematically reduces position noise, and those are saturated.
90fb390a	0.6393	0.7454	0.2120	0.78	0.77	1.01	0.42	session-summary	session: 2 independent architectural discards + 1 exploration branch (3 steps, REVERTED). Baseline de412448 UNCHANGED 0.6393 [bull 0.781251 Sh1.556 stab0.810, crash 0.767586 Sh1.311 stab0.974, sideways 1.013297 Sh1.941 stab0.849, rally 0.419353 Sh0.736 stab0.800755; ALL factors 1.0; binding=rally raw]. strategy.py byte-identical to de412448, reproduces 0.639349. THREE DISTINCT NEW mechanisms across 3 subsystems: (EXP1 discard) entry-time-churn-tagged faster choppy-hold de-risk (exit-side R2 complement of de412448 entry-size keep; new per-position _entry_churn state): composite 0.500142, rally raw 0.419353->0.431059 (+0.0117 choppy-exit cut bad rally holds) but stability 0.800755->0.580907 re-seed. FINDING: entry-time churn tag does NOT isolate rally on the EXIT side (unlike entry-SIZE side) - rally burst-leader/consolidation positions open at low entry-churn (calm-tagged) then turn choppy mid-hold -> exit fires -> rally trades change; sideways raw 1.013->0.996 (choppy-exit HURT sideways, did NOT reproduce reverted-branch +0.022). (EXP2 discard) SUBSYSTEM REDESIGN voter aggregation quintic strong-sum -> weighted LOG-ODDS Bayesian pooling: composite 0.298309, min_stability 0.800755->0.859452 (broad-weak pooling MORE noise-robust) BUT rally raw 0.419353->-0.320558 (NEGATIVE), crash/sideways down, bull near-identical. FINDING: quintic few-strong concentrated-conviction is LOAD-BEARING for trade quality; concentrated conviction > broad consensus as entry filter; also CONFIRMS sample_factor lever (bull 43/crash 45 trades <50 knee) is a TRAP (broad admission = worse trades, not more good ones). (EXP3=BRANCH OPEN, 3 steps REVERTED) temporal smoothing of combined_mult size-multiplier to lift stability: s1 3-bar median (0.4522, C0-kink ADDS noise), s2 3-bar mean (0.5018), s3 2-bar mean (0.5130); rally_stab 0.531/0.594/0.616 MONOTONIC toward baseline as smoothing decreases - NO sweet spot. FINDING: combined_mult is a MINOR input (entry+scale-in only) so temporal smoothing does NOT systematically reduce equity tracking error, only re-seeds rally lower + lags raw; only CURRENT-value quantization (grids, no lag) systematically helps stability & those are saturated. META: confirmed (a) rally stability re-seeds on EVERY edit incl byte-identical-raw ones (exp1), (b) the few-strong voter philosophy is load-bearing, (c) size temporal-smoothing is a dead end. NO regime score improved in any experiment.
5eae77a0	0.4564	0.6443	0.3759	0.78	0.77	1.01	0.02	discard	ARCHITECTURAL persist entry conviction-margin atten through full hold (scale-in asymptote=size*conv_mult, new per-symbol state). raw_composite 0.6382 ~FLAT (bull/crash BYTE-IDENTICAL, sideways 1.0133->1.0129, rally RAW 0.4194->0.4168 ~flat) -> NEW FINDING: rally raw invariant to FULL-HOLD size too (priors only tested first-bar+pipeline-structure; scale-in asymptote was always raw size). rally stab 0.8008->0.5112 (factor 1.0->0.037) re-seed crash -> rally final 0.4194->0.0156. composite 0.6393->0.4564. No regime improved; no branch (pure seed re-roll, no gain to preserve).
45942a93	0.5806	0.7121	0.2631	0.78	0.77	1.01	0.29	discard	ARCHITECTURAL admission stickiness: primary entry gate uses max(curr,prev-bar) strong-sum instead of current-bar (looser, anti-noise-dip, persist min-gate co-gates). raw_composite 0.639349 BYTE-IDENTICAL; ALL 4 regime RAW byte-identical (bull 0.781251/crash 0.767586/sideways 1.013297/rally 0.419353) -> zero clean-run trade delta (prev-bar crossings already entered or blocked by persist/admit co-gates). YET rally stab 0.8008->0.7063 (factor 1.0->0.688) re-seed, sideways stab 1.0->0.998 -> rally final 0.419->0.288, composite 0.6393->0.5806. CLEAN PROOF: a RAW-INERT admission edit still re-seeds rally stability via AST-hash alone. No regime improved; no branch.
180aafbd	0.4812	0.6580	0.3535	0.78	0.77	1.01	0.07	discard	ARCHITECTURAL realized-trade-streak entry-size de-risk (one-sided -25% after losing streak of CLOSED trades; new _realized_hist 5-trade window; near-virgin kelly/equity-curve class, 1 prior match). raw_composite 0.638637 ~flat; crash 0.767586 + sideways 1.013297 BYTE-IDENTICAL (streak de-risk rarely fires in trend/sideways), bull 0.781251->0.781523 (+0.0003 noise), rally RAW 0.419353->0.417603 (~flat) -> rally raw invariant to realized-equity-curve size channel too (3rd distinct size channel confirmed dead this session). rally stab 0.8008->0.5499 (factor 1.0->0.166) -> rally final 0.069, composite 0.481. No regime improved; no branch.
eb82ab05	0.5116	0.6597	0.2960	0.66	0.77	1.01	0.20	discard	ARCHITECTURAL simplification (exit-source-set subsystem): drop vol-expansion _ve + adverse-recovery _ar soft sources from MAX fusion -> slope+pp+time only. raw_composite 0.6393->0.6081. NEW LOAD-BEARING FINDING: bull RAW 0.781251->0.660419 (-0.121) = _ve/_ar load-bearing for BULL (NOT redundant with core 3); crash 0.767586 + sideways 1.013297 BYTE-IDENTICAL (ve/ar never binding exit there), rally RAW 0.418400 ~flat. rally stab re-seed 0.641 (factor 0.472), composite 0.512. Confirms exit-source set is load-bearing; no regime improved; no branch.
58d64194	0.4935	0.6624	0.3378	0.78	0.76	1.01	0.10	branch	BRANCH OPEN (TOD-removal): neutralize 6-cycle TOD/DOW/MOM/quarter/semi-annual/annual seasonal entry-size modulator (_tod_atten=1.0). raw_composite 0.639349->0.641874 (+0.0025, FIRST raw gain this session); rally RAW 0.419353->0.429756 (+0.0104 - TOD was HURTING rally), bull 0.781251->0.779815 (-0.0014), crash 0.767586->0.763421 (-0.0042), sideways 1.013297->1.005079 (-0.0082) -> seasonal sizing net-marginal+rally-negative=OVERFIT. Blocked by rally stab re-seed 0.8008->0.5706 (factor 0.235), rally final 0.101, composite 0.493. Branch hypothesis: +0.011 rally-raw buffer may make rally-inclusive grid of quiet-stretch resizes (the ungridded coverage gap) net-positive.
