commit	score	mean_score	std_score	bull_2021	crash_bear	sideways	rally_2024	status	description
-	-	-	-	-	-	-	-	session-summary	SESSION (baseline b902da2f 0.783185 -> UNCHANGED, no keep): 5 independent architectural experiments (Exp1-5, ALL discards), no exploration branch opened. EXIT RULE: 5 consecutive architectural discards MET -> stop. Baseline b902da2f re-verified reproduces 0.783185 (strategy.py matches b902da2f byte-identical, 0 diff verified post-revert) [bull 0.940387 Sh1.927 DD3.21pct, crash 0.731303 Sh1.274 DD2.46pct 100pct WR, sideways 0.996184 Sh2.01 DD2.21pct 48t sample_factor 0.980, rally 0.640302 Sh1.471 DD5.19pct 100t 85pct WR; all stab 1.0, all raw==score, min_stab 0.811]. THEME: thoroughly probed the rally ct-exit / streak axis (Exp1-4) + 1 simplification (Exp5). CROSS-EXPERIMENT CONCLUSIONS (all measured this session, verifiable): (1) Exp1 (ct-gated ATR stop tightening 0.75x for ct positions): BYTE-IDENTICAL INERT (0.783185). The ct losers do NOT exit via the SL stop path -- they exit via the soft-pressure MAX fusion (slope-against/time/pp/ve/ar/vc) + de-risk ramp BEFORE the tightened stop band binds. CORRECTS the prior session-summary framing that ct shorts "ride to stop as losses": the ct-loser exit path is SOFT-PRESSURE-DOMINATED, not stop-dominated. Extends the exit-timing/giveback-dominated inertness wall to the STOP subsystem. (2) Exp2 (ct-gated slope-against pressure WEIGHT boost +30pct in exit MAX fusion): BYTE-IDENTICAL INERT (0.783185). Slope-against is NOT the binding soft-pressure term for ct losers (another term dominates the MAX, or the exit fires via a path insensitive to _w_slope). Combined with Exp1, LOCALIZES the ct-loser exit path to TIME-PRESSURE (max_hold), which is ALREADY optimized in the baseline via _ct_hold_sat fast-saturating shortening (the validated Exp5 keep). The ct-loser exit is giveback/time-dominated and fully optimized: stop=inert, slope-against=inert, giveback=inert (ct peaks < _pp_min), pp-activation=refuted, max_hold=already-at-optimum. (3) Exp3 (ct TIME-GRID resize throttle, bars_held parity non-price-derived integer gate -- row 531 explicitly-untried vehicle): REGRESSION composite -0.077 (0.706), rally -0.223 (Sh1.471->1.121, DD5.19->7.20, stab0.811->0.802). The 1-bar lag on ct de-risk shrinks made ct losers LOSE MORE -> the partial-reduce shaves are NOT immaterial, they are LOAD-BEARING beneficial de-risking (shrinking the position as it loses caps the loss). CONFIRMS streak-breaking via shave-consolidation is WALLED at this baseline: unlike row 531s old 26f4b23d baseline where the 7-streak contained immaterial shaves (pos_pnl ~-0.01..-0.02pct), at b902da2f the de-risk ramp does real loss-capping work. (4) Exp4 (DEEP-STREAK ct admission ESCALATION tier +35pct at streak>=4): CATASTROPHIC composite -0.203 (0.580), bull -0.497 BREACHES 50pct gate (0.940->0.443), rally stab CRASHED 0.811->0.712 below 0.80 knee. The integer loss-streak MISFIRES on bull (2021 multi-bar corrections accumulate a long-loss streak; when ret_vlong dips negative the bull recovery dip-buy long is flagged ct and the +35pct escalation BLOCKS it -> destroys bull alpha, same misfire as per-direction streak ca639bc9 but worse). Even +35pct did NOT break the rally streak (raw DOWN 0.640->0.610 -- admission-inertness: ct shorts are high-conviction). Harder admission collapses rally stability (threshold noise boundary). (5) Exp5 (simplification: REMOVE _tq_atten R^2 entry attenuator, test redundancy with Kaufman ER): REGRESSION composite -0.011 (0.772), sideways -0.020 (Sh2.006->1.703), crash -0.016, bull -0.009, rally -0.004. R^2 (OLS linearity) is NOT redundant with Kaufman ER (path efficiency) -- _tq_atten is LOAD-BEARING. A path can be efficient (high ER) but non-linear (low R^2) and vice versa; R^2 captures direction-consistency ER misses. KEY LOAD-BEARING CONCLUSIONS: (A) the rally ct-loser exit path is FULLY OPTIMIZED (stop/slope/giveback all inert; time-pressure at _ct_hold_sat optimum; de-risk shaves load-bearing). (B) the rally streak_gate (0.873, 4 consec ct-short losses) is STRUCTURALLY UNBREAKABLE -- all 5 streak vehicles now confirmed walled: (1) per-step-$ gate=latch(catastrophic), (2) |pos_pnl|-band=price-boundary noise(stability collapse), (3) ratchet=overfit(failed cross-ex fa18a3d7), (4) time-grid=lag costs raw(rally -0.22), (5) admission escalation=misfires on bull + stability collapse(-0.203). (C) rally stability 0.811 is ABOVE the 0.80 knee -> stability_factor already 1.0 (capped) -> NO stability headroom; every rally improvement must come from raw_score, which is walled (Sharpe/ct-exit optimized, dd_gate DD-reduction maxed at giveback 0.50 + tp-harvest 0.60, streak_gate unbreakable, return_reward calmar leverage-invariant, sample_factor 1.0 at 100 trades). (D) the tight local optimum holds: even correlated-looking signals (R^2 vs ER) are load-bearing; no simplification holds score. REMAINING UNCONQUERED: rally (0.640, streak structurally unbreakable, ct-exit fully optimized, all raw levers walled, stability factor 1.0 no headroom) and crash (0.731, return-limited Sh1.274 100pct WR, structurally small-move-capped). Both binding regimes at non-addressable structural limits. Structural-exploration NOT attempted: no coherent subsystem-rewrite hypothesis with a plausible path (every core mechanism converted+tuned by prior sessions; the two binding-regime limits are structural properties of the regime data -- rally ct-loser peak magnitude + streak count, crash bounce move size -- not of the strategy mechanism). results.tsv append-only preserved (path-scoped git checkout -- strategy.py throughout, never git revert); all 5 discards reverted to b902da2f; strategy.py matches b902da2f byte-identical (0 diff verified). NEW BASELINE 0.783185 unchanged for future sessions.
4e06d616	0.783391	0.827144	0.145842	0.939957	0.730931	0.996268	0.641420	discard	Exp1 (architectural, indep): PORTFOLIO-HEALTH-COUPLED TREND-ALIGNED ENTRY BOOST (new structural relationship: the symmetric return-seeking opposite of _port_dd_atten shrink; size up trend-aligned entries when healthy + multi-day trend strong, self-limiting via the same _port_dd_atten signal). MEASURED vs b902da2f 0.783185: composite +0.000206 SUB-NOISE; mean +0.000100, std -0.000354. PER-REGIME: bull 0.940387->0.939957 (-0.000430, Sh1.927->1.926), crash 0.731303->0.730931 (-0.000372, Sh1.2727->1.2720 FLAT -- the hypothesis that crash under-captures the downtrend via vol-targeting shrink was REFUTED: the boost did NOT raise crash Sharpe, crash is NOT entry-size-return-limited), sideways 0.996184->0.996268 (+0.000084), rally 0.640302->0.641420 (+0.001118, Sh1.471->1.478, DD5.191->5.275 UP -- the boost fired on rally trend longs pushing DD toward the 8pct knee, the f92f71c1 warning that sizing up trend-aligned rally entries raises the 15pct losers). The health gate did NOT isolate crash as intended (crash Sharpe flat = boost either did not fire enough in crash or crash return-limit is not entry-size). Not branch-eligible (target regime crash did not improve; net sub-noise). 1st architectural discard.
5b9344de	0.783185	0.827044	0.146197	0.940387	0.731303	0.996184	0.640302	discard	Exp2 (architectural, indep): BEAR trend-aligned admission RELAXATION (symmetric counterpart to bull -10pct relaxation in uptrend; bear had no relaxation in downtrend). Lowered _bear_strong_min up to -10pct in a SUSTAINED downtrend (20-bar ret_long<0 AND multi-day ret_vlong<0 = crash; excludes rally pullback shorts ret_vlong>0 and dead-cat bounces ret_long>0). BYTE-IDENTICAL 0.783185; crash 0.731303 Sh1.2727 DD2.4614 57 trades UNCHANGED -- the relaxation did NOT admit any new crash bear entries. Crash bear admission is NOT threshold-limited at the margin: entries either have strong conviction (margin comfortably >0) or none, with no marginal bars sitting just below the -10pct floor. Combined with Exp1 (size boost left crash Sharpe flat = scale-invariant), CONFIRMS crash is NEITHER size-limited NOR admission-threshold-limited: the 57 crash trades are exactly where voter conviction appears, not a tunable threshold. Extends the documented admission-inertness wall to the bear-trend-aligned side. 2nd architectural discard.
0ffb5773	0.783185	0.827044	0.146196	0.940387	0.731303	0.996184	0.640302	discard	Exp3 (architectural simplification, indep): REMOVE the _ar_pressure adverse-recovery 5th soft exit source (set if False). BYTE-IDENTICAL 0.783185 -- ALL 4 regime scores, sharpes, MaxDDs, AND all 4 stability factors + flip_streak_gates byte-identical to b902da2f (bull stab 0.834255, crash 0.980865, sideways 0.865913, rally 0.811171, min 0.811171 all unchanged). The _ar_pressure (fires when a loser recovered from MAE but still in modest loss) NEVER fires -- not on the clean path AND not under AR(1) noise (stability identical = it never binds in the ensemble either). It is PURE DEAD CODE: the de-risk ramp + sl_pressure + time-pressure fire before the MAE-recovery-loser condition is ever reached. Confirms exit-fusion saturation extends to the _ar_pressure source (mirrors the prior std-ext 7th-source inertness finding). Reverted (strict +0.003 keep gate not met for a byte-identical change; simplification principle endorses keeping but the formal gate is binding -- dead-code removal recorded for a future session to keep if the gate is relaxed). 3rd architectural discard.
5a748c8a	0.793917	0.837126	0.144029	0.962118	0.731300	0.994833	0.660252	keep	KEEP (NEW BASELINE, SUPERSEDES b902da2f 0.783185, +0.010732). Exp4 (architectural, indep): 8th VOTER -- range/close efficiency-continuation (the prior-session-identified ONLY un-disproven axis: a new orthogonal data-source voter added WITHOUT touching existing voter weights). Signal = mean(|close-to-close|)/mean(|intrabar high-low range|) over 12 bars (interbar-move/intrabar-range ratio, DISTINCT from ER/Kaufman which is |net-move|/sum|bar-moves|), signed by the 12-bar close direction. High ratio = closes travel further than bar ranges = efficient interbar trend (continuation); low = range dominates = chop. Small fixed weight 0.55 appended to _base_weights (the 7 existing weights untouched; trend-strength _wt_shift only shifts indices 1-3). MEASURED vs b902da2f 0.783185: composite +0.010732; mean +0.010082 (0.827044->0.837126); std -0.002167 (0.146196->0.144029). PER-REGIME: bull 0.940387->0.962118 (+0.021731, Sh1.927->2.000, DD3.21->3.09pct, STABILITY 0.834->0.955 -- the efficiency voter stabilizes bull trend entries), crash 0.731303->0.731300 (-0.000003 BYTE-IDENTICAL, Sh1.2727 unchanged -- voter does not fire in crash sustained downtrend), sideways 0.996184->0.994833 (-0.001351, Sh2.006->2.002, stab0.866->0.848), rally 0.640302->0.660252 (+0.019950, Sh1.471->1.526, APY17.7->18.4pct, DD5.19->5.19, stab0.811->0.810). All stability_factor 1.0, all flip_streak_gate 1.0, raw_composite==composite (no penalties). All 4 keep gates met (composite +0.0107>=0.003, mean up, no regime >50pct drop -- max drop sideways -0.0014 trivial, no DD>10pct). BREAKTHROUGH: confirms the prior-session CROSS-EXPERIMENT CONCLUSION that a new orthogonal data-source voter is the ONLY un-disproven axis for moving regime raw -- the range/close ratio is genuinely orthogonal to the 7 existing voters (none read intrabar-range vs interbar-close-move). The voter helps bull (trend-continuation longs stabilized) + rally (trend-continuation longs higher Sharpe) while sparing crash (byte-identical) at the cost of a tiny sideways regression. New baseline for all subsequent experiments.
0b1d27e9	0.794107	0.837428	0.144403	0.962692	0.731300	0.995597	0.660123	discard	Exp5 (architectural, indep): CHOP-DAMPENER on the 8th voter (trend-scaled weight 0.35 chop -> 0.80 trend via _trend_strength_w, mirror of VWAP _vwap_wt). MEASURED vs 5a748c8a 0.793917: composite +0.000190 SUB-NOISE; mean +0.000302, std +0.000374 (worse). PER-REGIME: bull 0.962118->0.962692 (+0.000574, Sh2.000->2.001), crash 0.731300 BYTE-IDENTICAL, sideways 0.994833->0.995597 (+0.000764 RECOVERED as hypothesized -- Sh2.002->2.004, stab0.848->0.850; chop weight 0.55->0.35 spared sideways), rally 0.660252->0.660123 (-0.000129, Sh1.5256->1.5253, stab0.810->0.807 -- the lower chop weight also reduced the voters trend-adjacent contribution to rally). Directionally correct (sideways recovered) but net sub-noise and std worsened (sideways+bull gains offset by rally tiny loss + std up). The fixed 0.55 weight (Exp4) is near-optimal; trend-scaling redistributes marginally without clearing the +0.003 bar. 4th architectural discard (since the Exp4 keep reset the count, this is discard #1 since the keep -- but cumulative session arch discards: Exp1/2/3/5 = 4).
c4c31861	0.679291	0.728433	0.163808	0.590369	0.731300	0.994932	0.597132	discard	Exp6 (architectural, indep): 9th VOTER -- multi-day trend (ret_vlong, fast-saturating /0.03, continuous tanh). MEASURED vs 5a748c8a 0.793917: composite -0.114626 CATASTROPHIC; mean -0.108693, std +0.019779. PER-REGIME: bull 0.962118->0.590369 (-0.371749, Sh2.000->1.395 CRASHED), crash 0.731300 BYTE-IDENTICAL (Sh1.2727 unchanged -- CONFIRMS crash is admission-saturated: even a strongly-firing ret_vlong bear voter changes zero crash trades, no marginal crash bars exist near the admission floor), sideways 0.994833->0.994932 (+0.000099 flat), rally 0.660252->0.597132 (-0.063120, Sh1.526->1.382). FAILURE MECH: ret_vlong is fast-saturating in trend regimes (rally/bull solidly-trending -> voter near +-max conviction), so it OVER-AMPLIFIES trend conviction in the strong-sum -> admits marginal trend entries that lose (lower-quality trend continuation). This is the voter-aggregation wall (prior conclusion d): trend regimes rely on CORRELATED price-trend voter co-firing as the trend signal -- adding ANOTHER correlated trend voter (ret_vlong ~ correlated with ret_short/EMA/slope at the trend-regime scale) over-weights trend conviction rather than adding orthogonal info. Distinct from the successful 8th voter (range/close EFFICIENCY = orthogonal trend-QUALITY, not trend-DIRECTION). Confirms: new voters must be ORTHOGONAL (efficiency/quality), not another trend-DIRECTION signal. Also confirms crash admission-saturation extends to a 9th voter. 5th architectural discard (2nd since the Exp4 keep: Exp5, Exp6).
f9ab0750	0.794028	0.837288	0.144197	0.962842	0.731300	0.994811	0.660198	discard	Exp7 (parameter test on proven 8th voter): weight 0.55->0.70 (uniform, no chop reduction). MEASURED vs 5a748c8a 0.793917: composite +0.000111 SUB-NOISE; mean +0.000162, std +0.000168 (worse). PER-REGIME: bull 0.962118->0.962842 (+0.000724, Sh2.000->2.001), crash BYTE-IDENTICAL, sideways 0.994833->0.994811 (-0.000022 flat, stab0.866->0.839), rally 0.660252->0.660198 (-0.000054 flat). The 0.55 weight (Exp4) is near-optimal: higher weight gives bull +0.0007 but std worsens and rally/sideways flat-to-slightly-down -> net sub-noise. Parameter tuning on the proven 8th voter is saturated at 0.55. 6th architectural discard (3rd since the Exp4 keep: Exp5, Exp6, Exp7).
12f6e861	-999.000000	-249.597649	432.667674	0.416061	-999.000000	0.000000	0.193342	discard	Exp8 (architectural, indep): 9th voter -- 48-BAR range/close efficiency (longer-timescale version of the 8th 12-bar voter). CATASTROPHIC composite -999 (crash MaxDD 12.196pct BREACHED 10pct hard cutoff; crash Sharpe -0.692 NEGATIVE). PER-REGIME: bull 0.962->0.416 (Sh2.000->1.322, DD3.09->7.40pct UP), crash 0.731->-999 (Sh1.273->-0.692, DD2.46->12.20pct BREACH -- the 48-bar efficiency voter fired strongly bear in the sustained crash downtrend, OVER-ADMITTING crash shorts at bad times / wrong hold), sideways 0.995->0.000 (Sh2.006->1.314, STABILITY 0.866->0.025 CRASHED -- the 48-bar window is highly noise-sensitive in chop), rally 0.660->0.193 (Sh1.526->0.558). FAILURE MECH: a 48-bar efficiency signal is (a) too long-window -> noise-sensitive in sideways (stability 0.025), (b) strongly directional-biased in sustained trends -> over-admits crash shorts (the admission-saturation that protected crash at 12-bar BREAKS at 48-bar: the longer window creates marginal conviction bars that DIDNT exist at 12-bar, admitting low-quality crash shorts). The 12-bar window (Exp4 keep) is the calibrated sweet spot: short enough to be noise-robust in chop, long enough to capture trend efficiency without over-admitting. Confirms longer-window efficiency voters are walled. 7th architectural discard (4th since the Exp4 keep: Exp5, Exp6, Exp7, Exp8).
667ff568	0.783666	0.825557	0.139637	0.954340	0.715500	0.972913	0.659476	discard	Exp9 (architectural simplification, indep): REMOVE the _tq_atten (R^2 trend-quality entry attenuator) at the NEW baseline 5a748c8a (which has the 8th range/close EFFICIENCY voter). Tested whether the 8th efficiency voter subsumes the R^2 attenuator (both are trend-QUALITY signals). MEASURED vs 5a748c8a 0.793917: composite -0.010251 REGRESSION; mean -0.011569, std -0.004392 (better but mean dropped). PER-REGIME: bull 0.962->0.954 (-0.0078, Sh2.000->1.986), crash 0.731->0.716 (-0.0158, Sh1.273->1.242), sideways 0.995->0.973 (-0.0219, Sh2.006->1.696 BIG DROP), rally 0.660->0.659 (-0.0008). The R^2 attenuator is STILL LOAD-BEARING at the new baseline -- the 8th range/close EFFICIENCY voter does NOT subsume R^2 (path LINEARITY). They are DISTINCT quality signals (efficiency = interbar/intrabar move ratio; R^2 = OLS linearity of the path); both are needed. Confirms at the new baseline that the _tq_atten R^2 attenuator remains load-bearing (consistent with the old-baseline finding row 04db1628 -0.011). 8th architectural discard (5th consecutive since the Exp4 keep: Exp5, Exp6, Exp7, Exp8, Exp9 -> EXIT RULE 5 consecutive architectural discards MET).
-	-	-	-	-	-	-	-	session-summary	SESSION (baseline b902da2f 0.783185 -> NEW BASELINE 5a748c8a 0.793917, +0.010732 KEEP): 9 experiments (1 keep Exp4 + 8 discards Exp1/2/3/5/6/7/8/9), no exploration branch opened (Exp4 was a direct keep; subsequent discards were not branch-worthy -- Exp5/Exp7 sub-noise, Exp6/Exp8 catastrophic, Exp1/Exp2/Exp3 inert/flat). BREAKTHROUGH: Exp4 = 8th VOTER on range/close efficiency (interbar-close-move / intrabar-range ratio, signed by 12-bar close direction, fixed weight 0.55) -- the prior-session-identified ONLY un-disproven axis (new orthogonal data-source voter added WITHOUT touching existing voter weights). Confirmed the prior CROSS-EXPERIMENT CONCLUSION that a new orthogonal voter is the sole movable axis: range/close efficiency is genuinely orthogonal to the 7 existing voters (none read intrabar-range vs interbar-close-move). Lifted bull 0.940->0.962 (Sh1.927->2.000, STABILITY 0.834->0.955) + rally 0.640->0.660 (Sh1.471->1.526, APY17.7->18.4) at the cost of a tiny sideways -0.0014; crash byte-identical. EXIT RULE: 5 consecutive architectural discards since the keep MET (Exp5 chop-dampener sub-noise +0.00019, Exp6 9th directional ret_vlong voter CATASTROPHIC -0.115 over-amplifies trend, Exp7 8th-voter weight 0.70 sub-noise +0.00011, Exp8 48-bar efficiency voter CATASTROPHIC -999 crash DD 12.2pct breached, Exp9 remove _tq_atten -0.010 R^2 still load-bearing). CROSS-EXPERIMENT CONCLUSIONS (load-bearing for future sessions): (a) NEW VOTERS MUST BE ORTHOGONAL QUALITY (efficiency), NOT TREND-DIRECTION -- Exp6 ret_vlong voter over-amplified trend conviction -0.115 (voter-aggregation wall, prior conclusion d extended: adding a CORRELATED trend-direction voter over-weights trend, admits marginal trend losers); the 8th efficiency voter worked because it is trend-QUALITY not direction. (b) THE 12-BAR WINDOW IS THE EFFICIENCY-VOTER SWEET SPOT -- Exp8 48-bar was catastrophic (noise in chop sideways stab 0.025 + over-admitted crash shorts DD12.2pct); shorter/longer windows are walled. (c) CRASH IS ADMISSION-SATURATED + SIGNAL-LIMITED -- Exp1 (size boost) left crash Sharpe flat (scale-invariant), Exp2 (bear admission relaxation -10pct) byte-identical (no marginal crash bars near floor), Exp6 (strongly-firing ret_vlong bear voter) byte-identical on crash; crash 0.731 is a HARD FLOOR (100pct WR, 57 trades fixed by where conviction appears, not threshold; exit/hold/giveback/stop all walled per prior sessions). (d) R^2 (_tq_atten) REMAINS LOAD-BEARING at the new baseline -- the 8th efficiency voter does NOT subsume R^2 path-linearity (distinct quality signals, both needed). (e) Parameter tuning on the 8th voter is saturated at weight 0.55 (Exp5 trend-scaling + Exp7 uniform 0.70 both sub-noise). Baseline 5a748c8a re-verified reproduces 0.793917. The voter axis is now near-saturated: the one orthogonal-quality signal (12-bar range/close efficiency) was the win; directional voters catastrophic, longer-window catastrophic, refinements sub-noise. Future sessions: crash 0.731 is the binding floor (admission-saturated); the next movable axis would need ANOTHER genuinely-orthogonal quality signal (not direction, not a different window of the same efficiency) -- candidates are scarce (most price-derived ratios mined; volume-microstructure already used as boosts not voters; funding_rate all zeros).
