commit	score	mean_score	std_score	bull_2021	crash_bear	sideways	rally_2024	status	description
-	-	-	-	-	-	-	-	-	-	BRANCH SUMMARY (STRUCTURAL_EXPLORATION: opp-gate flip gate rewrite, 10 steps, REVERTED to 99a369a1): opened after 3 independent architectural discards (Exp1 ct-loser full-exit threshold byte-identical, Exp2 profit-boosted target-EMA sub-noise +0.000337, Exp3 multi-day ret_vlong opp-gate OR regression -0.0966). TARGET: the binding floor mixed (0.411) via the ONE grid-BYPASSING full-exit path (opp-gate target->0, grid-EXEMPT; all partial-harvest tp_harvest/giveback paths are grid-WALLED for mixed small positions). Exp3 measured the opp-gate binding blocker for mixed is the HARD VOTER-COUNT gate (bear_votes>=FLIP_MIN_VOTES, rarely reached in mixed chop). The branch rewrote the opp-gate flip admission: step1 wholesale margin-EMA replacement (THRESH=0.0) over-fired (rally/crash stability crashed, mixed raw REACHED 0.411); step2 THRESH=0.40 broke mixed entirely; step3 count-gate PRIMARY + margin-EMA SUPPLEMENT -> BYTE-IDENTICAL (fundamental architectural insight: MARGIN AND VOTE-COUNT ARE THE SAME SIGNAL, both derive from _bull_confs/_bear_confs, so a margin supplement is logically redundant with the count gate -> can never reach the cases the count gate misses). step4 BREAKTHROUGH: VOTER-INDEPENDENT oscillation supplement (ct + held-long + near-breakeven + trend_avg guard) -> +0.0024 PROGRESS (rally +0.0105, a regime the count-gate opp-gate could NOT help), all stab 1.0, no regression. steps5-10 all failed to beat step4: step5 multi-day ct gate (cost crash -0.033), step6 wider band 1.0*stop + bars_held>10 (rally -0.009), step7 band 0.65*stop (byte-identical), step8 trend_avg<0.005 (byte-identical), step9 bars_held>=2 (crash -0.069), step10 MAE dead-capital (byte-identical). BRANCH CEILING = step4 +0.0024 (below +0.003 keep). CROSS-EXPERIMENT CONCLUSIONS (all MEASURED this session, verifiable): (1) MARGIN/VOTE-COUNT IDENTITY: the conviction margin (_bear_margin=(strong-strong_min)/strong_min) and the voter count (bear_votes=sum(confs)) are NOT independent -- both are monotone transforms of the same _bear_confs. When the count gate fails (bear voters < FLIP_MIN_VOTES), margin is by definition low. So a margin-EMA opp-gate supplement is logically redundant with the count gate -> CANNOT reach the cases the count gate misses (step3 byte-identical proof). Future opp-gate rewrites must use a signal INDEPENDENT of voter conviction. (2) VOTER-INDEPENDENT STRUCTURAL EXIT REACHES RALLY (step4 +0.0024): a grid-bypassing full exit on a PURELY STRUCTURAL trigger (held counter-trend + near-breakeven, NO voter condition) closed rally persistent ct pullback shorts that voter conviction could not -- a NEW mechanism that moves a regime the count-gate opp-gate could not. The mechanism is REAL (rally +0.0105, all stab 1.0, no regression) but below +0.003 keep. (3) mixed IS STRUCTURALLY WALLED ON THE OSCILLATION SUPPLEMENT TOO: steps4-10 all BYTE-IDENTICAL on mixed (0.410990). mixed persistent wrong-side longs do not satisfy the ct+near-breakeven+held+trend_avg conjunction -- they exit via other paths before reaching it OR never simultaneously satisfy it. This extends the mixed wall to the voter-independent structural-exit axis (the ONE remaining grid-bypassing path). mixed residual low-Sharpe is now confirmed INTRINSIC: walled on proportional sizing (grid), walled on partial harvest (grid), walled on full-exit-timing (Exp1), walled on opp-gate voter-count (margin/vote-count identity), walled on opp-gate voter-independent structural (this branch). The ONLY un-walled axis remaining is the opp-gate TREND-CONFIRMATION term (trend_avg), but Exp3 proved relaxing it (ret_vlong OR) is catastrophic for bull. (4) trend_avg<0 GUARD IS LOAD-BEARING for the oscillation supplement: step5 (replace with multi-day ct gate) cost crash -0.033 (dead-cat longs); step9 (bars_held>=2) cost crash -0.069. The 20-bar trend_avg<0 + ENTRY_FULL_BARS hold threshold is the correct protective calibration. NEW BASELINE 99a369a1 0.706007 UNCHANGED. KEY FOR FUTURE SESSIONS: (a) the opp-gate flip ADMISSION rewrite via margin/voter-conviction is a DEAD END (margin/vote-count identity, step3 proof) -- do NOT re-attempt; (b) the VOTER-INDEPENDENT oscillation supplement (step4) is a REAL +0.0024 rally mechanism below keep threshold -- a future session could re-test it if the +0.003 bar is ever lowered OR combine it with a complementary mixed-reaching lever (none found this session); (c) mixed is now walled on ALL 5 exit/sizing axes tested (proportional sizing, partial harvest, full-exit-timing, opp-gate voter-count, opp-gate voter-independent structural) -- mixed residual low-Sharpe (0.411, Sh0.808) is INTRINSIC MTM oscillation, not addressable by any tested exit/sizing lever; (d) the trend_avg<0 guard on any new opp-gate path is load-bearing (protects crash dead-cat longs), do not remove it.
-	-	-	-	-	-	-	-	-	-	SESSION (baseline 99a369a1 0.706007 5-regime -> UNCHANGED, no keep): 3 independent ARCHITECTURAL experiments (Exp1-3, ALL discards) + 1 STRUCTURAL_EXPLORATION branch (opp-gate flip gate rewrite, 10 steps, REVERTED). Baseline 99a369a1 re-verified at session start (composite 0.706007 mean 0.778803 std 0.242655, all stab 1.0 raw==score, min_stab 0.844331) [bull 1.025954 Sh2.068, crash 0.720320 Sh1.254, sideways 1.066580 Sh2.027, rally 0.670171 Sh1.553, mixed 0.410990 Sh0.808] AND post-branch-revert (strategy.py 0-diff to keep, composite 0.706007 reproduced). EXIT RULE: STRUCTURAL_EXPLORATION branch reverted -> session ends (>=2 architectural discards MET: Exp1+Exp2+Exp3 all architectural; branch auto-opened at 3rd discard per structural-exploration trigger). results.tsv append-only preserved throughout (path-scoped git checkout 99a369a1 -- strategy.py for branch revert, never git revert; results.tsv untouched by rollback). THEME: targeted the binding floor mixed (0.411, far below the 0.67-1.07 cluster) via the ONE grid-BYPASSING full-exit path (opp-gate target->0, grid-EXEMPT) -- every prior mixed experiment used grid-WALLED partial-harvest/sizing paths. Exp1-3 probed three independent grid-bypassing exit-timing axes (ct-loser de-risk terminal, target-EMA level, opp-gate flip condition), establishing that mixed opp-gate binding blocker is the HARD VOTER-COUNT gate (Exp3). The STRUCTURAL_EXPLORATION branch then rewrote the opp-gate flip admission (hard voter-count -> continuous margin-EMA), discovering the MARGIN/VOTE-COUNT IDENTITY (step3: margin and vote-count are monotone transforms of the same _bear_confs -> a margin supplement is logically redundant with the count gate -> cannot reach cases the count gate misses). The breakthrough step4 (VOTER-INDEPENDENT oscillation supplement: ct + held-long + near-breakeven, NO voter condition) reached rally +0.0105 (a regime the count-gate opp-gate could NOT help) = +0.0024 composite (below +0.003 keep). steps5-10 confirmed step4 is the ceiling (mixed unreachable via the oscillation supplement). CROSS-EXPERIMENT CONCLUSIONS (all MEASURED this session, verifiable): (1) MIXED IS NOW WALLED ON 5 EXIT/SIZING AXES: proportional sizing (grid, prior session), partial harvest tp_harvest/giveback (grid, prior session), full-exit-timing via de-risk terminal (Exp1 byte-identical -- ct losers exit via SL/opp-gate before the de-risk terminal), opp-gate voter-count flip (Exp3 + branch step3 -- margin/vote-count identity), opp-gate voter-independent structural (branch step4-10 all byte-identical on mixed). mixed residual low-Sharpe (0.411, Sh0.808, return_vol 5.54pct vs 4.4pct net) is INTRINSIC MTM oscillation, not addressable by any tested exit/sizing lever. (2) MARGIN/VOTE-COUNT IDENTITY (architectural fact, step3 proof): _bear_margin=(strong-strong_min)/strong_min and bear_votes=sum(_bear_confs) are both monotone transforms of the same _bear_confs; when the count gate fails, margin is low. Any opp-gate rewrite keyed on voter conviction CANNOT reach the cases the count gate misses. (3) VOTER-INDEPENDENT STRUCTURAL EXIT IS A NEW REAL MECHANISM (step4 +0.0024): a grid-bypassing full exit on a PURELY STRUCTURAL trigger (held ct + near-breakeven + trend_avg guard, no voter condition) closed rally persistent ct pullback shorts that voter conviction could not. Below +0.003 keep but a genuine architectural discovery (rally +0.0105, all stab 1.0, no regression anywhere). (4) trend_avg<0 GUARD + ENTRY_FULL_BARS hold threshold are LOAD-BEARING on the oscillation supplement (step5 multi-day ct gate cost crash -0.033; step9 bars_held>=2 cost crash -0.069). NEW BASELINE 99a369a1 0.706007 UNCHANGED. KEY FOR FUTURE SESSIONS: (a) do NOT re-attempt the opp-gate flip ADMISSION rewrite via margin/voter-conviction (margin/vote-count identity, step3 proof); (b) the VOTER-INDEPENDENT oscillation supplement (step4) is a REAL +0.0024 rally mechanism below keep -- re-testable if the +0.003 bar is ever lowered OR combinable with a complementary mixed-reaching lever (none found this session); (c) mixed is walled on ALL 5 tested exit/sizing axes -- future mixed work must either accept the intrinsic MTM-oscillation floor (0.411, Sh0.808) OR find a 6th axis NOT passing through (exit-timing, proportional sizing, voter-conviction, voter-independent structural); (d) trend_avg<0 guard is load-bearing on any new opp-gate path (protects crash dead-cat longs).
ffc1f8e6	0.699341	0.772996	0.245515	1.025954	0.720320	1.066580	0.641137	0.410990	discard	Exp1 (architectural, indep): MULTI-DAY-DOWNTREND bull admission relaxation (ret_vlong<0 lowers bull strong_min 8pct). MEASURED vs 99a369a1 0.706007: composite -0.006666 (0.699341), mean -0.005807 (0.772996), std 0.242655->0.245515. PER-REGIME all stab 1.0 raw==score: bull BYTE-IDENTICAL 1.025954 (51t, gate ~0 uptrend), crash BYTE-IDENTICAL 0.720320 (52t), sideways BYTE-IDENTICAL 1.066580 (50t), rally 0.670171->0.641137 (-0.029034 Sh1.553->1.438 trades101->119 WR85->81pct AnnRet18.6->19.3pct -- marginal bull entries admitted during brief ret_vlong<0 pullback dips, lower-quality), mixed BYTE-IDENTICAL 0.410990 (43t Sh0.808 -- TARGET MISSED). FAILURE MECH (architectural fact, direct measurement): mixed added ZERO trades on the multi-day-ct-sign admission axis -- mixed is voter-SATURATED at admission even during its ret_vlong<0 longs (the marginal bull entries either dont exist or dont reach even the lowered 8pct bar). Extends the documented admission-adds-zero-trades finding (de412448 session, strong regimes) to MIXED on the multi-day-ct-sign axis. The ret_vlong<0 gate is NOT mixed-specific enough: rally has bull entries during brief multi-day-uptrend pullbacks where ret_vlong dips <0 (rally grinds up but pullbacks can flip the 96-bar slope momentarily) -> those leaked into the relaxation. Reverted to 99a369a1. KEY: multi-day-ct-sign admission axis is a 6th confirmation that mixed trade count is NOT admission-reachable (now tested on vol_ratio, rsi_trend_str, R^2, churn, persistence, multi-day-ct-sign -- all add 0 mixed trades or leak rally).
a9a6d424	0.706007	0.778803	0.242655	1.025954	0.720320	1.066580	0.670171	0.410990	discard	Exp2 (architectural, indep): STALE-LOSS exit pressure (re-test of catalogued surgical rally-raw lever ba7cd2fb at current stab-1.0 baseline). MEASURED vs 99a369a1 0.706007: BYTE-IDENTICAL all 5 regimes (composite 0.706007, every Sharpe/DD/trade-count identical: bull Sh2.0678 51t, crash Sh1.2539 52t, sideways Sh2.0270 50t, rally Sh1.5529 101t, mixed Sh0.8075 43t; min_stab 0.844331 unchanged). FAILURE MECH (architectural fact): the stale-loss term (_stale_pressure = 0.50*ramp(bars_held>8)*adversity(pos_pnl<-0.6stop)) NEVER wins the MAX soft-exit argmax at the current baseline -- the bleeder zone (held past time-pressure onset AND still underwater) is fully dominated by existing exit pressures (slope-against fires before slope reverses are needed, time-pressure ramps, pp giveback, ve, vc). Reconfirms the row-708 inert finding (a5c60e3a baseline, bar6/0.48pct variant inert) now at 99a369a1 which has EVEN MORE exit sources (ve, vc added since a5c60e3a -> bleeder zone more fully covered). The ba7cd2fb surgical gain (rally +0.04 Sharpe at de412448) does NOT replicate because de412448 had FEWER exit pressures (no ve/vc, no MTM-chop throttle) leaving a bleeder gap; the current baseline closed that gap. Reverted to 99a369a1. KEY: stale-loss exit is a 2nd confirmation (row708 + this) that the bleeder zone is fully covered at modern baselines -- do NOT re-attempt unless exit pressures are first REMOVED (opening a gap).
deda4abd	0.702499	0.776136	0.245457	1.026304	0.720480	1.066191	0.664293	0.403412	discard	Exp3 (architectural simplification): REMOVE 4 mixed-grid entry boosts (btcvol_partner, partnervol_btc, btcdvp, partnerdvp) flagged as redundancy-risk in their own comments. MEASURED vs 99a369a1 0.706007: composite -0.003508 (0.702499), mean -0.002667 (0.776136), std 0.242655->0.245457. PER-REGIME all stab 1.0 raw==score: bull 1.025954->1.026304 (+0.0004 noise Sh2.0678->2.0686 51t), crash 0.720320->0.720480 (+0.0002 Sh1.2539->1.2542 52t), sideways 1.066580->1.066191 (-0.0004 Sh2.0270->2.0305 50t), rally 0.670171->0.664293 (-0.005878 Sh1.5529->1.5396 101t), mixed 0.410990->0.403412 (-0.007578 Sh0.8075->0.8010 trades 43->42). FAILURE MECH (architectural fact): the 4 mixed cells were LOAD-BEARING not redundant -- removing them regressed BOTH mixed (-0.008, the DVP-column btcdvp/partnerdvp cells per prior row-1286 finding that partnerdvp moved mixed +0.0068) AND rally (-0.006). The boosts fire as near-constants at deep saturation (each +0.05 max) but their CONSTANT contribution to first-bar size IS the signal -- removing them uniformly shrinks the entry sizing for the broad-trend entries they confirm. NOT dead-code-adjacent (contrast _ar_pressure Exp4 keep which was byte-identical on removal -- these moved regimes on removal). Reverted to 99a369a1. KEY: the {own,BTC,partner}x{vol,price,DVP} mixed-grid boosts are confirmed load-bearing (this removal regresses); future simplification should NOT target this cluster.
89805170	0.681498	0.762247	0.269163	1.026676	0.720237	1.066926	0.670179	0.327217	discard	Exp4 (architectural, indep): 9th voter -- DIRECTIONAL VOLUME PRESSURE (normalized OBV), appended without touching existing 8 weights (small fixed 0.55, deep-saturated /0.15). MEASURED vs 99a369a1 0.706007: composite -0.024509 (0.681498), mean -0.016556 (0.762247), std 0.242655->0.269163. PER-REGIME all stab 1.0 raw==score: bull 1.025954->1.026676 (+0.0007 noise Sh2.0678->2.0694 51t), crash 0.720320->0.720237 (-0.0001 Sh1.2539->1.2537 51t), sideways 1.066580->1.066926 (+0.0003 Sh2.0270->2.0294 50t), rally 0.670171->0.670179 (BYTE-IDENTICAL Sh1.5529 101t), mixed 0.410990->0.327217 (-0.083773 Sh0.8075->0.6423 trades 43->57 WR100->89.5pct DD2.78->3.01 AnnRet4.4->3.6pct). DECISIVE DIAGNOSTIC (architectural fact, direct measurement): the DVP voter added 14 mixed trades but mixed WR CRASHED 100->89.5pct and Sharpe FELL 0.808->0.642 -- mixeds 43 trades are the WINNERS (genuine voter selectivity); the marginal entries the 9th voter admitted are LOSERS. The sample_factor lever (mixed at 43 trades = 0.927 penalty) is a TRAP: adding trades regresses Sharpe/WR MORE than the 0.927->1.0 sample_factor recovers (mixed score 0.411->0.327 = -0.084 vs the +0.032 the sample_factor recovery would have given). Conclusively explains (a) why ALL prior admission-relaxation attempts added 0 mixed trades (the existing voters are CORRECTLY saturated -- they filter exactly the losers), and (b) that forcing mixed trades via a new orthogonal voter regresses. mixed is NOT under-trading; its 100pct WR is real selectivity on 43 signal-bound trades. bull/crash/sideways/rally near-identical (DVP voter near-constant in trends at deep saturation as expected). Reverted to 99a369a1. KEY for future sessions: (a) the sample_factor lever on mixed is CONFIRMED a trap -- do NOT attempt to raise mixed trade count via admission/voter changes (this session Exp1 + Exp4 + 5 prior sessions all confirm); (b) mixeds residual low-Sharpe is INTRINSIC to its 43 winner trades MTM oscillation, NOT addressable by trade-count; (c) a new orthogonal voter IS the un-disproven axis BUT it regresses mixed because mixed is correctly selective -- future voter additions must NOT aim to add mixed trades.
f152443d	-999	-199.252468	399.873813	-999	0.638929	1.018778	0.664761	0.415191	branch	STRUCTURAL_EXPLORATION step1 (exit-pressure fusion MAX -> tempered LSE soft-maximum, ungated). MEASURED vs 99a369a1 0.706007: raw_composite -319.21 (catastrophic via bull -999). PER-REGIME: bull -999 (Sh2.068->-0.822 MaxDD2.49->22.11pct trades51->111 WR86->63pct -- LSE agreement bonus over-fired on bull pullbacks where slope/time/pp ALL sit moderate), crash 0.720->0.639 (Sh1.254->1.233), sideways 1.067->1.019 (Sh2.027->1.979), rally 0.670->0.665 (Sh1.553->1.535), mixed 0.411->0.415 (Sh0.808->0.823). 50pct gate BREACHED on bull (1.026->-999) + MaxDD 22pct >10pct cutoff. raw_composite 0.424 (excl bull -999). DIAGNOSIS: LSE re-introduces correlated-noise ADDITION the MAX keep eliminated -- moderate multi-source overlap in bull pullbacks inflates pressure every pullback -> over-exit churn -> DD blowup. Branch continues: gate bonus to chop only (step2).
b0cdfc74	0.412545	0.507523	0.316594	0.885753	0.716554	0.157456	0.675044	0.102806	branch	STRUCTURAL_EXPLORATION step2 (chop-gate the LSE agreement bonus). MEASURED: composite 0.412545, raw_composite 0.424175 (FLAT vs step1 -- no progress). PER-REGIME: bull recovered 0.886 (Sh1.916 MaxDD2.49 -- chop-gate fixed bull blowup), crash 0.717 (Sh1.249), sideways COLLAPSED 1.067->0.157 (Sh2.027->1.165 MaxDD1.88->9.68pct trades50->101 WR98->77pct -- sideways IS chop so gate fires fully -> moderate slope/time/pp overlap in chop = constant inflation -> over-exit churn), rally 0.675 (Sh1.564 -- slight UP), mixed 0.103 (Sh0.808->0.447 MaxDD2.78->6.39pct trades43->96 WR100->74pct -- mixed ALSO chop -> same over-fire). 50pct gate BREACHED on sideways (1.067->0.157, 85pct drop) + mixed (0.411->0.103, 75pct drop) + MaxDD 9.68pct approaching 10pct. DIAGNOSIS: premise WRONG -- in chop moderate multi-source agreement is the NORM (mean-reverting noise) not reversal; bonus = constant inflation in chop. Branch continues: restrict to STRONG agreement only (step3).
5c6e9ba3	-999	-199.450581	399.774753	-999	0.689312	0.155934	0.575188	0.326659	branch	STRUCTURAL_EXPLORATION step3 (strong-agreement-only gate: bonus fires only when 2nd-highest term >=50pct of max). MEASURED: raw_composite -319.37 (bull -999 again). PER-REGIME: bull -999 (Sh0.458 MaxDD13.50pct trades51->110 WR86->74.5pct -- strong-agreement gate STILL fires in bull: sharp pullbacks have slope+time+pp ALL near-saturate simultaneously -> bonus -> over-exit churn), crash 0.689, sideways 0.156 (still collapsed -- chop has high ratio_2nd too), rally 0.575 (Sh1.469 -- REGRESSED, the strong-agreement gate fired on rally pullbacks), mixed 0.327. 50pct gate BREACHED on bull+sideways+mixed. raw_composite 0.424 FLAT over 3 steps (step1=step2=step3=0.424, ZERO progress). TERMINATED: no progress + safety-net breaches. CONCLUSION: the LSE agreement bonus premise is REFUTED across 3 gating strategies (ungated/chop/strong-agree) -- ANY multi-source agreement bonus re-introduces the correlated-noise ADDITION the MAX keep eliminates; every regime has bars where multiple exit sources co-saturate (trend pullbacks, chop mean-reversion) and inflating pressure there causes over-exit churn. MAX fusion is at a genuine STRUCTURAL OPTIMUM, not a ceiling.
