commit	score	mean_score	std_score	bull_2021	crash_bear	sideways	rally_2024	status	description
-	0.563861	0.640462	0.255339	0.348217	0.730154	1.012687	0.470791	discard	Exp1 portfolio loss-streak entry block (cross-symbol hard cooldown 2bars after 3 consec losses, architectural new control flow). composite -0.215453 vs baseline 0.779314. PER-REGIME: bull 0.923316->0.348217 (-0.575099, Sh1.936->1.094, DD3.71->6.31pct, stab0.866->0.718 BELOW 0.80 knee -> stability_factor penalizes raw0.480->score0.348; block fired on bull 3-streak and blocked WINNING trend-aligned re-entries), crash 0.730154 byte-identical (0 consec losses -> block never fires), sideways 1.012687 byte-identical (0-1 consec -> rarely fires), rally 0.632168->0.470791 (-0.161377, Sh1.470->1.100, DD6.36->6.90pct UP, stab0.807->0.847; blocked 66pct-WR ct winners, DD rose not fell). std blew 0.151->0.255. PREMISE FALSIFIED: a hard entry block cannot reduce max_consecutive_losses because the blocked trades include winners (rally ct shorts 66pct WR, bull 4th-entry trend longs) -- missed-return exceeds loss-avoided, AND DD rose. The streak is structural (confirming prior sessions ct-admission finding extended to a hard-block). Distinct from prior ct-admission-tightening (this was a portfolio-wide hard block, still failed). crash/sideways sparring confirms block only fires at streak>=3 (bull/rally depth). Reverted to 637f5e53. 1st architectural discard.-	-999.000000	-249.078098	432.967625	0.960176	0.723100	1.004334	-999.000000	discard	Exp2 portfolio-DD-adaptive time-pressure intensification (shorten max_hold up to 20pct during portfolio DD, architectural new control flow on the TIME exit path). composite -999 (rally DD 6.36->12.71pct breached 10pct hard cutoff). PER-REGIME: bull 0.923316->0.960176 (+0.036860, Sh1.936->1.972, DD3.71->3.40pct -- DD-relief engaged on non-reversionary bull corrections), crash 0.730154->0.723100 (-0.007054, Sh1.274->1.261, byte-near-identical), sideways 1.012687->1.004334 (-0.008353, Sh2.001->1.987), rally 0.632168->-999 (Sh1.470->1.054, DD6.36->12.71pct BREACH, stab 1.0). ROOT CAUSE: the TIME exit path cuts MID-LIFE positions during DD pullbacks, including OPEN/LOSING rally positions that would REVERT upward -- same failure mode as the walled held-position de-risk (row 1015, cut HELD positions at a loss during DD -> missed rally upward reversion). This confirms the documented principle: only PEAK-harvesting DD levers (giveback-tightening harvesting at peak, tp-harvest at deep peak) are rally-safe because they lock realized gains and never cut an open/losing position; any OPEN-position cut during DD (held-de-risk, time-pressure, slope) backfires on rallys reversionary pullbacks. bull gain (+0.037) is real but unusable (rally DD breach). Reverted to 637f5e53. 2nd architectural discard (exit-rule 2-arch minimum MET).-	0.779314	0.824581	0.150890	0.923316	0.730154	1.012687	0.632168	discard	Exp3 loss-gated portfolio-DD time-pressure intensification (shorten max_hold during DD only for pos_pnl<0, architectural refinement of Exp2). BYTE-IDENTICAL INERT: composite 0.779314 unchanged, all 4 regimes byte-identical incl MaxDD (bull 0.923316 Sh1.936 DD3.71pct, crash 0.730154 Sh1.274 DD3.04pct, sideways 1.012687 Sh2.001 DD2.75pct, rally 0.632168 Sh1.470 DD6.36pct). ROOT CAUSE: loss-side time-pressure is non-binding -- losing positions exit via the ATR stop (sl_pressure hard gate, fires before max_hold) so shortening max_hold for losers during DD changes nothing. COMPLETES THE TIME-PATH DD-LEVER WALL: Exp2 (winner-side DD-time-shorten) blew rally DD 6.36->12.71pct via reversion-miss (cut winning trend-aligned longs during reversionary pullbacks); Exp3 (loser-side) inert (ATR-stopped first). The TIME exit path cannot contribute DD-reduction on EITHER side -- winners cut = reversion-miss (DD up), losers already ATR-stopped (inert). Only PEAK-harvesting DD levers (giveback-tightening, tp-harvest, both maxed at magnitude cliffs) are rally-safe. Reverted to 637f5e53. 3rd architectural discard.-	-	-	-	-	-	-	-	session-summary	SESSION (baseline 637f5e53 0.779314 -> UNCHANGED, no keep): 3 independent architectural experiments (Exp1-3, all discards), no branch opened. EXIT at 3 consecutive architectural discards (2-arch minimum exceeded; no promising direction for a branch -- every regime showed only walls or unusable signals). Baseline 637f5e53 re-verified reproduces 0.779314 byte-identical [bull 0.923316 Sh1.936 DD3.71pct sg0.905(3 consec), crash 0.730154 Sh1.274 DD3.04pct sg1.000(0 consec,100pct WR), sideways 1.012687 Sh2.001 DD2.75pct, rally 0.632168 Sh1.470 DD6.36pct sg0.875(4 consec); all stab 1.0, all raw==score, min_stab 0.807]. SCORE DECOMPOSITION (computed this session): streak_gate is the largest non-walled-appearing drag for rally (0.875, 4 consec losses -> 3 would give +3.3pct rally) AND bull (0.905, 3 consec). THEME: probed the STREAK and TIME-PATH-DD levers, both confirmed walled. Exp1 PORTFOLIO LOSS-STREAK ENTRY BLOCK (cross-symbol hard cooldown 2bars after 3 consec losses, NEW control flow distinct from prior ct-ADMISSION-tightening): CATASTROPHIC bull 0.923->0.348 (stab 0.866->0.718 below knee, Sh1.936->1.094, DD3.71->6.31pct) + rally 0.632->0.471 (Sh1.470->1.100, DD6.36->6.90pct UP); crash/sideways byte-identical (0/0-1 consec -> block never fires). PREMISE FALSIFIED: a hard entry block cannot reduce max_consecutive_losses because blocked trades include WINNERS (rally ct shorts 66pct WR, bull 4th-entry trend longs) -- missed-return exceeds loss-avoided, DD rose. Extends prior ct-admission-tightening-doesnt-engage-streak finding to a portfolio-wide hard block: the streak is STRUCTURAL (unbreakable from entry side, whether via threshold-tighten or hard-block). Exp2 PORTFOLIO-DD TIME-PRESSURE INTENSIFICATION (shorten max_hold up to 20pct during DD, NEW control flow on the TIME exit path, a 3rd DD-reduction lever distinct from maxed giveback-tightening + tp-harvest): rally DD 6.36->12.71pct BREACHED 10pct cutoff (-999); bull +0.037 (Sh1.936->1.972, DD3.71->3.40pct -- DD-relief on non-reversionary corrections). ROOT CAUSE: un-gated shortening cut WINNING trend-aligned positions during rally DD pullbacks, and rally pullbacks REVERT upward -> missed recovery -> DD compounded (same failure as walled held-position de-risk row 1015). Exp3 LOSS-GATED DD TIME-PRESSURE (Exp2 refinement, shorten max_hold during DD only for pos_pnl<0): BYTE-IDENTICAL INERT -- losers exit via ATR stop (sl_pressure hard gate) before max_hold, so loss-side time is non-binding. COMPLETES THE TIME-PATH DD-LEVER WALL: winner-side = reversion-miss (DD up), loser-side = ATR-stopped-first (inert). Only PEAK-harvesting DD levers (giveback-tightening, tp-harvest, both at magnitude cliffs) are rally-safe. CROSS-SESSION CONCLUSIONS (all measured this session): (a) the rally 4-loss streak is structurally unbreakable from the ENTRY side (hard block failed same as ct-admission-tighten); the streak lives in re-entry sequences whose individual trades are net-necessary for raw (blocking collapses raw). (b) the TIME exit path is a DEAD DD-reduction lever on both sides (winners cut = reversion-miss, losers ATR-stopped-first) -- only peak-harvesting works, and it is maxed. (c) bull (+0.037 in Exp2) responds to DD-relief but only via winner-cutting which is rally-incompatible (reversion coupling); bull DD-relief is maxed via giveback-tightening. (d) the composite is stuck: rally (binding, all levers walled -- streak structural, DD maxed, Sharpe admission-coupled), crash (return-limited, leverage-walled, hold-longer backfires, admission-coupled to rally), bull (streak structural, DD maxed), sideways (at ceiling, raising hurts std). STRUCTURAL-EXPLORATION eligibility met (3 arch discards) but NOT attempted: every core subsystem rewrite (voter-aggregation quintic, exit-fusion MAX, de-risk cushion) touches rally admission/exit timing or DD -- the knife-edge where Exp2 breached 10pct DD and prior sessions blew rally DD 7.34->14.90pct on a TOD tilt; the relaxed gates RETAIN the 10pct DD cutoff, so a subsystem rewrite would very likely discard on step 1 at high cost. NEXT SESSION: the strategy is at a confirmed deep local optimum (3 prior sessions now total 13 architectural discards + 2 reverted branches with no keep since 637f5e53). The remaining documented avenue (structural-exploration subsystem rewrite) is high-risk for immediate DD-breach; consider only if a non-timing-touching core mechanism replacement becomes identifiable. results.tsv append-only preserved (path-scoped git checkout -- strategy.py throughout, never git revert); all 3 discards reverted to 637f5e53.
	-999.000000	-499.126289	499.873722	-999.000000	0.596834	0.898010	-999.000000	discard	Exp1 (architectural, indep): VOTER-AGGREGATION RAMP POWER quintic->sextic (P=5->6, renormalized NORM=1/0.4^6). The ONE core mechanism of the voter-aggregation subsystem never directly varied (prior voter-agg attempts were family-discount + max-trim, both failed per conclusion (d) row 26f4b23d). Varying P is structurally different: changes SHAPE of conviction->contribution map, not WHICH voters count. Sextic sharpens so weak/marginal voters (conf 0.6-0.75) contribute even less, requiring a tighter CLUSTER of strong voters for admission. Hypothesis: filters rally low-conviction ct re-entries (streak source) while preserving trend conviction (sextic weights strong co-firing MORE per conclusion d). MEASURED vs 637f5e53 0.779314: CATASTROPHIC composite -999 (2 regimes breached 10pct DD cutoff). PER-REGIME all stab 1.0 all raw==score: bull 0.923316->-999 (Sh1.936->0.265, DD3.71->13.72pct BREACH, WR82.1->68.8pct, 56->64 trades), crash 0.730154->0.596834 (-0.133320, Sh1.274->1.257, DD3.04->3.07pct, 52->35 trades 100pct WR held), sideways 1.012687->0.898010 (-0.114677, Sh2.001->1.888, DD2.75->2.74pct, 52 trades), rally 0.632168->-999 (Sh1.470->-0.440, DD6.36->14.38pct BREACH, WR85.0->57.1pct, 100->49 trades). ROOT CAUSE: conclusion (d) CONFIRMED and STRONGER than expected -- sharpening away medium-conviction voters HURT the trend regimes (bull/rally) that rely on a BROAD coalition of price-trend voters co-firing, not just the strongest; rally WR collapsed 85->57pct (the filtered medium-conviction entries WERE the trend entries, not noise). crash/sideways (mean-reverting, fewer trend entries) partially spared but still regressed. The ramp power is NOT a free lever -- the quintic shape is load-bearing for trend-regime admission breadth. Reverted to 637f5e53. 1st architectural discard.
	-999.000000	-499.126293	499.873719	-999.000000	0.596834	0.897995	-999.000000	discard	Exp2 (architectural, indep): VOTER-AGGREGATION RAMP POWER quintic->QUARTIC (P=5->4, renormalized NORM=1/0.4^4=39.06). Symmetric counterpart to Exp1 (sextic P=6, discarded): Exp1 showed sharpening HURT trend regimes (bull WR 82->69pct, rally WR 85->57pct, both DD breached) -- inverted hypothesis (medium-conviction voters carry trend signal, not noise). Quartic flattens the map giving medium voters MORE weight (conf=0.7 contrib 0.031->0.0625; conf=0.8 0.237->0.316) to test if broadening captures that signal productively. MEASURED vs 637f5e53 0.779314: CATASTROPHIC composite -999, BYTE-IDENTICAL to Exp1 sextic results (bull Sh0.265 DD13.72pct 64 trades WR68.8pct; rally Sh-0.440 DD14.38pct 49 trades WR57.1pct; crash 0.596834 Sh1.257; sideways 0.897995 Sh1.888 -- identical to sextic to the decimal). ROOT CAUSE: the admission decisions are POWER-INVARIANT for P=4 vs P=6 (saturated voters conf=0.9 contribute 1.0 in both via renormalization; medium voters barely move the EMA-readiness accumulator margin which is dominated by near-saturated voters) -- yet BOTH deviate catastrophically from P=5 quintic. This means the EXACT quintic shape is a sharp tuned local optimum: the medium-voter contribution magnitudes at P=5 are precisely calibrated against STRONG_WEIGHT_MIN=1.75 / the EMA accumulator RHO/THRESH, and ANY power shift (either direction) breaks the bull/rally trade set (DD breach + Sharpe collapse). The ramp-power lever is load-bearing at P=5 BOTH ways -- not a free lever in either direction. Completes characterization of the one previously-untested voter-aggregation core mechanism: it is walled. Reverted to 637f5e53. 2nd architectural discard (2-arch minimum MET).
	0.777118	0.822940	0.152739	0.923359	0.730315	1.012205	0.625880	discard	Exp3 (architectural, simplification): REMOVED 4 grid-completion volume boosts (_btcvol_partner, _partnervol_btc, _btcdvp, _partnerdvp) + their now-dead DVP computations (_btc_dvp block, _alt_dvp loop). These were the MIXED cells + DVP column of the {own,BTC,partner}x{vol,price,DVP} grid, each +0.05 max deep-saturated, alt-only (BTC byte-identical 1.0). Their own comments flagged them possibly-redundant with the 5 clean 2-way boosts. Added under older scoring; under v2.2 the compounding +0.05x4 over-commitment of correlated alt trend legs MAY now be net-negative. MEASURED vs 637f5e53 0.779314: composite -0.002196 (0.777118 SUB-NOISE REGRESSION), raw_composite 0.779016 (~unchanged), mean -0.001641 (0.822940), std +0.001849 (0.152739). PER-REGIME all stab 1.0 except rally: bull 0.923316->0.923359 (BYTE-IDENTICAL +0.000043, Sh1.936->1.937, DD3.71 unchanged -- boosts were 1.0 for BTC, bull is BTC-dominated), crash 0.730154->0.730315 (BYTE-IDENTICAL +0.000161, Sh1.274 DD3.04 -- crash shorts unaffected), sideways 1.012687->1.012205 (-0.000482, Sh2.001->2.004), rally 0.632168->0.625880 (-0.006288, raw 0.632168->0.631360 -0.000808, stability_factor 1.0->0.991321 DROPPED, min_stability 0.807->0.797 BELOW 0.80 knee, Sh1.470->1.462, DD6.36->6.18, 100->99 trades). ROOT CAUSE: the 4 boosts were MILDLY LOAD-BEARING for rally STABILITY (not redundant) -- they fire on rally alt trend-LEG entries (ETH/SOL longs) and their removal introduced exit/entry-timing noise on those alt legs dropping rally stability below the 0.80 knee (the documented entry-shrink noise wall: removing/adding entry-side sizing on rally alt legs perturbs the noise-sensitive rally resize lattice). bull/crash byte-identical confirms the boosts only touched alt trend entries (BTC self-referential = 1.0). The grid-completion boosts are NOT redundant under v2.2 -- they contribute to rally alt-leg stability. Reverted to 637f5e53. 3rd architectural discard.
	0.778548	0.823992	0.151479	0.923316	0.727337	1.013146	0.632168	discard	Exp4 (architectural, indep): RANGE-EXPANSION exhaustion exit pressure (7th active soft MAX source). NEW data primitive: no existing voter/pressure reads single-bar PRICE RANGE relative to ATR. _ve uses vol-of-PRICE (6/18-bar std of log returns, a window return-dispersion); _vc uses VOLUME z; ATR_pct uses true-range MEAN. None measures whether the last bars range is unusually large vs recent ATR (breakout/exhaustion SHAPE). 3-bar mean range / _atr_pct; profit-side only; tanh above 1.4x saturate ~2.2x; max 0.45. MEASURED vs 637f5e53 0.779314: composite -0.000766 (0.778548 SUB-NOISE REGRESSION), raw_composite==composite (all stab 1.0, all raw==score, min_stab 0.807). PER-REGIME: bull BYTE-IDENTICAL 0.923316 (Sh1.936 DD3.71 56 trades), crash 0.730154->0.727337 (-0.002817, Sh1.274->1.271, DD3.04->3.05, 52->51 trades -- range-climax harvested one crash short early, lower Sharpe), sideways 1.012687->1.013146 (+0.000459, Sh2.001->2.002), rally BYTE-IDENTICAL 0.632168 (Sh1.470 DD6.36 100 trades). ROOT CAUSE: the range-expansion exit is INERT on the binding regimes (rally/bull byte-identical) because giveback/slope-against fires first -- confirms the documented EXIT-PATH INERTNESS wall (binding-regime winners exit via giveback+time; no additional exit source changes them, same as peak-stall Exp2-prior, trend-deceleration, cross-symbol-divergence). The only effect was a small crash regression (early harvest of one short) + tiny sideways gain, net sub-noise negative. A price-range exhaustion signal adds no incremental value at the exit decision. Reverted to 637f5e53. 4th architectural discard.
	0.779898	0.824993	0.150316	0.923240	0.729920	1.012725	0.634087	branch:open	Exp5 (architectural, indep): WICK-REJECTION entry boost. NEW candle-shape primitive: open-relative lower/upper wick (lower_wick = min(open,close)-low = intrabar DIP REJECTION of lows, bullish). Distinct from close_loc ((close-low)/(high-low)) which INCLUDES the body and is a linear transform of upper-vs-lower wick -- close_loc CANNOT isolate dip rejection. A bar closing at the high (close_loc=1.0) may have NO lower wick (open=low) OR a LARGE lower wick (open dipped then closed high) -- close_loc identical, wick-rejection very different. NO existing primitive reads open-relative wick. 3-bar mean lower-wick-frac for noise robustness (single-bar wicks flip under AR(1) high/low perturbation). Mirrors the validated close-conv boost envelope EXACTLY (trend_w x ER grind gate x multi-day ret_vlong>0 bull gate x deep-saturated /0.15 conviction), first-bar-only, +0.05 max, bilateral. MEASURED vs 637f5e53 0.779314: composite +0.000584 (0.779898 SUB-NOISE <0.003 keep threshold but POSITIVE), raw_composite==composite (all stab 1.0, all raw==score, min_stab 0.807). PER-REGIME: bull 0.923316->0.923240 (-0.000076 near-identical, Sh1.936 DD3.71 56 trades), crash 0.730154->0.729920 (-0.000234, Sh1.274->1.273 DD3.04 52 trades), sideways 1.012687->1.012725 (+0.000038, Sh2.001), rally 0.632168->0.634087 (+0.001919 BINDING-REGIME GAIN -- Sh1.470->1.475, DD6.36->6.37, 100->102 trades, WR85.0->85.3pct). All MaxDD<10pct, no regime >50pct drop, all stab 1.0. BRANCH OPENED (per-regime improvement on binding regime + fundamentally new mechanism): the wick-rejection signal is REAL for rally (grinding-uptrend bars have dip-rejection wicks -- buyers absorb intrabar pullback selling -> higher-conviction long -> larger first-bar commitment captures more trend). Diagnosis = magnitude too small (0.05 max boost -> rally +0.0019, need +0.003 composite); the tiny bull/crash regressions suggest the wick fires occasionally on non-rally bars. Fix hypothesis = amplify the wick magnitude (0.05->0.08) OR tighten the conviction gate so it fires only on STRONG dip-rejection (less bull/crash leakage), pushing rally toward +0.003 while protecting bull/crash. Iterating in branch.
	0.779701	0.824844	0.150476	0.923194	0.729779	1.012749	0.633654	branch:step1	Branch step1: amplify wick magnitude 0.05->0.08. MEASURED vs step0 0.779898: composite -0.000197 (NO-PROGRESS), raw_composite==composite (all stab 1.0, min_stab 0.807). PER-REGIME vs step0: bull 0.923240->0.923194 (-0.000046), crash 0.729920->0.729779 (-0.000141), sideways 1.012725->1.012749 (+0.000024), rally 0.634087->0.633654 (-0.000433 REGRESSION -- Sh1.475->1.476 up slightly BUT DD6.37->6.40 up, 102 trades). ROOT CAUSE: magnitude amplification triggers the entry-shrink noise wall -- larger first-bar sizing on rally alt legs gives back more (rally DD up), offsetting the conviction gain. The rally +0.0019 at 0.05 does NOT scale with magnitude; 0.05 is near the sweet spot. Magnitude is the wrong lever. 1st no-progress step.
	0.779906	0.825003	0.150322	0.923279	0.729920	1.012725	0.634088	branch:step3	Branch step3: remove bear-side wick boost (bull-only, _wick_boost_bear=1.0). MEASURED vs step0 0.779898: composite +0.000008 (MARGINAL PROGRESS, breaks no-progress streak), raw_composite==composite (all stab 1.0, min_stab 0.807). PER-REGIME vs step0: bull 0.923240->0.923279 (+0.000039), crash 0.729920 IDENTICAL (bear wick removal did NOT change crash -- crash shorts unaffected by bear wick boost), sideways 1.012725 IDENTICAL, rally 0.634087->0.634088 IDENTICAL (rally gain FULLY PRESERVED). KEY: the bear wick boost was INERT (never affected crash or rally ct shorts); the ENTIRE rally +0.0019 gain comes from the BULL wick boost alone. Bull-only is marginally cleaner (simpler, same rally gain, tiny bull recovery). Composite still +0.000592 sub-noise vs baseline, far from +0.003 keep.
	0.779926	0.825015	0.150297	0.923272	0.729871	1.012727	0.634190	branch:step4	Branch step4: loosen bull wick threshold 0.25->0.15 (fire on more dip-rejection bars). MEASURED vs step3 0.779906: composite +0.000020 (MARGINAL PROGRESS, essentially flat), raw_composite==composite (all stab 1.0, min_stab 0.808). PER-REGIME vs step3: bull 0.923279->0.923272 (-0.000007), crash 0.729920->0.729871 (-0.000049), sideways 1.012725->1.012727 (+0.000002), rally 0.634088->0.634190 (+0.000102, Sh1.475->1.477, DD6.37->6.40). BRANCH PLATEAUED at ~+0.0006 composite (rally +0.0020, Sh1.470->1.477). All amplification levers exhausted: magnitude 0.08 -> rally DD up -0.0004 (entry-shrink noise wall); tighten gate 0.35 -> rally gain lost -0.0005; bear removal -> inert (rally gain all bull-side); loosen gate 0.15 -> marginal +0.0001. The wick mechanism is a REAL but SUB-NOISE rally signal (+0.0020) un-amplifiable to the +0.003 keep threshold -- entry-shrink noise wall caps magnitude, threshold tuning gives only marginal moves. Per sub-noise rule (<0.003 = in-sample noise-floor, discard even if positive), not keepable. TERMINATING branch.
