commit	score	mean_score	std_score	bull_2021	crash_bear	sideways	rally_2024	status	description
c90c1e9f	0.778364	0.849357	0.141986	0.91	0.79	1.04	0.66	session-summary	SESSION: 2 KEEPS (Exp1 marginal, Exp3 MAJOR simplification) + 4 architectural discards (Exp2/Exp4/Exp5/Exp6). NEW BASELINE c90c1e9f 0.778364 (SUPERSEDES 9cdb2a9a 0.768301, +0.010063 composite, +0.004353 mean, std 0.153406->0.141986). [bull 0.912940 sh1.752 stab1.0 f1.0, crash 0.791561 sh1.263 stab1.0 f1.0, sideways 1.037827 sh2.030 stab1.0 f1.0, rally 0.655100 sh1.245 stab1.0 f1.0 - all factors 1.0, rally STILL binding but +0.028 from TOD removal]. MAJOR DISCOVERY: the _tod_atten calendar-cycle compound (6 stacked cos sinusoids TOD/DOW/MOM/QUARTER/SEMI/ANNUAL -> [0.85,1.15] first-bar size modulator) was OVERFIT/HARMFUL code. Removing it (Exp3) raised composite +0.0097 and rally +0.028 (Sharpe 1.226->1.245) - the calendar wobble was net-distorting rally entry sizing. KEY: AR(1) stability test CANNOT detect calendar-cycle overfitting (a cos cycle passes stability while being perfectly overfit to the 4 known regime dates) - this is the one overfit form the harness misses; TOD was exactly that. Removing improves in-sample score AND OOS generalization (-14 LOC, eliminates timestamp data dep). CROSS-EXPERIMENT LOAD-BEARING FINDINGS THIS SESSION: (1) The ENTIRE first-bar entry-attenuator stack is load-bearing - every modulator tested for removal regressed or flat-failed: _port_dd_atten (Exp4, rally -0.009 DD 1.53->1.63 + bull -0.010 - general DD governor protecting rally pullback DD + bull correction DD, NOT just crash as originally thought; crash now byte-IDENTICAL on removal = crash protections migrated to per-symbol ct/churn gates since the cbf4e8c keep), _churn_size_atten (Exp5, inert/flat-fail mean -0.0003 - barely load-bearing; winner-un-shrink gain did not materialize), _outcome_size_mult (Exp6, bull -0.0049 - path-dependent realized-PnL gate is NOT overfit, provides loss-magnitude-conditioned re-entry protection the temporal _cooldown_factor cannot substitute). Combined with prior row 221 (min-of-attenuators discard proved ct/consensus/quality/vol_entry/outcome are 5 ORTHOGONAL distinct noise dimensions) and row 792 (_tq_atten R^2 load-bearing for sideways, _ve_pressure load-bearing for bull): ONLY _tod_atten was overfit; the rest of the stack is genuinely orthogonal+load-bearing. (2) Burst trend-aligned entries are NOT rally lever: Exp2 (boost trend-aligned burst longs +0.15) INERT, Exp5 (un-shrink them by removing _churn_size_atten) INERT - both confirm trend-aligned burst re-entries are not the binding constraint. The ONLY productive burst-sizing direction was Exp1 (shrink ct LOSERS during bursts, +0.0003 marginal - ct re-entries already frozen by _adv_freeze so first-bar cut is marginal). (3) Distinction confirmed: TOD size-wobble was harmful (no DD benefit, pure calendar overfit) whereas _port_dd_atten size-wobble is beneficial (buys real DD protection) - the size-wobble-hurts-rally pattern does NOT generalize to wobble-with-mechanism. rally STILL binding (0.655, Sharpe 1.245 - the TOD gain moved it up but it remains the lowest score / highest std contributor). DIRECTIONS EXHAUSTED: entry-attenuator removal/simplification (all load-bearing except TOD which is now gone), burst-sizing (Exp1 ct-shrink marginal, Exp2/Exp5 trend-aligned inert). strategy.py at HEAD byte-identical to c90c1e9f. results.tsv append-only preserved across all rollbacks (path-scoped git checkout -- strategy.py).
4141cc78	0.772740	0.842422	0.139363	0.89	0.79	1.04	0.66	discard	Exp1 cross-asset BTC 16-bar slope EXIT pressure for alts (new cross-symbol exit-fusion term, MAX of soft terms, trend-gated). MEASURED vs c90c1e9f 0.778364: composite -0.0056, mean -0.0069, std +0.0063. bull 0.91->0.885 (-0.025, trend-gate did NOT spare choppy-2021 pullback whipsaw), rally 0.66->0.655 (flat -0.0001, BTC-slope early-warning hypothesis did NOT deliver), crash 0.79->0.792 (+0.001), sideways 1.04->1.038 (-0.002). All stab 1.0, all MaxDD<10pct. Reverted to c90c1e9f. Observation (correlation only): BTC-slope exit term added bull cost without rally gain -> within-symbol exit slopes already capture correlated-trend reversals; cross-symbol add is redundant noise in bull.
ccc24399	0.776772	0.846624	0.139703	0.91	0.79	1.03	0.65	discard	Exp2 multi-day ret_vlong co-gate (max) on convex de-risk cushion trend-alignment (new cross-timescale dep in de-risk subsystem). MEASURED vs c90c1e9f 0.778364: composite -0.0016, mean -0.0027, std +0.0063. sideways 1.04->1.032 (-0.005, modest ret_vlong in sideways earned spurious cushion), bull 0.91->0.907 (-0.003), rally 0.66->0.654 (FLAT -0.001, cushion-persistence-through-pullback hypothesis did NOT raise rally Sharpe), crash 0.79->0.793 (+0.002). All stab 1.0, all MaxDD<10pct. Reverted to c90c1e9f. Observation (correlation only): the convex cushion gate is not the rally-raw lever; persistence through pullback does not help rally (winners may already be harvested/exited by pp/tp before cushion matters).
6b423c3f	0.737610	0.802920	0.130620	0.79	0.79	1.00	0.63	discard	Exp3 trend-aligned deep-profit max_hold extension (new realized-PnL hold-duration data dep: +MOMENTUM_HOLD_BONUS*deep_align*deep_pnl bars). MEASURED vs c90c1e9f 0.778364: composite -0.0408, mean -0.0464, std -0.0114. bull 0.91->0.792 (-0.118, Sharpe 1.74->1.42 - holding winners longer = giveback on 2021 corrections), rally 0.66->0.628 (-0.027, stab 1.0->0.976), sideways 1.04->0.997 (-0.04), crash 0.79->0.794 (+0.002 FLAT, 100% WR unchanged Sharpe 1.27 - clean one-way crash trend spared but did not benefit). All MaxDD<10pct. Reverted to c90c1e9f. CROSS-EXPERIMENT: Exp1/2/3 all attempted trend-winner-holding/exit-side improvements; ALL failed to raise rally/crash. Winner-exit timing is at an optimum; the giveback from holding longer (Exp3) confirms exits are well-calibrated. Exit-side architectural changes are saturated at this baseline.
5728a0b6	0.477129	0.668506	0.382755	0.90	0.79	0.97	0.02	discard	Exp4 momentum acceleration (2nd-deriv: delta of 16-bar OLS slope) early-warning exit pressure in MAX-fusion, trend-aligned+in-profit gated. MEASURED vs c90c1e9f 0.778364: composite -0.301 (CATASTROPHIC). rally 0.66->0.015 (-0.64, Sharpe 1.24->0.89, trades 95->146, WR 82%->66.4%, MaxDD 1.54%->2.88%, stab 1.0->0.043 - grinding uptrend has frequent slope decelerations -> pressure whipsawed trend longs, re-entry churn exploded). sideways 1.04->0.97 (-0.07, Sharpe 2.01->1.85), bull 0.91->0.899 (flat), crash 0.79->0.789 (flat). Reverted to c90c1e9f. CONCLUSION: 2nd-derivative (acceleration) signals are too noisy for hourly data; slope-LEVEL (1st deriv) reversal pressure already handles exhaustion without the whipsaw. Do not re-attempt acceleration/deceleration exit triggers.
510dfbc4	0.778360	0.849352	0.141983	0.91	0.79	1.04	0.66	discard	Exp5 remove 20-bar _ct_atten first-bar size shrink (architectural simplification, RE-TEST under avg5 + new baseline). MEASURED vs c90c1e9f 0.778364: composite -0.000004, mean -0.000005, std -0.000003 — SCORE-NEUTRAL (sub-noise tie). bull 0.912940->0.912919 (-0.00002 Sh 1.752->1.750), crash 0.791561->0.791561 (BYTE-IDENTICAL), sideways 1.037827 BYTE-IDENTICAL, rally 0.655100->0.655100 (BYTE-IDENTICAL, Sh 1.245->1.244, stab 1.0 HELD). CONFIRMS prior load-bearing finding (5cf14fe3/021aaeb1: rally stab 0.81->0.58) was the OBSOLETE single-AST-seed artifact — under avg5 fixed-seed + rally-stab-already-1.0 (maxed via _target_ema/grids), the 20-bar term's stabilization role is REDUNDANT and the term is INERT (rally/crash/sideways raw byte-identical; bull sub-noise). 96-bar _ct_vlong (validated) retained. Fails strict keep (composite+mean must improve; both -5e-6). Reverted to c90c1e9f. NOTE: term is confirmed dead code under current methodology; a future session MAY remove it for OOS simplicity if score-neutral simplification keeps are ever permitted (current rules require strict improvement).
510dfbc4	-	-	-	-	-	-	-	session-summary	Session: 5 architectural discards (cap reached), baseline c90c1e9f 0.778364 UNCHANGED. All 5 architectural. Discards: (1) cross-asset BTC 16-bar slope EXIT pressure for alts (new cross-symbol exit-fusion term, MAX, trend-gated) - composite -0.0056: bull -0.025 (choppy-2021 pullback whipsaw despite trend-gate), rally FLAT -0.0001 (BTC-slope early-warning redundant with alt's own within-symbol slope), crash +0.001. (2) multi-day ret_vlong co-gate (max) on convex de-risk cushion trend-alignment - composite -0.0016: sideways -0.005 (modest ret_vlong earned spurious cushion), bull -0.003, rally FLAT -0.001 (cushion-persistence-through-pullback did not raise rally Sharpe), crash +0.002. (3) trend-aligned deep-profit max_hold extension (new realized-PnL hold-duration data dep) - composite -0.0408: bull -0.118 (Sh 1.74->1.42, giveback on 2021 corrections), rally -0.027 (stab 0.976), sideways -0.04, crash FLAT +0.002 (100% WR unchanged Sh 1.27). (4) momentum acceleration (2nd-deriv) early-warning exit pressure in MAX-fusion - CATASTROPHIC composite -0.301: rally 0.66->0.015 (Sh 1.24->0.89, trades 95->146, WR 82%->66%, stab 1.0->0.043 - grinding-uptrend decelerations whipsawed trend longs). (5) remove 20-bar _ct_atten (avg5 re-test) - SCORE-NEUTRAL composite -0.000004: confirms term INERT under avg5 + rally-stab-1.0 baseline (prior load-bearing 5cf14fe3 was obsolete single-seed artifact); fails strict keep. CROSS-EXPERIMENT INSIGHTS: (a) Exit-side architectural changes are SATURATED at this baseline - Exp1/2/3/4 all attempted trend-winner-holding / cross-symbol / early-warning exit mechanisms and ALL failed to raise rally/crash; winner-exit timing is at an optimum (holding longer gives back gains per Exp3, exiting earlier on acceleration whipsaws per Exp4). (b) 2nd-derivative (acceleration) signals are too noisy for hourly data - slope-LEVEL reversal pressure already handles exhaustion without whipsaw; do not re-attempt acceleration exit triggers. (c) Cross-symbol BTC slope exit is redundant with within-symbol alt slopes (correlated in trends). (d) The binding constraint rally 0.66 (Sharpe 1.24) is driven by return_volatility (vol_gate ~0.82, 3.4x sideways) from 95 churny trades at 82% WR - structural to the trade profile, not fixable via exit timing. (e) 20-bar _ct_atten confirmed dead code under current methodology (removable for OOS simplicity if score-neutral keeps ever permitted). Baseline c90c1e9f (0.778364) unchanged. Baseline per-regime: bull 0.91 / crash 0.79 / sideways 1.04 / rally 0.66, all stab 1.0.
958983cf	0.778364	0.849357	0.141986	0.91	0.79	1.04	0.66	discard	Exp1 (architectural, indep): added multi-day counter-trend soft-exit pressure term (_ctv_pressure, cap 0.30, fast-sat /0.01 ret_vlong gate + loss-only + bars_held>=2) to MAX soft-exit fusion. ret_vlong was absent from exit-PRESSURE fusion (only in _ct_hold_sat max_hold shorten / _ct_si_gate / _ct_vlong entry size / _ct_te_str target EMA). MEASURED vs c90c1e9f 0.778360: composite +0.000004 (sub-noise), mean +0.000000, ALL regimes BYTE-IDENTICAL (rally 0.655100 Sh1.244966 unchanged, bull/crash/sideways unchanged). The term NEVER binds as the MAX - counter-trend losing holds already exit via _ct_hold_sat time-cap + slope/pp/time pressure before _ctv_pressure (cap 0.30) exceeds them. Confirms _ct_hold_sat (row-701 proven bars_held lever) already fully captures the counter-trend exit-timing gain; a direct pressure term is REDUNDANT. Reverted to c90c1e9f.
c90c1e9f	0.826867	0.869466	0.141996	0.94	0.81	1.06	0.67	keep	RE-BASELINE under new scoring (vol_gate removed + CONSISTENCY_K 0.5->0.3). strategy.py UNCHANGED at c90c1e9f (byte-identical). Old composite 0.778364 -> new 0.826867 (+0.0485). Decomposition: k=0.5->0.3 contributes +0.0284 (0.2*std); vol_gate removal contributes +0.0201 (~2.6% uniform lift + std change). Per-regime: bull 0.936839 Sh1.752 stab1.0, crash 0.811280 Sh1.263 stab1.0, sideways 1.055509 Sh2.030 stab1.0, rally 0.674237 Sh1.245 stab0.825 factor1.0. All stability factors 1.0 (no penalty). rally remains binding raw constraint (lowest score 0.674).
c90c1e9f	0.826867	0.869466	0.141996	0.94	0.81	1.06	0.67	session-summary	SCORING REFACTOR (not an agent session). NEW BASELINE c90c1e9f 0.826867 SUPERSEDES old-scoring 0.778364. Two changes: (1) REMOVED vol_gate from compute_score — was double penalty (return_volatility = std(returns)*sqrt(8760) already in Sharpe denominator); near-constant 0.970-0.985 across all historical keeps (<1.4% regime spread), never changed ranking, only +2.6% uniform shift. At equal Sharpe it preferred lower-vol=lower-return strategies (misincentive). (2) CONSISTENCY_K 0.5->0.3 in regime_test.py composite — at k=0.5, 72% of composite gains came from std reduction (measured GLM R1-R6); k=0.3 keeps consistency reward (prevents abandoning weakest regime per 6/17 analysis) while giving mean-improvement room. Pure k=0 rejected (rewards 3-strong-1-weak fragile strategies). strategy.py byte-identical to c90c1e9f. pytest 21 passed.
e52ada26	0.827343	0.869853	0.141700	0.936204	0.813463	1.055509	0.674237	keep	KEEP (NEW BASELINE, SUPERSEDES c90c1e9f 0.826867 under new scoring k=0.3). Exp1 (architectural, indep): profit-graduated target EMA - weaken the ct-position smoothing alpha on LOSING holds (max -50pct via tanh(-pos_pnl/|SL|)), keep full alpha on winning ct holds. The _target_ema (alpha 0.99) was tuned when stability was the binding wall (k=0.5); under k=0.3 the stability benefit is discounted while its raw cost (lag holds ct losers bigger longer) remains. MEASURED vs c90c1e9f 0.826867: composite +0.000476 (0.827343), mean +0.000387 (0.869853), std -0.000296 (0.141700 tighter). PER-REGIME: rally BYTE-IDENTICAL 0.674237 (Sharpe 1.244966 unchanged, stab 0.825294 unchanged - rally ct losers exit via binary/full-exit path which bypasses the same-sign-resize _target_ema, so loss-gate does not bind there), crash 0.811280->0.813463 (+0.002183, Sharpe 1.2627->1.2676 - crash ct relief-rally longs that de-risk gradually get faster shrink on losers -> smaller realized losses), sideways BYTE-IDENTICAL 1.055509 (low ret_vlong -> gate 0), bull 0.936839->0.936204 (-0.000635, Sharpe 1.7524->1.7505 - small trade-set shift). All stability factors 1.0 (rally 0.825 knee held, bull 0.882, crash 0.970, sideways 0.872). All MaxDD<10pct (rally 1.528). All keep criteria met. NOTE: rally (the binding constraint) is byte-identical - the gain came from crash (below-cluster regime, double mean+std benefit under k=0.3) + std tightening. New data dep: target-EMA alpha depends on pos_pnl sign (was constant per ct-gate). Observation (correlation only): crash gain consistent with faster ct-loser de-risk hypothesis but direction-split PnL not measured.
a43bf620	0.827343	0.869853	0.141700	0.936204	0.813463	1.055509	0.674237	discard	Exp2 (architectural, indep): profit-graduated voter_bias EMA - weaken the additive exit-pressure EMA alpha on LOSING ct holds (mirror of Exp1 _target_ema pattern). MEASURED vs e52ada26 0.827343: BYTE-IDENTICAL (composite 0.827343, all 4 regimes identical incl rally 0.674237 Sh1.244966, crash 0.813463, bull 0.936204, sideways 1.055509). INERT: voter_bias is ADDITIVE on _exit_pressure (max(_sl_pressure,_soft_max)+_voter_bias) but _soft_max (slope/pp/time/ve/ar MAX) dominates the exit decision, so weakening the voter_bias smoothing changes no exit threshold crossing -> no trade changes. The voter_bias_ema's documented bull load-bearing role (branch step3) is edge-case and does not bind in the current baseline trade set. Not branch-eligible (no regime improved, variant of Exp1 mechanism that turned out inert). Reverted to e52ada26 (strategy.py only, results.tsv append-only intact).
5ee800fc	0.827146	0.869677	0.141771	0.936204	0.812759	1.055509	0.674237	discard	Exp3 (architectural, indep): age-ramped EXTRA target-EMA weakening for confirmed old losers (bars_held ramp 0->1 over bars 1-4, +20pct alpha cut on top of Exp1 50pct, reaching ~70pct for old losers). MEASURED vs e52ada26 0.827343: composite -0.000197 (0.827146), mean -0.000176 (0.869677). PER-REGIME: crash 0.813463->0.812759 (-0.000704, Sharpe 1.2676->1.2661 - REGRESSED: extra age-cut over-pressed dip-recover winners, cutting them at worse price before recovery), rally BYTE-IDENTICAL 0.674237 (Sharpe 1.244966 unchanged - rally shallow losses MaxDD1.53pct vs stop2.4pct still dont fire loss_gate even with age ramp), bull/sideways BYTE-IDENTICAL. All stab 1.0 (rally 0.825 held). Fails keep (composite+mean down). Not branch-eligible (no regime improved, crash regressed). Reverted to e52ada26 (strategy.py only). FINDING: ema-weakening direction exhausted for this session - Exp1 _target_ema helped crash +0.0022, Exp2 voter_bias_ema INERT (_soft_max dominates), Exp3 age-ramp hurt crash; rally unreachable via ema (shallow losses + binary exits bypass same-sign-resize ema).
e52ada26	0.827343	0.869853	0.141700	0.936204	0.813463	1.055509	0.674237	session-summary	SESSION (new scoring k=0.3 + vol_gate removed): 1 KEEP (Exp1) + 2 architectural discards (Exp2, Exp3). NEW BASELINE e52ada26 0.827343 (SUPERSEDES c90c1e9f 0.826867, +0.000476 composite, +0.000387 mean, std 0.141996->0.141700). [bull 0.936204 Sh1.750 stab0.882, crash 0.813463 Sh1.268 stab0.970, sideways 1.055509 Sh2.030 stab0.872, rally 0.674237 Sh1.245 stab0.825 - all factors 1.0, rally STILL binding raw constraint]. KEY INSIGHT (the session thesis): the scoring refactor (k=0.5->0.3 + vol_gate removal) SHIFTED THE OPTIMUM - the strategy was tuned under k=0.5 where std-reduction was 72pct of composite gains, so stability-smoothing mechanisms were added even at raw cost. Under k=0.3 the stability benefit is discounted while raw costs remain, so the strongest smoothing (_target_ema alpha 0.99 on ct positions) became over-discounted. Exp1 (profit-graduated target EMA: weaken alpha up to 50pct on LOSING ct holds via tanh(-pos_pnl/|SL|), keep full alpha on winners) captured this: crash +0.0022 (faster ct-loser de-risk -> smaller realized losses), std -0.0003, rally byte-identical. The gain came from crash (below-cluster regime -> double mean+std benefit under k=0.3). EXP2 (voter_bias_ema profit-graduation, mirror of Exp1): INERT byte-identical - voter_bias is ADDITIVE on _exit_pressure but _soft_max dominates the exit decision, so weakening voter_bias smoothing changes no exit threshold crossing. EXP3 (age-ramped extra target-EMA weakening for old losers): hurt crash -0.0007 (over-cut dip-recover winners) + rally byte-identical. CROSS-EXPERIMENT FINDINGS: (a) ema-weakening reaches crash (deeper intermediate losses fire loss_gate) but NOT rally - rally losers are SHALLOW (MaxDD 1.53pct vs stop 2.4pct -> tanh(-pos_pnl/|SL|) stays small) AND exit binary (target=0 bypasses the same-sign-resize _target_ema condition), so the smoothing never binds on rally losers. (b) rally raw Sharpe 1.245 remains the binding constraint and is structurally walled from the ema/smoothing axis. (c) voter_bias_ema is inert on the exit decision in the current baseline (_soft_max dominates) despite documented bull load-bearing role (edge-case, does not bind here). DIRECTIONS CONFIRMED DEAD/SATURATED THIS SESSION: profit-graduated smoothing extensions (Exp2/Exp3), voter_bias_ema modulation. strategy.py at HEAD byte-identical to e52ada26. results.tsv append-only preserved across all rollbacks (path-scoped git checkout -- strategy.py). FUTURE: rally remains the binding raw lever; ema/smoothing axis cannot reach it (shallow losses + binary exits). A future session targeting rally must find a non-ema, non-exit-timing lever (first-bar size on a NEW signal, or admission - though prior admission tightening collapsed bull). The k=0.3 shift may make OTHER over-discounted stability mechanisms worth re-auditing (the _target_ema was just the strongest; weaker smoothings may have smaller residual raw costs).
17484a0e	0.809675	0.852946	0.144236	0.938748	0.813463	1.021128	0.638446	discard	Exp1 (architectural, indep): trend-aligned WINNER pyramid in scale-in (full_target overshoots entry size by up to +0.30 when pos_pnl>0 AND trend-aligned AND slope_confirming). MEASURED vs e52ada26 0.827343: composite -0.0177, mean -0.0169, std +0.0025. PER-REGIME: rally 0.674237->0.638446 (-0.0358 the TARGET regressed), sideways 1.055509->1.021128 (-0.0344), bull 0.936204->0.938748 (+0.0025 slope_conf gate protected), crash 0.813463 byte-identical (ct gate spares). All stab 1.0. CONFIRMS dead-end pattern (cd282d74 xasset-sustain, b26bc213 burst-boost): oversizing trend winners through pullbacks = bigger giveback -> lower Sharpe. slope_conf gate insufficient protection. The realized-winner requirement (pos_pnl>0) did NOT avoid the giveback failure - winning rally longs still hit pullbacks. Reverted to e52ada26.
d8472c88	0.818594	0.863876	0.150941	0.936674	0.815769	1.055509	0.647552	discard	Exp2 (architectural, indep): range-EXTENSION shrink-only first-bar gate (bull at 20bar-high / bear at 20bar-low over-extended entries shrunk 20pct, shrink-only no admission boundary). MEASURED vs e52ada26 0.827343: composite -0.0087, mean -0.0060, std +0.0092. PER-REGIME: rally 0.674237->0.647552 (-0.0267 TARGET regressed), bull 0.936204->0.936674 (+0.0005), crash 0.813463->0.815769 (+0.0023), sideways 1.055509 byte-identical. All stab 1.0. DATA CONTRADICTS hypothesis: over-extended rally longs (range-top) are PROFITABLE (grinding uptrend continues), shrinking them cut winners -> lower Sharpe. Same lesson as Exp1/sustain-boost: rally trend continuation is real, removing size from it costs raw. The shrink-only no-admission-boundary design did avoid bull collapse (bull +0.0005) but the target regime regressed. Reverted to e52ada26.
