commit	score	mean_score	std_score	bull_2021	crash_bear	sideways	rally_2024	status	description
eb4c42db	0.4684	0.6269	0.3307	0.77	0.76	0.93	0.07	branch	branch step 7: per-bar gate x SMOOTH cumulative fade. rally 0.073: any cumulative-max term hurts (increments on noise-sensitive burst bars). DROP cumulative entirely.
bcb5197a	0.4487	0.6267	0.3484	0.77	0.76	0.93	0.03	branch	branch step 8: per-bar gate + ret_vlong DEADZONE (|ret_vlong|<0.02 no shrink). rally 0.031: deadzone put STEEP tanh region INSIDE rally operating range 0.02-0.04. backwards.
26f4b23d	0.6277	0.7211	0.1868	0.78	0.76	0.93	0.42	keep	BRANCH KEEP step 9 (SUPERSEDES 5e4c5d5c 0.5711 -> 0.6277, +0.0566 composite, +0.0345 mean, std 0.2312->0.1868 — FIRST baseline move past 5e4c5d5c in ~10 sessions). ARCHITECTURAL multi-day(96-bar OLS-slope) counter-trend SIZE attenuator with FAST-SATURATION profile. MECH: diagnostic found rally takes 50% short entries(6/12) in grinding uptrend (the rally killer: WR66% vs 86-100%, 7 consec losses) bc 20-bar trend gate sees local pullbacks as trend-aligned. NEW cross-timescale dep: ret_vlong=fast_slope(log HL2,96)*96 captures multi-day trend; _bull_ct_vlong/_bear_ct_vlong=1-0.40*_calm_ct*tanh(ret_vlong/0.01) shrinks counter-trend first-bar size. KEY INSIGHT (steps 1-9): rally raw INVARIANT 0.418 throughout — shrink only moves STABILITY. scale 0.01 (not 0.06) puts rally operating range 0.02-0.04 in FLAT saturated tanh (sensitivity ~0.4 vs ~5) = same 0.40x shrink but NOISE-FREE -> rally stab 0.720->0.809 factor 0.732->1.0. per-bar churn gate _calm_ct (smooth) protects rally execution-grid. ALL regimes up/flat: bull 0.753->0.776(stab 0.792->0.897), crash 0.757->0.759, sideways 0.930 flat, rally 0.306->0.419. NEW BASELINE=0.6277.
26f4b23d-session-summary	-	-	-	-	-	-	-	session-summary	session: 1 independent architectural discard (exp1) + 1 exploration branch (exp2 open + 8 steps) = BRANCH KEEP 26f4b23d (0.6277 SUPERSEDES 5e4c5d5c 0.5711, +0.0566 composite — first baseline move in ~10 sessions). INDEPENDENT DISCARD exp1: multi-day counter-trend ADMISSION tightening (rally raw preserved but stability collapsed 0.720->0.536 — admission = noise-sensitive pass/fail boundary at ret_vlong=0). PIVOT to continuous SIZE attenuation (branch). BRANCH ARC: exp2 open (size attenuator, bull+0.023 but rally stab 0.563) -> s2 OLS-slope -> s3 per-bar churn gate (BEST interim 0.531) -> s4-7 cumulative gates ALL worse (hard cliff/cumulative-max noise-sensitive on burst bars) -> s8 deadzone backwards -> s9 FAST-SATURATION scale 0.01 = KEEP. CONCLUSION/load-bearing: (1) rally is the lever (only regime with stability headroom, factor 0.732); (2) rally takes 50% counter-trend shorts in grinding uptrend = root cause of low rally raw+stability; (3) counter-trend SIZE shrink (not admission) is the vehicle; (4) shrink scale must be FAST-SATURATING (0.01) so rally operating range sits in flat tanh = noise-free; (5) per-bar churn gate (smooth) >> any cumulative-max gate (increments on perturbation-dependent burst bars). rally raw INVARIANT 0.418 across all 9 steps — the entire gain is stability factor 0.732->1.0.
-	0.5400	0.6731	0.2661	0.78	0.76	0.93	0.23	discard	ARCHITECTURAL multi-day(96bar ret_vlong) counter-trend EXIT pressure (7th soft term, fast-sat scale 0.01, MAX fusion). rally RAW +0.019 GENUINE (0.419->0.438, Sharpe 0.735->0.778, DD 1.85->1.78 BOTH improved) + raw_composite UP 0.628->0.636 -> mechanism cuts ct losers as intended. BUT rally stab_factor 1.0->0.518 (stability 0.809->0.655): exit-pressure term ~0.60 straddles de-risk floor 0.55 boundary -> exit-timing divergence under AR(1) -> re-breaks the stability the SIZE keep just fixed. CONFIRMS (new baseline): exit-pressure TIMING vehicle is noise-sensitive (boundary crossing) even with noise-free ret_vlong gate; the size keep was Sharpe-invariant only bc first-bar shrink is overwritten by scale-in. To move rally RAW noise-free need a Sharpe-AFFECTING non-boundary vehicle -> extend ct-shrink to whole hold next.
-	0.4729	0.6388	0.3317	0.81	0.74	0.93	0.08	discard	ARCHITECTURAL persist multi-day ct SIZE shrink through whole hold (apply _ct_vlong_hold to scale-in full_target, not just bar-0). rally RAW +0.006 (0.419->0.425 Sharpe 0.735->0.750) + BULL +0.036 (0.776->0.813) GENUINE; raw_composite 0.628->0.632. BUT rally stab_factor 1.0->0.181 (stability 0.809->0.554): scale-in recomputes full_target*ret_vlong across bars 1-3 -> multi-bar position-VALUE variance even with flat-sat gate (ret_vlong NOT yet saturated at early-hold bars). crash -0.024. CONFIRMS (2nd this session): ct down-weighting raises rally RAW+bull but ANY multi-bar position-value vehicle breaks rally stab; bar-0-ONLY size application (the keep) is LOAD-BEARING. exit-pressure(exp1) AND scale-in-size(exp2) both walled the same way.
f45feb2e	0.5624	0.6887	0.2527	0.82	0.73	0.93	0.27	branch	BRANCH OPEN: ARCHITECTURAL freeze bar-0 multi-day ct shrink factor at entry, persist through hold (full_target=live_size*frozen_const). rally RAW +0.022 (0.419->0.441 Sharpe 0.735->0.785, FIRST raw move in this family — prior sessions had rally raw INVARIANT 0.418) + BULL +0.047 (0.776->0.823 raw AND stab 0.897->0.923) GENUINE; raw_composite 0.628->0.641 (best seen). crash -0.025. RALLY stab_factor 1.0->0.608 (stability 0.809->0.682) -> final rally 0.268 -> composite 0.562<0.627. PROGRESSION across session (rally stab_factor): exit-pressure 0.518 -> live-scale-in 0.181 -> FROZEN 0.608 (noise-isolation helps). (1)NEW ARCH: persist ct-shrink via frozen-at-entry const, size live. (2)RALLY regressed bc frozen value includes _calm_ct (live churn gate) noise-sensitive at rally quiet-stretch entries (entry-bar timing shift). (3)FIX step2: base persisted hold-shrink on ret_vlong saturation ONLY (drop _calm_ct) -> rally op-range 0.02-0.04 in flat sat tail = robust ~0.6.
4b71bd27	0.5870	0.6999	0.2258	0.79	0.75	0.93	0.33	branch	branch step 3: restore step-1 frozen factor (_calm_ct kept, step2 proved it load-bearing for rally raw) at HALF persisted depth (0.5+0.5*ct_vlong). composite 0.587>step1 0.562, rally stab_factor 0.608->0.757, rally raw 0.431 (still>baseline 0.419), bull 0.823->0.794 (gain fading with depth). KEY FINDING: composite MONOTONE-DECREASING in persisted depth (depth0=baseline 0.627 > half 0.587 > full 0.562) -> SIZE-persistence walled by held-position variance, no positive depth keeps. PIVOT step4: drop size-persistence, use frozen ct-ness to TIGHTEN STOP for counter-trend positions (noise-immune binary entry-anchored channel; documented 'rally helped by MORE noise-immune entry-anchored exits').
f1ef183b	0.4353	0.6164	0.3621	0.78	0.76	0.93	0.00	branch	branch step 4: frozen ct flag tightens STOP 20pct for counter-trend (entry-anchored binary-saturating channel). RALLY HARD-CUTOFF 0.419->0.000 (stab 0.809->0.413). DECISIVE: rally Sharpe 0.735259 + max_dd 1.853283 BYTE-IDENTICAL to baseline = stop-tighten INERT on clean path, yet stability collapsed -> moving the stop LEVEL creates a noise-sensitive _sl_pressure boundary the AR(1) ensemble crosses differently. REPRODUCES documented row-18 (trend-aligned stop widening = pure stab redistribution, rally collapse). STOP-LEVEL modulation CONFIRMED WALLED. raw_composite 0.435<<step3 0.635 = no progress.
0d19abb5	0.4360	0.6175	0.3631	0.80	0.74	0.93	0.00	branch	branch step 5: frozen ct flag SLOWS scale-in PACE for counter-trend (extend _entry_full_bars up to +1.5). RALLY HARD-CUTOFF 0.419->0.000 (stab 0.809->0.450) AND rally raw DOWN (Sharpe 0.735->0.704, DD 1.85->1.93). Extending scale-in window = MORE bars where position path diverges under noise -> stability collapse + slower build hurts the pullback shorts that DO recover. bull +0.023 (0.776->0.799, consistent ct->bull gain all steps). PACE vehicle walled. 4TH confirmed wall this session (exit-pressure/size/stop/pace). INTRINSIC BIND identified: _calm_ct gate PROTECTS rally raw during bursts (step2 dropping it collapsed raw) but _calm_ct=f(len(_eh) at entry) is ENTRY-TIMING-SENSITIVE (entry boundary shifts under noise -> different frozen factor) = the stability-variance source. raw-protection gate IS the stability-variance source = coupled, cannot separate.
-	0.5870	0.6999	0.2258	0.79	0.75	0.93	0.33	discard	BRANCH SUMMARY (multi-day counter-trend RAW-persistence, exp3-open + 4 steps, REVERTED to 26f4b23d 0.6277 — strategy.py byte-identical, composite re-verified 0.627701). THESIS PROVEN: counter-trend down-weighting MOVES rally RAW for the first time in project history (rally raw 0.418->0.441, prior sessions had it INVARIANT 0.418 across ~12 sessions) AND bull RAW 0.776->0.823 (+0.047, both raw+stab). 4 VEHICLES ALL WALLED by rally STABILITY (sits at 0.809 = the factor=1.0 knee, ~0 margin): (exp3/step1) FROZEN bar-0 ct factor persisted as SIZE through hold -> rally stab 1.0->0.608, composite MONOTONE-DECREASING in persist depth (depth0=0.627>half 0.587>full 0.562) = held-position size-variance wall; (step2) drop _calm_ct from frozen factor -> rally raw COLLAPSED 0.441->0.296 = _calm_ct is LOAD-BEARING for rally raw; (step4) frozen flag tightens STOP 20pct -> rally HARD-CUTOFF 0.000, Sharpe+DD BYTE-IDENTICAL = stop-LEVEL modulation walled (reproduces row-18); (step5) frozen flag SLOWS scale-in PACE -> rally 0.000 + raw down = pace-window-extension adds path-divergence bars. INTRINSIC BIND (load-bearing): _calm_ct PROTECTS rally raw during bursts but _calm_ct=f(len(_eh)@entry) is ENTRY-TIMING-SENSITIVE = the SAME quantity that creates stability variance when persisted -> raw-protection gate IS the stability-variance source, COUPLED. bull gain (+0.047) is REAL+consistent all 5 steps but COUPLED to rally via shared counter-trend-short mechanism (bull-rally coupling row-20, no side/churn separator). Best step 0.587<baseline 0.627. REVERTED.
26f4b23d-session-summary	-	-	-	-	-	-	-	session-summary	session: 2 independent architectural discards (exp1 exit-pressure, exp2 live-scale-in-size) + 1 exploration branch (exp3-open + 4 steps, REVERTED). Baseline 26f4b23d UNCHANGED 0.6277 [bull 0.776 stab0.897 f1.0, crash 0.759 stab0.974 f1.0, sideways 0.930 stab0.869 f1.0, rally 0.419 raw0.419 stab0.809 f1.0 = ALL FACTORS NOW 1.0; binding constraint SHIFTED from rally-STABILITY (the ~12-session wall, FIXED by last keep) to rally-RAW 0.419 (Sharpe 0.735, DD 1.85 highest)]. THEME: move rally RAW via multi-day counter-trend down-weighting (rally takes 50pct pullback SHORTS in grinding uptrend = the killer, 66pct WR vs 86-100pct, 7-consec-loss). BREAKTHROUGH+WALL: counter-trend down-weighting MOVES rally RAW for the FIRST TIME in project history (0.418->0.441) AND bull RAW +0.047 (0.776->0.823) — but ALL 4 persistence vehicles collapse rally STABILITY (rally sits at 0.809 = factor=1.0 knee, ~0 margin -> any held-position/exit-timing perturbation drops it below 0.50). VEHICLES: (1)exit-pressure 7th soft term ret_vlong-gated -> rally stab 0.518 (exit-pressure term straddles de-risk floor 0.55 boundary); (2)LIVE scale-in size recompute -> rally stab 0.181 (time-varying _calm_ct jumps full_target bar-to-bar); (3)FROZEN bar-0 ct factor persisted as size -> rally stab 0.608, composite MONOTONE-DECREASING in depth = held-position-size-variance wall; (4)stop-LEVEL tighten -> rally 0.000 Sharpe+DD byte-identical (reproduces row-18 stop-modulation wall); (5)scale-in PACE slow -> rally 0.000 (window-extension path divergence). INTRINSIC BIND (load-bearing for future sessions): _calm_ct churn gate PROTECTS rally raw during bursts (step2 dropping it collapsed raw 0.441->0.296) but _calm_ct=f(len(_eh)@entry) is ENTRY-TIMING-SENSITIVE = the SAME quantity creating stability variance when persisted -> the raw-protection gate IS the stability-variance source, COUPLED, cannot separate by depth/side/gate. bull +0.047 REAL+robust (consistent all 5 steps) but COUPLED to rally via shared counter-trend-short mechanism (bull-rally coupling row-20). NEW STRATEGIC PICTURE: rally RAW is movable (thesis proven) but only via a vehicle that does NOT (a) perturb held-position value, (b) cross an exit/stop boundary, (c) extend the scale-in window, AND (d) preserves the _calm_ct burst protection without freezing its entry-timing-sensitive value. The ONLY proven-safe rally lever remains bar-0-ONLY size (Sharpe-invariant by construction). Baseline 26f4b23d 0.6277 UNCHANGED.
-	0.3503	0.4903	0.2802	0.79	0.55	0.60	0.03	discard	ARCHITECTURAL multi-day-trend-ALIGNED hold extension (scale DOWN _soft_max to 0.75x for positions aligned with noise-free 96-bar ret_vlong, fast-sat scale 0.01, SL-exempt). Untried OPPOSITE of row-506 (which ADDED ct exit pressure). Composite -0.277 vs 26f4b23d 0.6277. bull +0.009 (0.776->0.785) ONLY gain. RALLY COLLAPSED 0.419->0.030 (raw 0.419->0.043, Sharpe 0.735->0.064): loosening aligned-long exit holds through rally pullbacks -> real giveback -> raw destroyed. crash 0.759->0.545, sideways 0.930->0.601 (ret_vlong NOT ~0 there). FAILURE MECH: existing exit timing is LOAD-BEARING for raw Sharpe in ALL regimes; reducing soft_max on aligned positions removes the giveback-capture that the exits provide. CONFIRMS aligned-hold-extension wrong-direction: exits ARE alpha, not noise. Discard #1 (architectural).
-	0.6029	0.6952	0.1845	0.67	0.76	0.93	0.42	discard	ARCHITECTURAL consecutive-loss admission tightening (new noise-immune integer _loss_streak per-symbol counter; raise bull/bear strong_min by 1.0-1.25x via tanh after a RUN of losing exits). DIAGNOSTIC-DRIVEN: per-regime gate decomposition found rally raw dragged by TWO factors - low Sharpe (sq=0.551) AND streak_gate=0.792 from 7 consec losses (21pct haircut); prior sessions only ever attacked rally SHARPE, streak_gate UNTOUCHED. Composite -0.025 vs 26f4b23d 0.6277. RALLY Sharpe BYTE-IDENTICAL 0.7353 (admission did NOT change rally entries: its ct pullback shorts are HIGH-CONVICTION, pass even 1.25x-raised threshold). bull 0.776->0.673 (-0.103: a losing exit does NOT predict next entry is loser -> indiscriminately blocked subsequent bull WINNERS). crash/sideways flat. FAILURE MECH: (a) rally ct shorts not admission-blockable (high conviction); (b) loss-streak not autocorrelated with next-trade outcome; (c) max_consecutive_losses is GLOBAL cross-symbol interleaved metric, per-symbol counter structurally mismatched. CONFIRMS streak_gate not movable via admission. No regime improved -> not branch-worthy. Discard #2 (architectural).
-	0.4474	0.6198	0.3447	0.80	0.68	0.95	0.05	discard	ARCHITECTURAL trend-aligned DIFFERENTIAL scale-in ceiling boost (+20%, cumulative-churn gated _cm<=2 + ret_vlong alignment, on scale-in full_target). Hypothesis: differential (not uniform) sizing changes trade MIX -> moves Sharpe. Composite -0.180 vs 26f4b23d 0.6277. bull 0.776->0.800 (+0.024) + sideways 0.930->0.950 (+0.020) GENUINE long-aligned gains. crash 0.759->0.683 (TARGET REGRESSED: Sharpe flat 1.29->1.28, boosting aligned shorts added risk w/o mix improvement). RALLY 0.419->0.046 (stab 0.809->0.538 COLLAPSED). FAILURE MECH: bull+sideways gains come from PRE-BURST (cm<=2) long-aligned early entries; cumulative gate LEAKS pre-burst -> rally early longs ALSO boosted -> multi-bar position-value variance (same as row507) collapses rally (zero margin at 0.809 knee; bull tolerates via 0.897 margin). NOT branch-worthy: long-side gain INSEPARABLE from rally (shared pre-burst channel, gate cannot distinguish early-bull from early-rally); short-side (crash, rally-separable) REGRESSES. Confirms bull-rally coupling + multi-bar-size wall, mirror(grow) direction. Discard #3 (architectural).
-	0.4390	0.6213	0.3646	0.80	0.75	0.93	0.00	discard	ARCHITECTURAL directional-IMBALANCE-gated counter-trend SUSTAINED shrink on scale-in ceiling (new _entry_dir_history state; imb=|mean(recent entry dirs)|, gate=tanh((imb-0.4)/0.25), shrink full_target 0.70x for ct legs via ret_vlong fast-sat 0.01). Replaces row507's leaky per-bar _calm_ct churn gate with a noise-immune imbalance gate intended to be ~1 for one-sided bull, ~0 for bidirectional rally. Composite -0.189 vs 26f4b23d 0.6277. bull 0.776->0.804 (+0.028 Sharpe 1.54->1.60 GENUINE, matches row507 bull+0.036). crash 0.759->0.751, sideways 0.930 FLAT (balanced, imb~0 -> untouched as predicted). RALLY 0.419->0.000 (raw 0.419->0.000 clean Sharpe<=0, stab 0.809->0.470). FAILURE MECH: rally is NOT uniformly balanced over a 10-entry window — it has ONE-SIDED LOCAL STRETCHES (runs of longs in strong legs) where imb crosses 0.4 -> shrink fires on rally ct shorts -> removes clean directional alpha AND injects boundary noise. Imbalance gate does NOT separate rally. NOT branch-worthy: keep needs rally FULL recovery to ~0.42 (shrink must never fire in rally = forbidden regime classifier); partial recovery to 0.30 only gives composite ~0.58<0.6277. RECONFIRMS bull-rally coupling wall (session row20) + multi-bar position-value wall (row507): bull ct-short gain INSEPARABLE from rally collapse via shared ct-short mechanism. Discard #4 (architectural).
-	0.5600	0.6867	0.2534	0.80	0.75	0.93	0.26	discard	ARCHITECTURAL ONE-SIDED long-in-multi-day-downtrend WHOLE-HOLD ct shrink (0.70x on scale-in full_target, ret_vlong fast-sat 0.01, long positions ONLY). Designed to sidestep exp3/exp4 rally leaks: long-in-downtrend condition is STRUCTURALLY ZERO in rally (ret_vlong>0 by trend sign, not a proxy). Composite -0.068 vs 26f4b23d 0.6277. bull 0.776->0.803 (+0.027 Sharpe 1.54->1.60: shrinks bull longs during neg-96bar-slope pullbacks). crash 0.759->0.751 (TARGET REGRESSED Sharpe 1.29->1.24: shrinking dead-cat longs through hold hurts). sideways 0.930 FLAT. RALLY raw BYTE-IDENTICAL 0.418878 (condition does NOT fire on rally clean trades = NEW: first attempt preserving rally raw) BUT stability 0.809->0.688 factor->0.627 -> score 0.263. FAILURE MECH: noise test perturbs ret_vlong sign on rally LONG positions during flat stretches -> whole-hold recompute diverges (vehicle-a multi-bar position-value wall). NOT branch-worthy: best-case keep ~0.631 (+0.003, SEED-FRAGILE at rally cliff); bull gain from mild-pullback region AT the ret_vlong knee = coupled to rally-firing region, any knee shift to protect rally kills bull gain; crash (target) regressed. Reconfirms bull-rally coupling + multi-bar position-value wall 2x this session. Discard #5 (architectural).
26f4b23d-session-summary	-	-	-	-	-	-	-	session-summary	session: 5 independent architectural discards (NO branch opened - none branch-worthy). Baseline 26f4b23d UNCHANGED 0.6277 [bull 0.776 sh1.54 stab0.897 f1.0, crash 0.759 sh1.29 stab0.974 f1.0, sideways 0.930 sh1.71 stab0.869 f1.0, rally 0.419 sh0.735 stab0.809 f1.0 = ALL factors 1.0; binding constraint rally RAW]. DIAGNOSTIC (per-regime scoring-gate decomposition, load-bearing for future sessions): score = log(1+sharpe)*sample*dd_gate*vol_gate*streak_gate. dd_gate AND vol_gate are PINNED ~0.98 in ALL 4 regimes (NO headroom - dd_gate>=0.982, vol_gate 0.972-0.978) -> the ONLY movable levers are SHARPE (signal_quality) and streak_gate. rally raw dragged by TWO factors: low Sharpe (sq=0.551 vs 0.83-1.0 others) AND streak_gate=0.792 (7 consec losses, 21pct haircut) - the clustering ct pullback shorts. EXPERIMENTS: (1) multi-day-trend-ALIGNED hold extension (scale DOWN soft_max for aligned positions, untried opposite of row506) -> rally 0.419->0.030 ALL regimes collapse: CONFIRMS exits ARE alpha not noise, loosening aligned exit gives back gains. (2) consecutive-loss admission tightening (new _loss_streak integer, raise strong_min after loss runs, targets streak_gate) -> rally Sharpe BYTE-IDENTICAL (ct shorts HIGH-CONVICTION pass raised threshold) + bull -0.103 (loss doesnt predict next-entry outcome); also max_consecutive_losses is GLOBAL cross-symbol metric, per-symbol counter mismatched: streak_gate NOT admission-movable. (3) trend-aligned DIFFERENTIAL scale-in BOOST (+20pct, cumulative-churn gated) -> bull +0.024 sideways +0.020 GENUINE but rally 0.419->0.046 (cumulative gate LEAKS pre-burst -> rally early longs boosted -> multi-bar variance) + crash target regressed. (4) directional-IMBALANCE-gated ct sustained shrink (new _entry_dir_history, |mean dir|~1 bull ~0 rally) -> bull +0.028 GENUINE but rally 0.419->0.000 (rally has ONE-SIDED LOCAL stretches where imb crosses 0.4 -> shrink fires on rally ct shorts). (5) ONE-SIDED long-in-downtrend whole-hold shrink (structurally zero in rally by trend sign) -> rally RAW BYTE-IDENTICAL (FIRST attempt preserving rally raw!) but stability 0.809->0.688 (noise flips ret_vlong sign on rally longs during flat stretches -> vehicle-a multi-bar wall) + bull +0.027 coupled to ret_vlong knee + crash regressed. CROSS-EXPERIMENT CONCLUSIONS (load-bearing): (a) SCORE IS PURELY SHARPE+STREAK_GATE MOVABLE - dd/vol gates have zero headroom; abandon any DD/vol-targeting lever. (b) streak_gate NOT admission-movable (rally ct shorts high-conviction; loss not autocorrelated w next outcome; metric is global). (c) bull RAW is ROBUSTLY improvable +0.024-0.036 via counter-trend down-weighting (CONFIRMED 3 mechanisms: differential boost, imbalance shrink, one-sided shrink ALL give bull +0.024-0.028) - but bull gain is INSEPARABLE from rally collapse via shared ct-short mechanism AND it lives at the ret_vlong knee region coupled to rally. (d) THREE rally-sparing gates tried and ALL leak: cumulative-churn (pre-burst leak), directional-imbalance (one-sided-local-stretch leak), trend-SIGN one-sided (preserves rally RAW but noise flips the sign -> stability leak). (e) the one-sided trend-sign approach (exp5) is the CLOSEST any mechanism has come (rally raw byte-identical) - future work: the leak is purely ret_vlong SIGN noise on rally longs; a sign-HYSTERESIS or magnitude-deadzone on ret_vlong that keeps the long-shrink at strictly ZERO until ret_vlong is DEEPLY negative (past rallys flat-stretch noise band) might preserve both rally stability AND the crash dead-cat target - but crash REGRESSED in exp5 so the crash target itself may need a different vehicle. Baseline 26f4b23d 0.6277 UNCHANGED.
